### ISSUE TITLE
Egress Gateway not working on GKE

### ISSUE THREAD

**Issue by pippolo84** [cilium/cilium#20432]
### Is there an existing issue for this?

- [X] I have searched the existing issues

### What happened?

Following [this guide](https://docs.cilium.io/en/v1.12.0-rc3/gettingstarted/k8s-install-default/) I created a GKE test cluster, then installed Cilium v1.12.0-rc3 on it via Helm:

```
$ NATIVE_CIDR="$(gcloud container clusters describe "${NAME}" --format 'value(clusterIpv4Cidr)')"

$ helm install cilium cilium/cilium --version 1.12.0-rc3 \
  --namespace kube-system \
  --set nodeinit.enabled=true \
  --set nodeinit.reconfigureKubelet=true \
  --set nodeinit.removeCbrBridge=true \
  --set cni.binPath=/home/kubernetes/bin \
  --set gke.enabled=true \
  --set ipam.mode=kubernetes \
  --set ipv4NativeRoutingCIDR=$NATIVE_CIDR
```

To test the Egress Gateway feature, I started a GCE VM outside of the cluster, where I installed the `nginx` web server, so to log the IP address from which each HTTP request is coming.

I upgraded the Cilium installation to tune the options needed for the Egress Gateway feature:

```
$ helm upgrade cilium cilium/cilium --version 1.12.0-rc3 \
   --namespace kube-system \
   --reuse-values \
   --set egressGateway.enabled=true \
   --set bpf.masquerade=true \
   --set kubeProxyReplacement=strict \
   --set l7Proxy=false \
   --set rollOutCiliumPods=true
```

Following the related [Egress Gateway guide](https://docs.cilium.io/en/v1.12.0-rc3/gettingstarted/egress-gateway/#testing-the-egress-gateway-feature) I deployed the client pods to test the connection to the external nginx instance.

The nginx server was reachable from the `mediabot` pod:

```
$ kubectl exec mediabot -- curl http://34.118.120.16
<html>
<head>
<title>Welcome to nginx!</title>
<style>
    body {
        width: 35em;
        margin: 0 auto;
        font-family: Tahoma, Verdana, Arial, sans-serif;
    }
</style>
</head>
<body>
<h1>Welcome to nginx!</h1>
<p>If you see this page, the nginx web server is successfully installed and
working. Further configuration is required.</p>

<p>For online documentation and support please refer to
<a href="http://nginx.org/">nginx.org</a>.<br/>
Commercial support is available at
<a href="http://nginx.com/">nginx.com</a>.</p>

<p><em>Thank you for using nginx.</em></p>
</body>
```

Then I applied the following CiliumEgressGatewayPolicy:

```
$ kubectl get ciliumegressgatewaypolicy.cilium.io/egress-sample -o yaml
apiVersion: cilium.io/v2
kind: CiliumEgressGatewayPolicy
metadata:
  annotations:
    kubectl.kubernetes.io/last-applied-configuration: |
      {"apiVersion":"cilium.io/v2","kind":"CiliumEgressGatewayPolicy","metadata":{"annotations":{},"name":"egress-sample"},"spec":{"destinationCIDRs":["34.118.120.16/32"],"egressGateway":{"nodeSelector":{"matchLabels":{"egress-node":"test"}}},"selectors":[{"podSelector":{"matchLabels":{"class":"mediabot","io.kubernetes.pod.namespace":"default","org":"empire"}}}]}}
  creationTimestamp: "2022-07-07T16:41:40Z"
  generation: 2
  name: egress-sample
  resourceVersion: "19752"
  uid: 743ae595-e93e-4d9d-a95b-495888dba90c
spec:
  destinationCIDRs:
  - 34.118.120.16/32
  egressGateway:
    nodeSelector:
      matchLabels:
        egress-node: test
  selectors:
  - podSelector:
      matchLabels:
        class: mediabot
        io.kubernetes.pod.namespace: default
        org: empire
```

and set the label `egress-node:test` to the node designated as the egress gateway (a different node from the one where the `mediabot` pod was running on):

```
$ kubectl get nodes
NAME                                                  STATUS   ROLES    AGE     VERSION
gke-pippolo-test-gsg-183-default-pool-18f584cb-2npx   Ready    <none>   4h40m   v1.22.8-gke.202
gke-pippolo-test-gsg-183-default-pool-18f584cb-d39l   Ready    <none>   4h40m   v1.22.8-gke.202
gke-pippolo-test-gsg-183-default-pool-18f584cb-w38p   Ready    <none>   4h40m   v1.22.8-gke.202

$ kubectl get pods mediabot -o wide --show-labels
NAME       READY   STATUS    RESTARTS   AGE    IP            NODE                                                  NOMINATED NODE   READINESS GATES   LABELS
mediabot   1/1     Running   0          4h9m   10.100.2.71   gke-pippolo-test-gsg-183-default-pool-18f584cb-w38p   <none>           <none>            class=mediabot,org=empire

$ kubectl label nodes gke-pippolo-test-gsg-183-default-pool-18f584cb-2npx egress-node=test
```

But trying again to query the HTTP external server leads to a timeout:

```
$ kubectl exec mediabot -- curl http://34.118.120.16:80
  % Total    % Received % Xferd  Average Speed   Time    Time     Time  Current
                                 Dload  Upload   Total   Spent    Left  Speed
  0     0    0     0    0     0      0      0 --:--:--  0:02:10 --:--:--     0curl: (7) Failed to connect to 34.118.120.16 port 80: Operation timed out
command terminated with exit code 7
```

### Cilium Version

```
$ cilium version
cilium-cli: v0.11.10 compiled with go1.18.3 on linux/amd64
cilium image (default): v1.11.6
cilium image (stable): v1.11.6
cilium image (running): v1.12.0-rc3
```

### Kernel Version

```
$ kubectl exec cilium-4ccvf -n kube-system -c cilium-agent -- uname -a
Linux gke-pippolo-test-gsg-183-default-pool-18f584cb-2npx 5.10.90+ #1 SMP Sat Mar 5 10:09:49 UTC 2022 x86_64 x86_64 x86_64 GNU/Linux
```

### Kubernetes Version

```
$ kubectl version
Client Version: version.Info{Major:"1", Minor:"24", GitVersion:"v1.24.1", GitCommit:"3ddd0f45aa91e2f30c70734b175631bec5b5825a", GitTreeState:"clean", BuildDate:"2022-05-24T12:26:19Z", GoVersion:"go1.18.2", Compiler:"gc", Platform:"linux/amd64"}
Kustomize Version: v4.5.4
Server Version: version.Info{Major:"1", Minor:"22", GitVersion:"v1.22.8-gke.202", GitCommit:"88deae00580af268497b9656f216cb092b630563", GitTreeState:"clean", BuildDate:"2022-06-03T03:27:52Z", GoVersion:"go1.16.14b7", Compiler:"gc", Platform:"linux/amd64"}
```

### Code of Conduct

- [X] I agree to follow this project's Code of Conduct

**Comment by jibi** [comment]
I run a quick test and on the `eth0` interface on the node with the `egress-node: test` I see:
* traffic being correctly masqueraded with the IP of the node (`10.186.15.217`)
* reply traffic from the remote web server
* reply traffic being rev-SNATed with the pod IP (`10.100.2.71`)

```
root@gke-pippolo-test-gsg-183-default-pool-18f584cb-2npx:/home/cilium# tcpdump -i eth0 -n host 34.118.45.49
tcpdump: verbose output suppressed, use -v or -vv for full protocol decode
listening on eth0, link-type EN10MB (Ethernet), capture size 262144 bytes
12:37:43.953487 IP 10.186.15.217.35240 > 34.118.45.49.80: Flags [S], seq 962451211, win 42600, options [mss 1420,sackOK,TS val 2893692178 ecr 0,nop,wscale 7], length 0
12:37:43.955774 IP 34.118.45.49.80 > 10.186.15.217.35240: Flags [S.], seq 1276902895, ack 962451212, win 64768, options [mss 1420,sackOK,TS val 3799875431 ecr 2893692178,nop,wscale 7], length 0
12:37:43.955822 IP 34.118.45.49.80 > 10.100.2.71.35240: Flags [S.], seq 1276902895, ack 962451212, win 64768, options [mss 1420,sackOK,TS val 3799875431 ecr 2893692178,nop,wscale 7], length 0
```

So I moved to the vxlan device (on the gateway node) to check if we are correctly forwarding rev-SNATed back traffic to the worker node:

```
root@gke-pippolo-test-gsg-183-default-pool-18f584cb-2npx:/home/cilium# tcpdump -i cilium_vxlan -n host 34.118.45.49
tcpdump: verbose output suppressed, use -v or -vv for full protocol decode
listening on cilium_vxlan, link-type EN10MB (Ethernet), capture size 262144 bytes
12:40:04.697235 IP 10.100.2.71.35360 > 34.118.45.49.80: Flags [S], seq 2341543211, win 42600, options [mss 1420,sackOK,TS val 2893832922 ecr 0,nop,wscale 7], length 0
12:40:05.735580 IP 10.100.2.71.35360 > 34.118.45.49.80: Flags [S], seq 2341543211, win 42600, options [mss 1420,sackOK,TS val 2893833961 ecr 0,nop,wscale 7], length 0
12:40:07.783623 IP 10.100.2.71.35360 > 34.118.45.49.80: Flags [S], seq 2341543211, win 42600, options [mss 1420,sackOK,TS val 2893836009 ecr 0,nop,wscale 7], length 0
^C
3 packets captured
3 packets received by filter
0 packets dropped by kernel
```

And it seems like no: for some reason reply traffic does not end up in the tunnel :thinking: 

It could be a case of https://github.com/cilium/cilium/issues/17848 (although so far we've only observed this on EKS), checking Iptables now

**Comment by jibi** [comment]
OK, seems like it was just a misconfiguration (for example `enable-endpoint-routes` was set to false, even though it should be enabled in GKE).

I reinstalled Cilium from Helm:
```sh
➜  kubernetes git:(master) helm upgrade cilium ./cilium \
  --namespace kube-system \
  --set nodeinit.enabled=true \
  --set nodeinit.reconfigureKubelet=true \
  --set nodeinit.removeCbrBridge=true \
  --set cni.binPath=/home/kubernetes/bin \
  --set gke.enabled=true \
  --set ipam.mode=kubernetes \
  --set ipv4NativeRoutingCIDR=10.100.0.0/14
```

Enabled egress gateway:
```sh
➜  kubernetes git:(master) helm upgrade cilium ./cilium \
   --namespace kube-system \
   --reuse-values \
   --set egressGateway.enabled=true \
   --set bpf.masquerade=true \
   --set kubeProxyReplacement=strict \
   --set l7Proxy=false
```

rolled the agents and operators:
```sh
➜  kubernetes git:(master) ks rollout restart ds/cilium
daemonset.apps/cilium restarted
➜  kubernetes git:(master) ks rollout restart deployment/cilium-operator
deployment.apps/cilium-operator restarted
```

Maps are properly set on the gateway node:
```
root@gke-pippolo-test-gsg-183-default-pool-18f584cb-2npx:/home/cilium# cilium bpf egress list
Source IP     Destination CIDR   Egress IP       Gateway IP
10.100.2.71   34.118.45.49/32    10.186.15.217   10.186.15.217
```

Request from the client pod does not timeout anymore:
```sh
bash-4.3# curl 34.118.45.49
<!DOCTYPE html>
<html>
<head>
<title>Welcome to nginx!</title>
[..]
```

and tcpdump shows that traffic is being correctly masqueraded:
```
root@gke-pippolo-test-gsg-183-default-pool-18f584cb-2npx:/home/cilium# tcpdump -i eth0 host 34.118.45.49 -n
tcpdump: verbose output suppressed, use -v or -vv for full protocol decode
listening on eth0, link-type EN10MB (Ethernet), capture size 262144 bytes
10:14:55.378186 IP 10.186.15.217.42488 > 34.118.45.49.80: Flags [S], seq 70955748, win 42600, options [mss 1420,sackOK,TS val 3144323603 ecr 0,nop,wscale 7], length 0
10:14:55.380126 IP 34.118.45.49.80 > 10.186.15.217.42488: Flags [S.], seq 2137838749, ack 70955749, win 64768, options [mss 1420,sackOK,TS val 4050506856 ecr 3144323603,nop,wscale 7], length 0
10:14:55.381162 IP 10.186.15.217.42488 > 34.118.45.49.80: Flags [.], ack 1, win 333, options [nop,nop,TS val 3144323606 ecr 4050506856], length 0
10:14:55.381184 IP 10.186.15.217.42488 > 34.118.45.49.80: Flags [P.], seq 1:77, ack 1, win 333, options [nop,nop,TS val 3144323606 ecr 4050506856], length 76: HTTP: GET / HTTP/1.1
10:14:55.381647 IP 34.118.45.49.80 > 10.186.15.217.42488: Flags [.], ack 77, win 506, options [nop,nop,TS val 4050506858 ecr 3144323606], length 0
10:14:55.381866 IP 34.118.45.49.80 > 10.186.15.217.42488: Flags [P.], seq 1:851, ack 77, win 506, options [nop,nop,TS val 4050506858 ecr 3144323606], length 850: HTTP: HTTP/1.1 200 OK
10:14:55.382210 IP 10.186.15.217.42488 > 34.118.45.49.80: Flags [.], ack 851, win 327, options [nop,nop,TS val 3144323607 ecr 4050506858], length 0
10:14:55.382273 IP 10.186.15.217.42488 > 34.118.45.49.80: Flags [F.], seq 77, ack 851, win 331, options [nop,nop,TS val 3144323608 ecr 4050506858], length 0
10:14:55.382571 IP 34.118.45.49.80 > 10.186.15.217.42488: Flags [F.], seq 851, ack 78, win 506, options [nop,nop,TS val 4050506859 ecr 3144323608], length 0
10:14:55.382766 IP 10.186.15.217.42488 > 34.118.45.49.80: Flags [.], ack 852, win 331, options [nop,nop,TS val 3144323608 ecr 4050506859], length 0
^C
```

as `10.186.15.217` is the node IP assigned to the gateway:
```sh
root@gke-pippolo-test-gsg-183-default-pool-18f584cb-2npx:/home/cilium# ip a s dev eth0
2: eth0: <BROADCAST,MULTICAST,UP,LOWER_UP> mtu 1460 qdisc mq state UP group default qlen 1000
    link/ether 42:01:0a:ba:0f:d9 brd ff:ff:ff:ff:ff:ff
    inet 10.186.15.217/32 scope global dynamic eth0
       valid_lft 63930sec preferred_lft 63930sec
    inet6 fe80::4001:aff:feba:fd9/64 scope link
       valid_lft forever preferred_lft forever
```
