### ISSUE TITLE
CI: Pod-to-ingress-service-allow-ingress-identity exit 22 failure

### ISSUE THREAD

**Issue by YutaroHayakawa** [cilium/cilium#39472]
## CI failure

```
❌ command "curl --silent --fail --show-error --connect-timeout 2 --max-time 10 -w %{local_ip}:%{local_port} -> %{remote_ip}:%{remote_port} = %{response_code}\n --output /dev/null [http://cilium-ingress-same-node.cilium-test-3:80](http://cilium-ingress-same-node.cilium-test-3/)" failed: command failed (pod=cilium-test-3/client2-6dd74d49c5-nvq98, container=client2): command terminated with exit code 22
...
❌ 1/20 tests failed (1/257 actions), 3 tests skipped, 0 scenarios skipped:
Test [pod-to-ingress-service-allow-ingress-identity]:
  ❌ pod-to-ingress-service-allow-ingress-identity/pod-to-ingress-service:curl-2: cilium-test-3/client2-6dd74d49c5-nvq98 (10.244.3.51) -> cilium-test-3/cilium-ingress-same-node (cilium-ingress-same-node.cilium-test-3:80)
    ⛑️ The following owners are responsible for reliability of the testsuite: 
        - @cilium/sig-lb (pod-to-ingress-service)
        - @cilium/ci-structure (.github/workflows/tests-e2e-upgrade.yaml)
```

Link: https://github.com/cilium/cilium/actions/runs/14935254370/job/41961095656
Sysdump: [cilium-sysdump-conn-disrupt-test-cilium-upgrade-12-concurrent-20250509-183950 2.zip](https://github.com/user-attachments/files/20128650/cilium-sysdump-conn-disrupt-test-cilium-upgrade-12-concurrent-20250509-183950.2.zip)

**Comment by thorn3r** [comment]
hit on https://github.com/isovalent/cilium/actions/runs/15146118797/job/42582147098
PR: https://github.com/isovalent/cilium/pull/7332

**Comment by asauber** [comment]
hit here https://github.com/cilium/cilium/actions/runs/15984478214/job/45086037621
PR: https://github.com/cilium/cilium/pull/39957

**Comment by jrife** [comment]
another: https://github.com/cilium/cilium/actions/runs/16815291337/job/47630511204
PR: #40690

**Comment by mathpl** [comment]
Can we rename this ticker `CI: Pod-to-ingress-service-allow-ingress-identity exit 22 failure`.

We've seen similar failures in these runs:
- e2e upgrade:
  - https://github.com/cilium/cilium/actions/runs/16821204904/job/47648289397
  - https://github.com/cilium/cilium/actions/runs/16821204904/job/47648289441
  - https://github.com/cilium/cilium/actions/runs/16726793769/job/47344487955
  - https://github.com/cilium/cilium/actions/runs/16134454806/job/45527949633
- conformance ipsec e2e:
  - https://github.com/cilium/cilium/actions/runs/16612146719/job/46997169044
- conformance cluster mesh
  - https://github.com/cilium/cilium/actions/runs/16270434961/job/45936456601

Thank you!

**Comment by mhofstetter** [comment]
I analyzed one of the jobs where the sysdump is still available.

https://github.com/cilium/cilium/actions/runs/16815291337/job/47630511204 (PR: https://github.com/cilium/cilium/pull/40690)

This, and a bunch of other runs report HTTP `503` in the tests of `pod-to-ingress-service-allow-ingress-identity`.

```
2025-08-07T21:05:39.3284521Z [=] [cilium-test-4] Test [pod-to-ingress-service] [16/24]

[parallel running tests]

2025-08-07T21:05:39.3294535Z [=] [cilium-test-4] Test [pod-to-ingress-service-allow-ingress-identity] [17/24]
2025-08-07T21:05:39.3295993Z .  ℹ️  📜 Applying CiliumNetworkPolicy 'all-ingress-deny' to namespace 'cilium-test-4' on cluster kind-kind..
2025-08-07T21:05:39.3297417Z   ℹ️  📜 Applying CiliumNetworkPolicy 'allow-from-cilium-ingress' to namespace 'cilium-test-4' on cluster kind-kind..
2025-08-07T21:05:39.3298566Z   [-] Scenario [pod-to-ingress-service-allow-ingress-identity/pod-to-ingress-service]
2025-08-07T21:05:39.3300540Z   [.] Action [pod-to-ingress-service-allow-ingress-identity/pod-to-ingress-service:curl-0: cilium-test-4/client-645b68dcf7-vvdn8 (10.244.4.51) -> cilium-test-4/cilium-ingress-same-node (cilium-ingress-same-node.cilium-test-4:80)]
2025-08-07T21:05:39.3304171Z   ❌ command "curl --silent --fail --show-error --connect-timeout 2 --max-time 10 -w %{local_ip}:%{local_port} -> %{remote_ip}:%{remote_port} = %{response_code}\n --output /dev/null http://cilium-ingress-same-node.cilium-test-4:80" failed: command failed (pod=cilium-test-4/client-645b68dcf7-vvdn8, container=client): command terminated with exit code 22

[sysdump capturing]
2025-08-07T21:07:12.3787577Z ✅ The sysdump has been saved to cilium-sysdump-conn-disrupt-test-cilium-downgrade-30-concurrent-20250807-210535.zip

2025-08-07T21:07:12.4889474Z   ℹ️  curl stdout:
2025-08-07T21:07:12.4892573Z   10.244.4.51:57146 -> 10.96.214.119:80 = 503
2025-08-07T21:07:12.4893217Z   ℹ️  curl stderr:
2025-08-07T21:07:12.4893628Z   curl: (22) The requested URL returned error: 503
2025-08-07T21:07:12.4894070Z   
2025-08-07T21:07:12.4895645Z   [.] Action [pod-to-ingress-service-allow-ingress-identity/pod-to-ingress-service:curl-1: cilium-test-4/client-645b68dcf7-vvdn8 (10.244.4.51) -> cilium-test-4/cilium-ingress-other-node (cilium-ingress-other-node.cilium-test-4:80)]
2025-08-07T21:07:12.6168120Z .  [.] Action [pod-to-ingress-service-allow-ingress-identity/pod-to-ingress-service:curl-2: cilium-test-4/client2-66475877c6-v8ptz (10.244.4.4) -> cilium-test-4/cilium-ingress-same-node (cilium-ingress-same-node.cilium-test-4:80)]
2025-08-07T21:07:12.9847669Z .  [.] Action [pod-to-ingress-service-allow-ingress-identity/pod-to-ingress-service:curl-3: cilium-test-4/client2-66475877c6-v8ptz (10.244.4.4) -> cilium-test-4/cilium-ingress-other-node (cilium-ingress-other-node.cilium-test-4:80)]
2025-08-07T21:07:13.2382090Z .  [.] Action [pod-to-ingress-service-allow-ingress-identity/pod-to-ingress-service:curl-4: cilium-test-4/client3-795488bf5-7hz9z (10.244.0.80) -> cilium-test-4/cilium-ingress-same-node (cilium-ingress-same-node.cilium-test-4:80)]
2025-08-07T21:07:13.4935070Z .  [.] Action [pod-to-ingress-service-allow-ingress-identity/pod-to-ingress-service:curl-5: cilium-test-4/client3-795488bf5-7hz9z (10.244.0.80) -> cilium-test-4/cilium-ingress-other-node (cilium-ingress-other-node.cilium-test-4:80)]
```

Checking the hubble flows in the sysdump by filtering for K8s NS `cilium-test-4` and Client Pod IP `10.244.4.51` it's possible to find the related HTTP flows for the related tests `pod-to-ingress-service` (successful) & `pod-to-ingress-service-allow-ingress-identity` (failing) - both of them perform the pod-to-ingress requests. 

HTTP requests in the k8s namespace that originated from the client pod ip

```
❯ cat hubble-flows-cilium-* | hubble observe  --protocol=http --numeric --ip=10.244.4.51 --input-file -

# `pod-to-ingress-service` 1 call
Aug  7 21:05:30.444: 10.244.4.51:57130 (ingress) -> :8080 (ID:31753) http-request FORWARDED (HTTP/1.1 GET http://cilium-ingress-same-node.cilium-test-4/)

# `pod-to-ingress-service` 2 call
Aug  7 21:05:30.647: 10.244.4.51:53132 (ingress) -> 10.244.2.147:8080 (ID:16467) http-request FORWARDED (HTTP/1.1 GET http://cilium-ingress-other-node.cilium-test-4/)
Aug  7 21:05:30.658: 10.244.4.51:53132 (ingress) <- 10.244.2.147:8080 (ID:16467) http-response FORWARDED (HTTP/1.1 200 14ms (GET http://cilium-ingress-other-node.cilium-test-4/))

# `pod-to-ingress-service-allow-ingress-identity` -> failing call 1
Aug  7 21:05:35.458: 10.244.4.51:57146 (ingress) -> :8080 (ID:31753) http-request FORWARDED (HTTP/1.1 GET http://cilium-ingress-same-node.cilium-test-4/)
```

-> 1 & 3 connect from the same source-pod to the same destination-pod (`same-node`) - on the same node

Zooming into the timeframe of relevant requests (1 (successful) &3 (failing)) - it looks like the failing request receives a TCP `RST` on Envoys upstream connection (towards the destination pod).

```
❯ cat hubble-flows-cilium-* | hubble observe --since=2025-08-07T21:05:30Z --until=2025-08-07T21:05:36Z --protocol=tcp --numeric --namespace=cilium-test-4 --input-file -

# from successful request

Aug  7 21:05:30.421: 10.244.4.51 (ID:46005) <> 10.96.214.119:80 (world-ipv4) pre-xlate-fwd TRACED (TCP)
Aug  7 21:05:30.422: 10.244.4.51:57130 (ID:46005) -> 10.96.214.119:80 (world-ipv4) to-proxy FORWARDED (TCP Flags: SYN)
Aug  7 21:05:30.422: 10.244.4.51:57130 (ID:46005) <- 10.96.214.119:80 (world-ipv4) to-endpoint FORWARDED (TCP Flags: SYN, ACK)
Aug  7 21:05:30.422: 10.244.4.51:57130 (ID:46005) -> 10.96.214.119:80 (world-ipv4) to-proxy FORWARDED (TCP Flags: ACK)
Aug  7 21:05:30.423: 10.244.4.51:57130 (ID:46005) -> 10.96.214.119:80 (world-ipv4) to-proxy FORWARDED (TCP Flags: ACK, PSH)

# envoy on that node establishes upstream connection to destination pod

Aug  7 21:05:30.442: [fd00:10:244:4::d6c6]:37496 (ingress) -> [fd00:10:244:4::833d]:8080 (ID:31753) to-endpoint FORWARDED (TCP Flags: SYN)
Aug  7 21:05:30.442: [fd00:10:244:4::d6c6]:37496 (host) <- [fd00:10:244:4::833d]:8080 (ID:31753) to-stack FORWARDED (TCP Flags: SYN, ACK)
Aug  7 21:05:30.442: [fd00:10:244:4::d6c6]:37496 (ingress) -> [fd00:10:244:4::833d]:8080 (ID:31753) to-endpoint FORWARDED (TCP Flags: ACK)
Aug  7 21:05:30.443: [fd00:10:244:4::d6c6]:37496 (host) <> fd00:10:244:4::833d (ID:31753) pre-xlate-rev TRACED (TCP)

# push and receive data

Aug  7 21:05:30.444: 10.244.4.51:57130 (ingress) -> :8080 (ID:31753) http-request FORWARDED (HTTP/1.1 GET http://cilium-ingress-same-node.cilium-test-4/)
Aug  7 21:05:30.446: [fd00:10:244:4::d6c6]:37496 (ingress) -> [fd00:10:244:4::833d]:8080 (ID:31753) to-endpoint FORWARDED (TCP Flags: ACK, PSH)
Aug  7 21:05:30.453: [fd00:10:244:4::d6c6]:37496 (host) <- [fd00:10:244:4::833d]:8080 (ID:31753) to-stack FORWARDED (TCP Flags: ACK, PSH)
Aug  7 21:05:30.459: :57130 (ingress) <- [fd00:10:244:4::833d]:8080 (ID:31753) http-response FORWARDED (HTTP/1.1 200 27ms (GET http://cilium-ingress-same-node.cilium-test-4/))

Aug  7 21:05:30.464: 10.244.4.51:57130 (ID:46005) <- 10.96.214.119:80 (world-ipv4) to-endpoint FORWARDED (TCP Flags: ACK, PSH)
Aug  7 21:05:30.467: 10.244.4.51:57130 (ID:46005) -> 10.96.214.119:80 (world-ipv4) to-proxy FORWARDED (TCP Flags: ACK, FIN)
Aug  7 21:05:30.468: 10.244.4.51:57130 (ID:46005) <- 10.96.214.119:80 (world-ipv4) to-endpoint FORWARDED (TCP Flags: ACK, FIN)

# the second failing requests (ACK, FIN -> RST -> HTTP 503)

Aug  7 21:05:35.450: 10.244.4.51 (ID:46005) <> 10.96.214.119:80 (world-ipv4) pre-xlate-fwd TRACED (TCP)
Aug  7 21:05:35.450: 10.244.4.51:57146 (ID:46005) -> 10.96.214.119:80 (world-ipv4) to-proxy FORWARDED (TCP Flags: SYN)
Aug  7 21:05:35.450: 10.244.4.51:57146 (ID:46005) <- 10.96.214.119:80 (world-ipv4) to-endpoint FORWARDED (TCP Flags: SYN, ACK)
Aug  7 21:05:35.450: 10.244.4.51:57146 (ID:46005) -> 10.96.214.119:80 (world-ipv4) to-proxy FORWARDED (TCP Flags: ACK)
Aug  7 21:05:35.451: 10.244.4.51:57146 (ID:46005) -> 10.96.214.119:80 (world-ipv4) to-proxy FORWARDED (TCP Flags: ACK, PSH)

# upstream connection reuse fails because when we send the data we receive a RST on the upstream connection -> results in 503
Aug  7 21:05:35.455: [fd00:10:244:4::d6c6]:37496 (host) <- [fd00:10:244:4::833d]:8080 (ID:31753) to-stack FORWARDED (TCP Flags: ACK, FIN)
Aug  7 21:05:35.458: 10.244.4.51:57146 (ingress) -> :8080 (ID:31753) http-request FORWARDED (HTTP/1.1 GET http://cilium-ingress-same-node.cilium-test-4/)
Aug  7 21:05:35.460: [fd00:10:244:4::d6c6]:37496 (host) <- [fd00:10:244:4::833d]:8080 (ID:31753) to-stack FORWARDED (TCP Flags: RST)
Aug  7 21:05:35.461: :57146 (ingress) <- [fd00:10:244:4::833d]:8080 (ID:31753) http-response FORWARDED (HTTP/1.1 503 7ms (GET http://cilium-ingress-same-node.cilium-test-4/))

Aug  7 21:05:35.464: 10.244.4.51:57146 (ID:46005) <- 10.96.214.119:80 (world-ipv4) to-endpoint FORWARDED (TCP Flags: ACK, PSH)
Aug  7 21:05:35.465: 10.244.4.51:57146 (ID:46005) -> 10.96.214.119:80 (world-ipv4) to-proxy FORWARDED (TCP Flags: ACK, FIN)
Aug  7 21:05:35.466: 10.244.4.51:57146 (ID:46005) <- 10.96.214.119:80 (world-ipv4) to-endpoint FORWARDED (TCP Flags: ACK, FIN)
```

Cross-checking with the node-local Envoy log `logs-cilium-envoy-tvtxg-cilium-envoy-20250807-210535.log` we see the upstream connection reuse (for the same source- and destination pod)

```
2025-08-07T21:05:35.459058292Z ':authority', 'cilium-ingress-same-node.cilium-test-4'
2025-08-07T21:05:35.459061709Z ':path', '/'
2025-08-07T21:05:35.459072599Z ':method', 'GET'
2025-08-07T21:05:35.459075715Z ':scheme', 'http'
2025-08-07T21:05:35.459079091Z 'user-agent', 'curl/8.7.1'
2025-08-07T21:05:35.459358443Z 'accept', '*/*'
2025-08-07T21:05:35.459367129Z 'x-forwarded-for', '10.244.4.51'
2025-08-07T21:05:35.459370415Z 'x-forwarded-proto', 'http'
2025-08-07T21:05:35.459373431Z 'x-envoy-internal', 'true'
2025-08-07T21:05:35.459376526Z 'x-request-id', '3cb77e0b-3d8c-4b33-b96e-fb84f76bb4a6'
2025-08-07T21:05:35.459379291Z 
2025-08-07T21:05:35.459382457Z [2025-08-07 21:05:35.457][23][debug][pool] [external/envoy/source/common/conn_pool/conn_pool_base.cc:302] [Tags: "ConnectionId":"249"] using existing fully connected connection
2025-08-07T21:05:35.459385894Z [2025-08-07 21:05:35.458][23][debug][pool] [external/envoy/source/common/conn_pool/conn_pool_base.cc:219] [Tags: "ConnectionId":"249"] creating stream
2025-08-07T21:05:35.459389060Z [2025-08-07 21:05:35.458][23][debug][router] [external/envoy/source/common/router/upstream_request.cc:591] [Tags: "ConnectionId":"256","StreamId":"212205139774510930"] pool ready
2025-08-07T21:05:35.459392426Z [2025-08-07 21:05:35.458][23][trace][pool] [external/envoy/source/common/conn_pool/conn_pool_base.cc:136] per-upstream shouldCreateNewConnection returns false for pending 0 active 1 connecting_and_connected_capacity 0 connecting_capacity 0 ratio 1
2025-08-07T21:05:35.459395752Z [2025-08-07 21:05:35.458][23][debug][filter] [cilium/l7policy.cc:178] [Tags: "ConnectionId":"256"] cilium.l7policy: upstream decodeHeaders()
2025-08-07T21:05:35.459398758Z [2025-08-07 21:05:35.458][23][trace][filter] [cilium/ipcache.cc:152] cilium.ipcache: Looking up key: fd000010:2440004:0:833d/128
2025-08-07T21:05:35.459402134Z [2025-08-07 21:05:35.458][23][debug][filter] [cilium/ipcache.cc:157] cilium.ipcache: fd00:10:244:4::833d has ID 31753
2025-08-07T21:05:35.459405641Z [2025-08-07 21:05:35.458][23][debug][filter] [cilium/filter_state_cilium_policy.cc:97] [Tags: "ConnectionId":"256"] cilium.l7policy: Pod 10.244.4.51 HTTP egress policy enforcement skipped (no HTTP rules) on proxy_id: 15323 id: 31753 port: 8080
2025-08-07T21:05:35.459409177Z [2025-08-07 21:05:35.458][23][debug][filter] [cilium/filter_state_cilium_policy.cc:131] [Tags: "ConnectionId":"256"] cilium.l7policy: Ingress 10.244.4.2 HTTP ingress policy enforcement skipped (no HTTP rules) on proxy_id: 15323 id: 46005 port: 80
2025-08-07T21:05:35.460342028Z [2025-08-07 21:05:35.459][23][trace][http] [external/envoy/source/common/http/filter_manager.cc:573] [Tags: "ConnectionId":"256","StreamId":"212205139774510930"] decode headers called: filter=cilium.l7policy status=0
2025-08-07T21:05:35.460524659Z [2025-08-07 21:05:35.460][23][trace][router] [external/envoy/source/common/router/upstream_codec_filter.cc:61] [Tags: "ConnectionId":"256","StreamId":"212205139774510930"] proxying headers
2025-08-07T21:05:35.460531342Z [2025-08-07 21:05:35.460][23][trace][connection] [external/envoy/source/common/network/connection_impl.cc:570] [Tags: "ConnectionId":"249"] writing 232 bytes, end_stream false
2025-08-07T21:05:35.460535620Z [2025-08-07 21:05:35.460][23][debug][client] [external/envoy/source/common/http/codec_client.cc:142] [Tags: "ConnectionId":"249"] encode complete
2025-08-07T21:05:35.460539687Z [2025-08-07 21:05:35.460][23][trace][http] [external/envoy/source/common/http/filter_manager.cc:573] [Tags: "ConnectionId":"256","StreamId":"212205139774510930"] decode headers called: filter=envoy.filters.http.upstream_codec status=0
2025-08-07T21:05:35.460567770Z [2025-08-07 21:05:35.460][23][trace][http] [external/envoy/source/common/http/filter_manager.cc:573] [Tags: "ConnectionId":"256","StreamId":"212205139774510930"] decode headers called: filter=envoy.filters.http.router status=1
2025-08-07T21:05:35.460571647Z [2025-08-07 21:05:35.460][23][trace][misc] [external/envoy/source/common/event/scaled_range_timer_manager_impl.cc:60] enableTimer called on 0x735cff57de30 for 300000ms, min is 300000ms
2025-08-07T21:05:35.460583609Z [2025-08-07 21:05:35.460][23][trace][http] [external/envoy/source/common/http/http1/codec_impl.cc:700] [Tags: "ConnectionId":"256"] parsed 101 bytes
2025-08-07T21:05:35.460586965Z [2025-08-07 21:05:35.460][23][trace][connection] [external/envoy/source/common/network/connection_impl.cc:655] [Tags: "ConnectionId":"249"] socket event: 3
2025-08-07T21:05:35.460590723Z [2025-08-07 21:05:35.460][23][trace][connection] [external/envoy/source/common/network/connection_impl.cc:801] [Tags: "ConnectionId":"249"] write ready
2025-08-07T21:05:35.460881441Z [2025-08-07 21:05:35.460][23][trace][connection] [external/envoy/source/common/network/raw_buffer_socket.cc:70] [Tags: "ConnectionId":"249"] write returns: 232
2025-08-07T21:05:35.460893784Z [2025-08-07 21:05:35.460][23][trace][connection] [external/envoy/source/common/network/connection_impl.cc:701] [Tags: "ConnectionId":"249"] read ready. dispatch_buffered_data=0
2025-08-07T21:05:35.460897721Z [2025-08-07 21:05:35.460][23][trace][connection] [external/envoy/source/common/network/raw_buffer_socket.cc:25] [Tags: "ConnectionId":"249"] read returns: 0
2025-08-07T21:05:35.461246221Z [2025-08-07 21:05:35.460][23][debug][connection] [external/envoy/source/common/network/connection_impl.cc:774] [Tags: "ConnectionId":"249"] remote close
2025-08-07T21:05:35.461256831Z [2025-08-07 21:05:35.461][23][trace][connection] [external/envoy/source/common/network/connection_impl.cc:294] [Tags: "ConnectionId":"249"] connection is closing not through the filter manager
2025-08-07T21:05:35.461260067Z [2025-08-07 21:05:35.461][23][debug][connection] [external/envoy/source/common/network/connection_impl.cc:314] [Tags: "ConnectionId":"249"] closing socket: 0
2025-08-07T21:05:35.462227316Z [2025-08-07 21:05:35.461][23][trace][connection] [external/envoy/source/common/network/connection_impl.cc:510] [Tags: "ConnectionId":"249"] raising connection event 0
2025-08-07T21:05:35.462238988Z [2025-08-07 21:05:35.461][23][trace][http] [external/envoy/source/common/http/http1/codec_impl.cc:650] [Tags: "ConnectionId":"249"] parsing 0 bytes
2025-08-07T21:05:35.462242655Z [2025-08-07 21:05:35.461][23][trace][http] [external/envoy/source/common/http/http1/codec_impl.cc:700] [Tags: "ConnectionId":"249"] parsed 0 bytes
2025-08-07T21:05:35.462246442Z [2025-08-07 21:05:35.461][23][debug][client] [external/envoy/source/common/http/codec_client.cc:107] [Tags: "ConnectionId":"249"] disconnect. resetting 1 pending requests
2025-08-07T21:05:35.462249959Z [2025-08-07 21:05:35.461][23][debug][client] [external/envoy/source/common/http/codec_client.cc:159] [Tags: "ConnectionId":"249"] Request reset. Reason 7
2025-08-07T21:05:35.462253746Z [2025-08-07 21:05:35.461][23][trace][main] [external/envoy/source/common/event/dispatcher_impl.cc:233] item added to deferred deletion list (size=1)
2025-08-07T21:05:35.462259326Z [2025-08-07 21:05:35.461][23][debug][router] [external/envoy/source/common/router/router.cc:1487] [Tags: "ConnectionId":"256","StreamId":"212205139774510930"] upstream reset: reset reason: connection termination, transport failure reason: 
2025-08-07T21:05:35.462262382Z [2025-08-07 21:05:35.461][23][trace][main] [external/envoy/source/common/event/dispatcher_impl.cc:233] item added to deferred deletion list (size=2)
2025-08-07T21:05:35.462265668Z [2025-08-07 21:05:35.461][23][trace][main] [external/envoy/source/common/event/dispatcher_impl.cc:233] item added to deferred deletion list (size=3)
2025-08-07T21:05:35.462270527Z [2025-08-07 21:05:35.461][23][debug][http] [external/envoy/source/common/http/filter_manager.cc:1094] [Tags: "ConnectionId":"256","StreamId":"212205139774510930"] Sending local reply with details upstream_reset_before_response_started{connection_termination}
2025-08-07T21:05:35.462283832Z [2025-08-07 21:05:35.461][23][trace][misc] [external/envoy/source/common/event/scaled_range_timer_manager_impl.cc:60] enableTimer called on 0x735cff57de30 for 300000ms, min is 300000ms
2025-08-07T21:05:35.462287499Z [2025-08-07 21:05:35.461][23][trace][http] [external/envoy/source/common/http/filter_manager.cc:906] [Tags: "ConnectionId":"256","StreamId":"212205139774510930"] commonEncodePrefix end_stream: false, isHalfCloseEnabled: false
2025-08-07T21:05:35.462290524Z [2025-08-07 21:05:35.461][23][debug][filter] [cilium/l7policy.cc:333] [Tags: "ConnectionId":"256"] cilium.l7policy: downstream encodeHeaders()
2025-08-07T21:05:35.462293800Z [2025-08-07 21:05:35.462][23][trace][http] [external/envoy/source/common/http/filter_manager.cc:1263] [Tags: "ConnectionId":"256","StreamId":"212205139774510930"] encode headers called: filter=cilium.l7policy status=0
2025-08-07T21:05:35.462296706Z [2025-08-07 21:05:35.462][23][trace][http] [external/envoy/source/common/http/filter_manager.cc:1263] [Tags: "ConnectionId":"256","StreamId":"212205139774510930"] encode headers called: filter=envoy.filters.http.grpc_stats status=0
2025-08-07T21:05:35.462299611Z [2025-08-07 21:05:35.462][23][trace][http] [external/envoy/source/common/http/filter_manager.cc:1263] [Tags: "ConnectionId":"256","StreamId":"212205139774510930"] encode headers called: filter=envoy.filters.http.grpc_web status=0
2025-08-07T21:05:35.463901279Z [2025-08-07 21:05:35.462][23][debug][http] [external/envoy/source/common/http/conn_manager_impl.cc:1906] [Tags: "ConnectionId":"256","StreamId":"212205139774510930"] encoding headers via codec (end_stream=false):
2025-08-07T21:05:35.463912560Z ':status', '503'
2025-08-07T21:05:35.463916949Z 'content-length', '95'
2025-08-07T21:05:35.463921006Z 'content-type', 'text/plain'
2025-08-07T21:05:35.463924943Z 'date', 'Thu, 07 Aug 2025 21:05:35 GMT'
2025-08-07T21:05:35.463927809Z 'server', 'envoy'
2025-08-07T21:05:35.463930744Z 
```

including the following lines that indicate that the pending request (downstream connection) is reset without a retry)

```
[external/envoy/source/common/conn_pool/conn_pool_base.cc:302] [Tags: "ConnectionId":"249"] using existing fully connected connection
...
[external/envoy/source/common/network/connection_impl.cc:774] [Tags: "ConnectionId":"249"] remote close
...
[external/envoy/source/common/http/codec_client.cc:107] [Tags: "ConnectionId":"249"] disconnect. resetting 1 pending requests
...
# local reply -> 503
[external/envoy/source/common/http/filter_manager.cc:1094] [Tags: "ConnectionId":"256","StreamId":"212205139774510930"] Sending local reply with details upstream_reset_before_response_started{connection_termination}

``` 

Looking at the flows of the Envoy upstream connection we see that this reset of the reused connection happens after 5s of inactivity.

```
❯ cat hubble-flows-cilium-* | hubble observe --since=2025-08-07T21:05:30Z --until=2025-08-07T21:05:36Z --protocol=tcp --numeric --ip=fd00:10:244:4::d6c6 --input-file -

Aug  7 21:05:30.442: [fd00:10:244:4::d6c6]:37496 (ingress) -> [fd00:10:244:4::833d]:8080 (ID:31753) to-endpoint FORWARDED (TCP Flags: SYN)
Aug  7 21:05:30.442: [fd00:10:244:4::d6c6]:37496 (host) <- [fd00:10:244:4::833d]:8080 (ID:31753) to-stack FORWARDED (TCP Flags: SYN, ACK)
Aug  7 21:05:30.442: [fd00:10:244:4::d6c6]:37496 (ingress) -> [fd00:10:244:4::833d]:8080 (ID:31753) to-endpoint FORWARDED (TCP Flags: ACK)
Aug  7 21:05:30.443: [fd00:10:244:4::d6c6]:37496 (host) <> fd00:10:244:4::833d (ID:31753) pre-xlate-rev TRACED (TCP)
Aug  7 21:05:30.446: [fd00:10:244:4::d6c6]:37496 (ingress) -> [fd00:10:244:4::833d]:8080 (ID:31753) to-endpoint FORWARDED (TCP Flags: ACK, PSH)
Aug  7 21:05:30.453: [fd00:10:244:4::d6c6]:37496 (host) <- [fd00:10:244:4::833d]:8080 (ID:31753) to-stack FORWARDED (TCP Flags: ACK, PSH)

# ACK,FIN & RST after 5s
Aug  7 21:05:35.455: [fd00:10:244:4::d6c6]:37496 (host) <- [fd00:10:244:4::833d]:8080 (ID:31753) to-stack FORWARDED (TCP Flags: ACK, FIN)
Aug  7 21:05:35.460: [fd00:10:244:4::d6c6]:37496 (host) <- [fd00:10:244:4::833d]:8080 (ID:31753) to-stack FORWARDED (TCP Flags: RST)
```

Looks like the attempt to reuse the connection that is closed by the test application in the destination pod after 5s can lead to this (and maybe other) flakes. The timing of the next request from the same pod to the same destination pod is random and can happen before conn-close (proper reuse) or after (proper new connection) - or in this case exactly at that time. worst possible timing?

**Comment by mhofstetter** [comment]
Looking at the sourcecode of the test application (https://github.com/cilium/json-mock -> https://github.com/typicode/json-server -> https://github.com/tinyhttp/tinyhttp 🤷  ) i'm not able to see where this TCP timeout is set and/or could be configured.

But a small test with a Go http client app against that testapp showed the same behaviour.

test client app

```
package main

import (
	"context"
	"io"
	"log"
	"net"
	"net/http"
	"os"
	"time"
)

func main() {
	url := os.Args[1]
	interval, err := time.ParseDuration(os.Args[2])
	if err != nil {
		log.Println("failed to parse interval")
		return
	}

	client := &http.Client{
		Transport: &http.Transport{
			DialContext: defaultTransportDialContext(&net.Dialer{
				Timeout:   30 * time.Second,
				KeepAlive: 30 * time.Second,
			}),
		},
	}

	for {
		log.Println("Sending HTTP request")

		req, err := http.NewRequest("GET", url, nil)
		if err != nil {
			log.Println("failed to create request")
			continue
		}
		req.Header.Add("Content-Type", "application/json")
		r, err := client.Do(req)
		if err != nil {
			log.Println("Connection closed unexpectedly")
			continue
		}

		b, err := io.ReadAll(r.Body)
		if err != nil {
			log.Println("failed to read body")
			continue
		}
		if err := r.Body.Close(); err != nil {
			log.Println("failed to close body")
			continue
		}

		log.Printf("Received HTTP response - connection-close: %t - %s\n", r.Close, string(b))

		time.Sleep(interval)
	}
}

func defaultTransportDialContext(dialer *net.Dialer) func(context.Context, string, string) (net.Conn, error) {
	return func(ctx context.Context, network string, addr string) (net.Conn, error) {
		log.Printf("HTTP transport creates new connection to %s\n", addr)

		return dialer.DialContext(ctx, network, addr)
	}
}
```

running docker test backend app

```
docker run -p 9090:80 quay.io/cilium/json-mock
```

starting client app with an interval of 10s (> 5s timeout)

```
go run main.go http://localhost:9090/public 10s
```

we start to see the termination close with tcpdump

```
❯ sudo tcpdump -eni any 'port 9090'
tcpdump: data link type LINUX_SLL2
tcpdump: verbose output suppressed, use -v[v]... for full protocol decode
listening on any, link-type LINUX_SLL2 (Linux cooked v2), snapshot length 262144 bytes

14:48:59.463392 lo    In  ifindex 1 00:00:00:00:00:00 ethertype IPv4 (0x0800), length 80: 127.0.0.1.48602 > 127.0.0.1.9090: Flags [S], seq 4109863926, win 65495, options [mss 65495,sackOK,TS val 676428397 ecr 0,nop,wscale 7], length 0
14:48:59.463406 lo    In  ifindex 1 00:00:00:00:00:00 ethertype IPv4 (0x0800), length 80: 127.0.0.1.9090 > 127.0.0.1.48602: Flags [S.], seq 779591229, ack 4109863927, win 65483, options [mss 65495,sackOK,TS val 676428397 ecr 676428397,nop,wscale 7], length 0
14:48:59.463417 lo    In  ifindex 1 00:00:00:00:00:00 ethertype IPv4 (0x0800), length 72: 127.0.0.1.48602 > 127.0.0.1.9090: Flags [.], ack 1, win 512, options [nop,nop,TS val 676428397 ecr 676428397], length 0
14:48:59.463529 lo    In  ifindex 1 00:00:00:00:00:00 ethertype IPv4 (0x0800), length 205: 127.0.0.1.48602 > 127.0.0.1.9090: Flags [P.], seq 1:134, ack 1, win 512, options [nop,nop,TS val 676428397 ecr 676428397], length 133
14:48:59.463536 lo    In  ifindex 1 00:00:00:00:00:00 ethertype IPv4 (0x0800), length 72: 127.0.0.1.9090 > 127.0.0.1.48602: Flags [.], ack 134, win 511, options [nop,nop,TS val 676428397 ecr 676428397], length 0
14:48:59.467108 lo    In  ifindex 1 00:00:00:00:00:00 ethertype IPv4 (0x0800), length 524: 127.0.0.1.9090 > 127.0.0.1.48602: Flags [P.], seq 1:453, ack 134, win 512, options [nop,nop,TS val 676428400 ecr 676428397], length 452
14:48:59.467122 lo    In  ifindex 1 00:00:00:00:00:00 ethertype IPv4 (0x0800), length 72: 127.0.0.1.48602 > 127.0.0.1.9090: Flags [.], ack 453, win 509, options [nop,nop,TS val 676428400 ecr 676428400], length 0

14:49:04.472479 lo    In  ifindex 1 00:00:00:00:00:00 ethertype IPv4 (0x0800), length 72: 127.0.0.1.9090 > 127.0.0.1.48602: Flags [F.], seq 453, ack 134, win 512, options [nop,nop,TS val 676433406 ecr 676428400], length 0
14:49:04.472580 lo    In  ifindex 1 00:00:00:00:00:00 ethertype IPv4 (0x0800), length 72: 127.0.0.1.48602 > 127.0.0.1.9090: Flags [F.], seq 134, ack 454, win 512, options [nop,nop,TS val 676433406 ecr 676433406], length 0
14:49:04.472596 lo    In  ifindex 1 00:00:00:00:00:00 ethertype IPv4 (0x0800), length 72: 127.0.0.1.9090 > 127.0.0.1.48602: Flags [.], ack 135, win 512, options [nop,nop,TS val 676433406 ecr 676433406], length 0

14:49:09.468735 lo    In  ifindex 1 00:00:00:00:00:00 ethertype IPv4 (0x0800), length 80: 127.0.0.1.35582 > 127.0.0.1.9090: Flags [S], seq 3463340565, win 65495, options [mss 65495,sackOK,TS val 676438402 ecr 0,nop,wscale 7], length 0
14:49:09.468752 lo    In  ifindex 1 00:00:00:00:00:00 ethertype IPv4 (0x0800), length 80: 127.0.0.1.9090 > 127.0.0.1.35582: Flags [S.], seq 1669960584, ack 3463340566, win 65483, options [mss 65495,sackOK,TS val 676438402 ecr 676438402,nop,wscale 7], length 0
14:49:09.468765 lo    In  ifindex 1 00:00:00:00:00:00 ethertype IPv4 (0x0800), length 72: 127.0.0.1.35582 > 127.0.0.1.9090: Flags [.], ack 1, win 512, options [nop,nop,TS val 676438402 ecr 676438402], length 0
14:49:09.468963 lo    In  ifindex 1 00:00:00:00:00:00 ethertype IPv4 (0x0800), length 205: 127.0.0.1.35582 > 127.0.0.1.9090: Flags [P.], seq 1:134, ack 1, win 512, options [nop,nop,TS val 676438402 ecr 676438402], length 133
14:49:09.468980 lo    In  ifindex 1 00:00:00:00:00:00 ethertype IPv4 (0x0800), length 72: 127.0.0.1.9090 > 127.0.0.1.35582: Flags [.], ack 134, win 511, options [nop,nop,TS val 676438402 ecr 676438402], length 0
14:49:09.472631 lo    In  ifindex 1 00:00:00:00:00:00 ethertype IPv4 (0x0800), length 524: 127.0.0.1.9090 > 127.0.0.1.35582: Flags [P.], seq 1:453, ack 134, win 512, options [nop,nop,TS val 676438406 ecr 676438402], length 452
14:49:09.472655 lo    In  ifindex 1 00:00:00:00:00:00 ethertype IPv4 (0x0800), length 72: 127.0.0.1.35582 > 127.0.0.1.9090: Flags [.], ack 453, win 509, options [nop,nop,TS val 676438406 ecr 676438406], length 0

14:49:14.476418 lo    In  ifindex 1 00:00:00:00:00:00 ethertype IPv4 (0x0800), length 72: 127.0.0.1.9090 > 127.0.0.1.35582: Flags [F.], seq 453, ack 134, win 512, options [nop,nop,TS val 676443410 ecr 676438406], length 0
14:49:14.476546 lo    In  ifindex 1 00:00:00:00:00:00 ethertype IPv4 (0x0800), length 72: 127.0.0.1.35582 > 127.0.0.1.9090: Flags [F.], seq 134, ack 454, win 512, options [nop,nop,TS val 676443410 ecr 676443410], length 0
14:49:14.476570 lo    In  ifindex 1 00:00:00:00:00:00 ethertype IPv4 (0x0800), length 72: 127.0.0.1.9090 > 127.0.0.1.35582: Flags [.], ack 135, win 512, options [nop,nop,TS val 676443410 ecr 676443410], length 0

14:49:19.477474 lo    In  ifindex 1 00:00:00:00:00:00 ethertype IPv4 (0x0800), length 80: 127.0.0.1.33574 > 127.0.0.1.9090: Flags [S], seq 1000554234, win 65495, options [mss 65495,sackOK,TS val 676448411 ecr 0,nop,wscale 7], length 0
14:49:19.477495 lo    In  ifindex 1 00:00:00:00:00:00 ethertype IPv4 (0x0800), length 80: 127.0.0.1.9090 > 127.0.0.1.33574: Flags [S.], seq 522447850, ack 1000554235, win 65483, options [mss 65495,sackOK,TS val 676448411 ecr 676448411,nop,wscale 7], length 0
14:49:19.477514 lo    In  ifindex 1 00:00:00:00:00:00 ethertype IPv4 (0x0800), length 72: 127.0.0.1.33574 > 127.0.0.1.9090: Flags [.], ack 1, win 512, options [nop,nop,TS val 676448411 ecr 676448411], length 0
14:49:19.477684 lo    In  ifindex 1 00:00:00:00:00:00 ethertype IPv4 (0x0800), length 205: 127.0.0.1.33574 > 127.0.0.1.9090: Flags [P.], seq 1:134, ack 1, win 512, options [nop,nop,TS val 676448411 ecr 676448411], length 133
14:49:19.477704 lo    In  ifindex 1 00:00:00:00:00:00 ethertype IPv4 (0x0800), length 72: 127.0.0.1.9090 > 127.0.0.1.33574: Flags [.], ack 134, win 511, options [nop,nop,TS val 676448411 ecr 676448411], length 0
14:49:19.481478 lo    In  ifindex 1 00:00:00:00:00:00 ethertype IPv4 (0x0800), length 524: 127.0.0.1.9090 > 127.0.0.1.33574: Flags [P.], seq 1:453, ack 134, win 512, options [nop,nop,TS val 676448415 ecr 676448411], length 452
14:49:19.481494 lo    In  ifindex 1 00:00:00:00:00:00 ethertype IPv4 (0x0800), length 72: 127.0.0.1.33574 > 127.0.0.1.9090: Flags [.], ack 453, win 509, options [nop,nop,TS val 676448415 ecr 676448415], length 0
```

but with an interval smaller than 5s we properly reuse the connection

Not sure whether we should try to adjust/replace the testing backend app or whether this is something we need to take care of in the Envoys upstream cluster config.

**Comment by mhofstetter** [comment]
As always, a possible workaround could be to let curl retry (`tests.WithRetryAll()`)

**Comment by mhofstetter** [comment]
Opened https://github.com/cilium/cilium/pull/41131 to hopefully workaround the issue by using `RetryAll`. We should probably keep that PR open to further discuss how to proceed.

Questions

- Do we want to improve the backend test app and increase the connection timeout?
- Is this an actual issue (not just a CI flake) and we should try to somehow fix this in Envoy or is it expected that clients retry in such situations?
- ...

**Comment by mhofstetter** [comment]
> Is this an actual issue (not just a CI flake) and we should try to somehow fix this in Envoy or is it expected that clients retry in such situations?

It looks like it's a general recommendation when using loadbalancers (incl. servicemeshes) that their timeout should be lower than the one of their backends. Otherwise one can end up with this race condition where the backend might close TCP connections with a TCP reset (RST) while (in our case) Envoy wants to use that connection for an inflight request.

Good analysis in an Istio issue: https://github.com/istio/istio/issues/55138#issuecomment-2666855044
Blog post from the same author (also with links to public cloud LB docs that mention this topic): https://medium.com/@kburjack/fixing-503-errors-when-using-istio-envoy-bf63aa720826

While cilium provides a way to [configure Envoys cluster http idle timeout](https://github.com/cilium/cilium/blob/main/install/kubernetes/cilium/values.yaml.tmpl#L2464-L2465) - this still defaults to the 60s of Envoy. (Note that this is currently a global option and is used by Gateway API, Ingress, L7LB & E/W original_dst clusters for policy enforcement.) Therefore it's probably better to configure this on the test backend side - which in case of `cilium/json-mock` has a very low timeout of 5s (built on top of node.js that has this set as default timeout). 

> Do we want to improve the backend test app and increase the connection timeout?

IMO yes. I found a way to increase the keepalive timeout of [cilium/json-mock](https://github.com/cilium/json-mock)  from 5s to 65s. 

Patch of `cilium/json-mock` to increase keepalive timeout: https://github.com/cilium/json-mock/pull/271
Testing in `cilium/cilium`: https://github.com/cilium/cilium/pull/41169

-> I verified the keepalive timeout with the [manual test mentioned in this comment above](https://github.com/cilium/cilium/issues/39472#issuecomment-3183890198).

This might also be of help for other L7 related connectivity tests where Envoy is involved too (Gateway API, Ingress, L7LB, L7 Policy).

Update: Released version of `cilium/json-mock` with increased timeout will be updated with https://github.com/cilium/cilium/pull/41175

**Comment by mhofstetter** [comment]
Renovate PR that updates the `cilium/json-mock` with an updated version that is modified to have a keepalive-timeout of 65s (> 60s Envoy upstream cluster idle timeout) has been merged: https://github.com/cilium/cilium/pull/41175

In addition i closed the open workaround PR that would have introduced retries on the clientside: https://github.com/cilium/cilium/pull/41131

Let's close and reopen if we still see this issue 🙏 🤞
