### ISSUE TITLE
Egress NAT Not working

### ISSUE THREAD

**Issue by Champ-Goblem** [cilium/cilium#19187]
### Is there an existing issue for this?

- [X] I have searched the existing issues

### What happened?

[](https://docs.cilium.io/en/v1.11/gettingstarted/egress-gateway/)I am trying to use cilium to NAT connections from specific pods via a Digital Ocean floating IP, but I can not seem to get it to work. I have setup cilium as per [https://docs.cilium.io/en/v1.11/gettingstarted/egress-gateway/](https://docs.cilium.io/en/v1.11/gettingstarted/egress-gateway/) and I have another digital ocean droplet running nginx via docker in host networking mode.

When I curl the nginx instance from a pod on the k3s cluster with cilium I get the expected response and I can see the flow via hubble, along with iptables traces and tcpdumps of the packet. Once I add the cilium egress nat policy I am no longer able to talk to the nginx instance, and the connection times out.

The assigned floating IP from digital ocean is `159.65.214.133` and from what I understand this is NAT 1:1 with the anchor IP of the droplet (`10.16.0.9`). 

 `ip a show eth0` shows:

```
2: eth0: <BROADCAST,MULTICAST,UP,LOWER_UP> mtu 1500 qdisc fq_codel state UP group default qlen 1000
    link/ether 0e:98:57:a2:a7:de brd ff:ff:ff:ff:ff:ff
    inet 138.68.140.249/20 brd 138.68.143.255 scope global eth0
       valid_lft forever preferred_lft forever
    inet 10.16.0.9/16 brd 10.16.255.255 scope global eth0
       valid_lft forever preferred_lft forever
    inet6 fe80::c98:57ff:fea2:a7de/64 scope link 
       valid_lft forever preferred_lft forever
```

On the node itself if I add the floating IP to the `eth0` interface and curl the other droplet running nginx via this floating IP, this doesnt work:

```
root@k3s-host:~# curl --interface 159.65.214.133 http://68.183.33.195 --max-time 5
curl: (28) Connection timed out after 5001 milliseconds
```

It seems to be I need to curl via the anchor IP assigned to the droplet:

```
root@k3s-host:~# curl --interface 10.16.0.9 http://68.183.33.195 --max-time 5
<!DOCTYPE html>
<html>
<head>
<title>Welcome to nginx!</title>
<style>
html { color-scheme: light dark; }
body { width: 35em; margin: 0 auto;
font-family: Tahoma, Verdana, Arial, sans-serif; }
</style>
</head>
<body>
<h1>Welcome to nginx!</h1>
<p>If you see this page, the nginx web server is successfully installed and
working. Further configuration is required.</p>

<p>For online documentation and support please refer to
<a href="http://nginx.org/">nginx.org</a>.<br/>
Commercial support is available at
<a href="http://nginx.com/">nginx.com</a>.</p>

<p><em>Thank you for using nginx.</em></p>
</body>
</html>
```

and the logs in nginx show the floating IP was used:

```
159.65.214.133 - - [18/Mar/2022:12:20:02 +0000] "GET / HTTP/1.1" 200 615 "-" "curl/7.68.0" "-"
```

If I curl from a pod without setting up the egress NAT policy I can also see this works and shows the public IP of the droplet:

```
138.68.140.249 - - [18/Mar/2022:12:22:30 +0000] "GET / HTTP/1.1" 200 615 "-" "curl/7.78.0" "-"
```

A tcpdump of the `eth0` interface shows the traffic as expected:

```
root@k3s-host:~# tcpdump -i eth0 -n host 68.183.33.195
12:22:30.512783 IP 138.68.140.249.38360 > 68.183.33.195.80: Flags [S], seq 2858194048, win 64860, options [mss 1410,sackOK,TS val 2541689448 ecr 0,nop,wscale 7], length 0
12:22:30.515773 IP 68.183.33.195.80 > 138.68.140.249.38360: Flags [S.], seq 3601834517, ack 2858194049, win 65160, options [mss 1460,sackOK,TS val 3758900684 ecr 2541689448,nop,wscale 7], length 0
12:22:30.515968 IP 138.68.140.249.38360 > 68.183.33.195.80: Flags [.], ack 1, win 507, options [nop,nop,TS val 2541689451 ecr 3758900684], length 0
12:22:30.516699 IP 138.68.140.249.38360 > 68.183.33.195.80: Flags [P.], seq 1:78, ack 1, win 507, options [nop,nop,TS val 2541689452 ecr 3758900684], length 77: HTTP: GET / HTTP/1.1
12:22:30.517132 IP 68.183.33.195.80 > 138.68.140.249.38360: Flags [.], ack 78, win 509, options [nop,nop,TS val 3758900687 ecr 2541689452], length 0
12:22:30.517133 IP 68.183.33.195.80 > 138.68.140.249.38360: Flags [P.], seq 1:239, ack 78, win 509, options [nop,nop,TS val 3758900687 ecr 2541689452], length 238: HTTP: HTTP/1.1 200 OK
12:22:30.517283 IP 68.183.33.195.80 > 138.68.140.249.38360: Flags [P.], seq 239:854, ack 78, win 509, options [nop,nop,TS val 3758900687 ecr 2541689452], length 615: HTTP
12:22:30.517295 IP 138.68.140.249.38360 > 68.183.33.195.80: Flags [.], ack 239, win 506, options [nop,nop,TS val 2541689453 ecr 3758900687], length 0
12:22:30.517320 IP 138.68.140.249.38360 > 68.183.33.195.80: Flags [.], ack 854, win 502, options [nop,nop,TS val 2541689453 ecr 3758900687], length 0
12:22:30.517757 IP 138.68.140.249.38360 > 68.183.33.195.80: Flags [F.], seq 78, ack 854, win 502, options [nop,nop,TS val 2541689453 ecr 3758900687], length 0
12:22:30.518139 IP 68.183.33.195.80 > 138.68.140.249.38360: Flags [F.], seq 854, ack 79, win 509, options [nop,nop,TS val 3758900688 ecr 2541689453], length 0
12:22:30.518271 IP 138.68.140.249.38360 > 68.183.33.195.80: Flags [.], ack 855, win 502, options [nop,nop,TS val 2541689454 ecr 3758900688], length 0
```

Once I add the egress NAT policy via either the floating IP or the anchor IP as described above, the connection breaks:

```
spec:
  destinationCIDRs:
  - 0.0.0.0/0
  egress:
  - podSelector:
      matchLabels:
        egressNat: "true"
  egressSourceIP: 10.16.0.9
```

in the pod with `egressNat=true`:

```
/ # curl http://68.183.33.195 --max-time 5
curl: (28) Connection timed out after 5001 milliseconds
```

A tcpdump of `eth0` on the host shows no packets were captured:

```
root@k3s-host:~# tcpdump -i eth0 -n host 68.183.33.195
tcpdump: verbose output suppressed, use -v or -vv for full protocol decode
listening on eth0, link-type EN10MB (Ethernet), capture size 262144 bytes
^C
0 packets captured
0 packets received by filter
0 packets dropped by kernel
```

The tcpdump of the container veth interface in the host namespace shows:

```
root@k3s-host:~# tcpdump -i lxcfe07c7b07b99 -n host 68.183.33.195
tcpdump: verbose output suppressed, use -v or -vv for full protocol decode
listening on lxcfe07c7b07b99, link-type EN10MB (Ethernet), capture size 262144 bytes
12:26:36.359457 IP 10.0.0.189.39792 > 68.183.33.195.80: Flags [S], seq 3591322076, win 64860, options [mss 1410,sackOK,TS val 2541935295 ecr 0,nop,wscale 7], length 0
12:26:37.359827 IP 10.0.0.189.39792 > 68.183.33.195.80: Flags [S], seq 3591322076, win 64860, options [mss 1410,sackOK,TS val 2541936295 ecr 0,nop,wscale 7], length 0
12:26:39.375808 IP 10.0.0.189.39792 > 68.183.33.195.80: Flags [S], seq 3591322076, win 64860, options [mss 1410,sackOK,TS val 2541938311 ecr 0,nop,wscale 7], length 0
```

but the trace of iptables rules via `iptables -t raw -A PREROUTING -i lxcfe07c7b07b99 -j TRACE` shows nothing, when it showed a set of valid traces without the egress NAT policy.

`cilium monitor | grep 68.183.33.195` on the relevant cilium agent instance shows:

```
-> overlay flow 0x5339fb56 , identity 22184->unknown state new ifindex cilium_vxlan orig-ip 0.0.0.0: 10.0.0.189:41786 -> 68.183.33.195:80 tcp SYN
```

`cilium bpf egress list` correctly shows the entry:

```
Source IP    Destination CIDR   Egress IP   Gateway IP
10.0.0.189   68.183.33.195/32   10.16.0.9   10.16.0.9
```

A TCP dump on the droplet running nginx also shows no packets arriving from any of the IPs associated to the other node.

The hubble UI as well shows no flows from the pod associated with the NAT and no indication of blocked or allowed requests.

This may well be a misunderstanding on my part, but to me it looks like the packets never arrive at the `eth0` interface and the lack of IP table trace messages indicated the packet is being dropped somewhere? Does anyone have any ideas of what might be going wrong or where to look to debug this further?

### Cilium Version

1.11.1 & 1.11.2

### Kernel Version

5.4.0-97-generic

### Kubernetes Version

1.21.9

### Sysdump

[cilium-sysdump-20220318-125455.zip](https://github.com/cilium/cilium/files/8304563/cilium-sysdump-20220318-125455.zip)

### Relevant log output

```shell
N/A
```

### Code of Conduct

- [X] I agree to follow this project's Code of Conduct

**Comment by borkmann** [comment]
cc @jibi

**Comment by jibi** [comment]
Hi @Champ-Goblem :wave: 
I'm not super familiar with the DigitalOcean environment so I will need some more information. First of all, the egress IP you are trying to use is `159.65.214.133`, is that correct? If yes, which interface is that IP assigned to?

**Comment by Champ-Goblem** [comment]
Hi @jibi, thanks for the reply

Yes you are correct the egressIP I planned on using was `159.65.214.133`, but from what I understand of the Digital Ocean docs this isn’t directly assigned to the eth interface of the VM. Instead an anchor IP, which in this case should be `10.16.0.9`, is assigned to the interface and then traffic leaving this interface via this IP address is 1:1 NATed against `159.65.214.133`.

**Comment by Champ-Goblem** [comment]
Ok @jibi I have managed to recreate this on Digital Ocean again.
The setup is as so:

- 1 machine running k3s with the cilium install and egress gateways enabled (I will refer to this as kubernetes)
  - this has a public IP of `178.128.162.84`
  - this machine has a DO egress IP `68.183.255.90` which is mapped to the anchor IP `10.16.0.5`
- 1 machine running bare docker (I will refer to this as server)
  - 1 instance of nginx running via `docker run -d --network=host nginx:latest`
  - the machines public IP is `178.128.162.158`

From the kubernetes machine on the basic terminal (ie not inside a pod), I can do a `curl 178.128.162.158:80` which in the nginx logs on server shows:
```
178.128.162.84 - - [29/Apr/2022:10:21:18 +0000] "GET / HTTP/1.1" 200 615 "-" "curl/7.68.0" "-"
```
as expected the traffic originates from the public IP of the kubernetes machine.

Now via the terminal again I can perform `curl --interface 10.16.0.5 178.128.162.158:80` which shows in the nginx logs:
```
68.183.255.90 - - [29/Apr/2022:10:22:59 +0000] "GET / HTTP/1.1" 200 615 "-" "curl/7.68.0" "-"
```
the source IP is now the egress IP as expected.

Without an cilium egress NAT policy set I get the same result as the first test when done inside a pod on the kubernetes node with curl:
```
178.128.162.84 - - [29/Apr/2022:10:26:19 +0000] "GET / HTTP/1.1" 200 615 "-" "curl/7.78.0" "-"
```

From the server node pinging `10.16.0.5` doesnt work:
```
From 10.16.0.6 icmp_seq=1 Destination Host Unreachable
```
but pinging `68.183.255.90` is fine:
```
64 bytes from 68.183.255.90: icmp_seq=1 ttl=62 time=1.75 ms
```

**Comment by Champ-Goblem** [comment]
@jibi any more ideas since the above?

**Comment by Champ-Goblem** [comment]
@jibi good news, cilium 1.12.0 seems to have fixed this!
Nice work
