### ISSUE TITLE
kube-proxy replacement: backend selected by multiple externalIPs / LoadBalancer VIPs problem

### ISSUE THREAD

**Issue by asm76** [cilium/cilium#11810]
## Bug report

**General Information**

- Cilium version (run `cilium version`)
```
Client: 1.7.4 c7ee6d62b 2020-05-15T16:07:35+02:00 go version go1.13.10 linux/amd64
Daemon: 1.7.4 c7ee6d62b 2020-05-15T16:07:35+02:00 go version go1.13.10 linux/amd64
```
- Kernel version (run `uname -a`)
```
Linux api1 5.4.0-31-generic #35-Ubuntu SMP Thu May 7 20:20:34 UTC 2020 x86_64 x86_64 x86_64 GNU/Linux
```
- Orchestration system version in use (e.g. `kubectl version`, Mesos, ...)
```
Client Version: version.Info{Major:"1", Minor:"18", GitVersion:"v1.18.3", GitCommit:"2e7996e3e2712684bc73f0dec0200d64eec7fe40", GitTreeState:"clean", BuildDate:"2020-05-20T12:52:00Z", GoVersion:"go1.13.9", Compiler:"gc", Platform:"linux/amd64"}
Server Version: version.Info{Major:"1", Minor:"18", GitVersion:"v1.18.3", GitCommit:"2e7996e3e2712684bc73f0dec0200d64eec7fe40", GitTreeState:"clean", BuildDate:"2020-05-20T12:43:34Z", GoVersion:"go1.13.9", Compiler:"gc", Platform:"linux/amd64"}
```
- Link to relevant artifacts (policies, deployments scripts, ...)
```
helm template cilium cilium/cilium --namespace kube-system  --set global.k8sServiceHost=10.2.5.130 --set global.k8sServicePort=6443 --set global.kubeProxyReplacement=strict --set global.tunnel=disabled --set global.autoDirectNodeRoutes=true --set global.nodePort.mode=dsr > cilium.yaml
kubectl apply -f cilium.yaml
```
- Upload a system dump (run `curl -sLO
https://github.com/cilium/cilium-sysdump/releases/latest/download/cilium-sysdump.zip &&
python cilium-sysdump.zip` and then attach the generated zip file)

**How to reproduce the issue**

1. 3 node k8s cluster:
```
NAME   STATUS   ROLES    AGE   VERSION   INTERNAL-IP   EXTERNAL-IP   OS-IMAGE           KERNEL-VERSION     CONTAINER-RUNTIME
api1   Ready    master   49m   v1.18.3   10.2.5.130    <none>        Ubuntu 20.04 LTS   5.4.0-31-generic   docker://19.3.8
api2   Ready    <none>   48m   v1.18.3   10.2.5.131    <none>        Ubuntu 20.04 LTS   5.4.0-31-generic   docker://19.3.8
api3   Ready    <none>   48m   v1.18.3   10.2.5.132    <none>        Ubuntu 20.04 LTS   5.4.0-31-generic   docker://19.3.8
```

2. Add IP address 10.2.5.140/32 to the node api2, and 10.2.5.141/32 to api3.
3. Publish service with 2 externalIPs:
```
kubectl create deployment nginx --image nginx
kubectl expose deployment nginx --port=80 --target-port=80 --type=NodePort
```
Then `kubectl edit svc nginx` and add this section to service spec
```
externalIPs:
- 10.2.5.140
- 10.2.5.141
```
4. From the client VM test the service:
```
ab -c 10 -n 10000 10.2.5.141/
ab -c 10 -n 10000 10.2.5.140/
```
In my case 10.2.5.141 is working as expected (with strange delays, but tolerable),  but 10.2.5.140 doesn't.
```
ab -c 10 -n 10000 10.2.5.140/
This is ApacheBench, Version 2.3 <$Revision: 1807734 $>
Copyright 1996 Adam Twiss, Zeus Technology Ltd, http://www.zeustech.net/
Licensed to The Apache Software Foundation, http://www.apache.org/

Benchmarking 10.2.5.140 (be patient)
apr_pollset_poll: The timeout specified has expired (70007)
```
In tcpdump output I see
```
08:56:35.441515 IP 10.2.5.68.54088 > 10.2.5.140.80: Flags [S], seq 4187745149, win 64240, options [mss 1460,sackOK,TS val 2815165716
ecr 0,nop,wscale 7], length 0
08:56:35.441747 IP 10.2.5.68.54090 > 10.2.5.140.80: Flags [S], seq 3356518998, win 64240, options [mss 1460,sackOK,TS val 2815165717
ecr 0,nop,wscale 7], length 0
08:56:35.441876 IP 10.2.5.68.54092 > 10.2.5.140.80: Flags [S], seq 1265403744, win 64240, options [mss 1460,sackOK,TS val 2815165717
ecr 0,nop,wscale 7], length 0
08:56:35.441957 IP 10.2.5.141.80 > 10.2.5.68.54088: Flags [S.], seq 2030348502, ack 4187745150, win 65160, options [mss 1460,sackOK,T
S val 1975248262 ecr 2815165716,nop,wscale 7], length 0
08:56:35.441968 IP 10.2.5.68.54088 > 10.2.5.141.80: Flags [R], seq 4187745150, win 0, length 0                                       
08:56:35.441976 IP 10.2.5.141.80 > 10.2.5.68.54090: Flags [S.], seq 2394654131, ack 3356518999, win 65160, options [mss 1460,sackOK,T
S val 1975248262 ecr 2815165717,nop,wscale 7], length 0                                                                             
08:56:35.441978 IP 10.2.5.68.54090 > 10.2.5.141.80: Flags [R], seq 3356518999, win 0, length 0
08:56:35.442030 IP 10.2.5.141.80 > 10.2.5.68.54092: Flags [S.], seq 1011437172, ack 1265403745, win 65160, options [mss 1460,sackOK,T
S val 1975248262 ecr 2815165717,nop,wscale 7], length 0
08:56:35.442036 IP 10.2.5.68.54092 > 10.2.5.141.80: Flags [R], seq 1265403745, win 0, length 0                                      
08:56:35.442208 IP 10.2.5.68.54094 > 10.2.5.140.80: Flags [S], seq 3949975832, win 64240, options [mss 1460,sackOK,TS val 2815165717
ecr 0,nop,wscale 7], length 0                                                                                                       
08:56:35.442303 IP 10.2.5.68.54096 > 10.2.5.140.80: Flags [S], seq 3746109519, win 64240, options [mss 1460,sackOK,TS val 2815165717
ecr 0,nop,wscale 7], length 0                                                                                                       
08:56:35.442398 IP 10.2.5.68.54098 > 10.2.5.140.80: Flags [S], seq 901884488, win 64240, options [mss 1460,sackOK,TS val 2815165717 e
cr 0,nop,wscale 7], length 0                                                                                                        
08:56:35.442434 IP 10.2.5.141.80 > 10.2.5.68.54094: Flags [S.], seq 2702955072, ack 3949975833, win 65160, options [mss 1460,sackOK,T
S val 1975248262 ecr 2815165717,nop,wscale 7], length 0                                                                             
08:56:35.442440 IP 10.2.5.68.54094 > 10.2.5.141.80: Flags [R], seq 3949975833, win 0, length 0
08:56:35.442447 IP 10.2.5.141.80 > 10.2.5.68.54096: Flags [S.], seq 3086612402, ack 3746109520, win 65160, options [mss 1460,sackOK,T
S val 1975248262 ecr 2815165717,nop,wscale 7], length 0
08:56:35.442449 IP 10.2.5.68.54096 > 10.2.5.141.80: Flags [R], seq 3746109520, win 0, length 0                                      
08:56:35.442475 IP 10.2.5.141.80 > 10.2.5.68.54098: Flags [S.], seq 2698710660, ack 901884489, win 65160, options [mss 1460,sackOK,TS
 val 1975248262 ecr 2815165717,nop,wscale 7], length 0                                                                               
08:56:35.442478 IP 10.2.5.68.54098 > 10.2.5.141.80: Flags [R], seq 901884489, win 0, length 0
08:56:35.442630 IP 10.2.5.68.54100 > 10.2.5.140.80: Flags [S], seq 2038584870, win 64240, options [mss 1460,sackOK,TS val 2815165718
ecr 0,nop,wscale 7], length 0                                                                                                        
08:56:35.442717 IP 10.2.5.141.80 > 10.2.5.68.54100: Flags [S.], seq 2617589878, ack 2038584871, win 65160, options [mss 1460,sackOK,T
S val 1975248262 ecr 2815165718,nop,wscale 7], length 0                                       
08:56:35.442725 IP 10.2.5.68.54100 > 10.2.5.141.80: Flags [R], seq 2038584871, win 0, length 0
```

**Comment by brb** [comment]
@asm76 Can you upload the sysdump?

**Comment by asm76** [comment]
@brb, sure, sorry I forgot.
[cilium-sysdump-20200602-100721.zip](https://github.com/cilium/cilium/files/4716395/cilium-sysdump-20200602-100721.zip)

**Comment by aanm** [comment]
@asm76 can you also paste `kubectl get endpointslice --all-namespaces -o yaml`?

**Comment by asm76** [comment]
@aanm
```
apiVersion: v1
items:
- addressType: IPv4
  apiVersion: discovery.k8s.io/v1beta1
  endpoints:
  - addresses:
    - 10.2.5.130
    conditions:
      ready: true
  kind: EndpointSlice
  metadata:
    creationTimestamp: "2020-06-02T07:49:17Z"
    generation: 1
    labels:
      kubernetes.io/service-name: kubernetes
    managedFields:
    - apiVersion: discovery.k8s.io/v1beta1
      fieldsType: FieldsV1
      fieldsV1:
        f:addressType: {}
        f:endpoints: {}
        f:metadata:
          f:labels:
            .: {}
            f:kubernetes.io/service-name: {}
        f:ports: {}
      manager: kube-apiserver
      operation: Update
      time: "2020-06-02T07:49:17Z"
    name: kubernetes
    namespace: default
    resourceVersion: "157"
    selfLink: /apis/discovery.k8s.io/v1beta1/namespaces/default/endpointslices/kubernetes
    uid: bdfcd27f-6140-45cd-be86-81b4cef5073b
  ports:
  - name: https
    port: 6443
    protocol: TCP
- addressType: IPv4
  apiVersion: discovery.k8s.io/v1beta1
  endpoints:
  - addresses:
    - 10.217.2.111
    conditions:
      ready: true
    targetRef:
      kind: Pod
      name: nginx-f89759699-6dhgn
      namespace: default
      resourceVersion: "207503"
      uid: b330a457-763e-4ed1-9a87-4a3d0c994f6b
    topology:
      kubernetes.io/hostname: api3
  kind: EndpointSlice
  metadata:
    annotations:
      endpoints.kubernetes.io/last-change-trigger-time: "2020-06-08T07:15:37Z"
    creationTimestamp: "2020-06-02T07:54:50Z"
    generateName: nginx-
    generation: 8
    labels:
      endpointslice.kubernetes.io/managed-by: endpointslice-controller.k8s.io
      kubernetes.io/service-name: nginx
    managedFields:
    - apiVersion: discovery.k8s.io/v1beta1
      fieldsType: FieldsV1
      fieldsV1:
        f:addressType: {}
        f:endpoints: {}
        f:metadata:
          f:annotations:
            .: {}
            f:endpoints.kubernetes.io/last-change-trigger-time: {}
          f:generateName: {}
          f:labels:
            .: {}
            f:endpointslice.kubernetes.io/managed-by: {}
            f:kubernetes.io/service-name: {}
          f:ownerReferences:
            .: {}
            k:{"uid":"35e86a7c-ec06-4f09-8aa6-a6123ab56f8b"}:
              .: {}
              f:apiVersion: {}
              f:blockOwnerDeletion: {}
              f:controller: {}
              f:kind: {}
              f:name: {}
              f:uid: {}
        f:ports: {}
      manager: kube-controller-manager
      operation: Update
      time: "2020-06-08T07:15:37Z"
    name: nginx-8z77f
    namespace: default
    ownerReferences:
    - apiVersion: v1
      blockOwnerDeletion: true
      controller: true
      kind: Service
      name: nginx
      uid: 35e86a7c-ec06-4f09-8aa6-a6123ab56f8b
    resourceVersion: "207506"
    selfLink: /apis/discovery.k8s.io/v1beta1/namespaces/default/endpointslices/nginx-8z77f
    uid: a6feb29c-210d-4da2-aed2-90cb4d6a8740
  ports:
  - name: ""
    port: 80
    protocol: TCP
- addressType: IPv4
  apiVersion: discovery.k8s.io/v1beta1
  endpoints:
  - addresses:
    - 10.217.0.246
    conditions:
      ready: false
    targetRef:
      kind: Pod
      name: coredns-66bff467f8-74wkm
      namespace: kube-system
      resourceVersion: "207104"
      uid: fb320d39-1bae-4e06-b708-82cf854d4ae9
    topology:
      kubernetes.io/hostname: api1
  - addresses:
    - 10.217.0.80
    conditions:
      ready: true
    targetRef:
      kind: Pod
      name: coredns-66bff467f8-j7pjh
      namespace: kube-system
      resourceVersion: "207276"
      uid: c8ebd872-3554-4a5d-adc0-61a8840c47a0
    topology:
      kubernetes.io/hostname: api1
  kind: EndpointSlice
  metadata:
    annotations:
      endpoints.kubernetes.io/last-change-trigger-time: "2020-06-08T07:33:19Z"
    creationTimestamp: "2020-06-02T07:49:35Z"
    generateName: kube-dns-
    generation: 9
    labels:
      endpointslice.kubernetes.io/managed-by: endpointslice-controller.k8s.io
      kubernetes.io/service-name: kube-dns
    managedFields:
    - apiVersion: discovery.k8s.io/v1beta1
      fieldsType: FieldsV1
      fieldsV1:
        f:addressType: {}
        f:endpoints: {}
        f:metadata:
          f:annotations:
            .: {}
            f:endpoints.kubernetes.io/last-change-trigger-time: {}
          f:generateName: {}
          f:labels:
            .: {}
            f:endpointslice.kubernetes.io/managed-by: {}
            f:kubernetes.io/service-name: {}
          f:ownerReferences:
            .: {}
            k:{"uid":"dff0bbcd-b5b9-4a26-ae4a-ae221ccb813f"}:
              .: {}
              f:apiVersion: {}
              f:blockOwnerDeletion: {}
              f:controller: {}
              f:kind: {}
              f:name: {}
              f:uid: {}
        f:ports: {}
      manager: kube-controller-manager
      operation: Update
      time: "2020-06-08T07:14:20Z"
    name: kube-dns-gkvw7
    namespace: kube-system
    ownerReferences:
    - apiVersion: v1
      blockOwnerDeletion: true
      controller: true
      kind: Service
      name: kube-dns
      uid: dff0bbcd-b5b9-4a26-ae4a-ae221ccb813f
    resourceVersion: "207277"
    selfLink: /apis/discovery.k8s.io/v1beta1/namespaces/kube-system/endpointslices/kube-dns-gkvw7
    uid: e085996c-7c78-4bf4-8581-15e23dc06bc7
  ports:
  - name: dns-tcp
    port: 53
    protocol: TCP
  - name: metrics
    port: 9153
    protocol: TCP
  - name: dns
    port: 53
    protocol: UDP
kind: List
metadata:
  resourceVersion: ""
  selfLink: ""
```

**Comment by aanm** [comment]
@asm76 thank you. Can you replicate the issue when running with `enable-k8s-endpoint-slice: false` in Cilium's config map?

**Comment by aanm** [comment]
@asm76 you can change that setting in the configmap but you need to restart all cilium pods `kubectl delete pod -n kube-system -l k8s-app=cilium`

**Comment by asm76** [comment]
@aanm Yes, the same behavior
```
ubuntu@api1:~$ kubectl -n kube-system get cm cilium-config -o yaml| grep slice
  enable-k8s-endpoint-slice: "false"
        f:enable-k8s-endpoint-slice: {}
ubuntu@api1:~$ kubectl -n kube-system get pods -l k8s-app=cilium
NAME           READY   STATUS    RESTARTS   AGE
cilium-998lg   1/1     Running   0          2m36s
cilium-bhfpd   1/1     Running   0          2m36s
cilium-kt8pc   1/1     Running   0          2m25s
```

**Comment by brb** [comment]
From the tcpdump looks like a stale CT issue (TCP SYN ACK has the wrong src IP addr):
```
08:56:35.441515 IP 10.2.5.68.54088 > 10.2.5.140.80: Flags [S], seq 4187745149, win 64240, options [mss 1460,sackOK,TS val 2815165716
ecr 0,nop,wscale 7], length 0
08:56:35.441957 IP 10.2.5.141.80 > 10.2.5.68.54088: Flags [S.], seq 2030348502, ack 4187745150, win 65160, options [mss 1460,sackOK,T
S val 1975248262 ecr 2815165716,nop,wscale 7], length 0
08:56:35.441968 IP 10.2.5.68.54088 > 10.2.5.141.80: Flags [R], seq 4187745150, win 0, length 0
```

**Comment by borkmann** [comment]
Hello @asm76 getting back on this issue, I think it might be related to #10897 given in the sysdump it says that you're using DSR. Do you have a chance to check whether the issue reproduces with Cilium 1.8.1 and using SNAT for the NodePort mode?

**Comment by asm76** [comment]
Hello @borkmann. I installed cilium 1.8.1 using the following commands:

```
helm template cilium cilium/cilium --version 1.8.1 \
  --namespace kube-system  \
  --set config.ipam=kubernetes \
  --set global.k8sServiceHost=10.2.5.130 \
  --set global.k8sServicePort=6443 \
  --set global.kubeProxyReplacement=strict > cilium.1.8.1.yaml

kubectl apply -f cilium.1.8.1.yaml
```
and the issue is not reproducible.

**Comment by borkmann** [comment]
> Hello @borkmann. I installed cilium 1.8.1 using the following commands:
> 
> ```
> helm template cilium cilium/cilium --version 1.8.1 \
>   --namespace kube-system  \
>   --set config.ipam=kubernetes \
>   --set global.k8sServiceHost=10.2.5.130 \
>   --set global.k8sServicePort=6443 \
>   --set global.kubeProxyReplacement=strict > cilium.1.8.1.yaml
> 
> kubectl apply -f cilium.1.8.1.yaml
> ```
> 
> and the issue is not reproducible.

Great, thanks for confirming, and to make sure, if you are using 1.8.1 with `--set global.nodePort.mode=dsr` in the helm, I presume the issue re-appears, is that correct? If so it's very likely we're hitting #10897.

**Comment by asm76** [comment]
@borkmann yes, i also checked the DSR mode - issue is still here.

**Comment by errordeveloper** [comment]
@borkmann should this be closed in favour of #10897, or that still needs re-confirming?

**Comment by karthikt-yahoo** [comment]
We are facing the same issue. Our setup has a service with 2 ExternalIP mapped to same backend and when client reuses the source port to access the same backend via two VIPs, second request gets timedout because the response is still from vip 1 for the request made to vip 2. 

e.g. let says we vip two vips(two ExternalIPs service mapped to same backend).
Vip1: 1.1.1.1
Vip2: 2.2.2.2
Backend: 3.3.3.3
Client: 4.4.4.4

First Request sent to vip 1 works fine. 
4.4.4.4:27182 —> 1.1.1.1:80 —> 3.3.3.3:80

Second Request sent to vip2 with same client ip and source port has issue, because response for the request is sent with source ip as vip 1 ip and hence the client Reset and initiate the new SYN and goes in the same flow until it timeout. 
4.4.4.4:27182 —> 2.2.2.2:80 —> 3.3.3.3:80

**Comment by sureshvis** [comment]
Will also recommend documenting this "gap" oon cilium documents. This is pretty common use case where we have many external IP pointing to same backend

**Comment by brb** [comment]
As suggested, the issue was documented in #42632. No plans to fix it. Let's close it.
