### ISSUE TITLE
Nodeport service traffic  shows 00:00:00:00:00:00 MAC in tunnel mode egress inner packet

### ISSUE THREAD

**Issue by vincentmli** [cilium/cilium#18526]
after  enabling node-port in Cilium and  deploying node port service,  then access the node port service from external client, when the backend pod is on remote node, the egress  inner packet in tunnel traffic always has `00:00:00:00:00:00` src/dst MAC, for example tcpdump on `cilium_vxlan` interface:

```
[root@cilium-dev home]# tcpdump -nn -e -i cilium_vxlan not port 6443
dropped privs to tcpdump
tcpdump: verbose output suppressed, use -v or -vv for full protocol decode
listening on cilium_vxlan, link-type EN10MB (Ethernet), capture size 262144 bytes

13:25:50.746130 00:00:00:00:00:00 > 00:00:00:00:00:00, ethertype IPv4 (0x0800), length 74: 10.0.0.228.64395 > 10.0.1.126.80: Flags [S], seq 843006034, win 29200, options [mss 1460,sackOK,TS val 1852843144 ecr 0,nop,wscale 7], length 0
13:25:50.746921 12:e6:5a:bc:9e:6c > aa:f1:c5:11:70:e9, ethertype IPv4 (0x0800), length 74: 10.0.1.126.80 > 10.0.0.228.64395: Flags [S.], seq 1295800253, ack 843006035, win 64308, options [mss 1410,sackOK,TS val 3496821727 ecr 1852843144,nop,wscale 7], length 0
13:25:50.748206 00:00:00:00:00:00 > 00:00:00:00:00:00, ethertype IPv4 (0x0800), length 66: 10.0.0.228.64395 > 10.0.1.126.80: Flags [.], ack 1, win 229, options [nop,nop,TS val 1852843149 ecr 3496821727], length 0

```

https://github.com/cilium/cilium/blob/master/bpf/lib/nodeport.h#L1584-L1589 when `fib_params.dmac/smac` is not set, is   dmac/smac set to `00:00:00:00:00:00`  by default? 

then there are https://github.com/cilium/cilium/blob/master/bpf/lib/nodeport.h#L1620-L1627, to `eth_store_daddr/eth_store_saddr`, which i assume is to store the `00:00:00:00:00:00` in the `dmac/smac` since under tunnel mode, it does not require fib lookup. I commented out the `eth_store_daddr/eth_store_saddr` and test shows `dmac/smac` still set to `00:00:00:00:00:00`, are `eth_store_daddr/eth_store_saddr` redundant here? if not redundant, any potential issue without `eth_store_daddr/eth_store_saddr`?

**Comment by borkmann** [comment]
In general, the 00:00:00:00:00:00 mac is expected to save the fib lookup given it's not needed to populate these in our case. On the top of my head, not quite sure whether `eth_store_daddr`/`eth_store_saddr` would be redundant, I would think not given vxlan/geneve might only prepend the outer headers. Did you run Cilium with a noarp device?

**Comment by vincentmli** [comment]
it is just observation from someone asked in Slack and I am curious, I don't think the  00:00:00:00:00:00 would cause functionality issue from what I understand,  I don't run  arp or noarp device, not sure what noarp device does in this case :-).

**Comment by vincentmli** [comment]
now I understand that `eth_store_daddr`/`eth_store_saddr` happens after `__encap_with_nodeid`, so they are for outer headers, make sense, not redundant, sorry for the noise.
