### ISSUE TITLE
Cilium Egress Gateway SNAT Cluster Internal Traffic

### ISSUE THREAD

**Issue by Champ-Goblem** [cilium/cilium#23240]
### Is there an existing issue for this?

- [X] I have searched the existing issues

### What happened?

We recently tried out cilium 1.12.2 in order to use static egress IPs with some of our workloads on GKE. When testing it out we had issues where all cluster internal traffic was also being SNATed against the designated node rather than being routed internally in the cluster, something that the docs says should happen, even with the destination CIDR `0.0.0.0/0`. It seems to be that the traffic to services are affected whereas pod IP to pod IP is working as expected.

This can be demonstrated with the following egress policy:

```bash
apiVersion: cilium.io/v2
kind: CiliumEgressGatewayPolicy
metadata:
  name: egress-sample
spec:
  selectors:
  - podSelector:
      matchLabels:
        app: netutils
  destinationCIDRs:
  - 0.0.0.0/0
  egressGateway:
    nodeSelector:
      matchLabels:
        "cni.com/egress-gateway": "true"
    egressIP: x.x.x.x
```

Without this policy applied we see that internal networking to an nginx application in the same namespace works as expected, this includes curls to the service name, DNS lookups and curls to the service IP:

```bash
/ # curl nginx
<!DOCTYPE html>
<html>
<head>
<title>Welcome to nginx!</title>
<style>
html { color-scheme: light dark; }
body { width: 35em; margin: 0 auto;
font-family: Tahoma, Verdana, Arial, sans-serif; }
</style>
</head>
<body>
<h1>Welcome to nginx!</h1>
<p>If you see this page, the nginx web server is successfully installed and
working. Further configuration is required.</p>

<p>For online documentation and support please refer to
<a href="http://nginx.org/">nginx.org</a>.<br/>
Commercial support is available at
<a href="http://nginx.com/">nginx.com</a>.</p>

<p><em>Thank you for using nginx.</em></p>
</body>
</html>
/ # nslookup nginx
Server:		10.0.32.10
Address:	10.0.32.10#53

Name:	nginx.ns-m87vyhm5msvw.svc.cluster.local
Address: 10.0.46.90

/ # curl 10.0.46.90
<!DOCTYPE html>
<html>
<head>
<title>Welcome to nginx!</title>
<style>
html { color-scheme: light dark; }
body { width: 35em; margin: 0 auto;
font-family: Tahoma, Verdana, Arial, sans-serif; }
</style>
</head>
<body>
<h1>Welcome to nginx!</h1>
<p>If you see this page, the nginx web server is successfully installed and
working. Further configuration is required.</p>

<p>For online documentation and support please refer to
<a href="http://nginx.org/">nginx.org</a>.<br/>
Commercial support is available at
<a href="http://nginx.com/">nginx.com</a>.</p>

<p><em>Thank you for using nginx.</em></p>
</body>
</html>
```

vs when the policy is applied:

```bash
/ # curl nginx --max-time 1
curl: (28) Resolving timed out after 1000 milliseconds
/ # nslookup nginx
;; connection timed out; no servers could be reached

/ # curl 10.0.46.90 --max-time 1
curl: (28) Connection timed out after 1001 milliseconds
```

Trying the curl again with the pod IP and with the policy applied works as expected:

```bash
/ # curl 10.4.28.201
<!DOCTYPE html>
<html>
<head>
<title>Welcome to nginx!</title>
<style>
html { color-scheme: light dark; }
body { width: 35em; margin: 0 auto;
font-family: Tahoma, Verdana, Arial, sans-serif; }
</style>
</head>
<body>
<h1>Welcome to nginx!</h1>
<p>If you see this page, the nginx web server is successfully installed and
working. Further configuration is required.</p>

<p>For online documentation and support please refer to
<a href="http://nginx.org/">nginx.org</a>.<br/>
Commercial support is available at
<a href="http://nginx.com/">nginx.com</a>.</p>

<p><em>Thank you for using nginx.</em></p>
</body>
</html>
```

This seems similar to an issue that was raised a while ago #16147 but this fix should be in a release well before 1.12.

Here are the configmap values for cilium:

```bash
agent-not-ready-taint-key: node.cilium.io/agent-not-ready
  arping-refresh-period: 30s
  auto-direct-node-routes: "false"
  bpf-lb-external-clusterip: "false"
  bpf-lb-map-max: "65536"
  bpf-lb-sock: "false"
  bpf-map-dynamic-size-ratio: "0.0025"
  bpf-policy-map-max: "16384"
  bpf-root: /sys/fs/bpf
  cgroup-root: /run/cilium/cgroupv2
  cilium-endpoint-gc-interval: 5m0s
  cluster-id: "0"
  cluster-name: default
  custom-cni-conf: "false"
  debug: "false"
  disable-cnp-status-updates: "true"
  disable-endpoint-crd: "false"
  enable-auto-protect-node-port-range: "true"
  enable-bgp-control-plane: "false"
  enable-bpf-clock-probe: "true"
  enable-bpf-masquerade: "true"
  enable-endpoint-health-checking: "true"
  enable-endpoint-routes: "true"
  enable-health-check-nodeport: "true"
  enable-health-checking: "true"
  enable-hubble: "true"
  enable-ipv4: "true"
  enable-ipv4-egress-gateway: "true"
  enable-ipv4-masquerade: "true"
  enable-ipv6: "false"
  enable-ipv6-masquerade: "true"
  enable-k8s-terminating-endpoint: "true"
  enable-l2-neigh-discovery: "true"
  enable-l7-proxy: "false"
  enable-local-node-route: "false"
  enable-local-redirect-policy: "false"
  enable-policy: default
  enable-remote-node-identity: "true"
  enable-svc-source-range-check: "true"
  enable-vtep: "false"
  enable-well-known-identities: "false"
  enable-xt-socket-fallback: "true"
  hubble-disable-tls: "false"
  hubble-listen-address: :4244
  hubble-socket-path: /var/run/cilium/hubble.sock
  hubble-tls-cert-file: /var/lib/cilium/tls/hubble/server.crt
  hubble-tls-client-ca-files: /var/lib/cilium/tls/hubble/client-ca.crt
  hubble-tls-key-file: /var/lib/cilium/tls/hubble/server.key
  identity-allocation-mode: crd
  install-iptables-rules: "true"
  install-no-conntrack-iptables-rules: "false"
  ipam: kubernetes
  ipv4-native-routing-cidr: 10.4.0.0/14
  kube-proxy-replacement: strict
  kube-proxy-replacement-healthz-bind-address: ""
  monitor-aggregation: medium
  monitor-aggregation-flags: all
  monitor-aggregation-interval: 5s
  node-port-bind-protection: "true"
  nodes-gc-interval: 5m0s
  operator-api-serve-addr: 127.0.0.1:9234
  preallocate-bpf-maps: "false"
  procfs: /host/proc
  remove-cilium-node-taints: "true"
  set-cilium-is-up-condition: "true"
  sidecar-istio-proxy-image: cilium/istio_proxy
  synchronize-k8s-nodes: "true"
  tofqdns-dns-reject-response-code: refused
  tofqdns-enable-dns-compression: "true"
  tofqdns-endpoint-max-ip-per-hostname: "50"
  tofqdns-idle-connection-grace-period: 0s
  tofqdns-max-deferred-connection-deletes: "10000"
  tofqdns-min-ttl: "3600"
  tofqdns-proxy-response-max-delay: 100ms
  tunnel: disabled
  unmanaged-pod-watcher-interval: "15"
  vtep-cidr: ""
  vtep-endpoint: ""
  vtep-mac: ""
  vtep-mask: ""
```

### Cilium Version

cilium 1.12.2

### Kernel Version

5.15.54

### Kubernetes Version

v1.24.5-gke.600

### Code of Conduct

- [X] I agree to follow this project's Code of Conduct

**Comment by borkmann** [comment]
Cc @jibi

**Comment by jibi** [comment]
@Champ-Goblem could you share the full nginx service manifest please?

**Comment by Champ-Goblem** [comment]
Hi @jibi 
I have looked at this a bit more and it seems to be Kata Containers is the key to the failures. 

When I run the container in runC on GKE the connections to services all work as expected.
Whereas when I run the same workload in Kata with Cloud-Hypervisor suddenly connections to services are broken.

Below is the nginx spec with the `kata-clh` runtime class set.
```
apiVersion: v1
kind: Service
metadata:
  name: nginx-test
spec:
  type: ClusterIP
  selector:
    app: nginx-test
  ports:
  - protocol: TCP
    port: 80
    name: http
    targetPort: 80
---
apiVersion: apps/v1
kind: Deployment
metadata:
  name: nginx-test
spec:
  replicas: 1
  selector:
    matchLabels:
      app: nginx-test
  template:
    metadata:
      labels:
        app: nginx-test
    spec:
      runtimeClassName: kata-clh
      containers:
      - image: nginx:latest
        name: nginx
        ports:
        - containerPort: 80
          name: http
```

The main difference in the networking here is that the host VETH pair is redirected to a TAP interface which is paired to the running VM. More details can be found here (https://github.com/kata-containers/kata-containers/blob/main/docs/design/architecture/networking.md)

Here are two tcpdumps from a network debugging pod when targeted by the egress policy both with and without kata, running `nslookup nginx-test` in the same namespace. Both tcpdumps are taken on the host side of the VETH pair on the node.
Without Kata where the DNS resolves correctly:
```
# tcpdump -i lxc3ded1ddf3d05 -nn
dropped privs to tcpdump
tcpdump: verbose output suppressed, use -v or -vv for full protocol decode
listening on lxc3ded1ddf3d05, link-type EN10MB (Ethernet), capture size 262144 bytes
10:29:10.712577 IP 10.48.5.212.58049 > 10.48.15.96.53: 61569+ A? nginx-test.ns-cameron-egress-ip.svc.cluster.local. (67)
10:29:10.713703 IP 10.48.15.96.53 > 10.48.5.212.58049: 61569*- 1/0/0 A 10.115.14.3 (132)
10:29:10.714437 IP 10.48.5.212.49941 > 10.48.7.180.53: 2270+ AAAA? nginx-test.ns-cameron-egress-ip.svc.cluster.local. (67)
10:29:10.715209 IP 10.48.7.180.53 > 10.48.5.212.49941: 2270*- 0/1/0 (160)
```

With Kata where the DNS does not resolve and connections never reach coredns:
```
# tcpdump -i lxcec34279d1e1d -nn
dropped privs to tcpdump
tcpdump: verbose output suppressed, use -v or -vv for full protocol decode
listening on lxcec34279d1e1d, link-type EN10MB (Ethernet), capture size 262144 bytes
10:30:54.252205 IP 10.48.5.198.43320 > 10.115.0.10.53: 55179+ A? nginx-test.ns-cameron-egress-ip.svc.cluster.local. (67)
10:30:59.256758 IP 10.48.5.198.43320 > 10.115.0.10.53: 55179+ A? nginx-test.ns-cameron-egress-ip.svc.cluster.local. (67)
10:31:04.261066 IP 10.48.5.198.43320 > 10.115.0.10.53: 55179+ A? nginx-test.ns-cameron-egress-ip.svc.cluster.local. (67)
```

Interestingly the packets coming from the Kata based pod have the destination address `10.115.0.10` which corresponds to the clusterIP of the kube-dns service. The pod without Kata has a destination addresses of both the coredns pods (`10.48.15.96` & `10.48.7.180`).

I would like to mention that we have a workaround for now which is to generate a list of destinationCIDRs that exclude the service IP range and also any loadbalancer external IPs we have on the cluster. 

We found that excluding just the service IP range was not enough when a pod on the same cluster tried to talk to an external endpoint via a loadbalancer on the same cluster. It seems that return traffic does not get routed correctly due to the outgoing traffic being redirected to the egress node. This traffic is then DNATed by kube-proxy iptable rules to the loadbalancer's cluster IP, this then bypasses the SNAT on the egress node as its destination is now excluded from SNAT due to the new rules ignoring the cluster IP range on egress gateway policy.

**Comment by lukasmrtvy** [comment]
Have the same problem on AWS with EKS 1.26, Kata (upstream)  and Cilium 1.13.3

**Comment by Champ-Goblem** [comment]
Hi, @jibi @borkmann we are seeing the above issue with the cluster IP vs. pod IP issue with respect to Kata causing connectivity issues now on cilium 1.14+.
Previous to this on 1.13 and reverting the version back connections are working fine. However, we need to upgrade to cilium 1.14 ASAP so that we can get the improvements for cilium egress gateways.

**Comment by Champ-Goblem** [comment]
Further debugging has pinpointed the issue to enabling `strict` kube proxy replacement. 

When switching between strict and off after restarting the cilium pods each time would cause the issue to work and to break again. This was a default install of cilium with the cilium CLI on GKE, we then set:
```
kube-proxy-replacement: strict
enable-bpf-masquerade: "true"
```
which caused Kata-based pod network connections to break.

**Comment by Champ-Goblem** [comment]
We have managed to solve this issue by restricting socketLB to the host namespace only, via the flag `bpf-lb-sock-hostns-only` as indicated in this issue comment https://github.com/cilium/cilium/issues/15437#issuecomment-1027195041

Networking was restored in the cluster running cilium 1.14, and there is no longer a need to exclude service IP ranges from the egress gateway, as suggested for a temporary fix in a previous comment.

However, the docs on Kata and Cilium still suggest that it's not possible to use kube proxy replacement with Kata https://docs.cilium.io/en/stable/network/kubernetes/kata/#kata

**Comment by julianwiedmann** [comment]
Is this still an issue, and would anyone be willing to test some bleeding 1.16-based changes? I think with https://github.com/cilium/cilium/pull/32828 in place, we might be able to make this work now.
