### ISSUE TITLE
[cilium-agent] --exclude-local-address is not working

### ISSUE THREAD

**Issue by kevin-leong** [cilium/cilium#20000]
### Is there an existing issue for this?

- [X] I have searched the existing issues

### What happened?

I am using kube-vip for a VIP for the Kubernetes control plane on my cluster.

cilium-agent is picking up this VIP as a "Local IPv4 addresses" on the node that has the VIP active, and sending out packets for the pod using this VIP as the source address.  This is breaking the network for the pod.

I tried to use "--exclude-local-address" for the VIP, but it is not taking affect.

I need to be able to exclude this VIP from cilium-agent so that it uses the right IP address, or is there another method to achieve this besides trying to use "--exclude-local-address"?

### Cilium Version

root@kube2 # cilium version | grep -i running
cilium image (running): v1.11.5

### Kernel Version

root@kube2 # uname -a
Linux kube2.XXX.XXX.XXX 5.15.0-1008-raspi #8-Ubuntu SMP PREEMPT Thu May 19 11:58:51 UTC 2022 aarch64 aarch64 aarch64 GNU/Linux

### Kubernetes Version

root@kube2 # kubectl get nodes | grep kube2
kube2.XXX.XXX.XXX   Ready    control-plane,etcd,master   2d9h   v1.23.6+k3s1

### Relevant log output

```shell
root@kube2 # kubectl edit daemonset cilium -n kube-system 
.........
      containers:                                        
      - args:                                            
        - --config-dir=/tmp/cilium/config-map            
        - --exclude-local-address=10.0.30.10/32		<----- I am trying to exclude the VIP interface IP address (created by kube-vip)
        command:                                         
        - cilium-agent                                   
        env:                                             
        - name: K8S_NODE_NAME                            
          valueFrom:                                     
            fieldRef:                                    
              apiVersion: v1                             
              fieldPath: spec.nodeName                   
        - name: CILIUM_K8S_NAMESPACE                     
          valueFrom:                                     
            fieldRef:                                    
              apiVersion: v1                             
              fieldPath: metadata.namespace              
        - name: CILIUM_CLUSTERMESH_CONFIG                
          value: /var/lib/cilium/clustermesh/            
        - name: CILIUM_CNI_CHAINING_MODE                 
          valueFrom:                                     
            configMapKeyRef:                             
              key: cni-chaining-mode                     
              name: cilium-config                        
              optional: true                             
        - name: CILIUM_CUSTOM_CNI_CONF                   
          valueFrom:                                     
            configMapKeyRef:                             
              key: custom-cni-conf             
              name: cilium-config              
              optional: true                   
        - name: KUBERNETES_SERVICE_HOST        
          value: 10.0.30.10                         <-----  VIP interface IP address (created by kube-vip)
        - name: KUBERNETES_SERVICE_PORT        
          value: "6443"                        
        image: quay.io/cilium/cilium:v1.11.5@sha256:79e66c3c2677e9ecc3fd5b2ed8e4ea7e49cf99ed6ee181f2ef43400c4db5eef0
        imagePullPolicy: IfNotPresent                                                                               
        lifecycle:                                                                                                  


root@kube2 # ip addr show eth0 | grep inet
    inet 10.0.30.12/24 brd 10.0.30.255 scope global eth0
    inet6 fe80::dea6:32ff:febf:6a5c/64 scope link 

root@kube2 # kubectl get pod -o wide -A | grep -i cilium
kube-system    cilium-8rgkv                                             1/1     Running            0                 16m    10.0.30.12    kube2.XXX.XXX.XXX   <none>           <none>

root@kube2 # kubectl logs -n kube-system cilium-8rgkv| grep -A3 "Local IP"
level=info msg="  Local IPv4 addresses:" subsys=daemon
level=info msg="  - 10.0.30.12" subsys=daemon   <----- This is the eth0 interface IP address
level=info msg="  - 10.0.30.10" subsys=daemon   <----- This is the VIP interface IP address
level=info msg="Creating or updating CiliumNode resource" node=kube2.XXX.XXX.XXX subsys=nodediscovery


#
# On a container that is on kube2.XXX.XXX.XXX
# 

root@kube2:~# kubectl exec -it pod/alpine -- /bin/sh
/ # ping 8.8.8.8
PING 8.8.8.8 (8.8.8.8): 56 data bytes
^C
--- 8.8.8.8 ping statistics ---
4 packets transmitted, 0 packets received, 100% packet loss


#
#  You can see below that it is using the VIP interface IP address - 10.0.30.10.  It should be using the eth0 interface IP address 10.0.30.12 instead....
#
root@kube2 # tcpdump -i any host 8.8.8.8 -n
tcpdump: data link type LINUX_SLL2
tcpdump: verbose output suppressed, use -v[v]... for full protocol decode
listening on any, link-type LINUX_SLL2 (Linux cooked v2), snapshot length 262144 bytes
00:38:53.809002 lxcdd18bbe8050e In  IP 10.42.2.215 > 8.8.8.8: ICMP echo request, id 25, seq 8, length 64
00:38:53.809131 eth0  Out IP 10.0.30.10 > 8.8.8.8: ICMP echo request, id 43634, seq 8, length 64
00:38:54.809403 lxcdd18bbe8050e In  IP 10.42.2.215 > 8.8.8.8: ICMP echo request, id 25, seq 9, length 64
00:38:54.809471 eth0  Out IP 10.0.30.10 > 8.8.8.8: ICMP echo request, id 43634, seq 9, length 64
00:38:55.599985 lxcdd18bbe8050e In  IP 10.42.2.215 > 8.8.8.8: ICMP echo request, id 26, seq 0, length 64
```

### Code of Conduct

- [X] I agree to follow this project's Code of Conduct

**Comment by kevin-leong** [comment]
More logs for cilium-agent:

> 
root@kube2:/home/kleong# kubectl logs -n kube-system cilium-8rgkv
level=info msg="Started gops server" address="127.0.0.1:9890" subsys=daemon
level=info msg="Memory available for map entries (0.003% of 8186122240B): 20465305B" subsys=config
level=info msg="option bpf-ct-global-tcp-max set by dynamic sizing to 131072" subsys=config
level=info msg="option bpf-ct-global-any-max set by dynamic sizing to 65536" subsys=config
level=info msg="option bpf-nat-global-max set by dynamic sizing to 131072" subsys=config
level=info msg="option bpf-neigh-global-max set by dynamic sizing to 131072" subsys=config
level=info msg="option bpf-sock-rev-map-max set by dynamic sizing to 65536" subsys=config
level=info msg="  --agent-health-port='9876'" subsys=daemon
level=info msg="  --agent-labels=''" subsys=daemon
level=info msg="  --allocator-list-timeout='3m0s'" subsys=daemon
level=info msg="  --allow-icmp-frag-needed='true'" subsys=daemon
level=info msg="  --allow-localhost='auto'" subsys=daemon
level=info msg="  --annotate-k8s-node='true'" subsys=daemon
level=info msg="  --api-rate-limit=''" subsys=daemon
level=info msg="  --arping-refresh-period='30s'" subsys=daemon
level=info msg="  --auto-create-cilium-node-resource='true'" subsys=daemon
level=info msg="  --auto-direct-node-routes='false'" subsys=daemon
level=info msg="  --bgp-announce-lb-ip='true'" subsys=daemon
level=info msg="  --bgp-announce-pod-cidr='false'" subsys=daemon
level=info msg="  --bgp-config-path='/var/lib/cilium/bgp/config.yaml'" subsys=daemon
level=info msg="  --bpf-ct-global-any-max='262144'" subsys=daemon
level=info msg="  --bpf-ct-global-tcp-max='524288'" subsys=daemon
level=info msg="  --bpf-ct-timeout-regular-any='1m0s'" subsys=daemon
level=info msg="  --bpf-ct-timeout-regular-tcp='6h0m0s'" subsys=daemon
level=info msg="  --bpf-ct-timeout-regular-tcp-fin='10s'" subsys=daemon
level=info msg="  --bpf-ct-timeout-regular-tcp-syn='1m0s'" subsys=daemon
level=info msg="  --bpf-ct-timeout-service-any='1m0s'" subsys=daemon
level=info msg="  --bpf-ct-timeout-service-tcp='6h0m0s'" subsys=daemon
level=info msg="  --bpf-fragments-map-max='8192'" subsys=daemon
level=info msg="  --bpf-lb-acceleration='disabled'" subsys=daemon
level=info msg="  --bpf-lb-algorithm='maglev'" subsys=daemon
level=info msg="  --bpf-lb-bypass-fib-lookup='false'" subsys=daemon
level=info msg="  --bpf-lb-dev-ip-addr-inherit=''" subsys=daemon
level=info msg="  --bpf-lb-dsr-dispatch='opt'" subsys=daemon
level=info msg="  --bpf-lb-dsr-l4-xlate='frontend'" subsys=daemon
level=info msg="  --bpf-lb-external-clusterip='false'" subsys=daemon
level=info msg="  --bpf-lb-maglev-hash-seed='JLfvgnHc2kaSUFaI'" subsys=daemon
level=info msg="  --bpf-lb-maglev-table-size='65521'" subsys=daemon
level=info msg="  --bpf-lb-map-max='65536'" subsys=daemon
level=info msg="  --bpf-lb-mode='dsr'" subsys=daemon
level=info msg="  --bpf-lb-rss-ipv4-src-cidr=''" subsys=daemon
level=info msg="  --bpf-lb-rss-ipv6-src-cidr=''" subsys=daemon
level=info msg="  --bpf-lb-sock-hostns-only='false'" subsys=daemon
level=info msg="  --bpf-map-dynamic-size-ratio='0.0025'" subsys=daemon
level=info msg="  --bpf-nat-global-max='524288'" subsys=daemon
level=info msg="  --bpf-neigh-global-max='524288'" subsys=daemon
level=info msg="  --bpf-policy-map-max='16384'" subsys=daemon
level=info msg="  --bpf-root=''" subsys=daemon
level=info msg="  --bpf-sock-rev-map-max='262144'" subsys=daemon
level=info msg="  --bypass-ip-availability-upon-restore='false'" subsys=daemon
level=info msg="  --certificates-directory='/var/run/cilium/certs'" subsys=daemon
level=info msg="  --cflags=''" subsys=daemon
level=info msg="  --cgroup-root='/run/cilium/cgroupv2'" subsys=daemon
level=info msg="  --cluster-health-port='4240'" subsys=daemon
level=info msg="  --cluster-id=''" subsys=daemon
level=info msg="  --cluster-name='default'" subsys=daemon
level=info msg="  --clustermesh-config='/var/lib/cilium/clustermesh/'" subsys=daemon
level=info msg="  --cmdref=''" subsys=daemon
level=info msg="  --config=''" subsys=daemon
level=info msg="  --config-dir='/tmp/cilium/config-map'" subsys=daemon
level=info msg="  --conntrack-gc-interval='0s'" subsys=daemon
level=info msg="  --crd-wait-timeout='5m0s'" subsys=daemon
level=info msg="  --datapath-mode='veth'" subsys=daemon
level=info msg="  --debug='false'" subsys=daemon
level=info msg="  --debug-verbose=''" subsys=daemon
level=info msg="  --derive-masquerade-ip-addr-from-device=''" subsys=daemon
level=info msg="  --devices=''" subsys=daemon
level=info msg="  --direct-routing-device=''" subsys=daemon
level=info msg="  --disable-cnp-status-updates='true'" subsys=daemon
level=info msg="  --disable-conntrack='false'" subsys=daemon
level=info msg="  --disable-endpoint-crd='false'" subsys=daemon
level=info msg="  --disable-envoy-version-check='false'" subsys=daemon
level=info msg="  --disable-iptables-feeder-rules=''" subsys=daemon
level=info msg="  --dns-max-ips-per-restored-rule='1000'" subsys=daemon
level=info msg="  --egress-masquerade-interfaces=''" subsys=daemon
level=info msg="  --egress-multi-home-ip-rule-compat='false'" subsys=daemon
level=info msg="  --enable-auto-protect-node-port-range='true'" subsys=daemon
level=info msg="  --enable-bandwidth-manager='false'" subsys=daemon
level=info msg="  --enable-bpf-clock-probe='true'" subsys=daemon
level=info msg="  --enable-bpf-masquerade='true'" subsys=daemon
level=info msg="  --enable-bpf-tproxy='false'" subsys=daemon
level=info msg="  --enable-cilium-endpoint-slice='false'" subsys=daemon
level=info msg="  --enable-custom-calls='false'" subsys=daemon
level=info msg="  --enable-endpoint-health-checking='true'" subsys=daemon
level=info msg="  --enable-endpoint-routes='false'" subsys=daemon
level=info msg="  --enable-external-ips='true'" subsys=daemon
level=info msg="  --enable-health-check-nodeport='true'" subsys=daemon
level=info msg="  --enable-health-checking='true'" subsys=daemon
level=info msg="  --enable-host-firewall='false'" subsys=daemon
level=info msg="  --enable-host-legacy-routing='false'" subsys=daemon
level=info msg="  --enable-host-port='true'" subsys=daemon
level=info msg="  --enable-host-reachable-services='false'" subsys=daemon
level=info msg="  --enable-hubble='true'" subsys=daemon
level=info msg="  --enable-hubble-recorder-api='true'" subsys=daemon
level=info msg="  --enable-icmp-rules='false'" subsys=daemon
level=info msg="  --enable-identity-mark='true'" subsys=daemon
level=info msg="  --enable-ip-masq-agent='false'" subsys=daemon
level=info msg="  --enable-ipsec='false'" subsys=daemon
level=info msg="  --enable-ipv4='true'" subsys=daemon
level=info msg="  --enable-ipv4-egress-gateway='false'" subsys=daemon
level=info msg="  --enable-ipv4-fragment-tracking='true'" subsys=daemon
level=info msg="  --enable-ipv4-masquerade='true'" subsys=daemon
level=info msg="  --enable-ipv6='false'" subsys=daemon
level=info msg="  --enable-ipv6-masquerade='true'" subsys=daemon
level=info msg="  --enable-ipv6-ndp='false'" subsys=daemon
level=info msg="  --enable-k8s-api-discovery='false'" subsys=daemon
level=info msg="  --enable-k8s-endpoint-slice='true'" subsys=daemon
level=info msg="  --enable-k8s-event-handover='false'" subsys=daemon
level=info msg="  --enable-k8s-terminating-endpoint='true'" subsys=daemon
level=info msg="  --enable-l2-neigh-discovery='true'" subsys=daemon
level=info msg="  --enable-l7-proxy='true'" subsys=daemon
level=info msg="  --enable-local-node-route='true'" subsys=daemon
level=info msg="  --enable-local-redirect-policy='false'" subsys=daemon
level=info msg="  --enable-mke='false'" subsys=daemon
level=info msg="  --enable-monitor='true'" subsys=daemon
level=info msg="  --enable-node-port='false'" subsys=daemon
level=info msg="  --enable-policy='default'" subsys=daemon
level=info msg="  --enable-recorder='false'" subsys=daemon
level=info msg="  --enable-remote-node-identity='true'" subsys=daemon
level=info msg="  --enable-selective-regeneration='true'" subsys=daemon
level=info msg="  --enable-service-topology='false'" subsys=daemon
level=info msg="  --enable-session-affinity='true'" subsys=daemon
level=info msg="  --enable-svc-source-range-check='true'" subsys=daemon
level=info msg="  --enable-tracing='false'" subsys=daemon
level=info msg="  --enable-well-known-identities='false'" subsys=daemon
level=info msg="  --enable-wireguard='false'" subsys=daemon
level=info msg="  --enable-wireguard-userspace-fallback='false'" subsys=daemon
level=info msg="  --enable-xdp-prefilter='false'" subsys=daemon
level=info msg="  --enable-xt-socket-fallback='true'" subsys=daemon
level=info msg="  --encrypt-interface=''" subsys=daemon
level=info msg="  --encrypt-node='false'" subsys=daemon
level=info msg="  --endpoint-gc-interval='5m0s'" subsys=daemon
level=info msg="  --endpoint-interface-name-prefix='lxc+'" subsys=daemon
level=info msg="  --endpoint-queue-size='25'" subsys=daemon
level=info msg="  --endpoint-status=''" subsys=daemon
level=info msg="  --envoy-log=''" subsys=daemon
level=info msg="  --exclude-local-address='10.0.30.10/32'" subsys=daemon
level=info msg="  --fixed-identity-mapping=''" subsys=daemon
level=info msg="  --force-local-policy-eval-at-source='true'" subsys=daemon
level=info msg="  --fqdn-regex-compile-lru-size='1024'" subsys=daemon
level=info msg="  --gops-port='9890'" subsys=daemon
level=info msg="  --host-reachable-services-protos='tcp,udp'" subsys=daemon
level=info msg="  --http-403-msg=''" subsys=daemon
level=info msg="  --http-idle-timeout='0'" subsys=daemon
level=info msg="  --http-max-grpc-timeout='0'" subsys=daemon
level=info msg="  --http-normalize-path='true'" subsys=daemon
level=info msg="  --http-request-timeout='3600'" subsys=daemon
level=info msg="  --http-retry-count='3'" subsys=daemon
level=info msg="  --http-retry-timeout='0'" subsys=daemon
level=info msg="  --hubble-disable-tls='false'" subsys=daemon
level=info msg="  --hubble-event-buffer-capacity='4095'" subsys=daemon
level=info msg="  --hubble-event-queue-size='0'" subsys=daemon
level=info msg="  --hubble-export-file-compress='false'" subsys=daemon
level=info msg="  --hubble-export-file-max-backups='5'" subsys=daemon
level=info msg="  --hubble-export-file-max-size-mb='10'" subsys=daemon
level=info msg="  --hubble-export-file-path=''" subsys=daemon
level=info msg="  --hubble-listen-address=':4244'" subsys=daemon
level=info msg="  --hubble-metrics='dns,drop,tcp,flow,icmp,http'" subsys=daemon
level=info msg="  --hubble-metrics-server=':9091'" subsys=daemon
level=info msg="  --hubble-recorder-sink-queue-size='1024'" subsys=daemon
level=info msg="  --hubble-recorder-storage-path='/var/run/cilium/pcaps'" subsys=daemon
level=info msg="  --hubble-socket-path='/var/run/cilium/hubble.sock'" subsys=daemon
level=info msg="  --hubble-tls-cert-file='/var/lib/cilium/tls/hubble/server.crt'" subsys=daemon
level=info msg="  --hubble-tls-client-ca-files='/var/lib/cilium/tls/hubble/client-ca.crt'" subsys=daemon
level=info msg="  --hubble-tls-key-file='/var/lib/cilium/tls/hubble/server.key'" subsys=daemon
level=info msg="  --identity-allocation-mode='crd'" subsys=daemon
level=info msg="  --identity-change-grace-period='5s'" subsys=daemon
level=info msg="  --identity-restore-grace-period='10m0s'" subsys=daemon
level=info msg="  --install-iptables-rules='true'" subsys=daemon
level=info msg="  --install-no-conntrack-iptables-rules='false'" subsys=daemon
level=info msg="  --ip-allocation-timeout='2m0s'" subsys=daemon
level=info msg="  --ip-masq-agent-config-path='/etc/config/ip-masq-agent'" subsys=daemon
level=info msg="  --ipam='kubernetes'" subsys=daemon
level=info msg="  --ipsec-key-file=''" subsys=daemon
level=info msg="  --iptables-lock-timeout='5s'" subsys=daemon
level=info msg="  --iptables-random-fully='false'" subsys=daemon
level=info msg="  --ipv4-native-routing-cidr='10.42.0.0/16'" subsys=daemon
level=info msg="  --ipv4-node='auto'" subsys=daemon
level=info msg="  --ipv4-pod-subnets=''" subsys=daemon
level=info msg="  --ipv4-range='auto'" subsys=daemon
level=info msg="  --ipv4-service-loopback-address='169.254.42.1'" subsys=daemon
level=info msg="  --ipv4-service-range='auto'" subsys=daemon
level=info msg="  --ipv6-cluster-alloc-cidr='f00d::/64'" subsys=daemon
level=info msg="  --ipv6-mcast-device=''" subsys=daemon
level=info msg="  --ipv6-node='auto'" subsys=daemon
level=info msg="  --ipv6-pod-subnets=''" subsys=daemon
level=info msg="  --ipv6-range='auto'" subsys=daemon
level=info msg="  --ipv6-service-range='auto'" subsys=daemon
level=info msg="  --ipvlan-master-device='undefined'" subsys=daemon
level=info msg="  --join-cluster='false'" subsys=daemon
level=info msg="  --k8s-api-server=''" subsys=daemon
level=info msg="  --k8s-heartbeat-timeout='30s'" subsys=daemon
level=info msg="  --k8s-kubeconfig-path=''" subsys=daemon
level=info msg="  --k8s-namespace='kube-system'" subsys=daemon
level=info msg="  --k8s-require-ipv4-pod-cidr='false'" subsys=daemon
level=info msg="  --k8s-require-ipv6-pod-cidr='false'" subsys=daemon
level=info msg="  --k8s-service-cache-size='128'" subsys=daemon
level=info msg="  --k8s-service-proxy-name=''" subsys=daemon
level=info msg="  --k8s-sync-timeout='3m0s'" subsys=daemon
level=info msg="  --k8s-watcher-endpoint-selector='metadata.name!=kube-scheduler,metadata.name!=kube-controller-manager,metadata.name!=etcd-operator,metadata.name!=gcp-controller-manager'" subsys=daemon
level=info msg="  --keep-config='false'" subsys=daemon
level=info msg="  --kube-proxy-replacement='strict'" subsys=daemon
level=info msg="  --kube-proxy-replacement-healthz-bind-address=''" subsys=daemon
level=info msg="  --kvstore=''" subsys=daemon
level=info msg="  --kvstore-connectivity-timeout='2m0s'" subsys=daemon
level=info msg="  --kvstore-lease-ttl='15m0s'" subsys=daemon
level=info msg="  --kvstore-max-consecutive-quorum-errors='2'" subsys=daemon
level=info msg="  --kvstore-opt=''" subsys=daemon
level=info msg="  --kvstore-periodic-sync='5m0s'" subsys=daemon
level=info msg="  --label-prefix-file=''" subsys=daemon
level=info msg="  --labels=''" subsys=daemon
level=info msg="  --lib-dir='/var/lib/cilium'" subsys=daemon
level=info msg="  --local-router-ipv4=''" subsys=daemon
level=info msg="  --local-router-ipv6=''" subsys=daemon
level=info msg="  --log-driver=''" subsys=daemon
level=info msg="  --log-opt=''" subsys=daemon
level=info msg="  --log-system-load='false'" subsys=daemon
level=info msg="  --max-controller-interval='0'" subsys=daemon
level=info msg="  --metrics=''" subsys=daemon
level=info msg="  --mke-cgroup-mount=''" subsys=daemon
level=info msg="  --monitor-aggregation='medium'" subsys=daemon
level=info msg="  --monitor-aggregation-flags='all'" subsys=daemon
level=info msg="  --monitor-aggregation-interval='5s'" subsys=daemon
level=info msg="  --monitor-queue-size='0'" subsys=daemon
level=info msg="  --mtu='0'" subsys=daemon
level=info msg="  --nat46-range='0:0:0:0:0:FFFF::/96'" subsys=daemon
level=info msg="  --native-routing-cidr=''" subsys=daemon
level=info msg="  --node-port-acceleration='disabled'" subsys=daemon
level=info msg="  --node-port-algorithm='random'" subsys=daemon
level=info msg="  --node-port-bind-protection='true'" subsys=daemon
level=info msg="  --node-port-mode='snat'" subsys=daemon
level=info msg="  --node-port-range='30000,32767'" subsys=daemon
level=info msg="  --policy-audit-mode='false'" subsys=daemon
level=info msg="  --policy-queue-size='100'" subsys=daemon
level=info msg="  --policy-trigger-interval='1s'" subsys=daemon
level=info msg="  --pprof='false'" subsys=daemon
level=info msg="  --pprof-port='6060'" subsys=daemon
level=info msg="  --preallocate-bpf-maps='false'" subsys=daemon
level=info msg="  --prefilter-device='undefined'" subsys=daemon
level=info msg="  --prefilter-mode='native'" subsys=daemon
level=info msg="  --prepend-iptables-chains='true'" subsys=daemon
level=info msg="  --prometheus-serve-addr=':9090'" subsys=daemon
level=info msg="  --proxy-connect-timeout='1'" subsys=daemon
level=info msg="  --proxy-gid='1337'" subsys=daemon
level=info msg="  --proxy-prometheus-port='9095'" subsys=daemon
level=info msg="  --read-cni-conf=''" subsys=daemon
level=info msg="  --restore='true'" subsys=daemon
level=info msg="  --route-metric='0'" subsys=daemon
level=info msg="  --sidecar-istio-proxy-image='cilium/istio_proxy'" subsys=daemon
level=info msg="  --single-cluster-route='false'" subsys=daemon
level=info msg="  --socket-path='/var/run/cilium/cilium.sock'" subsys=daemon
level=info msg="  --sockops-enable='false'" subsys=daemon
level=info msg="  --state-dir='/var/run/cilium'" subsys=daemon
level=info msg="  --tofqdns-dns-reject-response-code='refused'" subsys=daemon
level=info msg="  --tofqdns-enable-dns-compression='true'" subsys=daemon
level=info msg="  --tofqdns-endpoint-max-ip-per-hostname='50'" subsys=daemon
level=info msg="  --tofqdns-idle-connection-grace-period='0s'" subsys=daemon
level=info msg="  --tofqdns-max-deferred-connection-deletes='10000'" subsys=daemon
level=info msg="  --tofqdns-min-ttl='0'" subsys=daemon
level=info msg="  --tofqdns-pre-cache=''" subsys=daemon
level=info msg="  --tofqdns-proxy-port='0'" subsys=daemon
level=info msg="  --tofqdns-proxy-response-max-delay='100ms'" subsys=daemon
level=info msg="  --trace-payloadlen='128'" subsys=daemon
level=info msg="  --tunnel='disabled'" subsys=daemon
level=info msg="  --tunnel-port='0'" subsys=daemon
level=info msg="  --version='false'" subsys=daemon
level=info msg="  --vlan-bpf-bypass=''" subsys=daemon
level=info msg="  --write-cni-conf-when-ready=''" subsys=daemon
level=info msg="     _ _ _" subsys=daemon
level=info msg=" ___|_| |_|_ _ _____" subsys=daemon
level=info msg="|  _| | | | | |     |" subsys=daemon
level=info msg="|___|_|_|_|___|_|_|_|" subsys=daemon
level=info msg="Cilium 1.11.5 b0d3140 2022-05-10T02:47:42+02:00 go version go1.17.9 linux/arm64" subsys=daemon
level=info msg="cilium-envoy  version: 9c0d933166ba192713f9e2fc3901f788557286ee/1.21.1/Distribution/RELEASE/BoringSSL" subsys=daemon
level=info msg="clang (10.0.0) and kernel (5.15.0) versions: OK!" subsys=linux-datapath
level=info msg="linking environment: OK!" subsys=linux-datapath
level=info msg="Detected mounted BPF filesystem at /sys/fs/bpf" subsys=bpf
level=info msg="Mounted cgroupv2 filesystem at /run/cilium/cgroupv2" subsys=cgroups
level=info msg="Parsing base label prefixes from default label list" subsys=labels-filter
level=info msg="Parsing additional label prefixes from user inputs: []" subsys=labels-filter
level=info msg="Final label prefixes to be used for identity evaluation:" subsys=labels-filter
level=info msg=" - reserved:.*" subsys=labels-filter
level=info msg=" - :io\\.kubernetes\\.pod\\.namespace" subsys=labels-filter
level=info msg=" - :io\\.cilium\\.k8s\\.namespace\\.labels" subsys=labels-filter
level=info msg=" - :app\\.kubernetes\\.io" subsys=labels-filter
level=info msg=" - !:io\\.kubernetes" subsys=labels-filter
level=info msg=" - !:kubernetes\\.io" subsys=labels-filter
level=info msg=" - !:.*beta\\.kubernetes\\.io" subsys=labels-filter
level=info msg=" - !:k8s\\.io" subsys=labels-filter
level=info msg=" - !:pod-template-generation" subsys=labels-filter
level=info msg=" - !:pod-template-hash" subsys=labels-filter
level=info msg=" - !:controller-revision-hash" subsys=labels-filter
level=info msg=" - !:annotation.*" subsys=labels-filter
level=info msg=" - !:etcd_node" subsys=labels-filter
level=info msg="Using autogenerated IPv4 allocation range" subsys=node v4Prefix=10.10.0.0/16
level=info msg="Initializing daemon" subsys=daemon
level=info msg="Establishing connection to apiserver" host="https://10.0.30.10:6443" subsys=k8s
level=info msg="Connected to apiserver" subsys=k8s
level=info msg="Trying to auto-enable \"enable-node-port\", \"enable-external-ips\", \"enable-host-reachable-services\", \"enable-host-port\", \"enable-session-affinity\" features" subsys=daemon
level=info msg="Inheriting MTU from external network interface" device=eth0 ipAddr=10.0.30.10 mtu=1500 subsys=mtu
struct { Version uint8; ASN16 uint16; HoldTime uint16; RouterID uint32; OptsLen uint8 }{Version:0x4, ASN16:0xfde8, HoldTime:0xb4, RouterID:0xa001e01, OptsLen:0x14}
level=info msg="Started BGP speaker" subsys=bgp-speaker
level=info msg="Restored services from maps" failed=0 restored=0 subsys=service
level=info msg="Reading old endpoints..." subsys=daemon
level=info msg="Envoy: Starting xDS gRPC server listening on /var/run/cilium/xds.sock" subsys=envoy-manager
level=info msg="No old endpoints found." subsys=daemon
level=info msg="Waiting until all Cilium CRDs are available" subsys=k8s
level=info msg="All Cilium CRDs have been found and are available" subsys=k8s
level=info msg="processing new event." component=MetalLBSpeaker.run subsys=bgp-speaker
level=info msg="Retrieved node information from kubernetes node" nodeName=kube2.XXX.XXX.XXX subsys=k8s
level=info msg="Received own node information from API server" ipAddr.ipv4=10.0.30.12 ipAddr.ipv6="<nil>" k8sNodeIP=10.0.30.12 labels="map[beta.kubernetes.io/arch:arm64 beta.kubernetes.io/instance-type:k3s beta.kubernetes.io/os:linux kubernetes.io/arch:arm64 kubernetes.io/hostname:kube2.XXX.XXX.XXX kubernetes.io/os:linux node-role.kubernetes.io/control-plane:true node-role.kubernetes.io/etcd:true node-role.kubernetes.io/master:true node.kubernetes.io/instance-type:k3s]" nodeName=kube2.XXX.XXX.XXX subsys=k8s v4Prefix=10.42.1.0/24 v6Prefix="<nil>"
level=info msg="Restored router IPs from node information" ipv4=10.42.1.201 ipv6="<nil>" subsys=k8s
level=info msg="k8s mode: Allowing localhost to reach local endpoints" subsys=daemon
level=info msg="Direct routing device detected" direct-routing-device=eth0 subsys=daemon
level=info msg="Detected devices" devices="[eth0]" subsys=daemon
level=info msg="Enabling k8s event listener" subsys=k8s-watcher
level=info msg="processing new event." component=MetalLBSpeaker.run subsys=bgp-speaker
level=info msg="processing new event." component=MetalLBSpeaker.run subsys=bgp-speaker
....
level=info msg="Removing stale endpoint interfaces" subsys=daemon
level=info msg="Skipping kvstore configuration" subsys=daemon
level=info msg="processing new event." component=MetalLBSpeaker.run subsys=bgp-speaker
level=info msg="processing new event." component=MetalLBSpeaker.run subsys=bgp-speaker
....
level=info msg="processing new event." component=MetalLBSpeaker.run subsys=bgp-speaker
level=info msg="processing new event." component=MetalLBSpeaker.run subsys=bgp-speaker
level=info msg="Waiting until all pre-existing resources have been received" subsys=k8s-watcher
level=info msg="processing new event." component=MetalLBSpeaker.run subsys=bgp-speaker
level=info msg="processing new event." component=MetalLBSpeaker.run subsys=bgp-speaker
....
level=info msg="Initializing node addressing" subsys=daemon
level=info msg="Initializing kubernetes IPAM" subsys=ipam v4Prefix=10.42.1.0/24 v6Prefix="<nil>"
level=warning msg="Failed to remove old router IPs (restored IP: 10.42.1.201) from cilium_host. Manual intervention is required to remove all other old IPs." error="Link not found" subsys=daemon
level=info msg="Restoring endpoints..." subsys=daemon
level=info msg="Endpoints restored" failed=0 restored=0 subsys=daemon
level=info msg="Addressing information:" subsys=daemon
level=info msg="  Cluster-Name: default" subsys=daemon
level=info msg="  Cluster-ID: 0" subsys=daemon
level=info msg="  Local node-name: kube2.XXX.XXX.XXX" subsys=daemon
level=info msg="  Node-IPv6: <nil>" subsys=daemon
level=info msg="  External-Node IPv4: 10.0.30.12" subsys=daemon
level=info msg="  Internal-Node IPv4: 10.42.1.201" subsys=daemon
level=info msg="  IPv4 allocation prefix: 10.42.1.0/24" subsys=daemon
level=info msg="  IPv4 native routing prefix: 10.42.0.0/16" subsys=daemon
level=info msg="  Loopback IPv4: 169.254.42.1" subsys=daemon
level=info msg="  Local IPv4 addresses:" subsys=daemon
level=info msg="  - 10.0.30.12" subsys=daemon
level=info msg="  - 10.0.30.10" subsys=daemon
level=info msg="Creating or updating CiliumNode resource" node=kube2.XXX.XXX.XXX subsys=nodediscovery
level=info msg="Adding local node to cluster" node="{kube2.XXX.XXX.XXX default [{InternalIP 10.0.30.12} {CiliumInternalIP 10.42.1.201}] 10.42.1.0/24 <nil> 10.42.1.60 <nil> 0 local 0 map[beta.kubernetes.io/arch:arm64 beta.kubernetes.io/instance-type:k3s beta.kubernetes.io/os:linux kubernetes.io/arch:arm64 kubernetes.io/hostname:kube2.XXX.XXX.XXX kubernetes.io/os:linux node-role.kubernetes.io/control-plane:true node-role.kubernetes.io/etcd:true node-role.kubernetes.io/master:true node.kubernetes.io/instance-type:k3s] 1 }" subsys=nodediscovery
level=info msg="Annotating k8s node" subsys=daemon v4CiliumHostIP.IPv4=10.42.1.201 v4Prefix=10.42.1.0/24 v4healthIP.IPv4=10.42.1.60 v6CiliumHostIP.IPv6="<nil>" v6Prefix="<nil>" v6healthIP.IPv6="<nil>"
level=info msg="Initializing identity allocator" subsys=identity-cache
level=info msg="Cluster-ID is not specified, skipping ClusterMesh initialization" subsys=daemon
level=info msg="Setting up BPF datapath" bpfClockSource=jiffies bpfInsnSet=v3 subsys=datapath-loader
level=info msg="Setting sysctl" subsys=sysctl sysParamName=net.core.bpf_jit_enable sysParamValue=1
level=info msg="Setting sysctl" subsys=sysctl sysParamName=net.ipv4.conf.all.rp_filter sysParamValue=0
level=info msg="Setting sysctl" subsys=sysctl sysParamName=net.ipv4.fib_multipath_use_neigh sysParamValue=1
level=info msg="Setting sysctl" subsys=sysctl sysParamName=kernel.unprivileged_bpf_disabled sysParamValue=1
level=info msg="Setting sysctl" subsys=sysctl sysParamName=kernel.timer_migration sysParamValue=0
level=info msg="Setting sysctl" subsys=sysctl sysParamName=net.ipv4.conf.cilium_host.forwarding sysParamValue=1
level=info msg="Setting sysctl" subsys=sysctl sysParamName=net.ipv4.conf.cilium_host.rp_filter sysParamValue=0
level=info msg="Setting sysctl" subsys=sysctl sysParamName=net.ipv4.conf.cilium_host.accept_local sysParamValue=1
level=info msg="All pre-existing resources have been received; continuing" subsys=k8s-watcher
level=info msg="Setting sysctl" subsys=sysctl sysParamName=net.ipv4.conf.cilium_host.send_redirects sysParamValue=0
level=info msg="Setting sysctl" subsys=sysctl sysParamName=net.ipv4.conf.cilium_net.forwarding sysParamValue=1
level=info msg="Setting sysctl" subsys=sysctl sysParamName=net.ipv4.conf.cilium_net.rp_filter sysParamValue=0
level=info msg="Setting sysctl" subsys=sysctl sysParamName=net.ipv4.conf.cilium_net.accept_local sysParamValue=1
level=info msg="Setting sysctl" subsys=sysctl sysParamName=net.ipv4.conf.cilium_net.send_redirects sysParamValue=0
level=info msg="regenerating all endpoints" reason="one or more identities created or deleted" subsys=endpoint-manager
level=info msg="regenerating all endpoints" reason="kube-apiserver identity updated" subsys=endpoint-manager
level=info msg="Adding new proxy port rules for cilium-dns-egress:37201" proxy port name=cilium-dns-egress subsys=proxy
level=info msg="Group not found" error="group: unknown group cilium" file-path=/var/run/cilium/monitor1_2.sock group=cilium subsys=api
level=info msg="Serving cilium node monitor v1.2 API at unix:///var/run/cilium/monitor1_2.sock" subsys=monitor-agent
level=info msg="Validating configured node address ranges" subsys=daemon
level=info msg="Starting connection tracking garbage collector" subsys=daemon
level=info msg="Starting IP identity watcher" subsys=ipcache
level=info msg="Initial scan of connection tracking completed" subsys=ct-gc
level=info msg="Regenerating restored endpoints" numRestored=0 subsys=daemon
level=info msg="Datapath signal listener running" subsys=signal
level=info msg="Creating host endpoint" subsys=daemon
level=info msg="Finished regenerating restored endpoints" regenerated=0 subsys=daemon total=0
level=info msg="New endpoint" containerID= datapathPolicyRevision=0 desiredPolicyRevision=0 endpointID=3179 ipv4= ipv6= k8sPodName=/ subsys=endpoint
level=info msg="Resolving identity labels (blocking)" containerID= datapathPolicyRevision=0 desiredPolicyRevision=0 endpointID=3179 identityLabels="k8s:node-role.kubernetes.io/control-plane=true,k8s:node-role.kubernetes.io/etcd=true,k8s:node-role.kubernetes.io/master=true,k8s:node.kubernetes.io/instance-type=k3s,reserved:host" ipv4= ipv6= k8sPodName=/ subsys=endpoint
level=info msg="Identity of endpoint changed" containerID= datapathPolicyRevision=0 desiredPolicyRevision=0 endpointID=3179 identity=1 identityLabels="k8s:node-role.kubernetes.io/control-plane=true,k8s:node-role.kubernetes.io/etcd=true,k8s:node-role.kubernetes.io/master=true,k8s:node.kubernetes.io/instance-type=k3s,reserved:host" ipv4= ipv6= k8sPodName=/ oldIdentity="no identity" subsys=endpoint
level=info msg="Launching Cilium health daemon" subsys=daemon
level=info msg="Launching Cilium health endpoint" subsys=daemon
level=info msg="Serving prometheus metrics on :9090" subsys=daemon
level=info msg="Started healthz status API server" address="127.0.0.1:9876" subsys=daemon
level=info msg="Initializing Cilium API" subsys=daemon
level=info msg="Daemon initialization completed" bootstrapTime=27.833152044s subsys=daemon
level=info msg="Group not found" error="group: unknown group cilium" file-path=/var/run/cilium/cilium.sock group=cilium subsys=api
level=info msg="Serving cilium API at unix:///var/run/cilium/cilium.sock" subsys=daemon
level=info msg="Starting Hubble Metrics server" address=":9091" metrics="[dns drop tcp flow icmp http]" subsys=hubble
level=info msg="Configured metrics plugin" name=dns status= subsys=hubble
level=info msg="Configured metrics plugin" name=drop status= subsys=hubble
level=info msg="Configured metrics plugin" name=tcp status= subsys=hubble
level=info msg="Configured metrics plugin" name=flow status= subsys=hubble
level=info msg="Configured metrics plugin" name=icmp status= subsys=hubble
level=info msg="Configured metrics plugin" name=http status= subsys=hubble
level=info msg="Configuring Hubble server" eventQueueSize=4096 maxFlows=4095 subsys=hubble
level=info msg="Group not found" error="group: unknown group cilium" file-path=/var/run/cilium/hubble.sock group=cilium subsys=api
level=info msg="Starting local Hubble server" address="unix:///var/run/cilium/hubble.sock" subsys=hubble
level=info msg="Beginning to read perf buffer" startTime="2022-05-30 02:35:03.654183973 +0000 UTC m=+27.959515420" subsys=monitor-agent
level=info msg="Starting Hubble server" address=":4244" subsys=hubble
level=info msg="Processing API request with rate limiter" name=endpoint-delete parallelRequests=4 subsys=rate uuid=614f3454-5a3c-43d1-9fa5-ed80fed582e6
level=info msg="API request released by rate limiter" name=endpoint-delete parallelRequests=4 subsys=rate uuid=614f3454-5a3c-43d1-9fa5-ed80fed582e6 waitDurationTotal="364.978µs"
level=info msg="API call has been processed" error="endpoint not found" name=endpoint-delete processingDuration="22.833µs" subsys=rate totalDuration="546.847µs" uuid=614f3454-5a3c-43d1-9fa5-ed80fed582e6 waitDurationTotal="364.978µs"
....

**Comment by kevin-leong** [comment]
Any ideas?
