### ISSUE TITLE
Cilium Sporadic unreachable nodes spikes (ICMP Connection timed out)

### ISSUE THREAD

**Issue by brnck** [cilium/cilium#24061]
### Is there an existing issue for this?

- [X] I have searched the existing issues

### What happened?

I have this behaviour in the cluster when nodes are reporting unreachable:

<img width="2984" alt="image" src="https://user-images.githubusercontent.com/14329469/221788281-51646f63-046e-4b28-a06d-13ee76ba751a.png">

I thought that maybe it is already with the cluster autoscaler behaviour, but as you can see from the metrics above sometimes it happens even when CA is not kicking in (creating/removing nodes).

Also, it is worth mentioning that this only happens on ICMP health checks:
```
❯ k exec -n kube-system -it cilium-nj6p4 -c cilium-agent -- cilium-health status --probe | grep "out"
      ICMP to stack:   Connection timed out
      ICMP to stack:   Connection timed out
      ICMP to stack:   Connection timed out
      ICMP to stack:   Connection timed out
      ICMP to stack:   Connection timed out
      ICMP to stack:   Connection timed out
      ICMP to stack:   Connection timed out
      ICMP to stack:   Connection timed out
      ICMP to stack:   Connection timed out
      ICMP to stack:   Connection timed out
      ICMP to stack:   Connection timed out
      ICMP to stack:   Connection timed out
      ICMP to stack:   Connection timed out
      ICMP to stack:   Connection timed out
      ICMP to stack:   Connection timed out
      ICMP to stack:   Connection timed out
      ICMP to stack:   Connection timed out
      ICMP to stack:   Connection timed out
      ICMP to stack:   Connection timed out
      ICMP to stack:   Connection timed out
      ICMP to stack:   Connection timed out
      ICMP to stack:   Connection timed out
```

```
❯ k exec -n kube-system -it cilium-nj6p4 -c cilium-agent -- cilium-health status --probe --succinct | grep unreachable
  10.0.50.206(localhost)   10.0.50.206      unreachable   reachable
```

It shows that ICMP even times out locally, but it works:
```
[app@ip-10-0-50-206 ~]$ ping 10.0.50.206
PING 10.0.50.206 (10.0.50.206) 56(84) bytes of data.
64 bytes from 10.0.50.206: icmp_seq=1 ttl=255 time=0.046 ms
64 bytes from 10.0.50.206: icmp_seq=2 ttl=255 time=0.065 ms
64 bytes from 10.0.50.206: icmp_seq=3 ttl=255 time=0.057 ms
64 bytes from 10.0.50.206: icmp_seq=4 ttl=255 time=0.048 ms
64 bytes from 10.0.50.206: icmp_seq=5 ttl=255 time=0.041 ms
64 bytes from 10.0.50.206: icmp_seq=6 ttl=255 time=0.040 ms
64 bytes from 10.0.50.206: icmp_seq=7 ttl=255 time=0.048 ms
^C
--- 10.0.50.206 ping statistics ---
7 packets transmitted, 7 received, 0% packet loss, time 6132ms
rtt min/avg/max/mdev = 0.040/0.049/0.065/0.009 ms
```

I've tried to run [a connectivity test](https://docs.cilium.io/en/v1.12/operations/troubleshooting/#cilium-connectivity-tests). It works with no issues.

cilium monitor tools as I understand, also, does not see anything unusual:
```
❯ k exec -n kube-system -it cilium-nj6p4 -c cilium-agent -- cilium monitor --type drop
Listening for events on 15 CPUs with 64x4096 of shared memory
Press Ctrl-C to quit
level=info msg="Initializing dissection cache..." subsys=monitor
xx drop (Unsupported L3 protocol) flow 0x0 to endpoint 2565, file bpf_lxc.c line 2206, , identity world->2135: fe80::44a:92ff:feec:e9d4 -> ff02::2 RouterSolicitation
xx drop (Unsupported L3 protocol) flow 0x0 to endpoint 81, file bpf_lxc.c line 2206, , identity world->56121: fe80::d038:62ff:feab:e5b7 -> ff02::2 RouterSolicitation
```

```
❯ hubble observe --to-label reserved:health --follow --protocol icmp -t drop
Feb 27 12:49:47.274: fe80::5cd7:8dff:fe43:d8cb (world) <> ff02::2 (health) Unsupported L3 protocol DROPPED (ICMPv6 RouterSolicitation)
Feb 27 12:50:16.022: fe80::9c73:21ff:fe31:a3e4 (world) <> ff02::2 (health) Unsupported L3 protocol DROPPED (ICMPv6 RouterSolicitation)
```

However, I am not sure if it is related, but I am seeing these in tcpdump log:

```
[root@ip-10-0-50-206 ~]# tcpdump "icmp[0] == 3"
tcpdump: verbose output suppressed, use -v or -vv for full protocol decode
listening on eth0, link-type EN10MB (Ethernet), capture size 262144 bytes
08:17:17.927169 IP ip-10-0-50-206.ec2.internal > ip-10-0-89-20.ec2.internal: ICMP ip-10-0-50-206.ec2.internal tcp port 31327 unreachable, length 68
08:17:18.014177 IP ip-10-0-50-206.ec2.internal > ip-10-0-2-230.ec2.internal: ICMP ip-10-0-50-206.ec2.internal tcp port 31327 unreachable, length 68
08:17:18.033603 IP ip-10-0-50-206.ec2.internal > ip-10-0-51-170.ec2.internal: ICMP ip-10-0-50-206.ec2.internal tcp port 31327 unreachable, length 68
08:17:18.121814 IP ip-10-0-50-206.ec2.internal > ip-10-0-69-210.ec2.internal: ICMP ip-10-0-50-206.ec2.internal tcp port 31327 unreachable, length 68
08:17:18.256596 IP ip-10-0-50-206.ec2.internal > ip-10-0-30-175.ec2.internal: ICMP ip-10-0-50-206.ec2.internal tcp port 31327 unreachable, length 68
08:17:19.114961 IP ip-10-0-50-206.ec2.internal > ip-10-0-2-179.ec2.internal: ICMP ip-10-0-50-206.ec2.internal tcp port 31498 unreachable, length 68
08:17:19.261291 IP ip-10-0-50-206.ec2.internal > ip-10-0-16-224.ec2.internal: ICMP ip-10-0-50-206.ec2.internal tcp port 31498 unreachable, length 68
08:17:19.294910 IP ip-10-0-50-206.ec2.internal > ip-10-0-73-204.ec2.internal: ICMP ip-10-0-50-206.ec2.internal tcp port 31498 unreachable, length 68
08:17:19.347782 IP ip-10-0-50-206.ec2.internal > ip-10-0-90-151.ec2.internal: ICMP ip-10-0-50-206.ec2.internal tcp port 31498 unreachable, length 68
08:17:19.410207 IP ip-10-0-50-206.ec2.internal > ip-10-0-63-116.ec2.internal: ICMP ip-10-0-50-206.ec2.internal tcp port 31498 unreachable, length 68
08:17:27.930569 IP ip-10-0-50-206.ec2.internal > ip-10-0-89-20.ec2.internal: ICMP ip-10-0-50-206.ec2.internal tcp port 31327 unreachable, length 68
08:17:28.016537 IP ip-10-0-50-206.ec2.internal > ip-10-0-2-230.ec2.internal: ICMP ip-10-0-50-206.ec2.internal tcp port 31327 unreachable, length 68
08:17:28.036188 IP ip-10-0-50-206.ec2.internal > ip-10-0-51-170.ec2.internal: ICMP ip-10-0-50-206.ec2.internal tcp port 31327 unreachable, length 68
08:17:28.121460 IP ip-10-0-50-206.ec2.internal > ip-10-0-69-210.ec2.internal: ICMP ip-10-0-50-206.ec2.internal tcp port 31327 unreachable, length 68
08:17:28.264474 IP ip-10-0-50-206.ec2.internal > ip-10-0-30-175.ec2.internal: ICMP ip-10-0-50-206.ec2.internal tcp port 31327 unreachable, length 68
08:17:29.121127 IP ip-10-0-50-206.ec2.internal > ip-10-0-2-179.ec2.internal: ICMP ip-10-0-50-206.ec2.internal tcp port 31498 unreachable, length 68
08:17:29.263760 IP ip-10-0-50-206.ec2.internal > ip-10-0-16-224.ec2.internal: ICMP ip-10-0-50-206.ec2.internal tcp port 31498 unreachable, length 68
08:17:29.301792 IP ip-10-0-50-206.ec2.internal > ip-10-0-73-204.ec2.internal: ICMP ip-10-0-50-206.ec2.internal tcp port 31498 unreachable, length 68
08:17:29.352832 IP ip-10-0-50-206.ec2.internal > ip-10-0-90-151.ec2.internal: ICMP ip-10-0-50-206.ec2.internal tcp port 31498 unreachable, length 68
08:17:29.413716 IP ip-10-0-50-206.ec2.internal > ip-10-0-63-116.ec2.internal: ICMP ip-10-0-50-206.ec2.internal tcp port 31498 unreachable, length 68
08:17:37.931985 IP ip-10-0-50-206.ec2.internal > ip-10-0-89-20.ec2.internal: ICMP ip-10-0-50-206.ec2.internal tcp port 31327 unreachable, length 68
08:17:38.018777 IP ip-10-0-50-206.ec2.internal > ip-10-0-2-230.ec2.internal: ICMP ip-10-0-50-206.ec2.internal tcp port 31327 unreachable, length 68
08:17:38.038268 IP ip-10-0-50-206.ec2.internal > ip-10-0-51-170.ec2.internal: ICMP ip-10-0-50-206.ec2.internal tcp port 31327 unreachable, length 68
08:17:38.124154 IP ip-10-0-50-206.ec2.internal > ip-10-0-69-210.ec2.internal: ICMP ip-10-0-50-206.ec2.internal tcp port 31327 unreachable, length 68
08:17:38.260134 IP ip-10-0-50-206.ec2.internal > ip-10-0-30-175.ec2.internal: ICMP ip-10-0-50-206.ec2.internal tcp port 31327 unreachable, length 68
08:17:39.128360 IP ip-10-0-50-206.ec2.internal > ip-10-0-2-179.ec2.internal: ICMP ip-10-0-50-206.ec2.internal tcp port 31498 unreachable, length 68
08:17:39.270708 IP ip-10-0-50-206.ec2.internal > ip-10-0-16-224.ec2.internal: ICMP ip-10-0-50-206.ec2.internal tcp port 31498 unreachable, length 68
08:17:39.315661 IP ip-10-0-50-206.ec2.internal > ip-10-0-73-204.ec2.internal: ICMP ip-10-0-50-206.ec2.internal tcp port 31498 unreachable, length 68
08:17:39.356416 IP ip-10-0-50-206.ec2.internal > ip-10-0-90-151.ec2.internal: ICMP ip-10-0-50-206.ec2.internal tcp port 31498 unreachable, length 68
08:17:39.417820 IP ip-10-0-50-206.ec2.internal > ip-10-0-63-116.ec2.internal: ICMP ip-10-0-50-206.ec2.internal tcp port 31498 unreachable, length 68
^C
30 packets captured
30 packets received by filter
0 packets dropped by kernel
```

At this point, I don't see any degradation in communication between the workloads. Everything works as expected, but we are getting alerts about unhealthy nodes and at this point I'm not sure this is the expected behaviour

### Cilium Version

v1.12.5

### Kernel Version

5.4.226-129.415.amzn2.aarch64

### Kubernetes Version

v1.22.16-eks-ffeb93d

### Sysdump

I'm not feeling comfortable sharing it publically, but I'd be glad to share it with maintainers via Cilium Slack 

### Anything else?

Similar issues that I've found:
* https://github.com/cilium/cilium/issues/9585

Resources that I've used to troubleshoot:
* https://docs.cilium.io/en/v1.12/operations/troubleshooting/
* https://arthurchiao.art/blog/cilium-code-health-probe/
* https://www.datadoghq.com/blog/cilium-metrics-and-architecture/#endpoint-health-metrics

### Code of Conduct

- [X] I agree to follow this project's Code of Conduct

**Comment by giorio94** [comment]
Node to node connectivity is tested using standard ICMP packets (as provided by the https://github.com/servak/go-fastping go library). A possibility is that ICMP probes are being sometimes dropped by the underlying network (e.g., due to rate limiting policies). One thing to notice in this respect is that the library sends the ICMP Echo Request message to all destinations at the same time. I would also suggest you to verify first that the node IP addresses reported by `cilium-health status` are correct (otherwise that would be the symptom for some stale status issue in the agent).

Could you also check with a long-running ping session if any seldom drop is reported?
