### ISSUE TITLE
Jumbo payload failed in cilium v1.5.6 and after

### ISSUE THREAD

**Issue by CH-anhngo** [cilium/cilium#11111]
## Bug report

**General Information**

- Cilium version (run `cilium version`) 1.6 and above
- Kernel version (run `uname -a`)  4.19.106-coreos
- Orchestration system version in use (e.g. `kubectl version`, Mesos, ...)
- Link to relevant artifacts (policies, deployments scripts, ...)
- Upload a system dump (run `curl -sLO
https://github.com/cilium/cilium-sysdump/releases/latest/download/cilium-sysdump.zip &&
python cilium-sysdump.zip` and then attach the generated zip file)

**How to reproduce the issue**

1. instruction 1
our services have huge payload is much larger than 8842 in below. We don't set mtu flag in cilium-agent (cilium pods). 
from ciliums logs we observed something: cilium v1.6.6
```
-> stack flow 0xb36bdae0 identity 37560->63143 state established ifindex 0: 10.120.4.78:46866 -> 10.120.1.1:8375 tcp ACK
-> endpoint 2483 flow 0x4c8bbffd identity 1->37560 state established ifindex lxcf9eb6e4589a7: 10.120.4.120 -> 10.120.4.78 DestinationUnreachable(FragmentationNeeded)
```
187:~# ip r s
default via 10.16.64.1 dev eth0 proto dhcp src 10.16.65.187 metric 1024 
10.16.64.0/22 dev eth0 proto kernel scope link src 10.16.65.187 
10.16.64.1 dev eth0 proto dhcp scope link src 10.16.65.187 metric 1024 
10.120.0.0/24 via 10.120.8.35 dev cilium_host src 10.120.8.35 mtu 8842 
10.120.1.0/24 via 10.120.8.35 dev cilium_host src 10.120.8.35 mtu 8842 
10.120.2.0/24 via 10.120.8.35 dev cilium_host src 10.120.8.35 mtu 8842 
10.120.4.0/24 via 10.120.8.35 dev cilium_host src 10.120.8.35 mtu 8842 
10.120.5.0/24 via 10.120.8.35 dev cilium_host src 10.120.8.35 mtu 8842 
10.120.6.0/24 via 10.120.8.35 dev cilium_host src 10.120.8.35 mtu 8842 
10.120.7.0/24 via 10.120.8.35 dev cilium_host src 10.120.8.35 mtu 8842 
10.120.8.0/24 via 10.120.8.35 dev cilium_host src 10.120.8.35 mtu 8842 
10.120.8.35 dev cilium_host scope link 
172.17.0.0/16 dev docker0 proto kernel scope link src 172.17.0.1 linkdown 

set cilium_vxlan to match with lxc_health size (9001) as suggestion from @jrfastab but does not work. (cilium v1.6.6)
Default it is 1500
~# ip a show cilium_vxlan
6: cilium_vxlan: <BROADCAST,MULTICAST,UP,LOWER_UP> mtu 9001 qdisc noqueue state UNKNOWN group default qlen 1000
    link/ether aa:2b:7d:19:47:f3 brd ff:ff:ff:ff:ff:ff
    inet6 fe80::a82b:7dff:fe19:47f3/64 scope link 
       valid_lft forever preferred_lft forever
We know that if we revert to cilium 1.5 our services is working fine. 
Or if we set override --mtu 30000 in cilium-agent daemonset with cilium v1.6.6 (or v1.7.2) our services also back to normal.
```
10.120.8.0/24 via 10.120.4.120 dev cilium_host src 10.120.4.120 mtu 29841
```
Further investigating the issue we found out that actually our services with jumbo payload started failing first in cilium `v1.5.6` it is working fine with cilium `v1.5.5`
Here is `ip  r s` in cilium v1.5.6 that we captured:
```
ip r s
default via 10.16.64.1 dev eth0 proto dhcp src 10.16.65.187 metric 1024 
10.16.64.0/22 dev eth0 proto kernel scope link src 10.16.65.187 
10.16.64.1 dev eth0 proto dhcp scope link src 10.16.65.187 metric 1024 
10.120.0.0/24 via 10.120.8.35 dev cilium_host src 10.120.8.35 
10.120.1.0/24 via 10.120.8.35 dev cilium_host src 10.120.8.35 
10.120.2.0/24 via 10.120.8.35 dev cilium_host src 10.120.8.35 
10.120.4.0/24 via 10.120.8.35 dev cilium_host src 10.120.8.35 
10.120.5.0/24 via 10.120.8.35 dev cilium_host src 10.120.8.35 
```
`ip r s` in cilium v1.5.7 where it broke also:
```
10.120.2.0/24 via 10.120.1.53 dev cilium_host src 10.120.1.53 mtu 8842 
10.120.4.0/24 via 10.120.1.53 dev cilium_host src 10.120.1.53 mtu 8842 
10.120.5.0/24 via 10.120.1.53 dev cilium_host src 10.120.1.53 mtu 8842 
10.120.6.0/24 via 10.120.1.53 dev cilium_host src 10.120.1.53 mtu 8842 
10.120.7.0/24 via 10.120.1.53 dev cilium_host src 10.120.1.53 mtu 8842 
10.120.8.0/24 via 10.120.1.53 dev cilium_host src 10.120.1.53 mtu 8842 
172.17.0.0/16 dev docker0 proto kernel scope link src 172.17.0.1 linkdown 
```

**Comment by tgraf** [comment]
Is it that the MTU is not detected correctly? It doesn't look like you are running with encapsulation enabled. Are you running with encryption enabled which will reduce the MTU to account for overhead?

**Comment by CH-anhngo** [comment]
we did ran with encapsulation assuming this traffic below seem being encrypted 
```
tcpdump -n -i cilium_vxlan
21:11:12.752716 IP 10.120.5.8 > 10.120.2.13: ESP(spi=0x00000001,seq=0xe13), length 4196
21:11:12.752870 IP 10.120.5.8 > 10.120.2.13: ESP(spi=0x00000001,seq=0xe14), length 1684
21:11:12.754468 IP 10.120.2.13 > 10.120.5.8: ESP(spi=0x00000001,seq=0x122e), length 100
```

**Comment by joestringer** [comment]
@CH-anhngo did you mean `v1.6.6 and after`? That's what the description says. Are you implying that v1.6.5 works? Which versions did you try?

**Comment by ch-dimitri** [comment]
@joestringer we initially tried with `v1.6.6` - that's why the initial description has that version in it.  Today, though, we rolled back versions until we noticed things working again.  Starting with a hypothesis that something in https://github.com/cilium/cilium/pull/8949 broke our use case, we tried `v1.5.7` and could reproduce the error.  We then tried `v1.5.6` and again were able to repro.  `v1.5.5` was the first version that tested clean.

**Comment by joestringer** [comment]
We're working through a bisect at the moment to try to pinpoint a specific commit that may have caused this regression.

**Comment by CH-anhngo** [comment]
This is bisect and test build outcome:
```
ad247126626174dd14876fd9128d2316cbb9cc51 is the first bad commit
commit ad247126626174dd14876fd9128d2316cbb9cc51
Author: bob <bob.bouteillier@datadoghq.com>
Date:   Thu Jul 25 19:36:44 2019 +0200
    [daemon] - Change MTU source for cilium_host (Use the Route one)
    [ upstream commit 86f926e816dc871bdd985c82f556644aae58c6d9 ]
    * for pods in hostNetwork the mtu was the same a the default interface.
      Packets were thus dropped once the stream was encrypted.
    Fixes: 1ce278f ("daemon: move IPSec bootstrap into separate function")
    Signed-off-by: Ray Bejjani <ray@isovalent.com>
:040000 040000 d55b9a8f662925e7bc37f55e10a37f5f5904ccbf 48a1f989abf4ba4ef0fa8868e44bf7b5d2fd3d4f M	daemon
```

**Comment by CH-anhngo** [comment]
Also @ch-dimitri figured out that [86f926e](https://github.com/cilium/cilium/commit/86f926e816dc871bdd985c82f556644aae58c6d9) got got reverted in https://github.com/cilium/cilium/pull/8882, but then https://github.com/cilium/cilium/pull/8903 broke our services  in v1.5.7. By syncing up with @jrfastab we understood that the #8903 exists because it fixes an another bug( so it can't simply revert it to fix our use case). That we are up now.

**Comment by errordeveloper** [comment]
@joestringer @tgraf has this concluded offline in some way, in which case an update would be good, or is this still needs addressing?

**Comment by joestringer** [comment]
I think we got as far as to bisect the commit where the regression was introduced, but that commit was fixing another bug so we couldn't just revert it. I don't know if it's still a problem with the latest 1.9.0 release.

**Comment by errordeveloper** [comment]
@CH-anhngo could you test this either with 1.9 or 1.10 please?

**Comment by ch-dimitri** [comment]
I'll see if we can run a test with 1.10 sometime in the next month or so.

**Comment by ti-mo** [comment]
@ch-dimitri @CH-anhngo, any news?

**Comment by ch-dimitri** [comment]
We weren't able to test up to 1.10, but preliminary tests with 1.7.16 look promising. We haven't observed the jumbo packet failures with transparent encryption enabled that we had with 1.5.6 and 1.6.6. But, we have yet to fully roll out the change because inter-version connectivity is broken: nodes running 1.5.4 can't communicate with nodes running 1.7.16, and vise versa. We don't yet know why and are debugging that issue.

**Comment by pchaigno** [comment]
@ch-dimitri Note upgrades from v1.n.x to v1.n+2.y are not supported. So if you're hitting connectivity issues with a cluster of v1.5.4 + v1.7.16, it's not unexpected. Our test don't cover that case. Both of these versions are also deprecated now.

**Comment by ch-dimitri** [comment]
I'm aware, @pchaigno, but as 1.6.6 has the problem described in this issue, we weren't able to do the stepwise upgrade. We're also considering building a new cluster and shifting workloads, but that comes with its own set of concerns.

**Comment by ch-dimitri** [comment]
We did try 1.6.12 now, and that seems to not evidence this issue, but 1.5.4 can't talk to that version, either. Shouldn't 1.5.4 be able to communicate with 1.6.12? If that is so, then we do have a separate issue.

**Comment by ch-dimitri** [comment]
Small-scale rollout of v1.7.16 proved that the jumbo packet failure issue is still present in that version. It's unclear why that didn't show up in our initial tests, but we've been able to reproduce the issue on our test cluster.
