### ISSUE TITLE
L7 CiliumNetworkPolicy: ingress proxy upstream leg never completes — pod's SYN-ACK reaches the veth but not the host stack (1.20.0, kernel 6.1, tunnel/vxlan)

### ISSUE THREAD

**Issue by Jseongwon** [cilium/cilium#47769]
## Is there an existing issue for this?

- [x] I have searched the existing issues

## What happened?

When any L7 `CiliumNetworkPolicy` is attached to an endpoint, the **ingress proxy's upstream leg (Envoy → backend pod) never completes its TCP handshake**, and the affected Service becomes unreachable for as long as the policy exists. Removing the policy restores it instantly.

The downstream leg works correctly: eBPF marks the packet, `iptables` TPROXY redirects it, Envoy's transparent socket accepts it, Envoy parses the HTTP request, and Hubble emits an `http-request FORWARDED` flow. Only the leg **after** that fails.

```
client ──► eBPF mark ──► iptables TPROXY ──► Envoy transparent socket ──► HTTP parse ──► Hubble L7 flow
   OK          OK              OK 36 pkts          OK  cx_total 9            OK             OK
                                                                                             │
                                              Envoy ──► backend pod  ◄──────────────────────┘
                                                 FAIL: SYN sent, pod replies SYN-ACK on the
                                                 lxc veth, but the SYN-ACK never reaches the
                                                 host stack. RST after ~2s. 26/26 = 100%.
```

`envoy_cluster_upstream_cx_connect_timeout{envoy_cluster_name="ingress-cluster"}` equals `envoy_cluster_upstream_cx_total` — **every** upstream connection times out.

Critically, `cilium-dbg monitor --type drop` reports **zero drops**, so the packet is lost silently somewhere between the veth ingress and the host network stack.

This looks closely related to how the ingress proxy's upstream connection is classified in conntrack — see **Possible root cause** below.

### tcpdump — the failing leg, with a working control in the same capture

Captured with `tcpdump -i any -e -n` in the host netns. The full pcap is attached.

**Control — before the policy is applied.** Same source IP, same pod, same veth:

```
12:55:09.853371 lxcc4bd6dbfdc72 Out  10.42.0.213.55556 > 10.42.0.204.9187: Flags [S]
12:55:09.853388 lxcc4bd6dbfdc72 In   10.42.0.204.9187 > 10.42.0.213.55556: Flags [S.]
12:55:09.853414 lxcc4bd6dbfdc72 Out  10.42.0.213.55556 > 10.42.0.204.9187: Flags [.], ack 1
   ^ the ACK goes out, i.e. the host stack received the SYN-ACK. Connection proceeds normally.
```

**Downstream leg with the policy applied — works.** This is the kubelet HTTP readiness probe being TPROXY-redirected into Envoy:

```
12:55:24.853830 cilium_host Out  10.42.0.213.49598 > 10.42.0.204.9187: Flags [S]
12:55:24.853849 lo          In   10.42.0.204.9187 > 10.42.0.213.49598: Flags [S.]
                 ^ Envoy's transparent socket answers on lo, spoofing the pod address
12:55:24.853936 cilium_host Out  10.42.0.213.49598 > 10.42.0.204.9187: Flags [P.], length 110
                 ^ GET /metrics HTTP/1.1
12:55:25.854421 cilium_host Out  ... Flags [F.]   (kubelet timeoutSeconds: 1 gives up)
```

**Upstream leg with the policy applied — fails.** This is Envoy connecting to the backend pod:

```
12:55:24.854560 lxcc4bd6dbfdc72 Out  10.42.0.213.49608 > 10.42.0.204.9187: Flags [S]
12:55:24.854572 lxcc4bd6dbfdc72 In   10.42.0.204.9187 > 10.42.0.213.49608: Flags [S.]
                 ^ the pod answers correctly, the SYN-ACK reaches the veth ...
                 ^ ... and is never seen again. It appears on NEITHER cilium_host NOR lo.
12:55:25.879008 lxcc4bd6dbfdc72 Out  10.42.0.213.49608 > ...: Flags [S]    (retransmit)
12:55:25.879027 lxcc4bd6dbfdc72 In   10.42.0.204.9187 > ...: Flags [S.]
12:55:27.891029 lxcc4bd6dbfdc72 In   10.42.0.204.9187 > ...: Flags [S.]
12:55:27.891099 cilium_host     Out  10.42.0.213.49608 > ...: Flags [R]    (RST, ~3s in)
```

The contrast between the control and the failing leg is the core of this report: **the identical path (same veth, same source IP, same destination pod) works without the policy and drops the SYN-ACK with it.**

### conntrack — only `ProxyRedirect` entries never see return traffic

```
$ cilium-dbg bpf ct list global | grep '10.42.0.204:9187'

# with the L7 policy attached:
TCP IN 10.42.0.213:49598 -> 10.42.0.204:9187 RxFlagsSeen=0x1b TxFlagsSeen=0x00 \
   Flags=0x0051 [ RxClosing SeenNonSyn ProxyRedirect ]
TCP IN 10.42.0.213:53672 -> 10.42.0.204:9187 RxFlagsSeen=0x1b TxFlagsSeen=0x00 \
   Flags=0x0051 [ RxClosing SeenNonSyn ProxyRedirect ]
TCP IN 10.42.0.213:39982 -> 10.42.0.204:9187 RxFlagsSeen=0x1b TxFlagsSeen=0x00 \
   Flags=0x0051 [ RxClosing SeenNonSyn ProxyRedirect ]

# same pod, before the policy was attached:
TCP IN 10.42.0.213:47702 -> 10.42.0.204:9187 RxFlagsSeen=0x1f TxFlagsSeen=0x1a \
   Flags=0x0013 [ RxClosing TxClosing SeenNonSyn ]
TCP IN 10.42.0.213:60840 -> 10.42.0.204:9187 RxFlagsSeen=0x1f TxFlagsSeen=0x1a \
   Flags=0x0013 [ RxClosing TxClosing SeenNonSyn ]
```

Every entry carrying `ProxyRedirect` has `TxFlagsSeen=0x00` — no return traffic ever observed. Every entry without it has `TxFlagsSeen=0x1a`. No exceptions.

### Envoy metrics (read from the Prometheus endpoint on `:9964`)

```
envoy_listener_downstream_cx_total{envoy_listener_address="127.0.0.1_10488"}   9
envoy_http_downstream_cx_total{envoy_http_conn_manager_prefix="proxy"}         9
envoy_http_downstream_rq_total{envoy_http_conn_manager_prefix="proxy"}         9
envoy_http_downstream_rq_rx_reset{envoy_http_conn_manager_prefix="proxy"}      9

envoy_cluster_upstream_cx_total{envoy_cluster_name="ingress-cluster"}          26
envoy_cluster_upstream_cx_connect_fail{envoy_cluster_name="ingress-cluster"}   26
envoy_cluster_upstream_cx_connect_timeout{envoy_cluster_name="ingress-cluster"} 26
```

Envoy accepts and parses fine; 100% of upstream connections time out. The `rx_reset` count reflects the kubelet probe (`timeoutSeconds: 1`) resetting before Envoy's upstream timeout elapses — with a client that waits longer, Envoy returns `503 upstream connect error or disconnect/reset before headers ... connection timeout`.

### Hubble confirms the request reaches L7

```
$ hubble observe --protocol http
Aug  5 12:56:10.856: 10.42.0.213:41478 (host) -> forge/postgres-exporter-...:9187 (ID:54041) \
    http-request FORWARDED (HTTP/1.1 GET http://10.42.0.204:9187/metrics)
```

Because no response is ever produced, `hubble_http_requests_total` stays at zero series — the httpV2 handler only emits on responses. This makes the failure additionally hard to spot from metrics alone.

### Ruled out by measurement

| Hypothesis | How it was checked | Result |
|---|---|---|
| Envoy's listening socket is not `IP_TRANSPARENT` | `ss -lnptOe --inet-sockopt` in the host netns | **transparent is set** on all 4 worker sockets (`fwmark:0xa00`) |
| Proxy port mismatch / stale redirect | `cilium-dbg status --all-redirects`, `iptables-save -t mangle`, Envoy listener dump | all `10488`, exactly one redirect |
| Missing kernel modules | `/proc/modules` | `xt_TPROXY`, `xt_socket`, `nf_tproxy_ipv4/v6`, `nf_socket_ipv4/v6`, `nf_defrag_ipv4/v6` all loaded |
| Envoy / iptables in different netns | `readlink /proc/self/ns/net` | identical (`net:[4026531840]`) |
| Host firewall (ufw) eating proxy traffic | `CILIUM_INPUT` vs `INPUT` policy DROP deltas in a window where TPROXY fired 36 pkts | `CILIUM_INPUT` ACCEPT +43, `INPUT` DROP +3 (background rate). Not ufw. |
| Policy enforcement / default-deny | `enableDefaultDeny: {ingress: false, egress: false}` visibility-only policy | **identical failure** |
| eBPF explicitly dropping | `cilium-dbg monitor --type drop` | 0 drops |
| Kernel rejecting the connection | `nstat`: `ListenDrops`, `ListenOverflows`, `TCPReqQFullDrop`, `TcpAttemptFails` | all unchanged during failure |
| xDS delivery | agent + Envoy logs | `lds: add/update listener 'cilium-http-ingress:10488'` on every attach |
| Standalone vs embedded Envoy | tested both | fails in both (embedded surfaces it as a 503 because clients wait long enough) |
| `rp_filter` | `/proc/sys/net/ipv4/conf/*/rp_filter` | all 0 |
| Leftover CNI from a previous mesh (Linkerd) | `/etc/cni/net.d`, iptables nat, CRDs | clean |

## Cilium Version

```
Client: 1.20.0 450c5314 2026-07-29T08:53:01+02:00 go version go1.26.5 linux/amd64
Daemon: 1.20.0 450c5314 2026-07-29T08:53:01+02:00 go version go1.26.5 linux/amd64
```

cilium-envoy: `quay.io/cilium/cilium-envoy:v1.37.5-1782911245-7cffc778c923f68a77954a53b1a98d6b5353f004`
(`sha256:583057dd4f7d54cd41efff3c413aa0b148ac201f522e2c3336851fa89c78b039`)

Note: Kubernetes 1.36 is only supported by Cilium 1.20, so downgrading to test an earlier minor is not an option here.

## Kernel Version

```
Linux 6.1.0-50-amd64 x86_64 GNU/Linux   (Debian 12)
```

## Kubernetes Version

```
Client Version: v1.36.2+k3s1
Server Version: v1.36.2+k3s1
```

Single node, 4 vCPU / 31 GiB.

## Relevant configuration

```
kube-proxy-replacement       true
routing-mode                 tunnel
tunnel-protocol              vxlan
datapath-mode                veth
ipam                         cluster-pool
identity-allocation-mode     crd
enable-l7-proxy              true
external-envoy-proxy         true         # standalone cilium-envoy DaemonSet (also reproduced with embedded)
envoy-xds-mode               ads
bpf-lb-sock                  false
enable-ipv4-masquerade       true
enable-bpf-masquerade        (unset)      # also reproduced with this set to true
enable-host-legacy-routing   (unset)
enable-endpoint-routes       (unset)
devices                      (auto)       # also reproduced pinned to a single device
enable-ipv6                  false
```

`cilium-dbg status`:

```
KubeProxyReplacement:  True [enp3s0 192.168.219.100 (Direct Routing), tailscale0 100.118.42.102]
Routing:               Network: Tunnel [vxlan]   Host: Legacy
Masquerading:          IPTables [IPv4: Enabled, IPv6: Disabled]
Proxy Status:          OK, ip 10.42.0.213, 1 redirects active on ports 10000-20000, Envoy: external
Controller Status:     283/283 healthy
```

## How can we reproduce the issue?

**Pick a target that actually receives HTTP traffic.** This matters — I initially used a Service whose readinessProbe was `tcpSocket`, saw `downstream_cx_total = 0`, and wrongly concluded that Envoy was never receiving connections. It was simply never being sent any HTTP. Here I use a `postgres-exporter` whose readinessProbe is `httpGet /metrics` and which is scraped by Prometheus, so requests flow continuously.

**1. Baseline**

```bash
kubectl -n forge run probe --rm -i --restart=Never --image=curlimages/curl:8.5.0 -- \
  -sS --max-time 8 -o /dev/null -w "HTTP %{http_code} connect %{time_connect}s\n" \
  http://postgres-exporter:9187/metrics
# HTTP 200 connect 0.000613s
```

**2. Attach a visibility-only L7 policy** (no enforcement — `enableDefaultDeny` disabled in both directions, so this changes nothing except turning on L7 parsing)

```yaml
apiVersion: cilium.io/v2
kind: CiliumNetworkPolicy
metadata:
  name: l7-vis-postgres-exporter
  namespace: forge
spec:
  endpointSelector:
    matchLabels:
      app: postgres-exporter
  enableDefaultDeny:
    ingress: false
    egress: false
  ingress:
    - fromEntities:
        - all
      toPorts:
        - ports:
            - port: "9187"
              protocol: TCP
          rules:
            http:
              - {}
```

**3. Observe**

```bash
# the redirect and listener come up cleanly
kubectl -n kube-system exec ds/cilium -c cilium-agent -- cilium-dbg status --all-redirects | grep -A2 'Proxy Port'
#   cilium-http-ingress   856:ingress:TCP:9187:   10488
kubectl -n kube-system logs ds/cilium-envoy | grep lds
#   lds: add/update listener 'cilium-http-ingress:10488'

# Envoy accepts and parses, but every upstream connection times out
curl -s http://127.0.0.1:9964/metrics | grep -E 'ingress-cluster.*(connect_fail|connect_timeout|cx_total)'

# conntrack: ProxyRedirect entries never see return traffic
kubectl -n kube-system exec ds/cilium -c cilium-agent -- cilium-dbg bpf ct list global | grep ProxyRedirect

# no eBPF drops are reported
kubectl -n kube-system exec ds/cilium -c cilium-agent -- cilium-dbg monitor --type drop
```

The Service is unreachable for as long as the policy exists; the pod goes `0/1` because its HTTP readiness probe now fails.

**4. Remove the policy — recovery is immediate** (`HTTP 200`, ~0.6 ms).

Reproduced 100% of the time across many attempts, on `admin-front:3000` and `postgres-exporter:9187`, with standalone and embedded Envoy, with and without `bpf.masquerade`, with `devices` auto-detected and pinned.

### Capturing the packet trace

The node's `ss` was too old for `--inet-sockopt` (iproute2 6.1.0; the option needs 6.4+), so I ran the socket and packet inspection from a netshoot pod sharing the host netns:

```bash
kubectl -n kube-system run netshoot-diag --image=nicolaka/netshoot --restart=Never \
  --overrides='{"spec":{"hostNetwork":true,"hostPID":true,
    "containers":[{"name":"netshoot","image":"nicolaka/netshoot","command":["sleep","3600"],
    "securityContext":{"privileged":true}}]}}'

kubectl -n kube-system exec netshoot-diag -- \
  tcpdump -i any -e -n "tcp port 9187 or tcp portrange 10000-20000" -w /tmp/l7.pcap
```

One note for anyone else chasing this: `tcpdump port 10488` will **always** be empty. TPROXY hands the packet to the socket without rewriting the destination, so no packet ever carries `127.0.0.1:10488` as an address. I lost time on this assumption.

## Possible root cause

I have not confirmed this in the datapath code, and I would appreciate a maintainer pointing me at the right place — I am happy to write the fix once the code path is identified.

**The ingress proxy's upstream connection is 5-tuple-shaped like the downstream connection it is serving, and the return traffic appears to be classified as proxy-redirect traffic a second time.**

Because `cilium-envoy` runs in the host netns, its upstream connection to the backend uses the `cilium_host` address as source. In this cluster that is `10.42.0.213`, which is also the source address of the host-originated traffic being proxied. So both legs look like:

```
downstream (client → proxy):   10.42.0.213:49598 → 10.42.0.204:9187
upstream   (proxy → backend):  10.42.0.213:49608 → 10.42.0.204:9187
```

They differ only in source port. Both create `TCP IN` conntrack entries toward the same `dst:dport`, and in the captured state **both** carry the `ProxyRedirect` flag while neither records any return traffic (`TxFlagsSeen=0x00`).

My working hypothesis is that when the pod's SYN-ACK enters `from-container` on the lxc veth, the reverse-direction CT lookup matches an entry marked `ProxyRedirect` and the packet is steered toward the proxy instead of being delivered to the host stack where Envoy's client socket is waiting. That would explain every observation at once:

- the SYN-ACK is visible on the veth but on neither `cilium_host` nor `lo`
- no drop is reported (the packet is redirected, not dropped)
- kernel TCP rejection counters stay flat (it is non-delivery, not refusal)
- the downstream leg is unaffected (it is the direction the redirect is meant for)
- removing the policy — and with it the `ProxyRedirect` classification — fixes it instantly

If that is right, the fix would live in how Envoy's upstream socket mark (`MARK_MAGIC_PROXY_INGRESS`, `0xa00`, which `ss` confirms is set on the listening socket) is expected to exempt the connection from re-redirection, and why that exemption is not taking effect on the return path here. It is possible this only manifests in the specific combination below, which is why I have listed it explicitly:

- `routing-mode: tunnel` (vxlan) **combined with** `KubeProxyReplacement` reporting `Direct Routing`
- `enable-bpf-masquerade` unset, so `Routing: Host: Legacy` and `Masquerading: IPTables` — an unusual pairing with `kube-proxy-replacement: true`. I also reproduced it with `bpf.masquerade: true` (`Host: BPF`), so this does not appear to be the trigger, but the two paths differ enough to be worth checking.
- `bpf-lb-sock: false`

Happy to run any additional instrumentation on this cluster — it is a lab node and I can attach the policy and break it at will.

## Anything else?

**Attachments** (I will attach these to the issue directly):

- `cilium-sysdump-during-failure.zip` — sysdump taken **while the policy was attached and failing**, so it contains the failing CT entries and Envoy stats
- `l7-upstream-leg-failure.pcap` — the full `tcpdump -i any -e` capture containing both the working control and the failing upstream leg

**Impact.** L7 features are unusable on this cluster: no L7 policy, and no `hubble_http_*` metrics, since requests never produce responses. Attaching a policy to get metrics takes the Service down, and the only status code it would ever record is `503`. L3/L4 policy, flow visibility, `hubble_flows_processed_total`, `hubble_tcp_flags_total` and the service map all work normally.

**Comment by Jseongwon** [comment]
### Follow-up: controlled A/B between standalone and embedded Envoy — the deployment mode is not a factor

Preempting the likely first question. In the original report I noted that both modes fail, but that claim rested on observations taken days apart with different instrumentation. I have now run both back-to-back against the same canary (`postgres-exporter:9187`, `httpGet` readinessProbe) with identical measurements, so this is a controlled comparison.

Switching modes is `envoy.enabled: true` → `false` in the Helm values (deleting the standalone DaemonSet first so the agent can claim `hostPort: 9964`).

| | standalone (`envoy.enabled: true`) | embedded (`envoy.enabled: false`) |
|---|---|---|
| proxy port | 10488 | 17854 (dynamically allocated) |
| `envoy_listener_downstream_cx_total` | 9 | 7 |
| `envoy_http_downstream_rq_total{prefix="proxy"}` | 9 | 7 |
| `envoy_http_downstream_rq_rx_reset{prefix="proxy"}` | 9 | 7 |
| `envoy_cluster_upstream_cx_total{ingress-cluster}` | 26 | 7 |
| `envoy_cluster_upstream_cx_connect_fail{ingress-cluster}` | 26 | 7 |
| `envoy_cluster_upstream_cx_connect_timeout{ingress-cluster}` | **26 / 26 = 100%** | **7 / 7 = 100%** |
| conntrack | `ProxyRedirect` entries have `TxFlagsSeen=0x00` | identical |
| Hubble | `http-request FORWARDED` emitted | identical |
| `hubble_http_*` series | 0 | 0 |
| pod→svc probe | `connect 0.000000s`, fails | identical |
| `cilium-dbg monitor --type drop` | 0 drops | 0 drops |

The absolute counts differ only because the observation windows differed in length; the failure rate is 100% in both. Every qualitative signal is the same: Envoy accepts the connection and parses the request, and every upstream connection to the backend pod times out.

So the split-lifecycle DaemonSet is not involved, and neither is xDS delivery — the embedded agent builds the listener in-process and the outcome is unchanged.

Two incidental notes from the switch, in case they are useful:

- **Embedded starts Envoy lazily.** With no L7 redirect present, nothing listens on `:9964` and `cilium-dbg envoy admin ...` returns `dial unix /var/run/cilium/envoy/sockets/admin.sock: connect: connection refused`. It is easy to misread this as a crashed Envoy. It comes up as soon as the first redirect is installed.
- **Leftovers after switching to embedded.** `cilium-envoy-config` (ConfigMap), `cilium-envoy` (Service) and `cilium-envoy` (ServiceAccount) stay behind; the chart no longer renders them, so with pruning disabled they linger and show as OutOfSync in ArgoCD.

The cluster is otherwise healthy in both modes (`278/278` controllers healthy, all workloads Ready, external connectivity fine) — the only thing that breaks is any Service carrying an L7 policy.

I am happy to run further instrumentation on request; this is a lab node and I can reproduce on demand.

**Comment by squeed** [comment]
I see you're running tailscale on the node. This is a known [source of problems](https://github.com/cilium/cilium/issues/36104) due to packet mark conflicts.

Can you try and reproduce on a node without tailscale
