### ISSUE TITLE
Geneve DSR load balancer mode does not work for TCP

### ISSUE THREAD

**Issue by stevefan1999-personal** [cilium/cilium#33609]
### Is there an existing issue for this?

- [X] I have searched the existing issues

### What happened?

I just made a new Node IPAM load balancer using Geneve in DSR mode as advertised in the documentation. I noticed that if I have `externalTrafficPolicy: Local`, then I won't have any incoming traffic at all, although I think this would be a separate issue. 

If I change it to `externalTrafficPolicy: Cluster`, there is a connection, but the whole connection stuck without any I/O until connection reset.

I'm running Cilium behind a Wireguard connection because my homelab does not have a public IP that can be listened to. So, I made a Wireguard network to my VPS and then I used the `CiliumLoadBalancerIPPool` to expose the mail server as a load balancer using that public IP from the VPS (plus the Egress policy set to use that VPS to have complete traffic relay), I have even set it up this way correctly:
```
apiVersion: cilium.io/v2alpha1
kind: CiliumLoadBalancerIPPool
metadata:
  name: vps-ip
spec:
  blocks:
    - cidr: 206.XXX.YYY.ZZZ/32
```
And if the load balancer is in SNAT mode, I can access 206.XXX.YYY.ZZZ to my mail server, but obviously I won't get the correct client IP address rendering the email server in an open relay setup (since it is resolved as internal IP). I'm not sure what to do now.

### Cilium Version

1.15.6

### Kernel Version

Talos Linux 1.6.5

### Kubernetes Version

v1.30.0

### Anything else?

Helm config
```
kubeProxyReplacement: true
bandwidthManager:
  bbr: true
  enabled: true
bpf:
  masquerade: true
  tproxy: true
cluster:
  name: kubehyper
egressGateway:
  enabled: true
gatewayAPI:
  enabled: false
hubble:
  relay:
    enabled: true
  ui:
    enabled: true
ingressController:
  enabled: false
ipMasqAgent:
  enabled: true
ipv6:
  enabled: false
nodeIPAM:
  enabled: true
sctp:
  enabled: true
tunnelProtocol: geneve
k8sServiceHost: localhost
k8sServicePort: 7445
loadBalancer:
  algorithm: maglev
  dsrDispatch: geneve
  mode: snat # depends, okay with snat, fails with dsr
routingMode: tunnel
operator:
  replicas: 3
securityContext:
  capabilities:
    ciliumAgent: [CHOWN, KILL, NET_ADMIN, NET_RAW, IPC_LOCK, SYS_ADMIN, SYS_RESOURCE, DAC_OVERRIDE, FOWNER, SETGID, SETUID]
    cleanCiliumState: [NET_ADMIN, SYS_ADMIN, SYS_RESOURCE]
cgroup:
  autoMount:
    enabled: false
  hostRoot: /sys/fs/cgroup
```

### Cilium Users Document

- [X] Are you a user of Cilium? Please add yourself to the [Users doc](https://github.com/cilium/cilium/blob/main/USERS.md)

### Code of Conduct

- [X] I agree to follow this project's Code of Conduct

**Comment by stevefan1999-personal** [comment]
My game server experiment shows that all my servers based on UDP won't have this issue, and the client source IP address is correctly resolved under Geneve DSR mode. It is TCP mode however having the connection stuck for some reason.

**Comment by stevefan1999-personal** [comment]
"daemon creation failed: BPF masquerading to route source (--enable-masquerade-to-route-source=\"true\") currently not supported with BPF-based masquerading (--enable-bpf-masquerade=\"true\")"

Huh...

**Comment by stevefan1999-personal** [comment]
I did an IRL check with WireShark, here's the request to LB with DSR
![image](https://github.com/user-attachments/assets/4009fb9b-81a1-4f62-bd0d-88dec94024f1)
Here's the request to LB with SNAT
![image](https://github.com/user-attachments/assets/ab5229f9-5b94-46af-9bc6-1e542bf4585d)

**Comment by stevefan1999-personal** [comment]
# SNAT 

tcpdump of cilium_geneve on the node that hosted the mail server pod:
```
18:09:19.369576 IP (tos 0x0, ttl 118, id 44016, offset 0, flags [DF], proto TCP (6), length 52)
    10.243.139.190.62327 > 10.240.9.152.submissions: Flags [S], cksum 0xa96d (correct), seq 1720110851, win 62258, options [mss 536,nop,wscale 8,nop,nop,sackOK], length 0
18:09:19.369628 IP (tos 0x0, ttl 64, id 0, offset 0, flags [DF], proto TCP (6), length 52)
    10.240.9.152.submissions > 10.243.139.190.62327: Flags [S.], cksum 0xab5f (incorrect -> 0xc4e0), seq 645902441, ack 1720110852, win 64860, options [mss 1410,nop,nop,sackOK,nop,wscale 7], length 0
18:09:19.387951 IP (tos 0x0, ttl 118, id 44017, offset 0, flags [DF], proto TCP (6), length 40)
    10.243.139.190.62327 > 10.240.9.152.submissions: Flags [.], cksum 0xfedc (correct), seq 1, ack 1, win 1025, length 0
18:09:19.388594 IP (tos 0x0, ttl 118, id 44018, offset 0, flags [DF], proto TCP (6), length 122)
    10.243.139.190.62327 > 10.240.9.152.submissions: Flags [P.], cksum 0xdbf7 (correct), seq 1:83, ack 1, win 1025, length 82
18:09:19.388628 IP (tos 0x0, ttl 64, id 17689, offset 0, flags [DF], proto TCP (6), length 40)
    10.240.9.152.submissions > 10.243.139.190.62327: Flags [.], cksum 0xab53 (incorrect -> 0x0091), seq 1, ack 83, win 507, length 0
18:09:19.400408 IP (tos 0x0, ttl 64, id 17690, offset 0, flags [DF], proto TCP (6), length 40)
    10.240.9.152.submissions > 10.243.139.190.62327: Flags [F.], cksum 0xab53 (incorrect -> 0x0090), seq 1, ack 83, win 507, length 0
18:09:19.414582 IP (tos 0x0, ttl 118, id 44019, offset 0, flags [DF], proto TCP (6), length 40)
    10.243.139.190.62327 > 10.240.9.152.submissions: Flags [.], cksum 0xfe89 (correct), seq 83, ack 2, win 1025, length 0
18:09:19.416129 IP (tos 0x0, ttl 118, id 44020, offset 0, flags [DF], proto TCP (6), length 40)
    10.243.139.190.62327 > 10.240.9.152.submissions: Flags [F.], cksum 0xfe88 (correct), seq 83, ack 2, win 1025, length 0
18:09:19.416171 IP (tos 0x0, ttl 64, id 0, offset 0, flags [DF], proto TCP (6), length 40)
    10.240.9.152.submissions > 10.243.139.190.62327: Flags [.], cksum 0x008f (correct), seq 2, ack 84, win 507, length 0
``` 
tcpdump of cilium_geneve on the node that the load balancer is hosted that connects to the target pod:
```
reading from file -, link-type EN10MB (Ethernet), snapshot length 4096
18:11:27.740698 IP (tos 0x0, ttl 118, id 44021, offset 0, flags [DF], proto TCP (6), length 52)
    10.243.139.190.62787 > 10.240.9.152.submissions: Flags [S], cksum 0x103f (correct), seq 2353545380, win 62258, options [mss 536,nop,wscale 8,nop,nop,sackOK], length 0
18:11:27.746795 IP (tos 0x0, ttl 64, id 0, offset 0, flags [DF], proto TCP (6), length 52)
    10.240.9.152.submissions > 10.243.139.190.62787: Flags [S.], cksum 0xa81f (correct), seq 1827794313, ack 2353545381, win 64860, options [mss 1410,nop,nop,sackOK,nop,wscale 7], length 0
18:11:27.752287 IP (tos 0x0, ttl 118, id 44022, offset 0, flags [DF], proto TCP (6), length 40)
    10.243.139.190.62787 > 10.240.9.152.submissions: Flags [.], cksum 0xe21b (correct), seq 1, ack 1, win 1025, length 0
18:11:27.753682 IP (tos 0x0, ttl 118, id 44023, offset 0, flags [DF], proto TCP (6), length 122)
    10.243.139.190.62787 > 10.240.9.152.submissions: Flags [P.], cksum 0xbf36 (correct), seq 1:83, ack 1, win 1025, length 82
18:11:27.759755 IP (tos 0x0, ttl 64, id 39092, offset 0, flags [DF], proto TCP (6), length 40)
    10.240.9.152.submissions > 10.243.139.190.62787: Flags [.], cksum 0xe3cf (correct), seq 1, ack 83, win 507, length 0
18:11:27.773097 IP (tos 0x0, ttl 64, id 39093, offset 0, flags [DF], proto TCP (6), length 40)
    10.240.9.152.submissions > 10.243.139.190.62787: Flags [F.], cksum 0xe3ce (correct), seq 1, ack 83, win 507, length 0
18:11:27.778314 IP (tos 0x0, ttl 118, id 44024, offset 0, flags [DF], proto TCP (6), length 40)
    10.243.139.190.62787 > 10.240.9.152.submissions: Flags [.], cksum 0xe1c8 (correct), seq 83, ack 2, win 1025, length 0
18:11:27.779591 IP (tos 0x0, ttl 118, id 44025, offset 0, flags [DF], proto TCP (6), length 40)
    10.243.139.190.62787 > 10.240.9.152.submissions: Flags [F.], cksum 0xe1c7 (correct), seq 83, ack 2, win 1025, length 0
18:11:27.787552 IP (tos 0x0, ttl 64, id 0, offset 0, flags [DF], proto TCP (6), length 40)
    10.240.9.152.submissions > 10.243.139.190.62787: Flags [.], cksum 0xe3cd (correct), seq 2, ack 84, win 507, length 0
```

**Comment by stevefan1999-personal** [comment]
# Geneve DSR

tcpdump of cilium_geneve on the node that hosted the mail server pod:
```
reading from file -, link-type EN10MB (Ethernet), snapshot length 4096
18:18:49.788674 IP (tos 0x0, ttl 119, id 44112, offset 0, flags [DF], proto TCP (6), length 52)
    <MY OWN ISP IP>.ctinets.com.61579 > 10.240.9.152.submissions: Flags [S], cksum 0xf8dd (correct), seq 3162704892, win 62258, options [mss 536,nop,wscale 8,nop,nop,sackOK], length 0
```

tcpdump of cilium_geneve on the node that the load balancer is hosted that connects to the target pod:
```
reading from file -, link-type EN10MB (Ethernet), snapshot length 4096
18:18:49.755979 IP (tos 0x0, ttl 119, id 44112, offset 0, flags [DF], proto TCP (6), length 52)
    <MY OWN ISP IP>.ctinets.com.61579 > 10.240.9.152.submissions: Flags [S], cksum 0xf8dd (correct), seq 3162704892, win 62258, options [mss 536,nop,wscale 8,nop,nop,sackOK], length 0
```

Looks like there is no respond...?

**Comment by stevefan1999-personal** [comment]
Is the MTU really correct for TCP though...

**Comment by stevefan1999-personal** [comment]
There's more, I have checked on the host interface of the node that hosted the pod (this time a game server on port 25565), here's what I got:
```
reading from file -, link-type EN10MB (Ethernet), snapshot length 4096
19:17:58.928626 IP (tos 0x0, ttl 62, id 0, offset 0, flags [DF], proto TCP (6), length 60)
    <Load Balancer Server IP>.25565 > <Third Party Client IP>.58468: Flags [S.], cksum 0x28da (correct), seq 440089612, ack 4104243680, win 64308, options [mss 1410,sackOK,TS val 110442570 ecr 1520752668,nop,wscale 7], length 0
19:18:02.796539 IP (tos 0x0, ttl 62, id 0, offset 0, flags [DF], proto TCP (6), length 48)
    <Load Balancer Server IP>.25565 > 51.75.66.201.1001: Flags [S.], cksum 0x9925 (correct), seq 2743871116, ack 2717961258, win 64860, options [mss 1410,nop,nop,sackOK], length 0
19:18:07.010743 IP (tos 0x0, ttl 62, id 0, offset 0, flags [DF], proto TCP (6), length 60)
    <Load Balancer Server IP>.25565 > <Third Party Client IP>.58468: Flags [S.], cksum 0x0948 (correct), seq 440089612, ack 4104243680, win 64308, options [mss 1410,sackOK,TS val 110450652 ecr 1520752668,nop,wscale 7], length 0
19:18:08.908628 IP (tos 0x0, ttl 62, id 0, offset 0, flags [DF], proto TCP (6), length 48)
    <Load Balancer Server IP>.25565 > 51.75.66.201.1001: Flags [S.], cksum 0x9925 (correct), seq 2743871116, ack 2717961258, win 64860, options [mss 1410,nop,nop,sackOK], length 0
19:18:13.218923 IP (tos 0x0, ttl 62, id 0, offset 0, flags [DF], proto TCP (6), length 60)
    <Load Balancer Server IP>.25565 > <Third Party Client IP>.38992: Flags [S.], cksum 0xcc56 (correct), seq 708622976, ack 4013035055, win 64308, options [mss 1410,sackOK,TS val 110456860 ecr 1520794508,nop,wscale 7], length 0
19:18:14.224595 IP (tos 0x0, ttl 62, id 0, offset 0, flags [DF], proto TCP (6), length 60)
    <Load Balancer Server IP>.25565 > <Third Party Client IP>.38992: Flags [S.], cksum 0xc868 (correct), seq 708622976, ack 4013035055, win 64308, options [mss 1410,sackOK,TS val 110457866 ecr 1520794508,nop,wscale 7], length 0
19:18:16.294105 IP (tos 0x0, ttl 62, id 0, offset 0, flags [DF], proto TCP (6), length 60)
    <Load Balancer Server IP>.25565 > <Third Party Client IP>.38992: Flags [S.], cksum 0xc053 (correct), seq 708622976, ack 4013035055, win 64308, options [mss 1410,sackOK,TS val 110459935 ecr 1520794508,nop,wscale 7], length 0
19:18:17.100594 IP (tos 0x0, ttl 62, id 0, offset 0, flags [DF], proto TCP (6), length 48)
    <Load Balancer Server IP>.25565 > 51.75.66.201.1001: Flags [S.], cksum 0x9925 (correct), seq 2743871116, ack 2717961258, win 64860, options [mss 1410,nop,nop,sackOK], length 0
19:18:17.313813 IP (tos 0x0, ttl 62, id 0, offset 0, flags [DF], proto TCP (6), length 60)
    <Load Balancer Server IP>.25565 > <Third Party Client IP>.38992: Flags [S.], cksum 0xbc57 (correct), seq 708622976, ack 4013035055, win 64308, options [mss 1410,sackOK,TS val 110460955 ecr 1520794508,nop,wscale 7], length 0
19:18:18.337976 IP (tos 0x0, ttl 62, id 0, offset 0, flags [DF], proto TCP (6), length 60)
    <Load Balancer Server IP>.25565 > <Third Party Client IP>.38992: Flags [S.], cksum 0xb857 (correct), seq 708622976, ack 4013035055, win 64308, options [mss 1410,sackOK,TS val 110461979 ecr 1520794508,nop,wscale 7], length 0
19:18:20.353849 IP (tos 0x0, ttl 62, id 0, offset 0, flags [DF], proto TCP (6), length 60)
    <Load Balancer Server IP>.25565 > <Third Party Client IP>.38992: Flags [S.], cksum 0xb077 (correct), seq 708622976, ack 4013035055, win 64308, options [mss 1410,sackOK,TS val 110463995 ecr 1520794508,nop,wscale 7], length 0
19:18:22.380556 IP (tos 0x0, ttl 62, id 0, offset 0, flags [DF], proto TCP (6), length 60)
    <Load Balancer Server IP>.25565 > <Third Party Client IP>.38992: Flags [S.], cksum 0xa88c (correct), seq 708622976, ack 4013035055, win 64308, options [mss 1410,sackOK,TS val 110466022 ecr 1520794508,nop,wscale 7], length 0
19:18:23.244612 IP (tos 0x0, ttl 62, id 0, offset 0, flags [DF], proto TCP (6), length 60)
    <Load Balancer Server IP>.25565 > <Third Party Client IP>.58468: Flags [S.], cksum 0xc9dd (correct), seq 440089612, ack 4104243680, win 64308, options [mss 1410,sackOK,TS val 110466886 ecr 1520752668,nop,wscale 7], length 0
19:18:24.418069 IP (tos 0x0, ttl 62, id 0, offset 0, flags [DF], proto TCP (6), length 60)
    <Load Balancer Server IP>.25565 > <Third Party Client IP>.38992: Flags [S.], cksum 0xa097 (correct), seq 708622976, ack 4013035055, win 64308, options [mss 1410,sackOK,TS val 110468059 ecr 1520794508,nop,wscale 7], length 0
```

This is pcaped from the load balancer server:
```
reading from file -, link-type EN10MB (Ethernet), snapshot length 4096
19:18:01.783870 IP (tos 0x0, ttl 46, id 1, offset 0, flags [DF], proto TCP (6), length 48)
    51.75.66.201.1001 > <Load Balancer Server IP>.25565: Flags [S], cksum 0xe079 (correct), seq 2717961257, win 32768, options [mss 1460,nop,nop,sackOK], length 0
19:18:07.007615 IP (tos 0x0, ttl 55, id 42618, offset 0, flags [DF], proto TCP (6), length 60)
    <Third Party Client IP>.58468 > <Load Balancer Server IP>.25565: Flags [S], cksum 0x32f3 (correct), seq 4104243679, win 64240, options [mss 1460,sackOK,TS val 1520788300 ecr 0,nop,wscale 7], length 0
19:18:14.238911 IP (tos 0x0, ttl 55, id 5520, offset 0, flags [DF], proto TCP (6), length 60)
    <Third Party Client IP>.38992 > <Load Balancer Server IP>.25565: Flags [S], cksum 0x23e8 (correct), seq 4013035054, win 64240, options [mss 1460,sackOK,TS val 1520795532 ecr 0,nop,wscale 7], length 0
19:18:17.310808 IP (tos 0x0, ttl 55, id 5523, offset 0, flags [DF], proto TCP (6), length 60)
    <Third Party Client IP>.38992 > <Load Balancer Server IP>.25565: Flags [S], cksum 0x17e8 (correct), seq 4013035054, win 64240, options [mss 1460,sackOK,TS val 1520798604 ecr 0,nop,wscale 7], length 0
19:18:18.334903 IP (tos 0x0, ttl 55, id 5524, offset 0, flags [DF], proto TCP (6), length 60)
    <Third Party Client IP>.38992 > <Load Balancer Server IP>.25565: Flags [S], cksum 0x13e8 (correct), seq 4013035054, win 64240, options [mss 1460,sackOK,TS val 1520799628 ecr 0,nop,wscale 7], length 0
19:18:24.414988 IP (tos 0x0, ttl 55, id 5526, offset 0, flags [DF], proto TCP (6), length 60)
    <Third Party Client IP>.38992 > <Load Balancer Server IP>.25565: Flags [S], cksum 0xfc27 (correct), seq 4013035054, win 64240, options [mss 1460,sackOK,TS val 1520805708 ecr 0,nop,wscale 7], length 0
19:18:32.607119 IP (tos 0x0, ttl 55, id 5527, offset 0, flags [DF], proto TCP (6), length 60)
    <Third Party Client IP>.38992 > <Load Balancer Server IP>.25565: Flags [S], cksum 0xdc27 (correct), seq 4013035054, win 64240, options [mss 1460,sackOK,TS val 1520813900 ecr 0,nop,wscale 7], length 0
```

I ran `curl <Load Balancer IP>:25565 -v` on the third-party client that has direct IP rather than masqueraded behind a home router.

Please ignore 51.75.66.201

**Comment by stevefan1999-personal** [comment]
This is looking sus:
```
root@backup:~# tcpdump -vvvnnn '(src <Homelab Network IP> or dst <Homelab Network IP> or src <Load Balancer Server IP> or dst <Load Balancer Server IP>) and not (port 22 or port 8007 or port 3260)'
tcpdump: listening on enp1s0, link-type EN10MB (Ethernet), snapshot length 262144 bytes
20:10:16.352980 IP (tos 0x0, ttl 64, id 25731, offset 0, flags [DF], proto TCP (6), length 60)
    <Third Party Client IP>.59984 > <Load Balancer Server IP>.25565: Flags [S], cksum 0x5405 (incorrect -> 0x8d20), seq 1162860748, win 64240, options [mss 1460,sackOK,TS val 746509135 ecr 0,nop,wscale 7], length 0
20:10:17.313553 IP (tos 0x0, ttl 64, id 55941, offset 0, flags [DF], proto TCP (6), length 60)
    <Third Party Client IP>.33338 > <Load Balancer Server IP>.25565: Flags [S], cksum 0x5405 (incorrect -> 0xf130), seq 1755166148, win 64240, options [mss 1460,sackOK,TS val 746510095 ecr 0,nop,wscale 7], length 0
20:10:18.336970 IP (tos 0x0, ttl 64, id 55942, offset 0, flags [DF], proto TCP (6), length 60)
    <Third Party Client IP>.33338 > <Load Balancer Server IP>.25565: Flags [S], cksum 0x5405 (incorrect -> 0xed30), seq 1755166148, win 64240, options [mss 1460,sackOK,TS val 746511119 ecr 0,nop,wscale 7], length 0
20:10:19.360961 IP (tos 0x0, ttl 64, id 55943, offset 0, flags [DF], proto TCP (6), length 60)
    <Third Party Client IP>.33338 > <Load Balancer Server IP>.25565: Flags [S], cksum 0x5405 (incorrect -> 0xe930), seq 1755166148, win 64240, options [mss 1460,sackOK,TS val 746512143 ecr 0,nop,wscale 7], length 0
20:10:20.384963 IP (tos 0x0, ttl 64, id 55944, offset 0, flags [DF], proto TCP (6), length 60)
    <Third Party Client IP>.33338 > <Load Balancer Server IP>.25565: Flags [S], cksum 0x5405 (incorrect -> 0xe530), seq 1755166148, win 64240, options [mss 1460,sackOK,TS val 746513167 ecr 0,nop,wscale 7], length 0
20:10:21.408969 IP (tos 0x0, ttl 64, id 55945, offset 0, flags [DF], proto TCP (6), length 60)
    <Third Party Client IP>.33338 > <Load Balancer Server IP>.25565: Flags [S], cksum 0x5405 (incorrect -> 0xe130), seq 1755166148, win 64240, options [mss 1460,sackOK,TS val 746514191 ecr 0,nop,wscale 7], length 0
20:10:22.432967 IP (tos 0x0, ttl 64, id 55946, offset 0, flags [DF], proto TCP (6), length 60)
    <Third Party Client IP>.33338 > <Load Balancer Server IP>.25565: Flags [S], cksum 0x5405 (incorrect -> 0xdd30), seq 1755166148, win 64240, options [mss 1460,sackOK,TS val 746515215 ecr 0,nop,wscale 7], length 0
20:10:24.448970 IP (tos 0x0, ttl 64, id 55947, offset 0, flags [DF], proto TCP (6), length 60)
    <Third Party Client IP>.33338 > <Load Balancer Server IP>.25565: Flags [S], cksum 0x5405 (incorrect -> 0xd550), seq 1755166148, win 64240, options [mss 1460,sackOK,TS val 746517231 ecr 0,nop,wscale 7], length 0
20:10:28.640965 IP (tos 0x0, ttl 64, id 55948, offset 0, flags [DF], proto TCP (6), length 60)
    <Third Party Client IP>.33338 > <Load Balancer Server IP>.25565: Flags [S], cksum 0x5405 (incorrect -> 0xc4f0), seq 1755166148, win 64240, options [mss 1460,sackOK,TS val 746521423 ecr 0,nop,wscale 7], length 0
20:10:36.832978 IP (tos 0x0, ttl 64, id 55949, offset 0, flags [DF], proto TCP (6), length 60)
    <Third Party Client IP>.33338 > <Load Balancer Server IP>.25565: Flags [S], cksum 0x5405 (incorrect -> 0xa4f0), seq 1755166148, win 64240, options [mss 1460,sackOK,TS val 746529615 ecr 0,nop,wscale 7], length 0
```
This is on my home router:
```
20:10:17.319418 IP (tos 0x0, ttl 62, id 0, offset 0, flags [DF], proto TCP (6), length 60)
    <Load Balancer Server IP>.25565 > <Third Party Client IP>.33338: Flags [S.], cksum 0x23b0 (correct), seq 2412780328, ack 1755166149, win 64308, options [mss 1410,sackOK,TS val 113580960 ecr 746510095,nop,wscale 7], length 0
20:10:18.342334 IP (tos 0x0, ttl 62, id 0, offset 0, flags [DF], proto TCP (6), length 60)
    <Load Balancer Server IP>.25565 > <Third Party Client IP>.33338: Flags [S.], cksum 0x1fb1 (correct), seq 2412780328, ack 1755166149, win 64308, options [mss 1410,sackOK,TS val 113581983 ecr 746510095,nop,wscale 7], length 0
20:10:19.366294 IP (tos 0x0, ttl 62, id 0, offset 0, flags [DF], proto TCP (6), length 60)
    <Load Balancer Server IP>.25565 > <Third Party Client IP>.33338: Flags [S.], cksum 0x1bb1 (correct), seq 2412780328, ack 1755166149, win 64308, options [mss 1410,sackOK,TS val 113583007 ecr 746510095,nop,wscale 7], length 0
20:10:20.393482 IP (tos 0x0, ttl 62, id 0, offset 0, flags [DF], proto TCP (6), length 60)
    <Load Balancer Server IP>.25565 > <Third Party Client IP>.33338: Flags [S.], cksum 0x17ae (correct), seq 2412780328, ack 1755166149, win 64308, options [mss 1410,sackOK,TS val 113584034 ecr 746510095,nop,wscale 7], length 0
20:10:21.414591 IP (tos 0x0, ttl 62, id 0, offset 0, flags [DF], proto TCP (6), length 60)
    <Load Balancer Server IP>.25565 > <Third Party Client IP>.33338: Flags [S.], cksum 0x13b1 (correct), seq 2412780328, ack 1755166149, win 64308, options [mss 1410,sackOK,TS val 113585055 ecr 746510095,nop,wscale 7], length 0
20:10:22.438581 IP (tos 0x0, ttl 62, id 0, offset 0, flags [DF], proto TCP (6), length 60)
    <Load Balancer Server IP>.25565 > <Third Party Client IP>.33338: Flags [S.], cksum 0x0fb0 (correct), seq 2412780328, ack 1755166149, win 64308, options [mss 1410,sackOK,TS val 113586080 ecr 746510095,nop,wscale 7], length 0
20:10:23.472810 IP (tos 0x0, ttl 62, id 0, offset 0, flags [DF], proto TCP (6), length 60)
    <Load Balancer Server IP>.25565 > <Third Party Client IP>.33338: Flags [S.], cksum 0x0ba6 (correct), seq 2412780328, ack 1755166149, win 64308, options [mss 1410,sackOK,TS val 113587114 ecr 746510095,nop,wscale 7], length 0
```
But I probably think I got the reason why I'm seeing this, but I'm not closing this issue until it is confirmed...

**Comment by stevefan1999-personal** [comment]
I would like to keep this open since DSR does work with UDP but not TCP which sounds quite strange on a deeper level, since DSR should not work if either case with my homelab setup. 

To summarize:
1. Tunneled Geneve DSR does not work with TCP, since the three-way handshake is not observed to complete at all
2. Tunneled Geneve DSR does work with UDP, but that's because UDP employs a fire-and-forgot model without handshake. So anyone can send data to the source client IP:port without problem.
3. Something might be wrong in eBPF datapath for load balancer handling TCP stuff
4. SNAT obviously works since the endpoint has to go back to the load balancer source, rather than going to the client directly.
5. It is also possible that your real server IP behind the load balancer, would leak on IP level if you use DSR.
6. LB in Geneve DSR mode probably works with native routing (?) It shouldn't be working though

**Comment by stevefan1999-personal** [comment]
https://github.com/cilium/cilium/blob/b0a69f3cbcb1b05bf3eca677b4cabee55b260ec4/bpf/lib/nodeport.h#L2311-L2340

I'm not sure how to attach a breakpoint here...

**Comment by stevefan1999-personal** [comment]
no stale

**Comment by stevefan1999-personal** [comment]
No stale

**Comment by yushoyamaguchi** [comment]
@stevefan1999-personal 

Hello. I've worked for a [similar issue](https://github.com/cilium/cilium/issues/32189), and also have interest in this issue.
 
`I'm not sure how to attach a breakpoint here...`
I don't use breakpoint for debugging because there is a convenient way for debug print.

```
debug: true
bpf.monitorAggregation: none
```
If using this setting, when putting this macro in codebase of datapath, 
```
cilium_dbg(ctx, 69, 69, 69);  //69 is an example number.
```
we can use below command to see the debug-print.
```
cilium-dbg monitor --verbose -t debug | grep =69 
```

The output is like this.
```
DEBUG: Unknown message type=69 arg1=69 arg2=69
```

**Comment by yushoyamaguchi** [comment]
I want to try to resolve this issue, but I cannot understand how to reproduce this situation.

In my normal environment, Geneve DSR with TCP work well.
What is special point in your environment?
I want to reproduce this bug in KinD environment.

**Comment by stevefan1999-personal** [comment]
> I want to try to resolve this issue, but I cannot understand how to reproduce this situation.
> 
> In my normal environment, Geneve DSR with TCP work well.
> What is special point in your environment?
> I want to reproduce this bug in KinD environment.

I'm running Geneve DSR over multiple WAN servers connected with a Wireguard virtual circuit

**Comment by stevefan1999-personal** [comment]
no-stale

**Comment by MathyV** [comment]
Hi @stevefan1999-personal , I was researching similar problems when I came across your issue. I'm not running my setup over Wireguard, but over a virtual network inside a Proxmox cluster. 

I haven't done research in detail (yet?) but in the end I suspected the MTU was the culprit, I think the Geneve implementation is not respecting the MTU of the network interface or is being wrongly configured. I manually set the MTU in my helm to my actual virtual network MTU and now the TCP LoadBalancer works! I just wanted to let you know in case you want to try it. 

 I also found possibly related #14339.

**Comment by stevefan1999-personal** [comment]
> Hi [@stevefan1999-personal](https://github.com/stevefan1999-personal) , I was researching similar problems when I came across your issue. I'm not running my setup over Wireguard, but over a virtual network inside a Proxmox cluster.
> 
> I haven't done research in detail (yet?) but in the end I suspected the MTU was the culprit, I think the Geneve implementation is not respecting the MTU of the network interface or is being wrongly configured. I manually set the MTU in my helm to my actual virtual network MTU and now the TCP LoadBalancer works! I just wanted to let you know in case you want to try it.
> 
> I also found possibly related [#14339](https://github.com/cilium/cilium/issues/14339).

MTU could be a possible problem since it can cause IP fragmentation if the true Path MTU is not respected.

**Comment by stevefan1999-personal** [comment]
no-stale

**Comment by stevefan1999-personal** [comment]
## Complete Environment Reproduction Guide for Cilium DSR Issue

@yushoyamaguchi Here's a comprehensive guide to reproduce the DSR (Direct Server Return) issue I'm experiencing with Cilium on Talos Linux. Would you like to give a helping hand?

### Issue Summary

When using Cilium's DSR load balancing mode on Talos Linux with nodes behind NAT, client connections receive no ACK packets back from the backend pods. The connection appears to be dropped after the backend receives the DSR request.

### Environment Overview

- **Platform**: Talos Linux with Cilium CNI
- **Network topology**: Mixed environment with public VPS and NAT'd nodes
- **Connection method**: KubeSpan (WireGuard-based) for inter-node communication
- **Issue**: DSR mode fails to return packets to clients behind NAT

### Prerequisites

#### Hardware Requirements

1. **Minimum 2 servers**:
   - **Server 1 (Load Balancer Node)**:
     - Must have a public IP address (e.g., ```123.123.123.123```)
     - Public IP assigned to main network interface (```eth0``` or ```ens0```)
     - Running Talos Linux
   - **Server 2+ (Backend Nodes)**:
     - Can be behind NAT or have public IPs
     - Must be able to establish connectivity with Server 1 via Cilium/KubeSpan
     - Running Talos Linux

2. **Test Client**:
   - Any computer behind IPv4 NAT (e.g., home network with IP like ```192.168.1.123```)
   - Must have internet access to reach the public IP

This means that all the servers do not share a L2 segment -- all of them are running over the Internet in L3 and interconnected using VPNs such as Wireguard to provide access for Cilium. 

Pretty convoluted but this is I do things for now, because I have a DigitalOcean server that I want to leverage the Cilium's DSR capability to do load balancing directly, rather than going through a userspace program. SNAT LB mode work so far, but DSR is still not working in 1.18.0-rc.0. It's quite frustrating at this point because I see no visible traces that I can debug on...

#### Software Requirements

- Talos Linux (latest stable version)
- Cilium CNI (configured as per below)
- kubectl access to the cluster

### Step 1: Cilium Configuration

Apply the following Cilium configuration via Helm values or ConfigMap:

```yaml
# cilium-values.yaml
kubeProxyReplacement: true
bpf:
  masquerade: true
  hostLegacyRouting: true
cluster:
  name: lab
k8sServiceHost: localhost
k8sServicePort: 7445
tunnelProtocol: geneve
operator:
  replicas: 3
securityContext:
  capabilities:
    ciliumAgent: 
      - CHOWN
      - KILL
      - NET_ADMIN
      - NET_RAW
      - IPC_LOCK
      - SYS_ADMIN
      - SYS_RESOURCE
      - DAC_OVERRIDE
      - FOWNER
      - SETGID
      - SETUID
    cleanCiliumState: 
      - NET_ADMIN
      - SYS_ADMIN
      - SYS_RESOURCE
cgroup:
  autoMount:
    enabled: false
  hostRoot: /sys/fs/cgroup
envoy:
  enabled: false
egressGateway:
  enabled: true
loadBalancer:
  mode: dsr              # Critical: DSR mode
  dsrDispatch: geneve    # Critical: GENEVE encapsulation for DSR

# Note: The following settings don't affect DSR functionality 
# but are included for completeness
cni:
  enableRouteMTUForCNIChaining: true
daemon:
  enableSourceIPVerification: false
pmtuDiscovery:
  enabled: true
```

### Step 2: Deploy Test Application

Create and apply the following YAML file:

```yaml
# test-dsr-environment.yaml
---
# Define the IP pool using your VPS public IP
apiVersion: cilium.io/v2
kind: CiliumLoadBalancerIPPool
metadata:
  name: vps-servers
spec:
  blocks:
  - cidr: 123.123.123.123/32  # REPLACE with your VPS public IP
  disabled: false
---
# Deploy a simple nginx application
apiVersion: apps/v1
kind: Deployment
metadata:
  labels:
    app: nginx
  name: nginx-deployment
  namespace: default
spec:
  replicas: 1
  selector:
    matchLabels:
      app: nginx
  template:
    metadata:
      labels:
        app: nginx
    spec:
      # IMPORTANT: Add anti-affinity to prevent scheduling on load balancer node
      affinity:
        nodeAffinity:
          requiredDuringSchedulingIgnoredDuringExecution:
            nodeSelectorTerms:
            - matchExpressions:
              - key: kubernetes.io/hostname
                operator: NotIn
                values:
                - <LOAD_BALANCER_NODE_NAME>  # REPLACE with your LB node hostname
      containers:
      - image: nginx:1.14.2
        imagePullPolicy: IfNotPresent
        name: nginx
        ports:
        - containerPort: 80
          protocol: TCP
---
# Create LoadBalancer service with DSR annotations
apiVersion: v1
kind: Service
metadata:
  annotations:
    lbipam.cilium.io/ips: 123.123.123.123         # REPLACE with your VPS public IP
    service.cilium.io/forwarding-mode: dsr         # Critical: Enable DSR mode
    service.cilium.io/lb-algorithm: random         # Load balancing algorithm
    service.cilium.io/type: LoadBalancer
  name: nginx
  namespace: default
spec:
  allocateLoadBalancerNodePorts: true
  externalTrafficPolicy: Cluster
  internalTrafficPolicy: Cluster
  ipFamilies:
  - IPv4
  ipFamilyPolicy: SingleStack
  ports:
  - port: 80
    protocol: TCP
    targetPort: 80
  selector:
    app: nginx
  type: LoadBalancer
```

### Step 3: Deployment Instructions

1. **Update the YAML file**:
   ```bash
   # Replace all instances of 123.123.123.123 with your actual public IP
   sed -i 's/123.123.123.123/YOUR_ACTUAL_PUBLIC_IP/g' test-dsr-environment.yaml
   
   # Replace <LOAD_BALANCER_NODE_NAME> with your LB node's hostname
   kubectl get nodes  # Find the hostname of your LB node
   sed -i 's/<LOAD_BALANCER_NODE_NAME>/YOUR_LB_NODE_NAME/g' test-dsr-environment.yaml
   ```

2. **Apply the configuration**:
   ```bash
   kubectl apply -f test-dsr-environment.yaml
   ```

3. **Verify deployment**:
   ```bash
   # Check that nginx pod is NOT running on the load balancer node
   kubectl get pods -o wide | grep nginx
   
   # Verify service has external IP assigned
   kubectl get svc nginx
   ```

### Step 4: Testing the Issue

1. **From your NAT'd client PC**, attempt to connect:
   ```bash
   # Simple curl test
   curl -v http://YOUR_PUBLIC_IP
   
   # Or use telnet for more control
   telnet YOUR_PUBLIC_IP 80
   ```

2. **Expected behavior (issue reproduction)**:
   - Connection will hang/timeout
   - No ACK packets will be returned to the client
   - No response from the nginx server
   - However surprisingly, UDP should work

### Step 5: Debugging and Verification

On the **load balancer node**, run:
```bash
# Monitor Cilium traffic
cilium monitor --type drop --type trace

# In another terminal, grep for relevant IPs
cilium monitor | grep -E "(YOUR_PUBLIC_IP|POD_IP|CLIENT_PUBLIC_IP|CLIENT_NAT_IP)"
```

On the **backend node** (where nginx is running):
```bash
# Check if DSR packets arrive
tcpdump -i any -nn port 80

# Monitor Cilium
cilium monitor --type drop --type trace
```

### Expected Observations

1. **Load Balancer Node**:
   - Incoming SYN packet from client
   - DSR dispatch via GENEVE to backend node
   - No further traffic visible

2. **Backend Node**:
   - Receives DSR encapsulated packet
   - Connection tracking entry disappears
   - No return packets generated

3. **Client**:
   - SYN sent
   - No SYN-ACK received
   - Eventually times out

### Additional Context

This issue occurs specifically in my home lab setup where:
- NUC worker nodes are behind my home router's NAT
- KubeSpan (WireGuard-based) is used for cluster connectivity
- The VPS with public IP acts as the load balancer node
- DSR mode should theoretically work as the backend can route to the internet

The core issue appears to be that after the backend node receives the DSR request from the load balancer, all connection tracking disappears, and no return packets are generated.

Please let me know if you need any additional information or clarification to reproduce this issue!

**Comment by stevefan1999-personal** [comment]
Again here's my log for Cilium monitor as proof, with some redaction:
```

# This is the load balancer
root@talos-9dcc0:/home/cilium# cilium-dbg monitor | grep -E "<MY ROUTER IP>|<LOAD BALANCER PUBLIC IP>|<POD IP>|<BACKEND IP>|<LOAD BALANCER CILIUM IP>|<BACKEND CILIUM IP>|<SERVICE CLUSTER IP>"
Listening for events on 4 CPUs with 64x4096 of shared memory
Press Ctrl-C to quit
-> network flow 0xbbd3c854 , identity host->unknown state established ifindex ens17 orig-ip <LOAD BALANCER PUBLIC IP>: <LOAD BALANCER PUBLIC IP>:51820 -> <REDACTED>:51820 udp
-> network flow 0x815fef79 , identity host->unknown state established ifindex kubespan orig-ip <LOAD BALANCER PUBLIC IP>: <LOAD BALANCER PUBLIC IP>:33164 -> 10.0.0.207:6443 tcp ACK
-> network flow 0xab6a1efb , identity host->unknown state established ifindex ens17 orig-ip <LOAD BALANCER PUBLIC IP>: <LOAD BALANCER PUBLIC IP>:51820 -> <BACKEND IP>:51820 udp
-> overlay flow 0x0 , identity world->26998 state new ifindex 0 orig-ip 0.0.0.0: <MY ROUTER IP>:52357 -> <POD IP>:80 tcp SYN
-> endpoint 1546 flow 0x7563eb88 , identity host->25817 state new ifindex lxcbb98a7b01541 orig-ip <LOAD BALANCER PUBLIC IP>: <LOAD BALANCER PUBLIC IP>:43552 -> 10.245.126.0:5000 tcp SYN
-> stack flow 0x710e88d9 , identity 25817->host state reply ifindex 0 orig-ip 0.0.0.0: 10.245.126.0:5000 -> <LOAD BALANCER PUBLIC IP>:43552 tcp SYN, ACK
-> endpoint 1546 flow 0x7563eb88 , identity host->25817 state established ifindex lxcbb98a7b01541 orig-ip <LOAD BALANCER PUBLIC IP>: <LOAD BALANCER PUBLIC IP>:43552 -> 10.245.126.0:5000 tcp ACK
-> endpoint 1546 flow 0x7563eb88 , identity host->25817 state established ifindex lxcbb98a7b01541 orig-ip <LOAD BALANCER PUBLIC IP>: <LOAD BALANCER PUBLIC IP>:43552 -> 10.245.126.0:5000 tcp ACK
-> network flow 0x81d85c7e , identity host->unknown state established ifindex ens17 orig-ip <LOAD BALANCER PUBLIC IP>: <LOAD BALANCER PUBLIC IP>:51820 -> <REDACTED>:51820 udp
-> network flow 0x77350dbd , identity host->unknown state established ifindex ens17 orig-ip <LOAD BALANCER PUBLIC IP>: <LOAD BALANCER PUBLIC IP>:51820 -> <REDACTED>:51820 udp
-> stack flow 0x710e88d9 , identity 25817->host state reply ifindex 0 orig-ip 0.0.0.0: 10.245.126.0:5000 -> <LOAD BALANCER PUBLIC IP>:43552 tcp ACK
-> stack flow 0x710e88d9 , identity 25817->host state reply ifindex 0 orig-ip 0.0.0.0: 10.245.126.0:5000 -> <LOAD BALANCER PUBLIC IP>:43552 tcp ACK, FIN
-> endpoint 1546 flow 0x7563eb88 , identity host->25817 state established ifindex lxcbb98a7b01541 orig-ip <LOAD BALANCER PUBLIC IP>: <LOAD BALANCER PUBLIC IP>:43552 -> 10.245.126.0:5000 tcp ACK, FIN
-> overlay flow 0x0 , identity world->26998 state new ifindex 0 orig-ip 0.0.0.0: <MY ROUTER IP>:52357 -> <POD IP>:80 tcp SYN
-> stack flow 0x9ea2812b , identity health->host state reply ifindex 0 orig-ip 0.0.0.0: 10.245.16.94:4240 -> <LOAD BALANCER PUBLIC IP>:37122 tcp ACK
-> endpoint 3523 flow 0xc25f34d3 , identity host->health state established ifindex lxc_health orig-ip <LOAD BALANCER PUBLIC IP>: <LOAD BALANCER PUBLIC IP>:37122 -> 10.245.16.94:4240 tcp ACK
-> overlay flow 0x0 , identity world->26998 state new ifindex 0 orig-ip 0.0.0.0: <MY ROUTER IP>:52357 -> <POD IP>:80 tcp SYN
-> network flow 0x38defbe2 , identity host->unknown state established ifindex ens17 orig-ip <LOAD BALANCER PUBLIC IP>: <LOAD BALANCER PUBLIC IP>:51820 -> <REDACTED>:51820 udp
-> network flow 0x47e29c47 , identity host->unknown state established ifindex ens17 orig-ip <LOAD BALANCER PUBLIC IP>: <LOAD BALANCER PUBLIC IP>:56308 -> 172.174.35.21:443 tcp ACK
-> overlay flow 0x6a96c019 , identity remote-node->health state unknown ifindex cilium_geneve orig-ip 0.0.0.0: <LOAD BALANCER CILIUM IP>:40590 -> 10.0.0.90:4240 tcp ACK
-> overlay flow 0x6a96c019 , identity remote-node->unknown state established ifindex cilium_geneve orig-ip <LOAD BALANCER CILIUM IP>: <LOAD BALANCER CILIUM IP>:40590 -> 10.0.0.90:4240 tcp ACK
-> network flow 0x9f612390 , identity host->unknown state established ifindex kubespan orig-ip <LOAD BALANCER PUBLIC IP>: <LOAD BALANCER PUBLIC IP>:50000 -> <REDACTED>:35916 tcp ACK
-> network flow 0xcba2803a , identity host->unknown state established ifindex kubespan orig-ip <LOAD BALANCER PUBLIC IP>: <LOAD BALANCER PUBLIC IP>:33220 -> 10.0.0.207:6443 tcp ACK
-> overlay flow 0x7ce56fec , identity remote-node->health state unknown ifindex cilium_geneve orig-ip 0.0.0.0: <LOAD BALANCER CILIUM IP>:49364 -> 10.242.25.205:4240 tcp SYN
-> overlay flow 0x7ce56fec , identity remote-node->unknown state new ifindex cilium_geneve orig-ip <LOAD BALANCER CILIUM IP>: <LOAD BALANCER CILIUM IP>:49364 -> 10.242.25.205:4240 tcp SYN
-> overlay flow 0x0 , identity remote-node->health state unknown ifindex cilium_geneve orig-ip 0.0.0.0: <LOAD BALANCER CILIUM IP> -> 10.242.25.205 icmp EchoRequest
-> network flow 0x7ce56fec , identity host->unknown state established ifindex ens17 orig-ip <LOAD BALANCER PUBLIC IP>: <LOAD BALANCER PUBLIC IP>:51820 -> <BACKEND IP>:51820 udp
-> overlay flow 0x7ce56fec , identity remote-node->health state unknown ifindex cilium_geneve orig-ip 0.0.0.0: <LOAD BALANCER CILIUM IP>:49364 -> 10.242.25.205:4240 tcp ACK
-> overlay flow 0x7ce56fec , identity remote-node->unknown state established ifindex cilium_geneve orig-ip <LOAD BALANCER CILIUM IP>: <LOAD BALANCER CILIUM IP>:49364 -> 10.242.25.205:4240 tcp ACK
-> overlay flow 0x7ce56fec , identity remote-node->health state unknown ifindex cilium_geneve orig-ip 0.0.0.0: <LOAD BALANCER CILIUM IP>:49364 -> 10.242.25.205:4240 tcp ACK
-> overlay flow 0x7ce56fec , identity remote-node->unknown state established ifindex cilium_geneve orig-ip <LOAD BALANCER CILIUM IP>: <LOAD BALANCER CILIUM IP>:49364 -> 10.242.25.205:4240 tcp ACK
-> overlay flow 0x7ce56fec , identity remote-node->health state unknown ifindex cilium_geneve orig-ip 0.0.0.0: <LOAD BALANCER CILIUM IP>:49364 -> 10.242.25.205:4240 tcp ACK
-> network flow 0x827e07e5 , identity host->unknown state established ifindex kubespan orig-ip <LOAD BALANCER PUBLIC IP>: <LOAD BALANCER PUBLIC IP>:52546 -> <REDACTED>:4240 tcp ACK, FIN
-> network flow 0x0 , identity host->unknown state new ifindex ens17 orig-ip <LOAD BALANCER PUBLIC IP>: <LOAD BALANCER PUBLIC IP>:40193 -> 194.180.49.218:40877 tcp ACK, RST
```
```
# This is the backend 
root@talos-1d3fb:/home/cilium# cilium-dbg monitor | grep -E "<MY ROUTER IP>|<LOAD BALANCER PUBLIC IP>|<POD IP>|<BACKEND IP>|<LOAD BALANCER CILIUM IP>|<BACKEND CILIUM IP>|<SERVICE CLUSTER IP>"
Listening for events on 1 CPUs with 64x4096 of shared memory
Press Ctrl-C to quit
-> network flow 0x8d42e228 , identity host->unknown state established ifindex kubespan orig-ip <BACKEND IP>: <BACKEND IP>:48358 -> 10.0.0.207:6443 tcp ACK
-> network flow 0xb5efc4ad , identity host->unknown state established ifindex ens17 orig-ip <BACKEND IP>: <BACKEND IP>:51820 -> <REDACTED>:51820 udp
-> network flow 0x5bcc3ab2 , identity host->unknown state established ifindex kubespan orig-ip <BACKEND IP>: <BACKEND IP>:50128 -> <REDACTED>:6443 tcp ACK
-> endpoint 2563 flow 0x4b1af6ba , identity host->25817 state new ifindex lxc47641ae2e294 orig-ip <BACKEND IP>: <BACKEND IP>:42218 -> 10.242.148.210:5000 tcp SYN
-> stack flow 0x6b27d4ec , identity 25817->host state reply ifindex 0 orig-ip 0.0.0.0: 10.242.148.210:5000 -> <BACKEND IP>:42218 tcp SYN, ACK
-> endpoint 2563 flow 0x4b1af6ba , identity host->25817 state established ifindex lxc47641ae2e294 orig-ip <BACKEND IP>: <BACKEND IP>:42218 -> 10.242.148.210:5000 tcp ACK
-> endpoint 2563 flow 0x4b1af6ba , identity host->25817 state established ifindex lxc47641ae2e294 orig-ip <BACKEND IP>: <BACKEND IP>:42218 -> 10.242.148.210:5000 tcp ACK
-> network flow 0xcd6428e3 , identity host->unknown state established ifindex ens17 orig-ip <BACKEND IP>: <BACKEND IP>:51820 -> <REDACTED>:51820 udp
-> stack flow 0x6b27d4ec , identity 25817->host state reply ifindex 0 orig-ip 0.0.0.0: 10.242.148.210:5000 -> <BACKEND IP>:42218 tcp ACK
-> stack flow 0x6b27d4ec , identity 25817->host state reply ifindex 0 orig-ip 0.0.0.0: 10.242.148.210:5000 -> <BACKEND IP>:42218 tcp ACK, FIN
-> endpoint 2563 flow 0x4b1af6ba , identity host->25817 state established ifindex lxc47641ae2e294 orig-ip <BACKEND IP>: <BACKEND IP>:42218 -> 10.242.148.210:5000 tcp ACK, FIN
-> network flow 0x548b12e9 , identity host->unknown state new ifindex kubespan orig-ip <BACKEND IP>: <BACKEND IP>:36350 -> <REDACTED>:6443 tcp SYN
-> network flow 0x548b12e9 , identity host->unknown state established ifindex kubespan orig-ip <BACKEND IP>: <BACKEND IP>:36350 -> <REDACTED>:6443 tcp ACK
-> network flow 0x548b12e9 , identity host->unknown state established ifindex kubespan orig-ip <BACKEND IP>: <BACKEND IP>:36350 -> <REDACTED>:6443 tcp ACK, FIN
-> network flow 0x6bee0e22 , identity host->unknown state established ifindex ens17 orig-ip <BACKEND IP>: <BACKEND IP>:51820 -> <REDACTED>:51820 udp
-> network flow 0x2ecb7963 , identity host->unknown state established ifindex ens17 orig-ip <BACKEND IP>: <BACKEND IP>:51820 -> <LOAD BALANCER PUBLIC IP>:51820 udp
-> network flow 0x29bb5c8 , identity host->unknown state established ifindex ens17 orig-ip <BACKEND IP>: <BACKEND IP>:51820 -> <REDACTED>:51820 udp
-> endpoint 443 flow 0x0 , identity world->26998 state new ifindex lxc489b2b11e751 orig-ip <MY ROUTER IP>: <MY ROUTER IP>:52357 -> <POD IP>:80 tcp SYN
-> stack flow 0xec769fa8 , identity 26998->world state reply ifindex 0 orig-ip 0.0.0.0: <POD IP>:80 -> <MY ROUTER IP>:52357 tcp SYN, ACK
-> network flow 0xec769fa8 , identity 26998->unknown state reply ifindex ens17 orig-ip 0.0.0.0: <LOAD BALANCER PUBLIC IP>:80 -> <MY ROUTER IP>:52357 tcp SYN, ACK
-> network flow 0xff13d954 , identity host->unknown state established ifindex kubespan orig-ip <BACKEND IP>: <BACKEND IP>:48370 -> 10.0.0.207:6443 tcp ACK
-> network flow 0x7fa5eccb , identity 26998->unknown state reply ifindex ens17 orig-ip 0.0.0.0: <LOAD BALANCER PUBLIC IP>:80 -> <MY ROUTER IP>:52357 tcp SYN, ACK
-> network flow 0x8d42e228 , identity host->unknown state established ifindex kubespan orig-ip <BACKEND IP>: <BACKEND IP>:48358 -> 10.0.0.207:6443 tcp ACK
-> network flow 0xa6eff5b0 , identity host->unknown state established ifindex ens17 orig-ip <BACKEND IP>: <BACKEND IP>:51820 -> <REDACTED>:51820 udp
-> network flow 0x5bcc3ab2 , identity host->unknown state established ifindex kubespan orig-ip <BACKEND IP>: <BACKEND IP>:50128 -> <REDACTED>:6443 tcp ACK
-> overlay flow 0x8a199a09 , identity remote-node->health state unknown ifindex cilium_geneve orig-ip 0.0.0.0: <BACKEND CILIUM IP>:36150 -> 10.0.0.90:4240 tcp ACK
-> overlay flow 0x8a199a09 , identity remote-node->unknown state established ifindex cilium_geneve orig-ip <BACKEND CILIUM IP>: <BACKEND CILIUM IP>:36150 -> 10.0.0.90:4240 tcp ACK
-> overlay flow 0x8a199a09 , identity remote-node->health state unknown ifindex cilium_geneve orig-ip 0.0.0.0: <BACKEND CILIUM IP>:36150 -> 10.0.0.90:4240 tcp ACK
-> network flow 0x14371c40 , identity 26998->unknown state reply ifindex ens17 orig-ip 0.0.0.0: <LOAD BALANCER PUBLIC IP>:80 -> <MY ROUTER IP>:52357 tcp SYN, ACK
-> network flow 0xea0c9574 , identity host->unknown state established ifindex ens17 orig-ip <BACKEND IP>: <BACKEND IP>:40464 -> 172.174.35.21:443 tcp ACK
-> stack flow 0x1cadf7a6 , identity health->host state reply ifindex 0 orig-ip 0.0.0.0: 10.242.25.205:4240 -> <BACKEND IP>:35302 tcp ACK
-> endpoint 1504 flow 0x1b29e952 , identity host->health state established ifindex lxc_health orig-ip <BACKEND IP>: <BACKEND IP>:35302 -> 10.242.25.205:4240 tcp ACK
-> network flow 0xf481abba , identity host->unknown state established ifindex ens17 orig-ip <BACKEND IP>: <BACKEND IP>:51820 -> <REDACTED>:51820 udp
-> network flow 0xe4c59975 , identity host->unknown state established ifindex kubespan orig-ip <BACKEND IP>: <BACKEND IP>:52416 -> <REDACTED>:4240 tcp ACK
-> network flow 0x8ac127b3 , identity host->unknown state established ifindex ens17 orig-ip <BACKEND IP>: <BACKEND IP>:51820 -> <REDACTED>:51820 udp
-> endpoint 1504 flow 0x0 , identity remote-node->health state new ifindex lxc_health orig-ip <LOAD BALANCER CILIUM IP>: <LOAD BALANCER CILIUM IP>:49364 -> 10.242.25.205:4240 tcp SYN
-> overlay flow 0x7d4978d7 , identity health->remote-node state reply ifindex cilium_geneve orig-ip 0.0.0.0: 10.242.25.205:4240 -> <LOAD BALANCER CILIUM IP>:49364 tcp SYN, ACK
-> network flow 0x7d4978d7 , identity host->unknown state established ifindex ens17 orig-ip <BACKEND IP>: <BACKEND IP>:51820 -> <LOAD BALANCER PUBLIC IP>:51820 udp
-> endpoint 1504 flow 0x0 , identity remote-node->health state new ifindex lxc_health orig-ip <LOAD BALANCER CILIUM IP>: <LOAD BALANCER CILIUM IP> -> 10.242.25.205 icmp EchoRequest
-> overlay flow 0x0 , identity health->remote-node state reply ifindex cilium_geneve orig-ip 0.0.0.0: 10.242.25.205 -> <LOAD BALANCER CILIUM IP> icmp EchoReply
-> endpoint 1504 flow 0x0 , identity remote-node->health state established ifindex lxc_health orig-ip <LOAD BALANCER CILIUM IP>: <LOAD BALANCER CILIUM IP>:49364 -> 10.242.25.205:4240 tcp ACK
-> endpoint 1504 flow 0x0 , identity remote-node->health state established ifindex lxc_health orig-ip <LOAD BALANCER CILIUM IP>: <LOAD BALANCER CILIUM IP>:49364 -> 10.242.25.205:4240 tcp ACK
-> overlay flow 0x7d4978d7 , identity health->remote-node state reply ifindex cilium_geneve orig-ip 0.0.0.0: 10.242.25.205:4240 -> <LOAD BALANCER CILIUM IP>:49364 tcp ACK
-> stack flow 0xc60a51f1 , identity 26998->world state reply ifindex 0 orig-ip 0.0.0.0: <POD IP>:80 -> <MY ROUTER IP>:52357 tcp SYN, ACK
-> network flow 0x0 , identity host->unknown state new ifindex kubespan orig-ip <BACKEND IP>: <BACKEND IP> -> <REDACTED> icmp EchoRequest
-> network flow 0x5bcf6402 , identity host->unknown state new ifindex kubespan orig-ip <BACKEND IP>: <BACKEND IP>:42162 -> <REDACTED>:4240 tcp SYN
-> network flow 0x5bcf6402 , identity host->unknown state established ifindex kubespan orig-ip <BACKEND IP>: <BACKEND IP>:42162 -> <REDACTED>:4240 tcp ACK
-> network flow 0x5bcf6402 , identity host->unknown state established ifindex kubespan orig-ip <BACKEND IP>: <BACKEND IP>:42162 -> <REDACTED>:4240 tcp ACK
-> network flow 0x9d850e24 , identity host->unknown state established ifindex kubespan orig-ip <BACKEND IP>: <BACKEND IP>:34352 -> <REDACTED>:4240 tcp ACK, FIN
-> network flow 0x9d850e24 , identity host->unknown state established ifindex ens17 orig-ip <BACKEND IP>: <BACKEND IP>:51820 -> <REDACTED>:51820 udp
-> network flow 0x5bcc3ab2 , identity host->unknown state established ifindex kubespan orig-ip <BACKEND IP>: <BACKEND IP>:50128 -> <REDACTED>:6443 tcp ACK
-> endpoint 2563 flow 0xbcc9d80e , identity host->25817 state new ifindex lxc47641ae2e294 orig-ip <BACKEND IP>: <BACKEND IP>:42074 -> 10.242.148.210:5000 tcp SYN
-> stack flow 0xfb6eb5bb , identity 25817->host state reply ifindex 0 orig-ip 0.0.0.0: 10.242.148.210:5000 -> <BACKEND IP>:42074 tcp SYN, ACK
-> endpoint 2563 flow 0xbcc9d80e , identity host->25817 state established ifindex lxc47641ae2e294 orig-ip <BACKEND IP>: <BACKEND IP>:42074 -> 10.242.148.210:5000 tcp ACK
-> endpoint 2563 flow 0xbcc9d80e , identity host->25817 state established ifindex lxc47641ae2e294 orig-ip <BACKEND IP>: <BACKEND IP>:42074 -> 10.242.148.210:5000 tcp ACK
-> network flow 0xeb43e8dd , identity host->unknown state established ifindex ens17 orig-ip <BACKEND IP>: <BACKEND IP>:51820 -> <REDACTED>:51820 udp
-> stack flow 0xfb6eb5bb , identity 25817->host state reply ifindex 0 orig-ip 0.0.0.0: 10.242.148.210:5000 -> <BACKEND IP>:42074 tcp ACK
-> endpoint 2563 flow 0xbcc9d80e , identity host->25817 state established ifindex lxc47641ae2e294 orig-ip <BACKEND IP>: <BACKEND IP>:42074 -> 10.242.148.210:5000 tcp ACK, FIN
-> stack flow 0xfb6eb5bb , identity 25817->host state reply ifindex 0 orig-ip 0.0.0.0: 10.242.148.210:5000 -> <BACKEND IP>:42074 tcp ACK, FIN
-> endpoint 2563 flow 0xbcc9d80e , identity host->25817 state established ifindex lxc47641ae2e294 orig-ip <BACKEND IP>: <BACKEND IP>:42074 -> 10.242.148.210:5000 tcp ACK
```

**Comment by stevefan1999-personal** [comment]
Okay here's some point of interests:

Load balancer: 
```
# This is the load balancer
root@talos-9dcc0:/home/cilium# cilium-dbg monitor | grep -E "<MY ROUTER IP>|<LOAD BALANCER PUBLIC IP>|<POD IP>|<BACKEND IP>|<LOAD BALANCER CILIUM IP>|<BACKEND CILIUM IP>|<SERVICE CLUSTER IP>"
Listening for events on 4 CPUs with 64x4096 of shared memory
Press Ctrl-C to quit

-> overlay flow 0x0 , identity world->26998 state new ifindex 0 orig-ip 0.0.0.0: <MY ROUTER IP>:52357 -> <POD IP>:80 tcp SYN
-> overlay flow 0x0 , identity world->26998 state new ifindex 0 orig-ip 0.0.0.0: <MY ROUTER IP>:52357 -> <POD IP>:80 tcp SYN
-> overlay flow 0x0 , identity world->26998 state new ifindex 0 orig-ip 0.0.0.0: <MY ROUTER IP>:52357 -> <POD IP>:80 tcp SYN
```

Backend:
```
# This is the backend 
root@talos-1d3fb:/home/cilium# cilium-dbg monitor | grep -E "<MY ROUTER IP>|<LOAD BALANCER PUBLIC IP>|<POD IP>|<BACKEND IP>|<LOAD BALANCER CILIUM IP>|<BACKEND CILIUM IP>|<SERVICE CLUSTER IP>"
Listening for events on 1 CPUs with 64x4096 of shared memory
Press Ctrl-C to quit

-> endpoint 443 flow 0x0 , identity world->26998 state new ifindex lxc489b2b11e751 orig-ip <MY ROUTER IP>: <MY ROUTER IP>:52357 -> <POD IP>:80 tcp SYN
-> stack flow 0xec769fa8 , identity 26998->world state reply ifindex 0 orig-ip 0.0.0.0: <POD IP>:80 -> <MY ROUTER IP>:52357 tcp SYN, ACK
-> network flow 0xec769fa8 , identity 26998->unknown state reply ifindex ens17 orig-ip 0.0.0.0: <LOAD BALANCER PUBLIC IP>:80 -> <MY ROUTER IP>:52357 tcp SYN, ACK
-> network flow 0x7fa5eccb , identity 26998->unknown state reply ifindex ens17 orig-ip 0.0.0.0: <LOAD BALANCER PUBLIC IP>:80 -> <MY ROUTER IP>:52357 tcp SYN, ACK
-> network flow 0x14371c40 , identity 26998->unknown state reply ifindex ens17 orig-ip 0.0.0.0: <LOAD BALANCER PUBLIC IP>:80 -> <MY ROUTER IP>:52357 tcp SYN, ACK
-> stack flow 0xc60a51f1 , identity 26998->world state reply ifindex 0 orig-ip 0.0.0.0: <POD IP>:80 -> <MY ROUTER IP>:52357 tcp SYN, ACK
```

Normally the DSR reply should go back to the load balancer...?

I just asked Grok for this and it mentioned the following:

Prompt:
```
Consider that we have a situation where the load balancer address is 123.123.123.123 and backend 10.10.10.10, am I correct?

1. User from external internet with LAN address 192.168.2.10 and WAN address 101.101.101.101 and the router sends a request to 123.123.123.123:1337, with a random source port (let's say 1234)
2. Load balancer forward this to 101.101.101.101:1234 request to 10.10.10.10:1337 with DSR
3. 10.10.10.10:1337 see the DSR request and source IP from 101.101.101.101:1234
4. 10.10.10.10:1337 directly replies back to 101.101.101.101:1234 due to DSR, bypassing the 123.123.123.123 totally
5. Now 101.101.101.101 see a packet from source 10.10.10.10:1337 and don't know what to do

Did I make something wrong
```

Response:
```
# Analysis of DSR Mode in Cilium with Specific IP Scenario

Thank you for providing a detailed scenario with specific IP addresses and steps. I’ll analyze your understanding of **Cilium's Direct Server Return (DSR)** mode in load balancing and address the potential misunderstanding in your sequence of events. I’ll also clarify how DSR operates with respect to the source IP seen by the external client.

## Your Scenario Breakdown and Correction

Let’s go through your described steps and highlight where the misunderstanding occurs, using the provided IP addresses:

1. **User Request Initiation**:  
   - An external user with a LAN address of **192.168.2.10** and a WAN address of **101.101.101.101** sends a request to the load balancer address **123.123.123.123:1337** (the service IP and port, e.g., a Kubernetes LoadBalancer service). The source port is a random one, say **1234**.  
   - **This step is correct**. The request originates from **101.101.101.101:1234** (WAN address and source port) and targets the service IP **123.123.123.123:1337**.

2. **Load Balancer Forwarding**:  
   - You stated that the load balancer forwards the request from **101.101.101.101:1234** to the backend **10.10.10.10:1337** with DSR.  
   - **This step is mostly correct**. In Cilium’s DSR mode, the load balancer (managed by Cilium using eBPF) forwards the request to the backend pod at **10.10.10.10:1337**. Importantly, the **source IP remains 101.101.101.101:1234** (the client’s WAN address), as DSR preserves the client’s source IP for the backend to see .

3. **Backend Sees the Request**:  
   - You noted that the backend **10.10.10.10:1337** sees the DSR request with the source IP as **101.101.101.101:1234**.  
   - **This step is correct**. One of the key advantages of DSR in Cilium is that the backend pod sees the real client IP (**101.101.101.101:1234**), allowing for policy enforcement or logging based on the actual client address .

4. **Backend Replies Directly**:  
   - You stated that the backend **10.10.10.10:1337** directly replies to **101.101.101.101:1234**, bypassing the load balancer **123.123.123.123** entirely due to DSR.  
   - **This step is partially correct**. In DSR mode, the backend does send the reply directly to the client (**101.101.101.101:1234**) without routing it back through the load balancer. However, there’s a critical detail about the source IP of the reply packet, which leads to the misunderstanding in the next step .

5. **Client Sees Reply Packet**:  
   - You mentioned that the client at **101.101.101.101** sees a packet with the source IP as **10.10.10.10:1337** and doesn’t know what to do with it.  
   - **This step is incorrect**. Here lies the misunderstanding. In Cilium’s DSR mode, when the backend (**10.10.10.10:1337**) sends the reply directly to the client (**101.101.101.101:1234**), it does **not** use its own IP as the source IP in the packet header. Instead, Cilium ensures that the reply packet’s source IP is set to the service IP (**123.123.123.123:1337**), the IP the client originally sent the request to. This maintains the illusion that the response is coming from the load balancer/service IP, even though it’s sent directly from the backend .

## Corrected Understanding of DSR Reply Behavior

**In DSR mode, the reply packet’s source IP is spoofed to match the service IP**. This is a critical aspect of how DSR works in Cilium and other load balancing systems using DSR. Let’s clarify the corrected flow for step 4 and 5:

- **Step 4 (Corrected) - Backend Replies Directly**: The backend at **10.10.10.10:1337** crafts a reply packet to the client at **101.101.101.101:1234**. However, the source IP in the packet header is set to **123.123.123.123:1337** (the service IP), not the backend’s IP (**10.10.10.10:1337**). This is achieved through Cilium’s eBPF-based packet manipulation, often by encoding service information in the packet (e.g., as an IP option for TCP SYN packets) to inform the backend how to construct the reply .
- **Step 5 (Corrected) - Client Receives Reply**: The client at **101.101.101.101:1234** receives a packet with the source IP **123.123.123.123:1337**, which matches the destination IP it originally sent the request to. Therefore, the client processes the packet correctly, as it appears to come from the expected service endpoint. The client is unaware that the packet was sent directly from the backend rather than routed through the load balancer .

## Why the Client Doesn’t See the Backend IP

The reason the client does not see the backend IP (**10.10.10.10:1337**) as the source is to maintain transparency and compatibility in the communication flow. If the client saw a reply from an unexpected IP address, it could reject the packet or fail to match it to the original request, as you correctly pointed out in your concern. Cilium avoids this by ensuring the reply packet’s source IP matches the service IP (**123.123.123.123:1337**) the client expects, even though the physical path bypasses the load balancer .

## Summary of the Issue in Your Understanding

**You were incorrect in assuming that the client sees the backend IP as the source IP in the reply packet**. In DSR mode, Cilium manipulates the packet headers so that the reply appears to come from the service IP (**123.123.123.123:1337**), not the backend IP (**10.10.10.10:1337**). This ensures the client can process the response without confusion, maintaining the expected client-server communication model while still benefiting from the performance optimization of bypassing the load balancer on the return path .

If you have further questions or additional scenarios to explore (e.g., specific network configurations or edge cases with DSR), please let me know!
```

**Comment by yushoyamaguchi** [comment]
@stevefan1999-personal 

Thank you for your description.
I'm sorry, but maybe I cannot prepare any talos cluster connecting via NAT...
Do you use bare-metal machine for K8s nodes?

**Comment by stevefan1999-personal** [comment]
> [@stevefan1999-personal](https://github.com/stevefan1999-personal)
> 
> Thank you for your description. I'm sorry, but maybe I cannot prepare any talos cluster connecting via NAT... Do you use bare-metal machine for K8s nodes?

My worker nodes (my homelab NUC) is running in bare metal behind NAT, and my load balancer servers are from various VPS providers (such as DigitalOcean or Vultr) with public IP attached to it. There I use Wiregard to connect them up, and I use the load balancer feature in Cilium to use it as a forwarding proxy to my services. 

This happens on L4 rather than L7, so I don't need application specific proxy such as Nginx or PGBouncer! Anything that runs TCP should work, and SNAT actually works so well, it is DSR that is having some trouble now...

**Comment by alagoutte** [comment]
`Normally the DSR reply should go back to the load balancer...?`

No because it is DSR and return directly to the client (no go back to LB)

I think your issue coming from your NAT router don't like SYN ACK (because don't see the SYN encapuslate on Geneve protocol)

**Comment by stevefan1999-personal** [comment]
no-stale

**Comment by stevefan1999-personal** [comment]
no stale

**Comment by stevefan1999-personal** [comment]
no stale
