### ISSUE TITLE
DSR: Client can't receive RST when the backend is switched in long lived connection

### ISSUE THREAD

**Issue by ysksuzuki** [cilium/cilium#27730]
### Is there an existing issue for this?

- [X] I have searched the existing issues

### What happened?

1. Create a StatufulSet with 3 replicas and setup a MySQL cluster (1 primary, 2 replicas). A primary pod has `moco.cybozu.com/role: primary` label, and replicas have `moco.cybozu.com/role: replica` label.

StatefulSet and Pods derived from it
```
apiVersion: apps/v1
kind: StatefulSet
metadata:
  labels:
    app.kubernetes.io/instance: test
    app.kubernetes.io/name: mysql
  name: moco-test
  namespace: dctest
spec:
  replicas: 3
  selector:
    matchLabels:
      app.kubernetes.io/instance: test
      app.kubernetes.io/name: mysql
  serviceName: moco-test
  template:
    metadata:
      creationTimestamp: null
      labels:
        app.kubernetes.io/instance: test
        app.kubernetes.io/name: mysql
    spec:
---
apiVersion: v1
kind: Pod
metadata:
  labels:
    app.kubernetes.io/instance: test
    app.kubernetes.io/name: mysql
    moco.cybozu.com/role: primary
    statefulset.kubernetes.io/pod-name: moco-test-0
  name: moco-test-0
  namespace: dctest
spec:
---
apiVersion: v1
kind: Pod
metadata:
  labels:
    app.kubernetes.io/instance: test
    app.kubernetes.io/name: mysql
    moco.cybozu.com/role: replica
    statefulset.kubernetes.io/pod-name: moco-test-1
  name: moco-test-1
  namespace: dctest
spec:
---
apiVersion: v1
kind: Pod
metadata:
  labels:
    app.kubernetes.io/instance: test
    app.kubernetes.io/name: mysql
    moco.cybozu.com/role: replica
    statefulset.kubernetes.io/pod-name: moco-test-2
  name: moco-test-2
  namespace: dctest
spec:
```

2. Create  a Loadbalancer service for primary

Loadbalancer service
```
apiVersion: v1
kind: Service
metadata:
  annotations:
    metallb.universe.tf/address-pool: default
  labels:
    app.kubernetes.io/instance: test
    app.kubernetes.io/name: mysql
  name: moco-test-primary
  namespace: dctest
spec:
  allocateLoadBalancerNodePorts: false
  externalTrafficPolicy: Cluster
  ports:
  - name: mysql
    port: 3306
    protocol: TCP
    targetPort: mysql
  - name: mysqlx
    port: 33060
    protocol: TCP
    targetPort: mysqlx
  selector:
    app.kubernetes.io/instance: test
    app.kubernetes.io/name: mysql
    moco.cybozu.com/role: primary
  type: LoadBalancer
```

3. Connect to the MySQCluster through the primary Loadbalancer service

```
$ kubectl -n dctest get svc
NAME                      TYPE           CLUSTER-IP      EXTERNAL-IP   PORT(S)              AGE
moco-test                 ClusterIP      None            <none>        3306/TCP,33060/TCP   25h
moco-test-primary         LoadBalancer   10.68.138.152   10.72.32.7    3306/TCP,33060/TCP   25h

mysql -u moco-admin -h 10.72.32.7 -p
Enter password:
Welcome to the MySQL monitor.  Commands end with ; or \g.
Your MySQL connection id is 19805
Server version: 8.0.30 Source distribution

Copyright (c) 2000, 2023, Oracle and/or its affiliates.

Oracle is a registered trademark of Oracle Corporation and/or its
affiliates. Other names may be trademarks of their respective
owners.

Type 'help;' or '\h' for help. Type '\c' to clear the current input statement.

mysql> select @@hostname;
+-------------+
| @@hostname  |
+-------------+
| moco-test-0 |
+-------------+
1 row in set (0.00 sec)
```
 
4. Switch the primary from `moco-test-0` to `moco-test-1`

`moco-test-1` has `moco.cybozu.com/role=primary` label, old primary `moco-test-0` has `moco.cybozu.com/role=replica` 
```
$ kubectl -n dctest get po --show-labels
moco-test-0                                               4/4     Running   0          25h   app.kubernetes.io/instance=test,app.kubernetes.io/name=mysql,moco.cybozu.com/role=replica,statefulset.kubernetes.io/pod-name=moco-test-0
moco-test-1                                               4/4     Running   0          25h   app.kubernetes.io/instance=test,app.kubernetes.io/name=mysql,moco.cybozu.com/role=primary,statefulset.kubernetes.io/pod-name=moco-test-1
moco-test-2                                               4/4     Running   0          25h   app.kubernetes.io/instance=test,app.kubernetes.io/name=mysql,moco.cybozu.com/role=replica,statefulset.kubernetes.io/pod-name=moco-test-2
```

5. MySQL client receives RST from Pod IP and doesn't reconnect

```
mysql> select @@hostname;
# Hang!!

# Receive RST from Pod IP
tcpdump -nl -i any
08:44:20.835469 eth0  Out IP 10.72.3.2.47252 > 10.72.32.7.3306: Flags [P.], seq 2042663753:2042663799, ack 3831983031, win 501, options [nop,nop,TS val 1359132732 ecr 564162268], length 46
08:44:20.835911 eth0  In  IP 10.64.1.137.3306 > 10.72.3.2.47252: Flags [R], seq 3831983031, win 0, length 0
08:44:21.043428 eth0  Out IP 10.72.3.2.47252 > 10.72.32.7.3306: Flags [P.], seq 0:46, ack 1, win 501, options [nop,nop,TS val 1359132940 ecr 564162268], length 46
08:44:21.043955 eth0  In  IP 10.64.1.137.3306 > 10.72.3.2.47252: Flags [R], seq 3831983031, win 0, length 0
08:44:21.251430 eth0  Out IP 10.72.3.2.47252 > 10.72.32.7.3306: Flags [P.], seq 0:46, ack 1, win 501, options [nop,nop,TS val 1359133148 ecr 564162268], length 46
08:44:21.251824 eth0  In  IP 10.64.1.137.3306 > 10.72.3.2.47252: Flags [R], seq 3831983031, win 0, length 0
08:44:21.691427 eth0  Out IP 10.72.3.2.47252 > 10.72.32.7.3306: Flags [P.], seq 0:46, ack 1, win 501, options [nop,nop,TS val 1359133588 ecr 564162268], length 46
08:44:21.691774 eth0  In  IP 10.64.1.137.3306 > 10.72.3.2.47252: Flags [R], seq 3831983031, win 0, length 0
```

### Cilium Version

1.14.1

### Kernel Version

Linux rack0-cs4 5.15.122-flatcar

### Kubernetes Version

$ kubectl version
WARNING: This version information is deprecated and will be replaced with the output from kubectl version --short. Use --output=yaml|json to get the full version.
Client Version: version.Info{Major:"1", Minor:"26", GitVersion:"v1.26.6", GitCommit:"11902a838028edef305dfe2f96be929bc4d114d8", GitTreeState:"clean", BuildDate:"2023-06-14T09:56:58Z", GoVersion:"go1.19.10", Compiler:"gc", Platform:"linux/amd64"}
Kustomize Version: v4.5.7
Server Version: version.Info{Major:"1", Minor:"26", GitVersion:"v1.26.6", GitCommit:"11902a838028edef305dfe2f96be929bc4d114d8", GitTreeState:"archive", BuildDate:"2023-07-05T01:27:55Z", GoVersion:"go1.19.10", Compiler:"gc", Platform:"linux/amd64"}

### Anything else?

LB configs

```
$ cilium config view 
bgp-announce-lb-ip                                true
bpf-lb-acceleration                               disabled
bpf-lb-algorithm                                  maglev
bpf-lb-dsr-dispatch                               opt
bpf-lb-external-clusterip                         false
bpf-lb-map-max                                    65536
bpf-lb-mode                                       dsr
bpf-lb-sock                                       true
bpf-lb-sock-hostns-only                           true
```

### Code of Conduct

- [X] I agree to follow this project's Code of Conduct

**Comment by ysksuzuki** [comment]
If the backend selection happens during the active connection, the new backend will receive a packet from an unknown connection and return RST. This RST won't be reverse SNAT because, in DSR mode, the service IP/port are encoded only in SYN packet.
https://github.com/cilium/cilium/blob/95e25bfb132750e97304dfbe0f5770f4b6debd96/bpf/lib/lb.h#L1626-L1648

**Comment by youngnick** [comment]
Thanks for this report!

Similarly to #27726, what do you think Cilium should be doing differently here?

**Comment by ysksuzuki** [comment]
I think Cilium should set the dsr info into IP option or Geneve option for the non-syn packets. Otherwise, the client will receive RST from the Pod IP.

**Comment by Olichous** [comment]
This is still reproducible on `main` (checked at v1.20.0-pre.4), and I've opened a draft PR with a
fix: https://github.com/cilium/cilium/pull/47020

To recap the root cause for anyone landing here: in DSR mode the service VIP:port is encoded only
in the **SYN** (`encap_geneve_dsr_opt{4,6}()` for Geneve, the IP option for `dsrDispatch=opt`).
When an in-flight packet is re-routed to a **different LB node** — e.g. an ECMP rehash after a BGP
next-hop is added/removed — that node does `CT_NEW`, picks a backend via Maglev, and forwards a
**non-SYN** packet with no DSR info. `nodeport_extract_dsr_v{4,6}()` on the backend node only reads
the option on SYN, so it can't build the reverse-xlate state, and the backend's RST egresses with
the pod/node IP instead of the VIP. The client ignores it (tuple mismatch) and hangs in RTO
backoff for the whole window. Worth stressing: **there is no drop anywhere** — no `cilium monitor`
drop event, no `cilium_drop_count_total` — it's a misdelivery, which is why it's so hard to spot.

@ysksuzuki, this implements exactly what you suggested here ("set the dsr info into IP option or
Geneve option for the non-syn packets"). @youngnick, re "what should Cilium do differently" — the
PR attaches the DSR info to the one non-SYN packet that *creates* the CT entry on the new LB node,
so it costs nothing on the wire in steady state.

The PR also discusses a simpler "attach on every packet" variant and the MTU question that came up
in #32091: for **Geneve** dispatch the option's 12 bytes are already reserved unconditionally by
`DsrTunnelOverhead` in `pkg/mtu`, so neither variant changes the MTU budget.

I have cross-node captures (LB / backend / client) of the freeze and the wrong-source RST if useful.
