### ISSUE TITLE
FIB lookup failed in cilium dualstack scenario in AKS

### ISSUE THREAD

**Issue by tamilmani1989** [cilium/cilium#31326]
### Is there an existing issue for this?

- [X] I have searched the existing issues

### What happened?

This issue happens in dualstack cluster in AKS using cilium. When user creates k8s service type loadbalancer, health probes are failing to respond. Upon investigation found LB health probes are sent from link local source address which cannot be forwarded `fe80::1234:5678:9abc`. To workaround this, added nftable rules to change source IP to global unicast ip for request and convert back to original destination IP in return. This workaround seems to be working in other CNI clusters with kube-proxy but not in cilium with kube-proxy replacement clusters. The return packets are not getting forwarded and failing with `FIB_LOOKUP_FAILED` error. The following is the error log from cilium monitor 

`xx drop (FIB lookup failed, 4) flow 0xb902961c to endpoint 0, ifindex 2, file nodeport.h:1533, , identity unknown->unknown: [fd4d:d4a6:3301:b26a::193]:80 -> [fe80::1234:5678:9abc]:51516 tcp SYN, ACK`

**Setup Details**
CloudProvider: AKS
CiliumConfig: IPv6Enabled, native routing, delegated ipam. Attached sysdump
NodeIP: fde9:48a7:d155:3659::5/128
PodIP: fd4d:d4a6:3301:b26a::193
NodePort: 32260
HealthProbe port: 32260
Healthprobe Src: fe80::1234:5678:9abc (link local)
Healthprobe dst: fde9:48a7:d155:3659::5(nodeip)
nftable modified src ip for health probe: 2603:1062:0:1:fe80:1234:5678:9abc

**nftable rules:**
```
define slb_lla = fe80::1234:5678:9abc
define slb_gua = 2603:1062:0:1:fe80:1234:5678:9abc

table ip6 azureSLBProbe
delete table ip6 azureSLBProbe

table ip6 azureSLBProbe {
    chain prerouting {
        type filter hook prerouting priority -300;

        # Add a rule that accepts router discovery packets without mangling or ipv6 breaks after
        # 9000 seconds when the default route times out
        iifname eth0 icmpv6 type { nd-neighbor-solicit, nd-router-advert, nd-neighbor-advert } counter accept

        # Map packets from the LB probe LLA to a SLA IP instead
        iifname eth0 ip6 saddr $slb_lla ip6 saddr set $slb_gua counter
    }
    chain postrouting {
        type filter hook postrouting priority -300;

        # Reverse the modification on the way back out
        oifname eth0 ip6 daddr $slb_gua ip6 daddr set $slb_lla counter
    }
}
```
**tcpdump capture on VM eth0 (netdevice)**

```
root@aks-nodepool1-35563861-vmss000001:/# tcpdump -ni eth0 -e ip6 and port 32260

19:44:18.758508 12:34:56:78:9a:bc > 00:22:48:71:6a:bf, ethertype IPv6 (0x86dd), length 86: fe80::1234:5678:9abc.51516 > fde9:48a7:d155:3659::5.32260: Flags [SEW], seq 3711416899, win 64800, options [mss 1440,nop,wscale 8,nop,nop,sackOK], length 0
```

Health port is same as nodeport which is 32260 and from above, we could see health probes are coming from link local source address to <nodeip:nodport>

**tcpdump capture on pod host veth (lxcb044218ddd3e)**:

```
root@aks-nodepool1-35563861-vmss000001:/# tcpdump -nli lxcb044218ddd3e -e ip6 and port 80

19:44:19.763563 96:18:ae:2c:b4:56 > 4e:0e:70:5d:de:25, ethertype IPv6 (0x86dd), length 86: 2603:1062:0:1:fe80:1234:5678:9abc.51516 > fd4d:d4a6:3301:b26a::193.80: Flags [SEW], seq 3711416899, win 64800, options [mss 1440,nop,wscale 8,nop,nop,sackOK], length 0
19:44:19.763588 4e:0e:70:5d:de:25 > 96:18:ae:2c:b4:56, ethertype IPv6 (0x86dd), length 86: fd4d:d4a6:3301:b26a::193.80 > 2603:1062:0:1:fe80:1234:5678:9abc.51516: Flags [S.], seq 277372771, ack 3711416900, win 64800, options [mss 1440,nop,nop,sackOK,nop,wscale 7], length 0
```

From above, you could see nftable prerouting rule changing src ip from `fe80::1234:5678:9abc` to `2603:1062:0:1:fe80:1234:5678:9abc` and also there is return packet with syn+ack back from the pod but this return packet doesn't  get to eth0. Looks like cilium dropped this packet due to this error:
`xx drop (FIB lookup failed, 4) flow 0xb902961c to endpoint 0, ifindex 2, file nodeport.h:1533, , identity unknown->unknown: [fd4d:d4a6:3301:b26a::193]:80 -> [fe80::1234:5678:9abc]:61358 tcp SYN, ACK`

Error code `4` indicates `BPF_FIB_LKUP_RET_NOT_FWDED`. I hope this means packet cannot be forwarded. This is confusing to me because as per nftable rule the return packet (syn+ack) destination ip should be changed to  original src ip (`fe80::1234:5678:9abc`) only in POSTROUTING chain and if output interface name matches eth0. Based on above error, looks like `fib_lookup` happens after destination IP got changed. Does fib lookup happen after packet routed to node nic eth0? Looking for some guidance on how we can solve this issue.

### Cilium Version

1.14.4

### Kernel Version

Linux aks-nodepool1-35563861-vmss000001 5.15.0-1057-azure #65-Ubuntu SMP Fri Feb 9 18:39:24 UTC 2024 x86_64 x86_64 x86_64 GNU/Linux

### Kubernetes Version

1.29

### Sysdump

[cilium-sysdump-20240311-130541.zip](https://github.com/cilium/cilium/files/14564069/cilium-sysdump-20240311-130541.zip)

### Cilium Users Document

- [X] Are you a user of Cilium? Please add yourself to the [Users doc](https://github.com/cilium/cilium/blob/main/USERS.md)

### Code of Conduct

- [X] I agree to follow this project's Code of Conduct

**Comment by nickolaev** [comment]
Some related discussion here - https://github.com/cilium/cilium/issues/30450

**Comment by tamilmani1989** [comment]
> Some related discussion here - #30450

@nickolaev seems to be not related to above issue

**Comment by nickolaev** [comment]
Seem like this has been tackled in https://github.com/Azure/azure-container-networking/pull/2710

**Comment by amitmavgupta** [comment]
@tamilmani1989 can we close this issue now that 2710 has been merged and public preview for the feature is available as well?
