### ISSUE TITLE
Packets targeting the cilium health IP address possibly looping between cilium_host and cilium_net on agent restart 

### ISSUE THREAD

**Issue by giorio94** [cilium/cilium#30326]
### Is there an existing issue for this?

- [X] I have searched the existing issues

### What happened?

I've discovered this issue while investigating errors like the following one reported by the Cilium CLI:

```
🟥 Found unexpected packet drops:
{
  "labels": {
    "direction": "EGRESS",
    "reason": "Unknown ICMPv4 code"
  },
  "name": "cilium_drop_count_total",
  "value": 10
}
```

Which according to the hubble flows (at least in the case I was lucky enough to get it captured) was caused by:

``` 
Jan 18 10:50:17.575: 172.18.0.2 (host) <> 172.18.0.4 (remote-node) Unsupported protocol for NAT masquerade DROPPED (ICMPv4 TimeExceeded(TTLExceeded))
Jan 18 10:50:17.575: fc00:f853:ccd:e793::2 (host) <> fc00:f853:ccd:e793::4 (remote-node) Unsupported protocol for NAT masquerade DROPPED (ICMPv6 TimeExceeded(HopLimitExceeded))
```

Clarification edit: the dropped flow above was not the cause of the Cilium CLI failure, as the error message is different (and this specific one is [already ignored](https://github.com/cilium/cilium-cli/blob/43fd00729dd213a4a3fdef100a098dc722a44332/defaults/defaults.go#L201)), but the considerations in the rest of this issue still apply.

Looking at the rest of the hubble flows, the cause appeared to be one packet targeting the health endpoint on that node being looped until the TTL expired, in turn generating the TTL exceeded ICMP message, which is not supported by the BPF masquerading logic, hence causing the increase of the metric:

```
Jan 18 10:50:17.572: 172.18.0.4:38892 (remote-node) <> 10.242.0.38:4240 (ID:9) from-network FORWARDED (TCP Flags: ACK, FIN)
Jan 18 10:50:17.572: 172.18.0.4:38892 (ID:9) <> 10.242.0.38:4240 (ID:9) from-host FORWARDED (TCP Flags: ACK, FIN)
Jan 18 10:50:17.572: 172.18.0.4:38892 (remote-node) <> 10.242.0.38:4240 (ID:9) to-stack FORWARDED (TCP Flags: ACK, FIN)
Jan 18 10:50:17.572: 172.18.0.4:38892 (ID:9) <> 10.242.0.38:4240 (ID:9) from-host FORWARDED (TCP Flags: ACK, FIN)
```

I managed to reproduce this issue locally in a pretty consistent way with the following steps:

* Create a new kind cluster: `KUBEPROXY_MODE=none WORKERS=2 make kind`
* Install cilium with default settings: `cilium install` (KPR will be automatically enabled given that kube-proxy is not deployed); BPF masquerade is not necessary for this to happen, only for it to be flagged by the CLI
* Run `cilium connectivity test --test='none'` to start a bunch of pods for the subsequent steps
* Retrieve the hosting node and pod IP address of one of the client pods, e.g., `kind-worker` and `10.244.1.245`
* Exec into one of the host-netns pods on another node (e.g., `kind-worker2`) and run `tcpdump -ni any -vv 'host $CLIENT_POD_IP or (icmp and icmp[0] == 11)'`
* Retrieve the current cilium health IP address associated with node `kind-worker2` from the CiliumNode resource, say `10.244.2.199`
* Restart all cilium agents
* While the agents are down, run `curl $CILIUM_HEALTH_IP:4240` from the client pod previously selected

The curl request will timeout, as expected, given that the health IP address changed on restart. If you are lucky, one of the syn packets will start looping, as observed through the tcpdump capture:

```
15:20:42.422270 cilium_vxlan P   IP (tos 0x0, ttl 64, id 25614, offset 0, flags [DF], proto TCP (6), length 60)
    10.244.1.245.40522 > 10.244.2.199.4240: Flags [S], cksum 0x1ad2 (incorrect -> 0x1be8), seq 2025795564, win 64860, options [mss 1410,sackOK,TS val 1692817373 ecr 0,nop,wscale 7], length 0
15:20:43.423946 cilium_vxlan P   IP (tos 0x0, ttl 64, id 25615, offset 0, flags [DF], proto TCP (6), length 60)
    10.244.1.245.40522 > 10.244.2.199.4240: Flags [S], cksum 0x1ad2 (incorrect -> 0x17fe), seq 2025795564, win 64860, options [mss 1410,sackOK,TS val 1692818375 ecr 0,nop,wscale 7], length 0
15:20:45.443932 cilium_vxlan P   IP (tos 0x0, ttl 64, id 25616, offset 0, flags [DF], proto TCP (6), length 60)
    10.244.1.245.40522 > 10.244.2.199.4240: Flags [S], cksum 0x1ad2 (incorrect -> 0x101a), seq 2025795564, win 64860, options [mss 1410,sackOK,TS val 1692820395 ecr 0,nop,wscale 7], length 0
15:20:49.535986 cilium_vxlan P   IP (tos 0x0, ttl 64, id 25617, offset 0, flags [DF], proto TCP (6), length 60)
    10.244.1.245.40522 > 10.244.2.199.4240: Flags [S], cksum 0x1ad2 (incorrect -> 0x001e), seq 2025795564, win 64860, options [mss 1410,sackOK,TS val 1692824487 ecr 0,nop,wscale 7], length 0
15:20:49.535993 cilium_net Out IP (tos 0x0, ttl 63, id 25617, offset 0, flags [DF], proto TCP (6), length 60)
    10.244.1.245.40522 > 10.244.2.199.4240: Flags [S], cksum 0x1ad2 (incorrect -> 0x001e), seq 2025795564, win 64860, options [mss 1410,sackOK,TS val 1692824487 ecr 0,nop,wscale 7], length 0
15:20:49.535994 cilium_host In  IP (tos 0x0, ttl 63, id 25617, offset 0, flags [DF], proto TCP (6), length 60)
    10.244.1.245.40522 > 10.244.2.199.4240: Flags [S], cksum 0x1ad2 (incorrect -> 0x001e), seq 2025795564, win 64860, options [mss 1410,sackOK,TS val 1692824487 ecr 0,nop,wscale 7], length 0
15:20:49.536015 cilium_host Out IP (tos 0x0, ttl 62, id 25617, offset 0, flags [DF], proto TCP (6), length 60)
    10.244.1.245.40522 > 10.244.2.199.4240: Flags [S], cksum 0x1ad2 (incorrect -> 0x001e), seq 2025795564, win 64860, options [mss 1410,sackOK,TS val 1692824487 ecr 0,nop,wscale 7], length 0
15:20:49.536016 cilium_net In  IP (tos 0x0, ttl 62, id 25617, offset 0, flags [DF], proto TCP (6), length 60)
    10.244.1.245.40522 > 10.244.2.199.4240: Flags [S], cksum 0x1ad2 (incorrect -> 0x001e), seq 2025795564, win 64860, options [mss 1410,sackOK,TS val 1692824487 ecr 0,nop,wscale 7], length 0
15:20:49.536018 cilium_host Out IP (tos 0x0, ttl 61, id 25617, offset 0, flags [DF], proto TCP (6), length 60)
    10.244.1.245.40522 > 10.244.2.199.4240: Flags [S], cksum 0x1ad2 (incorrect -> 0x001e), seq 2025795564, win 64860, options [mss 1410,sackOK,TS val 1692824487 ecr 0,nop,wscale 7], length 0
15:20:49.536018 cilium_net In  IP (tos 0x0, ttl 61, id 25617, offset 0, flags [DF], proto TCP (6), length 60)
    10.244.1.245.40522 > 10.244.2.199.4240: Flags [S], cksum 0x1ad2 (incorrect -> 0x001e), seq 2025795564, win 64860, options [mss 1410,sackOK,TS val 1692824487 ecr 0,nop,wscale 7], length 0
15:20:49.536019 cilium_host Out IP (tos 0x0, ttl 60, id 25617, offset 0, flags [DF], proto TCP (6), length 60)
    10.244.1.245.40522 > 10.244.2.199.4240: Flags [S], cksum 0x1ad2 (incorrect -> 0x001e), seq 2025795564, win 64860, options [mss 1410,sackOK,TS val 1692824487 ecr 0,nop,wscale 7], length 0
15:20:49.536019 cilium_net In  IP (tos 0x0, ttl 60, id 25617, offset 0, flags [DF], proto TCP (6), length 60)
    10.244.1.245.40522 > 10.244.2.199.4240: Flags [S], cksum 0x1ad2 (incorrect -> 0x001e), seq 2025795564, win 64860, options [mss 1410,sackOK,TS val 1692824487 ecr 0,nop,wscale 7], length 0
15:20:49.536020 cilium_host Out IP (tos 0x0, ttl 59, id 25617, offset 0, flags [DF], proto TCP (6), length 60)
    10.244.1.245.40522 > 10.244.2.199.4240: Flags [S], cksum 0x1ad2 (incorrect -> 0x001e), seq 2025795564, win 64860, options [mss 1410,sackOK,TS val 1692824487 ecr 0,nop,wscale 7], length 0
15:20:49.536020 cilium_net In  IP (tos 0x0, ttl 59, id 25617, offset 0, flags [DF], proto TCP (6), length 60)
    10.244.1.245.40522 > 10.244.2.199.4240: Flags [S], cksum 0x1ad2 (incorrect -> 0x001e), seq 2025795564, win 64860, options [mss 1410,sackOK,TS val 1692824487 ecr 0,nop,wscale 7], length 0
15:20:49.536021 cilium_host Out IP (tos 0x0, ttl 58, id 25617, offset 0, flags [DF], proto TCP (6), length 60)
    10.244.1.245.40522 > 10.244.2.199.4240: Flags [S], cksum 0x1ad2 (incorrect -> 0x001e), seq 2025795564, win 64860, options [mss 1410,sackOK,TS val 1692824487 ecr 0,nop,wscale 7], length 0
15:20:49.536021 cilium_net In  IP (tos 0x0, ttl 58, id 25617, offset 0, flags [DF], proto TCP (6), length 60)
    10.244.1.245.40522 > 10.244.2.199.4240: Flags [S], cksum 0x1ad2 (incorrect -> 0x001e), seq 2025795564, win 64860, options [mss 1410,sackOK,TS val 1692824487 ecr 0,nop,wscale 7], length 0
...
15:20:49.536076 cilium_net In  IP (tos 0x0, ttl 4, id 25617, offset 0, flags [DF], proto TCP (6), length 60)
    10.244.1.245.40522 > 10.244.2.199.4240: Flags [S], cksum 0x1ad2 (incorrect -> 0x001e), seq 2025795564, win 64860, options [mss 1410,sackOK,TS val 1692824487 ecr 0,nop,wscale 7], length 0
15:20:49.536077 cilium_host Out IP (tos 0x0, ttl 3, id 25617, offset 0, flags [DF], proto TCP (6), length 60)
    10.244.1.245.40522 > 10.244.2.199.4240: Flags [S], cksum 0x1ad2 (incorrect -> 0x001e), seq 2025795564, win 64860, options [mss 1410,sackOK,TS val 1692824487 ecr 0,nop,wscale 7], length 0
15:20:49.536077 cilium_net In  IP (tos 0x0, ttl 3, id 25617, offset 0, flags [DF], proto TCP (6), length 60)
    10.244.1.245.40522 > 10.244.2.199.4240: Flags [S], cksum 0x1ad2 (incorrect -> 0x001e), seq 2025795564, win 64860, options [mss 1410,sackOK,TS val 1692824487 ecr 0,nop,wscale 7], length 0
15:20:49.536079 cilium_host Out IP (tos 0x0, ttl 2, id 25617, offset 0, flags [DF], proto TCP (6), length 60)
    10.244.1.245.40522 > 10.244.2.199.4240: Flags [S], cksum 0x1ad2 (incorrect -> 0x001e), seq 2025795564, win 64860, options [mss 1410,sackOK,TS val 1692824487 ecr 0,nop,wscale 7], length 0
15:20:49.536079 cilium_net In  IP (tos 0x0, ttl 2, id 25617, offset 0, flags [DF], proto TCP (6), length 60)
    10.244.1.245.40522 > 10.244.2.199.4240: Flags [S], cksum 0x1ad2 (incorrect -> 0x001e), seq 2025795564, win 64860, options [mss 1410,sackOK,TS val 1692824487 ecr 0,nop,wscale 7], length 0
15:20:49.536080 cilium_host Out IP (tos 0x0, ttl 1, id 25617, offset 0, flags [DF], proto TCP (6), length 60)
    10.244.1.245.40522 > 10.244.2.199.4240: Flags [S], cksum 0x1ad2 (incorrect -> 0x001e), seq 2025795564, win 64860, options [mss 1410,sackOK,TS val 1692824487 ecr 0,nop,wscale 7], length 0
15:20:49.536080 cilium_net In  IP (tos 0x0, ttl 1, id 25617, offset 0, flags [DF], proto TCP (6), length 60)
    10.244.1.245.40522 > 10.244.2.199.4240: Flags [S], cksum 0x1ad2 (incorrect -> 0x001e), seq 2025795564, win 64860, options [mss 1410,sackOK,TS val 1692824487 ecr 0,nop,wscale 7], length 0
15:20:50.095847 lo    In  IP (tos 0xc0, ttl 64, id 48977, offset 0, flags [none], proto ICMP (1), length 80)
    10.244.2.19 > 10.244.2.19: ICMP time exceeded in-transit, length 60
        IP (tos 0x0, ttl 1, id 50699, offset 0, flags [DF], proto TCP (6), length 52)
```

### Cilium Version

cilium-cli: v0.15.20 compiled with go1.21.6 on linux/amd64
cilium image (running): 1.14.5

Reproduced with a recent main build as well.

### Kernel Version

Debian 6.1.67-1 (2023-12-12) x86_64 GNU/Linux

### Code of Conduct

- [X] I agree to follow this project's Code of Conduct

**Comment by aditighag** [comment]
@giorio94 Thanks for the detailed bug report, and repro steps. 

>The curl request will timeout, as expected, given that the health IP address changed on restart

Why does the health IP address change on restart? Is that expected?

Any chance you managed to save the sysdump?

**Comment by giorio94** [comment]
> @giorio94 Thanks for the detailed bug report, and repro steps.
> 
> > The curl request will timeout, as expected, given that the health IP address changed on restart
> 
> Why does the health IP address change on restart? Is that expected?
> 

Not sure honestly. But it seems related to https://github.com/cilium/cilium/issues/29019 (https://github.com/cilium/cilium/pull/29460 recently fixed the CiliumInternalIP part). https://github.com/cilium/cilium/pull/29964 is related as well, and mentions the flapping of the health IP.

> Any chance you managed to save the sysdump?

Not for that specific run, but here it is one: [cilium-sysdump-20240119-090653.zip](https://github.com/cilium/cilium/files/13986192/cilium-sysdump-20240119-090653.zip)

**Comment by aditighag** [comment]
Hmm... I've added agent label as well considering the health IP address restoration issue. Cilium health ip address has a special reserved identity, and it could cause issues if the ip address overlaps with another pod ip. 
If you have the cluster in the problematic state, I would suggest taking a sysdump before and after agent restart, so that the health ip addresses can be compared.

**Comment by tommyp1ckles** [comment]
I believe the health endpoint is always always recreated upon restarted:

1. Old endpoint state is removed here: https://github.com/isovalent/cilium/blob/pr/tp/feature-gates/daemon/cmd/state.go#L68-L81 and marked invalid for restore.
2. Endpoint appears to be [allocated from ipam  ](https://github.com/isovalent/cilium/blob/pr/tp/feature-gates/daemon/cmd/ipam.go#L313)

**Comment by giorio94** [comment]
> it could cause issues if the ip address overlaps with another pod (or cilium_host) ip

I'm pretty confident this didn't happen (at least in my tests), as there was not other pod churn except for the agent restart.

Just for the sake of clarity, I was able to cause one packet to loop only once per agent restart, then it resolves automatically. It may be something related with the ordering of endpoints regeneration.

**Comment by suse-coder** [comment]
Get the same:
 cilium connectivity test
ℹ️  Single-node environment detected, enabling single-node connectivity test
ℹ️  Monitor aggregation detected, will skip some flow validation steps
⌛ [talos-cluster] Waiting for deployment cilium-test-1/client to become ready...
⌛ [talos-cluster] Waiting for deployment cilium-test-1/client2 to become ready...
⌛ [talos-cluster] Waiting for deployment cilium-test-1/echo-same-node to become ready...
⌛ [talos-cluster] Waiting for pod cilium-test-1/client-b65598b6f-nt667 to reach DNS server on cilium-test-1/echo-same-node-799fbb4f76-2777b pod...
⌛ [talos-cluster] Waiting for pod cilium-test-1/client2-84576868b4-d6tlb to reach DNS server on cilium-test-1/echo-same-node-799fbb4f76-2777b pod...
⌛ [talos-cluster] Waiting for pod cilium-test-1/client-b65598b6f-nt667 to reach default/kubernetes service...
⌛ [talos-cluster] Waiting for pod cilium-test-1/client2-84576868b4-d6tlb to reach default/kubernetes service...
⌛ [talos-cluster] Waiting for Service cilium-test-1/echo-same-node to become ready...
⌛ [talos-cluster] Waiting for Service cilium-test-1/echo-same-node to be synchronized by Cilium pod kube-system/cilium-45sh8
⌛ [talos-cluster] Waiting for NodePort 10.0.4.129:31876 (cilium-test-1/echo-same-node) to become ready...
⌛ [talos-cluster] Waiting for NodePort 10.0.4.149:31876 (cilium-test-1/echo-same-node) to become ready...
ℹ️  Skipping IPCache check
🔭 Enabling Hubble telescope...
ℹ️  Hubble is OK, flows: 8190/8190, connected nodes: 2, unavailable nodes 0
ℹ️  Cilium version: 1.16.4
🏃[cilium-test-1] Running 103 tests ...
[=] [cilium-test-1] Test [no-unexpected-packet-drops] [1/103]
.
  [.] Action [no-unexpected-packet-drops/no-unexpected-packet-drops/talos-cluster/talos-controlplane-0]
  [-] Scenario [no-unexpected-packet-drops/no-unexpected-packet-drops]
  [.] Action [no-unexpected-packet-drops/no-unexpected-packet-drops/talos-cluster/talos-worker-0]
  ❌ Found unexpected packet drops:
{
  "labels": {
    "direction": "EGRESS",
    "reason": "CT: Unknown L4 protocol"
  },
  "name": "cilium_drop_count_total",
  "value": 4
}
{
  "labels": {
    "direction": "EGRESS",
    "reason": "TTL exceeded"
  },
  "name": "cilium_drop_count_total",
  "value": 2586
}
.[=] [cilium-test-1] Test [no-policies] [2/103]

**Comment by Skaronator** [comment]
@suse-coder I run into the exact same test result using two Talos VMs (worker + control plane). Did you find a solution?

**Comment by suse-coder** [comment]
I updated to the latest version of cilium. And did a 

kubectl -n kube-system rollout restart daemonset cilium
kubectl -n kube-system rollout restart daemonset cilium-envoy
kubectl -n kube-system rollout restart deployment cilium-operator
