### ISSUE TITLE
BGP Control Plane + Native Routing + LB-IPAM + BPF masquarade results in unable to accept IPv6 traffic on LoadBalancer (1.14.0-rc.0)

### ISSUE THREAD

**Issue by samip5** [cilium/cilium#26816]
### Is there an existing issue for this?

- [X] I have searched the existing issues

### What happened?

I tried to create a multi-stack load-balancer but it's unable to accept traffic on IPv6 despite the allocation of it's IP seems to have worked.

### Cilium Version

cilium-cli: v0.12.1 compiled with go1.18.5 on linux/amd64
cilium image (default): v1.12.0
cilium image (stable): v1.13.4
cilium image (running): v1.14.0-rc.0

### Kernel Version

5.19.0-1022-raspi
5.19.0-46-generic
6.1.0-10-amd64
6.1.38-060138-generic

### Kubernetes Version

```json
{
  "clientVersion": {
    "major": "1",
    "minor": "27",
    "gitVersion": "v1.27.2",
    "gitCommit": "7f6f68fdabc4df88cfea2dcf9a19b2b830f1e647",
    "gitTreeState": "archive",
    "buildDate": "2023-07-03T16:23:17Z",
    "goVersion": "go1.20.5",
    "compiler": "gc",
    "platform": "linux/amd64"
  },
  "kustomizeVersion": "v5.0.1",
  "serverVersion": {
    "major": "1",
    "minor": "26",
    "gitVersion": "v1.26.3+k3s1",
    "gitCommit": "01ea3ff27be0b04f945179171cec5a8e11a14f7b",
    "gitTreeState": "clean",
    "buildDate": "2023-03-27T22:23:17Z",
    "goVersion": "go1.19.7",
    "compiler": "gc",
    "platform": "linux/amd64"
  }
}
```

### Sysdump

[cilium-sysdump-20230714-013030.zip](https://github.com/cilium/cilium/files/12044880/cilium-sysdump-20230714-013030.zip)

### Relevant log output

```shell
# operator
level=error msg="service upsert failed" error="handleUpsertService: stripOrImportIngresses: Error while attempting to allocate IP '2001:67c:1104:fdb::'" subsys=lbipam
level=error msg="service upsert failed" error="handleUpsertService: stripOrImportIngresses: Error while attempting to allocate IP '2001:67c:1104:fdb::'" subsys=lbipam
level=error msg="service upsert failed" error="handleUpsertService: stripOrImportIngresses: Error while attempting to allocate IP '2001:67c:1104:fdb::'" subsys=lbipam
# agent
evel=debug msg="create Destination" Nlri="2001:67c:1104:fdb::4443/128" Topic=Table asn=213021 component=gobgp.BgpServerInstance subsys=bgp-control-plane
level=debug msg="Restoring service" serviceID=406 serviceIP="[2001:67c:1104:fdb::4443]:80" subsys=service
level=debug msg="Restoring service" l3n4Addr="{AddrCluster:2001:67c:1104:fdb::4443 L4Addr:{Protocol:NONE Port:80} Scope:0}" subsys=service
level=debug msg="Restoring service" serviceID=407 serviceIP="[2001:67c:1104:fdb::4443]:443" subsys=service
level=debug msg="Restoring service" l3n4Addr="{AddrCluster:2001:67c:1104:fdb::4443 L4Addr:{Protocol:NONE Port:443} Scope:0}" subsys=service
level=debug msg="Upserting service" backends="[]" l7LBFrontendPorts="[]" l7LBProxyPort=0 loadBalancerSourceRanges="[]" serviceIP="{2001:67c:1104:fdb::4443 {TCP 80} 0}" serviceName=ingress-nginx-controller serviceNamespace=networking sessionAffinity=false sessionAffinityTimeout=0 subsys=service svcExtTrafficPolicy=Cluster svcHealthCheckNodePort=0 svcIntTrafficPolicy=Cluster svcType=LoadBalancer
level=debug msg="Acquired service ID" backends="[]" l7LBFrontendPorts="[]" l7LBProxyPort=0 loadBalancerSourceRanges="[]" serviceID=406 serviceIP="{2001:67c:1104:fdb::4443 {TCP 80} 0}" serviceName=ingress-nginx-controller serviceNamespace=networking sessionAffinity=false sessionAffinityTimeout=0 subsys=service svcExtTrafficPolicy=Cluster svcHealthCheckNodePort=0 svcIntTrafficPolicy=Cluster svcType=LoadBalancer
level=debug msg="Upserted service entry" backendSlot=0 subsys=map-lb svcKey="[2001:67c:1104:fdb::4443]:20480" svcVal="0 0 (38401) [0x60 0x0]"
level=debug msg="Upserting service" backends="[]" l7LBFrontendPorts="[]" l7LBProxyPort=0 loadBalancerSourceRanges="[]" serviceIP="{2001:67c:1104:fdb::4443 {TCP 443} 0}" serviceName=ingress-nginx-controller serviceNamespace=networking sessionAffinity=false sessionAffinityTimeout=0 subsys=service svcExtTrafficPolicy=Cluster svcHealthCheckNodePort=0 svcIntTrafficPolicy=Cluster svcType=LoadBalancer
level=debug msg="Acquired service ID" backends="[]" l7LBFrontendPorts="[]" l7LBProxyPort=0 loadBalancerSourceRanges="[]" serviceID=407 serviceIP="{2001:67c:1104:fdb::4443 {TCP 443} 0}" serviceName=ingress-nginx-controller serviceNamespace=networking sessionAffinity=false sessionAffinityTimeout=0 subsys=service svcExtTrafficPolicy=Cluster svcHealthCheckNodePort=0 svcIntTrafficPolicy=Cluster svcType=LoadBalancer
level=debug msg="Upserted service entry" backendSlot=0 subsys=map-lb svcKey="[2001:67c:1104:fdb::4443]:47873" svcVal="0 0 (38657) [0x60 0x0]"
level=debug msg="Upserting service" backends="[[fddf:f7bc:9670:2::42be]:80 [fddf:f7bc:9670:3::f814]:80]" l7LBFrontendPorts="[]" l7LBProxyPort=0 loadBalancerSourceRanges="[]" serviceIP="{2001:67c:1104:fdb::4443 {TCP 80} 0}" serviceName=ingress-nginx-controller serviceNamespace=networking sessionAffinity=false sessionAffinityTimeout=0 subsys=service svcExtTrafficPolicy=Cluster svcHealthCheckNodePort=0 svcIntTrafficPolicy=Cluster svcType=LoadBalancer
level=debug msg="Acquired service ID" backends="[[fddf:f7bc:9670:2::42be]:80 [fddf:f7bc:9670:3::f814]:80]" l7LBFrontendPorts="[]" l7LBProxyPort=0 loadBalancerSourceRanges="[]" serviceID=406 serviceIP="{2001:67c:1104:fdb::4443 {TCP 80} 0}" serviceName=ingress-nginx-controller serviceNamespace=networking sessionAffinity=false sessionAffinityTimeout=0 subsys=service svcExtTrafficPolicy=Cluster svcHealthCheckNodePort=0 svcIntTrafficPolicy=Cluster svcType=LoadBalancer
level=debug msg="Upserted service entry" backendSlot=1 subsys=map-lb svcKey="[2001:67c:1104:fdb::4443]:20480" svcVal="1708 0 (38401) [0x0 0x0]"
level=debug msg="Upserted service entry" backendSlot=2 subsys=map-lb svcKey="[2001:67c:1104:fdb::4443]:20480" svcVal="1709 0 (38401) [0x0 0x0]"
level=debug msg="Upserted service entry" backendSlot=0 subsys=map-lb svcKey="[2001:67c:1104:fdb::4443]:20480" svcVal="0 2 (38401) [0x60 0x0]"
level=debug msg="Upserting service" backends="[[fddf:f7bc:9670:2::42be]:443 [fddf:f7bc:9670:3::f814]:443]" l7LBFrontendPorts="[]" l7LBProxyPort=0 loadBalancerSourceRanges="[]" serviceIP="{2001:67c:1104:fdb::4443 {TCP 443} 0}" serviceName=ingress-nginx-controller serviceNamespace=networking sessionAffinity=false sessionAffinityTimeout=0 subsys=service svcExtTrafficPolicy=Cluster svcHealthCheckNodePort=0 svcIntTrafficPolicy=Cluster svcType=LoadBalancer
level=debug msg="Acquired service ID" backends="[[fddf:f7bc:9670:2::42be]:443 [fddf:f7bc:9670:3::f814]:443]" l7LBFrontendPorts="[]" l7LBProxyPort=0 loadBalancerSourceRanges="[]" serviceID=407 serviceIP="{2001:67c:1104:fdb::4443 {TCP 443} 0}" serviceName=ingress-nginx-controller serviceNamespace=networking sessionAffinity=false sessionAffinityTimeout=0 subsys=service svcExtTrafficPolicy=Cluster svcHealthCheckNodePort=0 svcIntTrafficPolicy=Cluster svcType=LoadBalancer
level=debug msg="Upserted service entry" backendSlot=1 subsys=map-lb svcKey="[2001:67c:1104:fdb::4443]:47873" svcVal="1710 0 (38657) [0x0 0x0]"
level=debug msg="Upserted service entry" backendSlot=2 subsys=map-lb svcKey="[2001:67c:1104:fdb::4443]:47873" svcVal="1711 0 (38657) [0x0 0x0]"
level=debug msg="Upserted service entry" backendSlot=0 subsys=map-lb svcKey="[2001:67c:1104:fdb::4443]:47873" svcVal="0 2 (38657) [0x60 0x0]"
level=debug msg="sent update" Key="2001:14ba:16fd:961c::1" State=BGP_FSM_ESTABLISHED Topic=Peer asn=213021 attributes="[{Origin: i}  {LocalPref: 100} {MpReach(ipv6-unicast): {Nexthop: 2001:14ba:16fd:961c:ee8e:b5ff:fe7b:efaa, NLRIs: [2001:67c:1104:fdb::4443/128]}}]" component=gobgp.BgpServerInstance nlri="[]" subsys=bgp-control-plane withdrawals="[]"
```

### Anything else?

Current Helm values: <https://github.com/samip5/k8s-cluster/blob/22b9c7c6448ad2c6164b9891a73c82320636bc9a/cluster/apps/cilium-system/cilium/app/helm-release.yaml>

Output of `cilium-health status` is available at: https://bpa.st/6VEP2 (Seems to be that endpoint connectivity via IPv6 is not working, but is that the issue?)

I can see the packet arriving at the node:
```
02:03:35.412490 IP6 (flowlabel 0xde09b, hlim 63, next-header unknown (60) payload length: 68) 2001:14ba:16fd:9610:2468:bebf:3024:a6d0 > fddf:f7bc:9670:2::42be: DSTOPT (opt_type 0x1b: len=20) 51275 > 443: Flags [SEW], cksum 0x1072 (correct), seq 558173269, win 65535, options [mss 1440,nop,wscale 6,nop,nop,TS val 2895910638 ecr 0,sackOK,eol], length 0
```

### Code of Conduct

- [X] I agree to follow this project's Code of Conduct

**Comment by samip5** [comment]
It seems that BPF masquarade is the issue as no traffic from pods over IPv6 work with it enabled.

**Comment by samip5** [comment]
It seems that no matter what I did, it wasn't able to find the default virtual router, and thus IPv6 failed.

```
04:19:35.628967 lxcd62d57036892 M   IP6 fddf:f7bc:9670:2::568a > ff02::1:ff00:c762: ICMP6, neighbor solicitation, who has fddf:f7bc:9670:2::c762, length 32
04:19:35.629043 lxcd62d57036892 Out IP6 ffff:ffff:9670:2::c762 > fddf:f7bc:9670:2::568a: ICMP6, neighbor advertisement, tgt is fddf:f7bc:9670:2::c762, length 32
04:19:36.664316 lxcd62d57036892 M   IP6 fddf:f7bc:9670:2::568a > ff02::1:ff00:c762: ICMP6, neighbor solicitation, who has fddf:f7bc:9670:2::c762, length 32
04:19:36.664343 lxcd62d57036892 Out IP6 ffff:ffff:9670:2::c762 > fddf:f7bc:9670:2::568a: ICMP6, neighbor advertisement, tgt is fddf:f7bc:9670:2::c762, length 32
04:19:37.677043 lxcd62d57036892 M   IP6 fddf:f7bc:9670:2::568a > ff02::1:ff00:c762: ICMP6, neighbor solicitation, who has fddf:f7bc:9670:2::c762, length 32
04:19:37.677073 lxcd62d57036892 Out IP6 ffff:ffff:9670:2::c762 > fddf:f7bc:9670:2::568a: ICMP6, neighbor advertisement, tgt is fddf:f7bc:9670:2::c762, length 32
04:19:38.701036 lxcd62d57036892 M   IP6 fddf:f7bc:9670:2::568a > ff02::1:ff00:c762: ICMP6, neighbor solicitation, who has fddf:f7bc:9670:2::c762, length 32
04:19:38.701074 lxcd62d57036892 Out IP6 ffff:ffff:9670:2::c762 > fddf:f7bc:9670:2::568a: ICMP6, neighbor advertisement, tgt is fddf:f7bc:9670:2::c762, length 32
04:19:39.753768 lxcd62d57036892 M   IP6 fddf:f7bc:9670:2::568a > ff02::1:ff00:c762: ICMP6, neighbor solicitation, who has fddf:f7bc:9670:2::c762, length 32
04:19:39.753788 lxcd62d57036892 Out IP6 ffff:ffff:9670:2::c762 > fddf:f7bc:9670:2::568a: ICMP6, neighbor advertisement, tgt is fddf:f7bc:9670:2::c762, length 32
```

It does work on 1.13.4

**Comment by samip5** [comment]
I have located the problem, it has to do with the helm option `enableIPv6Masqurade` as if it's default aka enabled, it will result in:

```
Jul 22 10:04:30.313: 2001:14ba:16fd:961d:e65f:1ff:fe1b:3293 (host) <> 2001:67c:1be8::11 (world) Unsupported protocol for NAT masquerade DROPPED (ICMPv6 TimeExceeded(HopLimitExceeded))
Jul 22 10:04:30.563: 2001:14ba:16fd:961d:e65f:1ff:fe1b:3293 (host) <> 2001:67c:1be8::11 (world) Unsupported protocol for NAT masquerade DROPPED (ICMPv6 DestinationUnreachable(AddressUnreachable))
Jul 22 10:04:30.563: 2001:14ba:16fd:961d:e65f:1ff:fe1b:3293 (host) <> 2001:67c:1be8::11 (world) Unsupported protocol for NAT masquerade DROPPED (ICMPv6 DestinationUnreachable(AddressUnreachable))
Jul 22 10:04:30.563: 2001:14ba:16fd:961d:e65f:1ff:fe1b:3293 (host) <> 2001:67c:1be8::11 (world) Unsupported protocol for NAT masquerade DROPPED (ICMPv6 DestinationUnreachable(AddressUnreachable))
Jul 22 10:04:30.563: 2001:14ba:16fd:961d:e65f:1ff:fe1b:3293 (host) <> 2001:67c:1be8::11 (world) Unsupported protocol for NAT masquerade DROPPED (ICMPv6 DestinationUnreachable(AddressUnreachable))
Jul 22 10:04:30.563: 2001:14ba:16fd:961d:e65f:1ff:fe1b:3293 (host) <> 2001:67c:1be8::11 (world) Unsupported protocol for NAT masquerade DROPPED (ICMPv6 DestinationUnreachable(AddressUnreachable))
Jul 22 10:04:30.563: 2001:14ba:16fd:961d:e65f:1ff:fe1b:3293 (host) <> 2001:67c:1be8::11 (world) Unsupported protocol for NAT masquerade DROPPED (ICMPv6 DestinationUnreachable(AddressUnreachable))
```

Verified on snapshot.4.

<details><summary>Helm Values for reference</summary>
<code>

    autoDirectNodeRoutes: true
    bpf:
      masquerade: true
    bgp:
      enabled: false
    cluster:
      name: dev-cluster
      id: 1
    containerRuntime:
      integration: containerd
      socketPath: /var/run/k3s/containerd/containerd.sock
    endpointRoutes:
      enabled: true
    hubble:
      enabled: true
      metrics:
        enabled:
          - dns:query
          - drop
          - tcp
          - flow
          - port-distribution
          - icmp
          - http
        serviceMonitor:
          enabled: true
        dashboards:
          enabled: true
      relay:
        enabled: true
        rollOutPods: true
        prometheus:
          serviceMonitor:
            enabled: true
      ui:
        enabled: true
        rollOutPods: true
        ingress:
          enabled: true
          className: nginx
          annotations:
            hajimari.io/icon: simple-icons:cilium
          hosts:
            - &host "hubble.${SECRET_DOMAIN}"
          tls:
            - hosts:
                - *host
    ipam:
      mode: kubernetes
    bgpControlPlane:
      enabled: true
    ingressController:
      enabled: true
      loadbalancerMode: shared
      defaultSecretNamespace: networking
      defaultSecretName: ${SECRET_DOMAIN}-production-tls
      service:
        annotations:
          io.cilium/lb-ipam-ips: "10.46.2.10,2001:14ba:16fd:961d::e:443"

    k8sServiceHost: "10.0.110.5"
    k8sServicePort: 6443
    ipv4NativeRoutingCIDR: "10.42.0.0/16"
    ipv6NativeRoutingCIDR: "2001:67c:1104:d000::/56"
    kubeProxyReplacement: strict
    kubeProxyReplacementHealthzBindAddr: 0.0.0.0:10256
    loadBalancer:
      algorithm: maglev
      mode: dsr
    localRedirectPolicy: true
    ipv6:
      enabled: true
    operator:
      replicas: 1
      rollOutPods: true
      prometheus:
        enabled: true
        serviceMonitor:
          enabled: true
      dashboards:
        enabled: true
    prometheus:
      enabled: true
      serviceMonitor:
        enabled: true
    dashboards:
      enabled: true
    rollOutCiliumPods: true
    securityContext:
      privileged: true
    tunnel: disabled


</code>
</details>

**Comment by samip5** [comment]
This issue means that IPv6 as a whole is not working on 1.14.0. The release shouldn't have been pushed with broken IPv6.

**Comment by margamanterola** [comment]
Thanks for your report, Skyler. This is a specific combination of features. Have you been able to reproduce the problem with a different combination of features?

**Comment by samip5** [comment]
> Have you been able to reproduce the problem with a different combination of features?

I don't know what combination I should try to test it with as VXLAN support with IPv6, is not supported the last I tried it.

**Comment by samip5** [comment]
I tried to only disable BPF masquarade and IPv6 out works so it's definitely that feature that's broken at least.

**Comment by qmonnet** [comment]
There's a high chance it is IPv6 BPF masquerade indeed. It was added only recently (and it's a beta feature at this stage). I didn't have time to look into it yet, but will do next week. Thanks a lot for the report!

**Comment by MTRNord** [comment]
I am seeing the same bug on my setup with l2 announcements and lb-ipam managed by cilium. the LB is a traefik. However I have neither a bgp control plane, native routing or bpf masquerade in my setup:

```
bpf:
  hostLegacyRouting: false
cluster:
  # -- Name of the cluster. Only required for Cluster Mesh and mutual authentication with SPIRE.
  name: nordgedanken
  # -- (int) Unique ID of the cluster. Must be unique across all connected
  # clusters and in the range of 1 to 255. Only required for Cluster Mesh,
  # may be 0 if Cluster Mesh is not used.
  id: 0
cni:
  customConf: false
  uninstall: false
ipam:
  operator:
    clusterPoolIPv4PodCIDRList:
      - 10.245.0.0/16
    clusterPoolIPv6PodCIDRList:
      - fd00::/104
operator:
  unmanagedPodWatcher:
    restart: true
  prometheus:
    enabled: true
    serviceMonitor:
      enabled: true
  dashboards:
    enabled: true

policyEnforcementMode: default

kubeProxyReplacement: strict

tunnel: vxlan
tunnelPort: 8473
sessionAffinity: true
prometheus:
  enabled: true
  serviceMonitor:
    enabled: true
dashboards:
  enabled: true
hubble:
  relay:
    enabled: true
    prometheus:
      enabled: true
  ui:
    enabled: true
    metrics:
      enabled:
        - dns
        - tcp
        - httpV2

endpointStatus:
  enabled: true
  status: "policy"

nodePort:
  enabled: false

# Turn on after migration
l2announcements:
  enabled: true
k8sClientRateLimit:
  qps: 33
  burst: 40

k8sServiceHost: kubernetes.midnightthoughts.space
k8sServicePort: 6443

ipv6:
  enabled: true
```

Switching `enableIPv6Masqurade` to false also seems to have not made a difference for me.

cilium monitor is seeting this error for me though:

`xx drop (Service backend not found) flow 0x0 to endpoint 0, ifindex 2, file bpf_host.c:421, , identity world->unknown: [redacted]:58294 -> [redacted]:443 tcp SYN` where the target v6 is the one of the LB service.

**Comment by margamanterola** [comment]
Hi Marcel, thanks for your input. Your setup sounds quite different from the one originally reported here. Even the error messages are different. What made you say it's the same bug?

**Comment by MTRNord** [comment]
> Hi Marcel, thanks for your input. Your setup sounds quite different from the one originally reported here. Even the error messages are different. What made you say it's the same bug?

It seems like I am hitting the same issue that my loadbalancer is not able to get incoming LB v6 traffic. Specifically, it seems that I get timeouts due to the drop. The thing that made me reach for this specifically is that it is referencing 1.14 and LB-IPAM as well as cilium native l2 announcements.

**Comment by samip5** [comment]
> The thing that made me reach for this specifically is that it is referencing 1.14 and LB-IPAM as well as cilium native l2 announcements.

I'm not using L2 announcements at all though?

**Comment by MTRNord** [comment]
> > The thing that made me reach for this specifically is that it is referencing 1.14 and LB-IPAM as well as cilium native l2 announcements.
> 
> I'm not using L2 announcements at all though as I'm using BGP?

Oh! ok than I misunderstood that.

**Comment by margamanterola** [comment]
Marcel, please open a new issue about your problem.

**Comment by MTRNord** [comment]
> Marcel, please open a new issue about your problem.

I asked it now over at slack and will after that move it to an issue :+1:

**Comment by ti-mo** [comment]
@samip5  Would you be able to provide a sysdump from an affected node? If you don't want to share the whole thing, that's fine, I'm only interested in `node_config.h` (don't censor the `DEFINE_IPV6()`, unfortunately this matters) and a bpf_lxc.o template (there should only be one per node).

We found an issue that breaks multiple areas of Cilium's v6 handling that should be fixed by this patch: https://github.com/cilium/cilium/pull/28417. Unfortunately, it only pops up on specific deployments with v6 addresses that fall within a specific range (so, depending on which prefix is assigned to you by your ISP/cloud), making this really tricky to reproduce. Naturally, we would've preferred to ship 1.14 without this bug, but due to the nature of it, this didn't blow up in CI.

Based on the tcpdumps you've posted, it's already sort-of clear to me:
```
04:19:37.677073 lxcd62d57036892 Out IP6 ffff:ffff:9670:2::c762 > fddf:f7bc:9670:2::568a: ICMP6, neighbor advertisement, tgt is fddf:f7bc:9670:2::c762, length 32
```
`ffff:ffff:9670:2::c762 > fddf:f7bc:9670:2::568a: ... tgt is fddf:f7bc:9670:2::c762` -> the upper 4 bytes of the NA source addr are `ffffffff`, but the payload does contain the right target `fddf:f7bc:9670:2::c762`. The datapath doesn't set the right source IP when generating the packet, which is what the patch I posted should address.

If you can't build your own image, here's a 1.15-dev CI agent image that contains the patch: `quay.io/cilium/cilium-ci:0a28eb945e98a4729f5b580a28b5e346def975db`. If you have a non-critical cluster or test environment, you could give that a try. Note that you may need a Helm chart from the main branch, I haven't tested this with 1.14 charts.

If you could confirm whether or not this fixes your issue, that would allow us to track the impact this has caused. Thank you.

**Comment by samip5** [comment]
> @samip5 Would you be able to provide a sysdump from an affected node? If you don't want to share the whole thing, that's fine, I'm only interested in `node_config.h` (don't censor the `DEFINE_IPV6()`, unfortunately this matters) and a bpf_lxc.o template (there should only be one per node).
> 
> We found an issue that breaks multiple areas of Cilium's v6 handling that should be fixed by this patch: #28417. Unfortunately, it only pops up on specific deployments with v6 addresses that fall within a specific range (so, depending on which prefix is assigned to you by your ISP/cloud), making this really tricky to reproduce. Naturally, we would've preferred to ship 1.14 without this bug, but due to the nature of it, this didn't blow up in CI.
> 
> Based on the tcpdumps you've posted, it's already sort-of clear to me:
> 
> ```
> 04:19:37.677073 lxcd62d57036892 Out IP6 ffff:ffff:9670:2::c762 > fddf:f7bc:9670:2::568a: ICMP6, neighbor advertisement, tgt is fddf:f7bc:9670:2::c762, length 32
> ```
> 
> `ffff:ffff:9670:2::c762 > fddf:f7bc:9670:2::568a: ... tgt is fddf:f7bc:9670:2::c762` -> the upper 4 bytes of the NA source addr are `ffffffff`, but the payload does contain the right target `fddf:f7bc:9670:2::c762`. The datapath doesn't set the right source IP when generating the packet, which is what the patch I posted should address.
> 
> If you can't build your own image, here's a 1.15-dev CI agent image that contains the patch: `quay.io/cilium/cilium-ci:0a28eb945e98a4729f5b580a28b5e346def975db`. If you have a non-critical cluster or test environment, you could give that a try. Note that you may need a Helm chart from the main branch, I haven't tested this with 1.14 charts.
> 
> If you could confirm whether or not this fixes your issue, that would allow us to track the impact this has caused. Thank you.

The whole sysdump of my dev cluster running that CI agent image (too large for GH): https://s3.skym.fi/public/cilium-sysdump-20231007-213830.zip

**Comment by ti-mo** [comment]
> The whole sysdump of my dev cluster running that CI agent image (too large for GH): https://s3.skym.fi/public/cilium-sysdump-20231007-213830.zip

Thanks! The effect I'm trying to observe in the sysdump no longer reproduces in the CI image, but at least I can confirm that your HOST_IP is set to a SLAAC address, which should cause things to stop working with the current 1.14.2 release. Please try upgrading to 1.14.3 when that comes out (we're aiming for next week).

> It seems that the bpf programs are quite uh, unhappy `Verifier error: program tail_handle_snat_fwd_ipv6: load program: argument list too long: BPF program is too large. Processed 1000001 insn (2234 line(s) omitted)`

That's not great. Might be related to the combination of enabled features, but exceeding the 1m instruction limit shouldn't happen regardless. :frowning_face: @julianwiedmann Any ideas? This is on a 6.1 kernel w/ 1.15-dev. We might need to track this in a separate issue.

@samip5 Please report back when you've tried 1.14.3.

**Comment by julianwiedmann** [comment]
> > It seems that the bpf programs are quite uh, unhappy `Verifier error: program tail_handle_snat_fwd_ipv6: load program: argument list too long: BPF program is too large. Processed 1000001 insn (2234 line(s) omitted)`
> 
> That's not great. Might be related to the combination of enabled features, but exceeding the 1m instruction limit shouldn't happen regardless. ☹️ @julianwiedmann Any ideas? This is on a 6.1 kernel w/ 1.15-dev. We might need to track this in a separate issue.

Yeah that's unexpected. Let's track through a separate issue please.  First thing would be to extract the failing datapath config (so we can repro in CI), and to track down at what point this regressed.

**Comment by samip5** [comment]
> > > It seems that the bpf programs are quite uh, unhappy `Verifier error: program tail_handle_snat_fwd_ipv6: load program: argument list too long: BPF program is too large. Processed 1000001 insn (2234 line(s) omitted)`
> > 
> > That's not great. Might be related to the combination of enabled features, but exceeding the 1m instruction limit shouldn't happen regardless. ☹️ @julianwiedmann Any ideas? This is on a 6.1 kernel w/ 1.15-dev. We might need to track this in a separate issue.
> 
> Yeah that's unexpected. Let's track through a separate issue please.  First thing would be to extract the failing datapath config (so we can repro in CI), and to track down at what point this regressed.

Just so I know the details to post on another issue, what do you mean by datapath config?

**Comment by julianwiedmann** [comment]
> Just so I know the details to post on another issue, what do you mean by datapath config?

The sysdump should be sufficient. Based on your cilium config + environment, we need to come up with something like https://github.com/cilium/cilium/blob/main/bpf/complexity-tests/netnext/bpf_host/1.txt.

**Comment by samip5** [comment]
> > Just so I know the details to post on another issue, what do you mean by datapath config?
> 
> The sysdump should be sufficient. Based on your cilium config + environment, we need to come up with something like https://github.com/cilium/cilium/blob/main/bpf/complexity-tests/netnext/bpf_host/1.txt.

Alright, made a new issue for it. https://github.com/cilium/cilium/issues/28651

**Comment by samip5** [comment]
> @samip5 Please report back when you've tried 1.14.3.

After a quick test on 1.14.3, it seems to be working. I haven't done much testing except tested that my dual-stack service for smtp-relay does work.
