### ISSUE TITLE
cilium: sockops=true with cilium/istio seems sidecar not using sockops

### ISSUE THREAD

**Issue by jrfastab** [cilium/cilium#11039]
Config:
level=info msg="  --access-log=''" subsys=daemon
level=info msg="  --agent-labels=''" subsys=daemon
level=info msg="  --allow-localhost='auto'" subsys=daemon
level=info msg="  --annotate-k8s-node='true'" subsys=daemon
level=info msg="  --auto-create-cilium-node-resource='true'" subsys=daemon
level=info msg="  --auto-direct-node-routes='false'" subsys=daemon
level=info msg="  --blacklist-conflicting-routes='true'" subsys=daemon
level=info msg="  --bpf-compile-debug='false'" subsys=daemon
level=info msg="  --bpf-ct-global-any-max='262144'" subsys=daemon
level=info msg="  --bpf-ct-global-tcp-max='1000000'" subsys=daemon
level=info msg="  --bpf-ct-timeout-regular-any='1m0s'" subsys=daemon
level=info msg="  --bpf-ct-timeout-regular-tcp='6h0m0s'" subsys=daemon
level=info msg="  --bpf-ct-timeout-regular-tcp-fin='10s'" subsys=daemon
level=info msg="  --bpf-ct-timeout-regular-tcp-syn='1m0s'" subsys=daemon
level=info msg="  --bpf-ct-timeout-service-any='1m0s'" subsys=daemon
level=info msg="  --bpf-ct-timeout-service-tcp='6h0m0s'" subsys=daemon
level=info msg="  --bpf-nat-global-max='841429'" subsys=daemon
level=info msg="  --bpf-policy-map-max='16384'" subsys=daemon
level=info msg="  --bpf-root=''" subsys=daemon
level=info msg="  --cgroup-root=''" subsys=daemon
level=info msg="  --cluster-id='0'" subsys=daemon
level=info msg="  --cluster-name='default'" subsys=daemon
level=info msg="  --clustermesh-config=''" subsys=daemon
level=info msg="  --cmdref=''" subsys=daemon
level=info msg="  --config=''" subsys=daemon
level=info msg="  --config-dir=''" subsys=daemon
level=info msg="  --conntrack-garbage-collector-interval='0'" subsys=daemon
level=info msg="  --conntrack-gc-interval='0s'" subsys=daemon
level=info msg="  --container-runtime=''" subsys=daemon
level=info msg="  --container-runtime-endpoint='map[]'" subsys=daemon
level=info msg="  --datapath-mode='veth'" subsys=daemon
level=info msg="  --debug='false'" subsys=daemon
level=info msg="  --debug-verbose=''" subsys=daemon
level=info msg="  --device='undefined'" subsys=daemon
level=info msg="  --disable-cnp-status-updates='false'" subsys=daemon
level=info msg="  --disable-conntrack='false'" subsys=daemon
level=info msg="  --disable-endpoint-crd='false'" subsys=daemon
level=info msg="  --disable-envoy-version-check='true'" subsys=daemon
level=info msg="  --disable-ipv4='false'" subsys=daemon
level=info msg="  --disable-k8s-services='false'" subsys=daemon
level=info msg="  --docker='unix:///var/run/docker.sock'" subsys=daemon
level=info msg="  --egress-masquerade-interfaces=''" subsys=daemon
level=info msg="  --enable-endpoint-health-checking='true'" subsys=daemon
level=info msg="  --enable-endpoint-routes='false'" subsys=daemon
level=info msg="  --enable-health-checking='true'" subsys=daemon
level=info msg="  --enable-host-reachable-services='false'" subsys=daemon
level=info msg="  --enable-ipsec='false'" subsys=daemon
level=info msg="  --enable-ipv4='true'" subsys=daemon
level=info msg="  --enable-ipv6='false'" subsys=daemon
level=info msg="  --enable-k8s-event-handover='false'" subsys=daemon
level=info msg="  --enable-l7-proxy='true'" subsys=daemon
level=info msg="  --enable-legacy-services='false'" subsys=daemon
level=info msg="  --enable-node-port='false'" subsys=daemon
level=info msg="  --enable-policy='default'" subsys=daemon
level=info msg="  --enable-selective-regeneration='true'" subsys=daemon
level=info msg="  --enable-tracing='false'" subsys=daemon
level=info msg="  --encrypt-interface=''" subsys=daemon
level=info msg="  --encrypt-node='false'" subsys=daemon
level=info msg="  --endpoint-interface-name-prefix='lxc+'" subsys=daemon
level=info msg="  --endpoint-queue-size='25'" subsys=daemon
level=info msg="  --envoy-log=''" subsys=daemon
level=info msg="  --exclude-local-address=''" subsys=daemon
level=info msg="  --fixed-identity-mapping='map[]'" subsys=daemon
level=info msg="  --flannel-manage-existing-containers='false'" subsys=daemon
level=info msg="  --flannel-master-device=''" subsys=daemon
level=info msg="  --flannel-uninstall-on-exit='false'" subsys=daemon
level=info msg="  --force-local-policy-eval-at-source='true'" subsys=daemon
level=info msg="  --host-reachable-services-protos=''" subsys=daemon
level=info msg="  --http-403-msg=''" subsys=daemon
level=info msg="  --http-idle-timeout='0'" subsys=daemon
level=info msg="  --http-max-grpc-timeout='0'" subsys=daemon
level=info msg="  --http-request-timeout='3600'" subsys=daemon
level=info msg="  --http-retry-count='3'" subsys=daemon
level=info msg="  --http-retry-timeout='0'" subsys=daemon
level=info msg="  --identity-allocation-mode='kvstore'" subsys=daemon
level=info msg="  --identity-change-grace-period='5s'" subsys=daemon
level=info msg="  --install-iptables-rules='true'" subsys=daemon
level=info msg="  --ip-allocation-timeout='2m0s'" subsys=daemon
level=info msg="  --ipam=''" subsys=daemon
level=info msg="  --ipsec-key-file=''" subsys=daemon
level=info msg="  --ipv4-cluster-cidr-mask-size='8'" subsys=daemon
level=info msg="  --ipv4-node='auto'" subsys=daemon
level=info msg="  --ipv4-pod-subnets=''" subsys=daemon
level=info msg="  --ipv4-range='auto'" subsys=daemon
level=info msg="  --ipv4-service-loopback-address='169.254.42.1'" subsys=daemon
level=info msg="  --ipv4-service-range='auto'" subsys=daemon
level=info msg="  --ipv6-cluster-alloc-cidr='f00d::/64'" subsys=daemon
level=info msg="  --ipv6-node='auto'" subsys=daemon
level=info msg="  --ipv6-pod-subnets=''" subsys=daemon
level=info msg="  --ipv6-range='auto'" subsys=daemon
level=info msg="  --ipv6-service-range='auto'" subsys=daemon
level=info msg="  --ipvlan-master-device='undefined'" subsys=daemon
level=info msg="  --k8s-api-server=''" subsys=daemon
level=info msg="  --k8s-force-json-patch='false'" subsys=daemon
level=info msg="  --k8s-kubeconfig-path=''" subsys=daemon
level=info msg="  --k8s-namespace=''" subsys=daemon
level=info msg="  --k8s-require-ipv4-pod-cidr='false'" subsys=daemon
level=info msg="  --k8s-require-ipv6-pod-cidr='false'" subsys=daemon
level=info msg="  --k8s-service-cache-size='128'" subsys=daemon
level=info msg="  --k8s-watcher-endpoint-selector='metadata.name!=kube-scheduler,metadata.name!=kube-controller-manager,metadata.name!=etcd-operator,metadata.name!=gcp-controller-manager'" subsys=daemon
level=info msg="  --k8s-watcher-queue-size='1024'" subsys=daemon
level=info msg="  --keep-bpf-templates='false'" subsys=daemon
level=info msg="  --keep-config='false'" subsys=daemon
level=info msg="  --kvstore='etcd'" subsys=daemon
level=info msg="  --kvstore-connectivity-timeout='2m0s'" subsys=daemon
level=info msg="  --kvstore-lease-ttl='15m0s'" subsys=daemon
level=info msg="  --kvstore-opt='map[etcd.config:/var/lib/etcd-config/etcd.config]'" subsys=daemon
level=info msg="  --kvstore-periodic-sync='5m0s'" subsys=daemon
level=info msg="  --label-prefix-file=''" subsys=daemon
level=info msg="  --labels=''" subsys=daemon
level=info msg="  --lb=''" subsys=daemon
level=info msg="  --lib-dir='/var/lib/cilium'" subsys=daemon
level=info msg="  --log-driver=''" subsys=daemon
level=info msg="  --log-opt='map[]'" subsys=daemon
level=info msg="  --log-system-load='false'" subsys=daemon
level=info msg="  --masquerade='true'" subsys=daemon
level=info msg="  --max-controller-interval='0'" subsys=daemon
level=info msg="  --metrics=''" subsys=daemon
level=info msg="  --monitor-aggregation='None'" subsys=daemon
level=info msg="  --monitor-queue-size='0'" subsys=daemon
level=info msg="  --mtu='0'" subsys=daemon
level=info msg="  --nat46-range='0:0:0:0:0:FFFF::/96'" subsys=daemon
level=info msg="  --node-port-range=''" subsys=daemon
level=info msg="  --policy-queue-size='100'" subsys=daemon
level=info msg="  --policy-trigger-interval='1s'" subsys=daemon
level=info msg="  --pprof='false'" subsys=daemon
level=info msg="  --preallocate-bpf-maps='true'" subsys=daemon
level=info msg="  --prefilter-device='undefined'" subsys=daemon
level=info msg="  --prefilter-mode='native'" subsys=daemon
level=info msg="  --prepend-iptables-chains='true'" subsys=daemon
level=info msg="  --prometheus-serve-addr=''" subsys=daemon
level=info msg="  --proxy-connect-timeout='1'" subsys=daemon
level=info msg="  --read-cni-conf=''" subsys=daemon
level=info msg="  --restore='true'" subsys=daemon
level=info msg="  --sidecar-http-proxy='false'" subsys=daemon
level=info msg="  --sidecar-istio-proxy-image='cilium/istio_proxy'" subsys=daemon
level=info msg="  --single-cluster-route='false'" subsys=daemon
level=info msg="  --skip-crd-creation='false'" subsys=daemon
level=info msg="  --socket-path='/var/run/cilium/cilium.sock'" subsys=daemon
level=info msg="  --sockops-enable='true'" subsys=daemon
level=info msg="  --state-dir='/var/run/cilium'" subsys=daemon
level=info msg="  --tofqdns-dns-reject-response-code='refused'" subsys=daemon
level=info msg="  --tofqdns-enable-poller='false'" subsys=daemon
level=info msg="  --tofqdns-enable-poller-events='true'" subsys=daemon
level=info msg="  --tofqdns-endpoint-max-ip-per-hostname='50'" subsys=daemon
level=info msg="  --tofqdns-min-ttl='0'" subsys=daemon
level=info msg="  --tofqdns-pre-cache=''" subsys=daemon
level=info msg="  --tofqdns-proxy-port='0'" subsys=daemon
level=info msg="  --tofqdns-proxy-response-max-delay='50ms'" subsys=daemon
level=info msg="  --trace-payloadlen='128'" subsys=daemon
level=info msg="  --tunnel='vxlan'" subsys=daemon
level=info msg="  --version='false'" subsys=daemon
level=info msg="  --write-cni-conf-when-ready=''" subsys=daemon

**Comment by soumynathan** [comment]
Added info from the slack chat discussion:

Let me give you more info: I am running Cilium 1.6.6, my kernel is 5.3.18 and sockops is activated:
level=info msg="  --sockops-enable='true'" subsys=daemon
level=info msg="Sockmap Enabled: bpf_sockops prog_id 0 and map_id 540 loaded" subsys=sockops
level=info msg="Sockmsg Enabled, bpf_redir loaded" subsys=sockops

TCP Dump:
```
This is the tcpdump output on the lo interface of the client's pod
17:19:52.457811 IP 10.244.1.89.33056 > 127.0.0.1.15001: Flags [S], seq 1147162402, win 64860, options [mss 1410,sackOK,TS val 564058210 ecr 0,nop,wscale 7], length 0
17:19:52.457828 IP 10.104.155.157.8000 > 10.244.1.89.33056: Flags [S.], seq 3757825514, ack 1147162403, win 65483, options [mss 65495,sackOK,TS val 2610832446 ecr 564058210,nop,wscale 7], length 0
17:19:52.457844 IP 10.244.1.89.33056 > 127.0.0.1.15001: Flags [.], ack 3757825515, win 507, options [nop,nop,TS val 564058210 ecr 2610832446], length 0
17:19:52.457903 IP 10.244.1.89.33056 > 127.0.0.1.15001: Flags [P.], seq 0:82, ack 1, win 507, options [nop,nop,TS val 564058210 ecr 2610832446], length 82
17:19:52.468437 IP 10.104.155.157.8000 > 10.244.1.89.33056: Flags [P.], seq 1:258, ack 83, win 512, options [nop,nop,TS val 2610832457 ecr 564058210], length 257
17:19:52.468452 IP 10.244.1.89.33056 > 127.0.0.1.15001: Flags [.], ack 258, win 505, options [nop,nop,TS val 564058221 ecr 2610832457], length 0
17:19:52.468632 IP 10.244.1.89.33056 > 127.0.0.1.15001: Flags [F.], seq 82, ack 258, win 505, options [nop,nop,TS val 564058221 ecr 2610832457], length 0
17:19:52.468686 IP 10.104.155.157.8000 > 10.244.1.89.33056: Flags [F.], seq 258, ack 84, win 512, options [nop,nop,TS val 2610832457 ecr 564058221], length 0
17:19:52.468702 IP 10.244.1.89.33056 > 127.0.0.1.15001: Flags [.], ack 259, win 505, options [nop,nop,TS val 564058221 ecr 2610832457], length 0
```

Cilium logs:

https://hastebin.com/aboyemotev.ini

**Comment by seraphsea** [comment]
> Added info from the slack chat discussion:
> 
> Let me give you more info: I am running Cilium 1.6.6, my kernel is 5.3.18 and sockops is activated:
> level=info msg=" --sockops-enable='true'" subsys=daemon
> level=info msg="Sockmap Enabled: bpf_sockops prog_id 0 and map_id 540 loaded" subsys=sockops
> level=info msg="Sockmsg Enabled, bpf_redir loaded" subsys=sockops
> 
> TCP Dump:
> 
> ```
> This is the tcpdump output on the lo interface of the client's pod
> 17:19:52.457811 IP 10.244.1.89.33056 > 127.0.0.1.15001: Flags [S], seq 1147162402, win 64860, options [mss 1410,sackOK,TS val 564058210 ecr 0,nop,wscale 7], length 0
> 17:19:52.457828 IP 10.104.155.157.8000 > 10.244.1.89.33056: Flags [S.], seq 3757825514, ack 1147162403, win 65483, options [mss 65495,sackOK,TS val 2610832446 ecr 564058210,nop,wscale 7], length 0
> 17:19:52.457844 IP 10.244.1.89.33056 > 127.0.0.1.15001: Flags [.], ack 3757825515, win 507, options [nop,nop,TS val 564058210 ecr 2610832446], length 0
> 17:19:52.457903 IP 10.244.1.89.33056 > 127.0.0.1.15001: Flags [P.], seq 0:82, ack 1, win 507, options [nop,nop,TS val 564058210 ecr 2610832446], length 82
> 17:19:52.468437 IP 10.104.155.157.8000 > 10.244.1.89.33056: Flags [P.], seq 1:258, ack 83, win 512, options [nop,nop,TS val 2610832457 ecr 564058210], length 257
> 17:19:52.468452 IP 10.244.1.89.33056 > 127.0.0.1.15001: Flags [.], ack 258, win 505, options [nop,nop,TS val 564058221 ecr 2610832457], length 0
> 17:19:52.468632 IP 10.244.1.89.33056 > 127.0.0.1.15001: Flags [F.], seq 82, ack 258, win 505, options [nop,nop,TS val 564058221 ecr 2610832457], length 0
> 17:19:52.468686 IP 10.104.155.157.8000 > 10.244.1.89.33056: Flags [F.], seq 258, ack 84, win 512, options [nop,nop,TS val 2610832457 ecr 564058221], length 0
> 17:19:52.468702 IP 10.244.1.89.33056 > 127.0.0.1.15001: Flags [.], ack 259, win 505, options [nop,nop,TS val 564058221 ecr 2610832457], length 0
> ```
> 
> Cilium logs:
> 
> https://hastebin.com/aboyemotev.ini

in your case， which env you used , minikube or Kubernetes

**Comment by seraphsea** [comment]
@soumynathan in your case, which env you used, minikube or Kubernetes?

**Comment by soumynathan** [comment]
> @soumynathan in your case, which env you used, minikube or Kubernetes?

Kubernetes.

**Comment by soumynathan** [comment]
@jrfastab Any update on this issue.

**Comment by jrfastab** [comment]
@soumynathan I'm able to reproduce this so seems like an issue specific to istio sidecar usage. sockops enabled is working in other cases.

**Comment by jrfastab** [comment]
Output of sidecar injected iptables rules,
```
$ sudo nsenter -t 15508 -n iptables -t nat -S
-P PREROUTING ACCEPT
-P INPUT ACCEPT
-P OUTPUT ACCEPT
-P POSTROUTING ACCEPT
-N ISTIO_IN_REDIRECT
-N ISTIO_OUTPUT
-N ISTIO_REDIRECT
-A OUTPUT -p tcp -j ISTIO_OUTPUT
-A ISTIO_IN_REDIRECT -p tcp -j REDIRECT --to-ports 15006
-A ISTIO_OUTPUT -s 127.0.0.6/32 -o lo -j RETURN
-A ISTIO_OUTPUT ! -d 127.0.0.1/32 -o lo -m owner --uid-owner 1337 -j ISTIO_IN_REDIRECT
-A ISTIO_OUTPUT -o lo -m owner ! --uid-owner 1337 -j RETURN
-A ISTIO_OUTPUT -m owner --uid-owner 1337 -j RETURN
-A ISTIO_OUTPUT ! -d 127.0.0.1/32 -o lo -m owner --gid-owner 1337 -j ISTIO_IN_REDIRECT
-A ISTIO_OUTPUT -o lo -m owner ! --gid-owner 1337 -j RETURN
-A ISTIO_OUTPUT -m owner --gid-owner 1337 -j RETURN
-A ISTIO_OUTPUT -d 127.0.0.1/32 -j RETURN
-A ISTIO_OUTPUT -j ISTIO_REDIRECT
-A ISTIO_REDIRECT -p tcp -j REDIRECT --to-ports 15001
```

**Comment by jrfastab** [comment]
We have a special case in bpf_sockops.c to handle proxy redirect when running cilium l7 policy but nothing for sidecar injections so we abort inserting the socket into the sockmap, the insert into sockmap triggers using bpf redirect. The code check is here,
```
        /* Lookup IPv4 address, this will return a match if:
         * - The destination IP address belongs to the local endpoint manage
         *   by Cilium.
         * - The destination IP address is an IP address associated with the
         *   host itself.
         * Then because these are local IPs that have passed LB/Policy/NAT
         * blocks redirect directly to socket.
         */
        exists = __lookup_ip4_endpoint(key.dip4);
        if (!exists)
                return;

```

**Comment by soumynathan** [comment]
So is there a fix for it.

**Comment by manuelbuil** [comment]
> Output of sidecar injected iptables rules,
> 
> ```
> $ sudo nsenter -t 15508 -n iptables -t nat -S
> -P PREROUTING ACCEPT
> -P INPUT ACCEPT
> -P OUTPUT ACCEPT
> -P POSTROUTING ACCEPT
> -N ISTIO_IN_REDIRECT
> -N ISTIO_OUTPUT
> -N ISTIO_REDIRECT
> -A OUTPUT -p tcp -j ISTIO_OUTPUT
> -A ISTIO_IN_REDIRECT -p tcp -j REDIRECT --to-ports 15006
> -A ISTIO_OUTPUT -s 127.0.0.6/32 -o lo -j RETURN
> -A ISTIO_OUTPUT ! -d 127.0.0.1/32 -o lo -m owner --uid-owner 1337 -j ISTIO_IN_REDIRECT
> -A ISTIO_OUTPUT -o lo -m owner ! --uid-owner 1337 -j RETURN
> -A ISTIO_OUTPUT -m owner --uid-owner 1337 -j RETURN
> -A ISTIO_OUTPUT ! -d 127.0.0.1/32 -o lo -m owner --gid-owner 1337 -j ISTIO_IN_REDIRECT
> -A ISTIO_OUTPUT -o lo -m owner ! --gid-owner 1337 -j RETURN
> -A ISTIO_OUTPUT -m owner --gid-owner 1337 -j RETURN
> -A ISTIO_OUTPUT -d 127.0.0.1/32 -j RETURN
> -A ISTIO_OUTPUT -j ISTIO_REDIRECT
> -A ISTIO_REDIRECT -p tcp -j REDIRECT --to-ports 15001
> ```

I was having a quick look and I am wondering about one thing. There are also other rules in the mangle table which are doing the TProxy config:
```
# Generated by iptables-save v1.8.3 on Mon May  4 17:58:46 2020
*mangle
:PREROUTING ACCEPT [3144285:176178012]
:INPUT ACCEPT [5780982:697710640]
:FORWARD ACCEPT [0:0]
:OUTPUT ACCEPT [5555040:702005610]
:POSTROUTING ACCEPT [5555040:702005610]
:ISTIO_DIVERT - [0:0]
:ISTIO_INBOUND - [0:0]
:ISTIO_TPROXY - [0:0]
-A PREROUTING -p tcp -j ISTIO_INBOUND
-A ISTIO_DIVERT -j MARK --set-xmark 0x539/0xffffffff
-A ISTIO_DIVERT -j ACCEPT
-A ISTIO_INBOUND -p tcp -m tcp --dport 22 -j RETURN
-A ISTIO_INBOUND -p tcp -m tcp --dport 15090 -j RETURN
-A ISTIO_INBOUND -p tcp -m tcp --dport 15020 -j RETURN
-A ISTIO_INBOUND -p tcp -m conntrack --ctstate RELATED,ESTABLISHED -j ISTIO_DIVERT
-A ISTIO_INBOUND -p tcp -j ISTIO_TPROXY
-A ISTIO_TPROXY ! -d 127.0.0.1/32 -p tcp -j TPROXY --on-port 15001 --on-ip 0.0.0.0 --tproxy-mark 0x539/0xffffffff
```
Then I see in my ip rules:
`32765:	from all fwmark 0x539 lookup 133`
and that table 133 has:
`local default dev lo scope host`

I am not very familiar with this setup but, if the TProxy packets are configured with `dev lo`, doesn't that mean that traffic will always hit the loopback interface?

**Comment by jrfastab** [comment]
It is possible to get sockops working with sidecar proxies but it is a feature request. I suggest a bugfix in documentation to make it clear that sidecars are not currently supported and then mark this issue as a feature-request.

To enable this we would need to, hook the istio sidecar knowledge down to cilium datapath so that cilium datapath in bpf_sockops.c can learn when its safe/not-safe to do the redirect. Additionally the datapath would have to do the tproxy port/ip rewrite and mark field set so the envoy instance receives correct information. User space side control path would be needed to push down dports, ips, mark, etc to set from datapath side which are currently pushed into iptables path with an init container as far as I know.

@manuelbuil correct, to enable this on sockmap side we would need logic in the sockmap bpf datapath to emulate the tproxy configuration (just set the mark and ip addresses correctly from socket side) and also add cilium user space logic to push this info down from some control side. Certainly doable but more than a couple days work imo.

**Comment by ukcuf** [comment]
+1 to this feature request.

**Comment by IronCore864** [comment]
+1

**Comment by vsxen** [comment]
```
uname  -a
Linux ubuntu-focal 5.4.0-72-generic #80-Ubuntu SMP Mon Apr 12 17:35:00 UTC 2021 x86_64 x86_64 x86_64 GNU/Linux
```
ubuntu 20.04 can work with --sockops-enable.

but also need istio use sockops instead of iptables,

**Comment by weizhouBlue** [comment]
> @soumynathan I'm able to reproduce this so seems like an issue specific to istio sidecar usage. sockops enabled is working in other cases.

what other case do you mean ?   
I tested it for istio case , and did not find any RPS and latency promotion  
I also tested it with 127.0.0.1 communication within a pod  , and also did not find any  RPS and latency promotion

**Comment by withlin** [comment]
+1

**Comment by brb** [comment]
The sockops feature was removed from Cilium (https://github.com/cilium/cilium/issues/23556). Closing the issue.
