### ISSUE TITLE
clustermesh: Request replies not forwarded to originating pod

### ISSUE THREAD

**Issue by mantoine96** [cilium/cilium#33393]
### Is there an existing issue for this?

- [X] I have searched the existing issues

### What happened?

I have created a cluster mesh between two clusters, one running Cilium v1.14.12, and the other running v1.16.0-rc.0.

When I try to access a global service from a cluster to the other, the endpoint will be correctly resolved. However the requests end in timeouts.

Upon investigating more, I saw that:
* This happened regardless of the originating cluster
* The originating cluster will see in Hubble/Cilium Monitor only the SYN
* The destination cluster will see in Hubble/Cilium Monitor the SYN + SYN-ACK response
* The response is not received by the originating cluster/node
* tcpdumps on the hosts also show that the SYN ACKs are "sent" by the destination cluster, but not received by the originating cluster
* I was also able to replicate **as long as one of the clusters was running v1.14.12, with 1.15.0 up until 1.16.0** 

| Version Map | 1.14.12 | 1.15.0 | 1.15.6 | 1.16.0-rc.0 |
| --- | --- | --- | --- | --- |
| 1.14.12 | ✅ | ❌ | ❌ | ❌  |
| 1.15.0 | ❌ | ✅ | ✅ |  ✅ |
| 1.16.0-rc.0 | ❌ |  ✅ | ... | ✅ |

We are running in AWS, using EKS (1.27 for the source cluster, 1.30 for the destination cluster, although I have tested that the issue is not dependent on Kubernetes (1.16.0 on 1.27 also has the same issue) or OS changes (1.16.0 on bottlerocket vs AL2 presents the same issue).

We are not using KVStoreMesh, and are deploying Cluster Mesh using Cilium CLI, creating services of type LoadBalancer, specifically internal NLBs.
 

### Cilium Version

1.16.0-rc.0 (but also reproduced with 1.15.x)

### Kernel Version

5.10.218-208.862.amzn2.x86_64 

I also observed the issue with: 6.1.90

### Kubernetes Version

1.30

### Regression

Last working version: 1.14.12

The issue occurs from 1.15.0 to 1.16.0-rc.0

### Sysdump

[v1-14-12.zip](https://github.com/user-attachments/files/15977311/v1-14-12.zip)
[v1-16-0.zip](https://github.com/user-attachments/files/15977312/v1-16-0.zip)

### Relevant log output

<details>
<summary>Commands used to configure clustermesh</summary>

```
# Leaving the annotations here for troubleshooting context, obviously this isn't supported on the latest release of cilium-cli but that's a change I'm making too.
$ ./cilium clustermesh enable --context $CLUSTER_A_CONTEXT -ncilium-system --service-annotation 'service.beta.kubernetes.io/aws-load-balancer-internal=true' --service-annotation 'service.beta.kubernetes.io/aws-load-balancer-type=nlb' --service-annotation 'service.beta.kubernetes.io/aws-load-balancer-additional-resource-tags=cluster_name=test-trusty-alien,owner=sysdev' --service-annotation 'service.beta.kubernetes.io/load-balancer-source-ranges=10.210.12.6/32,10.210.92.217/32,10.210.39.244/32' --service-annotation "external-dns.alpha.kubernetes.io/hostname=clustermesh-apiserver.$CLUSTER_A_NAME.eu-dev.awsmmcn.private"
$ ./cilium clustermesh enable --context $CLUSTER_B_CONTEXT -ncilium-system --service-annotation 'service.beta.kubernetes.io/aws-load-balancer-internal=true' --service-annotation 'service.beta.kubernetes.io/aws-load-balancer-type=nlb' --service-annotation 'service.beta.kubernetes.io/aws-load-balancer-additional-resource-tags=cluster_name=test-trusty-alien,owner=sysdev' --service-annotation 'service.beta.kubernetes.io/load-balancer-source-ranges=10.210.12.6/32,10.210.92.217/32,10.210.39.244/32' --service-annotation "external-dns.alpha.kubernetes.io/hostname=clustermesh-apiserver.$CLUSTER_B_NAME.eu-dev.awsmmcn.private"
$ ./cilium clustermesh connect --context $CLUSTER_A_CONTEXT --destination-context $CLUSTER_B_CONTEXT -ncilium-system
$ kubectl --context ${CLUSTER_A_CONTEXT} delete pod -ncilium-system -l 'k8s-app=cilium'
$ kubectl --context ${CLUSTER_B_CONTEXT} delete pod -ncilium-system -l 'k8s-app=cilium'
```

The security groups for both clusters have also been updated to allow all traffic from the other cluster
 
</details>

<details>
<summary>cilium troubleshoot clustermesh on originating cluster</summary> 

```
root@ip-10-210-110-229:/home/cilium# cilium troubleshoot clustermesh
Found 2 remote cluster configurations

Remote cluster "test-meet-katydid":
📄 Configuration path: /var/lib/cilium/clustermesh/test-meet-katydid

🔌 Endpoints:
   - https://test-meet-katydid.mesh.cilium.io:2379
     ✅ Hostname resolved to: 10.210.98.248
     ✅ TCP connection successfully established to 10.210.98.248:2379
     ✅ TLS connection successfully established to 10.210.98.248:2379
     ℹ️   Negotiated TLS version: TLS 1.3, ciphersuite TLS_AES_128_GCM_SHA256
     ℹ️   Etcd server version: 3.5.14

🔑 Digital certificates:
   ✅ TLS Root CA certificates:
      - Serial number:       48:26:a1:d3:be:fe:49:6a:18:98:64:84:88:33:17:d6
        Subject:             CN=Cilium CA
        Issuer:              CN=Cilium CA
        Validity:
          Not before:  2024-06-20 09:01:16 +0000 UTC
          Not after:   2027-06-20 09:01:16 +0000 UTC
   ✅ TLS client certificates:
      - Serial number:       64:61:c7:03:81:be:d6:dd:e4:1d:87:35:96:f1:5d:de:75:29:e4:36
        Subject:             CN=remote
        Issuer:              CN=Cilium CA
        Validity:
          Not before:  2024-06-26 06:35:00 +0000 UTC
          Not after:   2027-06-26 06:35:00 +0000 UTC

⚙️  Etcd client:
   ✅ Etcd connection successfully established
   ℹ️   Etcd cluster ID: baf7312d750f9a6e
[...]
```

</details>

<details>
<summary>cilium-dbg troubleshoot clustermesh on destination cluster</summary>

```
root@ip-10-210-174-82:/home/cilium# cilium-dbg troubleshoot clustermesh
Found 1 remote cluster configurations

Remote cluster "test-maximum-drum":
📄 Configuration path: /var/lib/cilium/clustermesh/test-maximum-drum

🔌 Endpoints:
   - https://test-maximum-drum.mesh.cilium.io:2379
     ✅ Hostname resolved to: 10.210.180.234
     ✅ TCP connection successfully established to 10.210.180.234:2379
     ✅ TLS connection successfully established to 10.210.180.234:2379
     ℹ️   Negotiated TLS version: TLS 1.2, ciphersuite TLS_ECDHE_ECDSA_WITH_AES_128_GCM_SHA256
     ℹ️   Etcd server version: 3.5.4

🔑 Digital certificates:
   ✅ TLS Root CA certificates:
      - Serial number:       48:26:a1:d3:be:fe:49:6a:18:98:64:84:88:33:17:d6
        Subject:             CN=Cilium CA
        Issuer:              CN=Cilium CA
        Validity:
          Not before:  2024-06-20 09:01:16 +0000 UTC
          Not after:   2027-06-20 09:01:16 +0000 UTC
   ✅ TLS client certificates:
      - Serial number:       23:c8:5a:69:f5:ca:bf:b6:cb:6d:97:27:55:99:b4:ba:13:79:6b:57
        Subject:             CN=remote
        Issuer:              CN=Cilium CA
        Validity:
          Not before:  2024-06-25 13:30:00 +0000 UTC
          Not after:   2027-06-25 13:30:00 +0000 UTC
        ⚠️  Cannot verify certificate with the configured root CAs

⚙️  Etcd client:
   ✅ Etcd connection successfully established
   ℹ️   Etcd cluster ID: 23b85df67202eb9
```

</details>

<details>
<summary> Cilium Config Originating Cluster </summary>

```
apiVersion: v1
data:
  agent-not-ready-taint-key: node.cilium.io/agent-not-ready
  api-rate-limit: '{"endpoint-create": "rate-limit:4/s,rate-burst:32,parallel-requests:8,auto-adjust:true,min-parallel-requests:4,max-parallel-requests:8",
    "endpoint-delete": "auto-adjust:true,min-parallel-requests:4,max-parallel-requests:8"}'
  arping-refresh-period: 30s
  auto-create-cilium-node-resource: "true"
  auto-direct-node-routes: "false"
  bpf-lb-external-clusterip: "false"
  bpf-lb-map-max: "65536"
  bpf-lb-sock: "false"
  bpf-map-dynamic-size-ratio: "0.0025"
  bpf-policy-map-max: "65536"
  bpf-root: /sys/fs/bpf
  cgroup-root: /run/cilium/cgroupv2
  cilium-endpoint-gc-interval: 5m0s
  cluster-id: "35"
  cluster-name: test-maximum-drum
  cni-exclusive: "true"
  cni-log-file: /var/run/cilium/cilium-cni.log
  cnp-node-status-gc-interval: 0s
  custom-cni-conf: "false"
  debug: "false"
  debug-verbose: ""
  disable-cnp-status-updates: "true"
  dnsproxy-enable-transparent-mode: "false"
  ec2-api-endpoint: ""
  egress-gateway-reconciliation-trigger-interval: 1s
  egress-masquerade-interfaces: eth0
  enable-auto-protect-node-port-range: "true"
  enable-bgp-control-plane: "false"
  enable-bpf-clock-probe: "false"
  enable-endpoint-health-checking: "true"
  enable-endpoint-routes: "true"
  enable-health-check-nodeport: "true"
  enable-health-checking: "true"
  enable-hubble: "true"
  enable-hubble-open-metrics: "false"
  enable-ipv4: "true"
  enable-ipv4-big-tcp: "false"
  enable-ipv4-masquerade: "true"
  enable-ipv6: "false"
  enable-ipv6-big-tcp: "false"
  enable-ipv6-masquerade: "true"
  enable-k8s-networkpolicy: "true"
  enable-k8s-terminating-endpoint: "true"
  enable-l2-neigh-discovery: "true"
  enable-l7-proxy: "true"
  enable-local-redirect-policy: "false"
  enable-metrics: "true"
  enable-policy: always
  enable-remote-node-identity: "true"
  enable-sctp: "false"
  enable-svc-source-range-check: "true"
  enable-vtep: "false"
  enable-well-known-identities: "false"
  enable-xt-socket-fallback: "true"
  eni-tags: '{}'
  external-envoy-proxy: "false"
  hubble-disable-tls: "false"
  hubble-listen-address: :4244
  hubble-metrics: drop:sourceContext=workload-name|dns|identity;destinationContext=workload-name|dns|identity
  hubble-metrics-server: :9096
  hubble-socket-path: /var/run/cilium/hubble.sock
  hubble-tls-cert-file: /var/lib/cilium/tls/hubble/server.crt
  hubble-tls-client-ca-files: /var/lib/cilium/tls/hubble/client-ca.crt
  hubble-tls-key-file: /var/lib/cilium/tls/hubble/server.key
  identity-allocation-mode: crd
  identity-gc-interval: 15m0s
  identity-heartbeat-timeout: 30m0s
  install-no-conntrack-iptables-rules: "false"
  ipam: eni
  ipam-cilium-node-update-rate: 15s
  ipv4-native-routing-cidr: 10.210.0.0/16
  k8s-client-burst: "10"
  k8s-client-qps: "5"
  kube-proxy-replacement: "true"
  kube-proxy-replacement-healthz-bind-address: ""
  labels: k8s:!spark-exec-id
  mesh-auth-enabled: "true"
  mesh-auth-gc-interval: 5m0s
  mesh-auth-queue-size: "1024"
  mesh-auth-rotated-identities-queue-size: "1024"
  metrics: +cilium_proxy_datapath_update_timeout_total
  monitor-aggregation: medium
  monitor-aggregation-flags: all
  monitor-aggregation-interval: 5s
  node-port-bind-protection: "true"
  nodes-gc-interval: 5m0s
  operator-api-serve-addr: 127.0.0.1:9234
  operator-prometheus-serve-addr: :6942
  policy-audit-mode: "false"
  preallocate-bpf-maps: "false"
  procfs: /host/proc
  prometheus-serve-addr: :9090
  proxy-connect-timeout: "2"
  proxy-idle-timeout-seconds: "60"
  proxy-max-connection-duration-seconds: "0"
  proxy-max-requests-per-connection: "0"
  proxy-prometheus-port: "9964"
  proxy-xff-num-trusted-hops-egress: "0"
  proxy-xff-num-trusted-hops-ingress: "0"
  read-cni-conf: /tmp/cni-configuration/cni-config
  remove-cilium-node-taints: "true"
  routing-mode: native
  set-cilium-is-up-condition: "true"
  set-cilium-node-taints: "true"
  sidecar-istio-proxy-image: cilium/istio_proxy
  skip-cnp-status-startup-clean: "false"
  subnet-tags-filter: Network=Private
  synchronize-k8s-nodes: "true"
  tofqdns-dns-reject-response-code: refused
  tofqdns-enable-dns-compression: "true"
  tofqdns-endpoint-max-ip-per-hostname: "401"
  tofqdns-idle-connection-grace-period: 0s
  tofqdns-max-deferred-connection-deletes: "10000"
  tofqdns-proxy-port: "10053"
  tofqdns-proxy-response-max-delay: 400ms
  unmanaged-pod-watcher-interval: "15"
  update-ec2-adapter-limit-via-api: "true"
  vtep-cidr: ""
  vtep-endpoint: ""
  vtep-mac: ""
  vtep-mask: ""
  write-cni-conf-when-ready: /host/etc/cni/net.d/05-cilium.conflist
kind: ConfigMap
metadata:
  annotations:
    meta.helm.sh/release-name: cilium
    meta.helm.sh/release-namespace: cilium-system
  creationTimestamp: "2024-06-20T09:01:22Z"
  labels:
    app.kubernetes.io/managed-by: Helm
  name: cilium-config
  namespace: cilium-system
  resourceVersion: "1624"
  uid: 5c07af71-f196-4f9b-a95a-a13905bb5fbc

```

</details>

<details>
<summary>Cilium Config destination cluster</summary>

```
apiVersion: v1
data:
  agent-not-ready-taint-key: node.cilium.io/agent-not-ready
  api-rate-limit: '{"endpoint-create": "rate-limit:4/s,rate-burst:32,parallel-requests:8,auto-adjust:true,min-parallel-requests:4,max-parallel-requests:8",
    "endpoint-delete": "auto-adjust:true,min-parallel-requests:4,max-parallel-requests:8"}'
  arping-refresh-period: 30s
  auto-create-cilium-node-resource: "true"
  auto-direct-node-routes: "false"
  bpf-events-drop-enabled: "true"
  bpf-events-policy-verdict-enabled: "true"
  bpf-events-trace-enabled: "true"
  bpf-lb-acceleration: disabled
  bpf-lb-external-clusterip: "false"
  bpf-lb-map-max: "65536"
  bpf-lb-sock: "false"
  bpf-map-dynamic-size-ratio: "0.0025"
  bpf-policy-map-max: "65536"
  bpf-root: /sys/fs/bpf
  cgroup-root: /run/cilium/cgroupv2
  cilium-endpoint-gc-interval: 5m0s
  cluster-id: "18"
  cluster-name: test-meet-katydid
  clustermesh-enable-endpoint-sync: "false"
  clustermesh-enable-mcs-api: "false"
  cni-exclusive: "true"
  cni-log-file: /var/run/cilium/cilium-cni.log
  controller-group-metrics: write-cni-file sync-host-ips sync-lb-maps-with-k8s-services
  custom-cni-conf: "false"
  datapath-mode: veth
  debug: "false"
  debug-verbose: ""
  direct-routing-skip-unreachable: "false"
  dnsproxy-enable-transparent-mode: "false"
  ec2-api-endpoint: ""
  egress-gateway-reconciliation-trigger-interval: 1s
  egress-masquerade-interfaces: eth0
  enable-auto-protect-node-port-range: "true"
  enable-bpf-clock-probe: "false"
  enable-endpoint-health-checking: "true"
  enable-endpoint-routes: "true"
  enable-health-check-loadbalancer-ip: "false"
  enable-health-check-nodeport: "true"
  enable-health-checking: "true"
  enable-hubble: "true"
  enable-hubble-open-metrics: "false"
  enable-ipv4: "true"
  enable-ipv4-big-tcp: "false"
  enable-ipv4-masquerade: "true"
  enable-ipv6: "false"
  enable-ipv6-big-tcp: "false"
  enable-ipv6-masquerade: "true"
  enable-k8s-networkpolicy: "true"
  enable-k8s-terminating-endpoint: "true"
  enable-l2-neigh-discovery: "true"
  enable-l7-proxy: "true"
  enable-local-redirect-policy: "false"
  enable-masquerade-to-route-source: "false"
  enable-metrics: "true"
  enable-node-selector-labels: "false"
  enable-policy: always
  enable-runtime-device-detection: "true"
  enable-sctp: "false"
  enable-svc-source-range-check: "true"
  enable-tcx: "true"
  enable-vtep: "false"
  enable-well-known-identities: "false"
  enable-xt-socket-fallback: "true"
  eni-tags: '{}'
  envoy-base-id: "0"
  envoy-keep-cap-netbindservice: "false"
  external-envoy-proxy: "true"
  hubble-disable-tls: "false"
  hubble-export-file-max-backups: "5"
  hubble-export-file-max-size-mb: "10"
  hubble-listen-address: :4244
  hubble-metrics: drop:sourceContext=workload-name|dns|identity;destinationContext=workload-name|dns|identity
  hubble-metrics-server: :9096
  hubble-metrics-server-enable-tls: "false"
  hubble-socket-path: /var/run/cilium/hubble.sock
  hubble-tls-cert-file: /var/lib/cilium/tls/hubble/server.crt
  hubble-tls-client-ca-files: /var/lib/cilium/tls/hubble/client-ca.crt
  hubble-tls-key-file: /var/lib/cilium/tls/hubble/server.key
  identity-allocation-mode: crd
  identity-gc-interval: 15m0s
  identity-heartbeat-timeout: 30m0s
  install-no-conntrack-iptables-rules: "false"
  ipam: eni
  ipam-cilium-node-update-rate: 15s
  ipv4-native-routing-cidr: 10.210.0.0/16
  k8s-client-burst: "20"
  k8s-client-qps: "10"
  k8s-require-ipv4-pod-cidr: "false"
  k8s-require-ipv6-pod-cidr: "false"
  kube-proxy-replacement: "true"
  kube-proxy-replacement-healthz-bind-address: ""
  labels: k8s:!spark-exec-id
  max-connected-clusters: "255"
  mesh-auth-enabled: "true"
  mesh-auth-gc-interval: 5m0s
  mesh-auth-queue-size: "1024"
  mesh-auth-rotated-identities-queue-size: "1024"
  metrics: +cilium_proxy_datapath_update_timeout_total
  monitor-aggregation: medium
  monitor-aggregation-flags: all
  monitor-aggregation-interval: 5s
  node-port-bind-protection: "true"
  nodeport-addresses: ""
  nodes-gc-interval: 5m0s
  operator-api-serve-addr: 127.0.0.1:9234
  operator-prometheus-serve-addr: :6942
  policy-audit-mode: "false"
  policy-cidr-match-mode: ""
  preallocate-bpf-maps: "false"
  procfs: /host/proc
  prometheus-serve-addr: :9090
  proxy-connect-timeout: "2"
  proxy-idle-timeout-seconds: "60"
  proxy-max-connection-duration-seconds: "0"
  proxy-max-requests-per-connection: "0"
  proxy-xff-num-trusted-hops-egress: "0"
  proxy-xff-num-trusted-hops-ingress: "0"
  read-cni-conf: /tmp/cni-configuration/cni-config
  remove-cilium-node-taints: "true"
  routing-mode: tunnel
  service-no-backend-response: reject
  set-cilium-is-up-condition: "true"
  set-cilium-node-taints: "true"
  subnet-tags-filter: Network=Private
  synchronize-k8s-nodes: "true"
  tofqdns-dns-reject-response-code: refused
  tofqdns-enable-dns-compression: "true"
  tofqdns-endpoint-max-ip-per-hostname: "401"
  tofqdns-idle-connection-grace-period: 0s
  tofqdns-max-deferred-connection-deletes: "10000"
  tofqdns-proxy-port: "10053"
  tofqdns-proxy-response-max-delay: 400ms
  tunnel-protocol: vxlan
  unmanaged-pod-watcher-interval: "15"
  update-ec2-adapter-limit-via-api: "true"
  vtep-cidr: ""
  vtep-endpoint: ""
  vtep-mac: ""
  vtep-mask: ""
  write-cni-conf-when-ready: /host/etc/cni/net.d/05-cilium.conflist
kind: ConfigMap
metadata:
  annotations:
    meta.helm.sh/release-name: cilium
    meta.helm.sh/release-namespace: cilium-system
  creationTimestamp: "2024-06-19T13:51:41Z"
  labels:
    app.kubernetes.io/managed-by: Helm
  name: cilium-config
  namespace: cilium-system
  resourceVersion: "3268598"
  uid: 798c200b-93a0-4c53-aed3-9fb441aa5c26

```

</details>

#### Cilium Originating Cluster

<details>

<summary>Cilium Monitor output</summary>

```

root@ip-10-210-112-181:/home/cilium# cilium monitor --related-to 1892  | grep 8080
Listening for events on 8 CPUs with 64x4096 of shared memory
Press Ctrl-C to quit
time="2024-06-25T16:07:43Z" level=info msg="Initializing dissection cache..." subsys=monitor
Policy verdict log: flow 0x572822cc local EP ID 1892, remote ID 1193113, proto 6, egress, action allow, auth: disabled, match L3-L4, 10.210.118.243:45122 -> 10.210.135.103:8080 tcp SYN
-> stack flow 0x572822cc , identity 2330254->1193113 state new ifindex 0 orig-ip 0.0.0.0: 10.210.118.243:45122 -> 10.210.135.103:8080 tcp SYN
-> stack flow 0xc1bad6cb , identity 2330254->1193113 state established ifindex 0 orig-ip 0.0.0.0: 10.210.118.243:45122 -> 10.210.135.103:8080 tcp SYN
-> stack flow 0x7c65508 , identity 2330254->1193113 state established ifindex 0 orig-ip 0.0.0.0: 10.210.118.243:45122 -> 10.210.135.103:8080 tcp SYN

```

</details>

##### Host Originating Cluster

<details>
<summary>tcpdump output</summary>

```

[root@ip-10-210-112-181 ec2-user]# tcpdump -i any 'host 10.210.118.243 and host 10.210.135.103' -nn
tcpdump: verbose output suppressed, use -v or -vv for full protocol decode
listening on any, link-type LINUX_SLL (Linux cooked), capture size 262144 bytes
16:07:35.973223 IP 10.210.118.243.34742 > 10.210.135.103.8080: Flags [S], seq 429069589, win 65535, options [mss 8961,sackOK,TS val 3976317094 ecr 0,nop,wscale 9], length 0
16:07:35.973252 IP 10.210.118.243.34742 > 10.210.135.103.8080: Flags [S], seq 429069589, win 65535, options [mss 8961,sackOK,TS val 3976317094 ecr 0,nop,wscale 9], length 0
16:07:43.675650 IP 10.210.118.243.45122 > 10.210.135.103.8080: Flags [S], seq 410431854, win 65535, options [mss 8961,sackOK,TS val 3976324796 ecr 0,nop,wscale 9], length 0
16:07:43.675695 IP 10.210.118.243.45122 > 10.210.135.103.8080: Flags [S], seq 410431854, win 65535, options [mss 8961,sackOK,TS val 3976324796 ecr 0,nop,wscale 9], length 0
16:07:44.677235 IP 10.210.118.243.45122 > 10.210.135.103.8080: Flags [S], seq 410431854, win 65535, options [mss 8961,sackOK,TS val 3976325798 ecr 0,nop,wscale 9], length 0
16:07:44.677279 IP 10.210.118.243.45122 > 10.210.135.103.8080: Flags [S], seq 410431854, win 65535, options [mss 8961,sackOK,TS val 3976325798 ecr 0,nop,wscale 9], length 0
16:07:46.693229 IP 10.210.118.243.45122 > 10.210.135.103.8080: Flags [S], seq 410431854, win 65535, options [mss 8961,sackOK,TS val 3976327814 ecr 0,nop,wscale 9], length 0
16:07:46.693272 IP 10.210.118.243.45122 > 10.210.135.103.8080: Flags [S], seq 410431854, win 65535, options [mss 8961,sackOK,TS val 3976327814 ecr 0,nop,wscale 9], length 0
16:07:50.821227 IP 10.210.118.243.45122 > 10.210.135.103.8080: Flags [S], seq 410431854, win 65535, options [mss 8961,sackOK,TS val 3976331942 ecr 0,nop,wscale 9], length 0
16:07:50.821256 IP 10.210.118.243.45122 > 10.210.135.103.8080: Flags [S], seq 410431854, win 65535, options [mss 8961,sackOK,TS val 3976331942 ecr 0,nop,wscale 9], length 0
16:07:59.013240 IP 10.210.118.243.45122 > 10.210.135.103.8080: Flags [S], seq 410431854, win 65535, options [mss 8961,sackOK,TS val 3976340134 ecr 0,nop,wscale 9], length 0
16:07:59.013270 IP 10.210.118.243.45122 > 10.210.135.103.8080: Flags [S], seq 410431854, win 65535, options [mss 8961,sackOK,TS val 3976340134 ecr 0,nop,wscale 9], length 0
16:08:15.141229 IP 10.210.118.243.45122 > 10.210.135.103.8080: Flags [S], seq 410431854, win 65535, options [mss 8961,sackOK,TS val 3976356262 ecr 0,nop,wscale 9], length 0
16:08:15.141256 IP 10.210.118.243.45122 > 10.210.135.103.8080: Flags [S], seq 410431854, win 65535, options [mss 8961,sackOK,TS val 3976356262 ecr 0,nop,wscale 9], length 0

```

</details>

#### Destination Cluster Cilium

<details>
<summary>Cilium Monitor Output</summary>

``` 

root@ip-10-210-148-21:/home/cilium# cilium monitor --related-to 69 | grep 8080
Listening for events on 4 CPUs with 64x4096 of shared memory
Press Ctrl-C to quit
time="2024-06-25T16:07:35Z" level=info msg="Initializing dissection cache..." subsys=monitor
-> endpoint 69 flow 0xacd55ef9 , identity 2330254->1193113 state established ifindex 0 orig-ip 10.210.118.243: 10.210.118.243:34742 -> 10.210.135.103:8080 tcp SYN
-> overlay flow 0x5a4d7333 , identity 1193113->2330254 state reply ifindex cilium_vxlan orig-ip 0.0.0.0: 10.210.135.103:8080 -> 10.210.118.243:34742 tcp SYN, ACK
Policy verdict log: flow 0x6c3e573d local EP ID 69, remote ID 2330254, proto 6, ingress, action allow, auth: disabled, match L3-L4, 10.210.118.243:45122 -> 10.210.135.103:8080 tcp SYN
-> endpoint 69 flow 0x6c3e573d , identity 2330254->1193113 state new ifindex 0 orig-ip 10.210.118.243: 10.210.118.243:45122 -> 10.210.135.103:8080 tcp SYN
-> overlay flow 0xdd65363d , identity 1193113->2330254 state reply ifindex cilium_vxlan orig-ip 0.0.0.0: 10.210.135.103:8080 -> 10.210.118.243:45122 tcp SYN, ACK
-> endpoint 69 flow 0x6c3e573d , identity 2330254->1193113 state established ifindex 0 orig-ip 10.210.118.243: 10.210.118.243:45122 -> 10.210.135.103:8080 tcp SYN
-> overlay flow 0x600f1786 , identity 1193113->2330254 state reply ifindex cilium_vxlan orig-ip 0.0.0.0: 10.210.135.103:8080 -> 10.210.118.243:45122 tcp SYN, ACK
-> overlay flow 0x618b2df1 , identity 1193113->2330254 state reply ifindex cilium_vxlan orig-ip 0.0.0.0: 10.210.135.103:8080 -> 10.210.118.243:34742 tcp SYN, ACK
-> endpoint 69 flow 0x6c3e573d , identity 2330254->1193113 state established ifindex 0 orig-ip 10.210.118.243: 10.210.118.243:45122 -> 10.210.135.103:8080 tcp SYN
-> overlay flow 0xb85388fb , identity 1193113->2330254 state reply ifindex cilium_vxlan orig-ip 0.0.0.0: 10.210.135.103:8080 -> 10.210.118.243:45122 tcp SYN, ACK
-> overlay flow 0xc155e64 , identity 1193113->2330254 state reply ifindex cilium_vxlan orig-ip 0.0.0.0: 10.210.135.103:8080 -> 10.210.118.243:45122 tcp SYN, ACK
-> endpoint 69 flow 0x6c3e573d , identity 2330254->1193113 state established ifindex 0 orig-ip 10.210.118.243: 10.210.118.243:45122 -> 10.210.135.103:8080 tcp SYN
-> overlay flow 0xa2590f2e , identity 1193113->2330254 state reply ifindex cilium_vxlan orig-ip 0.0.0.0: 10.210.135.103:8080 -> 10.210.118.243:45122 tcp SYN, ACK
-> overlay flow 0xca3941b , identity 1193113->2330254 state reply ifindex cilium_vxlan orig-ip 0.0.0.0: 10.210.135.103:8080 -> 10.210.118.243:45122 tcp SYN, ACK
-> endpoint 69 flow 0x6c3e573d , identity 2330254->1193113 state established ifindex 0 orig-ip 10.210.118.243: 10.210.118.243:45122 -> 10.210.135.103:8080 tcp SYN
-> overlay flow 0x1ac03e58 , identity 1193113->2330254 state reply ifindex cilium_vxlan orig-ip 0.0.0.0: 10.210.135.103:8080 -> 10.210.118.243:45122 tcp SYN, ACK 

```

</details>

#### Destination Cluster Host

<details>
<summary>tcpdump output</summary>

```

[root@admin]# tcpdump -i any 'host 10.210.118.243 and host 10.210.135.103' -nn
tcpdump: verbose output suppressed, use -v or -vv for full protocol decode
listening on any, link-type LINUX_SLL (Linux cooked), capture size 262144 bytes
16:07:43.676097 IP 10.210.118.243.45122 > 10.210.135.103.8080: Flags [S], seq 410431854, win 65535, options [mss 8961,sackOK,TS val 3976324796 ecr 0,nop,wscale 9], length 0
16:07:43.676172 IP 10.210.118.243.45122 > 10.210.135.103.8080: Flags [S], seq 410431854, win 65535, options [mss 8961,sackOK,TS val 3976324796 ecr 0,nop,wscale 9], length 0
16:07:43.676209 IP 10.210.135.103.8080 > 10.210.118.243.45122: Flags [S.], seq 863141451, ack 410431855, win 62293, options [mss 8911,sackOK,TS val 3873844288 ecr 3976324796,nop,wscale 7], length 0
16:07:43.676223 IP 10.210.135.103.8080 > 10.210.118.243.45122: Flags [S.], seq 863141451, ack 410431855, win 62293, options [mss 8911,sackOK,TS val 3873844288 ecr 3976324796,nop,wscale 7], length 0
16:07:44.677685 IP 10.210.118.243.45122 > 10.210.135.103.8080: Flags [S], seq 410431854, win 65535, options [mss 8961,sackOK,TS val 3976325798 ecr 0,nop,wscale 9], length 0
16:07:44.677739 IP 10.210.118.243.45122 > 10.210.135.103.8080: Flags [S], seq 410431854, win 65535, options [mss 8961,sackOK,TS val 3976325798 ecr 0,nop,wscale 9], length 0
16:07:44.677770 IP 10.210.135.103.8080 > 10.210.118.243.45122: Flags [S.], seq 863141451, ack 410431855, win 62293, options [mss 8911,sackOK,TS val 3873845290 ecr 3976324796,nop,wscale 7], length 0
16:07:44.677785 IP 10.210.135.103.8080 > 10.210.118.243.45122: Flags [S.], seq 863141451, ack 410431855, win 62293, options [mss 8911,sackOK,TS val 3873845290 ecr 3976324796,nop,wscale 7], length 0
16:07:45.717430 IP 10.210.135.103.8080 > 10.210.118.243.45122: Flags [S.], seq 863141451, ack 410431855, win 62293, options [mss 8911,sackOK,TS val 3873846330 ecr 3976324796,nop,wscale 7], length 0
16:07:45.717453 IP 10.210.135.103.8080 > 10.210.118.243.45122: Flags [S.], seq 863141451, ack 410431855, win 62293, options [mss 8911,sackOK,TS val 3873846330 ecr 3976324796,nop,wscale 7], length 0
16:07:46.693686 IP 10.210.118.243.45122 > 10.210.135.103.8080: Flags [S], seq 410431854, win 65535, options [mss 8961,sackOK,TS val 3976327814 ecr 0,nop,wscale 9], length 0
16:07:46.693747 IP 10.210.118.243.45122 > 10.210.135.103.8080: Flags [S], seq 410431854, win 65535, options [mss 8961,sackOK,TS val 3976327814 ecr 0,nop,wscale 9], length 0
16:07:46.693774 IP 10.210.135.103.8080 > 10.210.118.243.45122: Flags [S.], seq 863141451, ack 410431855, win 62293, options [mss 8911,sackOK,TS val 3873847306 ecr 3976324796,nop,wscale 7], length 0
16:07:46.693789 IP 10.210.135.103.8080 > 10.210.118.243.45122: Flags [S.], seq 863141451, ack 410431855, win 62293, options [mss 8911,sackOK,TS val 3873847306 ecr 3976324796,nop,wscale 7], length 0
16:07:48.747404 IP 10.210.135.103.8080 > 10.210.118.243.45122: Flags [S.], seq 863141451, ack 410431855, win 62293, options [mss 8911,sackOK,TS val 3873849360 ecr 3976324796,nop,wscale 7], length 0
16:07:48.747425 IP 10.210.135.103.8080 > 10.210.118.243.45122: Flags [S.], seq 863141451, ack 410431855, win 62293, options [mss 8911,sackOK,TS val 3873849360 ecr 3976324796,nop,wscale 7], length 0
16:07:50.821649 IP 10.210.118.243.45122 > 10.210.135.103.8080: Flags [S], seq 410431854, win 65535, options [mss 8961,sackOK,TS val 3976331942 ecr 0,nop,wscale 9], length 0
16:07:50.821703 IP 10.210.118.243.45122 > 10.210.135.103.8080: Flags [S], seq 410431854, win 65535, options [mss 8961,sackOK,TS val 3976331942 ecr 0,nop,wscale 9], length 0
16:07:50.821725 IP 10.210.135.103.8080 > 10.210.118.243.45122: Flags [S.], seq 863141451, ack 410431855, win 62293, options [mss 8911,sackOK,TS val 3873851434 ecr 3976324796,nop,wscale 7], length 0
16:07:50.821741 IP 10.210.135.103.8080 > 10.210.118.243.45122: Flags [S.], seq 863141451, ack 410431855, win 62293, options [mss 8911,sackOK,TS val 3873851434 ecr 3976324796,nop,wscale 7], length 0
16:07:52.107420 IP 10.210.135.103.8080 > 10.210.118.243.34742: Flags [S.], seq 3043827879, ack 429069590, win 62293, options [mss 8911,sackOK,TS val 3873852720 ecr 3976285685,nop,wscale 7], length 0
16:07:52.107454 IP 10.210.135.103.8080 > 10.210.118.243.34742: Flags [S.], seq 3043827879, ack 429069590, win 62293, options [mss 8911,sackOK,TS val 3873852720 ecr 3976285685,nop,wscale 7], length 0
16:07:54.837415 IP 10.210.135.103.8080 > 10.210.118.243.45122: Flags [S.], seq 863141451, ack 410431855, win 62293, options [mss 8911,sackOK,TS val 3873855450 ecr 3976324796,nop,wscale 7], length 0
16:07:54.837433 IP 10.210.135.103.8080 > 10.210.118.243.45122: Flags [S.], seq 863141451, ack 410431855, win 62293, options [mss 8911,sackOK,TS val 3873855450 ecr 3976324796,nop,wscale 7], length 0
16:07:59.013682 IP 10.210.118.243.45122 > 10.210.135.103.8080: Flags [S], seq 410431854, win 65535, options [mss 8961,sackOK,TS val 3976340134 ecr 0,nop,wscale 9], length 0
16:07:59.013726 IP 10.210.118.243.45122 > 10.210.135.103.8080: Flags [S], seq 410431854, win 65535, options [mss 8961,sackOK,TS val 3976340134 ecr 0,nop,wscale 9], length 0
16:07:59.013757 IP 10.210.135.103.8080 > 10.210.118.243.45122: Flags [S.], seq 863141451, ack 410431855, win 62293, options [mss 8911,sackOK,TS val 3873859626 ecr 3976324796,nop,wscale 7], length 0
16:07:59.013772 IP 10.210.135.103.8080 > 10.210.118.243.45122: Flags [S.], seq 863141451, ack 410431855, win 62293, options [mss 8911,sackOK,TS val 3873859626 ecr 3976324796,nop,wscale 7], length 0
16:08:07.467414 IP 10.210.135.103.8080 > 10.210.118.243.45122: Flags [S.], seq 863141451, ack 410431855, win 62293, options [mss 8911,sackOK,TS val 3873868080 ecr 3976324796,nop,wscale 7], length 0
16:08:07.467469 IP 10.210.135.103.8080 > 10.210.118.243.45122: Flags [S.], seq 863141451, ack 410431855, win 62293, options [mss 8911,sackOK,TS val 3873868080 ecr 3976324796,nop,wscale 7], length 0
16:08:15.141667 IP 10.210.118.243.45122 > 10.210.135.103.8080: Flags [S], seq 410431854, win 65535, options [mss 8961,sackOK,TS val 3976356262 ecr 0,nop,wscale 9], length 0
16:08:15.141729 IP 10.210.118.243.45122 > 10.210.135.103.8080: Flags [S], seq 410431854, win 65535, options [mss 8961,sackOK,TS val 3976356262 ecr 0,nop,wscale 9], length 0
16:08:15.141758 IP 10.210.135.103.8080 > 10.210.118.243.45122: Flags [S.], seq 863141451, ack 410431855, win 62293, options [mss 8911,sackOK,TS val 3873875754 ecr 3976324796,nop,wscale 7], length 0
16:08:15.141770 IP 10.210.135.103.8080 > 10.210.118.243.45122: Flags [S.], seq 863141451, ack 410431855, win 62293, options [mss 8911,sackOK,TS val 3873875754 ecr 3976324796,nop,wscale 7], length 0
16:08:31.157408 IP 10.210.135.103.8080 > 10.210.118.243.45122: Flags [S.], seq 863141451, ack 410431855, win 62293, options [mss 8911,sackOK,TS val 3873891770 ecr 3976324796,nop,wscale 7], length 0
16:08:31.157437 IP 10.210.135.103.8080 > 10.210.118.243.45122: Flags [S.], seq 863141451, ack 410431855, win 62293, options [mss 8911,sackOK,TS val 3873891770 ecr 3976324796,nop,wscale 7], length 0

```

</details>

<details>

<summary>pwru output for destination cluster</summary>

```0xffff8cfb93852700      1    [<empty>:(0)]           __ip_local_out
0xffff8cfb93852700      1    [<empty>:(0)]             nf_hook_slow
0xffff8cfb93852700      1    [<empty>:(0)]        selinux_ip_output
0xffff8cfb93852700      1    [<empty>:(0)]                ip_output
0xffff8cfb93852700      1    [<empty>:(0)]             nf_hook_slow
0xffff8cfb93852700      1    [<empty>:(0)]     selinux_ip_postroute
0xffff8cfb93852700      1    [<empty>:(0)]         ip_finish_output
0xffff8cfb93852700      1    [<empty>:(0)]       __ip_finish_output
0xffff8cfb93852700      1    [<empty>:(0)]        ip_finish_output2
0xffff8cfb93852700      1    [<empty>:(0)]     neigh_resolve_output
0xffff8cfb93852700      1    [<empty>:(0)]       __neigh_event_send
0xffff8cfb93852700      1    [<empty>:(0)]                skb_clone
0xffff8cfb93852700      1    [<empty>:(0)]        ipv4_neigh_lookup
0xffff8cfb93852700      1    [<empty>:(0)]     neigh_resolve_output
0xffff8cfb93852700      1    [<empty>:(0)]               eth_header
0xffff8cfb93852700      1    [<empty>:(0)]                 skb_push
0xffff8cfb93852700      1    [<empty>:(0)]         __dev_queue_xmit
0xffff8cfb93852700      1    [<empty>:(0)]       qdisc_pkt_len_init
0xffff8cfb93852700      1    [<empty>:(0)]      netdev_core_pick_tx
0xffff8cfb93852700      1    [<empty>:(0)]        validate_xmit_skb
0xffff8cfb93852700      1    [<empty>:(0)]       netif_skb_features
0xffff8cfb93852700      1    [<empty>:(0)]  passthru_features_check
0xffff8cfb93852700      1    [<empty>:(0)]     skb_network_protocol
0xffff8cfb93852700      1    [<empty>:(0)]  skb_csum_hwoffload_help
0xffff8cfb93852700      1    [<empty>:(0)]       validate_xmit_xfrm
0xffff8cfb93852700      1    [<empty>:(0)]      dev_hard_start_xmit
0xffff8cfb93852700      1    [<empty>:(0)]       dev_queue_xmit_nit
0xffff8cfb93852700      1    [<empty>:(0)]   skb_clone_tx_timestamp
0xffff8cfb93852700      1    [<empty>:(0)]        __dev_forward_skb
0xffff8cfb93852700      1    [<empty>:(0)]       __dev_forward_skb2
0xffff8cfb93852700      1    [<empty>:(0)]         skb_scrub_packet
0xffff8cfb93852700      1    [<empty>:(0)]           eth_type_trans
0xffff8cfb93852700      1    [<empty>:(0)]               __netif_rx
0xffff8cfb93852700      1    [<empty>:(0)]        netif_rx_internal
0xffff8cfb93852700      1    [<empty>:(0)]       enqueue_to_backlog
0xffff8cfb93852700      1    [<empty>:(0)]      __netif_receive_skb
0xffff8cfb93852700      1    [<empty>:(0)] __netif_receive_skb_one_core
0xffff8cfb93852700      1    [<empty>:(0)]              tpacket_rcv
0xffff8cfb93852700      1    [<empty>:(0)]                 skb_push
0xffff8cfb93852700      1    [<empty>:(0)]              consume_skb
0xffff8cfb93852700      1    [<empty>:(0)]               packet_rcv
0xffff8cfb93852700      1    [<empty>:(0)]                 skb_push
0xffff8cfb93852700      1    [<empty>:(0)]              consume_skb
0xffff8cfb93852700      1    [<empty>:(0)]             tcf_classify
0xffff8cfb93852700      1    [<empty>:(0)]      skb_ensure_writable
0xffff8cfb93852700      1    [<empty>:(0)]      skb_ensure_writable
0xffff8cfb93852700      1    [<empty>:(0)]          skb_do_redirect
0xffff8cfb93852700      1    [<empty>:(0)]           __bpf_redirect
0xffff8cfb93852700      1    [<empty>:(0)]         __dev_queue_xmit
0xffff8cfb93852700      1    [<empty>:(0)]       qdisc_pkt_len_init
0xffff8cfb93852700      1    [<empty>:(0)]             tcf_classify
0xffff8cfb93852700      1    [<empty>:(0)]      netdev_core_pick_tx
0xffff8cfb93852700      1    [<empty>:(0)]        validate_xmit_skb
0xffff8cfb93852700      1    [<empty>:(0)]       netif_skb_features
0xffff8cfb93852700      1    [<empty>:(0)]     skb_network_protocol
0xffff8cfb93852700      1    [<empty>:(0)]  skb_csum_hwoffload_help
0xffff8cfb93852700      1    [<empty>:(0)]       validate_xmit_xfrm
0xffff8cfb93852700      1    [<empty>:(0)]      dev_hard_start_xmit
0xffff8cfb93852700      1    [<empty>:(0)]       dev_queue_xmit_nit
0xffff8cfb93852700      1    [<empty>:(0)]                skb_clone
0xffff8cfb93852700      1    [<empty>:(0)]    skb_tunnel_check_pmtu
0xffff8cfb93852700      1    [<empty>:(0)] iptunnel_handle_offloads
0xffff8cfb93852700      1    [<empty>:(0)]             udp_set_csum
0xffff8cfb93852700      1    [<empty>:(0)]            iptunnel_xmit
0xffff8cfb93852700      1    [<empty>:(0)]         skb_scrub_packet
0xffff8cfb93852700      1    [<empty>:(0)]                 skb_push
0xffff8cfb93852700      1    [<empty>:(0)]             ip_local_out
0xffff8cfb93852700      1    [<empty>:(0)]           __ip_local_out
0xffff8cfb93852700      1    [<empty>:(0)]             nf_hook_slow
0xffff8cfb93852700      1    [<empty>:(0)]             ipt_do_table
0xffff8cfb93852700      1    [<empty>:(0)]        selinux_ip_output
0xffff8cfb93852700      1    [<empty>:(0)]             ipt_do_table
0xffff8cfb93852700      1    [<empty>:(0)]             ipt_do_table
0xffff8cfb93852700      1    [<empty>:(0)]             ipt_do_table
0xffff8cfb93852700      1    [<empty>:(0)]                ip_output
0xffff8cfb93852700      1    [<empty>:(0)]             nf_hook_slow
0xffff8cfb93852700      1    [<empty>:(0)]             ipt_do_table
0xffff8cfb93852700      1    [<empty>:(0)]             ipt_do_table
0xffff8cfb93852700      1    [<empty>:(0)]     selinux_ip_postroute
0xffff8cfb93852700      1    [<empty>:(0)]         ip_finish_output
0xffff8cfb93852700      1    [<empty>:(0)]       __ip_finish_output
0xffff8cfb93852700      1    [<empty>:(0)]        ip_finish_output2
0xffff8cfb93852700      1    [<empty>:(0)]         __dev_queue_xmit
0xffff8cfb93852700      1    [<empty>:(0)] __netif_receive_skb_one_core
0xffff8cfb93852700      1    [<empty>:(0)]              tpacket_rcv
0xffff8cfb93852700      1    [<empty>:(0)]                 skb_push
0xffff8cfb93852700      1    [<empty>:(0)]              consume_skb
0xffff8cfb93852700      1    [<empty>:(0)]               packet_rcv
0xffff8cfb93852700      1    [<empty>:(0)]                 skb_push
0xffff8cfb93852700      1    [<empty>:(0)]              consume_skb
0xffff8cfb93852700      1    [<empty>:(0)]             tcf_classify
0xffff8cfb93852700      1    [<empty>:(0)]      skb_ensure_writable
0xffff8cfb93852700      1    [<empty>:(0)]      skb_ensure_writable
0xffff8cfb93852700      1    [<empty>:(0)]          skb_do_redirect
0xffff8cfb93852700      1    [<empty>:(0)]           __bpf_redirect
0xffff8cfb93852700      1    [<empty>:(0)]         __dev_queue_xmit
0xffff8cfb93852700      1    [<empty>:(0)]       qdisc_pkt_len_init
0xffff8cfb93852700      1    [<empty>:(0)]             tcf_classify
0xffff8cfb93852700      1    [<empty>:(0)]      netdev_core_pick_tx
0xffff8cfb93852700      1    [<empty>:(0)]        validate_xmit_skb
0xffff8cfb93852700      1    [<empty>:(0)]       netif_skb_features
0xffff8cfb93852700      1    [<empty>:(0)]     skb_network_protocol
0xffff8cfb93852700      1    [<empty>:(0)]  skb_csum_hwoffload_help
0xffff8cfb93852700      1    [<empty>:(0)]       validate_xmit_xfrm
0xffff8cfb93852700      1    [<empty>:(0)]      dev_hard_start_xmit
0xffff8cfb93852700      1    [<empty>:(0)]       dev_queue_xmit_nit
0xffff8cfb93852700      1    [<empty>:(0)]                skb_clone
0xffff8cfb93852700      1    [<empty>:(0)]    skb_tunnel_check_pmtu
0xffff8cfb93852700      1    [<empty>:(0)] iptunnel_handle_offloads
0xffff8cfb93852700      1    [<empty>:(0)]             udp_set_csum
0xffff8cfb93852700      1    [<empty>:(0)]            iptunnel_xmit
0xffff8cfb93852700      1    [<empty>:(0)]         skb_scrub_packet
0xffff8cfb93852700      1    [<empty>:(0)]                 skb_push
0xffff8cfb93852700      1    [<empty>:(0)]             ip_local_out
0xffff8cfb93852700      1    [<empty>:(0)]           __ip_local_out
0xffff8cfb93852700      1    [<empty>:(0)]             nf_hook_slow
0xffff8cfb93852700      1    [<empty>:(0)]             ipt_do_table
0xffff8cfb93852700      1    [<empty>:(0)]        selinux_ip_output
0xffff8cfb93852700      1    [<empty>:(0)]             ipt_do_table
0xffff8cfb93852700      1    [<empty>:(0)]             ipt_do_table
0xffff8cfb93852700      1    [<empty>:(0)]             ipt_do_table
0xffff8cfb93852700      1    [<empty>:(0)]                ip_output
0xffff8cfb93852700      1    [<empty>:(0)]             nf_hook_slow
0xffff8cfb93852700      1    [<empty>:(0)]             ipt_do_table
0xffff8cfb93852700      1    [<empty>:(0)]             ipt_do_table
0xffff8cfb93852700      1    [<empty>:(0)]     selinux_ip_postroute
0xffff8cfb93852700      1    [<empty>:(0)]         ip_finish_output
0xffff8cfb93852700      1    [<empty>:(0)]       __ip_finish_output
0xffff8cfb93852700      1    [<empty>:(0)]        ip_finish_output2
0xffff8cfb93852700      1    [<empty>:(0)]         __dev_queue_xmit
```

</details>

### Cilium Users Document

- [X] Are you a user of Cilium? Please add yourself to the [Users doc](https://github.com/cilium/cilium/blob/main/USERS.md)

### Code of Conduct

- [X] I agree to follow this project's Code of Conduct

**Comment by mantoine96** [comment]
Upon further investigation, it seems like there was a breaking change in BPF plumbing in the 1.15.0 release, which leads to this incompatibility of clustermesh between 1.14.x clusters and 1.15+

**Comment by giorio94** [comment]
Thanks @mantoine96 for the very detailed information!

As a preliminary note, at most one minor version skew across clusters is supported (and tested) for clustermesh. I don't think that your issue is related to that, both because it would manifest at the control plane level and because you also observed the same problems with v1.14 and v1.15. 

That said, the sysdumps appear to be incomplete, and don't contain any information about the state of the different nodes (including the bpf maps). Still, based on the tcpdump output, the return packet looks correct in terms of IP addresses, but gets dropped somewhere. I see that you are using ENI mode, hence AWS is responsible for actually forwarding the traffic, so one possibility is that it gets dropped by the AWS underlying network (e.g., due to a missing firewall rule). However, given that it works when the version matches, that doesn't sound like a possible explanation.

Looking at the cilium monitor output, the following line looks suspicious, as it mentions that the packet is forwarded over the `cilium_vxlan` interface, which should not be present. Hence, there must be something wrong with the configuration.

```
-> overlay flow 0x5a4d7333 , identity 1193113->2330254 state reply ifindex cilium_vxlan orig-ip 0.0.0.0: 10.210.135.103:8080 -> 10.210.118.243:34742 tcp SYN, ACK
```

This is also confirmed by the cilium configmap on the second cluster:

```
  routing-mode: tunnel
  tunnel-protocol: vxlan
```

Looking at the helm values, I see `tunnel: disabled`, but that setting got deprecated a while ago, and replaced with `routingMode: native`. Fixing that should address the issue.

**Comment by mantoine96** [comment]
Hey @giorio94 

Thank you so much for the fast reply. It appears that you are right indeed, the `tunnel: disabled` setting got deprecated on 1.15.0 which explains why this problem occurs whenever there is a cluster on either side of that deprecation.

I can confirm that setting `routingMode: native` fixed the issue! So this was user error 100% 🤦 

I will be going through the deprecations in Helm to make sure we are not affected by any other one.

Thanks again!
