### ISSUE TITLE
Pods running with "hostNetwork: true" cannot reach Service ClusterIPs.

### ISSUE THREAD

**Issue by tappof** [cilium/cilium#44324]
### Is there an existing issue for this?

- [x] I have searched the existing issues

### Version

equal or higher than v1.19.0 and lower than v1.20.0

### What happened?

I deployed Cilium (1.19.0) on my Talos cluster using Helm.
I’m experiencing an issue with Pods running with `hostNetwork: true` cannot reach Service ClusterIPs.

### How can we reproduce the issue?

```
kubeProxyReplacement: true
ipam:
  mode: kubernetes
routingMode: native
autoDirectNodeRoutes: true
ipv4NativeRoutingCIDR: 100.126.0.0/16
bpf:
  masquerade: true
securityContext:
  capabilities:
    ciliumAgent:
      - CHOWN
      - KILL
      - NET_ADMIN
      - NET_RAW
      - IPC_LOCK
      - SYS_ADMIN
      - SYS_RESOURCE
      - DAC_OVERRIDE
      - FOWNER
      - SETGID
      - SETUID
    cleanCiliumState:
      - NET_ADMIN
      - SYS_ADMIN
      - SYS_RESOURCE
cgroup:
  autoMount:
    enabled: false
    hostRoot: "/sys/fs/cgroup"
k8sServiceHost: localhost
k8sServicePort: 7445
ingressController:
  enabled: true
  default: true
  loadBalancerMode: shared
  service:
    loadBalancerIP: "192.168.0.80"
l2announcements:
  enabled: true
  leaseDuration: 60s
  leaseRenewDeadline: 20s
  leaseRetryPeriod: 4s
k8sClientRateLimit:
  qps: 200
  burst: 400
hubble:
  enabled: true
  metrics:
    enabled:
      - dns
      - drop
      - tcp
      - flow
      - port-distribution
      - icmp
      - httpV2:exemplars=true;labelsContext=source_ip,source_namespace,source_workload,destination_ip,destination_namespace,destination_workload,traffic_direction
  relay:
    enabled: true
  ui:
    enabled: true
operator:
  prometheus:
    enabled: true
prometheus:
  enabled: true
```

```
❯ k get service
NAME                                                 TYPE           CLUSTER-IP        EXTERNAL-IP    PORT(S)                        AGE
kube-system-metrics-server                           LoadBalancer   100.127.222.133   192.168.0.78   4443:32241/TCP                 46h
```

```
hamburg0:/# telnet 100.127.222.133 4443
telnet: can't connect to remote host (100.127.222.133): Operation timed out
```

It seems that the packets follow the default route (via ens18), leaving the cluster.
```
hamburg0:/# tcpdump -ni ens18 -s0 -vvv host 100.127.222.133 and port 4443
08:32:42.808115 IP (tos 0x0, ttl 63, id 977, offset 0, flags [DF], proto TCP (6), length 60)
    192.168.0.40.47536 > 100.127.222.133.4443: Flags [S], cksum 0xe4ed (correct), seq 3451088677, win 64240, options [mss 1460,sackOK,TS val 2444348085 ecr 0,nop,wscale 7], length 0
08:32:42.808141 IP (tos 0x0, ttl 63, id 49303, offset 0, flags [DF], proto TCP (6), length 60)
    192.168.0.40.47520 > 100.127.222.133.4443: Flags [S], cksum 0x3291 (correct), seq 2253351158, win 64240, options [mss 1460,sackOK,TS val 2444348085 ecr 0,nop,wscale 7], length 0
08:32:42.808147 IP (tos 0x0, ttl 63, id 30433, offset 0, flags [DF], proto TCP (6), length 60)
    192.168.0.40.47508 > 100.127.222.133.4443: Flags [S], cksum 0x2b9b (correct), seq 1347986927, win 64240, options [mss 1460,sackOK,TS val 2444348085 ecr 0,nop,wscale 7], length 0
08:32:42.808185 IP (tos 0x0, ttl 63, id 27627, offset 0, flags [DF], proto TCP (6), length 60)
    192.168.0.40.47496 > 100.127.222.133.4443: Flags [S], cksum 0xbe81 (correct), seq 346246858, win 64240, options [mss 1460,sackOK,TS val 2444348085 ecr 0,nop,wscale 7], length 0
08:32:42.999554 IP (tos 0x0, ttl 64, id 33206, offset 0, flags [DF], proto TCP (6), length 60)
```

```
hamburg0:/# ip r l
default via 192.168.0.1 dev ens18 proto static metric 1024
100.126.0.0/24 via 192.168.0.43 dev ens18 proto kernel
100.126.1.0/24 via 100.126.1.34 dev cilium_host proto kernel src 100.126.1.34
100.126.1.34 dev cilium_host proto kernel scope link
100.126.2.0/24 via 192.168.0.42 dev ens18 proto kernel
100.126.3.0/24 via 192.168.0.44 dev ens18 proto kernel
100.126.4.0/24 via 192.168.0.41 dev ens18 proto kernel
192.168.0.0/24 dev ens18 proto kernel scope link src 192.168.0.40
```

The talos machineconfigs almost follows the default values (exceptions are only for ip/dns/ntp configs).

### Cilium Version

```
❯ cilium-cli version
cilium-cli:  compiled with go1.25.5 X:nodwarf5 on linux/amd64
cilium image (default): v1.18.5
cilium image (stable): v1.18.6
cilium image (running): 1.18.4
```

### Kernel Version

```
❯ talosctl -n 192.168.0.40 read /proc/version
Linux version 6.12.57-talos (root@buildkitsandbox) (gcc (GCC) 14.3.0, GNU ld (GNU Binutils) 2.44) #1 SMP Wed Nov  5 12:59:35 UTC 2025

❯ talosctl -n 192.168.0.40 version
Client:
  Tag:         v1.12.3
  SHA:         6d6471f69230e271c3289f6a3ab6ac78f7b9766a

  Built:
  Go version:  go1.25.7 X:nodwarf5
  OS/Arch:     linux/amd64
Server:
  NODE:        192.168.0.40
  Tag:         v1.11.5
  SHA:         bc34de6e
  Built:
  Go version:  go1.24.9
  OS/Arch:     linux/amd64
  Enabled:     RBAC
```

Talos image: factory.talos.dev/installer/ce4c980550dd2ab1b17bbf2b08801c7eb59418eafe8f279833297925d67c7515:v1.11.5.

### Kubernetes Version

```
❯ kubectl version
Client Version: v1.35.0
Kustomize Version: v5.7.1
Server Version: v1.34.1
```

### Regression

I had the same behavior with 1.18.4 (also with vxlan overlay network and/or `bpf.masquerade: false`).

### Sysdump

[cilium-sysdump-20260211-232915.zip](https://github.com/user-attachments/files/25275082/cilium-sysdump-20260211-232915.zip)

### Relevant log output

```shell

```

### Cilium Users Document

- [ ] Are you a user of Cilium? Please add yourself to the [Users doc](https://github.com/cilium/cilium/blob/main/USERS.md)

### Code of Conduct

- [x] I agree to follow this project's Code of Conduct

**Comment by rgo3** [comment]
Hey @tappof, thanks for the report!

The following section in your config looks a bit off to me:
```
cgroup:
  autoMount:
    enabled: false
    hostRoot: "/sys/fs/cgroup"
```

I think it should be:
```
cgroup:
  autoMount:
    enabled: false
  hostRoot: "/sys/fs/cgroup"
```

My theory would be that because of the indentation error, the hostRoot field doesn't propagate to Cilium's config, e.g. in the sysdump I see that the config map contains: `cgroup-root:/run/cilium/cgroupv2`. If cilium doesn't attach the socket programs to the correct cgroup, the service IP to backend translation fails and you could end up with the error you are reporting here.

**Comment by tappof** [comment]
Thank you so much @rgo3. Indeed, the problem was caused by the hostRoot key being misconfigured.
