### ISSUE TITLE
Cilium + CoreDNS on EKS unable to communicate to Kubernetes master.

### ISSUE THREAD

**Issue by izaakschroeder** [cilium/cilium#14459]
## Bug report

**General Information**

- Cilium version (run `cilium version`)

```
Client: 1.9.1 ab7c84d3b 2020-12-14T10:28:01+01:00 go version go1.15.6 linux/amd64
Daemon: 1.9.1 ab7c84d3b 2020-12-14T10:28:01+01:00 go version go1.15.6 linux/amd64
```

- Kernel version (run `uname -a`)

```
Linux ip-10-232-145-223.us-west-2.compute.internal 5.4.68 #1 SMP Fri Nov 20 21:53:46 UTC 2020 x86_64 x86_64 x86_64 GNU/Linux
```

- Orchestration system version in use (e.g. `kubectl version`, Mesos, ...)

```
Client Version: version.Info{Major:"1", Minor:"19", GitVersion:"v1.19.3", GitCommit:"1e11e4a2108024935ecfcb2912226cedeafd99df", GitTreeState:"clean", BuildDate:"2020-10-14T12:50:19Z", GoVersion:"go1.15.2", Compiler:"gc", Platform:"darwin/amd64"}
Server Version: version.Info{Major:"1", Minor:"18+", GitVersion:"v1.18.9-eks-d1db3c", GitCommit:"d1db3c46e55f95d6a7d3e5578689371318f95ff9", GitTreeState:"clean", BuildDate:"2020-10-20T22:18:07Z", GoVersion:"go1.13.15", Compiler:"gc", Platform:"linux/amd64"}
```

- Link to relevant artifacts (policies, deployments scripts, ...)

Deployed to AWS EKS using Terraform: https://gist.github.com/izaakschroeder/a625fe44ef5cfa435823bf50540118d1. Host instances are running AWS Bottlerocket.

- Generate and upload a system zip:

```
curl -sLO https://git.io/cilium-sysdump-latest.zip && python cilium-sysdump-latest.zip
```

[cilium-sysdump-20201219-224843.zip](https://github.com/cilium/cilium/files/5720626/cilium-sysdump-20201219-224843.zip)

**How to reproduce the issue**

1. Deploy Cilium per above method
2. Observe CoreDNS pods unable to have network traffic leave the node *BUT* other pods are fine

I had a conversation with @aanm on Slack about this and we concluded that creating the issue was the best step forward. I will include some of our conversation here as additional context.

@izaakschroeder: hello! was wondering if i could grab an extra set of eyes on a problem i'm having running `cilium` on EKS + `bottlerocket`. with `ipam.mode=cluster-pool` (_NOT_ using `eni` mode) and `kubeProxyReplacement=strict`. i've adapted the instructions to the best of my ability and am at the point where i can deploy a simple `nginx` pod, `kubectl exec -ti shell-demo -- /bin/bash` and then `curl -k https://172.20.0.1/` (the k8s API server service) and get a 403 back (yay!). however, the existing EKS `coredns` pods seem to fail this exact same query:

```
Failed to list *v1.Namespace: Get https://172.20.0.1:443/api/v1/namespaces?limit=500&resourceVersion=0: dial tcp 172.20.0.1:443: i/o timeout
```

i have checked everything i can possibly think of:

```
> kubectl get cep --all-namespaces -o json | jq -r '.items[].metadata | .namespace + "/" + .name'
default/shell-demo
kube-system/coredns-5cfb6f95db-lv89d
kube-system/coredns-5cfb6f95db-z2z4j
```

Indicates that `core-dns` is indeed being managed by `cilium`. `hubble` shows traffic being sent from the `coredns` pods:

```
> kubectl -n cilium-system exec -ti cilium-fv5nd -- hubble observe --since 3m
Dec 17 20:54:07.983  kube-system/coredns-7f4746c54c-g6zjt:59654  10.232.132.203:443             to-stack                 FORWARDED  TCP Flags: SYN
Dec 17 20:54:07.983  kube-system/coredns-7f4746c54c-g6zjt:34856  10.232.26.69:443              to-stack                 FORWARDED  TCP Flags: SYN
Dec 17 20:54:07.983  kube-system/coredns-7f4746c54c-g6zjt:34858  10.232.26.69:443              to-stack                 FORWARDED  TCP Flags: SYN
```

Just as it is for the `shell-demo` pod:

```
> kubectl -n cilium-system exec -ti cilium-fv5nd -- hubble observe --since 13m --from-pod default/shell-demo
Dec 19 02:19:00.305  default/shell-demo:51174  10.232.132.203:443  to-stack  FORWARDED  TCP Flags: SYN
Dec 19 02:19:00.306  default/shell-demo:51174  10.232.132.203:443  to-stack  FORWARDED  TCP Flags: ACK
Dec 19 02:19:00.307  default/shell-demo:51174  10.232.132.203:443  to-stack  FORWARDED  TCP Flags: ACK, PSH
Dec 19 02:19:00.313  default/shell-demo:51174  10.232.132.203:443  to-stack  FORWARDED  TCP Flags: ACK, FIN
Dec 19 02:19:00.316  default/shell-demo:51174  10.232.132.203:443  to-stack  FORWARDED  TCP Flags: RST
Dec 19 02:19:00.316  default/shell-demo:51174  10.232.132.203:443  to-stack  FORWARDED  TCP Flags: RST
Dec 19 02:24:37.155  default/shell-demo:53632  10.232.26.69:443   to-stack  FORWARDED  TCP Flags: SYN
Dec 19 02:24:37.155  default/shell-demo:53632  10.232.26.69:443   to-stack  FORWARDED  TCP Flags: ACK
```

`cilium`'s service list seems fine:

```
ID  Frontend     Service Type  Backend
1  172.20.0.1:443  ClusterIP   1 => 10.232.132.203:443
                   2 => 10.232.26.69:443
```

and `cilium`'s health otherwise looks good as far as i can tell:

```
KVStore:        Ok  Disabled
Kubernetes:       Ok  1.18+ (v1.18.9-eks-d1db3c) [linux/amd64]
Kubernetes APIs:    ["cilium/v2::CiliumClusterwideNetworkPolicy", "cilium/v2::CiliumEndpoint", "cilium/v2::CiliumNetworkPolicy", "cilium/v2::CiliumNode", "core/v1::Namespace", "core/v1::Node", "core/v1::Pods", "core/v1::Service", "discovery/v1beta1::EndpointSlice", "networking.k8s.io/v1::NetworkPolicy"]
KubeProxyReplacement:  Strict  [eth0 (Direct Routing)]
Cilium:         Ok    OK
NodeMonitor:      Listening for events on 2 CPUs with 64x4096 of shared memory
Cilium health daemon:  Ok
IPAM:          IPv4: 3/4095 allocated from 10.112.32.0/20,
BandwidthManager:    Disabled
Host Routing:      Legacy
Masquerading:      BPF  [eth0]  10.112.32.0/20
Controller Status:   21/21 healthy
Proxy Status:      OK, ip 10.112.37.101, 0 redirects active on ports 10000-20000
Hubble:         Ok       Current/Max Flows: 4096/4096 (100.00%), Flows/s: 2.55  Metrics: Ok
Cluster health:     2/2 reachable  (2020-12-17T21:53:13Z)
```

@aanm: See if disabling srcdstcheck helps https://docs.aws.amazon.com/vpc/latest/userguide/VPC_NAT_Instance.html#EIP_Disable_SrcDestCheck

@izaakschroeder: thanks @aanm! i just tried now by disabling that check on both nodes and then running kubectl -n kube-system rollout restart deployment coredns. it looks like the same error is occurring :disappointed:

the coredns pod also has other entries in its log that may be of interest:

```
[ERROR] plugin/errors: 2 6748038765678202754.5333392404381245149. HINFO: read udp 10.112.39.84:57767->10.232.0.2:53: i/o timeout
[ERROR] plugin/errors: 2 6748038765678202754.5333392404381245149. HINFO: read udp 10.112.39.84:36607->10.232.0.2:53: i/o timeout
[ERROR] plugin/errors: 2 6748038765678202754.5333392404381245149. HINFO: read udp 10.112.39.84:57374->10.232.0.2:53: i/o timeout
[ERROR] plugin/errors: 2 6748038765678202754.5333392404381245149. HINFO: read udp 10.112.39.84:52006->10.232.0.2:53: i/o timeout
[ERROR] plugin/errors: 2 6748038765678202754.5333392404381245149. HINFO: read udp 10.112.39.84:49870->10.232.0.2:53: i/o timeout
[ERROR] plugin/errors: 2 6748038765678202754.5333392404381245149. HINFO: read udp 10.112.39.84:52394->10.232.0.2:53: i/o timeout
[ERROR] plugin/errors: 2 6748038765678202754.5333392404381245149. HINFO: read udp 10.112.39.84:54247->10.232.0.2:53: i/o timeout
[ERROR] plugin/errors: 2 6748038765678202754.5333392404381245149. HINFO: read udp 10.112.39.84:43705->10.232.0.2:53: i/o timeout
```

and these also appear to work fine in the host:

```
nslookup google.ca
Server:         10.232.0.2
Address:        10.232.0.2:53
Non-authoritative answer:
Name:   google.ca
Address: 216.58.193.67
Non-authoritative answer:
Name:   google.ca
Address: 2607:f8b0:400a:803::2003
````

**Comment by mvisonneau** [comment]
I have a similar behaviour after upgrading my base AMI to the latest release of Ubuntu EKS 🤔 

All internal network seems broken, rollbacking to former AMIs seems to sort it out. I will investigate it further tomorrow.

**Comment by izaakschroeder** [comment]
Thanks for looking into this @mvisonneau! 😄

**Comment by mvisonneau** [comment]
I made some further troubleshooting but reverting the kernel version on the newest AMI doesn't sort it out.

On my end I am working in ENI mode with KubeProxyReplacement strict as well. For me the problem is not only scoped to CoreDNS, all pods and all connectivity is affected 🤔

**Comment by mvisonneau** [comment]
Alright so I managed to figure this out! Although they seemed to look alike at first sight, I do not believe my issue was related to this one that @izaakschroeder described. The root cause turned out to be a change of a kernel parameter: `net.ipv4.conf.all.arp_ignore=2`, used to be `net.ipv4.conf.all.arp_ignore=1` resulting into the following:

```
~$ nsenter --net=/var/run/netns/cni-b8b6dc33-1875-e32d-c730-f3da8f2c21f9 tcpdump -i eth0
tcpdump: verbose output suppressed, use -v or -vv for full protocol decode
listening on eth0, link-type EN10MB (Ethernet), capture size 262144 bytes
22:03:48.297180 IP ip-10-16-38-213.eu-west-1.compute.internal.47022 > ip-10-16-96-50.eu-west-1.compute.internal.https: Flags [S], seq 2712694359, win 62727, options [mss 8961,sackOK,TS val 1199655564 ecr 0,nop,wscale 7], length 0
22:03:48.297963 ARP, Request who-has ip-10-16-38-213.eu-west-1.compute.internal tell ip-10-16-41-160.eu-west-1.compute.internal, length 28
22:03:49.327777 IP ip-10-16-38-213.eu-west-1.compute.internal.47022 > ip-10-16-96-50.eu-west-1.compute.internal.https: Flags [S], seq 2712694359, win 62727, options [mss 8961,sackOK,TS val 1199656595 ecr 0,nop,wscale 7], length 0
22:03:49.327888 ARP, Request who-has ip-10-16-38-213.eu-west-1.compute.internal tell ip-10-16-41-160.eu-west-1.compute.internal, length 28
22:03:50.351809 ARP, Request who-has ip-10-16-38-213.eu-west-1.compute.internal tell ip-10-16-41-160.eu-west-1.compute.internal, length 28
22:03:51.343794 IP ip-10-16-38-213.eu-west-1.compute.internal.47022 > ip-10-16-96-50.eu-west-1.compute.internal.https: Flags [S], seq 2712694359, win 62727, options [mss 8961,sackOK,TS val 1199658611 ecr 0,nop,wscale 7], length 0
22:03:53.713681 ARP, Request who-has ip-10-16-38-213.eu-west-1.compute.internal tell ip-10-16-41-160.eu-west-1.compute.internal, length 28
22:03:54.735780 ARP, Request who-has ip-10-16-38-213.eu-west-1.compute.internal tell ip-10-16-41-160.eu-west-1.compute.internal, length 28
22:03:55.471780 IP ip-10-16-38-213.eu-west-1.compute.internal.47022 > ip-10-16-96-50.eu-west-1.compute.internal.https: Flags [S], seq 2712694359, win 62727, options [mss 8961,sackOK,TS val 1199662739 ecr 0,nop,wscale 7], length 0
22:03:55.759789 ARP, Request who-has ip-10-16-38-213.eu-west-1.compute.internal tell ip-10-16-41-160.eu-west-1.compute.internal, length 28
```

**Comment by izaakschroeder** [comment]
@mvisonneau I checked on my end and `arp_ignore` is `0` here so I think you're right – issues not related.

```sh
> kubectl -n cilium-system exec -ti cilium-g7z4t -- cat /proc/sys/net/ipv4/conf/all/arp_ignore
0
```

**Comment by izaakschroeder** [comment]
I talked with @tgraf on Slack in an attempt to investigate further. I ran my exact same setup in ENI mode and everything worked fine. The changes I made to the terraform helm setup is as follows:

```
  set {
    name  = "hostFirewall"
    value = false # used to be true
  }

  set {
    name  = "operator.image.repository"
    # used to be cilium_image_operator_generic
    value = regex("^(.*/operator)", aws_ecr_repository.cilium_image_operator_aws.repository_url)[0]
  }

  set {
    name  = "tunnel"
    value = "disabled"
  }

  set {
    name  = "ipam.mode"
    value = "eni"
  }

  set {
    name  = "eni"
    value = true
  }
```

Everything else remained the same. The logs from `coredns` are now empty:

```
kubectl logs -n kube-system coredns-67b79bfff6-w454v
.:53
[INFO] plugin/reload: Running configuration MD5 = 47d57903c0f0ba4ee0626a17181e5d94
CoreDNS-1.7.0
linux/amd64, go1.13.15, f59c03d0
```

And running `kubectl apply -n cilium-test -f https://raw.githubusercontent.com/cilium/cilium/v1.9/examples/kubernetes/connectivity-check/connectivity-check.yaml` resulted in:

```
echo-a-57cbbd9b8b-jb8lt                                  1/1     Running   0          34s
echo-b-6db5fc8ff8-gstnx                                  1/1     Running   0          34s
echo-b-host-76d89978c-2trk6                              1/1     Running   0          34s
host-to-b-multi-node-clusterip-fd6868749-l4vhp           1/1     Running   0          33s
host-to-b-multi-node-headless-54fbc4659f-zwqjv           1/1     Running   0          33s
pod-to-a-648fd74787-76dl6                                1/1     Running   0          34s
pod-to-a-allowed-cnp-7776c879f-2dbvm                     1/1     Running   0          33s
pod-to-a-denied-cnp-b5ff897c7-p555g                      1/1     Running   0          34s
pod-to-b-intra-node-nodeport-6546644d59-pnmm4            1/1     Running   0          32s
pod-to-b-multi-node-clusterip-7d54c74c5f-frhhw           1/1     Running   0          33s
pod-to-b-multi-node-headless-76db68d547-5q257            1/1     Running   0          33s
pod-to-b-multi-node-nodeport-7496df84d7-cts8d            1/1     Running   0          33s
pod-to-external-1111-6d4f9d9645-hjt2q                    1/1     Running   0          34s
pod-to-external-fqdn-allow-google-cnp-5bc496897c-kpsmf   1/1     Running   0          33s
```

@tgraf concluded:

> Yes, please add this info. Running encap on EKS is pretty rare and it must be something specific to it.

**Comment by izaakschroeder** [comment]
This may be related: https://github.com/bottlerocket-os/bottlerocket/issues/1367 😄

**Comment by priyankachouk** [comment]
Hi all,

I am trying to deploy cilium on my kubeadm k8s cluster, i have created 2 nodes and install cilium on that- my cilium and calico pods are running well but after deploying cilium coredns getting continuosly inti crashloopbackoff state.
Its networking related issue, can anyone please help me out from this problem.
Thanks in advance.

**Comment by dmitry-mightydevops** [comment]
for those who gets this old issue and experience coredns errors like above, this setup worked for me using latest 1.14.1:

```sh
helm upgrade --install cilium cilium/cilium --version 1.14.1 \
--create-namespace --namespace cilium \
--set enableIPv4Masquerade=false \
--set tunnel=disabled \
--set endpointRoutes.enabled=true \
--set encryption.enabled=true \
--set encryption.type=wireguard \
--set encryption.nodeEncryption=true \
--set l7Proxy=false \
--set ipam.mode=eni \
--set eni.enabled=true \
--set externalIPs.enabled=true
```

**Comment by atamgp** [comment]
@dmitry-mightydevops  could you share your full config?

I have same coredns issues and try using cilium with:
- full mode (=eni mode without aws-cni) 
- kubeProxyReplacement=strict 
- bottlerocket

Is the combination of encryption enabled, l7Proxy disabled and externalIPs enabled  needed?

**Comment by dmitry-mightydevops** [comment]
@atamgp

```sh
helm upgrade cilium cilium/cilium --version 1.14.1 \
--create-namespace --namespace cilium \
--set cni.chainingMode=aws-cni \
--set cni.exclusive=false \
--set enableIPv4Masquerade=false \
--set routingMode=native \
--set endpointRoutes.enabled=true \
--set hubble.relay.enabled=true \
--set hubble.ui.enabled=true \
--set endpointStatus.enabled=true \
--set endpointStatus.status=policy
```

I have decided to go with chaining mode as I'm new to Cilium and that is easier to adopt it.
