### ISSUE TITLE
pod visit host network(host has multi network devices)

### ISSUE THREAD

**Issue by llhhbc** [cilium/cilium#18381]
### Is there an existing issue for this?

- [X] I have searched the existing issues

#### host has 4 devices:
12: bond0: <BROADCAST,MULTICAST,MASTER,UP,LOWER_UP> mtu 1500 qdisc noqueue state UP group default qlen 1000
    inet 10.1.102.10/23 brd 10.1.103.255 scope global bond0
13: bond1: <BROADCAST,MULTICAST,MASTER,UP,LOWER_UP> mtu 1500 qdisc noqueue state UP group default qlen 1000
    link/ether b8:ce:f6:04:cd:55 brd ff:ff:ff:ff:ff:ff
    inet 10.1.12.7/23 brd 10.1.13.255 scope global bond1
14: bond2: <BROADCAST,MULTICAST,MASTER,UP,LOWER_UP> mtu 1500 qdisc noqueue state UP group default qlen 1000
    inet 10.3.4.7/21 brd 10.3.7.255 scope global bond2
15: bondmg: <BROADCAST,MULTICAST,MASTER,UP,LOWER_UP> mtu 1500 qdisc noqueue state UP group default qlen 1000
    inet 10.0.1.7/24 brd 10.0.1.255 scope global bondmg

#### I have a listen :
tcp        0      0 0.0.0.0:1521            0.0.0.0:*               LISTEN      47088/tnslsnr 

curl 10.0.1.7:1521 in pod:(timeout)

#### tcpdump on host:(has reply)
tcpdump -i any port 1521 -nnn -vvv
tcpdump: listening on any, link-type LINUX_SLL (Linux cooked), capture size 262144 bytes
    10.244.14.66.50676 > 10.0.1.7.1521: Flags [S], cksum 0x246b (incorrect -> 0x6428), seq 1048903325, win 64860, options [mss 1410,sackOK,TS val 1609652599 ecr 0,nop,wscale 7], length 0
19:45:30.691049 IP (tos 0x0, ttl 64, id 0, offset 0, flags [DF], proto TCP (6), length 60)
    10.0.1.7.1521 > 10.244.14.66.50676: Flags [S.], cksum 0x246b (incorrect -> 0x995e), seq 600603118, ack 1048903326, win 65160, options [mss 1460,sackOK,TS val 1943335926 ecr 1609637196,nop,wscale 7], length 0
19:45:30.691054 IP (tos 0x0, ttl 64, id 0, offset 0, flags [DF], proto TCP (6), length 60)
    10.0.1.7.1521 > 10.244.14.66.50676: Flags [S.], cksum 0x246b (incorrect -> 0x995e), seq 600603118, ack 1048903326, win 65160, options [mss 1460,sackOK,TS val 1943335926 ecr 1609637196,nop,wscale 7], length 0
19:45:47.074953 IP (tos 0x0, ttl 64, id 0, offset 0, flags [DF], proto TCP (6), length 60)
    10.0.1.7.1521 > 10.244.14.66.50676: Flags [S.], cksum 0x246b (incorrect -> 0x595e), seq 600603118, ack 1048903326, win 65160, options [mss 1460,sackOK,TS val 1943352310 ecr 1609637196,nop,wscale 7], length 0
19:45:47.074968 IP (tos 0x0, ttl 64, id 0, offset 0, flags [DF], proto TCP (6), length 60)
    10.0.1.7.1521 > 10.244.14.66.50676: Flags [S.], cksum 0x246b (incorrect -> 0x595e), seq 600603118, ack 1048903326, win 65160, options [mss 1460,sackOK,TS val 1943352310 ecr 1609637196,nop,wscale 7], length 0

### Cilium Version

cilium version
Client: 1.10.4 2a46fd6 2021-09-01T12:58:41-07:00 go version go1.16.7 linux/amd64
Daemon: 1.10.4 2a46fd6 2021-09-01T12:58:41-07:00 go version go1.16.7 linux/amd64

### Kernel Version

uname -a
Linux ds-rds-master-1 4.19.113-300.el7.x86_64 #1 SMP Mon Mar 30 21:50:38 UTC 2020 x86_64 x86_64 x86_64 GNU/Linux

### Kubernetes Version

 kubectl version
Client Version: version.Info{Major:"1", Minor:"20", GitVersion:"v1.20.14", GitCommit:"57a3aa3f13699cf3db9c52d228c18db94fa81876", GitTreeState:"clean", BuildDate:"2021-12-15T14:52:33Z", GoVersion:"go1.15.15", Compiler:"gc", Platform:"linux/amd64"}
Server Version: version.Info{Major:"1", Minor:"20", GitVersion:"v1.20.14", GitCommit:"57a3aa3f13699cf3db9c52d228c18db94fa81876", GitTreeState:"clean", BuildDate:"2021-12-15T14:47:10Z", GoVersion:"go1.15.15", Compiler:"gc", Platform:"linux/amd64"}

### Code of Conduct

- [X] I agree to follow this project's Code of Conduct

**Comment by aanm** [comment]
Hello, thanks for opening the GH issue, please provide steps to reproduce the issue and a cilium sysdump otherwise the issue can't be fixed. Thank you.
