### ISSUE TITLE
Should we remove VLAN priority tags (vlan=0) from packets before processing in Cilium

### ISSUE THREAD

**Issue by kvaps** [cilium/cilium#41371]
Crossposted to https://github.com/kubeovn/kube-ovn/issues/5650

### Cilium Version

v1.17.5

### Kubernetes Version

v1.33.2

### Operation-system/Kernel Version

```
Talos (v1.10.5)   6.12.35-talos
```

### Description

Hey, we run cilium and kube-ovn in chaining mode. Cilium running in kube-proxy-replacement mode.

We have issue with `externalTrafficPolicy=Cluster` when traffic comes to one node and should be routed to pod running on another node.

### Steps To Reproduce

- Take two nodes: `node1` and `node2`
- Setup `kube-ovn` and `cilium`
- Run nginx pod on `node1`
- Create service and specify in `.spec.externalIPs` the public IP of `node2`
- Send packets to node2 public IP

### Current Behavior

`tcpdump -i any port 80` on input node shows that packet is coming on `enp98s0` then it DNAT'ed by cilium to pod IP and sent to `ovn0`:

```
10:23:42.858125 enp98s0 In  IP 5.6.7.8.60421 > 1.2.3.4.80: Flags [S], seq 135515977, win 65535, options [mss 1460,nop,wscale 6,nop,nop,TS val 1518876366 ecr 0,sackOK,eol], length 0
10:23:42.858145 ovn0  Out IP 1.2.3.4.60421 > 10.244.0.111.80: Flags [S], seq 135515977, win 65535, options [mss 1460,nop,wscale 6,nop,nop,TS val 1518876366 ecr 0,sackOK,eol], length 0
10
```

I expected that packet will be processed by OVN, but it seems they just get dropped underlying CNI, because still have VLAN assigned.

If I run `tcpdump -ee` I can see that packets have `vlan=0` assigned:

```
14:25:10.538214 66:0d:e7:b9:60:a0 > 82:c8:ba:03:93:b9, ethertype 802.1Q (0x8100), length 82: vlan 0, p 0, ethertype IPv4 (0x0800), 1.2.3.4.49184 > 10.244.0.12.80: Flags [S], seq 3623648735, win 65535, options [mss 1460,nop,wscale 6,nop,nop,TS val 1443654524 ecr 0,sackOK,eol], length 0
```

Cilium process them as-is, and send with `vlan=0` tags

### Expected Behavior

I expect that Cilium will remove `vlan=0` and send packets without assigned tag (eg `vlan=1`)

It seems Cisco have feature which can't be reconfigured. There is a bug reported on Cisco bug tracker that some routers might send packets with `vlan=0`, not `vlan=1`:

- https://community.cisco.com/t5/unified-computing-system-discussions/cisco-ucs-nexus-802-1p-tagging-vlan0-on-traffic-between-blades/m-p/3756287#M28394
- https://bst.cloudapps.cisco.com/bugsearch/bug/CSCuu29425

And workaround for linux bridge `net.bridge.bridge-nf-filter-vlan-tagged = 1` which is not working for Cilium and OVN.

**Comment by joestringer** [comment]
Is it possible to avoid generating packets with this VLAN tag in the first place?

Is there some reference to 802.1q we could use as obvious justification why stripping these tags is the right thing for a forwarding element to do? I understand that for your use case this could be useful, but equally so I could imagine another user being surprised that sending packets into Cilium with this VLAN would cause the 802.1q header to be stripped. That seems to be a completely valid header to have and could be used for 802.1p. So my gut feeling is that just stripping the tags is not the right behavior.

**Comment by kvaps** [comment]
From my understanding, these VLAN tags apply to L2 frames rather than L3 packets. They don’t make much sense for in-cluster communication because L2 frames are typically encapsulated or replaced by the underlying CNI.

Looking at this from an RFC standpoint:
- If we treat Cilium as an L3 router, packets should be routed via another interface. VLAN tags like vlan0 should be omitted because the packet is entering a new L2 segment.
- If we treat Cilium as an L2 switch, frames should be forwarded between ports within the same L2 segment, so it would make sense to preserve the vlan0 tag.

In fact at this stage, Cilium performs NAT and routing lookup and routes packets into a different L3 segments (eg. pod CIDR). This behavior aligns more with that of an L3 router. In typical L3 routing, packets are encapsulated in new L2 frames when leaving a router interface, and those frames are constructed according to the destination segment’s rules.

Although Cilium’s behavior isn’t exactly the same as a traditional router, it seems correct to drop vlan0 tags here, as Cilium is primarily operating at the L3 layer.

**Comment by joestringer** [comment]
I think the awkward thing is that Cilium can be configured in both an L3-style mode and in an L2 passthrough style mode, so I'm not sure we can just pick one behavior and implement that one.

**Comment by kvaps** [comment]
Workaround: deploy application on all nodes, and use externalTrafficPolicy=Local for exposing service
