### ISSUE TITLE
[Bug] NodeEncryption (WireGuard) — decrypted host traffic lost in VXLAN mode

### ISSUE THREAD

**Issue by poehlerflorian** [cilium/cilium#46062]
### Is there an existing issue for this?

- [x] I have searched the existing issues

### Version

equal or higher than v1.19.3 and lower than v1.20.0

### What happened?

With `encryption.nodeEncryption=true` and `tunnel: vxlan`, host-level connectivity between worker nodes fails silently. Pod-to-pod traffic is unaffected.
 
**Expected:** Node-to-node ICMP and TCP between workers succeeds (packets delivered to host stack).  
**Actual:** Requests time out. No eBPF drop events are emitted.
 
`cilium-health status` on a worker node:
```
worker1.internal.test:
  Host connectivity to 192.168.100.12:
    ICMP to stack:   Connection timed out
    HTTP to agent:   context deadline exceeded
  Endpoint connectivity to 10.42.3.138:
    ICMP to stack:   OK, RTT=587µs
    HTTP to agent:   OK, RTT=1.15ms
```
 
`tcpdump -i any icmp` on the **receiving** worker while being pinged by another worker:
```
cilium_wg0 In   IP 192.168.100.12 > 192.168.100.13: ICMP echo request
cilium_net Out  IP 192.168.100.12 > 192.168.100.13: ICMP echo request
```
No reply is ever generated. The packet arrives decrypted on `cilium_wg0`, is redirected by the eBPF TC ingress program to `cilium_net`, crosses the veth into `cilium_host`, and is silently consumed. It never reaches the host network stack.
 
**Confirmed non-issues:**
- WireGuard peering is healthy — UDP/51871 flows between all workers
- `allowed-ips` includes node IPs — confirmed by packet appearing on `cilium_wg0 In`
- `CiliumNode` objects are correct — all nodes have valid `InternalIP` and `CiliumInternalIP`
- No eBPF drops — `cilium monitor --type drop` emits nothing during the test
**Root cause hypothesis:** The eBPF TC ingress program on `cilium_wg0` redirects all decrypted traffic to `cilium_net` uniformly. The eBPF program on `cilium_host` ingress handles VXLAN-encapsulated pod traffic correctly, but has no code path for plain host IP packets (dst = node IP, not a pod CIDR). The packet is silently dropped without a drop event.
 
**Note:** Control-plane nodes correctly show `NodeEncryption: OptedOut` per the `node-encryption-opt-out-labels` default. The bug only manifests between worker nodes.
 
**Workaround:** Setting `encryption.nodeEncryption=false` restores connectivity. Pod-to-pod traffic remains encrypted via WireGuard over VXLAN.

### How can we reproduce the issue?

1. Install Cilium with the following Helm flags:
   ```
   helm install cilium cilium/cilium \
     --set encryption.enabled=true \
     --set encryption.type=wireguard \
     --set encryption.nodeEncryption=true \
     --set tunnel=vxlan
   ```
2. Cluster must have at least 2 worker (non-control-plane) nodes.
3. Ping between two workers at their node IPs:
   ```
   ping 192.168.100.12   # from another worker
   ```
4. Observe timeout.
5. On the destination worker, run `tcpdump -i any icmp` during the ping — observe `cilium_wg0 In → cilium_net Out` with no reply.

### Cilium Version

```
Client: 1.19.3 f5eb641b 2026-04-14T12:00:16+00:00 go version go1.25.9 linux/amd64
Daemon: 1.19.3 f5eb641b 2026-04-14T12:00:16+00:00 go version go1.25.9 linux/amd64
```

### Kernel Version

```
Linux worker1.internal.test 5.14.0-611.5.1.el9_7.x86_64 #1 SMP PREEMPT_DYNAMIC Tue Nov 11 08:09:09 EST 2025 x86_64 x86_64 x86_64 GNU/Linux
```

### Kubernetes Version

```
Server Version: v1.36.0+rke2r1
```

### Regression

Unknown — `nodeEncryption` was enabled from initial cluster setup. Not tested on earlier Cilium versions.

### Sysdump

Not `cilium sysdump` but `cilium-health get` sinc I get `cilium-dbg sysdump cannot perform this action, you need a different tool.` from the cilium pod
```
root@worker2:/home/cilium# cilium-health get
Daemon uptime:           46.560732898s
Node load:               4.35 1.34 0.47
KVStore:                 Disabled   
Kubernetes:              Ok         1.36 (v1.36.0+rke2r1) [linux/amd64]
Kubernetes APIs:         ["cilium/v2::CiliumCIDRGroup", "cilium/v2::CiliumClusterwideEnvoyConfig", "cilium/v2::CiliumClusterwideNetworkPolicy", "cilium/v2::CiliumEndpoint", "cilium/v2::CiliumEnvoyConfig", "cilium/v2::CiliumNetworkPolicy", "cilium/v2::CiliumNode", "core/v1::Pods", "networking.k8s.io/v1::NetworkPolicy"]
KubeProxyReplacement:    True   [eth0  192.168.100.13 (Direct Routing)]
Host firewall:           Disabled
SRv6:                    Disabled
CNI Chaining:            none
CNI Config file:         successfully wrote CNI configuration file to /host/etc/cni/net.d/05-cilium.conflist
Cilium:                  Ok   1.19.3 (v1.19.3-f5eb641b)
NodeMonitor:             Listening for events on 60 CPUs with 64x4096 of shared memory
Cilium health daemon:    Ok   
IPAM:                    IPv4: 37/254 allocated from 10.42.4.0/24, 
IPv4 BIG TCP:            Disabled
IPv6 BIG TCP:            Disabled
BandwidthManager:        Disabled
Routing:                 Network: Tunnel [vxlan]   Host: BPF
Attach Mode:             TCX
Device Mode:             veth
Masquerading:            BPF   [eth0]   10.0.0.0/8  [IPv4: Enabled, IPv6: Disabled]
Controller Status:       67/67 healthy
Proxy Status:            OK, ip 10.42.4.83, 0 redirects active on ports 10000-20000, Envoy: external
Global Identity Range:   min 256, max 65535
Hubble:                  Ok          Current/Max Flows: 4095/4095 (100.00%), Flows/s: 100.84   Metrics: Ok
Encryption:              Wireguard   [NodeEncryption: Enabled, cilium_wg0 (Pubkey: <redacted>, Port: 51871, Peers: 5)]
```

### Relevant log output

```shell
No relevant log output — the failure is silent (no drops, no errors in cilium-agent logs).
```

### Anything else?

Appears to be a long-standing known limitation first reported in #13663 (v1.9.0),
where a maintainer confirmed NodeEncryption was not implemented for tunnel (VXLAN/Geneve)
mode. The documentation warning about this was present at the time but has since been
removed. The current docs mark NodeEncryption as "beta" but no longer state that VXLAN
mode is unsupported.

#33159 is probably unrelated (transient race condition during peer updates).

**Bug Report created with Claude but proof-read and corrected by me.**

### Cilium Users Document

- [ ] Are you a user of Cilium? Please add yourself to the [Users doc](https://github.com/cilium/cilium/blob/main/USERS.md)

### Code of Conduct

- [x] I agree to follow this project's Code of Conduct

**Comment by ssam18** [comment]
Thanks for the clear writeup. Could you attach a `cilium sysdump` plus the following from one of the affected worker nodes while the ping is timing out

- `ip route show table all`
- `iptables-save -c`
- `sysctl net.ipv4.conf.cilium_host.rp_filter net.ipv4.conf.cilium_net.rp_filter net.ipv4.conf.all.rp_filter`
- Output of `bpftool net show` so we can confirm which programs are attached to `cilium_wg0`, `cilium_host`, and `cilium_net`

The hypothesis about a missing eBPF branch on cilium_host ingress is plausible but the code path for plain host IP packets does exist in `cil_to_host` (it returns `CTX_ACT_OK` when host firewall is off, which should send the packet to the stack). The fact that you see the packet at `cilium_net Out` rather than `cilium_host In` after the redirect suggests the drop might be at the routing or rp_filter layer rather than in BPF, and the data above should help pin that down.

**Comment by poehlerflorian** [comment]
Thanks for the quick response.

I'll see if I can get the cilium-cli installed for `cilium sysdump`. Could take a few days.

In the meantime, here are the other outputs:

`ip route show table all`

<details>

```terminaloutput
[root@worker2 ~]$ ip route show table all
local default dev lo table 2004 proto kernel scope host 
default via 192.168.1.1 dev eth0 proto static metric 100 
10.42.0.0/24 via 10.42.5.171 dev cilium_host proto kernel src 10.42.5.171 mtu 1370 
10.42.1.0/24 via 10.42.5.171 dev cilium_host proto kernel src 10.42.5.171 mtu 1370 
10.42.3.0/24 via 10.42.5.171 dev cilium_host proto kernel src 10.42.5.171 mtu 1370 
10.42.4.0/24 via 10.42.5.171 dev cilium_host proto kernel src 10.42.5.171 mtu 1370 
10.42.5.0/24 via 10.42.5.171 dev cilium_host proto kernel src 10.42.5.171 
10.42.5.171 dev cilium_host proto kernel scope link 
10.42.6.0/24 via 10.42.5.171 dev cilium_host proto kernel src 10.42.5.171 mtu 1370 
192.168.1.1 dev eth0 proto static scope link metric 100 
local 10.42.5.171 dev cilium_host table local proto kernel scope host src 10.42.5.171 
local 127.0.0.0/8 dev lo table local proto kernel scope host src 127.0.0.1 
local 127.0.0.1 dev lo table local proto kernel scope host src 127.0.0.1 
broadcast 127.255.255.255 dev lo table local proto kernel scope link src 127.0.0.1 
local 192.168.100.13 dev eth0 table local proto kernel scope host src 192.168.100.13 
```

</details>

`iptables-save -c`

<details>

_I removed/redacted a few rules that are not relevant and/or contained company-related information. Should not
affect anything cilium-related, however._

```terminaloutput
[root@worker2 ~]$ iptables-save -c
# Generated by iptables-save v1.8.10 (nf_tables) on Thu May 21 08:13:25 2026
*mangle
:PREROUTING ACCEPT [0:0]
:INPUT ACCEPT [0:0]
:FORWARD ACCEPT [0:0]
:OUTPUT ACCEPT [0:0]
:POSTROUTING ACCEPT [0:0]
:CILIUM_POST_mangle - [0:0]
:CILIUM_PRE_mangle - [0:0]
:KUBE-IPTABLES-HINT - [0:0]
:KUBE-KUBELET-CANARY - [0:0]
[12648:3108496] -A PREROUTING -m comment --comment "cilium-feeder: CILIUM_PRE_mangle" -j CILIUM_PRE_mangle
[12193:2014882] -A POSTROUTING -m comment --comment "cilium-feeder: CILIUM_POST_mangle" -j CILIUM_POST_mangle
[0:0] -A CILIUM_PRE_mangle ! -o lo -m socket --transparent -m mark ! --mark 0xe00/0xf00 -m mark ! --mark 0x800/0xf00 -m comment --comment "cilium: any->pod redirect proxied traffic to host proxy" -j MARK --set-xmark 0x200/0xffffffff
COMMIT
# Completed on Thu May 21 08:13:25 2026
# Generated by iptables-save v1.8.10 (nf_tables) on Thu May 21 08:13:25 2026
*raw
:PREROUTING ACCEPT [0:0]
:OUTPUT ACCEPT [0:0]
:CILIUM_OUTPUT_raw - [0:0]
:CILIUM_PRE_raw - [0:0]
[12648:3108496] -A PREROUTING -m comment --comment "cilium-feeder: CILIUM_PRE_raw" -j CILIUM_PRE_raw
[12581:2045614] -A OUTPUT -m comment --comment "cilium-feeder: CILIUM_OUTPUT_raw" -j CILIUM_OUTPUT_raw
[1518:471964] -A CILIUM_OUTPUT_raw -m mark --mark 0xe00/0xf00 -m comment --comment "cilium-encryption-notrack:" -j CT --notrack
[0:0] -A CILIUM_OUTPUT_raw -m mark --mark 0xd00/0xf00 -m comment --comment "cilium-encryption-notrack:" -j CT --notrack
[1381:360130] -A CILIUM_OUTPUT_raw -p udp -m udp --dport 8472 -m comment --comment "cilium: NOTRACK for tunnel traffic" -j CT --notrack
[0:0] -A CILIUM_OUTPUT_raw -o cilium_host -m mark --mark 0xa00/0xfffffeff -m comment --comment "cilium: NOTRACK for proxy return traffic" -j CT --notrack
[0:0] -A CILIUM_OUTPUT_raw -o cilium_host -m mark --mark 0x800/0xe00 -m comment --comment "cilium: NOTRACK for L7 proxy upstream traffic" -j CT --notrack
[0:0] -A CILIUM_PRE_raw -m mark --mark 0xe00/0xf00 -m comment --comment "cilium-encryption-notrack:" -j CT --notrack
[4000:1886618] -A CILIUM_PRE_raw -m mark --mark 0xd00/0xf00 -m comment --comment "cilium-encryption-notrack:" -j CT --notrack
[1640:846214] -A CILIUM_PRE_raw -p udp -m udp --dport 8472 -m comment --comment "cilium: NOTRACK for tunnel traffic" -j CT --notrack
[0:0] -A CILIUM_PRE_raw -m mark --mark 0x200/0xf00 -m comment --comment "cilium: NOTRACK for proxy traffic" -j CT --notrack
COMMIT
# Completed on Thu May 21 08:13:25 2026
# Generated by iptables-save v1.8.10 (nf_tables) on Thu May 21 08:13:25 2026
*filter
:INPUT DROP [79:12950]
:FORWARD DROP [4:216]
:OUTPUT DROP [11905:760972]
:CILIUM_FORWARD - [0:0]
:CILIUM_INPUT - [0:0]
:CILIUM_OUTPUT - [0:0]
:KUBE-FIREWALL - [0:0]
:KUBE-KUBELET-CANARY - [0:0]
[12653:3108798] -A INPUT -m comment --comment "cilium-feeder: CILIUM_INPUT" -j CILIUM_INPUT
[3890410:1849408941] -A INPUT -j KUBE-FIREWALL
[3574783:1830271547] -A INPUT -m state --state RELATED,ESTABLISHED -j ACCEPT
[6049:314580] -A INPUT -p icmp -m state --state NEW -m comment --comment "inbound icmp requests" -j ACCEPT
[66974:4018440] -A INPUT -i lo -m state --state NEW -m comment --comment "accept loopback" -j ACCEPT
[0:0] -A INPUT -s 192.168.100.8/29 -i eth0 -p tcp -m tcp --dport 9345 -m state --state NEW -m comment --comment "RKE2 agent registration (cluster internal)" -j ACCEPT
[0:0] -A INPUT -s 192.168.100.8/29 -i eth0 -p tcp -m tcp --dport 6443 -m state --state NEW -m comment --comment "Kubernetes API (cluster internal)" -j ACCEPT
[0:0] -A INPUT -s 192.168.100.8/29 -i eth0 -p tcp -m tcp --dport 2379:2381 -m state --state NEW -m comment --comment "Etcd peer communication (cluster internal)" -j ACCEPT
[4107:246420] -A INPUT -s 192.168.100.8/29 -i eth0 -p tcp -m tcp -m multiport --dports 4240,4250 -m state --state NEW -m comment --comment "Cilium CNI peer communication (cluster internal)" -j ACCEPT
[6:824] -A INPUT -s 192.168.100.8/29 -i eth0 -p udp -m udp --dport 51871 -m state --state NEW -m comment --comment "Cilium CNI wireguard listen port (cluster internal)" -j ACCEPT
[0:0] -A INPUT -s 192.168.100.8/29 -i eth0 -p udp -m udp --dport 8472 -m state --state NEW -m comment --comment "Cilium CNI VXLAN listen port (cluster internal)" -j ACCEPT
[0:0] -A INPUT -s 192.168.100.8/29 -i eth0 -p tcp -m tcp --dport 5001 -m state --state NEW -m comment --comment "Embedded registry mirror (Spegel) (cluster internal)" -j ACCEPT
[0:0] -A INPUT -s 10.42.0.0/16 -i eth0 -m state --state NEW -m comment --comment "Kubernetes pod-to-node communication" -j ACCEPT
[10:544] -A INPUT -i lxc+ -m state --state NEW -m comment --comment "allow inbound" -j ACCEPT
[46:7090] -A INPUT -s 10.42.0.0/16 -i cilium_+ -m state --state NEW -m comment --comment "allow inbound" -j ACCEPT
[1396:834935] -A INPUT -s 192.168.100.8/29 -i cilium_+ -m state --state NEW -m comment --comment "allow inbound" -j ACCEPT
[0:0] -A FORWARD -m comment --comment "cilium-feeder: CILIUM_FORWARD" -j CILIUM_FORWARD
[0:0] -A FORWARD -m state --state RELATED,ESTABLISHED -j ACCEPT
[12581:2045614] -A OUTPUT -m comment --comment "cilium-feeder: CILIUM_OUTPUT" -j CILIUM_OUTPUT
[4166952:607383967] -A OUTPUT -j KUBE-FIREWALL
[3960013:595002168] -A OUTPUT -m state --state RELATED,ESTABLISHED -j ACCEPT
[12531:651612] -A OUTPUT -p icmp -m state --state NEW -m comment --comment "outbound icmp requests" -j ACCEPT
[0:0] -A OUTPUT -p udp -m udp --dport 33434:33463 -m state --state NEW -m comment --comment "outbound traceroute requests" -j REJECT --reject-with icmp-host-unreachable
[66971:4018260] -A OUTPUT -o lo -m state --state NEW -m comment --comment "accept loopback" -j ACCEPT
[6231:572801] -A OUTPUT -d 192.168.100.8/29 -o eth0 -m state --state NEW -m comment --comment "allow outbound" -j ACCEPT
[13:780] -A OUTPUT -d 192.168.1.1/32 -o eth0 -p tcp -m tcp --dport 179 -m state --state NEW -m comment --comment "allow bgp communication with vm host" -j ACCEPT
[0:0] -A OUTPUT -o lxc+ -m state --state NEW -m comment --comment "allow outbound" -j ACCEPT
[104911:6294660] -A OUTPUT -d 10.42.0.0/16 -o cilium_+ -m state --state NEW -m comment --comment "allow outbound" -j ACCEPT
[0:0] -A OUTPUT -d 192.168.100.8/29 -o cilium_+ -m state --state NEW -m comment --comment "allow outbound" -j ACCEPT
[0:0] -A CILIUM_FORWARD -m mark --mark 0xe00/0xf00 -m comment --comment "exclude encrypt/decrypt marks from filter CILIUM_FORWARD chain" -j ACCEPT
[0:0] -A CILIUM_FORWARD -m mark --mark 0xd00/0xf00 -m comment --comment "exclude encrypt/decrypt marks from filter CILIUM_FORWARD chain" -j ACCEPT
[0:0] -A CILIUM_FORWARD -o cilium_host -m comment --comment "cilium: any->cluster on cilium_host forward accept" -j ACCEPT
[0:0] -A CILIUM_FORWARD -i cilium_host -m comment --comment "cilium: cluster->any on cilium_host forward accept (nodeport)" -j ACCEPT
[0:0] -A CILIUM_FORWARD -i lxc+ -m comment --comment "cilium: cluster->any on lxc+ forward accept" -j ACCEPT
[0:0] -A CILIUM_FORWARD -i cilium_net -m comment --comment "cilium: cluster->any on cilium_net forward accept (nodeport)" -j ACCEPT
[0:0] -A CILIUM_INPUT -m mark --mark 0x200/0xf00 -m comment --comment "cilium: ACCEPT for proxy traffic" -j ACCEPT
[0:0] -A CILIUM_INPUT -m mark --mark 0xe00/0xf00 -m comment --comment "exclude encrypt/decrypt marks from filter CILIUM_INPUT chain" -j ACCEPT
[4000:1886618] -A CILIUM_INPUT -m mark --mark 0xd00/0xf00 -m comment --comment "exclude encrypt/decrypt marks from filter CILIUM_INPUT chain" -j ACCEPT
[1381:360130] -A CILIUM_OUTPUT -p udp -m udp --dport 8472 -m comment --comment "cilium: ACCEPT for tunnel traffic" -j ACCEPT
[0:0] -A CILIUM_OUTPUT -m mark --mark 0xa00/0xe00 -m comment --comment "cilium: ACCEPT for proxy traffic" -j ACCEPT
[0:0] -A CILIUM_OUTPUT -m mark --mark 0x800/0xe00 -m comment --comment "cilium: ACCEPT for l7 proxy upstream traffic" -j ACCEPT
[1518:471964] -A CILIUM_OUTPUT -m mark --mark 0xe00/0xf00 -m comment --comment "exclude encrypt/decrypt marks from filter CILIUM_OUTPUT chain" -j ACCEPT
[0:0] -A CILIUM_OUTPUT -m mark --mark 0xd00/0xf00 -m comment --comment "exclude encrypt/decrypt marks from filter CILIUM_OUTPUT chain" -j ACCEPT
[9682:1213520] -A CILIUM_OUTPUT -m mark ! --mark 0xd00/0xf00 -m mark ! --mark 0xe00/0xf00 -m mark ! --mark 0x400/0xf00 -m mark ! --mark 0xa00/0xe00 -m mark ! --mark 0x800/0xe00 -m comment --comment "cilium: host->any mark as from host" -j MARK --set-xmark 0xc00/0xf00
[0:0] -A KUBE-FIREWALL ! -s 127.0.0.0/8 -d 127.0.0.0/8 -m comment --comment "block incoming localnet connections" -m conntrack ! --ctstate RELATED,ESTABLISHED,DNAT -j DROP
COMMIT
# Completed on Thu May 21 08:13:25 2026
# Generated by iptables-save v1.8.10 (nf_tables) on Thu May 21 08:13:25 2026
*nat
:PREROUTING ACCEPT [0:0]
:INPUT ACCEPT [0:0]
:OUTPUT ACCEPT [0:0]
:POSTROUTING ACCEPT [0:0]
:CILIUM_OUTPUT_nat - [0:0]
:CILIUM_POST_nat - [0:0]
:CILIUM_PRE_nat - [0:0]
:KUBE-KUBELET-CANARY - [0:0]
[629:37692] -A PREROUTING -m comment --comment "cilium-feeder: CILIUM_PRE_nat" -j CILIUM_PRE_nat
[524:31344] -A OUTPUT -m comment --comment "cilium-feeder: CILIUM_OUTPUT_nat" -j CILIUM_OUTPUT_nat
[505:30204] -A POSTROUTING -m comment --comment "cilium-feeder: CILIUM_POST_nat" -j CILIUM_POST_nat
[0:0] -A CILIUM_OUTPUT_nat -m mark --mark 0xe00/0xf00 -m comment --comment "exclude encrypt/decrypt marks from nat CILIUM_OUTPUT_nat chain" -j ACCEPT
[0:0] -A CILIUM_OUTPUT_nat -m mark --mark 0xd00/0xf00 -m comment --comment "exclude encrypt/decrypt marks from nat CILIUM_OUTPUT_nat chain" -j ACCEPT
[0:0] -A CILIUM_POST_nat -m mark --mark 0xe00/0xf00 -m comment --comment "exclude encrypt/decrypt marks from nat CILIUM_POST_nat chain" -j ACCEPT
[0:0] -A CILIUM_POST_nat -m mark --mark 0xd00/0xf00 -m comment --comment "exclude encrypt/decrypt marks from nat CILIUM_POST_nat chain" -j ACCEPT
[0:0] -A CILIUM_PRE_nat -m mark --mark 0xe00/0xf00 -m comment --comment "exclude encrypt/decrypt marks from nat CILIUM_PRE_nat chain" -j ACCEPT
[0:0] -A CILIUM_PRE_nat -m mark --mark 0xd00/0xf00 -m comment --comment "exclude encrypt/decrypt marks from nat CILIUM_PRE_nat chain" -j ACCEPT
COMMIT
# Completed on Thu May 21 08:13:25 2026
# Warning: iptables-legacy tables present, use iptables-legacy-save to see them

```

</details>

`sysctl net.ipv4.conf.cilium_host.rp_filter net.ipv4.conf.cilium_net.rp_filter net.ipv4.conf.all.rp_filter`

<details>

```terminaloutput
[root@worker2 ~]$ sysctl net.ipv4.conf.cilium_host.rp_filter net.ipv4.conf.cilium_net.rp_filter net.ipv4.conf.all.rp_filter
net.ipv4.conf.cilium_host.rp_filter = 0
net.ipv4.conf.cilium_net.rp_filter = 0
net.ipv4.conf.all.rp_filter = 0
```

</details>

`bpftool net show`

<details>

```terminaloutput
root@worker2:/home/cilium# bpftool net show
xdp:
eth0(2) driver id 257477

tc:
eth0(2) tcx/ingress cil_from_netdev prog_id 257603 link_id 19 
eth0(2) tcx/egress cil_to_netdev prog_id 257605 link_id 20 
cilium_net(11) tcx/ingress cil_to_host prog_id 257592 link_id 29 
cilium_host(12) tcx/ingress cil_to_host prog_id 257580 link_id 27 
cilium_host(12) tcx/egress cil_from_host prog_id 257577 link_id 28 
cilium_wg0(13) tcx/ingress cil_from_wireguard prog_id 257480 link_id 26 
cilium_vxlan(14) tcx/ingress cil_from_overlay prog_id 257489 link_id 24 
cilium_vxlan(14) tcx/egress cil_to_overlay prog_id 257488 link_id 25 
lxcda3103d2216c(144) tcx/ingress cil_from_container prog_id 257536 link_id 359 
lxcc05a5e1ff28f(148) tcx/ingress cil_from_container prog_id 257516 link_id 361 
lxce949116514f8(152) tcx/ingress cil_from_container prog_id 257511 link_id 363 
lxc0c2c29aa35f8(154) tcx/ingress cil_from_container prog_id 257561 link_id 365 
lxcf8c912e51b2e(158) tcx/ingress cil_from_container prog_id 257530 link_id 396 
lxc_health(160) tcx/ingress cil_from_container prog_id 257569 link_id 398 

flow_dissector:

netfilter:
```

</details>

Let me know if I can provide more information.

**Comment by bersoare** [comment]
could this be related to https://github.com/cilium/cilium/pull/45974?

**Comment by poehlerflorian** [comment]
I now noticed that when restarting `iptables.service` on the **destination** node, pings are successful until I restart the cilium pod on that node. After recreating the cilium pod ping is unsuccessful again.

```
# Source node (worker2.internal.test)
11:13:40.589477 cilium_wg0 Out IP worker2.internal.test > worker3.internal.test: ICMP echo request, id 16, seq 1, length 64
11:13:40.589763 cilium_wg0 In  IP worker3.internal.test > worker2.internal.test: ICMP echo reply, id 16, seq 1, length 64
11:13:40.589765 cilium_net Out IP worker3.internal.test > worker2.internal.test: ICMP echo reply, id 16, seq 1, length 64
11:13:40.589766 cilium_host In  IP worker3.internal.test > worker2.internal.test: ICMP echo reply, id 16, seq 1, length 64

# Dest node (worker3.internal.test)

11:13:40.589636 cilium_wg0 In  IP worker2.internal.test > worker3.internal.test: ICMP echo request, id 16, seq 1, length 64
11:13:40.589641 cilium_net Out IP worker2.internal.test > worker3.internal.test: ICMP echo request, id 16, seq 1, length 64
11:13:40.589643 cilium_host In  IP worker2.internal.test > worker3.internal.test: ICMP echo request, id 16, seq 1, length 64
11:13:40.589661 cilium_wg0 Out IP worker3.internal.test > worker2.internal.test: ICMP echo reply, id 16, seq 1, length 64
```

Not sure if my understanding is correct, but somewhere between `cilium_net Out` and `cilium_host In` the package gets dropped, right? Because when ping is unsuccessful, `cilium_wg0 In` and `cilium_net Out` also appear in the tcpdump log but `cilium_host In` and `cilium_wg0 Out` do not.

**Comment by ssam18** [comment]
@poehlerflorian Your reading is corrct but it is worth being precise about what the tcpdump output proves. `cilium_net` and `cilium_host` are the two ends of a veth pair, so a packet that shows `Out cilium_net` should normally show `In cilium_host` on the same node within the same nanosecond. When the second event is missing in the failure case, there are two plausible causes.

1. The packet is dropped by an eBPF program attached to `cilium_host` ingress before tcpdump's RX hook sees it. TC ingress runs inside `__netif_receive_skb_core` before AF_PACKET delivery, so a TC ingress drop is invisible to tcpdump.
2. The packet never actually leaves `cilium_net` because it was redirected elsewhere by a tc egress program (for example via `bpf_redirect` to the tunnel device, or dropped with `TC_ACT_SHOT`), in which case the `Out cilium_net` event you do see is the BPF program running rather than the packet hitting the wire.

The cleanest way to tell which is happening is `cilium-dbg monitor -v` on the destination node during a failing ping. That will print Cilium's drop reasons and verdicts directly and skip the tcpdump ambiguity. While the failing ping is running, also worth grabbing `tc filter show dev cilium_host ingress` and `tc filter show dev cilium_net egress` so we can see exactly which programs are attached.

The `iptables.service` correlation you noticed is still the strongest lead since the symptom flips with the cilium pod restart. A diff of `iptables-save -c` before and after the pod restart should highlight the offending rule, and the counters in `-c` mode tell us which rule is matching the dropped ICMP.

**Comment by poehlerflorian** [comment]
When running `cilium-dbg monitor -v` I see nothing useful as far as I can tell. The source ip address does not show in the logs (neither node ip nor cilium host ip).

`tc filter show dev cilium_host ingress` and `tc filter show dev cilium_net egress` have no output, neither from the host nor inside the cilium pod.

**iptables rules diff**

Restarting iptables removes a bunch of rules so the offending rule should be somewhere in there.

<details>

removed/redacted anything unrelated

```diff
8,14d7
< :CILIUM_POST_mangle - [0:0]
< :CILIUM_PRE_mangle - [0:0]
< :KUBE-IPTABLES-HINT - [0:0]
< :KUBE-KUBELET-CANARY - [0:0]
< [31212:8486646] -A PREROUTING -m comment --comment "cilium-feeder: CILIUM_PRE_mangle" -j CILIUM_PRE_mangle
< [30527:4827091] -A POSTROUTING -m comment --comment "cilium-feeder: CILIUM_POST_mangle" -j CILIUM_POST_mangle
< [0:0] -A CILIUM_PRE_mangle ! -o lo -m socket --transparent -m mark ! --mark 0xe00/0xf00 -m mark ! --mark 0x800/0xf00 -m comment --comment "cilium: any->pod redirect proxied traffic to host proxy" -j MARK --set-xmark 0x200/0xffffffff
16,17c9,10
21,33d13
< :CILIUM_OUTPUT_raw - [0:0]
< :CILIUM_PRE_raw - [0:0]
< [31212:8486646] -A PREROUTING -m comment --comment "cilium-feeder: CILIUM_PRE_raw" -j CILIUM_PRE_raw
< [30662:4835071] -A OUTPUT -m comment --comment "cilium-feeder: CILIUM_OUTPUT_raw" -j CILIUM_OUTPUT_raw
< [2742:864348] -A CILIUM_OUTPUT_raw -m mark --mark 0xe00/0xf00 -m comment --comment "cilium-encryption-notrack:" -j CT --notrack
< [0:0] -A CILIUM_OUTPUT_raw -m mark --mark 0xd00/0xf00 -m comment --comment "cilium-encryption-notrack:" -j CT --notrack
< [2481:657749] -A CILIUM_OUTPUT_raw -p udp -m udp --dport 8472 -m comment --comment "cilium: NOTRACK for tunnel traffic" -j CT --notrack
< [0:0] -A CILIUM_OUTPUT_raw -o cilium_host -m mark --mark 0xa00/0xfffffeff -m comment --comment "cilium: NOTRACK for proxy return traffic" -j CT --notrack
< [0:0] -A CILIUM_OUTPUT_raw -o cilium_host -m mark --mark 0x800/0xe00 -m comment --comment "cilium: NOTRACK for L7 proxy upstream traffic" -j CT --notrack
< [0:0] -A CILIUM_PRE_raw -m mark --mark 0xe00/0xf00 -m comment --comment "cilium-encryption-notrack:" -j CT --notrack
< [6326:3632514] -A CILIUM_PRE_raw -m mark --mark 0xd00/0xf00 -m comment --comment "cilium-encryption-notrack:" -j CT --notrack
< [3072:1704806] -A CILIUM_PRE_raw -p udp -m udp --dport 8472 -m comment --comment "cilium: NOTRACK for tunnel traffic" -j CT --notrack
< [0:0] -A CILIUM_PRE_raw -m mark --mark 0x200/0xf00 -m comment --comment "cilium: NOTRACK for proxy traffic" -j CT --notrack
38,48c18,21
< :CILIUM_FORWARD - [0:0]
< :CILIUM_INPUT - [0:0]
< :CILIUM_OUTPUT - [0:0]
< :KUBE-FIREWALL - [0:0]
< :KUBE-KUBELET-CANARY - [0:0]
< [30569:8432634] -A INPUT -m comment --comment "cilium-feeder: CILIUM_INPUT" -j CILIUM_INPUT
< [2845956:402239752] -A INPUT -j KUBE-FIREWALL
101,108c74,78
< [643:54012] -A FORWARD -m comment --comment "cilium-feeder: CILIUM_FORWARD" -j CILIUM_FORWARD
< [30662:4835071] -A OUTPUT -m comment --comment "cilium-feeder: CILIUM_OUTPUT" -j CILIUM_OUTPUT
< [2993302:365023626] -A OUTPUT -j KUBE-FIREWALL
---
180,195d149
< [0:0] -A CILIUM_FORWARD -m mark --mark 0xe00/0xf00 -m comment --comment "exclude encrypt/decrypt marks from filter CILIUM_FORWARD chain" -j ACCEPT
< [0:0] -A CILIUM_FORWARD -m mark --mark 0xd00/0xf00 -m comment --comment "exclude encrypt/decrypt marks from filter CILIUM_FORWARD chain" -j ACCEPT
< [0:0] -A CILIUM_FORWARD -o cilium_host -m comment --comment "cilium: any->cluster on cilium_host forward accept" -j ACCEPT
< [0:0] -A CILIUM_FORWARD -i cilium_host -m comment --comment "cilium: cluster->any on cilium_host forward accept (nodeport)" -j ACCEPT
< [0:0] -A CILIUM_FORWARD -i lxc+ -m comment --comment "cilium: cluster->any on lxc+ forward accept" -j ACCEPT
< [0:0] -A CILIUM_FORWARD -i cilium_net -m comment --comment "cilium: cluster->any on cilium_net forward accept (nodeport)" -j ACCEPT
< [0:0] -A CILIUM_INPUT -m mark --mark 0x200/0xf00 -m comment --comment "cilium: ACCEPT for proxy traffic" -j ACCEPT
< [0:0] -A CILIUM_INPUT -m mark --mark 0xe00/0xf00 -m comment --comment "exclude encrypt/decrypt marks from filter CILIUM_INPUT chain" -j ACCEPT
< [6326:3632514] -A CILIUM_INPUT -m mark --mark 0xd00/0xf00 -m comment --comment "exclude encrypt/decrypt marks from filter CILIUM_INPUT chain" -j ACCEPT
< [2481:657749] -A CILIUM_OUTPUT -p udp -m udp --dport 8472 -m comment --comment "cilium: ACCEPT for tunnel traffic" -j ACCEPT
< [0:0] -A CILIUM_OUTPUT -m mark --mark 0xa00/0xe00 -m comment --comment "cilium: ACCEPT for proxy traffic" -j ACCEPT
< [0:0] -A CILIUM_OUTPUT -m mark --mark 0x800/0xe00 -m comment --comment "cilium: ACCEPT for l7 proxy upstream traffic" -j ACCEPT
< [2742:864348] -A CILIUM_OUTPUT -m mark --mark 0xe00/0xf00 -m comment --comment "exclude encrypt/decrypt marks from filter CILIUM_OUTPUT chain" -j ACCEPT
< [0:0] -A CILIUM_OUTPUT -m mark --mark 0xd00/0xf00 -m comment --comment "exclude encrypt/decrypt marks from filter CILIUM_OUTPUT chain" -j ACCEPT
< [25439:3312974] -A CILIUM_OUTPUT -m mark ! --mark 0xd00/0xf00 -m mark ! --mark 0xe00/0xf00 -m mark ! --mark 0x400/0xf00 -m mark ! --mark 0xa00/0xe00 -m mark ! --mark 0x800/0xe00 -m comment --comment "cilium: host->any mark as from host" -j MARK --set-xmark 0xc00/0xf00
< [0:0] -A KUBE-FIREWALL ! -s 127.0.0.0/8 -d 127.0.0.0/8 -m comment --comment "block incoming localnet connections" -m conntrack ! --ctstate RELATED,ESTABLISHED,DNAT -j DROP
197,198c151,152
204,216d157
< :CILIUM_OUTPUT_nat - [0:0]
< :CILIUM_POST_nat - [0:0]
< :CILIUM_PRE_nat - [0:0]
< :KUBE-KUBELET-CANARY - [0:0]
< [2517:166404] -A PREROUTING -m comment --comment "cilium-feeder: CILIUM_PRE_nat" -j CILIUM_PRE_nat
< [1310:78566] -A OUTPUT -m comment --comment "cilium-feeder: CILIUM_OUTPUT_nat" -j CILIUM_OUTPUT_nat
< [1265:75866] -A POSTROUTING -m comment --comment "cilium-feeder: CILIUM_POST_nat" -j CILIUM_POST_nat
< [0:0] -A CILIUM_OUTPUT_nat -m mark --mark 0xe00/0xf00 -m comment --comment "exclude encrypt/decrypt marks from nat CILIUM_OUTPUT_nat chain" -j ACCEPT
< [0:0] -A CILIUM_OUTPUT_nat -m mark --mark 0xd00/0xf00 -m comment --comment "exclude encrypt/decrypt marks from nat CILIUM_OUTPUT_nat chain" -j ACCEPT
< [0:0] -A CILIUM_POST_nat -m mark --mark 0xe00/0xf00 -m comment --comment "exclude encrypt/decrypt marks from nat CILIUM_POST_nat chain" -j ACCEPT
< [0:0] -A CILIUM_POST_nat -m mark --mark 0xd00/0xf00 -m comment --comment "exclude encrypt/decrypt marks from nat CILIUM_POST_nat chain" -j ACCEPT
< [0:0] -A CILIUM_PRE_nat -m mark --mark 0xe00/0xf00 -m comment --comment "exclude encrypt/decrypt marks from nat CILIUM_PRE_nat chain" -j ACCEPT
< [0:0] -A CILIUM_PRE_nat -m mark --mark 0xd00/0xf00 -m comment --comment "exclude encrypt/decrypt marks from nat CILIUM_PRE_nat chain" -j ACCEPT

```

</details>

**Comment by poehlerflorian** [comment]
So, I tried to debug a little bit more with Claude, and it seems like it found the root cause:

<details>

> ## Root Cause: Confirmed by PR #45974
> 
> This PR is the direct fix and it explains everything. Here is a precise breakdown.
> 
> ### What went wrong
> 
> The PR description explains: "what was happening here is that packets received on a wireguard interface (that is, after decryption) were not being conntrack'd, which led to two issues: iptables with policy DROP could not match on ctstate, and common rules in such deployments like `--ctstate NEW,RELATED,ESTABLISHED` would not work."
> 
> The chain of events in your setup:
> 
> 1. PR #41990 introduced Cilium's iptables NOTRACK rules matching on mark `0xd00/0xf00` to prevent outer WireGuard UDP/51871 packets from polluting conntrack — which is correct
> 2. **But** the same mark `0xd00` is also set on **post-decryption inner packets** by `bpf_wireguard`. As the PR notes: "in bpf_wireguard this mark also means 'this packet was decrypted', and post-decryption packets matched that rule too"
> 3. Your decrypted host ICMP packets therefore also get NOTRACK'd → conntrack state = `UNTRACKED`
> 4. `cil_to_host` on `cilium_host` ingress performs a conntrack lookup (`bpf_skb_ct_lookup`). With no CT entry (UNTRACKED), it finds no valid state → drops the packet **before AF_PACKET** (explaining why `cilium_host In` never appears in tcpdump — TC drops are invisible to tcpdump)
> 5. Your INPUT chain has `INPUT DROP` as default policy, and your rules use `-m state --state NEW` — neither matches `UNTRACKED` as a fallback even if the packet survived
> 
> ### Why iptables restart fixed it
> 
> Removing Cilium's NOTRACK rules meant inner packets were tracked normally (state `NEW`). `cil_to_host`'s conntrack lookup succeeded → packet passed → `cilium_host In` appeared in tcpdump → ICMP reply generated. Cilium pod restart re-installs the NOTRACK rules → broken again.
> 
> ### The fix
> 
> PR #45974 solves this "by removing set_mark from the pre-decryption path and changes the iptables rules for wireguard to match based on proto + port" — specifically `udp port 51871`. Only the outer WireGuard tunnel packets get NOTRACK'd; inner decrypted packets are tracked normally.
> 
> The PR is still **open and awaiting review** (not yet merged into `main`). It explicitly references your issue #46062 as one it addresses. You can follow it for the fix landing in a patch release.

</details>

I then tested this by deleting and replacing the offending rule:
```
# 1. Remove the mark-based NOTRACK rule that incorrectly catches decrypted inner packets
iptables -t raw -D CILIUM_PRE_raw \
  -m mark --mark 0xd00/0xf00 \
  -m comment --comment "cilium-encryption-notrack:" \
  -j CT --notrack

# 2. Add the correct replacement: NOTRACK only the outer WireGuard UDP/51871 packets
iptables -t raw -I CILIUM_PRE_raw 1 \
  -p udp --dport 51871 \
  -m comment --comment "notrack wireguard outer packets (manual fix)" \
  -j CT --notrack
```

After removing the rule, Pings were already successful.

However, a cilium pod restart then did **not** cause the pings to fail again.

<details>

> The Cilium pod restart almost certainly did re-add the broken rule — Cilium flushes and rebuilds its chains on every start. The reason ping still works is that the conntrack entries created while your fix was active are still alive in the kernel. The cil_to_host ct_lookup now finds those existing ESTABLISHED entries and lets the packets through, even though 0xd00 NOTRACK is back.
>
> This actually further confirms the root cause: the bug only affects new connections with no conntrack entry. Existing tracked connections survive the regression.

</details>

Only after flushing conntrack (`conntrack -D -p icmp`) the ping failed again.

I do not have enough cilium/networking knowledge to actually confirm this, but it sounds really plausible. @bersoare could you have a look at this and perhaps confirm if this is indeed related to your pull request #45974?

**Comment by ssam18** [comment]
@poehlerflorian Nice bisection, the proto+port substitution + conntrack flush re-trigger is conclusive that this is #45974's territory. One small clarification on the mechanism: Cilium uses its own BPF LRU conntrack maps (`pkg/maps/ctmap`), not Linux nf_conntrack, so `cil_to_host` is probably not the drop site. The drop is much more likely in iptables `INPUT` against your default-DROP policy. UNTRACKED packets don't match `--ctstate NEW`, which is exactly the breakage bersoare's PR description calls out. Doesn't change the conclusion: this is a duplicate of #45497, and #45974 is the fix. I'd suggest labeling accordingly so triage state matches.

For anyone else landing here before #45974 merges + backports to 1.19, your manual replacement (drop the mark-based NOTRACK, install a `-p udp --dport 51871` notrack rule instead) is the same change the PR makes, and it survives pod restart for any already-established connection since Cilium's chain rebuild doesn't flush nf_conntrack.
