### ISSUE TITLE
[Bug] EndpointSlice to external address fails to complete TCP handshake via Gateway API / Envoy

### ISSUE THREAD

**Issue by deanqx** [cilium/cilium#46798]
### Is there an existing issue for this?

- [x] I have searched the existing issues

### Version

equal or higher than v1.19.5 and lower than v1.20.0

### What happened?

When exposing an external service (located on the same physical subnet as the cluster node) using a custom `EndpointSlice` and routing traffic to it via the Cilium Gateway API (Envoy), the connection fails with an HTTP `503 Service Unavailable` error.

Directly connecting to the external service from the host node or from an isolated standalone pod works perfectly. However, when traffic is routed through the Gateway API `HTTPRoute` targeting the `Service` backed by the external `EndpointSlice`, the TCP handshake never completes. Traffic analysis shows that the `SYN` packet leaves the host and the `SYN-ACK` returns and is successfully delivered back to the Envoy pod (`cilium_host -> cilium_net`), but the subsequent `ACK` packet to complete the handshake is never sent back out to the external server.

### Expected Behavior

Traffic routed through the Gateway API to an external IP specified in a custom `EndpointSlice` should successfully complete the TCP handshake and proxy the HTTP traffic, just as it does for internal pods.

## Environment Setup

- Single-node cluster
- Host System uses Linux Bridge (I already tried disabling it)
- Host IP: `10.101.2.3`
- External Server IP: `10.101.2.7`
- Cilium uses Gateway API, tunnel (`VXLAN`) and `kubeProxyReplacement: true`

All reverse path filtering is disabled, verified by:

```bash
sudo sysctl -a | grep "rp_filter = 2"
sudo sysctl -a | grep "rp_filter = 1"
```

### Cilium Loadbalancer

```yaml
apiVersion: cilium.io/v2alpha1
kind: CiliumLoadBalancerIPPool
metadata:
  name: cilium-ip-pool
  namespace: gateway-system
spec:
  blocks:
    - cidr: "10.101.2.200/32"
---
apiVersion: cilium.io/v2alpha1
kind: CiliumL2AnnouncementPolicy
metadata:
  name: cilium-l2-policy
  namespace: gateway-system
spec:
  nodeSelector:
    matchExpressions:
      - key: kubernetes.io/hostname
        operator: In
        values:
          - node1
  loadBalancerIPs: true
  interfaces:
    - ^br0$
```

### Gateway API

```yaml
apiVersion: gateway.networking.k8s.io/v1
kind: Gateway
metadata:
  name: cilium-gateway
  namespace: gateway-system
spec:
  gatewayClassName: cilium
  listeners:
    - name: http
      hostname: test.example.com
      port: 8080
      protocol: HTTP
      allowedRoutes:
        namespaces:
          from: All
```

### Route to external

```yaml
apiVersion: v1
kind: Service
metadata:
  name: test
spec:
  ports:
    - name: web
      port: 8080
---
apiVersion: discovery.k8s.io/v1
kind: EndpointSlice
metadata:
  name: test
  labels:
    kubernetes.io/service-name: test
addressType: IPv4
ports:
  - name: web
    port: 8080
endpoints:
  - addresses:
      - "10.101.2.7"
    conditions:
      ready: true
---
apiVersion: gateway.networking.k8s.io/v1
kind: HTTPRoute
metadata:
  name: test-route
spec:
  parentRefs:
    - name: cilium-gateway
      namespace: gateway-system
      sectionName: http
  hostnames:
    - "test.example.com"
  rules:
      backendRefs:
        - name: test
          kind: Service
          port: 8080
```

## On cluster external server

```bash
python -m http.server 8123
```

## Trigger failure

```bash
curl --show-headers --header "Host: home.kowi.it" http://10.101.2.3
```

Output:

```
HTTP/1.1 503 Service Unavailable
content-length: 91
content-type: text/plain
date: Mon, 29 Jun 2026 17:44:22 GMT
server: envoy

upstream connect error or disconnect/reset before headers. reset reason: connection timeout
```

The same `curl` command works when sent from a BusyBox Pod. 

### Cilium Version

cilium image (default): v1.19.3
cilium image (stable): v1.19.5
cilium image (running): 1.19.5+557ea3b67b23

### Kernel Version

Linux 7.0.12-arch1-1 x86_64

### Kubernetes Version

Client Version: v1.36.2
Kustomize Version: v5.8.1
Server Version: v1.35.5+k3s1

### Relevant log output

```shell
Cilium and Envoy do not show any error messages. Hubble only shows that the request was `FORWARDED`.
```

### Anything else?

On the server running Cilium:

```bash
sudo tcpdump -i any port 8080
```

Output:

```
br0   Out IP 10.101.2.3.41571 > 10.101.2.7.8080: Flags [S], seq 143282964, win 64240, options [mss 1460,sackOK,TS val 1919551161 ecr 0,nop,wscale 10], length 0
enp1s0 Out IP 10.101.2.3.41571 > 10.101.2.7.8080: Flags [S], seq 143282964, win 64240, options [mss 1460,sackOK,TS val 1919551161 ecr 0,nop,wscale 10], length 0
enp1s0 P   IP 10.101.2.7.8080 > 10.101.2.3.41571: Flags [S.], seq 3260555409, ack 143282965, win 65160, options [mss 1460,sackOK,TS val 893433771 ecr 1919547028,nop,wscale 10], length 0
br0   In  IP 10.101.2.7.8080 > 10.101.2.3.41571: Flags [S.], seq 3260555409, ack 143282965, win 65160, options [mss 1460,sackOK,TS val 893433771 ecr 1919547028,nop,wscale 10], length 0
enp1s0 P   IP 10.101.2.7.8080 > 10.101.2.3.41571: Flags [S.], seq 3260555409, ack 143282965, win 65160, options [mss 1460,sackOK,TS val 893435832 ecr 1919547028,nop,wscale 10], length 0
br0   In  IP 10.101.2.7.8080 > 10.101.2.3.41571: Flags [S.], seq 3260555409, ack 143282965, win 65160, options [mss 1460,sackOK,TS val 893435832 ecr 1919547028,nop,wscale 10], length 0
# This repeated for a few milliseconds, the ack from 10.101.2.7:8080 is not recognised
cilium_host Out IP 10.101.2.7.8080 > 10.42.0.121.41571: Flags [S.], seq 3260555409, ack 143282965, win 65160, options [mss 1460,sackOK,TS val 893435832 ecr 1919547028,nop,wscale 10], length 0
cilium_net In  IP 10.101.2.7.8080 > 10.42.0.121.41571: Flags [S.], seq 3260555409, ack 143282965, win 65160, options [mss 1460,sackOK,TS val 893435832 ecr 1919547028,nop,wscale 10], length 0
# This repeated many times for a few milliseconds, I noticed that cilium is never sending something to 10.101.2.7:8080
```

In a new request this was recorded:

```bash
sudo conntrack -E -p tcp --reply-src 10.101.2.7
```

Output:

```
    [NEW] tcp      6 300 ESTABLISHED src=10.101.2.200 dst=10.101.2.7 sport=443 dport=38684 [UNREPLIED] src=10.101.2.7 dst=10.101.2.200 sport=38684 dport=443
 [UPDATE] tcp      6 300 src=10.101.2.200 dst=10.101.2.7 sport=443 dport=38684 src=10.101.2.7 dst=10.101.2.200 sport=38684 dport=443 [ASSURED]
    [NEW] tcp      6 120 SYN_SENT src=10.42.0.121 dst=10.101.2.7 sport=44571 dport=8080 [UNREPLIED] src=10.101.2.7 dst=10.42.0.121 sport=8080 dport=44571
 [UPDATE] tcp      6 120 FIN_WAIT src=10.101.2.200 dst=10.101.2.7 sport=443 dport=38684 src=10.101.2.7 dst=10.101.2.200 sport=38684 dport=443 [ASSURED]
 [UPDATE] tcp      6 60 SYN_RECV src=10.42.0.121 dst=10.101.2.7 sport=44571 dport=8080 src=10.101.2.7 dst=10.42.0.121 sport=8080 dport=44571
```

### Cilium Users Document

- [x] Are you a user of Cilium? Please add yourself to the [Users doc](https://github.com/cilium/cilium/blob/main/USERS.md)

### Code of Conduct

- [x] I agree to follow this project's Code of Conduct

**Comment by deanqx** [comment]
The work-around is to use a Pod that forwards all traffic. I don't think this is the indented way to do it.

```yaml
apiVersion: apps/v1
kind: Deployment
metadata:
  name: traffic-forward
spec:
  replicas: 1
  selector:
    matchLabels:
      app: traffic-forward
  template:
    metadata:
      labels:
        app: traffic-forward
    spec:
      containers:
        - name: socat
          image: alpine/socat:latest
          args: ["TCP-LISTEN:8080,fork,reuseaddr", "TCP:10.101.2.10:8080"]
          ports:
            - containerPort: 8080
              name: socat-port
          resources:
            limits:
              memory: 64Mi
            requests:
              memory: 64Mi
              cpu: 10m
---
apiVersion: v1
kind: Service
metadata:
  name: test
spec:
  ports:
    - protocol: TCP
      port: 8080
  selector:
    app: traffic-forward
```

**Comment by squeed** [comment]
Oh, I'm curious if we ever intended to support load-balancing to an endpoint outside of the cluster. That said, we should support host-network pods (which are almost the same thing).

Does a `pwru` show anything interesting?

**Comment by deanqx** [comment]
Thank you for your fast response. I'm showing the actual values now. 

```yaml
apiVersion: v1
kind: Service
metadata:
  name: home-assistant
  namespace: home-assistant
spec:
  ports:
    - name: http
      protocol: TCP
      port: 8123
      targetPort: 8123
---
apiVersion: discovery.k8s.io/v1
kind: EndpointSlice
metadata:
  name: home-assistant
  namespace: home-assistant
  labels:
    kubernetes.io/service-name: home-assistant
addressType: IPv4
ports:
  - name: http
    appProtocol: http
    protocol: TCP
    port: 8123
endpoints:
  - addresses:
      - "10.101.2.10"
```

```sh
sudo pwru 'tcp and port 8123'
```

Output (stopped after a few ms):

```
SKB                CPU PROCESS          NETNS      MARK/x        IFACE       PROTO  MTU   LEN   TUPLE FUNC
0xffff8aede825cce8 2   ~um-envoy:143825 4026531833 80b00           0         0x0000 1500  60    10.42.0.176:44529->10.101.2.10:8123(tcp) ip_local_out
0xffff8aede825cce8 2   ~um-envoy:143825 4026531833 80b00           0         0x0000 1500  60    10.42.0.176:44529->10.101.2.10:8123(tcp) __ip_local_out
0xffff8aede825cce8 2   ~um-envoy:143825 4026531833 80b00           0         0x0800 1500  60    10.42.0.176:44529->10.101.2.10:8123(tcp) nf_hook_slow
0xffff8aede825cce8 2   ~um-envoy:143825 4026531833 80b00           0         0x0800 1500  60    10.42.0.176:44529->10.101.2.10:8123(tcp) ip_output
0xffff8aede825cce8 2   ~um-envoy:143825 4026531833 80b00         br0:2       0x0800 1500  60    10.42.0.176:44529->10.101.2.10:8123(tcp) nf_hook_slow
0xffff8aede825cce8 2   ~um-envoy:143825 4026531833 80b00         br0:2       0x0800 1500  60    10.42.0.176:44529->10.101.2.10:8123(tcp) ip_finish_output
0xffff8aede825cce8 2   ~um-envoy:143825 4026531833 80b00         br0:2       0x0800 1500  60    10.42.0.176:44529->10.101.2.10:8123(tcp) __cgroup_bpf_run_filter_skb
0xffff8aede825cce8 2   ~um-envoy:143825 4026531833 80b00         br0:2       0x0800 1500  60    10.42.0.176:44529->10.101.2.10:8123(tcp) __ip_finish_output
0xffff8aede825cce8 2   ~um-envoy:143825 4026531833 80b00         br0:2       0x0800 1500  60    10.42.0.176:44529->10.101.2.10:8123(tcp) ip_finish_output2
0xffff8aede825cce8 2   ~um-envoy:143825 4026531833 80b00         br0:2       0x0800 1500  60    10.42.0.176:44529->10.101.2.10:8123(tcp) neigh_resolve_output
0xffff8aede825cce8 2   ~um-envoy:143825 4026531833 80b00         br0:2       0x0800 1500  60    10.42.0.176:44529->10.101.2.10:8123(tcp) __neigh_event_send
0xffff8aede825cce8 2   ~um-envoy:143825 4026531833 80b00         br0:2       0x0800 1500  60    10.42.0.176:44529->10.101.2.10:8123(tcp) eth_header
0xffff8aede825cce8 2   ~um-envoy:143825 4026531833 80b00         br0:2       0x0800 1500  60    10.42.0.176:44529->10.101.2.10:8123(tcp) skb_push
0xffff8aede825cce8 2   ~um-envoy:143825 4026531833 80b00         br0:2       0x0800 1500  74    10.42.0.176:44529->10.101.2.10:8123(tcp) __dev_queue_xmit
0xffff8aede825cce8 2   ~um-envoy:143825 4026531833 80b00         br0:2       0x0800 1500  74    10.42.0.176:44529->10.101.2.10:8123(tcp) qdisc_pkt_len_segs_init
0xffff8aede825cce8 2   ~um-envoy:143825 4026531833 80b00         br0:2       0x0800 1500  74    10.42.0.176:44529->10.101.2.10:8123(tcp) skb_ensure_writable
0xffff8aede825cce8 2   ~um-envoy:143825 4026531833 80b00         br0:2       0x0800 1500  74    10.42.0.176:44529->10.101.2.10:8123(tcp) skb_ensure_writable
0xffff8aede825cce8 2   ~um-envoy:143825 4026531833 80b00         br0:2       0x0800 1500  74    10.101.2.3:44529->10.101.2.10:8123(tcp)  skb_ensure_writable
0xffff8aede825cce8 2   ~um-envoy:143825 4026531833 80b00         br0:2       0x0800 1500  74    10.101.2.3:44529->10.101.2.10:8123(tcp)  skb_ensure_writable
0xffff8aede825cce8 2   ~um-envoy:143825 4026531833 80b00         br0:2       0x0800 1500  74    10.101.2.3:44529->10.101.2.10:8123(tcp)  inet_proto_csum_replace_by_diff
0xffff8aede825cce8 2   ~um-envoy:143825 4026531833 80300         br0:2       0x0800 1500  74    10.101.2.3:44529->10.101.2.10:8123(tcp)  netdev_core_pick_tx
0xffff8aede825cce8 2   ~um-envoy:143825 4026531833 80300         br0:2       0x0800 1500  74    10.101.2.3:44529->10.101.2.10:8123(tcp)  validate_xmit_skb
0xffff8aede825cce8 2   ~um-envoy:143825 4026531833 80300         br0:2       0x0800 1500  74    10.101.2.3:44529->10.101.2.10:8123(tcp)  netif_skb_features
0xffff8aede825cce8 2   ~um-envoy:143825 4026531833 80300         br0:2       0x0800 1500  74    10.101.2.3:44529->10.101.2.10:8123(tcp)  passthru_features_check
0xffff8aede825cce8 2   ~um-envoy:143825 4026531833 80300         br0:2       0x0800 1500  74    10.101.2.3:44529->10.101.2.10:8123(tcp)  skb_network_protocol
0xffff8aede825cce8 2   ~um-envoy:143825 4026531833 80300         br0:2       0x0800 1500  74    10.101.2.3:44529->10.101.2.10:8123(tcp)  skb_csum_hwoffload_help
0xffff8aede825cce8 2   ~um-envoy:143825 4026531833 80300         br0:2       0x0800 1500  74    10.101.2.3:44529->10.101.2.10:8123(tcp)  validate_xmit_xfrm
0xffff8aede825cce8 2   ~um-envoy:143825 4026531833 80300         br0:2       0x0800 1500  74    10.101.2.3:44529->10.101.2.10:8123(tcp)  dev_hard_start_xmit
0xffff8aede825cce8 2   ~um-envoy:143825 4026531833 80300         br0:2       0x0800 1500  74    10.101.2.3:44529->10.101.2.10:8123(tcp)  skb_pull
0xffff8aede825cce8 2   ~um-envoy:143825 4026531833 80300       vnet1:858     0x0800 1500  60    10.101.2.3:44529->10.101.2.10:8123(tcp)  nf_hook_slow
0xffff8aede825cce8 2   ~um-envoy:143825 4026531833 80300       vnet1:858     0x0800 1500  60    10.101.2.3:44529->10.101.2.10:8123(tcp)  skb_push
0xffff8aede825cce8 2   ~um-envoy:143825 4026531833 80300       vnet1:858     0x0800 1500  74    10.101.2.3:44529->10.101.2.10:8123(tcp)  __dev_queue_xmit
0xffff8aede825cce8 2   ~um-envoy:143825 4026531833 80300       vnet1:858     0x0800 1500  74    10.101.2.3:44529->10.101.2.10:8123(tcp)  qdisc_pkt_len_segs_init
0xffff8aede825cce8 2   ~um-envoy:143825 4026531833 80300       vnet1:858     0x0800 1500  74    10.101.2.3:44529->10.101.2.10:8123(tcp)  netdev_core_pick_tx
0xffff8aede825cce8 2   ~um-envoy:143825 4026531833 80300       vnet1:858     0x0800 1500  74    10.101.2.3:44529->10.101.2.10:8123(tcp)  validate_xmit_skb
0xffff8aede825cce8 2   ~um-envoy:143825 4026531833 80300       vnet1:858     0x0800 1500  74    10.101.2.3:44529->10.101.2.10:8123(tcp)  netif_skb_features
0xffff8aede825cce8 2   ~um-envoy:143825 4026531833 80300       vnet1:858     0x0800 1500  74    10.101.2.3:44529->10.101.2.10:8123(tcp)  passthru_features_check
0xffff8aede825cce8 2   ~um-envoy:143825 4026531833 80300       vnet1:858     0x0800 1500  74    10.101.2.3:44529->10.101.2.10:8123(tcp)  skb_network_protocol
0xffff8aede825cce8 2   ~um-envoy:143825 4026531833 80300       vnet1:858     0x0800 1500  74    10.101.2.3:44529->10.101.2.10:8123(tcp)  skb_csum_hwoffload_help
0xffff8aede825cce8 2   ~um-envoy:143825 4026531833 80300       vnet1:858     0x0800 1500  74    10.101.2.3:44529->10.101.2.10:8123(tcp)  validate_xmit_xfrm
0xffff8aede825cce8 2   ~um-envoy:143825 4026531833 80300       vnet1:858     0x0800 1500  74    10.101.2.3:44529->10.101.2.10:8123(tcp)  dev_hard_start_xmit
0xffff8aede825cce8 2   ~um-envoy:143825 4026531833 80300       vnet1:858     0x0800 1500  74    10.101.2.3:44529->10.101.2.10:8123(tcp)  tcp_wfree
0xffff8aede825cce8 3   ~wrapped:3479002 4026531833 80300       vnet1:858     0x0800 1500  74    10.101.2.3:44529->10.101.2.10:8123(tcp)  consume_skb
0xffff8aede825cce8 3   ~wrapped:3479002 4026531833 80300       vnet1:858     0x0800 1500  74    10.101.2.3:44529->10.101.2.10:8123(tcp)  skb_release_head_state
0xffff8aede825cce8 3   ~wrapped:3479002 4026531833 80300       vnet1:858     0x0800 1500  74    10.101.2.3:44529->10.101.2.10:8123(tcp)  skb_release_data
0xffff8aede825cce8 3   ~wrapped:3479002 4026531833 80300       vnet1:858     0x0800 1500  74    10.101.2.3:44529->10.101.2.10:8123(tcp)  kfree_skbmem
0xffff8aecf2097d00 3   ~wrapped:3479002 4026531833 0           vnet1:858     0x0800 1500  60    10.101.2.10:8123->10.101.2.3:44529(tcp)  netif_receive_skb
0xffff8aecf2097d00 3   ~wrapped:3479002 4026531833 0           vnet1:858     0x0800 1500  60    10.101.2.10:8123->10.101.2.3:44529(tcp)  __netif_receive_skb
0xffff8aecf2097d00 3   ~wrapped:3479002 4026531833 0           vnet1:858     0x0800 1500  60    10.101.2.10:8123->10.101.2.3:44529(tcp)  __netif_receive_skb_one_core
0xffff8aecf2097d00 3   ~wrapped:3479002 4026531833 0           vnet1:858     0x0800 1500  60    10.101.2.10:8123->10.101.2.3:44529(tcp)  skb_pull_rcsum
0xffff8aecf2097d00 3   ~wrapped:3479002 4026531833 0           vnet1:858     0x0800 1500  60    10.101.2.10:8123->10.101.2.3:44529(tcp)  skb_ext_add
0xffff8aecf2097d00 3   ~wrapped:3479002 4026531833 0             br0:2       0x0800 1500  60    10.101.2.10:8123->10.101.2.3:44529(tcp)  nf_hook_slow
0xffff8aecf2097d00 3   ~wrapped:3479002 4026531833 0             br0:2       0x0800 1500  60    10.101.2.10:8123->10.101.2.3:44529(tcp)  nf_checksum
0xffff8aecf2097d00 3   ~wrapped:3479002 4026531833 0             br0:2       0x0800 1500  60    10.101.2.10:8123->10.101.2.3:44529(tcp)  nf_ip_checksum
0xffff8aecf2097d00 3   ~wrapped:3479002 4026531833 0             br0:2       0x0800 1500  60    10.101.2.10:8123->10.101.2.3:44529(tcp)  __inet_lookup_listener
0xffff8aecf2097d00 3   ~wrapped:3479002 4026531833 0             br0:2       0x0800 1500  60    10.101.2.10:8123->10.101.2.3:44529(tcp)  inet_lhash2_lookup
0xffff8aecf2097d00 3   ~wrapped:3479002 4026531833 0             br0:2       0x0800 1500  60    10.101.2.10:8123->10.101.2.3:44529(tcp)  inet_lhash2_lookup
0xffff8aecf2097d00 3   ~wrapped:3479002 4026531833 0           vnet1:858     0x0800 1500  60    10.101.2.10:8123->10.101.2.3:44529(tcp)  skb_push
0xffff8aecf2097d00 3   ~wrapped:3479002 4026531833 0           vnet1:858     0x0800 1500  60    10.101.2.10:8123->10.101.2.3:44529(tcp)  nf_hook_slow
0xffff8aecf2097d00 3   ~wrapped:3479002 4026531833 0             br0:2       0x0800 1500  60    10.101.2.10:8123->10.101.2.3:44529(tcp)  nf_hook_slow
0xffff8aecf2097d00 3   ~wrapped:3479002 4026531833 0             br0:2       0x0800 1500  60    10.101.2.10:8123->10.101.2.3:44529(tcp)  netif_receive_skb
0xffff8aecf2097d00 3   ~wrapped:3479002 4026531833 0             br0:2       0x0800 1500  60    10.101.2.10:8123->10.101.2.3:44529(tcp)  __netif_receive_skb
0xffff8aecf2097d00 3   ~wrapped:3479002 4026531833 0             br0:2       0x0800 1500  60    10.101.2.10:8123->10.101.2.3:44529(tcp)  __netif_receive_skb_one_core
0xffff8aecf2097d00 3   ~wrapped:3479002 4026531833 0             br0:2       0x0800 1500  60    10.101.2.10:8123->10.101.2.3:44529(tcp)  qdisc_pkt_len_segs_init
0xffff8aecf2097d00 3   ~wrapped:3479002 4026531833 0             br0:2       0x0800 1500  74    10.101.2.10:8123->10.101.2.3:44529(tcp)  skb_ensure_writable
0xffff8aecf2097d00 3   ~wrapped:3479002 4026531833 0             br0:2       0x0800 1500  74    10.101.2.10:8123->10.101.2.3:44529(tcp)  skb_ensure_writable
0xffff8aecf2097d00 3   ~wrapped:3479002 4026531833 0             br0:2       0x0800 1500  74    10.101.2.10:8123->10.42.0.176:44529(tcp) skb_ensure_writable
0xffff8aecf2097d00 3   ~wrapped:3479002 4026531833 0             br0:2       0x0800 1500  74    10.101.2.10:8123->10.42.0.176:44529(tcp) skb_ensure_writable
0xffff8aecf2097d00 3   ~wrapped:3479002 4026531833 0             br0:2       0x0800 1500  74    10.101.2.10:8123->10.42.0.176:44529(tcp) inet_proto_csum_replace_by_diff
0xffff8aecf2097d00 3   ~wrapped:3479002 4026531833 300           br0:2       0x0800 1500  60    10.101.2.10:8123->10.42.0.176:44529(tcp) ip_rcv
0xffff8aecf2097d00 3   ~wrapped:3479002 4026531833 300           br0:2       0x0800 1500  60    10.101.2.10:8123->10.42.0.176:44529(tcp) ip_rcv_core
0xffff8aecf2097d00 3   ~wrapped:3479002 4026531833 300           br0:2       0x0800 1500  60    10.101.2.10:8123->10.42.0.176:44529(tcp) nf_hook_slow
0xffff8aecf2097d00 3   ~wrapped:3479002 4026531833 300           br0:2       0x0800 1500  60    10.101.2.10:8123->10.42.0.176:44529(tcp) ip_rcv_finish
0xffff8aecf2097d00 3   ~wrapped:3479002 4026531833 300           br0:2       0x0800 1500  60    10.101.2.10:8123->10.42.0.176:44529(tcp) ip_rcv_finish_core
0xffff8aecf2097d00 3   ~wrapped:3479002 4026531833 300           br0:2       0x0800 1500  60    10.101.2.10:8123->10.42.0.176:44529(tcp) tcp_v4_early_demux
0xffff8aecf2097d00 3   ~wrapped:3479002 4026531833 300           br0:2       0x0800 1500  60    10.101.2.10:8123->10.42.0.176:44529(tcp) ip_route_input_noref
0xffff8aecf2097d00 3   ~wrapped:3479002 4026531833 300           br0:2       0x0800 1500  60    10.101.2.10:8123->10.42.0.176:44529(tcp) ip_route_input_slow
0xffff8aecf2097d00 3   ~wrapped:3479002 4026531833 300           br0:2       0x0800 1500  60    10.101.2.10:8123->10.42.0.176:44529(tcp) fib_validate_source
0xffff8aecf2097d00 3   ~wrapped:3479002 4026531833 300           br0:2       0x0800 1500  60    10.101.2.10:8123->10.42.0.176:44529(tcp) __fib_validate_source
0xffff8aecf2097d00 3   ~wrapped:3479002 4026531833 300           br0:2       0x0800 1500  60    10.101.2.10:8123->10.42.0.176:44529(tcp) ip_forward
0xffff8aecf2097d00 3   ~wrapped:3479002 4026531833 300           br0:2       0x0800 1500  60    10.101.2.10:8123->10.42.0.176:44529(tcp) sk_skb_reason_drop(SKB_DROP_REASON_NOT_SPECIFIED)
0xffff8aecf2097d00 3   ~wrapped:3479002 4026531833 300           br0:2       0x0800 1500  60    10.101.2.10:8123->10.42.0.176:44529(tcp) skb_release_head_state
0xffff8aecf2097d00 3   ~wrapped:3479002 4026531833 300           br0:2       0x0800 1500  60    10.101.2.10:8123->10.42.0.176:44529(tcp) sock_edemux
0xffff8aecf2097d00 3   ~wrapped:3479002 4026531833 300           br0:2       0x0800 1500  60    10.101.2.10:8123->10.42.0.176:44529(tcp) skb_release_data
0xffff8aecf2097d00 3   ~wrapped:3479002 4026531833 300           br0:2       0x0800 1500  60    10.101.2.10:8123->10.42.0.176:44529(tcp) skb_free_head
0xffff8aecf2097d00 3   ~wrapped:3479002 4026531833 300           br0:2       0x0800 1500  60    10.101.2.10:8123->10.42.0.176:44529(tcp) kfree_skbmem
0xffff8aede825cce8 2   <empty>:0        4026531833 80300       vnet1:858     0x0800 1500  74    10.101.2.3:44529->10.101.2.10:8123(tcp)  __copy_skb_header
0xffff8aede825cce8 2   <empty>:0        4026531833 80b00           0         0x0000 1500  60    10.42.0.176:44529->10.101.2.10:8123(tcp) ip_local_out
0xffff8aede825cce8 2   <empty>:0        4026531833 80b00           0         0x0000 1500  60    10.42.0.176:44529->10.101.2.10:8123(tcp) __ip_local_out
0xffff8aede825cce8 2   <empty>:0        4026531833 80b00           0         0x0800 1500  60    10.42.0.176:44529->10.101.2.10:8123(tcp) nf_hook_slow
0xffff8aede825cce8 2   <empty>:0        4026531833 80b00           0         0x0800 1500  60    10.42.0.176:44529->10.101.2.10:8123(tcp) ip_output
0xffff8aede825cce8 2   <empty>:0        4026531833 80b00         br0:2       0x0800 1500  60    10.42.0.176:44529->10.101.2.10:8123(tcp) nf_hook_slow
0xffff8aede825cce8 2   <empty>:0        4026531833 80b00         br0:2       0x0800 1500  60    10.42.0.176:44529->10.101.2.10:8123(tcp) ip_finish_output
0xffff8aede825cce8 2   <empty>:0        4026531833 80b00         br0:2       0x0800 1500  60    10.42.0.176:44529->10.101.2.10:8123(tcp) __cgroup_bpf_run_filter_skb
0xffff8aede825cce8 2   <empty>:0        4026531833 80b00         br0:2       0x0800 1500  60    10.42.0.176:44529->10.101.2.10:8123(tcp) __ip_finish_output
0xffff8aede825cce8 2   <empty>:0        4026531833 80b00         br0:2       0x0800 1500  60    10.42.0.176:44529->10.101.2.10:8123(tcp) ip_finish_output2
0xffff8aede825cce8 2   <empty>:0        4026531833 80b00         br0:2       0x0800 1500  60    10.42.0.176:44529->10.101.2.10:8123(tcp) neigh_resolve_output
0xffff8aede825cce8 2   <empty>:0        4026531833 80b00         br0:2       0x0800 1500  60    10.42.0.176:44529->10.101.2.10:8123(tcp) eth_header
0xffff8aede825cce8 2   <empty>:0        4026531833 80b00         br0:2       0x0800 1500  60    10.42.0.176:44529->10.101.2.10:8123(tcp) skb_push
0xffff8aede825cce8 2   <empty>:0        4026531833 80b00         br0:2       0x0800 1500  74    10.42.0.176:44529->10.101.2.10:8123(tcp) __dev_queue_xmit
0xffff8aede825cce8 2   <empty>:0        4026531833 80b00         br0:2       0x0800 1500  74    10.42.0.176:44529->10.101.2.10:8123(tcp) qdisc_pkt_len_segs_init
0xffff8aede825cce8 2   <empty>:0        4026531833 80b00         br0:2       0x0800 1500  74    10.42.0.176:44529->10.101.2.10:8123(tcp) skb_ensure_writable
0xffff8aede825cce8 2   <empty>:0        4026531833 80b00         br0:2       0x0800 1500  74    10.42.0.176:44529->10.101.2.10:8123(tcp) skb_ensure_writable
0xffff8aede825cce8 2   <empty>:0        4026531833 80b00         br0:2       0x0800 1500  74    10.101.2.3:44529->10.101.2.10:8123(tcp)  skb_ensure_writable
0xffff8aede825cce8 2   <empty>:0        4026531833 80b00         br0:2       0x0800 1500  74    10.101.2.3:44529->10.101.2.10:8123(tcp)  skb_ensure_writable
0xffff8aede825cce8 2   <empty>:0        4026531833 80b00         br0:2       0x0800 1500  74    10.101.2.3:44529->10.101.2.10:8123(tcp)  inet_proto_csum_replace_by_diff
0xffff8aede825cce8 2   <empty>:0        4026531833 80300         br0:2       0x0800 1500  74    10.101.2.3:44529->10.101.2.10:8123(tcp)  netdev_core_pick_tx
0xffff8aede825cce8 2   <empty>:0        4026531833 80300         br0:2       0x0800 1500  74    10.101.2.3:44529->10.101.2.10:8123(tcp)  validate_xmit_skb
0xffff8aede825cce8 2   <empty>:0        4026531833 80300         br0:2       0x0800 1500  74    10.101.2.3:44529->10.101.2.10:8123(tcp)  netif_skb_features
0xffff8aede825cce8 2   <empty>:0        4026531833 80300         br0:2       0x0800 1500  74    10.101.2.3:44529->10.101.2.10:8123(tcp)  passthru_features_check
0xffff8aede825cce8 2   <empty>:0        4026531833 80300         br0:2       0x0800 1500  74    10.101.2.3:44529->10.101.2.10:8123(tcp)  skb_network_protocol
0xffff8aede825cce8 2   <empty>:0        4026531833 80300         br0:2       0x0800 1500  74    10.101.2.3:44529->10.101.2.10:8123(tcp)  skb_csum_hwoffload_help
0xffff8aede825cce8 2   <empty>:0        4026531833 80300         br0:2       0x0800 1500  74    10.101.2.3:44529->10.101.2.10:8123(tcp)  validate_xmit_xfrm
0xffff8aede825cce8 2   <empty>:0        4026531833 80300         br0:2       0x0800 1500  74    10.101.2.3:44529->10.101.2.10:8123(tcp)  dev_hard_start_xmit
0xffff8aede825cce8 2   <empty>:0        4026531833 80300         br0:2       0x0800 1500  74    10.101.2.3:44529->10.101.2.10:8123(tcp)  skb_pull
0xffff8aede825cce8 2   <empty>:0        4026531833 80300       vnet1:858     0x0800 1500  60    10.101.2.3:44529->10.101.2.10:8123(tcp)  nf_hook_slow
0xffff8aede825cce8 2   <empty>:0        4026531833 80300       vnet1:858     0x0800 1500  60    10.101.2.3:44529->10.101.2.10:8123(tcp)  skb_push
0xffff8aede825cce8 2   <empty>:0        4026531833 80300       vnet1:858     0x0800 1500  74    10.101.2.3:44529->10.101.2.10:8123(tcp)  __dev_queue_xmit
0xffff8aede825cce8 2   <empty>:0        4026531833 80300       vnet1:858     0x0800 1500  74    10.101.2.3:44529->10.101.2.10:8123(tcp)  qdisc_pkt_len_segs_init
0xffff8aede825cce8 2   <empty>:0        4026531833 80300       vnet1:858     0x0800 1500  74    10.101.2.3:44529->10.101.2.10:8123(tcp)  netdev_core_pick_tx
0xffff8aede825cce8 2   <empty>:0        4026531833 80300       vnet1:858     0x0800 1500  74    10.101.2.3:44529->10.101.2.10:8123(tcp)  validate_xmit_skb
0xffff8aede825cce8 2   <empty>:0        4026531833 80300       vnet1:858     0x0800 1500  74    10.101.2.3:44529->10.101.2.10:8123(tcp)  netif_skb_features
0xffff8aede825cce8 2   <empty>:0        4026531833 80300       vnet1:858     0x0800 1500  74    10.101.2.3:44529->10.101.2.10:8123(tcp)  passthru_features_check
0xffff8aede825cce8 2   <empty>:0        4026531833 80300       vnet1:858     0x0800 1500  74    10.101.2.3:44529->10.101.2.10:8123(tcp)  skb_network_protocol
0xffff8aede825cce8 2   <empty>:0        4026531833 80300       vnet1:858     0x0800 1500  74    10.101.2.3:44529->10.101.2.10:8123(tcp)  skb_csum_hwoffload_help
0xffff8aede825cce8 2   <empty>:0        4026531833 80300       vnet1:858     0x0800 1500  74    10.101.2.3:44529->10.101.2.10:8123(tcp)  validate_xmit_xfrm
0xffff8aede825cce8 2   <empty>:0        4026531833 80300       vnet1:858     0x0800 1500  74    10.101.2.3:44529->10.101.2.10:8123(tcp)  dev_hard_start_xmit
0xffff8aede825cce8 2   <empty>:0        4026531833 80300       vnet1:858     0x0800 1500  74    10.101.2.3:44529->10.101.2.10:8123(tcp)  tcp_wfree
0xffff8aede825cce8 1   ~wrapped:3479002 4026531833 80300       vnet1:858     0x0800 1500  74    10.101.2.3:44529->10.101.2.10:8123(tcp)  consume_skb
0xffff8aede825cce8 1   ~wrapped:3479002 4026531833 80300       vnet1:858     0x0800 1500  74    10.101.2.3:44529->10.101.2.10:8123(tcp)  skb_release_head_state
0xffff8aede825cce8 1   ~wrapped:3479002 4026531833 80300       vnet1:858     0x0800 1500  74    10.101.2.3:44529->10.101.2.10:8123(tcp)  skb_release_data
0xffff8aede825cce8 1   ~wrapped:3479002 4026531833 80300       vnet1:858     0x0800 1500  74    10.101.2.3:44529->10.101.2.10:8123(tcp)  kfree_skbmem
0xffff8aecd2355b00 1   ~wrapped:3479002 4026531833 0           vnet1:858     0x0800 1500  60    10.101.2.10:8123->10.101.2.3:44529(tcp)  netif_receive_skb
0xffff8aecd2355b00 1   ~wrapped:3479002 4026531833 0           vnet1:858     0x0800 1500  60    10.101.2.10:8123->10.101.2.3:44529(tcp)  __netif_receive_skb
0xffff8aecd2355b00 1   ~wrapped:3479002 4026531833 0           vnet1:858     0x0800 1500  60    10.101.2.10:8123->10.101.2.3:44529(tcp)  __netif_receive_skb_one_core
0xffff8aecd2355b00 1   ~wrapped:3479002 4026531833 0           vnet1:858     0x0800 1500  60    10.101.2.10:8123->10.101.2.3:44529(tcp)  skb_pull_rcsum
0xffff8aecd2355b00 1   ~wrapped:3479002 4026531833 0           vnet1:858     0x0800 1500  60    10.101.2.10:8123->10.101.2.3:44529(tcp)  skb_ext_add
0xffff8aecd2355b00 1   ~wrapped:3479002 4026531833 0             br0:2       0x0800 1500  60    10.101.2.10:8123->10.101.2.3:44529(tcp)  nf_hook_slow
0xffff8aecd2355b00 1   ~wrapped:3479002 4026531833 0             br0:2       0x0800 1500  60    10.101.2.10:8123->10.101.2.3:44529(tcp)  nf_checksum
0xffff8aecd2355b00 1   ~wrapped:3479002 4026531833 0             br0:2       0x0800 1500  60    10.101.2.10:8123->10.101.2.3:44529(tcp)  nf_ip_checksum
0xffff8aecd2355b00 1   ~wrapped:3479002 4026531833 0             br0:2       0x0800 1500  60    10.101.2.10:8123->10.101.2.3:44529(tcp)  __inet_lookup_listener
0xffff8aecd2355b00 1   ~wrapped:3479002 4026531833 0             br0:2       0x0800 1500  60    10.101.2.10:8123->10.101.2.3:44529(tcp)  inet_lhash2_lookup
0xffff8aecd2355b00 1   ~wrapped:3479002 4026531833 0             br0:2       0x0800 1500  60    10.101.2.10:8123->10.101.2.3:44529(tcp)  inet_lhash2_lookup
0xffff8aecd2355b00 1   ~wrapped:3479002 4026531833 0           vnet1:858     0x0800 1500  60    10.101.2.10:8123->10.101.2.3:44529(tcp)  skb_push
0xffff8aecd2355b00 1   ~wrapped:3479002 4026531833 0           vnet1:858     0x0800 1500  60    10.101.2.10:8123->10.101.2.3:44529(tcp)  nf_hook_slow
0xffff8aecd2355b00 1   ~wrapped:3479002 4026531833 0             br0:2       0x0800 1500  60    10.101.2.10:8123->10.101.2.3:44529(tcp)  nf_hook_slow
0xffff8aecd2355b00 1   ~wrapped:3479002 4026531833 0             br0:2       0x0800 1500  60    10.101.2.10:8123->10.101.2.3:44529(tcp)  netif_receive_skb
0xffff8aecd2355b00 1   ~wrapped:3479002 4026531833 0             br0:2       0x0800 1500  60    10.101.2.10:8123->10.101.2.3:44529(tcp)  __netif_receive_skb
0xffff8aecd2355b00 1   ~wrapped:3479002 4026531833 0             br0:2       0x0800 1500  60    10.101.2.10:8123->10.101.2.3:44529(tcp)  __netif_receive_skb_one_core
0xffff8aecd2355b00 1   ~wrapped:3479002 4026531833 0             br0:2       0x0800 1500  60    10.101.2.10:8123->10.101.2.3:44529(tcp)  qdisc_pkt_len_segs_init
0xffff8aecd2355b00 1   ~wrapped:3479002 4026531833 0             br0:2       0x0800 1500  74    10.101.2.10:8123->10.101.2.3:44529(tcp)  skb_ensure_writable
0xffff8aecd2355b00 1   ~wrapped:3479002 4026531833 0             br0:2       0x0800 1500  74    10.101.2.10:8123->10.101.2.3:44529(tcp)  skb_ensure_writable
0xffff8aecd2355b00 1   ~wrapped:3479002 4026531833 0             br0:2       0x0800 1500  74    10.101.2.10:8123->10.42.0.176:44529(tcp) skb_ensure_writable
0xffff8aecd2355b00 1   ~wrapped:3479002 4026531833 0             br0:2       0x0800 1500  74    10.101.2.10:8123->10.42.0.176:44529(tcp) skb_ensure_writable
0xffff8aecd2355b00 1   ~wrapped:3479002 4026531833 0             br0:2       0x0800 1500  74    10.101.2.10:8123->10.42.0.176:44529(tcp) inet_proto_csum_replace_by_diff
0xffff8aecd2355b00 1   ~wrapped:3479002 4026531833 300           br0:2       0x0800 1500  60    10.101.2.10:8123->10.42.0.176:44529(tcp) ip_rcv
0xffff8aecd2355b00 1   ~wrapped:3479002 4026531833 300           br0:2       0x0800 1500  60    10.101.2.10:8123->10.42.0.176:44529(tcp) ip_rcv_core
0xffff8aecd2355b00 1   ~wrapped:3479002 4026531833 300           br0:2       0x0800 1500  60    10.101.2.10:8123->10.42.0.176:44529(tcp) nf_hook_slow
0xffff8aecd2355b00 1   ~wrapped:3479002 4026531833 300           br0:2       0x0800 1500  60    10.101.2.10:8123->10.42.0.176:44529(tcp) ip_rcv_finish
0xffff8aecd2355b00 1   ~wrapped:3479002 4026531833 300           br0:2       0x0800 1500  60    10.101.2.10:8123->10.42.0.176:44529(tcp) ip_rcv_finish_core
0xffff8aecd2355b00 1   ~wrapped:3479002 4026531833 300           br0:2       0x0800 1500  60    10.101.2.10:8123->10.42.0.176:44529(tcp) tcp_v4_early_demux
0xffff8aecd2355b00 1   ~wrapped:3479002 4026531833 300           br0:2       0x0800 1500  60    10.101.2.10:8123->10.42.0.176:44529(tcp) ip_route_input_noref
0xffff8aecd2355b00 1   ~wrapped:3479002 4026531833 300           br0:2       0x0800 1500  60    10.101.2.10:8123->10.42.0.176:44529(tcp) ip_route_input_slow
0xffff8aecd2355b00 1   ~wrapped:3479002 4026531833 300           br0:2       0x0800 1500  60    10.101.2.10:8123->10.42.0.176:44529(tcp) fib_validate_source
0xffff8aecd2355b00 1   ~wrapped:3479002 4026531833 300           br0:2       0x0800 1500  60    10.101.2.10:8123->10.42.0.176:44529(tcp) __fib_validate_source
0xffff8aecd2355b00 1   ~wrapped:3479002 4026531833 300           br0:2       0x0800 1500  60    10.101.2.10:8123->10.42.0.176:44529(tcp) ip_forward
0xffff8aecd2355b00 1   ~wrapped:3479002 4026531833 300           br0:2       0x0800 1500  60    10.101.2.10:8123->10.42.0.176:44529(tcp) sk_skb_reason_drop(SKB_DROP_REASON_NOT_SPECIFIED)
0xffff8aecd2355b00 1   ~wrapped:3479002 4026531833 300           br0:2       0x0800 1500  60    10.101.2.10:8123->10.42.0.176:44529(tcp) skb_release_head_state
0xffff8aecd2355b00 1   ~wrapped:3479002 4026531833 300           br0:2       0x0800 1500  60    10.101.2.10:8123->10.42.0.176:44529(tcp) sock_edemux
0xffff8aecd2355b00 1   ~wrapped:3479002 4026531833 300           br0:2       0x0800 1500  60    10.101.2.10:8123->10.42.0.176:44529(tcp) skb_release_data
0xffff8aecd2355b00 1   ~wrapped:3479002 4026531833 300           br0:2       0x0800 1500  60    10.101.2.10:8123->10.42.0.176:44529(tcp) skb_free_head
0xffff8aecd2355b00 1   ~wrapped:3479002 4026531833 300           br0:2       0x0800 1500  60    10.101.2.10:8123->10.42.0.176:44529(tcp) kfree_skbmem
0xffff8aede825cce8 2   <empty>:0        4026531833 80300       vnet1:858     0x0800 1500  74    10.101.2.3:44529->10.101.2.10:8123(tcp)  __copy_skb_header
0xffff8aede825cce8 2   <empty>:0        4026531833 80b00           0         0x0000 1500  60    10.42.0.176:44529->10.101.2.10:8123(tcp) ip_local_out
0xffff8aede825cce8 2   <empty>:0        4026531833 80b00           0         0x0000 1500  60    10.42.0.176:44529->10.101.2.10:8123(tcp) __ip_local_out
0xffff8aede825cce8 2   <empty>:0        4026531833 80b00           0         0x0800 1500  60    10.42.0.176:44529->10.101.2.10:8123(tcp) nf_hook_slow
0xffff8aede825cce8 2   <empty>:0        4026531833 80b00           0         0x0800 1500  60    10.42.0.176:44529->10.101.2.10:8123(tcp) ip_output
0xffff8aede825cce8 2   <empty>:0        4026531833 80b00         br0:2       0x0800 1500  60    10.42.0.176:44529->10.101.2.10:8123(tcp) nf_hook_slow
0xffff8aede825cce8 2   <empty>:0        4026531833 80b00         br0:2       0x0800 1500  60    10.42.0.176:44529->10.101.2.10:8123(tcp) ip_finish_output
0xffff8aede825cce8 2   <empty>:0        4026531833 80b00         br0:2       0x0800 1500  60    10.42.0.176:44529->10.101.2.10:8123(tcp) __cgroup_bpf_run_filter_skb
0xffff8aede825cce8 2   <empty>:0        4026531833 80b00         br0:2       0x0800 1500  60    10.42.0.176:44529->10.101.2.10:8123(tcp) __ip_finish_output
0xffff8aede825cce8 2   <empty>:0        4026531833 80b00         br0:2       0x0800 1500  60    10.42.0.176:44529->10.101.2.10:8123(tcp) ip_finish_output2
0xffff8aede825cce8 2   <empty>:0        4026531833 80b00         br0:2       0x0800 1500  60    10.42.0.176:44529->10.101.2.10:8123(tcp) neigh_resolve_output
0xffff8aede825cce8 2   <empty>:0        4026531833 80b00         br0:2       0x0800 1500  60    10.42.0.176:44529->10.101.2.10:8123(tcp) eth_header
0xffff8aede825cce8 2   <empty>:0        4026531833 80b00         br0:2       0x0800 1500  60    10.42.0.176:44529->10.101.2.10:8123(tcp) skb_push
0xffff8aede825cce8 2   <empty>:0        4026531833 80b00         br0:2       0x0800 1500  74    10.42.0.176:44529->10.101.2.10:8123(tcp) __dev_queue_xmit
0xffff8aede825cce8 2   <empty>:0        4026531833 80b00         br0:2       0x0800 1500  74    10.42.0.176:44529->10.101.2.10:8123(tcp) qdisc_pkt_len_segs_init
0xffff8aede825cce8 2   <empty>:0        4026531833 80b00         br0:2       0x0800 1500  74    10.42.0.176:44529->10.101.2.10:8123(tcp) skb_ensure_writable
0xffff8aede825cce8 2   <empty>:0        4026531833 80b00         br0:2       0x0800 1500  74    10.42.0.176:44529->10.101.2.10:8123(tcp) skb_ensure_writable
0xffff8aede825cce8 2   <empty>:0        4026531833 80b00         br0:2       0x0800 1500  74    10.101.2.3:44529->10.101.2.10:8123(tcp)  skb_ensure_writable
0xffff8aede825cce8 2   <empty>:0        4026531833 80b00         br0:2       0x0800 1500  74    10.101.2.3:44529->10.101.2.10:8123(tcp)  skb_ensure_writable
0xffff8aede825cce8 2   <empty>:0        4026531833 80b00         br0:2       0x0800 1500  74    10.101.2.3:44529->10.101.2.10:8123(tcp)  inet_proto_csum_replace_by_diff
0xffff8aede825cce8 2   <empty>:0        4026531833 80300         br0:2       0x0800 1500  74    10.101.2.3:44529->10.101.2.10:8123(tcp)  netdev_core_pick_tx
0xffff8aede825cce8 2   <empty>:0        4026531833 80300         br0:2       0x0800 1500  74    10.101.2.3:44529->10.101.2.10:8123(tcp)  validate_xmit_skb
0xffff8aede825cce8 2   <empty>:0        4026531833 80300         br0:2       0x0800 1500  74    10.101.2.3:44529->10.101.2.10:8123(tcp)  netif_skb_features
0xffff8aede825cce8 2   <empty>:0        4026531833 80300         br0:2       0x0800 1500  74    10.101.2.3:44529->10.101.2.10:8123(tcp)  passthru_features_check
0xffff8aede825cce8 2   <empty>:0        4026531833 80300         br0:2       0x0800 1500  74    10.101.2.3:44529->10.101.2.10:8123(tcp)  skb_network_protocol
0xffff8aede825cce8 2   <empty>:0        4026531833 80300         br0:2       0x0800 1500  74    10.101.2.3:44529->10.101.2.10:8123(tcp)  skb_csum_hwoffload_help
0xffff8aede825cce8 2   <empty>:0        4026531833 80300         br0:2       0x0800 1500  74    10.101.2.3:44529->10.101.2.10:8123(tcp)  validate_xmit_xfrm
0xffff8aede825cce8 2   <empty>:0        4026531833 80300         br0:2       0x0800 1500  74    10.101.2.3:44529->10.101.2.10:8123(tcp)  dev_hard_start_xmit
0xffff8aede825cce8 2   <empty>:0        4026531833 80300         br0:2       0x0800 1500  74    10.101.2.3:44529->10.101.2.10:8123(tcp)  skb_pull
0xffff8aede825cce8 2   <empty>:0        4026531833 80300       vnet1:858     0x0800 1500  60    10.101.2.3:44529->10.101.2.10:8123(tcp)  nf_hook_slow
0xffff8aede825cce8 2   <empty>:0        4026531833 80300       vnet1:858     0x0800 1500  60    10.101.2.3:44529->10.101.2.10:8123(tcp)  skb_push
0xffff8aede825cce8 2   <empty>:0        4026531833 80300       vnet1:858     0x0800 1500  74    10.101.2.3:44529->10.101.2.10:8123(tcp)  __dev_queue_xmit
0xffff8aede825cce8 2   <empty>:0        4026531833 80300       vnet1:858     0x0800 1500  74    10.101.2.3:44529->10.101.2.10:8123(tcp)  qdisc_pkt_len_segs_init
0xffff8aede825cce8 2   <empty>:0        4026531833 80300       vnet1:858     0x0800 1500  74    10.101.2.3:44529->10.101.2.10:8123(tcp)  netdev_core_pick_tx
0xffff8aede825cce8 2   <empty>:0        4026531833 80300       vnet1:858     0x0800 1500  74    10.101.2.3:44529->10.101.2.10:8123(tcp)  validate_xmit_skb
0xffff8aede825cce8 2   <empty>:0        4026531833 80300       vnet1:858     0x0800 1500  74    10.101.2.3:44529->10.101.2.10:8123(tcp)  netif_skb_features
0xffff8aede825cce8 2   <empty>:0        4026531833 80300       vnet1:858     0x0800 1500  74    10.101.2.3:44529->10.101.2.10:8123(tcp)  passthru_features_check
0xffff8aede825cce8 2   <empty>:0        4026531833 80300       vnet1:858     0x0800 1500  74    10.101.2.3:44529->10.101.2.10:8123(tcp)  skb_network_protocol
0xffff8aede825cce8 2   <empty>:0        4026531833 80300       vnet1:858     0x0800 1500  74    10.101.2.3:44529->10.101.2.10:8123(tcp)  skb_csum_hwoffload_help
0xffff8aede825cce8 2   <empty>:0        4026531833 80300       vnet1:858     0x0800 1500  74    10.101.2.3:44529->10.101.2.10:8123(tcp)  validate_xmit_xfrm
0xffff8aede825cce8 2   <empty>:0        4026531833 80300       vnet1:858     0x0800 1500  74    10.101.2.3:44529->10.101.2.10:8123(tcp)  dev_hard_start_xmit
0xffff8aede825cce8 2   <empty>:0        4026531833 80300       vnet1:858     0x0800 1500  74    10.101.2.3:44529->10.101.2.10:8123(tcp)  tcp_wfree
0xffff8aede825cce8 1   ~wrapped:3479002 4026531833 80300       vnet1:858     0x0800 1500  74    10.101.2.3:44529->10.101.2.10:8123(tcp)  consume_skb
0xffff8aede825cce8 1   ~wrapped:3479002 4026531833 80300       vnet1:858     0x0800 1500  74    10.101.2.3:44529->10.101.2.10:8123(tcp)  skb_release_head_state
0xffff8aede825cce8 1   ~wrapped:3479002 4026531833 80300       vnet1:858     0x0800 1500  74    10.101.2.3:44529->10.101.2.10:8123(tcp)  skb_release_data
0xffff8aede825cce8 1   ~wrapped:3479002 4026531833 80300       vnet1:858     0x0800 1500  74    10.101.2.3:44529->10.101.2.10:8123(tcp)  kfree_skbmem
0xffff8aecd018f600 0   ~wrapped:3479002 4026531833 0           vnet1:858     0x0800 1500  60    10.101.2.10:8123->10.101.2.3:44529(tcp)  netif_receive_skb
0xffff8aecd018f600 0   ~wrapped:3479002 4026531833 0           vnet1:858     0x0800 1500  60    10.101.2.10:8123->10.101.2.3:44529(tcp)  __netif_receive_skb
0xffff8aecd018f600 0   ~wrapped:3479002 4026531833 0           vnet1:858     0x0800 1500  60    10.101.2.10:8123->10.101.2.3:44529(tcp)  __netif_receive_skb_one_core
0xffff8aecd018f600 0   ~wrapped:3479002 4026531833 0           vnet1:858     0x0800 1500  60    10.101.2.10:8123->10.101.2.3:44529(tcp)  skb_pull_rcsum
0xffff8aecd018f600 0   ~wrapped:3479002 4026531833 0           vnet1:858     0x0800 1500  60    10.101.2.10:8123->10.101.2.3:44529(tcp)  skb_ext_add
0xffff8aecd018f600 0   ~wrapped:3479002 4026531833 0             br0:2       0x0800 1500  60    10.101.2.10:8123->10.101.2.3:44529(tcp)  nf_hook_slow
0xffff8aecd018f600 0   ~wrapped:3479002 4026531833 0             br0:2       0x0800 1500  60    10.101.2.10:8123->10.101.2.3:44529(tcp)  nf_checksum
0xffff8aecd018f600 0   ~wrapped:3479002 4026531833 0             br0:2       0x0800 1500  60    10.101.2.10:8123->10.101.2.3:44529(tcp)  nf_ip_checksum
0xffff8aecd018f600 0   ~wrapped:3479002 4026531833 0             br0:2       0x0800 1500  60    10.101.2.10:8123->10.101.2.3:44529(tcp)  __inet_lookup_listener
0xffff8aecd018f600 0   ~wrapped:3479002 4026531833 0             br0:2       0x0800 1500  60    10.101.2.10:8123->10.101.2.3:44529(tcp)  inet_lhash2_lookup
0xffff8aecd018f600 0   ~wrapped:3479002 4026531833 0             br0:2       0x0800 1500  60    10.101.2.10:8123->10.101.2.3:44529(tcp)  inet_lhash2_lookup
0xffff8aecd018f600 0   ~wrapped:3479002 4026531833 0           vnet1:858     0x0800 1500  60    10.101.2.10:8123->10.101.2.3:44529(tcp)  skb_push
0xffff8aecd018f600 0   ~wrapped:3479002 4026531833 0           vnet1:858     0x0800 1500  60    10.101.2.10:8123->10.101.2.3:44529(tcp)  nf_hook_slow
0xffff8aecd018f600 0   ~wrapped:3479002 4026531833 0             br0:2       0x0800 1500  60    10.101.2.10:8123->10.101.2.3:44529(tcp)  nf_hook_slow
0xffff8aecd018f600 0   ~wrapped:3479002 4026531833 0             br0:2       0x0800 1500  60    10.101.2.10:8123->10.101.2.3:44529(tcp)  netif_receive_skb
0xffff8aecd018f600 0   ~wrapped:3479002 4026531833 0             br0:2       0x0800 1500  60    10.101.2.10:8123->10.101.2.3:44529(tcp)  __netif_receive_skb
0xffff8aecd018f600 0   ~wrapped:3479002 4026531833 0             br0:2       0x0800 1500  60    10.101.2.10:8123->10.101.2.3:44529(tcp)  __netif_receive_skb_one_core
0xffff8aecd018f600 0   ~wrapped:3479002 4026531833 0             br0:2       0x0800 1500  60    10.101.2.10:8123->10.101.2.3:44529(tcp)  qdisc_pkt_len_segs_init
0xffff8aecd018f600 0   ~wrapped:3479002 4026531833 0             br0:2       0x0800 1500  74    10.101.2.10:8123->10.101.2.3:44529(tcp)  skb_ensure_writable
0xffff8aecd018f600 0   ~wrapped:3479002 4026531833 0             br0:2       0x0800 1500  74    10.101.2.10:8123->10.101.2.3:44529(tcp)  skb_ensure_writable
0xffff8aecd018f600 0   ~wrapped:3479002 4026531833 0             br0:2       0x0800 1500  74    10.101.2.10:8123->10.42.0.176:44529(tcp) skb_ensure_writable
```

**Comment by youngnick** [comment]
Gateway API is absolutely not intended to be used to forward to manual EndpointSlices, which is why this hasn't been tested and doesn't work. That's to prevent this CVE: https://github.com/kubernetes/kubernetes/issues/103675 in upstream Kubernetes.

That said, I'm not really sure why this doesn't work, I don't think we are explicitly blocking it, just that we have never checked it, because of the above.

As @squeed says, there is an argument that this might be okay for host-network pods (although I should note that also falls foul of the CVE above).

tbh, I'd recommend working around this somehow in the short term.

In the longer term, there is a [Backend Resource](https://gateway-api.sigs.k8s.io/geps/gep-4894/) being developed upstream which will allow doing this by hostname explicitly (at the cost that you're accepting the security risk).

**Comment by deanqx** [comment]
Thank you for your reply and the hint about the security risk. For now I will continue to use a pod as proxy out of the cluster.
