### ISSUE TITLE
KubeProxy Replacement Healthz Port doesn't work on IPv6 (it does work in IPv4)

### ISSUE THREAD

**Issue by aojea** [cilium/cilium#22164]
### Is there an existing issue for this?

- [X] I have searched the existing issues

### What happened?

1. GKE
2. Create IPv4 and IPv6 LoadBalancer

```
cilum service list
18   10.1.0.80:80                             LoadBalancer   1 => 10.196.1.3:80                
                                                             2 => 10.196.6.3:80                
                                                             3 => 10.196.3.2:80                
19   [fd20:219:ec94::36:0:0]:80               LoadBalancer   1 => [fd20:219:ec94::2e:0:3]:80   
                                                             2 => [fd20:219:ec94::33:0:3]:80   
                                                             3 => [fd20:219:ec94::30:0:2]:80  
```

4. Loadbalancer healthchecks targets the Loadbalancer IP on the Node and the kube-proxy /healthz endpoint on port 10256 (by default)
6. It works for IPv4
```
# tcpdump -c 5 -ni eth0 host 10.1.0.80 and tcp port 10256
tcpdump: verbose output suppressed, use -v or -vv for full protocol decode
listening on eth0, link-type EN10MB (Ethernet), capture size 262144 bytes
23:45:37.311867 IP 130.211.0.213.32768 > 10.1.0.80.10256: Flags [S], seq 1970396132, win 65535, options [mss 1420,sackOK,TS val 3321840059 ecr 0,nop,wscale 8], length 0
23:45:37.311971 IP 10.1.0.80.10256 > 130.211.0.213.32768: Flags [S.], seq 1703497394, ack 1970396133, win 43648, options [mss 1420,sackOK,TS val 1373561591 ecr 3321840059,nop,wscale 7], length 0
23:45:37.312506 IP 130.211.0.213.32768 > 10.1.0.80.10256: Flags [.], ack 1, win 256, options [nop,nop,TS val 3321840061 ecr 1373561591], length 0
23:45:37.312698 IP 130.211.0.213.32768 > 10.1.0.80.10256: Flags [P.], seq 1:93, ack 1, win 256, options [nop,nop,TS val 3321840061 ecr 1373561591], length 92
23:45:37.312712 IP 10.1.0.80.10256 > 130.211.0.213.32768: Flags [.], ack 93, win 341, options [nop,nop,TS val 1373561591 ecr 3321840061], length 0
```
8. It does not work for IPv6, packets enter the host
```
tcpdump -c 5 -ni eth0 host fd20:219:ec94::36:0:0 and tcp port 10256
tcpdump: verbose output suppressed, use -v or -vv for full protocol decode
listening on eth0, link-type EN10MB (Ethernet), capture size 262144 bytes
23:46:20.063898 IP6 2600:2d00:1:b029:0:2b:3a:600b.32780 > fd20:219:ec94::36:0:0.10256: Flags [S], seq 3550670051, win 65535, options [mss 1400,sackOK,TS val 4147719513 ecr 0,nop,wscale 8], length 0
23:46:24.440713 IP6 2600:2d00:1:b029:0:2b:3a:6001.32768 > fd20:219:ec94::36:0:0.10256: Flags [S], seq 640245957, win 65535, options [mss 1400,sackOK,TS val 517378067 ecr 0,nop,wscale 8], length 0
23:46:25.460589 IP6 2600:2d00:1:b029:0:2b:3a:6004.40148 > fd20:219:ec94::36:0:0.10256: Flags [S], seq 2807822967, win 65535, options [mss 1400,sackOK,TS val 549939819 ecr 0,nop,wscale 8], length 0
23:46:28.064340 IP6 2600:2d00:1:b029:0:2b:3a:600b.41070 > fd20:219:ec94::36:0:0.10256: Flags [S], seq 1229939710, win 65535, options [mss 1400,sackOK,TS val 4147727514 ecr 0,nop,wscale 8], length 0
23:46:32.440720 IP6 2600:2d00:1:b029:0:2b:3a:6001.32768 > fd20:219:ec94::36:0:0.10256: Flags [S], seq 765246075, win 65535, options [mss 1400,sackOK,TS val 517386067 ecr 0,nop,wscale 8], length 0
```

but is not redirected, not familiar with cilium, maybe this trace can help ?

```
0xffff90408780fd00      1        [<empty>]              __kfree_skb 130.211.0.59:37568->10.1.0.82:10256(tcp)
2022/11/14 23:48:34 Perf event ring buffer full, dropped 1 samples
0xffff9040ad08d700      1        [<empty>]         tcp6_gro_receive [2600:2d00:1:b029:0:2b:3a:600b]:41012->[fd20:219:ec94::38:0:0]:10256(tcp)
0xffff9040ad08d700      1        [<empty>]          tcp_gro_receive [2600:2d00:1:b029:0:2b:3a:600b]:41012->[fd20:219:ec94::38:0:0]:10256(tcp)
0xffff9040ad08d700      1        [<empty>]             tcf_classify [2600:2d00:1:b029:0:2b:3a:600b]:41012->[fd20:219:ec94::38:0:0]:10256(tcp)
0xffff9040ad08d700      1        [<empty>]      skb_ensure_writable [2600:2d00:1:b029:0:2b:3a:600b]:41012->[fd20:219:ec94::38:0:0]:10256(tcp)
0xffff9040ad08d700      1        [<empty>]       nf_ct_frag6_gather [2600:2d00:1:b029:0:2b:3a:600b]:41012->[fd20:219:ec94::38:0:0]:10256(tcp)
0xffff9040ad08d700      1        [<empty>]            ip6t_do_table [2600:2d00:1:b029:0:2b:3a:600b]:41012->[fd20:219:ec94::38:0:0]:10256(tcp)
0xffff9040ad08d700      1        [<empty>]          nf_conntrack_in [2600:2d00:1:b029:0:2b:3a:600b]:41012->[fd20:219:ec94::38:0:0]:10256(tcp)
0xffff9040ad08d700      1        [<empty>]  nf_conntrack_tcp_packet [2600:2d00:1:b029:0:2b:3a:600b]:41012->[fd20:219:ec94::38:0:0]:10256(tcp)
0xffff9040ad08d700      1        [<empty>]              nf_checksum [2600:2d00:1:b029:0:2b:3a:600b]:41012->[fd20:219:ec94::38:0:0]:10256(tcp)
0xffff9040ad08d700      1        [<empty>]          nf_ip6_checksum [2600:2d00:1:b029:0:2b:3a:600b]:41012->[fd20:219:ec94::38:0:0]:10256(tcp)
0xffff9040ad08d700      1        [<empty>]            ip6t_do_table [2600:2d00:1:b029:0:2b:3a:600b]:41012->[fd20:219:ec94::38:0:0]:10256(tcp)
0xffff9040ad08d700      1        [<empty>]             inet6_lookup [2600:2d00:1:b029:0:2b:3a:600b]:41012->[fd20:219:ec94::38:0:0]:10256(tcp)
0xffff9040ad08d700      1        [<empty>]    inet6_lookup_listener [2600:2d00:1:b029:0:2b:3a:600b]:41012->[fd20:219:ec94::38:0:0]:10256(tcp)
0xffff9040ad08d700      1        [<empty>]    reuseport_select_sock [2600:2d00:1:b029:0:2b:3a:600b]:41012->[fd20:219:ec94::38:0:0]:10256(tcp)
0xffff9040ad08d700      1        [<empty>]            ip6t_do_table [2600:2d00:1:b029:0:2b:3a:600b]:41012->[fd20:219:ec94::38:0:0]:10256(tcp)
0xffff9040ad08d700      1        [<empty>]       tcp_v6_early_demux [2600:2d00:1:b029:0:2b:3a:600b]:41012->[fd20:219:ec94::38:0:0]:10256(tcp)
0xffff9040ad08d700      1        [<empty>]          ip6_route_input [2600:2d00:1:b029:0:2b:3a:600b]:41012->[fd20:219:ec94::38:0:0]:10256(tcp)
0xffff9040ad08d700      1        [<empty>]             nf_hook_slow [2600:2d00:1:b029:0:2b:3a:600b]:41012->[fd20:219:ec94::38:0:0]:10256(tcp)
0xffff9040ad08d700      1        [<empty>]            ip6t_do_table [2600:2d00:1:b029:0:2b:3a:600b]:41012->[fd20:219:ec94::38:0:0]:10256(tcp)
0xffff9040ad08d700      1        [<empty>]            ip6t_do_table [2600:2d00:1:b029:0:2b:3a:600b]:41012->[fd20:219:ec94::38:0:0]:10256(tcp)
0xffff9040ad08d700      1        [<empty>]         kfree_skb_reason [2600:2d00:1:b029:0:2b:3a:600b]:41012->[fd20:219:ec94::38:0:0]:10256(tcp)
0xffff9040ad08d700      1        [<empty>]              __kfree_skb [2600:2d00:1:b029:0:2b:3a:600b]:41012->[fd20:219:ec94::38:0:0]:10256(tcp)
0xffff9040ad08d700      1        [<empty>]   skb_release_head_state [2600:2d00:1:b029:0:2b:3a:600b]:41012->[fd20:219:ec94::38:0:0]:10256(tcp)
```

curl to the endpoint in ipv6 works locally

```
 curl -6 [fd20:219:ec94::36:0:0]:10256/healthz
{"lastUpdated": "2022-11-14 23:59:40.537436271 +0000 UTC m=+545168.909632092","currentTime": "2022-11-14 23:59:40.537436271 +0000 UTC m=+545168.909632092"
```

### Cilium Version

cilium version
Client: 1.11.9 1be589d924 2022-10-03T21:37:49+00:00 go version go1.17.13 linux/amd64
Daemon: 1.11.9 1be589d924 2022-10-03T21:37:49+00:00 go version go1.17.13 linux/amd64

### Kernel Version

Linux ... 5.15.65+ #1 SMP Sat Oct 29 09:33:11 UTC 2022 x86_64 x86_64 x86_64 GNU/Linux

### Kubernetes Version

v1.25

### Code of Conduct

- [X] I agree to follow this project's Code of Conduct

**Comment by brb** [comment]
Thanks for the issue! Can you run `ip6tables-save -c` and `ip -o a`?

**Comment by aojea** [comment]
```
# Generated by ip6tables-save v1.8.5 on Tue Nov 15 14:47:04 2022
*raw
:PREROUTING ACCEPT [652205:848705541]
:OUTPUT ACCEPT [208269:812870211]
:CILIUM_OUTPUT_raw - [0:0]
:CILIUM_PRE_raw - [0:0]
-A PREROUTING -m comment --comment "cilium-feeder: CILIUM_PRE_raw" -j CILIUM_PRE_raw
-A OUTPUT -m comment --comment "cilium-feeder: CILIUM_OUTPUT_raw" -j CILIUM_OUTPUT_raw
-A CILIUM_OUTPUT_raw -m mark --mark 0xa00/0xfffffeff -m comment --comment "cilium: NOTRACK for proxy return traffic" -j CT --notrack
-A CILIUM_PRE_raw -m mark --mark 0x200/0xf00 -m comment --comment "cilium: NOTRACK for proxy traffic" -j CT --notrack
COMMIT
# Completed on Tue Nov 15 14:47:04 2022
# Generated by ip6tables-save v1.8.5 on Tue Nov 15 14:47:04 2022
*nat
:PREROUTING ACCEPT [59529:4762456]
:INPUT ACCEPT [2:296]
:OUTPUT ACCEPT [2:296]
:POSTROUTING ACCEPT [2:296]
:CILIUM_POST_nat - [0:0]
:CNI-DN-252d899b2bf8c8f511919 - [0:0]
:CNI-HOSTPORT-DNAT - [0:0]
:CNI-HOSTPORT-MASQ - [0:0]
:CNI-HOSTPORT-SETMARK - [0:0]
:KUBE-KUBELET-CANARY - [0:0]
:KUBE-MARK-DROP - [0:0]
:KUBE-MARK-MASQ - [0:0]
:KUBE-POSTROUTING - [0:0]
-A PREROUTING -m addrtype --dst-type LOCAL -j CNI-HOSTPORT-DNAT
-A OUTPUT -m addrtype --dst-type LOCAL -j CNI-HOSTPORT-DNAT
-A POSTROUTING -m comment --comment "CNI portfwd requiring masquerade" -j CNI-HOSTPORT-MASQ
-A POSTROUTING -m comment --comment "cilium-feeder: CILIUM_POST_nat" -j CILIUM_POST_nat
-A POSTROUTING -m comment --comment "kubernetes postrouting rules" -j KUBE-POSTROUTING
-A CNI-DN-252d899b2bf8c8f511919 -s fd20:219:ec94::2f:0:3/128 -p tcp -m tcp --dport 80 -j CNI-HOSTPORT-SETMARK
-A CNI-DN-252d899b2bf8c8f511919 -p tcp -m tcp --dport 80 -j DNAT --to-destination [fd20:219:ec94::2f:0:3]:80
-A CNI-HOSTPORT-DNAT -p tcp -m comment --comment "dnat name: \"gke-pod-network\" id: \"caa01384a2aa05119b97be9df5b85f973f1d7d829a1bbd5edf0020b5576fd532\"" -m multiport --dports 80 -j CNI-DN-252d899b2bf8c8f511919
-A CNI-HOSTPORT-MASQ -m mark --mark 0x2000/0x2000 -j MASQUERADE
-A CNI-HOSTPORT-SETMARK -m comment --comment "CNI portfwd masquerade mark" -j MARK --set-xmark 0x2000/0x2000
-A KUBE-MARK-DROP -j MARK --set-xmark 0x8000/0x8000
-A KUBE-MARK-MASQ -j MARK --set-xmark 0x4000/0x4000
-A KUBE-POSTROUTING -m mark ! --mark 0x4000/0x4000 -j RETURN
-A KUBE-POSTROUTING -j MARK --set-xmark 0x4000/0x0
-A KUBE-POSTROUTING -m comment --comment "kubernetes service traffic requiring SNAT" -j MASQUERADE --random-fully
COMMIT
# Completed on Tue Nov 15 14:47:04 2022
# Generated by ip6tables-save v1.8.5 on Tue Nov 15 14:47:04 2022
*mangle
:PREROUTING ACCEPT [652205:848705541]
:INPUT ACCEPT [652193:848704485]
:FORWARD ACCEPT [0:0]
:OUTPUT ACCEPT [208269:812870211]
:POSTROUTING ACCEPT [208269:812870211]
:CILIUM_PRE_mangle - [0:0]
:KUBE-IPTABLES-HINT - [0:0]
:KUBE-KUBELET-CANARY - [0:0]
-A PREROUTING -m comment --comment "cilium-feeder: CILIUM_PRE_mangle" -j CILIUM_PRE_mangle
-A CILIUM_PRE_mangle -m socket --transparent -m comment --comment "cilium: any->pod redirect proxied traffic to host proxy" -j MARK --set-xmark 0x200/0xffffffff
-A CILIUM_PRE_mangle -p tcp -m mark --mark 0xad9e0200 -m comment --comment "cilium: TPROXY to host cilium-dns-egress proxy" -j TPROXY --on-port 40621 --on-ip :: --tproxy-mark 0x200/0xffffffff
-A CILIUM_PRE_mangle -p udp -m mark --mark 0xad9e0200 -m comment --comment "cilium: TPROXY to host cilium-dns-egress proxy" -j TPROXY --on-port 40621 --on-ip :: --tproxy-mark 0x200/0xffffffff
COMMIT
# Completed on Tue Nov 15 14:47:04 2022
# Generated by ip6tables-save v1.8.5 on Tue Nov 15 14:47:04 2022
*filter
:INPUT DROP [423830:33906400]
:FORWARD DROP [0:0]
:OUTPUT DROP [0:0]
:CILIUM_FORWARD - [0:0]
:CILIUM_INPUT - [0:0]
:CILIUM_OUTPUT - [0:0]
:KUBE-FIREWALL - [0:0]
:KUBE-KUBELET-CANARY - [0:0]
-A INPUT -m comment --comment "cilium-feeder: CILIUM_INPUT" -j CILIUM_INPUT
-A INPUT -m state --state RELATED,ESTABLISHED -j ACCEPT
-A INPUT -p udp -m udp --dport 546 -j ACCEPT
-A INPUT -p ipv6-icmp -j ACCEPT
-A INPUT -i lo -j ACCEPT
-A INPUT -p ipv6-icmp -j ACCEPT
-A INPUT -m state --state RELATED,ESTABLISHED -j ACCEPT
-A INPUT -p udp -m udp --dport 546 -j ACCEPT
-A INPUT -p tcp -m tcp --dport 22 -j ACCEPT
-A FORWARD -m comment --comment "cilium-feeder: CILIUM_FORWARD" -j CILIUM_FORWARD
-A FORWARD -p tcp -j ACCEPT
-A FORWARD -p udp -j ACCEPT
-A FORWARD -p ipv6-icmp -j ACCEPT
-A FORWARD -p sctp -j ACCEPT
-A OUTPUT -m comment --comment "cilium-feeder: CILIUM_OUTPUT" -j CILIUM_OUTPUT
-A OUTPUT -m state --state NEW,RELATED,ESTABLISHED -j ACCEPT
-A OUTPUT -p ipv6-icmp -j ACCEPT
-A OUTPUT -o lo -j ACCEPT
-A OUTPUT -p ipv6-icmp -j ACCEPT
-A OUTPUT -m state --state NEW,RELATED,ESTABLISHED -j ACCEPT
-A CILIUM_FORWARD -o cilium_host -m comment --comment "cilium: any->cluster on cilium_host forward accept" -j ACCEPT
-A CILIUM_FORWARD -i cilium_host -m comment --comment "cilium: cluster->any on cilium_host forward accept (nodeport)" -j ACCEPT
-A CILIUM_FORWARD -i lxc+ -m comment --comment "cilium: cluster->any on lxc+ forward accept" -j ACCEPT
-A CILIUM_FORWARD -i cilium_net -m comment --comment "cilium: cluster->any on cilium_net forward accept (nodeport)" -j ACCEPT
-A CILIUM_FORWARD -o lxc+ -m comment --comment "cilium: any->cluster on lxc+ forward accept" -j ACCEPT
-A CILIUM_FORWARD -i lxc+ -m comment --comment "cilium: cluster->any on lxc+ forward accept (nodeport)" -j ACCEPT
-A CILIUM_INPUT -m mark --mark 0x200/0xf00 -m comment --comment "cilium: ACCEPT for proxy traffic" -j ACCEPT
-A CILIUM_OUTPUT -m mark --mark 0xa00/0xfffffeff -m comment --comment "cilium: ACCEPT for proxy return traffic" -j ACCEPT
-A CILIUM_OUTPUT -m mark ! --mark 0xe00/0xf00 -m mark ! --mark 0xd00/0xf00 -m mark ! --mark 0xa00/0xe00 -m comment --comment "cilium: host->any mark as from host" -j MARK --set-xmark 0xc00/0xf00
-A KUBE-FIREWALL -m comment --comment "kubernetes firewall for dropping marked packets" -m mark --mark 0x8000/0x8000 -j DROP
COMMIT
# Completed on Tue Nov 15 14:47:04 2022
``` 

```
ip -o a
1: lo    inet 127.0.0.1/8 scope host lo\       valid_lft forever preferred_lft forever
1: lo    inet6 ::1/128 scope host \       valid_lft forever preferred_lft forever
2: eth0    inet 10.1.0.73/32 metric 1024 scope global dynamic eth0\       valid_lft 49339sec preferred_lft 49339sec
2: eth0    inet6 fd20:219:ec94::2f:0:0/128 scope global dynamic noprefixroute \       valid_lft 58387sec preferred_lft 58387sec
2: eth0    inet6 fe80::4001:aff:fe01:49/64 scope link \       valid_lft forever preferred_lft forever
3: docker0    inet 169.254.123.1/24 brd 169.254.123.255 scope global docker0\       valid_lft forever preferred_lft forever
4: cilium_net    inet6 fe80::b89e:a2ff:fe81:ca97/64 scope link \       valid_lft forever preferred_lft forever
5: cilium_host    inet 169.254.4.6/32 scope link cilium_host\       valid_lft forever preferred_lft forever
5: cilium_host    inet6 fd20:219:ec94::2f:0:0/128 scope global \       valid_lft forever preferred_lft forever
5: cilium_host    inet6 fe80::e44e:a5ff:fefb:9d08/64 scope link \       valid_lft forever preferred_lft forever
6: gkeb1bc3ce4b73    inet 10.196.2.1/32 scope global gkeb1bc3ce4b73\       valid_lft forever preferred_lft forever
6: gkeb1bc3ce4b73    inet6 fd20:219:ec94::2f:0:1/128 scope global \       valid_lft forever preferred_lft forever
6: gkeb1bc3ce4b73    inet6 fe80::2cbe:a7ff:fe50:6fa3/64 scope link \       valid_lft forever preferred_lft forever
7: gke7d925220d7e    inet 10.196.2.1/32 scope global gke7d925220d7e\       valid_lft forever preferred_lft forever
7: gke7d925220d7e    inet6 fd20:219:ec94::2f:0:1/128 scope global \       valid_lft forever preferred_lft forever
7: gke7d925220d7e    inet6 fe80::3019:2ff:fe8d:73d0/64 scope link \       valid_lft forever preferred_lft forever
``

**Comment by brb** [comment]
What's the `ip6tables-save -c` output (spot the 6)?

**Comment by aojea** [comment]
ups
sorry
```
home/cilium# ip6tables-save -c
# Generated by ip6tables-save v1.8.4 on Tue Nov 15 15:00:06 2022
*raw
:PREROUTING ACCEPT [653107:849968621]
:OUTPUT ACCEPT [208550:814083099]
:CILIUM_OUTPUT_raw - [0:0]
:CILIUM_PRE_raw - [0:0]
[653107:849968621] -A PREROUTING -m comment --comment "cilium-feeder: CILIUM_PRE_raw" -j CILIUM_PRE_raw
[208550:814083099] -A OUTPUT -m comment --comment "cilium-feeder: CILIUM_OUTPUT_raw" -j CILIUM_OUTPUT_raw
[0:0] -A CILIUM_OUTPUT_raw -m mark --mark 0xa00/0xfffffeff -m comment --comment "cilium: NOTRACK for proxy return traffic" -j CT --notrack
[0:0] -A CILIUM_PRE_raw -m mark --mark 0x200/0xf00 -m comment --comment "cilium: NOTRACK for proxy traffic" -j CT --notrack
COMMIT
# Completed on Tue Nov 15 15:00:06 2022
# Generated by ip6tables-save v1.8.4 on Tue Nov 15 15:00:06 2022
*nat
:PREROUTING ACCEPT [60118:4809576]
:INPUT ACCEPT [2:296]
:OUTPUT ACCEPT [2:296]
:POSTROUTING ACCEPT [2:296]
:CILIUM_POST_nat - [0:0]
:CNI-DN-252d899b2bf8c8f511919 - [0:0]
:CNI-HOSTPORT-DNAT - [0:0]
:CNI-HOSTPORT-MASQ - [0:0]
:CNI-HOSTPORT-SETMARK - [0:0]
:KUBE-KUBELET-CANARY - [0:0]
:KUBE-MARK-DROP - [0:0]
:KUBE-MARK-MASQ - [0:0]
:KUBE-POSTROUTING - [0:0]
[60118:4809576] -A PREROUTING -m addrtype --dst-type LOCAL -j CNI-HOSTPORT-DNAT
[0:0] -A OUTPUT -m addrtype --dst-type LOCAL -j CNI-HOSTPORT-DNAT
[2:296] -A POSTROUTING -m comment --comment "CNI portfwd requiring masquerade" -j CNI-HOSTPORT-MASQ
[23:2792] -A POSTROUTING -m comment --comment "cilium-feeder: CILIUM_POST_nat" -j CILIUM_POST_nat
[24:2872] -A POSTROUTING -m comment --comment "kubernetes postrouting rules" -j KUBE-POSTROUTING
[0:0] -A CNI-DN-252d899b2bf8c8f511919 -s fd20:219:ec94::2f:0:3/128 -p tcp -m tcp --dport 80 -j CNI-HOSTPORT-SETMARK
[0:0] -A CNI-DN-252d899b2bf8c8f511919 -p tcp -m tcp --dport 80 -j DNAT --to-destination [fd20:219:ec94::2f:0:3]:80
[0:0] -A CNI-HOSTPORT-DNAT -p tcp -m comment --comment "dnat name: \"gke-pod-network\" id: \"caa01384a2aa05119b97be9df5b85f973f1d7d829a1bbd5edf0020b5576fd532\"" -m multiport --dports 80 -j CNI-DN-252d899b2bf8c8f511919
[0:0] -A CNI-HOSTPORT-MASQ -m mark --mark 0x2000/0x2000 -j MASQUERADE
[0:0] -A CNI-HOSTPORT-SETMARK -m comment --comment "CNI portfwd masquerade mark" -j MARK --set-xmark 0x2000/0x2000
[0:0] -A KUBE-MARK-DROP -j MARK --set-xmark 0x8000/0x8000
[0:0] -A KUBE-MARK-MASQ -j MARK --set-xmark 0x4000/0x4000
[24:2872] -A KUBE-POSTROUTING -m mark ! --mark 0x4000/0x4000 -j RETURN
[0:0] -A KUBE-POSTROUTING -j MARK --set-xmark 0x4000/0x0
[0:0] -A KUBE-POSTROUTING -m comment --comment "kubernetes service traffic requiring SNAT" -j MASQUERADE --random-fully
COMMIT
# Completed on Tue Nov 15 15:00:06 2022
# Generated by ip6tables-save v1.8.4 on Tue Nov 15 15:00:06 2022
*mangle
:PREROUTING ACCEPT [653107:849968621]
:INPUT ACCEPT [653095:849967565]
:FORWARD ACCEPT [0:0]
:OUTPUT ACCEPT [208550:814083099]
:POSTROUTING ACCEPT [208550:814083099]
:CILIUM_PRE_mangle - [0:0]
:KUBE-IPTABLES-HINT - [0:0]
:KUBE-KUBELET-CANARY - [0:0]
[653107:849968621] -A PREROUTING -m comment --comment "cilium-feeder: CILIUM_PRE_mangle" -j CILIUM_PRE_mangle
[0:0] -A CILIUM_PRE_mangle -m socket --transparent -m comment --comment "cilium: any->pod redirect proxied traffic to host proxy" -j MARK --set-xmark 0x200/0xffffffff
[0:0] -A CILIUM_PRE_mangle -p tcp -m mark --mark 0xad9e0200 -m comment --comment "cilium: TPROXY to host cilium-dns-egress proxy" -j TPROXY --on-port 40621 --on-ip :: --tproxy-mark 0x200/0xffffffff
[0:0] -A CILIUM_PRE_mangle -p udp -m mark --mark 0xad9e0200 -m comment --comment "cilium: TPROXY to host cilium-dns-egress proxy" -j TPROXY --on-port 40621 --on-ip :: --tproxy-mark 0x200/0xffffffff
COMMIT
# Completed on Tue Nov 15 15:00:06 2022
# Generated by ip6tables-save v1.8.4 on Tue Nov 15 15:00:06 2022
*filter
:INPUT DROP [424419:33953520]
:FORWARD DROP [0:0]
:OUTPUT DROP [0:0]
:CILIUM_FORWARD - [0:0]
:CILIUM_INPUT - [0:0]
:CILIUM_OUTPUT - [0:0]
:KUBE-FIREWALL - [0:0]
:KUBE-KUBELET-CANARY - [0:0]
[653095:849967565] -A INPUT -m comment --comment "cilium-feeder: CILIUM_INPUT" -j CILIUM_INPUT
[195297:813188274] -A INPUT -m state --state RELATED,ESTABLISHED -j ACCEPT
[14:2072] -A INPUT -p udp -m udp --dport 546 -j ACCEPT
[33373:2887016] -A INPUT -p ipv6-icmp -j ACCEPT
[9:720] -A INPUT -i lo -j ACCEPT
[9:864] -A INPUT -p ipv6-icmp -j ACCEPT
[0:0] -A INPUT -m state --state RELATED,ESTABLISHED -j ACCEPT
[1:152] -A INPUT -p udp -m udp --dport 546 -j ACCEPT
[0:0] -A INPUT -p tcp -m tcp --dport 22 -j ACCEPT
[0:0] -A FORWARD -m comment --comment "cilium-feeder: CILIUM_FORWARD" -j CILIUM_FORWARD
[0:0] -A FORWARD -p tcp -j ACCEPT
[0:0] -A FORWARD -p udp -j ACCEPT
[0:0] -A FORWARD -p ipv6-icmp -j ACCEPT
[0:0] -A FORWARD -p sctp -j ACCEPT
[208550:814083099] -A OUTPUT -m comment --comment "cilium-feeder: CILIUM_OUTPUT" -j CILIUM_OUTPUT
[195322:813190444] -A OUTPUT -m state --state NEW,RELATED,ESTABLISHED -j ACCEPT
[13257:957664] -A OUTPUT -p ipv6-icmp -j ACCEPT
[0:0] -A OUTPUT -o lo -j ACCEPT
[6:472] -A OUTPUT -p ipv6-icmp -j ACCEPT
[1:110] -A OUTPUT -m state --state NEW,RELATED,ESTABLISHED -j ACCEPT
[0:0] -A CILIUM_FORWARD -o cilium_host -m comment --comment "cilium: any->cluster on cilium_host forward accept" -j ACCEPT
[0:0] -A CILIUM_FORWARD -i cilium_host -m comment --comment "cilium: cluster->any on cilium_host forward accept (nodeport)" -j ACCEPT
[0:0] -A CILIUM_FORWARD -i lxc+ -m comment --comment "cilium: cluster->any on lxc+ forward accept" -j ACCEPT
[0:0] -A CILIUM_FORWARD -i cilium_net -m comment --comment "cilium: cluster->any on cilium_net forward accept (nodeport)" -j ACCEPT
[0:0] -A CILIUM_FORWARD -o lxc+ -m comment --comment "cilium: any->cluster on lxc+ forward accept" -j ACCEPT
[0:0] -A CILIUM_FORWARD -i lxc+ -m comment --comment "cilium: cluster->any on lxc+ forward accept (nodeport)" -j ACCEPT
[0:0] -A CILIUM_INPUT -m mark --mark 0x200/0xf00 -m comment --comment "cilium: ACCEPT for proxy traffic" -j ACCEPT
[0:0] -A CILIUM_OUTPUT -m mark --mark 0xa00/0xfffffeff -m comment --comment "cilium: ACCEPT for proxy return traffic" -j ACCEPT
[208550:814083099] -A CILIUM_OUTPUT -m mark ! --mark 0xe00/0xf00 -m mark ! --mark 0xd00/0xf00 -m mark ! --mark 0xa00/0xe00 -m comment --comment "cilium: host->any mark as from host" -j MARK --set-xmark 0xc00/0xf00
[0:0] -A KUBE-FIREWALL -m comment --comment "kubernetes firewall for dropping marked packets" -m mark --mark 0x8000/0x8000 -j DROP
COMMIT
# Completed on Tue Nov 15 15:00:06 2022
```

**Comment by aojea** [comment]
at a certain scale we have also these problems

>   bpf-map-sync-cilium_lb6_services_v2   never          55s ago      241     11592 map sync errors   

@brb just some guidance, are there any steps I can use to pinpoint the problem or at least the part that can give you more info?

**Comment by brb** [comment]
The `pwru` trace suggest that the request is dropped by an iptables rule. In the case of IPv6, I see many drops by:
```
# Completed on Tue Nov 15 15:00:06 2022
# Generated by ip6tables-save v1.8.4 on Tue Nov 15 15:00:06 2022
*filter
:INPUT DROP [424419:33953520]
```

In the case of IPv4, you have the same `DROP` policy for the `filter` chain, but this should let the requests in:
```
[581669:566168098] -A INPUT -p tcp -j ACCEPT
```

Anyway, the usual way to access the kube-proxy's /healthz is to use a node IP instead of a service VIP. Or did you mean `--enable-health-check-nodeport`?

**Comment by brb** [comment]
> at a certain scale we have also these problems

>>    bpf-map-sync-cilium_lb6_services_v2 never 55s ago 241 11592 map sync errors

Do you have the affected cilium-agent log? The related BPF map might be full. Anyway, I'd suggest to open a separate issue.

**Comment by aojea** [comment]
> In the case of IPv4, you have the same `DROP` policy for the `filter` chain, but this should let the requests in:

doh, now I'm embarrassed, so obvious , thanks 

> Anyway, the usual way to access the kube-proxy's /healthz is to use a node IP instead of a service VIP

yeah, I thought the same, but  I'm still ramping up in GKE, it seems is how it works in GKE, I double checked with the IPv4 one as you can see in the tcpdump of the issue description ...

> Do you have the affected cilium-agent log? The related BPF map might be full. Anyway, I'd suggest to open a separate issue.

my teammate @panslava pointed me to this https://docs.cilium.io/en/v1.12/concepts/ebpf/maps/ and we may be hitting some limit on this other environment, it has 5k nodes and lots of endpoints, disregard that comment then

Thanks for the help, I think we can close this, if we get blocked again we'll open a new one with more information
