### ISSUE TITLE
Cilium replies from wrong interface in multi interface setup

### ISSUE THREAD

**Issue by rivolity** [cilium/cilium#40521]
### Is there an existing issue for this?

- [x] I have searched the existing issues

### Version

equal or higher than v1.17.5 and lower than v1.18.0

### What happened?

I'm encountering an issue with Cilium (v1.17.5) involving multiple VLAN interfaces where BGP peering and L2 announcements work fine on main VLAN interface (eth0), but do not work correctly when switched to second VLAN interface (eth1).

✅ Expected Behavior
When the node is peered via BGP or announcing L2 via eth1, service traffic (e.g., LoadBalancer IPs) should be routed in and out of eth1.

❌ Actual Behavior
BGP peering on eth1 succeeds.
However, traffic destined for the LoadBalancer IP is routed out through eth0 instead of eth1.
This results in asymmetric routing and breaks connectivity from external sources.

🔍 Debugging Performed
Deployed an nginx service directly on the host, bound the config to 10.14.14.13 (IP of eth1). It is reachable from outside only via eth1, proving the routing is correct at the OS level.

BGP sessions established successfully via both interfaces (eth0 and eth1) depending on config.
When BGP or L2 announcement is enabled on eth1, advertised IP is accessible externally but return path is still via eth0.
When using BGP or L2 announcement with Peers from eth0, everything works fine with no issue.

🏔️ Inside the Cluster I can reach the LB exposed with no Issue (from all nodes).

🟢 Verification

```
➜  dev : cilium bgp peers
Node            Local AS   Peer AS   Peer Address   Session State   Uptime     Family         Received   Advertised
mgt-master-01   64522      64520     10.14.14.1     established     1h         ipv4/unicast   1          2    
mgt-master-02   64522      64520     10.14.14.1     established     1h         ipv4/unicast   1          2    
mgt-master-03   64522      64520     10.14.14.1     established     1h         ipv4/unicast   1          2    
mgt-worker-01   64522      64520     10.14.14.1     established     1h         ipv4/unicast   1          2    
mgt-worker-02   64522      64520     10.14.14.1     established     1h         ipv4/unicast   1          2    
mgt-worker-03   64522      64520     10.14.14.1     established     1h         ipv4/unicast   1          2   
```

All devices binded to cilium agent
```
➜  dev :  kubectl -n kube-system exec ds/cilium -- cilium-dbg shell -- db/show devices
Defaulted container "cilium-agent" out of: cilium-agent, config (init), mount-cgroup (init), apply-sysctl-overwrites (init), mount-bpf-fs (init), clean-cilium-state (init), install-cni-binaries (init)
Name           Index   Selected   Type     MTU     HWAddr              Flags                            Addresses
lo             1       false      device   65536                       up|loopback|running              127.0.0.1, ::1
eth0           2       true       device   1500    56:8e:bc:68:99:19   up|broadcast|multicast|running   10.13.13.12, fe80::548e:bcff:fe68:9919
eth1           3       true       device   1500    bc:24:11:6a:c6:d2   up|broadcast|multicast|running   10.14.14.12, fe80::bc61:b189:9f59:4ebe
cilium_net     4       false      veth     1500    ea:83:bc:91:63:11   up|broadcast|multicast|running   fe80::e883:bcff:fe91:6311
cilium_host    5       false      veth     1500    22:6a:2f:4d:8e:0c   up|broadcast|multicast|running   fe80::206a:2fff:fe4d:8e0c, 10.42.6.49
cilium_vxlan   6       false      vxlan    1500    3e:e4:46:98:15:da   up|broadcast|multicast|running   fe80::3ce4:46ff:fe98:15da
lxc_health     8       false      veth     1500    fe:e7:32:4c:15:f8   up|broadcast|multicast|running   fe80::fce7:32ff:fe4c:15f8
```

Cilient agent Capabilities
```
➜  dev : k -n kube-system get ds/cilium -o jsonpath='{.spec.template.spec.containers[?(@.name=="cilium-agent")].securityContext.capabilities.add}'
["CHOWN","KILL","NET_ADMIN","NET_RAW","IPC_LOCK","SYS_MODULE","SYS_ADMIN","SYS_RESOURCE","DAC_OVERRIDE","FOWNER","SETGID","SETUID","CAP_NET_BIND_SERVICE"]
```

Service LoadBalancer Exposed
```
➜  dev: k get svc -n nginx
NAME                TYPE           CLUSTER-IP      EXTERNAL-IP   PORT(S)          AGE
cilium-gateway-gw   LoadBalancer   10.43.157.111   10.16.16.18   7443:31652/TCP   8s
nginx               LoadBalancer   10.43.222.40    10.16.16.17   7443:31024/TCP   21h
nginx-internal      ClusterIP      10.43.109.79    <none>        80/TCP           21h
```

BGP configuration
```
apiVersion: cilium.io/v2alpha1
kind: CiliumBGPClusterConfig
metadata:
  name: cilium-bgp
spec:
  nodeSelector:
    matchLabels:
      kubernetes.io/os: linux
  bgpInstances:
  - name: "bgp-k8s-cilium"
    localASN: 64522
    peers:
    - name: "pfsense-peer"
      peerASN: 64520
      peerAddress: '10.14.14.1'
      peerConfigRef:
        name: "cilium-peer"
---
apiVersion: cilium.io/v2alpha1
kind: CiliumBGPPeerConfig
metadata:
  name: cilium-peer
spec:
  transport:
    peerPort: 179
  timers:
    holdTimeSeconds: 180
    keepAliveTimeSeconds: 60
    connectRetryTimeSeconds: 5
  gracefulRestart:
    enabled: true
    restartTimeSeconds: 15
  families:
    - afi: ipv4
      safi: unicast
      advertisements:
        matchLabels:
          advertise: "bgp"
---
apiVersion: cilium.io/v2alpha1
kind: CiliumBGPAdvertisement
metadata:
  name: bgp-advertisements
  labels:
    advertise: bgp
spec:
  advertisements:
    - advertisementType: "Service"
      service:
        addresses:
          - LoadBalancerIP
          - ExternalIP
      selector:
        matchExpressions: #[]
          - {key: somekey, operator: NotIn, values: ['never-used-value']}
---
apiVersion: "cilium.io/v2alpha1"
kind: CiliumLoadBalancerIPPool
metadata:
  name: "default-pool"
spec:
  allowFirstLastIPs: "No"
  blocks:
    - cidr: "10.16.16.16/28"
```

L2 Configuration
```
apiVersion: "cilium.io/v2alpha1"
kind: CiliumLoadBalancerIPPool
metadata:
  name: "l2-pool"
spec:
  allowFirstLastIPs: "No"
  blocks:
    # - cidr: "10.14.14.40/29"
    - start: "10.14.14.40"
      stop: "10.14.14.46"
---
apiVersion: "cilium.io/v2alpha1"
kind: CiliumL2AnnouncementPolicy
metadata:
  name: l2policy
spec:
  externalIPs: true
  loadBalancerIPs: true
  interfaces:
  - eth1
  serviceSelector:
    matchExpressions:
      # All services
      - {key: somekey, operator: NotIn, values: ['never-used-value']}
  nodeSelector:
    matchLabels:
      kubernetes.io/os: linux
```

🎯 Server config
```
➜  dev: ip -4 a
1: lo: <LOOPBACK,UP,LOWER_UP> mtu 65536 qdisc noqueue state UNKNOWN group default qlen 1000
    inet 127.0.0.1/8 scope host lo
      valid_lft forever preferred_lft forever
2: eth0: <BROADCAST,MULTICAST,UP,LOWER_UP> mtu 1500 qdisc fq_codel state UP group default qlen 1000
    altname enp0s18
    altname ens18
    inet 10.13.13.10/24 brd 10.13.13.255 scope global dynamic noprefixroute eth0
      valid_lft 3943sec preferred_lft 3943sec
3: eth1: <BROADCAST,MULTICAST,UP,LOWER_UP> mtu 1500 qdisc fq_codel state UP group default qlen 1000
    altname enp0s19
    altname ens19
    inet 10.14.14.10/24 brd 10.14.14.255 scope global dynamic noprefixroute eth1
      valid_lft 3943sec preferred_lft 3943sec
5: cilium_host@cilium_net: <BROADCAST,MULTICAST,NOARP,UP,LOWER_UP> mtu 1500 qdisc noqueue state UP group default qlen 1000
    inet 10.42.0.185/32 scope global cilium_host
      valid_lft forever preferred_lft forever
```

Route
```
➜  dev: ip route
default via 10.13.13.1 dev eth0 proto dhcp src 10.13.13.10 metric 100 
10.13.13.0/24 dev eth0 proto kernel scope link src 10.13.13.10 metric 100 
10.14.14.0/24 dev eth1 proto kernel scope link src 10.14.14.10 metric 101 
10.42.0.0/24 via 10.42.0.185 dev cilium_host proto kernel src 10.42.0.185 
10.42.0.185 dev cilium_host proto kernel scope link 
10.42.1.0/24 via 10.42.0.185 dev cilium_host proto kernel src 10.42.0.185 mtu 1450 
10.42.2.0/24 via 10.42.0.185 dev cilium_host proto kernel src 10.42.0.185 mtu 1450 
10.42.4.0/24 via 10.42.0.185 dev cilium_host proto kernel src 10.42.0.185 mtu 1450 
10.42.5.0/24 via 10.42.0.185 dev cilium_host proto kernel src 10.42.0.185 mtu 1450 
10.42.6.0/24 via 10.42.0.185 dev cilium_host proto kernel src 10.42.0.185 mtu 1450 
```

rule used for traffic
```
nmcli connection modify "Wired connection 1" \
    connection.id vlan14 \
    ipv4.never-default true \
    +ipv4.routes "0.0.0.0/0 10.14.14.1 table=101" \
    +ipv4.routing-rules "priority 100 from 10.14.14.20 to 10.14.14.0/24 table main" \
    +ipv4.routing-rules "priority 101 from 10.14.14.20 table 101"
sudo nmcli connection down "vlan14" && sudo nmcli connection up "vlan14"
```

masquerading devices
```
Masquerading: BPF [eth0, eth1] 10.42.6.0/24 [IPv4: Enabled, IPv6: Disabled]
```

### How can we reproduce the issue?

1. Install cilium with Helm
2. use BGP on a second interface
3. expose a service of type LB - which will use an IP from the IpPool of BGP
4. test accessing the IP of the LB from outside the cluster

### Cilium Version

```
cilium-cli: v0.16.18 compiled with go1.23.1 on linux/amd64
cilium image (default): v1.16.1
cilium image (stable): v1.17.5
cilium image (running): 1.17.5
```

### Kernel Version

Linux rke-worker-node-01 5.14.0-427.42.1.el9_4.x86_64 #1 SMP PREEMPT_DYNAMIC Fri Oct 18 14:35:40 EDT 2024 x86_64 x86_64 x86_64 GNU/Linux

### Kubernetes Version

```
Client Version: v1.25.4
Kustomize Version: v4.5.7
Server Version: v1.32.4+rke2r1
```

### Sysdump

[cilium-sysdump-20250715-003454.zip](https://github.com/user-attachments/files/21223219/cilium-sysdump-20250715-003454.zip)

### Relevant log output

```shell
--------------------------------------------------------------------------------------------
Pwru dump from the worker receiving traffic (10.17.17.8 is the address from where i test the LB).
--------------------------------------------------------------------------------------------
➜  dev: pwru 'src host 10.17.17.8' --output-json
2025/07/14 18:45:37 Attaching kprobes (via kprobe-multi)...
1541 / 1541 [------------------------------------------------------------------------------------------------------------------------------------------] 100.00% ? p/s2025/07/14 18:45:37 Attached (ignored 0)
2025/07/14 18:45:37 Listening for events..
{"skb":"0xffff8f084f448b00","cpu":1,"process":"<empty>:0","func":"inet_gro_receive","netns":4026531840,"iface":"eth1:3","proto":2048,"mtu":1500,"len":60,"tuple":{"saddr":"10.17.17.8","daddr":"10.16.16.17","sport":37950,"dport":7443,"proto":6}}
{"skb":"0xffff8f084f448b00","cpu":1,"process":"<empty>:0","func":"tcp4_gro_receive","netns":4026531840,"iface":"eth1:3","proto":2048,"mtu":1500,"len":60,"tuple":{"saddr":"10.17.17.8","daddr":"10.16.16.17","sport":37950,"dport":7443,"proto":6}}
{"skb":"0xffff8f084f448b00","cpu":1,"process":"<empty>:0","func":"tcp_gro_receive","netns":4026531840,"iface":"eth1:3","proto":2048,"mtu":1500,"len":60,"tuple":{"saddr":"10.17.17.8","daddr":"10.16.16.17","sport":37950,"dport":7443,"proto":6}}
{"skb":"0xffff8f084f448b00","cpu":1,"process":"<empty>:0","func":"skb_defer_rx_timestamp","netns":4026531840,"iface":"eth1:3","proto":2048,"mtu":1500,"len":60,"tuple":{"saddr":"10.17.17.8","daddr":"10.16.16.17","sport":37950,"dport":7443,"proto":6}}
{"skb":"0xffff8f084f448b00","cpu":1,"process":"<empty>:0","func":"skb_ensure_writable","netns":4026531840,"iface":"eth1:3","proto":2048,"mtu":1500,"len":74,"tuple":{"saddr":"10.17.17.8","daddr":"10.16.16.17","sport":37950,"dport":7443,"proto":6}}
{"skb":"0xffff8f084f448b00","cpu":1,"process":"<empty>:0","func":"skb_ensure_writable","netns":4026531840,"iface":"eth1:3","proto":2048,"mtu":1500,"len":74,"tuple":{"saddr":"10.17.17.8","daddr":"10.16.16.17","sport":37950,"dport":7443,"proto":6}}
{"skb":"0xffff8f084f448b00","cpu":1,"process":"<empty>:0","func":"skb_ensure_writable","netns":4026531840,"iface":"eth1:3","proto":2048,"mtu":1500,"len":74,"tuple":{"saddr":"10.17.17.8","daddr":"10.42.4.193","sport":37950,"dport":7443,"proto":6}}
{"skb":"0xffff8f084f448b00","cpu":1,"process":"<empty>:0","func":"skb_ensure_writable","netns":4026531840,"iface":"eth1:3","proto":2048,"mtu":1500,"len":74,"tuple":{"saddr":"10.17.17.8","daddr":"10.42.4.193","sport":37950,"dport":7443,"proto":6}}
{"skb":"0xffff8f084f448b00","cpu":1,"process":"<empty>:0","func":"inet_proto_csum_replace_by_diff","netns":4026531840,"iface":"eth1:3","proto":2048,"mtu":1500,"len":74,"tuple":{"saddr":"10.17.17.8","daddr":"10.42.4.193","sport":37950,"dport":7443,"proto":6}}
{"skb":"0xffff8f084f448b00","cpu":1,"process":"<empty>:0","func":"skb_ensure_writable","netns":4026531840,"iface":"eth1:3","proto":2048,"mtu":1500,"len":74,"tuple":{"saddr":"10.17.17.8","daddr":"10.42.4.193","sport":37950,"dport":7443,"proto":6}}
{"skb":"0xffff8f084f448b00","cpu":1,"process":"<empty>:0","func":"inet_proto_csum_replace4","netns":4026531840,"iface":"eth1:3","proto":2048,"mtu":1500,"len":74,"tuple":{"saddr":"10.17.17.8","daddr":"10.42.4.193","sport":37950,"dport":7443,"proto":6}}
{"skb":"0xffff8f084f448b00","cpu":1,"process":"<empty>:0","func":"skb_ensure_writable","netns":4026531840,"iface":"eth1:3","proto":2048,"mtu":1500,"len":74,"tuple":{"saddr":"10.17.17.8","daddr":"10.42.4.193","sport":37950,"dport":7443,"proto":6}}
{"skb":"0xffff8f084f448b00","cpu":1,"process":"<empty>:0","func":"skb_ensure_writable","netns":4026531840,"iface":"eth1:3","proto":2048,"mtu":1500,"len":74,"tuple":{"saddr":"10.17.17.8","daddr":"10.42.4.193","sport":37950,"dport":80,"proto":6}}
{"skb":"0xffff8f084f448b00","cpu":1,"process":"<empty>:0","func":"skb_ensure_writable","netns":4026531840,"iface":"eth1:3","proto":2048,"mtu":1500,"len":74,"tuple":{"saddr":"10.17.17.8","daddr":"10.42.4.193","sport":37950,"dport":80,"proto":6}}
{"skb":"0xffff8f084f448b00","cpu":1,"process":"<empty>:0","func":"skb_ensure_writable","netns":4026531840,"iface":"eth1:3","proto":2048,"mtu":1500,"len":74,"tuple":{"saddr":"10.17.17.8","daddr":"10.42.4.193","sport":37950,"dport":80,"proto":6}}
{"skb":"0xffff8f084f448b00","cpu":1,"process":"<empty>:0","func":"skb_do_redirect","netns":4026531840,"iface":"eth1:3","proto":2048,"mtu":1500,"len":74,"tuple":{"saddr":"10.17.17.8","daddr":"10.42.4.193","sport":37950,"dport":80,"proto":6}}
{"skb":"0xffff8f084f448b00","cpu":1,"process":"<empty>:0","func":"ip_rcv_core","netns":4026532388,"iface":"eth0:9","proto":2048,"mtu":1500,"len":60,"tuple":{"saddr":"10.17.17.8","daddr":"10.42.4.193","sport":37950,"dport":80,"proto":6}}
{"skb":"0xffff8f084f448b00","cpu":1,"process":"<empty>:0","func":"tcp_v4_early_demux","netns":4026532388,"iface":"eth0:9","proto":2048,"mtu":1500,"len":60,"tuple":{"saddr":"10.17.17.8","daddr":"10.42.4.193","sport":37950,"dport":80,"proto":6}}
{"skb":"0xffff8f084f448b00","cpu":1,"process":"<empty>:0","func":"ip_route_input_noref","netns":4026532388,"iface":"eth0:9","proto":2048,"mtu":1500,"len":60,"tuple":{"saddr":"10.17.17.8","daddr":"10.42.4.193","sport":37950,"dport":80,"proto":6}}
{"skb":"0xffff8f084f448b00","cpu":1,"process":"<empty>:0","func":"ip_route_input_rcu","netns":4026532388,"iface":"eth0:9","proto":2048,"mtu":1500,"len":60,"tuple":{"saddr":"10.17.17.8","daddr":"10.42.4.193","sport":37950,"dport":80,"proto":6}}
{"skb":"0xffff8f084f448b00","cpu":1,"process":"<empty>:0","func":"ip_route_input_slow","netns":4026532388,"iface":"eth0:9","proto":2048,"mtu":1500,"len":60,"tuple":{"saddr":"10.17.17.8","daddr":"10.42.4.193","sport":37950,"dport":80,"proto":6}}
{"skb":"0xffff8f084f448b00","cpu":1,"process":"<empty>:0","func":"fib_validate_source","netns":4026532388,"iface":"eth0:9","proto":2048,"mtu":1500,"len":60,"tuple":{"saddr":"10.17.17.8","daddr":"10.42.4.193","sport":37950,"dport":80,"proto":6}}
{"skb":"0xffff8f084f448b00","cpu":1,"process":"<empty>:0","func":"__fib_validate_source","netns":4026532388,"iface":"eth0:9","proto":2048,"mtu":1500,"len":60,"tuple":{"saddr":"10.17.17.8","daddr":"10.42.4.193","sport":37950,"dport":80,"proto":6}}
{"skb":"0xffff8f084f448b00","cpu":1,"process":"<empty>:0","func":"ip_local_deliver","netns":4026532388,"iface":"eth0:9","proto":2048,"mtu":65536,"len":60,"tuple":{"saddr":"10.17.17.8","daddr":"10.42.4.193","sport":37950,"dport":80,"proto":6}}
{"skb":"0xffff8f084f448b00","cpu":1,"process":"<empty>:0","func":"ip_local_deliver_finish","netns":4026532388,"iface":"eth0:9","proto":2048,"mtu":65536,"len":60,"tuple":{"saddr":"10.17.17.8","daddr":"10.42.4.193","sport":37950,"dport":80,"proto":6}}
{"skb":"0xffff8f084f448b00","cpu":1,"process":"<empty>:0","func":"ip_protocol_deliver_rcu","netns":4026532388,"iface":"eth0:9","proto":2048,"mtu":65536,"len":40,"tuple":{"saddr":"10.17.17.8","daddr":"10.42.4.193","sport":37950,"dport":80,"proto":6}}
{"skb":"0xffff8f084f448b00","cpu":1,"process":"<empty>:0","func":"raw_local_deliver","netns":4026532388,"iface":"eth0:9","proto":2048,"mtu":65536,"len":40,"tuple":{"saddr":"10.17.17.8","daddr":"10.42.4.193","sport":37950,"dport":80,"proto":6}}
{"skb":"0xffff8f084f448b00","cpu":1,"process":"<empty>:0","func":"raw_v4_input","netns":4026532388,"iface":"eth0:9","proto":2048,"mtu":65536,"len":40,"tuple":{"saddr":"10.17.17.8","daddr":"10.42.4.193","sport":37950,"dport":80,"proto":6}}
{"skb":"0xffff8f084f448b00","cpu":1,"process":"<empty>:0","func":"tcp_v4_rcv","netns":4026532388,"iface":"eth0:9","proto":2048,"mtu":65536,"len":40,"tuple":{"saddr":"10.17.17.8","daddr":"10.42.4.193","sport":37950,"dport":80,"proto":6}}
{"skb":"0xffff8f084f448b00","cpu":1,"process":"<empty>:0","func":"__inet_lookup_listener","netns":4026532388,"iface":"eth0:9","proto":2048,"mtu":65536,"len":40,"tuple":{"saddr":"10.17.17.8","daddr":"10.42.4.193","sport":37950,"dport":80,"proto":6}}
{"skb":"0xffff8f084f448b00","cpu":1,"process":"<empty>:0","func":"inet_lhash2_lookup","netns":4026532388,"iface":"eth0:9","proto":2048,"mtu":65536,"len":40,"tuple":{"saddr":"10.17.17.8","daddr":"10.42.4.193","sport":37950,"dport":80,"proto":6}}
{"skb":"0xffff8f084f448b00","cpu":1,"process":"<empty>:0","func":"inet_lhash2_lookup","netns":4026532388,"iface":"eth0:9","proto":2048,"mtu":65536,"len":40,"tuple":{"saddr":"10.17.17.8","daddr":"10.42.4.193","sport":37950,"dport":80,"proto":6}}
{"skb":"0xffff8f084f448b00","cpu":1,"process":"<empty>:0","func":"tcp_filter","netns":4026532388,"iface":"eth0:9","proto":2048,"mtu":65536,"len":40,"tuple":{"saddr":"10.17.17.8","daddr":"10.42.4.193","sport":37950,"dport":80,"proto":6}}
{"skb":"0xffff8f084f448b00","cpu":1,"process":"<empty>:0","func":"sk_filter_trim_cap","netns":4026532388,"iface":"eth0:9","proto":2048,"mtu":65536,"len":40,"tuple":{"saddr":"10.17.17.8","daddr":"10.42.4.193","sport":37950,"dport":80,"proto":6}}
{"skb":"0xffff8f084f448b00","cpu":1,"process":"<empty>:0","func":"security_sock_rcv_skb","netns":4026532388,"iface":"eth0:9","proto":2048,"mtu":65536,"len":40,"tuple":{"saddr":"10.17.17.8","daddr":"10.42.4.193","sport":37950,"dport":80,"proto":6}}
{"skb":"0xffff8f084f448b00","cpu":1,"process":"<empty>:0","func":"selinux_socket_sock_rcv_skb","netns":4026532388,"iface":"eth0:9","proto":2048,"mtu":65536,"len":40,"tuple":{"saddr":"10.17.17.8","daddr":"10.42.4.193","sport":37950,"dport":80,"proto":6}}
{"skb":"0xffff8f084f448b00","cpu":1,"process":"<empty>:0","func":"bpf_lsm_socket_sock_rcv_skb","netns":4026532388,"iface":"eth0:9","proto":2048,"mtu":65536,"len":40,"tuple":{"saddr":"10.17.17.8","daddr":"10.42.4.193","sport":37950,"dport":80,"proto":6}}
{"skb":"0xffff8f084f448b00","cpu":1,"process":"<empty>:0","func":"tcp_v4_fill_cb","netns":4026532388,"iface":"eth0:9","proto":2048,"mtu":65536,"len":40,"tuple":{"saddr":"10.17.17.8","daddr":"10.42.4.193","sport":37950,"dport":80,"proto":6}}
{"skb":"0xffff8f084f448b00","cpu":1,"process":"<empty>:0","func":"tcp_v4_do_rcv","iface":"0","proto":2048,"mtu":65536,"len":40,"tuple":{"saddr":"10.17.17.8","daddr":"10.42.4.193","sport":37950,"dport":80,"proto":6}}
{"skb":"0xffff8f084f448b00","cpu":1,"process":"<empty>:0","func":"tcp_rcv_state_process","iface":"0","proto":2048,"mtu":65536,"len":40,"tuple":{"saddr":"10.17.17.8","daddr":"10.42.4.193","sport":37950,"dport":80,"proto":6}}
{"skb":"0xffff8f084f448b00","cpu":1,"process":"<empty>:0","func":"tcp_v4_conn_request","iface":"0","proto":2048,"mtu":65536,"len":40,"tuple":{"saddr":"10.17.17.8","daddr":"10.42.4.193","sport":37950,"dport":80,"proto":6}}
{"skb":"0xffff8f084f448b00","cpu":1,"process":"<empty>:0","func":"tcp_conn_request","iface":"0","proto":2048,"mtu":65536,"len":40,"tuple":{"saddr":"10.17.17.8","daddr":"10.42.4.193","sport":37950,"dport":80,"proto":6}}
{"skb":"0xffff8f084f448b00","cpu":1,"process":"<empty>:0","func":"tcp_v4_route_req","iface":"0","proto":2048,"mtu":65536,"len":40,"tuple":{"saddr":"10.17.17.8","daddr":"10.42.4.193","sport":37950,"dport":80,"proto":6}}
{"skb":"0xffff8f084f448b00","cpu":1,"process":"<empty>:0","func":"security_inet_conn_request","iface":"0","proto":2048,"mtu":65536,"len":40,"tuple":{"saddr":"10.17.17.8","daddr":"10.42.4.193","sport":37950,"dport":80,"proto":6}}
{"skb":"0xffff8f084f448b00","cpu":1,"process":"<empty>:0","func":"selinux_inet_conn_request","iface":"0","proto":2048,"mtu":65536,"len":40,"tuple":{"saddr":"10.17.17.8","daddr":"10.42.4.193","sport":37950,"dport":80,"proto":6}}
{"skb":"0xffff8f084f448b00","cpu":1,"process":"<empty>:0","func":"selinux_skb_peerlbl_sid","iface":"0","proto":2048,"mtu":65536,"len":40,"tuple":{"saddr":"10.17.17.8","daddr":"10.42.4.193","sport":37950,"dport":80,"proto":6}}
{"skb":"0xffff8f084f448b00","cpu":1,"process":"<empty>:0","func":"selinux_xfrm_skb_sid","iface":"0","proto":2048,"mtu":65536,"len":40,"tuple":{"saddr":"10.17.17.8","daddr":"10.42.4.193","sport":37950,"dport":80,"proto":6}}
{"skb":"0xffff8f084f448b00","cpu":1,"process":"<empty>:0","func":"selinux_xfrm_skb_sid_ingress","iface":"0","proto":2048,"mtu":65536,"len":40,"tuple":{"saddr":"10.17.17.8","daddr":"10.42.4.193","sport":37950,"dport":80,"proto":6}}
{"skb":"0xffff8f084f448b00","cpu":1,"process":"<empty>:0","func":"selinux_netlbl_skbuff_getsid","iface":"0","proto":2048,"mtu":65536,"len":40,"tuple":{"saddr":"10.17.17.8","daddr":"10.42.4.193","sport":37950,"dport":80,"proto":6}}
{"skb":"0xffff8f084f448b00","cpu":1,"process":"<empty>:0","func":"bpf_lsm_inet_conn_request","iface":"0","proto":2048,"mtu":65536,"len":40,"tuple":{"saddr":"10.17.17.8","daddr":"10.42.4.193","sport":37950,"dport":80,"proto":6}}
{"skb":"0xffff8f084f448b00","cpu":1,"process":"<empty>:0","func":"tcp_try_fastopen","iface":"0","proto":2048,"mtu":65536,"len":40,"tuple":{"saddr":"10.17.17.8","daddr":"10.42.4.193","sport":37950,"dport":80,"proto":6}}
{"skb":"0xffff8f084f448b00","cpu":1,"process":"<empty>:0","func":"consume_skb","iface":"0","proto":2048,"mtu":65536,"len":40,"tuple":{"saddr":"10.17.17.8","daddr":"10.42.4.193","sport":37950,"dport":80,"proto":6}}
{"skb":"0xffff8f084f448b00","cpu":1,"process":"<empty>:0","func":"skb_release_head_state","iface":"0","proto":2048,"mtu":65536,"len":40,"tuple":{"saddr":"10.17.17.8","daddr":"10.42.4.193","sport":37950,"dport":80,"proto":6}}
{"skb":"0xffff8f084f448b00","cpu":1,"process":"<empty>:0","func":"skb_release_data","iface":"0","proto":2048,"len":40,"tuple":{"saddr":"10.17.17.8","daddr":"10.42.4.193","sport":37950,"dport":80,"proto":6}}
{"skb":"0xffff8f084f448b00","cpu":1,"process":"<empty>:0","func":"skb_free_head","iface":"0","proto":2048,"len":40,"tuple":{"saddr":"10.17.17.8","daddr":"10.42.4.193","sport":37950,"dport":80,"proto":6}}
{"skb":"0xffff8f084f448b00","cpu":1,"process":"<empty>:0","func":"kfree_skbmem","iface":"0","proto":2048,"len":40,"tuple":{"saddr":"10.17.17.8","daddr":"10.42.4.193","sport":37950,"dport":80,"proto":6}}

--------------------------------------------------------------------------------------------
TCP Dump
--------------------------------------------------------------------------------------------
➜  dev: tcpdump -i any tcp and host 10.17.17.8
tcpdump: data link type LINUX_SLL2
dropped privs to tcpdump
tcpdump: verbose output suppressed, use -v[v]... for full protocol decode
listening on any, link-type LINUX_SLL2 (Linux cooked v2), snapshot length 262144 bytes
18:51:14.766595 eth1  In  IP 10.17.17.8.isnetserv > 10.16.16.17.oracleas-https: Flags [S], seq 2377193552, win 64240, options [mss 1460,sackOK,TS val 4068450634 ecr 0,nop,wscale 7], length 0
18:51:14.767115 eth0  Out IP 10.16.16.17.oracleas-https > 10.17.17.8.isnetserv: Flags [S.], seq 407067220, ack 2377193553, win 32154, options [mss 1410,sackOK,TS val 2421286344 ecr 4068450634,nop,wscale 7], length 0
18:51:15.778013 eth0  Out IP 10.16.16.17.oracleas-https > 10.17.17.8.isnetserv: Flags [S.], seq 407067220, ack 2377193553, win 32154, options [mss 1410,sackOK,TS val 2421287354 ecr 4068450634,nop,wscale 7], length 0
18:51:15.802983 eth1  In  IP 10.17.17.8.isnetserv > 10.16.16.17.oracleas-https: Flags [S], seq 2377193552, win 64240, options [mss 1460,sackOK,TS val 4068451671 ecr 0,nop,wscale 7], length 0
18:51:15.803293 eth0  Out IP 10.16.16.17.oracleas-https > 10.17.17.8.isnetserv: Flags [S.], seq 407067220, ack 2377193553, win 32154, options [mss 1410,sackOK,TS val 2421287380 ecr 4068450634,nop,wscale 7], length 0
18:51:16.827194 eth1  In  IP 10.17.17.8.isnetserv > 10.16.16.17.oracleas-https: Flags [S], seq 2377193552, win 64240, options [mss 1460,sackOK,TS val 4068452695 ecr 0,nop,wscale 7], length 0
18:51:16.827530 eth0  Out IP 10.16.16.17.oracleas-https > 10.17.17.8.isnetserv: Flags [S.], seq 407067220, ack 2377193553, win 32154, options [mss 1410,sackOK,TS val 2421288404 ecr 4068450634,nop,wscale 7], length 0
18:51:17.851186 eth1  In  IP 10.17.17.8.isnetserv > 10.16.16.17.oracleas-https: Flags [S], seq 2377193552, win 64240, options [mss 1460,sackOK,TS val 4068453719 ecr 0,nop,wscale 7], length 0
18:51:17.851571 eth0  Out IP 10.16.16.17.oracleas-https > 10.17.17.8.isnetserv: Flags [S.], seq 407067220, ack 2377193553, win 32154, options [mss 1410,sackOK,TS val 2421289428 ecr 4068450634,nop,wscale 7], length 0
18:51:18.875281 eth1  In  IP 10.17.17.8.isnetserv > 10.16.16.17.oracleas-https: Flags [S], seq 2377193552, win 64240, options [mss 1460,sackOK,TS val 4068454743 ecr 0,nop,wscale 7], length 0
18:51:18.875822 eth0  Out IP 10.16.16.17.oracleas-https > 10.17.17.8.isnetserv: Flags [S.], seq 407067220, ack 2377193553, win 32154, options [mss 1410,sackOK,TS val 2421290452 ecr 4068450634,nop,wscale 7], length 0
18:51:19.899348 eth1  In  IP 10.17.17.8.isnetserv > 10.16.16.17.oracleas-https: Flags [S], seq 2377193552, win 64240, options [mss 1460,sackOK,TS val 4068455767 ecr 0,nop,wscale 7], length 0
18:51:19.899954 eth0  Out IP 10.16.16.17.oracleas-https > 10.17.17.8.isnetserv: Flags [S.], seq 407067220, ack 2377193553, win 32154, options [mss 1410,sackOK,TS val 2421291476 ecr 4068450634,nop,wscale 7], length 0
18:51:21.922125 eth0  Out IP 10.16.16.17.oracleas-https > 10.17.17.8.isnetserv: Flags [S.], seq 407067220, ack 2377193553, win 32154, options [mss 1410,sackOK,TS val 2421293499 ecr 4068450634,nop,wscale 7], length 0
18:51:21.947132 eth1  In  IP 10.17.17.8.isnetserv > 10.16.16.17.oracleas-https: Flags [S], seq 2377193552, win 64240, options [mss 1460,sackOK,TS val 4068457815 ecr 0,nop,wscale 7], length 0
18:51:21.947792 eth0  Out IP 10.16.16.17.oracleas-https > 10.17.17.8.isnetserv: Flags [S.], seq 407067220, ack 2377193553, win 32154, options [mss 1410,sackOK,TS val 2421293524 ecr 4068450634,nop,wscale 7], length 0

--------------------------------------------------------------------------------------------
Cilium Status from the pod
--------------------------------------------------------------------------------------------
➜  dev: k exec -it cilium-bfhnr -- cilium status
Defaulted container "cilium-agent" out of: cilium-agent, config (init), mount-cgroup (init), apply-sysctl-overwrites (init), mount-bpf-fs (init), clean-cilium-state (init), install-cni-binaries (init)
KVStore:                 Disabled   
Kubernetes:              Ok         1.32 (v1.32.4+rke2r1) [linux/amd64]
Kubernetes APIs:         ["EndpointSliceOrEndpoint", "cilium/v2::CiliumClusterwideEnvoyConfig", "cilium/v2::CiliumClusterwideNetworkPolicy", "cilium/v2::CiliumEndpoint", "cilium/v2::CiliumEnvoyConfig", "cilium/v2::CiliumNetworkPolicy", "cilium/v2::CiliumNode", "cilium/v2alpha1::CiliumCIDRGroup", "core/v1::Namespace", "core/v1::Pods", "core/v1::Service", "networking.k8s.io/v1::NetworkPolicy"]
KubeProxyReplacement:    True   [eth0    10.13.13.11 2a01:e0a:9a1:81d3:50be:5cff:fee9:96fe fe80::50be:5cff:fee9:96fe (Direct Routing), eth1   10.14.14.11 fe80::bc8:2400:3688:81]
Host firewall:           Disabled
SRv6:                    Disabled
CNI Chaining:            none
CNI Config file:         successfully wrote CNI configuration file to /host/etc/cni/net.d/05-cilium.conflist
Cilium:                  Ok   1.17.5 (v1.17.5-69aab28c)
NodeMonitor:             Listening for events on 2 CPUs with 64x4096 of shared memory
Cilium health daemon:    Ok   
IPAM:                    IPv4: 4/254 allocated from 10.42.5.0/24, 
IPv4 BIG TCP:            Disabled
IPv6 BIG TCP:            Disabled
BandwidthManager:        Disabled
Routing:                 Network: Tunnel [vxlan]   Host: BPF
Attach Mode:             TCX
Device Mode:             veth
Masquerading:            BPF   [eth0, eth1]   10.42.5.0/24 [IPv4: Enabled, IPv6: Disabled]
Controller Status:       30/30 healthy
Proxy Status:            OK, ip 10.42.5.64, 0 redirects active on ports 10000-20000, Envoy: external
Global Identity Range:   min 256, max 65535
Hubble:                  Ok              Current/Max Flows: 364/4095 (8.89%), Flows/s: 13.09   Metrics: Disabled
Encryption:              Disabled        
Cluster health:          0/0 reachable   (2025-07-14T22:43:23Z)
Name                     IP              Node   Endpoints
Modules Health:          Stopped(0) Degraded(0) OK(70)
```

### Anything else?

Helm values

```
bpf:
  masquerade: true
  hostLegacyRouting: false
  tproxy: true
  vlanBypass: [0]
  preallocateMaps: true

ipam:
  mode: "kubernetes"

securityContext:
  capabilities:
    ciliumAgent:
      - CHOWN
      - KILL
      - NET_ADMIN
      - NET_RAW
      - IPC_LOCK
      - SYS_MODULE
      - SYS_ADMIN
      - SYS_RESOURCE
      - DAC_OVERRIDE
      - FOWNER
      - SETGID
      - SETUID
      - CAP_NET_BIND_SERVICE

ipv4:
  enabled: true

k8sServiceHost: localhost
k8sServicePort: 6443

k8s:
  requireIPv4PodCIDR: true

gatewayAPI:
  enabled: true
  hostNetwork:
    enabled: false

kubeProxyReplacement: "true"

envoy:
  securityContext:
    privileged: true
    capabilities:
      envoy:
        - NET_ADMIN
        - SYS_ADMIN
        - BPF
        - NET_BIND_SERVICE
      keepCapNetBindService: true

hubble:
  relay:
    enabled: true
  ui:
    enabled: true

bgpControlPlane:
  enabled: true

nodePort:
  enabled: true
  range: "30000,32767"

l2announcements:
  enabled: true
  leaseDuration: 10s
  leaseRenewDeadline: 5s
  leaseRetryPeriod: 2s

operator:
  replicas: 1

egressGateway:
  enabled: true
```

### Cilium Users Document

- [x] Are you a user of Cilium? Please add yourself to the [Users doc](https://github.com/cilium/cilium/blob/main/USERS.md)

### Code of Conduct

- [x] I agree to follow this project's Code of Conduct

**Comment by rivolity** [comment]
I have also tested without bpf

**Comment by YutaroHayakawa** [comment]
> 10.17.17.8 is the address from where i test the LB

I think this is a problem. Cilium and KubeProxy basically follows the kernel's routing to forward the Service traffic. BGP or L2 announcement doesn't control the outgoing traffic (it does for incoming traffic). So, when it returns back to the `10.17.17.8`, it hits the default route in your case which points to the gateway on the link `eth0`.

```
➜  dev: ip route
default via 10.13.13.1 dev eth0 proto dhcp src 10.13.13.10 metric 100 <<<<<< This one
10.13.13.0/24 dev eth0 proto kernel scope link src 10.13.13.10 metric 100 
10.14.14.0/24 dev eth1 proto kernel scope link src 10.14.14.10 metric 101 
10.42.0.0/24 via 10.42.0.185 dev cilium_host proto kernel src 10.42.0.185 
10.42.0.185 dev cilium_host proto kernel scope link 
10.42.1.0/24 via 10.42.0.185 dev cilium_host proto kernel src 10.42.0.185 mtu 1450 
10.42.2.0/24 via 10.42.0.185 dev cilium_host proto kernel src 10.42.0.185 mtu 1450 
10.42.4.0/24 via 10.42.0.185 dev cilium_host proto kernel src 10.42.0.185 mtu 1450 
10.42.5.0/24 via 10.42.0.185 dev cilium_host proto kernel src 10.42.0.185 mtu 1450 
10.42.6.0/24 via 10.42.0.185 dev cilium_host proto kernel src 10.42.0.185 mtu 1450 
```

Controlling the external traffic is user's responsibility, so if you're wishing the `10.17.17.8` routed to `eth1`, then you need to setup the route for it.

**Comment by rivolity** [comment]
Hello @YutaroHayakawa ,
Thank you for your reply.

To help with debugging, I deployed an Nginx instance directly on the machine. I was able to access it from 10.17.17.8 to the second interface eth1 without any issues, after adjusting the routing table and IP rules to ensure that traffic entering through an interface also exits through the same interface.

However, as shown in the logs, we’re seeing traffic coming in via eth1 and going out via eth0, which violates the kernel's expected routing behavior.

Modifying routes on a per-IP basis isn’t ideal, as it restricts flexibility and makes it difficult to support access from multiple interfaces. I’m looking for a solution that allows consistent behavior across all interfaces without relying on static, IP-specific routes.

**Comment by YutaroHayakawa** [comment]
> To help with debugging, I deployed an Nginx instance directly on the machine. I was able to access it from 10.17.17.8 to the second interface eth1 without any issues, after adjusting the routing table and IP rules to ensure that traffic entering through an interface also exits through the same interface.

> However, as shown in the logs, we’re seeing traffic coming in via eth1 and going out via eth0, which violates the kernel's expected routing behavior.

Hmm, that might be because of the BPF Host Routing. What happens when you set `bpf.hostLegacyRouting=true`? BPF-based routing has a mode where we bypass the IP Rule and just lookup main table. We might rely on that.

**Comment by Foosec** [comment]
I have a similar use case, although the behaviour of going with the nodes default gateway for responses seems expected to me. I've tried pushing default routes into the ingress' namespace with multus, but that just results in two default routes with the same metric which isnt ideal. 

Perhaps a good feature addition to cilium? EgressGateway doesn't quite cover this.
