### ISSUE TITLE
Pods unable to communicate on the same node

### ISSUE THREAD

**Issue by maxpain** [cilium/cilium#20518]
### Is there an existing issue for this?

- [X] I have searched the existing issues

### What happened?

Pods can't communicate on the same node, but can on different nodes.
ping to pod IP is working from a different host or container on a different host but isn't working from the same node or container on the same node.

Also, pods can't ping public IP of the same node and `cilium_host` interface as well.

### Cilium Version

cilium-cli: 0.11.10 compiled with go1.18.3 on darwin/arm64
cilium image (default): v1.11.6
cilium image (stable): v1.11.6
cilium image (running): v1.11.6

### Kernel Version

Linux s1-sharq-tas 5.15.0-41-generic #44-Ubuntu SMP Wed Jun 22 14:20:53 UTC 2022 x86_64 x86_64 x86_64 GNU/Linux

### Kubernetes Version

Client Version: version.Info{Major:"1", Minor:"23", GitVersion:"v1.23.7", GitCommit:"42c05a547468804b2053ecf60a3bd15560362fc2", GitTreeState:"clean", BuildDate:"2022-05-24T12:30:55Z", GoVersion:"go1.17.10", Compiler:"gc", Platform:"linux/amd64"}
Server Version: version.Info{Major:"1", Minor:"23", GitVersion:"v1.23.7", GitCommit:"42c05a547468804b2053ecf60a3bd15560362fc2", GitTreeState:"clean", BuildDate:"2022-05-24T12:24:41Z", GoVersion:"go1.17.10", Compiler:"gc", Platform:"linux/amd64"}

### Relevant log output

`10.229.65.86` — IP address of pod [netshoot](https://hub.docker.com/r/nicolaka/netshoot)
`10.229.65.36` — IP address of `cilium_host` host interface.

`ip a` inside the container:
```
1: lo: <LOOPBACK,UP,LOWER_UP> mtu 65536 qdisc noqueue state UNKNOWN group default qlen 1000
    link/loopback 00:00:00:00:00:00 brd 00:00:00:00:00:00
    inet 127.0.0.1/8 scope host lo
       valid_lft forever preferred_lft forever
    inet6 ::1/128 scope host
       valid_lft forever preferred_lft forever
152: eth0@if153: <BROADCAST,MULTICAST,UP,LOWER_UP> mtu 1500 qdisc noqueue state UP group default qlen 1000
    link/ether 3a:b3:c4:27:e2:d8 brd ff:ff:ff:ff:ff:ff link-netnsid 0
    inet 10.229.65.86/32 scope global eth0
       valid_lft forever preferred_lft forever
    inet6 fe80::38b3:c4ff:fe27:e2d8/64 scope link
       valid_lft forever preferred_lft forever
```

`tcpdump -i any -n icmp` on the host:
```
21:48:55.536371 lxc8df77f06e6ba Out IP 10.229.65.36 > 10.229.65.86: ICMP echo request, id 5, seq 1, length 64
21:48:55.536384 lxc8df77f06e6ba In  IP 10.229.65.86 > 10.229.65.36: ICMP echo reply, id 5, seq 1, length 64
```

`tcpdump -i any -n` inside the container
```
21:19:03.918615 eth0  In  IP 10.229.65.36 > 10.229.65.86: ICMP echo request, id 4, seq 218, length 64
21:19:03.918618 eth0  Out IP 10.229.65.86 > 10.229.65.36: ICMP echo reply, id 4, seq 218, length 64
```

`ip a` on this node:
```
1: lo: <LOOPBACK,UP,LOWER_UP> mtu 65536 qdisc noqueue state UNKNOWN group default qlen 1000
    link/loopback 00:00:00:00:00:00 brd 00:00:00:00:00:00
    inet 127.0.0.1/8 scope host lo
       valid_lft forever preferred_lft forever
2: enp39s0: <BROADCAST,MULTICAST,UP,LOWER_UP> mtu 1500 qdisc fq state UP group default qlen 1000
    link/ether d8:bb:c1:14:45:59 brd ff:ff:ff:ff:ff:ff
    inet 83.221.180.248/26 brd 83.221.180.255 scope global enp39s0
       valid_lft forever preferred_lft forever
3: enp38s0: <NO-CARRIER,BROADCAST,MULTICAST,UP> mtu 1500 qdisc mq state DOWN group default qlen 1000
    link/ether d8:bb:c1:14:45:5b brd ff:ff:ff:ff:ff:ff
4: cilium_net@cilium_host: <BROADCAST,MULTICAST,NOARP,UP,LOWER_UP> mtu 1500 qdisc noqueue state UP group default qlen 1000
    link/ether 5a:8d:30:89:93:44 brd ff:ff:ff:ff:ff:ff
5: cilium_host@cilium_net: <BROADCAST,MULTICAST,NOARP,UP,LOWER_UP> mtu 1500 qdisc noqueue state UP group default qlen 1000
    link/ether ca:13:0a:54:2a:a2 brd ff:ff:ff:ff:ff:ff
    inet 10.229.65.36/32 scope link cilium_host
       valid_lft forever preferred_lft forever
9: lxc0babeb14410b@if8: <BROADCAST,MULTICAST,UP,LOWER_UP> mtu 1500 qdisc noqueue state UP group default qlen 1000
    link/ether b2:2b:34:18:b3:47 brd ff:ff:ff:ff:ff:ff link-netns cni-c8cd17f7-c9ee-403e-6da1-efbc689edc72
153: lxc8df77f06e6ba@if152: <BROADCAST,MULTICAST,UP,LOWER_UP> mtu 1500 qdisc noqueue state UP group default qlen 1000
    link/ether e6:1f:f6:ae:dc:a2 brd ff:ff:ff:ff:ff:ff link-netns cni-83e9b179-8b33-7c4f-e77c-f4d318f39415
213: lxc_health@if212: <BROADCAST,MULTICAST,UP,LOWER_UP> mtu 1500 qdisc noqueue state UP group default qlen 1000
    link/ether 9a:c9:82:a3:bf:fe brd ff:ff:ff:ff:ff:ff link-netnsid 2
```

`ip route` on this node:
```
default via 83.221.180.193 dev enp39s0 proto static
10.229.64.0/24 via 83.221.180.249 dev enp39s0
10.229.65.0/24 via 10.229.65.36 dev cilium_host src 10.229.65.36
10.229.65.36 dev cilium_host scope link
83.221.180.192/26 dev enp39s0 proto kernel scope link src 83.221.180.248
```

`hubble observe --since 3m --pod gameflare/netshoot`
```
Jul 13 21:00:31.124: 10.229.65.86 -> gameflare/netshoot to-endpoint FORWARDED (ICMPv4 EchoRequest)
Jul 13 21:00:31.124: 10.229.65.86 <- gameflare/netshoot to-stack FORWARDED (ICMPv4 EchoReply)
```

`cilium monitor -v`
```
-> endpoint 1605 flow 0x0 , identity host->55506 state established ifindex lxc8df77f06e6ba orig-ip 10.229.65.36: 10.229.65.36 -> 10.229.65.86 EchoRequest
-> stack flow 0x0 , identity 55506->host state reply ifindex 0 orig-ip 0.0.0.0: 10.229.65.86 -> 10.229.65.36 EchoReply
```

### Anything else?

Helm values:
```yaml
debug:
  enabled: true
  verbose: true
bandwidthManager: true
tunnel: disabled
ipv4NativeRoutingCIDR: 10.229.64.0/18
autoDirectNodeRoutes: true
kubeProxyReplacement: strict
installNoConntrackIptablesRules: true
hostServices.enabled: true
ipMasqAgent.enabled: true
bpf.masquerade: true
loadBalancer.mode: dsr
ipam.mode: kubernetes
cni.exclusive: false
containerRuntime.integration: containerd
```

### Code of Conduct

- [X] I agree to follow this project's Code of Conduct

**Comment by maxpain** [comment]
The problem was related [this issue](https://github.com/cilium/cilium/issues/10645).
