### ISSUE TITLE
DNS egress defaults-closed, but other egress default-open

### ISSUE THREAD

**Issue by msiebuhr** [cilium/cilium#11767]
## Bug report

I've spent some time getting egress to FQDN's working on a bare-metal Kubernetes cluster, roughly:

```yaml
---
apiVersion: cilium.io/v2
description: Default deny all rule, except DNS to k8s
kind: CiliumNetworkPolicy
metadata:
  name: deny-all
  namespace: harbor
spec:
  description: "Allow DNS queries to kube-dns"
  egress:
    - toEndpoints:
        - matchLabels:
            k8s-app: kube-dns
            k8s:io.kubernetes.pod.namespace: kube-system
      toPorts:
        - ports:
            - port: "53"
              protocol: UDP
#          rules:   # <-- spoiler alert
#            dns:
#              - matchPattern: "*"
  endpointSelector:
    matchLabels: {}
  ingress:
    - {}
---
apiVersion: "cilium.io/v2"
kind: CiliumNetworkPolicy
metadata:
  name: "harbor-core"
  namespace: harbor
specs:
  - description: "Allow all internal traffic"
    # Works
  - description: "Allow external traffic into harbor-core"
    # Works
  - description: "Allow outbound traffic to some.example.com"
    endpointSelector:
      matchLabels:
        app: harbor
    egress:
      - toFQDNs:
          - matchName: "some.example.com"
        toPorts:
          - ports:
              - port: "443"
                protocol: TCP
```
This didn't work. A rough distillation of our debug-journey:

We did a lot of cURL'ing from within the container supposed to do the egress. Mostly yielding

    kubectl exec -n harbor harbor-harbor-core-64b7679cdf-tdswb -it -- curl -v https://some.example.com/
    *   Trying 185.164.13.150...
    * TCP_NODELAY set
    ^Ccommand terminated with exit code 130

Do note that DNS clearly works, but outbound traffic is blocked. And it shows up in `kubectl exec cilium-684bc -- cilium monitor -t drop`, so a rule is clearly missing somewhere:

    xx drop (Policy denied) flow 0xf87d0e5c to endpoint 0, identity 34836->2: 10.217.1.1:45736 -> 185.164.13.150:4567 tcp SYN
    xx drop (Policy denied) flow 0xe4005019 to endpoint 0, identity 34836->2: 10.217.1.1:45780 -> 185.164.13.150:4567 tcp SYN
    xx drop (Policy denied) flow 0xd789f83a to endpoint 0, identity 34836->2: 10.217.1.1:45780 -> 185.164.13.150:4567 tcp SYN

The cilium-container has a bunch of errors like `kubectl -n kube-system logs cilium-684bc` has a bunch of errors on the form `level=error msg="FQDNSelector was already registered for updates, returning without any identities" fqdnSelector="{some.example.com }" subsys=fqdn` we were guessing at the time that is was related to re-applying the same network-policy, causing some FQDN-cache to have duplicate entries. (Also, timestamps would have been really nice to correlate with other events).

Looking at the endpoint with `kubectl -n kube-system -it exec cilium-684bc -- cilium endpoint get 2832` *did* include the rule for _some.example.com_, so something must've worked despite the error above.

Much later I found out about `kubectl -n harbor get ciliumendpoints harbor-harbor-core-64b7679cdf-tdswb -o json`, that did *not* include the rule for _some.example.com_.

Re-copy/pasting things from https://docs.cilium.io/en/v1.7/gettingstarted/dns/#apply-dns-egress-policy, we got it down to the DNS `rules`-section is needed to be explicitly set for things to work. I'm guessing it is needed for cilium itself to look up the IP addresses of `toFQDNs`-egress rules.

(We've been back-and-forth between different configurations a few times, so the fact that we could look up DNS in the pod may have been due to caching - we don't know for a fact.)

### The bug

Overall, this was rather a surprise for us, as all other rules we've done is default-open: if you allow traffic to pod, _all_ ports/protocols/... are open until more specific rules closes it down further. On the other hand, DNS seem to default-closed: only explicitly allowed traffic will go through, which means that by default nothing will work.

 * It would've been nice if the documentation was a bit more clear on the need for `rules` in the DNS-section. The closest we've come is from <https://docs.cilium.io/en/v1.6/policy/language/#dns-proxy-preferred> that states _A DNS Proxy intercepts egress DNS traffic and records IPs seen in the responses. This interception is, itself, a separate policy rule governing the DNS requests, and must be specified separately._ (This could be read as the `rules:`-section having to be there...)
 * _If_ the error-message we saw above is related, it would be nice if it had a bit more "blame DNS" to it.

**General Information**

- Cilium version (run `cilium version`)

    Client: 1.7.1 1ba69e67b 2020-03-04T15:44:41-08:00 go version go1.13.8 linux/amd64
    Daemon: 1.7.1 1ba69e67b 2020-03-04T15:44:41-08:00 go version go1.13.8 linux/amd64

- Kernel version (run `uname -a`)

    Linux worker1 4.15.0-64-generic #73-Ubuntu SMP Thu Sep 12 13:16:13 UTC 2019 x86_64 x86_64 x86_64 GNU/Linux

- Orchestration system version in use (e.g. `kubectl version`, Mesos, ...)

    >kubectl version
    Client Version: version.Info{Major:"1", Minor:"18", GitVersion:"v1.18.3", GitCommit:"2e7996e3e2712684bc73f0dec0200d64eec7fe40", GitTreeState:"clean", BuildDate:"2020-05-20T12:52:00Z", GoVersion:"go1.13.9", Compiler:"gc", Platform:"linux/amd64"}
    Server Version: version.Info{Major:"1", Minor:"17", GitVersion:"v1.17.3", GitCommit:"06ad960bfd03b39c8310aaf92d1e7c12ce618213", GitTreeState:"clean", BuildDate:"2020-02-11T18:07:13Z", GoVersion:"go1.13.6", Compiler:"gc", Platform:"linux/amd64"}

- Link to relevant artifacts (policies, deployments scripts, ...)
- Upload a system dump (run `curl -sLO
https://github.com/cilium/cilium-sysdump/releases/latest/download/cilium-sysdump.zip &&
python cilium-sysdump.zip` and then attach the generated zip file) - cilium container does not contain curl, so cannot produce from cilium's point-of-view.

**How to reproduce the issue**

1. instruction 1
2. instruction 2

**Comment by jrajahalme** [comment]
@msiebuhr Thanks for the report. Bare port/protocol rule on port 53 (no `rules`) will allow the DNS traffic to go through; as you see there were no drops for port 53. The problem is that the `rules.dns` section is required to tell Cilium that it should apply DNS proxy on that traffic. DNS traffic can be carried on ports other than 53, so always intercepting traffic on port 53 is not desirable. The same logic applies to all L7 traffic (HTTP, Kafka, DNS): the rules section is required for that traffic to be intercepted for policy enforcement. DNS is special in the sense that `toFQDNs` rules depend on it.

You can see the results of intercepted DNS queries with `cilium fqdn cache list`, see [toFQDNs troubleshooting docs](https://docs.cilium.io/en/v1.7/policy/troubleshooting/#troubleshooting-tofqdns-rules) for examples.

The error log you saw regarding msg="FQDNSelector was already registered" has been fixed in later releases (e.g, 1.7.2, see #10501), but it is likely inconsequential in your case.

You get timestamps for `kubectl logs` by adding the option `--timestamps`.

Given the above I believe this is a matter of documenting this better. Any suggestions?

**Comment by msiebuhr** [comment]
Thanks for the follow-up!

Just to make sure I get you right: The `toFQDN`-rules relies on the DNS _proxy_ (Just having DNS open is not enough.)?

I would definitely appreciate if the documentation spelt this out a bit clearer. Perhaps some logging to that effect. (I don't see schema-validation working, as it could be uploaded as two different K8s objects.)

**Comment by jrajahalme** [comment]
Right, DNS proxy is required to gain visibility to name->address mapping, as the packets subjected to policy enforcement only carry addresses, not DNS names.

**Comment by joestringer** [comment]
It looks like the documentation mentions the proxy multiple times, but it is written from a developer perpective ("This works via the DNS proxy"), and not a user perspective ("The DNS proxy *must* be configured for ToFQDN rules to take effect).

https://docs.cilium.io/en/latest/policy/language/#dns-based

**Comment by pchaigno** [comment]
> It looks like the documentation mentions the proxy multiple times, but it is written from a developer perpective ("This works via the DNS proxy"), and not a user perspective ("The DNS proxy _must_ be configured for ToFQDN rules to take effect").
> 
> https://docs.cilium.io/en/latest/policy/language/#dns-based

Flagged this as `good-first-issue` and `area/documentation`. We should change the wording :point_up_2:

**Comment by h3llix** [comment]
I would like to take this up .

**Comment by joestringer** [comment]
@h3llix are you still planning to propose a fix for this one?

**Comment by h3llix** [comment]
Hi @joestringer. Srry I completely forgot about this issue. Currently I am looking into two issues as my gsoc project.

If someone could provide a solution to this, that would be really helpful as i am still busy with the project.

**Comment by wenhuwang** [comment]
hello，Is this problem fixed? I have a similar situation.
### General Information
- Cilium version
```
# cilium version
Client: 1.8.9 9bef863 2021-04-20T14:49:16-07:00 go version go1.14.15 linux/amd64
Daemon: 1.8.9 9bef863 2021-04-20T14:49:16-07:00 go version go1.14.15 linux/amd64
```
- Kernel version
```
$ uname -a
Linux node1 4.15.0-156-generic #163-Ubuntu SMP Thu Aug 19 23:31:58 UTC 2021 x86_64 x86_64 x86_64 GNU/Linux
```
- Orchestration system version
```
$ kubectl version
Client Version: version.Info{Major:"1", Minor:"20", GitVersion:"v1.20.4", GitCommit:"e87da0bd6e03ec3fea7933c4b5263d151aafd07c", GitTreeState:"clean", BuildDate:"2021-02-18T16:12:00Z", GoVersion:"go1.15.8", Compiler:"gc", Platform:"linux/amd64"}
Server Version: version.Info{Major:"1", Minor:"20", GitVersion:"v1.20.7", GitCommit:"132a687512d7fb058d0f5890f07d4121b3f0a2e2", GitTreeState:"clean", BuildDate:"2021-05-12T12:32:49Z", GoVersion:"go1.15.12", Compiler:"gc", Platform:"linux/amd64"}
```

### cilium network policy
 ```
apiVersion: cilium.io/v2
kind: CiliumNetworkPolicy
metadata:
  name: allow-test1-to-baidu
  namespace: demo
spec:
  egress:
  - toEndpoints:
    - matchLabels:
        k8s:io.kubernetes.pod.namespace: kube-system
        k8s:k8s-app: kube-dns
    toPorts:
    - ports:
      - port: "53"
        protocol: ANY
      rules:
        dns:
        - matchPattern: '*'
  - toFQDNs:
    - matchName: www.baidu.com
  endpointSelector:
    matchLabels:
      app: np-test01
 ```

We did a lot of  curl from within the container supposed to do the egress. all failed.
```
sh-4.2# curl --connect-timeout 5  www.baidu.com
curl: (7) Failed connect to www.baidu.com:80; Operation now in progress
```
And it shows up in `kubectl exec cilium-h2v6z -- cilium monitor  --from 2126 -t drop`, so a rule is clearly missing somewhere:
```
Listening for events on 48 CPUs with 64x4096 of shared memory
Press Ctrl-C to quit
level=info msg="Initializing dissection cache..." subsys=monitor
xx drop (Policy denied) flow 0xac1e34cb to endpoint 0, identity 46595->2: 10.165.87.147:41596 -> 180.101.49.11:80 tcp SYN
xx drop (Policy denied) flow 0x82d3eac0 to endpoint 0, identity 46595->2: 10.165.87.147:41596 -> 180.101.49.11:80 tcp SYN
xx drop (Policy denied) flow 0xde9920b0 to endpoint 0, identity 46595->2: 10.165.87.147:58234 -> 180.101.49.12:80 tcp SYN
xx drop (Policy denied) flow 0xb966b69a to endpoint 0, identity 46595->2: 10.165.87.147:58234 -> 180.101.49.12:80 tcp SYN
```

Go into the pod cilium-h2v6z for further debug and find that there is no dns cache generated.
```
# cilium fqdn names
{
  "DNSPollNames": [
    "www.baidu.com."
  ],
  "FQDNPolicySelectors": [
    {
      "regexString": "^www[.]baidu[.]com[.]$",
      "selectorString": "MatchName: www.baidu.com, MatchPattern: "
    }
  ]
}

# cilium fqdn cache list
Endpoint   Source   FQDN   TTL   ExpirationTime   IPs 
```

The `kubectl -n kube-system logs -f cilium-h2v6z`  command to view the log have no obvious errors informations. i guess it may be that DNS proxy is not working, but don't know how to troubleshoot this problem.


Hope to give some suggestions. thanks

**Comment by aanm** [comment]
Hello @wenhuwang have you checked if there was DNS traffic to `baidu.com` from within the container with tcpdump?

**Comment by wenhuwang** [comment]
> 

The capture information is as follows:
```
$ kubectl -n demo exec -it np-test01-55597b5f7f-vbx4j bash
[root@np-test01-55597b5f7f-vbx4j /]# tcpdump -nvv -i eth0 
tcpdump: listening on eth0, link-type EN10MB (Ethernet), capture size 262144 bytes
01:17:43.901686 IP (tos 0x0, ttl 64, id 11172, offset 0, flags [DF], proto UDP (17), length 82)
    10.165.87.147.57443 > 169.254.25.10.domain: [bad udp cksum 0x2590 -> 0xecad!] 43129+ A? www.baidu.com.demo.svc.cluster.local. (54)
01:17:43.901739 IP (tos 0x0, ttl 64, id 11173, offset 0, flags [DF], proto UDP (17), length 82)
    10.165.87.147.57443 > 169.254.25.10.domain: [bad udp cksum 0x2590 -> 0x1a87!] 31365+ AAAA? www.baidu.com.demo.svc.cluster.local. (54)
01:17:43.902781 IP (tos 0x0, ttl 63, id 18048, offset 0, flags [DF], proto UDP (17), length 175)
    169.254.25.10.domain > 10.165.87.147.57443: [bad udp cksum 0x25ed -> 0xba85!] 43129 NXDomain*- q: A? www.baidu.com.demo.svc.cluster.local. 0/1/0 ns: cluster.local. SOA ns.dns.cluster.local. hostmaster.cluster.local. 1638407835 7200 1800 86400 5 (147)
01:17:43.902882 IP (tos 0x0, ttl 63, id 18049, offset 0, flags [DF], proto UDP (17), length 175)
    169.254.25.10.domain > 10.165.87.147.57443: [bad udp cksum 0x25ed -> 0xe85e!] 31365 NXDomain*- q: AAAA? www.baidu.com.demo.svc.cluster.local. 0/1/0 ns: cluster.local. SOA ns.dns.cluster.local. hostmaster.cluster.local. 1638407835 7200 1800 86400 5 (147)
01:17:43.902960 IP (tos 0x0, ttl 64, id 11174, offset 0, flags [DF], proto UDP (17), length 77)
    10.165.87.147.46053 > 169.254.25.10.domain: [bad udp cksum 0x258b -> 0xb4c5!] 6281+ A? www.baidu.com.svc.cluster.local. (49)
01:17:43.902992 IP (tos 0x0, ttl 64, id 11175, offset 0, flags [DF], proto UDP (17), length 77)
    10.165.87.147.46053 > 169.254.25.10.domain: [bad udp cksum 0x258b -> 0xd9bf!] 55438+ AAAA? www.baidu.com.svc.cluster.local. (49)
01:17:43.903509 IP (tos 0x0, ttl 63, id 18050, offset 0, flags [DF], proto UDP (17), length 170)
    169.254.25.10.domain > 10.165.87.147.46053: [bad udp cksum 0x25e8 -> 0xeb53!] 55438 NXDomain*- q: AAAA? www.baidu.com.svc.cluster.local. 0/1/0 ns: cluster.local. SOA ns.dns.cluster.local. hostmaster.cluster.local. 1638407835 7200 1800 86400 5 (142)
01:17:43.903626 IP (tos 0x0, ttl 63, id 18051, offset 0, flags [DF], proto UDP (17), length 170)
    169.254.25.10.domain > 10.165.87.147.46053: [bad udp cksum 0x25e8 -> 0xc659!] 6281 NXDomain*- q: A? www.baidu.com.svc.cluster.local. 0/1/0 ns: cluster.local. SOA ns.dns.cluster.local. hostmaster.cluster.local. 1638407835 7200 1800 86400 5 (142)
01:17:43.903692 IP (tos 0x0, ttl 64, id 11176, offset 0, flags [DF], proto UDP (17), length 73)
    10.165.87.147.41112 > 169.254.25.10.domain: [bad udp cksum 0x2587 -> 0x4058!] 6690+ A? www.baidu.com.cluster.local. (45)
01:17:43.903725 IP (tos 0x0, ttl 64, id 11177, offset 0, flags [DF], proto UDP (17), length 73)
    10.165.87.147.41112 > 169.254.25.10.domain: [bad udp cksum 0x2587 -> 0x1953!] 9767+ AAAA? www.baidu.com.cluster.local. (45)
01:17:43.904284 IP (tos 0x0, ttl 63, id 18052, offset 0, flags [DF], proto UDP (17), length 166)
    169.254.25.10.domain > 10.165.87.147.41112: [bad udp cksum 0x25e4 -> 0x51ec!] 6690 NXDomain*- q: A? www.baidu.com.cluster.local. 0/1/0 ns: cluster.local. SOA ns.dns.cluster.local. hostmaster.cluster.local. 1638407835 7200 1800 86400 5 (138)
01:17:43.904356 IP (tos 0x0, ttl 63, id 18053, offset 0, flags [DF], proto UDP (17), length 166)
    169.254.25.10.domain > 10.165.87.147.41112: [bad udp cksum 0x25e4 -> 0x2ae7!] 9767 NXDomain*- q: AAAA? www.baidu.com.cluster.local. 0/1/0 ns: cluster.local. SOA ns.dns.cluster.local. hostmaster.cluster.local. 1638407835 7200 1800 86400 5 (138)
01:17:43.904429 IP (tos 0x0, ttl 64, id 11178, offset 0, flags [DF], proto UDP (17), length 59)
    10.165.87.147.55733 > 169.254.25.10.domain: [bad udp cksum 0x2579 -> 0x120c!] 12904+ A? www.baidu.com. (31)
01:17:43.904466 IP (tos 0x0, ttl 64, id 11179, offset 0, flags [DF], proto UDP (17), length 59)
    10.165.87.147.55733 > 169.254.25.10.domain: [bad udp cksum 0x2579 -> 0xc304!] 26223+ AAAA? www.baidu.com. (31)
01:17:43.908202 IP (tos 0x0, ttl 63, id 18054, offset 0, flags [DF], proto UDP (17), length 192)
    169.254.25.10.domain > 10.165.87.147.55733: [bad udp cksum 0x25fe -> 0xbc6d!] 26223 q: AAAA? www.baidu.com. 1/1/0 www.baidu.com. CNAME www.a.shifen.com. ns: a.shifen.com. SOA ns1.a.shifen.com. baidu_dns_master.baidu.com. 2112020002 5 5 2592000 3600 (164)
01:17:43.908329 IP (tos 0x0, ttl 63, id 18055, offset 0, flags [DF], proto UDP (17), length 536)
    169.254.25.10.domain > 10.165.87.147.55733: [bad udp cksum 0x2756 -> 0x4fa6!] 12904 q: A? www.baidu.com. 3/5/5 www.baidu.com. CNAME www.a.shifen.com., www.a.shifen.com. A 180.101.49.11, www.a.shifen.com. A 180.101.49.12 ns: a.shifen.com. NS ns4.a.shifen.com., a.shifen.com. NS ns5.a.shifen.com., a.shifen.com. NS ns3.a.shifen.com., a.shifen.com. NS ns1.a.shifen.com., a.shifen.com. NS ns2.a.shifen.com. ar: ns2.a.shifen.com. A 220.181.33.32, ns1.a.shifen.com. A 110.242.68.42, ns3.a.shifen.com. A 112.80.255.253, ns5.a.shifen.com. A 180.76.76.95, ns4.a.shifen.com. A 14.215.177.229 (508)
01:17:43.913384 IP (tos 0x0, ttl 64, id 3097, offset 0, flags [DF], proto TCP (6), length 60)
    10.165.87.147.53846 > 180.101.49.11.http: Flags [S], cksum 0x47d7 (incorrect -> 0x29d5), seq 2076008679, win 42300, options [mss 1410,sackOK,TS val 853757767 ecr 0,nop,wscale 9], length 0
01:17:44.928399 IP (tos 0x0, ttl 64, id 3098, offset 0, flags [DF], proto TCP (6), length 60)
    10.165.87.147.53846 > 180.101.49.11.http: Flags [S], cksum 0x47d7 (incorrect -> 0x25de), seq 2076008679, win 42300, options [mss 1410,sackOK,TS val 853758782 ecr 0,nop,wscale 9], length 0
01:17:46.408097 IP (tos 0x0, ttl 64, id 48565, offset 0, flags [DF], proto TCP (6), length 60)
    10.165.87.147.42248 > 180.101.49.12.http: Flags [S], cksum 0x47d8 (incorrect -> 0x4dc3), seq 1402688859, win 42300, options [mss 1410,sackOK,TS val 3472224321 ecr 0,nop,wscale 9], length 0
01:17:47.424413 IP (tos 0x0, ttl 64, id 48566, offset 0, flags [DF], proto TCP (6), length 60)
    10.165.87.147.42248 > 180.101.49.12.http: Flags [S], cksum 0x47d8 (incorrect -> 0x49cb), seq 1402688859, win 42300, options [mss 1410,sackOK,TS val 3472225337 ecr 0,nop,wscale 9], length 0
01:17:48.960393 ARP, Ethernet (len 6), IPv4 (len 4), Request who-has 10.165.87.32 tell 10.165.87.147, length 28
01:17:48.960434 ARP, Ethernet (len 6), IPv4 (len 4), Reply 10.165.87.32 is-at 5e:72:2c:a6:46:fa, length 28
```
container ip 10.165.87.147 and 180.101.49.12 Failed to establish TCP connection.

**Comment by joestringer** [comment]
@wenhuwang does `cilium status --all-redirects` print information about configured proxy redirects?

**Comment by wenhuwang** [comment]
> @wenhuwang does `cilium status --all-redirects` print information about configured proxy redirects?

The output information of the `cilium status --all-redirects` command is as follows:
```
KVStore:                Ok   etcd: 3/3 connected, lease-ID=20007be82c391940, lock lease-ID=20007be82c391942, has-quorum=true: https://10.165.6.21:2379 - 3.4.13; https://10.165.6.23:2379 - 3.4.13 (Leader); https://10.165.6.22:2379 - 3.4.13
Kubernetes:             Ok   1.20 (v1.20.7) [linux/amd64]
Kubernetes APIs:        ["CustomResourceDefinition", "cilium/v2::CiliumClusterwideNetworkPolicy", "cilium/v2::CiliumNetworkPolicy", "core/v1::Namespace", "core/v1::Node", "core/v1::Pods", "core/v1::Service", "discovery/v1beta1::EndpointSlice", "networking.k8s.io/v1::NetworkPolicy"]
KubeProxyReplacement:   Probe   []   [SessionAffinity]
Cilium:                 Ok      OK
NodeMonitor:            Listening for events on 48 CPUs with 64x4096 of shared memory
Cilium health daemon:   Ok   
IPAM:                   IPv4: 14/255 allocated from 10.165.87.0/24, 
Masquerading:           IPTables
Controller Status:      103/103 healthy
Proxy Status:           OK, ip 10.165.87.32, 2 redirects active on ports 10000-20000
  Protocol            Redirect             Proxy Port
  cilium-dns-egress   2126:egress:TCP:53   32768
  cilium-dns-egress   2126:egress:UDP:53   32768
Hubble:           Disabled
Cluster health:   9/9 reachable   (2021-12-03T01:16:31Z)
```

**Comment by wenhuwang** [comment]
@aanm @joestringer hello, do you have any other troubleshooting ideas? otherwise, i can only try to upgrade the cilium version.

**Comment by aanm** [comment]
@wenhuwang can you provide a Cilium sysdump?

**Comment by wenhuwang** [comment]
> @wenhuwang can you provide a Cilium sysdump?

hello, my cilium version has upgraded to v1.10.4, this issues already exists. cilium sysdump files as follows.
[cilium-sysdump-20211210-133354.zip](https://github.com/cilium/cilium/files/7690530/cilium-sysdump-20211210-133354.zip)

thanks for your help.

**Comment by vincentmli** [comment]
@wenhuwang 

your sysdump has empty bpf ipcache list, weird, maybe you can run `cilium bpf ipcache list` manually while running into the issue to show if any bpf ipcache map record for IP resolved for `www.baidu.com`

**Comment by vincentmli** [comment]
@wenhuwang 

I noticed you have two policies applied to same `nginx` pod, one is `toCIDR`, another is to `toFQDNS`

```
    name: private-whitelist                                                      
    namespace: demo                                                              
    resourceVersion: "945539"                                                    
    uid: 72aafa70-d9a4-41c7-b596-d90704d1a508                                    
  spec:                                                                          
    egress:                                                                      
    - toCIDR:                                                                    
      - 172.16.0.0/12                                                            
      - 192.168.0.0/16                                                           
      - 169.254.20.0/24                                                          
    endpointSelector:                                                            
      matchLabels:                                                               
        any:run: nginx   

    - toFQDNs:                                                                   
      - matchName: www.baidu.com                                                 
    endpointSelector:                                                            
      matchLabels:                                                               
        any:run: nginx                                             

```

I could be wrong, but if you have `toCIDR` that allows `nginx` pod connect to these subnet, does it mean `nginx` pod will not be allowed to connect to other IP/subnet (including baidu.com) that are not included in `toCIDR` ?  could you remove `toCIDR` policy for a quick test to prove me wrong :)

**Comment by wenhuwang** [comment]
> @wenhuwang
> 
> your sysdump has empty bpf ipcache list, weird, maybe you can run `cilium bpf ipcache list` manually while running into the issue to show if any bpf ipcache map record for IP resolved for `www.baidu.com`

@vincentmli hello, i tried to run the `cilium bpf ipcache list` command, but it returns  an errors.
```
root@node9:/home/cilium# cilium bpf ipcache get 10.165.120.214
Error: unable to dump IPCache: Unable to get next key from map with file descriptor 7: errno 524

root@node9:/home/cilium# cilium bpf ipcache list              
error dumping contents of map: Unable to get next key from map with file descriptor 7: errno 524
```
Is there a problem with the some configurations?
thanks for you help.

**Comment by wenhuwang** [comment]
> @wenhuwang
> 
> I noticed you have two policies applied to same `nginx` pod, one is `toCIDR`, another is to `toFQDNS`
> 
> ```
>     name: private-whitelist                                                      
>     namespace: demo                                                              
>     resourceVersion: "945539"                                                    
>     uid: 72aafa70-d9a4-41c7-b596-d90704d1a508                                    
>   spec:                                                                          
>     egress:                                                                      
>     - toCIDR:                                                                    
>       - 172.16.0.0/12                                                            
>       - 192.168.0.0/16                                                           
>       - 169.254.20.0/24                                                          
>     endpointSelector:                                                            
>       matchLabels:                                                               
>         any:run: nginx   
> 
>     - toFQDNs:                                                                   
>       - matchName: www.baidu.com                                                 
>     endpointSelector:                                                            
>       matchLabels:                                                               
>         any:run: nginx                                             
> ```
> 
> I could be wrong, but if you have `toCIDR` that allows `nginx` pod connect to these subnet, does it mean `nginx` pod will not be allowed to connect to other IP/subnet (including baidu.com) that are not included in `toCIDR` ? could you remove `toCIDR` policy for a quick test to prove me wrong :)

It needs `toCIDR` policy that allow the pod to access DNS and some private subnet. if i remove the `toCIDR` ,the pod will can't to  resolve `www.baidu.com`. i tried.
I also tried to use ccnp to configure `toCIDR`,  and the result was same.

**Comment by vincentmli** [comment]
> Error: unable to dump IPCache: Unable to get next key from map with file descriptor 7:

I think it might related to your old kernel version `4.15.0` , are on on ubuntu 16.x ? 
see https://github.com/cilium/cilium/issues/10080, maybe try a newer Ubuntu like ubuntu 20.x ?

**Comment by wenhuwang** [comment]
> 



> > Error: unable to dump IPCache: Unable to get next key from map with file descriptor 7:
> 
> I think it might related to your old kernel version `4.15.0` , are on on ubuntu 16.x ? see #10080, maybe try a newer Ubuntu like ubuntu 20.x ?

Thank you  providing a way to troubleshoot the problem, i will try to test it in a higher version of the kernel environment.

**Comment by wenhuwang** [comment]
@vincentmli hello, i have upgraded  kernel version to `5.4.0-92` on ubuntu 20.04.3, this probles still exists.

#### environment information:
```
root@node1:~# uname -a
Linux node1 5.4.0-92-generic #103-Ubuntu SMP Fri Nov 26 16:13:00 UTC 2021 x86_64 x86_64 x86_64 GNU/Linux

root@node1:~# kubectl get node
NAME    STATUS   ROLES                  AGE    VERSION
node1   Ready    control-plane,master   6d3h   v1.22.5
node2   Ready    control-plane,master   6d3h   v1.22.5

root@node1:~# kubectl -n kube-system exec -it cilium-px2ft -- cilium version
Defaulted container "cilium-agent" out of: cilium-agent, clean-cilium-state (init)
Client: 1.10.6 17d3d15e16 2021-12-09T18:34:11-08:00 go version go1.16.11 linux/amd64
Daemon: 1.10.6 17d3d15e16 2021-12-09T18:34:11-08:00 go version go1.16.11 linux/amd64
```

cilium agent debug log:
```
level=debug msg=mapSelectorsToIPs fqdnSelectors="map[{www.baidu.com }:{}]" subsys=fqdn
level=debug msg="DNSCache forward" Wwh DNSCache forward="map[]" subsys=fqdn
level=debug msg="Emitting matching DNS Name -> IPs for FQDNSelector" DNSName=www.baidu.com. IPs="[]" matchName=www.baidu.com subsys=fqdn
level=debug msg="getting identities for IPs associated with FQDNSelector" fqdnSelector="{www.baidu.com }" ips="[]" subsys=policy
```
through the debug log, it can be found that there is no IP information cached in the DNSCache object. Further i add the debug log to the notifiOnDNSMsg function int the daemon/cmd/fqdn.go file in the cilium source code, and found that it has not been printed out, so i suspect that  it may be the dns request  in the pod was not forwarded to the dns proxy of cilium-agent.

i guess it may be related to bpf rules, but it is not clear how to troubleshoot. 
Hope someone can help,thanks.

**Comment by vincentmli** [comment]
@wenhuwang 

I did a test in my lab with following policy which is pretty much same as yours except I used `netshoot` pod as test pod

```
apiVersion: "cilium.io/v2"
kind: CiliumNetworkPolicy
metadata:
  name: "baidu-fqdn"
spec:
  endpointSelector:
    matchLabels:
      app: netshoot
  egress:
  - toFQDNs:
    - matchName: "www.baidu.com"
  - toEndpoints:
    - matchLabels:
        "k8s:io.kubernetes.pod.namespace": kube-system
        "k8s:k8s-app": kube-dns
    toPorts:
    - ports:
      - port: "53"
        protocol: ANY
      rules:
        dns:
        - matchPattern: "*"
```

after applying the policy,

I run ping from netshoot pod to make sure there is always traffic going to www.baidu.com

```
while true; do kubectl exec -it netshoot -- ping -c 1 www.baidu.com; sleep 1 ; done

```

then I have another script to dump the ipcache and fqdn cache for each cilium agent pod

```
#!/bin/bash

RED='\033[0;31m'
GREEN='\033[0;32m'
BROWN='\033[0;33m'
BLUE='\033[0;34m'
NC='\033[0m' # No Color


ok=0

until [ $ok -eq 1 ]
do

    for node in $(kubectl  get no  | awk '{print $1;}' | grep -v 'NAME')

    do

        CA=$(kubectl get -l k8s-app=cilium pods -n kube-system --field-selector spec.nodeName=$node -o jsonpath='{.items[0].metadata.name}')

          echo -e "${RED}"
          echo "cilium node $node agent $CA" >&2
          echo -e "${NC}"
          echo -e "${GREEN}"

        echo -e "${BLUE}"
        #kubectl exec -it $CA -n kube-system -- cilium status 2>&1>>/dev/null
        kubectl exec -it $CA -n kube-system -- cilium status

        if [ $? -eq 0 ]
        then
          echo -e "${NC}"
          ok=1
          kubectl exec -it $CA -n kube-system -- cilium bpf ipcache list
          kubectl exec -it $CA -n kube-system -- cilium fqdn cache list
          echo -e "${NC}"
        else
          echo -e "${RED}Wait for cilium agent to be up${NC}" >&2
          ok=0
        fi

    done

    sleep 2

done

```

here is the script output, you can see both ipcache and fqdn cache has DNS record for `www.baidu.com` from the cilium agent pod `cilium-pwfbr`   located on the node `centos-dev.localdomain`  which also  host the   `netshoot`  pod,  

cilium node `cilium-dev` agent `cilium-4fv4p` does not have the record because `netshoot` pod is not located on node `cilium-dev` , I do wonder though why the DNS record is not synced in all nodes, maybe it is work by design that the DNS record only populated in ipcache and fqdn cache on the node where the `endpointSelector` matched label `netshoot` pod is located ?


```
cilium node centos-dev.localdomain agent cilium-pwfbr



Defaulted container "cilium-agent" out of: cilium-agent, clean-cilium-state (init)
KVStore:                Ok   Disabled
Kubernetes:             Ok   1.21 (v1.21.1) [linux/amd64]
Kubernetes APIs:        ["cilium/v2::CiliumClusterwideNetworkPolicy", "cilium/v2::CiliumEndpoint", "cilium/v2::CiliumNetworkPolicy", "cilium/v2::CiliumNode", "core/v1::Namespace", "core/v1::Node", "core/v1::Pods", "core/v1::Service", "discovery/v1::EndpointSlice", "networking.k8s.io/v1::NetworkPolicy"]
KubeProxyReplacement:   Strict    [ens192 10.169.72.233 (Direct Routing)]
Host firewall:          Enabled   [ens192]
Cilium:                 Ok   1.10.90 (v1.10.90-ce93109ce4)
NodeMonitor:            Listening for events on 8 CPUs with 64x4096 of shared memory
IPAM:                   IPv4: 7/254 allocated from 10.0.1.0/24, 
BandwidthManager:       EDT with BPF   [ens192]
Host Routing:           BPF
Masquerading:           BPF   [ens192]   10.0.1.0/24 [IPv4: Enabled, IPv6: Disabled]
Controller Status:      46/46 healthy
Proxy Status:           OK, ip 10.0.1.116, 2 redirects active on ports 10000-20000
Hubble:                 Ok   Current/Max Flows: 4095/4095 (100.00%), Flows/s: 216.52   Metrics: Disabled
Encryption:             Disabled
Cluster health:            Probe disabled

Defaulted container "cilium-agent" out of: cilium-agent, clean-cilium-state (init)
IP PREFIX/ADDRESS   IDENTITY
104.193.88.123/32   identity=16777223 encryptkey=0 tunnelendpoint=0.0.0.0      
104.244.42.2/32     identity=16777219 encryptkey=0 tunnelendpoint=0.0.0.0      
10.0.0.113/32       identity=824 encryptkey=0 tunnelendpoint=10.169.72.239     
10.0.0.228/32       identity=6 encryptkey=0 tunnelendpoint=10.169.72.239       
10.0.1.116/32       identity=1 encryptkey=0 tunnelendpoint=0.0.0.0             
10.0.1.136/32       identity=24926 encryptkey=0 tunnelendpoint=0.0.0.0         
10.0.1.186/32       identity=59824 encryptkey=0 tunnelendpoint=0.0.0.0         
10.169.72.233/32    identity=1 encryptkey=0 tunnelendpoint=0.0.0.0             
10.0.1.125/32       identity=59824 encryptkey=0 tunnelendpoint=0.0.0.0         
10.0.1.126/32       identity=7949 encryptkey=0 tunnelendpoint=0.0.0.0          
104.193.88.77/32    identity=16777222 encryptkey=0 tunnelendpoint=0.0.0.0      
104.244.42.66/32    identity=16777218 encryptkey=0 tunnelendpoint=0.0.0.0      
104.244.42.194/32   identity=16777221 encryptkey=0 tunnelendpoint=0.0.0.0      
10.0.0.1/32         identity=57112 encryptkey=0 tunnelendpoint=10.169.72.239   
10.0.1.52/32        identity=824 encryptkey=0 tunnelendpoint=0.0.0.0           
10.0.1.162/32       identity=60997 encryptkey=0 tunnelendpoint=0.0.0.0         
10.3.72.233/32      identity=1 encryptkey=0 tunnelendpoint=0.0.0.0             
10.3.72.239/32      identity=16777217 encryptkey=0 tunnelendpoint=0.0.0.0      
10.169.72.239/32    identity=6 encryptkey=0 tunnelendpoint=10.169.72.239       
104.244.42.130/32   identity=16777220 encryptkey=0 tunnelendpoint=0.0.0.0      
0.0.0.0/0           identity=2 encryptkey=0 tunnelendpoint=0.0.0.0             


Defaulted container "cilium-agent" out of: cilium-agent, clean-cilium-state (init)
Endpoint   Source   FQDN               TTL    ExpirationTime             IPs                                                        
2614       lookup   api.twitter.com.   3600   2022-01-20T01:29:19.400Z   104.244.42.66,104.244.42.2,104.244.42.194,104.244.42.130   
2614       lookup   www.baidu.com.     3600   2022-01-20T01:37:56.684Z   104.193.88.77,104.193.88.123      <===                         

cilium node cilium-dev agent cilium-4fv4p

Defaulted container "cilium-agent" out of: cilium-agent, clean-cilium-state (init)
KVStore:                Ok   Disabled
Kubernetes:             Ok   1.21 (v1.21.1) [linux/amd64]
Kubernetes APIs:        ["cilium/v2::CiliumClusterwideNetworkPolicy", "cilium/v2::CiliumEndpoint", "cilium/v2::CiliumNetworkPolicy", "cilium/v2::CiliumNode", "core/v1::Namespace", "core/v1::Node", "core/v1::Pods", "core/v1::Service", "discovery/v1::EndpointSlice", "networking.k8s.io/v1::NetworkPolicy"]
KubeProxyReplacement:   Strict    [ens192 10.169.72.239 (Direct Routing)]
Host firewall:          Enabled   [ens192]
Cilium:                 Ok   1.10.90 (v1.10.90-ce93109ce4)
NodeMonitor:            Listening for events on 8 CPUs with 64x4096 of shared memory
IPAM:                   IPv4: 3/254 allocated from 10.0.0.0/24, 
BandwidthManager:       EDT with BPF   [ens192]
Host Routing:           BPF
Masquerading:           BPF   [ens192]   10.0.0.0/24 [IPv4: Enabled, IPv6: Disabled]
Controller Status:      26/26 healthy
Proxy Status:           OK, ip 10.0.0.228, 0 redirects active on ports 10000-20000
Hubble:                 Ok   Current/Max Flows: 4095/4095 (100.00%), Flows/s: 69.63   Metrics: Disabled
Encryption:             Disabled
Cluster health:            Probe disabled

Defaulted container "cilium-agent" out of: cilium-agent, clean-cilium-state (init)
IP PREFIX/ADDRESS   IDENTITY
10.0.1.186/32       identity=59824 encryptkey=0 tunnelendpoint=10.169.72.233   
0.0.0.0/0           identity=2 encryptkey=0 tunnelendpoint=0.0.0.0             
10.3.72.239/32      identity=1 encryptkey=0 tunnelendpoint=0.0.0.0             
10.169.72.239/32    identity=1 encryptkey=0 tunnelendpoint=0.0.0.0             
10.0.0.228/32       identity=1 encryptkey=0 tunnelendpoint=0.0.0.0             
10.0.1.125/32       identity=59824 encryptkey=0 tunnelendpoint=10.169.72.233   
10.0.1.126/32       identity=7949 encryptkey=0 tunnelendpoint=10.169.72.233    
10.0.1.136/32       identity=24926 encryptkey=0 tunnelendpoint=10.169.72.233   
10.0.1.162/32       identity=60997 encryptkey=0 tunnelendpoint=10.169.72.233   
10.169.72.233/32    identity=6 encryptkey=0 tunnelendpoint=10.169.72.233       
10.0.0.1/32         identity=57112 encryptkey=0 tunnelendpoint=0.0.0.0         
10.0.0.113/32       identity=824 encryptkey=0 tunnelendpoint=0.0.0.0           
10.0.1.52/32        identity=824 encryptkey=0 tunnelendpoint=10.169.72.233     
10.0.1.116/32       identity=6 encryptkey=0 tunnelendpoint=10.169.72.233       

Defaulted container "cilium-agent" out of: cilium-agent, clean-cilium-state (init)
Endpoint   Source   FQDN   TTL   ExpirationTime   IPs   

```

**Comment by vincentmli** [comment]
@wenhuwang 

are you still able to reproduce the issue in your local lab test or production? I think cilium agent debug log would be helpful when the issue happens, specifically watch the logs with `subsys=fqdn` and `subsys=fqdn/dnsproxy`, below is a working example log, when you can reproduce the failure, watch if the dnsproxy has received the DNS request from pod and DNS response from coredns as proxy

```
level=debug msg="Adding CiliumNetworkPolicy" ciliumNetworkPolicyName=baidu-fqdn k8sApiVersion=cilium.io/v2 k8sNamespace=default subsys=k8s-watcher
level=info msg="Policy Add Request" ciliumNetworkPolicy="[&{EndpointSelector:{\"matchLabels\":{\"any:app\":\"netshoot\",\"k8s:io.kubernetes.pod.namespace\":\"default\"}} NodeSelector:{} Ingress:[] IngressDeny:[] Egress:[{EgressCommonRule:{ToEndpoints:[] ToRequires:[] ToCIDR: ToCIDRSet:[] ToEntities:[] ToServices:[] ToGroups:[] aggregatedSelectors:[{LabelSelector:0xc0003f11c0 requirements:0xc00000dbf0 cachedLabelSelectorString:&LabelSelector{MatchLabels:map[string]string{reserved.none: ,},MatchExpressions:[]LabelSelectorRequirement{},}}]} ToPorts:[] ToFQDNs:[{MatchName:www.baidu.com MatchPattern:}] ICMPs:[]} {EgressCommonRule:{ToEndpoints:[{\"matchLabels\":{\"k8s:io.kubernetes.pod.namespace\":\"kube-system\",\"k8s:k8s-app\":\"kube-dns\"}}] ToRequires:[] ToCIDR: ToCIDRSet:[] ToEntities:[] ToServices:[] ToGroups:[] aggregatedSelectors:[]} ToPorts:[{Ports:[{Port:53 Protocol:ANY}] TerminatingTLS:<nil> OriginatingTLS:<nil> Rules:0xc0001a1880}] ToFQDNs:[] ICMPs:[]}] EgressDeny:[] Labels:[k8s:io.cilium.k8s.policy.derived-from=CiliumNetworkPolicy k8s:io.cilium.k8s.policy.name=baidu-fqdn k8s:io.cilium.k8s.policy.namespace=default k8s:io.cilium.k8s.policy.uid=5930c622-5233-4dde-8f27-e2bfabb16308] Description:}]" policyAddRequest=051a4463-9215-43c7-8020-bfc987922c41 subsys=daemon
level=info msg="Imported CiliumNetworkPolicy" ciliumNetworkPolicyName=baidu-fqdn k8sApiVersion=cilium.io/v2 k8sNamespace=default subsys=k8s-watcher
level=debug msg=mapSelectorsToIPs fqdnSelectors="map[{www.baidu.com }:{}]" subsys=fqdn
level=debug msg="Emitting matching DNS Name -> IPs for FQDNSelector" DNSName=www.baidu.com. IPs="[]" matchName=www.baidu.com subsys=fqdn
level=debug msg="getting identities for IPs associated with FQDNSelector" fqdnSelector="{www.baidu.com }" ips="[]" subsys=fqdn
level=debug msg="Handling DNS query from endpoint" DNSRequestID=41144 dnsName=www.baidu.com.default.svc.cluster.local. ipAddr="10.0.1.65:36684" subsys=fqdn/dnsproxy
level=debug msg="Handling DNS query from endpoint" DNSRequestID=40333 dnsName=www.baidu.com.default.svc.cluster.local. ipAddr="10.0.1.65:36684" subsys=fqdn/dnsproxy
level=debug msg="Found target server to of DNS request secID {ID:59824 Source:custom-resource shadowed:false}" DNSRequestID=41144 dnsName=www.baidu.com.default.svc.cluster.local. endpointID=30 ipAddr="10.0.1.65:36684" server="10.0.1.130:53" subsys=fqdn/dnsproxy
level=debug msg="Found target server to of DNS request secID {ID:59824 Source:custom-resource shadowed:false}" DNSRequestID=40333 dnsName=www.baidu.com.default.svc.cluster.local. endpointID=30 ipAddr="10.0.1.65:36684" server="10.0.1.130:53" subsys=fqdn/dnsproxy
level=debug msg="Forwarding DNS request for a name that is allowed" DNSRequestID=41144 dnsName=www.baidu.com.default.svc.cluster.local. endpointID=30 ipAddr="10.0.1.65:36684" subsys=fqdn/dnsproxy
level=debug msg="Forwarding DNS request for a name that is allowed" DNSRequestID=40333 dnsName=www.baidu.com.default.svc.cluster.local. endpointID=30 ipAddr="10.0.1.65:36684" subsys=fqdn/dnsproxy
level=debug msg="Received DNS response to proxied lookup" DNSRequestID=41144 dnsName=www.baidu.com.default.svc.cluster.local. endpointID=30 ipAddr="10.0.1.65:36684" resp=";; opcode: QUERY, status: NXDOMAIN, id: 64516\n;; flags: qr aa rd; QUERY: 1, ANSWER: 0, AUTHORITY: 1, ADDITIONAL: 0\n\n;; QUESTION SECTION:\n;www.baidu.com.default.svc.cluster.local.\tIN\t AAAA\n\n;; AUTHORITY SECTION:\ncluster.local.\t30\tIN\tSOA\tns.dns.cluster.local. hostmaster.cluster.local. 1642791120 7200 1800 86400 30\n" subsys=fqdn/dnsproxy
level=debug msg="Notifying with DNS response to original DNS query" DNSRequestID=41144 dnsName=www.baidu.com.default.svc.cluster.local. endpointID=30 ipAddr="10.0.1.65:36684" subsys=fqdn/dnsproxy
level=debug msg="Responding to original DNS query" DNSRequestID=41144 dnsName=www.baidu.com.default.svc.cluster.local. endpointID=30 ipAddr="10.0.1.65:36684" subsys=fqdn/dnsproxy
level=debug msg="Received DNS response to proxied lookup" DNSRequestID=40333 dnsName=www.baidu.com.default.svc.cluster.local. endpointID=30 ipAddr="10.0.1.65:36684" resp=";; opcode: QUERY, status: NXDOMAIN, id: 56451\n;; flags: qr aa rd; QUERY: 1, ANSWER: 0, AUTHORITY: 1, ADDITIONAL: 0\n\n;; QUESTION SECTION:\n;www.baidu.com.default.svc.cluster.local.\tIN\t A\n\n;; AUTHORITY SECTION:\ncluster.local.\t30\tIN\tSOA\tns.dns.cluster.local. hostmaster.cluster.local. 1642791120 7200 1800 86400 30\n" subsys=fqdn/dnsproxy
level=debug msg="Notifying with DNS response to original DNS query" DNSRequestID=40333 dnsName=www.baidu.com.default.svc.cluster.local. endpointID=30 ipAddr="10.0.1.65:36684" subsys=fqdn/dnsproxy
level=debug msg="dnsproxy: Wrote DNS response (150/150 bytes) from 10.0.1.130:53 to 10.0.1.65:36684" subsys=fqdn/dnsproxy
level=debug msg="Responding to original DNS query" DNSRequestID=40333 dnsName=www.baidu.com.default.svc.cluster.local. endpointID=30 ipAddr="10.0.1.65:36684" subsys=fqdn/dnsproxy
level=debug msg="dnsproxy: Wrote DNS response (150/150 bytes) from 10.0.1.130:53 to 10.0.1.65:36684" subsys=fqdn/dnsproxy
level=debug msg="Handling DNS query from endpoint" DNSRequestID=8308 dnsName=www.baidu.com.svc.cluster.local. ipAddr="10.0.1.65:49462" subsys=fqdn/dnsproxy
level=debug msg="Found target server to of DNS request secID {ID:59824 Source:custom-resource shadowed:false}" DNSRequestID=8308 dnsName=www.baidu.com.svc.cluster.local. endpointID=30 ipAddr="10.0.1.65:49462" server="10.0.1.130:53" subsys=fqdn/dnsproxy
level=debug msg="Handling DNS query from endpoint" DNSRequestID=7396 dnsName=www.baidu.com.svc.cluster.local. ipAddr="10.0.1.65:49462" subsys=fqdn/dnsproxy
level=debug msg="Forwarding DNS request for a name that is allowed" DNSRequestID=8308 dnsName=www.baidu.com.svc.cluster.local. endpointID=30 ipAddr="10.0.1.65:49462" subsys=fqdn/dnsproxy
level=debug msg="Found target server to of DNS request secID {ID:59824 Source:custom-resource shadowed:false}" DNSRequestID=7396 dnsName=www.baidu.com.svc.cluster.local. endpointID=30 ipAddr="10.0.1.65:49462" server="10.0.1.130:53" subsys=fqdn/dnsproxy
level=debug msg="Forwarding DNS request for a name that is allowed" DNSRequestID=7396 dnsName=www.baidu.com.svc.cluster.local. endpointID=30 ipAddr="10.0.1.65:49462" subsys=fqdn/dnsproxy
level=debug msg="Received DNS response to proxied lookup" DNSRequestID=7396 dnsName=www.baidu.com.svc.cluster.local. endpointID=30 ipAddr="10.0.1.65:49462" resp=";; opcode: QUERY, status: NXDOMAIN, id: 19723\n;; flags: qr aa rd; QUERY: 1, ANSWER: 0, AUTHORITY: 1, ADDITIONAL: 0\n\n;; QUESTION SECTION:\n;www.baidu.com.svc.cluster.local.\tIN\t A\n\n;; AUTHORITY SECTION:\ncluster.local.\t30\tIN\tSOA\tns.dns.cluster.local. hostmaster.cluster.local. 1642791120 7200 1800 86400 30\n" subsys=fqdn/dnsproxy
level=debug msg="Notifying with DNS response to original DNS query" DNSRequestID=7396 dnsName=www.baidu.com.svc.cluster.local. endpointID=30 ipAddr="10.0.1.65:49462" subsys=fqdn/dnsproxy
level=debug msg="Received DNS response to proxied lookup" DNSRequestID=8308 dnsName=www.baidu.com.svc.cluster.local. endpointID=30 ipAddr="10.0.1.65:49462" resp=";; opcode: QUERY, status: NXDOMAIN, id: 57845\n;; flags: qr aa rd; QUERY: 1, ANSWER: 0, AUTHORITY: 1, ADDITIONAL: 0\n\n;; QUESTION SECTION:\n;www.baidu.com.svc.cluster.local.\tIN\t AAAA\n\n;; AUTHORITY SECTION:\ncluster.local.\t30\tIN\tSOA\tns.dns.cluster.local. hostmaster.cluster.local. 1642791120 7200 1800 86400 30\n" subsys=fqdn/dnsproxy
level=debug msg="Notifying with DNS response to original DNS query" DNSRequestID=8308 dnsName=www.baidu.com.svc.cluster.local. endpointID=30 ipAddr="10.0.1.65:49462" subsys=fqdn/dnsproxy
level=debug msg="Responding to original DNS query" DNSRequestID=7396 dnsName=www.baidu.com.svc.cluster.local. endpointID=30 ipAddr="10.0.1.65:49462" subsys=fqdn/dnsproxy
level=debug msg="Responding to original DNS query" DNSRequestID=8308 dnsName=www.baidu.com.svc.cluster.local. endpointID=30 ipAddr="10.0.1.65:49462" subsys=fqdn/dnsproxy
level=debug msg="dnsproxy: Wrote DNS response (142/142 bytes) from 10.0.1.130:53 to 10.0.1.65:49462" subsys=fqdn/dnsproxy
level=debug msg="dnsproxy: Wrote DNS response (142/142 bytes) from 10.0.1.130:53 to 10.0.1.65:49462" subsys=fqdn/dnsproxy
level=debug msg="Handling DNS query from endpoint" DNSRequestID=59344 dnsName=www.baidu.com.cluster.local. ipAddr="10.0.1.65:44532" subsys=fqdn/dnsproxy
level=debug msg="Found target server to of DNS request secID {ID:59824 Source:custom-resource shadowed:false}" DNSRequestID=59344 dnsName=www.baidu.com.cluster.local. endpointID=30 ipAddr="10.0.1.65:44532" server="10.0.1.61:53" subsys=fqdn/dnsproxy
level=debug msg="Forwarding DNS request for a name that is allowed" DNSRequestID=59344 dnsName=www.baidu.com.cluster.local. endpointID=30 ipAddr="10.0.1.65:44532" subsys=fqdn/dnsproxy
level=debug msg="Handling DNS query from endpoint" DNSRequestID=60225 dnsName=www.baidu.com.cluster.local. ipAddr="10.0.1.65:44532" subsys=fqdn/dnsproxy
level=debug msg="Found target server to of DNS request secID {ID:59824 Source:custom-resource shadowed:false}" DNSRequestID=60225 dnsName=www.baidu.com.cluster.local. endpointID=30 ipAddr="10.0.1.65:44532" server="10.0.1.61:53" subsys=fqdn/dnsproxy
level=debug msg="Forwarding DNS request for a name that is allowed" DNSRequestID=60225 dnsName=www.baidu.com.cluster.local. endpointID=30 ipAddr="10.0.1.65:44532" subsys=fqdn/dnsproxy
level=debug msg="Received DNS response to proxied lookup" DNSRequestID=59344 dnsName=www.baidu.com.cluster.local. endpointID=30 ipAddr="10.0.1.65:44532" resp=";; opcode: QUERY, status: NXDOMAIN, id: 27311\n;; flags: qr aa rd; QUERY: 1, ANSWER: 0, AUTHORITY: 1, ADDITIONAL: 0\n\n;; QUESTION SECTION:\n;www.baidu.com.cluster.local.\tIN\t A\n\n;; AUTHORITY SECTION:\ncluster.local.\t30\tIN\tSOA\tns.dns.cluster.local. hostmaster.cluster.local. 1642791120 7200 1800 86400 30\n" subsys=fqdn/dnsproxy
level=debug msg="Notifying with DNS response to original DNS query" DNSRequestID=59344 dnsName=www.baidu.com.cluster.local. endpointID=30 ipAddr="10.0.1.65:44532" subsys=fqdn/dnsproxy
level=debug msg="Responding to original DNS query" DNSRequestID=59344 dnsName=www.baidu.com.cluster.local. endpointID=30 ipAddr="10.0.1.65:44532" subsys=fqdn/dnsproxy
level=debug msg="dnsproxy: Wrote DNS response (138/138 bytes) from 10.0.1.61:53 to 10.0.1.65:44532" subsys=fqdn/dnsproxy
level=debug msg="Received DNS response to proxied lookup" DNSRequestID=60225 dnsName=www.baidu.com.cluster.local. endpointID=30 ipAddr="10.0.1.65:44532" resp=";; opcode: QUERY, status: NXDOMAIN, id: 35742\n;; flags: qr aa rd; QUERY: 1, ANSWER: 0, AUTHORITY: 1, ADDITIONAL: 0\n\n;; QUESTION SECTION:\n;www.baidu.com.cluster.local.\tIN\t AAAA\n\n;; AUTHORITY SECTION:\ncluster.local.\t30\tIN\tSOA\tns.dns.cluster.local. hostmaster.cluster.local. 1642791120 7200 1800 86400 30\n" subsys=fqdn/dnsproxy
level=debug msg="Notifying with DNS response to original DNS query" DNSRequestID=60225 dnsName=www.baidu.com.cluster.local. endpointID=30 ipAddr="10.0.1.65:44532" subsys=fqdn/dnsproxy
level=debug msg="Responding to original DNS query" DNSRequestID=60225 dnsName=www.baidu.com.cluster.local. endpointID=30 ipAddr="10.0.1.65:44532" subsys=fqdn/dnsproxy
level=debug msg="dnsproxy: Wrote DNS response (138/138 bytes) from 10.0.1.61:53 to 10.0.1.65:44532" subsys=fqdn/dnsproxy
level=debug msg="Handling DNS query from endpoint" DNSRequestID=47721 dnsName=www.baidu.com.es.f5net.com. ipAddr="10.0.1.65:41654" subsys=fqdn/dnsproxy
level=debug msg="Handling DNS query from endpoint" DNSRequestID=48502 dnsName=www.baidu.com.es.f5net.com. ipAddr="10.0.1.65:41654" subsys=fqdn/dnsproxy
level=debug msg="Found target server to of DNS request secID {ID:59824 Source:custom-resource shadowed:false}" DNSRequestID=47721 dnsName=www.baidu.com.es.f5net.com. endpointID=30 ipAddr="10.0.1.65:41654" server="10.0.1.130:53" subsys=fqdn/dnsproxy
level=debug msg="Forwarding DNS request for a name that is allowed" DNSRequestID=47721 dnsName=www.baidu.com.es.f5net.com. endpointID=30 ipAddr="10.0.1.65:41654" subsys=fqdn/dnsproxy
level=debug msg="Found target server to of DNS request secID {ID:59824 Source:custom-resource shadowed:false}" DNSRequestID=48502 dnsName=www.baidu.com.es.f5net.com. endpointID=30 ipAddr="10.0.1.65:41654" server="10.0.1.130:53" subsys=fqdn/dnsproxy
level=debug msg="Forwarding DNS request for a name that is allowed" DNSRequestID=48502 dnsName=www.baidu.com.es.f5net.com. endpointID=30 ipAddr="10.0.1.65:41654" subsys=fqdn/dnsproxy
level=debug msg="Received DNS response to proxied lookup" DNSRequestID=47721 dnsName=www.baidu.com.es.f5net.com. endpointID=30 ipAddr="10.0.1.65:41654" resp=";; opcode: QUERY, status: NXDOMAIN, id: 13994\n;; flags: qr aa rd; QUERY: 1, ANSWER: 0, AUTHORITY: 1, ADDITIONAL: 0\n\n;; QUESTION SECTION:\n;www.baidu.com.es.f5net.com.\tIN\t A\n\n;; AUTHORITY SECTION:\nes.f5net.com.\t30\tIN\tSOA\tns1.es.f5net.com. esnetowners.f5.com. 2022011202 1800 900 604800 30\n" subsys=fqdn/dnsproxy
level=debug msg="Notifying with DNS response to original DNS query" DNSRequestID=47721 dnsName=www.baidu.com.es.f5net.com. endpointID=30 ipAddr="10.0.1.65:41654" subsys=fqdn/dnsproxy
level=debug msg="Responding to original DNS query" DNSRequestID=47721 dnsName=www.baidu.com.es.f5net.com. endpointID=30 ipAddr="10.0.1.65:41654" subsys=fqdn/dnsproxy
level=debug msg="dnsproxy: Wrote DNS response (126/126 bytes) from 10.0.1.130:53 to 10.0.1.65:41654" subsys=fqdn/dnsproxy
level=debug msg="Received DNS response to proxied lookup" DNSRequestID=48502 dnsName=www.baidu.com.es.f5net.com. endpointID=30 ipAddr="10.0.1.65:41654" resp=";; opcode: QUERY, status: NXDOMAIN, id: 46691\n;; flags: qr aa rd; QUERY: 1, ANSWER: 0, AUTHORITY: 1, ADDITIONAL: 0\n\n;; QUESTION SECTION:\n;www.baidu.com.es.f5net.com.\tIN\t AAAA\n\n;; AUTHORITY SECTION:\nes.f5net.com.\t30\tIN\tSOA\tns1.es.f5net.com. esnetowners.f5.com. 2022011202 1800 900 604800 30\n" subsys=fqdn/dnsproxy
level=debug msg="Notifying with DNS response to original DNS query" DNSRequestID=48502 dnsName=www.baidu.com.es.f5net.com. endpointID=30 ipAddr="10.0.1.65:41654" subsys=fqdn/dnsproxy
level=debug msg="Responding to original DNS query" DNSRequestID=48502 dnsName=www.baidu.com.es.f5net.com. endpointID=30 ipAddr="10.0.1.65:41654" subsys=fqdn/dnsproxy
level=debug msg="dnsproxy: Wrote DNS response (126/126 bytes) from 10.0.1.130:53 to 10.0.1.65:41654" subsys=fqdn/dnsproxy
level=debug msg="Handling DNS query from endpoint" DNSRequestID=43500 dnsName=www.baidu.com. ipAddr="10.0.1.65:47846" subsys=fqdn/dnsproxy
level=debug msg="Found target server to of DNS request secID {ID:59824 Source:custom-resource shadowed:false}" DNSRequestID=43500 dnsName=www.baidu.com. endpointID=30 ipAddr="10.0.1.65:47846" server="10.0.1.61:53" subsys=fqdn/dnsproxy
level=debug msg="Forwarding DNS request for a name that is allowed" DNSRequestID=43500 dnsName=www.baidu.com. endpointID=30 ipAddr="10.0.1.65:47846" subsys=fqdn/dnsproxy
level=debug msg="Handling DNS query from endpoint" DNSRequestID=44212 dnsName=www.baidu.com. ipAddr="10.0.1.65:47846" subsys=fqdn/dnsproxy
level=debug msg="Found target server to of DNS request secID {ID:59824 Source:custom-resource shadowed:false}" DNSRequestID=44212 dnsName=www.baidu.com. endpointID=30 ipAddr="10.0.1.65:47846" server="10.0.1.61:53" subsys=fqdn/dnsproxy
level=debug msg="Forwarding DNS request for a name that is allowed" DNSRequestID=44212 dnsName=www.baidu.com. endpointID=30 ipAddr="10.0.1.65:47846" subsys=fqdn/dnsproxy
level=debug msg="Received DNS response to proxied lookup" DNSRequestID=43500 dnsName=www.baidu.com. endpointID=30 ipAddr="10.0.1.65:47846" resp=";; opcode: QUERY, status: NOERROR, id: 26675\n;; flags: qr rd ra; QUERY: 1, ANSWER: 4, AUTHORITY: 0, ADDITIONAL: 0\n\n;; QUESTION SECTION:\n;www.baidu.com.\tIN\t A\n\n;; ANSWER SECTION:\nwww.baidu.com.\t30\tIN\tCNAME\twww.a.shifen.com.\nwww.a.shifen.com.\t30\tIN\tCNAME\twww.wshifen.com.\nwww.wshifen.com.\t30\tIN\tA\t104.193.88.123\nwww.wshifen.com.\t30\tIN\tA\t104.193.88.77\n" subsys=fqdn/dnsproxy
level=debug msg="Notifying with DNS response to original DNS query" DNSRequestID=43500 dnsName=www.baidu.com. endpointID=30 ipAddr="10.0.1.65:47846" subsys=fqdn/dnsproxy
level=debug msg="Updated FQDN with new IPs" IPs="[104.193.88.123 104.193.88.77]" fqdnSelectorsToUpdate="map[{www.baidu.com }:{}]" matchName=www.baidu.com. subsys=fqdn
level=debug msg=mapSelectorsToIPs fqdnSelectors="map[{www.baidu.com }:{}]" subsys=fqdn
level=debug msg="Emitting matching DNS Name -> IPs for FQDNSelector" DNSName=www.baidu.com. IPs="[104.193.88.77 104.193.88.123]" matchName=www.baidu.com subsys=fqdn
level=debug msg="getting identities for IPs associated with FQDNSelector" fqdnSelector="{www.baidu.com }" ips="[104.193.88.77 104.193.88.123]" subsys=daemon
level=debug msg="updating FQDN selector" fqdnSelectorString="{www.baidu.com }" identitySlice="[16777218 16777219]" subsys=daemon
level=debug msg="Responding to original DNS query" DNSRequestID=43500 dnsName=www.baidu.com. endpointID=30 ipAddr="10.0.1.65:47846" subsys=fqdn/dnsproxy
level=debug msg="dnsproxy: Wrote DNS response (181/181 bytes) from 10.0.1.61:53 to 10.0.1.65:47846" subsys=fqdn/dnsproxy
level=debug msg="Received DNS response to proxied lookup" DNSRequestID=44212 dnsName=www.baidu.com. endpointID=30 ipAddr="10.0.1.65:47846" resp=";; opcode: QUERY, status: NOERROR, id: 50379\n;; flags: qr rd ra; QUERY: 1, ANSWER: 2, AUTHORITY: 0, ADDITIONAL: 0\n\n;; QUESTION SECTION:\n;www.baidu.com.\tIN\t AAAA\n\n;; ANSWER SECTION:\nwww.baidu.com.\t30\tIN\tCNAME\twww.a.shifen.com.\nwww.a.shifen.com.\t30\tIN\tCNAME\twww.wshifen.com.\n" subsys=fqdn/dnsproxy
level=debug msg="Notifying with DNS response to original DNS query" DNSRequestID=44212 dnsName=www.baidu.com. endpointID=30 ipAddr="10.0.1.65:47846" subsys=fqdn/dnsproxy
level=debug msg="Responding to original DNS query" DNSRequestID=44212 dnsName=www.baidu.com. endpointID=30 ipAddr="10.0.1.65:47846" subsys=fqdn/dnsproxy
level=debug msg="dnsproxy: Wrote DNS response (119/119 bytes) from 10.0.1.61:53 to 10.0.1.65:47846" subsys=fqdn/dnsproxy
level=debug msg=mapSelectorsToIPs fqdnSelectors="map[{www.baidu.com }:{}]" subsys=fqdn
level=debug msg="Emitting matching DNS Name -> IPs for FQDNSelector" DNSName=www.baidu.com. IPs="[104.193.88.77 104.193.88.123]" matchName=www.baidu.com subsys=fqdn
level=debug msg="getting identities for IPs associated with FQDNSelector" fqdnSelector="{www.baidu.com }" ips="[104.193.88.77 104.193.88.123]" subsys=daemon
level=debug msg="updating FQDN selector" fqdnSelectorString="{www.baidu.com }" identitySlice="[16777218 16777219]" subsys=daemon
```

**Comment by wenhuwang** [comment]
@vincentmli 
My k8s cluster name is cluster.local, i found that when i remove  dots from cluster name, the fqdn network policy is aviable. but i don't know why.

**Comment by vincentmli** [comment]
@wenhuwang 
how do you check and modify your cluster name? through kubectl or manually change some file?

**Comment by vincentmli** [comment]
@wenhuwang I changed my cluster name from `kubernetes` to `cluster.local` from example  https://medium.com/@manumv1/how-to-rename-a-kubernetes-cluster-c10db35d92aa, I don't have fqdn problem

```
kubectl config view
apiVersion: v1
clusters:
- cluster:
    certificate-authority-data: DATA+OMITTED
    server: https://10.3.72.239:6443
  name: cluster.local
contexts:
- context:
    cluster: cluster.local
    user: kubernetes-admin
  name: kubernetes-admin@cluster.local
current-context: kubernetes-admin@cluster.local
kind: Config
preferences: {}
users:
- name: kubernetes-admin
  user:
    client-certificate-data: REDACTED
    client-key-data: REDACTED
```

**Comment by wenhuwang** [comment]
> @wenhuwang how do you check and modify your cluster name? through kubectl or manually change some file?

After i update cluster name configuration, i use the [kubespray](https://github.com/kubernetes-sigs/kubespray) project to redeploy kubernetes.

**Comment by wenhuwang** [comment]
@vincentmli 
I found that installing cilium using  the `cilium install` command fails, when cluster name contains dots.  the logs look like this:
```
# cilium install --version=v1.10.6
🔮 Auto-detected Kubernetes kind: kind
✨ Running "kind" validation checks
✅ Detected kind version "0.11.1"
ℹ️  using Cilium version "v1.10.6"
🔮 Auto-detected cluster name: kind-kind.local
🔮 Auto-detected IPAM mode: kubernetes
🔮 Auto-detected datapath mode: tunnel
❌ Cluster name "kind-kind.local" cannot contain dots
↩️ Rolling back installation...

Error: Unable to install Cilium: invalid cluster name, dots are not allowed
```

**Comment by vincentmli** [comment]
@wenhuwang if you follow https://docs.cilium.io/en/v1.11/gettingstarted/kubeproxy-free/ to use kubeadm to run kubernetes and cilium, you should be able to use https://medium.com/@manumv1/how-to-rename-a-kubernetes-cluster-c10db35d92aa later to change cluster name with dot, and the fqdn policy should continue to work

**Comment by wenhuwang** [comment]
> should be able to use



> @wenhuwang if you follow https://docs.cilium.io/en/v1.11/gettingstarted/kubeproxy-free/ to use kubeadm to run kubernetes and cilium, you should be able to use https://medium.com/@manumv1/how-to-rename-a-kubernetes-cluster-c10db35d92aa later to change cluster name with dot, and the fqdn policy should continue to work

@vincentmli my cluster is not replacing kube-proxy with cilium, but i will try to change cluster name to use  https://medium.com/@manumv1/how-to-rename-a-kubernetes-cluster-c10db35d92aa .

**Comment by vincentmli** [comment]
sorry I don't know why cilium-cli does not allow dot in cluster name

**Comment by aanm** [comment]
This issue hasn't seen any comment for over two years. Feel free to create a new GitHub issue if you still see the issue persisting with a recent version.
