### ISSUE TITLE
VTEP traffic is being ignored when the cluster is running in WireGuard encryption mode

### ISSUE THREAD

**Issue by jhaprins** [cilium/cilium#31056]
### Is there an existing issue for this?

- [X] I have searched the existing issues

### What happened?

I have my test cluster configured in vxlan tunnel mode and I have WireGuard enabled to encrypt all traffic between the nodes. This works just fine and I can see the traffic being encrypted on the wire. 
I want to test the new VTEP mode introduced in version 1.15, and though IPSEC encryption is stated as incompatible with VTEP mode, wireguard is not, so in theorie it might work. Testing this I noticed that all VTEP traffic is being ignored. Further analysis shows me that the arp requests are visible on the regular interface of the worker node within the vxlan tunnel. For the rest this traffic is fully ignored.

### Cilium Version

1.15.1

### Kernel Version

6.1.73-flatcar

### Kubernetes Version

Client Version: v1.28.6
Kustomize Version: v5.0.4-0.20230601165947-6ce0bf390ce3
Server Version: v1.28.6

### Regression

Probably not

### Sysdump

[cilium-sysdump-20240229-100715.zip](https://github.com/cilium/cilium/files/14446401/cilium-sysdump-20240229-100715.zip)

### Relevant log output

```shell
10:03:34.486384 IP 172.30.19.30.54083 > 172.30.19.255.8472: OTV, flags [I] (0x08), overlay 0, instance 2
ARP, Request who-has 10.128.11.34 tell 10.125.1.1, length 28
10:03:35.510480 IP 172.30.19.30.54083 > 172.30.19.255.8472: OTV, flags [I] (0x08), overlay 0, instance 2
ARP, Request who-has 10.128.11.34 tell 10.125.1.1, length 28
10:03:36.534376 IP 172.30.19.30.54083 > 172.30.19.255.8472: OTV, flags [I] (0x08), overlay 0, instance 2
ARP, Request who-has 10.128.11.34 tell 10.125.1.1, length 28
```

### Cilium Users Document

- [X] Are you a user of Cilium? Please add yourself to the [Users doc](https://github.com/cilium/cilium/blob/main/USERS.md)

### Code of Conduct

- [X] I agree to follow this project's Code of Conduct

**Comment by joestringer** [comment]
What do you mean "VTEP traffic is being ignored"? Exactly what does the VTEP traffic do, and what did you expect to happen to it? I see the unanswered ARP requests, are you expecting Cilium to do ARP response across the VTEP fabric? I wonder if there's just no feature for that. Note that the VTEP support does *not* extend the L2 domain to each Pod in the cluster.

**Comment by jhaprins** [comment]
When I have no encryption enabled (--set encryption.enabled=false) within the cluster arp requests are actually answered and you can create a traffic flow from the VTEP host to any of the pods within the cluster. When traffic within the cluster is encrypted (--set encryption.enabled=true) this does not work anymore because the traffic coming in from the VTEP is not encrypted and will therefor be ignored within the cluster.

The problem is that traffic coming in from outside of the cluster from the VTEP hosts can never adhere to the encryption standards within Cilium inside the cluster.

**Comment by joestringer** [comment]
OK thanks, that makes sense to me. Either the VTEP needs to participate in the encrypted tunnel mesh, or Cilium would need to be adjusted to somehow treat the VTEP-sourced traffic differently to allow it.

I don't know the deep details of how the datapath is behaving in this scenario, but this seems like a case where a contributor could pick up this problem statement and come up with a proposal to solve it. The next step would be to see a concrete proposal.
