### ISSUE TITLE
Connection delays with 1.6 to 1.7 upgrade on a 100+ nodes k8s 1.16 cluster

### ISSUE THREAD

**Issue by nr17** [cilium/cilium#13333]
## Bug report

**General Information**

- Cilium version (run `cilium version`)
```
root@ip-10-93-137-53:~# cilium version
Client: 1.7.9 e7ae39019 2020-09-01T18:39:45-07:00 go version go1.13.15 linux/amd64
Daemon: 1.7.9 e7ae39019 2020-09-01T18:39:45-07:00 go version go1.13.15 linux/amd64
```
- Kernel version (run `uname -a`)
```
root@ip-10-93-137-53:~# uname -a
Linux ip-10-93-137-53 4.15.0-115-generic #116~16.04.1-Ubuntu SMP Wed Aug 26 17:36:48 UTC 2020 x86_64 x86_64 x86_64 GNU/Linux
```

- Orchestration system version in use (e.g. `kubectl version`, Mesos, ...)
```
$ kubectl version
Client Version: version.Info{Major:"1", Minor:"18", GitVersion:"v1.18.3", GitCommit:"2e7996e3e2712684bc73f0dec0200d64eec7fe40", GitTreeState:"clean", BuildDate:"2020-05-21T14:50:54Z", GoVersion:"go1.14.3", Compiler:"gc", Platform:"darwin/amd64"}
Server Version: version.Info{Major:"1", Minor:"16", GitVersion:"v1.16.8", GitCommit:"ec6eb119b81be488b030e849b9e64fda4caaf33c", GitTreeState:"clean", BuildDate:"2020-03-12T20:52:22Z", GoVersion:"go1.13.8", Compiler:"gc", Platform:"linux/amd64"}
```
- Link to relevant artifacts (policies, deployments scripts, ...)
- Generate and upload a system zip:
The cluster has company specific information. So not uploading sysdump.
cilium pod's init log to understand features enabled:
[cilium_init.log](https://github.com/cilium/cilium/files/5302052/cilium_init.log)

**How to reproduce the issue**
client: curl on a macbook
client ------TCP1----> ELB ------TCP2----> K8s worker ---FORWARD--> nginx worker ------> service pod 

It appears that with cilium 1.7, TCP connection setup takes longer than usual. It can happen if k8s worker nodes are dropping TCP SYNs. In this case client (when bypassing ELB) or ELB has to retransmit the TCP SYNs resulting in the delay during the connection setup. TCP1 gets established quickly, but TCP2 gets delayed. This manifests as server hello being received after a delay on the client end.

With 1.7, we see delays in setting up of the connections from the k8s worker node participating in load-balancing traffic from ELB.
(⎈ |dev-c15a-labawsuse-admin:kube-system)curl_delay $ ./test.sh
14:36:11.542605 * Trying 2a0a:4b00:1f7:801e:ef41:502c:a5d:b4db:443...
14:36:11.543085 * TCP_NODELAY set
14:36:11.642760 * Connected to <fqdn> (2a0a:4b00:1f7:801e:ef41:502c:a5d:b4db) port 443 (#0)
14:36:11.646086 * ALPN, offering http/1.1
14:36:11.663677 * successfully set certificate verify locations:
14:36:11.663734 * CAfile: /Users/nrana/opt/anaconda3/ssl/cacert.pem
CApath: none
14:36:11.664176 * TLSv1.3 (OUT), TLS handshake, Client hello (1):
14:36:17.371698 * TLSv1.3 (IN), TLS handshake, Server hello (2):
14:36:17.372159 * TLSv1.3 (IN), TLS handshake, Encrypted Extensions (8):
14:36:17.372291 * TLSv1.3 (IN), TLS handshake, Certificate (11):
14:36:17.373604 * TLSv1.3 (IN), TLS handshake, CERT verify (15):
14:36:17.373879 * TLSv1.3 (IN), TLS handshake, Finished (20):
14:36:17.373986 * TLSv1.3 (OUT), TLS change cipher, Change cipher spec (1):
14:36:17.374054 * TLSv1.3 (OUT), TLS handshake, Finished (20):

![image](https://user-images.githubusercontent.com/5409241/94618172-93d09080-025f-11eb-946d-102a809434c2.png)

The pcap capture is from the nginx host. As we can see the TCP SYN itself reaches the node after 5 secs at 14:36:17 vs 14:36:11 when the client started the connection setup.

Test scripts used
This script keeps running curl and exits if there is a delay of more than 3 seconds.
cat test.sh
```
#!/bin/bash

if [[ $# -eq 0 ]];
then
    url="https://<fqdn>/echo"
else
    url=$1
fi

delay=3
while [ true ]
do
    start=`date +%s`
    curl -w "@curl-format.txt" -s --ipv4 --trace-time -v $url
    echo
    end=`date +%s`

    runtime=$((end-start))
    if [ $runtime -ge $delay ]
    then
        break
    fi
done

echo "Handshake took longer than $delay seconds: $runtime"
echo "exiting test..."
```

This following test bypasses AWS ELB and directly sends the request to the specified k8s worker node. That node forwards the request to the nginx k8s node (using kube-proxy iptables or cilium forwarding).
```
$ cat node-port.sh
#!/bin/bash
dip=$1
delay=3
scriptDuration=60
scriptStart=`date +%s`

while [ true ]
do
    start=`date +%s`
    curl -w "@curl-format.txt" -s --haproxy-protocol  -k --trace-time -v --resolve $host:30465:$dip https://$host:30465/inrotation.txt -H "Host: $host"
    end=`date +%s`
    runtime=$((end-start))
    if [ $runtime -ge $delay ]
    then
        echo "Handshake took longer than $delay seconds: $runtime"
        echo "exiting test..."
        break
    fi

    scriptRunTime=$((end-scriptStart))
    if [ $scriptRunTime -ge $scriptDuration ]
    then
        echo "Ran for $scriptDuration seconds successfully, exiting"
        break
    fi
done
```

This following test runs node-port.sh against all nodes of the cluster, bypassing ELB.
```
$ cat runTestAllNodes.sh
for node in $(kubectl get nodes -o wide | grep -v INT | grep -v master | awk '{print $6}')
do
    echo
    echo ">>> RUNNING on $node"
    ./node-port.sh $node
    echo "<<< DONE on $node"
done
```

runTestAllNodes.sh test result with cilium 1.7:
[1.7-all-nodes-test.log.gz](https://github.com/cilium/cilium/files/5301956/1.7-all-nodes-test.log.gz)

$ grep time_app all-nodes-test.log | grep -v "0\."
time_appconnect: 19.429814s
time_appconnect: 1.300437s
time_appconnect: 1.225390s
time_appconnect: 1.239791s
time_appconnect: 1.233259s
time_appconnect: 1.235974s
time_appconnect: 1.440181s
time_appconnect: 1.244038s
time_appconnect: 1.241509s
time_appconnect: 19.533314s
time_appconnect: 1.178103s
time_appconnect: 1.510683s
time_appconnect: 1.242825s
time_appconnect: 1.228714s
time_appconnect: 1.234639s
time_appconnect: 19.468425s
time_appconnect: 1.236721s
time_appconnect: 1.444458s
time_appconnect: 19.464529s
time_appconnect: 19.438658s
time_appconnect: 19.514127s
time_appconnect: 1.242912s
time_appconnect: 1.052972s
time_appconnect: 1.244528s
time_appconnect: 19.808824s
time_appconnect: 1.243116s
time_appconnect: 19.473240s
time_appconnect: 1.233405s
time_appconnect: 1.253107s
time_appconnect: 19.410588s
time_appconnect: 19.499735s
time_appconnect: 1.246178s
time_appconnect: 19.414737s
time_appconnect: 19.412350s
time_appconnect: 19.458430s
time_appconnect: 1.689954s
time_appconnect: 1.404454s
time_appconnect: 19.575672s
time_appconnect: 1.241366s
time_appconnect: 1.262291s
time_appconnect: 1.250611s
time_appconnect: 1.075596s
time_appconnect: 19.470899s
time_appconnect: 1.240626s
time_appconnect: 1.241299s
time_appconnect: 1.246301s
time_appconnect: 1.143131s
time_appconnect: 1.143642s
time_appconnect: 1.250771s
time_appconnect: 1.279985s
time_appconnect: 19.458716s

runTestAllNodes.sh test result with cilium 1.6:
[1.6-all-nodes-test.log.gz](https://github.com/cilium/cilium/files/5301963/1.6-all-nodes-test.log.gz)

(⎈ |dev-c15a-labawsuse-admin:harness-delegate)curl_delay $ grep time_app 1.6-all-nodes-test.log | grep -v "0\."
time_appconnect: 1.232426s
time_appconnect: 1.437736s
time_appconnect: 1.364282s
time_appconnect: 1.061703s
time_appconnect: 1.228092s
time_appconnect: 1.237797s
time_appconnect: 1.445933s
time_appconnect: 1.236047s
time_appconnect: 1.227650s
time_appconnect: 6.289174s
time_appconnect: 1.446460s
time_appconnect: 1.247768s
time_appconnect: 1.426705s
time_appconnect: 1.543135s
time_appconnect: 1.470899s
time_appconnect: 1.129491s
time_appconnect: 1.762592s
time_appconnect: 1.583169s
time_appconnect: 1.029330s
time_appconnect: 1.424878s
time_appconnect: 1.365455s
time_appconnect: 1.417927s
time_appconnect: 1.137588s
time_appconnect: 1.376337s
time_appconnect: 1.392282s
time_appconnect: 1.343857s
time_appconnect: 1.365737s
time_appconnect: 2.402398s
time_appconnect: 1.396372s
time_appconnect: 1.337604s
time_appconnect: 1.368370s
time_appconnect: 1.291826s
time_appconnect: 1.016252s
time_appconnect: 1.079500s
time_appconnect: 1.228793s
time_appconnect: 1.252302s
time_appconnect: 1.233515s

The curl client for the above tests was running on a mac book. We can see above that for cilium 1.7, client TCP connection setup to the k8s worker node is taking up to 19s. If we look at how a mac kernel's typical behavior for TCP SYNs retransmission, it seems that the 8th retransmitted packet makes it through.
This is evident from the retransmission behavior of Mac based TCP client as shown below in a sample packet capture. The default retransmission times for mac are : {1, 1, 1, 1, 1, 2, 4, 8, 16, 32, 64, 64, 64}

With Linux, the behavior is slightly different. The packets are retranmitted at {1, 3, 7, 15, 31, 65 }th seconds.
And if include ELB in the curl test, we observe server hello delays similar to the intervals above in our tests:
```
grep -B 1 "time_appconnect:  [1-9]" curl-delay.log
       time_connect:  0.101098s
    time_appconnect:  1.272165s
--
       time_connect:  0.099376s
    time_appconnect:  1.416461s
--
       time_connect:  0.104694s
    time_appconnect:  1.312507s
--
       time_connect:  0.116003s
    time_appconnect:  3.436879s
--
       time_connect:  0.098239s
    time_appconnect:  2.278533s
--
       time_connect:  0.111997s
    time_appconnect:  2.593224s
--
       time_connect:  0.108467s
    time_appconnect:  4.377752s
--
       time_connect:  0.101142s
    time_appconnect:  2.794053s
--
       time_connect:  0.123960s
    time_appconnect:  2.135441s
--
       time_connect:  0.135513s
    time_appconnect:  3.324246s
--
       time_connect:  0.131735s
    time_appconnect:  4.841471s
--
       time_connect:  0.100949s
    time_appconnect:  4.262275s
--
       time_connect:  0.110196s
    time_appconnect:  3.167280s
--
       time_connect:  0.105047s
    time_appconnect:  15.219555s
--
       time_connect:  0.106077s
    time_appconnect:  2.364657s
--
       time_connect:  0.101587s
    time_appconnect:  3.769322s
--
       time_connect:  0.113066s
    time_appconnect:  2.928472s
--
       time_connect:  0.124887s
    time_appconnect:  2.163788s
--
       time_connect:  0.141268s
    time_appconnect:  7.765396s
--
       time_connect:  0.114381s
    time_appconnect:  2.177919s
--
       time_connect:  0.136068s
    time_appconnect:  2.922563s
--
       time_connect:  0.112571s
    time_appconnect:  9.829308s
--
       time_connect:  0.371588s
    time_appconnect:  2.168459s
--
       time_connect:  0.102246s
    time_appconnect:  3.488918s
--
       time_connect:  0.290870s
    time_appconnect:  10.606300s
--
       time_connect:  0.104572s
    time_appconnect:  3.303413s
```

This indicates the ELB (most likely a linux based system) is also retransmitting TCP SYNs before it can get a successful TCP conn setup.

**Comment by joestringer** [comment]
Hi @nr17 , thanks for the detailed report!

In the absence of a Cilium sysdump, I'm wondering about the other kinds of information we can get, for instance:
* What kinds of services are involved here? I presume nodeport?
* Are there any network policies in place?
* Is it possible to gather `cilium monitor` output that captures evidence that packets are received to the k8s worker? If there were drops that are related to your specific flow, that would be ideal as it would give specific information about the drops, why, and context that Cilium has at the time.
* Is it possible to reproduce the behaviour from within the cluster or from another IP behind the ELB which is not part of the cluster? For instance, can we tie it down to requests going through a specific worker's nodeport IP?
* If one node's nodeport can be isolated to observe the problem, can we trace which backend the failing connections are translated to? What other info can we get here? If kube-proxy is involved, the iptables rules may have counters (`iptables-save -c`); There may be other info we can get from Cilium itself but it's a little hard to know exactly where to look without knowing how Cilium is configured.

**Comment by nr17** [comment]
More information inline:

> 
> * What kinds of services are involved here? I presume nodeport?
We have a kubernetes Loadbalancer type and a clusterIP type service involved.
client -->ELB-->k8s loadbalancer service (nginx)--> clusterIP service

> * Are there any network policies in place?
yes. Most namespaces have a policy similar to the following anonymized example: 
```
apiVersion: v1
items:
- apiVersion: cilium.io/v2
  kind: CiliumNetworkPolicy
  metadata:
    annotations:
    labels:
      heritage: Tiller
    name: harness-delegates
    namespace: harness-delegate
  specs:
  - egress:
    - toEndpoints:
      - matchLabels:
          k8s:io.kubernetes.pod.namespace: kube-system
          k8s:k8s-app: kube-dns
      toPorts:
      - ports:
        - port: "53"
          protocol: ANY
        rules:
          dns:
          - matchPattern: '*'
    - toServices:
      - k8sService:
          namespace: default
          serviceName: kubernetes
    - toFQDNs:
      - matchName: api.k8s.<cluster-fqdn>
      - matchName: <fqdn1>
      - matchName: <fqdn2>
      - matchName: <fqdn3>
      - matchName: <fqdn4>
      - matchPattern: '*.dev-fqdn5'
      - matchPattern: '*.dev-fqdn6'
      toPorts:
      - ports:
        - port: "443"
          protocol: TCP
    endpointSelector:
      matchLabels:
        app: <app-name>
        harness.io/name: <appl-name>-<cluster-name>
kind: List
metadata:
  resourceVersion: ""
  selfLink: ""
```

> * Is it possible to gather `cilium monitor` output that captures evidence that packets are received to the k8s worker? If there were drops that are related to your specific flow, that would be ideal as it would give specific information about the drops, why, and context that Cilium has at the time.
That is the hardest part. Its difficult to pin-point which node out of 100+ nodes is experiencing packet drops.

> * Is it possible to reproduce the behaviour from within the cluster or from another IP behind the ELB which is not part of the cluster? For instance, can we tie it down to requests going through a specific worker's nodeport IP?
I did not try. I could reproduce it for the following 2 flows (with all 100+ nodes). I wasn't able to reproduce it consistently for a single K8s worker node, hence had to try it on all nodes (1 min for each node) using a script.
1) client ------TCP1----> ELB ------TCP2----> K8s worker ---FORWARD--> nginx worker ------> service pod
2) client ------TCP1------> K8s worker ---FORWARD--> nginx worker ------> service pod

> * If one node's nodeport can be isolated to observe the problem, can we trace which backend the failing connections are translated to? What other info can we get here? If kube-proxy is involved, the iptables rules may have counters (`iptables-save -c`); There may be other info we can get from Cilium itself but it's a little hard to know exactly where to look without knowing how Cilium is configured.
I shared part of the initialization log from one of the cilium pods in the issue. It should have the flags/configuration to know how cilium has been configured.

We have rolled back the cluster to 1.6 for now and plan to stay with 1.6 until this is resolved. I wasn't able to reproduce this in a smaller test cluster. I can try it on the test cluster once again.

**Comment by nr17** [comment]
I am able to reproduce the issue with the flow #2:
client ------TCP1------> K8s worker ---FORWARD--> nginx worker ------> service pod

The test needs to run for few minutes before it encounters the issue. The test exits immediately after letting this connection complete to help stop the capture at that point in time. I captured the packets on the "K8s worker" node, and can see the evidence of TCP SYNs retransmissions and that particular connection attempt getting dropped completely after 7 retransmissions. Subsequently, curl re-attempts the request with a new TCP connection which succeeds. 
```
23612 304.086359254 10.23.255.238 → 10.93.161.68 TCP 80 53760 → 31614 [SYN] Seq=0 Win=65535 Len=0 MSS=1314 WS=64 TSval=210721919 TSecr=0 SACK_PERM=1
23613 304.168508581 10.23.255.238 → 10.93.161.68 TCP 68 29920 → 31614 [ACK] Seq=765 Ack=7722 Win=131072 Len=0 TSval=210722002 TSecr=3794489633
23614 305.098603835 10.23.255.238 → 10.93.161.68 TCP 80 [TCP Retransmission] 53760 → 31614 [SYN] Seq=0 Win=65535 Len=0 MSS=1314 WS=64 TSval=210722919 TSecr=0 SACK_PERM=1
23615 306.109386411 10.23.255.238 → 10.93.161.68 TCP 80 [TCP Retransmission] 53760 → 31614 [SYN] Seq=0 Win=65535 Len=0 MSS=1314 WS=64 TSval=210723919 TSecr=0 SACK_PERM=1
23616 307.120093828 10.23.255.238 → 10.93.161.68 TCP 80 [TCP Retransmission] 53760 → 31614 [SYN] Seq=0 Win=65535 Len=0 MSS=1314 WS=64 TSval=210724919 TSecr=0 SACK_PERM=1
23617 308.128123679 10.23.255.238 → 10.93.161.68 TCP 80 [TCP Retransmission] 53760 → 31614 [SYN] Seq=0 Win=65535 Len=0 MSS=1314 WS=64 TSval=210725919 TSecr=0 SACK_PERM=1
23618 309.135991652 10.23.255.238 → 10.93.161.68 TCP 80 [TCP Retransmission] 53760 → 31614 [SYN] Seq=0 Win=65535 Len=0 MSS=1314 WS=64 TSval=210726919 TSecr=0 SACK_PERM=1
23619 311.150821588 10.23.255.238 → 10.93.161.68 TCP 80 [TCP Retransmission] 53760 → 31614 [SYN] Seq=0 Win=65535 Len=0 MSS=1314 WS=64 TSval=210728919 TSecr=0 SACK_PERM=1
23620 315.188178954 10.23.255.238 → 10.93.161.68 TCP 80 [TCP Retransmission] 53760 → 31614 [SYN] Seq=0 Win=65535 Len=0 MSS=1314 WS=64 TSval=210732919 TSecr=0 SACK_PERM=1

23621 323.250723130 10.23.255.238 → 10.93.161.68 TCP 80 44211 → 31614 [SYN] Seq=0 Win=65535 Len=0 MSS=1314 WS=64 TSval=210740920 TSecr=0 SACK_PERM=1
23622 323.251502277 10.93.161.68 → 10.23.255.238 TCP 76 31614 → 44211 [SYN, ACK] Seq=0 Ack=1 Win=65535 Len=0 MSS=8911 SACK_PERM=1 TSval=1892165730 TSecr=210740920 WS=512
23623 323.352478795 10.23.255.238 → 10.93.161.68 TCP 68 44211 → 31614 [ACK] Seq=1 Ack=1 Win=131456 Len=0 TSval=210741019 TSecr=1892165730
23624 323.368653443 10.23.255.238 → 10.93.161.68 TLSv1 585 Client Hello
23625 323.369390865 10.93.161.68 → 10.23.255.238 TCP 68 31614 → 44211 [ACK] Seq=1 Ack=518 Win=67072 Len=0 TSval=1892165848 TSecr=210741032
23626 323.370455949 10.93.161.68 → 10.23.255.238 TLSv1.3 2672 Server Hello, Change Cipher Spec, Application Data
23627 323.370496752 10.93.161.68 → 10.23.255.238 TCP 1560 31614 → 44211 [PSH, ACK] Seq=2605 Ack=518 Win=67072 Len=1492 TSval=1892165849 TSecr=210741032 [TCP segment of a reassembled PDU]
23628 323.379382848 10.93.161.68 → 10.23.255.238 TLSv1.3 2806 Application Data, Application Data, Application Data
23629 323.469962391 10.23.255.238 → 10.93.161.68 TCP 80 44211 → 31614 [ACK] Seq=518 Ack=1303 Win=130176 Len=0 TSval=210741135 TSecr=1892165849 SLE=3907 SRE=4097
23630 323.470048709 10.23.255.238 → 10.93.161.68 TCP 80 44211 → 31614 [ACK] Seq=518 Ack=2625 Win=128832 Len=0 TSval=210741135 TSecr=1892165849 SLE=3907 SRE=4097
23631 323.470095483 10.23.255.238 → 10.93.161.68 TCP 68 44211 → 31614 [ACK] Seq=518 Ack=4097 Win=127360 Len=0 TSval=210741135 TSecr=1892165849
23632 323.470138579 10.23.255.238 → 10.93.161.68 TCP 68 [TCP Window Update] 44211 → 31614 [ACK] Seq=518 Ack=4097 Win=131072 Len=0 TSval=210741135 TSecr=1892165849
23633 323.485364045 10.23.255.238 → 10.93.161.68 TCP 68 44211 → 31614 [ACK] Seq=518 Ack=6701 Win=128448 Len=0 TSval=210741143 TSecr=1892165858
23634 323.485443204 10.23.255.238 → 10.93.161.68 TCP 68 44211 → 31614 [ACK] Seq=518 Ack=6835 Win=130560 Len=0 TSval=210741143 TSecr=1892165858
23635 323.485488401 10.23.255.238 → 10.93.161.68 TLSv1.3 148 Change Cipher Spec, Application Data
23636 323.485532209 10.23.255.238 → 10.93.161.68 TLSv1.3 210 Application Data
23637 323.486221625 10.93.161.68 → 10.23.255.238 TCP 68 31614 → 44211 [ACK] Seq=6835 Ack=740 Win=68096 Len=0 TSval=1892165964 TSecr=210741144
23638 323.486379938 10.93.161.68 → 10.23.255.238 TLSv1.3 387 Application Data
23639 323.486459964 10.93.161.68 → 10.23.255.238 TLSv1.3 387 Application Data
23640 323.487670455 10.93.161.68 → 10.23.255.238 TLSv1.3 316 Application Data
23641 323.592865075 10.23.255.238 → 10.93.161.68 TCP 68 44211 → 31614 [ACK] Seq=740 Ack=7154 Win=130752 Len=0 TSval=210741257 TSecr=1892165965
23642 323.599854733 10.23.255.238 → 10.93.161.68 TCP 68 44211 → 31614 [ACK] Seq=740 Ack=7473 Win=130432 Len=0 TSval=210741257 TSecr=1892165965
23643 323.599924070 10.23.255.238 → 10.93.161.68 TCP 68 44211 → 31614 [ACK] Seq=740 Ack=7721 Win=130176 Len=0 TSval=210741257 TSecr=1892165966
23644 323.599975514 10.23.255.238 → 10.93.161.68 TLSv1.3 92 Application Data
23645 323.600019429 10.23.255.238 → 10.93.161.68 TCP 68 44211 → 31614 [FIN, ACK] Seq=764 Ack=7721 Win=131072 Len=0 TSval=210741260 TSecr=1892165966
23646 323.600840333 10.93.161.68 → 10.23.255.238 TCP 68 31614 → 44211 [FIN, ACK] Seq=7721 Ack=765 Win=68096 Len=0 TSval=1892166079 TSecr=210741258
23647 323.697888857 10.23.255.238 → 10.93.161.68 TCP 68 44211 → 31614 [ACK] Seq=765 Ack=7722 Win=131072 Len=0 TSval=210741361 TSecr=1892166079
```

When this happened, I was running "cilium monitor --type drop" on that node and it showed no drops. I'll look into iptables counters next. 

@joestringer Are there any other commands I can run during the test to provide more information?

**Comment by nr17** [comment]
I traced the retransmitted packets using iptables TRACE target. Hopefully it gives some more insights on how packet is being processed.
```
19888 574.443786038 10.23.255.238 → 10.93.161.68 TCP 80 10847 → 31614 [SYN] Seq=0 Win=65535 Len=0 MSS=1314 WS=64 TSval=214521137 TSecr=0 SACK_PERM=1
19889 574.574882611 10.23.255.238 → 10.93.161.68 TCP 68 [TCP Out-Of-Order] 38034 → 31614 [FIN, ACK] Seq=764 Ack=7722 Win=131072 Len=0 TSval=214521261 TSecr=1357157174
19890 575.493765422 10.23.255.238 → 10.93.161.68 TCP 80 [TCP Retransmission] 10847 → 31614 [SYN] Seq=0 Win=65535 Len=0 MSS=1314 WS=64 TSval=214522137 TSecr=0 SACK_PERM=1
19891 576.524750576 10.23.255.238 → 10.93.161.68 TCP 80 [TCP Retransmission] 10847 → 31614 [SYN] Seq=0 Win=65535 Len=0 MSS=1314 WS=64 TSval=214523137 TSecr=0 SACK_PERM=1
19892 577.561820855 10.23.255.238 → 10.93.161.68 TCP 80 [TCP Retransmission] 10847 → 31614 [SYN] Seq=0 Win=65535 Len=0 MSS=1314 WS=64 TSval=214524137 TSecr=0 SACK_PERM=1
19893 578.472620454 10.23.255.238 → 10.93.161.68 TCP 80 [TCP Retransmission] 10847 → 31614 [SYN] Seq=0 Win=65535 Len=0 MSS=1314 WS=64 TSval=214525137 TSecr=0 SACK_PERM=1
19894 579.465606343 10.23.255.238 → 10.93.161.68 TCP 80 [TCP Retransmission] 10847 → 31614 [SYN] Seq=0 Win=65535 Len=0 MSS=1314 WS=64 TSval=214526138 TSecr=0 SACK_PERM=1
19895 581.482515465 10.23.255.238 → 10.93.161.68 TCP 80 [TCP Retransmission] 10847 → 31614 [SYN] Seq=0 Win=65535 Len=0 MSS=1314 WS=64 TSval=214528138 TSecr=0 SACK_PERM=1
19896 585.563366172 10.23.255.238 → 10.93.161.68 TCP 80 [TCP Retransmission] 10847 → 31614 [SYN] Seq=0 Win=65535 Len=0 MSS=1314 WS=64 TSval=214532138 TSecr=0 SACK_PERM=1
```

```
cat 10847-drop-2.log
[6024175.564697] TRACE: raw:PREROUTING:policy:2 IN=eth0 OUT= MAC=02:ed:1c:0f:e6:e7:02:38:31:84:2b:d5:08:00 SRC=10.23.255.238 DST=10.93.161.68 LEN=64 TOS=0x00 PREC=0x00 TTL=56 ID=0 DF PROTO=TCP SPT=10847 DPT=31614 SEQ=1689139364 ACK=0 WINDOW=65535 RES=0x00 SYN URGP=0 OPT (02040522010303060101080A0CC955310000000004020000)
[6024175.564706] TRACE: mangle:PREROUTING:policy:1 IN=eth0 OUT= MAC=02:ed:1c:0f:e6:e7:02:38:31:84:2b:d5:08:00 SRC=10.23.255.238 DST=10.93.161.68 LEN=64 TOS=0x00 PREC=0x00 TTL=56 ID=0 DF PROTO=TCP SPT=10847 DPT=31614 SEQ=1689139364 ACK=0 WINDOW=65535 RES=0x00 SYN URGP=0 OPT (02040522010303060101080A0CC955310000000004020000)
[6024175.564712] TRACE: nat:PREROUTING:rule:1 IN=eth0 OUT= MAC=02:ed:1c:0f:e6:e7:02:38:31:84:2b:d5:08:00 SRC=10.23.255.238 DST=10.93.161.68 LEN=64 TOS=0x00 PREC=0x00 TTL=56 ID=0 DF PROTO=TCP SPT=10847 DPT=31614 SEQ=1689139364 ACK=0 WINDOW=65535 RES=0x00 SYN URGP=0 OPT (02040522010303060101080A0CC955310000000004020000)
[6024175.564789] TRACE: nat:KUBE-SERVICES:rule:135 IN=eth0 OUT= MAC=02:ed:1c:0f:e6:e7:02:38:31:84:2b:d5:08:00 SRC=10.23.255.238 DST=10.93.161.68 LEN=64 TOS=0x00 PREC=0x00 TTL=56 ID=0 DF PROTO=TCP SPT=10847 DPT=31614 SEQ=1689139364 ACK=0 WINDOW=65535 RES=0x00 SYN URGP=0 OPT (02040522010303060101080A0CC955310000000004020000)
[6024175.564796] TRACE: nat:KUBE-NODEPORTS:rule:11 IN=eth0 OUT= MAC=02:ed:1c:0f:e6:e7:02:38:31:84:2b:d5:08:00 SRC=10.23.255.238 DST=10.93.161.68 LEN=64 TOS=0x00 PREC=0x00 TTL=56 ID=0 DF PROTO=TCP SPT=10847 DPT=31614 SEQ=1689139364 ACK=0 WINDOW=65535 RES=0x00 SYN URGP=0 OPT (02040522010303060101080A0CC955310000000004020000)
[6024175.564801] TRACE: nat:KUBE-MARK-MASQ:rule:1 IN=eth0 OUT= MAC=02:ed:1c:0f:e6:e7:02:38:31:84:2b:d5:08:00 SRC=10.23.255.238 DST=10.93.161.68 LEN=64 TOS=0x00 PREC=0x00 TTL=56 ID=0 DF PROTO=TCP SPT=10847 DPT=31614 SEQ=1689139364 ACK=0 WINDOW=65535 RES=0x00 SYN URGP=0 OPT (02040522010303060101080A0CC955310000000004020000)
[6024175.564807] TRACE: nat:KUBE-MARK-MASQ:return:2 IN=eth0 OUT= MAC=02:ed:1c:0f:e6:e7:02:38:31:84:2b:d5:08:00 SRC=10.23.255.238 DST=10.93.161.68 LEN=64 TOS=0x00 PREC=0x00 TTL=56 ID=0 DF PROTO=TCP SPT=10847 DPT=31614 SEQ=1689139364 ACK=0 WINDOW=65535 RES=0x00 SYN URGP=0 OPT (02040522010303060101080A0CC955310000000004020000) MARK=0x4000
[6024175.564813] TRACE: nat:KUBE-NODEPORTS:rule:12 IN=eth0 OUT= MAC=02:ed:1c:0f:e6:e7:02:38:31:84:2b:d5:08:00 SRC=10.23.255.238 DST=10.93.161.68 LEN=64 TOS=0x00 PREC=0x00 TTL=56 ID=0 DF PROTO=TCP SPT=10847 DPT=31614 SEQ=1689139364 ACK=0 WINDOW=65535 RES=0x00 SYN URGP=0 OPT (02040522010303060101080A0CC955310000000004020000) MARK=0x4000
[6024175.564862] TRACE: nat:KUBE-SVC-SIHBGXESXOXE7DPQ:rule:5 IN=eth0 OUT= MAC=02:ed:1c:0f:e6:e7:02:38:31:84:2b:d5:08:00 SRC=10.23.255.238 DST=10.93.161.68 LEN=64 TOS=0x00 PREC=0x00 TTL=56 ID=0 DF PROTO=TCP SPT=10847 DPT=31614 SEQ=1689139364 ACK=0 WINDOW=65535 RES=0x00 SYN URGP=0 OPT (02040522010303060101080A0CC955310000000004020000) MARK=0x4000
[6024175.564873] TRACE: nat:KUBE-SEP-6BFXYBUSLTWBG63D:rule:2 IN=eth0 OUT= MAC=02:ed:1c:0f:e6:e7:02:38:31:84:2b:d5:08:00 SRC=10.23.255.238 DST=10.93.161.68 LEN=64 TOS=0x00 PREC=0x00 TTL=56 ID=0 DF PROTO=TCP SPT=10847 DPT=31614 SEQ=1689139364 ACK=0 WINDOW=65535 RES=0x00 SYN URGP=0 OPT (02040522010303060101080A0CC955310000000004020000) MARK=0x4000
[6024175.564883] TRACE: mangle:FORWARD:policy:1 IN=eth0 OUT=cilium_host MAC=02:ed:1c:0f:e6:e7:02:38:31:84:2b:d5:08:00 SRC=10.23.255.238 DST=100.96.26.110 LEN=64 TOS=0x00 PREC=0x00 TTL=55 ID=0 DF PROTO=TCP SPT=10847 DPT=443 SEQ=1689139364 ACK=0 WINDOW=65535 RES=0x00 SYN URGP=0 OPT (02040522010303060101080A0CC955310000000004020000) MARK=0x4000
[6024175.564888] TRACE: filter:FORWARD:rule:1 IN=eth0 OUT=cilium_host MAC=02:ed:1c:0f:e6:e7:02:38:31:84:2b:d5:08:00 SRC=10.23.255.238 DST=100.96.26.110 LEN=64 TOS=0x00 PREC=0x00 TTL=55 ID=0 DF PROTO=TCP SPT=10847 DPT=443 SEQ=1689139364 ACK=0 WINDOW=65535 RES=0x00 SYN URGP=0 OPT (02040522010303060101080A0CC955310000000004020000) MARK=0x4000
[6024175.564894] TRACE: filter:CILIUM_TRANSIENT_FORWARD:rule:1 IN=eth0 OUT=cilium_host MAC=02:ed:1c:0f:e6:e7:02:38:31:84:2b:d5:08:00 SRC=10.23.255.238 DST=100.96.26.110 LEN=64 TOS=0x00 PREC=0x00 TTL=55 ID=0 DF PROTO=TCP SPT=10847 DPT=443 SEQ=1689139364 ACK=0 WINDOW=65535 RES=0x00 SYN URGP=0 OPT (02040522010303060101080A0CC955310000000004020000) MARK=0x4000
[6024175.564898] TRACE: mangle:POSTROUTING:policy:1 IN= OUT=cilium_host SRC=10.23.255.238 DST=100.96.26.110 LEN=64 TOS=0x00 PREC=0x00 TTL=55 ID=0 DF PROTO=TCP SPT=10847 DPT=443 SEQ=1689139364 ACK=0 WINDOW=65535 RES=0x00 SYN URGP=0 OPT (02040522010303060101080A0CC955310000000004020000) MARK=0x4000
[6024175.564902] TRACE: nat:POSTROUTING:rule:1 IN= OUT=cilium_host SRC=10.23.255.238 DST=100.96.26.110 LEN=64 TOS=0x00 PREC=0x00 TTL=55 ID=0 DF PROTO=TCP SPT=10847 DPT=443 SEQ=1689139364 ACK=0 WINDOW=65535 RES=0x00 SYN URGP=0 OPT (02040522010303060101080A0CC955310000000004020000) MARK=0x4000
[6024175.564908] TRACE: nat:KUBE-POSTROUTING:rule:1 IN= OUT=cilium_host SRC=10.23.255.238 DST=100.96.26.110 LEN=64 TOS=0x00 PREC=0x00 TTL=55 ID=0 DF PROTO=TCP SPT=10847 DPT=443 SEQ=1689139364 ACK=0 WINDOW=65535 RES=0x00 SYN URGP=0 OPT (02040522010303060101080A0CC955310000000004020000) MARK=0x4000
[6024176.614685] TRACE: raw:PREROUTING:policy:3 IN=eth0 OUT= MAC=02:ed:1c:0f:e6:e7:02:38:31:84:2b:d5:08:00 SRC=10.23.255.238 DST=10.93.161.68 LEN=64 TOS=0x00 PREC=0x00 TTL=56 ID=0 DF PROTO=TCP SPT=10847 DPT=31614 SEQ=1689139364 ACK=0 WINDOW=65535 RES=0x00 SYN URGP=0 OPT (02040522010303060101080A0CC959190000000004020000)
[6024176.614694] TRACE: mangle:PREROUTING:rule:1 IN=eth0 OUT= MAC=02:ed:1c:0f:e6:e7:02:38:31:84:2b:d5:08:00 SRC=10.23.255.238 DST=10.93.161.68 LEN=64 TOS=0x00 PREC=0x00 TTL=56 ID=0 DF PROTO=TCP SPT=10847 DPT=31614 SEQ=1689139364 ACK=0 WINDOW=65535 RES=0x00 SYN URGP=0 OPT (02040522010303060101080A0CC959190000000004020000)
[6024176.614702] TRACE: mangle:CILIUM_PRE_mangle:return:4 IN=eth0 OUT= MAC=02:ed:1c:0f:e6:e7:02:38:31:84:2b:d5:08:00 SRC=10.23.255.238 DST=10.93.161.68 LEN=64 TOS=0x00 PREC=0x00 TTL=56 ID=0 DF PROTO=TCP SPT=10847 DPT=31614 SEQ=1689139364 ACK=0 WINDOW=65535 RES=0x00 SYN URGP=0 OPT (02040522010303060101080A0CC959190000000004020000)
[6024176.614707] TRACE: mangle:PREROUTING:policy:2 IN=eth0 OUT= MAC=02:ed:1c:0f:e6:e7:02:38:31:84:2b:d5:08:00 SRC=10.23.255.238 DST=10.93.161.68 LEN=64 TOS=0x00 PREC=0x00 TTL=56 ID=0 DF PROTO=TCP SPT=10847 DPT=31614 SEQ=1689139364 ACK=0 WINDOW=65535 RES=0x00 SYN URGP=0 OPT (02040522010303060101080A0CC959190000000004020000)
[6024176.614717] TRACE: mangle:FORWARD:policy:1 IN=eth0 OUT=cilium_host MAC=02:ed:1c:0f:e6:e7:02:38:31:84:2b:d5:08:00 SRC=10.23.255.238 DST=100.96.26.110 LEN=64 TOS=0x00 PREC=0x00 TTL=55 ID=0 DF PROTO=TCP SPT=10847 DPT=443 SEQ=1689139364 ACK=0 WINDOW=65535 RES=0x00 SYN URGP=0 OPT (02040522010303060101080A0CC959190000000004020000)
[6024176.614722] TRACE: filter:FORWARD:rule:1 IN=eth0 OUT=cilium_host MAC=02:ed:1c:0f:e6:e7:02:38:31:84:2b:d5:08:00 SRC=10.23.255.238 DST=100.96.26.110 LEN=64 TOS=0x00 PREC=0x00 TTL=55 ID=0 DF PROTO=TCP SPT=10847 DPT=443 SEQ=1689139364 ACK=0 WINDOW=65535 RES=0x00 SYN URGP=0 OPT (02040522010303060101080A0CC959190000000004020000)
[6024176.614728] TRACE: filter:CILIUM_FORWARD:rule:1 IN=eth0 OUT=cilium_host MAC=02:ed:1c:0f:e6:e7:02:38:31:84:2b:d5:08:00 SRC=10.23.255.238 DST=100.96.26.110 LEN=64 TOS=0x00 PREC=0x00 TTL=55 ID=0 DF PROTO=TCP SPT=10847 DPT=443 SEQ=1689139364 ACK=0 WINDOW=65535 RES=0x00 SYN URGP=0 OPT (02040522010303060101080A0CC959190000000004020000)
[6024176.614732] TRACE: mangle:POSTROUTING:rule:1 IN= OUT=cilium_host SRC=10.23.255.238 DST=100.96.26.110 LEN=64 TOS=0x00 PREC=0x00 TTL=55 ID=0 DF PROTO=TCP SPT=10847 DPT=443 SEQ=1689139364 ACK=0 WINDOW=65535 RES=0x00 SYN URGP=0 OPT (02040522010303060101080A0CC959190000000004020000)
[6024176.614736] TRACE: mangle:CILIUM_POST_mangle:return:1 IN= OUT=cilium_host SRC=10.23.255.238 DST=100.96.26.110 LEN=64 TOS=0x00 PREC=0x00 TTL=55 ID=0 DF PROTO=TCP SPT=10847 DPT=443 SEQ=1689139364 ACK=0 WINDOW=65535 RES=0x00 SYN URGP=0 OPT (02040522010303060101080A0CC959190000000004020000)
[6024176.614740] TRACE: mangle:POSTROUTING:policy:2 IN= OUT=cilium_host SRC=10.23.255.238 DST=100.96.26.110 LEN=64 TOS=0x00 PREC=0x00 TTL=55 ID=0 DF PROTO=TCP SPT=10847 DPT=443 SEQ=1689139364 ACK=0 WINDOW=65535 RES=0x00 SYN URGP=0 OPT (02040522010303060101080A0CC959190000000004020000)
[6024177.645678] TRACE: raw:PREROUTING:policy:3 IN=eth0 OUT= MAC=02:ed:1c:0f:e6:e7:02:38:31:84:2b:d5:08:00 SRC=10.23.255.238 DST=10.93.161.68 LEN=64 TOS=0x00 PREC=0x00 TTL=56 ID=0 DF PROTO=TCP SPT=10847 DPT=31614 SEQ=1689139364 ACK=0 WINDOW=65535 RES=0x00 SYN URGP=0 OPT (02040522010303060101080A0CC95D010000000004020000)
[6024177.645755] TRACE: mangle:PREROUTING:rule:1 IN=eth0 OUT= MAC=02:ed:1c:0f:e6:e7:02:38:31:84:2b:d5:08:00 SRC=10.23.255.238 DST=10.93.161.68 LEN=64 TOS=0x00 PREC=0x00 TTL=56 ID=0 DF PROTO=TCP SPT=10847 DPT=31614 SEQ=1689139364 ACK=0 WINDOW=65535 RES=0x00 SYN URGP=0 OPT (02040522010303060101080A0CC95D010000000004020000)
[6024177.645793] TRACE: mangle:CILIUM_PRE_mangle:return:4 IN=eth0 OUT= MAC=02:ed:1c:0f:e6:e7:02:38:31:84:2b:d5:08:00 SRC=10.23.255.238 DST=10.93.161.68 LEN=64 TOS=0x00 PREC=0x00 TTL=56 ID=0 DF PROTO=TCP SPT=10847 DPT=31614 SEQ=1689139364 ACK=0 WINDOW=65535 RES=0x00 SYN URGP=0 OPT (02040522010303060101080A0CC95D010000000004020000)
[6024177.645833] TRACE: mangle:PREROUTING:policy:2 IN=eth0 OUT= MAC=02:ed:1c:0f:e6:e7:02:38:31:84:2b:d5:08:00 SRC=10.23.255.238 DST=10.93.161.68 LEN=64 TOS=0x00 PREC=0x00 TTL=56 ID=0 DF PROTO=TCP SPT=10847 DPT=31614 SEQ=1689139364 ACK=0 WINDOW=65535 RES=0x00 SYN URGP=0 OPT (02040522010303060101080A0CC95D010000000004020000)
[6024177.645879] TRACE: mangle:FORWARD:policy:1 IN=eth0 OUT=cilium_host MAC=02:ed:1c:0f:e6:e7:02:38:31:84:2b:d5:08:00 SRC=10.23.255.238 DST=100.96.26.110 LEN=64 TOS=0x00 PREC=0x00 TTL=55 ID=0 DF PROTO=TCP SPT=10847 DPT=443 SEQ=1689139364 ACK=0 WINDOW=65535 RES=0x00 SYN URGP=0 OPT (02040522010303060101080A0CC95D010000000004020000)
[6024177.645918] TRACE: filter:FORWARD:rule:1 IN=eth0 OUT=cilium_host MAC=02:ed:1c:0f:e6:e7:02:38:31:84:2b:d5:08:00 SRC=10.23.255.238 DST=100.96.26.110 LEN=64 TOS=0x00 PREC=0x00 TTL=55 ID=0 DF PROTO=TCP SPT=10847 DPT=443 SEQ=1689139364 ACK=0 WINDOW=65535 RES=0x00 SYN URGP=0 OPT (02040522010303060101080A0CC95D010000000004020000)
[6024177.645965] TRACE: filter:CILIUM_FORWARD:rule:1 IN=eth0 OUT=cilium_host MAC=02:ed:1c:0f:e6:e7:02:38:31:84:2b:d5:08:00 SRC=10.23.255.238 DST=100.96.26.110 LEN=64 TOS=0x00 PREC=0x00 TTL=55 ID=0 DF PROTO=TCP SPT=10847 DPT=443 SEQ=1689139364 ACK=0 WINDOW=65535 RES=0x00 SYN URGP=0 OPT (02040522010303060101080A0CC95D010000000004020000)
[6024177.646003] TRACE: mangle:POSTROUTING:rule:1 IN= OUT=cilium_host SRC=10.23.255.238 DST=100.96.26.110 LEN=64 TOS=0x00 PREC=0x00 TTL=55 ID=0 DF PROTO=TCP SPT=10847 DPT=443 SEQ=1689139364 ACK=0 WINDOW=65535 RES=0x00 SYN URGP=0 OPT (02040522010303060101080A0CC95D010000000004020000)
[6024177.646052] TRACE: mangle:CILIUM_POST_mangle:return:1 IN= OUT=cilium_host SRC=10.23.255.238 DST=100.96.26.110 LEN=64 TOS=0x00 PREC=0x00 TTL=55 ID=0 DF PROTO=TCP SPT=10847 DPT=443 SEQ=1689139364 ACK=0 WINDOW=65535 RES=0x00 SYN URGP=0 OPT (02040522010303060101080A0CC95D010000000004020000)
[6024177.646091] TRACE: mangle:POSTROUTING:policy:2 IN= OUT=cilium_host SRC=10.23.255.238 DST=100.96.26.110 LEN=64 TOS=0x00 PREC=0x00 TTL=55 ID=0 DF PROTO=TCP SPT=10847 DPT=443 SEQ=1689139364 ACK=0 WINDOW=65535 RES=0x00 SYN URGP=0 OPT (02040522010303060101080A0CC95D010000000004020000)
[6024178.682745] TRACE: raw:PREROUTING:policy:3 IN=eth0 OUT= MAC=02:ed:1c:0f:e6:e7:02:38:31:84:2b:d5:08:00 SRC=10.23.255.238 DST=10.93.161.68 LEN=64 TOS=0x00 PREC=0x00 TTL=56 ID=0 DF PROTO=TCP SPT=10847 DPT=31614 SEQ=1689139364 ACK=0 WINDOW=65535 RES=0x00 SYN URGP=0 OPT (02040522010303060101080A0CC960E90000000004020000)
[6024178.682754] TRACE: mangle:PREROUTING:rule:1 IN=eth0 OUT= MAC=02:ed:1c:0f:e6:e7:02:38:31:84:2b:d5:08:00 SRC=10.23.255.238 DST=10.93.161.68 LEN=64 TOS=0x00 PREC=0x00 TTL=56 ID=0 DF PROTO=TCP SPT=10847 DPT=31614 SEQ=1689139364 ACK=0 WINDOW=65535 RES=0x00 SYN URGP=0 OPT (02040522010303060101080A0CC960E90000000004020000)
[6024178.682763] TRACE: mangle:CILIUM_PRE_mangle:return:4 IN=eth0 OUT= MAC=02:ed:1c:0f:e6:e7:02:38:31:84:2b:d5:08:00 SRC=10.23.255.238 DST=10.93.161.68 LEN=64 TOS=0x00 PREC=0x00 TTL=56 ID=0 DF PROTO=TCP SPT=10847 DPT=31614 SEQ=1689139364 ACK=0 WINDOW=65535 RES=0x00 SYN URGP=0 OPT (02040522010303060101080A0CC960E90000000004020000)
[6024178.682768] TRACE: mangle:PREROUTING:policy:2 IN=eth0 OUT= MAC=02:ed:1c:0f:e6:e7:02:38:31:84:2b:d5:08:00 SRC=10.23.255.238 DST=10.93.161.68 LEN=64 TOS=0x00 PREC=0x00 TTL=56 ID=0 DF PROTO=TCP SPT=10847 DPT=31614 SEQ=1689139364 ACK=0 WINDOW=65535 RES=0x00 SYN URGP=0 OPT (02040522010303060101080A0CC960E90000000004020000)
[6024178.682776] TRACE: mangle:FORWARD:policy:1 IN=eth0 OUT=cilium_host MAC=02:ed:1c:0f:e6:e7:02:38:31:84:2b:d5:08:00 SRC=10.23.255.238 DST=100.96.26.110 LEN=64 TOS=0x00 PREC=0x00 TTL=55 ID=0 DF PROTO=TCP SPT=10847 DPT=443 SEQ=1689139364 ACK=0 WINDOW=65535 RES=0x00 SYN URGP=0 OPT (02040522010303060101080A0CC960E90000000004020000)
[6024178.682781] TRACE: filter:FORWARD:rule:1 IN=eth0 OUT=cilium_host MAC=02:ed:1c:0f:e6:e7:02:38:31:84:2b:d5:08:00 SRC=10.23.255.238 DST=100.96.26.110 LEN=64 TOS=0x00 PREC=0x00 TTL=55 ID=0 DF PROTO=TCP SPT=10847 DPT=443 SEQ=1689139364 ACK=0 WINDOW=65535 RES=0x00 SYN URGP=0 OPT (02040522010303060101080A0CC960E90000000004020000)
[6024178.682787] TRACE: filter:CILIUM_FORWARD:rule:1 IN=eth0 OUT=cilium_host MAC=02:ed:1c:0f:e6:e7:02:38:31:84:2b:d5:08:00 SRC=10.23.255.238 DST=100.96.26.110 LEN=64 TOS=0x00 PREC=0x00 TTL=55 ID=0 DF PROTO=TCP SPT=10847 DPT=443 SEQ=1689139364 ACK=0 WINDOW=65535 RES=0x00 SYN URGP=0 OPT (02040522010303060101080A0CC960E90000000004020000)
[6024178.682792] TRACE: mangle:POSTROUTING:rule:1 IN= OUT=cilium_host SRC=10.23.255.238 DST=100.96.26.110 LEN=64 TOS=0x00 PREC=0x00 TTL=55 ID=0 DF PROTO=TCP SPT=10847 DPT=443 SEQ=1689139364 ACK=0 WINDOW=65535 RES=0x00 SYN URGP=0 OPT (02040522010303060101080A0CC960E90000000004020000)
[6024178.682795] TRACE: mangle:CILIUM_POST_mangle:return:1 IN= OUT=cilium_host SRC=10.23.255.238 DST=100.96.26.110 LEN=64 TOS=0x00 PREC=0x00 TTL=55 ID=0 DF PROTO=TCP SPT=10847 DPT=443 SEQ=1689139364 ACK=0 WINDOW=65535 RES=0x00 SYN URGP=0 OPT (02040522010303060101080A0CC960E90000000004020000)
[6024178.682799] TRACE: mangle:POSTROUTING:policy:2 IN= OUT=cilium_host SRC=10.23.255.238 DST=100.96.26.110 LEN=64 TOS=0x00 PREC=0x00 TTL=55 ID=0 DF PROTO=TCP SPT=10847 DPT=443 SEQ=1689139364 ACK=0 WINDOW=65535 RES=0x00 SYN URGP=0 OPT (02040522010303060101080A0CC960E90000000004020000)
[6024179.593548] TRACE: raw:PREROUTING:policy:3 IN=eth0 OUT= MAC=02:ed:1c:0f:e6:e7:02:38:31:84:2b:d5:08:00 SRC=10.23.255.238 DST=10.93.161.68 LEN=64 TOS=0x00 PREC=0x00 TTL=56 ID=0 DF PROTO=TCP SPT=10847 DPT=31614 SEQ=1689139364 ACK=0 WINDOW=65535 RES=0x00 SYN URGP=0 OPT (02040522010303060101080A0CC964D10000000004020000)
[6024179.593619] TRACE: mangle:PREROUTING:rule:1 IN=eth0 OUT= MAC=02:ed:1c:0f:e6:e7:02:38:31:84:2b:d5:08:00 SRC=10.23.255.238 DST=10.93.161.68 LEN=64 TOS=0x00 PREC=0x00 TTL=56 ID=0 DF PROTO=TCP SPT=10847 DPT=31614 SEQ=1689139364 ACK=0 WINDOW=65535 RES=0x00 SYN URGP=0 OPT (02040522010303060101080A0CC964D10000000004020000)
[6024179.593658] TRACE: mangle:CILIUM_PRE_mangle:return:4 IN=eth0 OUT= MAC=02:ed:1c:0f:e6:e7:02:38:31:84:2b:d5:08:00 SRC=10.23.255.238 DST=10.93.161.68 LEN=64 TOS=0x00 PREC=0x00 TTL=56 ID=0 DF PROTO=TCP SPT=10847 DPT=31614 SEQ=1689139364 ACK=0 WINDOW=65535 RES=0x00 SYN URGP=0 OPT (02040522010303060101080A0CC964D10000000004020000)
[6024179.593699] TRACE: mangle:PREROUTING:policy:2 IN=eth0 OUT= MAC=02:ed:1c:0f:e6:e7:02:38:31:84:2b:d5:08:00 SRC=10.23.255.238 DST=10.93.161.68 LEN=64 TOS=0x00 PREC=0x00 TTL=56 ID=0 DF PROTO=TCP SPT=10847 DPT=31614 SEQ=1689139364 ACK=0 WINDOW=65535 RES=0x00 SYN URGP=0 OPT (02040522010303060101080A0CC964D10000000004020000)
[6024179.593739] TRACE: mangle:FORWARD:policy:1 IN=eth0 OUT=cilium_host MAC=02:ed:1c:0f:e6:e7:02:38:31:84:2b:d5:08:00 SRC=10.23.255.238 DST=100.96.26.110 LEN=64 TOS=0x00 PREC=0x00 TTL=55 ID=0 DF PROTO=TCP SPT=10847 DPT=443 SEQ=1689139364 ACK=0 WINDOW=65535 RES=0x00 SYN URGP=0 OPT (02040522010303060101080A0CC964D10000000004020000)
[6024179.593780] TRACE: filter:FORWARD:rule:1 IN=eth0 OUT=cilium_host MAC=02:ed:1c:0f:e6:e7:02:38:31:84:2b:d5:08:00 SRC=10.23.255.238 DST=100.96.26.110 LEN=64 TOS=0x00 PREC=0x00 TTL=55 ID=0 DF PROTO=TCP SPT=10847 DPT=443 SEQ=1689139364 ACK=0 WINDOW=65535 RES=0x00 SYN URGP=0 OPT (02040522010303060101080A0CC964D10000000004020000)
[6024179.593829] TRACE: filter:CILIUM_FORWARD:rule:1 IN=eth0 OUT=cilium_host MAC=02:ed:1c:0f:e6:e7:02:38:31:84:2b:d5:08:00 SRC=10.23.255.238 DST=100.96.26.110 LEN=64 TOS=0x00 PREC=0x00 TTL=55 ID=0 DF PROTO=TCP SPT=10847 DPT=443 SEQ=1689139364 ACK=0 WINDOW=65535 RES=0x00 SYN URGP=0 OPT (02040522010303060101080A0CC964D10000000004020000)
[6024179.593865] TRACE: mangle:POSTROUTING:rule:1 IN= OUT=cilium_host SRC=10.23.255.238 DST=100.96.26.110 LEN=64 TOS=0x00 PREC=0x00 TTL=55 ID=0 DF PROTO=TCP SPT=10847 DPT=443 SEQ=1689139364 ACK=0 WINDOW=65535 RES=0x00 SYN URGP=0 OPT (02040522010303060101080A0CC964D10000000004020000)
[6024179.593905] TRACE: mangle:CILIUM_POST_mangle:return:1 IN= OUT=cilium_host SRC=10.23.255.238 DST=100.96.26.110 LEN=64 TOS=0x00 PREC=0x00 TTL=55 ID=0 DF PROTO=TCP SPT=10847 DPT=443 SEQ=1689139364 ACK=0 WINDOW=65535 RES=0x00 SYN URGP=0 OPT (02040522010303060101080A0CC964D10000000004020000)
[6024179.593942] TRACE: mangle:POSTROUTING:policy:2 IN= OUT=cilium_host SRC=10.23.255.238 DST=100.96.26.110 LEN=64 TOS=0x00 PREC=0x00 TTL=55 ID=0 DF PROTO=TCP SPT=10847 DPT=443 SEQ=1689139364 ACK=0 WINDOW=65535 RES=0x00 SYN URGP=0 OPT (02040522010303060101080A0CC964D10000000004020000)
[6024180.586536] TRACE: raw:PREROUTING:policy:3 IN=eth0 OUT= MAC=02:ed:1c:0f:e6:e7:02:38:31:84:2b:d5:08:00 SRC=10.23.255.238 DST=10.93.161.68 LEN=64 TOS=0x00 PREC=0x00 TTL=56 ID=0 DF PROTO=TCP SPT=10847 DPT=31614 SEQ=1689139364 ACK=0 WINDOW=65535 RES=0x00 SYN URGP=0 OPT (02040522010303060101080A0CC968BA0000000004020000)
[6024180.586545] TRACE: mangle:PREROUTING:rule:1 IN=eth0 OUT= MAC=02:ed:1c:0f:e6:e7:02:38:31:84:2b:d5:08:00 SRC=10.23.255.238 DST=10.93.161.68 LEN=64 TOS=0x00 PREC=0x00 TTL=56 ID=0 DF PROTO=TCP SPT=10847 DPT=31614 SEQ=1689139364 ACK=0 WINDOW=65535 RES=0x00 SYN URGP=0 OPT (02040522010303060101080A0CC968BA0000000004020000)
[6024180.586553] TRACE: mangle:CILIUM_PRE_mangle:return:4 IN=eth0 OUT= MAC=02:ed:1c:0f:e6:e7:02:38:31:84:2b:d5:08:00 SRC=10.23.255.238 DST=10.93.161.68 LEN=64 TOS=0x00 PREC=0x00 TTL=56 ID=0 DF PROTO=TCP SPT=10847 DPT=31614 SEQ=1689139364 ACK=0 WINDOW=65535 RES=0x00 SYN URGP=0 OPT (02040522010303060101080A0CC968BA0000000004020000)
[6024180.586558] TRACE: mangle:PREROUTING:policy:2 IN=eth0 OUT= MAC=02:ed:1c:0f:e6:e7:02:38:31:84:2b:d5:08:00 SRC=10.23.255.238 DST=10.93.161.68 LEN=64 TOS=0x00 PREC=0x00 TTL=56 ID=0 DF PROTO=TCP SPT=10847 DPT=31614 SEQ=1689139364 ACK=0 WINDOW=65535 RES=0x00 SYN URGP=0 OPT (02040522010303060101080A0CC968BA0000000004020000)
[6024180.586568] TRACE: mangle:FORWARD:policy:1 IN=eth0 OUT=cilium_host MAC=02:ed:1c:0f:e6:e7:02:38:31:84:2b:d5:08:00 SRC=10.23.255.238 DST=100.96.26.110 LEN=64 TOS=0x00 PREC=0x00 TTL=55 ID=0 DF PROTO=TCP SPT=10847 DPT=443 SEQ=1689139364 ACK=0 WINDOW=65535 RES=0x00 SYN URGP=0 OPT (02040522010303060101080A0CC968BA0000000004020000)
[6024180.586573] TRACE: filter:FORWARD:rule:1 IN=eth0 OUT=cilium_host MAC=02:ed:1c:0f:e6:e7:02:38:31:84:2b:d5:08:00 SRC=10.23.255.238 DST=100.96.26.110 LEN=64 TOS=0x00 PREC=0x00 TTL=55 ID=0 DF PROTO=TCP SPT=10847 DPT=443 SEQ=1689139364 ACK=0 WINDOW=65535 RES=0x00 SYN URGP=0 OPT (02040522010303060101080A0CC968BA0000000004020000)
[6024180.586579] TRACE: filter:CILIUM_FORWARD:rule:1 IN=eth0 OUT=cilium_host MAC=02:ed:1c:0f:e6:e7:02:38:31:84:2b:d5:08:00 SRC=10.23.255.238 DST=100.96.26.110 LEN=64 TOS=0x00 PREC=0x00 TTL=55 ID=0 DF PROTO=TCP SPT=10847 DPT=443 SEQ=1689139364 ACK=0 WINDOW=65535 RES=0x00 SYN URGP=0 OPT (02040522010303060101080A0CC968BA0000000004020000)
[6024180.586583] TRACE: mangle:POSTROUTING:rule:1 IN= OUT=cilium_host SRC=10.23.255.238 DST=100.96.26.110 LEN=64 TOS=0x00 PREC=0x00 TTL=55 ID=0 DF PROTO=TCP SPT=10847 DPT=443 SEQ=1689139364 ACK=0 WINDOW=65535 RES=0x00 SYN URGP=0 OPT (02040522010303060101080A0CC968BA0000000004020000)
[6024180.586587] TRACE: mangle:CILIUM_POST_mangle:return:1 IN= OUT=cilium_host SRC=10.23.255.238 DST=100.96.26.110 LEN=64 TOS=0x00 PREC=0x00 TTL=55 ID=0 DF PROTO=TCP SPT=10847 DPT=443 SEQ=1689139364 ACK=0 WINDOW=65535 RES=0x00 SYN URGP=0 OPT (02040522010303060101080A0CC968BA0000000004020000)
[6024180.586591] TRACE: mangle:POSTROUTING:policy:2 IN= OUT=cilium_host SRC=10.23.255.238 DST=100.96.26.110 LEN=64 TOS=0x00 PREC=0x00 TTL=55 ID=0 DF PROTO=TCP SPT=10847 DPT=443 SEQ=1689139364 ACK=0 WINDOW=65535 RES=0x00 SYN URGP=0 OPT (02040522010303060101080A0CC968BA0000000004020000)
[6024182.603466] TRACE: raw:PREROUTING:policy:3 IN=eth0 OUT= MAC=02:ed:1c:0f:e6:e7:02:38:31:84:2b:d5:08:00 SRC=10.23.255.238 DST=10.93.161.68 LEN=64 TOS=0x00 PREC=0x00 TTL=56 ID=0 DF PROTO=TCP SPT=10847 DPT=31614 SEQ=1689139364 ACK=0 WINDOW=65535 RES=0x00 SYN URGP=0 OPT (02040522010303060101080A0CC9708A0000000004020000)
[6024182.603484] TRACE: mangle:PREROUTING:rule:1 IN=eth0 OUT= MAC=02:ed:1c:0f:e6:e7:02:38:31:84:2b:d5:08:00 SRC=10.23.255.238 DST=10.93.161.68 LEN=64 TOS=0x00 PREC=0x00 TTL=56 ID=0 DF PROTO=TCP SPT=10847 DPT=31614 SEQ=1689139364 ACK=0 WINDOW=65535 RES=0x00 SYN URGP=0 OPT (02040522010303060101080A0CC9708A0000000004020000)
[6024182.603500] TRACE: mangle:CILIUM_PRE_mangle:return:4 IN=eth0 OUT= MAC=02:ed:1c:0f:e6:e7:02:38:31:84:2b:d5:08:00 SRC=10.23.255.238 DST=10.93.161.68 LEN=64 TOS=0x00 PREC=0x00 TTL=56 ID=0 DF PROTO=TCP SPT=10847 DPT=31614 SEQ=1689139364 ACK=0 WINDOW=65535 RES=0x00 SYN URGP=0 OPT (02040522010303060101080A0CC9708A0000000004020000)
[6024182.603511] TRACE: mangle:PREROUTING:policy:2 IN=eth0 OUT= MAC=02:ed:1c:0f:e6:e7:02:38:31:84:2b:d5:08:00 SRC=10.23.255.238 DST=10.93.161.68 LEN=64 TOS=0x00 PREC=0x00 TTL=56 ID=0 DF PROTO=TCP SPT=10847 DPT=31614 SEQ=1689139364 ACK=0 WINDOW=65535 RES=0x00 SYN URGP=0 OPT (02040522010303060101080A0CC9708A0000000004020000)
[6024182.603529] TRACE: mangle:FORWARD:policy:1 IN=eth0 OUT=cilium_host MAC=02:ed:1c:0f:e6:e7:02:38:31:84:2b:d5:08:00 SRC=10.23.255.238 DST=100.96.26.110 LEN=64 TOS=0x00 PREC=0x00 TTL=55 ID=0 DF PROTO=TCP SPT=10847 DPT=443 SEQ=1689139364 ACK=0 WINDOW=65535 RES=0x00 SYN URGP=0 OPT (02040522010303060101080A0CC9708A0000000004020000)
[6024182.603540] TRACE: filter:FORWARD:rule:1 IN=eth0 OUT=cilium_host MAC=02:ed:1c:0f:e6:e7:02:38:31:84:2b:d5:08:00 SRC=10.23.255.238 DST=100.96.26.110 LEN=64 TOS=0x00 PREC=0x00 TTL=55 ID=0 DF PROTO=TCP SPT=10847 DPT=443 SEQ=1689139364 ACK=0 WINDOW=65535 RES=0x00 SYN URGP=0 OPT (02040522010303060101080A0CC9708A0000000004020000)
[6024182.603552] TRACE: filter:CILIUM_FORWARD:rule:1 IN=eth0 OUT=cilium_host MAC=02:ed:1c:0f:e6:e7:02:38:31:84:2b:d5:08:00 SRC=10.23.255.238 DST=100.96.26.110 LEN=64 TOS=0x00 PREC=0x00 TTL=55 ID=0 DF PROTO=TCP SPT=10847 DPT=443 SEQ=1689139364 ACK=0 WINDOW=65535 RES=0x00 SYN URGP=0 OPT (02040522010303060101080A0CC9708A0000000004020000)
[6024182.603561] TRACE: mangle:POSTROUTING:rule:1 IN= OUT=cilium_host SRC=10.23.255.238 DST=100.96.26.110 LEN=64 TOS=0x00 PREC=0x00 TTL=55 ID=0 DF PROTO=TCP SPT=10847 DPT=443 SEQ=1689139364 ACK=0 WINDOW=65535 RES=0x00 SYN URGP=0 OPT (02040522010303060101080A0CC9708A0000000004020000)
[6024182.603570] TRACE: mangle:CILIUM_POST_mangle:return:1 IN= OUT=cilium_host SRC=10.23.255.238 DST=100.96.26.110 LEN=64 TOS=0x00 PREC=0x00 TTL=55 ID=0 DF PROTO=TCP SPT=10847 DPT=443 SEQ=1689139364 ACK=0 WINDOW=65535 RES=0x00 SYN URGP=0 OPT (02040522010303060101080A0CC9708A0000000004020000)
[6024182.603578] TRACE: mangle:POSTROUTING:policy:2 IN= OUT=cilium_host SRC=10.23.255.238 DST=100.96.26.110 LEN=64 TOS=0x00 PREC=0x00 TTL=55 ID=0 DF PROTO=TCP SPT=10847 DPT=443 SEQ=1689139364 ACK=0 WINDOW=65535 RES=0x00 SYN URGP=0 OPT (02040522010303060101080A0CC9708A0000000004020000)
[6024186.684312] TRACE: raw:PREROUTING:policy:3 IN=eth0 OUT= MAC=02:ed:1c:0f:e6:e7:02:38:31:84:2b:d5:08:00 SRC=10.23.255.238 DST=10.93.161.68 LEN=64 TOS=0x00 PREC=0x00 TTL=56 ID=0 DF PROTO=TCP SPT=10847 DPT=31614 SEQ=1689139364 ACK=0 WINDOW=65535 RES=0x00 SYN URGP=0 OPT (02040522010303060101080A0CC9802A0000000004020000)
[6024186.684320] TRACE: mangle:PREROUTING:rule:1 IN=eth0 OUT= MAC=02:ed:1c:0f:e6:e7:02:38:31:84:2b:d5:08:00 SRC=10.23.255.238 DST=10.93.161.68 LEN=64 TOS=0x00 PREC=0x00 TTL=56 ID=0 DF PROTO=TCP SPT=10847 DPT=31614 SEQ=1689139364 ACK=0 WINDOW=65535 RES=0x00 SYN URGP=0 OPT (02040522010303060101080A0CC9802A0000000004020000)
[6024186.684327] TRACE: mangle:CILIUM_PRE_mangle:return:4 IN=eth0 OUT= MAC=02:ed:1c:0f:e6:e7:02:38:31:84:2b:d5:08:00 SRC=10.23.255.238 DST=10.93.161.68 LEN=64 TOS=0x00 PREC=0x00 TTL=56 ID=0 DF PROTO=TCP SPT=10847 DPT=31614 SEQ=1689139364 ACK=0 WINDOW=65535 RES=0x00 SYN URGP=0 OPT (02040522010303060101080A0CC9802A0000000004020000)
[6024186.684332] TRACE: mangle:PREROUTING:policy:2 IN=eth0 OUT= MAC=02:ed:1c:0f:e6:e7:02:38:31:84:2b:d5:08:00 SRC=10.23.255.238 DST=10.93.161.68 LEN=64 TOS=0x00 PREC=0x00 TTL=56 ID=0 DF PROTO=TCP SPT=10847 DPT=31614 SEQ=1689139364 ACK=0 WINDOW=65535 RES=0x00 SYN URGP=0 OPT (02040522010303060101080A0CC9802A0000000004020000)
[6024186.684340] TRACE: mangle:FORWARD:policy:1 IN=eth0 OUT=cilium_host MAC=02:ed:1c:0f:e6:e7:02:38:31:84:2b:d5:08:00 SRC=10.23.255.238 DST=100.96.26.110 LEN=64 TOS=0x00 PREC=0x00 TTL=55 ID=0 DF PROTO=TCP SPT=10847 DPT=443 SEQ=1689139364 ACK=0 WINDOW=65535 RES=0x00 SYN URGP=0 OPT (02040522010303060101080A0CC9802A0000000004020000)
[6024186.684345] TRACE: filter:FORWARD:rule:1 IN=eth0 OUT=cilium_host MAC=02:ed:1c:0f:e6:e7:02:38:31:84:2b:d5:08:00 SRC=10.23.255.238 DST=100.96.26.110 LEN=64 TOS=0x00 PREC=0x00 TTL=55 ID=0 DF PROTO=TCP SPT=10847 DPT=443 SEQ=1689139364 ACK=0 WINDOW=65535 RES=0x00 SYN URGP=0 OPT (02040522010303060101080A0CC9802A0000000004020000)
[6024186.684350] TRACE: filter:CILIUM_FORWARD:rule:1 IN=eth0 OUT=cilium_host MAC=02:ed:1c:0f:e6:e7:02:38:31:84:2b:d5:08:00 SRC=10.23.255.238 DST=100.96.26.110 LEN=64 TOS=0x00 PREC=0x00 TTL=55 ID=0 DF PROTO=TCP SPT=10847 DPT=443 SEQ=1689139364 ACK=0 WINDOW=65535 RES=0x00 SYN URGP=0 OPT (02040522010303060101080A0CC9802A0000000004020000)
[6024186.684354] TRACE: mangle:POSTROUTING:rule:1 IN= OUT=cilium_host SRC=10.23.255.238 DST=100.96.26.110 LEN=64 TOS=0x00 PREC=0x00 TTL=55 ID=0 DF PROTO=TCP SPT=10847 DPT=443 SEQ=1689139364 ACK=0 WINDOW=65535 RES=0x00 SYN URGP=0 OPT (02040522010303060101080A0CC9802A0000000004020000)
[6024186.684358] TRACE: mangle:CILIUM_POST_mangle:return:1 IN= OUT=cilium_host SRC=10.23.255.238 DST=100.96.26.110 LEN=64 TOS=0x00 PREC=0x00 TTL=55 ID=0 DF PROTO=TCP SPT=10847 DPT=443 SEQ=1689139364 ACK=0 WINDOW=65535 RES=0x00 SYN URGP=0 OPT (02040522010303060101080A0CC9802A0000000004020000)
[6024186.684362] TRACE: mangle:POSTROUTING:policy:2 IN= OUT=cilium_host SRC=10.23.255.238 DST=100.96.26.110 LEN=64 TOS=0x00 PREC=0x00 TTL=55 ID=0 DF PROTO=TCP SPT=10847 DPT=443 SEQ=1689139364 ACK=0 WINDOW=65535 RES=0x00 SYN URGP=0 OPT (02040522010303060101080A0CC9802A0000000004020000)
```

**Comment by nr17** [comment]
Last trace is
```
[6024186.684362] TRACE: mangle:POSTROUTING:policy:2 IN= OUT=cilium_host SRC=10.23.255.238 DST=100.96.26.110 LEN=64 TOS=0x00 PREC=0x00 TTL=55 ID=0 DF PROTO=TCP SPT=10847 DPT=443 SEQ=1689139364 ACK=0 WINDOW=65535 RES=0x00 SYN URGP=0 OPT (02040522010303060101080A0CC9802A0000000004020000)
```
100.96.26.110 is the IP of nginx pod.

**Comment by nr17** [comment]
After some more investigation, it seems that the TCP SYN from forwarding node to nginx node is not getting SNATed correctly.

These are the captures on the nginx node. 10.93.161.68 is the forwarding k8s worker node. 100.96.26.226 is nginx pod IP. 100.96.17.151 is IP address for cilium_host on 10.93.161.68.

successful case:
```
48 12.529057171 100.96.17.151 → 100.96.26.226 TCP 78 13608 → 443 [SYN] Seq=0 Win=65535 Len=0 MSS=1314 WS=64 TSval=221834283 TSecr=0 SACK_PERM=1
49 12.529154288 100.96.26.226 → 100.96.17.151 TCP 74 443 → 13608 [SYN, ACK] Seq=0 Ack=1 Win=65535 Len=0 MSS=8911 SACK_PERM=1 TSval=97765904 TSecr=221834283 WS=512
50 12.630578764 100.96.17.151 → 100.96.26.226 TCP 66 13608 → 443 [ACK] Seq=1 Ack=1 Win=131456 Len=0 TSval=221834377 TSecr=97765904
```

Drop case
```
 4792 49.822231806 10.93.161.68 → 100.96.26.226 TCP 78 43769 → 443 [SYN] Seq=0 Win=65535 Len=0 MSS=1314 WS=64 TSval=220206027 TSecr=0 SACK_PERM=1
 4794 50.855973114 10.93.161.68 → 100.96.26.226 TCP 78 [TCP Retransmission] 43769 → 443 [SYN] Seq=0 Win=65535 Len=0 MSS=1314 WS=64 TSval=220207045 TSecr=0 SACK_PERM=1
 4795 51.230273318 10.93.161.68 → 100.96.26.226 TCP 78 [TCP Retransmission] 43769 → 443 [SYN] Seq=0 Win=65535 Len=0 MSS=1314 WS=64 TSval=220207416 TSecr=0 SACK_PERM=1
 4796 51.606858775 10.93.161.68 → 100.96.26.226 TCP 78 [TCP Retransmission] 43769 → 443 [SYN] Seq=0 Win=65535 Len=0 MSS=1314 WS=64 TSval=220207787 TSecr=0 SACK_PERM=1
 4799 51.997835574 10.93.161.68 → 100.96.26.226 TCP 78 [TCP Retransmission] 43769 → 443 [SYN] Seq=0 Win=65535 Len=0 MSS=1314 WS=64 TSval=220208158 TSecr=0 SACK_PERM=1
 4800 52.362804211 10.93.161.68 → 100.96.26.226 TCP 78 [TCP Retransmission] 43769 → 443 [SYN] Seq=0 Win=65535 Len=0 MSS=1314 WS=64 TSval=220208529 TSecr=0 SACK_PERM=1
 4801 52.904911224 10.93.161.68 → 100.96.26.226 TCP 78 [TCP Retransmission] 43769 → 443 [SYN] Seq=0 Win=65535 Len=0 MSS=1314 WS=64 TSval=220209065 TSecr=0 SACK_PERM=1
 4802 53.991603095 10.93.161.68 → 100.96.26.226 TCP 78 [TCP Retransmission] 43769 → 443 [SYN] Seq=0 Win=65535 Len=0 MSS=1314 WS=64 TSval=220210137 TSecr=0 SACK_PERM=1
 4803 56.153149627 10.93.161.68 → 100.96.26.226 TCP 78 [TCP Retransmission] 43769 → 443 [SYN] Seq=0 Win=65535 Len=0 MSS=1314 WS=64 TSval=220212281 TSecr=0 SACK_PERM=1
```

iptables TRACE log in the previous comment should be helpful for further investigation (Note that it is for a different dropped TCP connection).

**Comment by nr17** [comment]
It seems the root cause is a periodic flush of iptables, perhaps initiated by garbageCollect()
In drop case, there is no cilium specific iptable rule in PREROUTING chain of mangle table to forward the packet to the custom CILIUM_PRE_mangle chain. This condition happens for a very brief moment causing the incoming TCP SYN packet to be processed in an unintended manner.

**Comment by nr17** [comment]
[SYN-port-fail-56344.log](https://github.com/cilium/cilium/files/5320025/SYN-port-fail-56344.log)
[SYN-port-succ-48055.log](https://github.com/cilium/cilium/files/5320026/SYN-port-succ-48055.log)

Attached iptables TRACE logs for successful and drop cases.

**Comment by nr17** [comment]
Possible commit which introduced the issue: https://github.com/cilium/cilium/commit/3285cbc53fb41913e6d20fad38667b12961b47ad

https://github.com/cilium/cilium/commit/3285cbc53fb41913e6d20fad38667b12961b47ad#diff-e487db840fd85b399fd8893b55e0ac17R327 This line causes reinitialization of iptables (delete + create). This leads to the TCP SYN getting forwarded with “node’s host IP” instead of cilium_host IP to the k8s target pod when it arrives at that point of time. All the retransmissions also get forwarded the same way. e.g.
```
10.93.161.68 → 100.96.26.226 TCP 78 47137 → 443 [SYN] Seq=0 Win=65535 Len=0 MSS=1314 WS=64 TSval=219260225 TSecr=0 SACK_PERM=1
```
We are using 4.15 kernel and see the following lines in cilium
```
4715 level=debug msg="Detected IPCache delete operation support: true" subsys=map-ipcache
4716 level=debug msg="Detected IPCache dump operation support: false" subsys=map-ipcache
4717 level=info msg="Periodic IPCache map swap will occur due to lack of kernel support for LPM delete operation. Upgrade to Linux 4.15 or higher to avoid this." subsys=map-ipcache
```

As a work-around, I believe that using 4.16 (or above) kernel will avoid the call to TriggerReloadWithoutCompile() and this issue can be avoided.

**Comment by nr17** [comment]
I ran the same tests with the newer kernel and the issue was not observed with kernel 5.4.0.
