### ISSUE TITLE
Compilation failure of bpf_xdp.o when enabling Wireguard with XDP

### ISSUE THREAD

**Issue by ysksuzuki** [cilium/cilium#25354]
### Is there an existing issue for this?

- [X] I have searched the existing issues

### What happened?

In conjunction with `bpf-lb-acceleration=native`,  `enable-wireguard=true` and `encrypt-node=true`, the cilium-agent crashed with the following error log. I think we need to have an agent check to reject configs with wireguard and XDP.

```
level=error msg="Failed to compile bpf_xdp.o: exit status 1" compiler-pid=107 linker-pid=108 subsys=datapath-loader
level=warning msg="In file included from /var/lib/cilium/bpf/bpf_xdp.c:37:" subsys=datapath-loader
level=warning msg="In file included from /var/lib/cilium/bpf/lib/nodeport.h:21:" subsys=datapath-loader
level=warning msg="In file included from /var/lib/cilium/bpf/lib/encap.h:11:" subsys=datapath-loader
level=warning msg="/var/lib/cilium/bpf/lib/wireguard.h:76:12: error: no member named 'mark' in 'struct xdp_md'" subsys=datapath-loader
level=warning msg="        if ((ctx->mark & MARK_MAGIC_WG_ENCRYPTED) == MARK_MAGIC_WG_ENCRYPTED)" subsys=datapath-loader
level=warning msg="             ~~~  ^" subsys=datapath-loader
level=warning msg="1 error generated." subsys=datapath-loader
level=fatal msg="Failed to compile XDP program" error="Failed to compile bpf_xdp.o: exit status 1" subsys=datapath-loader
```

### Cilium Version

v1.14.0-snapshot.2

### Kernel Version

Linux rack0-cs4 5.15.106-flatcar

### Kubernetes Version

Client Version: version.Info{Major:"1", Minor:"25", GitVersion:"v1.25.6", GitCommit:"ff2c119726cc1f8926fb0585c74b25921e866a28", GitTreeState:"clean", BuildDate:"2023-01-18T19:22:09Z", GoVersion:"go1.19.5", Compiler:"gc", Platform:"linux/amd64"}
Kustomize Version: v4.5.7
Server Version: version.Info{Major:"1", Minor:"25", GitVersion:"v1.25.6", GitCommit:"ff2c119726cc1f8926fb0585c74b25921e866a28", GitTreeState:"archive", BuildDate:"2023-02-06T09:05:12Z", GoVersion:"go1.19.4", Compiler:"gc", Platform:"linux/amd64"}

### Code of Conduct

- [X] I agree to follow this project's Code of Conduct

**Comment by youngnick** [comment]
Thanks for this @ysksuzuki. Would we be able to get a sysdump?

**Comment by ysksuzuki** [comment]
Here is the sysdump.

[cilium-sysdump-20230511-104226.zip](https://github.com/cilium/cilium/files/11451187/cilium-sysdump-20230511-104226.zip)

**Comment by youngnick** [comment]
Thanks for that. I'll get some datapath folks to check this one out.

**Comment by brb** [comment]
Thanks for the issue. Good catch!

The node-to-node encryption (`encrypt-node=true`) enables encryption of the following traffic:
1. E/W traffic within cluster between cluster nodes.
2. N/S LB traffic when a node redirects an LB-ed request to another node (running selected LB backend).

With the XDP enabled, the 1st case should work, but the 2nd is currently not implemented (there is no functionality to redirect from `bpf_xdp` to `cilium_wg0`).

I think for now we could add a warning to the agent saying that N/S LB traffic won't be encrypted, and then protect the invocation of `wg_maybe_redirect_to_encrypt()` in `encap.h` with `#if __ctx_is == __ctx_skb`.

@ysksuzuki Do you plan to send a PR?

**Comment by ysksuzuki** [comment]
Hi @brb  Sure, I will do that

> 2. N/S LB traffic when a node redirects an LB-ed request to another node (running selected LB backend).

A bit out of the topic, but is this traffic encrypted with the DSR IP option mode (XDP disabled)? I think that Cilium doesn't redirect traffic to cilium_wg0 here because the source identity is the world in the DSR IP option mode.
https://github.com/cilium/cilium/blob/master/bpf/lib/wireguard.h#L97-L104

Also, with the tunneling mode(SNAT + tunnel or DSR + GENEVE), Cilium does not redirect to cilium_wg0 here because the destination is a remote node and the encrypted key is 0.

**Comment by brb** [comment]
Thanks!

> I think that Cilium doesn't redirect traffic to cilium_wg0 here because the source identity is the world in the DSR IP option mode.

Yep, you are right.

> Also, with the tunneling mode(SNAT + tunnel or DSR + GENEVE), Cilium does not redirect to cilium_wg0 here because the destination is a remote node and the encrypted key is 0.

I'm expecting that SNAT + a tunnel mode + no XDP should encrypt the traffic, as the nodeport.h would redirect o cilium_wg0?

**Comment by ysksuzuki** [comment]
Sorry for my late reply.

> I'm expecting that SNAT + a tunnel mode + no XDP should encrypt the traffic, as the nodeport.h would redirect o cilium_wg0?

As far as I tested it, SNAT + tunnel mode + no XDP didn't encrypt the redirected traffic from an intermediate node. I think 
 that's because `__encap_with_nodeid`  is called here. It doesn't call `wg_maybe_redirect_to_encrypt`
https://github.com/cilium/cilium/blob/1b19e5f279e8ca0002f96ddb96c1a99b9142fd70/bpf/lib/nodeport.h#L2081

```
# SNAT + native routing mode + XDP disabled
#  (Receiver side) All the packets from the remote node are going through cilium_wg0
14:24:51.591918 cilium_wg0 In  IP 10.69.0.197.42496 > 10.64.0.96.8000: Flags [S], seq 3223024943, win 64240, options [mss 1460,sackOK,TS val 3799708393 ecr 0,nop,wscale 7], length 0
14:24:51.592004 cilium_wg0 Out IP 10.64.0.96.8000 > 10.69.0.197.42496: Flags [S.], seq 556306988, ack 3223024944, win 64768, options [mss 1420,sackOK,TS val 3458138236 ecr 3799708393,nop,wscale 7], length 0
14:24:51.592766 cilium_wg0 In  IP 10.69.0.197.42496 > 10.64.0.96.8000: Flags [.], ack 1, win 502, options [nop,nop,TS val 3799708394 ecr 3458138236], length 0
14:24:51.592805 cilium_wg0 In  IP 10.69.0.197.42496 > 10.64.0.96.8000: Flags [P.], seq 1:75, ack 1, win 502, options [nop,nop,TS val 3799708394 ecr 3458138236], length 74
14:24:51.592823 cilium_wg0 Out IP 10.64.0.96.8000 > 10.69.0.197.42496: Flags [.], ack 75, win 506, options [nop,nop,TS val 3458138237 ecr 3799708394], length 0
14:24:51.593397 cilium_wg0 Out IP 10.64.0.96.8000 > 10.69.0.197.42496: Flags [P.], seq 1:122, ack 75, win 506, options [nop,nop,TS val 3458138237 ecr 3799708394], length 121
14:24:51.593818 cilium_wg0 In  IP 10.69.0.197.42496 > 10.64.0.96.8000: Flags [.], ack 122, win 502, options [nop,nop,TS val 3799708396 ecr 3458138237], length 0
14:24:51.593961 cilium_wg0 In  IP 10.69.0.197.42496 > 10.64.0.96.8000: Flags [F.], seq 75, ack 122, win 502, options [nop,nop,TS val 3799708396 ecr 3458138237], length 0
14:24:51.594104 cilium_wg0 Out IP 10.64.0.96.8000 > 10.69.0.197.42496: Flags [F.], seq 122, ack 76, win 506, options [nop,nop,TS val 3458138238 ecr 3799708396], length 0
14:24:51.594567 cilium_wg0 In  IP 10.69.0.197.42496 > 10.64.0.96.8000: Flags [.], ack 123, win 502, options [nop,nop,TS val 3799708396 ecr 3458138238], length 0

# SNAT + tunnel mode + XDP disabled
#  (Receiver side) Rx packets from the remote node are going through cilium_vxlan. Tx packets to the remote node are going through cilium_wg0
14:26:12.257804 cilium_vxlan P   IP 10.0.1.76.54316 > 10.64.0.96.8000: Flags [S], seq 796306250, win 64240, options [mss 1460,sackOK,TS val 3799789059 ecr 0,nop,wscale 7], length 0
14:26:12.257901 cilium_wg0 Out IP 10.64.0.96.8000 > 10.0.1.76.54316: Flags [S.], seq 4020090756, ack 796306251, win 64768, options [mss 1420,sackOK,TS val 473402588 ecr 3799789059,nop,wscale 7], length 0
14:26:12.258473 cilium_vxlan P   IP 10.0.1.76.54316 > 10.64.0.96.8000: Flags [.], ack 1, win 502, options [nop,nop,TS val 3799789060 ecr 473402588], length 0
14:26:12.258473 cilium_vxlan P   IP 10.0.1.76.54316 > 10.64.0.96.8000: Flags [P.], seq 1:75, ack 1, win 502, options [nop,nop,TS val 3799789060 ecr 473402588], length 74
14:26:12.258566 cilium_wg0 Out IP 10.64.0.96.8000 > 10.0.1.76.54316: Flags [.], ack 75, win 506, options [nop,nop,TS val 473402588 ecr 3799789060], length 0
14:26:12.259062 cilium_wg0 Out IP 10.64.0.96.8000 > 10.0.1.76.54316: Flags [P.], seq 1:122, ack 75, win 506, options [nop,nop,TS val 473402589 ecr 3799789060], length 121
14:26:12.259567 cilium_vxlan P   IP 10.0.1.76.54316 > 10.64.0.96.8000: Flags [.], ack 122, win 502, options [nop,nop,TS val 3799789061 ecr 473402589], length 0
14:26:12.259693 cilium_vxlan P   IP 10.0.1.76.54316 > 10.64.0.96.8000: Flags [F.], seq 75, ack 122, win 502, options [nop,nop,TS val 3799789061 ecr 473402589], length 0
14:26:12.259795 cilium_wg0 Out IP 10.64.0.96.8000 > 10.0.1.76.54316: Flags [F.], seq 122, ack 76, win 506, options [nop,nop,TS val 473402590 ecr 3799789061], length 0
14:26:12.260126 cilium_vxlan P   IP 10.0.1.76.54316 > 10.64.0.96.8000: Flags [.], ack 123, win 502, options [nop,nop,TS val 3799789062 ecr 473402590], length 0
```
