### ISSUE TITLE
Traffic dropped when the LoadBalancer hasn't been used in a while

### ISSUE THREAD

**Issue by zviratko** [cilium/cilium#31690]
### Is there an existing issue for this?

- [X] I have searched the existing issues

### What happened?

**It's happening on the same cluster as this https://github.com/cilium/cilium/issues/31689, so please reuse all the info, but I am including a new sysdump collected shortly after reproducing it**

Since this a lab/dev cluster, it is not uncommon not to use the services for a while.
What happens is, that after a number of minutes, the first connection attempt ends up being dropped. I don't know the exact timeframe it needs to be idle, 10 minutes seems to do it but I have also now seen it after 5 minutes.

When this happens, hubble shows this:
(In the past i have seen "No NAT mapping for NAT masquerade DROPPED", but that was probably partly caused by me misconfiguring the ipv4NativeRoutingCIDR: 10.0.0.0/8...)

```
# hubble observe -f --port 5201
Mar 31 16:54:15.239: 10.3.0.2:46912 (world) -> default/iperf3-server-694f76fc65-55zrh:5201 (ID:50141) to-endpoint FORWARDED (TCP Flags: SYN)
Mar 31 16:54:15.239: 10.3.0.2:46912 (world) <- default/iperf3-server-694f76fc65-55zrh:5201 (ID:50141) to-network FORWARDED (TCP Flags: SYN, ACK)
Mar 31 16:54:15.239: 10.3.0.2:46912 (world) <- default/iperf3-server:5201 (world) to-network FORWARDED (TCP Flags: SYN, ACK)
Mar 31 16:54:15.239: 10.3.0.2:46912 (world) <- default/iperf3-server:5201 (world) to-network FORWARDED (TCP Flags: SYN, ACK)
^ at shis moment client already gets a RST
Mar 31 16:54:22.326: 10.3.0.2:46912 (world) <- default/iperf3-server-694f76fc65-55zrh:5201 (ID:50141) to-network FORWARDED (TCP Flags: SYN, ACK)
Mar 31 16:54:22.326: 10.3.0.2:46912 (world) <- default/iperf3-server:5201 (world) to-network FORWARDED (TCP Flags: SYN, ACK)
```

tcpdump on the ingress node:
```
tcpdump: listening on dev-worker01, link-type EN10MB (Ethernet), snapshot length 262144 bytes
16:54:15.214277 de:d2:07:7b:cf:e8 > 00:00:36:a0:73:74, ethertype 802.1Q (0x8100), length 78: vlan 1004, p 0, ethertype IPv4 (0x0800), (tos 0x10, ttl 62, id 24280, offset 0, flags [DF], proto TCP (6), length 60)
    10.3.0.2.46912 > 10.64.4.60.5201: Flags [S], cksum 0xe3cb (correct), seq 4146662108, win 64240, options [mss 1460,sackOK,TS val 3223241484 ecr 0,nop,wscale 7], length 0
16:54:15.214412 00:00:36:a0:73:74 > 00:00:36:4e:cc:f9, ethertype 802.1Q (0x8100), length 86: vlan 1001, p 0, ethertype IPv4 (0x0800), (tos 0x10, ttl 61, id 24280, offset 0, flags [DF], proto TCP (6), length 68, options (unknown 154))
    10.3.0.2.46912 > 100.98.4.161.5201: Flags [S], cksum 0x8944 (correct), seq 4146662108, win 64240, options [mss 1460,sackOK,TS val 3223241484 ecr 0,nop,wscale 7], length 0
16:54:30.495555 de:d2:07:7b:cf:e8 > 00:00:36:a0:73:74, ethertype 802.1Q (0x8100), length 58: vlan 1004, p 0, ethertype IPv4 (0x0800), (tos 0x0, ttl 62, id 0, offset 0, flags [DF], proto TCP (6), length 40)
    10.3.0.2.46912 > 10.64.4.60.5201: Flags [R], cksum 0xc9c7 (correct), seq 4146662109, win 0, length 0
16:54:30.495730 00:00:36:a0:73:74 > 00:00:36:4e:cc:f9, ethertype 802.1Q (0x8100), length 58: vlan 1001, p 0, ethertype IPv4 (0x0800), (tos 0x0, ttl 61, id 0, offset 0, flags [DF], proto TCP (6), length 40)
    10.3.0.2.46912 > 100.98.4.161.5201: Flags [R], cksum 0x6f40 (correct), seq 4146662109, win 0, length 0
```
00:00:36:a0:73:74 is the worker node where the backend iperf3 pod is running

Subsequent connections usually work without an issue.

### Cilium Version

1.15.3

### Kernel Version

Linux worker02 6.1.82-talos #1 SMP Tue Mar 19 17:48:01 UTC 2024 x86_64 x86_64 x86_64 GNU/Linux

### Kubernetes Version

Client Version: v1.29.2
Kustomize Version: v5.0.4-0.20230601165947-6ce0bf390ce3
Server Version: v1.29.3

### Sysdump
[cilium-sysdump-20240331-165654.zip](https://github.com/cilium/cilium/files/14817008/cilium-sysdump-20240331-165654.zip)

### Cilium Users Document

- [ ] Are you a user of Cilium? Please add yourself to the [Users doc](https://github.com/cilium/cilium/blob/main/USERS.md)

### Code of Conduct

- [X] I agree to follow this project's Code of Conduct

**Comment by zviratko** [comment]
In case anybody enounters a similiar issue, the root cause is
1. Not much traffic on that particular bridge port
2. (Linux) bridge or switch expiring the L2 MAC address from the port
3. Incoming traffic causing the bridge/switch to flood all ports in order to find where the neighbor lives
4. ALL CILIUM NODES responding to the request as if it was intended for them, confusing the router(?) - I think each node uses it's own MAC, but I'm not 100% sure now
5.  For some reason, it converges after a few seconds and starts working normally, but connection attempts made in the first few seconds  just time out

I guess this behaviour will only be encountered on lab/dev/inactive clusters like mine.
Workaround would be making permanent port entries for the MACs, prolonging the port address-table cache time or similiar.
