### ISSUE TITLE
Pod to pod intermittent connection issues with ipam:eni and IPsec enabled

### ISSUE THREAD

**Issue by recollir** [cilium/cilium#18868]
### Is there an existing issue for this?

- [X] I have searched the existing issues

### What happened?

Hi everyone,

we have recently migrated a Kubernetes cluster from the AWS CNI plugin to Cilium 1.10.4 and since then we have experienced intermittent pod to pod connection issues. The issue started showign up a couple of days after the migration was completed, it doesn't seem to be bound to any specific application or protocol, and it manifests itself as packet loss. A restart of the cilium agent resolves the immediate issue but the issue shows up again after some time.

Detailed description

A prometheus pod 'PA' on node 'NA' can't scrape metrics for pod 'PB' on node 'NB'.

1. Prometheus pod PA sends SYN which is never seen on target pod PB
2. Prometheus pod PA can scrape other targets (in all subnets)
3. From the Prometheus node NA host network (if we ssh into the node and curl the metrics endpoint) we can scrape the metrics for pod PB (metrics are saved correctly)
4. Pod PB can receive new connections from host NB network (e.g. kubelet liveness probes)
5. Pod PB existing connections to other services continue to work
6. Other pods on node NB can continue receiving new network connections and work as expected
7. Restart of the cilium agent on node PB resolves the issue

NOTE: we run 3 prometheus (one in each availability zone) and they all recover after the restart of the cilium agent on node NB.

We have observed the same behaviour for connections over UDP (e.g. some pods unable to resolve DNS names via CoreDNS)

IPs mentioned in below tcpdump output (section `Anything else`):

- Prometheus pod PA: 10.103.172.168 - eu-west-1b
- Prometheus node NA: 10.103.167.210 - eu-west-1b
- Target pod PB: 10.103.212.169 - eu-west-1c
- Target node NB: 10.103.220.250 - eu-west-1c

Observation: the restart of the agent generates a lot of `insertion failed` errors in conntrack (conntrack is not full though)

### Cilium Version

1.10.4, ipam: eni, IPsec enabled (installed via Helm chart)

```
helm template cilium cilium/cilium --version 1.10.4 \
  --namespace kube-system \
  --set cluster.name=bar_prod_foo_example_com \
  --set cluster.id=${ID} \
  --set eni.subnetTagsFilter="Name=eu-west-1?.bar.prod.foo.example.com" \
  --set endpointRoutes.enabled=true \
  --set egressMasqueradeInterfaces=ens+ \
  --set ipam.mode=eni \
  --set eni.enabled=true \
  --set cni.customConf=true \
  --set cni.configMap=cni-configuration \
  --set nativeRoutingCIDR="10.0.0.0/8" \
  --set encryption.enabled=true \
  --set encryption.type=ipsec \
  --set tunnel=disabled \
  --set hostServices.enabled=true \
  --set hubble.relay.enabled=true \
  --set hubble.ui.enabled=true \
  --set hubble.tls.auto.method=cronJob \
  --set prometheus.enabled=true \
  --set operator.prometheus.enabled=true \
  --set debug.enabled=false \
  --set podAnnotations."logging\.example\.com/service"=cilium-agent \
  --set podAnnotations."logging\.example\.com/type"=go-kv \
  --set operator.podAnnotations."logging\.example\.com/service"=cilium-operator \
  --set operator.podAnnotations."logging\.example\.com/type"=go-kv \
  --set proxy.prometheus.enabled=false \
  --set hubble.metrics.enabled="{dns,drop,tcp,flow,icmp,http}" \
  --set hubble.tls.auto.method=cronJob \
  --set updateStrategy.rollingUpdate.maxUnavailable="10" \
  --set updateStrategy.type=RollingUpdate \
  --set operator.nodeSelector."foo\.example\.com/instance-class"=system \
  --set hubble.relay.nodeSelector."foo\.example\.com/instance-class"=system \
  --set hubble.ui.nodeSelector."foo\.example\.com/instance-class"=system \
  --set hubble.relay.tolerations[0].operator=Exists \
  --set hubble.ui.tolerations[0].operator=Exists \
> cilium-nodeselectors.helm.yaml
```

cni-config.yaml:
```
apiVersion: v1
kind: ConfigMap
metadata:
  name: cni-configuration
  namespace: kube-system
data:
  cni-config: |-
    {
      "cniVersion":"0.3.1",
      "name":"cilium",
      "plugins": [
        {
          "cniVersion":"0.3.1",
          "type":"cilium-cni",
          "eni": {
            "subnet-tags":{
              "KubernetesCluster":"bar.prod.foo.example.com",
              "SubnetType":"Private"
            }
          },
          "ipam": {
            "min-allocate": 41,
            "pre-allocate": 8
          }
        }
      ]
    }
```

### Kernel Version

kernel 5.11.0-1028-aws

Ubuntu 20.04 LTS - ubuntu-focal-20.04-amd64-server-20220131

### Kubernetes Version

1.18 (installed via kops in AWS (3 availability zones with 3 private /19 subnets)

Cluster size ~ 400 nodes  
Instance types c5.4xlarge, m5.4xlarge, r5.4xlarge. 
~ 3000 deployments, 10000 pods, 2000 services (ClusterIP)

### Sysdump

We ran `cilium debuginfo` on two nodes. We prefer to share the output privately.

### Relevant log output

```shell
`cilium status` showed all green (took ca 4 minutes to run)

No error msgs were seen in the logs - only level=info
```

### Anything else?

Tcpdump

1. Prometheus pod PA sends SYN which is never seen on target pod PB
   On the Prometheus node NA:

```
> tcpdump -tttt "host 10.103.212.169 and host 10.103.172.168" -r 2.pcap -nn
2022-02-17 12:00:03.752607 IP 10.103.172.168.34328 > 10.103.212.169.4196: Flags [S], seq 2290644311, win 65535, options [mss 8884,sackOK,TS val 987092310 ecr 0,nop,wscale 9], length 0

2022-02-17 12:00:06.062158 IP 10.103.172.168.37584 > 10.103.212.169.4196: Flags [S], seq 3862844180, win 65535, options [mss 8884,sackOK,TS val 987094620 ecr 0,nop,wscale 9], length 0
```

On the pod node NB:

```
> tcpdump -tttt "host 10.103.212.169 and host 10.103.172.168" -r 2.pcap -nn
# no match
```

2. Prometheus pod PA (10.103.172.168) can scrape other targets (in any subnets)

```
2022-02-17 12:00:03.013315 IP 10.103.172.168.33074 > 10.103.135.155.8080: Flags [S], seq 3252546460, win 65535, options [mss 8884,sackOK,TS val 526846194 ecr 0,nop,wscale 9], length 0
2022-02-17 12:00:03.013374 IP 10.103.172.168.33074 > 10.103.135.155.8080: Flags [S], seq 3252546460, win 65535, options [mss 8884,sackOK,TS val 526846194 ecr 0,nop,wscale 9], length 0
2022-02-17 12:00:03.013809 IP 10.103.135.155.8080 > 10.103.172.168.33074: Flags [S.], seq 2423403366, ack 3252546461, win 65535, options [mss 8884,sackOK,TS val 427316159 ecr 526846194,nop,wscale 9], length 0
2022-02-17 12:00:03.013833 IP 10.103.135.155.8080 > 10.103.172.168.33074: Flags [S.], seq 2423403366, ack 3252546461, win 65535, options [mss 8884,sackOK,TS val 427316159 ecr 526846194,nop,wscale 9], length 0
2022-02-17 12:00:03.013846 IP 10.103.172.168.33074 > 10.103.135.155.8080: Flags [.], ack 1, win 128, options [nop,nop,TS val 526846195 ecr 427316159], length 0
2022-02-17 12:00:03.013859 IP 10.103.172.168.33074 > 10.103.135.155.8080: Flags [.], ack 1, win 128, options [nop,nop,TS val 526846195 ecr 427316159], length 0
2022-02-17 12:00:03.013924 IP 10.103.172.168.33074 > 10.103.135.155.8080: Flags [P.], seq 1:242, ack 1, win 128, options [nop,nop,TS val 526846195 ecr 427316159], length 241: HTTP: GET /metrics HTTP/1.1
```

3. From the Prometheus node NA host network (if we ssh into the node and curl the metrics endpoint) we can scrape the metrics for pod PB (metrics are saved correctly)

- Fetched metrics via wget without errors

4. Pod PB (10.103.212.169) can receive new connections from host NB network (10.103.220.250) (e.g. kubelet liveness probes OR curl to the metrics endpoint)

```
2022-02-17 12:00:12.009244 IP 10.103.220.250.59570 > 10.103.212.169.4196: Flags [S], seq 1694039071, win 65535, options [mss 8961,sackOK,TS val 638208065 ecr 0,nop,wscale 9], length 0
2022-02-17 12:00:12.009253 IP 10.103.212.169.4196 > 10.103.220.250.59570: Flags [S.], seq 1263619998, ack 1694039072, win 65535, options [mss 8884,sackOK,TS val 3699002021 ecr 638208065,nop,wscale 9], length 0
2022-02-17 12:00:12.009276 IP 10.103.220.250.59570 > 10.103.212.169.4196: Flags [.], ack 1, win 128, options [nop,nop,TS val 638208065 ecr 3699002021], length 0
2022-02-17 12:00:12.009386 IP 10.103.220.250.59570 > 10.103.212.169.4196: Flags [P.], seq 1:121, ack 1, win 128, options [nop,nop,TS val 638208065 ecr 3699002021], length 120
2022-02-17 12:00:12.009394 IP 10.103.212.169.4196 > 10.103.220.250.59570: Flags [.], ack 121, win 128, options [nop,nop,TS val 3699002021 ecr 638208065], length 0
2022-02-17 12:00:12.009519 IP 10.103.212.169.4196 > 10.103.220.250.59570: Flags [P.], seq 1:140, ack 121, win 128, options [nop,nop,TS val 3699002021 ecr 638208065], length 139
```

5. Pod PB (10.103.212.169) existing connections to other endpoints continue to work

```
2022-02-17 12:00:04.052515 IP 10.103.168.139.9092 > 10.103.212.169.37612: Flags [P.], seq 3717563939:3717564629, ack 1284457188, win 46758, options [nop,nop,TS val 2961025670 ecr 1202105999], length 690
2022-02-17 12:00:04.052541 IP 10.103.168.139.9092 > 10.103.212.169.37612: Flags [P.], seq 0:690, ack 1, win 46758, options [nop,nop,TS val 2961025670 ecr 1202105999], length 690
2022-02-17 12:00:04.053449 IP 10.103.212.169.37612 > 10.103.168.139.9092: Flags [P.], seq 1:402, ack 690, win 5582, options [nop,nop,TS val 1202106006 ecr 2961025670], length 401
2022-02-17 12:00:04.053461 IP 10.103.212.169.37612 > 10.103.168.139.9092: Flags [P.], seq 1:402, ack 690, win 5582, options [nop,nop,TS val 1202106006 ecr 2961025670], length 401
2022-02-17 12:00:04.055602 IP 10.103.168.139.9092 > 10.103.212.169.37612: Flags [P.], seq 690:759, ack 402, win 46758, options [nop,nop,TS val 2961025674 ecr 1202106006], length 69
```

6. Other pods (10.103.195.132) on node NB can continue receiving new network connections and work as expected

```
2022-02-17 12:00:06.936582 IP 10.103.135.130.38022 > 10.103.195.132.9091: Flags [S], seq 3039497611, win 65535, options [mss 8884,sackOK,TS val 58554342 ecr 0,nop,wscale 9], length 0
2022-02-17 12:00:06.936733 IP 10.103.135.130.38022 > 10.103.195.132.9091: Flags [S], seq 3039497611, win 65535, options [mss 8884,sackOK,TS val 58554342 ecr 0,nop,wscale 9], length 0
2022-02-17 12:00:06.936751 IP 10.103.195.132.9091 > 10.103.135.130.38022: Flags [S.], seq 1541887290, ack 3039497612, win 65535, options [mss 8884,sackOK,TS val 2714233498 ecr 58554342,nop,wscale 9], length 0
2022-02-17 12:00:06.936771 IP 10.103.195.132.9091 > 10.103.135.130.38022: Flags [S.], seq 1541887290, ack 3039497612, win 65535, options [mss 8884,sackOK,TS val 2714233498 ecr 58554342,nop,wscale 9], length 0
2022-02-17 12:00:06.937281 IP 10.103.135.130.38022 > 10.103.195.132.9091: Flags [.], ack 1, win 128, options [nop,nop,TS val 58554343 ecr 2714233498], length 0
2022-02-17 12:00:06.937314 IP 10.103.135.130.38022 > 10.103.195.132.9091: Flags [.], ack 1, win 128, options [nop,nop,TS val 58554343 ecr 2714233498], length 0
2022-02-17 12:00:06.937317 IP 10.103.135.130.38022 > 10.103.195.132.9091: Flags [P.], seq 1:252, ack 1, win 128, options [nop,nop,TS val 58554343 ecr 2714233498], length 251
2022-02-17 12:00:06.937363 IP 10.103.135.130.38022 > 10.103.195.132.9091: Flags [P.], seq 1:252, ack 1, win 128, options [nop,nop,TS val 58554343 ecr 2714233498], length 251
```

7. Restart of the cilium agent on node PB resolves the issue

```
2022-02-17 12:28:46.762234 IP 10.103.172.168.48238 > 10.103.212.169.4196: Flags [S], seq 906838819, win 65535, options [mss 8884,sackOK,TS val 988815318 ecr 0,nop,wscale 9], length 0
2022-02-17 12:28:46.762292 IP 10.103.172.168.48238 > 10.103.212.169.4196: Flags [S], seq 906838819, win 65535, options [mss 8884,sackOK,TS val 988815318 ecr 0,nop,wscale 9], length 0
2022-02-17 12:28:46.762306 IP 10.103.212.169.4196 > 10.103.172.168.48238: Flags [S.], seq 875846799, ack 906838820, win 65535, options [mss 8884,sackOK,TS val 750488970 ecr 988815318,nop,wscale 9], length 0
2022-02-17 12:28:46.762317 IP 10.103.212.169.4196 > 10.103.172.168.48238: Flags [S.], seq 875846799, ack 906838820, win 65535, options [mss 8884,sackOK,TS val 750488970 ecr 988815318,nop,wscale 9], length 0
2022-02-17 12:28:46.762716 IP 10.103.172.168.48238 > 10.103.212.169.4196: Flags [.], ack 1, win 128, options [nop,nop,TS val 988815319 ecr 750488970], length 0
2022-02-17 12:28:46.762724 IP 10.103.172.168.48238 > 10.103.212.169.4196: Flags [.], ack 1, win 128, options [nop,nop,TS val 988815319 ecr 750488970], length 0
2022-02-17 12:28:46.762827 IP 10.103.172.168.48238 > 10.103.212.169.4196: Flags [P.], seq 1:242, ack 1, win 128, options [nop,nop,TS val 988815319 ecr 750488970], length 241
2022-02-17 12:28:46.762836 IP 10.103.172.168.48238 > 10.103.212.169.4196: Flags [P.], seq 1:242, ack 1, win 128, options [nop,nop,TS val 988815319 ecr 750488970], length 241
```

### Code of Conduct

- [X] I agree to follow this project's Code of Conduct

**Comment by vincentmli** [comment]
> 7. Restart of the cilium agent on node PB resolves the issue

only giving some thought here :), can you make sure if the SYN really arrived at NB by tcpdump on proper network interface on NB from your network path? if SYN did arrive at NB and dropped for some reason, maybe run PWRU https://github.com/cilium/pwru on NB to see if any clue there?

**Comment by recollir** [comment]
Thanks for the link to PWRU. We will run it the next time we encounter the issue; in the meantime we have disabled IPsec encryption to see if the situation of connectivity problems improves (we are setting up a second cluster to reproduce the issues though).

tcpdump against any interface (`tcpdump -i any ...`)on NB (done directly in the host OS) does not see the packet. Shouldn't it be able to see the packet in a working system when being received by the host ENIs (ens5 or ens6)?

BTW the rules in Iptables are identical before and after the restart of the cilium agent. Also the routes were identical. Any other place we should check for differences or problems in the collected data from the `cilium-bugtool`? Anything you would see with access to the data (that we can share privately)?

We have also seen that once the connectivity problems between two pods start, they don't recover (the connectivity is permanently lost and even new connection attempts fail) and the only fix we know for the moment is to restart the agents.

**Comment by recollir** [comment]
So the situation has somewhat stabalised after disabling IPsec. We have seen the intermittent connection issues much less but they come from time to time in bursts though never really dissappear.

We had the possibility to run pwru on a node where a pod had issues communicating to the CoreDNS and another pod could resolve through CoreDNS.

Non-working pod (pwru filtering on the pod IP and using the tuple output - sorted by timestamp):

```
0xffff8dfa0b1a8500           [node]              udp4_hwcsum 1396405178130000 10.103.189.249:52882->100.64.0.10:53(udp)
0xffff8dfa0b1a8500           [node]              ip_send_skb 1396405178151483 10.103.189.249:52882->100.64.0.10:53(udp)
0xffff8dfa0b1a8500           [node]             ip_local_out 1396405178153689 10.103.189.249:52882->100.64.0.10:53(udp)
0xffff8dfa0b1a8500           [node]           __ip_local_out 1396405178155603 10.103.189.249:52882->100.64.0.10:53(udp)
0xffff8dfa0b1a8500           [node]                ip_output 1396405178157445 10.103.189.249:52882->100.64.0.10:53(udp)
0xffff8dfa0b1a8500           [node]             nf_hook_slow 1396405178159373 10.103.189.249:52882->100.64.0.10:53(udp)
0xffff8dfa0b1a8500           [node]  apparmor_ipv4_postroute 1396405178161397 10.103.189.249:52882->100.64.0.10:53(udp)
0xffff8dfa0b1a8500           [node]         ip_finish_output 1396405178163307 10.103.189.249:52882->100.64.0.10:53(udp)
0xffff8dfa0b1a8500        [node] __cgroup_bpf_run_filter_skb 1396405178164817 10.103.189.249:52882->100.64.0.10:53(udp)
0xffff8dfa0b1a8500           [node]       __ip_finish_output 1396405178166622 10.103.189.249:52882->100.64.0.10:53(udp)
0xffff8dfa0b1a8500           [node]        ip_finish_output2 1396405178168031 10.103.189.249:52882->100.64.0.10:53(udp)
0xffff8dfa0b1a8500           [node]           dev_queue_xmit 1396405178170433 10.103.189.249:52882->100.64.0.10:53(udp)
0xffff8dfa0b1a8500           [node]         __dev_queue_xmit 1396405178172043 10.103.189.249:52882->100.64.0.10:53(udp)
0xffff8dfa0b1a8500           [node]      netdev_core_pick_tx 1396405178173475 10.103.189.249:52882->100.64.0.10:53(udp)
0xffff8dfa0b1a8500           [node]        validate_xmit_skb 1396405178175649 10.103.189.249:52882->100.64.0.10:53(udp)
0xffff8dfa0b1a8500           [node]       netif_skb_features 1396405178177139 10.103.189.249:52882->100.64.0.10:53(udp)
0xffff8dfa0b1a8500           [node]  passthru_features_check 1396405178178845 10.103.189.249:52882->100.64.0.10:53(udp)
0xffff8dfa0b1a8500           [node]     skb_network_protocol 1396405178180441 10.103.189.249:52882->100.64.0.10:53(udp)
0xffff8dfa0b1a8500           [node]  skb_csum_hwoffload_help 1396405178181951 10.103.189.249:52882->100.64.0.10:53(udp)
0xffff8dfa0b1a8500           [node]       validate_xmit_xfrm 1396405178183247 10.103.189.249:52882->100.64.0.10:53(udp)
0xffff8dfa0b1a8500           [node]      dev_hard_start_xmit 1396405178185455 10.103.189.249:52882->100.64.0.10:53(udp)
0xffff8dfa0b1a8500           [node]   skb_clone_tx_timestamp 1396405178187622 10.103.189.249:52882->100.64.0.10:53(udp)
0xffff8dfa0b1a8500           [node]        __dev_forward_skb 1396405178190048 10.103.189.249:52882->100.64.0.10:53(udp)
0xffff8dfa0b1a8500           [node]         skb_scrub_packet 1396405178191967 10.103.189.249:52882->100.64.0.10:53(udp)
0xffff8dfa0b1a8500           [node]           eth_type_trans 1396405178193441 10.103.189.249:52882->100.64.0.10:53(udp)
0xffff8dfa0b1a8500           [node]                 netif_rx 1396405178195366 10.103.189.249:52882->100.64.0.10:53(udp)
0xffff8dfa0b1a8500           [node]        netif_rx_internal 1396405178197092 10.103.189.249:52882->100.64.0.10:53(udp)
0xffff8dfa0b1a8500           [node]       enqueue_to_backlog 1396405178199128 10.103.189.249:52882->100.64.0.10:53(udp)
0xffff8dfa0b1a8500           [node]      __netif_receive_skb 1396405178201190 10.103.189.249:52882->100.64.0.10:53(udp)
0xffff8dfa0b1a8500       [node] __netif_receive_skb_one_core 1396405178202729 10.103.189.249:52882->100.64.0.10:53(udp)
0xffff8dfa0b1a8500           [node]     tcf_classify_ingress 1396405178205115 10.103.189.249:52882->100.64.0.10:53(udp)
0xffff8dfa0b1a8500           [node]      skb_ensure_writable 1396405178209788 10.103.189.249:52882->100.64.0.10:53(udp)
0xffff8dfa0b1a8500        [<empty>]              consume_skb 1396405178277167 10.103.189.249:52882->10.103.164.2:53(udp)
0xffff8dfa0b1a8500        [<empty>]          skb_release_all 1396405178280522 10.103.189.249:52882->10.103.164.2:53(udp)
0xffff8dfa0b1a8500        [<empty>]   skb_release_head_state 1396405178281786 10.103.189.249:52882->10.103.164.2:53(udp)
0xffff8dfa0b1a8500        [<empty>]         skb_release_data 1396405178283334 10.103.189.249:52882->10.103.164.2:53(udp)
0xffff8dfa0b1a8500        [<empty>]            skb_free_head 1396405178284779 10.103.189.249:52882->10.103.164.2:53(udp)
0xffff8dfa0b1a8500        [<empty>]             kfree_skbmem 1396405178286722 10.103.189.249:52882->10.103.164.2:53(udp)
```

Working pod (pwru filtering on the pod IP and using the tuple output - sorted by timestamp):

```
0xffff8dfec316c700           [curl]              udp4_hwcsum 1397742887468561 10.103.169.108:60889->100.64.0.10:53(udp)
0xffff8dfec316c700           [curl]              ip_send_skb 1397742887474118 10.103.169.108:60889->100.64.0.10:53(udp)
0xffff8dfec316c700           [curl]             ip_local_out 1397742887476548 10.103.169.108:60889->100.64.0.10:53(udp)
0xffff8dfec316c700           [curl]           __ip_local_out 1397742887478363 10.103.169.108:60889->100.64.0.10:53(udp)
0xffff8dfec316c700           [curl]                ip_output 1397742887480327 10.103.169.108:60889->100.64.0.10:53(udp)
0xffff8dfec316c700           [curl]             nf_hook_slow 1397742887482783 10.103.169.108:60889->100.64.0.10:53(udp)
0xffff8dfec316c700           [curl]  apparmor_ipv4_postroute 1397742887484986 10.103.169.108:60889->100.64.0.10:53(udp)
0xffff8dfec316c700           [curl]         ip_finish_output 1397742887487279 10.103.169.108:60889->100.64.0.10:53(udp)
0xffff8dfec316c700        [curl] __cgroup_bpf_run_filter_skb 1397742887489295 10.103.169.108:60889->100.64.0.10:53(udp)
0xffff8dfec316c700           [curl]       __ip_finish_output 1397742887491489 10.103.169.108:60889->100.64.0.10:53(udp)
0xffff8dfec316c700           [curl]        ip_finish_output2 1397742887493525 10.103.169.108:60889->100.64.0.10:53(udp)
0xffff8dfec316c700           [curl]           dev_queue_xmit 1397742887495507 10.103.169.108:60889->100.64.0.10:53(udp)
0xffff8dfec316c700           [curl]         __dev_queue_xmit 1397742887497598 10.103.169.108:60889->100.64.0.10:53(udp)
0xffff8dfec316c700           [curl]      netdev_core_pick_tx 1397742887499486 10.103.169.108:60889->100.64.0.10:53(udp)
0xffff8dfec316c700           [curl]        validate_xmit_skb 1397742887501751 10.103.169.108:60889->100.64.0.10:53(udp)
0xffff8dfec316c700           [curl]       netif_skb_features 1397742887503649 10.103.169.108:60889->100.64.0.10:53(udp)
0xffff8dfec316c700           [curl]  passthru_features_check 1397742887505527 10.103.169.108:60889->100.64.0.10:53(udp)
0xffff8dfec316c700           [curl]     skb_network_protocol 1397742887507605 10.103.169.108:60889->100.64.0.10:53(udp)
0xffff8dfec316c700           [curl]  skb_csum_hwoffload_help 1397742887509822 10.103.169.108:60889->100.64.0.10:53(udp)
0xffff8dfec316c700           [curl]       validate_xmit_xfrm 1397742887511621 10.103.169.108:60889->100.64.0.10:53(udp)
0xffff8dfec316c700           [curl]      dev_hard_start_xmit 1397742887513926 10.103.169.108:60889->100.64.0.10:53(udp)
0xffff8dfec316c700           [curl]   skb_clone_tx_timestamp 1397742887516967 10.103.169.108:60889->100.64.0.10:53(udp)
0xffff8dfec316c700           [curl]        __dev_forward_skb 1397742887519596 10.103.169.108:60889->100.64.0.10:53(udp)
0xffff8dfec316c700           [curl]         skb_scrub_packet 1397742887521778 10.103.169.108:60889->100.64.0.10:53(udp)
0xffff8dfec316c700           [curl]           eth_type_trans 1397742887523765 10.103.169.108:60889->100.64.0.10:53(udp)
0xffff8dfec316c700           [curl]                 netif_rx 1397742887525980 10.103.169.108:60889->100.64.0.10:53(udp)
0xffff8dfec316c700           [curl]        netif_rx_internal 1397742887529923 10.103.169.108:60889->100.64.0.10:53(udp)
0xffff8dfec316c700           [curl]       enqueue_to_backlog 1397742887532884 10.103.169.108:60889->100.64.0.10:53(udp)
0xffff8dfec316c700           [curl]      __netif_receive_skb 1397742887535934 10.103.169.108:60889->100.64.0.10:53(udp)
0xffff8dfec316c700       [curl] __netif_receive_skb_one_core 1397742887538168 10.103.169.108:60889->100.64.0.10:53(udp)
0xffff8dfec316c700           [curl]     tcf_classify_ingress 1397742887542324 10.103.169.108:60889->100.64.0.10:53(udp)
0xffff8dfec316c700        [<empty>]              consume_skb 1397742887740039 10.103.169.108:60889->10.103.130.69:53(udp)
0xffff8dfec316c700        [<empty>]          skb_release_all 1397742887742748 10.103.169.108:60889->10.103.130.69:53(udp)
0xffff8dfec316c700        [<empty>]   skb_release_head_state 1397742887744358 10.103.169.108:60889->10.103.130.69:53(udp)
0xffff8dfec316c700        [<empty>]         skb_release_data 1397742887745869 10.103.169.108:60889->10.103.130.69:53(udp)
0xffff8dfec316c700        [<empty>]            skb_free_head 1397742887747491 10.103.169.108:60889->10.103.130.69:53(udp)
0xffff8dfec316c700        [<empty>]             kfree_skbmem 1397742887749414 10.103.169.108:60889->10.103.130.69:53(udp)
0xffff8dfec316c800        [<empty>]              consume_skb 1397742887813886 10.103.169.108:60889->10.103.130.69:53(udp)
0xffff8dfec316c800        [<empty>]          skb_release_all 1397742887816597 10.103.169.108:60889->10.103.130.69:53(udp)
0xffff8dfec316c800        [<empty>]   skb_release_head_state 1397742887817982 10.103.169.108:60889->10.103.130.69:53(udp)
0xffff8dfec316c800        [<empty>]         skb_release_data 1397742887819847 10.103.169.108:60889->10.103.130.69:53(udp)
0xffff8dfec316c800        [<empty>]            skb_free_head 1397742887821435 10.103.169.108:60889->10.103.130.69:53(udp)
0xffff8dfec316c800        [<empty>]             kfree_skbmem 1397742887823198 10.103.169.108:60889->10.103.130.69:53(udp)
0xffff8df8059a4ee0           [curl]             ip_local_out 1397742893146983 10.103.169.108:46420->74.125.193.102:80(tcp)
0xffff8df8059a4ee0           [curl]           __ip_local_out 1397742893156026 10.103.169.108:46420->74.125.193.102:80(tcp)
0xffff8df8059a4ee0           [curl]                ip_output 1397742893157850 10.103.169.108:46420->74.125.193.102:80(tcp)
0xffff8df8059a4ee0           [curl]             nf_hook_slow 1397742893160724 10.103.169.108:46420->74.125.193.102:80(tcp)
```

**Comment by recollir** [comment]
If I do the following side by side comparison (leaving out timestamps and the SKBs) one can see the following
```
     32 10.103.189.249:52882->100.64.0.10:53(udp)                  udp4_hwcsum                   udp4_hwcsum 10.103.169.108:60889->100.64.0.10:53(udp)
     31 10.103.189.249:52882->100.64.0.10:53(udp)                  ip_send_skb                   ip_send_skb 10.103.169.108:60889->100.64.0.10:53(udp)
     30 10.103.189.249:52882->100.64.0.10:53(udp)                 ip_local_out                  ip_local_out 10.103.169.108:60889->100.64.0.10:53(udp)
     29 10.103.189.249:52882->100.64.0.10:53(udp)               __ip_local_out                __ip_local_out 10.103.169.108:60889->100.64.0.10:53(udp)
     28 10.103.189.249:52882->100.64.0.10:53(udp)                    ip_output                     ip_output 10.103.169.108:60889->100.64.0.10:53(udp)
     27 10.103.189.249:52882->100.64.0.10:53(udp)                 nf_hook_slow                  nf_hook_slow 10.103.169.108:60889->100.64.0.10:53(udp)
     26 10.103.189.249:52882->100.64.0.10:53(udp)      apparmor_ipv4_postroute       apparmor_ipv4_postroute 10.103.169.108:60889->100.64.0.10:53(udp)
     25 10.103.189.249:52882->100.64.0.10:53(udp)             ip_finish_output              ip_finish_output 10.103.169.108:60889->100.64.0.10:53(udp)
     24 10.103.189.249:52882->100.64.0.10:53(udp)  __cgroup_bpf_run_filter_skb   __cgroup_bpf_run_filter_skb 10.103.169.108:60889->100.64.0.10:53(udp)
     23 10.103.189.249:52882->100.64.0.10:53(udp)           __ip_finish_output            __ip_finish_output 10.103.169.108:60889->100.64.0.10:53(udp)
     22 10.103.189.249:52882->100.64.0.10:53(udp)            ip_finish_output2             ip_finish_output2 10.103.169.108:60889->100.64.0.10:53(udp)
     21 10.103.189.249:52882->100.64.0.10:53(udp)               dev_queue_xmit                dev_queue_xmit 10.103.169.108:60889->100.64.0.10:53(udp)
     20 10.103.189.249:52882->100.64.0.10:53(udp)             __dev_queue_xmit              __dev_queue_xmit 10.103.169.108:60889->100.64.0.10:53(udp)
     19 10.103.189.249:52882->100.64.0.10:53(udp)          netdev_core_pick_tx           netdev_core_pick_tx 10.103.169.108:60889->100.64.0.10:53(udp)
     18 10.103.189.249:52882->100.64.0.10:53(udp)            validate_xmit_skb             validate_xmit_skb 10.103.169.108:60889->100.64.0.10:53(udp)
     17 10.103.189.249:52882->100.64.0.10:53(udp)           netif_skb_features            netif_skb_features 10.103.169.108:60889->100.64.0.10:53(udp)
     16 10.103.189.249:52882->100.64.0.10:53(udp)      passthru_features_check       passthru_features_check 10.103.169.108:60889->100.64.0.10:53(udp)
     15 10.103.189.249:52882->100.64.0.10:53(udp)         skb_network_protocol          skb_network_protocol 10.103.169.108:60889->100.64.0.10:53(udp)
     14 10.103.189.249:52882->100.64.0.10:53(udp)      skb_csum_hwoffload_help       skb_csum_hwoffload_help 10.103.169.108:60889->100.64.0.10:53(udp)
     13 10.103.189.249:52882->100.64.0.10:53(udp)           validate_xmit_xfrm            validate_xmit_xfrm 10.103.169.108:60889->100.64.0.10:53(udp)
     12 10.103.189.249:52882->100.64.0.10:53(udp)          dev_hard_start_xmit           dev_hard_start_xmit 10.103.169.108:60889->100.64.0.10:53(udp)
     11 10.103.189.249:52882->100.64.0.10:53(udp)       skb_clone_tx_timestamp        skb_clone_tx_timestamp 10.103.169.108:60889->100.64.0.10:53(udp)
     10 10.103.189.249:52882->100.64.0.10:53(udp)            __dev_forward_skb             __dev_forward_skb 10.103.169.108:60889->100.64.0.10:53(udp)
      9 10.103.189.249:52882->100.64.0.10:53(udp)             skb_scrub_packet              skb_scrub_packet 10.103.169.108:60889->100.64.0.10:53(udp)
      8 10.103.189.249:52882->100.64.0.10:53(udp)               eth_type_trans                eth_type_trans 10.103.169.108:60889->100.64.0.10:53(udp)
      7 10.103.189.249:52882->100.64.0.10:53(udp)                     netif_rx                      netif_rx 10.103.169.108:60889->100.64.0.10:53(udp)
      6 10.103.189.249:52882->100.64.0.10:53(udp)            netif_rx_internal             netif_rx_internal 10.103.169.108:60889->100.64.0.10:53(udp)
      5 10.103.189.249:52882->100.64.0.10:53(udp)           enqueue_to_backlog            enqueue_to_backlog 10.103.169.108:60889->100.64.0.10:53(udp)
      4 10.103.189.249:52882->100.64.0.10:53(udp)          __netif_receive_skb           __netif_receive_skb 10.103.169.108:60889->100.64.0.10:53(udp)
      3 10.103.189.249:52882->100.64.0.10:53(udp) __netif_receive_skb_one_core  __netif_receive_skb_one_core 10.103.169.108:60889->100.64.0.10:53(udp)
      2 10.103.189.249:52882->100.64.0.10:53(udp)         tcf_classify_ingress          tcf_classify_ingress 10.103.169.108:60889->100.64.0.10:53(udp)
      1
    33  10.103.189.249:52882->100.64.0.10:53(udp)          skb_ensure_writable                   consume_skb 10.103.169.108:60889->10.103.130.69:53(udp)
      1 10.103.189.249:52882->10.103.164.2:53(udp)                 consume_skb               skb_release_all 10.103.169.108:60889->10.103.130.69:53(udp)
      2 10.103.189.249:52882->10.103.164.2:53(udp)             skb_release_all        skb_release_head_state 10.103.169.108:60889->10.103.130.69:53(udp)
      3 10.103.189.249:52882->10.103.164.2:53(udp)      skb_release_head_state              skb_release_data 10.103.169.108:60889->10.103.130.69:53(udp)
      4 10.103.189.249:52882->10.103.164.2:53(udp)            skb_release_data                 skb_free_head 10.103.169.108:60889->10.103.130.69:53(udp)
      5 10.103.189.249:52882->10.103.164.2:53(udp)               skb_free_head                  kfree_skbmem 10.103.169.108:60889->10.103.130.69:53(udp)
      6 10.103.189.249:52882->10.103.164.2:53(udp)                kfree_skbmem                   consume_skb 10.103.169.108:60889->10.103.130.69:53(udp)
      7                                                                                      skb_release_all 10.103.169.108:60889->10.103.130.69:53(udp)
      8                                                                               skb_release_head_state 10.103.169.108:60889->10.103.130.69:53(udp)
      9                                                                                     skb_release_data 10.103.169.108:60889->10.103.130.69:53(udp)
     10                                                                                        skb_free_head 10.103.169.108:60889->10.103.130.69:53(udp)
     11                                                                                         kfree_skbmem 10.103.169.108:60889->10.103.130.69:53(udp)
     12                                                                                         ip_local_out 10.103.169.108:46420->74.125.193.102:80(tcp)
     13                                                                                       __ip_local_out 10.103.169.108:46420->74.125.193.102:80(tcp)
     14                                                                                            ip_output 10.103.169.108:46420->74.125.193.102:80(tcp)
     15                                                                                         nf_hook_slow 10.103.169.108:46420->74.125.193.102:80(tcp)
```

Left two columns non working pod
Right two columns working pod

At line 33 the non-working pod does a `skb_ensure_writable` while for the working pod a `consume_skb` happens. For the non-working pod the "communication" breaks after `kfree_skbmem`, the working on does another `consume_skb` and then switches over from DNS to do the real work (in this case a curl to port 80)

**Comment by recollir** [comment]
@brb @aanm We have a cilium sysdump for just that node. Anything we should look at? Would it be possible to share that sysdump in a private fashion?

Anything else you would suggest to try, test and collect data from?

Please note that this is now without IPsec.

**Comment by prune998** [comment]
I had similar issues and wasn't able to get to a conclusion. 
In my case it was even impacting the `kubelet` of the node to reach the AWS API metadata of the node `169.254.169.254`. but anything else could reach it. 
My guess is that it was linked to `nat` or `ct` tables containing strange entries.
`cilium bpf  nat flush global` and `cilium bpf  ct flush global` would generally correct the issue.

Finally, I enable the `ipMasqAgent` to ensure we're not masquerading whatever is internal in the cluster:

```
bpf:
  # enable EBPF masquerade. https://docs.cilium.io/en/stable/concepts/networking/masquerading/
  masquerade: true
ipMasqAgent:
  enabled: true
```

So far, so good... 
Try using the `cilium bpf  ct list global ` (or other `cilium bpf` commands to get insight)

**Comment by recollir** [comment]
Thanks @prune998. We have seen the ` kubelet` being impacted on occasions where it could not scrape the readiness or liveness probes. Did enabling `ipMasqAgent` resolve the issues for you completely? Where you running with or without encryption?

**Comment by recollir** [comment]
Second follow up as I missed to ask, @prune998: are you using “native VPC” IPs for your pods, that is IPAM mode ENI?

**Comment by recollir** [comment]
I also wonder how the new default of `bpf.masquerade: false` would affect the `ipMasqAgent` setting? There is this commit https://github.com/cilium/cilium/commit/dc40b2cbe0468aa7389cdafa6c0ae0387f165eb8

**Comment by recollir** [comment]
Hi again.

At the beginning of the week we found another broken pod on the cluster where we experienced intermittent communication problems.

We could drain the corresponding node and then saturate it with 50+ test pods running the [netshoot container](https://github.com/nicolaka/netshoot) so that the AWS instance will have several ENIs attached to it.

Luckily one of those test pods also should the same/similar symptoms as the real application pod before and that we have seen in previous weeks after the migration. All other pods on the node work and don’t experience communication problems, as far as we can see. To recap our setup: Cilium 1.10.4, ipam mode ENI in AWS, no kube-proxy replacement, and encryption currently disabled (see [#18868](https://github.com/cilium/cilium/issues/18868))

This is what we have tried:

- Dns resolution against coredns clusterip
- Dns resolution against a coredns pod on different node in the cluster
- Dns resolution against the VPC dns resolver
- Dns resolution against @8.8.8.8

- Curl/telnet against a pod ip on the same node
- Curl/telnet against a pod ip on a different node in the cluster
- Curl/telnet against a cluster ip service in the cluster
- Curl/telnet against an internal ELB ip in the same VPC
- Curl/telnet against an external ip on the internet

(we used the IP to not have to do any dns resolution in curl/telnet)

On the working pods on that node everything works (also for pods on the same ENI as the broken pod).

For the broken pod we get the following results for outgoing traffic:

- NOTOK  - Dns resolution against coredns clusterip
- NOTOK  - Dns resolution against a coredns pod on different node in the cluster
- NOTOK  - Dns resolution against the VPC dns resolver
- WORKS - Dns resolution against @8.8.8.8

- WORKS - Curl/telnet against a pod ip on the same node
- NOTOK  - Curl/telnet against a pod ip on a different node in the cluster
- NOTOK  - Curl/telnet against a cluster ip service in the cluster
- NOTOK  - Curl/telnet against an internal ELB ip in the same VPC
- WORKS - Curl/telnet against an external ip on the internet
 
We have also done the opposite - running a service (nc) inside the broken pod and tried to reach it. These are the results for incoming traffic regarding the broken pod.

- WORKS - Curl/telnet from a pod on the same node directly to the pod ip
- WORKS - Curl/telnet from the same node (host network) directly to the pod ip
- WORKS - Curl/telnet from a pod on the same node against a cluster ip service for the broken pod

- NOTOK - Curl/telnet from a pod on another node directly to the pod ip
- NOTOK  - Curl/telnet from another node (host network) directly to the pod ip
- NOTOK - Curl/telnet from a pod on another node against a cluster ip service for the broken pod

- WORKS - Curl/telnet from a pod on the same node against the ELB of the service for the broken pod
- WORKS - Curl/telnet from a pod on another node against the ELB of the service for the broken pod
- WORKS - Curl/telnet from the internet against the ELB of the service for the broken pod

Tl;dr to summarize and get a better overview:

- The broken pod can not talk to anything inside the cluster or the VPC.
- It can talk to other pods on the same node and anything outside the VPC on the internet.

- The broken pod can not be reached from pods on other nodes (neither directly nore through the clusterIP).
- It can be reached from pods on the same node or from through the ELB of the clusterIP service.

- There are other pods on the same node and on the same ENI where everything of the above works.

We have collected the sysdump. We also ran hubble and tcpdump on the broken source node and on the nodes of the other destination pods. From the output there it seems that no packet from the broken pod is leaving the node. While we see packets arriving on the destination node and replies coming back when doing the same test with any of the working pods on the node. We noticed that in both cases (for the working and for the broken pod) that we see and get entries in the conntrack and cilium ct map. Though in the case for the broken pod the output for ct does not make sense.

When looking through the sysdump we compared the settings and output of a working pod against the broken pod at different place. We did the same with exec:ing into the cilium agent on that node and looking at several cilium xxx outputs…

We assume the packets from the broken pod are somewhere lost on the node. We don’t know yet where. Any ideas and suggestions on how to proceed with our debugging? Where should we look deeper into? Bpf maps, iptables, …? Any hint is appreciated.

I will add some of the outputs from hubble and tcpdump and ct in another msg.

**Comment by recollir** [comment]
Broken pod netshoot-31 trying to do DNS against a coredns pod directly (the same works for other pods on the same node):

```
Broken pod IP: 10.103.205.47
Node of broken pod: ip-10-103-220-24
Coredns pod IP: 10.103.205.145
Node of coredns pod: ip-10-103-216-108
```

```
bash-5.1# dig +short +time=2 +tries=1 google.com @10.103.205.145
;; connection timed out; no servers could be reached

root@ip-10-103-220-24:~# tcpdump -i any host 10.103.205.47
tcpdump: verbose output suppressed, use -v or -vv for full protocol decode
listening on any, link-type LINUX_SLL (Linux cooked v1), capture size 262144 bytes
12:30:41.423577 ARP, Request who-has ip-10-103-220-24 tell 10.103.205.47, length 28
12:30:41.423592 ARP, Reply ip-10-103-220-24 is-at b6:ad:e6:5b:a4:04 (oui Unknown), length 28
12:30:41.423597 IP 10.103.205.47.42308 > 10.103.205.145.domain: 24303+ [1au] A? google.com. (54)
12:30:41.423748 IP 10.103.205.47.42308 > 10.103.205.145.domain: 24303+ [1au] A? google.com. (54)

root@ip-10-103-216-108:~# tcpdump -i any host 10.103.205.47
tcpdump: verbose output suppressed, use -v or -vv for full protocol decode
listening on any, link-type LINUX_SLL (Linux cooked v1), capture size 262144 bytes
```

**Comment by recollir** [comment]
Broken pod curling/telneting to another pod in the cluster (the same works for other pods on the same node):

```
Broken pod IP: 10.103.205.47
Node of broken pod: ip-10-103-220-24
Pod IP running nc in listening mode: 10.103.185.101
Node of pod running nc: ip-10-103-165-188
```

```
Inside broken pod:    telnet 10.103.185.101 8080
Insde pod running nc: nc -l -k -p 8080
```

```
root@ip-10-103-220-24:~# tcpdump -i any host 10.103.205.47
tcpdump: verbose output suppressed, use -v or -vv for full protocol decode
listening on any, link-type LINUX_SLL (Linux cooked v1), capture size 262144 bytes
12:47:14.700994 IP 10.103.205.47.52012 > 10.103.185.101.http-alt: Flags [S], seq 3428568814, win 65535, options [mss 8961,sackOK,TS val 3367981072 ecr 0,nop,wscale 9], length 0
12:47:14.701132 IP 10.103.205.47.52012 > 10.103.185.101.http-alt: Flags [S], seq 3428568814, win 65535, options [mss 8961,sackOK,TS val 3367981072 ecr 0,nop,wscale 9], length 0
12:47:15.718456 IP 10.103.205.47.52012 > 10.103.185.101.http-alt: Flags [S], seq 3428568814, win 65535, options [mss 8961,sackOK,TS val 3367982090 ecr 0,nop,wscale 9], length 0
12:47:15.718504 IP 10.103.205.47.52012 > 10.103.185.101.http-alt: Flags [S], seq 3428568814, win 65535, options [mss 8961,sackOK,TS val 3367982090 ecr 0,nop,wscale 9], length 0
12:47:17.734472 IP 10.103.205.47.52012 > 10.103.185.101.http-alt: Flags [S], seq 3428568814, win 65535, options [mss 8961,sackOK,TS val 3367984106 ecr 0,nop,wscale 9], length 0
12:47:17.734557 IP 10.103.205.47.52012 > 10.103.185.101.http-alt: Flags [S], seq 3428568814, win 65535, options [mss 8961,sackOK,TS val 3367984106 ecr 0,nop,wscale 9], length 0
12:47:21.894476 IP 10.103.205.47.52012 > 10.103.185.101.http-alt: Flags [S], seq 3428568814, win 65535, options [mss 8961,sackOK,TS val 3367988266 ecr 0,nop,wscale 9], length 0
```

```
root@ip-10-103-165-188:~# tcpdump -i any host 10.103.205.47
tcpdump: verbose output suppressed, use -v or -vv for full protocol decode
listening on any, link-type LINUX_SLL (Linux cooked v1), capture size 262144 bytes
```

```
❯ hubble observe --pod bravo-dev/netshoot-31 --follow
Mar 22 13:05:41.386: bravo-dev/netshoot-31:57206 -> 10.103.185.101:8080 to-stack FORWARDED (TCP Flags: SYN)
Mar 22 13:05:48.582: bravo-dev/netshoot-31:57206 -> 10.103.185.101:8080 to-stack FORWARDED (TCP Flags: SYN)
```

```
❯ kubectl exec -ti -n kube-system cilium-jsqtt -- bash
root@ip-10-103-220-24:/home/cilium# cilium bpf ct list global | fgrep 10.103.205.47
TCP OUT 10.103.205.47:51032 -> 10.103.185.101:8080 expires=20157681 RxPackets=0 RxBytes=0 RxFlagsSeen=0x00 LastRxReport=0 TxPackets=6 TxBytes=444 TxFlagsSeen=0x02 LastTxReport=20157623 Flags=0x0000 [ ] RevNAT=0 SourceSecurityID=138265 IfIndex=0
ICMP OUT 10.103.205.47:0 -> 10.103.185.101:0 related expires=20157650 RxPackets=0 RxBytes=0 RxFlagsSeen=0x00 LastRxReport=0 TxPackets=1 TxBytes=74 TxFlagsSeen=0x02 LastTxReport=20157592 Flags=0x0010 [ SeenNonSyn ] RevNAT=0 SourceSecurityID=138265 IfIndex=0

root@ip-10-103-220-24:~# conntrack -L | fgrep '10.103.205.47'
tcp      6 114 SYN_SENT src=10.103.205.47 dst=10.103.185.101 sport=33828 dport=8080 [UNREPLIED] src=10.103.185.101 dst=10.103.205.47 sport=8080 dport=33828 mark=0 use=1
```

**Comment by prune998** [comment]
Do you see any packet denied in hubble ? (to/from 10.103.205.47 and port 8080)

**Comment by prune998** [comment]
What if you `tcpdump` on the `nc` node, port 8080 (not filtering on the IP) ?

the `src_port` of you various captures does not match...

**Comment by recollir** [comment]
These are outputs from several tries, all non working, where I first collected only tcpdump, and then hubble, and then etc... I did not collect all output in the same session.

I will give another tcpdump a try. BTW I did not see any dropped packages with cilium monitor. Maybe I should also just look at everything related to that endpoint and not just dropped packages.

**Comment by recollir** [comment]
Ok. I think we know now what is wrong. Unfortunately I can't write it up right now and will do it later. The interesting thing is now to know why it happens.

**Comment by recollir** [comment]
A similar problem though not identical happens in #18179

**Comment by abebars** [comment]
Hey @recollir did you find a solution for this issue?

**Comment by recollir** [comment]
We think we found one solution by doing a coalesce on the router and health endpoints. If it is the sole solution we don't know yet. But it is one problem we think we solved. We are preparing a PR probably after KubeCon. What are you seeing @abebars ? Have you wrote up your problem in an issue or in Slack?

**Comment by recollir** [comment]
@abebars good find.
