### ISSUE TITLE
the package recv from

### ISSUE THREAD

**Issue by WingkaiHo** [cilium/cilium#7677]
## Bug report

**General Information**

- Cilium version (run `1.2.5`)
- Kernel version (run `4.14.83`)
- Orchestration system version in use (e.g. `kubectl version v1.11.3`， kube-proxy use ipvs)

**How to reproduce the issue**

1. When I use kube service ip to communication with dns, but recv packet from dns is pod ip not service some time

in pod env
```
[root@bi-apiproxy-test-79644b6d7-v766t app]# cat /etc/resolv.conf 
nameserver 10.233.0.3  // my kube-dns service ip
search node.svc.cluster.local svc.cluster.local cluster.local
options ndots:5
```

I ping domain some time 
```
$ ping baidu.com
```

I use tcpdump in same pod

tcpdump: verbose output suppressed, use -v or -vv for full protocol decode

```

normal:
listening on eth0, link-type EN10MB (Ethernet), capture size 262144 bytes
17:48:29.998339 IP 10.234.27.233.42240 > 10.233.0.3.53: Flags [S], seq 481729785, win 26730, options [mss 8910,sackOK,TS val 2395271363 ecr 0,nop,wscale 9], length 0
17:48:29.998687 IP 10.233.0.3.53 > 10.234.27.233.42240: Flags [S.], seq 2910944088, ack 481729786, win 43690, options [mss 65430,sackOK,TS val 2276345679 ecr 2395271363,nop,wscale 7], length 0
17:48:29.998716 IP 10.234.27.233.42240 > 10.233.0.3.53: Flags [.], ack 1, win 53, options [nop,nop,TS val 2395271363 ecr 2276345679], length 0
17:48:31.999127 IP 10.233.0.3.53 > 10.234.27.233.42240: Flags [F.], seq 1, ack 1, win 342, options [nop,nop,TS val 2276347679 ecr 2395271363], length 0
17:48:31.999243 IP 10.234.27.233.42240 > 10.233.0.3.53: Flags [F.], seq 1, ack 2, win 53, options [nop,nop,TS val 2395273363 ecr 2276347679], length 0
17:48:31.999389 IP 10.233.0.3.53 > 10.234.27.233.42240: Flags [.], ack 2, win 342, options [nop,nop,TS val 2276347679 ecr 2395273363], length 0

some time is abnormal
// 10.233.0.3.53 is kube-dns server ip 
18:07:14.092124 IP 10.234.27.233.47986 > 10.233.0.3.53: 50297+ A? baidu.com.node.svc.cluster.local. (50)
// 10.234.16.89 and 10.234.5.160 are pod ip, no replace by service ip
18:07:14.092913 IP 10.234.16.89.53 > 10.234.27.233.47986: 50297 NXDomain* 0/1/0 (104)
18:07:19.097357 IP 10.234.27.233.47986 > 10.233.0.3.53: 50297+ A? baidu.com.node.svc.cluster.local. (50)
18:07:19.097926 IP 10.234.16.89.53 > 10.234.27.233.47986: 50297 NXDomain 0/1/0 (104)
18:07:24.102603 IP 10.234.27.233.38414 > 10.233.0.3.53: 60056+ A? baidu.com. (27)
18:07:24.137138 IP 10.234.5.160.53 > 10.234.27.233.38414: 60056 2/0/0 A 123.125.114.144, A 220.181.57.216 (59)
18:07:29.107840 IP 10.234.27.233.38414 > 10.233.0.3.53: 60056+ A? baidu.com. (27)
18:07:29.108875 IP 10.234.5.160.53 > 10.234.27.233.38414: 60056 2/0/0 A 123.125.114.144, A 220.181.57.216 (59)
```
some the the pod revc packet from dns, the IP is pod IP, no service ip.  Only appear in pod， and this host is normal use kube-service to communication with kube-dns.

**Comment by aanm** [comment]
Hello @WingkaiHo , v1.2.5 is end of life so it's recommended to update your cilium version.

However, I believe the problem might not related with Cilium, can you provide the output of `kubect get pod bi-apiproxy-test-79644b6d7-v766t -o yaml`? Thank you!

**Comment by WingkaiHo** [comment]
There's only one machine in this situation.

**Comment by WingkaiHo** [comment]
```
apiVersion: v1
kind: Pod
metadata:
  annotations:
    cilium.io/identity: "7812"
    podpreset.admission.kubernetes.io/podpreset-allow-tz-env: "2686"
  creationTimestamp: 2019-02-26T03:01:47Z
  generateName: bi-apiproxy-test-79644b6d7-
  labels:
    app: test-yixiongzou-apiproxy
    app.kubernetes.io/name: bi-apiproxy
    gitlab.stage: test
    pod-template-hash: "352006283"
  name: bi-apiproxy-test-79644b6d7-v766t
  namespace: node
  ownerReferences:
  - apiVersion: apps/v1
    blockOwnerDeletion: true
    controller: true
    kind: ReplicaSet
    name: bi-apiproxy-test-79644b6d7
    uid: dacab33d-3972-11e9-838f-ecf4bbe195dc
  resourceVersion: "199631094"
  selfLink: /api/v1/namespaces/node/pods/bi-apiproxy-test-79644b6d7-v766t
  uid: dacca627-3972-11e9-838f-ecf4bbe195dc
spec:
  containers:
  - command:
    - npm
    - run
    - docker
    env:
    - name: NODE_ENV
      value: development
    - name: K8S_NODE_IP
      valueFrom:
        fieldRef:
          apiVersion: v1
          fieldPath: status.hostIP
    - name: K8S_POD_NAME
      valueFrom:
        fieldRef:
          apiVersion: v1
          fieldPath: metadata.name
    - name: TZ
      value: Asia/Shanghai
    image: docker.tupu.ai/node/apiproxy:378386ff
    imagePullPolicy: IfNotPresent
    name: bi-apiproxy
    resources:
      limits:
        cpu: "2"
        memory: 1500Mi
      requests:
        cpu: "1"
        memory: 1500Mi
    terminationMessagePath: /dev/termination-log
    terminationMessagePolicy: File
    volumeMounts:
    - mountPath: /app/logs/
      name: logs
    - mountPath: /var/run/secrets/kubernetes.io/serviceaccount
      name: default-token-tkq8g
      readOnly: true
  dnsPolicy: ClusterFirst
  nodeName: gz-cs-2-102
  nodeSelector:
    classify: cpu
    prod-consul: "true"
  priority: 0
  restartPolicy: Always
  schedulerName: default-scheduler
  securityContext: {}
  serviceAccount: default
  serviceAccountName: default
  terminationGracePeriodSeconds: 30
  tolerations:
  - effect: NoExecute
    key: node.kubernetes.io/not-ready
    operator: Exists
    tolerationSeconds: 300
  - effect: NoExecute
    key: node.kubernetes.io/unreachable
    operator: Exists
    tolerationSeconds: 300
  volumes:
  - hostPath:
      path: /k8s_local_pv/logs/node/bi-apiproxy/
      type: DirectoryOrCreate
    name: logs
  - name: default-token-tkq8g
    secret:
      defaultMode: 420
      secretName: default-token-tkq8g
status:
  conditions:
  - lastProbeTime: null
    lastTransitionTime: 2019-02-26T03:01:24Z
    status: "True"
    type: Initialized
  - lastProbeTime: null
    lastTransitionTime: 2019-02-26T03:01:37Z
    status: "True"
    type: Ready
  - lastProbeTime: null
    lastTransitionTime: null
    status: "True"
    type: ContainersReady
  - lastProbeTime: null
    lastTransitionTime: 2019-02-26T03:01:47Z
    status: "True"
    type: PodScheduled
  containerStatuses:
  - containerID: docker://833fa9f970c22000c4ae6d19c0ca0d759d6143292abd7c6e7af84eca86021864
    image: docker.tupu.ai/node/apiproxy:378386ff
    imageID: docker-pullable://docker.tupu.ai/node/apiproxy@sha256:061b8a4d65d581e79649461281e7b907afa87098fb9687fac5fc35ff3a012f34
    lastState: {}
    name: bi-apiproxy
    ready: true
    restartCount: 0
    state:
      running:
        startedAt: 2019-02-26T03:01:36Z
  hostIP: 172.26.2.102
  phase: Running
  podIP: 10.234.27.233
  qosClass: Burstable
  startTime: 2019-02-26T03:01:24Z
```

**Comment by brb** [comment]
@WingkaiHo 

Were the DNS lookup requests which happened at 18:07:14.092124 over UDP or TCP?

Can you please paste the output of `iptables-save -c` from the node running the pod which queries the DNS?

**Comment by WingkaiHo** [comment]
```
# Generated by iptables-save v1.4.21 on Thu Apr 11 20:18:13 2019
*raw
:PREROUTING ACCEPT [59798928501:227531548131255]
:OUTPUT ACCEPT [3842163906:4964729574635]
COMMIT
# Completed on Thu Apr 11 20:18:13 2019
# Generated by iptables-save v1.4.21 on Thu Apr 11 20:18:13 2019
*mangle
:PREROUTING ACCEPT [143359753:563494956287]
:INPUT ACCEPT [13904674:5876124775]
:FORWARD ACCEPT [129454969:557618826216]
:OUTPUT ACCEPT [10888798:8975941950]
:POSTROUTING ACCEPT [140040592:564765709685]
:CILIUM_POST_mangle - [0:0]
-A POSTROUTING -m comment --comment "cilium-feeder: CILIUM_POST_mangle" -j CILIUM_POST_mangle
-A CILIUM_POST_mangle -o cilium_host -m comment --comment "cilium: clear masq bit for pkts to cilium_host" -j MARK --set-xmark 0x0/0x4000
COMMIT
# Completed on Thu Apr 11 20:18:13 2019
# Generated by iptables-save v1.4.21 on Thu Apr 11 20:18:13 2019
*nat
:PREROUTING ACCEPT [1080:101184]
:INPUT ACCEPT [750:81384]
:OUTPUT ACCEPT [733:80058]
:POSTROUTING ACCEPT [728:79758]
:CILIUM_POST - [0:0]
:DOCKER - [0:0]
:KUBE-FIREWALL - [0:0]
:KUBE-LOAD-BALANCER - [0:0]
:KUBE-MARK-DROP - [0:0]
:KUBE-MARK-MASQ - [0:0]
:KUBE-NODE-PORT - [0:0]
:KUBE-POSTROUTING - [0:0]
:KUBE-SERVICES - [0:0]
-A PREROUTING -m comment --comment "kubernetes service portals" -j KUBE-SERVICES
-A PREROUTING -m addrtype --dst-type LOCAL -j DOCKER
-A OUTPUT -m comment --comment "kubernetes service portals" -j KUBE-SERVICES
-A OUTPUT ! -d 127.0.0.0/8 -m addrtype --dst-type LOCAL -j DOCKER
-A POSTROUTING -m comment --comment "kubernetes postrouting rules" -j KUBE-POSTROUTING
-A POSTROUTING -s 172.17.0.0/16 ! -o docker0 -j MASQUERADE
-A POSTROUTING -m comment --comment "cilium-feeder: CILIUM_POST" -j CILIUM_POST
-A CILIUM_POST ! -s 10.234.27.1/32 ! -d 10.234.27.0/24 -o cilium_host -m comment --comment "cilium host->cluster masquerade" -j SNAT --to-source 10.234.27.1
-A CILIUM_POST -s 10.234.27.0/24 -o cilium_host -m comment --comment "cilium hostport loopback masquerade" -j SNAT --to-source 10.234.27.1
-A CILIUM_POST -s 10.234.27.0/24 ! -d 10.234.27.0/24 ! -o cilium_+ -m comment --comment "cilium masquerade non-cluster" -j MASQUERADE
-A DOCKER -i docker0 -j RETURN
-A KUBE-FIREWALL -j KUBE-MARK-DROP
-A KUBE-LOAD-BALANCER -j KUBE-MARK-MASQ
-A KUBE-MARK-DROP -j MARK --set-xmark 0x8000/0x8000
-A KUBE-MARK-MASQ -j MARK --set-xmark 0x4000/0x4000
-A KUBE-NODE-PORT -m comment --comment "mark MASQ for externaltrafficpolicy=cluster" -j KUBE-MARK-MASQ
-A KUBE-NODE-PORT -j KUBE-MARK-MASQ
-A KUBE-POSTROUTING -m comment --comment "kubernetes service traffic requiring SNAT" -m mark --mark 0x4000/0x4000 -j MASQUERADE
-A KUBE-POSTROUTING -m comment --comment "Kubernetes endpoints dst ip:port, source ip for solving hairpin purpose" -m set --match-set KUBE-LOOP-BACK dst,dst,src -j MASQUERADE
-A KUBE-SERVICES -m comment --comment "Kubernetes nodeport TCP port for masquerade purpose" -m set --match-set KUBE-NODE-PORT-TCP dst -j KUBE-NODE-PORT
-A KUBE-SERVICES -m comment --comment "Kubernetes service cluster ip + port for masquerade purpose" -m set --match-set KUBE-CLUSTER-IP dst,dst -j KUBE-MARK-MASQ
-A KUBE-SERVICES -p udp -m udp -m comment --comment "Kubernetes nodeport UDP port for masquerade purpose" -m set --match-set KUBE-NODE-PORT-UDP dst -j KUBE-NODE-PORT
-A KUBE-SERVICES -m set --match-set KUBE-CLUSTER-IP dst,dst -j ACCEPT
COMMIT
# Completed on Thu Apr 11 20:18:13 2019
# Generated by iptables-save v1.4.21 on Thu Apr 11 20:18:13 2019
*filter
:INPUT ACCEPT [13904674:5876124775]
:FORWARD ACCEPT [0:0]
:OUTPUT ACCEPT [10585647:7146889045]
:CILIUM_FORWARD - [0:0]
:CILIUM_OUTPUT - [0:0]
:DOCKER - [0:0]
:DOCKER-ISOLATION - [0:0]
:DOCKER-USER - [0:0]
:KUBE-FIREWALL - [0:0]
:KUBE-FORWARD - [0:0]
-A INPUT -j KUBE-FIREWALL
-A FORWARD -m comment --comment "kubernetes forwarding rules" -j KUBE-FORWARD
-A FORWARD -j DOCKER-USER
-A FORWARD -j DOCKER-ISOLATION
-A FORWARD -o docker0 -j DOCKER
-A FORWARD -o docker0 -m conntrack --ctstate RELATED,ESTABLISHED -j ACCEPT
-A FORWARD -i docker0 ! -o docker0 -j ACCEPT
-A FORWARD -i docker0 -o docker0 -j ACCEPT
-A FORWARD -m comment --comment "cilium-feeder: CILIUM_FORWARD" -j CILIUM_FORWARD
-A OUTPUT -j KUBE-FIREWALL
-A OUTPUT -m comment --comment "cilium-feeder: CILIUM_OUTPUT" -j CILIUM_OUTPUT
-A CILIUM_FORWARD -d 10.0.0.0/8 -o cilium_host -m comment --comment "cilium: any->cluster on cilium_host forward accept" -j ACCEPT
-A CILIUM_FORWARD -s 10.0.0.0/8 -m comment --comment "cilium: cluster->any forward accept" -j ACCEPT
-A CILIUM_OUTPUT -m mark ! --mark 0xa00/0xe00 -m comment --comment "cilium: host->any mark as from host" -j MARK --set-xmark 0xc00/0xf00
-A DOCKER-ISOLATION -j RETURN
-A DOCKER-USER -j RETURN
-A KUBE-FIREWALL -m comment --comment "kubernetes firewall for dropping marked packets" -m mark --mark 0x8000/0x8000 -j DROP
COMMIT
# Completed on Thu Apr 11 20:18:13 2019
```

**Comment by brb** [comment]
@WingkaiHo Thanks. Did you run the DNS lookup request which happened at 18:07:14.092124 over UDP or TCP?

Also, I need output of `kubectl describe svc -n=kube-system kube-dns` and `ipvsadm -ln` from the same node.

**Comment by WingkaiHo** [comment]
only on machine could no use service ip communicate with dns.

kubectl describe svc -n=kube-system coredns
```
apiVersion: v1
kind: Service
metadata:
  annotations:
    kubectl.kubernetes.io/last-applied-configuration: |
      {"apiVersion":"v1","kind":"Service","metadata":{"annotations":{},"labels":{"addonmanager.kubernetes.io/mode":"Reconcile","k8s-app":"coredns","kubernetes.io/cluster-service":"true","kubernetes.io/name":"CoreDNS"},"name":"coredns","namespace":"kube-system"},"spec":{"clusterIP":"10.233.0.3","ports":[{"name":"dns","port":53,"protocol":"UDP"},{"name":"dns-tcp","port":53,"protocol":"TCP"}],"selector":{"k8s-app":"coredns"}}}
  creationTimestamp: 2019-03-05T10:29:09Z
  labels:
    addonmanager.kubernetes.io/mode: Reconcile
    k8s-app: coredns
    kubernetes.io/cluster-service: "true"
    kubernetes.io/name: CoreDNS
  name: coredns
  namespace: kube-system
  resourceVersion: "214225368"
  selfLink: /api/v1/namespaces/kube-system/services/coredns
  uid: 831e3712-3f31-11e9-b21d-44a84246e955
spec:
  clusterIP: 10.233.0.3
  ports:
  - name: dns
    port: 53
    protocol: UDP
    targetPort: 53
  - name: dns-tcp
    port: 53
    protocol: TCP
    targetPort: 53
  selector:
    k8s-app: coredns
  sessionAffinity: None
  type: ClusterIP
status:
  loadBalancer: {}
```

ipvs in this machine:
```
TCP  10.233.0.3:53 rr
  -> 10.234.5.160:53              Masq    1      0          0         
  -> 10.234.16.89:53              Masq    1      0          0         
..

UDP  10.233.0.3:53 rr
  -> 10.234.5.160:53              Masq    1      0          0         
  -> 10.234.16.89:53              Masq    1      0          0 
...

some time pod recv dns result package source ip is (10.234.5.160, 10.234.16.89)  not 10.233.0.3:


```

**Comment by WingkaiHo** [comment]
I found i disable selinux and restat kube-porxy and cilium to fix this problem
