### ISSUE TITLE
Masquerading fails when devices are set without our kube-proxy replacement

### ISSUE THREAD

**Issue by pchaigno** [cilium/cilium#12141]
When Cilium (v1.8) is configured with `global.devices` set, `global.autoDirectNodeRoutes=true`, and `global.masquerade=true`, multi-node connectivity seems to fail. In particular, attempts to resolve DNS names fail with the following errors:
```
$ dig kubernetes.default.svc.cluster.local @10.0.1.157
;; reply from unexpected source: 192.168.36.12#53, expected 10.0.1.157#53
;; reply from unexpected source: 192.168.36.12#53, expected 10.0.1.157#53
```
The query reaches the second node with kube-dns as expected, but then the answer leaves the second node with source IP address `192.168.36.12` instead of the `10.0.1.157` expected by the client. So masquerading seems to fail (which is why setting `global.masquerade=false` works around the bug).

@brb added a few more informations:
> One more data point: when we do NOT set `--device(s)`, a reply from bpf_lxc does not enter `nat/POSTROUTING` chain (in which the MASQ rule is installed).
>
> `tc filter del dev enp0s8 ingress` fixes the issue.

Related: #11969

**Comment by brb** [comment]
(Putting this for now in this issue) Another interesting side effect of setting `--devices` when host-fw and kube-proxy replacement are disabled is the one reported by @jrajahalme:

```
Symptom is that security IDs from remote nodes get defaulted to WORLD and dropped when policy is in effect:
```
Link to thread: https://cilium.slack.com/archives/CDKG8NNHK/p1592425114171600

**Comment by christarazi** [comment]
Ran into this while working on https://github.com/cilium/cilium/pull/12482

**Comment by pchaigno** [comment]
This bug can also happen without direct routing, e.g. when opening a connection to a remote pod from a node. An easy way to reproduce this is to follow [the getting started guide for the bandwidth manager](https://docs.cilium.io/en/latest/gettingstarted/bandwidth-manager/), which enables devices, and disable our kube-proxy replacement. The following trace can be observed on the node with the netperf client (notice how `192.168.33.11` appears all of a sudden):
```
11:25:33.586245 IP 192.168.33.12.52323 > 10.16.179.77.12865: Flags [S], seq 1839789503, win 64240, options [mss 1460,sackOK,TS val 60860791 ecr 0,nop,wscale 7], length 0
11:25:33.586598 IP 10.16.179.77.12865 > 192.168.33.12.52323: Flags [S.], seq 3833696169, ack 1839789504, win 64308, options [mss 1410,sackOK,TS val 2964236847 ecr 60860791,nop,wscale 7], length 0
11:25:33.586684 IP 192.168.33.12.52323 > 10.16.179.77.12865: Flags [.], ack 1, win 502, options [nop,nop,TS val 60860791 ecr 2964236847], length 0
11:25:33.589215 IP 192.168.33.12.52323 > 10.16.179.77.12865: Flags [P.], seq 1:657, ack 1, win 502, options [nop,nop,TS val 60860794 ecr 2964236847], length 656
11:25:33.589520 IP 192.168.33.11.12865 > 192.168.33.12.52323: Flags [.], ack 1839790160, win 501, options [nop,nop,TS val 2964236850 ecr 60860794], length 0
11:25:33.589567 IP 192.168.33.12.52323 > 192.168.33.11.12865: Flags [R], seq 1839790160, win 0, length 0
11:25:33.801856 IP 192.168.33.12.52323 > 10.16.179.77.12865: Flags [P.], seq 1:657, ack 1, win 502, options [nop,nop,TS val 60861006 ecr 2964236847], length 656
11:25:33.803226 IP 10.16.179.77.12865 > 192.168.33.12.52323: Flags [R], seq 3833696170, win 0, length 0
```

**Comment by joestringer** [comment]
@pchaigno is this a regression from v1.8.2?

**Comment by errordeveloper** [comment]
@pchaigno I might have encountered this on OpenShift, we had to disable BPF masq to make egress traffic reach external hosts.

**Comment by brb** [comment]
> I might have encountered this on OpenShift, we had to disable BPF masq to make egress traffic reach external hosts.

@errordeveloper Do you have a sysdump when the BPF-masq was enabled?

**Comment by errordeveloper** [comment]
@brb no, but we can try reproduce if needed, see the OpenShift OKD getting started guide.

**Comment by brb** [comment]
> no, but we can try reproduce if needed, see the OpenShift OKD guide.

@errordeveloper Once you have an OKD cluster running, please ping me. Thanks!

**Comment by julianwiedmann** [comment]
> I tried to reproduce this by setting devices manually and running [the tests](https://github.com/pchaigno/cilium/blob/25810847a11b659df9056a32b907e0da62fd5666/test/k8sT/DatapathConfiguration.go#L319-L352) with masquerading enabled on our 4.9 VMs. It seems we fixed the bug, so we can close this issue once #18722 is merged.

Let's do so.
