### ISSUE TITLE
Invalid load balancing reverse translation

### ISSUE THREAD

**Issue by tgraf** [cilium/cilium#5239]
The following TCP handshake is being observed:
```
21:26:13.486129 IP (tos 0x0, ttl 64, id 54673, offset 0, flags [DF], proto TCP (6), length 60)
    10.2.2.139.48582 > 172.18.0.50.80: Flags [S], cksum 0xb8ff (incorrect -> 0x1c31), seq 4272068330, win 26733, options [mss 8911,sackOK,TS val 11639072 ecr 0,nop,wscale 7], length 0
21:26:13.488158 IP (tos 0x0, ttl 63, id 0, offset 0, flags [DF], proto TCP (6), length 60)
    172.18.0.146.9200 > 10.2.2.139.48582: Flags [S.], cksum 0x9245 (correct), seq 4098393398, ack 4272068331, win 26697, options [mss 8911,sackOK,TS val 1831175006 ecr 11638043,nop,wscale 7], length 0
21:26:13.488172 IP (tos 0x0, ttl 64, id 32224, offset 0, flags [DF], proto TCP (6), length 40)
    10.2.2.139.48582 > 172.18.0.146.9200: Flags [R], cksum 0x7f6a (correct), seq 4272068331, win 0, length 0
```

Load balancing entry:
```
8    172.18.0.50:80      1 => 10.2.1.189:80
15   172.18.0.146:9200   1 => 10.2.2.84:9200
```

Monitor output:
```
CPU 04: MARK 0xb78e62cb FROM 54580 DEBUG: Conntrack lookup 1/2: src=10.2.2.139:48582 dst=10.2.1.189:80
CPU 04: MARK 0xb78e62cb FROM 54580 DEBUG: Conntrack lookup 2/2: nexthdr=6 flags=1
CPU 04: MARK 0xb78e62cb FROM 54580 DEBUG: CT entry found lifetime=805662, revnat=15
CPU 04: MARK 0xb78e62cb FROM 54580 DEBUG: CT verdict: Established, revnat=15
CPU 04: MARK 0xb78e62cb FROM 54580 DEBUG: Successfully mapped daddr=10.2.1.189 to identity=13454
CPU 04: MARK 0xb78e62cb FROM 54580 DEBUG: Encapsulating to node 2885694567 (0xac003467) from seclabel 13454
```

The CT entry has the wrong revnat ID stored which results in wrong reverse translation.

**Comment by tgraf** [comment]
We are hitting existing conntrack entries of previous endpoints
