### ISSUE TITLE
cilium-agent with L2 neighbor discovery adds invalid entry to ARP table (with local IP)

### ISSUE THREAD

**Issue by seleznev** [cilium/cilium#43880]
### Is there an existing issue for this?

- [x] I have searched the existing issues

### Version

equal or higher than v1.19.2 and lower than v1.20.0

### What happened?

The cilium-agent with `--enable-l2-neigh-discovery` enabled adds an invalid entry to the ARP table (using the local IP), which leads to Gratuitous ARP (GARP) requests being sent every 1-5 seconds.

```
root@kind-control-plane:/home/cilium# ip neighbour
172.18.0.2 dev eth0 managed extern_learn FAILED 
172.18.0.1 dev eth0 lladdr 1a:5f:be:da:73:71 managed extern_learn REACHABLE 
172.18.0.3 dev eth0 lladdr 06:7f:ba:2d:3f:3a managed extern_learn REACHABLE 
fe80::185f:beff:feda:7371 dev eth0 lladdr 1a:5f:be:da:73:71 router STALE
```

```
root@kind-control-plane:/home/cilium# ip address show dev eth0
2: eth0@if73: <BROADCAST,MULTICAST,UP,LOWER_UP> mtu 1500 qdisc noqueue state UP group default 
    link/ether 62:71:a6:ed:a6:63 brd ff:ff:ff:ff:ff:ff link-netnsid 0
    inet 172.18.0.2/16 brd 172.18.255.255 scope global eth0
       valid_lft forever preferred_lft forever
    inet6 fc00:f853:ccd:e793::2/64 scope global nodad 
       valid_lft forever preferred_lft forever
    inet6 fe80::6071:a6ff:feed:a663/64 scope link 
       valid_lft forever preferred_lft forever
```

```
root@kind-control-plane:/home/cilium# cilium-dbg statedb dump
  [...]
  "forwardable-ip": [
    {"IP":"172.18.0.2","Owners":[{"Type":1,"ID":"172.18.0.2:9964/TCP"}]},
    [...]
  ],
  "devices": [
    [...]
    {"Index":2,"MTU":1500,"Name":"eth0","HardwareAddr":"62:71:a6:ed:a6:63","Flags":51,"Addrs":[{"Addr":"172.18.0.2","Secondary":false,"Scope":0},{"Addr":"fc00:f853:ccd:e793::2","Secondary":false,"Scope":0},{"Addr":"fe80::6071:a6ff:feed:a663","Secondary":false,"Scope":253}],"RawFlags":69699,"Type":"veth","MasterIndex":0,"OperStatus":"up","Selected":true,"NotSelectedReason":""},
    [...]
  ],
  "neighbors": [
    [...]
    {"LinkIndex":2,"IPAddr":"172.18.0.2","HardwareAddr":"","Type":2,"State":32,"Flags":16,"FlagsExt":1},
    [...]
  ],
  "desired-neighbors": [
    [...]
    {"IP":"172.18.0.2","IfIndex":2,"Status":{"updated-at":"2026-03-26T16:07:35.92159796Z","id":126,"kind":"Done"}},
    [...]
  ]
  [...]
```

> Gratuitous ARP (GARP)

For external hosts, it looks exactly like GARP (the node asks about itself), but for the local node, it is not technically GARP (the kernel is just trying to resolve the ARP entry as if it were an external host).

```
root@kind-control-plane:/home/cilium# tcpdump -i any -vn arp
tcpdump: data link type LINUX_SLL2
tcpdump: listening on any, link-type LINUX_SLL2 (Linux cooked v2), snapshot length 262144 bytes
16:11:48.178460 eth0  Out ARP, Ethernet (len 6), IPv4 (len 4), Request who-has 172.18.0.2 tell 172.18.0.2, length 28
16:11:49.200468 eth0  Out ARP, Ethernet (len 6), IPv4 (len 4), Request who-has 172.18.0.2 tell 172.18.0.2, length 28
16:11:50.224483 eth0  Out ARP, Ethernet (len 6), IPv4 (len 4), Request who-has 172.18.0.2 tell 172.18.0.2, length 28
16:11:53.300467 eth0  Out ARP, Ethernet (len 6), IPv4 (len 4), Request who-has 172.18.0.2 tell 172.18.0.2, length 28
16:11:54.320585 eth0  Out ARP, Ethernet (len 6), IPv4 (len 4), Request who-has 172.18.0.2 tell 172.18.0.2, length 28
16:11:55.344458 eth0  Out ARP, Ethernet (len 6), IPv4 (len 4), Request who-has 172.18.0.2 tell 172.18.0.2, length 28
16:11:58.419449 eth0  Out ARP, Ethernet (len 6), IPv4 (len 4), Request who-has 172.18.0.2 tell 172.18.0.2, length 28
16:11:59.440547 eth0  Out ARP, Ethernet (len 6), IPv4 (len 4), Request who-has 172.18.0.2 tell 172.18.0.2, length 28
16:12:00.464479 eth0  Out ARP, Ethernet (len 6), IPv4 (len 4), Request who-has 172.18.0.2 tell 172.18.0.2, length 28
16:12:03.538453 eth0  Out ARP, Ethernet (len 6), IPv4 (len 4), Request who-has 172.18.0.2 tell 172.18.0.2, length 28
16:12:04.560475 eth0  Out ARP, Ethernet (len 6), IPv4 (len 4), Request who-has 172.18.0.2 tell 172.18.0.2, length 28
16:12:05.584483 eth0  Out ARP, Ethernet (len 6), IPv4 (len 4), Request who-has 172.18.0.2 tell 172.18.0.2, length 28
```

### How can we reproduce the issue?

1. Create a kind cluster.
2. Install Cilium v1.19.2 with `l2NeighDiscovery` and `kubeProxyReplacement` enabled:
    ```
    helm install cilium oci://quay.io/cilium/charts/cilium --version 1.19.2 \
      --namespace kube-system \
      --set image.pullPolicy=IfNotPresent \
      --set ipam.mode=kubernetes \
      --set kubeProxyReplacement=true \
      --set l2NeighDiscovery.enabled=true \
      --set k8sServiceHost=kind-control-plane \
      --set k8sServicePort=6443
    ```
3. `kubectl exec` into the cilium-agent Pod.
4. Find the local IP (e.g., using `ip a`).
5. Verify that the local IP is present in `forwardable-ip` and `desired-neighbors` in the `cilium-dbg statedb dump` output.
6. Verify that `ip neighbour` contains an entry with `INCOMPLETE`/`FAILED` state and the local IP.

### Cilium Version

```
# cilium version
Client: 1.19.2 3977f6a1 2026-03-17T13:15:59+00:00 go version go1.25.8 linux/amd64
Daemon: 1.19.2 3977f6a1 2026-03-17T13:15:59+00:00 go version go1.25.8 linux/amd64
```

### Kernel Version

```
# uname -a
Linux kind-control-plane 6.17.0-19-generic #19~24.04.2-Ubuntu SMP PREEMPT_DYNAMIC Fri Mar  6 23:08:46 UTC 2 x86_64 x86_64 x86_64 GNU/Linux
```

### Kubernetes Version

v1.35.0 (kind v0.31.0)

### Relevant log output

```shell

```

### Cilium Users Document

- [ ] Are you a user of Cilium? Please add yourself to the [Users doc](https://github.com/cilium/cilium/blob/main/USERS.md)

### Code of Conduct

- [x] I agree to follow this project's Code of Conduct

**Comment by seleznev** [comment]
The issue is still present on 1.19.2 (originally reported on 1.18.6).
