### ISSUE TITLE
ipam=eni works but  169.254.169.254 unreachable

### ISSUE THREAD

**Issue by pasztorl** [cilium/cilium#25527]
### Is there an existing issue for this?

- [X] I have searched the existing issues

### What happened?

I've created a kubeadm cluster in an aws vpc. Cilium is configured to use ipam=eni. With a custom cni config in configmap I added the subnet allocation.
When I start a pod it gets the right ip address and can communicate with other pods and outside so the setup seems working for me.
Then i installed the aws cloud provider which wanted to communicate with 169.254.169.254 to get the az info and timeouted.
I ran a tcpdump and I saw that if the pod communicate outside it masqueraded to the node IP but when the pod send packets to 169.254.169.254 it node masqueraded before left the node's network interface.

Because the 169.254.169.254 is not in direct routing cidr it sould be masqueraded I think. Am I wrong?
If I create a single iptables rule to masquerade it works, but I think it should masqueraded by default.

### Cilium Version

1.13.2

### Kernel Version

5.19.0-1025-aws #26~22.04.1-Ubuntu

### Kubernetes Version

v1.26.4

### Sysdump

[cilium-sysdump-20230518-154834.zip](https://github.com/cilium/cilium/files/11508301/cilium-sysdump-20230518-154834.zip)

### Relevant log output

```shell
# POD IP: 172.23.4.81 TARGET HOST: 169.254.169.254 NODE IF: ens5 NODE IP: 172.23.11.77
tcpdump -n port 80 -i ens5
tcpdump: verbose output suppressed, use -v[v]... for full protocol decode
listening on ens5, link-type EN10MB (Ethernet), snapshot length 262144 bytes
15:52:52.382469 IP 172.23.4.81.42250 > 169.254.169.254.80: Flags [S], seq 2140683196, win 62244, options [mss 3458,sackOK,TS val 523169440 ecr 0,nop,wscale 7], length 0
15:52:53.401367 IP 172.23.4.81.42250 > 169.254.169.254.80: Flags [S], seq 2140683196, win 62244, options [mss 3458,sackOK,TS val 523170458 ecr 0,nop,wscale 7], length 0

# POD IP: 172.23.4.81 TARGET HOST: 1.1.1.1 NODE IF: ens5 NODE IP: 172.23.11.77
tcpdump -n port 80 -i ens5
tcpdump: verbose output suppressed, use -v[v]... for full protocol decode
listening on ens5, link-type EN10MB (Ethernet), snapshot length 262144 bytes
15:54:12.288632 IP 172.23.11.77.47090 > 1.1.1.1.80: Flags [S], seq 280177228, win 62244, options [mss 3458,sackOK,TS val 1963437028 ecr 0,nop,wscale 7], length 0
15:54:12.290035 IP 1.1.1.1.80 > 172.23.4.81.47090: Flags [S.], seq 936344689, ack 280177229, win 65160, options [mss 1460,sackOK,TS val 2384295759 ecr 1963437028,nop,wscale 13], length 0
15:54:12.290086 IP 172.23.11.77.47090 > 1.1.1.1.80: Flags [.], ack 936344690, win 487, options [nop,nop,TS val 1963437029 ecr 2384295759], length 0
15:54:12.290130 IP 172.23.11.77.47090 > 1.1.1.1.80: Flags [P.], seq 0:71, ack 1, win 487, options [nop,nop,TS val 1963437029 ecr 2384295759], length 71: HTTP: GET / HTTP/1.1
15:54:12.291041 IP 1.1.1.1.80 > 172.23.4.81.47090: Flags [.], ack 72, win 7, options [nop,nop,TS val 2384295761 ecr 1963437029], length 0
15:54:12.291450 IP 1.1.1.1.80 > 172.23.4.81.47090: Flags [P.], seq 1:387, ack 72, win 8, options [nop,nop,TS val 2384295761 ecr 1963437029], length 386: HTTP: HTTP/1.1 301 Moved Permanently
15:54:12.291475 IP 172.23.11.77.47090 > 1.1.1.1.80: Flags [.], ack 387, win 486, options [nop,nop,TS val 1963437031 ecr 2384295761], length 0
15:54:12.291588 IP 172.23.11.77.47090 > 1.1.1.1.80: Flags [F.], seq 71, ack 387, win 486, options [nop,nop,TS val 1963437031 ecr 2384295761], length 0
15:54:12.292623 IP 1.1.1.1.80 > 172.23.4.81.47090: Flags [F.], seq 387, ack 73, win 8, options [nop,nop,TS val 2384295762 ecr 1963437031], length 0
15:54:12.292664 IP 172.23.11.77.47090 > 1.1.1.1.80: Flags [.], ack 388, win 486, options [nop,nop,TS val 1963437032 ecr 2384295762], length 0
```

### Code of Conduct

- [X] I agree to follow this project's Code of Conduct

**Comment by pasztorl** [comment]
Hi! I Have an update. Finally discovered the problem. The nodes configured to use a subnet for pods which has /21 netmask, but cilium creaate masq rules for he node (not ciliumnode) resource's podcidr key which is a different /24 / node so this is why pods which have IP allocated by ipam fits to the node's /24 works the others not masqueraded. There is a config option what I missed to fix this?

**Comment by squeed** [comment]
@pasztorl I'm having a bit of trouble parsing your update - would you mind spelling it out with some examples? Thanks!

**Comment by pasztorl** [comment]
hi! thanks for anwsering!
So what I want to achieve:

amazon vpc
k8s nodes on a private network using nat gateway
k8s pods on a private subnet on the same vpc
k8s pods network is a /21

on nodes i disabled networkd so cilium only manages the network interfaces
ens5 is the node's default route
ns6 belongs to pods network

what is the correct settings for this type of setup?
if I disable the pod cidr allocation in the kubernetes controller manager config the nodes not get podcidr keys and cilium choose a random cidr from 10.0.0.0/8 which is not the pod cidr of the pod subnet
if I set the pod cidr on kubernetes controller manager when the cilium allocate ip addresses from the eni pool but the pod cidr /21 and the masquerade rule added by cilium is /24 and there is allocated ips which belongs to this /24 others not.

i've also tried to disable cidr allocation on the kubernetes controller manager and precreate ciliumnodes but always got error message from cilium about node not found. Which is required parameters to add when I create a ciliumnode object?

As i understand from the cilium documentation the process looks like that:
- kubernetes not assigns pod cidr at all
- cilium reads ciliumnode resource and allocate the ips
- cilium sets up the masquerading for the allocated ips

I've run this with proxy-replacement: strict values, but it not worked, then switched back to kube-proxy
The best for me is if I can go with all optimalisations what cilium offer with bpf and ipam: eni

**Comment by pasztorl** [comment]
sorry, that was my mistake. So disabling kube controller manager cidr allocation, then manually set the cidrs (not on the cilliumnode, but) on the kubernetes node object solved the problem, now all connectivity test successful. Thanks!
