### ISSUE TITLE
L2 responder reconciler repeatedly tries to delete non-existent BPF map entries, causing intermittent ARP failures

### ISSUE THREAD

**Issue by mhorcajada** [cilium/cilium#45068]
### Is there an existing issue for this?

- [x] I have searched the existing issues

### Version

equal or higher than v1.19.2 and lower than v1.20.0

### What happened?

LoadBalancer services using Cilium L2 Announcements intermittently become unreachable from outside the cluster with `No route to host`. The root cause is that the L2 responder BPF map loses entries for announced IPs, so the elected leader node stops responding to ARP requests.
 
The Cilium agent logs show the L2 responder reconciler repeatedly attempting to **delete** entries from the BPF map that don't exist, cycling every 5 minutes:
 
```
level=error msg="Error(s) while full reconciling l2 responder map" module=agent.datapath.l2-responder error="delete 192.168.1.250@2: delete: key does not exist"
level=error msg="Error(s) while full reconciling l2 responder map" module=agent.datapath.l2-responder error="delete 192.168.1.230@2: delete: key does not exist"
```
 
This happens even though:
- The node **is** the lease holder (leader) for these IPs
- The L2 announcer and leader election jobs report `[OK]`
- The services are valid, healthy, and have backends in `cilium-dbg service list`
- `arping` sometimes gets responses, sometimes doesn't — confirming intermittent ARP failures
 
Restarting the Cilium agent pod temporarily fixes the issue by forcing a clean BPF map rebuild, but the errors return within minutes and connectivity eventually degrades again.
 
### Environment
 
- 2-node bare-metal cluster (KVM VMs on a single host)
- Worker node interface: `enp1s0` (index 2) — matches the L2 policy regex
- Tunnel mode: VXLAN
- Two Ingress controllers: ingress-nginx and Cilium Ingress, both using Cilium LB-IPAM + L2 Announcements
 
### L2AnnouncementPolicy
 
```yaml
apiVersion: cilium.io/v2alpha1
kind: CiliumL2AnnouncementPolicy
metadata:
  name: metallb-migration-l2policy
spec:
  interfaces:
  - ^enp[0-9]+s[0-9]+
  loadBalancerIPs: true
  nodeSelector:
    matchLabels:
      kubernetes.io/os: linux
```
 
### CiliumLoadBalancerIPPool
 
```yaml
apiVersion: cilium.io/v2
kind: CiliumLoadBalancerIPPool
metadata:
  name: metallb-migration-pool
spec:
  blocks:
  - start: 192.168.1.230
    stop: 192.168.1.250
```
 
### Affected services
 
```
$ kubectl get svc -A | grep -E "192.168.1.230|192.168.1.250"
ingress-nginx   ingress-nginx-controller   LoadBalancer   10.108.176.71   192.168.1.230   80:32575/TCP,443:30600/TCP   374d
kube-system     cilium-ingress             LoadBalancer   10.97.54.165    192.168.1.250   80/TCP,443/TCP               41d
```
 
### Lease status (leader is the worker for both)
 
```
$ kubectl get leases -n kube-system | grep -E "cilium-ingress|ingress-nginx"
cilium-l2announce-ingress-nginx-ingress-nginx-controller   k8s-cluster-worker-1   10d
cilium-l2announce-kube-system-cilium-ingress               k8s-cluster-worker-1   43d
```
 
### Cilium service list confirms backends exist
 
```
$ kubectl -n kube-system exec cilium-worker-pod -- cilium-dbg service list | grep 192.168.1.250
139   192.168.1.250:80/TCP       LoadBalancer
140   192.168.1.250:443/TCP      LoadBalancer
```
 
### Cilium status verbose — L2 subsystems report OK
 
```
l2-announcer
│   ├── job-l2-announcer-run                            [OK] Running (39h, x1)
│   ├── leader-election
│   │   ├── job-leader-election-kube-system-cilium-ingress  [OK] Running (39h, x1)
│   │   ├── job-leader-election-ingress-nginx-ingress-nginx-controller  [OK] Running (39h, x1)
 
l2-responder
│   └── job-l2-responder-reconciler                     [OK] Running (39h, x1)
```
 
### Error pattern in agent logs (worker node)
 
The errors alternate every 5 minutes, cycling through affected IPs:
 
```
time=2026-03-31T02:08:16Z level=error msg="Error(s) while full reconciling l2 responder map" error="delete 192.168.1.234@2: delete: key does not exist"
time=2026-03-31T02:13:16Z level=error msg="Error(s) while full reconciling l2 responder map" error="delete 192.168.1.250@2: delete: key does not exist"
time=2026-03-31T02:18:16Z level=error msg="Error(s) while full reconciling l2 responder map" error="delete 192.168.1.234@2: delete: key does not exist"
time=2026-03-31T02:23:16Z level=error msg="Error(s) while full reconciling l2 responder map" error="delete 192.168.1.250@2: delete: key does not exist"
time=2026-03-31T02:28:16Z level=error msg="Error(s) while full reconciling l2 responder map" error="delete 192.168.1.234@2: delete: key does not exist"
time=2026-03-31T02:33:16Z level=error msg="Error(s) while full reconciling l2 responder map" error="delete 192.168.1.250@2: delete: key does not exist"
```
 
Note: 192.168.1.234 was a stale LoadBalancer service (`kubernetes-dashboard-kong-proxy`) that was no longer in use. After deleting that service, the errors for .234 stopped, but errors for .230 and .250 persist.
 
After the pod restart, errors shifted to also include multiple delete attempts for the same IP in a single reconciliation pass:
 
```
time=2026-03-31T03:13:06Z level=error msg="Error(s) while full reconciling l2 responder map" error="delete 192.168.1.230@2: delete: key does not exist\ndelete 192.168.1.230@2: delete: key does not exist\ndelete 192.168.1.230@2: delete: key does not exist\ndelete 192.168.1.230@2: delete: key does not exist\ndelete 192.168.1.230@2: delete: key does not exist\ndelete 192.168.1.230@2: delete: key does not exist\ndelete 192.168.1.230@2: delete: key does not exist"
```
 
### Symptom observed from outside the cluster
 
```
$ curl -vk https://apicurio.cluster.local/apis/ccompat/v7/config
*   Trying 192.168.1.250:443...
* connect to 192.168.1.250 port 443 from 192.168.1.133 port 57964 failed: No route to host
curl: (7) Failed to connect to apicurio.cluster.local port 443 after 3053 ms: Couldn't connect to server
```
 
tcpdump confirms ARP requests going unanswered after the BPF map entry is lost:
 
```
04:54:16.902825 ARP, Request who-has 192.168.1.250 tell 192.168.1.133, length 28
04:54:17.926826 ARP, Request who-has 192.168.1.250 tell 192.168.1.133, length 28
04:54:18.946841 ARP, Request who-has 192.168.1.250 tell 192.168.1.133, length 28
(no replies)
```
 
### Connectivity test — 10/10 failures before pod restart
 
```
$ for i in $(seq 1 10); do
  curl -sk --connect-timeout 3 -o /dev/null -w "Attempt $i: HTTP %{http_code} - %{time_total}s\n" \
    https://apicurio.cluster.local/apis/ccompat/v7/config
  sleep 2
done
Attempt 1: HTTP 000 - 3.002356s (FAILED)
Attempt 2: HTTP 000 - 3.002026s (FAILED)
...
Attempt 10: HTTP 000 - 3.001399s (FAILED)
```
 
### After restarting the Cilium pod on the worker — immediate fix
 
```
$ kubectl -n kube-system delete pod cilium-p8lbl
 
$ for i in $(seq 1 5); do
  curl -sk --connect-timeout 3 -o /dev/null -w "Attempt $i: HTTP %{http_code} - %{time_total}s\n" \
    https://apicurio.cluster.local/apis/ccompat/v7/config
  sleep 2
done
Attempt 1: HTTP 200 - 0.120037s
Attempt 2: HTTP 200 - 0.023374s
Attempt 3: HTTP 200 - 0.016211s
Attempt 4: HTTP 200 - 0.015856s
Attempt 5: HTTP 200 - 0.016479s
```
 
However, the reconciler errors return within minutes after the restart.

### How can we reproduce the issue?

1. Set up a 2-node bare-metal cluster with Cilium v1.19.2 using VXLAN tunnel mode
2. Configure `CiliumLoadBalancerIPPool` and `CiliumL2AnnouncementPolicy`
3. Deploy multiple LoadBalancer services (we have 12 using the pool)
4. Wait for the L2 responder reconciler to run (every 5 minutes)
5. Observe errors in the Cilium agent logs on the leader node
6. Eventually, ARP responses stop for affected IPs, causing `No route to host` from external hosts

### Cilium Version

Client: 1.19.2 3977f6a1 2026-03-17T13:15:59+00:00 go version go1.25.8 linux/amd64
Daemon: 1.19.2 3977f6a1 2026-03-17T13:15:59+00:00 go version go1.25.8 linux/amd64

### Kernel Version

# Host KVM
Linux k8s-node-01 6.18.20 #5 SMP PREEMPT_DYNAMIC Wed Mar 25 12:34:13 CET 2026 x86_64 x86_64 x86_64 GNU/Linux

# Control plane & workers
Linux k8s-cluster-master-1 6.17.0-19-generic #19~24.04.2-Ubuntu SMP PREEMPT_DYNAMIC Fri Mar  6 23:08:46 UTC 2 x86_64 x86_64 x86_64 GNU/Linux

### Kubernetes Version

Client Version: v1.35.3
Kustomize Version: v5.7.1
Server Version: v1.35.3

### Regression

Unknown — this is the first version where we've used L2 Announcements with this number of services. The setup was migrated from MetalLB.

### Sysdump

Can provide on request.

### Relevant log output

```shell

```

### Anything else?

The fact that deleting a stale LoadBalancer service (kubernetes-dashboard-kong-proxy with IP 192.168.1.234) immediately stopped the reconciler errors for that specific IP suggests the reconciler is computing stale desired-state entries. The same pattern continues for active services (.230, .250), which indicates the reconciler's diff logic may have a bug where it marks entries for deletion on the leader node when they should be preserved.
 
The L2 announcer subsystem (leases, leader election) works correctly — the issue is isolated to the L2 responder BPF map reconciler.

### Cilium Users Document

- [ ] Are you a user of Cilium? Please add yourself to the [Users doc](https://github.com/cilium/cilium/blob/main/USERS.md)

### Code of Conduct

- [x] I agree to follow this project's Code of Conduct

**Comment by bdomars** [comment]
We just hit the same issue in one of our clusters after upgrading cilium to v1.19.2. Reverting back to v1.19.1 solved it for us.

**Comment by mhorcajada** [comment]
> We just hit the same issue in one of our clusters after upgrading cilium to v1.19.2. Reverting back to v1.19.1 solved it for us.

Thanks for confirming @bdomars   We're seeing the exact same behavior on v1.19.2, reverting to v1.19.1 is not an option for us, but restarting the Cilium agent pod on the affected node restores L2 responder BPF map entries as a temporary workaround.

**Comment by xtineskim** [comment]
thanks @mhorcajada for the description and a workaround

hmm taking a look there are [no changes to the l2responder ](https://github.com/cilium/cilium/commits/main/pkg/datapath/l2responder) (between 1.19 pre 4 and 1.19.2), unsure if that is the true underlying cause...

**Comment by mhorcajada** [comment]
> thanks [@mhorcajada](https://github.com/mhorcajada) for the description and a workaround
> 
> hmm taking a look there are [no changes to the l2responder ](https://github.com/cilium/cilium/commits/main/pkg/datapath/l2responder) (between 1.19 pre 4 and 1.19.2), unsure if that is the true underlying cause...

Thanks @xtineskim. To clarify: we've been running Cilium since v1.17.3 but hadn't observed this behavior before. That said, we can't rule out it existed in earlier versions — it may just not have triggered in our environment until v1.19.2. The symptom is the cilium_l2_responder_v4 BPF map losing its entries silently (verified via bpftool map dump). Restarting the Cilium agent on the affected node repopulates the map and restores ARP responses. This may point to a BPF map lifecycle/reconciliation issue rather than the L2 responder logic itself.

**Comment by xtineskim** [comment]
thanks for the info @mhorcajada - would it be possible to get the sysdump? i think it'd be helpful to go through more of the logs 👀

**Comment by mhorcajada** [comment]
> thanks for the info [@mhorcajada](https://github.com/mhorcajada) - would it be possible to get the sysdump? i think it'd be helpful to go through more of the logs 👀

@xtineskim sure, I'll generate a sysdump. How would you prefer I share it? I'd rather not attach it to the public issue since it may contain sensitive cluster info.

**Comment by xtineskim** [comment]
also @mhorcajada if you check the `cilium-dbg statedb l2-announce` what does it show?

**Comment by mhorcajada** [comment]
@xtineskim here's the output from the worker node (where the ingress-nginx pod runs):
<details>
<summary>cilium-dbg statedb l2-announce (filtered for ingress-nginx)</summary>
```json
kubectl exec -n kube-system $(kubectl get pods -n kube-system -l k8s-app=cilium -o name --field-selector spec.nodeName=k8s-cluster-worker-1) -- cilium-dbg statedb l2-announce | grep -i ingress-nginx
    {"ID":{"Module":["agent","controlplane","endpoint-manager"],"Component":["cilium-endpoint-2203 (ingress-nginx/ingress-nginx-controller-7d78ffcf48-mzrwm)","cep-k8s-sync"]},"Level":"OK","Message":"sync-to-k8s-ciliumendpoint (2203)","Error":"","LastOK":"2026-04-02T04:39:22.837129262Z","Updated":"2026-04-02T04:39:22.837129262Z","Stopped":"0001-01-01T00:00:00Z","Final":"","Count":2341},
    {"ID":{"Module":["agent","controlplane","endpoint-manager"],"Component":["cilium-endpoint-2203 (ingress-nginx/ingress-nginx-controller-7d78ffcf48-mzrwm)","datapath-regenerate"]},"Level":"OK","Message":"Endpoint regeneration successful","Error":"","LastOK":"2026-04-02T04:38:50.433554374Z","Updated":"2026-04-02T04:38:50.433554374Z","Stopped":"0001-01-01T00:00:00Z","Final":"","Count":197},
    {"ID":{"Module":["agent","controlplane","endpoint-manager"],"Component":["cilium-endpoint-2203 (ingress-nginx/ingress-nginx-controller-7d78ffcf48-mzrwm)","policymap-sync"]},"Level":"OK","Message":"sync-policymap-2203","Error":"","LastOK":"2026-04-02T04:35:40.147337551Z","Updated":"2026-04-02T04:35:40.147337551Z","Stopped":"0001-01-01T00:00:00Z","Final":"","Count":27},
    {"ID":{"Module":["agent","controlplane","l2-announcer"],"Component":["leader-election","job-leader-election-ingress-nginx-ingress-nginx-controller"]},"Level":"OK","Message":"Running","Error":"","LastOK":"2026-03-31T09:34:32.423594359Z","Updated":"2026-03-31T09:34:32.423594359Z","Stopped":"0001-01-01T00:00:00Z","Final":"","Count":1},
    {"Address":"0.0.0.0:30600/TCP","Type":"NodePort","ServiceName":"ingress-nginx/ingress-nginx-controller","PortName":"https","ServicePort":443,"Status":{"updated-at":"2026-04-02T04:30:00.935346246Z","id":110177,"kind":"Done"},"Backends":[{"Address":"10.0.1.84:443/TCP","PortNames":["https"],"Weight":100,"NodeName":"k8s-cluster-worker-1","Zone":null,"ClusterID":0,"Source":"k8s","State":0,"Unhealthy":false,"UnhealthyUpdatedAt":null}],"HealthCheckBackends":[{"Address":"10.0.1.84:443/TCP","PortNames":["https"],"Weight":100,"NodeName":"k8s-cluster-worker-1","Zone":null,"ClusterID":0,"Source":"k8s","State":0,"Unhealthy":false,"UnhealthyUpdatedAt":null}],"ID":5,"RedirectTo":null},
    {"Address":"0.0.0.0:30600/TCP/i","Type":"NodePort","ServiceName":"ingress-nginx/ingress-nginx-controller","PortName":"https","ServicePort":443,"Status":{"updated-at":"2026-04-02T04:30:00.904081526Z","id":110171,"kind":"Done"},"Backends":[{"Address":"10.0.1.84:443/TCP","PortNames":["https"],"Weight":100,"NodeName":"k8s-cluster-worker-1","Zone":null,"ClusterID":0,"Source":"k8s","State":0,"Unhealthy":false,"UnhealthyUpdatedAt":null}],"HealthCheckBackends":[{"Address":"10.0.1.84:443/TCP","PortNames":["https"],"Weight":100,"NodeName":"k8s-cluster-worker-1","Zone":null,"ClusterID":0,"Source":"k8s","State":0,"Unhealthy":false,"UnhealthyUpdatedAt":null}],"ID":7,"RedirectTo":null},
    {"Address":"0.0.0.0:32575/TCP","Type":"NodePort","ServiceName":"ingress-nginx/ingress-nginx-controller","PortName":"http","ServicePort":80,"Status":{"updated-at":"2026-04-02T04:30:00.885870951Z","id":110164,"kind":"Done"},"Backends":[{"Address":"10.0.1.84:80/TCP","PortNames":["http"],"Weight":100,"NodeName":"k8s-cluster-worker-1","Zone":null,"ClusterID":0,"Source":"k8s","State":0,"Unhealthy":false,"UnhealthyUpdatedAt":null}],"HealthCheckBackends":[{"Address":"10.0.1.84:80/TCP","PortNames":["http"],"Weight":100,"NodeName":"k8s-cluster-worker-1","Zone":null,"ClusterID":0,"Source":"k8s","State":0,"Unhealthy":false,"UnhealthyUpdatedAt":null}],"ID":9,"RedirectTo":null},
    {"Address":"0.0.0.0:32575/TCP/i","Type":"NodePort","ServiceName":"ingress-nginx/ingress-nginx-controller","PortName":"http","ServicePort":80,"Status":{"updated-at":"2026-04-02T04:30:00.94541961Z","id":110179,"kind":"Done"},"Backends":[{"Address":"10.0.1.84:80/TCP","PortNames":["http"],"Weight":100,"NodeName":"k8s-cluster-worker-1","Zone":null,"ClusterID":0,"Source":"k8s","State":0,"Unhealthy":false,"UnhealthyUpdatedAt":null}],"HealthCheckBackends":[{"Address":"10.0.1.84:80/TCP","PortNames":["http"],"Weight":100,"NodeName":"k8s-cluster-worker-1","Zone":null,"ClusterID":0,"Source":"k8s","State":0,"Unhealthy":false,"UnhealthyUpdatedAt":null}],"ID":11,"RedirectTo":null},
    {"Address":"10.107.32.185:443/TCP","Type":"ClusterIP","ServiceName":"ingress-nginx/ingress-nginx-controller-admission","PortName":"https-webhook","ServicePort":443,"Status":{"updated-at":"2026-04-02T04:30:00.886089006Z","id":110166,"kind":"Done"},"Backends":[{"Address":"10.0.1.84:8443/TCP","PortNames":["https-webhook"],"Weight":100,"NodeName":"k8s-cluster-worker-1","Zone":null,"ClusterID":0,"Source":"k8s","State":0,"Unhealthy":false,"UnhealthyUpdatedAt":null}],"HealthCheckBackends":[{"Address":"10.0.1.84:8443/TCP","PortNames":["https-webhook"],"Weight":100,"NodeName":"k8s-cluster-worker-1","Zone":null,"ClusterID":0,"Source":"k8s","State":0,"Unhealthy":false,"UnhealthyUpdatedAt":null}],"ID":166,"RedirectTo":null},
    {"Address":"10.108.176.71:80/TCP","Type":"ClusterIP","ServiceName":"ingress-nginx/ingress-nginx-controller","PortName":"http","ServicePort":80,"Status":{"updated-at":"2026-04-02T04:30:00.914890798Z","id":110173,"kind":"Done"},"Backends":[{"Address":"10.0.1.84:80/TCP","PortNames":["http"],"Weight":100,"NodeName":"k8s-cluster-worker-1","Zone":null,"ClusterID":0,"Source":"k8s","State":0,"Unhealthy":false,"UnhealthyUpdatedAt":null}],"HealthCheckBackends":[{"Address":"10.0.1.84:80/TCP","PortNames":["http"],"Weight":100,"NodeName":"k8s-cluster-worker-1","Zone":null,"ClusterID":0,"Source":"k8s","State":0,"Unhealthy":false,"UnhealthyUpdatedAt":null}],"ID":13,"RedirectTo":null},
    {"Address":"10.108.176.71:443/TCP","Type":"ClusterIP","ServiceName":"ingress-nginx/ingress-nginx-controller","PortName":"https","ServicePort":443,"Status":{"updated-at":"2026-04-02T04:30:00.886093616Z","id":110167,"kind":"Done"},"Backends":[{"Address":"10.0.1.84:443/TCP","PortNames":["https"],"Weight":100,"NodeName":"k8s-cluster-worker-1","Zone":null,"ClusterID":0,"Source":"k8s","State":0,"Unhealthy":false,"UnhealthyUpdatedAt":null}],"HealthCheckBackends":[{"Address":"10.0.1.84:443/TCP","PortNames":["https"],"Weight":100,"NodeName":"k8s-cluster-worker-1","Zone":null,"ClusterID":0,"Source":"k8s","State":0,"Unhealthy":false,"UnhealthyUpdatedAt":null}],"ID":14,"RedirectTo":null},
    {"Address":"192.168.1.230:80/TCP","Type":"LoadBalancer","ServiceName":"ingress-nginx/ingress-nginx-controller","PortName":"http","ServicePort":80,"Status":{"updated-at":"2026-04-02T04:30:00.955125768Z","id":110181,"kind":"Done"},"Backends":[{"Address":"10.0.1.84:80/TCP","PortNames":["http"],"Weight":100,"NodeName":"k8s-cluster-worker-1","Zone":null,"ClusterID":0,"Source":"k8s","State":0,"Unhealthy":false,"UnhealthyUpdatedAt":null}],"HealthCheckBackends":[{"Address":"10.0.1.84:80/TCP","PortNames":["http"],"Weight":100,"NodeName":"k8s-cluster-worker-1","Zone":null,"ClusterID":0,"Source":"k8s","State":0,"Unhealthy":false,"UnhealthyUpdatedAt":null}],"ID":15,"RedirectTo":null},
    {"Address":"192.168.1.230:80/TCP/i","Type":"LoadBalancer","ServiceName":"ingress-nginx/ingress-nginx-controller","PortName":"http","ServicePort":80,"Status":{"updated-at":"2026-04-02T04:30:00.925318534Z","id":110175,"kind":"Done"},"Backends":[{"Address":"10.0.1.84:80/TCP","PortNames":["http"],"Weight":100,"NodeName":"k8s-cluster-worker-1","Zone":null,"ClusterID":0,"Source":"k8s","State":0,"Unhealthy":false,"UnhealthyUpdatedAt":null}],"HealthCheckBackends":[{"Address":"10.0.1.84:80/TCP","PortNames":["http"],"Weight":100,"NodeName":"k8s-cluster-worker-1","Zone":null,"ClusterID":0,"Source":"k8s","State":0,"Unhealthy":false,"UnhealthyUpdatedAt":null}],"ID":16,"RedirectTo":null},
    {"Address":"192.168.1.230:443/TCP","Type":"LoadBalancer","ServiceName":"ingress-nginx/ingress-nginx-controller","PortName":"https","ServicePort":443,"Status":{"updated-at":"2026-04-02T04:30:00.886080118Z","id":110165,"kind":"Done"},"Backends":[{"Address":"10.0.1.84:443/TCP","PortNames":["https"],"Weight":100,"NodeName":"k8s-cluster-worker-1","Zone":null,"ClusterID":0,"Source":"k8s","State":0,"Unhealthy":false,"UnhealthyUpdatedAt":null}],"HealthCheckBackends":[{"Address":"10.0.1.84:443/TCP","PortNames":["https"],"Weight":100,"NodeName":"k8s-cluster-worker-1","Zone":null,"ClusterID":0,"Source":"k8s","State":0,"Unhealthy":false,"UnhealthyUpdatedAt":null}],"ID":17,"RedirectTo":null},
    {"Address":"192.168.1.230:443/TCP/i","Type":"LoadBalancer","ServiceName":"ingress-nginx/ingress-nginx-controller","PortName":"https","ServicePort":443,"Status":{"updated-at":"2026-04-02T04:30:00.895076524Z","id":110169,"kind":"Done"},"Backends":[{"Address":"10.0.1.84:443/TCP","PortNames":["https"],"Weight":100,"NodeName":"k8s-cluster-worker-1","Zone":null,"ClusterID":0,"Source":"k8s","State":0,"Unhealthy":false,"UnhealthyUpdatedAt":null}],"HealthCheckBackends":[{"Address":"10.0.1.84:443/TCP","PortNames":["https"],"Weight":100,"NodeName":"k8s-cluster-worker-1","Zone":null,"ClusterID":0,"Source":"k8s","State":0,"Unhealthy":false,"UnhealthyUpdatedAt":null}],"ID":18,"RedirectTo":null},
    {"Name":"ingress-nginx/ingress-nginx-controller","Source":"k8s","Labels":{"app.kubernetes.io/component":{"key":"app.kubernetes.io/component","value":"controller","source":"k8s"},"app.kubernetes.io/instance":{"key":"app.kubernetes.io/instance","value":"ingress-nginx","source":"k8s"},"app.kubernetes.io/managed-by":{"key":"app.kubernetes.io/managed-by","value":"Helm","source":"k8s"},"app.kubernetes.io/name":{"key":"app.kubernetes.io/name","value":"ingress-nginx","source":"k8s"},"app.kubernetes.io/part-of":{"key":"app.kubernetes.io/part-of","value":"ingress-nginx","source":"k8s"},"app.kubernetes.io/version":{"key":"app.kubernetes.io/version","value":"1.15.1","source":"k8s"},"argocd.argoproj.io/instance":{"key":"argocd.argoproj.io/instance","value":"ingress-nginx","source":"k8s"},"helm.sh/chart":{"key":"helm.sh/chart","value":"ingress-nginx-4.15.1","source":"k8s"},"helm.toolkit.fluxcd.io/name":{"key":"helm.toolkit.fluxcd.io/name","value":"ingress-nginx","source":"k8s"},"helm.toolkit.fluxcd.io/namespace":{"key":"helm.toolkit.fluxcd.io/namespace","value":"ingress-nginx","source":"k8s"}},"Annotations":{"argocd.argoproj.io/tracking-id":"ingress-nginx:/Service:ingress-nginx/ingress-nginx-controller","io.cilium/lb-ipam":"cilium","io.cilium/lb-ipam-ips":"192.168.1.230","meta.helm.sh/release-name":"ingress-nginx","meta.helm.sh/release-namespace":"ingress-nginx"},"Selector":{"app.kubernetes.io/component":"controller","app.kubernetes.io/instance":"ingress-nginx","app.kubernetes.io/name":"ingress-nginx"},"NatPolicy":"","ExtTrafficPolicy":"Local","IntTrafficPolicy":"Cluster","ForwardingMode":"","SessionAffinity":false,"SessionAffinityTimeout":0,"LoadBalancerClass":null,"ProxyRedirect":null,"HealthCheckNodePort":30570,"LoopbackHostPort":false,"SourceRanges":null,"PortNames":{"http":80,"https":443},"TrafficDistribution":""},
    {"Name":"ingress-nginx/ingress-nginx-controller-admission","Source":"k8s","Labels":{"app.kubernetes.io/component":{"key":"app.kubernetes.io/component","value":"controller","source":"k8s"},"app.kubernetes.io/instance":{"key":"app.kubernetes.io/instance","value":"ingress-nginx","source":"k8s"},"app.kubernetes.io/managed-by":{"key":"app.kubernetes.io/managed-by","value":"Helm","source":"k8s"},"app.kubernetes.io/name":{"key":"app.kubernetes.io/name","value":"ingress-nginx","source":"k8s"},"app.kubernetes.io/part-of":{"key":"app.kubernetes.io/part-of","value":"ingress-nginx","source":"k8s"},"app.kubernetes.io/version":{"key":"app.kubernetes.io/version","value":"1.15.1","source":"k8s"},"argocd.argoproj.io/instance":{"key":"argocd.argoproj.io/instance","value":"ingress-nginx","source":"k8s"},"helm.sh/chart":{"key":"helm.sh/chart","value":"ingress-nginx-4.15.1","source":"k8s"},"helm.toolkit.fluxcd.io/name":{"key":"helm.toolkit.fluxcd.io/name","value":"ingress-nginx","source":"k8s"},"helm.toolkit.fluxcd.io/namespace":{"key":"helm.toolkit.fluxcd.io/namespace","value":"ingress-nginx","source":"k8s"}},"Annotations":{"argocd.argoproj.io/tracking-id":"ingress-nginx:/Serviceingress-nginx/ingress-nginx-controller-admission","meta.helm.sh/release-name":"ingress-nginx","meta.helm.sh/release-namespace":"ingress-nginx"},"Selector":{"app.kubernetes.io/component":"controller","app.kubernetes.io/instance":"ingress-nginx","app.kubernetes.io/name":"ingress-nginx"},"NatPolicy":"","ExtTrafficPolicy":"Cluster","IntTrafficPolicy":"Cluster","ForwardingMode":"","SessionAffinity":false,"SessionAffinityTimeout":0,"LoadBalancerClass":null,"ProxyRedirect":null,"HealthCheckNodePort":0,"LoopbackHostPort":false,"SourceRanges":null,"PortNames":{"https-webhook":443},"TrafficDistribution":""},
    {"Address":"10.0.1.84:80/TCP","Instances":[{"k":{"ServiceName":"ingress-nginx/ingress-nginx-controller","SourcePriority":4},"v":{"Address":"10.0.1.84:80/TCP","PortNames":["http"],"Weight":100,"NodeName":"k8s-cluster-worker-1","Zone":null,"ClusterID":0,"Source":"k8s","State":0,"Unhealthy":false,"UnhealthyUpdatedAt":null}}]},
    {"Address":"10.0.1.84:443/TCP","Instances":[{"k":{"ServiceName":"ingress-nginx/ingress-nginx-controller","SourcePriority":4},"v":{"Address":"10.0.1.84:443/TCP","PortNames":["https"],"Weight":100,"NodeName":"k8s-cluster-worker-1","Zone":null,"ClusterID":0,"Source":"k8s","State":0,"Unhealthy":false,"UnhealthyUpdatedAt":null}}]},
    {"Address":"10.0.1.84:8443/TCP","Instances":[{"k":{"ServiceName":"ingress-nginx/ingress-nginx-controller-admission","SourcePriority":4},"v":{"Address":"10.0.1.84:8443/TCP","PortNames":["https-webhook"],"Weight":100,"NodeName":"k8s-cluster-worker-1","Zone":null,"ClusterID":0,"Source":"k8s","State":0,"Unhealthy":false,"UnhealthyUpdatedAt":null}}]},
    {"metadata":{"name":"ingress-nginx-controller-7d78ffcf48-mzrwm","generateName":"ingress-nginx-controller-7d78ffcf48-","namespace":"ingress-nginx","uid":"a01290af-2dc1-486e-a13c-5f9a622e9499","resourceVersion":"250317839","generation":1,"labels":{"app.kubernetes.io/component":"controller","app.kubernetes.io/instance":"ingress-nginx","app.kubernetes.io/managed-by":"Helm","app.kubernetes.io/name":"ingress-nginx","app.kubernetes.io/part-of":"ingress-nginx","app.kubernetes.io/version":"1.15.1","helm.sh/chart":"ingress-nginx-4.15.1","pod-template-hash":"7d78ffcf48"},"annotations":{"kubectl.kubernetes.io/restartedAt":"2026-04-01T14:20:19+02:00"},"ownerReferences":[{"apiVersion":"apps/v1","kind":"ReplicaSet","name":"ingress-nginx-controller-7d78ffcf48","uid":"00faa2e7-6c48-4cc3-8b58-bfbd3d1fae22","controller":true}]},"spec":{"containers":[{"name":"controller","image":"registry.k8s.io/ingress-nginx/controller:v1.15.1@sha256:594ceea76b01c592858f803f9ff4d2cb40542cae2060410b2c95f75907d659e1","ports":[{"name":"http","containerPort":80,"protocol":"TCP"},{"name":"https","containerPort":443,"protocol":"TCP"},{"name":"webhook","containerPort":8443,"protocol":"TCP"}],"volumeMounts":[{"mountPath":"/usr/local/certificates/"},{"mountPath":"/etc/ssl/certs/vault"},{"mountPath":"/var/run/secrets/kubernetes.io/serviceaccount"}]}],"serviceAccountName":"ingress-nginx","nodeName":"k8s-cluster-worker-1"},"status":{"phase":"Running","conditions":[{"type":"PodReadyToStartContainers","status":"True","lastProbeTime":null,"lastTransitionTime":"2026-04-01T22:05:45Z"},{"type":"Initialized","status":"True","lastProbeTime":null,"lastTransitionTime":"2026-04-01T22:05:14Z"},{"type":"Ready","status":"True","lastProbeTime":null,"lastTransitionTime":"2026-04-01T22:35:59Z"},{"type":"ContainersReady","status":"True","lastProbeTime":null,"lastTransitionTime":"2026-04-01T22:35:59Z"},{"type":"PodScheduled","status":"True","lastProbeTime":null,"lastTransitionTime":"2026-04-01T22:05:11Z"}],"hostIP":"192.168.1.211","podIP":"10.0.1.84","podIPs":[{"ip":"10.0.1.84"}],"startTime":"2026-04-01T22:05:14Z","containerStatuses":[{"state":{"running":{"startedAt":"2026-04-01T22:05:44Z"}},"containerID":"containerd://052c2ce888733e9cd8233f58d445c1b0920f36794ce73564ac0de6b70011785d"}],"qosClass":"Burstable"},"updatedAt":"2026-04-01T22:36:01.004130617Z"},
    {"name":"ingress-nginx","labels":{"kubernetes.io/metadata.name":"ingress-nginx","name":"ingress-nginx"},"updatedAt":"2026-04-01T22:28:45.009958465Z"},
    {"IP":"192.168.1.230","NetworkInterface":"enp1s0","Origins":[{"Name":"ingress-nginx-controller","Namespace":"ingress-nginx"}]},
```
</details>

Key observations: the L2 entry shows "IP":"192.168.1.230" on enp1s0 with the correct origin, ExtTrafficPolicy is "Local", and the backend points to k8s-cluster-worker-1. Everything looks consistent — the state is correct now after an agent restart, which is the workaround.

**Comment by isugimpy** [comment]
I've been hitting what appears to be this problem for a bit now.  Interestingly, mine eventually does self-resolve without requiring a restart of the Cilium pods.  There'll just be a window of a few minutes where the arp entry is dead, and then it'll recover.  This seems to be happening frequently, but I don't have precise timing on the interval.  It's possible my problem may be different, because I'm not getting the same volume of logs as the OP, just similar behavior.  I am getting the logs though.  Just in very small volume.

**Comment by mhorcajada** [comment]
> I've been hitting what appears to be this problem for a bit now. Interestingly, mine eventually does self-resolve without requiring a restart of the Cilium pods. There'll just be a window of a few minutes where the arp entry is dead, and then it'll recover. This seems to be happening frequently, but I don't have precise timing on the interval. It's possible my problem may be different, because I'm not getting the same volume of logs as the OP, just similar behavior. I am getting the logs though. Just in very small volume.

@isugimpy Thanks for reporting! Interesting that in your case it self-recovers after a few minutes. In our case, the ARP entry stays dead until we restart the Cilium pod  it never recovers on its own. That might suggest different triggering conditions or timing in the BPF map reconciliation loop. What Cilium version are you running?

**Comment by isugimpy** [comment]
I was on 1.19.2.  Downgraded to 1.19.1 to see if it'd make a difference.  Unfortunately it hasn't.

**Comment by scottrus** [comment]
**v1.18 is also affected. The defect exists in all versions that have L2 announcements.**

This issue lists v1.19.2 and higher as affected. The defect is older. The pointer-reuse line is present in the first version of the reconciler (commit `a815210ca3`, "datapath: L2 responder reconciler", 2023-05-15). That commit shipped with L2 announcements in v1.14. At tag `v1.18.11`, the defect is at `pkg/datapath/l2responder/l2responder.go:229`. The fix (`e6ff2e7e2b`, PR #45197) is in v1.19.4+ and v1.20.0+. No v1.18.x release contains it, up to and including v1.18.13 (2026-08-17). Users who stay on v1.18 because this issue reads as "v1.19 only" are not safe.

**Production observation on v1.18.11** (Talos v1.13.9, kube-proxy replacement, three L2 LoadBalancer VIPs). We saw two symptom types from the same defect:

1. **Orphan type.** A rolling restart of the DaemonSet replaced an agent while its node held three leases. The leases moved to other nodes. The dead agent's map entries stayed. The new agent's full reconciliation found the orphans every 5 minutes, queued them, and deleted at most one aliased key per round. The node answered ARP for VIPs it did not own for 40+ hours. The true holder and the stale node answered every broadcast ARP request in a duel. Our router's next-hop MAC for each VIP flapped on a ~10-second cycle. Connections that were in flight across a flip received RFC 793 resets from the node that had no state for them. Client-visible failure rate was 0.1% to 0.7% of requests through the router.

2. **Self-delete type** (the symptom this issue documents). On the same node, the aliased delete removed the one legitimate entry in each full round. The reconciler re-created the entry one round later. The VIP was unanswerable by its owner for up to 5 of every 10 minutes, and the entry's `responses_sent` counter reset each cycle.

The log arithmetic identifies the defect exactly. With 4 map entries and an empty desired state at agent start, the log shows one silent success and three failures:

```
level=error msg="Error(s) while reconciling l2 responder map" module=agent.datapath.l2-responder
error="delete 192.168.200.241@8: delete: key does not exist\ndelete 192.168.200.241@8: delete: key does not exist\ndelete 192.168.200.241@8: delete: key does not exist"
```

With 3 orphans and 1 desired entry in steady state, each 5-minute round shows two failures. The failure count is always the queue length minus one, because every queued pointer aliases the last iterated key.

A map dump makes the state visible. Orphan counters grow without limit. The owned entry's counter stays near zero because of the delete/re-create cycle:

```
# bpftool map dump pinned /sys/fs/bpf/tc/globals/cilium_l2_responder_v4   (affected node)
key: c0 a8 c8 f2 08 00 00 00  value: 67 97 00 00 00 00 00 00   <- orphan, 38759 responses
key: c0 a8 c8 f0 08 00 00 00  value: 58 97 00 00 00 00 00 00   <- orphan, 38744 responses
key: c0 a8 c8 f3 08 00 00 00  value: c2 00 00 00 00 00 00 00   <- orphan, 194 responses
key: c0 a8 c8 f1 08 00 00 00  value: 00 00 00 00 00 00 00 00   <- owned by this node's lease
```

A second dump 17 minutes later showed the two busy orphan counters at +257 each. The orphans answer live traffic, they are not history.

**An agent restart is not a reliable workaround.** The result depends on the map content after the restart:

- Map with orphans plus one legitimate entry: the aliased delete targets the last iterated key. In our case that key was the legitimate entry. The orphans stay without limit. We observed 40+ hours.
- Map with orphans only: each full round deletes one arbitrary entry, so a small orphan set drains at one entry per 5 minutes. We observed this too.

A later rolling restart (our v1.18.11 to v1.18.13 hop) minted 3 new orphan entries across 2 nodes. Any DaemonSet rollout on an affected version can create the condition.

**Workaround for unfixed versions.** Delete the orphan keys directly. Keep the keys that match the node's current leases:

```
bpftool map delete pinned /sys/fs/bpf/tc/globals/cilium_l2_responder_v4 \
  key hex <ip4 bytes> <ifindex u32le bytes>
```

After the deletion, the map equals the desired state, the delete queue stays empty, and both symptom types stop until the next lease movement.

**Suggested actions.** Update the affected-versions metadata to include v1.14 through v1.18. A note in the v1.18 docs would also help, since v1.18 remains in maintenance support.
