### ISSUE TITLE
Pod-forwarded VPN traffic to Cilium L2 LoadBalancer VIP fails with ICMP host unreachable

### ISSUE THREAD

**Issue by Blarc** [cilium/cilium#47580]
### Is there an existing issue for this?

- [x] I have searched the existing issues

### Version

equal or higher than v1.18.12 and lower than v1.19.0

### Summary

Traffic forwarded from a VPN pod to a Cilium LoadBalancer VIP advertised by L2 announcements fails with `ICMP host unreachable`.

The same VPN tunnel can reach the Kubernetes API on the node IP, but cannot reach internal applications exposed through a Cilium LoadBalancer IP used by Traefik.

This looks like a Cilium datapath/L2 LB VIP edge case involving forwarded traffic from a pod.

### Environment

- Kubernetes distribution: Talos
- Cluster topology: single-node cluster
- CNI: Cilium
- Cilium version/chart: `1.18.6`
- kube-proxy replacement: enabled
- LoadBalancer IPAM: used for service VIPs
- L2 announcements: enabled
- VPN: WireGuard running in a Kubernetes pod via `wireguard-operator`
- Ingress: Traefik Gateway behind a Cilium LoadBalancer service
- Node LAN IP: `192.168.1.16`
- Traefik internal LoadBalancer VIP: `192.168.1.228`
- WireGuard pod IP: `10.244.0.50`
- WireGuard client IP: `10.8.0.14`

Relevant Cilium values:

```yaml
cilium:
  kubeProxyReplacement: true

  l2announcements:
    enabled: true

  externalIPs:
    enabled: true

  ciliumEndpointSlice:
    enabled: true

  loadBalancer:
    algorithm: maglev
```

L2 announcement policy:

```yaml
apiVersion: cilium.io/v2alpha1
kind: CiliumL2AnnouncementPolicy
metadata:
  name: default-l2-announcement-policy
  namespace: kube-system
spec:
  externalIPs: true
  loadBalancerIPs: true
```

Traefik service:

```text
traefik   LoadBalancer   192.168.1.228   80/TCP,443/TCP
```

WireGuard service:

```text
wireguard-svc   NodePort   51820:31820/UDP
```

### Expected Behavior

A VPN client connected to the WireGuard pod should be able to reach the Cilium LoadBalancer VIP:

```text
10.8.0.14 -> 192.168.1.228:443
```

The packet should be forwarded to the Traefik service/backend, the same as a normal LAN client hitting `192.168.1.228:443`.

### Actual Behavior

The WireGuard tunnel works and traffic reaches the WireGuard pod.

The VPN client can reach the Kubernetes API on the real node IP:

```text
10.8.0.14 -> 192.168.1.16:6443
```

But traffic to the Cilium LoadBalancer VIP fails:

```text
10.8.0.14 -> 192.168.1.228:443
```

Tcpdump from a debug container attached to the WireGuard pod network namespace shows:

```text
wg0   In  IP 10.8.0.14.55140 > 192.168.1.228.443: Flags [S], length 0
eth0  Out IP 10.244.0.50.55140 > 192.168.1.228.443: Flags [S], length 0

eth0  In  IP 192.168.1.16 > 10.244.0.50: ICMP host 192.168.1.228 unreachable, length 68
wg0   Out IP 192.168.1.16 > 10.8.0.14: ICMP host 192.168.1.228 unreachable, length 68
```

So the VPN pod forwards the packet, but the node responds that the Cilium LoadBalancer VIP is unreachable.

### Additional Observations

- The WireGuard tunnel is active and handshakes successfully.
- The VPN client can reach the Kubernetes API using the real node IP.
- A pod can originate traffic to the LoadBalancer VIP directly.
- The failure appears specific to traffic forwarded through the VPN pod toward the Cilium LoadBalancer VIP.
- Running a Tailscale subnet router in userspace networking mode avoids the issue, likely because it opens outbound userspace connections instead of relying on kernel forwarding from a pod interface.

### Questions

Is traffic forwarded from a pod to a Cilium LoadBalancer IP advertised by L2 announcements expected to work?

If yes, what Cilium setting should allow this datapath?

If no, is the recommended solution to run the VPN router with `hostNetwork: true`, or is there a supported way to make pod-forwarded VPN traffic reach Cilium LoadBalancer VIPs?

### How can we reproduce the issue?

1. Deploy a single-node Kubernetes cluster with Cilium.

   Relevant Cilium settings:

   ```yaml
   kubeProxyReplacement: true

   l2announcements:
     enabled: true

   externalIPs:
     enabled: true
   ```

2. Create a Cilium L2 announcement policy for LoadBalancer IPs.

   ```yaml
   apiVersion: cilium.io/v2alpha1
   kind: CiliumL2AnnouncementPolicy
   metadata:
     name: default-l2-announcement-policy
   spec:
     externalIPs: true
     loadBalancerIPs: true
   ```

3. Expose an HTTP/HTTPS ingress controller using a Cilium LoadBalancer IP from the LAN subnet.

   Example:

   ```text
   Node LAN IP:          192.168.1.16
   LoadBalancer VIP:     192.168.1.228
   Ingress controller:   Traefik
   ```

4. Deploy WireGuard inside Kubernetes as a normal pod, not `hostNetwork`.

   The WireGuard pod should route client traffic from a VPN subnet, for example:

   ```text
   WireGuard pod IP:      10.244.0.50
   WireGuard interface:   wg0
   VPN client IP:         10.8.0.14
   Routed LAN subnet:     192.168.1.0/24
   ```

5. Connect a remote WireGuard client.

6. From the WireGuard client, access the Cilium LoadBalancer VIP:

   ```bash
   curl -vk https://192.168.1.228
   ```

   Or access a hostname that resolves to the VIP:

   ```bash
   curl -vk https://grafana.home.
   ```

7. Attach tcpdump to the WireGuard pod network namespace.

   Example:

   ```bash
   kubectl debug -n wireguard pod/<wireguard-pod> -it \
     --image=nicolaka/netshoot \
     --target=<wireguard-container> \
     -- tcpdump -ni any 'host 192.168.1.228 or icmp or udp port 51820'
   ```

8. Observe that the VPN client SYN reaches the WireGuard pod and is forwarded out of the pod:

   ```text
   wg0   In  IP 10.8.0.14.55140 > 192.168.1.228.443: Flags [S], length 0
   eth0  Out IP 10.244.0.50.55140 > 192.168.1.228.443: Flags [S], length 0
   ```

9. Observe that the node replies with `ICMP host unreachable` for the LoadBalancer VIP:

   ```text
   eth0  In  IP 192.168.1.16 > 10.244.0.50: ICMP host 192.168.1.228 unreachable, length 68
   wg0   Out IP 192.168.1.16 > 10.8.0.14: ICMP host 192.168.1.228 unreachable, length 68
   ```

10. Verify that the same VPN client can reach the real node IP, for example the Kubernetes API:

    ```bash
    curl -k https://192.168.1.16:6443
    ```

    This confirms the VPN route itself works and the failure is specific to the Cilium LoadBalancer VIP.

11. Optional control test: from inside a normal pod, originate traffic to the LoadBalancer VIP:

    ```bash
    wget http://192.168.1.228
    ```

    In my cluster, pod-originated traffic to the VIP works, but forwarded VPN traffic from the pod fails.

### Cilium Version

  v1.18.6
  Running images:
  quay.io/cilium/cilium:v1.18.6
  quay.io/cilium/operator-generic:v1.18.6

### Kernel Version

OS-IMAGE:        Talos (v1.13.7)
KERNEL-VERSION:  6.18.39-talos (amd64)
Kubernetes:      v1.36.2
Container runtime: containerd://2.2.6

### Kubernetes Version

Client Version: v1.36.3
Kustomize Version: v5.8.1
Server Version: v1.36.2

### Relevant log output

```shell

```

### Cilium Users Document

- [x] Are you a user of Cilium? Please add yourself to the [Users doc](https://github.com/cilium/cilium/blob/main/USERS.md)

### Code of Conduct

- [x] I agree to follow this project's Code of Conduct

**Comment by Blarc** [comment]
I found a solution, although a counter-intuitive one.

This setup used to work, which is why I started looking through recent changes in my GitOps repo. I found a commit where I removed the old Cilium Gateway resources/classes because I had migrated ingress from Cilium Gateway to Traefik Gateway.

That change also set:

```yaml
gatewayAPI:
  enabled: false
```

At first this looked completely unrelated, because I no longer use Gateway API via Cilium. My current ingress path is Traefik behind a Cilium LoadBalancer VIP. But then I noticed that the Cilium Helm reference says `gatewayAPI.enabled=true` automatically sets `enable-envoy-config`, so I tested whether the Envoy config integration was the relevant part.

Changing `gatewayAPI.enabled` back to enabled fixed the WireGuard issue:

```yaml
gatewayAPI:
  enabled: true
```

After doing this, the same WireGuard client could access the same application through the same internal LoadBalancer VIP.

I then tested the smaller change and confirmed that Gateway API itself is not required. This also fixes the issue:

```yaml
gatewayAPI:
  enabled: false

envoyConfig:
  enabled: true
```

No WireGuard configuration change was needed.

This suggests the issue is specifically related to Cilium behavior when Envoy config support is disabled. Even though I am no longer using Cilium Gateway resources directly, enabling `envoyConfig.enabled=true` appears to restore or activate datapath handling that makes pod-forwarded VPN traffic to the Cilium LoadBalancer VIP work.

So the minimal workaround in my cluster is:

```yaml
envoyConfig:
  enabled: true
```

**Comment by smagnani96** [comment]
Hey, thanks for reporting the issue. I think this is might due to [these lines](https://github.com/cilium/cilium/blob/3ab8efdd3b3f944db3eb8415dfeb4b608e3ae56b/bpf/bpf_lxc.c#L90-L96).

GatewayAPI enabled fixes it as it enables `bpf-lb-sock-hostns-only: true`, which sets `ENABLE_SOCKET_LB_HOST_ONLY`. Plain EnvoyConfig enabled doesn't touch that Helm value, but enables `ENABLE_L7_LB`. 

You're WG pod decapsulate and forwards (via kernel IP forwarding path) to eth0. W/o per-packet LB, destination never gets rewritten and the packet leaves the veth with the LB VIP.

I will add proper labels to this issue.
