### ISSUE TITLE
Gateway API Envoy cannot connect to backend pod on the same node while remote-node backend works

### ISSUE THREAD

**Issue by sihamouda** [cilium/cilium#47898]
### Is there an existing issue for this?

- [x] I have searched the existing issues

### Version

equal or higher than v1.19.6 and lower than v1.20.0

### What happened?

I am using Cilium Gateway API with an external Envoy DaemonSet and a hostNetwork Gateway listener.

The Gateway is restricted to one node (`node B`) using:

```yaml
gatewayAPI:
  enabled: true
  hostNetwork:
    enabled: true
    nodes:
      matchLabels:
        gateway-node: "true"
```

The backend Service has two healthy pod endpoints:

10.244.4.70:5556 on the same node as the Gateway/Envoy (node B)
10.244.0.92:5556 on another node (node A)

Requests through the Gateway intermittently return HTTP 503:
```
upstream connect error or disconnect/reset before headers.
reset reason: connection timeout
```

Envoy's cluster statistics show that the remote-node backend works consistently, while the same-node backend cannot establish a TCP connection:
```
10.244.0.92:5556 (remote node)
  cx_connect_fail: 0
  rq_success: >0

10.244.4.70:5556 (same node)
  cx_connect_fail: increasing
  rq_success: 0
```

Envoy EDS contains both endpoints and marks both as healthy.

A tcpdump on the Gateway node shows that for the failing same-node backend:

Cilium/Envoy sends SYN from 10.244.4.231 to 10.244.4.70:5556.
The backend pod immediately returns SYN-ACK.
The initiating side does not complete the handshake with ACK.
SYN is retransmitted several times.
Eventually the connection is reset.

Example of a tcp dump:
```
sudo tcpdump -ni any \
  'host 10.244.4.70 and tcp port 5556'
tcpdump: data link type LINUX_SLL2
tcpdump: verbose output suppressed, use -v[v]... for full protocol decode
listening on any, link-type LINUX_SLL2 (Linux cooked v2), snapshot length 262144 bytes
16:01:02.844908 lxcc086eafec2bb Out IP 10.244.4.231.55920 > 10.244.4.70.5556: Flags [S], seq 1257591198, win 64480, options [mss 1240,sackOK,TS val 499698959 ecr 0,nop,wscale 7], length 0
16:01:02.844936 lxcc086eafec2bb In  IP 10.244.4.70.5556 > 10.244.4.231.55920: Flags [S.], seq 3736550654, ack 1257591199, win 65084, options [mss 1240,sackOK,TS val 3932615119 ecr 499698959,nop,wscale 7], length 0
16:01:03.862840 lxcc086eafec2bb Out IP 10.244.4.231.55920 > 10.244.4.70.5556: Flags [S], seq 1257591198, win 64480, options [mss 1240,sackOK,TS val 499699977 ecr 0,nop,wscale 7], length 0
16:01:03.863946 lxcc086eafec2bb In  IP 10.244.4.70.5556 > 10.244.4.231.55920: Flags [S.], seq 3736550654, ack 1257591199, win 65084, options [mss 1240,sackOK,TS val 3932616138 ecr 499698959,nop,wscale 7], length 0
16:01:03.864031 lxcc086eafec2bb In  IP 10.244.4.70.5556 > 10.244.4.231.55920: Flags [S.], seq 3736550654, ack 1257591199, win 65084, options [mss 1240,sackOK,TS val 3932616138 ecr 499698959,nop,wscale 7], length 0
16:01:04.886806 lxcc086eafec2bb Out IP 10.244.4.231.55920 > 10.244.4.70.5556: Flags [S], seq 1257591198, win 64480, options [mss 1240,sackOK,TS val 499701001 ecr 0,nop,wscale 7], length 0
16:01:04.886850 lxcc086eafec2bb In  IP 10.244.4.70.5556 > 10.244.4.231.55920: Flags [S.], seq 3736550654, ack 1257591199, win 65084, options [mss 1240,sackOK,TS val 3932617161 ecr 499698959,nop,wscale 7], length 0
16:01:05.910828 lxcc086eafec2bb Out IP 10.244.4.231.55920 > 10.244.4.70.5556: Flags [S], seq 1257591198, win 64480, options [mss 1240,sackOK,TS val 499702025 ecr 0,nop,wscale 7], length 0
16:01:05.910976 lxcc086eafec2bb In  IP 10.244.4.70.5556 > 10.244.4.231.55920: Flags [S.], seq 3736550654, ack 1257591199, win 65084, options [mss 1240,sackOK,TS val 3932618185 ecr 499698959,nop,wscale 7], length 0
16:01:06.934814 lxcc086eafec2bb Out IP 10.244.4.231.55920 > 10.244.4.70.5556: Flags [S], seq 1257591198, win 64480, options [mss 1240,sackOK,TS val 499703049 ecr 0,nop,wscale 7], length 0
16:01:06.934858 lxcc086eafec2bb In  IP 10.244.4.70.5556 > 10.244.4.231.55920: Flags [S.], seq 3736550654, ack 1257591199, win 65084, options [mss 1240,sackOK,TS val 3932619209 ecr 499698959,nop,wscale 7], length 0
16:01:08.432711 lxcc086eafec2bb Out IP 10.244.4.231.55934 > 10.244.4.70.5556: Flags [S], seq 2940870166, win 64480, options [mss 1240,sackOK,TS val 499704546 ecr 0,nop,wscale 7], length 0
16:01:08.432768 lxcc086eafec2bb In  IP 10.244.4.70.5556 > 10.244.4.231.55934: Flags [S.], seq 1462187794, ack 2940870167, win 65084, options [mss 1240,sackOK,TS val 3932620707 ecr 499704546,nop,wscale 7], length 0
16:01:08.982828 lxcc086eafec2bb In  IP 10.244.4.70.5556 > 10.244.4.231.55920: Flags [S.], seq 3736550654, ack 1257591199, win 65084, options [mss 1240,sackOK,TS val 3932621257 ecr 499698959,nop,wscale 7], length 0
16:01:08.982957 lxcc086eafec2bb Out IP 10.244.4.231.55920 > 10.244.4.70.5556: Flags [R], seq 1257591199, win 0, length 0
16:01:09.494805 lxcc086eafec2bb Out IP 10.244.4.231.55934 > 10.244.4.70.5556: Flags [S], seq 2940870166, win 64480, options [mss 1240,sackOK,TS val 499705609 ecr 0,nop,wscale 7], length 0
16:01:09.494863 lxcc086eafec2bb In  IP 10.244.4.70.5556 > 10.244.4.231.55934: Flags [S.], seq 1462187794, ack 2940870167, win 65084, options [mss 1240,sackOK,TS val 3932621769 ecr 499704546,nop,wscale 7], length 0
16:01:09.494892 lxcc086eafec2bb In  IP 10.244.4.70.5556 > 10.244.4.231.55934: Flags [S.], seq 1462187794, ack 2940870167, win 65084, options [mss 1240,sackOK,TS val 3932621769 ecr 499704546,nop,wscale 7], length 0
16:01:10.518820 lxcc086eafec2bb Out IP 10.244.4.231.55934 > 10.244.4.70.5556: Flags [S], seq 2940870166, win 64480, options [mss 1240,sackOK,TS val 499706633 ecr 0,nop,wscale 7], length 0
16:01:10.518856 lxcc086eafec2bb In  IP 10.244.4.70.5556 > 10.244.4.231.55934: Flags [S.], seq 1462187794, ack 2940870167, win 65084, options [mss 1240,sackOK,TS val 3932622793 ecr 499704546,nop,wscale 7], length 0
16:01:11.542847 lxcc086eafec2bb Out IP 10.244.4.231.55934 > 10.244.4.70.5556: Flags [S], seq 2940870166, win 64480, options [mss 1240,sackOK,TS val 499707657 ecr 0,nop,wscale 7], length 0
16:01:11.542910 lxcc086eafec2bb In  IP 10.244.4.70.5556 > 10.244.4.231.55934: Flags [S.], seq 1462187794, ack 2940870167, win 65084, options [mss 1240,sackOK,TS val 3932623817 ecr 499704546,nop,wscale 7], length 0
16:01:12.566826 lxcc086eafec2bb Out IP 10.244.4.231.55934 > 10.244.4.70.5556: Flags [S], seq 2940870166, win 64480, options [mss 1240,sackOK,TS val 499708681 ecr 0,nop,wscale 7], length 0
16:01:12.566884 lxcc086eafec2bb In  IP 10.244.4.70.5556 > 10.244.4.231.55934: Flags [S.], seq 1462187794, ack 2940870167, win 65084, options [mss 1240,sackOK,TS val 3932624841 ecr 499704546,nop,wscale 7], length 0
16:01:13.598031 lxcc086eafec2bb Out IP 10.244.4.231.33024 > 10.244.4.70.5556: Flags [S], seq 397235219, win 64480, options [mss 1240,sackOK,TS val 499709712 ecr 0,nop,wscale 7], length 0
16:01:13.598065 lxcc086eafec2bb In  IP 10.244.4.70.5556 > 10.244.4.231.33024: Flags [S.], seq 196499280, ack 397235220, win 65084, options [mss 1240,sackOK,TS val 3932625872 ecr 499709712,nop,wscale 7], length 0
16:01:14.614821 lxcc086eafec2bb In  IP 10.244.4.70.5556 > 10.244.4.231.55934: Flags [S.], seq 1462187794, ack 2940870167, win 65084, options [mss 1240,sackOK,TS val 3932626889 ecr 499704546,nop,wscale 7], length 0
16:01:14.614823 lxcc086eafec2bb Out IP 10.244.4.231.33024 > 10.244.4.70.5556: Flags [S], seq 397235219, win 64480, options [mss 1240,sackOK,TS val 499710729 ecr 0,nop,wscale 7], length 0
16:01:14.614875 lxcc086eafec2bb In  IP 10.244.4.70.5556 > 10.244.4.231.33024: Flags [S.], seq 196499280, ack 397235220, win 65084, options [mss 1240,sackOK,TS val 3932626889 ecr 499709712,nop,wscale 7], length 0
16:01:14.614893 lxcc086eafec2bb In  IP 10.244.4.70.5556 > 10.244.4.231.33024: Flags [S.], seq 196499280, ack 397235220, win 65084, options [mss 1240,sackOK,TS val 3932626889 ecr 499709712,nop,wscale 7], length 0
16:01:14.615000 lxcc086eafec2bb Out IP 10.244.4.231.55934 > 10.244.4.70.5556: Flags [R], seq 2940870167, win 0, length 0
16:01:15.638809 lxcc086eafec2bb Out IP 10.244.4.231.33024 > 10.244.4.70.5556: Flags [S], seq 397235219, win 64480, options [mss 1240,sackOK,TS val 499711753 ecr 0,nop,wscale 7], length 0
16:01:15.638846 lxcc086eafec2bb In  IP 10.244.4.70.5556 > 10.244.4.231.33024: Flags [S.], seq 196499280, ack 397235220, win 65084, options [mss 1240,sackOK,TS val 3932627913 ecr 499709712,nop,wscale 7], length 0
^C
33 packets captured
33 packets received by filter
0 packets dropped by kernel

```

The backend itself is healthy and directly reachable.

Expected behavior:

Envoy should be able to establish upstream connections to both same-node and remote-node Service endpoints. Requests through the Gateway should not intermittently return 503 depending on which backend is selected.

Note: It's not a firewall issue, I tested that too

### How can we reproduce the issue?

Two-node Kubernetes cluster:

- Node A: control-plane / worker
- Node B: worker and Gateway node
- Cilium Gateway API listener exposed only on Node B
- Backend Deployment with one pod on each node

Relevant Cilium configuration:

```yaml
cluster:
  name: your cluster name

gatewayAPI:
  enabled: true
  hostNetwork:
    enabled: true
    nodes:
      matchLabels:
        gateway-node: "true"

ipam:
  mode: kubernetes

ipv4NativeRoutingCIDR: 10.244.0.0/16

kubeProxyReplacement: true

routingMode: tunnel
tunnelProtocol: vxlan
```

Only the Gateway node has: `gateway-node=true`

Create a Gateway listener on port 8080 and an HTTPRoute pointing to a Service with two backend pods, one on each node.

Example backend endpoints in my environment:
10.244.4.70:5556  same node as Gateway/Envoy
10.244.0.92:5556  remote node

Generate repeated requests through the Gateway:
```bash
for i in {1..20}; do
  printf "$i "
  curl -sS \
    --connect-timeout 3 \
    -H 'Host: YOUR_HOSTNAME' \
    -o /dev/null \
    -w '%{http_code}\n' \
    http://NODE_B_IP:8080
done
```

### Cilium Version

Cilium 1.19.5
cilium-envoy v1.36.8-1781157951-a7f42a3390781539911b5b9107881b35ecc4e752

### Kernel Version

6.8.0-136-generic

### Kubernetes Version

Client Version: v1.36.3
Kustomize Version: v5.8.1
Server Version: v1.36.3

### Sysdump

[cilium-sysdump-20260811-160528.zip](https://github.com/user-attachments/files/30942709/cilium-sysdump-20260811-160528.zip)

### Relevant log output

```shell

```

### Anything else?

This is my first time to use cilium.
This Issue is raised by me Anis Hamouda with the help of AI

### Cilium Users Document

- [ ] Are you a user of Cilium? Please add yourself to the [Users doc](https://github.com/cilium/cilium/blob/main/USERS.md)

### Code of Conduct

- [x] I agree to follow this project's Code of Conduct

**Comment by chattytak** [comment]
#47591 
While there are differences in the detailed cilium configurations, it feels similar to the issue I posted.
Because I have the bpf.tproxy feature enabled, my issue is being suspected of being related to it, so they aren't being very proactive in addressing it.

#47940 
The issue mentioned above is likely a similar phenomenon, but it will probably not be taken seriously simply because it is ARM64.
There are countless issues, such as #42325 , that appear to be identical to this phenomenon, yet they all remain unresolved and neglected.

**Comment by squeed** [comment]
@sihamouda thanks for the bug report. A question: how are you contacting the gateway from the client pod?

I'm not an Envoy / Gateway API expert, but I am taking a look.

**Comment by sihamouda** [comment]
@squeed sorry for late response

I reproduced it from both:

- a client pod inside the cluster, contacting the Gateway through the gateway node IP/listener port with the HTTPRoute hostname;
- my laptop, which can directly reach the VPS over NetBird/private connectivity.

In both cases, the behavior is the same: requests succeed when Envoy selects the backend pod on the remote node, but fail with 503 when it selects the backend pod on the same node as the Gateway/Envoy.

In my case I was trying to deploy dex with 2 replicas and I first thought maybe it is firewall issue but after investigating it's not.

**Comment by chattytak** [comment]
Under certain conditions, the following command may resolve it.
`sysctl -w net.ipv4.conf.all.accept_local=1`

https://github.com/cilium/cilium/issues/47591#issuecomment-5353245536

**Comment by sihamouda** [comment]
Thank you @chattytak for my case it worked
