### DISCUSSION TITLE
Cilium agent stuck in Init:CrashLoopBackOff on dual-homed bare-metal nodes — device auto-detection picks the wrong interface?

### DISCUSSION THREAD

**Discussion by electrical** [cilium/cilium#47347] [Q&A]
## Summary

After an RKE2/Kubernetes upgrade (v1.34.5+rke2r1 → v1.35.6+rke2r1, which bundled a Cilium chart bump to v1.19.4), the `cilium-agent` DaemonSet pod on **every bare-metal worker node** (3 of 3) got stuck in `Init:CrashLoopBackOff` on the `config` init container, unable to reach the Kubernetes API server via its ClusterIP. Control-plane nodes in the same cluster rolled through the exact same upgrade with zero issues.

Packet capture on an affected node (see below) shows the `config` init container's outbound connection to the API server is sourced from the node's **public IP**, not its private/internal IP — even though the private IP is what Kubernetes itself uses as the node's `InternalIP`, and even though a plain unprivileged `curl` from the same host, at the same time, correctly sources from the private IP and succeeds instantly. This strongly suggests Cilium's device/IP auto-detection is picking the wrong interface on nodes that have two independent NICs/addresses (one public, one private), and that whatever component makes the outbound connection for `build-config` is binding to that auto-detected address rather than letting the kernel's routing table pick the source address normally.

We're not certain this is the actual mechanism — we'd like to confirm with the team whether this diagnosis matches known behavior, and if so, whether explicitly pinning `devices` is the correct/only fix, or if there's a better-supported pattern for this topology.

## Environment

- **Kubernetes distribution:** RKE2, versions involved: `v1.34.5+rke2r1` (before) → `v1.35.6+rke2r1` (after)
- **Cluster management:** Rancher 2.14.3 (RKE2 "custom" cluster — nodes provisioned independently via Terraform, then registered into Rancher)
- **Cilium version:** `v1.19.4` (`rancher/mirrored-cilium-cilium:v1.19.4`, bundled via RKE2's `rke2-cilium` addon chart)
- **CNI mode:** `cni: cilium` in RKE2 config; `kube-proxy` running in **iptables** mode (not IPVS, not kube-proxy replacement — `disable-kube-proxy: false`)
- **Cilium chart values:** effectively empty — no `devices`, `k8sServiceHost`, or IP overrides set. `devices` is left on auto-detect.
- **Cluster topology:** 3 control-plane nodes + 3 worker nodes, all on Hetzner (bare-metal/dedicated servers), OS Ubuntu 24.04.4 LTS, kernel 6.8.x, containerd 2.2.5.
  - **Control-plane nodes:** single network path — private network only from Kubernetes' point of view (`kubectl get nodes` shows `EXTERNAL-IP: <none>`).
  - **Worker nodes:** dual-homed —
    - A public IP assigned directly to the primary physical NIC (`enp193s0f0np0`), which also owns the node's **default route**.
    - A private network address on a VLAN sub-interface of that same NIC (`vswitch.4003`, e.g. `10.0.3.x`), which is what kubelet reports as the node's `InternalIP`, and which has specific (non-default) routes to the rest of the cluster's private network (control-plane nodes, pod/service CIDRs' egress path, etc.)

## What we did

Routine minor-version upgrade: Kubernetes/RKE2 `v1.34.5` → `v1.35.6` across the cluster (rolling control-plane upgrade, then workers), following standard version-skew rules (single minor-version hop). This pulled in a new bundled `rke2-cilium` chart version, bumping the running Cilium agent from an older 1.18.x-era version to `v1.19.4`.

## What broke

Immediately after each worker node's `cilium-agent` DaemonSet pod got recreated (as part of the chart bump), it became stuck:

```
NAME            READY   STATUS                  RESTARTS   AGE
cilium-xxxxx    0/1     Init:CrashLoopBackOff    6          13m
```

`config` init container logs:

```
time=... level=info  msg="Establishing connection to apiserver" subsys=cilium-dbg module=k8s-client ipAddr=https://10.43.0.1:443
time=... level=info  msg="Establishing connection to apiserver" subsys=cilium-dbg module=k8s-client ipAddr=https://10.43.0.1:443
time=... level=error msg="Unable to contact k8s api-server" subsys=cilium-dbg module=k8s-client ipAddr=https://10.43.0.1:443 error="Get \"https://10.43.0.1:443/api/v1/namespaces/kube-system\": dial tcp 10.43.0.1:443: i/o timeout"
time=... level=error msg="Start hook failed" subsys=cilium-dbg function="client.(*compositeClientset).onStart (k8s-client)" error="..."
time=... level=error msg="Failed to start hive" subsys=cilium-dbg error="..." duration=1m5.034822901s
Error: Build config failed: failed to start: Get "https://10.43.0.1:443/api/v1/namespaces/kube-system": dial tcp 10.43.0.1:443: i/o timeout
```

`10.43.0.1` is the cluster's `kubernetes.default` ClusterIP. This happened on **all three worker nodes** as each one's cilium pod came up (one at a time, over about 20 minutes as we worked through the rollout). All three control-plane nodes' cilium pods rolled through cleanly in the same window with no issue.

This did **not** self-heal:
- Kubelet's own crash-loop-backoff container restarts (same pod, same sandbox) never resolved it — we saw 4-6+ restarts over 10+ minutes with no progress.
- A `kubectl delete pod` (forcing a brand-new pod/sandbox on the same node) also did **not** fix it on one of the three nodes.
- A **full node reboot** did fix it, on all three nodes — but this felt non-deterministic rather than a guaranteed remedy (we've hit this exact symptom on a previous upgrade too, and reboot was the only thing that ever worked).

## Diagnosis

We deployed a privileged, `hostNetwork: true` debug pod (`nicolaka/netshoot`) onto one of the still-broken worker nodes to investigate live, while its actual `cilium-agent` pod was still actively crash-looping on the same node.

**1. iptables rules for the `kubernetes` service were correct** — proper 3-way random-weighted DNAT to all three control-plane `:6443` endpoints, no anomalies.

**2. `rp_filter` was inconsistent but not obviously the cause:**
```
/proc/sys/net/ipv4/conf/all/rp_filter: 0
/proc/sys/net/ipv4/conf/cilium_host/rp_filter: 0   (and other cilium-owned interfaces: 0)
/proc/sys/net/ipv4/conf/default/rp_filter: 2
/proc/sys/net/ipv4/conf/enp193s0f0np0/rp_filter: 2   (physical NIC)
/proc/sys/net/ipv4/conf/vswitch.4003/rp_filter: 2    (private VLAN interface)
```
(We initially suspected this, since `rp_filter=2`/loose mode plus asymmetric-looking routing is a classic drop cause — but the direct connectivity test below ruled it out as the *current* blocker.)

**3. A plain `curl` from the debug pod (same node, same network namespace since both are `hostNetwork`) succeeded instantly** against both the ClusterIP and all three real API server addresses directly:
```
curl -sk https://10.43.0.1:443/version        -> HTTP 401 in 0.21s   (i.e. full TCP+TLS handshake succeeded)
curl -sk https://10.0.1.10:6443/version       -> HTTP 401 in 0.005s
curl -sk https://10.0.1.11:6443/version       -> HTTP 401 in 0.007s
curl -sk https://10.0.1.12:6443/version       -> HTTP 401 in 0.007s
```
This proves the node's routing, iptables/NAT, and `rp_filter` config were **not** broken at the moment the actual cilium-agent's own connection attempts were still timing out on the same node. Whatever's wrong is specific to the `config` init container's own outbound connection, not general host networking.

**4. Packet capture confirms it: the `config` init container is sourcing from the wrong IP.**

Since the debug pod and the real `cilium-agent` pod both run with `hostNetwork: true`, they share the exact same network namespace as the host — so a `tcpdump` in the debug pod captures the real cilium-agent's own packets. During a live retry cycle, we captured this (real public IP replaced with a documentation-range placeholder, `203.0.113.50`, for this post — the private addresses below are real and are all within our own cluster's private CIDR):

```
15:xx:xx.xxxxxx 203.0.113.50.41510 > 10.0.1.11.6443: Flags [S], seq ..., win 65280 ...
15:xx:xx.xxxxxx 203.0.113.50.41510 > 10.0.1.11.6443: Flags [S], seq ..., win 65280 ...   (retransmit, backoff ~1s)
15:xx:xx.xxxxxx 203.0.113.50.41510 > 10.0.1.11.6443: Flags [S], seq ..., win 65280 ...   (retransmit, backoff ~2s)
... (9 SYN retransmits total, standard TCP exponential backoff, zero replies ever)
15:xx:xx.xxxxxx 203.0.113.50.39414 > 10.0.1.10.6443: Flags [S], seq ..., win 65280 ...
... (same pattern against the second control-plane node, also zero replies)
```

`203.0.113.50` here is the **node's public IP** — the same one assigned directly to `enp193s0f0np0`, the interface that owns the default route. `10.0.1.10`/`10.0.1.11` are control-plane nodes' **private-network-only** addresses, never intended to be reachable from a public-sourced packet. There is no route back for a public-sourced SYN to a private-only destination in this topology, so the connection black-holes permanently — this matches the observed `i/o timeout` exactly, and explains why it never self-resolves: it's not transient, the source IP selection is simply wrong every single time.

For comparison, the successful `curl` test above (same node, same destinations) sourced correctly from the node's private IP (`10.0.3.x` on `vswitch.4003`) via normal kernel routing-table selection — the difference is entirely in how the source address gets chosen.

## Our working theory

With `devices` left unset, Cilium's auto-detection appears to select interface(s) based on which one owns the node's **default route** (`0.0.0.0/0`). On these dual-homed workers, that's the public-facing physical NIC (`enp193s0f0np0`), not the VLAN sub-interface (`vswitch.4003`) that kubelet/RKE2 uses as the node's actual `InternalIP`. Control-plane nodes never hit this because they don't have a second, competing default-route-owning interface — there's nothing for the auto-detection to get "wrong."

We suspect (but haven't confirmed from source) that whatever client the `config` init container / `cilium-dbg build-config` step uses to reach the API server explicitly binds its outbound connection's local address to this auto-detected device's IP, rather than leaving source-address selection to the kernel's normal routing table (which, as shown above, picks correctly on this same node for an unbound socket).

## Questions

1. Does this match a known failure mode — specifically, does the early bootstrap/`config`-init k8s-client path bind outbound connections to an auto-detected "primary" device IP rather than doing a normal unbound dial?
2. Is explicitly setting `devices` (e.g. pinning it to the VLAN/private interface only) the correct and complete fix for this topology, or is there a more specific/recommended option (e.g. an explicit `k8s-service-host`/`k8s-service-port` override to bypass ClusterIP-based bootstrapping entirely, or an IP auto-detection flag we should be setting instead)?
3. Is this expected to reproduce on a **fresh install** onto this same dual-homed topology too, or is it specifically an upgrade-path/DaemonSet-recreation issue?
4. Is there a way to make this deterministic/reliably reproducible on demand? We only ever hit it after a chart-version-triggered pod recreation, and only ever fixed it with a full node reboot (not a pod delete) — we don't yet understand why a reboot works when a pod recreation alone doesn't, if the root cause is really just device auto-detection at agent-start time.

Happy to provide full logs, `ip route`/`ip addr` output, and the full tcpdump capture if useful — trimmed here for readability.

**Comment by ECD5A** [comment]
The packet capture is useful, but it points to a different mechanism than `devices` auto-detection.

In v1.19.4, Cilium explicitly performs direct-routing/host-firewall device detection **after** the first successful API-server connection ([`daemon.go`](https://github.com/cilium/cilium/blob/v1.19.4/daemon/cmd/daemon.go#L165-L167)). Therefore the `build-config` init container cannot be binding this request to an already auto-detected device; it has not reached that stage yet.

However, `cilium-dbg build-config` is also not equivalent to an ordinary `curl`. Its Hive includes `hostfirewallbypass.Cell` ([`build-config.go`](https://github.com/cilium/cilium/blob/v1.19.4/cilium-dbg/cmd/build-config.go#L29-L34)). That cell defaults `enable-k8s-host-firewall-bypass` to true, and in this command there is no `DaemonConfig` to disable it. The resulting client dialer sets `SO_MARK` to Cilium's egress magic mark plus the reserved host identity on every API-server socket ([`bypass.go`](https://github.com/cilium/cilium/blob/v1.19.4/pkg/k8s/hostfirewallbypass/bypass.go#L30-L48)). The dialer itself has no `LocalAddr` ([`cell.go`](https://github.com/cilium/cilium/blob/v1.19.4/pkg/k8s/client/cell.go#L347-L363)), so Cilium is not explicitly binding the public address. The marked socket is taking a different policy-routing/netfilter/BPF path, which can result in a different source address.

That explains all three unusual observations at once:

- `curl` and `build-config` share the host network namespace but behave differently;
- the source address changes only for the Cilium client;
- deleting the Pod does not help, while rebooting does, because the relevant state is host-level routing/netfilter/BPF state rather than Pod state.

I would compare marked and unmarked routing before the next reboot:

```bash
ip rule show
ip route get 10.43.0.1
ip route get 10.43.0.1 mark 0x10b00
ip route get 10.0.1.10
ip route get 10.0.1.10 mark 0x10b00
```

`0x10b00` is the v1.19.4 mark produced by `MagicMarkEgress` (`0x0b00`) plus reserved host identity `1`. Also preserve `iptables-save`, `nft list ruleset`, `bpftool cgroup tree`, and the relevant `ip rule`/route tables before rebooting.

The decisive A/B test is to run the same `cilium-dbg build-config` invocation with its hidden flag disabled:

```bash
--enable-k8s-host-firewall-bypass=false
```

If that immediately makes the SYN use `10.0.3.x`, this is a reproducible Cilium bootstrap bug/interaction, not device auto-detection. The source locations above plus the two tcpdumps would make a strong bug report.

For the production mitigation, I would configure `k8sServiceHost`/`k8sServicePort` to a stable private API-server load-balancer or the supported node-local RKE2 API proxy. This deliberately avoids using the Kubernetes ClusterIP while Cilium itself is still bootstrapping; Cilium documents those values for exactly this bootstrap path. Pinning `devices: vswitch.4003` is not the first fix here: that configuration is resolved only after `build-config` succeeds, and selecting only the private VLAN could also unintentionally remove the public NIC from NodePort/load-balancer handling.
