### ISSUE TITLE
node ipset updates having inconsistent updates causing issues with masquerading

### ISSUE THREAD

**Issue by rahulait** [cilium/cilium#31251]
### Is there an existing issue for this?

- [X] I have searched the existing issues

### What happened?

We have a scenario where we have pub+priv ip on eth0 (172.XX and 192.168.XX) and another priv ip on eth1 (10.XX). We have cilium direct routing on eth1 and use it for pod-to-pod traffic. When the k8s cluster comes up for the first time, the internal ip in k get nodes is set to private of eth0. Cilium is then installed and it creates ciliumnode objects which show internal ip as 192.XX subnet ip. The ipset created also contains 192 addresses.
```
NAME                       STATUS   ROLES           AGE   VERSION   INTERNAL-IP       EXTERNAL-IP       OS-IMAGE             KERNEL-VERSION      CONTAINER-RUNTIME
rah1-control-plane-5vr7j   Ready    control-plane   8h    v1.29.2   192.168.137.121   172.234.198.56    Ubuntu 22.04.4 LTS   5.15.0-94-generic   containerd://1.7.2
rah1-control-plane-6xfrc   Ready    control-plane   8h    v1.29.2   192.168.137.151   172.233.219.103   Ubuntu 22.04.4 LTS   5.15.0-94-generic   containerd://1.7.2
rah1-control-plane-8g9rr   Ready    control-plane   8h    v1.29.2   192.168.137.48    172.234.198.53    Ubuntu 22.04.4 LTS   5.15.0-94-generic   containerd://1.7.2
...
...

root@rah1-control-plane-5vr7j:~# k get cn
NAME                       CILIUMINTERNALIP   INTERNALIP        AGE
rah1-control-plane-5vr7j   10.192.5.158       192.168.137.121   8h
rah1-control-plane-6xfrc   10.192.0.85        192.168.137.151   8h
rah1-control-plane-8g9rr   10.192.4.238       192.168.137.48    8h
rah1-md-0-dkbw2            10.192.3.20        192.168.137.43    8h
rah1-md-0-hw8vg            10.192.1.242       192.168.137.29    8h
rah1-md-0-n6std            10.192.2.108       192.168.137.44    8h

root@rah1-control-plane-5vr7j:~# ipset -L
Name: cilium_node_set_v4
Type: hash:ip
Revision: 5
Header: family inet hashsize 1024 maxelem 65536 bucketsize 12 initval 0x662b89b7
Size in memory: 440
References: 1
Number of entries: 6
Members:
192.168.137.43
192.168.137.29
192.168.137.121
192.168.137.151
192.168.137.48
192.168.137.44
```
We then have [cloud-controller-manager](https://kubernetes.io/docs/concepts/architecture/cloud-controller/) pod which comes up and tells k8s that internal ip is 10.XX ip and external is pub of eth0. Sample output:
```
root@rah1-control-plane-5vr7j:~# k get nodes -o wide
NAME                       STATUS   ROLES           AGE   VERSION   INTERNAL-IP   EXTERNAL-IP       OS-IMAGE             KERNEL-VERSION       CONTAINER-RUNTIME
rah1-control-plane-5vr7j   Ready    control-plane   15h   v1.29.2   10.0.0.7      172.234.198.56    Ubuntu 22.04.4 LTS   5.15.0-100-generic   containerd://1.7.2
rah1-control-plane-6xfrc   Ready    control-plane   16h   v1.29.2   10.0.0.2      172.233.219.103   Ubuntu 22.04.4 LTS   5.15.0-94-generic    containerd://1.7.2
rah1-control-plane-8g9rr   Ready    control-plane   16h   v1.29.2   10.0.0.6      172.234.198.53    Ubuntu 22.04.4 LTS   5.15.0-94-generic    containerd://1.7.2
...
...
```
Cilium doesn’t detect the change and the cilium daemonset needs to be restarted. Once we rollout restart the cilium daemonset, cilium updates the ciliumnode objects to use the new internal ip. “ipset on each node” also gets updated except for the node ip itself. We see the same pattern on all nodes and sometimes one or two node ips are not updated in an ipset. The node on which we run ipset -L never gets its ip updated in the ipset. We have seen this on all the nodes in the cluster.
```
root@rah1-control-plane-5vr7j:~# k get cn
NAME                       CILIUMINTERNALIP   INTERNALIP   AGE
rah1-control-plane-5vr7j   10.192.5.158       10.0.0.7     8h
rah1-control-plane-6xfrc   10.192.0.85        10.0.0.2     8h
rah1-control-plane-8g9rr   10.192.4.238       10.0.0.6     8h
rah1-md-0-dkbw2            10.192.3.20        10.0.0.4     8h
rah1-md-0-hw8vg            10.192.1.242       10.0.0.3     8h
rah1-md-0-n6std            10.192.2.108       10.0.0.5     8h

root@rah1-control-plane-5vr7j:~# ipset -L
Name: cilium_node_set_v4
Type: hash:ip
Revision: 5
Header: family inet hashsize 1024 maxelem 65536 bucketsize 12 initval 0x662b89b7
Size in memory: 520
References: 1
Number of entries: 8
Members:
10.0.0.3
10.0.0.4
192.168.137.121
10.0.0.2
10.0.0.5
192.168.137.48
10.0.0.6
10.0.0.7
```
ipset sample from another node in cluster:
```
root@rah1-md-0-n6std:~# ipset -L
Name: cilium_node_set_v4
Type: hash:ip
Revision: 5
Header: family inet hashsize 1024 maxelem 65536 bucketsize 12 initval 0x2626bd74
Size in memory: 480
References: 1
Number of entries: 7
Members:
10.0.0.2
10.0.0.7
10.0.0.3
10.0.0.4
192.168.137.44
10.0.0.6
10.0.0.5
```
To fix this, we have to reboot every node in the cluster. Once the nodes come back up, they have correct entries in ipset.
```
root@rah1-control-plane-5vr7j:~# uptime
 06:39:52 up 4 min,  1 user,  load average: 0.09, 0.07, 0.02
root@rah1-control-plane-5vr7j:~# ipset -L
Name: cilium_node_set_v4
Type: hash:ip
Revision: 5
Header: family inet hashsize 1024 maxelem 65536 bucketsize 12 initval 0x22002e16
Size in memory: 440
References: 1
Number of entries: 6
Members:
10.0.0.7
10.0.0.6
10.0.0.3
10.0.0.4
10.0.0.2
10.0.0.5
```
We are hitting an issue where pod(10.XX) -> 192 subnet traffic never gets masqueraded when it leaves eth0 even with ipv4 masquerade enabled in iptables mode.
```
06:04:00.158497 IP 10.192.2.208.51260 > 192.168.137.121.5999: Flags [S], seq 4205577441, win 64240, options [mss 1460,sackOK,TS val 2171511560 ecr 0,nop,wscale 7], length 0
06:04:01.170020 IP 10.192.2.208.51260 > 192.168.137.121.5999: Flags [S], seq 4205577441, win 64240, options [mss 1460,sackOK,TS val 2171512572 ecr 0,nop,wscale 7], length 0
```
Only after we reboot the nodes and ipset -L has only the 10.XX subnet entries, we see that the traffic gets properly masqueraded.
```
06:46:30.036391 IP 192.168.137.44.33172 > 192.168.137.121.5999: Flags [S], seq 1962386773, win 64240, options [mss 1460,sackOK,TS val 2174061438 ecr 0,nop,wscale 7], length 0
06:46:30.036789 IP 192.168.137.121.5999 > 192.168.137.44.33172: Flags [S.], seq 2814283932, ack 1962386774, win 65160, options [mss 1460,sackOK,TS val 135350407 ecr 2174061438,nop,wscale 7], length 0
```
And all cilium tests pass only after that (node reboot).
```
...............................................

✅ All 47 tests (663 actions) successful, 28 tests skipped, 0 scenarios skipped.
root@rah1-control-plane-5vr7j:~#
```

### Cilium Version
```
root@rah1-control-plane-8g9rr:/home/cilium# cilium version
Client: 1.15.1 a368c8f0 2024-02-14T22:16:57+00:00 go version go1.21.6 linux/amd64
Daemon: 1.15.1 a368c8f0 2024-02-14T22:16:57+00:00 go version go1.21.6 linux/amd64
root@rah1-control-plane-8g9rr:/home/cilium#
```
### Kernel Version
```
root@rah1-control-plane-5vr7j:~# uname -a
Linux rah1-control-plane-5vr7j 5.15.0-100-generic #110-Ubuntu SMP Wed Feb 7 13:27:48 UTC 2024 x86_64 x86_64 x86_64 GNU/Linux
root@rah1-control-plane-5vr7j:~#
```
### Kubernetes Version
```
root@rah1-control-plane-5vr7j:~# k version
Client Version: v1.29.2
Kustomize Version: v5.0.4-0.20230601165947-6ce0bf390ce3
Server Version: v1.29.2
root@rah1-control-plane-5vr7j:~#
```

### Cilium Users Document

- [ ] Are you a user of Cilium? Please add yourself to the [Users doc](https://github.com/cilium/cilium/blob/main/USERS.md)

### Code of Conduct

- [X] I agree to follow this project's Code of Conduct

**Comment by rahulait** [comment]
Looking closely, we see that previously, in a 6 node cluster, there were 6 entries. But if internal ip changes and cilium daemonset is restarted, the new ipset contains one or more additional incorrect entries. It fails to clean up correctly.
Before:
```
root@rah1-control-plane-5vr7j:~# ipset -L
Name: cilium_node_set_v4
Type: hash:ip
Revision: 5
Header: family inet hashsize 1024 maxelem 65536 bucketsize 12 initval 0x662b89b7
Size in memory: 440
References: 1
Number of entries: 6
Members:
192.168.137.43
192.168.137.29
192.168.137.121
192.168.137.151
192.168.137.48
192.168.137.44
```

After:
```
root@rah1-control-plane-5vr7j:~# ipset -L
Name: cilium_node_set_v4
Type: hash:ip
Revision: 5
Header: family inet hashsize 1024 maxelem 65536 bucketsize 12 initval 0x662b89b7
Size in memory: 520
References: 1
Number of entries: 8
Members:
10.0.0.3
10.0.0.4
192.168.137.121
10.0.0.2
10.0.0.5
192.168.137.48
10.0.0.6
10.0.0.7
```

There is a leak of atleast one ip in ipset of each node.

**Comment by rahulait** [comment]
Not sure if someone triaged this.
