### ISSUE TITLE
Unexpected Behavior with Cilium External Workloads together with WireGuard Encryption

### ISSUE THREAD

**Issue by jspaleta** [cilium/cilium#29677]
### Is there an existing issue for this?

- [X] I have searched the existing issues

### What happened?
Tested originally with Cilium 1.14.2, confirmed on 1.14.4 and 1.15.0-pre.3

The Cilium agent ipcache is failing to include the WireGuard key for the external workload, even though the wireguard configuration for all agents correctly establishes the external workload CiliumNode as a peer, and the CiliumNode resource corresponding to the external workload has the expected public key annotation. 

It appears, based on additional investigation (see comments for full record), that the external workload's CiliumEndPoint resource is created in a "special" fashion and is not associated with the external workloads CiliumNode and without that association the information concerning the encryption key is lost. The CEP's status object is missing the information concerning the node's encryption key.

This lack of association to a CiliumNode is also true for any CiliumEndpoint created as a CRD object, and not created by a running cilium-agent and then exported as a CRD.  There doesn't seem to be a way at present to manually create a CiliumEndpoint via a CRD resource that is associated with a CiliumNode.
  
This manifests differently in 1.14.x and 1.15.0-pre.X

In 1.14.x this results in a bifurcated communication for an HTTP request sent from the external workload to a service or pod. The request sent from the external workload to a pod on a worker node being encrypted while the response back to the external workload is unencrypted.

In 1.15.0-pre  this results in both request and response being sent over the unencrypted vxlan tunnel.

This change in behavior from 1.14.x to 1.15.0-pre.x is inline with control-plane node host network behavior under the influence of the default opt out label string. Except, changing the opt out string to allow WireGuard encrypted traffic from control-plane node host network, does not also allow WireGuard from the external workload. 

On 1.14.4 the external workload and cluster, ipcache disagrees about the encryptkey status of the external workload.
From external workload's pov
```
sudo cilium-dbg bpf ipcache get 192.168.1.28
192.168.1.28 maps to identity identity=1 encryptkey=255 tunnelendpoint=0.0.0.0
```

From cluster modes's POV
```
kubectl exec pod/cilium-jfw4t -n kube-system -- cilium bpf ipcache get 192.168.1.28
192.168.1.28 maps to identity identity=4483 encryptkey=0 tunnelendpoint=192.168.1.28
```

The CiliumNode resource associated with the external workload has the encryption key populated, but the associated CiliumEndPoint's status does not.

```
$ kubectl get cn/msi -o yaml
apiVersion: cilium.io/v2
kind: CiliumNode
metadata:
  annotations:
    network.cilium.io/wg-pub-key: JJk3IPipv7qJ5jkfzZDci3Sf0gO7um7Yws9c9Uk1t34=
  creationTimestamp: "2023-12-08T02:38:56Z"
  generation: 1
  labels:
    class: boba_fett
    io.cilium.k8s.policy.cluster: home-lab
    io.kubernetes.pod.name: msi
    io.kubernetes.pod.namespace: default
    org: bounty_hunters
  name: msi
  ownerReferences:
  - apiVersion: cilium.io/v2
    kind: CiliumExternalWorkload
    name: msi
    uid: d732ce15-4bad-4a3d-b089-8160e0b7061d
  resourceVersion: "1284070"
  uid: 1675cdd3-b35b-48a0-ab13-2d7272a82ffc
spec:
  addresses:
  - ip: 192.168.1.28
    type: InternalIP
  - ip: 10.192.1.5
    type: CiliumInternalIP
  alibaba-cloud: {}
  azure: {}
  encryption:
    key: 255 #### encryption.key is included here!
  eni: {}
  health: {}
  ingress: {}
  ipam:
    podCIDRs:
    - 10.192.1.4/30
    pools: {}
  nodeidentity: 1
status:
  alibaba-cloud: {}
  azure: {}
  eni: {}
  ipam:
    operator-status:
      error: allocator not configured for the requested CIDR 10.192.1.4/30


$ kubectl get cep/msi -o yaml
apiVersion: cilium.io/v2
kind: CiliumEndpoint
metadata:
  creationTimestamp: "2023-12-08T02:38:56Z"
  generation: 2
  labels:
    name: msi
  name: msi
  namespace: default
  ownerReferences:
  - apiVersion: cilium.io/v2
    kind: CiliumNode
    name: msi
    uid: 1675cdd3-b35b-48a0-ab13-2d7272a82ffc
  resourceVersion: "1284072"
  uid: 0f78f56f-7554-48ca-b582-f16d7c1e5331
status:
  encryption: {}  #### !!!!!!MISSING key=255
  id: 1
  identity:
    id: 52754
    labels:
    - k8s:class=boba_fett
    - k8s:io.cilium.k8s.policy.cluster=home-lab
    - k8s:io.kubernetes.pod.name=msi
    - k8s:io.kubernetes.pod.namespace=default
    - k8s:org=bounty_hunters
  networking:
    addressing:
    - ipv4: 192.168.1.28
    - ipv4: 10.192.1.5
    node: 192.168.1.28
  state: ready

```

Is this a problem with the metadata for the external workload's CiliumNode not populating fully?

the public key does show up in the CiliumNode K8s resource as an annotation, so the external workload is communicating it to the apiserver, but its just not propagating into the ipcache other agents nor in the status information for the endpoint.

### Current guesses as to underlying problem
1) Is there a bug/design issue with how the CEP generated for the CEW is created, such that it is unassociated with a CiliumNode.

2) Is there some logic misfiring that prevents ipcache syncing for performance reasons that isn't taking into account changes in encryption key? I'm suspicious that the "skip update" logic in ipcache upsert function is the villain here.
ref:

[cilium/pkg/ipcache/ipcache.go](https://github.com/cilium/cilium/blob/be9ba166089f886961509da8052c843a1fe79692/pkg/ipcache/ipcache.go#L330)

Line 330 in [be9ba16](https://github.com/cilium/cilium/commit/be9ba166089f886961509da8052c843a1fe79692)
 // Skip update if IP is already mapped to the given identity 

if I'm reading the logic right, any request to update the ipcache due to the node's encryption key changing would be thrown out. This could be my specific problem.

But I'm also concerned that this logic could cause problems in supported configurations with WireGuard enabled, where a node public key rolled in such a way that the "skip update" logic still fired. It's a little pathological but possible.

It feels like the "skip update" should also test to see if the key has changed.

I'll add comments concerning my differential diagnosis between the 1.14 and 1.15 binaries from the two trees and update the main description accordingly. If this will be fixed the fix will need to come in the 1.15 pre-release and head, the 1.14.x behavior is just a notable marker for reference because it sort of works there with the bifurcated communication.

### Cilium Version

cilium-cli: v0.15.11 compiled with go1.21.3 on linux/amd64
cilium image (default): v1.14.2
cilium image (stable): v1.14.4
cilium image (running): 1.14.2

### Kernel Version

CentOS Stream 9
Linux nuc-02 5.14.0-361.el9.x86_64 #1 SMP PREEMPT_DYNAMIC Thu Aug 24 13:40:45 UTC 2023 x86_64 x86_64 x86_64 GNU/Linux

### Kubernetes Version

Kustomize Version: v5.0.4-0.20230601165947-6ce0bf390ce3
Server Version: v1.28.3+k3s1

### Sysdump

[cilium-sysdump-20231206-091458.zip](https://github.com/cilium/cilium/files/13590014/cilium-sysdump-20231206-091458.zip)

### Relevant log output

```shell
Here's a example of a http request from the external workload that takes a bifricated path through the Cilium network.
The initial inbound request to the DeathStar service goes over the WireGuard tunnel interface, but the response goes over the unencrypted Cilium vxlan.

[jspaleta@mexternal-workload ~]$ curl -s -XPOST deathstar.default.svc.cluster.local/v1/request-landing
Ship landed


[jspaleta@worker-node ~]$ sudo tcpdump -vi cilium_wg0 "port 80"
dropped privs to tcpdump
tcpdump: listening on cilium_wg0, link-type RAW (Raw IP), snapshot length 262144 bytes
08:57:41.967818 IP (tos 0x0, ttl 64, id 52417, offset 0, flags [DF], proto TCP (6), length 60)
    10.192.1.5.46120 > 10.42.0.104.http: Flags [S], cksum 0xe66a (correct), seq 3563353577, win 64860, options [mss 1380,sackOK,TS val 480129741 ecr 0,nop,wscale 7], length 0
08:57:41.968367 IP (tos 0x0, ttl 64, id 52418, offset 0, flags [DF], proto TCP (6), length 52)
    10.192.1.5.46120 > 10.42.0.104.http: Flags [.], cksum 0xb398 (correct), ack 3950884482, win 507, options [nop,nop,TS val 480129741 ecr 3647136060], length 0
08:57:41.968445 IP (tos 0x0, ttl 64, id 52419, offset 0, flags [DF], proto TCP (6), length 170)
    10.192.1.5.46120 > 10.42.0.104.http: Flags [P.], cksum 0xeba5 (correct), seq 0:118, ack 1, win 507, options [nop,nop,TS val 480129742 ecr 3647136060], length 118: HTTP, length: 118
	POST /v1/request-landing HTTP/1.1
	Host: deathstar.default.svc.cluster.local
	User-Agent: curl/7.76.1
	Accept: */*

[jspaleta@worker-node ~]$ sudo tcpdump -vi cilium_vxlan "port 80"
dropped privs to tcpdump
tcpdump: listening on cilium_vxlan, link-type EN10MB (Ethernet), snapshot length 262144 bytes
08:57:41.967939 IP (tos 0x0, ttl 64, id 0, offset 0, flags [DF], proto TCP (6), length 60)
    10.42.0.104.http > 10.192.1.5.46120: Flags [S.], cksum 0x1685 (incorrect -> 0x8bee), seq 3950884481, ack 3563353578, win 64296, options [mss 1380,sackOK,TS val 3647136060 ecr 480129741,nop,wscale 7], length 0
08:57:41.968499 IP (tos 0x0, ttl 64, id 11508, offset 0, flags [DF], proto TCP (6), length 52)
    10.42.0.104.http > 10.192.1.5.46120: Flags [.], cksum 0x167d (incorrect -> 0xb326), ack 119, win 502, options [nop,nop,TS val 3647136060 ecr 480129742], length 0
08:57:41.969101 IP (tos 0x0, ttl 64, id 11509, offset 0, flags [DF], proto TCP (6), length 166)
    10.42.0.104.http > 10.192.1.5.46120: Flags [P.], cksum 0x16ef (incorrect -> 0x0570), seq 1:115, ack 119, win 502, options [nop,nop,TS val 3647136061 ecr 480129742], length 114: HTTP, length: 114
	HTTP/1.1 200 OK
	Content-Type: text/plain
	Date: Wed, 06 Dec 2023 17:57:41 GMT
	Content-Length: 12
	
	Ship landed


It looks like the public key for the external workload is being exported correctly...

[jspaleta@mexternal-workload ~]$ docker exec cilium cilium encrypt status
Encryption: Wireguard                 
Interface: cilium_wg0
	Public key: GiBPT5D+GetxL3mVKr2yMUi9dmsN/hKwZGBwJmHG41c=
	Number of peers: 2

[jspaleta@workstation ~ $] kubectl exec ds/cilium --namespace kube-system -- cilium encrypt status
Defaulted container "cilium-agent" out of: cilium-agent, config (init), mount-cgroup (init), apply-sysctl-overwrites (init), mount-bpf-fs (init), clean-cilium-state (init), install-cni-binaries (init)
Encryption: Wireguard                 
Interface: cilium_wg0
	Public key: t9T9QcBGeJsiFUED4fcFuwESwvDmqco1p6A2LkaBzGI=
	Number of peers: 2


kubectl get cn/msi -o yaml |grep network.cilium.io/wg-pub-key
    network.cilium.io/wg-pub-key: GiBPT5D+GetxL3mVKr2yMUi9dmsN/hKwZGBwJmHG41c=

kubectl get cn/nuc-01 -o yaml |grep network.cilium.io/wg-pub-key
    network.cilium.io/wg-pub-key: 1ZmFygJxSWjRY0lpnMN0/UFE5YJCIxSQ0vbJng7QjT0=

kubectl get cn/nuc-02 -o yaml |grep network.cilium.io/wg-pub-key
    network.cilium.io/wg-pub-key: t9T9QcBGeJsiFUED4fcFuwESwvDmqco1p6A2LkaBzGI=
```

### Anything else?

1. The combination of external workload(Beta feature) and wireGuard encryption(Beta feature) are documented as currently incompatible, so I don't expect this to be high priority issue. But its soooooo close to working. I'm hoping the underlying issue here is something simple. Prior to 1.14 the packets just got black-holed, so the bifurcation is actually progress!

2. In order to get WireGuard enabled on external workload I needed to adjust the install parameters for the external workload as the install script doesn't autodetect that encryption is enabled in the cluster.

External workload Cilium agent run under docker:
cilium-agent --join-cluster --bpf-lb-sock --enable-endpoint-health-checking=false --cluster-name home-lab --cluster-id 0 --kvstore etcd --kvstore-opt etcd.config=/var/lib/cilium/etcd/config.yaml --enable-l7-proxy=false --enable-wireguard=true --enable-ipv6=false --encrypt-node

Manually added CONFIG_OVERWRITES="--enable-l7-proxy=false --enable-wireguard=true --enable-ipv6=false --encrypt-node"

3. afaict the wireguard peering is working, all agents configure a wg tunnel with the external workload as a peer endpoint. It's only the bpf ipcache that isn't being updated to be made aware of the public key. 

### Code of Conduct

- [X] I agree to follow this project's Code of Conduct

**Comment by jspaleta** [comment]
it appears as if the http request is being handled the same way for both the external workload and the control-plane node. Just did a retest from the control-plane node host network to the death star service IP address and I see the same bifrication.  This is expected for the control-plane because by default, the encryption to the control-plane node is forbidden by the default NodeEncryptionOptOutLabels value.
Feels like its something going amiss with the logic around the NodeEncryptionOptOutLabels, but I can't be sure without more breadcrumbs.  Replacing the my 1.14 install with pre-release now, as if this will be fixed it will be fixed in devel not 1.14

**Comment by jspaleta** [comment]
Moving to the 1.15.0-pre.3  and my hopes are dashed it seems the almost working state of 1.14.2 no longer exists. 

Communication from the external workload to the wiregaurd enabled cluster has reverted back to 1.13 behavior. packets appear to be blackholed...cant even use dns service inside the cluster.

More interestingly,  testing from the kubernetes control-plane host network using 1.15.pre I'm no longer seeing bifurcation.  now from control-plane host network both the HTTP request and response go through the vxlan.

**Comment by jspaleta** [comment]
Using 1.15.0-pre.3  and it looks like the WireGuard tunnel is established.

From the external workload:
```
sudo cilium-dbg debuginfo --output json | jq .encryption
{
  "wireguard": {
    "interfaces": [
      {
        "listen-port": 51871,
        "name": "cilium_wg0",
        "peer-count": 2,
        "peers": [
          {
            "allowed-ips": [
              "192.168.1.26/32",
              "10.42.0.147/32",
              "10.42.0.33/32"
            ],
            "endpoint": "192.168.1.26:51871",
            "last-handshake-time": "2023-12-06T21:00:47.242Z",
            "public-key": "1ZmFygJxSWjRY0lpnMN0/UFE5YJCIxSQ0vbJng7QjT0=",
            "transfer-rx": 49764,
            "transfer-tx": 73100
          },
          {
            "allowed-ips": [
              "192.168.1.21/32",
              "10.42.1.197/32",
              "10.42.1.80/32"
            ],
            "endpoint": "192.168.1.21:51871",
            "last-handshake-time": "2023-12-06T21:01:02.151Z",
            "public-key": "t9T9QcBGeJsiFUED4fcFuwESwvDmqco1p6A2LkaBzGI=",
            "transfer-rx": 177372,
            "transfer-tx": 29044
          }
        ],
        "public-key": "Vd/WthZGeiYygDauBdDbnnHwYSX9BsjSQhk5IQAIgAo="
      }
    ],
    "node-encryption": "Enabled"
  }
}
```

From the cluster
```
kubectl exec ds/cilium --namespace kube-system -- cilium-dbg debuginfo --output json | jq .encryption
Defaulted container "cilium-agent" out of: cilium-agent, config (init), mount-cgroup (init), apply-sysctl-overwrites (init), mount-bpf-fs (init), clean-cilium-state (init), install-cni-binaries (init)
{
  "wireguard": {
    "interfaces": [
      {
        "listen-port": 51871,
        "name": "cilium_wg0",
        "peer-count": 2,
        "peers": [
          {
            "allowed-ips": [
              "192.168.1.21/32",
              "10.42.1.127/32",
              "10.42.1.74/32",
              "10.42.1.99/32",
              "10.42.1.197/32",
              "10.42.1.80/32"
            ],
            "endpoint": "192.168.1.21:51871",
            "last-handshake-time": "2023-12-06T21:04:02.186Z",
            "public-key": "t9T9QcBGeJsiFUED4fcFuwESwvDmqco1p6A2LkaBzGI=",
            "transfer-rx": 97882992,
            "transfer-tx": 269074624
          },
          {
            "allowed-ips": [
              "192.168.1.28/32",
              "10.192.1.6/32"
            ],
            "endpoint": "192.168.1.28:51871",
            "last-handshake-time": "2023-12-06T21:02:51.149Z",
            "public-key": "Vd/WthZGeiYygDauBdDbnnHwYSX9BsjSQhk5IQAIgAo=",
            "transfer-rx": 77168,
            "transfer-tx": 51984
          }
        ],
        "public-key": "1ZmFygJxSWjRY0lpnMN0/UFE5YJCIxSQ0vbJng7QjT0="
      }
    ],
    "node-encryption": "Enabled"
  }
}

```

**Comment by jspaleta** [comment]
Okay its crazier....
still on 1.15.0-pre.3
If I delete the external workload, uninstall cilium from it and then reinstall it...it starts communicating via cilium_vxlan to the pre-existing deathstar pod...even though cilium-dbg bpf ipcache tells me it should be using the cilium_wg0 tunnel.

```
[jspaleta@msi ~]$ sudo cilium-dbg bpf ipcache get 10.42.0.29
10.42.0.29 maps to identity identity=25254 encryptkey=255 tunnelendpoint=192.168.1.26

[jspaleta@msi ~]$ sudo cilium-dbg identity get 25254
ID      LABELS
25254   k8s:app.kubernetes.io/name=deathstar
        k8s:class=deathstar
        k8s:io.cilium.k8s.namespace.labels.kubernetes.io/metadata.name=default
        k8s:io.cilium.k8s.policy.cluster=home-lab
        k8s:io.cilium.k8s.policy.serviceaccount=default
        k8s:io.kubernetes.pod.namespace=default
        k8s:org=empire

[jspaleta@msi ~]$ curl --connect-timeout 10 -XPOST http://10.42.0.29/v1/request-landing
Ship landed

[jspaleta@msi ~]$ sudo tcpdump -vi cilium_wg0 "port 80"
dropped privs to tcpdump
tcpdump: listening on cilium_wg0, link-type RAW (Raw IP), snapshot length 262144 bytes
[jspaleta@msi ~]$ sudo tcpdump -vi cilium_vxlan "port 80"
dropped privs to tcpdump
tcpdump: listening on cilium_vxlan, link-type EN10MB (Ethernet), snapshot length 262144 bytes
13:52:26.768087 IP (tos 0x0, ttl 64, id 38421, offset 0, flags [DF], proto TCP (6), length 60)
    msi.49052 > 10-42-0-29.deathstar.default.svc.cluster.local.http: Flags [S], cksum 0x163b (incorrect -> 0x4111), seq 3096628410, win 64860, options [mss 1380,sackOK,TS val 3411862334 ecr 0,nop,wscale 7], length 0
13:52:26.768799 IP (tos 0x0, ttl 64, id 0, offset 0, flags [DF], proto TCP (6), length 60)
    10-42-0-29.deathstar.default.svc.cluster.local.http > msi.49052: Flags [S.], cksum 0xce1a (correct), seq 3176266954, ack 3096628411, win 64296, options [mss 1380,sackOK,TS val 1625971218 ecr 3411862334,nop,wscale 7], length 0
13:52:26.768910 IP (tos 0x0, ttl 64, id 38422, offset 0, flags [DF], proto TCP (6), length 52)
    msi.49052 > 10-42-0-29.deathstar.default.svc.cluster.local.http: Flags [.], cksum 0x1633 (incorrect -> 0xf5c3), ack 1, win 507, options [nop,nop,TS val 3411862335 ecr 1625971218], length 0
13:52:26.769084 IP (tos 0x0, ttl 64, id 38423, offset 0, flags [DF], proto TCP (6), length 145)
    msi.49052 > 10-42-0-29.deathstar.default.svc.cluster.local.http: Flags [P.], cksum 0x1690 (incorrect -> 0x3eb0), seq 1:94, ack 1, win 507, options [nop,nop,TS val 3411862335 ecr 1625971218], length 93: HTTP, length: 93
	POST /v1/request-landing HTTP/1.1
	Host: 10.42.0.29
	User-Agent: curl/7.76.1
	Accept: */*
	
13:52:26.769717 IP (tos 0x0, ttl 64, id 37801, offset 0, flags [DF], proto TCP (6), length 52)
    10-42-0-29.deathstar.default.svc.cluster.local.http > msi.49052: Flags [.], cksum 0xf56a (correct), ack 94, win 502, options [nop,nop,TS val 1625971219 ecr 3411862335], length 0
13:52:26.769821 IP (tos 0x0, ttl 64, id 37802, offset 0, flags [DF], proto TCP (6), length 166)
    10-42-0-29.deathstar.default.svc.cluster.local.http > msi.49052: Flags [P.], cksum 0x4db5 (correct), seq 1:115, ack 94, win 502, options [nop,nop,TS val 1625971219 ecr 3411862335], length 114: HTTP, length: 114
	HTTP/1.1 200 OK
	Content-Type: text/plain
	Date: Wed, 06 Dec 2023 22:52:26 GMT
	Content-Length: 12
	
	Ship landed

```

I expected it to use the wireguard tunnel.
More interestingly, the wireguard config on the external workload lists the pod IPs that I expect.

```
[jspaleta@msi ~]$ sudo cilium-dbg debuginfo --output json | jq .encryption
{
  "wireguard": {
    "interfaces": [
      {
        "listen-port": 51871,
        "name": "cilium_wg0",
        "peer-count": 2,
        "peers": [
          {
            "allowed-ips": [
              "192.168.1.26/32",
              "10.42.0.147/32",
              "10.42.0.33/32",
              "10.42.0.13/32",
              "10.42.0.205/32",
              "10.42.0.29/32",
              "10.42.0.93/32"
            ],
            "endpoint": "192.168.1.26:51871",
            "last-handshake-time": "2023-12-06T22:55:58.959Z",
            "public-key": "1ZmFygJxSWjRY0lpnMN0/UFE5YJCIxSQ0vbJng7QjT0=",
            "transfer-rx": 71004,
            "transfer-tx": 128196
          },
          {
            "allowed-ips": [
              "192.168.1.21/32",
              "10.42.1.197/32",
              "10.42.1.80/32",
              "10.42.1.127/32",
              "10.42.1.74/32",
              "10.42.1.99/32"
            ],
            "endpoint": "192.168.1.21:51871",
            "last-handshake-time": "2023-12-06T22:55:06.951Z",
            "public-key": "t9T9QcBGeJsiFUED4fcFuwESwvDmqco1p6A2LkaBzGI=",
            "transfer-rx": 430852,
            "transfer-tx": 53756
          }
        ],
        "public-key": "Vd/WthZGeiYygDauBdDbnnHwYSX9BsjSQhk5IQAIgAo="
      }
    ],
    "node-encryption": "Enabled"
  }
}

```
Seems like there are a couple of different bugs going on in 1.15.0-pre.3 that are muddying things.
First, everything seems to initialize correctly when the external workload is added but it appears that Cilium state updates aren't happening for the external workload when new pods are added.

If I delete and re-create the deathstar pod, giving it a new IP address... the external workload can not communicate with it. nor is the identity list on the external workload updated.

Its like the clustermesh apiserver isnt syncing with the cluster...that's troubling. I'll have to check that separately without wireguard enabled to baseline that behavior.

Second, there still something going on with the selection of the vxlan instead of the wireguard tunnel contrary to what the ipcache information is saying.

**Comment by jspaleta** [comment]
I'm suspicous of the "skip update" logic in ipcache upcert is the villain here.
ref:
https://github.com/cilium/cilium/blob/be9ba166089f886961509da8052c843a1fe79692/pkg/ipcache/ipcache.go#L330

if I'm reading the logic right, any request to update the ipcache due to the node's encryption key changing would be thrown out. This could be my specific problem.

But I'm also concerned that this logic could cause problems in supported configurations with WireGuard enabled, where a node public key rolled in such a way that the "skip update" logic still fired. It's a little pathological but possible.

It feels like the "skip update" should also test to see if the key has changed.

**Comment by jspaleta** [comment]
I would really love a debug log message for when the ipcache upsert skip update logic fires.

Now that've I've seen this logic, it could help me explain some other issues with external workloads I've experienced.

**Comment by jspaleta** [comment]
Just add more detail looking at the CiliumNode resource for the external workload and the spec.encryption.key field is set to 255 as expected... It really does seem like bpf ipcache for the cluster agents are failing to update for some reason.

But I'm confused as to why that may be. To see if the CiliumNode was being added then modified to add the key information in a way that would trigger the skip logic... I set a watch and created the external workload. The necessary encryption key information that ipcache needs appears to be there in the ADDED event. Still a mystery as to why ipcache isn't picking up the encryption key for the CiliumNode associated with the CiliumExtenalWorkload


```
$ curl -s http://localhost:8080/apis/cilium.io/v2/watch/ciliumnodes?resourceVersion=1278338
{"type":"ADDED","object":{"apiVersion":"cilium.io/v2","kind":"CiliumNode","metadata":{"annotations":{"network.cilium.io/wg-pub-key":"NC8j4Ltppv6alAcK6U0V4+8ZCa7fhwqKgWU4/yqh3nA="},"creationTimestamp":"2023-12-08T01:00:15Z","generation":1,"labels":{"class":"boba_fett","io.cilium.k8s.policy.cluster":"home-lab","io.kubernetes.pod.name":"msi","io.kubernetes.pod.namespace":"default","org":"bounty_hunters"},"managedFields":[{"apiVersion":"cilium.io/v2","fieldsType":"FieldsV1","fieldsV1":{"f:metadata":{"f:annotations":{".":{},"f:network.cilium.io/wg-pub-key":{}},"f:labels":{".":{},"f:class":{},"f:io.cilium.k8s.policy.cluster":{},"f:io.kubernetes.pod.name":{},"f:io.kubernetes.pod.namespace":{},"f:org":{}},"f:ownerReferences":{".":{},"k:{\"uid\":\"e558d768-e113-46b3-8484-a9f9b12e883c\"}":{}}},"f:spec":{".":{},"f:addresses":{},"f:alibaba-cloud":{},"f:azure":{},"f:encryption":{".":{},"f:key":{}},"f:eni":{},"f:health":{},"f:ingress":{},"f:ipam":{".":{},"f:podCIDRs":{},"f:pools":{}},"f:nodeidentity":{}}},"manager":"clustermesh-apiserver","operation":"Update","time":"2023-12-08T01:00:15Z"}],"name":"msi","ownerReferences":[{"apiVersion":"cilium.io/v2","kind":"CiliumExternalWorkload","name":"msi","uid":"e558d768-e113-46b3-8484-a9f9b12e883c"}],"resourceVersion":"1278499","uid":"168b97a8-fed2-45f6-bd74-27405706e4f4"},"spec":{"addresses":[{"ip":"192.168.1.28","type":"InternalIP"},{"ip":"10.192.1.5","type":"CiliumInternalIP"}],"alibaba-cloud":{},"azure":{},"encryption":{"key":255},"eni":{},"health":{},"ingress":{},"ipam":{"podCIDRs":["10.192.1.4/30"],"pools":{}},"nodeidentity":1}}}
{"type":"MODIFIED","object":{"apiVersion":"cilium.io/v2","kind":"CiliumNode","metadata":{"annotations":{"network.cilium.io/wg-pub-key":"NC8j4Ltppv6alAcK6U0V4+8ZCa7fhwqKgWU4/yqh3nA="},"creationTimestamp":"2023-12-08T01:00:15Z","generation":1,"labels":{"class":"boba_fett","io.cilium.k8s.policy.cluster":"home-lab","io.kubernetes.pod.name":"msi","io.kubernetes.pod.namespace":"default","org":"bounty_hunters"},"managedFields":[{"apiVersion":"cilium.io/v2","fieldsType":"FieldsV1","fieldsV1":{"f:status":{".":{},"f:alibaba-cloud":{},"f:azure":{},"f:eni":{},"f:ipam":{".":{},"f:operator-status":{".":{},"f:error":{}}}}},"manager":"cilium-operator-generic","operation":"Update","subresource":"status","time":"2023-12-08T01:00:15Z"},{"apiVersion":"cilium.io/v2","fieldsType":"FieldsV1","fieldsV1":{"f:metadata":{"f:annotations":{".":{},"f:network.cilium.io/wg-pub-key":{}},"f:labels":{".":{},"f:class":{},"f:io.cilium.k8s.policy.cluster":{},"f:io.kubernetes.pod.name":{},"f:io.kubernetes.pod.namespace":{},"f:org":{}},"f:ownerReferences":{".":{},"k:{\"uid\":\"e558d768-e113-46b3-8484-a9f9b12e883c\"}":{}}},"f:spec":{".":{},"f:addresses":{},"f:alibaba-cloud":{},"f:azure":{},"f:encryption":{".":{},"f:key":{}},"f:eni":{},"f:health":{},"f:ingress":{},"f:ipam":{".":{},"f:podCIDRs":{},"f:pools":{}},"f:nodeidentity":{}}},"manager":"clustermesh-apiserver","operation":"Update","time":"2023-12-08T01:00:15Z"}],"name":"msi","ownerReferences":[{"apiVersion":"cilium.io/v2","kind":"CiliumExternalWorkload","name":"msi","uid":"e558d768-e113-46b3-8484-a9f9b12e883c"}],"resourceVersion":"1278500","uid":"168b97a8-fed2-45f6-bd74-27405706e4f4"},"spec":{"addresses":[{"ip":"192.168.1.28","type":"InternalIP"},{"ip":"10.192.1.5","type":"CiliumInternalIP"}],"alibaba-cloud":{},"azure":{},"encryption":{"key":255},"eni":{},"health":{},"ingress":{},"ipam":{"podCIDRs":["10.192.1.4/30"],"pools":{}},"nodeidentity":1},"status":{"alibaba-cloud":{},"azure":{},"eni":{},"ipam":{"operator-status":{"error":"allocator not configured for the requested CIDR 10.192.1.4/30"}}}}}

```

a quick diff of the two json events...
```
diff -u a.json b.json 
--- a.json	2023-12-07 16:06:09.719456479 -0900
+++ b.json	2023-12-07 16:06:17.359468526 -0900
@@ -1,5 +1,5 @@
 {
-  "type": "ADDED",
+  "type": "MODIFIED",
   "object": {
     "apiVersion": "cilium.io/v2",
     "kind": "CiliumNode",
@@ -21,6 +21,29 @@
           "apiVersion": "cilium.io/v2",
           "fieldsType": "FieldsV1",
           "fieldsV1": {
+            "f:status": {
+              ".": {},
+              "f:alibaba-cloud": {},
+              "f:azure": {},
+              "f:eni": {},
+              "f:ipam": {
+                ".": {},
+                "f:operator-status": {
+                  ".": {},
+                  "f:error": {}
+                }
+              }
+            }
+          },
+          "manager": "cilium-operator-generic",
+          "operation": "Update",
+          "subresource": "status",
+          "time": "2023-12-08T01:00:15Z"
+        },
+        {
+          "apiVersion": "cilium.io/v2",
+          "fieldsType": "FieldsV1",
+          "fieldsV1": {
             "f:metadata": {
               "f:annotations": {
                 ".": {},
@@ -73,7 +96,7 @@
           "uid": "e558d768-e113-46b3-8484-a9f9b12e883c"
         }
       ],
-      "resourceVersion": "1278499",
+      "resourceVersion": "1278500",
       "uid": "168b97a8-fed2-45f6-bd74-27405706e4f4"
     },
     "spec": {
@@ -102,6 +125,16 @@
         "pools": {}
       },
       "nodeidentity": 1
+    },
+    "status": {
+      "alibaba-cloud": {},
+      "azure": {},
+      "eni": {},
+      "ipam": {
+        "operator-status": {
+          "error": "allocator not configured for the requested CIDR 10.192.1.4/30"
+        }
+      }
     }
   }
 }

```

Nothing obvious in the diff that I think would point to the skip update logic in ipcache misfiring, but I can't rule it out.

**Comment by jspaleta** [comment]
More info...
The CiliumEndPoint associated with the CiliumExternalWorkload is missing its encryption key information in its status.

```
$ kubectl get cep/msi -o json | jq .status.encryption
{}
```

Compare this with the pods running on the worker node, for example the xwing pod from the deathstar tutorial:
```
$ kubectl get cep/xwing -o json | jq .status.encryption
{
  "key": 255
}
```

Because external workloads are both nodes AND endpoints, its a little confusing as to the order of operations on how this gets populated and how it impacts bpf ipcache. My current understanding is the CiliumNode resource is the keeper of truth here, and that the missing encryption key in CiliumEndPoint status is perhaps just another symptom of the underlying problem.

**Comment by jspaleta** [comment]
Okay my brain wouldn't let me sleep last night...
the fact that the CiliumEndpoint status doesn't include the "key: 255" value is a smoking gun of sorts.

The status is only populated by the cilium-agent running on the external workload as the endpoint is created and then sent to the k8s kvstore, and because its an ExternalWorkload the kvstore is actually etcd as provided by the clustermesh apiserver running in the cluster.
And the k8s CRDs are created from that. So there's an extra layer to examine.



I need examine the node-local cilium API representation of the external workload endpoint and its associated etcd key/value information and compare to the CRD.

**Comment by jspaleta** [comment]
okay looking at the cilium api output now

on the external workload
```
sudo curl --unix-socket /var/run/cilium/cilium.sock http://localhost/v1/ip | jq .
...
  {
    "cidr": "192.168.1.28/32",
    "encryptKey": 255,
    "hostIP": "192.168.1.28",
    "identity": 1
  },
```
from the cluster
```
kubectl exec ds/cilium -n kube-system -- curl --unix-socket /var/run/cilium/cilium.sock http://localhost/v1/ip | jq .
...

  {
    "cidr": "192.168.1.28/32",
    "hostIP": "192.168.1.28",
    "identity": 52754,
    "metadata": {
      "name": "msi",
      "namespace": "default",
      "source": "custom-resource"
    }
  },
```  
It's interesting that the cluster side connects the ip address to the endpoint with identity 52754, but the external workload side connects it with identity 1 which is local host. I would have expected the cluster side to use identity 6 for remote-node instead of using the endpoint associated with the ip address. But external workloads are weird, they are sort of nodes and sort of endpoints.
But either way that encryptKey field should be there....
So i guess I need to look into the etcd key values in the apiserver

**Comment by jspaleta** [comment]
So it looks like the cluster agents are seeing the CiliumEndPoint associated with the CiliumExternalWorkload and choosing to map the IP address to that identity instead of the identity associated with the Ciliumnode.


Because the CiliumEndpoint is not actually associated with the node the encrypt.key field isn't populated.

If I delete the CiliumEndpoint CRD object the cluster's cilium API response looks like I expect

```
kubectl delete CiliumEndPoint/msi

kubectl exec pod/cilium-6wknr -n kube-system -- curl --unix-socket /var/run/cilium/cilium.sock http://localhost/v1/ip | jq .
...
  {
    "cidr": "192.168.1.28/32",
    "encryptKey": 255,
    "hostIP": "192.168.1.28",
    "identity": 6
  },

```
This matches what I expect from the external workload's cilium API!!!
```
sudo curl --unix-socket /var/run/cilium/cilium.sock http://localhost/v1/ip | jq .
...
  {
    "cidr": "192.168.1.28/32",
    "encryptKey": 255,
    "hostIP": "192.168.1.28",
    "identity": 1
  },
```
Identity 1 (local host) becomes Identity 6 (remote-node)

But the bpf ipcache on the cluster agent isn't updated to match

```
kubectl exec pod/cilium-6wknr -n kube-system -- cilium bpf ipcache get 192.168.1.28
192.168.1.28 maps to identity identity=6 encryptkey=0 tunnelendpoint=192.168.1.28
```
The identity updated but the encryptkey did not.

Because the CiliumEndpoint created as part of CiliumExternalWorkload first-time registration is not an endpoint object created on the external workload agent itself, it doesn't have the association to the CiliumNode's encryption state.

**Comment by jspaleta** [comment]
So it appears that right now there's no way to actually do an Cilium API lookup for the endpoint associated with the external workload.

The CEP k8s resource exists...
```
$ kubectl get cep
NAME                         SECURITY IDENTITY   ENDPOINT STATE   IPV4           IPV6
msi                          35648               ready            192.168.1.28   
deathstar-5df7cdc64c-f6kgr   48985               ready            10.42.0.233    
tiefighter                   43550               ready            10.42.0.248    
xwing                        49843               ready            10.42.0.69     


$ kubectl get cep/msi -o yaml
apiVersion: cilium.io/v2
kind: CiliumEndpoint
metadata:
  creationTimestamp: "2023-12-11T19:44:11Z"
  generation: 2
  labels:
    name: msi
  name: msi
  namespace: default
  ownerReferences:
  - apiVersion: cilium.io/v2
    kind: CiliumNode
    name: msi
    uid: c0e3cadd-795a-4f5f-87d2-5bd8c9975f72
  resourceVersion: "1572271"
  uid: 498e9632-2f90-43a4-9404-224f59795787
status:
  encryption: {}
  id: 1
  identity:
    id: 35648
    labels:
    - k8s:class=boba_fett
    - k8s:io.cilium.k8s.policy.cluster=home-lab
    - k8s:io.kubernetes.pod.name=msi
    - k8s:io.kubernetes.pod.namespace=default
    - k8s:org=bounty_hunters
  networking:
    addressing:
    - ipv4: 192.168.1.28
    - ipv4: 10.192.1.5
    node: 192.168.1.28
  state: ready

```
and in the cluster, the the ipcache is somehow matching on that cep

```
$ kubectl exec pod/cilium-8h5h5 -n kube-system -- curl --unix-socket /var/run/cilium/cilium.sock http://localhost/v1/ip | jq .
...
  {
    "cidr": "192.168.1.28/32",
    "hostIP": "192.168.1.28",
    "identity": 35648,
    "metadata": {
      "name": "msi",
      "namespace": "default",
      "source": "custom-resource"
    }
  },
```
But trying to find it using the Cilium API doesn't seem the work.  
```
$ kubectl exec pod/cilium-8h5h5 -n kube-system -- curl --unix-socket /var/run/cilium/cilium.sock http://localhost/v1/endpoint | jq . | grep msi

(no result)

$ kubectl exec pod/cilium-8h5h5 -n kube-system -- curl --unix-socket /var/run/cilium/cilium.sock http://localhost/v1/ip | jq .| grep tiefighter

          "name": "resolve-labels-default/tiefighter",
        "k8s-pod-name": "tiefighter",
        "pod-name": "default/tiefighter"
          "k8s:app.kubernetes.io/name=tiefighter",
          "k8s:class=tiefighter",
          "k8s:app.kubernetes.io/name=tiefighter",
          "k8s:class=tiefighter",
```


Even with the 1.15.0-pre.3 release that introduces the cep-name prefix doesn't find an endpoint (though I think that's a bug in the new cep-name handling that I need to file.)

And the cilium-global prefix is documented in the code as non-functional, so I'm not at present able to use the API to find any endpoint created as a CEP CRD and not created by a cilium node and exported to the kvstore.

**Comment by jspaleta** [comment]
Hmm I'm having a really hard time figuring out where in the codebase  the CiliumEndpoint created as part of CiliumExternalWorkload bring up is actually performed.

The only call to the Cilium API client CreateEndpoint using EndpointChangeRequest is in the Cilium CNI plugin code.. and that all makes sense.

The Cilium endpoint associated with the external workload must be done elsewhere using a different mechanism than the Cilium API,

**Comment by sjm42** [comment]
Well, I have ran into exactly this same issue. WG encryption with external vm half works.
I was able to confirm with tcpdump that vm->cluster goes thru WG and reply packets are coming back nonencrypted.

**Comment by jspaleta** [comment]
@sjm42   yeah there's a bug somewhere internal.  
I need to document a little more that I discovered with input from @joestringer to diagnos it a little further.
the metadata that indicates that encrypted path is available for the eternal workload endpoints isn't fully propagating.

**Comment by sashaozz** [comment]
/unstale

This is still relevant and very much awaited as so far we are not able to use External Workloads with Transparent Encryption.

**Comment by cccsss01** [comment]
Very interested in this as well

**Comment by jdaln** [comment]
Also interested in this getting more attention.

**Comment by sjm42** [comment]
Well uh, AFAIK this is still relevant and has interest on it, including myself.

**Comment by sjm42** [comment]
Well uh, AFAIK this is still relevant and has interest on it, including myself.

**Comment by joestringer** [comment]
Due to lack of ongoing forward progress on this beta feature, external workloads was deprecated in Cilium 1.17 ([docs](https://docs.cilium.io/en/v1.17/network/external-workloads/#external-workloads)), with removal scheduled in Cilium 1.18 (ETA mid 2025). Perhaps in future an alternative solution to this problem will be submitted, but for now the implementation is becoming difficult to maintain and there is not sufficient contribution to the area to justify keeping the functionality in the tree.
