### ISSUE TITLE
With Gateway API, the 3-way handshake fails when Envoy and the Backend Pod are running on the same Node.

### ISSUE THREAD

**Issue by chattytak** [cilium/cilium#47591]
### Is there an existing issue for this?

- https://github.com/cilium/cilium/issues/42325

### Version

equal or higher than v1.20.0 and lower than v1.21.0

### What happened?

It is structured as follows.
When the backend Pod and the assigned Envoy are on the same Node, 
the 3-way handshake between the Envoy and the Pod fails. 
As a result, the Envoy returns a 503 error to the client.
When the assigned Envoy and the backend Pod are on different Nodes, it works normally.

```mermaid
flowchart TD
    A[Client 192.168.0.10] -->|to 10.1.1.66| B[bgp router]
    B --> C[Envoy]
    B --> D[Envoy]
    B --> E[Envoy]

    subgraph cilium_host 10.0.1.12
      C -->|Failed| F[Backend 10.0.1.41]
    end

    subgraph cilium_host 10.0.2.183
      D -->|Success| F
    end

    subgraph cilium_host 10.0.0.179
      E -->|Success| F
    end
```

### Failed Pattern: [Client] -> [Backend Pod Running Node]
- hubble log
```
10.0.1.12:54518 (ingress) -> default/whoami-5996d44689-hhnw4:80 (ID:47342) to-endpoint FORWARDED (TCP Flags: SYN)
10.0.1.12:54518 (host) <- default/whoami-5996d44689-hhnw4:80 (ID:47342) to-stack FORWARDED (TCP Flags: SYN, ACK)
192.168.0.10:40936 (ingress) -> default/cilium-gateway-default-gateway:80 (world) http-request FORWARDED (HTTP/1.1 GET http://whoami.example.test/)
192.168.0.10:40936 (ingress) <- default/cilium-gateway-default-gateway:80 (world) http-response FORWARDED (HTTP/1.1 503 4999ms (GET http://whoami.example.test/))
10.0.1.12:54518 (host) <- default/whoami-5996d44689-hhnw4:80 (ID:47342) to-stack FORWARDED (TCP Flags: SYN, ACK)
10.0.1.12:54518 (host) -> default/whoami-5996d44689-hhnw4:80 (ID:47342) to-endpoint FORWARDED (TCP Flags: RST)
``` 

  - tcpdump (With a debug container attached to the envoy pod)
```
03:36:39.863257 eth0  In  IP 192.168.0.10.52434 > 10.1.1.66.80: Flags [S], seq 4261706409, win 64240, options [mss 1460,sackOK,TS val 451367369 ecr 0,nop,wscale 7], length 0
03:36:39.863267 cilium_net Out IP 192.168.0.10.52434 > 10.1.1.66.80: Flags [S], seq 4261706409, win 64240, options [mss 1460,sackOK,TS val 451367369 ecr 0,nop,wscale 7], length 0
03:36:39.863270 cilium_host In  IP 192.168.0.10.52434 > 10.1.1.66.80: Flags [S], seq 4261706409, win 64240, options [mss 1460,sackOK,TS val 451367369 ecr 0,nop,wscale 7], length 0
03:36:39.863327 eth0  Out IP 10.1.1.66.80 > 192.168.0.10.52434: Flags [S.], seq 1339676486, ack 4261706410, win 65160, options [mss 1460,sackOK,TS val 94404898 ecr 451367369,nop,wscale 7], length 0
03:36:39.863873 eth0  In  IP 192.168.0.10.52434 > 10.1.1.66.80: Flags [.], ack 1, win 502, options [nop,nop,TS val 451367370 ecr 94404898], length 0
03:36:39.863876 cilium_net Out IP 192.168.0.10.52434 > 10.1.1.66.80: Flags [.], ack 1, win 502, options [nop,nop,TS val 451367370 ecr 94404898], length 0
03:36:39.863878 eth0  In  IP 192.168.0.10.52434 > 10.1.1.66.80: Flags [P.], seq 1:84, ack 1, win 502, options [nop,nop,TS val 451367370 ecr 94404898], length 83: HTTP: GET / HTTP/1.1
03:36:39.863878 cilium_net Out IP 192.168.0.10.52434 > 10.1.1.66.80: Flags [P.], seq 1:84, ack 1, win 502, options [nop,nop,TS val 451367370 ecr 94404898], length 83: HTTP: GET / HTTP/1.1
03:36:39.863879 cilium_host In  IP 192.168.0.10.52434 > 10.1.1.66.80: Flags [.], ack 1, win 502, options [nop,nop,TS val 451367370 ecr 94404898], length 0
03:36:39.863922 cilium_host In  IP 192.168.0.10.52434 > 10.1.1.66.80: Flags [P.], seq 1:84, ack 1, win 502, options [nop,nop,TS val 451367370 ecr 94404898], length 83: HTTP: GET / HTTP/1.1
03:36:39.863951 eth0  Out IP 10.1.1.66.80 > 192.168.0.10.52434: Flags [.], ack 84, win 509, options [nop,nop,TS val 94404899 ecr 451367370], length 0
03:36:39.865005 lxc9a5a9b98cc14 Out IP 10.0.1.12.53236 > 10.0.1.41.80: Flags [S], seq 3239086413, win 64480, options [mss 1240,sackOK,TS val 2510293579 ecr 0,nop,wscale 7], length 0
03:36:39.865026 lxc9a5a9b98cc14 In  IP 10.0.1.41.80 > 10.0.1.12.53236: Flags [S.], seq 3547594077, ack 3239086414, win 65084, options [mss 1240,sackOK,TS val 1641961762 ecr 2510293579,nop,wscale 7], length 0
03:36:40.869815 lxc9a5a9b98cc14 Out IP 10.0.1.12.53236 > 10.0.1.41.80: Flags [S], seq 3239086413, win 64480, options [mss 1240,sackOK,TS val 2510294584 ecr 0,nop,wscale 7], length 0
03:36:40.869836 lxc9a5a9b98cc14 In  IP 10.0.1.41.80 > 10.0.1.12.53236: Flags [S.], seq 3547594077, ack 3239086414, win 65084, options [mss 1240,sackOK,TS val 1641962767 ecr 2510293579,nop,wscale 7], length 0
03:36:40.869857 lxc9a5a9b98cc14 In  IP 10.0.1.41.80 > 10.0.1.12.53236: Flags [S.], seq 3547594077, ack 3239086414, win 65084, options [mss 1240,sackOK,TS val 1641962767 ecr 2510293579,nop,wscale 7], length 0
03:36:41.893824 lxc9a5a9b98cc14 Out IP 10.0.1.12.53236 > 10.0.1.41.80: Flags [S], seq 3239086413, win 64480, options [mss 1240,sackOK,TS val 2510295608 ecr 0,nop,wscale 7], length 0
03:36:41.893870 lxc9a5a9b98cc14 In  IP 10.0.1.41.80 > 10.0.1.12.53236: Flags [S.], seq 3547594077, ack 3239086414, win 65084, options [mss 1240,sackOK,TS val 1641963791 ecr 2510293579,nop,wscale 7], length 0
03:36:42.918755 lxc9a5a9b98cc14 Out IP 10.0.1.12.53236 > 10.0.1.41.80: Flags [S], seq 3239086413, win 64480, options [mss 1240,sackOK,TS val 2510296633 ecr 0,nop,wscale 7], length 0
03:36:42.918781 lxc9a5a9b98cc14 In  IP 10.0.1.41.80 > 10.0.1.12.53236: Flags [S.], seq 3547594077, ack 3239086414, win 65084, options [mss 1240,sackOK,TS val 1641964816 ecr 2510293579,nop,wscale 7], length 0
03:36:43.941800 lxc9a5a9b98cc14 Out IP 10.0.1.12.53236 > 10.0.1.41.80: Flags [S], seq 3239086413, win 64480, options [mss 1240,sackOK,TS val 2510297656 ecr 0,nop,wscale 7], length 0
03:36:43.941828 lxc9a5a9b98cc14 In  IP 10.0.1.41.80 > 10.0.1.12.53236: Flags [S.], seq 3547594077, ack 3239086414, win 65084, options [mss 1240,sackOK,TS val 1641965839 ecr 2510293579,nop,wscale 7], length 0
03:36:44.864884 eth0  Out IP 10.1.1.66.80 > 192.168.0.10.52434: Flags [P.], seq 1:226, ack 84, win 509, options [nop,nop,TS val 94409900 ecr 451367370], length 225: HTTP: HTTP/1.1 503 Service Unavailable
03:36:44.866262 eth0  In  IP 192.168.0.10.52434 > 10.1.1.66.80: Flags [.], ack 226, win 501, options [nop,nop,TS val 451372372 ecr 94409900], length 0
03:36:44.866268 cilium_net Out IP 192.168.0.10.52434 > 10.1.1.66.80: Flags [.], ack 226, win 501, options [nop,nop,TS val 451372372 ecr 94409900], length 0
03:36:44.866270 cilium_host In  IP 192.168.0.10.52434 > 10.1.1.66.80: Flags [.], ack 226, win 501, options [nop,nop,TS val 451372372 ecr 94409900], length 0
03:36:44.866415 eth0  In  IP 192.168.0.10.52434 > 10.1.1.66.80: Flags [F.], seq 84, ack 226, win 501, options [nop,nop,TS val 451372373 ecr 94409900], length 0
03:36:44.866416 cilium_net Out IP 192.168.0.10.52434 > 10.1.1.66.80: Flags [F.], seq 84, ack 226, win 501, options [nop,nop,TS val 451372373 ecr 94409900], length 0
03:36:44.866417 cilium_host In  IP 192.168.0.10.52434 > 10.1.1.66.80: Flags [F.], seq 84, ack 226, win 501, options [nop,nop,TS val 451372373 ecr 94409900], length 0
03:36:44.866484 eth0  Out IP 10.1.1.66.80 > 192.168.0.10.52434: Flags [F.], seq 226, ack 85, win 509, options [nop,nop,TS val 94409901 ecr 451372373], length 0
03:36:44.867113 eth0  In  IP 192.168.0.10.52434 > 10.1.1.66.80: Flags [.], ack 227, win 501, options [nop,nop,TS val 451372373 ecr 94409901], length 0
03:36:44.867116 cilium_net Out IP 192.168.0.10.52434 > 10.1.1.66.80: Flags [.], ack 227, win 501, options [nop,nop,TS val 451372373 ecr 94409901], length 0
03:36:44.867118 cilium_host In  IP 192.168.0.10.52434 > 10.1.1.66.80: Flags [.], ack 227, win 501, options [nop,nop,TS val 451372373 ecr 94409901], length 0
03:36:45.989774 lxc9a5a9b98cc14 In  IP 10.0.1.41.80 > 10.0.1.12.53236: Flags [S.], seq 3547594077, ack 3239086414, win 65084, options [mss 1240,sackOK,TS val 1641967887 ecr 2510293579,nop,wscale 7], length 0
03:36:45.989834 lxc9a5a9b98cc14 Out IP 10.0.1.12.53236 > 10.0.1.41.80: Flags [R], seq 3239086414, win 0, length 0
```

### Success Pattern: [Client] -> [Other Node] -(vxlan)-> [Backend Pod Running Node]
- hubble log
```
10.0.2.89:38041 (ingress) <> default/whoami-5996d44689-hhnw4:80 (ID:47342) to-overlay FORWARDED (TCP Flags: SYN)
10.0.2.89:38041 (ingress) -> default/whoami-5996d44689-hhnw4:80 (ID:47342) to-endpoint FORWARDED (TCP Flags: SYN)
10.0.2.89:38041 (ingress) <- default/whoami-5996d44689-hhnw4:80 (ID:47342) to-overlay FORWARDED (TCP Flags: SYN, ACK)
10.0.2.89:38041 (ingress) <> default/whoami-5996d44689-hhnw4:80 (ID:47342) to-overlay FORWARDED (TCP Flags: ACK)
192.168.0.10:35352 (ingress) -> default/whoami-5996d44689-hhnw4:80 (ID:47342) http-request FORWARDED (HTTP/1.1 GET http://whoami.example.test/)
10.0.2.89:38041 (ingress) <> default/whoami-5996d44689-hhnw4:80 (ID:47342) to-overlay FORWARDED (TCP Flags: ACK, PSH)
10.0.2.89:38041 (ingress) -> default/whoami-5996d44689-hhnw4:80 (ID:47342) to-endpoint FORWARDED (TCP Flags: ACK)
10.0.2.89:38041 (ingress) -> default/whoami-5996d44689-hhnw4:80 (ID:47342) to-endpoint FORWARDED (TCP Flags: ACK, PSH)
10.0.2.89:38041 (ingress) <- default/whoami-5996d44689-hhnw4:80 (ID:47342) to-overlay FORWARDED (TCP Flags: ACK, PSH)
10.0.2.89:38041 (ingress) <> default/whoami-5996d44689-hhnw4:80 (ID:47342) to-overlay FORWARDED (TCP Flags: ACK)
192.168.0.10:35352 (ingress) <- default/whoami-5996d44689-hhnw4:80 (ID:47342) http-response FORWARDED (HTTP/1.1 200 2ms (GET http://whoami.example.test/))
``` 
- tcpdump (With a debug container attached to the envoy pod)
```
03:36:39.122650 cilium_vxlan P   IP 10.0.2.89.35631 > 10.0.1.41.80: Flags [S], seq 3170010198, win 65450, options [mss 1190,sackOK,TS val 4192566623 ecr 0,nop,wscale 7], length 0
03:36:39.122727 lxc9a5a9b98cc14 In  IP 10.0.1.41.80 > 10.0.2.89.35631: Flags [S.], seq 3994243639, ack 3170010199, win 64790, options [mss 1190,sackOK,TS val 420265790 ecr 4192566623,nop,wscale 7], length 0
03:36:39.122740 cilium_vxlan Out IP 10.0.1.41.80 > 10.0.2.89.35631: Flags [S.], seq 3994243639, ack 3170010199, win 64790, options [mss 1190,sackOK,TS val 420265790 ecr 4192566623,nop,wscale 7], length 0
03:36:39.123573 cilium_vxlan P   IP 10.0.2.89.35631 > 10.0.1.41.80: Flags [.], ack 1, win 512, options [nop,nop,TS val 4192566624 ecr 420265790], length 0
03:36:39.123871 cilium_vxlan P   IP 10.0.2.89.35631 > 10.0.1.41.80: Flags [P.], seq 1:216, ack 1, win 512, options [nop,nop,TS val 4192566625 ecr 420265790], length 215: HTTP: GET / HTTP/1.1
03:36:39.123901 lxc9a5a9b98cc14 In  IP 10.0.1.41.80 > 10.0.2.89.35631: Flags [.], ack 216, win 505, options [nop,nop,TS val 420265792 ecr 4192566625], length 0
03:36:39.123907 cilium_vxlan Out IP 10.0.1.41.80 > 10.0.2.89.35631: Flags [.], ack 216, win 505, options [nop,nop,TS val 420265792 ecr 4192566625], length 0
03:36:39.124182 lxc9a5a9b98cc14 In  IP 10.0.1.41.80 > 10.0.2.89.35631: Flags [P.], seq 1:462, ack 216, win 505, options [nop,nop,TS val 420265792 ecr 4192566625], length 461: HTTP: HTTP/1.1 200 OK
03:36:39.124197 cilium_vxlan Out IP 10.0.1.41.80 > 10.0.2.89.35631: Flags [P.], seq 1:462, ack 216, win 505, options [nop,nop,TS val 420265792 ecr 4192566625], length 461: HTTP: HTTP/1.1 200 OK
03:36:39.125517 cilium_vxlan P   IP 10.0.2.89.35631 > 10.0.1.41.80: Flags [.], ack 462, win 509, options [nop,nop,TS val 4192566626 ecr 420265792], length 0
```

### How can we reproduce the issue?

Using the Values below to deploy with Helm reproduces the issue 100% in my environment. 
In these Values, the elements specific to my environment that need to be communicated are..
The Node OS is AlmaLinux 10. 
Since the ip_tables module is not installed by default in AlmaLinux 10, I have installed kernel-modules-extra.
I use k0s as my Kubernetes distribution. k0s features a function called "node-local load balancer".
Using this feature, an Envoy-based load balancer is provided at the worker node's localhost:7443, 
providing redundancy for the KubeAPI ports of multiple control planes.
```
bgpControlPlane:
  enabled: true
hubble:
  relay:
    enabled: true
  ui:
    enabled: true
k8sServiceHost: localhost
k8sServicePort: 7443
kubeProxyReplacement: true
socketLB:
  enabled: true
  terminatePodConnections: true
  hostNamespaceOnly: true
operator:
  replicas: 1
bpf:
  tproxy: true
  masquerade: true
gatewayAPI:
  enabled: true
```

### Cilium Version

1.20.0

### Kernel Version

6.12.0-211.38.1.el10_2.x86_64_v2 #1 SMP PREEMPT_DYNAMIC Fri Jul 24 14:11:49 UTC 2026 x86_64 Linux

### Kubernetes Version

v1.36.2+k0s

### Relevant log output

```shell

```

### Cilium Users Document

- [ ] Are you a user of Cilium? Please add yourself to the [Users doc](https://github.com/cilium/cilium/blob/main/USERS.md)

### Code of Conduct

- [x] I agree to follow this project's Code of Conduct

**Comment by chattytak** [comment]
https://github.com/cilium/cilium/issues/42325

The way the Hubble logs are output is slightly different, so I'm not sure if it's the exact same phenomenon, but there is a similarity.

**Comment by pchaigno** [comment]
Thanks for the report! Did you try reproducing without BPF TPROXY (that feature isn't even documented so I wouldn't enable it) and BPF masquerading?

**Comment by chattytak** [comment]
While bpf.masquerade can be set to False without affecting operation, setting bpf.tproxy to False results in the following behavior:
```
15:31:41.294954 eth0  In  IP 192.168.0.10.39400 > 10.1.1.66.80: Flags [S], seq 2416879870, win 64240, options [mss 1460,sackOK,TS val 580668802 ecr 0,nop,wscale 7], length 0
15:31:41.294966 eth0  Out IP 10.1.1.66 > 192.168.0.10: ICMP 10.1.1.66 tcp port 80 unreachable, length 72
```

Looking at `iptables -L -n -t mangle`, it doesn't feel like it's working correctly.
```
# iptables -L -n -t mangle -v
Chain PREROUTING (policy ACCEPT 25M packets, 12G bytes)
 pkts bytes target     prot opt in     out     source               destination
 240K  135M CILIUM_PRE_mangle  all  --  *      *       0.0.0.0/0            0.0.0.0/0            /* cilium-feeder: CILIUM_PRE_mangle */

Chain INPUT (policy ACCEPT 0 packets, 0 bytes)
 pkts bytes target     prot opt in     out     source               destination

Chain FORWARD (policy ACCEPT 182K packets, 29M bytes)
 pkts bytes target     prot opt in     out     source               destination

Chain OUTPUT (policy ACCEPT 0 packets, 0 bytes)
 pkts bytes target     prot opt in     out     source               destination

Chain POSTROUTING (policy ACCEPT 27M packets, 15G bytes)
 pkts bytes target     prot opt in     out     source               destination
 258K  120M CILIUM_POST_mangle  all  --  *      *       0.0.0.0/0            0.0.0.0/0            /* cilium-feeder: CILIUM_POST_mangle */

Chain CILIUM_POST_mangle (1 references)
 pkts bytes target     prot opt in     out     source               destination

Chain CILIUM_PRE_mangle (1 references)
 pkts bytes target     prot opt in     out     source               destination
    0     0 MARK       all  --  *      !lo     0.0.0.0/0            0.0.0.0/0            socket --transparent mark match ! 0xe00/0xf00 mark match ! 0x800/0xf00 /* cilium: any->pod redirect proxied traffic to host proxy */ MARK set 0x200
    0     0 TPROXY     tcp  --  *      *       0.0.0.0/0            0.0.0.0/0            mark match 0xc9a50200 /* cilium: TPROXY to host cilium-dns-egress proxy */ TPROXY redirect 127.0.0.1:42441 mark 0x200/0xffffffff
    0     0 TPROXY     udp  --  *      *       0.0.0.0/0            0.0.0.0/0            mark match 0xc9a50200 /* cilium: TPROXY to host cilium-dns-egress proxy */ TPROXY redirect 127.0.0.1:42441 mark 0x200/0xffffffff

Chain KUBE-IPTABLES-HINT (0 references)
 pkts bytes target     prot opt in     out     source               destination

Chain KUBE-KUBELET-CANARY (0 references)
 pkts bytes target     prot opt in     out     source               destination
```

**Comment by pchaigno** [comment]
> While bpf.masquerade can be set to False without affecting operation, setting bpf.tproxy to False results in the following behavior:

I'd still recommend to debug this rather than BPF TPROXY, as the latter is really not stable.

What command did you use to capture this tcpdump output? It looks like the packet was somehow not redirected to TPROXY and went up the stack trying to find a socket. I'm wondering if it went through the appropriate BPF programs and received the expected packet mark. [pwru](https://github.com/cilium/pwru) might be better to figure this out.

> Looking at `iptables -L -n -t mangle`, it doesn't feel like it's working correctly.

Are you referring to the zero counters for the TPROXY rules or am I missing something?

**Comment by nezdolik** [comment]
I reproduced the same failure pattern on Cilium 1.20.0, k0s v1.36.2, AlmaLinux 10.2, and the reported kernel version.

MTU 1280 reproduced the report’s MSS values (1240 same-node, 1190 cross-node), but did not cause failures by itself.

The failure appeared when `rp_filter` was enabled on the backend-facing Cilium via:

```bash
sysctl -w net.ipv4.conf.<lxc-interface>.rp_filter=1
```

**Results:**
Same-node: repeated SYN/SYN-ACK, missing third ACK, HTTP 503 after 5 seconds.
Cross-node over VXLAN: HTTP 200.
Restoring rp_filter=0 immediately restored same-node HTTP 200.

@chattytak could you check these values on the affected node?
```
sysctl net.ipv4.conf.all.rp_filter
sysctl net.ipv4.conf.default.rp_filter
sysctl net.ipv4.conf.lxc9a5a9b98cc14.rp_filter
journalctl -k | grep -i martian
cat /etc/sysctl.d/99-zzz-override_cilium.conf
```

**Comment by chattytak** [comment]
@nezdolik 

rp_filter is disabled, so I imagine it's not the cause.

```
[root@sv-k0sw-01 ~]# tail -n +1 /proc/sys/net/ipv4/conf/*/rp_filter
==> /proc/sys/net/ipv4/conf/all/rp_filter <==
0

==> /proc/sys/net/ipv4/conf/cilium_host/rp_filter <==
0

==> /proc/sys/net/ipv4/conf/cilium_net/rp_filter <==
0

==> /proc/sys/net/ipv4/conf/cilium_vxlan/rp_filter <==
0

==> /proc/sys/net/ipv4/conf/default/rp_filter <==
1

==> /proc/sys/net/ipv4/conf/eth0/rp_filter <==
2

==> /proc/sys/net/ipv4/conf/lo/rp_filter <==
1

==> /proc/sys/net/ipv4/conf/lxc8958f7caddcc/rp_filter <==
0

==> /proc/sys/net/ipv4/conf/lxccf2859d7937d/rp_filter <==
0

==> /proc/sys/net/ipv4/conf/lxcea1251651c52/rp_filter <==
0

==> /proc/sys/net/ipv4/conf/lxcf27d46cf4a7d/rp_filter <==
0

==> /proc/sys/net/ipv4/conf/lxc_health/rp_filter <==
0

==> /proc/sys/net/ipv4/conf/wt0/rp_filter <==
1
[root@sv-k0sw-01 ~]#
[root@sv-k0sw-01 ~]# journalctl -k | grep -i martian
[root@sv-k0sw-01 ~]#
[root@sv-k0sw-01 ~]# cat /etc/sysctl.d/99-zzz-override_cilium.conf

# Disable rp_filter on Cilium interfaces since it may cause mangled packets to be dropped
-net.ipv4.conf.lxc*.rp_filter = 0
-net.ipv4.conf.cilium_*.rp_filter = 0
# The kernel uses max(conf.all, conf.{dev}) as its value, so we need to set .all. to 0 as well.
# Otherwise it will overrule the device specific settings.
net.ipv4.conf.all.rp_filter = 0
[root@sv-k0sw-01 ~]#
```

**Comment by chattytak** [comment]
@pchaigno 
I tried using pwru, but there is a massive amount of output and I don't know where to start investigating. 
The following drop messages are appearing.
Are there any messages here that might be useful for the investigation?

```
sk_skb_reason_drop(SKB_CONSUMED)
sk_skb_reason_drop(SKB_DROP_REASON_IP_LOCAL_SOURCE)
sk_skb_reason_drop(SKB_DROP_REASON_NOT_SPECIFIED)
```

**Comment by chattytak** [comment]
I have identified the cause. 
Upon investigating the `SKB_DROP_REASON_IP_LOCAL_SOURCE` message, I traced the issue back to the kernel parameter `net.ipv4.conf.all.src_valid_mark=1`. 
It appears that `src_valid_mark` is set to `True` by WireGuard or WireGuard-based VPN clients.
(it is reportedly necessary to enable `src_valid_mark` when using policy-based routing with `fwmark`.)
Since I have Netbird, a WireGuard-based VPN client, installed on the worker nodes, I checked `net.ipv4.conf.all.src_valid_mark` and confirmed it was indeed set to `True`.

https://github.com/tailscale/tailscale/issues/19796
An issue reported in the Tailscale (a WireGuard-based VPN) project noted that when this parameter is enabled, it causes Cilium's Envoy proxy to malfunction. 
According to this issue, setting `net.ipv4.conf.all.accept_local=1` allows packets from local source addresses, enabling Envoy to function even in environments where `src_valid_mark` is enabled. 

After actually executing `sysctl -w net.ipv4.conf.all.accept_local=1` on the worker nodes, the issue no longer occurred.

This issue arises from the compatibility between Cilium and WireGuard-based VPN clients. 
Since this is due to a lack of consideration on the part of the WireGuard-based VPN client, will Cilium not take any action? Or, as suggested in the Tailscale issue, will you distribute configurations like the one below on the Cilium side? 
If it is the former, I will unfortunately have to close this issue.

```
# /etc/sysctl.d/90-cilium-tproxy.conf
net.ipv4.conf.all.accept_local = 1
net.ipv4.conf.eno1.accept_local = 1
```
The sample provided in the Tailscale Issue explicitly set the eno1 interface to 1 in addition to "all," but my understanding is that this is likely unnecessary and specifying "all" should be sufficient.
In my actual testing, setting only `all` to 1 was sufficient. 
Theoretically, since the configuration values under `net.ipv4.conf` are applied as the result of an OR operation between the `all` value and the individual interface values, setting `all` to 1 should result in a value of 1 regardless of what the individual interface values are.

**Comment by nezdolik** [comment]
Thanks for the detailed investigation. This looks like the correct root cause.
With src_valid_mark=1, ipv4 source validation includes Cilium’s 0x200 proxy mark. The reverse lookup therefore selects Cilium’s table 2004, (with local catch-all route). The backend SYN-ACK arrives through the host-side lxc* interface, so Linux rejects it as SKB_DROP_REASON_IP_LOCAL_SOURCE while accept_local=0.
Enabling net.ipv4.conf.all.accept_local=1 by default sounds like a too broad fix (will be effective on each interface and relaxes source validation protection). For this particular failure the relevant interface is lxc*.
Could you confirm the narrower workaround by resetting the global setting and enabling it only on the backend’s host-side interface?
```
sysctl -w net.ipv4.conf.all.accept_local=0
sysctl -w net.ipv4.conf.<backend-lxc-interface>.accept_local=1
(then reset to 0 on interface level and validate that it fails again)
```
If that works, we could enable the option on Cilium managed endpoint interfaces only.

**Comment by chattytak** [comment]
I created and applied the following configuration, referring to the contents of `99-zzz-override_cilium.conf`.
Limiting the scope from `all` to `lxc*` yields the same effect, and the issue has been resolved.
Therefore, the only line that actually needs to be applied is `-net.ipv4.conf.lxc*.accept_local = 1`.

- Source
```
# cat /etc/sysctl.d/99-zzz-override_cilium.conf

# Disable rp_filter on Cilium interfaces since it may cause mangled packets to be dropped
-net.ipv4.conf.lxc*.rp_filter = 0
-net.ipv4.conf.cilium_*.rp_filter = 0
# The kernel uses max(conf.all, conf.{dev}) as its value, so we need to set .all. to 0 as well.
# Otherwise it will overrule the device specific settings.
net.ipv4.conf.all.rp_filter = 0
```
- New File
```
# cat /etc/sysctl.d/90-accept_local.conf
net.ipv4.conf.all.accept_local = 0
-net.ipv4.conf.lxc*.accept_local = 1
```

**Comment by nezdolik** [comment]
@cilium/sig-datapath any opinions on how to proceed on this? Should we just document the potential incompatibility for this Cilium+Tailscale case or distribute Cilium with  `net.ipv4.conf.lxc*.accept_local = 1` or smth else?

**Comment by chattytak** [comment]
Just for your reference, I use Netbird.
Since the control plane and worker nodes are located in different locations, they are interconnected via a WireGuard VPN.
This problem occurs because the Netbird client, like Tailscale, sets src_valid_mark=1.

This is strictly my personal opinion.
It has a proven track record of distributing and implementing workaround configurations for the rp_filter on lxc* interfaces.
In that case, to provide relief for src_valid_mark on lxc* interfaces, it would be more consistent to also distribute accept_local.
Since there is already an implementation, you just need to add one line.

Furthermore, it is unrealistic to expect Tailscale or Netbird developers to account for the fact that only lxc* must have `accept_local` enabled due to the transparent Envoy proxy implementation added by Cilium's unique routing design. 
Since Cilium is the one implementing the proxy, they should handle this responsibility through to the end.
