### ISSUE TITLE
Connections hanging when using L4LB server with Kubernetes NodePort

### ISSUE THREAD

**Issue by linecolumn** [cilium/cilium#14569]
Summary: when using in-front Kubernetes `L4LB` proxy (`IPVS-DR` or HaProxy), and pointing to Kubernetes Workers Nodeport endpoints all connections are hanging. 

- Cilium version `1.9.1` 
- Kernel version Linux `5.4.12`
- Orchestration system version in use Kubernetes `v1.19.6`

1. Install and configure `L4LB` (IPVS using DR) on server outside of Kubernetes cluster
2. Install Kubernetes Cluster with Cilium
3. Deploy PodInfo for the test, and use nodeport 32000 service
3. Check with curl if Nodeport is reachable directly from Kubernetes cluster and trough `L4LB` (IPVS-DR) server

Cilium Helm command line:

```
helm -f values.yaml install cilium cilium/cilium --version 1.9.1 --namespace kube-system \
	--set kubeProxyReplacement=strict \
	--set k8sServiceHost=192.168.1.61 \
	--set k8sServicePort=6443 \
	--set devices='{em1,em2,dummy0,dummy1,dummy2,dummy3}' \
	--set loadBalancer.mode=dsr \
	--set tunnel=disabled \
	--set autoDirectNodeRoutes=true
```

Cillium `values.yaml` file:

```
nativeRoutingCIDR: 10.250.0.0/15
ipam:
  mode: "kubernetes"
```

L4LB (IPVS-DR) and Kubernetes workers have:

`em1` - public IP interface, with default route to router
`em2` - private IP interface
`dummy[0..3]` - additional IPs used for Direct Routing

There is no firewall on the servers, and all servers have default gateway set to x.y.z.1 via em1 (default via x.y.z.1 dev em1 proto static metric 100).

All Kubernetes workers have following `sysctl` setup:

```
net.ipv4.conf.all.arp_ignore = 1
net.ipv4.conf.all.arp_announce = 2
net.ipv4.conf.all.rp_filter = 0
```

Cilium status:

```
KVStore:                Ok   Disabled
Kubernetes:             Ok   1.19 (v1.19.6) [linux/amd64]
Kubernetes APIs:        ["cilium/v2::CiliumClusterwideNetworkPolicy", "cilium/v2::CiliumEndpoint", "cilium/v2::CiliumNetworkPolicy", "cilium/v2::CiliumNode", "core/v1::Namespace", "core/v1::Node", "core/v1::Pods", "core/v1::Service", "discovery/v1beta1::EndpointSlice", "networking.k8s.io/v1::NetworkPolicy"]
KubeProxyReplacement:   Strict   [dummy1, dummy2, dummy3, em1, em2 (Direct Routing), dummy0]
Cilium:                 Ok       OK
Cilium health daemon:   Ok   
IPAM:                   IPv4: 36/255 allocated from 10.251.3.0/24, 
BandwidthManager:       Disabled
Host Routing:           Legacy
Masquerading:           BPF   [dummy1, dummy2, dummy3, em1, em2, dummy0]   10.250.0.0/15
Controller Status:      153/153 healthy
Proxy Status:           OK, ip 10.251.3.250, 0 redirects active on ports 10000-20000
Hubble:                 Ok              Current/Max Flows: 4096/4096 (100.00%), Flows/s: 64.07   Metrics: Disabled
Cluster health:         4/4 reachable   (2021-01-09T19:16:55Z)
KubeProxyReplacement Details:
  Status:              Strict
  Protocols:           TCP, UDP
  Devices:             dummy1, dummy2, dummy3, em1, em2 (Direct Routing), dummy0
  Mode:                DSR
  Backend Selection:   Random
  Session Affinity:    Enabled
  XDP Acceleration:    Disabled
  Services:
  - ClusterIP:      Enabled
  - NodePort:       Enabled (Range: 30000-32767) 
  - LoadBalancer:   Enabled 
  - externalIPs:    Enabled 
  - HostPort:       Enabled
```

Check that Cilium got IP from dummy interface and that it LB properly:

```
7    x.y.z.235:32000    NodePort       1 => 10.251.3.144:9898    
                                          2 => 10.251.3.186:9898    
                                          3 => 10.251.3.86:9898     
                                          4 => 10.251.0.209:9898    
                                          5 => 10.251.3.205:9898    
                                          6 => 10.251.3.13:9898     
                                          7 => 10.251.0.108:9898    
[...]
```

Check from Kubernetes worker connection to same public IP (on dummy interface):

```
$ curl x.y.z.235:32000
{
  "hostname": "demo4-7b9d848568-vqz6x",
  "version": "4.0.6",
[...]
```

Check from outside of the Kubernetes cluster to workers public IP:32000 (on em1 interface):

```
$ curl x.y.z.51:32000
{
  "hostname": "demo4-7b9d848568-xmmlr",
  "version": "4.0.6",
  "revision": "26a630c0b4b3452833d96c511d93f6f2d2e90a99",
[...]
```

Check from L4LB server to Kubernetes workers private IP:32000 (on em2 interface):

```
$ curl 192.168.1.51:32000
{
  "hostname": "demo4-7b9d848568-xmmlr",
  "version": "4.0.6",
  "revision": "26a630c0b4b3452833d96c511d93f6f2d2e90a99",
[...]
```

L4LB server is configured with LVS-DR to point to one Kubernetes node:

```
TCP  x.y.47.235:32000 rr
  -> 192.168.1.51:32000          Route   1      0          0         
```

When issuing connection test to `x.y.z.235:32000` connection hangs:

```
$ curl x.y.z.235:32000
[hanging]

$ telnet x.y.z.235 32000
Trying x.y.z.235...
```

Here is the tcpdump on L4LB fist public (em1) interface, then private (em2) interface:

```
em1 (public interface):
178.1.1.37.50420 > x.y.z.235.32000: Flags [S], seq 1197711353, win 64240, options [mss 1460,sackOK,TS val 2624708792 ecr 0,nop,wscale 7], length 0

em2 (private interface):
178.1.1.37.50436 > x.y.z.235.32000: Flags [S], seq 170496865, win 64240, options [mss 1460,sackOK,TS val 2624842757 ecr 0,nop,wscale 7], length 0
x.y.z.235.32000 > 178.1.1.37.50436: Flags [S.], seq 2626566312, ack 170496866, win 65535, options [mss 1460,sackOK,TS val 2147263360 ecr 2624835674,nop,wscale 12], length 0
```

at same time tcpdump on Kubernetes worker (192.168.1.51):

```
em1 (public interface):
nothing

em2 (private interface):
178.1.1.37.50470 > x.y.z.235.32000: Flags [S], seq 2970191994, win 64240, options [mss 1460,sackOK,TS val 2625104901 ecr 0,nop,wscale 7], length 0
**x.y.z.235.32000 > 178.1.1.37.50470: Flags [S.], seq 3928184192, ack 2970191995, win 65535, options [mss 1460,sackOK,TS val 1941990289 ecr 2625097757,nop,wscale 12], length 0**
```

It seems that DSR response from Kubernetes worker is getting lost on `em2` (private interface), instead to go via default route which is on `em1` (public interface).

**Comment by brb** [comment]
The dummy device hack should work only when accessing a service from the host which has those devices. It's not expected to work when accessed from outside.

Re DSR: check whether your underlying network does not drop requests with IPv4 options. From the tcpdump on the worker node I don't see any request to the service endpoint.

**Comment by linecolumn** [comment]
Let me describe more and copy paste tcpdump happenin on Kubernetes worker node:

`178.1.1.37` - Client IP
`x.y.z.235` - IP attached to dummy interface on Kubernetes worker, and anycasted on lo interface at L4LB (LVS-DR)

When initiating connection from `Client IP` to `x.y.z.235:32000` no packets arrives or goes out via Kubernetes workers `em1` (public interface).

Request arrives on Kubernetes Worker node (`178.1.1.37.50470 > x.y.z.235.32000`) via `em2` (private interface), which is okay as LVS is in DR mode. 

But response from Kubernetes Worker goes via `em2` and thus client never get any response (`x.y.z.235.32000 > 178.1.1.37.50470`).

If response can go via `em1`, where is default gateway, it should work.

```
em1 (public interface):
no requests

em2 (private interface):

178.1.1.37.50470 > x.y.z.235.32000: Flags [S], seq 2970191994, win 64240, options [mss 1460,sackOK,TS val 2625104901 ecr 0,nop,wscale 7], length 0
x.y.z.235.32000 > 178.1.1.37.50470: Flags [S.], seq 3928184192, ack 2970191995, win 65535, options [mss 1460,sackOK,TS val 1941990289 ecr 2625097757,nop,wscale 12], length 0
```

My use case is to utilize in front L4LBs with Anycasted public IPs + LVS-DR load balance traffic directly to Kubernetes Nodeport using Cilium and kube-proxy-replacement + eBPF/DSR. Hopefully there is solution as this should be quite common approach for on-premises traffic balancing.

**Comment by oldthreefeng** [comment]
@linecolumn  @borkmann   hello ， there are on more question about K8sServiceHost . If kuberetes is Ha cluster. not a single master node,  
what exactly for K8sServiceHost?   Ha control-palne  address like LB_HOST  or just  one of master Host address.

**Comment by brb** [comment]
@oldthreefeng HA control-plane LB address. Next time please ask such questions in a separate GH issue or on Cilium's slack, as it is unrelated to the current issue.
