### ISSUE TITLE
Envoy returns "upstream connect error or disconnect/reset before headers"

### ISSUE THREAD

**Issue by tgraf** [cilium/cilium#2666]
@jrajahalme I'm observing the following behaviour:

```
$ docker run -d --net cilium -l id.foo tgraf/netperf
$ cilium policy import ./l7.json
$ docker exec -ti e0ea107ec814 curl google.com/
upstream connect error or disconnect/reset before headers
[...]
```

Policy loaded
```
[{
  "labels": [{"key": "name", "value": "rule1"}],
  "endpointSelector": {"matchLabels": {"id.foo": ""}},
  "egress": [{
    "toPorts": [{
      "ports": [
        {"port": "80", "protocol": "TCP"}
      ],
      "rules": {
        "HTTP": [
          {
            "method": "GET",
            "path": "/"
          }
        ]
      }
    },{
      "ports": [
        {"port": "53", "protocol": "UDP"}
      ]
    }]
  }]
}]
```

Debug log:
```
Jan 28 03:55:34 cilium-master cilium-agent[25302]: level=debug msg="RDS_56326:egress:TCP:80_1: Access log message: timestamp:1517140534201396700 http_protocol:HTTP11 cilium_resource_name:\"RDS_56326:egress:TCP:80_1\" cilium_rule_ref:\"PathRegexp(\\\"/\\\") && MethodRegexp(\\\"GET\\\")\" source_security_id:264 source_address:\"10.11.129.91:53480\" destination_address:\"172.217.16.142:80\" scheme:\"http\" host:\"google.com\" path:\"/\" method:\"GET\" headers:<key:\"user-agent\" value:\"curl/7.52.1\" > headers:<key:\"accept\" value:\"*/*\" > headers:<key:\"x-request-id\" value:\"e284a5a4-2881-4e40-aeaa-ee69b2c8dffe\" > "
Jan 28 03:55:34 cilium-master cilium-agent[25302]: level=debug msg="Logging HTTP L7 flow record" code=0 header="map[User-Agent:[curl/7.52.1] Accept:[*/*] X-Request-Id:[e284a5a4-2881-4e40-aeaa-ee69b2c8dffe]]" method=GET protocol=HTTP/1.1 type=Request url="http://google.com/" verdict=Forwarded
Jan 28 03:55:35 cilium-master cilium-agent[25302]: level=debug msg="RDS_56326:egress:TCP:80_1: Access log message: timestamp:1517140535205457700 http_protocol:HTTP11 entry_type:Response cilium_resource_name:\"RDS_56326:egress:TCP:80_1\" cilium_rule_ref:\"PathRegexp(\\\"/\\\") && MethodRegexp(\\\"GET\\\")\" source_security_id:264 source_address:\"10.11.129.91:53480\" destination_address:\"172.217.16.142:80\" scheme:\"http\" host:\"google.com\" path:\"/\" method:\"GET\" status:503 headers:<key:\"user-agent\" value:\"curl/7.52.1\" > headers:<key:\"accept\" value:\"*/*\" > headers:<key:\"x-request-id\" value:\"e284a5a4-2881-4e40-aeaa-ee69b2c8dffe\" > "
Jan 28 03:55:35 cilium-master cilium-agent[25302]: level=debug msg="Logging HTTP L7 flow record" code=503 header="map[User-Agent:[curl/7.52.1] Accept:[*/*] X-Request-Id:[e284a5a4-2881-4e40-aeaa-ee69b2c8dffe]]" method=GET protocol=HTTP/1.1 type=Response url="http://google.com/" verdict=Forwarded
```

**Comment by jrajahalme** [comment]
It is an upstream connection timeout: 
```
[2018-01-31 20:09:59.708][27712][debug][pool] external/envoy/source/common/http/http1/conn_pool.cc:65] creating a new connection
[2018-01-31 20:09:59.708][27712][debug][client] external/envoy/source/common/http/codec_client.cc:23] [C4] connecting
[2018-01-31 20:09:59.708][27712][debug][connection] external/envoy/source/common/network/connection_impl.cc:543] [C4] connecting to 172.217.1.46:80
[2018-01-31 20:09:59.708][27712][debug][connection] external/envoy/source/common/network/connection_impl.cc:552] [C4] connection in progress
[2018-01-31 20:09:59.708][27712][debug][pool] external/envoy/source/common/http/http1/conn_pool.cc:91] queueing request due to no available connections
[2018-01-31 20:09:59.708][27709][debug][upstream] external/envoy/source/common/upstream/original_dst_cluster.cc:35] Adding host 172.217.1.46:80.
[2018-01-31 20:09:59.708][27710][debug][upstream] external/envoy/source/common/upstream/original_dst_cluster.cc:35] Adding host 172.217.1.46:80.
[2018-01-31 20:09:59.708][27711][debug][upstream] external/envoy/source/common/upstream/original_dst_cluster.cc:35] Adding host 172.217.1.46:80.
[2018-01-31 20:09:59.708][27699][debug][upstream] external/envoy/source/common/upstream/original_dst_cluster.cc:35] Adding host 172.217.1.46:80.
[2018-01-31 20:10:00.709][27712][debug][pool] external/envoy/source/common/http/http1/conn_pool.cc:313] [C4] connect timeout
[2018-01-31 20:10:00.709][27712][debug][connection] external/envoy/source/common/network/connection_impl.cc:144] [C4] closing data_to_write=0 type=1
[2018-01-31 20:10:00.709][27712][debug][connection] external/envoy/source/common/network/connection_impl.cc:177] [C4] closing socket: 1
[2018-01-31 20:10:00.709][27712][debug][client] external/envoy/source/common/http/codec_client.cc:70] [C4] disconnect. resetting 0 pending requests
[2018-01-31 20:10:00.709][27712][debug][pool] external/envoy/source/common/http/http1/conn_pool.cc:107] [C4] client disconnected
[2018-01-31 20:10:00.709][27712][debug][router] external/envoy/source/common/router/router.cc:456] [C3][S17103058144325641471] upstream reset
```
We have a connect timeout of one second:
```
					ConnectTimeout:  &duration.Duration{Seconds: 1, Nanos: 0},
```

However, no matter how much I increase this it still happens, which tells me that packets from the proxy to the world are not getting through, need see whats going on the monitor.

**Comment by tgraf** [comment]
> However, no matter how much I increase this it still happens, which tells me that packets from the proxy to the world are not getting through, need see whats going on the monitor.

OK, that makes sense. The policy does not allow egress to the outside world.

**Comment by jrajahalme** [comment]
Just verified on master as of Jan 4th that this same problem is there, and also when using golang proxy. With Oxy the proxy keeps trying for 2 minutes, but the host sends a RST on each SYN-ACK coming back:
```
tcpdump: listening on enp0s3, link-type EN10MB (Ethernet), capture size 262144 bytes
10:56:11.015634 IP (tos 0x0, ttl 63, id 3186, offset 0, flags [DF], proto TCP (6), length 60)
    10.0.2.15.41508 > 216.58.194.174.80: Flags [S], cksum 0xa726 (incorrect -> 0x44ca), seq 923831919, win 29200, options [mss 1460,sackOK,TS val 1868317 ecr 0,nop,wscale 7], length 0
10:56:11.031335 IP (tos 0x0, ttl 64, id 45321, offset 0, flags [none], proto TCP (6), length 44)
    216.58.194.174.80 > 10.0.2.15.41508: Flags [S.], cksum 0x4562 (correct), seq 969280001, ack 923831920, win 65535, options [mss 1460], length 0
10:56:11.031395 IP (tos 0x0, ttl 64, id 11001, offset 0, flags [DF], proto TCP (6), length 40)
    10.0.2.15.41508 > 216.58.194.174.80: Flags [R], cksum 0xa0f3 (correct), seq 923831920, win 0, length 0
10:56:12.016841 IP (tos 0x0, ttl 63, id 3187, offset 0, flags [DF], proto TCP (6), length 60)
    10.0.2.15.41508 > 216.58.194.174.80: Flags [S], cksum 0xa726 (incorrect -> 0x43cf), seq 923831919, win 29200, options [mss 1460,sackOK,TS val 1868568 ecr 0,nop,wscale 7], length 0
10:56:12.041160 IP (tos 0x0, ttl 64, id 45325, offset 0, flags [none], proto TCP (6), length 44)
    216.58.194.174.80 > 10.0.2.15.41508: Flags [S.], cksum 0x575f (correct), seq 969472001, ack 923831920, win 65535, options [mss 1460], length 0
10:56:12.041214 IP (tos 0x0, ttl 64, id 11194, offset 0, flags [DF], proto TCP (6), length 40)
    10.0.2.15.41508 > 216.58.194.174.80: Flags [R], cksum 0xa0f3 (correct), seq 923831920, win 0, length 0
10:56:14.032117 IP (tos 0x0, ttl 63, id 3188, offset 0, flags [DF], proto TCP (6), length 60)
    10.0.2.15.41508 > 216.58.194.174.80: Flags [S], cksum 0xa726 (incorrect -> 0x41d7), seq 923831919, win 29200, options [mss 1460,sackOK,TS val 1869072 ecr 0,nop,wscale 7], length 0
10:56:14.047087 IP (tos 0x0, ttl 64, id 45329, offset 0, flags [none], proto TCP (6), length 44)
    216.58.194.174.80 > 10.0.2.15.41508: Flags [S.], cksum 0x755a (correct), seq 969792001, ack 923831920, win 65535, options [mss 1460], length 0
10:56:14.047152 IP (tos 0x0, ttl 64, id 11588, offset 0, flags [DF], proto TCP (6), length 40)
    10.0.2.15.41508 > 216.58.194.174.80: Flags [R], cksum 0xa0f3 (correct), seq 923831920, win 0, length 0
```

**Comment by jrajahalme** [comment]
Same on db33c9340afaf726186dde57886586ac86b74b9b with Oxy proxy. I wonder if this has ever worked, or if the RST is introduced by a change in the Linux kernel?

To summarize:
1. Proxy initiates a new connection (TCP SYN) to the destination (google)
2. Google responds with a correct SYN-ACK (looks the same on tcpdump as the one w/o proxy)
3. Cilium host responds to Google with TCP RST.

Neither of 2. or 3. is visible in cilium monitor output, but 1. is.

This TCP-level bahavior is the same with both Go and Envoy proxies, but they manifest differently due to different timeouts and other proxy server behavior.

Currently I have no ideas on how to debug this further.

**Comment by jrajahalme** [comment]
Should have noticed your response a bit earlier :-)

How should the policy be modified to allow traffic to world?

**Comment by jrajahalme** [comment]
@tgraf IMO would be better drop traffic due to L3 before sending it to the proxy. And have the drop visible in cilium monitor :-)

**Comment by jrajahalme** [comment]
So the issue is that ToEntities and/or ToCIDR is not yet supported with ToPorts?

**Comment by tgraf** [comment]
> IMO would be better drop traffic due to L3 before sending it to the proxy. And have the drop visible in cilium monitor :-)

Agreed. This is what set me off and what made me initially believe this is a proxy bug.

> So the issue is that ToEntities and/or ToCIDR is not yet supported with ToPorts?

The policy did not contain a `toEntities: world`
