### ISSUE TITLE
IPv6 path MTU discovery for Service not working

### ISSUE THREAD

**Issue by jose-ledesma** [cilium/cilium#16080]
## Bug report
We are using Cilium in a Kubernetes cluster with IPv6 enabled. We found that certains IPv6 clients were having issues contacting with our services over IPv6.

The issue seems related the IPV6 path MTU discovery mechanism. We found that Cilium is not correctly processing the ICMPv6 Packet Too Big (type 2) packets.

This is a tcpdump showing the issue:

```
# tcpdump -i any -nn host  remote_host
tcpdump: verbose output suppressed, use -v or -vv for full protocol decode
listening on any, link-type LINUX_SLL (Linux cooked v1), capture size 262144 bytes

08:39:11.026408 IP6 remote_host.33453 > kubernetes_host.443: Flags [S], seq 41663, win 65535, options [mss 1440], length 0
08:39:11.026496 IP6 remote_host.33453 > kubernetes_pod.443: Flags [S], seq 41663, win 65535, options [mss 1440], length 0
08:39:11.026520 IP6 kubernetes_pod.443 > remote_host.33453: Flags [S.], seq 2815181787, ack 41664, win 64800, options [mss 1440], length 0
08:39:11.026532 IP6 kubernetes_host.443 > remote_host.33453: Flags [S.], seq 2815181787, ack 41664, win 64800, options [mss 1440], length 0
08:39:11.330524 IP6 remote_host.33453 > kubernetes_host.443: Flags [.], ack 1, win 65535, length 0
08:39:11.330616 IP6 remote_host.33453 > kubernetes_pod.443: Flags [.], ack 1, win 65535, length 0
08:39:11.340545 IP6 remote_host.33453 > kubernetes_host.443: Flags [.], seq 1:320, ack 1, win 65535, length 319
08:39:11.340609 IP6 remote_host.33453 > kubernetes_pod.443: Flags [.], seq 1:320, ack 1, win 65535, length 319
08:39:11.340639 IP6 kubernetes_pod.443 > remote_host.33453: Flags [.], ack 320, win 64481, length 0
08:39:11.340649 IP6 kubernetes_host.443 > remote_host.33453: Flags [.], ack 320, win 64481, length 0
08:39:11.341423 IP6 kubernetes_pod.443 > remote_host.33453: Flags [P.], seq 1:128, ack 320, win 64481, length 127
08:39:11.341444 IP6 kubernetes_host.443 > remote_host.33453: Flags [P.], seq 1:128, ack 320, win 64481, length 127
# here the packet size is 1440. remote_host never ack this packet
08:39:11.341559 IP6 kubernetes_pod.443 > remote_host.33453: Flags [.], seq 128:1568, ack 320, win 64481, length 1440
08:39:11.341566 IP6 kubernetes_host.443 > remote_host.33453: Flags [.], seq 128:1568, ack 320, win 64481, length 1440
08:39:11.644558 IP6 remote_host.33453 > kubernetes_host.443: Flags [.], ack 128, win 65535, length 0
08:39:11.644619 IP6 remote_host.33453 > kubernetes_pod.443: Flags [.], ack 128, win 65535, length 0
08:39:11.644645 IP6 kubernetes_pod.443 > remote_host.33453: Flags [P.], seq 1568:2737, ack 320, win 64481, length 1169
08:39:11.644665 IP6 kubernetes_host.443 > remote_host.33453: Flags [P.], seq 1568:2737, ack 320, win 64481, length 1169
# PTB ICMP6 packet 
08:39:11.652147 IP6 remote_host > kubernetes_host: ICMP6, packet too big, mtu 1280, length 1240
08:39:11.947741 IP6 remote_host.33453 > kubernetes_host.443: Flags [.], ack 128, win 65535, length 0
08:39:11.947815 IP6 remote_host.33453 > kubernetes_pod.443: Flags [.], ack 128, win 65535, length 0
08:39:12.589136 IP6 kubernetes_pod.443 > remote_host.33453: Flags [.], seq 128:1568, ack 320, win 64481, length 1440
08:39:12.589189 IP6 kubernetes_host.443 > remote_host.33453: Flags [.], seq 128:1568, ack 320, win 64481, length 1440
08:39:12.889577 IP6 remote_host > kubernetes_host: ICMP6, packet too big, mtu 1280, length 1240
08:39:14.445165 IP6 kubernetes_pod.443 > remote_host.33453: Flags [.], seq 128:1568, ack 320, win 64481, length 1440
08:39:14.445224 IP6 kubernetes_host.443 > remote_host.33453: Flags [.], seq 128:1568, ack 320, win 64481, length 1440
08:39:14.752866 IP6 remote_host > kubernetes_host: ICMP6, packet too big, mtu 1280, length 1240
08:39:18.317160 IP6 kubernetes_pod.443 > remote_host.33453: Flags [.], seq 128:1568, ack 320, win 64481, length 1440
08:39:18.317219 IP6 kubernetes_host.443 > remote_host.33453: Flags [.], seq 128:1568, ack 320, win 64481, length 1440
08:39:18.630860 IP6 remote_host > kubernetes_host: ICMP6, packet too big, mtu 1280, length 1240
08:39:25.741141 IP6 kubernetes_pod.443 > remote_host.33453: Flags [.], seq 128:1568, ack 320, win 64481, length 1440
08:39:25.741176 IP6 kubernetes_host.443 > remote_host.33453: Flags [.], seq 128:1568, ack 320, win 64481, length 1440
08:39:26.332100 IP6 kubernetes_pod.443 > remote_host.33453: Flags [F.], seq 2737, ack 320, win 64481, length 0
08:39:26.332131 IP6 kubernetes_host.443 > remote_host.33453: Flags [F.], seq 2737, ack 320, win 64481, length 0
08:39:26.635259 IP6 remote_host.33453 > kubernetes_host.443: Flags [R], seq 41983, win 0, length 0
08:39:26.635340 IP6 remote_host.33453 > kubernetes_pod.443: Flags [R], seq 41983, win 0, length 0
```

**General Information**

- Cilium version: 1.9.1
- Kernel version: Linux xxx 5.4.0-72-generic #80-Ubuntu SMP Mon Apr 12 17:35:00 UTC 2021 x86_64 x86_64 x86_64 GNU/Linux
- Orchestration system version in use: `Server Version: version.Info{Major:"1", Minor:"20", GitVersion:"v1.20.4+k3s-959758f7", GitCommit:"959758f7c8ced8bf6727876e625de19dd565b72e", GitTreeState:"clean", BuildDate:"2021-03-15T10:18:22Z", GoVersion:"go1.15.8", Compiler:"gc", Platform:"linux/amd64"}`

**How to reproduce the issue**

1. On a Kubernetes IPv6 create an internet-facing service
2. Try to connect to such service forcing path mtu discovery (we used: https://wand.net.nz/pmtud/webserver.php )

**Comment by jose-ledesma** [comment]
It seems there was a similar issue for IPv4 here: https://github.com/cilium/cilium/issues/8129, although we have network policies disabled

**Comment by jose-ledesma** [comment]
I just tested Path MTU discovery with latest Cilium version (v1.14.2) and it still fails

**Comment by GeorgFoc** [comment]
I can confirm that Path MTU discovery does not work for Cilium v1.14.5 which is really a problem for us.

**Comment by julianwiedmann** [comment]
I believe this comes down to what's described [here](https://github.com/cilium/cilium/issues/34380#issuecomment-2288570604) - the KPR code currently doesn't forward such ICMP packets to the backend.

**Comment by Nikhil77Sharma** [comment]
@julianwiedmann @msune , we planning for this as part of dual stack 1.17, as this is part of Comcast requirements

**Comment by msune** [comment]
Related: https://github.com/cilium/cilium/pull/40405
