### ISSUE TITLE
Egress gateway does not work on EKS with CNI Overlay

### ISSUE THREAD

**Issue by justinas-b** [cilium/cilium#29605]
### Is there an existing issue for this?

- [X] I have searched the existing issues

### What happened?

Hey! I am assessing feasibility to use `cilium` as an egress filter for all workloads hosted on kuberentes, however when using CNI overlay (on top of AWS VPC CNI), my pods cannot reach any resources when routed trough egress gateway.

I am installing `cilium` through helm chart:

```
helm install cilium cilium/cilium --version 1.14.3 \
   --namespace cilium \
   --set egressGateway.enabled=true \
   --set bpf.masquerade=true \
   --set kubeProxyReplacement=true \
   --set l7Proxy=false \
   --set cni.chainingMode=aws-cni
```

On EKS. o have two node pools - `main` for all microservices, and `egress` pool which should be used explicitly to allow egress traffic only. I have deployed `CiliumEgressGatewayPolicy` which should route all traffic where destination is `1.1.1.1` originating from pods labeled with `egress: "yes"` through worker node with `eks.amazonaws.com/nodegroup: egress` label:

```
apiVersion: cilium.io/v2
kind: CiliumEgressGatewayPolicy
metadata:
  name: egress
spec:
  destinationCIDRs:
  - 1.1.1.1/32
  egressGateway:
    nodeSelector:
      matchLabels:
        eks.amazonaws.com/nodegroup: egress
  selectors:
  - podSelector:
      matchLabels:
        egress: "yes"
```

In `cilium` I can see that egress route is propagated:
```
root@ip-10-45-177-134:/home/cilium# cilium bpf egress list
Source IP      Destination CIDR   Egress IP   Gateway IP
10.45.178.27   1.1.1.1/32         0.0.0.0     10.45.171.51
```

When i initiate connection from the pod labeled with `egress: "yes"`, i am getting timeout and cannot reach the external resource through egress gateway (it works if i delete egress policy):
```
netshoot1:~# nc -zvw3 1.1.1.1 53
nc: connect to 1.1.1.1 port 53 (tcp) timed out: Operation in progress
```

On egress gateway itself i can see that traffic it is being routed through it, but for some reason response is not sent back to the pod which initiates the connection:
```
oot@ip-10-45-171-51:/home/cilium# tcpdump -n | grep '1.1.1.1'
tcpdump: verbose output suppressed, use -v[v]... for full protocol decode
listening on eth0, link-type EN10MB (Ethernet), snapshot length 262144 bytes
IP 10.45.178.27.51078 > 1.1.1.1.53: Flags [S], seq 3829763245, win 62727, options [mss 8961,sackOK,TS val 466473320 ecr 0,nop,wscale 7], length 0
14:15:25.396968 IP 10.45.171.51.50549 > 1.1.1.1.53: Flags [S], seq 3829763245, win 62727, options [mss 8961,sackOK,TS val 466473320 ecr 0,nop,wscale 7], length 0
14:15:25.399594 IP 1.1.1.1.53 > 10.45.171.51.50549: Flags [S.], seq 1197347832, ack 3829763246, win 65160, options [mss 1460,sackOK,TS val 568331799 ecr 466473320,nop,wscale 13], length 0
14:15:25.399660 IP 1.1.1.1.53 > 10.45.178.27.51078: Flags [S.], seq 1197347832, ack 3829763246, win 65160, options [mss 1460,sackOK,TS val 568331799 ecr 466473320,nop,wscale 13], length 0
14:15:26.405787 IP 1.1.1.1.53 > 10.45.171.51.50549: Flags [S.], seq 1197347832, ack 3829763246, win 65160, options [mss 1460,sackOK,TS val 568332806 ecr 466473320,nop,wscale 13], length 0
14:15:26.405848 IP 1.1.1.1.53 > 10.45.178.27.51078: Flags [S.], seq 1197347832, ack 3829763246, win 65160, options [mss 1460,sackOK,TS val 568332806 ecr 466473320,nop,wscale 13], length 0
IP 10.45.178.27.51078 > 1.1.1.1.53: Flags [S], seq 3829763245, win 62727, options [mss 8961,sackOK,TS val 466474334 ecr 0,nop,wscale 7], length 0
14:15:26.410451 IP 10.45.171.51.50549 > 1.1.1.1.53: Flags [S], seq 3829763245, win 62727, options [mss 8961,sackOK,TS val 466474334 ecr 0,nop,wscale 7], length 0
14:15:26.412921 IP 1.1.1.1.53 > 10.45.171.51.50549: Flags [S.], seq 1197347832, ack 3829763246, win 65160, options [mss 1460,sackOK,TS val 568332813 ecr 466473320,nop,wscale 13], length 0
14:15:26.412956 IP 1.1.1.1.53 > 10.45.178.27.51078: Flags [S.], seq 1197347832, ack 3829763246, win 65160, options [mss 1460,sackOK,TS val 568332813 ecr 466473320,nop,wscale 13], length 0
```

### Cilium Version

```
root@ip-10-45-171-51:/home/cilium# cilium version
Client: 1.14.3 252a99ef 2023-10-18T18:21:56+03:00 go version go1.20.10 linux/amd64
Daemon: 1.14.3 252a99ef 2023-10-18T18:21:56+03:00 go version go1.20.10 linux/amd64
```

Same happens on v1.14.4

### Kernel Version

```
root@ip-10-45-171-51:/home/cilium# uname -r
5.10.198-187.748.amzn2.x86_64
```

### Kubernetes Version

v1.24.17-eks-4f4795d

### Sysdump

[cilium-sysdump-20231204-160322.zip](https://github.com/cilium/cilium/files/13546905/cilium-sysdump-20231204-160322.zip)

### Anything else?

`10.45.178.27` - my test pod IP address
`10.45.171.51` - egress gateway's IP address

There is no `ciliumnetworkpolicies` nor `ciliumclusterwidenetworkpolicies` deployed.

I have v1.11.5 for AWS VPC CNI deployed:
```
❯ kubectl -n kube-system get ds/aws-node -o json | jq -r '.spec.template.spec.containers[0].image'
602401143452.dkr.ecr.eu-west-2.amazonaws.com/amazon-k8s-cni:v1.11.5-eksbuild.1
```

### Code of Conduct

- [X] I agree to follow this project's Code of Conduct

**Comment by justinas-b** [comment]
Nether below configuration works 👀 i am wondering if this is a misconfiguration on my side, or is it a bug?

```sh
helm upgrade cilium cilium/cilium --version 1.14.3 \
   --namespace cilium \
   --set egressGateway.enabled=true \
   --set bpf.masquerade=true \
   --set kubeProxyReplacement=true \
   --set l7Proxy=false \
   --set cni.chainingMode=aws-cni \
   --set cni.exclusive=false \
   --set enableIPv4Masquerade=true \
   --set ipv4NativeRoutingCIDR=172.20.0.0/16 \
   --set routingMode=native
```

I have found https://github.com/cilium/cilium/issues/29363 but i am not sure if this is related or not, as for me it does not work ether with v1.14.3

**Comment by justinas-b** [comment]
```
helm upgrade cilium cilium/cilium --version 1.14.3 \
   --namespace cilium \
   --set egressGateway.enabled=true \
   --set bpf.masquerade=true \
   --set kubeProxyReplacement=true \
   --set l7Proxy=false \
   --set cni.chainingMode=aws-cni \
   --set cni.exclusive=false \
   --set enableIPv4Masquerade=true \
   --set ipam.mode=eni \
   --set eni.awsReleaseExcessIPs=true\
   --set eni.enabled=true \
   --set egressGateway.installRoutes=true
```

I am playing with different configs, but nether of it works 🙄 with above configuration i am getting following output on connectivity test

```
❯ cilium connectivity test -n cilium
ℹ️  Monitor aggregation detected, will skip some flow validation steps
ℹ️  Skipping tests that require a node Without Cilium
⌛ [arn:aws:eks:us-east-1:123456789012:cluster/dev-eks] Waiting for deployment cilium-test/client to become ready...
⌛ [arn:aws:eks:us-east-1:123456789012:cluster/dev-eks] Waiting for deployment cilium-test/client2 to become ready...
⌛ [arn:aws:eks:us-east-1:123456789012:cluster/dev-eks] Waiting for deployment cilium-test/echo-same-node to become ready...
⌛ [arn:aws:eks:us-east-1:123456789012:cluster/dev-eks] Waiting for deployment cilium-test/echo-other-node to become ready...
⌛ [arn:aws:eks:us-east-1:123456789012:cluster/dev-eks] Waiting for CiliumEndpoint for pod cilium-test/client-996668d96-4spvn to appear...
⌛ [arn:aws:eks:us-east-1:123456789012:cluster/dev-eks] Waiting for CiliumEndpoint for pod cilium-test/client2-84c66894fd-mt7jp to appear...
⌛ [arn:aws:eks:us-east-1:123456789012:cluster/dev-eks] Waiting for pod cilium-test/client-996668d96-4spvn to reach DNS server on cilium-test/echo-same-node-778f495746-p5lhk pod...
⌛ [arn:aws:eks:us-east-1:123456789012:cluster/dev-eks] Waiting for pod cilium-test/client2-84c66894fd-mt7jp to reach DNS server on cilium-test/echo-same-node-778f495746-p5lhk pod...
⌛ [arn:aws:eks:us-east-1:123456789012:cluster/dev-eks] Waiting for pod cilium-test/client2-84c66894fd-mt7jp to reach DNS server on cilium-test/echo-other-node-666d8db686-5d4x8 pod...
⌛ [arn:aws:eks:us-east-1:123456789012:cluster/dev-eks] Waiting for pod cilium-test/client-996668d96-4spvn to reach DNS server on cilium-test/echo-other-node-666d8db686-5d4x8 pod...
⌛ [arn:aws:eks:us-east-1:123456789012:cluster/dev-eks] Waiting for pod cilium-test/client-996668d96-4spvn to reach default/kubernetes service...
⌛ [arn:aws:eks:us-east-1:123456789012:cluster/dev-eks] Waiting for pod cilium-test/client2-84c66894fd-mt7jp to reach default/kubernetes service...
⌛ [arn:aws:eks:us-east-1:123456789012:cluster/dev-eks] Waiting for CiliumEndpoint for pod cilium-test/echo-other-node-666d8db686-5d4x8 to appear...
⌛ [arn:aws:eks:us-east-1:123456789012:cluster/dev-eks] Waiting for CiliumEndpoint for pod cilium-test/echo-same-node-778f495746-p5lhk to appear...
⌛ [arn:aws:eks:us-east-1:123456789012:cluster/dev-eks] Waiting for Service cilium-test/echo-other-node to become ready...
connectivity test failed: timeout reached waiting for service cilium-test/echo-other-node (last error: error with exec request (pod=cilium-test/client-996668d96-4spvn, container=): context deadline exceeded)
```

**Comment by justinas-b** [comment]
If i run connectivity test using below helm values:
```
helm install cilium cilium/cilium --version 1.14.3 \
   --namespace cilium \
   --set egressGateway.enabled=true \
   --set bpf.masquerade=true \
   --set kubeProxyReplacement=true \
   --set l7Proxy=false \
   --set cni.chainingMode=aws-cni
```
Connectivity test looks like this:
```
cilium connectivity test -n cilium
ℹ️  Monitor aggregation detected, will skip some flow validation steps
✨ [arn:aws:eks:us-east-1:123456789012:cluster/dev-eks] Creating namespace cilium-test for connectivity check...
✨ [arn:aws:eks:us-east-1:123456789012:cluster/dev-eks] Deploying echo-same-node service...
✨ [arn:aws:eks:us-east-1:123456789012:cluster/dev-eks] Deploying DNS test server configmap...
✨ [arn:aws:eks:us-east-1:123456789012:cluster/dev-eks] Deploying same-node deployment...
✨ [arn:aws:eks:us-east-1:123456789012:cluster/dev-eks] Deploying client deployment...
✨ [arn:aws:eks:us-east-1:123456789012:cluster/dev-eks] Deploying client2 deployment...
✨ [arn:aws:eks:us-east-1:123456789012:cluster/dev-eks] Deploying echo-other-node service...
✨ [arn:aws:eks:us-east-1:123456789012:cluster/dev-eks] Deploying other-node deployment...
✨ [host-netns] Deploying arn:aws:eks:us-east-1:123456789012:cluster/dev-eks daemonset...
✨ [host-netns-non-cilium] Deploying arn:aws:eks:us-east-1:123456789012:cluster/dev-eks daemonset...
ℹ️  Skipping tests that require a node Without Cilium
⌛ [arn:aws:eks:us-east-1:123456789012:cluster/dev-eks] Waiting for deployment cilium-test/client to become ready...
⌛ [arn:aws:eks:us-east-1:123456789012:cluster/dev-eks] Waiting for deployment cilium-test/client2 to become ready...
⌛ [arn:aws:eks:us-east-1:123456789012:cluster/dev-eks] Waiting for deployment cilium-test/echo-same-node to become ready...
⌛ [arn:aws:eks:us-east-1:123456789012:cluster/dev-eks] Waiting for deployment cilium-test/echo-other-node to become ready...
⌛ [arn:aws:eks:us-east-1:123456789012:cluster/dev-eks] Waiting for CiliumEndpoint for pod cilium-test/client-996668d96-kw6fb to appear...
⌛ [arn:aws:eks:us-east-1:123456789012:cluster/dev-eks] Waiting for CiliumEndpoint for pod cilium-test/client2-84c66894fd-nbxpw to appear...
⌛ [arn:aws:eks:us-east-1:123456789012:cluster/dev-eks] Waiting for pod cilium-test/client2-84c66894fd-nbxpw to reach DNS server on cilium-test/echo-same-node-778f495746-m9ncg pod...
⌛ [arn:aws:eks:us-east-1:123456789012:cluster/dev-eks] Waiting for pod cilium-test/client-996668d96-kw6fb to reach DNS server on cilium-test/echo-same-node-778f495746-m9ncg pod...
⌛ [arn:aws:eks:us-east-1:123456789012:cluster/dev-eks] Waiting for pod cilium-test/client-996668d96-kw6fb to reach DNS server on cilium-test/echo-other-node-666d8db686-s4vwz pod...
⌛ [arn:aws:eks:us-east-1:123456789012:cluster/dev-eks] Waiting for pod cilium-test/client2-84c66894fd-nbxpw to reach DNS server on cilium-test/echo-other-node-666d8db686-s4vwz pod...
⌛ [arn:aws:eks:us-east-1:123456789012:cluster/dev-eks] Waiting for pod cilium-test/client-996668d96-kw6fb to reach default/kubernetes service...
⌛ [arn:aws:eks:us-east-1:123456789012:cluster/dev-eks] Waiting for pod cilium-test/client2-84c66894fd-nbxpw to reach default/kubernetes service...
⌛ [arn:aws:eks:us-east-1:123456789012:cluster/dev-eks] Waiting for CiliumEndpoint for pod cilium-test/echo-other-node-666d8db686-s4vwz to appear...
⌛ [arn:aws:eks:us-east-1:123456789012:cluster/dev-eks] Waiting for CiliumEndpoint for pod cilium-test/echo-same-node-778f495746-m9ncg to appear...
⌛ [arn:aws:eks:us-east-1:123456789012:cluster/dev-eks] Waiting for Service cilium-test/echo-other-node to become ready...
⌛ [arn:aws:eks:us-east-1:123456789012:cluster/dev-eks] Waiting for Service cilium-test/echo-other-node to be synchronized by Cilium pod cilium/cilium-79l9k
⌛ [arn:aws:eks:us-east-1:123456789012:cluster/dev-eks] Waiting for Service cilium-test/echo-same-node to become ready...
⌛ [arn:aws:eks:us-east-1:123456789012:cluster/dev-eks] Waiting for Service cilium-test/echo-same-node to be synchronized by Cilium pod cilium/cilium-79l9k
⌛ [arn:aws:eks:us-east-1:123456789012:cluster/dev-eks] Waiting for NodePort 10.45.161.80:30359 (cilium-test/echo-other-node) to become ready...
⌛ [arn:aws:eks:us-east-1:123456789012:cluster/dev-eks] Waiting for NodePort 10.45.161.80:30916 (cilium-test/echo-same-node) to become ready...
⌛ [arn:aws:eks:us-east-1:123456789012:cluster/dev-eks] Waiting for NodePort 10.45.168.253:30359 (cilium-test/echo-other-node) to become ready...
⌛ [arn:aws:eks:us-east-1:123456789012:cluster/dev-eks] Waiting for NodePort 10.45.168.253:30916 (cilium-test/echo-same-node) to become ready...
⌛ [arn:aws:eks:us-east-1:123456789012:cluster/dev-eks] Waiting for NodePort 10.45.177.134:30359 (cilium-test/echo-other-node) to become ready...
⌛ [arn:aws:eks:us-east-1:123456789012:cluster/dev-eks] Waiting for NodePort 10.45.177.134:30916 (cilium-test/echo-same-node) to become ready...
⌛ [arn:aws:eks:us-east-1:123456789012:cluster/dev-eks] Waiting for NodePort 10.45.171.51:30359 (cilium-test/echo-other-node) to become ready...
⌛ [arn:aws:eks:us-east-1:123456789012:cluster/dev-eks] Waiting for NodePort 10.45.171.51:30916 (cilium-test/echo-same-node) to become ready...
ℹ️  Skipping IPCache check
🔭 Enabling Hubble telescope...
⚠️  Unable to contact Hubble Relay, disabling Hubble telescope and flow validation: rpc error: code = Unavailable desc = connection error: desc = "transport: Error while dialing: dial tcp [::1]:4245: connect: connection refused"
ℹ️  Expose Relay locally with:
   cilium hubble enable
   cilium hubble port-forward&
ℹ️  Cilium version: 1.14.3
🏃 Running 58 tests ...
[=] Test [no-policies] [1/58]
.......
  [-] Scenario [no-policies/pod-to-pod]
  [.] Action [no-policies/pod-to-pod/curl-ipv4-0: cilium-test/client-996668d96-kw6fb (10.45.169.135) -> cilium-test/echo-other-node-666d8db686-s4vwz (10.45.161.92:8080)]
  [.] Action [no-policies/pod-to-pod/curl-ipv4-1: cilium-test/client-996668d96-kw6fb (10.45.169.135) -> cilium-test/echo-same-node-778f495746-m9ncg (10.45.171.109:8080)]
  [.] Action [no-policies/pod-to-pod/curl-ipv4-2: cilium-test/client2-84c66894fd-nbxpw (10.45.171.169) -> cilium-test/echo-other-node-666d8db686-s4vwz (10.45.161.92:8080)]
  [.] Action [no-policies/pod-to-pod/curl-ipv4-3: cilium-test/client2-84c66894fd-nbxpw (10.45.171.169) -> cilium-test/echo-same-node-778f495746-m9ncg (10.45.171.109:8080)]
  [-] Scenario [no-policies/client-to-client]
  [.] Action [no-policies/client-to-client/ping-ipv4-0: cilium-test/client-996668d96-kw6fb (10.45.169.135) -> cilium-test/client2-84c66894fd-nbxpw (10.45.171.169:0)]
  [.] Action [no-policies/client-to-client/ping-ipv4-1: cilium-test/client2-84c66894fd-nbxpw (10.45.171.169) -> cilium-test/client-996668d96-kw6fb (10.45.169.135:0)]
  [-] Scenario [no-policies/pod-to-service]
  [.] Action [no-policies/pod-to-service/curl-0: cilium-test/client-996668d96-kw6fb (10.45.169.135) -> cilium-test/echo-other-node (echo-other-node.cilium-test:8080)]
  ❌ command "curl -w %{local_ip}:%{local_port} -> %{remote_ip}:%{remote_port} = %{response_code} --silent --fail --show-error --output /dev/null --connect-timeout 2 --max-time 10 http://echo-other-node.cilium-test:8080" failed: error with exec request (pod=cilium-test/client-996668d96-kw6fb, container=client): command terminated with exit code 28
  ℹ️  curl output:


  📄 No flows recorded for peer cilium-test/client-996668d96-kw6fb during action curl-0
  📄 No flows recorded for peer cilium-test/echo-other-node during action curl-0
  [.] Action [no-policies/pod-to-service/curl-1: cilium-test/client-996668d96-kw6fb (10.45.169.135) -> cilium-test/echo-same-node (echo-same-node.cilium-test:8080)]
  ❌ command "curl -w %{local_ip}:%{local_port} -> %{remote_ip}:%{remote_port} = %{response_code} --silent --fail --show-error --output /dev/null --connect-timeout 2 --max-time 10 http://echo-same-node.cilium-test:8080" failed: error with exec request (pod=cilium-test/client-996668d96-kw6fb, container=client): command terminated with exit code 28
  ℹ️  curl output:


  📄 No flows recorded for peer cilium-test/client-996668d96-kw6fb during action curl-1
  📄 No flows recorded for peer cilium-test/echo-same-node during action curl-1
  [.] Action [no-policies/pod-to-service/curl-2: cilium-test/client2-84c66894fd-nbxpw (10.45.171.169) -> cilium-test/echo-other-node (echo-other-node.cilium-test:8080)]
  ❌ command "curl -w %{local_ip}:%{local_port} -> %{remote_ip}:%{remote_port} = %{response_code} --silent --fail --show-error --output /dev/null --connect-timeout 2 --max-time 10 http://echo-other-node.cilium-test:8080" failed: error with exec request (pod=cilium-test/client2-84c66894fd-nbxpw, container=client2): command terminated with exit code 28
  ℹ️  curl output:


  📄 No flows recorded for peer cilium-test/client2-84c66894fd-nbxpw during action curl-2
  📄 No flows recorded for peer cilium-test/echo-other-node during action curl-2
  [.] Action [no-policies/pod-to-service/curl-3: cilium-test/client2-84c66894fd-nbxpw (10.45.171.169) -> cilium-test/echo-same-node (echo-same-node.cilium-test:8080)]
  ❌ command "curl -w %{local_ip}:%{local_port} -> %{remote_ip}:%{remote_port} = %{response_code} --silent --fail --show-error --output /dev/null --connect-timeout 2 --max-time 10 http://echo-same-node.cilium-test:8080" failed: error with exec request (pod=cilium-test/client2-84c66894fd-nbxpw, container=client2): command terminated with exit code 28
  ℹ️  curl output:


  📄 No flows recorded for peer cilium-test/client2-84c66894fd-nbxpw during action curl-3
  📄 No flows recorded for peer cilium-test/echo-same-node during action curl-3
  [-] Scenario [no-policies/pod-to-hostport]
  [.] Action [no-policies/pod-to-hostport/curl-0: cilium-test/client2-84c66894fd-nbxpw (10.45.171.169) -> cilium-test/echo-other-node-666d8db686-s4vwz (10.45.161.80:4000)]
  ❌ command "curl -w %{local_ip}:%{local_port} -> %{remote_ip}:%{remote_port} = %{response_code} --silent --fail --show-error --output /dev/null --connect-timeout 2 --max-time 10 http://10.45.161.80:4000" failed: error with exec request (pod=cilium-test/client2-84c66894fd-nbxpw, container=client2): command terminated with exit code 28
  ℹ️  curl output:


  📄 No flows recorded for peer cilium-test/client2-84c66894fd-nbxpw during action curl-0
  📄 No flows recorded for peer cilium-test/echo-other-node-666d8db686-s4vwz during action curl-0
  [.] Action [no-policies/pod-to-hostport/curl-1: cilium-test/client2-84c66894fd-nbxpw (10.45.171.169) -> cilium-test/echo-same-node-778f495746-m9ncg (10.45.168.253:4000)]
  [.] Action [no-policies/pod-to-hostport/curl-2: cilium-test/client-996668d96-kw6fb (10.45.169.135) -> cilium-test/echo-other-node-666d8db686-s4vwz (10.45.161.80:4000)]
  ❌ command "curl -w %{local_ip}:%{local_port} -> %{remote_ip}:%{remote_port} = %{response_code} --silent --fail --show-error --output /dev/null --connect-timeout 2 --max-time 10 http://10.45.161.80:4000" failed: error with exec request (pod=cilium-test/client-996668d96-kw6fb, container=client): command terminated with exit code 28
  ℹ️  curl output:


  📄 No flows recorded for peer cilium-test/client-996668d96-kw6fb during action curl-2
  📄 No flows recorded for peer cilium-test/echo-other-node-666d8db686-s4vwz during action curl-2
  [.] Action [no-policies/pod-to-hostport/curl-3: cilium-test/client-996668d96-kw6fb (10.45.169.135) -> cilium-test/echo-same-node-778f495746-m9ncg (10.45.168.253:4000)]
  [-] Scenario [no-policies/pod-to-world]
  [.] Action [no-policies/pod-to-world/http-to-one.one.one.one-0: cilium-test/client-996668d96-kw6fb (10.45.169.135) -> one.one.one.one-http (one.one.one.one:80)]
  ❌ command "curl -w %{local_ip}:%{local_port} -> %{remote_ip}:%{remote_port} = %{response_code} --silent --fail --show-error --output /dev/null --connect-timeout 2 --max-time 10 --retry 3 --retry-all-errors --retry-delay 3 http://one.one.one.one:80" failed: error with exec request (pod=cilium-test/client-996668d96-kw6fb, container=client): command terminated with exit code 28
  ℹ️  curl output:


  📄 No flows recorded for peer cilium-test/client-996668d96-kw6fb during action http-to-one.one.one.one-0
  📄 No flows recorded for peer one.one.one.one-http during action http-to-one.one.one.one-0
  [.] Action [no-policies/pod-to-world/https-to-one.one.one.one-0: cilium-test/client-996668d96-kw6fb (10.45.169.135) -> one.one.one.one-https (one.one.one.one:443)]
  ❌ command "curl -w %{local_ip}:%{local_port} -> %{remote_ip}:%{remote_port} = %{response_code} --silent --fail --show-error --output /dev/null --connect-timeout 2 --max-time 10 --retry 3 --retry-all-errors --retry-delay 3 https://one.one.one.one:443" failed: error with exec request (pod=cilium-test/client-996668d96-kw6fb, container=client): command terminated with exit code 28
  ℹ️  curl output:


  📄 No flows recorded for peer cilium-test/client-996668d96-kw6fb during action https-to-one.one.one.one-0
  📄 No flows recorded for peer one.one.one.one-https during action https-to-one.one.one.one-0
  [.] Action [no-policies/pod-to-world/https-to-one.one.one.one-index-0: cilium-test/client-996668d96-kw6fb (10.45.169.135) -> one.one.one.one-https-index (one.one.one.one:443)]
  ❌ command "curl -w %{local_ip}:%{local_port} -> %{remote_ip}:%{remote_port} = %{response_code} --silent --fail --show-error --output /dev/null --connect-timeout 2 --max-time 10 --retry 3 --retry-all-errors --retry-delay 3 https://one.one.one.one:443/index.html" failed: error with exec request (pod=cilium-test/client-996668d96-kw6fb, container=client): command terminated with exit code 28
  ℹ️  curl output:


  📄 No flows recorded for peer cilium-test/client-996668d96-kw6fb during action https-to-one.one.one.one-index-0
  📄 No flows recorded for peer one.one.one.one-https-index during action https-to-one.one.one.one-index-0
  [.] Action [no-policies/pod-to-world/http-to-one.one.one.one-1: cilium-test/client2-84c66894fd-nbxpw (10.45.171.169) -> one.one.one.one-http (one.one.one.one:80)]
  ❌ command "curl -w %{local_ip}:%{local_port} -> %{remote_ip}:%{remote_port} = %{response_code} --silent --fail --show-error --output /dev/null --connect-timeout 2 --max-time 10 --retry 3 --retry-all-errors --retry-delay 3 http://one.one.one.one:80" failed: error with exec request (pod=cilium-test/client2-84c66894fd-nbxpw, container=client2): command terminated with exit code 28
  ℹ️  curl output:


  📄 No flows recorded for peer cilium-test/client2-84c66894fd-nbxpw during action http-to-one.one.one.one-1
  📄 No flows recorded for peer one.one.one.one-http during action http-to-one.one.one.one-1
  [.] Action [no-policies/pod-to-world/https-to-one.one.one.one-1: cilium-test/client2-84c66894fd-nbxpw (10.45.171.169) -> one.one.one.one-https (one.one.one.one:443)]
  ❌ command "curl -w %{local_ip}:%{local_port} -> %{remote_ip}:%{remote_port} = %{response_code} --silent --fail --show-error --output /dev/null --connect-timeout 2 --max-time 10 --retry 3 --retry-all-errors --retry-delay 3 https://one.one.one.one:443" failed: error with exec request (pod=cilium-test/client2-84c66894fd-nbxpw, container=client2): command terminated with exit code 28
  ℹ️  curl output:


  📄 No flows recorded for peer cilium-test/client2-84c66894fd-nbxpw during action https-to-one.one.one.one-1
  📄 No flows recorded for peer one.one.one.one-https during action https-to-one.one.one.one-1
  [.] Action [no-policies/pod-to-world/https-to-one.one.one.one-index-1: cilium-test/client2-84c66894fd-nbxpw (10.45.171.169) -> one.one.one.one-https-index (one.one.one.one:443)]
  ❌ command "curl -w %{local_ip}:%{local_port} -> %{remote_ip}:%{remote_port} = %{response_code} --silent --fail --show-error --output /dev/null --connect-timeout 2 --max-time 10 --retry 3 --retry-all-errors --retry-delay 3 https://one.one.one.one:443/index.html" failed: error with exec request (pod=cilium-test/client2-84c66894fd-nbxpw, container=client2): command terminated with exit code 28
  ℹ️  curl output:


  📄 No flows recorded for peer cilium-test/client2-84c66894fd-nbxpw during action https-to-one.one.one.one-index-1
  📄 No flows recorded for peer one.one.one.one-https-index during action https-to-one.one.one.one-index-1
  [-] Scenario [no-policies/pod-to-host]
  [.] Action [no-policies/pod-to-host/ping-ipv4-internal-ip: cilium-test/client-996668d96-kw6fb (10.45.169.135) -> 10.45.161.80 (10.45.161.80:0)]
  [.] Action [no-policies/pod-to-host/ping-ipv4-internal-ip: cilium-test/client-996668d96-kw6fb (10.45.169.135) -> 10.45.168.253 (10.45.168.253:0)]
  [.] Action [no-policies/pod-to-host/ping-ipv4-internal-ip: cilium-test/client-996668d96-kw6fb (10.45.169.135) -> 10.45.171.51 (10.45.171.51:0)]
  [.] Action [no-policies/pod-to-host/ping-ipv4-internal-ip: cilium-test/client-996668d96-kw6fb (10.45.169.135) -> 10.45.177.134 (10.45.177.134:0)]
  [.] Action [no-policies/pod-to-host/ping-ipv4-internal-ip: cilium-test/client2-84c66894fd-nbxpw (10.45.171.169) -> 10.45.161.80 (10.45.161.80:0)]
  [.] Action [no-policies/pod-to-host/ping-ipv4-internal-ip: cilium-test/client2-84c66894fd-nbxpw (10.45.171.169) -> 10.45.168.253 (10.45.168.253:0)]
  [.] Action [no-policies/pod-to-host/ping-ipv4-internal-ip: cilium-test/client2-84c66894fd-nbxpw (10.45.171.169) -> 10.45.171.51 (10.45.171.51:0)]
  [.] Action [no-policies/pod-to-host/ping-ipv4-internal-ip: cilium-test/client2-84c66894fd-nbxpw (10.45.171.169) -> 10.45.177.134 (10.45.177.134:0)]
  [-] Scenario [no-policies/pod-to-external-workload]
  [-] Scenario [no-policies/pod-to-cidr]
  [.] Action [no-policies/pod-to-cidr/external-1111-0: cilium-test/client-996668d96-kw6fb (10.45.169.135) -> external-1111 (1.1.1.1:443)]
  [.] Action [no-policies/pod-to-cidr/external-1111-1: cilium-test/client2-84c66894fd-nbxpw (10.45.171.169) -> external-1111 (1.1.1.1:443)]
  [.] Action [no-policies/pod-to-cidr/external-1001-0: cilium-test/client2-84c66894fd-nbxpw (10.45.171.169) -> external-1001 (1.0.0.1:443)]
  [.] Action [no-policies/pod-to-cidr/external-1001-1: cilium-test/client-996668d96-kw6fb (10.45.169.135) -> external-1001 (1.0.0.1:443)]
[=] Test [no-policies-extra] [2/58]
................
[=] Test [allow-all-except-world] [3/58]
.........
  ℹ️  📜 Applying CiliumNetworkPolicy 'allow-all-except-world' to namespace 'cilium-test'..
  [-] Scenario [allow-all-except-world/pod-to-host]
  [.] Action [allow-all-except-world/pod-to-host/ping-ipv4-internal-ip: cilium-test/client-996668d96-kw6fb (10.45.169.135) -> 10.45.168.253 (10.45.168.253:0)]
  [.] Action [allow-all-except-world/pod-to-host/ping-ipv4-internal-ip: cilium-test/client-996668d96-kw6fb (10.45.169.135) -> 10.45.171.51 (10.45.171.51:0)]
  [.] Action [allow-all-except-world/pod-to-host/ping-ipv4-internal-ip: cilium-test/client-996668d96-kw6fb (10.45.169.135) -> 10.45.177.134 (10.45.177.134:0)]
  [.] Action [allow-all-except-world/pod-to-host/ping-ipv4-internal-ip: cilium-test/client-996668d96-kw6fb (10.45.169.135) -> 10.45.161.80 (10.45.161.80:0)]
  [.] Action [allow-all-except-world/pod-to-host/ping-ipv4-internal-ip: cilium-test/client2-84c66894fd-nbxpw (10.45.171.169) -> 10.45.168.253 (10.45.168.253:0)]
  [.] Action [allow-all-except-world/pod-to-host/ping-ipv4-internal-ip: cilium-test/client2-84c66894fd-nbxpw (10.45.171.169) -> 10.45.171.51 (10.45.171.51:0)]
  [.] Action [allow-all-except-world/pod-to-host/ping-ipv4-internal-ip: cilium-test/client2-84c66894fd-nbxpw (10.45.171.169) -> 10.45.177.134 (10.45.177.134:0)]
  [.] Action [allow-all-except-world/pod-to-host/ping-ipv4-internal-ip: cilium-test/client2-84c66894fd-nbxpw (10.45.171.169) -> 10.45.161.80 (10.45.161.80:0)]
  [-] Scenario [allow-all-except-world/pod-to-external-workload]
  [-] Scenario [allow-all-except-world/pod-to-pod]
  [.] Action [allow-all-except-world/pod-to-pod/curl-ipv4-0: cilium-test/client-996668d96-kw6fb (10.45.169.135) -> cilium-test/echo-other-node-666d8db686-s4vwz (10.45.161.92:8080)]
  ❌ command "curl -w %{local_ip}:%{local_port} -> %{remote_ip}:%{remote_port} = %{response_code} --silent --fail --show-error --output /dev/null --connect-timeout 2 --max-time 10 http://10.45.161.92:8080" failed: error with exec request (pod=cilium-test/client-996668d96-kw6fb, container=client): command terminated with exit code 28
  ℹ️  curl output:


  📄 No flows recorded for peer cilium-test/client-996668d96-kw6fb during action curl-ipv4-0
  📄 No flows recorded for peer cilium-test/echo-other-node-666d8db686-s4vwz during action curl-ipv4-0
  [.] Action [allow-all-except-world/pod-to-pod/curl-ipv4-1: cilium-test/client-996668d96-kw6fb (10.45.169.135) -> cilium-test/echo-same-node-778f495746-m9ncg (10.45.171.109:8080)]
  [.] Action [allow-all-except-world/pod-to-pod/curl-ipv4-2: cilium-test/client2-84c66894fd-nbxpw (10.45.171.169) -> cilium-test/echo-other-node-666d8db686-s4vwz (10.45.161.92:8080)]
  ❌ command "curl -w %{local_ip}:%{local_port} -> %{remote_ip}:%{remote_port} = %{response_code} --silent --fail --show-error --output /dev/null --connect-timeout 2 --max-time 10 http://10.45.161.92:8080" failed: error with exec request (pod=cilium-test/client2-84c66894fd-nbxpw, container=client2): command terminated with exit code 28
  ℹ️  curl output:


  📄 No flows recorded for peer cilium-test/client2-84c66894fd-nbxpw during action curl-ipv4-2
  📄 No flows recorded for peer cilium-test/echo-other-node-666d8db686-s4vwz during action curl-ipv4-2
  [.] Action [allow-all-except-world/pod-to-pod/curl-ipv4-3: cilium-test/client2-84c66894fd-nbxpw (10.45.171.169) -> cilium-test/echo-same-node-778f495746-m9ncg (10.45.171.109:8080)]
  [-] Scenario [allow-all-except-world/client-to-client]
  [.] Action [allow-all-except-world/client-to-client/ping-ipv4-0: cilium-test/client-996668d96-kw6fb (10.45.169.135) -> cilium-test/client2-84c66894fd-nbxpw (10.45.171.169:0)]
  [.] Action [allow-all-except-world/client-to-client/ping-ipv4-1: cilium-test/client2-84c66894fd-nbxpw (10.45.171.169) -> cilium-test/client-996668d96-kw6fb (10.45.169.135:0)]
  [-] Scenario [allow-all-except-world/pod-to-service]
  [.] Action [allow-all-except-world/pod-to-service/curl-0: cilium-test/client-996668d96-kw6fb (10.45.169.135) -> cilium-test/echo-other-node (echo-other-node.cilium-test:8080)]
  ❌ command "curl -w %{local_ip}:%{local_port} -> %{remote_ip}:%{remote_port} = %{response_code} --silent --fail --show-error --output /dev/null --connect-timeout 2 --max-time 10 http://echo-other-node.cilium-test:8080" failed: error with exec request (pod=cilium-test/client-996668d96-kw6fb, container=client): command terminated with exit code 28
  ℹ️  curl output:


  📄 No flows recorded for peer cilium-test/client-996668d96-kw6fb during action curl-0
  📄 No flows recorded for peer cilium-test/echo-other-node during action curl-0
  [.] Action [allow-all-except-world/pod-to-service/curl-1: cilium-test/client-996668d96-kw6fb (10.45.169.135) -> cilium-test/echo-same-node (echo-same-node.cilium-test:8080)]
  ❌ command "curl -w %{local_ip}:%{local_port} -> %{remote_ip}:%{remote_port} = %{response_code} --silent --fail --show-error --output /dev/null --connect-timeout 2 --max-time 10 http://echo-same-node.cilium-test:8080" failed: error with exec request (pod=cilium-test/client-996668d96-kw6fb, container=client): command terminated with exit code 28
  ℹ️  curl output:


  📄 No flows recorded for peer cilium-test/client-996668d96-kw6fb during action curl-1
  📄 No flows recorded for peer cilium-test/echo-same-node during action curl-1
  [.] Action [allow-all-except-world/pod-to-service/curl-2: cilium-test/client2-84c66894fd-nbxpw (10.45.171.169) -> cilium-test/echo-other-node (echo-other-node.cilium-test:8080)]
  ❌ command "curl -w %{local_ip}:%{local_port} -> %{remote_ip}:%{remote_port} = %{response_code} --silent --fail --show-error --output /dev/null --connect-timeout 2 --max-time 10 http://echo-other-node.cilium-test:8080" failed: error with exec request (pod=cilium-test/client2-84c66894fd-nbxpw, container=client2): command terminated with exit code 28
  ℹ️  curl output:


  📄 No flows recorded for peer cilium-test/client2-84c66894fd-nbxpw during action curl-2
  📄 No flows recorded for peer cilium-test/echo-other-node during action curl-2
  [.] Action [allow-all-except-world/pod-to-service/curl-3: cilium-test/client2-84c66894fd-nbxpw (10.45.171.169) -> cilium-test/echo-same-node (echo-same-node.cilium-test:8080)]
  ❌ command "curl -w %{local_ip}:%{local_port} -> %{remote_ip}:%{remote_port} = %{response_code} --silent --fail --show-error --output /dev/null --connect-timeout 2 --max-time 10 http://echo-same-node.cilium-test:8080" failed: error with exec request (pod=cilium-test/client2-84c66894fd-nbxpw, container=client2): command terminated with exit code 28
  ℹ️  curl output:


  📄 No flows recorded for peer cilium-test/client2-84c66894fd-nbxpw during action curl-3
  📄 No flows recorded for peer cilium-test/echo-same-node during action curl-3
  ℹ️  📜 Deleting CiliumNetworkPolicy 'allow-all-except-world' from namespace 'cilium-test'..
[=] Test [client-ingress] [4/58]
..
[=] Test [client-ingress-knp] [5/58]
..
[=] Test [allow-all-with-metrics-check] [6/58]
....
[=] Test [all-ingress-deny] [7/58]
........
[=] Test [all-ingress-deny-knp] [8/58]
........
[=] Test [all-egress-deny] [9/58]
................
[=] Test [all-egress-deny-knp] [10/58]
................
[=] Test [all-entities-deny] [11/58]
........
[=] Test [cluster-entity] [12/58]
..
[=] Test [host-entity] [13/58]
........
[=] Test [echo-ingress] [14/58]
...
  ℹ️  📜 Applying CiliumNetworkPolicy 'echo-ingress-from-other-client' to namespace 'cilium-test'..
  [-] Scenario [echo-ingress/pod-to-pod]
  [.] Action [echo-ingress/pod-to-pod/curl-ipv4-0: cilium-test/client-996668d96-kw6fb (10.45.169.135) -> cilium-test/echo-other-node-666d8db686-s4vwz (10.45.161.92:8080)]
  [.] Action [echo-ingress/pod-to-pod/curl-ipv4-1: cilium-test/client-996668d96-kw6fb (10.45.169.135) -> cilium-test/echo-same-node-778f495746-m9ncg (10.45.171.109:8080)]
  [.] Action [echo-ingress/pod-to-pod/curl-ipv4-2: cilium-test/client2-84c66894fd-nbxpw (10.45.171.169) -> cilium-test/echo-other-node-666d8db686-s4vwz (10.45.161.92:8080)]
  ❌ command "curl -w %{local_ip}:%{local_port} -> %{remote_ip}:%{remote_port} = %{response_code} --silent --fail --show-error --output /dev/null --connect-timeout 2 --max-time 10 http://10.45.161.92:8080" failed: error with exec request (pod=cilium-test/client2-84c66894fd-nbxpw, container=client2): command terminated with exit code 28
  ℹ️  curl output:


  📄 No flows recorded for peer cilium-test/client2-84c66894fd-nbxpw during action curl-ipv4-2
  📄 No flows recorded for peer cilium-test/echo-other-node-666d8db686-s4vwz during action curl-ipv4-2
  [.] Action [echo-ingress/pod-to-pod/curl-ipv4-3: cilium-test/client2-84c66894fd-nbxpw (10.45.171.169) -> cilium-test/echo-same-node-778f495746-m9ncg (10.45.171.109:8080)]
  ℹ️  📜 Deleting CiliumNetworkPolicy 'echo-ingress-from-other-client' from namespace 'cilium-test'..
[=] Test [echo-ingress-knp] [15/58]
...
  ℹ️  📜 Applying KubernetesNetworkPolicy 'echo-ingress-from-other-client' to namespace 'cilium-test'..
  [-] Scenario [echo-ingress-knp/pod-to-pod]
  [.] Action [echo-ingress-knp/pod-to-pod/curl-ipv4-0: cilium-test/client-996668d96-kw6fb (10.45.169.135) -> cilium-test/echo-other-node-666d8db686-s4vwz (10.45.161.92:8080)]
  [.] Action [echo-ingress-knp/pod-to-pod/curl-ipv4-1: cilium-test/client-996668d96-kw6fb (10.45.169.135) -> cilium-test/echo-same-node-778f495746-m9ncg (10.45.171.109:8080)]
  [.] Action [echo-ingress-knp/pod-to-pod/curl-ipv4-2: cilium-test/client2-84c66894fd-nbxpw (10.45.171.169) -> cilium-test/echo-other-node-666d8db686-s4vwz (10.45.161.92:8080)]
  ❌ command "curl -w %{local_ip}:%{local_port} -> %{remote_ip}:%{remote_port} = %{response_code} --silent --fail --show-error --output /dev/null --connect-timeout 2 --max-time 10 http://10.45.161.92:8080" failed: error with exec request (pod=cilium-test/client2-84c66894fd-nbxpw, container=client2): command terminated with exit code 28
  ℹ️  curl output:


  📄 No flows recorded for peer cilium-test/client2-84c66894fd-nbxpw during action curl-ipv4-2
  📄 No flows recorded for peer cilium-test/echo-other-node-666d8db686-s4vwz during action curl-ipv4-2
  [.] Action [echo-ingress-knp/pod-to-pod/curl-ipv4-3: cilium-test/client2-84c66894fd-nbxpw (10.45.171.169) -> cilium-test/echo-same-node-778f495746-m9ncg (10.45.171.109:8080)]
  ℹ️  📜 Deleting K8S NetworkPolicy 'echo-ingress-from-other-client' from namespace 'cilium-test'..
[=] Test [client-ingress-icmp] [16/58]
..
[=] Test [client-egress] [17/58]
....
[=] Test [client-egress-knp] [18/58]
....
[=] Test [client-egress-expression] [19/58]
....
[=] Test [client-egress-expression-knp] [20/58]
....
[=] Test [client-with-service-account-egress-to-echo] [21/58]
....
[=] Test [client-egress-to-echo-service-account] [22/58]
....
[=] Test [to-entities-world] [23/58]
.
  ℹ️  📜 Applying CiliumNetworkPolicy 'client-egress-to-entities-world' to namespace 'cilium-test'..
  [-] Scenario [to-entities-world/pod-to-world]
  [.] Action [to-entities-world/pod-to-world/http-to-one.one.one.one-0: cilium-test/client-996668d96-kw6fb (10.45.169.135) -> one.one.one.one-http (one.one.one.one:80)]
  ❌ command "curl -w %{local_ip}:%{local_port} -> %{remote_ip}:%{remote_port} = %{response_code} --silent --fail --show-error --output /dev/null --connect-timeout 2 --max-time 10 --retry 3 --retry-all-errors --retry-delay 3 http://one.one.one.one:80" failed: error with exec request (pod=cilium-test/client-996668d96-kw6fb, container=client): command terminated with exit code 28
  ℹ️  curl output:


  📄 No flows recorded for peer cilium-test/client-996668d96-kw6fb during action http-to-one.one.one.one-0
  📄 No flows recorded for peer one.one.one.one-http during action http-to-one.one.one.one-0
  [.] Action [to-entities-world/pod-to-world/https-to-one.one.one.one-0: cilium-test/client-996668d96-kw6fb (10.45.169.135) -> one.one.one.one-https (one.one.one.one:443)]
  [.] Action [to-entities-world/pod-to-world/https-to-one.one.one.one-index-0: cilium-test/client-996668d96-kw6fb (10.45.169.135) -> one.one.one.one-https-index (one.one.one.one:443)]
  [.] Action [to-entities-world/pod-to-world/http-to-one.one.one.one-1: cilium-test/client2-84c66894fd-nbxpw (10.45.171.169) -> one.one.one.one-http (one.one.one.one:80)]
  ❌ command "curl -w %{local_ip}:%{local_port} -> %{remote_ip}:%{remote_port} = %{response_code} --silent --fail --show-error --output /dev/null --connect-timeout 2 --max-time 10 --retry 3 --retry-all-errors --retry-delay 3 http://one.one.one.one:80" failed: error with exec request (pod=cilium-test/client2-84c66894fd-nbxpw, container=client2): command terminated with exit code 28
  ℹ️  curl output:


  📄 No flows recorded for peer cilium-test/client2-84c66894fd-nbxpw during action http-to-one.one.one.one-1
  📄 No flows recorded for peer one.one.one.one-http during action http-to-one.one.one.one-1
  [.] Action [to-entities-world/pod-to-world/https-to-one.one.one.one-1: cilium-test/client2-84c66894fd-nbxpw (10.45.171.169) -> one.one.one.one-https (one.one.one.one:443)]
  [.] Action [to-entities-world/pod-to-world/https-to-one.one.one.one-index-1: cilium-test/client2-84c66894fd-nbxpw (10.45.171.169) -> one.one.one.one-https-index (one.one.one.one:443)]
  ℹ️  📜 Deleting CiliumNetworkPolicy 'client-egress-to-entities-world' from namespace 'cilium-test'..
[=] Test [to-cidr-external] [24/58]
....
[=] Test [to-cidr-external-knp] [25/58]
....
[=] Test [echo-ingress-from-other-client-deny] [26/58]
.
  ℹ️  📜 Applying CiliumNetworkPolicy 'allow-all-egress' to namespace 'cilium-test'..
  ℹ️  📜 Applying CiliumNetworkPolicy 'allow-all-ingress' to namespace 'cilium-test'..
  ℹ️  📜 Applying CiliumNetworkPolicy 'echo-ingress-from-other-client-deny' to namespace 'cilium-test'..
  [-] Scenario [echo-ingress-from-other-client-deny/pod-to-pod]
  [.] Action [echo-ingress-from-other-client-deny/pod-to-pod/curl-ipv4-0: cilium-test/client-996668d96-kw6fb (10.45.169.135) -> cilium-test/echo-other-node-666d8db686-s4vwz (10.45.161.92:8080)]
  ❌ command "curl -w %{local_ip}:%{local_port} -> %{remote_ip}:%{remote_port} = %{response_code} --silent --fail --show-error --output /dev/null --connect-timeout 2 --max-time 10 http://10.45.161.92:8080" failed: error with exec request (pod=cilium-test/client-996668d96-kw6fb, container=client): command terminated with exit code 28
  ℹ️  curl output:


  📄 No flows recorded for peer cilium-test/client-996668d96-kw6fb during action curl-ipv4-0
  📄 No flows recorded for peer cilium-test/echo-other-node-666d8db686-s4vwz during action curl-ipv4-0
  [.] Action [echo-ingress-from-other-client-deny/pod-to-pod/curl-ipv4-1: cilium-test/client-996668d96-kw6fb (10.45.169.135) -> cilium-test/echo-same-node-778f495746-m9ncg (10.45.171.109:8080)]
  [-] Scenario [echo-ingress-from-other-client-deny/pod-to-pod]
  [.] Action [echo-ingress-from-other-client-deny/pod-to-pod/curl-ipv4-0: cilium-test/client2-84c66894fd-nbxpw (10.45.171.169) -> cilium-test/echo-other-node-666d8db686-s4vwz (10.45.161.92:8080)]
  [.] Action [echo-ingress-from-other-client-deny/pod-to-pod/curl-ipv4-1: cilium-test/client2-84c66894fd-nbxpw (10.45.171.169) -> cilium-test/echo-same-node-778f495746-m9ncg (10.45.171.109:8080)]
  [-] Scenario [echo-ingress-from-other-client-deny/client-to-client]
  [.] Action [echo-ingress-from-other-client-deny/client-to-client/ping-ipv4-0: cilium-test/client-996668d96-kw6fb (10.45.169.135) -> cilium-test/client2-84c66894fd-nbxpw (10.45.171.169:0)]
  [.] Action [echo-ingress-from-other-client-deny/client-to-client/ping-ipv4-1: cilium-test/client2-84c66894fd-nbxpw (10.45.171.169) -> cilium-test/client-996668d96-kw6fb (10.45.169.135:0)]
  ℹ️  📜 Deleting CiliumNetworkPolicy 'allow-all-egress' from namespace 'cilium-test'..
  ℹ️  📜 Deleting CiliumNetworkPolicy 'allow-all-ingress' from namespace 'cilium-test'..
  ℹ️  📜 Deleting CiliumNetworkPolicy 'echo-ingress-from-other-client-deny' from namespace 'cilium-test'..
[=] Test [client-ingress-from-other-client-icmp-deny] [27/58]
...
  ℹ️  📜 Applying CiliumNetworkPolicy 'allow-all-egress' to namespace 'cilium-test'..
  ℹ️  📜 Applying CiliumNetworkPolicy 'allow-all-ingress' to namespace 'cilium-test'..
  ℹ️  📜 Applying CiliumNetworkPolicy 'client-ingress-from-other-client-icmp-deny' to namespace 'cilium-test'..
  [-] Scenario [client-ingress-from-other-client-icmp-deny/client-to-client]
  [.] Action [client-ingress-from-other-client-icmp-deny/client-to-client/ping-ipv4-0: cilium-test/client-996668d96-kw6fb (10.45.169.135) -> cilium-test/client2-84c66894fd-nbxpw (10.45.171.169:0)]
  [.] Action [client-ingress-from-other-client-icmp-deny/client-to-client/ping-ipv4-1: cilium-test/client2-84c66894fd-nbxpw (10.45.171.169) -> cilium-test/client-996668d96-kw6fb (10.45.169.135:0)]
  [-] Scenario [client-ingress-from-other-client-icmp-deny/pod-to-pod]
  [.] Action [client-ingress-from-other-client-icmp-deny/pod-to-pod/curl-ipv4-0: cilium-test/client-996668d96-kw6fb (10.45.169.135) -> cilium-test/echo-other-node-666d8db686-s4vwz (10.45.161.92:8080)]
  ❌ command "curl -w %{local_ip}:%{local_port} -> %{remote_ip}:%{remote_port} = %{response_code} --silent --fail --show-error --output /dev/null --connect-timeout 2 --max-time 10 http://10.45.161.92:8080" failed: error with exec request (pod=cilium-test/client-996668d96-kw6fb, container=client): command terminated with exit code 28
  ℹ️  curl output:


  📄 No flows recorded for peer cilium-test/client-996668d96-kw6fb during action curl-ipv4-0
  📄 No flows recorded for peer cilium-test/echo-other-node-666d8db686-s4vwz during action curl-ipv4-0
  [.] Action [client-ingress-from-other-client-icmp-deny/pod-to-pod/curl-ipv4-1: cilium-test/client-996668d96-kw6fb (10.45.169.135) -> cilium-test/echo-same-node-778f495746-m9ncg (10.45.171.109:8080)]
  [.] Action [client-ingress-from-other-client-icmp-deny/pod-to-pod/curl-ipv4-2: cilium-test/client2-84c66894fd-nbxpw (10.45.171.169) -> cilium-test/echo-other-node-666d8db686-s4vwz (10.45.161.92:8080)]
  ❌ command "curl -w %{local_ip}:%{local_port} -> %{remote_ip}:%{remote_port} = %{response_code} --silent --fail --show-error --output /dev/null --connect-timeout 2 --max-time 10 http://10.45.161.92:8080" failed: error with exec request (pod=cilium-test/client2-84c66894fd-nbxpw, container=client2): command terminated with exit code 28
  ℹ️  curl output:


  📄 No flows recorded for peer cilium-test/client2-84c66894fd-nbxpw during action curl-ipv4-2
  📄 No flows recorded for peer cilium-test/echo-other-node-666d8db686-s4vwz during action curl-ipv4-2
  [.] Action [client-ingress-from-other-client-icmp-deny/pod-to-pod/curl-ipv4-3: cilium-test/client2-84c66894fd-nbxpw (10.45.171.169) -> cilium-test/echo-same-node-778f495746-m9ncg (10.45.171.109:8080)]
  ℹ️  📜 Deleting CiliumNetworkPolicy 'allow-all-egress' from namespace 'cilium-test'..
  ℹ️  📜 Deleting CiliumNetworkPolicy 'allow-all-ingress' from namespace 'cilium-test'..
  ℹ️  📜 Deleting CiliumNetworkPolicy 'client-ingress-from-other-client-icmp-deny' from namespace 'cilium-test'..
[=] Test [client-egress-to-echo-deny] [28/58]
......
[=] Test [client-ingress-to-echo-named-port-deny] [29/58]
...
  ℹ️  📜 Applying CiliumNetworkPolicy 'allow-all-egress' to namespace 'cilium-test'..
  ℹ️  📜 Applying CiliumNetworkPolicy 'allow-all-ingress' to namespace 'cilium-test'..
  ℹ️  📜 Applying CiliumNetworkPolicy 'client-ingress-to-echo-named-port-deny' to namespace 'cilium-test'..
  [-] Scenario [client-ingress-to-echo-named-port-deny/pod-to-pod]
  [.] Action [client-ingress-to-echo-named-port-deny/pod-to-pod/curl-ipv4-0: cilium-test/client-996668d96-kw6fb (10.45.169.135) -> cilium-test/echo-same-node-778f495746-m9ncg (10.45.171.109:8080)]
  [.] Action [client-ingress-to-echo-named-port-deny/pod-to-pod/curl-ipv4-1: cilium-test/client-996668d96-kw6fb (10.45.169.135) -> cilium-test/echo-other-node-666d8db686-s4vwz (10.45.161.92:8080)]
  [-] Scenario [client-ingress-to-echo-named-port-deny/pod-to-pod]
  [.] Action [client-ingress-to-echo-named-port-deny/pod-to-pod/curl-ipv4-0: cilium-test/client2-84c66894fd-nbxpw (10.45.171.169) -> cilium-test/echo-other-node-666d8db686-s4vwz (10.45.161.92:8080)]
  ❌ command "curl -w %{local_ip}:%{local_port} -> %{remote_ip}:%{remote_port} = %{response_code} --silent --fail --show-error --output /dev/null --connect-timeout 2 --max-time 10 http://10.45.161.92:8080" failed: error with exec request (pod=cilium-test/client2-84c66894fd-nbxpw, container=client2): command terminated with exit code 28
  ℹ️  curl output:


  📄 No flows recorded for peer cilium-test/client2-84c66894fd-nbxpw during action curl-ipv4-0
  📄 No flows recorded for peer cilium-test/echo-other-node-666d8db686-s4vwz during action curl-ipv4-0
  [.] Action [client-ingress-to-echo-named-port-deny/pod-to-pod/curl-ipv4-1: cilium-test/client2-84c66894fd-nbxpw (10.45.171.169) -> cilium-test/echo-same-node-778f495746-m9ncg (10.45.171.109:8080)]
  ℹ️  📜 Deleting CiliumNetworkPolicy 'allow-all-egress' from namespace 'cilium-test'..
  ℹ️  📜 Deleting CiliumNetworkPolicy 'allow-all-ingress' from namespace 'cilium-test'..
  ℹ️  📜 Deleting CiliumNetworkPolicy 'client-ingress-to-echo-named-port-deny' from namespace 'cilium-test'..
[=] Test [client-egress-to-echo-expression-deny] [30/58]
.
  ℹ️  📜 Applying CiliumNetworkPolicy 'allow-all-egress' to namespace 'cilium-test'..
  ℹ️  📜 Applying CiliumNetworkPolicy 'allow-all-ingress' to namespace 'cilium-test'..
  ℹ️  📜 Applying CiliumNetworkPolicy 'client-egress-to-echo-expression-deny' to namespace 'cilium-test'..
  [-] Scenario [client-egress-to-echo-expression-deny/pod-to-pod]
  [.] Action [client-egress-to-echo-expression-deny/pod-to-pod/curl-ipv4-0: cilium-test/client2-84c66894fd-nbxpw (10.45.171.169) -> cilium-test/echo-other-node-666d8db686-s4vwz (10.45.161.92:8080)]
  ❌ command "curl -w %{local_ip}:%{local_port} -> %{remote_ip}:%{remote_port} = %{response_code} --silent --fail --show-error --output /dev/null --connect-timeout 2 --max-time 10 http://10.45.161.92:8080" failed: error with exec request (pod=cilium-test/client2-84c66894fd-nbxpw, container=client2): command terminated with exit code 28
  ℹ️  curl output:


  📄 No flows recorded for peer cilium-test/client2-84c66894fd-nbxpw during action curl-ipv4-0
  📄 No flows recorded for peer cilium-test/echo-other-node-666d8db686-s4vwz during action curl-ipv4-0
  [.] Action [client-egress-to-echo-expression-deny/pod-to-pod/curl-ipv4-1: cilium-test/client2-84c66894fd-nbxpw (10.45.171.169) -> cilium-test/echo-same-node-778f495746-m9ncg (10.45.171.109:8080)]
  [-] Scenario [client-egress-to-echo-expression-deny/pod-to-pod]
  [.] Action [client-egress-to-echo-expression-deny/pod-to-pod/curl-ipv4-0: cilium-test/client-996668d96-kw6fb (10.45.169.135) -> cilium-test/echo-same-node-778f495746-m9ncg (10.45.171.109:8080)]
  [.] Action [client-egress-to-echo-expression-deny/pod-to-pod/curl-ipv4-1: cilium-test/client-996668d96-kw6fb (10.45.169.135) -> cilium-test/echo-other-node-666d8db686-s4vwz (10.45.161.92:8080)]
  ℹ️  📜 Deleting CiliumNetworkPolicy 'allow-all-egress' from namespace 'cilium-test'..
  ℹ️  📜 Deleting CiliumNetworkPolicy 'allow-all-ingress' from namespace 'cilium-test'..
  ℹ️  📜 Deleting CiliumNetworkPolicy 'client-egress-to-echo-expression-deny' from namespace 'cilium-test'..
[=] Test [client-with-service-account-egress-to-echo-deny] [31/58]
...
  ℹ️  📜 Applying CiliumNetworkPolicy 'allow-all-egress' to namespace 'cilium-test'..
  ℹ️  📜 Applying CiliumNetworkPolicy 'allow-all-ingress' to namespace 'cilium-test'..
  ℹ️  📜 Applying CiliumNetworkPolicy 'client-with-service-account-egress-to-echo-deny' to namespace 'cilium-test'..
  [-] Scenario [client-with-service-account-egress-to-echo-deny/pod-to-pod]
  [.] Action [client-with-service-account-egress-to-echo-deny/pod-to-pod/curl-ipv4-0: cilium-test/client-996668d96-kw6fb (10.45.169.135) -> cilium-test/echo-other-node-666d8db686-s4vwz (10.45.161.92:8080)]
  [.] Action [client-with-service-account-egress-to-echo-deny/pod-to-pod/curl-ipv4-1: cilium-test/client-996668d96-kw6fb (10.45.169.135) -> cilium-test/echo-same-node-778f495746-m9ncg (10.45.171.109:8080)]
  [-] Scenario [client-with-service-account-egress-to-echo-deny/pod-to-pod]
  [.] Action [client-with-service-account-egress-to-echo-deny/pod-to-pod/curl-ipv4-0: cilium-test/client2-84c66894fd-nbxpw (10.45.171.169) -> cilium-test/echo-other-node-666d8db686-s4vwz (10.45.161.92:8080)]
  ❌ command "curl -w %{local_ip}:%{local_port} -> %{remote_ip}:%{remote_port} = %{response_code} --silent --fail --show-error --output /dev/null --connect-timeout 2 --max-time 10 http://10.45.161.92:8080" failed: error with exec request (pod=cilium-test/client2-84c66894fd-nbxpw, container=client2): command terminated with exit code 28
  ℹ️  curl output:


  📄 No flows recorded for peer cilium-test/client2-84c66894fd-nbxpw during action curl-ipv4-0
  📄 No flows recorded for peer cilium-test/echo-other-node-666d8db686-s4vwz during action curl-ipv4-0
  [.] Action [client-with-service-account-egress-to-echo-deny/pod-to-pod/curl-ipv4-1: cilium-test/client2-84c66894fd-nbxpw (10.45.171.169) -> cilium-test/echo-same-node-778f495746-m9ncg (10.45.171.109:8080)]
  ℹ️  📜 Deleting CiliumNetworkPolicy 'allow-all-egress' from namespace 'cilium-test'..
  ℹ️  📜 Deleting CiliumNetworkPolicy 'allow-all-ingress' from namespace 'cilium-test'..
  ℹ️  📜 Deleting CiliumNetworkPolicy 'client-with-service-account-egress-to-echo-deny' from namespace 'cilium-test'..
[=] Test [client-egress-to-echo-service-account-deny] [32/58]
.
  ℹ️  📜 Applying CiliumNetworkPolicy 'allow-all-egress' to namespace 'cilium-test'..
  ℹ️  📜 Applying CiliumNetworkPolicy 'allow-all-ingress' to namespace 'cilium-test'..
  ℹ️  📜 Applying CiliumNetworkPolicy 'client-egress-to-echo-service-account-deny' to namespace 'cilium-test'..
  [-] Scenario [client-egress-to-echo-service-account-deny/pod-to-pod]
  [.] Action [client-egress-to-echo-service-account-deny/pod-to-pod/curl-ipv4-0: cilium-test/client-996668d96-kw6fb (10.45.169.135) -> cilium-test/echo-other-node-666d8db686-s4vwz (10.45.161.92:8080)]
  ❌ command "curl -w %{local_ip}:%{local_port} -> %{remote_ip}:%{remote_port} = %{response_code} --silent --fail --show-error --output /dev/null --connect-timeout 2 --max-time 10 http://10.45.161.92:8080" failed: error with exec request (pod=cilium-test/client-996668d96-kw6fb, container=client): command terminated with exit code 28
  ℹ️  curl output:


  📄 No flows recorded for peer cilium-test/client-996668d96-kw6fb during action curl-ipv4-0
  📄 No flows recorded for peer cilium-test/echo-other-node-666d8db686-s4vwz during action curl-ipv4-0
  [.] Action [client-egress-to-echo-service-account-deny/pod-to-pod/curl-ipv4-1: cilium-test/client-996668d96-kw6fb (10.45.169.135) -> cilium-test/echo-same-node-778f495746-m9ncg (10.45.171.109:8080)]
  ℹ️  📜 Deleting CiliumNetworkPolicy 'allow-all-egress' from namespace 'cilium-test'..
  ℹ️  📜 Deleting CiliumNetworkPolicy 'allow-all-ingress' from namespace 'cilium-test'..
  ℹ️  📜 Deleting CiliumNetworkPolicy 'client-egress-to-echo-service-account-deny' from namespace 'cilium-test'..
[=] Test [client-egress-to-cidr-deny] [33/58]
....
[=] Test [client-egress-to-cidr-deny-default] [34/58]
....
[=] Skipping Test [health] [35/58] (Feature health-checking is disabled)
[=] Skipping Test [north-south-loadbalancing] [36/58] (Feature node-without-cilium is disabled)
[=] Test [pod-to-pod-encryption] [37/58]
.
  [-] Scenario [pod-to-pod-encryption/pod-to-pod-encryption]
  [.] Action [pod-to-pod-encryption/pod-to-pod-encryption/curl-ipv4: cilium-test/client-996668d96-kw6fb (10.45.169.135) -> cilium-test/echo-other-node-666d8db686-s4vwz (10.45.161.92:8080)]
  ❌ Expected to see unencrypted packets, but none found. This check might be broken
  ❌ Expected to see unencrypted packets, but none found. This check might be broken
  📄 No flows recorded for peer cilium-test/client-996668d96-kw6fb during action curl-ipv4
  📄 No flows recorded for peer cilium-test/echo-other-node-666d8db686-s4vwz during action curl-ipv4
[=] Test [node-to-node-encryption] [38/58]
...
[=] Skipping Test [egress-gateway-excluded-cidrs] [39/58] (Feature node-without-cilium is disabled)
[=] Skipping Test [pod-to-node-cidrpolicy] [40/58] (Feature cidr-match-nodes is disabled)
[=] Skipping Test [north-south-loadbalancing-with-l7-policy] [41/58] (Feature node-without-cilium is disabled)
[=] Skipping Test [echo-ingress-l7] [42/58] (Feature l7-proxy is disabled)
[=] Skipping Test [echo-ingress-l7-named-port] [43/58] (Feature l7-proxy is disabled)
[=] Skipping Test [client-egress-l7-method] [44/58] (Feature l7-proxy is disabled)
[=] Skipping Test [client-egress-l7] [45/58] (Feature l7-proxy is disabled)
[=] Skipping Test [client-egress-l7-named-port] [46/58] (Feature l7-proxy is disabled)
[=] Skipping Test [client-egress-l7-tls-deny-without-headers] [47/58] (Feature l7-proxy is disabled)
[=] Skipping Test [client-egress-l7-tls-headers] [48/58] (Feature l7-proxy is disabled)
[=] Skipping Test [client-egress-l7-set-header] [49/58] (Feature l7-proxy is disabled)
[=] Skipping Test [echo-ingress-auth-always-fail] [50/58] (Feature mutual-auth-spiffe is disabled)
[=] Skipping Test [echo-ingress-mutual-auth-spiffe] [51/58] (Feature mutual-auth-spiffe is disabled)
[=] Skipping Test [pod-to-ingress-service] [52/58] (Feature ingress-controller is disabled)
[=] Skipping Test [pod-to-ingress-service-deny-all] [53/58] (Feature ingress-controller is disabled)
[=] Skipping Test [pod-to-ingress-service-deny-ingress-identity] [54/58] (Feature ingress-controller is disabled)
[=] Skipping Test [pod-to-ingress-service-deny-backend-service] [55/58] (Feature ingress-controller is disabled)
[=] Skipping Test [pod-to-ingress-service-allow-ingress-identity] [56/58] (Feature ingress-controller is disabled)
[=] Skipping Test [dns-only] [57/58] (Feature l7-proxy is disabled)
[=] Skipping Test [to-fqdns] [58/58] (Feature l7-proxy is disabled)

📋 Test Report
❌ 12/36 tests failed (30/232 actions), 22 tests skipped, 0 scenarios skipped:
Test [no-policies]:
  ❌ no-policies/pod-to-hostport/curl-0: cilium-test/client2-84c66894fd-nbxpw (10.45.171.169) -> cilium-test/echo-other-node-666d8db686-s4vwz (10.45.161.80:4000)
  ❌ no-policies/pod-to-hostport/curl-2: cilium-test/client-996668d96-kw6fb (10.45.169.135) -> cilium-test/echo-other-node-666d8db686-s4vwz (10.45.161.80:4000)
  ❌ no-policies/pod-to-world/http-to-one.one.one.one-0: cilium-test/client-996668d96-kw6fb (10.45.169.135) -> one.one.one.one-http (one.one.one.one:80)
  ❌ no-policies/pod-to-world/https-to-one.one.one.one-0: cilium-test/client-996668d96-kw6fb (10.45.169.135) -> one.one.one.one-https (one.one.one.one:443)
  ❌ no-policies/pod-to-world/https-to-one.one.one.one-index-0: cilium-test/client-996668d96-kw6fb (10.45.169.135) -> one.one.one.one-https-index (one.one.one.one:443)
  ❌ no-policies/pod-to-world/http-to-one.one.one.one-1: cilium-test/client2-84c66894fd-nbxpw (10.45.171.169) -> one.one.one.one-http (one.one.one.one:80)
  ❌ no-policies/pod-to-world/https-to-one.one.one.one-1: cilium-test/client2-84c66894fd-nbxpw (10.45.171.169) -> one.one.one.one-https (one.one.one.one:443)
  ❌ no-policies/pod-to-world/https-to-one.one.one.one-index-1: cilium-test/client2-84c66894fd-nbxpw (10.45.171.169) -> one.one.one.one-https-index (one.one.one.one:443)
  ❌ no-policies/pod-to-service/curl-0: cilium-test/client-996668d96-kw6fb (10.45.169.135) -> cilium-test/echo-other-node (echo-other-node.cilium-test:8080)
  ❌ no-policies/pod-to-service/curl-1: cilium-test/client-996668d96-kw6fb (10.45.169.135) -> cilium-test/echo-same-node (echo-same-node.cilium-test:8080)
  ❌ no-policies/pod-to-service/curl-2: cilium-test/client2-84c66894fd-nbxpw (10.45.171.169) -> cilium-test/echo-other-node (echo-other-node.cilium-test:8080)
  ❌ no-policies/pod-to-service/curl-3: cilium-test/client2-84c66894fd-nbxpw (10.45.171.169) -> cilium-test/echo-same-node (echo-same-node.cilium-test:8080)
Test [allow-all-except-world]:
  ❌ allow-all-except-world/pod-to-pod/curl-ipv4-0: cilium-test/client-996668d96-kw6fb (10.45.169.135) -> cilium-test/echo-other-node-666d8db686-s4vwz (10.45.161.92:8080)
  ❌ allow-all-except-world/pod-to-pod/curl-ipv4-2: cilium-test/client2-84c66894fd-nbxpw (10.45.171.169) -> cilium-test/echo-other-node-666d8db686-s4vwz (10.45.161.92:8080)
  ❌ allow-all-except-world/pod-to-service/curl-0: cilium-test/client-996668d96-kw6fb (10.45.169.135) -> cilium-test/echo-other-node (echo-other-node.cilium-test:8080)
  ❌ allow-all-except-world/pod-to-service/curl-1: cilium-test/client-996668d96-kw6fb (10.45.169.135) -> cilium-test/echo-same-node (echo-same-node.cilium-test:8080)
  ❌ allow-all-except-world/pod-to-service/curl-2: cilium-test/client2-84c66894fd-nbxpw (10.45.171.169) -> cilium-test/echo-other-node (echo-other-node.cilium-test:8080)
  ❌ allow-all-except-world/pod-to-service/curl-3: cilium-test/client2-84c66894fd-nbxpw (10.45.171.169) -> cilium-test/echo-same-node (echo-same-node.cilium-test:8080)
Test [echo-ingress]:
  ❌ echo-ingress/pod-to-pod/curl-ipv4-2: cilium-test/client2-84c66894fd-nbxpw (10.45.171.169) -> cilium-test/echo-other-node-666d8db686-s4vwz (10.45.161.92:8080)
Test [echo-ingress-knp]:
  ❌ echo-ingress-knp/pod-to-pod/curl-ipv4-2: cilium-test/client2-84c66894fd-nbxpw (10.45.171.169) -> cilium-test/echo-other-node-666d8db686-s4vwz (10.45.161.92:8080)
Test [to-entities-world]:
  ❌ to-entities-world/pod-to-world/http-to-one.one.one.one-0: cilium-test/client-996668d96-kw6fb (10.45.169.135) -> one.one.one.one-http (one.one.one.one:80)
  ❌ to-entities-world/pod-to-world/http-to-one.one.one.one-1: cilium-test/client2-84c66894fd-nbxpw (10.45.171.169) -> one.one.one.one-http (one.one.one.one:80)
Test [echo-ingress-from-other-client-deny]:
  ❌ echo-ingress-from-other-client-deny/pod-to-pod/curl-ipv4-0: cilium-test/client-996668d96-kw6fb (10.45.169.135) -> cilium-test/echo-other-node-666d8db686-s4vwz (10.45.161.92:8080)
Test [client-ingress-from-other-client-icmp-deny]:
  ❌ client-ingress-from-other-client-icmp-deny/pod-to-pod/curl-ipv4-0: cilium-test/client-996668d96-kw6fb (10.45.169.135) -> cilium-test/echo-other-node-666d8db686-s4vwz (10.45.161.92:8080)
  ❌ client-ingress-from-other-client-icmp-deny/pod-to-pod/curl-ipv4-2: cilium-test/client2-84c66894fd-nbxpw (10.45.171.169) -> cilium-test/echo-other-node-666d8db686-s4vwz (10.45.161.92:8080)
Test [client-ingress-to-echo-named-port-deny]:
  ❌ client-ingress-to-echo-named-port-deny/pod-to-pod/curl-ipv4-0: cilium-test/client2-84c66894fd-nbxpw (10.45.171.169) -> cilium-test/echo-other-node-666d8db686-s4vwz (10.45.161.92:8080)
Test [client-egress-to-echo-expression-deny]:
  ❌ client-egress-to-echo-expression-deny/pod-to-pod/curl-ipv4-0: cilium-test/client2-84c66894fd-nbxpw (10.45.171.169) -> cilium-test/echo-other-node-666d8db686-s4vwz (10.45.161.92:8080)
Test [client-with-service-account-egress-to-echo-deny]:
  ❌ client-with-service-account-egress-to-echo-deny/pod-to-pod/curl-ipv4-0: cilium-test/client2-84c66894fd-nbxpw (10.45.171.169) -> cilium-test/echo-other-node-666d8db686-s4vwz (10.45.161.92:8080)
Test [client-egress-to-echo-service-account-deny]:
  ❌ client-egress-to-echo-service-account-deny/pod-to-pod/curl-ipv4-0: cilium-test/client-996668d96-kw6fb (10.45.169.135) -> cilium-test/echo-other-node-666d8db686-s4vwz (10.45.161.92:8080)
Test [pod-to-pod-encryption]:
  ❌ pod-to-pod-encryption/pod-to-pod-encryption/curl-ipv4: cilium-test/client-996668d96-kw6fb (10.45.169.135) -> cilium-test/echo-other-node-666d8db686-s4vwz (10.45.161.92:8080)
connectivity test failed: 12 tests failed
```

**Comment by hustshawn** [comment]
Hi team, how is the status now? any updates?
