### ISSUE TITLE
Gateway API cross-node L7 proxy timeout with ENI mode, secondary CIDR, and kube-proxy replacement

### ISSUE THREAD

**Issue by Smana** [cilium/cilium#43493]
## What happened?

Gateway API cross-node L7 proxy traffic fails with "upstream connect error: connection timeout" when using Cilium in AWS EKS with:
- ENI IPAM mode with secondary CIDR (100.64.0.0/16) for pod IPs
- Kube-proxy replacement (native BPF)
- Native routing mode
- Prefix delegation enabled

**Expected behavior:** HTTPRoutes should route traffic to backend pods on any node.

**Actual behavior:** Envoy proxy receives the request but cannot connect to backend pods on remote nodes. The error is:
```
upstream connect error or disconnect/reset before headers. reset reason: connection timeout
```

Services are accessible within the cluster (tested with curl from debug pod - 200 OK), but Gateway API L7 proxy fails cross-node.

The ipcache shows `hastunnel` flags for remote pods even in native routing mode:
```
100.64.88.100/32    identity=12331 tunnelendpoint=10.0.29.80 flags=hastunnel    
100.64.107.228/32   identity=64835 tunnelendpoint=0.0.0.0 flags=<none>  # local pod
```

## How can we reproduce the issue?

1. Deploy EKS cluster with secondary CIDR (100.64.0.0/16) for pods
2. Install Cilium with ENI IPAM mode, kube-proxy replacement, and native routing
3. Configure subnets with tag `cilium.io/pod-subnet=true` for pod IP allocation
4. Use custom CNI config with `first-interface-index: 1` to use secondary ENIs
5. Deploy Gateway API with Tailscale LoadBalancer class
6. Create HTTPRoute pointing to a backend service
7. Access the HTTPRoute from outside the cluster - cross-node traffic times out

**Reference implementation:** https://github.com/Smana/cloud-native-ref/pull/1228

### Helm Values

```yaml
bandwidthManager:
  enabled: true
bpf:
  preallocateMaps: true
devices: "eth+ pod-id-link+"
egressMasqueradeInterfaces: eth0
eni:
  enabled: true
  awsEnablePrefixDelegation: true
cni:
  customConf: true
  configMap: cilium-cni-configuration
installNoConntrackIptablesRules: true
ipam:
  mode: eni
kubeProxyReplacement: true
loadBalancer:
  enabled: true
  mode: hybrid
socketLB:
  enabled: true
  hostNamespaceOnly: true
routingMode: native
envoy:
  enabled: true
  resources:
    limits:
      memory: 300Mi
    requests:
      cpu: 200m
      memory: 300Mi
gatewayAPI:
  enabled: true
hubble:
  relay:
    enabled: true
  ui:
    enabled: true
```

### Custom CNI ConfigMap

```json
{
  "cniVersion": "0.3.1",
  "name": "cilium",
  "plugins": [
    {
      "type": "cilium-cni",
      "enable-debug": false,
      "log-file": "/var/run/cilium/cilium-cni.log",
      "eni": {
        "first-interface-index": 1,
        "subnet-tags": {
          "cilium.io/pod-subnet": "true"
        }
      }
    }
  ]
}
```

## Cilium Version

```
Client: 1.18.5 7d4d8932 2025-12-17T04:56:47+00:00 go version go1.24.11 linux/amd64
Daemon: 1.18.5 7d4d8932 2025-12-17T04:56:47+00:00 go version go1.24.11 linux/amd64
```

## Kernel Version

```
Bottlerocket OS 1.52.0 (aws-k8s-1.34)
Kernel: 6.12.58
```

## Kubernetes Version

```
Server Version: v1.34.2-eks-b3126f4
```

## Regression

Unknown - this is our first attempt with this specific configuration.

## Related Issues

- #33967 - Gateway API: envoy doesn't proxy traffic to pod on EKS setup with kube-proxy replacement
- #35559 - Gateway API - Envoy not receiving replies - Connection timeout
- #30581 - CiliumNetworkPolicy Enforcing L7 Rules Causing Gateway to Timeout
- #29235 - CiliumIngress controller timeout in AWS ENI mode

## Anything else?

The specific scenario involves:
- **Secondary CIDR** (100.64.0.0/16) for pod IPs via ENI prefix delegation
- **Tailscale LoadBalancer** for Gateway services (works fine for non-L7 traffic)
- **Kube-proxy replacement** with native BPF
- **Native routing mode** (not tunnel)

The return traffic (SYN-ACK) from backend pods appears to not reach Envoy, suggesting a BPF datapath issue in the L7 proxy return path when using ENI mode with secondary CIDR.

Workaround attempted: `gatewayAPI.hostNetwork.enabled: true` - but this breaks the Tailscale LoadBalancer integration (Gateway shows "AddressNotAssigned").

**Comment by Smana** [comment]
**Additional regression context:**

This configuration (ENI mode + native routing + kube-proxy replacement) was working on the `main` branch approximately one month ago **without the secondary CIDR**.

The key difference in the current setup is the use of:
- Secondary CIDR (100.64.0.0/16) for pod IPs
- Custom CNI config with `first-interface-index: 1` to skip eth0 and use secondary ENIs
- Subnet tags (`cilium.io/pod-subnet=true`) to select specific subnets for pod IP allocation

This suggests the issue is specifically related to the **secondary CIDR / custom CNI configuration** rather than ENI + native routing in general.

**Comment by xtineskim** [comment]
hi @Smana, thank you for the detailed post~
are you able to paste the sysdump of your config?

**Comment by Smana** [comment]
Hi @xtineskim 

Here it is

[cilium-sysdump-20260110-200958.zip](https://github.com/user-attachments/files/24545851/cilium-sysdump-20260110-200958.zip)

**Comment by Smana** [comment]
I finally ended up [enabling Wireguard](https://github.com/Smana/cloud-native-ref/pull/1319/changes#diff-88dcd798708cc10aabdf0d8dfe4fa00600013ee67e296039ace1ead9e22d50faR82), which fixed my issue.

**Comment by kmatasfp** [comment]
I ran into similar issue, for me root cause was Cilium's envoy proxy sends backend connections through eth0 with a pod-subnet source IP, and AWS drops them because the source IP doesn't match the ENI.

Some background. 
* node subnets are ["172.16.48.0/20", "172.16.64.0/20", "172.16.80.0/20"] connected to eth0
* pods subnets are ["172.16.128.0/19", "172.16.160.0/19", "172.16.192.0/19"] connected to eth1
* 172.16.172.97.8080 is a service I want to access from outside.
* ip-172-16-51-141.ec2.internal is some node where the pod is not running

so ran a tcp dump

```
❯ kubectl run tcpdump-debug --image=nicolaka/netshoot \
        --overrides='{"spec":{"nodeName":"ip-172-16-51-141.ec2.internal","hostNetwork":true}}' \
        --rm -it --restart=Never -- \
        tcpdump -i any -nn 'host 172.16.172.97 and port 8080' -c 20
All commands and output from this session will be recorded in container logs, including credentials and sensitive information passed through the command prompt.
If you don't see a command prompt, try pressing enter.
18:01:23.466472 eth0  Out IP 172.16.135.119.44663 > 172.16.172.97.8080: Flags [S], seq 60760740, win 62727, options [mss 8961,sackOK,TS val 3706278750 ecr 0,nop,wscale 7], length 0
18:01:24.472432 eth0  Out IP 172.16.135.119.44663 > 172.16.172.97.8080: Flags [S], seq 60760740, win 62727, options [mss 8961,sackOK,TS val 3706279756 ecr 0,nop,wscale 7], length 0
18:01:25.512435 eth0  Out IP 172.16.135.119.44663 > 172.16.172.97.8080: Flags [S], seq 60760740, win 62727, options [mss 8961,sackOK,TS val 3706280796 ecr 0,nop,wscale 7], length 0
18:01:26.552412 eth0  Out IP 172.16.135.119.44663 > 172.16.172.97.8080: Flags [S], seq 60760740, win 62727, options [mss 8961,sackOK,TS val 3706281836 ecr 0,nop,wscale 7], length 0
18:01:27.602434 eth0  Out IP 172.16.135.119.44663 > 172.16.172.97.8080: Flags [S], seq 60760740, win 62727, options [mss 8961,sackOK,TS val 3706282886 ecr 0,nop,wscale 7], length 0 
```

Here I see that the source ip is 172.16.135.119 (pod subent) and it is going out over eth0. AWS does not like this and drops the connection.

Everythin works perfectly if I just do curl from the same node (ip-172-16-51-141.ec2.internal) to the service 172.16.172.97.8080, just an issue with how cilium routes traffic in this case

After manually patching the routing rules on the node, things worked as expected, so not sure where things went wrong and routing rules are not properly populated:

This was the fix:
```
kubectl run route-fix --image=nicolaka/netshoot \
  --overrides='{"spec":{"nodeName":"ip-172-16-51-141.ec2.internal","hostNetwork":true,"containers":[{"name":"route-fix","image":"nicolaka/netshoot","command":["ip","rule","add","from","172.16.135.119","lookup","11","priority","111"],"securityContext":{"privileged":true}}]}}' \
  --rm -it --restart=Never
````

**Comment by kmatasfp** [comment]
Did more digging, looks like the correct routing rule is added cilium agent startup, but then it is later deleted for some reason:
```
kubectl -n kube-system logs cilium-rbk6b | grep -iE "ingress.*(route|rule|routing|eni|mac|gateway|configure)"
time=2026-02-12T19:15:45.262619652Z level=debug source=/go/src/github.com/cilium/cilium/pkg/datapath/linux/routing/routing.go:298 msg="Deleted ingress rule" endpointID=2624 containerID="" ciliumEndpointName=/ datapathPolicyRevision=0 identity=8 ipv6="" ipv4=172.16.135.119 containerInterface="" k8sPodName=/ desiredPolicyRevision=0 subsys=endpoint rule="20: from all to 172.16.135.119/32 lookup main proto unspec" ipAddr=172.16.135.119/32
```

**Comment by kmatasfp** [comment]
Hopefully this is helpful to the maintainers. Summary of my investigation (disclaimer - used AI to help me producing this github summary comment, investigation done by me)

**Cilium Version:** 1.18.6 (also confirmed same issue in 1.19.0 source)
**Kernel Version:** 6.12.63 (Bottlerocket OS on EKS)
**Kubernetes Version:** 1.32
**Installation Method:** Helm

### Configuration

#### Helm values
```
ipam.mode: eni
eni.enabled: true
eni.awsEnablePrefixDelegation: true
kubeProxyReplacement: true
routingMode: native
gatewayAPI.enabled: true
```
#### Custom CNI config
```
"plugins":[{"cniVersion":"0.3.1","eni":{"first-interface-index":1,"security-groups":["sg-A"],"subnet-ids":["subnet-A","subnet-B","subent-C"[]},"type":"cilium-cni"}]
```

#### What happened
After a Cilium agent restart, cross-node Gateway API routing fails with HTTP 503 errors. Traffic works when the NLB routes to the same node as the backend pod, but fails when it routes to a different node.
The root cause is that the ingress endpoint's ip routing rules (installed by `allocateIngressIPs()` during startup) are deleted shortly after by `regenerateRestoredEndpoints()`, which incorrectly cleans up the restored ingress endpoint.

#### When this occurs
This bug only manifests in ENI mode configurations where pod subnets are on secondary ENIs (separate from the node subnet on `eth0`). In this configuration, each ENI has its own routing table (e.g. table `11 = RouteTableInterfacesOffset(10) + InterfaceNumber(1)`), and ip rules are needed to direct traffic sourced from secondary ENI IPs through the correct routing table.
If nodes and pods share the same subnet on `eth0`, the default routing table handles all traffic and the deleted rules have no impact.

Affected setup:
| Subnet type | CIDRs | Interface |
|---|---|---|
| Node subnets | `172.16.48.0/20`, `172.16.64.0/20`, `172.16.80.0/20` | `eth0` |
| Pod subnets | `172.16.128.0/19`, `172.16.160.0/19`, `172.16.192.0/19` | `Secondary ENI` |

Ingress IPs are allocated from pod subnets (on secondary ENIs).

Two ip rules are installed by `Configure()` for the ingress IP:
| Priority | Constant | Rule | Purpose |
|---|---|---|---|
| `20` | `RulePriorityIngress` | `to <ingress-ip> lookup main` | Routes inbound traffic to the ingress IP via the main table |
| `111` | `RulePriorityEgressv2` | `from <ingress-ip> lookup <eni-table>` | Routes outbound traffic from the ingress IP through the correct ENI |

Without these rules, traffic sourced from the ingress IP exits via eth0 with a source IP that doesn't belong to eth0's subnet, and AWS drops it (VPC source/destination check).

#### How to reproduce
1. Deploy Cilium with `gatewayAPI.enabled: true` and `ipam.mode: eni` on a multi-node EKS cluster with separate node and pod subnets (secondary ENIs for pod CIDRs)
2. Create a `Gateway` and `HTTPRoute` pointing to a backend `Service`
3. Verify cross-node routing works
4. Restart the Cilium agent (e.g. `kubectl rollout restart ds/cilium -n kube-system`)
5. Cross-node routing via the Gateway returns `503`

#### Root cause analysis
During agent startup, the following sequence occurs:
1. `allocateIngressIPs()` ( [daemon/cmd/ipam.go](https://github.com/cilium/cilium/blob/95896696119f33a0f5d21019182192fcdab3600f/daemon/cmd/ipam.go#L321) ) runs and installs ip rules for the ingress IP via `RoutingInfo.Configure()` ( [pkg/datapath/linux/routing/routing.go](https://github.com/cilium/cilium/blob/v1.18.6/pkg/datapath/linux/routing/routing.go#L43) ). This installs two rules:
   - Priority 20 ingress rule ( [routing.go](https://github.com/cilium/cilium/blob/v1.18.6/pkg/datapath/linux/routing/routing.go#L81), using `linux_defaults.RulePriorityIngress )`
   - Priority 111 egress rule ( [routing.go](https://github.com/cilium/cilium/blob/95896696119f33a0f5d21019182192fcdab3600f/pkg/datapath/linux/routing/routing.go#L118), `using linux_defaults.RulePriorityEgressv2)`

   Both constants are defined in [pkg/datapath/linux/linux_defaults/linux_defaults.go](https://github.com/cilium/cilium/blob/v1.18.6/pkg/datapath/linux/linux_defaults/linux_defaults.go).

2. `fetchOldEndpoints()` ( [daemon/cmd/state.go](https://github.com/cilium/cilium/blob/v1.18.6/daemon/cmd/state.go#L149) ) reads serialized endpoint state from disk, including the previous ingress endpoint which has `ifName: ""` (empty string — by design, since the ingress endpoint is virtual with no veth pair, see `CreateIngressEndpoint()` in [pkg/endpoint/endpoint.go](https://github.com/cilium/cilium/blob/95896696119f33a0f5d21019182192fcdab3600f/pkg/endpoint/endpoint.go#L683) ).
3. `restoreOldEndpoints()` ( [daemon/cmd/state.go](https://github.com/cilium/cilium/blob/v1.18.6/daemon/cmd/state.go#L187) ) iterates over restored endpoints and calls `validateEndpoint()` ( [daemon/cmd/state.go](https://github.com/cilium/cilium/blob/v1.18.6/daemon/cmd/state.go#L79) ) for each one. This function has a guard for the health endpoint:
```   
   if ep.HasLabels(labels.LabelHealth) {
       // clean up state dir, return false, nil
   }
```
   
There is no equivalent guard for the ingress endpoint. It falls through to step 4.

4. `ValidateConnectorPlumbing()` ( [pkg/endpoint/bpf.go](https://github.com/cilium/cilium/blob/v1.18.6/pkg/endpoint/bpf.go#L1652) ) unconditionally calls `linkChecker(e.ifName)`. For the ingress endpoint, this is `linkChecker("")`, which fails because there is no interface named `""`. The function returns "interface  could not be found".
   Note: `CheckHealth()` ( [pkg/endpoint/bpf.go](https://github.com/cilium/cilium/blob/v1.18.6/pkg/endpoint/bpf.go#L1665) ) in the same file correctly handles empty interface names:
     
```
 iface := ep.HostInterface()
 if iface == "" {
       return nil
 }
```   
But `ValidateConnectorPlumbing()` has no such guard.

5. `validateEndpoint()` returns `valid=false, err=<interface error>, so the endpoint is added to state.toClean`.
6. `regenerateRestoredEndpoints()` ( [daemon/cmd/state.go](https://github.com/cilium/cilium/blob/v1.18.6/daemon/cmd/state.go#L212)) calls `RemoveEndpoint()`  ( [pkg/endpointmanager/manager.go](https://github.com/cilium/cilium/blob/95896696119f33a0f5d21019182192fcdab3600f/daemon/cmd/state.go#L341) ) for each endpoint in `state.toClean`.
7. `RemoveEndpoint()` → `Delete()` → `linuxrouting.Delete()` ( [pkg/datapath/linux/routing/routing.go](https://github.com/cilium/cilium/blob/v1.18.6/pkg/datapath/linux/routing/routing.go#L264) ) which deletes all ip rules for the ingress IP, including both the priority `20` ingress rule and the priority `111` egress rule that `allocateIngressIPs()` installed in step 1.
8. Neither rule is re-created because `allocateIngressIPs()` already ran. Cross-node Gateway API routing is broken until the next agent restart (which repeats the same cycle).

#### From the logs
```
time=2026-02-13T00:48:14.895Z level=warn msg="Unable to restore endpoint, ignoring" endpointID=283 error="interface  could not be found"
time=2026-02-13T00:48:15.222Z level=debug msg="Deleting endpoint routing rules" ipv4=172.16.202.67 identity=8 endpointID=283
time=2026-02-13T00:48:15.236Z level=debug msg="Deleted ingress rule" ipv4=172.16.202.67 endpointID=283 identity=8 rule="20: from all to 172.16.202.67/32 lookup main proto unspec"
```

The empty interface name in "interface  could not be found" shows the ingress endpoint (with `ifName: ""`) is failing `ValidateConnectorPlumbing`.

#### Workaround

##### Option 1
A DaemonSet running on each node that detects the missing ip rule and re-adds it after Cilium starts:

```
INGRESS_IP=$(curl -s $API_SERVER/apis/cilium.io/v2/ciliumnodes/$NODE_NAME \
  | jq -r '.spec.ingress.ipv4')
if ! ip rule show priority 111 | grep -q "from $INGRESS_IP"; then
    ip rule add from "$INGRESS_IP" lookup 11 priority 111
fi
...
```

##### Option 2
Enable encryption between nodes

In case you enable encryption ingress uses `cilium_wg0` interface to leave the node and AWS does not drop the connection in this case, see following `tcpdump`

```
06:57:09.350207 cilium_wg0 Out IP 172.16.135.119.37311 > 172.16.172.97.8080: Flags [S], seq 3554239318, win 62727, options [mss 8961,sackOK,TS val 3752824633 ecr 0,nop,wscale 7], length 0
06:57:09.351578 cilium_wg0 In  IP 172.16.172.97.8080 > 172.16.135.119.37311: Flags [S.], seq 1149161316, ack 3554239319, win 62083, options [mss 8881,sackOK,TS val 3644883164 ecr 3752824633,nop,wscale 7], length 0
06:57:09.351603 cilium_net Out IP 172.16.172.97.8080 > 172.16.135.119.37311: Flags [S.], seq 1149161316, ack 3554239319, win 62083, options [mss 8881,sackOK,TS val 3644883164 ecr 3752824633,nop,wscale 7], length 0
06:57:09.351615 cilium_host In  IP 172.16.172.97.8080 > 172.16.135.119.37311: Flags [S.], seq 1149161316, ack 3554239319, win 62083, options [mss 8881,sackOK,TS val 3644883164 ecr 3752824633,nop,wscale 7], length 0
06:57:09.351666 cilium_wg0 Out IP 172.16.135.119.37311 > 172.16.172.97.8080: Flags [.], ack 1, win 491, options [nop,nop,TS val 3752824635 ecr 3644883164], length 0
06:57:09.351826 cilium_wg0 Out IP 172.16.135.119.37311 > 172.16.172.97.8080: Flags [P.], seq 1:227, ack 1, win 491, options [nop,nop,TS val 3752824635 ecr 3644883164], length 226: HTTP: GET / HTTP/1.1
06:57:09.352998 cilium_wg0 In  IP 172.16.172.97.8080 > 172.16.135.119.37311: Flags [.], ack 227, win 484, options [nop,nop,TS val 3644883166 ecr 3752824635], length 0
06:57:09.353023 cilium_net Out IP 172.16.172.97.8080 > 172.16.135.119.37311: Flags [.], ack 227, win 484, options [nop,nop,TS val 3644883166 ecr 3752824635], length 0
06:57:09.353026 cilium_host In  IP 172.16.172.97.8080 > 172.16.135.119.37311: Flags [.], ack 227, win 484, options [nop,nop,TS val 3644883166 ecr 3752824635], length 0
06:57:09.353194 cilium_wg0 In  IP 172.16.172.97.8080 > 172.16.135.119.37311: Flags [P.], seq 1:946, ack 227, win 484, options [nop,nop,TS val 3644883166 ecr 3752824635], length 945: HTTP: HTTP/1.1 200 OK
06:57:09.353217 cilium_net Out IP 172.16.172.97.8080 > 172.16.135.119.37311: Flags [P.], seq 1:946, ack 227, win 484, options [nop,nop,TS val 3644883166 ecr 3752824635], length 945: HTTP: HTTP/1.1 200 OK
06:57:09.353219 cilium_host In  IP 172.16.172.97.8080 > 172.16.135.119.37311: Flags [P.], seq 1:946, ack 227, win 484, options [nop,nop,TS val 3644883166 ecr 3752824635], length 945: HTTP: HTTP/1.1 200 OK
06:57:09.353257 cilium_wg0 Out IP 172.16.135.119.37311 > 172.16.172.97.8080: Flags [.], ack 946, win 484, options [nop,nop,TS val 3752824636 ecr 3644883166], length 0
06:57:09.353265 cilium_wg0 In  IP 172.16.172.97.8080 > 172.16.135.119.37311: Flags [P.], seq 946:3975, ack 227, win 484, options [nop,nop,TS val 3644883166 ecr 3752824635], length 3029: HTTP
06:57:09.353275 cilium_net Out IP 172.16.172.97.8080 > 172.16.135.119.37311: Flags [P.], seq 946:3975, ack 227, win 484, options [nop,nop,TS val 3644883166 ecr 3752824635], length 3029: HTTP
06:57:09.353275 cilium_host In  IP 172.16.172.97.8080 > 172.16.135.119.37311: Flags [P.], seq 946:3975, ack 227, win 484, options [nop,nop,TS val 3644883166 ecr 3752824635], length 3029: HTTP
06:57:09.353283 cilium_wg0 Out IP 172.16.135.119.37311 > 172.16.172.97.8080: Flags [.], ack 3975, win 461, options [nop,nop,TS val 3752824636 ecr 3644883166], length 0
06:57:17.312640 cilium_wg0 Out IP 172.16.135.119.38425 > 172.16.172.97.8080: Flags [F.], seq 1271987266, ack 1418228148, win 490, options [nop,nop,TS val 3752832596 ecr 3644831117], length 0
06:57:17.314242 cilium_wg0 In  IP 172.16.172.97.8080 > 172.16.135.119.38425: Flags [F.], seq 1, ack 1, win 440, options [nop,nop,TS val 3644891127 ecr 3752832596], length 0
06:57:17.314266 cilium_net Out IP 172.16.172.97.8080 > 172.16.135.119.38425: Flags [F.], seq 1, ack 1, win 440, options [nop,nop,TS val 3644891127 ecr 3752832596], length 0
```

Flow:
`envoy (src: 172.16.135.119) → cilium_wg0 → [encrypted over eth0] → remote node → cilium_wg0 → pod (172.16.172.97)`

For brevity TCP dump without encryption
```
18:01:23.466472 eth0  Out IP 172.16.135.119.44663 > 172.16.172.97.8080: Flags [S], seq 60760740, win 62727, options [mss 8961,sackOK,TS val 3706278750 ecr 0,nop,wscale 7], length 0
18:01:24.472432 eth0  Out IP 172.16.135.119.44663 > 172.16.172.97.8080: Flags [S], seq 60760740, win 62727, options [mss 8961,sackOK,TS val 3706279756 ecr 0,nop,wscale 7], length 0
18:01:25.512435 eth0  Out IP 172.16.135.119.44663 > 172.16.172.97.8080: Flags [S], seq 60760740, win 62727, options [mss 8961,sackOK,TS val 3706280796 ecr 0,nop,wscale 7], length 0
18:01:26.552412 eth0  Out IP 172.16.135.119.44663 > 172.16.172.97.8080: Flags [S], seq 60760740, win 62727, options [mss 8961,sackOK,TS val 3706281836 ecr 0,nop,wscale 7], length 0
18:01:27.602434 eth0  Out IP 172.16.135.119.44663 > 172.16.172.97.8080: Flags [S], seq 60760740, win 62727, options [mss 8961,sackOK,TS val 3706282886 ecr 0,nop,wscale 7], length 0 
```

Flow
`envoy (src: 172.16.135.119) → local node eth0 → VPC (dropped here) → remote node eth0 → pod (172.16.172.97)`

**Comment by bodgit** [comment]
I've just bumped into this, I had `eni.nodeSpec.firstInterfaceIndex: 1` set just to put the Pod IP addresses on a dedicated ENI which I figured might come in handy at some point. Both ENI's were still getting IP addresses from the same subnet.

I was getting intermittent 503 errors until I removed that config so all the IP addresses are back on the first/only ENI and now I don't get any errors.

Edit: running Cilium 1.19.1

**Comment by briantopping** [comment]
We're experiencing the same class of issue on bare-metal with VXLAN tunneling (not ENI), confirming this affects more than just ENI-mode clusters.

### Environment

- Cilium 1.19.1, `external-envoy-proxy: true`, `kube-proxy-replacement: true`
- IPv6 dual-stack, VXLAN tunnel mode
- Talos Linux, kernel 6.18.9
- Gateway API with wildcard TLS cert

### Symptoms

- Cross-node Gateway API HTTPS requests: ~60% take 5-7 seconds (consistent with TCP retransmission backoff: 1+2+4=7s)
- Same-node (Envoy + backend pod co-located): consistently fast (70-160ms)
- HTTP (port 80) through same Gateway: consistently fast (30ms)
- Direct port-forward to backend pod: consistently fast (75ms)
- Through ClusterIP from inside cluster: consistently fast (<1ms)
- Server OTel traces show 15-25ms processing; `x-envoy-upstream-service-time` reports 5000-7000ms
- Zero eBPF drops on both nodes during slow requests (`cilium-dbg monitor --type drop`)

### Same log signature on every node

```
level=warn msg="Unable to restore endpoint, ignoring" endpointID=1730 ciliumEndpointName=/ error="interface  could not be found"
level=warn msg="Unable to restore endpoint, ignoring" endpointID=1260 ciliumEndpointName=/ error="interface  could not be found"
level=warn msg="Unable to restore endpoint, ignoring" endpointID=214  ciliumEndpointName=/ error="interface  could not be found"
level=warn msg="Unable to restore endpoint, ignoring" endpointID=1250 ciliumEndpointName=/ error="interface  could not be found"
level=warn msg="Unable to restore endpoint, ignoring" endpointID=748  ciliumEndpointName=/ error="interface  could not be found"
level=warn msg="Unable to restore endpoint, ignoring" endpointID=3276 ciliumEndpointName=/ error="interface  could not be found"
```

All 6 nodes. The ingress endpoint with `ifName: ""` fails `ValidateConnectorPlumbing` on every agent restart.

### Why VXLAN mode is intermittent (not hard failure like ENI)

On ENI, the deleted ip rules cause the kernel to route the ingress endpoint's traffic out `eth0` with a source IP that doesn't belong to that interface — AWS VPC drops it (100% failure).

On VXLAN, the mechanism is different. The ingress endpoint (e.g. `fd00:10:244:2::9342`) has an IPv6 address but no real network interface — no veth, no lxc. It's a virtual endpoint:

```
ENDPOINT   POLICY (ingress)   POLICY (egress)   IDENTITY   LABELS               IPv6                    STATUS
4058       Disabled           Disabled          8          reserved:ingress      fd00:10:244:2::9342     ready
```

When the return packet arrives on the Envoy node via VXLAN destined for `fd00:10:244:2::9342`, the eBPF program finds this endpoint but there's no `ifindex` to redirect the packet to. Delivery relies entirely on the kernel TPROXY socket lookup to find Envoy's listening socket. When this lookup fails (the connection uses `IP_TRANSPARENT` with a fabricated source address), the packet is silently dropped — no eBPF drop counter is incremented because the drop happens in the kernel TPROXY path, not in the eBPF program.

The intermittent nature on VXLAN (~60% of requests) is consistent with the TPROXY socket lookup sometimes succeeding and sometimes failing. Recovery via TCP retransmission produces the 5-7 second delay (matching exponential backoff).

### Observations from `cilium-dbg monitor`

On the Envoy node, the upstream connections from the ingress endpoint appear as `state unknown`:

```
-> overlay flow ... identity ingress->1698 state unknown ifindex cilium_vxlan
   [fd00:10:244:2::9342]:46073 -> [fd00:10:244:4::4878]:4000 tcp ACK
```

On the backend pod's node, the response leaves normally via overlay:

```
-> overlay flow ... identity 1698->ingress state reply ifindex cilium_vxlan
   [fd00:10:244:4::4878]:4000 -> [fd00:10:244:2::9342]:39433 tcp ACK
```

But the Envoy node's monitor does not show the return traffic arriving — the response packets are not visible in the trace between arriving on `cilium_vxlan` and being delivered to Envoy.

### Envoy stats confirm instant TCP connect, delayed request processing

```
upstream_cx_connect_ms_sum:  99.7ms over 228 connections (avg 0.44ms)
upstream_cx_connect_fail:    0
upstream_cx_connect_timeout: 0
upstream_cx_http1_total:     228 (all HTTP/1.1, zero HTTP/2)
upstream_rq_pending_total:   228 (every request pends before dispatch)
```

TCP connections establish instantly, but the HTTP request/response exchange is delayed.

### WireGuard made our deployment worse

Enabling WireGuard on our deployment per @kmatasfp's comment changed the behavior from intermittent 5-7s to a hard 5s on every request (100% affected). Reverted.

### Workaround

Same-node scheduling (`nodeSelector`) eliminates the issue — when Envoy and the backend pod are on the same node, requests are consistently fast.

### Not the cause

We ruled out: request headers, content type, response size, auth tokens, HTTP/1.1 vs HTTP/2, TLS handshake, `grpc_web` filter, route timeout config, `host-legacy-routing: true`, `externalTrafficPolicy: Local`.

**Comment by andrejvanderzee** [comment]
We have same issue since upgrading from 1.18.2 to 1.19.4.
Exactly same settings in both version 1.18.2 fails cross-node traffic resulting in Envoy timeouts.

```
    kubeProxyReplacement = true
    routingMode          = "native"
    enableIPv4Masquerade = false
  cni = {
      chainingMode = "aws-cni"
      exclusive    = false
    }
    encryption = {
      enabled        = true
      type           = "wireguard"
      nodeEncryption = true
    }
```

We also use  chain-mode with AWS CNI and ENIConfig with secondary CIDR for PODs

**Comment by Smana** [comment]
Requesting a reopen — this was closed by the stale bot without triage, and the scope has grown beyond the original report.

Original setup: EKS, Cilium ENI IPAM with prefix delegation, native routing — the BPF ipcache sets the tunnel flag incorrectly for remote pod IPs, breaking Gateway API L7 proxying cross-node. Our only viable workaround remains `encryption.type: wireguard`, which we still run today on **v1.20.1** (fresh EKS 1.36 cluster, 2026-09-01); nothing in the 1.20.x changelogs indicates a fix, and we have not risked disabling the workaround to re-reproduce.

Since the report, other commenters in this thread have described what looks like the same class of issue on quite different datapaths: bare-metal VXLAN + IPv6 on 1.19.1, and aws-cni chaining mode where even the WireGuard workaround reportedly does not help. That suggests the underlying ipcache/tunnel-flag problem is broader than ENI + prefix delegation.

Happy to provide fresh sysdumps or a reproduction from our reference environment (config public at https://github.com/Smana/cloud-native-ref) if it helps triage.
