### ISSUE TITLE
XDP and DSR do not establish connection to NodePort without a backend pod

### ISSUE THREAD

**Issue by verdel** [cilium/cilium#37961]
### Is there an existing issue for this?

- [x] I have searched the existing issues

### Version

v1.16.5

### What happened?

1. I created an RKE2 cluster in Rancher on VMware vSphere VM with one master node and two worker nodes in plain L2 network. We use vmxnet3 VM adapters:
```
kubectl get node -o wide
NAME                               STATUS   ROLES                       AGE     VERSION          INTERNAL-IP   EXTERNAL-IP   OS-IMAGE             KERNEL-VERSION     CONTAINER-RUNTIME
control-vl584-l9ld5                Ready    control-plane,etcd,master   7m13s   v1.30.9+rke2r1   10.236.2.27   10.236.2.27   Ubuntu 24.04.2 LTS   6.8.0-53-generic   containerd://1.7.23-k3s2
worker-gw-528xw-bjwtl              Ready    worker                      3m23s   v1.30.9+rke2r1   10.236.2.29   10.236.2.29   Ubuntu 24.04.2 LTS   6.8.0-53-generic   containerd://1.7.23-k3s2
worker-gw-528xw-c982r              Ready    worker                      3m21s   v1.30.9+rke2r1   10.236.2.28   10.236.2.28   Ubuntu 24.04.2 LTS   6.8.0-53-generic   containerd://1.7.23-k3s2
```
2. Cilium was installed from the Helm chart v1.16.5 with the following parameters:
```yaml
autoDirectNodeRoutes: true
bandwidthManager:
  bbr: true
  enabled: true
bpf:
  hostLegacyRouting: false
  masquerade: true
cni:
  chainingMode: none
enableIPv4BIGTCP: true
envoy:
  enabled: false
externalIPs:
  enabled: true
global:
  cattle:
    clusterId: c-m-z8zwv8gf
  clusterCIDR: 10.42.0.0/16
  clusterCIDRv4: 10.42.0.0/16
  clusterDNS: 10.43.0.10
  clusterDomain: cluster.local
  rke2DataDir: /var/lib/rancher/rke2
  serviceCIDR: 10.43.0.0/16
  systemDefaultIngressClass: ingress-nginx
hubble:
  enabled: false
ipv4NativeRoutingCIDR: 10.42.0.0/16
k8sServiceHost: localhost
k8sServicePort: "6443"
kubeProxyReplacement: true
l2announcements:
  enabled: true
  leaseDuration: 3s
  leaseRenewDeadline: 1s
  leaseRetryPeriod: 200ms
loadBalancer:
  acceleration: native
  algorithm: maglev
  mode: hybrid
nodePort:
  enabled: true
routingMode: native
```
```
CNI Chaining:           none
IPv4 BIG TCP:           Enabled   [65536]
BandwidthManager:       EDT with BPF [BBR] [ens33]
Routing:                Network: Native   Host: BPF
Masquerading:           BPF   [ens33]   10.42.0.0/16 [IPv4: Enabled, IPv6: Disabled]
KubeProxyReplacement Details:
  Status:                 True
  Socket LB:              Enabled
  Socket LB Tracing:      Enabled
  Socket LB Coverage:     Full
  Devices:                ens33  10.236.2.29 (Direct Routing)
  Mode:                   Hybrid
    DSR Dispatch Mode:    IP Option/Extension
  Backend Selection:      Maglev (Table Size: 16381)
  Session Affinity:       Enabled
  Graceful Termination:   Enabled
  NAT46/64 Support:       Disabled
  XDP Acceleration:       Native
  Services:
  - ClusterIP:      Enabled
  - NodePort:       Enabled (Range: 30000-32767)
  - LoadBalancer:   Enabled
  - externalIPs:    Enabled
  - HostPort:       Enabled
```
3. A deployment with one replica of Nginx was created:
```yaml
apiVersion: apps/v1
kind: Deployment
metadata:
  name: my-nginx
  namespace: test
spec:
  selector:
    matchLabels:
      run: my-nginx
  replicas: 1
  template:
    metadata:
      labels:
        run: my-nginx
    spec:
      containers:
        - name: my-nginx
          image: nginx
          ports:
            - containerPort: 80
```
4. A service with NodePort type for Nginx was created (:
```yaml
apiVersion: v1
kind: Service
metadata:
  name: my-service-nodeport
  namespace: test
spec:
  externalTrafficPolicy: Cluster
  internalTrafficPolicy: Cluster
  ports:
    - name: http
      port: 80
      protocol: TCP
      targetPort: 80
  selector:
    run: my-nginx
  type: NodePort
```
5. Here are all the k8s resources that interest us:
```shell
kubectl get node,pod,service -o wide
NAME                                    STATUS   ROLES                       AGE   VERSION          INTERNAL-IP   EXTERNAL-IP   OS-IMAGE             KERNEL-VERSION     CONTAINER-RUNTIME
node/control-vl584-l9ld5                Ready    control-plane,etcd,master   14m   v1.30.9+rke2r1   10.236.2.27   10.236.2.27   Ubuntu 24.04.2 LTS   6.8.0-53-generic   containerd://1.7.23-k3s2
node/worker-gw-528xw-bjwtl              Ready    worker                      10m   v1.30.9+rke2r1   10.236.2.29   10.236.2.29   Ubuntu 24.04.2 LTS   6.8.0-53-generic   containerd://1.7.23-k3s2
node/worker-gw-528xw-c982r              Ready    worker                      10m   v1.30.9+rke2r1   10.236.2.28   10.236.2.28   Ubuntu 24.04.2 LTS   6.8.0-53-generic   containerd://1.7.23-k3s2

NAME                           READY   STATUS    RESTARTS   AGE     IP            NODE                               NOMINATED NODE   READINESS GATES
pod/my-nginx-fdd6574f7-kjfb2   1/1     Running   0          2m19s   10.42.1.129   worker-gw-528xw-bjwtl                <none>           <none>

NAME                          TYPE       CLUSTER-IP      EXTERNAL-IP   PORT(S)        AGE     SELECTOR
service/my-service-nodeport   NodePort   10.43.203.150   <none>        80:31638/TCP   2m10s   run=my-nginx
```
6. The pod is running on the worker node `worker-gw-528xw-bjwtl` with the external address `10.236.2.29`. If I make a curl request to the NodePort - 31638 of this node, everything works fine. But if I make a request to the address of the second worker node, which does not have the nginx pod - `worker-gw-528xw-c982r` (10.236.2.28), the connection fails
```shell
> curl -v http://10.236.2.29:31638
* Rebuilt URL to: http://10.236.2.29:31638/
*   Trying 10.236.2.29...
* TCP_NODELAY set
* Connected to 10.236.2.29 (10.236.2.29) port 31638 (#0)
> GET / HTTP/1.1
> Host: 10.236.2.29:31638
> User-Agent: curl/7.58.0
> Accept: */*
>
< HTTP/1.1 200 OK
< Server: nginx/1.27.4
< Date: Mon, 03 Mar 2025 13:21:56 GMT
< Content-Type: text/html
< Content-Length: 615
< Last-Modified: Wed, 05 Feb 2025 11:06:32 GMT
< Connection: keep-alive
< ETag: "67a34638-267"
< Accept-Ranges: bytes
<
<!DOCTYPE html>
<html>
<head>
<title>Welcome to nginx!</title>
<style>
html { color-scheme: light dark; }
body { width: 35em; margin: 0 auto;
font-family: Tahoma, Verdana, Arial, sans-serif; }
</style>
</head>
<body>
<h1>Welcome to nginx!</h1>
<p>If you see this page, the nginx web server is successfully installed and
working. Further configuration is required.</p>

<p>For online documentation and support please refer to
<a href="http://nginx.org/">nginx.org</a>.<br/>
Commercial support is available at
<a href="http://nginx.com/">nginx.com</a>.</p>

<p><em>Thank you for using nginx.</em></p>
</body>
</html>

> curl -v http://10.236.2.28:31638
* Rebuilt URL to: http://10.236.2.28:31638/
*   Trying 10.236.2.28...
* TCP_NODELAY set
```

If we use SNAT mode instead of DSR, the issue persists.

### How can we reproduce the issue?

Install Cilium from the Helm chart v1.16.5 with the following parameters:

```yaml
autoDirectNodeRoutes: true
bandwidthManager:
  bbr: true
  enabled: true
bpf:
  hostLegacyRouting: false
  masquerade: true
cni:
  chainingMode: none
enableIPv4BIGTCP: true
envoy:
  enabled: false
externalIPs:
  enabled: true
global:
  cattle:
    clusterId: c-m-z8zwv8gf
  clusterCIDR: 10.42.0.0/16
  clusterCIDRv4: 10.42.0.0/16
  clusterDNS: 10.43.0.10
  clusterDomain: cluster.local
  rke2DataDir: /var/lib/rancher/rke2
  serviceCIDR: 10.43.0.0/16
  systemDefaultIngressClass: ingress-nginx
hubble:
  enabled: false
ipv4NativeRoutingCIDR: 10.42.0.0/16
k8sServiceHost: localhost
k8sServicePort: "6443"
kubeProxyReplacement: true
l2announcements:
  enabled: true
  leaseDuration: 3s
  leaseRenewDeadline: 1s
  leaseRetryPeriod: 200ms
loadBalancer:
  acceleration: native
  algorithm: maglev
  mode: hybrid
nodePort:
  enabled: true
routingMode: native
```

### Cilium Version

v1.16.5-ad688277

### Kernel Version

6.8.0-53-generic

### Kubernetes Version

v1.30.9+rke2r1

### Sysdump

[cilium-sysdump-20250303-162547.zip](https://github.com/user-attachments/files/19053949/cilium-sysdump-20250303-162547.zip)

### Relevant log output

```shell

```

### Cilium Users Document

- [ ] Are you a user of Cilium? Please add yourself to the [Users doc](https://github.com/cilium/cilium/blob/main/USERS.md)

### Code of Conduct

- [x] I agree to follow this project's Code of Conduct

**Comment by verdel** [comment]
I additionally investigated network packets using xdpdump and discovered that with XDP enabled, as well as without it, an outgoing network packet is formed with the client’s source address and the pod address as the destination address.

After that, the packet is dropped by the ESXi hypervisor (the k8s cluster nodes are running as virtual machines in VMware vSphere).

I will try to find the reason why the hypervisor or virtual switch is dropping the packets.

**Comment by julianwiedmann** [comment]
:wave: I'm a bit unsure what exact config combination is failing for you. Maybe you want to spend a few more cycles on fleshing this out? The title implies XDP and DSR, but the text says you're also seeing the same symptoms with SNAT.

**Comment by verdel** [comment]
@julianwiedmann, yes, you’re right. I incorrectly named the issue, as DSR definitely does not affect the behavior described. Also, I believe the issue is not with XDP itself, but with the settings of VMware vSphere, which is used to run virtual machines with the K8s cluster nodes.

We can either close this issue or change the title and wait until I receive traffic dumps from various Capture Points of the ESXi hypervisor stack. After that, I will be able to describe what the issue was, and we can close the issue.

**Comment by julianwiedmann** [comment]
> We can either close this issue or change the title and wait until I receive traffic dumps from various Capture Points of the ESXi hypervisor stack. After that, I will be able to describe what the issue was, and we can close the issue.

Let's close then :). Feel tree to add any conclusions once you have them, or re-open if you're able to pinpoint the exact problem a bit more.

**Comment by fmiqbal** [comment]
yea, got the same exact issue, with almost same configuration, the thing that make it work/not work is `loadbalancer.acceleration`, suspecting XDP, came from almost exact environment too, rke2 1.31, vmware vsphere 7.0.3.01900 with cilium 1.17.1

```
rke2-cilium:
  MTU: 1400
  tunnelProtocol: geneve
  autoDirectNodeRoutes: true
  enableIPv4BIGTCP: true
  installNoConntrackIptablesRules: true
  bandwidthManager:
    enabled: true
    bbr: true
  bpfClockProbe: true
  bpf:
    hostLegacyRouting: false
    mapDynamicSizeRatio: 0.08
    distributedLRU:
      enabled: true
    events:
      trace:
        enabled: false
      monitorInterval: 10s
    masquerade: true
    datapathMode: netkit
  enableIPv6Masquerade: false
  dashboards:
    annotations:
      grafana_folder: Cilium
    enabled: true
    namespace: kube-system
  egressGateway:
    enabled: true
  endpointRoutes:
    enabled: true
  envoy:
    enabled: true
    prometheus:
      serviceMonitor:
        enabled: true
  externalIPs:
    enabled: true
  gatewayAPI:
    enabled: true
  hubble:
    eventQueueSize: 32768
    enabled: true
    metrics:
      dashboards:
        enabled: true
        annotations:
          grafana_folder: Hubble
        namespace: cattle-dashboards
      enableOpenMetrics: true
      enabled:
        - dns
        - drop
        - tcp
        - flow
        - icmp
        - port-distribution
        - 'httpV2:exemplars=true;labelsContext=source_ip,source_namespace,source_workload,destination_ip,destination_namespace,destination_workload,traffic_direction;sourceContext=workload-name|reserved-identity;destinationContext=workload-name|reserved-identity'
      serviceMonitor:
        enabled: true
    relay:
      enabled: true
      podAnnotations:
        cluster-autoscaler.kubernetes.io/safe-to-evict: "true"
      prometheus:
        enabled: true
        serviceMonitor:
          enabled: true
    ui:
      enabled: true
      podAnnotations:
        cluster-autoscaler.kubernetes.io/safe-to-evict: "true"
      service:
        type: LoadBalancer
      frontend:
        server:
          ipv6:
            enabled: false
  ingressController:
    enabled: true
  ipv4NativeRoutingCIDR: ${cluster_cidr}
  k8sClientRateLimit:
    burst: 40
    qps: 20
  k8sServiceHost: 127.0.0.1
  k8sServicePort: 6443
  kubeProxyReplacement: true
  l2announcements:
    enabled: true
  loadBalancer:
    acceleration: native
    l7:
      backend: envoy
    mode: dsr

  operator:
    dashboards:
      annotations:
        grafana_folder: Cilium
      enabled: true
      namespace: cattle-dashboards
    podAnnotations:
      cluster-autoscaler.kubernetes.io/safe-to-evict: "true"
    prometheus:
      serviceMonitor:
        enabled: true
      enabled: true
  prometheus:
    serviceMonitor:
      enabled: true
    enabled: true
  routingMode: native
```

**Comment by verdel** [comment]
@fmiqbal 

I found an issue in one of the two test installations. In the second installation, I currently don’t have direct access to the hypervisors to inspect the traffic using pktcap-uw.

In my case, if XDP and DSR are enabled in Cilium, the size of the packet forwarded from the node that doesn’t host the pod associated with the Service exceeds the MTU of the dvSwitch and the physical switch.

![Image](https://github.com/user-attachments/assets/9f16fbc4-9f72-4aa3-9b5a-ea35d60b5146)

If you observe the traffic at the point where it exits the vSwitch into the driver module (point 1), you can see a GET request with a packet length of 1522 bytes

```
> pktcap-uw --uplink vmnic0 --capture PortOutput --srcip 10.75.3.202 -o - | tcpdump-uw -r - -ennv

18:10:00.843856 00:50:56:9d:f4:01 > 00:50:56:9d:ad:6d, ethertype IPv4 (0x0800), length 86: (tos 0x0, ttl 62, id 0, offset 0, flags [DF], proto TCP (6), length 72, options (unknown 154))
    10.75.3.202.62378 > 10.42.2.108.80: Flags [S], cksum 0x00fb (correct), seq 1531388825, win 65535, options [mss 1460,nop,wscale 6,nop,nop,TS val 1696088931 ecr 0,sackOK,eol], length 0

18:10:00.849612 00:50:56:9d:f4:01 > 00:50:56:9d:ad:6d, ethertype IPv4 (0x0800), length 66: (tos 0x0, ttl 62, id 0, offset 0, flags [DF], proto TCP (6), length 52)
    10.75.3.202.62378 > 10.42.2.108.80: Flags [.], cksum 0xab59 (correct), ack 516836445, win 2059, options [nop,nop,TS val 1696088937 ecr 2599520051], length 0

18:10:00.850386 00:50:56:9d:f4:01 > 00:50:56:9d:ad:6d, ethertype IPv4 (0x0800), length 1522: (tos 0x0, ttl 62, id 0, offset 0, flags [DF], proto TCP (6), length 131)
    10.75.3.202.62378 > 10.42.2.108.80: Flags [P.], cksum 0x1879 (correct), seq 0:79, ack 1, win 2059, options [nop,nop,TS val 1696088937 ecr 2599520051], length 79: HTTP, length: 79
	GET / HTTP/1.1
	Host: 10.75.7.10:30188
	User-Agent: curl/8.7.1
	Accept: */*
```

However, if you capture the traffic at point two, these packets are no longer present.

```
> pktcap-uw --uplink vmnic0 --capture UplinkSndKernel --srcip 10.75.3.202 -o - | tcpdump-uw -r - -ennv
18:09:37.001786 00:50:56:9d:f4:01 > 00:50:56:9d:ad:6d, ethertype IPv4 (0x0800), length 86: (tos 0x0, ttl 62, id 0, offset 0, flags [DF], proto TCP (6), length 72, options (unknown 154))
    10.75.3.202.62361 > 10.42.2.108.80: Flags [S], cksum 0x9bd9 (correct), seq 3163442766, win 65535, options [mss 1460,nop,wscale 6,nop,nop,TS val 13533411 ecr 0,sackOK,eol], length 0

18:09:37.005108 00:50:56:9d:f4:01 > 00:50:56:9d:ad:6d, ethertype IPv4 (0x0800), length 66: (tos 0x0, ttl 62, id 0, offset 0, flags [DF], proto TCP (6), length 52)
    10.75.3.202.62361 > 10.42.2.108.80: Flags [.], cksum 0x236e (correct), ack 2707376570, win 2059, options [nop,nop,TS val 13533415 ecr 2599496209], length 0
```

If you increase the `MTU` in the `dvSwitch/vSwitch` settings and in the settings of the switches between the hypervisor hosts where the Kubernetes cluster worker nodes are located, the packets start passing through the entire path without any issues.

Unfortunately, I can’t explain the increase in network packet size when XDP is enabled. As I understand it, when using XDP, the packet is padded to a size equal to the MTU on interface + 22 bytes.

Here is a packet with XDP disabled

```
18:01:03.253024 00:50:56:9d:ff:8a > 00:50:56:9d:35:6f, ethertype IPv4 (0x0800), length 145: (tos 0x0, ttl 62, id 0, offset 0, flags [DF], proto TCP (6), length 131)
    10.75.3.202.58418 > 10.42.1.169.80: Flags [P.], cksum 0x0ff1 (correct), seq 0:79, ack 1, win 2059, options [nop,nop,TS val 3215757742 ecr 1812761338], length 79: HTTP, length: 79
	GET / HTTP/1.1
	Host: 10.75.7.13:32752
	User-Agent: curl/8.7.1
	Accept: */*
```

And here is one with XDP enabled:

```
18:14:11.170085 00:50:56:9d:f4:01 > 00:50:56:9d:ad:6d, ethertype IPv4 (0x0800), length 1522: (tos 0x0, ttl 62, id 0, offset 0, flags [DF], proto TCP (6), length 131)
    10.75.3.202.62575 > 10.42.2.108.80: Flags [FP.], cksum 0xaafd (correct), seq 0:79, ack 1, win 2059, options [nop,nop,TS val 3754063311 ecr 2599761926], length 79: HTTP, length: 79
	GET / HTTP/1.1
	Host: 10.75.7.10:30188
	User-Agent: curl/8.7.1
	Accept: */*
```

In the case of the second test installation, I still don’t see even the initial SYN packet on the interface of the worker node that hosts the nginx pod and where the packets should be forwarded from the worker node without this pod.

I hope I’ll be able to get access to the hypervisors’ consoles to investigate the second possible cause of the issue.

For now, I recommend trying to increase the MTU size on vSwitch and hardware network devices between ESXi node, if possible. Or decrease MTU on network interface of VM.

@julianwiedmann, maybe you can help explain why the packet size increases when XDP is used? Could this be a feature of the vmxnet3 driver in VMware vSphere rather than XDP or Cilium?
