### ISSUE TITLE
Routing loop for traffic to Service External IP not matched with Service port

### ISSUE THREAD

**Issue by dmitry-sinina** [cilium/cilium#20436]
### Is there an existing issue for this?

- [x] I have searched the existing issues

### What happened?

I am announcing service External IP over BGP to upstream routers(using MetalLb) but cilium doesn't install blackhole routes for such ranges. It causes routing loop for traffic not destined to service port.
for example:
```
$ kubectl -n yeti-production get svc
NAME                  TYPE           CLUSTER-IP      EXTERNAL-IP    PORT(S)          AGE
yeti-cli-backend      LoadBalancer   10.11.139.119   10.11.140.15   22:32539/TCP     7d17h
```
Traffic to service port delivered correctly:
```
$ telnet 10.11.140.15 22
Trying 10.11.140.15...
Connected to 10.11.140.15.
Escape character is '^]'.
```

Any other traffic to ExternaIP but not to tcp port 22:
```
$ ping 10.11.140.15
PING 10.11.140.15 (10.11.140.15) 56(84) bytes of data.
From 10.11.13.3 icmp_seq=1 Time to live exceeded
From 10.11.13.3 icmp_seq=2 Time to live exceeded
^C

$telnet 10.11.140.15 23
Trying 10.11.140.15...
telnet: Unable to connect to remote host: No route to host
```

In this case tcpdump on node looks like(see TTL values):
```
# tcpdump -i bond0 -vn -s0 host 10.11.140.15 
tcpdump: listening on bond0, link-type EN10MB (Ethernet), snapshot length 262144 bytes
07:40:02.290064 IP (tos 0x10, ttl 62, id 49483, offset 0, flags [DF], proto TCP (6), length 60)
    10.122.87.4.44330 > 10.11.140.15.23: Flags [S], cksum 0x868c (correct), seq 1872468748, win 64860, options [mss 1380,sackOK,TS val 1028989745 ecr 0,nop,wscale 7], length 0
07:40:02.290105 IP (tos 0x10, ttl 61, id 49483, offset 0, flags [DF], proto TCP (6), length 60)
    10.122.87.4.44330 > 10.11.140.15.23: Flags [S], cksum 0x868c (correct), seq 1872468748, win 64860, options [mss 1380,sackOK,TS val 1028989745 ecr 0,nop,wscale 7], length 0
07:40:02.290175 IP (tos 0x10, ttl 60, id 49483, offset 0, flags [DF], proto TCP (6), length 60)
.....
07:40:02.292448 IP (tos 0x10, ttl 3, id 49483, offset 0, flags [DF], proto TCP (6), length 60)
    10.122.87.4.44330 > 10.11.140.15.23: Flags [S], cksum 0x868c (correct), seq 1872468748, win 64860, options [mss 1380,sackOK,TS val 1028989745 ecr 0,nop,wscale 7], length 0
07:40:02.292502 IP (tos 0x10, ttl 2, id 49483, offset 0, flags [DF], proto TCP (6), length 60)
    10.122.87.4.44330 > 10.11.140.15.23: Flags [S], cksum 0x868c (correct), seq 1872468748, win 64860, options [mss 1380,sackOK,TS val 1028989745 ecr 0,nop,wscale 7], length 0
07:40:02.292507 IP (tos 0x10, ttl 1, id 49483, offset 0, flags [DF], proto TCP (6), length 60)
    10.122.87.4.44330 > 10.11.140.15.23: Flags [S], cksum 0x868c (correct), seq 1872468748, win 64860, options [mss 1380,sackOK,TS val 1028989745 ecr 0,nop,wscale 7], length 0
```
node routing table:
```
# ip ro
default via 10.11.13.1 dev bond0 onlink 
10.11.13.0/24 dev bond0 proto kernel scope link src 10.11.13.11 
10.11.128.0/24 via 10.11.130.138 dev cilium_host src 10.11.130.138 mtu 1450 
10.11.129.0/24 via 10.11.130.138 dev cilium_host src 10.11.130.138 mtu 1450 
10.11.130.0/24 via 10.11.130.138 dev cilium_host src 10.11.130.138 
10.11.130.138 dev cilium_host scope link 
10.11.131.0/24 via 10.11.130.138 dev cilium_host src 10.11.130.138 mtu 1450 
10.11.132.0/24 via 10.11.130.138 dev cilium_host src 10.11.130.138 mtu 1450 
```

Looks like it happens because traffic not destined to Service Port in bpf just passed to kernel network stack and then routed according to linux routing table which doesn't have blackhole route for External IP, so kernel just send it to back to upstream router(according to default route).

Possible solutions:
* drop traffic destined to Service External IP but not to Service port in eBPF dataplane
* install blackhole route to node routing table for external IPs announced by BGP(may be it should be done on metallb side?)

### Cilium Version

v1.11.6

### Kernel Version

Linux 5.10.0-12-amd64 #1 SMP Debian 5.10.103-1 (2022-03-07) x86_64 GNU/Linux

### Kubernetes Version

v1.23.5

### Code of Conduct

- [X] I agree to follow this project's Code of Conduct

**Comment by brb** [comment]
@dmitry-sinina It's an expected behavior, please see https://github.com/cilium/cilium/issues/14176 for the explanation why it happens, and how to remediate it.

**Comment by dmitry-sinina** [comment]
https://github.com/cilium/cilium/issues/14118

**Comment by anthr76** [comment]
This issue is still present.

**Comment by sor88** [comment]
This issue is still present.

**Comment by cristianm** [comment]
Same issue here....

**Comment by hvolpers** [comment]
+1
