### ISSUE TITLE
ipv6 only: no connectivity to Kube API from CoreDNS pods

### ISSUE THREAD

**Issue by sergey-safarov** [cilium/cilium#36967]
### Is there an existing issue for this?

- [x] I have searched the existing issues

### Version

equal or higher than v1.16.5 and lower than v1.17.0

### What happened?

I have deployed `cilium` on the IPv6-only node.
All pods started properly except `codedns` pods.
in coredns logs I see
```
[WARNING] plugin/kubernetes: starting server with unsynced Kubernetes API
.:53
[INFO] plugin/reload: Running configuration SHA512 = 1b226df79860026c6a52e67daa10d7f0d57ec5b023288ec00c5e05f93523c894564e15b91770d3a07ae1cfbe861d15b37d4a0027e69c546ab112970993a3b03b
CoreDNS-1.11.3
linux/arm64, go1.21.11, a6338e9
[INFO] plugin/ready: Still waiting on: "kubernetes"
[INFO] plugin/ready: Still waiting on: "kubernetes"
[INFO] plugin/kubernetes: pkg/mod/k8s.io/client-go@v0.29.3/tools/cache/reflector.go:229: failed to list *v1.Namespace: Get "https://[fdc0:9089:c9f0::1]:443/api/v1/namespaces?limit=500&resourceVer
sion=0": dial tcp [fdc0:9089:c9f0::1]:443: i/o timeout
[INFO] plugin/kubernetes: pkg/mod/k8s.io/client-go@v0.29.3/tools/cache/reflector.go:229: failed to list *v1.EndpointSlice: Get "https://[fdc0:9089:c9f0::1]:443/apis/discovery.k8s.io/v1/endpointsl
ices?limit=500&resourceVersion=0": dial tcp [fdc0:9089:c9f0::1]:443: i/o timeout
[INFO] plugin/kubernetes: Trace[1853710730]: "Reflector ListAndWatch" name:pkg/mod/k8s.io/client-go@v0.29.3/tools/cache/reflector.go:229 (13-Jan-2025 20:30:44.794) (total time: 30001ms):
Trace[1853710730]: ---"Objects listed" error:Get "https://[fdc0:9089:c9f0::1]:443/apis/discovery.k8s.io/v1/endpointslices?limit=500&resourceVersion=0": dial tcp [fdc0:9089:c9f0::1]:443: i/o timeo
ut 30000ms (20:31:14.795)
Trace[1853710730]: [30.001365838s] [30.001365838s] END
[ERROR] plugin/kubernetes: pkg/mod/k8s.io/client-go@v0.29.3/tools/cache/reflector.go:229: Failed to watch *v1.EndpointSlice: failed to list *v1.EndpointSlice: Get "https://[fdc0:9089:c9f0::1]:443
/apis/discovery.k8s.io/v1/endpointslices?limit=500&resourceVersion=0": dial tcp [fdc0:9089:c9f0::1]:443: i/o timeout
[INFO] plugin/kubernetes: Trace[1828309007]: "Reflector ListAndWatch" name:pkg/mod/k8s.io/client-go@v0.29.3/tools/cache/reflector.go:229 (13-Jan-2025 20:30:44.794) (total time: 30002ms):
Trace[1828309007]: ---"Objects listed" error:Get "https://[fdc0:9089:c9f0::1]:443/api/v1/namespaces?limit=500&resourceVersion=0": dial tcp [fdc0:9089:c9f0::1]:443: i/o timeout 30001ms (20:31:14.7
95)
Trace[1828309007]: [30.002193645s] [30.002193645s] END
[ERROR] plugin/kubernetes: pkg/mod/k8s.io/client-go@v0.29.3/tools/cache/reflector.go:229: Failed to watch *v1.Namespace: failed to list *v1.Namespace: Get "https://[fdc0:9089:c9f0::1]:443/api/v1/
namespaces?limit=500&resourceVersion=0": dial tcp [fdc0:9089:c9f0::1]:443: i/o timeout
[INFO] plugin/kubernetes: pkg/mod/k8s.io/client-go@v0.29.3/tools/cache/reflector.go:229: failed to list *v1.Service: Get "https://[fdc0:9089:c9f0::1]:443/api/v1/services?limit=500&resourceVersion
=0": dial tcp [fdc0:9089:c9f0::1]:443: i/o timeout
[INFO] plugin/kubernetes: Trace[219955208]: "Reflect
```

I see an inbound packets on `lxc` network interface but no response send back.
```
[root@ippbx-1-0b ~]# tcpdump -ni lxcd97326d32c0b host fdc0:9089:c9f0::1 and port 443
dropped privs to tcpdump
tcpdump: verbose output suppressed, use -v[v]... for full protocol decode
listening on lxcd97326d32c0b, link-type EN10MB (Ethernet), snapshot length 262144 bytes
23:01:20.638212 IP6 fd00::ca.40598 > fdc0:9089:c9f0::1.https: Flags [S], seq 3400249706, win 31970, options [mss 1390,sackOK,TS val 1021465227 ecr 0,nop,wscale 7], length 0
23:01:22.548196 IP6 fd00::ca.45890 > fdc0:9089:c9f0::1.https: Flags [S], seq 1889802193, win 31970, options [mss 1390,sackOK,TS val 1021467137 ecr 0,nop,wscale 7], length 0
23:01:53.536400 IP6 fd00::ca.48154 > fdc0:9089:c9f0::1.https: Flags [S], seq 2530009607, win 31970, options [mss 1390,sackOK,TS val 1021498125 ecr 0,nop,wscale 7], length 0
23:01:54.548239 IP6 fd00::ca.48154 > fdc0:9089:c9f0::1.https: Flags [S], seq 2530009607, win 31970, options [mss 1390,sackOK,TS val 1021499137 ecr 0,nop,wscale 7], length 0
23:01:56.628229 IP6 fd00::ca.48154 > fdc0:9089:c9f0::1.https: Flags [S], seq 2530009607, win 31970, options [mss 1390,sackOK,TS val 1021501217 ecr 0,nop,wscale 7], length 0
```
There is no connectivity from the pods but connection is present from the host network
```
[root@ippbx-1-0b ~]# curl -k --noproxy "*" https://[fdc0:9089:c9f0::1]:443/livez?verbose
[+]ping ok
[+]log ok
[+]etcd ok
[+]poststarthook/start-apiserver-admission-initializer ok
[+]poststarthook/generic-apiserver-start-informers ok
[+]poststarthook/priority-and-fairness-config-consumer ok
[+]poststarthook/priority-and-fairness-filter ok
[+]poststarthook/storage-object-count-tracker-hook ok
[+]poststarthook/start-apiextensions-informers ok
[+]poststarthook/start-apiextensions-controllers ok
[+]poststarthook/crd-informer-synced ok
[+]poststarthook/start-system-namespaces-controller ok
[+]poststarthook/start-cluster-authentication-info-controller ok
[+]poststarthook/start-kube-apiserver-identity-lease-controller ok
[+]poststarthook/start-kube-apiserver-identity-lease-garbage-collector ok
[+]poststarthook/start-legacy-token-tracking-controller ok
[+]poststarthook/start-service-ip-repair-controllers ok
[+]poststarthook/rbac/bootstrap-roles ok
[+]poststarthook/scheduling/bootstrap-system-priority-classes ok
[+]poststarthook/priority-and-fairness-config-producer ok
[+]poststarthook/bootstrap-controller ok
[+]poststarthook/aggregator-reload-proxy-client-cert ok
[+]poststarthook/start-kube-aggregator-informers ok
[+]poststarthook/apiservice-status-local-available-controller ok
[+]poststarthook/apiservice-status-remote-available-controller ok
[+]poststarthook/apiservice-registration-controller ok
[+]poststarthook/apiservice-discovery-controller ok
[+]poststarthook/kube-apiserver-autoregistration ok
[+]autoregister-completion ok
[+]poststarthook/apiservice-openapi-controller ok
[+]poststarthook/apiservice-openapiv3-controller ok
livez check passed
```

### How can we reproduce the issue?

1. create `kubeadm-config.yaml` with content
```yaml
# kubeadm-config.yaml
kind: ClusterConfiguration
apiVersion: kubeadm.k8s.io/v1beta4
controlPlaneEndpoint: kube-host.somedomain
networking:
  serviceSubnet: fdc0:9089:c9f0::/112
  podSubnet: fdc0:9089:c9f1::/56
---
kind: InitConfiguration
apiVersion: kubeadm.k8s.io/v1beta4
nodeRegistration:
  criSocket: "unix:///var/run/crio/crio.sock"
```
2. init k8s host
```
kubeadm init --config /tmp/kubeadm-config.yaml
```
3. start `cilium`
```
/usr/local/bin/cilium install --set ipv6.enabled=true --set ipv4.enabled=false
```
4. set `ipv4-node` value
```
kubectl patch configmap -n kube-system cilium-config -p '{"data":{"ipv4-node": "123.44.55.66"}}'
```
5. terminate old `cilium` pod
```
kubectl delete pods -n kube-system cilium-xxxxx
```

Now you can see all pods started and ready except coredns
```
[root@kube-host ~]# kubectl get pods --all-namespaces
NAMESPACE     NAME                                                  READY   STATUS              RESTARTS   AGE
kube-system   cilium-8vp9j                                          1/1     Running             0          18s
kube-system   cilium-envoy-bcmbl                                    1/1     Running             0          7m11s
kube-system   cilium-operator-54644c46f4-7fch6                      1/1     Running             0          7m11s
kube-system   coredns-668d6bf9bc-9wfxf                              0/1     ContainerCreating   0          7m11s
kube-system   coredns-668d6bf9bc-dh8pp                              0/1     ContainerCreating   0          7m11s
kube-system   etcd-ippbx-1-0b.stage.nga911.com                      1/1     Running             27         7m16s
kube-system   kube-apiserver-ippbx-1-0b.stage.nga911.com            1/1     Running             5          7m19s
kube-system   kube-controller-manager-ippbx-1-0b.stage.nga911.com   1/1     Running             5          7m16s
kube-system   kube-proxy-fscl2                                      1/1     Running             0          7m11s
kube-system   kube-scheduler-ippbx-1-0b.stage.nga911.com            1/1     Running             6          7m16s
```

### Cilium Version

```
[root@kube-host ~]# /usr/local/bin/cilium version
cilium-cli: v0.16.23 compiled with go1.23.4 on linux/arm64
cilium image (default): v1.16.5
cilium image (stable): v1.16.5
cilium image (running): 1.16.5
```

### Kernel Version

```
Linux kube-host.somedomain 5.14.0-522.el9.aarch64 #1 SMP PREEMPT_DYNAMIC Sun Oct 20 13:17:02 UTC 2024 aarch64 aarch64 aarch64 GNU/Linux
```

### Kubernetes Version

```
[root@kube-host ~]# kubectl version
Client Version: v1.32.0
Kustomize Version: v5.5.0
Server Version: v1.32.0
```

### Sysdump

[cilium-sysdump-20250113-232937.zip](https://github.com/user-attachments/files/18403288/cilium-sysdump-20250113-232937.zip)

### Relevant log output

```shell

```

### Anything else?

I have tested using versions
```
v1.17.0-rc.0
v1.16.5
v1.15.12
```
Issue present on this three. On `v1.14.18` cilium was not started on k8s 1.32.0

Also, I have tested the same server when on the host present IPv4 address. In this case, the coredns pods started properly.

### Cilium Users Document

- [ ] Are you a user of Cilium? Please add yourself to the [Users doc](https://github.com/cilium/cilium/blob/main/USERS.md)

### Code of Conduct

- [x] I agree to follow this project's Code of Conduct

**Comment by netops2devops** [comment]
Hi! I have been successfully running Cilium 1.16.X on a IPv6 only network for several months now without any major issues. Due to https://github.com/cilium/cilium/issues/17240 you can only run Cilium with IPv6 only when you use `routingMode: native`. You will need to provide some additional config bits which I have documented here. 

https://github.com/cilium/cilium/issues/35822#issuecomment-2463559319
https://github.com/cilium/cilium/issues/34997#issuecomment-2380284075

**Comment by sergey-safarov** [comment]
Thanks @netops2devops for your comments.
I have gotten working k8s on one node using the suggested commands.
To simplify installation I have prepared a bash script. For script required `jq` and `ipcalc` utilities.
```bash
#!/bin/bash
export KUBECONFIG=/etc/kubernetes/admin.conf
set -x

serviceCird="fdc0:9089:c9f0::/108"
podCidr="fdc0:9089:c9f1::/56"
k8sServiceHost=$(ip -6 -j addr show dev eth0| jq -r '.[].addr_info | map(select(.scope=="global")) | .[].local')
#'
network=$(ipcalc --no-decorate --network ${k8sServiceHost}/56)

systemctl enable kubelet.service
systemctl enable --now crio
/bin/kubeadm init \
  --service-cidr ${serviceCird} \
  --pod-network-cidr ${podCidr} \
  --apiserver-advertise-address ${k8sServiceHost} \
  --control-plane-endpoint ${HOSTNAME}

/usr/local/bin/cilium install \
  --set ipam.operator.clusterPoolIPv6MaskSize=120 \
  --set ipv6.enabled=true \
  --set ipv4.enabled=false \
  --set routing-mode=native \
  --set ipv6NativeRoutingCIDR=${network}/56 \
  --set kubeProxyReplacement=true \
  --set ipam.operator.clusterPoolIPv6PodCIDRList="${serviceCird}" \
  --set nodeinit.enabled=true \
  --set k8s.requireIPv6PodCIDR=true \
  --set k8sServiceHost=${HOSTNAME} \
  --set k8sServicePort=6443

kubectl patch configmap -n kube-system cilium-config -p '{"data":{"ipv4-node": "123.44.55.66"}}'
kubectl taint nodes ${HOSTNAME} node-role.kubernetes.io/control-plane-

systemctl restart crio.service kubelet.service
sed -i -E -e "s/(no_proxy=\")/\1${HOSTNAME},/I" /etc/environment
```
I have added
```
kubectl patch configmap -n kube-system cilium-config -p '{"data":{"ipv4-node": "123.44.55.66"}}'
```
Because without this I got error message
> level=error msg="Start hook failed" function="cmd.newDaemonPromise.func1 (cmd/daemon_main.go:1735) (agent.controlplane.daemon)" error="postinit failed: external IPv4 node address could not be derived, please configure via --ipv4-node"

@netops2devops do you know why `IPv4` address still required?

Also, I have removed `--set auto-direct-node-routes` because got this error message
> level=fatal msg="auto-direct-node-routes cannot be used with tunneling. Packets must be routed through the tunnel device." subsys=daemon

**Comment by netops2devops** [comment]
@sergey-safarov If you are running K8s on a single node (with Cilium, IPv6 only) then the configuration should be straightforward. In that case you don't even need the config bits I shared before 

I've never tried building an IPv6 only K8s directly with kubeadm but I do think you'll likely need to provide some additional configuration options some of which can be found here https://github.com/sgryphon/kubernetes-ipv6

I hope this works for you.

**Comment by sergey-safarov** [comment]
Thanks @netops2devops  for the comment.

What is next with this ticket?
Should I close this or leave it as a feature request to get working pod networks after the command
```bash
cilium install \
  --set ipv6.enabled=true \
  --set ipv4.enabled=false
```

**Comment by netops2devops** [comment]
@sergey-safarov apologies for late response. So it looks like you're using vanilla K8s which I am not intimately familiar with. Going by the docs https://kubernetes.io/docs/reference/command-line-tools-reference/kubelet/ you will need to configure the `kubelet` to use `--node-ip=::`  I happened to run into this as well when I was installing single node k3s with Cilium (ipv6 only) I had to provide the following config bits to K3s. You will likely need to map these config bits to kubeadm/kubelet options for your vanilla K8s 

```
#/etc/rancher/config.yaml
---
cluster-init: true
write-kubeconfig-mode: "0644"
flannel-backend: none
disable-network-policy: true
disable-kube-proxy: true
cluster-cidr: fd00:10:42::/56
service-cidr: fd00:10:96::/112
kubelet-arg:
  - "node-ip=::"
disable:
  - traefik
  - metrics-server
  - servicelb
```

Then helm install with the following 
```
❯ helm install cilium cilium/cilium \
--namespace=kube-system \
--set ipv4.enabled=false \
--set ipv6.enabled=true \
--set k8sServiceHost='IPv6-API-SERVER-ADDR' \
--set k8sServicePort=6443 \
--set kubeProxyReplacement=true \
--set routingMode=native \
--set ipv6NativeRoutingCIDR=fd00:10:42::/64 \
--set ipam.operator.clusterPoolIPv6PodCIDRList=fd00:10:42::/104 \
--set k8s.requireIPv6PodCIDR=true \
--set autodirectnoderoutes=true
```
