### ISSUE TITLE
External traffic to LoadBalancer VIP fails when the backend pod is local to the L2 Announcer.

### ISSUE THREAD

**Issue by zviratko** [cilium/cilium#31689]
### Is there an existing issue for this?

- [X] I have searched the existing issues

### What happened?

1. Talos Linux 1.6.7 + Cilium 1.15.3. Direct routing, KPR, DSR. One interface is routing internal inter-node traffic (eth0.1001), two interfaces are dedicated to hosting L2 Announced VIP addresses (eth0.1004, eth0.1006). All nodes are runing on a single libvirt host (it's a lab ATM) with a single trunk VLAN interface. I am injecting routing tables and rules for policy routing for incoming VIP traffic (shouldn't be part of the issue).
2. POD + Service are created:

```
apiVersion: apps/v1
kind: Deployment
metadata:
  name: iperf3-server
  labels:
    app: iperf3-server
spec:
  replicas: 1
  selector:
    matchLabels:
      app: iperf3-server
  template:
    metadata:
      labels:
        app: iperf3-server
    spec:
      #hostNetwork: true
      #nodeSelector:
      #  kubernetes.io/hostname: mynode01
      containers:
      - name: iperf3-server-tcp
        image: networkstatic/iperf3
        args: ['-s']
        ports:
        - containerPort: 5201
          name: server
      terminationGracePeriodSeconds: 0

---

apiVersion: v1
kind: Service
metadata:
  name: iperf3-server
  labels:
    service.kubernetes.io/lbnetwork: devsvc-pool2
spec:
  selector:
    app: iperf3-server
  ports:
  - protocol: TCP
    name: 5201-tcp
    port: 5201
    targetPort: server
  - protocol: UDP
    name: 5201-udp
    port: 5201
    targetPort: server
  type: LoadBalancer
  ```
  
  3. This LoadBalancer gets an external IP from the pool (10.64.4.60 on eth0.1004)
  4. If the L2 Announcer lease gets assigned to the same node hosting the iperf3-server pod, all traffic is dropped to it
```
POD:  default                iperf3-server-694f76fc65-55zrh                        1/1     Running   0             16m   100.98.4.161   worker02   <none>           <none>
L2LEASE:  kube-system       cilium-l2announce-default-iperf3-server        worker02                                                                              16m
SERVICE:  default                iperf3-server                          LoadBalancer   100.96.103.92    10.64.4.60    5201:31107/TCP,5201:31107/UDP   17m
 ``` 
  
```
  tcpdump -n -i dev-worker02 host 10.3.02
  15:49:11.424903 IP 10.3.0.2.56362 > 10.64.4.60.5201: Flags [S], seq 195754253, win 64240, options [mss 1460,sackOK,TS val 3219337692 ecr 0,nop,wscale 7], length 0
15:49:11.425137 IP 10.64.4.60 > 10.3.0.2: ICMP 10.64.4.60 tcp port 5201 unreachable, length 72
```

Wanted to give more output and with "-v -e " it actually shows this which I haven't noticed before - all the cluster ndoes sending the SYN to the POD IP (notice the different MACs in there). I don't know how to interpret this.
```
# tcpdump -v -e -n -i dev-worker02 host 10.3.0.2
tcpdump: listening on dev-worker02, link-type EN10MB (Ethernet), snapshot length 262144 bytes
15:54:49.121181 de:d2:07:7b:cf:e8 > 00:00:36:4e:cc:f9, ethertype 802.1Q (0x8100), length 78: vlan 1004, p 0, ethertype IPv4 (0x0800), (tos 0x10, ttl 62, id 63708, offset 0, flags [DF], proto TCP (6), length 60)
    10.3.0.2.36010 > 10.64.4.60.5201: Flags [S], cksum 0x140e (correct), seq 1622017520, win 64240, options [mss 1460,sackOK,TS val 3219675390 ecr 0,nop,wscale 7], length 0
15:54:49.121287 00:00:36:4e:cc:f9 > de:d2:07:7b:cf:e8, ethertype 802.1Q (0x8100), length 110: vlan 1004, p 0, ethertype IPv4 (0x0800), (tos 0x10, ttl 64, id 0, offset 0, flags [none], proto ICMP (1), length 92)
    10.64.4.60 > 10.3.0.2: ICMP 10.64.4.60 tcp port 5201 unreachable, length 72
	(tos 0x10, ttl 62, id 63708, offset 0, flags [DF], proto TCP (6), length 60)
    10.3.0.2.36010 > 10.64.4.60.5201: Flags [S], cksum 0x140e (correct), seq 1622017520, win 64240, options [mss 1460,sackOK,TS val 3219675390 ecr 0,nop,wscale 7], length 0
15:54:49.121309 00:00:36:a0:7e:8c > 00:00:36:4e:cc:f9, ethertype 802.1Q (0x8100), length 86: vlan 1001, p 0, ethertype IPv4 (0x0800), (tos 0x10, ttl 61, id 63708, offset 0, flags [DF], proto TCP (6), length 68, options (unknown 154))
    10.3.0.2.36010 > 100.98.4.161.5201: Flags [S], cksum 0xb986 (correct), seq 1622017520, win 64240, options [mss 1460,sackOK,TS val 3219675390 ecr 0,nop,wscale 7], length 0
15:54:49.121330 00:00:36:63:4f:c3 > 00:00:36:4e:cc:f9, ethertype 802.1Q (0x8100), length 86: vlan 1001, p 0, ethertype IPv4 (0x0800), (tos 0x10, ttl 61, id 63708, offset 0, flags [DF], proto TCP (6), length 68, options (unknown 154))
    10.3.0.2.36010 > 100.98.4.161.5201: Flags [S], cksum 0xb986 (correct), seq 1622017520, win 64240, options [mss 1460,sackOK,TS val 3219675390 ecr 0,nop,wscale 7], length 0
15:54:49.121347 00:00:36:a0:73:74 > 00:00:36:4e:cc:f9, ethertype 802.1Q (0x8100), length 86: vlan 1001, p 0, ethertype IPv4 (0x0800), (tos 0x10, ttl 61, id 63708, offset 0, flags [DF], proto TCP (6), length 68, options (unknown 154))
    10.3.0.2.36010 > 100.98.4.161.5201: Flags [S], cksum 0xb986 (correct), seq 1622017520, win 64240, options [mss 1460,sackOK,TS val 3219675390 ecr 0,nop,wscale 7], length 0
15:54:49.121472 00:00:36:b1:ec:31 > 00:00:36:4e:cc:f9, ethertype 802.1Q (0x8100), length 86: vlan 1001, p 0, ethertype IPv4 (0x0800), (tos 0x10, ttl 61, id 63708, offset 0, flags [DF], proto TCP (6), length 68, options (unknown 154))
    10.3.0.2.36010 > 100.98.4.161.5201: Flags [S], cksum 0xb986 (correct), seq 1622017520, win 64240, options [mss 1460,sackOK,TS val 3219675390 ecr 0,nop,wscale 7], length 0
15:54:49.121528 00:00:36:c3:bd:9e > 00:00:36:4e:cc:f9, ethertype 802.1Q (0x8100), length 86: vlan 1001, p 0, ethertype IPv4 (0x0800), (tos 0x10, ttl 61, id 63708, offset 0, flags [DF], proto TCP (6), length 68, options (unknown 154))
    10.3.0.2.36010 > 100.98.4.161.5201: Flags [S], cksum 0xb986 (correct), seq 1622017520, win 64240, options [mss 1460,sackOK,TS val 3219675390 ecr 0,nop,wscale 7], length 0
15:54:49.121692 00:00:36:4e:cc:f9 > de:d2:07:7b:cf:e8, ethertype 802.1Q (0x8100), length 78: vlan 1004, p 0, ethertype IPv4 (0x0800), (tos 0x0, ttl 63, id 0, offset 0, flags [DF], proto TCP (6), length 60)
    10.64.4.60.5201 > 10.3.0.2.36010: Flags [S.], cksum 0x18af (incorrect -> 0xa793), seq 37025014, ack 1622017521, win 43440, options [mss 1460,sackOK,TS val 1925272507 ecr 3219675390,nop,wscale 9], length 0
15:54:49.121791 00:00:36:4e:cc:f9 > de:d2:07:7b:cf:e8, ethertype 802.1Q (0x8100), length 78: vlan 1004, p 0, ethertype IPv4 (0x0800), (tos 0x0, ttl 63, id 0, offset 0, flags [DF], proto TCP (6), length 60)
    10.64.4.60.5201 > 10.3.0.2.36010: Flags [S.], cksum 0x18af (incorrect -> 0xa793), seq 37025014, ack 1622017521, win 43440, options [mss 1460,sackOK,TS val 1925272507 ecr 3219675390,nop,wscale 9], length 0
15:54:49.122390 de:d2:07:7b:cf:e8 > 00:00:36:4e:cc:f9, ethertype 802.1Q (0x8100), length 58: vlan 1004, p 0, ethertype IPv4 (0x0800), (tos 0x0, ttl 62, id 0, offset 0, flags [DF], proto TCP (6), length 40)
    10.3.0.2.36010 > 10.64.4.60.5201: Flags [R], cksum 0x8fc5 (correct), seq 1622017521, win 0, length 0
15:54:49.122400 de:d2:07:7b:cf:e8 > 00:00:36:4e:cc:f9, ethertype 802.1Q (0x8100), length 58: vlan 1004, p 0, ethertype IPv4 (0x0800), (tos 0x0, ttl 62, id 0, offset 0, flags [DF], proto TCP (6), length 40)
    10.3.0.2.36010 > 10.64.4.60.5201: Flags [R], cksum 0x8fc5 (correct), seq 1622017521, win 0, length 0
15:54:49.122495 00:00:36:4e:cc:f9 > de:d2:07:7b:cf:e8, ethertype 802.1Q (0x8100), length 100: vlan 1004, p 0, ethertype IPv4 (0x0800), (tos 0x0, ttl 64, id 0, offset 0, flags [none], proto ICMP (1), length 82)
    10.64.4.60 > 10.3.0.2: ICMP 10.64.4.60 tcp port 5201 unreachable, length 62
	(tos 0x0, ttl 62, id 0, offset 0, flags [DF], proto TCP (6), length 40)
    10.3.0.2.36010 > 10.64.4.60.5201: Flags [R], cksum 0x8fc5 (correct), seq 1622017521, win 0, length 0
15:54:49.122535 00:00:36:4e:cc:f9 > de:d2:07:7b:cf:e8, ethertype 802.1Q (0x8100), length 100: vlan 1004, p 0, ethertype IPv4 (0x0800), (tos 0x0, ttl 64, id 0, offset 0, flags [none], proto ICMP (1), length 82)
    10.64.4.60 > 10.3.0.2: ICMP 10.64.4.60 tcp port 5201 unreachable, length 62
	(tos 0x0, ttl 62, id 0, offset 0, flags [DF], proto TCP (6), length 40)
    10.3.0.2.36010 > 10.64.4.60.5201: Flags [R], cksum 0x8fc5 (correct), seq 1622017521, win 0, length 0
15:54:50.145909 00:00:36:4e:cc:f9 > de:d2:07:7b:cf:e8, ethertype 802.1Q (0x8100), length 78: vlan 1004, p 0, ethertype IPv4 (0x0800), (tos 0x0, ttl 63, id 0, offset 0, flags [DF], proto TCP (6), length 60)
    10.64.4.60.5201 > 10.3.0.2.36010: Flags [S.], cksum 0x18af (incorrect -> 0xa392), seq 37025014, ack 1622017521, win 43440, options [mss 1460,sackOK,TS val 1925273532 ecr 3219675390,nop,wscale 9], length 0
15:54:50.146726 de:d2:07:7b:cf:e8 > 00:00:36:4e:cc:f9, ethertype 802.1Q (0x8100), length 58: vlan 1004, p 0, ethertype IPv4 (0x0800), (tos 0x0, ttl 62, id 0, offset 0, flags [DF], proto TCP (6), length 40)
    10.3.0.2.36010 > 10.64.4.60.5201: Flags [R], cksum 0x8fc5 (correct), seq 1622017521, win 0, length 0
15:54:50.146923 00:00:36:4e:cc:f9 > de:d2:07:7b:cf:e8, ethertype 802.1Q (0x8100), length 100: vlan 1004, p 0, ethertype IPv4 (0x0800), (tos 0x0, ttl 64, id 0, offset 0, flags [none], proto ICMP (1), length 82)
    10.64.4.60 > 10.3.0.2: ICMP 10.64.4.60 tcp port 5201 unreachable, length 62
	(tos 0x0, ttl 62, id 0, offset 0, flags [DF], proto TCP (6), length 40)
    10.3.0.2.36010 > 10.64.4.60.5201: Flags [R], cksum 0x8fc5 (correct), seq 1622017521, win 0, length 0
15:54:52.161991 00:00:36:4e:cc:f9 > de:d2:07:7b:cf:e8, ethertype 802.1Q (0x8100), length 78: vlan 1004, p 0, ethertype IPv4 (0x0800), (tos 0x0, ttl 63, id 0, offset 0, flags [DF], proto TCP (6), length 60)
    10.64.4.60.5201 > 10.3.0.2.36010: Flags [S.], cksum 0x18af (incorrect -> 0x9bb2), seq 37025014, ack 1622017521, win 43440, options [mss 1460,sackOK,TS val 1925275548 ecr 3219675390,nop,wscale 9], length 0
15:54:52.162796 de:d2:07:7b:cf:e8 > 00:00:36:4e:cc:f9, ethertype 802.1Q (0x8100), length 58: vlan 1004, p 0, ethertype IPv4 (0x0800), (tos 0x0, ttl 62, id 0, offset 0, flags [DF], proto TCP (6), length 40)
    10.3.0.2.36010 > 10.64.4.60.5201: Flags [R], cksum 0x8fc5 (correct), seq 1622017521, win 0, length 0
15:54:52.162975 00:00:36:4e:cc:f9 > de:d2:07:7b:cf:e8, ethertype 802.1Q (0x8100), length 100: vlan 1004, p 0, ethertype IPv4 (0x0800), (tos 0x0, ttl 64, id 0, offset 0, flags [none], proto ICMP (1), length 82)
    10.64.4.60 > 10.3.0.2: ICMP 10.64.4.60 tcp port 5201 unreachable, length 62
	(tos 0x0, ttl 62, id 0, offset 0, flags [DF], proto TCP (6), length 40)
    10.3.0.2.36010 > 10.64.4.60.5201: Flags [R], cksum 0x8fc5 (correct), seq 1622017521, win 0, length 0
```

### Cilium Version

1.15.3

### Kernel Version

Linux worker02 6.1.82-talos #1 SMP Tue Mar 19 17:48:01 UTC 2024 x86_64 x86_64 x86_64 GNU/Linux

### Kubernetes Version

Client Version: v1.29.2
Kustomize Version: v5.0.4-0.20230601165947-6ce0bf390ce3
Server Version: v1.29.3

### Sysdump

[cilium-sysdump-20240331-155103.zip](https://github.com/cilium/cilium/files/14816572/cilium-sysdump-20240331-155103.zip)

### Cilium Users Document

- [ ] Are you a user of Cilium? Please add yourself to the [Users doc](https://github.com/cilium/cilium/blob/main/USERS.md)

### Code of Conduct

- [X] I agree to follow this project's Code of Conduct
