### ISSUE TITLE
wireguard: ICMPv6 NA over cilium_wg0 is dropped

### ISSUE THREAD

**Issue by brb** [cilium/cilium#23899]
While running the upcoming ci-datapath IPv6 connectivity tests on a cluster with WG's node-to-node encryption enabled, I've noticed that sometimes the pod to host tests are flaking. For example:
```
❌ 1/1 tests failed (2/12 actions), 30 tests skipped, 0 scenarios skipped:
Test [host-entity]:
  ❌ host-entity/pod-to-host/ping-3: cilium-test/client-7b78db77d5-dpl5z (fd00:10:244:2::83cf) -> fc00:f853:ccd:e793::6 (fc00:f853:ccd:e793::6:0)
  ❌ host-entity/pod-to-host/ping-9: cilium-test/client2-78f748dd67-6g276 (fd00:10:244:2::d0b8) -> fc00:f853:ccd:e793::6 (fc00:f853:ccd:e793::6:0)
```

A further inspection traced the following relevant ICMPv6 neighbor resolution:
```
11:08:23.789478 eth0  Out IP6 fc00:f853:ccd:e793::3 > ff02::1:ff00:6: ICMP6, neighbor solicitation, who has fc00:f853:ccd:e793::6, length 32
11:08:23.789874 cilium_wg0 In  IP6 fd00:10:244:1::b8ed > fc00:f853:ccd:e793::3: ICMP6, neighbor advertisement, tgt is fc00:f853:ccd:e793::6, length 32
```

Meanwhile, a successful resolution was the following:
```
11:30:44.936450 eth0  Out IP6 fe80::42:acff:fe0c:103 > ff02::1:ff00:6: ICMP6, neighbor solicitation, who has fc00:f853:ccd:e793::6, length 32
11:30:44.936829 eth0  In  IP6 fd00:10:244:1::b8ed > fe80::42:acff:fe0c:103: ICMP6, neighbor advertisement, tgt is fc00:f853:ccd:e793::6, length 32
```

The second didn't go over the WG tunnel, as neither `fe80::42:acff:fe0c:103` nor `ff02::1:ff00:6` are in the IPCache, while `fc00:f853:ccd:e793::3` is (`eth0` v6 addr).

From the `pwru` output I saw that the NA in the first case was received and handled:
```
0xffff98b292d9fb00      1 [kworker/1:0-wg-crypt-cilium_wg0]                ndisc_rcv netns=4026533521 mark=0x300 ifindex=2 proto=dd86 mtu=1420 len=24 [fd00:10:244:1::b8ed]:0->[fc00:f853:ccd:e793::3]:0(icmp6)
0xffff98b292d9fb00      1 [kworker/1:0-wg-crypt-cilium_wg0]            ndisc_recv_na netns=4026533521 mark=0x300 ifindex=2 proto=dd86 mtu=1420 len=32 [fd00:10:244:1::b8ed]:0->[fc00:f853:ccd:e793::3]:0(icmp6)
```

A bit more tracing with `bpftrace`, and then finally the culprit: https://github.com/torvalds/linux/blob/v6.1/net/ipv6/ndisc.c#L1084 - because the `accept_untracked_na` is set to 0 on the `cilium_wg0`, the neighbor entry is not created.

To fix the issue, we should set the setting when `--encrypt-node=true` && `--enable-ipv6`.

**Comment by brb** [comment]
Unfortunately, the `accept_untracked_na` fix works when a neighbor entry is new. When it existed before (e.g.., `NUD_STALE`), the NA seems to be dropped.

To debug I used the following bpftrace script:
```
kprobe:neigh_lookup {
	printf("neigh_lookup: dev:%s\n", ((struct net_device *)arg2)->name);
}
kretprobe:neigh_lookup {
	printf("neigh_lookup return: %x nud_state:%x\n", retval, ((struct neighbour *)retval)->nud_state);
}
kprobe:__neigh_create {
	printf("neigh_create: %s\n", ((struct net_device *)arg2)->name);
}
kprobe:pneigh_lookup {
	printf("pneigh_lookup: %s\n", ((struct net_device *)arg3)->name);
}
kretprobe:pneigh_lookup {
	printf("pneigh_lookup return: %d\n", retval);
}
kprobe:ndisc_update {
	printf("ndisc_update: %s\n", ((struct net_device *)arg0)->name);
}
kprobe:__neigh_update {
	printf("__neigh_update: %d, flags:%x, new:%d\n", ((struct neighbour *)arg0)->nud_state, arg3, arg2);
}
kretprobe:__neigh_update {
	printf("__neigh_update return: %d\n", retval);
}
```

The relevant output:
```
neigh_lookup: dev:cilium_wg0
neigh_lookup return: d1841600 nud_state:40
__neigh_update: 64, flags:7, new:2
__neigh_update return: -1
```

Looks like the `NUD_NOARP` was set (from `__neigh_update`'s `nud_state` 64 = 0x40 = `NUD_NOARP`), and thus this condition was hit https://github.com/torvalds/linux/blob/v6.1/net/core/neighbour.c#L1329. The `NUD_NOARP` is probably coming from the `cilium_wg0` being L3 dev.

**Comment by brb** [comment]
> The NUD_NOARP is probably coming from the cilium_wg0 being L3 dev.

Yep, even if I set `ip link set cilium_wg0 arp on`, this is still triggered - https://github.com/torvalds/linux/blob/v6.1/net/ipv6/ndisc.c#L357.
