### ISSUE TITLE
Connectivity test fails due to VLAN packet drops

### ISSUE THREAD

**Issue by Javex** [cilium/cilium#36830]
### Is there an existing issue for this?

- [x] I have searched the existing issues

### Version

equal or higher than v1.16.5 and lower than v1.17.0

### What happened?

I am deploying Cilium for the first time, to my homelab Talos cluster. Everything seems fine, but the connectivity test fails with

```
.  ❌ Found unexpected packet drops:
{
  "labels": {
    "direction": "INGRESS",
    "reason": "VLAN traffic disallowed by VLAN filter"
  },
  "name": "cilium_drop_count_total",
  "value": 288
}
```

I didn't understand how this could be and couldn't find anyone running into this issue. After looking through the code, I found [this section](https://github.com/cilium/cilium/blob/5a4fdc967a51146c15b65e5401ecb5d7decdd8d2/bpf/bpf_host.c#L1252-L1260) which seems to be where that metric would originate from. 

What I think is happening here: My Kubernetes nodes are VMs inside Proxmox, their network interfaces are bridge interfaces attached to the main LAN interface which forwards VLAN packets through to the VMs. I _do_ have some local VLAN traffic and would expect that to arrive at the nodes.

On the Proxmox host I ran `tcpdump -i tap202i0 vlan` (that being the interface name attached to one of the node VMs) and saw packets arriving. When I run `cilium metrics list -o json | jq '.[] | select((.name == "cilium_drop_count_total"))'` on the corresponding VM's cilium pod (basically what the [test is doing](https://github.com/cilium/cilium/blob/main/cilium-cli/connectivity/tests/errors.go#L147)), I see the metric increase when tcpdump logs a packet, otherwise it stays the same.

```
# tcpdump -i tap202i0 vlan
tcpdump: verbose output suppressed, use -v[v]... for full protocol decode
listening on tap202i0, link-type EN10MB (Ethernet), snapshot length 262144 bytes
00:54:54.355474 IP 10.0.20.30.5355 > 224.0.0.252.5355: UDP, length 38
00:54:55.605310 IP 10.0.20.30.5355 > 224.0.0.252.5355: UDP, length 38
00:54:56.783578 IP 10.0.20.30.5355 > 224.0.0.252.5355: UDP, length 38
00:54:58.104685 IP 10.0.20.30.5355 > 224.0.0.252.5355: UDP, length 38
00:54:59.354703 IP 10.0.20.30.5355 > 224.0.0.252.5355: UDP, length 38
```

```
# cilium metrics list -o json | jq '.[] | select((.name == "cilium_drop_count_total"))'
{
  "labels": {
    "direction": "INGRESS",
    "reason": "Stale or unroutable IP"
  },
  "name": "cilium_drop_count_total",
  "value": 2
}
{
  "labels": {
    "direction": "INGRESS",
    "reason": "VLAN traffic disallowed by VLAN filter"
  },
  "name": "cilium_drop_count_total",
  "value": 350
}
```

I believe this to be a bug in the test suite (or metrics collection) as there is no connectivity issue: Cilium is simply seeing VLAN packets that it should disregard.

### How can we reproduce the issue?

1. Install Cilium on a node
2. Run connectivity test (it should succeed)
3. Send network packets with VLAN tags to the node interface
4. Run connectivity test (it should fail)

### Cilium Version

1.16.5 (though note that I ran 1.15.x first and don't know how to reset the metrics collection, not sure if the update would've done that)

### Kernel Version

6.6.64

### Kubernetes Version

1.31.4

### Relevant log output

```shell

```

### Cilium Users Document

- [ ] Are you a user of Cilium? Please add yourself to the [Users doc](https://github.com/cilium/cilium/blob/main/USERS.md)

### Code of Conduct

- [x] I agree to follow this project's Code of Conduct

**Comment by julianwiedmann** [comment]
> Cilium is simply seeing VLAN packets that it should disregard.

As suggestion - wouldn't it make sense then to [configure](https://docs.cilium.io/en/stable/configuration/vlan-802.1q/) Cilium accordingly, and set `--vlan-bpf-bypass=0` ?

**Comment by Javex** [comment]
> > Cilium is simply seeing VLAN packets that it should disregard.
> 
> As suggestion - wouldn't it make sense then to [configure](https://docs.cilium.io/en/stable/configuration/vlan-802.1q/) Cilium accordingly, and set `--vlan-bpf-bypass=0` ?

I've read the docs page a few times, but I don't fully understand what this option does. To be honest, the packets probably shouldn't arrive on the interface in the first place.

I guess I don't fully understand the purpose of this metric/test. Is it supposed to indicate if Cilium is dropping VLAN traffic that the user might expect to arrive and so it's supposed to fail? If so, there's no bug here and we can close this issue.

**Comment by toralux** [comment]
I get the same error in a Proxmox and Talos environment:

<img width="760" alt="Image" src="https://github.com/user-attachments/assets/c9713d6a-73cf-4052-bfa2-18131731cd26" />

Adding `--set bpf.vlanBypass="{0}"` on `helm install` didn't help in my case

**Comment by TobiasS1402** [comment]
My Cilium vlan traffic fails with the following just like above:
```bash
{
  "labels": {
    "direction": "INGRESS",
    "reason": "VLAN traffic disallowed by VLAN filter"
  },
  "name": "cilium_drop_count_total",
  "value": 430
}
```

## environment:
Host:
```bash
No LSB modules are available.
Distributor ID:	Debian
Description:	Debian GNU/Linux 12 (bookworm)
Release:	12
Codename:	bookworm
```
k3s:
``` bash
v1.32.3+k3s1
```
hypervisor:
```bash
pve-manager/8.3.5/dac3aa88bac3f300 (running kernel: 5.15.158-2-pve)
```

**Comment by bdrewery** [comment]
> To be honest, the packets probably shouldn't arrive on the interface in the first place.

This is worth thinking about more. Why is a VM receiving VLANs it does not expect or need? Is there a security risk for you?

For me the fix was to set `tag = 1` for the VM NIC config to only pass in vlan 1. The PVE UI shows it as "VLAN Tag".

Your bridge is likely VLAN aware and has something like `bridge-vids 2-4094` on it and is passing in all VLANs to every VM that has the bridge. Best to limit VMs to only seeing VLANs they should be seeing.

**Comment by max06** [comment]
Chiming in here, due to the same issue, but different environment:

I'm running k8s on a bunch of raspberry pies. They are connected to a switch tagging outgoing untagged packets with vlan id 20. The rpis here have no clue about being in a vlan. I'm pretty sure proxmox does the same to avoid requiring configuring the guest os, purely relying on dhcp. 

I also have a second vlan (id 30) configured with a dedicated vlan interface on my rpis. Running tcpdump on eth0 I can see these packages. This id is configured in the bypass list, to allow one of my pods sending out packages in a different subnet with proper source address. 

I can't rule out a config error in my switch that would allow other vlan packages to show up on the raspberry pies, to be dropped there, for example dhcp (broadcast) requests. 

I get the same failing tests as well.

**Comment by joestringer** [comment]
> I guess I don't fully understand the purpose of this metric/test. Is it supposed to indicate if Cilium is dropping VLAN traffic that the user might expect to arrive and so it's supposed to fail? If so, there's no bug here and we can close this issue.

The specific test assumes that any dropped packets might indicate a bug or environment misconfiguration. However it looks like if you happen to have VLAN packets floating around in the network, then Cilium will drop those and cause the test to fail.

If you're expecting those packets to be dropped and you're not experiencing an issue related to those drops, then I think everything is fine and the test failure can be ignored. If you're experiencing problems related to the VLAN-tagged traffic, then this test is providing you some Cilium-specific context about why the packets are being dropped. In the latter case there are suggestions in the thread above about how to configure Cilium to enable those packets to pass through.

I think we could open a thread about whether it makes sense for this specific test to be enabled by default for user environments or not, but we should probably follow up on that in a separate thread.

I'll close this thread out as I don't think there is something directly actionable from this question thread.

**Comment by pchaigno** [comment]
As discussed in https://github.com/cilium/cilium/issues/40564#issuecomment-3095854141, I don't think the right solution here is to skip the test. It also sounds like we have a few action items here.

This VLAN check was introduced in https://github.com/cilium/cilium/pull/16772. That pull request description provides more context on what the check and `vlan-bpf-bypass` do.

In terms of action items:
- I think we need to rename and document this flag. The description isn't enough to understand what the check is doing. And the name doesn't help much. At the very least, we should drop `bpf` from the name as that's an implementation detail.
- We could also consider disabling this check by default. It however sounds like this check makes sense in the general case and is mostly an issue on Proxmox. So maybe a better action item here is to document the Proxmox-specific case and recommend to set `vlan-bpf-bypass=0` in that case.

**Comment by joestringer** [comment]
> We could also consider disabling this check by default. 

We can consider this, but if a user configures a CCNP that applies host firewall to the node, then this traffic needs to be disabled unless the user is opting in to allowing the traffic.

**Comment by asauber** [comment]
As @mark-liu mentions in https://github.com/cilium/cilium/pull/44657#issue-4036379491, using the `--vlan-bpf-bypass=0` flag does not resolve the issue because drops still appear in metrics.

We also have [the `--expected-drop-reasons` flag](https://github.com/cilium/cilium/blob/ea17ed87298e7078171d2885da2f2bd08a02815d/.github/workflows/conformance-clustermesh.yaml#L690) for the connectivity tests.

Could anyone with this type of environment test the following invocation of the flag, and let us know if it resolves the issue? 

`--expected-drop-reasons='+VLAN traffic disallowed by VLAN filter'`
