### ISSUE TITLE
On almalinux 9.0 beta, The mac address of lxc health keeps changing,

### ISSUE THREAD

**Issue by erictarrence** [cilium/cilium#19678]
### Is there an existing issue for this?

- [X] I have searched the existing issues

### What happened?

On almalinux 9.0 beta, the pod network cannot be pinged through the cilium host (pod gateway) IP
Causes network failure between pods
coredns has been in run and CrashLoopBackOff state and cannot be ready
The mac address of lxc health keeps changing

```
kubectl -n kube-system get pod -o wide | grep coredns
coredns-6b5d4865bb-ksdpq           0/1     CrashLoopBackOff   27 (6s ago)    115m   10.2.3.49        node1     <none>           <none>
coredns-6b5d4865bb-kxhd2           0/1     Running            27 (4s ago)    115m   10.2.3.61        node1     <none>           <none>

# route -n
Kernel IP routing table
Destination     Gateway         Genmask         Flags Metric Ref    Use Iface
0.0.0.0         192.168.122.1   0.0.0.0         UG    100    0        0 enp1s0
10.2.0.0        10.2.1.1        255.255.255.0   UG    0      0        0 cilium_host
10.2.1.0        10.2.1.1        255.255.255.0   UG    0      0        0 cilium_host
10.2.1.1        0.0.0.0         255.255.255.255 UH    0      0        0 cilium_host
10.2.2.0        10.2.1.1        255.255.255.0   UG    0      0        0 cilium_host
10.2.3.0        10.2.1.1        255.255.255.0   UG    0      0        0 cilium_host
10.2.4.0        10.2.1.1        255.255.255.0   UG    0      0        0 cilium_host
192.168.122.0   0.0.0.0         255.255.255.0   U     100    0        0 enp1s0

 kubectl exec -it busybox -- sh
/ # route -n
Kernel IP routing table
Destination     Gateway         Genmask         Flags Metric Ref    Use Iface
0.0.0.0         10.2.1.1        0.0.0.0         UG    0      0        0 eth0
10.2.1.1        0.0.0.0         255.255.255.255 UH    0      0        0 eth0
/ # ping 10.2.1.1
PING 10.2.1.1 (10.2.1.1): 56 data bytes
^C
--- 10.2.1.1 ping statistics ---
6 packets transmitted, 0 packets received, 100% packet loss



**The mac address of lxc health keeps changing**


# ip addr | grep lxc_health -A 1
463: lxc_health@if462: <BROADCAST,MULTICAST,UP,LOWER_UP> mtu 1500 qdisc noqueue state UP group default qlen 1000
    link/ether c2:a7:c1:58:ac:cb brd ff:ff:ff:ff:ff:ff link-netns cilium-health
# ip addr | grep lxc_health -A 1
465: lxc_health@if464: <BROADCAST,MULTICAST,UP,LOWER_UP> mtu 1500 qdisc noqueue state UP group default qlen 1000
    link/ether 6e:da:ed:45:d2:d7 brd ff:ff:ff:ff:ff:ff link-netns cilium-health
```
```
Defaulted container "cilium-agent" out of: cilium-agent, mount-cgroup (init), wait-for-node-init (init), clean-cilium-state (init)
# cilium-health status
Probe time:   2022-05-04T15:41:59Z
Nodes:
  master1 (localhost):
    Host connectivity to 192.168.122.61:
      ICMP to stack:   OK, RTT=1.389517ms
      HTTP to agent:   OK, RTT=221.17µs
    Endpoint connectivity to 10.2.1.219:
      ICMP to stack:   Connection timed out
      HTTP to agent:   Get "http://10.2.1.219:4240/hello": dial tcp 10.2.1.219:4240: connect: connection timed out
  master2:
    Host connectivity to 192.168.122.62:
      ICMP to stack:   OK, RTT=1.328936ms
      HTTP to agent:   OK, RTT=170.911µs
    Endpoint connectivity to 10.2.2.16:
      ICMP to stack:   OK, RTT=1.386317ms
      HTTP to agent:   OK, RTT=647.08µs
  master3:
    Host connectivity to 192.168.122.63:
      ICMP to stack:   OK, RTT=1.464233ms
      HTTP to agent:   OK, RTT=351.381µs
    Endpoint connectivity to 10.2.0.226:
      ICMP to stack:   OK, RTT=1.356906ms
      HTTP to agent:   OK, RTT=375.483µs
  node1:
    Host connectivity to 192.168.122.64:
      ICMP to stack:   OK, RTT=1.3959ms
      HTTP to agent:   OK, RTT=638.75µs
    Endpoint connectivity to 10.2.3.234:
      ICMP to stack:   OK, RTT=1.387369ms
      HTTP to agent:   OK, RTT=393.127µs
  node2:
    Host connectivity to 192.168.122.65:
      ICMP to stack:   OK, RTT=1.338028ms
      HTTP to agent:   OK, RTT=303.847µs
    Endpoint connectivity to 10.2.4.167:
      ICMP to stack:   OK, RTT=1.530682ms
      HTTP to agent:   OK, RTT=580.522µs
```

almalinux 9.0 beta message
```
 tail -f /var/log/messages 
May  4 18:52:42 test-alma9-kvm61 kernel: IPv4: martian source 10.2.1.189 from 10.2.1.210, on dev lxc_health
May  4 18:52:42 test-alma9-kvm61 kernel: ll header: 00000000: 66 8d 55 c5 19 c1 42 58 9d 6b 4c 60 08 00
May  4 18:52:42 test-alma9-kvm61 NetworkManager[682]: <info>  [1651661562.1817] manager: (cilium): new Veth device (/org/freedesktop/NetworkManager/Devices/462)
May  4 18:52:42 test-alma9-kvm61 NetworkManager[682]: <info>  [1651661562.1911] manager: (lxc_health): new Veth device (/org/freedesktop/NetworkManager/Devices/463)
May  4 18:52:42 test-alma9-kvm61 systemd-udevd[34955]: Using default interface naming scheme 'v250'.
May  4 18:52:42 test-alma9-kvm61 NetworkManager[682]: <info>  [1651661562.1917] device (lxc_health): carrier: link connected
May  4 18:52:47 test-alma9-kvm61 kubelet[6908]: I0504 18:52:47.830090    6908 kubelet_getters.go:176] "Pod status updated" pod="kube-system/etcd-master1" status=Running
May  4 18:52:47 test-alma9-kvm61 kubelet[6908]: I0504 18:52:47.830378    6908 kubelet_getters.go:176] "Pod status updated" pod="kube-system/kube-apiserver-master1" status=Running
May  4 18:52:47 test-alma9-kvm61 kubelet[6908]: I0504 18:52:47.830405    6908 kubelet_getters.go:176] "Pod status updated" pod="kube-system/kube-controller-manager-master1" status=Running
May  4 18:52:47 test-alma9-kvm61 kubelet[6908]: I0504 18:52:47.830425    6908 kubelet_getters.go:176] "Pod status updated" pod="kube-system/kube-scheduler-master1" status=Running
```

```

### Cilium Version

cilium 1.11.2/1.11.4

### Kernel Version

```
cat /etc/redhat-release 
AlmaLinux release 9.0 Beta (Emerald Puma)
 uname -r
5.14.0-70.5.1.el9_0.x86_64

### Kubernetes Version

kubectl version
Client Version: version.Info{Major:"1", Minor:"23", GitVersion:"v1.23.3", GitCommit:"816c97ab8cff8a1c72eccca1026f7820e93e0d25", GitTreeState:"clean", BuildDate:"2022-01-25T21:25:17Z", GoVersion:"go1.17.6", Compiler:"gc", Platform:"linux/amd64"}
Server Version: version.Info{Major:"1", Minor:"23", GitVersion:"v1.23.3", GitCommit:"816c97ab8cff8a1c72eccca1026f7820e93e0d25", GitTreeState:"clean", BuildDate:"2022-01-25T21:19:12Z", GoVersion:"go1.17.6", Compiler:"gc", Platform:"linux/amd64"}

```

### Sysdump

```
cilium status
    /¯¯\
 /¯¯\__/¯¯\    Cilium:         5 errors
 \__/¯¯\__/    Operator:       OK
 /¯¯\__/¯¯\    Hubble:         1 errors
 \__/¯¯\__/    ClusterMesh:    disabled
    \__/

DaemonSet         cilium             Desired: 5, Ready: 5/5, Available: 5/5
Deployment        cilium-operator    Desired: 2, Ready: 2/2, Available: 2/2
Deployment        hubble-relay       Desired: 1, Unavailable: 1/1
Deployment        hubble-ui          Desired: 1, Ready: 1/1, Available: 1/1
Containers:       cilium             Running: 5
                  cilium-operator    Running: 2
                  hubble-relay       Running: 1
                  hubble-ui          Running: 1
Cluster Pods:     5/5 managed by Cilium
Image versions    cilium             quay.io/cilium/cilium:v1.11.4@sha256:d9d4c7759175db31aa32eaa68274bb9355d468fbc87e23123c80052e3ed63116: 5
                  cilium-operator    quay.io/cilium/operator-generic:v1.11.4@sha256:bf75ad0dc47691a3a519b8ab148ed3a792ffa2f1e309e6efa955f30a40e95adc: 2
                  hubble-relay       quay.io/cilium/hubble-relay:v1.11.4@sha256:460d50bd0c6bcdfa3c62b0488541c102a4079f5def07d2649ff67bc24fd0dd3f: 1
                  hubble-ui          quay.io/cilium/hubble-ui:v0.8.5@sha256:4eaca1ec1741043cfba6066a165b3bf251590cf4ac66371c4f63fbed2224ebb4: 1
                  hubble-ui          quay.io/cilium/hubble-ui-backend:v0.8.5@sha256:2bce50cf6c32719d072706f7ceccad654bfa907b2745a496da99610776fe31ed: 1
                  hubble-ui          docker.io/envoyproxy/envoy:v1.18.4@sha256:e5c2bb2870d0e59ce917a5100311813b4ede96ce4eb0c6bfa879e3fbe3e83935: 1
Errors:           cilium             cilium-2twdr    controller cilium-health-ep is failing since 52s (55x): Get "http://10.2.1.215:4240/hello": dial tcp 10.2.1.215:4240: connect: connection timed out
                  cilium             cilium-dq7ld    controller cilium-health-ep is failing since 8s (57x): Get "http://10.2.2.103:4240/hello": dial tcp 10.2.2.103:4240: connect: connection timed out
                  cilium             cilium-jxmtd    controller cilium-health-ep is failing since 9s (57x): Get "http://10.2.3.252:4240/hello": dial tcp 10.2.3.252:4240: connect: connection timed out
                  cilium             cilium-nptcd    controller cilium-health-ep is failing since 11s (2x): Get "http://10.2.4.150:4240/hello": dial tcp 10.2.4.150:4240: connect: connection timed out
                  cilium             cilium-zqxlq    controller cilium-health-ep is failing since 13s (56x): Get "http://10.2.0.43:4240/hello": dial tcp 10.2.0.43:4240: connect: connection timed out
                  hubble-relay       hubble-relay    1 pods of Deployment hubble-relay are not ready

```

```
helm install cilium cilium/cilium --version 1.11.2 \
--namespace kube-system \
--set nodeinit.enabled=true \
--set externalIPs.enabled=true \
--set nodePort.enabled=true \
--set hostPort.enabled=true \
--set pullPolicy=IfNotPresent \
--set config.ipam=cluster-pool \
--set hubble.enabled=true \
--set hubble.listenAddress=:4244 \
--set hubble.relay.enabled=true \
--set hubble.metrics.enabled="{dns,drop,tcp,flow,port-distribution,icmp,http}" \
--set hubble.ui.enabled=true \
--set kubeProxyReplacement=strict \
--set k8sServiceHost=192.168.122.99 \
--set k8sServicePort=6443 \
--set operator.prometheus.enabled=true \
--set prometheus.enabled=true \
--set ipam.operator.clusterPoolIPv4MaskSize=26 \
--set ipam.operator.clusterPoolIPv4PodCIDR=10.1.0.0/16
```
### Relevant log output

_No response_

### Anything else?

_No response_

### Code of Conduct

- [X] I agree to follow this project's Code of Conduct

**Comment by Ericra95** [comment]
Everything works fine on almalinux 8.5

```
kubectl exec -it busy-box-5df6cc9447-7gc7p -- sh
/ # route -n
Kernel IP routing table
Destination     Gateway         Genmask         Flags Metric Ref    Use Iface
0.0.0.0         10.2.3.166      0.0.0.0         UG    0      0        0 eth0
10.2.3.166      0.0.0.0         255.255.255.255 UH    0      0        0 eth0
/ # ping 10.2.3.166
PING 10.2.3.166 (10.2.3.166): 56 data bytes
64 bytes from 10.2.3.166: seq=0 ttl=63 time=0.067 ms
64 bytes from 10.2.3.166: seq=1 ttl=63 time=0.084 ms
^C
--- 10.2.3.166 ping statistics ---
2 packets transmitted, 2 packets received, 0% packet loss
round-trip min/avg/max = 0.067/0.075/0.084 ms

**Comment by Ericra95** [comment]
cilium status prompts an error  ,The mac address of lxc health keeps changing

```
controller cilium-health-ep is failing since 8s (58x): Get "http://10.2.4.26:4240/hello":
```
But inside the container wget works fine
```
wget http://10.2.4.26:4240/hello
Connecting to 10.2.4.26:4240 (10.2.4.26:4240)
saving to 'hello'
'hello' saved
```

```

 cilium status
    /¯¯\
 /¯¯\__/¯¯\    Cilium:         5 errors
 \__/¯¯\__/    Operator:       OK
 /¯¯\__/¯¯\    Hubble:         1 errors
 \__/¯¯\__/    ClusterMesh:    disabled
    \__/

DaemonSet         cilium             Desired: 5, Ready: 5/5, Available: 5/5
Deployment        cilium-operator    Desired: 2, Ready: 2/2, Available: 2/2
Deployment        hubble-relay       Desired: 1, Unavailable: 1/1
Deployment        hubble-ui          Desired: 1, Ready: 1/1, Available: 1/1
Containers:       cilium             Running: 5
                  cilium-operator    Running: 2
                  hubble-relay       Running: 1
                  hubble-ui          Running: 1
Cluster Pods:     5/5 managed by Cilium
Image versions    hubble-ui          quay.io/cilium/hubble-ui-backend:v0.8.5@sha256:2bce50cf6c32719d072706f7ceccad654bfa907b2745a496da99610776fe31ed: 1
                  hubble-ui          docker.io/envoyproxy/envoy:v1.18.4@sha256:e5c2bb2870d0e59ce917a5100311813b4ede96ce4eb0c6bfa879e3fbe3e83935: 1
                  hubble-ui          quay.io/cilium/hubble-ui:v0.8.5@sha256:4eaca1ec1741043cfba6066a165b3bf251590cf4ac66371c4f63fbed2224ebb4: 1
                  cilium             quay.io/cilium/cilium:v1.11.2@sha256:4332428fbb528bda32fffe124454458c9b716c86211266d1a03c4ddf695d7f60: 5
                  cilium-operator    quay.io/cilium/operator-generic:v1.11.2@sha256:4c8bea6818ee3e4932f99e9c1d7efa88b8c0f3cd516160caec878406531e45e7: 2
                  hubble-relay       quay.io/cilium/hubble-relay:v1.11.2@sha256:f031f95f3c9ba8962094649c0cc913f90723d553203444c8fb9a591e38873c9d: 1
Errors:           cilium             cilium-9hm59    controller cilium-health-ep is failing since 9s (58x): Get "http://10.2.2.250:4240/hello": dial tcp 10.2.2.250:4240: connect: connection timed out
                  cilium             cilium-d9f8h    controller cilium-health-ep is failing since 8s (58x): Get "http://10.2.0.32:4240/hello": dial tcp 10.2.0.32:4240: connect: connection timed out
                  cilium             cilium-dgb5g    controller cilium-health-ep is failing since 8s (58x): Get "http://10.2.1.179:4240/hello": dial tcp 10.2.1.179:4240: connect: connection timed out
                  cilium             cilium-f2qxh    controller cilium-health-ep is failing since 8s (58x): Get "http://10.2.4.26:4240/hello": dial tcp 10.2.4.26:4240: connect: connection timed out
                  cilium             cilium-kbmkq    controller cilium-health-ep is failing since 7s (58x): Get "http://10.2.3.161:4240/hello": dial tcp 10.2.3.161:4240: connect: connection timed out
                  hubble-relay       hubble-relay    1 pods of Deployment hubble-relay are not ready
```
```
# kubectl -n kube-system exec -it cilium-f2qxh cilium-f2qxh -- sh
Defaulted container "cilium-agent" out of: cilium-agent, mount-cgroup (init), wait-for-node-init (init), clean-cilium-state (init)
#  cilium bpf endpoint list
IP ADDRESS         LOCAL ENDPOINT INFO
192.168.122.65:0   (localhost)                                                                         
10.2.4.26:0        id=3611  flags=0x0000 ifindex=105 mac=3E:6E:FB:8C:58:A4 nodemac=BA:1F:40:FD:C9:AB   
10.2.4.101:0       id=701   flags=0x0000 ifindex=71  mac=26:4F:D7:CF:E4:25 nodemac=CA:A3:83:E7:AD:70   
10.2.4.24:0        (localhost)                                                                         
10.2.4.112:0       id=1339  flags=0x0000 ifindex=9   mac=FE:51:F1:1B:D2:5B nodemac=B6:F9:89:32:CF:21   
10.2.4.104:0       id=267   flags=0x0000 ifindex=11  mac=62:3B:D4:BF:A4:4E nodemac=92:BE:C2:49:28:E5 
```
```
# kubectl exec -it busybox -- sh
/ # ip addr
1: lo: <LOOPBACK,UP,LOWER_UP> mtu 65536 qdisc noqueue qlen 1000
    link/loopback 00:00:00:00:00:00 brd 00:00:00:00:00:00
    inet 127.0.0.1/8 scope host lo
       valid_lft forever preferred_lft forever
70: eth0@if71: <BROADCAST,MULTICAST,UP,LOWER_UP,M-DOWN> mtu 1500 qdisc noqueue qlen 1000
    link/ether 26:4f:d7:cf:e4:25 brd ff:ff:ff:ff:ff:ff
    inet 10.2.4.101/32 scope global eth0
       valid_lft forever preferred_lft forever


/ # ip route
default via 10.2.4.24 dev eth0 
10.2.4.24 dev eth0 scope link 

/ # ping 10.2.4.24
PING 10.2.4.24 (10.2.4.24): 56 data bytes
^C
--- 10.2.4.24 ping statistics ---
40 packets transmitted, 0 packets received, 100% packet loss

/ # ping 10.2.4.26
PING 10.2.4.26 (10.2.4.26): 56 data bytes
64 bytes from 10.2.4.26: seq=0 ttl=63 time=0.127 ms
64 bytes from 10.2.4.26: seq=1 ttl=63 time=0.146 ms
64 bytes from 10.2.4.26: seq=2 ttl=63 time=0.089 ms
64 bytes from 10.2.4.26: seq=3 ttl=63 time=0.100 ms
64 bytes from 10.2.4.26: seq=4 ttl=63 time=0.101 ms
64 bytes from 10.2.4.26: seq=5 ttl=63 time=0.149 ms
^C
--- 10.2.4.26 ping statistics ---
6 packets transmitted, 6 packets received, 0% packet loss
round-trip min/avg/max = 0.089/0.118/0.149 ms




10:14:13.655715 IP 10.2.4.101 > 10.2.4.24: ICMP echo request, id 54, seq 30, length 64
10:14:14.017492 ARP, Request who-has 10.2.4.24 tell 10.2.4.101, length 28
10:14:14.017498 ARP, Reply 10.2.4.24 is-at ca:a3:83:e7:ad:70, length 28
10:14:14.658544 IP 10.2.4.101 > 10.2.4.24: ICMP echo request, id 54, seq 31, length 64
10:14:15.661192 IP 10.2.4.101 > 10.2.4.24: ICMP echo request, id 54, seq 32, length 64
10:14:16.664274 IP 10.2.4.101 > 10.2.4.24: ICMP echo request, id 54, seq 33, length 64
^C


tcpdump: verbose output suppressed, use -v[v]... for full protocol decode
listening on lxc_health, link-type EN10MB (Ethernet), snapshot length 262144 bytes
10:21:06.232054 IP 10.2.2.122.45286 > 10.2.4.26.4240: Flags [.], ack 3148399343, win 83, length 0
10:21:06.232064 IP 10.2.4.26.4240 > 10.2.2.122.45286: Flags [.], ack 1, win 83, length 0
10:21:06.689521 IP 10.2.4.26.4240 > 10.2.2.122.45286: Flags [.], ack 1, win 83, length 0
10:21:06.690122 IP 10.2.2.122.45286 > 10.2.4.26.4240: Flags [.], ack 1, win 83, length 0
10:21:06.755384 IP 10.2.3.163.42416 > 10.2.4.26.4240: Flags [.], ack 496459103, win 83, length 0
10:21:06.755395 IP 10.2.4.26.4240 > 10.2.3.163.42416: Flags [.], ack 1, win 83, length 0
10:21:06.760924 IP 10.2.0.170.61490 > 10.2.4.26.4240: Flags [.], ack 882691116, win 83, length 0
10:21:06.760933 IP 10.2.4.26.4240 > 10.2.0.170.61490: Flags [.], ack 1, win 83, length 0
10:21:06.849214 IP 10.2.1.189.56084 > 10.2.4.26.4240: Flags [.], ack 2877147649, win 83, length 0
10:21:06.849225 IP 10.2.4.26.4240 > 10.2.1.189.56084: Flags [.], ack 1, win 83, length 0
10:21:07.201455 IP 10.2.4.26.4240 > 10.2.0.170.61490: Flags [.], ack 1, win 83, length 0
10:21:07.201455 IP 10.2.4.26.4240 > 10.2.3.163.42416: Flags [.], ack 1, win 83, length 0
10:21:07.201467 IP 10.2.4.26.4240 > 10.2.1.189.56084: Flags [.], ack 1, win 83, length 0
10:21:07.201905 IP 10.2.0.170.61490 > 10.2.4.26.4240: Flags [.], ack 1, win 83, length 0
10:21:07.201907 IP 10.2.1.189.56084 > 10.2.4.26.4240: Flags [.], ack 1, win 83, length 0
10:21:07.201941 IP 10.2.3.163.42416 > 10.2.4.26.4240: Flags [.], ack 1, win 83, length 0
10:21:08.225440 IP 10.2.4.26.4240 > 10.2.4.24.54484: Flags [S.], seq 2129408120, ack 2006107500, win 42340, options [mss 1460,nop,nop,sackOK,nop,wscale 9], length 0
^C
17 packets captured

/ # wget http://10.2.4.26:4240/hello
Connecting to 10.2.4.26:4240 (10.2.4.26:4240)
saving to 'hello'
'hello' saved
/ # telnet 10.2.4.26 4240
Connected to 10.2.4.26
^C
Console escape. Commands are:

 l	go to line mode
 c	go to character mode
 z	suspend telnet
 e	exit telnet
/ # 
/ # cat hello 
/ # stat hello
  File: hello
  Size: 0         	Blocks: 0          IO Block: 4096   regular empty file
Device: a5h/165d	Inode: 35121476    Links: 1
Access: (0644/-rw-r--r--)  Uid: (    0/    root)   Gid: (    0/    root)
Access: 2022-05-05 02:28:48.377320901 +0000
Modify: 2022-05-05 02:28:24.404579338 +0000
Change: 2022-05-05 02:28:24.404579338 +0000

/ # wget http://10.2.1.179:4240/hello
Connecting to 10.2.1.179:4240 (10.2.1.179:4240)
saving to 'hello'
'hello' saved

```

**Comment by xpflying** [comment]
@Ericra95 I encountered the same problem, why did you close this issue?
