### ISSUE TITLE
L7 egress from container to world is broken

### ISSUE THREAD

**Issue by joestringer** [cilium/cilium#3373]
I set up a pod and an L7 policy, then attempted to contact the outside world. It doesn't work with a policy that should allow the traffic.  For some reason, the SYN-ACKs from world back into egress proxy are being reset before they reach Envoy, so Envoy cannot pass the reply on to the pod.

Policy:
```
[                                                                               
  {                                                                             
    "endpointSelector": {                                                       
      "matchLabels": {                                                          
        "container:id": "app2"                                                  
      }                                                                         
    },                                                                          
    "egress": [                                                                 
      {                                                                         
        "toEntities": [                                                         
          "world"                                                               
        ]                                                                                                                                                                                                                                                                                   
      },                                                                        
      {                                                                         
        "toPorts": [                                                            
          {"ports":[ {"port": "53", "protocol": "UDP"} ] },                     
          {"ports":[ {"port": "80", "protocol": "TCP"} ],                       
           "rules": {                                                           
             "HTTP": [                                                          
               {                                                                
                 "method": "GET",                                               
                 "path": ".*"                                                   
               }                                                                
             ]                                                                  
           }                                                                    
          }                                                                     
        ]                                                                       
      }                                                                         
    ]                                                                           
  }                                                                             
] 
```

Run an endpoint with labels app2, inside:

```
bash-4.3# curl -4 google.com       
upstream connect error or disconnect/reset before headers
```

From the host:
```
$ sudo tcpdump -nvi enp0s3 "tcp && port 80"                                                                                                                                                                                                   
tcpdump: listening on enp0s3, link-type EN10MB (Ethernet), capture size 262144 bytes                                                          
00:59:15.103747 IP (tos 0x0, ttl 63, id 36428, offset 0, flags [DF], proto TCP (6), length 60)                                               
    10.0.2.15.45782 > 172.217.2.238.80: Flags [S], cksum 0xbc04 (incorrect -> 0xe067), seq 3765052754, win 28200, options [mss 1410,sackOK,TS val 2817973489 ecr 0,nop,wscale 7], length 0
00:59:15.151789 IP (tos 0x0, ttl 64, id 51722, offset 0, flags [none], proto TCP (6), length 44)                                             
    172.217.2.238.80 > 10.0.2.15.45782: Flags [S.], cksum 0x63bb (correct), seq 1738496001, ack 3765052755, win 65535, options [mss 1460], length 0
00:59:15.151891 IP (tos 0x0, ttl 64, id 4443, offset 0, flags [DF], proto TCP (6), length 40)                                                
    10.0.2.15.45782 > 172.217.2.238.80: Flags [R], cksum 0x3b26 (correct), seq 3765052755, win 0, length 0
```

cilium monitor times out and sends a 503:
```
$ cilium monitor -t l7 |  ts '[%Y-%m-%d %H:%M:%.S]'                                            
[2018-03-29 01:00:50.601502] Listening for events on 2 CPUs with 64x4096 of shared memory                                                    
[2018-03-29 01:00:50.601980] Press Ctrl-C to quit                     
[2018-03-29 01:00:51.874583] -> Request http from 29381 ([container:maintainer=tgraf@tgraf.ch container:id=app2]) to 0 ([reserved:world]), identity 57561->2, verdict Forwarded GET http://google.com/ => 0
[2018-03-29 01:00:52.849965] -> Response http from 29381 ([container:maintainer=tgraf@tgraf.ch container:id=app2]) to 0 ([reserved:world]), identity 57561->2, verdict Forwarded GET http://google.com/ => 503
```

Routes:
```
$ ip route              
default via 10.0.2.2 dev enp0s3 proto dhcp src 10.0.2.15 metric 100   
10.0.2.0/24 dev enp0s3 proto kernel scope link src 10.0.2.15          
10.0.2.2 dev enp0s3 proto dhcp scope link src 10.0.2.15 metric 100    
10.11.0.0/16 via 10.11.28.238 dev cilium_host src 10.11.28.238        
10.11.28.238 dev cilium_host scope link                               
172.17.0.0/16 dev docker0 proto kernel scope link src 172.17.0.1      
192.168.33.0/24 dev enp0s8 proto kernel scope link src 192.168.33.11  
192.168.34.0/24 dev enp0s9 proto kernel scope link src 192.168.34.11
```

**Comment by joestringer** [comment]
@tgraf is the intended design such that we would expect traffic from the proxy to the outside world to go via `cilium_host`? Because this is not the case in this example.

**Comment by joestringer** [comment]
Something else to note is that often calls from containers to the outside world are encrypted, in which case we wouldn't be able to peek inside the packets today anyway, so the workaround would be to remove the L7 policy and fall back to CIDR-only.

**Comment by tgraf** [comment]
@joestringer Packets from container to outside world should get redirected via cilium_host to proxy and proxy sends them out like any regular local process.

**Comment by joestringer** [comment]
Yeah, I'm not sure why the responses aren't handled back into the proxy just like any other regular local process. Local processes seem to work fine for the equivalent request.

**Comment by joestringer** [comment]
Duplicate of #3453.
