### ISSUE TITLE
Reply packet comes to the Node but not received by the container

### ISSUE THREAD

**Issue by anupamdialpad** [cilium/cilium#27132]
### Is there an existing issue for this?

- [X] I have searched the existing issues

### What happened?

Packets are going out through the lxc interface and the response reaches the Node but fails to be received by the container.
Here is the tcdump 
```
$ tcpdump -i any host 172.217.12.132 -n

11:37:10.245478 lxcf5cbf63f3d30 In  IP 10.36.0.238 > 172.217.12.132: ICMP echo request, id 104, seq 42, length 64
11:37:10.245513 eno1  Out IP 103.35.127.34 > 172.217.12.132: ICMP echo request, id 104, seq 42, length 64
11:37:10.291637 eno1  In  IP 172.217.12.132 > 103.35.127.34: ICMP echo reply, id 104, seq 42, length 64
11:37:11.269480 lxcf5cbf63f3d30 In  IP 10.36.0.238 > 172.217.12.132: ICMP echo request, id 104, seq 43, length 64
11:37:11.269515 eno1  Out IP 103.35.127.34 > 172.217.12.132: ICMP echo request, id 104, seq 43, length 64
11:37:11.315629 eno1  In  IP 172.217.12.132 > 103.35.127.34: ICMP echo reply, id 104, seq 43, length 64
11:37:12.293481 lxcf5cbf63f3d30 In  IP 10.36.0.238 > 172.217.12.132: ICMP echo request, id 104, seq 44, length 64
11:37:12.293520 eno1  Out IP 103.35.127.34 > 172.217.12.132: ICMP echo request, id 104, seq 44, length 64
11:37:12.339660 eno1  In  IP 172.217.12.132 > 103.35.127.34: ICMP echo reply, id 104, seq 44, length 64
```

The first 3 lines shows that the packet leaves the lxc interface and goes out public through eno1 and the response is received by eno1 but it doesn't go back to the lxc interface.

We have seen this issue couple of times in the past and every time we restart the Cilium pod this issue goes away.

### Cilium Version

1.14.0-rc.1

### Kernel Version

5.10.0-22-amd64 #1 SMP Debian 5.10.178-3 (2023-04-22) x86_64 GNU/Linux

### Kubernetes Version

1.25.9

### Sysdump

[cilium-sysdump-20230728-120624.zip](https://github.com/cilium/cilium/files/12194311/cilium-sysdump-20230728-120624.zip)

### Code of Conduct

- [X] I agree to follow this project's Code of Conduct

**Comment by anupamdialpad** [comment]
This happens when netfilter is restarted on the Node which was getting executed during pushing new code to our Nodes.
Closing this since we can avoid netfilter restart.
