### ISSUE TITLE
Geneve DSR is broken when running w/o BPF masquerade

### ISSUE THREAD

**Issue by brb** [cilium/cilium#32189]
Encountered on the latest `main` (stable branches might be affected too):

```
12:39:59.287274 IP 172.18.0.2.30851 > 172.18.0.1.44148: Flags [S.], seq 736152428, ack 72597045, win 32950, options [mss 1330,sackOK,TS val 1289060956 ecr 1762384254,nop,wscale 7], length 0
12:39:59.287471 IP 172.18.0.3.80 > 172.18.0.1.44148: Flags [.], ack 72597124, win 257, options [nop,nop,TS val 1289060956 ecr 1762384254], length 0
12:39:59.287486 IP 172.18.0.1.44148 > 172.18.0.3.80: Flags [R], seq 72597124, win 0, length 0
12:39:59.494078 IP 172.18.0.2.30851 > 172.18.0.1.44148: Flags [R], seq 736152429, win 0, length 01
```

The second reply gets wrong src port (should be 30851 instead of 80). Enabling BPF masq fixes the issue.

**Comment by julianwiedmann** [comment]
We're probably missing to consider what's described here for `from-netdev` traffic (ie where DSR with IP-option would get handled):
https://github.com/cilium/cilium/blob/a2069654ea618fa80d2175f9f453ff50c183e7bf/bpf/bpf_host.c#L719

**Comment by julianwiedmann** [comment]
This should also cover the same scenario that @giorio94 described in https://github.com/cilium/cilium/issues/26407#issuecomment-1881573685.

**Comment by stevefan1999-personal** [comment]
DSR with Geneve in tunnel mode also doesn't work either, see #33609. I have to force myself to use SNAT for this reason.

**Comment by yushoyamaguchi** [comment]
In addition, there is no conntrack entry which is meet the below NAT rule.

```
pkts bytes target     prot opt in     out     source               destination         
    1    52 MASQUERADE  all  --  *      !cilium_+  10.100.2.0/24       !10.100.2.0/24        /* cilium masquerade non-cluster */
```

Maybe it is the cause that some source-address of some packets is set as LB EXTRENAL-IP.

I think it may be a conntrack bug...

**Comment by yushoyamaguchi** [comment]
@brb @julianwiedmann 

In today's APAC dev meeting, @YutaroHayakawa told me that 
```
1. Rewrite this rule to narrow its scope, ensuring that it does not apply to DSR reply packets.
2. Add another rule to prevent packets from being processed by this rule
```
these plans are challenging to achieve because it is difficult to write iptables rule which is applied to only DSR reply packet.<br>
He said that It is conceivable to mark DSR packets on the eBPF program side, but not many usable bits seem to be available.


I'm not working on this issue to use Cilium with this setting(using DSR without BPF masquerade) in important environment.
I'm working on this issue just for learning Cilium data-path and Linux packet processing. <br>
Therefore, it is okay to add an explanation in the documentation to clarify that using DSR without BPF masquerade is not supported.

If you have the motivation to solve this issue even if it complicates the implementation, I’d be happy to work with you to explore potential solutions.

**Comment by julianwiedmann** [comment]
> [@brb](https://github.com/brb) [@julianwiedmann](https://github.com/julianwiedmann)
> 
> I'm sorry for repeating mention.
> 
> Do you think this issue does not necessarily need to be resolved? If you think this issue should be resolved, I want to work for resolving.

Of course, thank you! I'll assign this to you then :)

**Comment by yushoyamaguchi** [comment]
@julianwiedmann 

Thank you.

My plan is to not add these iptables rules when bpf-masquerade is disabled.
Is it okay?

**Comment by julianwiedmann** [comment]
> [@julianwiedmann](https://github.com/julianwiedmann)
> 
> Thank you.
> 
> My plan is to not add [this iptables rule](https://github.com/cilium/cilium/issues/32189#issuecomment-2468458681) when bpf-masquerade is disabled. Is it okay? Other detailed conditions may need to be set. I'll considered it from here on.

I haven't thought about it much, but my [initial gut feeling](https://github.com/cilium/cilium/issues/32189#issuecomment-2077038894) was that we essentially have an asymmetry here, and need to run **both** directions of the traffic through the host stack.

So I'd be curious what happens in a scenario with per-ep routing enabled - so that `from-overlay` passes the forward direction into the host stack, and it gets delivered from there (with netfilter visibility).

**Comment by yushoyamaguchi** [comment]
In this context, what does per-ep routing mean?

`need to run both directions of the traffic through the host stack.`
In addition, in my thought, both directions of the traffic is treated by host-stack, in current implementation.

**Comment by julianwiedmann** [comment]
> I'm sorry, in this context, what does per-ep routing mean? (Is this referring to a specific setting in Cilium?)

never mind, I was talking nonsense :).

I thought that setting `enable-endpoint-routes` (and thus having `USE_BPF_PROG_FOR_INGRESS_POLICY`) would be enough to send us down [this code path](https://github.com/cilium/cilium/blob/f928ca28600fd9a882094e21b418c8d82357a166/bpf/lib/l3.h#L97). But that doesn't hold, as in this scenario `ENABLE_NODEPORT` is set.

**Comment by yushoyamaguchi** [comment]
@julianwiedmann 

I'm sorry for a question.
https://github.com/cilium/cilium/issues/32189#issuecomment-2077038894
Does this mean that if there is a conn_track entry where:
- src = Client IP address from outside the cluster
- dst = Pod IP address specified as the destination by the LB
then the return traffic will not be masqueraded?"
I couldn't understand why it is, I'm sorry...


I thought it would be easier to modify [the iptables rules](https://github.com/cilium/cilium/blob/7f2222818884bd05dd027fc9efd82ff3eb4e3f54/pkg/datapath/iptables/iptables.go#L1770-L1797) so they don't apply to DSR reply packets - would that be difficult?

**Comment by julianwiedmann** [comment]
that's my understanding of how it works, yes. If there's a CT entry in forward direction, then the reply doesn't get masqueraded.

In the end we'd want this to look very similar to how DSR with IP-option handles this config, right? Either it's broken as well, or there is a way to avoid customizations to the iptables setup.

**Comment by XA21X** [comment]
I was trying to get L2 announcements working for FreeRADIUS and this was the missing piece. 🎉 

I was already using Geneve but the following helm options were needed: (DSR + BPF masquerade)

```
loadBalancer:
  mode: dsr
  dsrDispatch: geneve

bpf:
  masquerade: true
```

Without DSR, the RADIUS server sees the wrong source IP (I didn't want to allow-all) and rejects the request.

With DSR but without BPF masquerade, the response comes from the wrong IP and the client rejects the response.

**Comment by yushoyamaguchi** [comment]
@julianwiedmann 

Thank you for your support.
I could fix this problem using the way which you suggested.
https://github.com/cilium/cilium/pull/37937

**Comment by yushoyamaguchi** [comment]
@julianwiedmann 

Could you close this issue?

https://github.com/cilium/cilium/pull/37937
