### ISSUE TITLE
Cilium does not respond to ARP requests when you enable L2 pod announcements

### ISSUE THREAD

**Issue by ttc0419** [cilium/cilium#39933]
### Is there an existing issue for this?

- [x] I have searched the existing issues

### Version

equal or higher than v1.17.4 and lower than v1.18.0

### What happened?

Cannot ping pod when L2 pod announcement is enabled, cilium does not reply any arp requests for pod ip.

**Pod:**
```
NAMESPACE     NAME                                           READY   STATUS    RESTARTS   AGE     IP              NODE             NOMINATED NODE   READINESS GATES
default       pod/ingress-nginx-controller-cd6d9998c-jd4wg   1/1     Running   0          4m18s   192.168.54.94   control-node-1   <none>           <none>
```

**ping:**
```
[u@h d](master)% ping 192.168.54.94
PING 192.168.54.94 (192.168.54.94): 56 data bytes
Request timeout for icmp_seq 0
Request timeout for icmp_seq 1
Request timeout for icmp_seq 2
Request timeout for icmp_seq 3
ping: sendto: No route to host
Request timeout for icmp_seq 4
ping: sendto: Host is down
Request timeout for icmp_seq 5
^C
--- 192.168.54.94 ping statistics ---
7 packets transmitted, 0 packets received, 100.0% packet loss
```

**tcpdump on node-1:**
```
[root@control-node-1 ~]# tcpdump -ani any arp
tcpdump: data link type LINUX_SLL2
dropped privs to tcpdump
tcpdump: verbose output suppressed, use -v[v]... for full protocol decode
listening on any, link-type LINUX_SLL2 (Linux cooked v2), snapshot length 262144 bytes
15:28:27.242998 enp0s1 B   ARP, Request who-has 192.168.54.94 tell 192.168.54.5, length 28
15:28:28.260441 enp0s1 B   ARP, Request who-has 192.168.54.94 tell 192.168.54.5, length 28
15:28:29.265340 enp0s1 B   ARP, Request who-has 192.168.54.94 tell 192.168.54.5, length 28
15:28:30.269631 enp0s1 B   ARP, Request who-has 192.168.54.94 tell 192.168.54.5, length 28
15:28:31.271115 enp0s1 B   ARP, Request who-has 192.168.54.94 tell 192.168.54.5, length 28
^C
5 packets captured
7 packets received by filter
0 packets dropped by kernel
```

### How can we reproduce the issue?

helm install with values:
```yaml
k8sServiceHost: xxx
k8sServicePort: 6443

envoy:
  enabled: false

k8sNetworkPolicy:
  enabled: false

hubble:
  enabled: false

loadBalancer:
  acceleration: best-effort
  mode: dsr

l7Proxy: false
kubeProxyReplacement: true
installNoConntrackIptablesRules: true

ipam:
  mode: kubernetes

routingMode: native
autoDirectNodeRoutes: true
enableIPv4Masquerade: false
ipv4NativeRoutingCIDR: 192.168.54.0/24

l2podAnnouncements:
  enabled: true
  interface: enp0s1

l2announcements:
  enabled: true
```

### Cilium Version

1.17.3

### Kernel Version

Linux control-node-3 5.14.0-570.18.1.el9_6.aarch64 #1 SMP PREEMPT_DYNAMIC Fri May 30 14:00:52 EDT 2025 aarch64 aarch64 aarch64 GNU/Linux

### Kubernetes Version

1.33.0

### Regression

No

### Sysdump

[cilium-sysdump-20250607-153426.zip](https://github.com/user-attachments/files/20637553/cilium-sysdump-20250607-153426.zip)

### Cilium Users Document

- [x] Are you a user of Cilium? Please add yourself to the [Users doc](https://github.com/cilium/cilium/blob/main/USERS.md)

### Code of Conduct

- [x] I agree to follow this project's Code of Conduct

**Comment by dylandreimerink** [comment]
The L2 pod announcement feature does not actually make your pods respond to ARP. It sends out a GARP once when a pod starts up. It is intended to signal to the network infrastructure that the pod IP now has a new MAC address in situations where the pod CIDR is shared with non-k8s resources.

To get pod to pod traffic working over L2 without tunneling you can use native routing + `auto-direct-node-routes: true`. But this will not make the pod IP available from outside the cluster, only from other Cilium nodes. You typically want to use services

**Comment by ttc0419** [comment]
@dylandreimerink  Thanks for the clarification, what I wanted was a flat network, which each pod will work like a server in the node's LAN like most cloud providers when using VPC CNI. Is there a way to achieve this with cilium? Will responding to ARP be considered as a feature for L2 Pod Announcement?

**Comment by dylandreimerink** [comment]
Typically it is not desirable to expose a pod directly. The IP a pod gets, its clusterIP is not stable. 

> each pod will work like a server in the node's LAN like most cloud providers when using VPC CNI. Is there a way to achieve this with cilium

You have a few options.

First, you can use BGP to [announce your pod CIDRs](https://docs.cilium.io/en/latest/network/bgp-control-plane/bgp-control-plane-v2/#bgp-adverts-podcidr). This does require a BGP enabled network. 

You have a number of other options, which allow you to expose the pod via the node IPs, each with their own upside and downside:
* Node port services
* [Host port](https://docs.cilium.io/en/latest/network/kubernetes/kubeproxy-free/#kubeproxyfree-hostport)
* [Node IPAM LB](https://docs.cilium.io/en/latest/network/node-ipam/#node-ipam)

Last option, is to enable ARP proxying. As far as I know this isn't regularly tested or explicitly supported by Cilium, but I have recently seen someone mention that this worked for them. You have to manually enable it on your nodes via the sysctl:
`echo 1 > /proc/sys/net/ipv4/conf/all/proxy_arp` for all interfaces or `echo 1 >  /proc/sys/net/ipv4/conf/INTERFACE_NAME/proxy_arp`  for specific interfaces. 

> Will responding to ARP be considered as a feature for L2 Pod Announcement?

Not excluding it in the future. But its not something anyone is actively working on or planning on working on.

**Comment by Djarid** [comment]
I'm a ~little~ lot confused. The documentation says

"L2 Announcements is a feature which makes services visible and reachable on the local area network. This feature is primarily intended for on-premises deployments within networks without BGP based routing such as office or campus networks.

When used, this feature will respond to ARP queries for ExternalIPs and/or LoadBalancer IPs. These IPs are Virtual IPs (not installed on network devices) on multiple nodes, so for each service one node at a time will respond to the ARP queries and respond with its MAC address. This node will perform load balancing with the service load balancing feature, thus acting as a north/south load balancer."

critically "When used, this feature will **respond** to ARP queries".

I've followed the guides and have several services working quite happily with L2-announce. But I have some services which  Cilium 1.17.5 stubbornly refuses to announce despite cilium reporting everything is healthy and configured. GARP just isn't happening

**Comment by dylandreimerink** [comment]
> critically "When used, this feature will respond to ARP queries".

Yes, this is a funny detail about ARP. Some clients ignore GARP messages because they can be used to poison the ARP cache. So we send out a GARP once, when a node gets the lease for a given service, to update the cache of any clients that do listen to it. But most of the work after that is responding to ARP queries, as if the service IPs were installed on a given node. (we only do this for service l2 announcements, not l2 pod announcements)

We call it "announcing" to indicate that we let other network devices know how to reach IPs, its not about the exact workings of the protocols involved in doing so.

> But I have some services which Cilium 1.17.5 stubbornly refuses to announce despite cilium reporting everything is healthy and configured. GARP just isn't happening

Would like to point out that this seems unrelated to the issue which is about L2 pod announcements, not service announcements. I recommend opening a new issue.
