### ISSUE TITLE
Packet drops with `externalTrafficPolicy: Cluster` in generic-veth chaining mode

### ISSUE THREAD

**Issue by kvaps** [cilium/cilium#32714]
### Is there an existing issue for this?

- [X] I have searched the existing issues

### What happened?

Hey, I use cilium in generic-veth chaining mode with kube-ovn. Kube-proxy replacement is enabled in strict mode.

Everything works as expected. However external traffic to service with `externalTrafficPolicy: Cluster` forwarded to pods on external nodes always reseted:

```
11:52:30.232445 IP 192.168.100.13.57196 > 10.244.0.129.80: Flags [S], seq 1862326452, win 65535, options [mss 1460,nop,wscale 6,nop,nop,TS val 1540021380 ecr 0,sackOK,eol], length 0
11:52:30.232539 IP 10.244.0.129.80 > 192.168.100.13.57196: Flags [S.], seq 499673168, ack 1862326453, win 32352, options [mss 1360,sackOK,TS val 2139715536 ecr 1540021380,nop,wscale 7], length 0
11:52:30.232877 IP 192.168.100.13.57196 > 10.244.0.129.80: Flags [R], seq 1862326453, win 0, length 0
```

In case if I disable `hostLegacyRouting` option, I see that external services traffic can reach pods on both local and remote nodes, however in this case any pods on the same nodes can’t reach each-other, packets are just dropped for some reason.

### Cilium Version

Client: 1.15.5 8c7e442c 2024-05-10T16:33:07+02:00 go version go1.21.10 linux/amd64
Daemon: 1.15.5 8c7e442c 2024-05-10T16:33:07+02:00 go version go1.21.10 linux/amd64

### Kernel Version

Linux srv1 6.6.29-talos #1 SMP Tue Apr 30 14:51:50 UTC 2024 x86_64 x86_64 x86_64 GNU/Linux

### Kubernetes Version

v1.30.0

### Sysdump

[cilium-sysdump-20240524-220902.zip](https://github.com/cilium/cilium/files/15439495/cilium-sysdump-20240524-220902.zip)

[1.pcap.gz](https://github.com/cilium/cilium/files/15444633/1.pcap.gz)

### Cilium Users Document

- [ ] Are you a user of Cilium? Please add yourself to the [Users doc](https://github.com/cilium/cilium/blob/main/USERS.md)

### Code of Conduct

- [X] I agree to follow this project's Code of Conduct

**Comment by kvaps** [comment]
This patch makes everything working in my setup:

```diff
diff --git a/bpf/bpf_lxc.c b/bpf/bpf_lxc.c
index 5034120554..798eb2c0b0 100644
--- a/bpf/bpf_lxc.c
+++ b/bpf/bpf_lxc.c
@@ -1092,7 +1092,7 @@ ct_recreate4:
         * that endpoint.
         */
        if (is_defined(ENABLE_ROUTING) || hairpin_flow ||
-           is_defined(ENABLE_HOST_ROUTING)) {
+           !is_defined(ENABLE_HOST_ROUTING)) {
                /* Hairpin requests need to pass through the backend's to-container
                 * path, to create a CT_INGRESS entry with .lb_loopback set. This
                 * drives RevNAT in the backend's from-container path.
@@ -1114,7 +1114,7 @@ ct_recreate4:
                 */
                ep = lookup_ip4_endpoint(ip4);
                if (ep) {
-#if defined(ENABLE_HOST_ROUTING) || defined(ENABLE_ROUTING)
+#if !defined(ENABLE_HOST_ROUTING) || defined(ENABLE_ROUTING)
                        if (ep->flags & ENDPOINT_F_HOST) {
                                if (is_defined(ENABLE_ROUTING)) {
 # ifdef HOST_IFINDEX
@@ -1250,7 +1250,7 @@ skip_vtep:
                        return ret;
        }
 #endif /* TUNNEL_MODE || ENABLE_HIGH_SCALE_IPCACHE */
-       if (is_defined(ENABLE_HOST_ROUTING)) {
+       if (!is_defined(ENABLE_HOST_ROUTING)) {
                int oif = 0;

                ret = fib_redirect_v4(ctx, ETH_HLEN, ip4, false, false, ext_err, &oif);
@@ -1263,7 +1263,7 @@ skip_vtep:

        goto pass_to_stack;

-#if defined(ENABLE_HOST_ROUTING) || defined(ENABLE_ROUTING)
+#if !defined(ENABLE_HOST_ROUTING) || defined(ENABLE_ROUTING)
 to_host:
 #endif
 #ifdef ENABLE_ROUTING
```

**Comment by kvaps** [comment]
@borkmann maybe you could help to investigate this?

**Comment by kvaps** [comment]
Oh, after three days of debugging I found that `ovn0` device has missing bpf program:


now I added it to cilium-config:
```
devices: "en+ ovn0"
```

and everything statred working 🎉 

```
# tc filter show dev ovn0 egress
filter protocol all pref 1 bpf chain 0
filter protocol all pref 1 bpf chain 0 handle 0x1 cil_to_netdev-ovn0 direct-action not_in_hw id 114214 tag 63638179020264a5 jited
```

Is there any way to say "use autodetected device plus another one" in cilium?

Also there is a potencial race condition, because kube-ovn requires cilium to working and starts , and cilium requires `ovn0` interface to add bpf program on it.

**Comment by kvaps** [comment]
Closed in favor https://github.com/cilium/cilium/issues/32721

**Comment by kldancer** [comment]
> ### 这是否存在问题？
> * [x] 我已经搜索了现有问题
> 
> ### 发生了什么？
> 嘿，我在通用 veth 链模式下使用 cilium 和 kube-ovn。在严格模式下启用了 kube-proxy 替换。
> 
> `externalTrafficPolicy: Cluster`一切按预期运行。然而，转发到外部节点 Pod 的服务的外部流量总是被重置：
> 
> ```
> 11:52:30.232445 IP 192.168.100.13.57196 > 10.244.0.129.80: Flags [S], seq 1862326452, win 65535, options [mss 1460,nop,wscale 6,nop,nop,TS val 1540021380 ecr 0,sackOK,eol], length 0
> 11:52:30.232539 IP 10.244.0.129.80 > 192.168.100.13.57196: Flags [S.], seq 499673168, ack 1862326453, win 32352, options [mss 1360,sackOK,TS val 2139715536 ecr 1540021380,nop,wscale 7], length 0
> 11:52:30.232877 IP 192.168.100.13.57196 > 10.244.0.129.80: Flags [R], seq 1862326453, win 0, length 0
> ```
> 
> 如果我禁用`hostLegacyRouting`该选项，我会看到外部服务流量可以到达本地和远程节点上的 pod，但是在这种情况下，同一节点上的任何 pod 都无法相互访问，数据包由于某种原因被丢弃。
> 
> ### Cilium版本
> 客户端：1.15.5 [8c7e442](https://github.com/cilium/cilium/commit/8c7e442ccd48b9011a10f34a128ec98751d9a80e) 2024-05-10T16：33：07+02：00 go版本go1.21.10 linux/amd64 守护进程：1.15.5 [8c7e442](https://github.com/cilium/cilium/commit/8c7e442ccd48b9011a10f34a128ec98751d9a80e) 2024-05-10T16：33：07+02：00 go版本go1.21.10 linux/amd64
> 
> ### 内核版本
> Linux srv1 6.6.29-talos [#1](https://github.com/cilium/cilium/pull/1) SMP 周二 4月 30日 14:51:50 UTC 2024 x86_64 x86_64 x86_64 GNU/Linux
> 
> ### Kubernetes 版本
> v1.30.0
> 
> ### 回归
> _没有回应_
> 
> ### 系统转储
> [cilium-sysdump-20240524-220902.zip](https://github.com/cilium/cilium/files/15439495/cilium-sysdump-20240524-220902.zip)
> 
> [1.pcap.gz](https://github.com/cilium/cilium/files/15444633/1.pcap.gz)
> 
> ### 相关日志输出
> _没有回应_
> 
> ### 还要别的吗？
> _没有回应_
> 
> ### Cilium 用户文档
> * [ ] 您是 Cilium 用户吗？请将您自己添加到[用户文档中。](https://github.com/cilium/cilium/blob/main/USERS.md)
> 
> ### 行为守则
> * [x] 我同意遵守该项目的行为准则

Hello, have you encountered hostport exceptions when using cilium in generic-veth mode and enabling kube-proxy-replacement + kube-ovn? Like this issue：
https://github.com/kubeovn/kube-ovn/issues/4204
