### ISSUE TITLE
cilium 1.16.0 版本偶现连接 redis 超时问题

### ISSUE THREAD

**Issue by rebelsre** [cilium/cilium#34855]
### Is there an existing issue for this?

- [X] I have searched the existing issues

### Version

equal or higher than v1.16.0 and lower than v1.17.0

### What happened?

现有问题：在 1.16.0 版本的 cilium 组件的 K8s 1.30.1 集群中，pod 或者 K8s 节点去连接 redis 会随机超时，比如100个连接，其中一个连接卡住，随机出现，但一般几分钟内就会出现
期望：不出现这种随机卡住连接的情况

### How can we reproduce the issue?

1. cilium 安装配置
cilium install 
    --version v1.16.0 \
    --namespace kube-system \
    --set operator.replicas=1 \
    --set ipam.operator.clusterPoolIPv4PodCIDRList[0]="10.194.0.0/16" \
    --set hubble.relay.enabled=true \
    --set hubble.ui.enabled=true \
    --set kubeProxyReplacement=true \
    --set k8sServiceHost=xxx \
    --set k8sServicePort=6443 \
    --set localRedirectPolicy=true \
    --set bandwidthManager.enabled=true \
    --set bpf.masquerade=true

2. 在 k8s 集群内部或者宿主机，循环使用 redis-cil 连接 redis 节点，执行 get key 或者 info 之类命令，一段时间会出现连接超时卡住的现象，随机但必现
while true ; do date ; redis-cli -h 127.0.0.1 -p 6379 info memory ; sleep 1s ; done

### Cilium Version

1.16.0

### Kernel Version

5.4.204-1.el7.elrepo.x86_64

### Kubernetes Version

1.30.1

### Relevant log output

```shell
测试脚本：
#!/bin/bash

# Redis 服务器的地址和端口
REDIS_HOST="xxx"
REDIS_PORT="xxx"
TIMEOUT=3
AUTH="xxx"  
KEY="xxx"  # 要查询的 Redis key

# 日志文件
LOG_FILE="./redis_timeout.log"

while true
do
    # 获取当前时间（开始时间）
    START_TIME=$(date +%s%3N)

    # 执行 Redis GET 操作并计算耗时
    RESULT=$(timeout $TIMEOUT redis-cli -h $REDIS_HOST -p $REDIS_PORT -a $AUTH  GET $KEY)
    if [ $? -ne 0 ]; then
        echo "$(date '+%Y-%m-%d %H:%M:%S') - Redis connection error" >> $LOG_FILE
        #sleep 0.1
        #continue
    fi

    # 获取当前时间（结束时间）
    END_TIME=$(date +%s%3N)

    # 计算操作耗时
    DURATION=$((END_TIME - START_TIME))

    # 检查是否超过 3 秒（3000 毫秒）
    if [ $DURATION -ge 3000 ]; then
        LOG="$(date '+%Y-%m-%d %H:%M:%S') - Redis GET operation timeout, duration: ${DURATION}ms"
        echo $LOG
        echo $LOG >> $LOG_FILE
        break;
    else
        echo "Redis GET result: $RESULT (took ${DURATION}ms)"
    fi

    # 每秒执行一次
    sleep 0.1
done

脚本日志：
Redis GET result:  (took 5ms)
Redis GET result:  (took 6ms)
Redis GET result:  (took 5ms)
Redis GET result:  (took 6ms)
2024-09-13 18:07:38 - Redis GET operation timeout, duration: 3003ms
```

### Cilium Users Document

- [ ] Are you a user of Cilium? Please add yourself to the [Users doc](https://github.com/cilium/cilium/blob/main/USERS.md)

### Code of Conduct

- [X] I agree to follow this project's Code of Conduct

**Comment by StLeoX** [comment]
是否可能是 redis 自身的问题？
可以在该环境下进入 redis 容器，执行该脚本查看效果。

**Comment by rebelsre** [comment]
> 是否可能是 redis 自身的问题？ 可以在该环境下进入 redis 容器，执行该脚本查看效果。

验证过了，就只有这个 K8s 集群会，且所在宿主机也会，意思就是只要加入这个集群的机器以及集群内部都有这个情况，其他的都正常，cilium 会对新加入的节点做哪些变更

**Comment by rebelsre** [comment]
抓包显示是节点重置了连接，表现就是连接卡死在那边
```shell
14:13:23.016486 IP host1.33666 > redis: Flags [S], seq 3403162508, win 64240, options [mss 1460,sackOK,TS val 2321989988 ecr 0,nop,wscale 7], length 0
14:13:23.016766 IP redis > host1.33666: Flags [S.], seq 205308573, ack 3403162509, win 65160, options [mss 1460,sackOK,TS val 2993527787 ecr 2321989988,nop,wscale 7], length 0
14:13:23.017437 IP host1.33666 > redis: Flags [R], seq 3403162509, win 0, length 0
14:13:24.076054 IP host1.33666 > redis: Flags [S], seq 3403162508, win 64240, options [mss 1460,sackOK,TS val 2321991048 ecr 0,nop,wscale 7], length 0
14:13:24.076382 IP redis > host1.33666: Flags [S.], seq 221864910, ack 3403162509, win 65160, options [mss 1460,sackOK,TS val 2993528847 ecr 2321991048,nop,wscale 7], length 0
14:13:24.076964 IP host1.33666 > redis: Flags [R], seq 3403162509, win 0, length 0
```

**Comment by StLeoX** [comment]
![image](https://github.com/user-attachments/assets/8e79ebf1-6600-47a9-b92b-7eb3aaedbc34)
确实没能复现 :(

不过根据你的描述，应该是对 redis 进行了熔断，所以可能是启用了某些 NetworkPolicy 配置。

**Comment by rebelsre** [comment]
> ![image](https://private-user-images.githubusercontent.com/59193798/368414326-8e79ebf1-6600-47a9-b92b-7eb3aaedbc34.png?jwt=eyJhbGciOiJIUzI1NiIsInR5cCI6IkpXVCJ9.eyJpc3MiOiJnaXRodWIuY29tIiwiYXVkIjoicmF3LmdpdGh1YnVzZXJjb250ZW50LmNvbSIsImtleSI6ImtleTUiLCJleHAiOjE3MjY2MzgyNTgsIm5iZiI6MTcyNjYzNzk1OCwicGF0aCI6Ii81OTE5Mzc5OC8zNjg0MTQzMjYtOGU3OWViZjEtNjYwMC00N2E5LWI5MmItN2ViM2FhZWRiYzM0LnBuZz9YLUFtei1BbGdvcml0aG09QVdTNC1ITUFDLVNIQTI1NiZYLUFtei1DcmVkZW50aWFsPUFLSUFWQ09EWUxTQTUzUFFLNFpBJTJGMjAyNDA5MTglMkZ1cy1lYXN0LTElMkZzMyUyRmF3czRfcmVxdWVzdCZYLUFtei1EYXRlPTIwMjQwOTE4VDA1MzkxOFomWC1BbXotRXhwaXJlcz0zMDAmWC1BbXotU2lnbmF0dXJlPTlkYjMxMTE2OGVlYWUyNWJkMDE0NjUzYTExYTRlMjM0OGZmMTY2YzJkMDJhOGM4NjE0ZTVjMjhhYjRiZmQyMDUmWC1BbXotU2lnbmVkSGVhZGVycz1ob3N0JmFjdG9yX2lkPTAma2V5X2lkPTAmcmVwb19pZD0wIn0.15fuWMRmnd1-XO5dVBDOJ6gSykJJWY595nWhkp6hDdQ) 确实没能复现 :(
> 
> 不过根据你的描述，应该是对 redis 进行了熔断，所以可能是启用了某些 NetworkPolicy 配置。

和 redis 没关系，目前发现有问题的这个 K8s 集群，宿主机会有这种问题是因为我们集群使用 nodeport 且调整了范围，和系统级别的 net.ipv4.ip_local_port_range 有一定的范围冲突，导致随时使用端口时出现问题，但我调整 net.ipv4.ip_local_port_range 范围后，宿主机已经不再出现这个问题，但 K8s 集群内部问题依旧存在，不知道你对这块还有什么想法不，是否 K8s 集群内部也有这样一个配置存在？
再次申明一下和 redis 没有任何关系，换成 MySQL 或者其他服务都一样的，只和这个 K8s 集群有关，可能是一些设置上的问题

**Comment by rebelsre** [comment]
kubectl get NetworkPolicy --all-namespaces 检查过集群配置，没有任何输出，集群内部没有配置过 NetworkPolicy 相关

**Comment by rebelsre** [comment]
已经确认是修改了 NodePort 端口范围导致的问题，K8s 集群内部也用了默认的 net.ipv4.ip_local_port_range，修改 net.ipv4.ip_local_port_range 后就没再出现过问题，和 cilium 没有关系。
不过是不是针对这种场景 cilium 能有一些更好的处理方式？帖子先关闭，打扰各位。

**Comment by StandNorthStar** [comment]
我们也遇到了相同的问题，不过我们在k8s 1.26、cilium 1.16版本，抓包也发现随机端口和nodeport分配端口冲突了。但是后来我们更新worker节点上的分配端口范围和随机分配端口范围，还是会不间断出现连接外部服务超时情况，抓包查看仍然是和nodePort冲突。不晓得各位有遇到否？
