### ISSUE TITLE
Cilium conntrack unexpectedly maps packets against Pod IP to LB traffic targeting the same Pod.

### ISSUE THREAD

**Issue by MrHohn** [cilium/cilium#37566]
### Is there an existing issue for this?

- [x] I have searched the existing issues

### Version

equal or higher than v1.16.6 and lower than v1.17.0

### What happened?

We are observing timeout errors when multiple clients on the same VM host (outside of the Kubernetes cluster) send traffic to the same backend pod via direct pod IP and service load balancer IP simultaneously.

The timeout errors were only observed on requests against the pod IP.

### How can we reproduce the issue?

**_NOTE:_** The setup here is scoped to a single backend pod and port to simplify the problem. In reality with multiple backends and random ports, this become timeout flakes that are fairly hard to debug and root cause.

I have a backend pod IP `10.40.0.67`, LB IP `10.128.0.54` (passthrough L4 LB with only one backend pod) and the client VM IP `10.128.0.88`.

---

Step 1: Send a TCP request to LB IP from the VM with a fixed port. `curl -H "Connection: close" --local-port 40002 10.128.0.54` was the command I used -- it closes the connection so I can reuse the same port immediately.

The request went through and cilium conntrack table has these entries (noting the `RevNAT=18` bit in the `OUT` path):
```
# cilium bpf ct list global | grep 40002
TCP OUT 10.128.0.88:40002 -> 10.40.0.67:80 expires=18747953 Packets=0 Bytes=0 RxFlagsSeen=0x1b LastRxReport=18747914 TxFlagsSeen=0x1b LastTxReport=18747914 Flags=0x0033 [ RxClosing TxClosing SeenNonSyn NodePort ] RevNAT=18 SourceSecurityID=2 IfIndex=0 BackendID=0 
TCP SVC 10.128.0.88:40002 -> 10.128.0.54:80 expires=18747953 Packets=0 Bytes=0 RxFlagsSeen=0x00 LastRxReport=0 TxFlagsSeen=0x1b LastTxReport=18747914 Flags=0x0013 [ RxClosing TxClosing SeenNonSyn ] RevNAT=18 SourceSecurityID=0 IfIndex=0 BackendID=8 
TCP IN 10.128.0.88:40002 -> 10.40.0.67:80 expires=18747953 Packets=0 Bytes=0 RxFlagsSeen=0x1b LastRxReport=18747914 TxFlagsSeen=0x1b LastTxReport=18747914 Flags=0x0013 [ RxClosing TxClosing SeenNonSyn ] RevNAT=0 SourceSecurityID=2 IfIndex=0 BackendID=0
```

---

Step 2: Immediately after step 1 (before the LB connection entry expires), send a TCP request to pod IP from the same VM and port. `curl -H "Connection: close" --local-port 40002 10.40.0.67`.

The request stuck and no new entries are created in cilium conntrack table. Tcpdump shows the return packet from pod got unexpectedly reverse NATed to the LB IP.
```
# tcpdump -i any -np host 10.128.0.88
...
18:19:50.079547 eth0  In  IP 10.128.0.88.40000 > 10.40.0.67.80: Flags [S], seq 2885958255, win 65320, options [mss 1420,sackOK,TS val 2847211478 ecr 0,nop,wscale 7], length 0
18:19:50.079683 gkefff52179453 Out IP 10.128.0.88.40000 > 10.40.0.67.80: Flags [S], seq 2885958255, win 65320, options [mss 1420,sackOK,TS val 2847211478 ecr 0,nop,wscale 7], length 0
18:19:50.079719 gkefff52179453 In  IP 10.40.0.67.80 > 10.128.0.88.40000: Flags [.], ack 96, win 341, options [nop,nop,TS val 2204884658 ecr 635452858], length 0
18:19:50.079755 eth0  Out IP 10.128.0.54.80 > 10.128.0.88.40000: Flags [.], ack 96, win 341, options [nop,nop,TS val 2204884658 ecr 635452858], length 0    <========= Unexpected reverse NAT happened
18:19:50.081095 eth0  In  IP 10.128.0.88.40000 > 10.128.0.54.80: Flags [R], seq 4065098348, win 0, length 0
18:19:50.081191 gkefff52179453 Out IP 10.128.0.88.40000 > 10.40.0.67.80: Flags [R], seq 4065098348, win 0, length 0
```

---

Step 3: Try a working request against pod IP and see how the conntrack entry looks like - for comparison. `curl -H "Connection: close" --local-port 40003 10.40.0.67`

A new entry is created in cilium conntrack table (with `RevNAT=0`):
```
# cilium bpf ct list global | grep 40003                                                                        
TCP IN 10.128.0.88:40003 -> 10.40.0.67:80 expires=18760237 Packets=0 Bytes=0 RxFlagsSeen=0x1b LastRxReport=18760198 TxFlagsSeen=0x1b LastTxReport=18760198 Flags=0x0013 [ RxClosing TxClosing SeenNonSyn ] RevNAT=0 SourceSecurityID=2 IfIndex=0 BackendID=0 
```

---

Step 4: See how it looks like in kube-proxy. Performed the same test on a kube-proxy cluster and confirmed it doesn't suffer from the same issue. Below are the linux conntrack entries created for both connections (agains Pod IP `10.176.7.7` and LB IP `10.0.0.13`, client VM IP is `10.0.0.12`):
```
# conntrack -L | grep 10.0.0.13
tcp      6 101 TIME_WAIT src=10.0.0.13 dst=10.176.7.7 sport=40000 dport=80 src=10.176.7.7 dst=10.0.0.13 sport=80 dport=40000 [ASSURED] mark=0 use=1
tcp      6 103 TIME_WAIT src=10.0.0.13 dst=10.0.0.12 sport=40000 dport=80 src=10.176.7.7 dst=10.0.0.13 sport=80 dport=8444 [ASSURED] mark=0 use=1
```
Notably linux conntrack was able to distinguish packets belonging to two different traffic paths.

### Cilium Version

1.16.5

### Kernel Version

6.6.56+

### Kubernetes Version

v1.32.1

### Relevant log output

```shell

```

### Cilium Users Document

- [x] Are you a user of Cilium? Please add yourself to the [Users doc](https://github.com/cilium/cilium/blob/main/USERS.md)

### Code of Conduct

- [x] I agree to follow this project's Code of Conduct

**Comment by sypakine** [comment]
@MrHohn, can we reproduce this using OSS Cilium @ HEAD with a turn-key reproduction?  What do you need to execute on that?
