### ISSUE TITLE
Hostport interferes return packet of masqueraded traffic to the pod on the same port

### ISSUE THREAD

**Issue by MrHohn** [cilium/cilium#34041]
### Is there an existing issue for this?

- [X] I have searched the existing issues

### Version

higher than v1.14.13 and lower than v1.15.0

### What happened?

I'm observing the return packet of masqueraded pod traffic getting redirected mistakenly to another pod with hostport set up.

### How can we reproduce the issue?

Create a cluster with Cilium dataplane deployed and eBPF masquerade enabled (was deploying in GKE for my repro).

In the experiment, I created two pods. Pod-1 (`10.64.0.7`) with hostport set to 60000 and pod-2 (`10.64.0.5`) without.

Next, try sending packet from pod-2 with port 60000, the packet got masqueraded to node IP (`10.128.0.37:60000` - source port won't change in this case). Afterward, the returned packet got mistakenly captured by hostport and was redirected to pod-1 instead. Snippet of tcpdump on this:
```
00:43:16.677951 gke83dbd022cd5 In  IP 10.64.0.5.60000 > 34.160.111.145.80: Flags [S], seq 506403072, win 21300, options [mss 1420,sackOK,TS val 3698613153 ecr 0,nop,wscale 7], length 0
00:43:16.678012 eth0  Out IP 10.128.0.37.60000 > 34.160.111.145.80: Flags [S], seq 506403072, win 21300, options [mss 1420,sackOK,TS val 3698613153 ecr 0,nop,wscale 7], length 0
00:43:16.680703 eth0  In  IP 34.160.111.145.80 > 10.128.0.37.60000: Flags [S.], seq 728662785, ack 506403073, win 65535, options [mss 1412,sackOK,TS val 1611171439 ecr 3698613153,nop,wscale 8], length 0
00:43:16.680784 gkeb14b9f2029e Out IP 34.160.111.145.80 > 10.64.0.7.60000: Flags [S.], seq 728662785, ack 506403073, win 65535, options [mss 1412,sackOK,TS val 1611171439 ecr 3698613153,nop,wscale 8], length 0
00:43:16.680797 gkeb14b9f2029e In  IP 10.64.0.7.60000 > 34.160.111.145.80: Flags [R], seq 506403073, win 0, length 0
00:43:16.680826 eth0  Out IP 10.128.0.37.60000 > 34.160.111.145.80: Flags [R], seq 506403073, win 0, length 0
00:43:17.681385 gke83dbd022cd5 In  IP 10.64.0.5.60000 > 34.160.111.145.80: Flags [S], seq 506403072, win 21300, options [mss 1420,sackOK,TS val 3698614157 ecr 0,nop,wscale 7], length 0
00:43:17.681463 eth0  Out IP 10.128.0.37.60000 > 34.160.111.145.80: Flags [S], seq 506403072, win 21300, options [mss 1420,sackOK,TS val 3698614157 ecr 0,nop,wscale 7], length 0
00:43:17.682562 eth0  In  IP 34.160.111.145.80 > 10.128.0.37.60000: Flags [S.], seq 744318768, ack 506403073, win 65535, options [mss 1412,sackOK,TS val 1611172441 ecr 3698614157,nop,wscale 8], length 0
00:43:17.682616 gkeb14b9f2029e Out IP 34.160.111.145.80 > 10.64.0.7.60000: Flags [S.], seq 744318768, ack 506403073, win 65535, options [mss 1412,sackOK,TS val 1611172441 ecr 3698614157,nop,wscale 8], length 0
00:43:17.682639 gkeb14b9f2029e In  IP 10.64.0.7.60000 > 34.160.111.145.80: Flags [R], seq 506403073, win 0, length 0
00:43:17.682669 eth0  Out IP 10.128.0.37.60000 > 34.160.111.145.80: Flags [R], seq 506403073, win 0, length 0
00:43:19.729428 gke83dbd022cd5 In  IP 10.64.0.5.60000 > 34.160.111.145.80: Flags [S], seq 506403072, win 21300, options [mss 1420,sackOK,TS val 3698616205 ecr 0,nop,wscale 7], length 0
00:43:19.729481 eth0  Out IP 10.128.0.37.60000 > 34.160.111.145.80: Flags [S], seq 506403072, win 21300, options [mss 1420,sackOK,TS val 3698616205 ecr 0,nop,wscale 7], length 0
00:43:19.730560 eth0  In  IP 34.160.111.145.80 > 10.128.0.37.60000: Flags [S.], seq 776319130, ack 506403073, win 65535, options [mss 1412,sackOK,TS val 1611174489 ecr 3698616205,nop,wscale 8], length 0
00:43:19.730600 gkeb14b9f2029e Out IP 34.160.111.145.80 > 10.64.0.7.60000: Flags [S.], seq 776319130, ack 506403073, win 65535, options [mss 1412,sackOK,TS val 1611174489 ecr 3698616205,nop,wscale 8], length 0
00:43:19.730617 gkeb14b9f2029e In  IP 10.64.0.7.60000 > 34.160.111.145.80: Flags [R], seq 506403073, win 0, length 0
00:43:19.730646 eth0  Out IP 10.128.0.37.60000 > 34.160.111.145.80: Flags [R], seq 506403073, win 0, length 0
```

### Cilium Version

1.14.7

### Kernel Version

6.1.90+

### Kubernetes Version

v1.30.1

### Cilium Users Document

- [X] Are you a user of Cilium? Please add yourself to the [Users doc](https://github.com/cilium/cilium/blob/main/USERS.md)

### Code of Conduct

- [X] I agree to follow this project's Code of Conduct

**Comment by julianwiedmann** [comment]
Yep, fair to say that using an ephemeral port as `hostPort` will potentially cause this kind of problem.

**Comment by MrHohn** [comment]
Keeping this open - still hoping to see a resolution of this.

We are exploring the possibility to expand the nodeport NAT range (it is 32768-65535 currently) to allow for a greater number of connections per node. Under that context, it may not be very practical to avoid the entire nodeport NAT range.

**Comment by MrHohn** [comment]
Not sure what is the state of hostport support in Cilium. In the Kubernetes best practice doc hostport is very much not recommended any more: https://kubernetes.io/docs/concepts/configuration/overview/#services

May be we just need to note this down as a known issue some where and close.
