### ISSUE TITLE
Envoy immediately disconnects on external request

### ISSUE THREAD

**Issue by tgraf** [cilium/cilium#3453]
How to reproduce:

Load simple egress HTTP policy:
```
[{
    "labels": [{"key": "name", "value": "egress-to-host"}],
    "endpointSelector": {"matchLabels": {"id.foo":""}},
    "egress": [{
      "toEntities": ["world"],
      "toPorts": [{
	"ports": [
	  {"port": "80", "protocol": "TCP"}
	],
	"rules": {
	  "HTTP": [
	    {
	      "method": "GET",
	      "path": "/"
	    }
	  ]
	}
      }]
    },{
      "toEntities": ["host"],
      "toPorts": [
          {"ports":[ {"port": "53", "protocol": "UDP"}]}
      ]
    }]
}]
```

Perform an egress HTTP request:
```
docker exec -ti f884990d3f9e curl -4 google.com/
```

tcpdump:
```
02:25:55.277759 IP (tos 0x0, ttl 63, id 61662, offset 0, flags [DF], proto TCP (6), length 60)
    10.0.2.15.54946 > dfw28s01-in-f14.1e100.net.http: Flags [S], cksum 0xbc04 (incorrect -> 0x15e0), seq 713063188, win 28200, options [mss 1410,sackOK,TS val 166858 ecr 0,nop,wscale 7], length 0
02:25:55.326188 IP (tos 0x0, ttl 64, id 3694, offset 0, flags [none], proto TCP (6), length 44)
    dfw28s01-in-f14.1e100.net.http > 10.0.2.15.54946: Flags [S.], cksum 0x7a88 (correct), seq 120512001, ack 713063189, win 65535, options [mss 1460], length 0
02:25:55.326256 IP (tos 0x0, ttl 64, id 65282, offset 0, flags [DF], proto TCP (6), length 40)
    10.0.2.15.54946 > dfw28s01-in-f14.1e100.net.http: Flags [R], cksum 0x7782 (correct), seq 713063189, win 0, length 0
```

Logs:
```
Apr 02 02:32:32 runtime1 cilium-agent[5703]: level=debug msg="level=debug msg=\"external/envoy/source/server/server.cc:130] flushing stats\" subsys=envoy-main thread=6531"
Apr 02 02:32:32 runtime1 cilium-agent[5703]: level=debug msg="Queueing container event" containerID=f884990d3f event="exec_create: curl -4 google.com/" subsys=containerd-watcher
Apr 02 02:32:32 runtime1 cilium-agent[5703]: level=debug msg="Processing event for Container" containerID=f884990d3f event="exec_create: curl -4 google.com/" subsys=containerd-watcher
Apr 02 02:32:32 runtime1 cilium-agent[5703]: level=debug msg="Queueing container event" containerID=f884990d3f event="exec_start: curl -4 google.com/" subsys=containerd-watcher
Apr 02 02:32:32 runtime1 cilium-agent[5703]: level=debug msg="Processing event for Container" containerID=f884990d3f event="exec_start: curl -4 google.com/" subsys=containerd-watcher
Apr 02 02:32:32 runtime1 cilium-agent[5703]: level=debug msg="10.11.129.91: Access log message: timestamp:1522636352895353286 http_protocol:HTTP11 policy_name:\"10.11.129.91\" source_security_id:60318 source_address:\"10.11.129.91:43508\" destination_address:\"172.217.2.238:80\" scheme:\"http\" host:\"google.com\" path:\"/\" method:\"GET\" headers:<key:\"user-agent\" value:\"curl/7.52.1\" > headers:<key:\"accept\" value:\"*/*\" > headers:<key:\"x-request-id\" value:\"faf4c131-73e6-4a12-a5ff-62fc56e34f07\" > "
Apr 02 02:32:32 runtime1 cilium-agent[5703]: level=debug msg="Logging flow record" code=0 header="map[User-Agent:[curl/7.52.1] Accept:[*/*] X-Request-Id:[faf4c131-73e6-4a12-a5ff-62fc56e34f07]]" message= method=GET protocol=HTTP/1.1 type=Request url="http://google.com/" verdict=Forwarded
Apr 02 02:32:32 runtime1 cilium-agent[5703]: level=debug msg="level=debug msg=\"cilium_socket_option.h:51] Cilium SocketOption(): source_identity: 60318, destination_identity: 2, ingress: false, port: 80, proxy_port: 16648\" subsys=envoy-filter thread=6537"
Apr 02 02:32:32 runtime1 cilium-agent[5703]: level=debug msg="level=debug msg=\"external/envoy/source/server/connection_handler_impl.cc:189] [C30] new connection\" subsys=envoy-main thread=6537"
Apr 02 02:32:32 runtime1 cilium-agent[5703]: level=debug msg="level=warning msg=\"cilium_network_filter.cc:55] Cilium Network: onNewConnection\" subsys=envoy-filter thread=6537"
Apr 02 02:32:32 runtime1 cilium-agent[5703]: level=debug msg="level=debug msg=\"cilium_network_filter.cc:70] [C30] Cilium Network: Added connection callbacks to delete proxymap entry later\" subsys=envoy-filter thread=6537"
Apr 02 02:32:32 runtime1 cilium-agent[5703]: level=debug msg="level=debug msg=\"external/envoy/source/common/http/conn_manager_impl.cc:186] [C30] new stream\" subsys=envoy-http thread=6537"
Apr 02 02:32:32 runtime1 cilium-agent[5703]: level=debug msg="level=debug msg=\"external/envoy/source/common/http/conn_manager_impl.cc:794] [C30][S2475324161357402941] request end stream\" subsys=envoy-http thread=6537"
Apr 02 02:32:32 runtime1 cilium-agent[5703]: level=debug msg="level=debug msg=\"external/envoy/source/common/http/conn_manager_impl.cc:458] [C30][S2475324161357402941] request headers complete (end_stream=true):\" subsys=envoy-http thread=6537"
Apr 02 02:32:32 runtime1 cilium-agent[5703]: level=debug msg="level=debug msg=\"external/envoy/source/common/http/conn_manager_impl.cc:463] [C30][S2475324161357402941]   ':authority':'google.com'\" subsys=envoy-http thread=6537"
Apr 02 02:32:32 runtime1 cilium-agent[5703]: level=debug msg="level=debug msg=\"external/envoy/source/common/http/conn_manager_impl.cc:463] [C30][S2475324161357402941]   'user-agent':'curl/7.52.1'\" subsys=envoy-http thread=6537"
Apr 02 02:32:32 runtime1 cilium-agent[5703]: level=debug msg="level=debug msg=\"external/envoy/source/common/http/conn_manager_impl.cc:463] [C30][S2475324161357402941]   'accept':'*/*'\" subsys=envoy-http thread=6537"
Apr 02 02:32:32 runtime1 cilium-agent[5703]: level=debug msg="level=debug msg=\"external/envoy/source/common/http/conn_manager_impl.cc:463] [C30][S2475324161357402941]   ':path':'/'\" subsys=envoy-http thread=6537"
Apr 02 02:32:32 runtime1 cilium-agent[5703]: level=debug msg="level=debug msg=\"external/envoy/source/common/http/conn_manager_impl.cc:463] [C30][S2475324161357402941]   ':method':'GET'\" subsys=envoy-http thread=6537"
Apr 02 02:32:32 runtime1 cilium-agent[5703]: level=debug msg="level=debug msg=\"cilium_l7policy.cc:141] Cilium L7: Egress (60318->2) policy lookup for endpoint 10.11.129.91: ALLOW\" subsys=envoy-filter thread=6537"
Apr 02 02:32:32 runtime1 cilium-agent[5703]: level=debug msg="level=debug msg=\"external/envoy/source/common/router/router.cc:250] [C30][S2475324161357402941] cluster 'cluster1' match for URL '/'\" subsys=envoy-router thread=6537"
Apr 02 02:32:32 runtime1 cilium-agent[5703]: level=debug msg="level=debug msg=\"external/envoy/source/common/upstream/original_dst_cluster.cc:67] Created host 172.217.2.238:80.\" subsys=envoy-upstream thread=6537"
Apr 02 02:32:32 runtime1 cilium-agent[5703]: level=debug msg="level=debug msg=\"external/envoy/source/common/router/router.cc:298] [C30][S2475324161357402941]   ':authority':'google.com'\" subsys=envoy-router thread=6537"
Apr 02 02:32:32 runtime1 cilium-agent[5703]: level=debug msg="level=debug msg=\"external/envoy/source/common/router/router.cc:298] [C30][S2475324161357402941]   'user-agent':'curl/7.52.1'\" subsys=envoy-router thread=6537"
Apr 02 02:32:32 runtime1 cilium-agent[5703]: level=debug msg="level=debug msg=\"external/envoy/source/common/router/router.cc:298] [C30][S2475324161357402941]   'accept':'*/*'\" subsys=envoy-router thread=6537"
Apr 02 02:32:32 runtime1 cilium-agent[5703]: level=debug msg="level=debug msg=\"external/envoy/source/common/router/router.cc:298] [C30][S2475324161357402941]   ':path':'/'\" subsys=envoy-router thread=6537"
Apr 02 02:32:32 runtime1 cilium-agent[5703]: level=debug msg="level=debug msg=\"external/envoy/source/common/router/router.cc:298] [C30][S2475324161357402941]   ':method':'GET'\" subsys=envoy-router thread=6537"
Apr 02 02:32:32 runtime1 cilium-agent[5703]: level=debug msg="level=debug msg=\"external/envoy/source/common/router/router.cc:298] [C30][S2475324161357402941]   'x-forwarded-proto':'http'\" subsys=envoy-router thread=6537"
Apr 02 02:32:32 runtime1 cilium-agent[5703]: level=debug msg="level=debug msg=\"external/envoy/source/common/router/router.cc:298] [C30][S2475324161357402941]   'x-request-id':'faf4c131-73e6-4a12-a5ff-62fc56e34f07'\" subsys=envoy-router thread=6537"
Apr 02 02:32:32 runtime1 cilium-agent[5703]: level=debug msg="level=debug msg=\"external/envoy/source/common/router/router.cc:298] [C30][S2475324161357402941]   'x-envoy-expected-rq-timeout-ms':'15000'\" subsys=envoy-router thread=6537"
Apr 02 02:32:32 runtime1 cilium-agent[5703]: level=debug msg="level=debug msg=\"external/envoy/source/common/router/router.cc:298] [C30][S2475324161357402941]   ':scheme':'http'\" subsys=envoy-router thread=6537"
Apr 02 02:32:32 runtime1 cilium-agent[5703]: level=debug msg="level=debug msg=\"external/envoy/source/common/http/http1/conn_pool.cc:73] creating a new connection\" subsys=envoy-pool thread=6537"
Apr 02 02:32:32 runtime1 cilium-agent[5703]: level=debug msg="level=debug msg=\"external/envoy/source/common/http/codec_client.cc:25] [C31] connecting\" subsys=envoy-client thread=6537"
Apr 02 02:32:32 runtime1 cilium-agent[5703]: level=debug msg="level=debug msg=\"external/envoy/source/common/network/connection_impl.cc:570] [C31] connecting to 172.217.2.238:80\" subsys=envoy-connection thread=6537"
Apr 02 02:32:32 runtime1 cilium-agent[5703]: level=debug msg="level=debug msg=\"external/envoy/source/common/network/connection_impl.cc:579] [C31] connection in progress\" subsys=envoy-connection thread=6537"
Apr 02 02:32:32 runtime1 cilium-agent[5703]: level=debug msg="level=debug msg=\"external/envoy/source/common/upstream/cluster_manager_impl.cc:720] membership update for TLS cluster cluster1\" subsys=envoy-upstream thread=6538"
Apr 02 02:32:32 runtime1 cilium-agent[5703]: level=debug msg="level=debug msg=\"external/envoy/source/common/http/http1/conn_pool.cc:99] queueing request due to no available connections\" subsys=envoy-pool thread=6537"
Apr 02 02:32:32 runtime1 cilium-agent[5703]: level=debug msg="level=debug msg=\"external/envoy/source/common/upstream/original_dst_cluster.cc:35] Adding host 172.217.2.238:80.\" subsys=envoy-upstream thread=6538"
Apr 02 02:32:32 runtime1 cilium-agent[5703]: level=debug msg="level=debug msg=\"external/envoy/source/common/upstream/cluster_manager_impl.cc:720] membership update for TLS cluster cluster1\" subsys=envoy-upstream thread=6531"
Apr 02 02:32:32 runtime1 cilium-agent[5703]: level=debug msg="level=debug msg=\"external/envoy/source/common/upstream/original_dst_cluster.cc:35] Adding host 172.217.2.238:80.\" subsys=envoy-upstream thread=6531"
Apr 02 02:32:32 runtime1 cilium-agent[5703]: level=debug msg="level=debug msg=\"external/envoy/source/common/upstream/cluster_manager_impl.cc:720] membership update for TLS cluster cluster1\" subsys=envoy-upstream thread=6537"
Apr 02 02:32:33 runtime1 cilium-agent[5703]: level=debug msg="level=debug msg=\"external/envoy/source/common/upstream/original_dst_cluster.cc:125] Cleaning up stale original dst hosts.\" subsys=envoy-upstream thread=6531"
Apr 02 02:32:33 runtime1 cilium-agent[5703]: level=debug msg="level=debug msg=\"external/envoy/source/common/upstream/original_dst_cluster.cc:128] Keeping active host 172.217.2.238:80.\" subsys=envoy-upstream thread=6531"
Apr 02 02:32:33 runtime1 cilium-agent[5703]: level=debug msg="10.11.129.91: Access log message: timestamp:1522636352895353286 http_protocol:HTTP11 entry_type:Response policy_name:\"10.11.129.91\" source_security_id:60318 source_address:\"10.11.129.91:43508\" destination_address:\"172.217.2.238:80\" scheme:\"http\" host:\"google.com\" path:\"/\" method:\"GET\" status:503 headers:<key:\"user-agent\" value:\"curl/7.52.1\" > headers:<key:\"accept\" value:\"*/*\" > headers:<key:\"x-request-id\" value:\"faf4c131-73e6-4a12-a5ff-62fc56e34f07\" > "
Apr 02 02:32:33 runtime1 cilium-agent[5703]: level=debug msg="level=debug msg=\"external/envoy/source/common/http/http1/conn_pool.cc:321] [C31] connect timeout\" subsys=envoy-pool thread=6537"
Apr 02 02:32:33 runtime1 cilium-agent[5703]: level=debug msg="level=debug msg=\"external/envoy/source/common/network/connection_impl.cc:99] [C31] closing data_to_write=0 type=1\" subsys=envoy-connection thread=6537"
Apr 02 02:32:33 runtime1 cilium-agent[5703]: level=debug msg="level=debug msg=\"external/envoy/source/common/network/connection_impl.cc:134] [C31] closing socket: 1\" subsys=envoy-connection thread=6537"
Apr 02 02:32:33 runtime1 cilium-agent[5703]: level=debug msg="level=debug msg=\"external/envoy/source/common/http/codec_client.cc:81] [C31] disconnect. resetting 0 pending requests\" subsys=envoy-client thread=6537"
Apr 02 02:32:33 runtime1 cilium-agent[5703]: level=debug msg="level=debug msg=\"external/envoy/source/common/http/http1/conn_pool.cc:115] [C31] client disconnected\" subsys=envoy-pool thread=6537"
Apr 02 02:32:33 runtime1 cilium-agent[5703]: level=debug msg="level=debug msg=\"external/envoy/source/common/router/router.cc:464] [C30][S2475324161357402941] upstream reset\" subsys=envoy-router thread=6537"
Apr 02 02:32:33 runtime1 cilium-agent[5703]: level=debug msg="level=debug msg=\"external/envoy/source/common/http/conn_manager_impl.cc:968] [C30][S2475324161357402941] encoding headers via codec (end_stream=false):\" subsys=envoy-http thread=6537"
Apr 02 02:32:33 runtime1 cilium-agent[5703]: level=debug msg="level=debug msg=\"external/envoy/source/common/http/conn_manager_impl.cc:972] [C30][S2475324161357402941]   ':status':'503'\" subsys=envoy-http thread=6537"
Apr 02 02:32:33 runtime1 cilium-agent[5703]: level=debug msg="level=debug msg=\"external/envoy/source/common/http/conn_manager_impl.cc:972] [C30][S2475324161357402941]   'content-length':'57'\" subsys=envoy-http thread=6537"
Apr 02 02:32:33 runtime1 cilium-agent[5703]: level=debug msg="level=debug msg=\"external/envoy/source/common/http/conn_manager_impl.cc:972] [C30][S2475324161357402941]   'content-type':'text/plain'\" subsys=envoy-http thread=6537"
Apr 02 02:32:33 runtime1 cilium-agent[5703]: level=debug msg="level=debug msg=\"external/envoy/source/common/http/conn_manager_impl.cc:972] [C30][S2475324161357402941]   'date':'Mon, 02 Apr 2018 02:32:33 GMT'\" subsys=envoy-http thread=6537"
Apr 02 02:32:33 runtime1 cilium-agent[5703]: level=debug msg="level=debug msg=\"external/envoy/source/common/http/conn_manager_impl.cc:972] [C30][S2475324161357402941]   'server':'envoy'\" subsys=envoy-http thread=6537"
Apr 02 02:32:33 runtime1 cilium-agent[5703]: level=debug msg="level=debug msg=\"external/envoy/source/common/network/connection_impl.cc:448] [C30] remote close\" subsys=envoy-connection thread=6537"
Apr 02 02:32:33 runtime1 cilium-agent[5703]: level=debug msg="level=debug msg=\"external/envoy/source/common/network/connection_impl.cc:134] [C30] closing socket: 0\" subsys=envoy-connection thread=6537"
Apr 02 02:32:33 runtime1 cilium-agent[5703]: level=debug msg="Logging flow record" code=503 header="map[User-Agent:[curl/7.52.1] Accept:[*/*] X-Request-Id:[faf4c131-73e6-4a12-a5ff-62fc56e34f07]]" message= method=GET protocol=HTTP/1.1 type=Response url="http://google.com/" verdict=Forwarded
Apr 02 02:32:33 runtime1 cilium-agent[5703]: level=debug msg="level=warning msg=\"cilium_network_filter.cc:94] [C30] Cilium Network: Connection Closed, proxymap cleanup succeeded\" subsys=envoy-filter thread=6537"
Apr 02 02:32:33 runtime1 cilium-agent[5703]: level=debug msg="level=debug msg=\"external/envoy/source/server/connection_handler_impl.cc:48] [C30] adding to cleanup list\" subsys=envoy-main thread=6537"
Apr 02 02:32:33 runtime1 cilium-agent[5703]: level=debug msg="Queueing container event" containerID=f884990d3f event=exec_die subsys=containerd-watcher
Apr 02 02:32:33 runtime1 cilium-agent[5703]: level=debug msg="Processing event for Container" containerID=f884990d3f event=exec_die subsys=containerd-watcher
Apr 02 02:32:34 runtime1 cilium-agent[5703]: level=debug msg="level=debug msg=\"external/envoy/source/common/upstream/original_dst_cluster.cc:125] Cleaning up stale original dst hosts.\" subsys=envoy-upstream thread=6531"
Apr 02 02:32:34 runtime1 cilium-agent[5703]: level=debug msg="level=debug msg=\"external/envoy/source/common/upstream/original_dst_cluster.cc:132] Removing stale host 172.217.2.238:80.\" subsys=envoy-upstream thread=6531"
Apr 02 02:32:34 runtime1 cilium-agent[5703]: level=debug msg="level=debug msg=\"external/envoy/source/common/upstream/cluster_manager_impl.cc:720] membership update for TLS cluster cluster1\" subsys=envoy-upstream thread=6538"
Apr 02 02:32:34 runtime1 cilium-agent[5703]: level=debug msg="level=debug msg=\"external/envoy/source/common/upstream/original_dst_cluster.cc:30] Removing host 172.217.2.238:80.\" subsys=envoy-upstream thread=6538"
Apr 02 02:32:34 runtime1 cilium-agent[5703]: level=debug msg="level=debug msg=\"external/envoy/source/common/upstream/cluster_manager_impl.cc:720] membership update for TLS cluster cluster1\" subsys=envoy-upstream thread=6537"
Apr 02 02:32:34 runtime1 cilium-agent[5703]: level=debug msg="level=debug msg=\"external/envoy/source/common/upstream/cluster_manager_impl.cc:720] membership update for TLS cluster cluster1\" subsys=envoy-upstream thread=6531"
Apr 02 02:32:34 runtime1 cilium-agent[5703]: level=debug msg="level=debug msg=\"external/envoy/source/common/upstream/original_dst_cluster.cc:30] Removing host 172.217.2.238:80.\" subsys=envoy-upstream thread=6537"
Apr 02 02:32:34 runtime1 cilium-agent[5703]: level=debug msg="level=debug msg=\"external/envoy/source/common/upstream/original_dst_cluster.cc:30] Removing host 172.217.2.238:80.\" subsys=envoy-upstream thread=6531"
Apr 02 02:32:36 runtime1 cilium-agent[5703]: level=debug msg="level=debug msg=\"external/envoy/source/common/upstream/original_dst_cluster.cc:125] Cleaning up stale original dst hosts.\" subsys=envoy-upstream thread=6531"
Apr 02 02:32:37 runtime1 cilium-agent[5703]: level=debug msg="Filtering CT map entry" entryDstIP="2607:f8b0:4000:811::200e" entryDstPort=80 entryFlags=0 entryProto=6 entryProxyPort=16648 entrySrcIP="f00d::a0f:0:0:dc06" entrySrcSecID=60318 filterEndpointID=0 filterEndpointIP="<nil>" filterType=timeout
Apr 02 02:32:37 runtime1 cilium-agent[5703]: level=debug msg="Ignoring CT map entry: no endpoint ID or IP given in filter" entryDstIP="2607:f8b0:4000:811::200e" entryDstPort=80 entryFlags=0 entryProto=6 entryProxyPort=16648 entrySrcIP="f00d::a0f:0:0:dc06" entrySrcSecID=60318 filterEndpointID=0 filterEndpointIP="<nil>" filterType=timeout
Apr 02 02:32:37 runtime1 cilium-agent[5703]: level=debug msg="Filtering CT map entry" entryDstIP="2607:f8b0:4000:811::200e" entryDstPort=80 entryFlags=0 entryProto=6 entryProxyPort=16648 entrySrcIP="f00d::a0f:0:0:dc06" entrySrcSecID=60318 filterEndpointID=0 filterEndpointIP="<nil>" filterType=timeout
Apr 02 02:32:37 runtime1 cilium-agent[5703]: level=debug msg="Ignoring CT map entry: no endpoint ID or IP given in filter" entryDstIP="2607:f8b0:4000:811::200e" entryDstPort=80 entryFlags=0 entryProto=6 entryProxyPort=16648 entrySrcIP="f00d::a0f:0:0:dc06" entrySrcSecID=60318 filterEndpointID=0 filterEndpointIP="<nil>" filterType=timeout
Apr 02 02:32:37 runtime1 cilium-agent[5703]: level=debug msg="Filtering CT map entry" entryDstIP="2607:f8b0:4000:811::200e" entryDstPort=80 entryFlags=0 entryProto=6 entryProxyPort=16648 entrySrcIP="f00d::a0f:0:0:dc06" entrySrcSecID=60318 filterEndpointID=0 filterEndpointIP="<nil>" filterType=timeout
Apr 02 02:32:37 runtime1 cilium-agent[5703]: level=debug msg="Ignoring CT map entry: no endpoint ID or IP given in filter" entryDstIP="2607:f8b0:4000:811::200e" entryDstPort=80 entryFlags=0 entryProto=6 entryProxyPort=16648 entrySrcIP="f00d::a0f:0:0:dc06" entrySrcSecID=60318 filterEndpointID=0 filterEndpointIP="<nil>" filterType=timeout
Apr 02 02:32:37 runtime1 cilium-agent[5703]: level=debug msg="Filtering CT map entry" entryDstIP="2607:f8b0:4000:811::200e" entryDstPort=80 entryFlags=0 entryProto=6 entryProxyPort=16648 entrySrcIP="f00d::a0f:0:0:dc06" entrySrcSecID=60318 filterEndpointID=0 filterEndpointIP="<nil>" filterType=timeout
Apr 02 02:32:37 runtime1 cilium-agent[5703]: level=debug msg="Ignoring CT map entry: no endpoint ID or IP given in filter" entryDstIP="2607:f8b0:4000:811::200e" entryDstPort=80 entryFlags=0 entryProto=6 entryProxyPort=16648 entrySrcIP="f00d::a0f:0:0:dc06" entrySrcSecID=60318 filterEndpointID=0 filterEndpointIP="<nil>" filterType=timeout
Apr 02 02:32:37 runtime1 cilium-agent[5703]: level=debug msg="Filtering CT map entry" entryDstIP="2607:f8b0:4000:811::200e" entryDstPort=80 entryFlags=0 entryProto=6 entryProxyPort=16648 entrySrcIP="f00d::a0f:0:0:dc06" entrySrcSecID=60318 filterEndpointID=0 filterEndpointIP="<nil>" filterType=timeout
Apr 02 02:32:37 runtime1 cilium-agent[5703]: level=debug msg="Ignoring CT map entry: no endpoint ID or IP given in filter" entryDstIP="2607:f8b0:4000:811::200e" entryDstPort=80 entryFlags=0 entryProto=6 entryProxyPort=16648 entrySrcIP="f00d::a0f:0:0:dc06" entrySrcSecID=60318 filterEndpointID=0 filterEndpointIP="<nil>" filterType=timeout
Apr 02 02:32:37 runtime1 cilium-agent[5703]: level=debug msg="Filtering CT map entry" entryDstIP="2607:f8b0:4000:811::200e" entryDstPort=80 entryFlags=0 entryProto=6 entryProxyPort=16648 entrySrcIP="f00d::a0f:0:0:dc06" entrySrcSecID=60318 filterEndpointID=0 filterEndpointIP="<nil>" filterType=timeout
Apr 02 02:32:37 runtime1 cilium-agent[5703]: level=debug msg="Ignoring CT map entry: no endpoint ID or IP given in filter" entryDstIP="2607:f8b0:4000:811::200e" entryDstPort=80 entryFlags=0 entryProto=6 entryProxyPort=16648 entrySrcIP="f00d::a0f:0:0:dc06" entrySrcSecID=60318 filterEndpointID=0 filterEndpointIP="<nil>" filterType=timeout
Apr 02 02:32:37 runtime1 cilium-agent[5703]: level=debug msg="Filtering CT map entry" entryDstIP="2607:f8b0:4000:811::200e" entryDstPort=80 entryFlags=0 entryProto=6 entryProxyPort=16648 entrySrcIP="f00d::a0f:0:0:dc06" entrySrcSecID=60318 filterEndpointID=0 filterEndpointIP="<nil>" filterType=timeout
Apr 02 02:32:37 runtime1 cilium-agent[5703]: level=debug msg="Ignoring CT map entry: no endpoint ID or IP given in filter" entryDstIP="2607:f8b0:4000:811::200e" entryDstPort=80 entryFlags=0 entryProto=6 entryProxyPort=16648 entrySrcIP="f00d::a0f:0:0:dc06" entrySrcSecID=60318 filterEndpointID=0 filterEndpointIP="<nil>" filterType=timeout
Apr 02 02:32:37 runtime1 cilium-agent[5703]: level=debug msg="Filtering CT map entry" entryDstIP=8.8.8.8 entryDstPort=53 entryFlags=0 entryProto=17 entryProxyPort=0 entrySrcIP=10.11.129.91 entrySrcSecID=60318 filterEndpointID=0 filterEndpointIP="<nil>" filterType=timeout
```

**Comment by jrajahalme** [comment]
tcpdump on the `cilium_host` device never sees the response:
```
y$ sudo tcpdump -n -i cilium_host host google.com
tcpdump: verbose output suppressed, use -v or -vv for full protocol decode
listening on cilium_host, link-type EN10MB (Ethernet), capture size 262144 bytes
20:22:05.587308 IP 10.11.28.238.36668 > 172.217.2.238.80: Flags [S], seq 2736133373, win 28200, options [mss 1410,sackOK,TS val 273428103 ecr 0,nop,wscale 7], length 0
^C
1 packet captured
1 packet received by filter
0 packets dropped by kernel
```
This would mean that the host stack can't reverse NAT the packets coming for `10.0.2.15` to `10.11.28.238`?

Likewise, the cilium monitor only sees the outgoing SYN, nothing more of the upstream connection.
