### ISSUE TITLE
BPF masquerading does not masquerade traffic to remote node's ExternalIP

### ISSUE THREAD

**Issue by jochenseeber** [cilium/cilium#17177]
## Bug report

We have a Cilium cluster with native routing (no encapsulation). When starting a pod on any node, the node it runs on is reachable (e.g. ping). However, other nodes external IP is *not* reachable. So if pod1 runs on node1, `ping external_ip_of_node1` works, `ping external_ip_of_node2` does not.

Each node has an internal interface (dummy0) and an external interface (external). All nodes are connected internally using a WireGuard interface (wg0) at the OS level (not managed by Cilium) so that all cluster traffic is encrypted. All external interfaces are reachable from each node.

**General Information**

- Cilium version (run `cilium version`)

```
Defaulted container "cilium-agent" out of: cilium-agent, mount-cgroup (init), wait-for-node-init (init), clean-cilium-state (init)
Client: 1.10.3 4145278 2021-07-15T16:11:03+02:00 go version go1.16.6 linux/amd64
Daemon: 1.10.3 4145278 2021-07-15T16:11:03+02:00 go version go1.16.6 linux/amd64
```

- Kernel version (run `uname -a`)

```
Linux dev-0001 5.8.0-63-generic #71-Ubuntu SMP Tue Jul 13 15:59:12 UTC 2021 x86_64 x86_64 x86_64 GNU/Linux
```

- Orchestration system version in use (e.g. `kubectl version`, ...)

```
Client Version: version.Info{Major:"1", Minor:"21", GitVersion:"v1.21.3+k3s1", GitCommit:"1d1f220fbee9cdeb5416b76b707dde8c231121f2", GitTreeState:"clean", BuildDate:"2021-07-22T20:52:14Z", GoVersion:"go1.16.6", Compiler:"gc", Platform:"linux/amd64"}
Server Version: version.Info{Major:"1", Minor:"21", GitVersion:"v1.21.3+k3s1", GitCommit:"1d1f220fbee9cdeb5416b76b707dde8c231121f2", GitTreeState:"clean", BuildDate:"2021-07-22T20:52:14Z", GoVersion:"go1.16.6", Compiler:"gc", Platform:"linux/amd64"}
```

- Generate and upload a system zip:
```
curl -sLO https://git.io/cilium-sysdump-latest.zip && python cilium-sysdump-latest.zip
```

**How to reproduce the issue**

1. Start a network multitool pod on any node (https://github.com/Praqma/Network-MultiTool)
2. Exec into a shell of the pod
3. Ping external address: `ping 1.1.1.1` works
4. Ping own node's external address: works
5. Ping other node's external address: does *not* work

**pinging external system**

tcpdump
```
17:42:40.538395 IP 10.100.2.123 > 1.1.1.1: ICMP echo request, id 51, seq 1, length 64
17:42:40.538453 IP NODE1 > 1.1.1.1: ICMP echo request, id 61439, seq 1, length 64
17:42:40.543845 IP 1.1.1.1 > NODE1: ICMP echo reply, id 61439, seq 1, length 64
17:42:40.543892 IP 1.1.1.1 > 10.100.2.123: ICMP echo reply, id 51, seq 1, length 64
```

cilium monitor
```
Policy verdict log: flow 0x0 local EP ID 333, remote ID world, proto 1, egress, action allow, match all, 10.100.2.123 -> 1.1.1.1 EchoRequest
-> stack flow 0x0 identity 237465->world state new ifindex 0 orig-ip 0.0.0.0: 10.100.2.123 -> 1.1.1.1 EchoRequest
```

Some NAT seems to be happening here

**pinging own node**

tcpdump
```
17:38:29.191152 IP 10.100.2.123 > NODE1: ICMP echo request, id 47, seq 1, length 64
17:38:29.191219 IP NODE1 > 10.100.2.123: ICMP echo reply, id 47, seq 1, length 64
```

cilium monitor
```
-> stack flow 0x0 identity 237465->host state new ifindex 0 orig-ip 0.0.0.0: 10.100.2.123 -> NODE1 EchoRequest
-> endpoint 333 flow 0x0 identity host->237465 state reply ifindex 0 orig-ip NODE1: NODE1 -> 10.100.2.123 EchoReply
```

works

**pinging other node**

tcpdump
```
17:39:02.437350 IP 10.100.2.123 > $NODE2: ICMP echo request, id 48, seq 1, length 64
```

cilium monitor
```
Policy verdict log: flow 0x0 local EP ID 333, remote ID remote-node, proto 1, egress, action allow, match all, 10.100.2.123 -> NODE2 EchoRequest
-> stack flow 0x0 identity 237465->remote-node state new ifindex 0 orig-ip 0.0.0.0: 10.100.2.123 -> NODE2 EchoRequest
```

no response (and no NAT!)

**Comment by jochenseeber** [comment]
Slack discussion about this: https://cilium.slack.com/archives/C1MATJ5U5/p1629215650387500

**Comment by pchaigno** [comment]
Summarizing discussion from Slack:

### Root Cause

The cluster is using BPF-based masquerading:
```
# kubectl -n kube-system exec cilium-jf7bc -- cilium status --verbose
[...]
Masquerading:           BPF       [dummy0, external]   10.96.0.0/12 [IPv4: Enabled, IPv6: Disabled]
```
<br>

In BPF-based masquerading, we rely on the destination security identity to skip masquerading for cluster nodes. In particular, we filter on the `remote-node` identity: https://github.com/cilium/cilium/blob/83edea82d215930c1ee714b322d6e59cbbfec766/bpf/lib/nodeport.h#L1203-L1204
However, all IP addresses of remote nodes are associated with this `remote-node` identity, regardless of internal vs. external.

### Workaround

A simple workaround is to disable BPF masquerading to rely on our iptables-based masquerading instead. A more complex workaround would be to handle masquerading yourself.

### Long-term Solution

It looks like we shouldn't be masquerading traffic to external IP addresses. Differentiating between external IP addresses and internal IP addresses in the BPF logic will be a bit more involved than a simple `if` condition. We may need to have a map with all internal IP addresses. /cc @brb 

I have a PR opened to extend this logic to the iptables-based masquerading: https://github.com/cilium/cilium/pull/16603. In the current version of the PR, we skip masquerading for external IP addresses as well. If we decide not to, it's easy to change.

**Comment by aditighag** [comment]
Just to add to @pchaigno's comment - 

BPF-based masquerading currently skips SNAT for both internal and external IPs (Paul has linked the code).
iptables-based masquerading currently SNATs traffic destined to both internal and external IPs. However, this will change with Paul's [PR](https://github.com/cilium/cilium/pull/16603). We need the ability to differentiate between traffic destined to internal and external IPs in both the cases.

**Comment by brb** [comment]
Re BPF masq, https://github.com/cilium/cilium/pull/17168 should fix the issue.

**Comment by aditighag** [comment]
>should we skip masquerading for external IPs of remote nodes?

I think we should only skip masquerading for internal IPs. What would be the reasons for not masquerading external IPs?

**Comment by pchaigno** [comment]
> > should we skip masquerading for external IPs of remote nodes?
>
> I think we should only skip masquerading for internal IPs. What would be the reasons for not masquerading external IPs?

Yes, that's what I meant to write :facepalm: 

Should we skip masquerading **only for internal IPs** of remote nodes?

**Comment by brb** [comment]
> Should we skip masquerading only for internal IPs of remote nodes?

I assume we are talking about k8s Node's ExternalIP and InternalIP, right? What's the exact meaning of the ExternalIP in the context of k8s?

**Comment by pchaigno** [comment]
[The documentation](https://kubernetes.io/docs/concepts/architecture/nodes/#addresses) only seems to state:
> ExternalIP: Typically the IP address of the node that is externally routable (available from outside the cluster).
InternalIP: Typically the IP address of the node that is routable only within the cluster.

**Comment by brb** [comment]
We could make BPF masq aware of the ExternalIPs, but at the cost of losing a security identity of a sender. I'm still trying to understand all implications.

**Comment by SerialVelocity** [comment]
It seems upgrading to 1.11 is broken for me because of #16603. Pods on different hosts that talk through the external IP address (e.g. using the DNS name for TLS validation) can no longer communicate.

**Comment by brb** [comment]
> It seems upgrading to 1.11 is broken for me because of #16603.

cc @pchaigno

**Comment by pchaigno** [comment]
@SerialVelocity Would you be able to test if https://github.com/cilium/cilium/pull/18483 solves the issue for you? The test images are listed at https://github.com/cilium/cilium/runs/4815621695?check_suite_focus=true.

**Comment by jorhett** [comment]
This also appears to impact traffic going to ingress/gateway endpoints hosted by the same node, specifically lb-ipam-pool-assigned addresses hosted on the same node.

**Comment by tamilmani1989** [comment]
encountered a similar issue: https://github.com/cilium/cilium/issues/35823. Once we enabled ebpf host routing, we found iptable based masquerading doesn't work, so the only choice for us to rely on bpf based masquerade. cilium bpf based masquerade supports upstream ip-masq-agent configuration but its behavior is different from upstream ip-masq-agent in terms of snat to remote node IPs. This would be breaking change for customers who wants to migrate from legacy host routing with upstream iptable based masquerade to ebpf host routing. cc: @pchaigno @aditighag

**Comment by pchaigno** [comment]
> Once we enabled ebpf host routing, we found iptable based masquerading doesn't work, so the only choice for us to rely on bpf based masquerade.

The agent should disable BPF Host Routing if IPtables-based masquerading is enabled: https://github.com/cilium/cilium/blob/10591b4af267709328ffdda4c8bd52d877dc838f/daemon/cmd/kube_proxy_replacement.go#L357-L359 Is that what you observed?

> cilium bpf based masquerade supports upstream ip-masq-agent configuration but its behavior is different from upstream ip-masq-agent in terms of snat to remote node IPs.

Yep, that why we kept this issue opened. I don't think anyone is working on a fix at the moment, but such a fix would definitely be welcome 😃

**Comment by tamilmani1989** [comment]
> Is that what you observed?

Apologies for not being clear. We use upstream ip-masq-agent and cilium iptable masquerading is disabled in our case.

> Yep, that why we kept this issue opened. I don't think anyone is working on a fix at the moment, but such a fix would definitely be welcome 😃

Good to know. we will come up with a fix.

**Comment by kevinvalk** [comment]
@behzad-mir thanks for the work on the PR! Last night I spent hours debugging until I figured that indeed external node IPs are not NATed... (Also started investigation due to failing cert-manager, I have same setup native routing on Wireguard mesh).

Looking forward to having PR #37568 merged 🎉

UPDATE:

> This flag currently masquerades traffic to node ``InternalIP`` addresses.

Am I correct in that this means SNAT is only applied on traffic to InternalIP? Not ExternalIP? **In my case, traffic to InternalIP can be routed natively and traffic to ExternalIP cannot.**

**Comment by kevinvalk** [comment]
After reading the https://github.com/cilium/cilium/pull/37568 source code I figure all `reserved:remote-node` endpoint will be masqueraded. This means that both traffic to `InternalIP` and `ExternalIP` are now masqueraded :(

Wouldn't it be way nicer and "easier" (in the end) to somehow allow a configuration option to define which identities should be assigned to `InternalIP` and `ExternalIP` node addresses? That way, one could configure that all `externalIPs` should be given `reserved:world` identity which also would result in it being nicely masqueraded.

I tried to figure out where in the code node addresses are "assigned" identities, but did not fully grasp how and where this was done. Maybe somebody knows?

**Comment by pchaigno** [comment]
The problem orignally discussed here was addressed by the new flag in https://github.com/cilium/cilium/pull/37568. As noted in the latest comments by @kevinvalk, this isn't optimal behavior however. I'm therefore closing this in favor of https://github.com/cilium/cilium/issues/41462, which discusses the optimal behavior.
