### ISSUE TITLE
Cilium OSS v1.14.x breaks with Google GKE  and bpf.masquerade on metadata-server / Workload-Identity

### ISSUE THREAD

**Issue by fuog** [cilium/cilium#28655]
### Is there an existing issue for this?

- [X] I have searched the existing issues

### What happened?

GCP offers a metadata server for its instances/VMs/Nodes which takes over various 'node-personal' tasks. Among other things are DNS, NTP, metadata-key/value lookup via http and so on.. With GKE, this service is also responsible for the workload-identity. This service is normally offered via 169.254.169.254 and on GKE nodes (classic dataplane) via 169.254.169.252:988. 
With Cilium there was never a problem to reach this service in v1.13.x until I tried to upgrade to v1.14.x. **The address cannot be reached by a normal pod.** (icmp, tcp/http, no netpols) 
Looking closer you find that "169.254.169.252/32" was implemented on a GKE node as an additional ip on the lo interface:
```
 some-gke-node-7783-46b27a12-9q54  ~  ip addr show dev lo 
1: lo: <LOOPBACK,UP,LOWER_UP> mtu 65536 qdisc noqueue state UNKNOWN group default qlen 1000
    link/loopback 00:00:00:00:00:00 brd 00:00:00:00:00:00
    inet 127.0.0.1/8 scope host lo
       valid_lft forever preferred_lft forever
    inet 169.254.169.252/32 scope host lo
       valid_lft forever preferred_lft forever
    inet6 ::1/128 scope host 
       valid_lft forever preferred_lft forever
```
Also you will find, that iptables is tuned by GCP to DNAT traffic on 169.254.169.254 (regular DNS-Entry "metadata.google.internal") **to the 169.254.169.252:988** _(maybe old dataplane v1 implementation)_
```
 gsome-gke-node-7783-46b27a12-9q54  ~  iptables -n -L -t nat | head
Chain PREROUTING (policy ACCEPT)
target     prot opt source               destination         
CILIUM_PRE_nat  0    --  0.0.0.0/0            0.0.0.0/0            /* cilium-feeder: CILIUM_PRE_nat */
KUBE-SERVICES  0    --  0.0.0.0/0            0.0.0.0/0            /* kubernetes service portals */
DNAT       6    --  0.0.0.0/0            169.254.169.254      tcp dpt:8080 /* metadata-concealment: bridge traffic to metadata server goes to metadata proxy */ to:169.254.169.252:987
DNAT       6    --  0.0.0.0/0            169.254.169.254      tcp dpt:80 /* metadata-concealment: bridge traffic to metadata server goes to metadata proxy */ to:169.254.169.252:988
```
You will also find, that a GKE is runnging that workload as kube-system daemonsets:
```
❯ kubectl -n kube-system describe daemonsets.apps gke-metadata-server
Name:           gke-metadata-server
...
Pod Template:
  Containers:
   gke-metadata-server:
    Image:       gke.gcr.io/gke-metadata-server:gke_metadata_server_20220719.00_p0
    Host Ports:  987/TCP, 988/TCP, 989/TCP
    ...
```

What i did learn was: 
- disable `bpf.masquerade` **will allow traffic to `169.254.169.252:988` again** 
- it's DNAT'ed  fake `169.254.169.254`  works with or without masq.

But this is not a solution for me because it seams both are used.

How does the traffic flow look between  `v1.13.x` and `v1.14.x`?
```
# 1.14.2 && 1.14.0 - connection is failing on the 169.254. alias.
❯ kubectl -n mgmt-cni-cilium exec -it cilium-77cz8 -- cilium monitor --from 3777
level=info msg="Initializing dissection cache..." subsys=monitor
-> network flow 0xdc85b7fc , identity 10599->world state new ifindex eth0 orig-ip 0.0.0.0: 100.68.8.235:58934 -> 169.254.169.252:988 tcp SYN
-> network flow 0x2a981be9 , identity 10599->world state established ifindex eth0 orig-ip 0.0.0.0: 100.68.8.235:58934 -> 169.254.169.252:988 tcp SYN
-> network flow 0xb37d17ab , identity 10599->world state established ifindex eth0 orig-ip 0.0.0.0: 100.68.8.235:58934 -> 169.254.169.252:988 tcp SYN
-> network flow 0x6161543e , identity 10599->world state established ifindex eth0 orig-ip 0.0.0.0: 100.68.8.235:58934 -> 169.254.169.252:988 tcp SYN
-> endpoint 3777 flow 0x300535d7 , identity 12031->10599 state new ifindex lxcdc87b9397560 orig-ip 100.68.8.104: 100.68.8.104:36436 -> 100.68.8.235:80 tcp SYN
-> network flow 0x81f3a335 , identity 10599->world state established ifindex eth0 orig-ip 0.0.0.0: 100.68.8.235:58934 -> 169.254.169.252:988 tcp SYN
-> endpoint 3777 flow 0x6c19e4a3 , identity 12031->10599 state new ifindex lxcdc87b9397560 orig-ip 100.68.8.104: 100.68.8.104:42930 -> 100.68.8.235:80 tcp SYN
root@debugging-pod-gcloud:/# curl 10.234.159.44:988 
computeMetadata/   # expected ... using node-ip
root@debugging-pod-gcloud:/# curl 169.254.169.252:988
^C          # tcp timeout

# 1.13.8  - connection does work
❯ kubectl -n mgmt-cni-cilium exec -it cilium-gtbcx -- cilium monitor --from 3777
-> stack flow 0x1315e097 , identity 10599->world state new ifindex 0 orig-ip 0.0.0.0: 100.68.8.235:35874 -> 169.254.169.252:988 tcp SYN
-> endpoint 3777 flow 0x1f9ac95d , identity world->10599 state reply ifindex 0 orig-ip 169.254.169.252: 169.254.169.252:988 -> 100.68.8.235:35874 tcp SYN, ACK
-> stack flow 0x1315e097 , identity 10599->world state established ifindex 0 orig-ip 0.0.0.0: 100.68.8.235:35874 -> 169.254.169.252:988 tcp ACK
-> stack flow 0x1315e097 , identity 10599->world state established ifindex 0 orig-ip 0.0.0.0: 100.68.8.235:35874 -> 169.254.169.252:988 tcp ACK
-> endpoint 3777 flow 0x1f9ac95d , identity world->10599 state reply ifindex 0 orig-ip 169.254.169.252: 169.254.169.252:988 -> 100.68.8.235:35874 tcp ACK
-> stack flow 0x1315e097 , identity 10599->world state established ifindex 0 orig-ip 0.0.0.0: 100.68.8.235:35874 -> 169.254.169.252:988 tcp ACK, FIN
-> endpoint 3777 flow 0x1f9ac95d , identity world->10599 state reply ifindex 0 orig-ip 169.254.169.252: 169.254.169.252:988 -> 100.68.8.235:35874 tcp ACK, FIN
-> stack flow 0x1315e097 , identity 10599->world state established ifindex 0 orig-ip 0.0.0.0: 100.68.8.235:35874 -> 169.254.169.252:988 tcp ACK

root@debugging-pod-gcloud:/# curl 10.234.159.44:988
computeMetadata/   # expected ... using node-ip
root@debugging-pod-gcloud:/# curl 169.254.169.252:988
computeMetadata/   # expected 

```

Did i miss something? the Cilium configuration is mostly  pretty simple like Cilium OSS GKE-docs explains it.

- How is an additional `lo` ip a problem when using Masq from a Pod endpoint to the same host?

### Cilium Version

migration from `v1.13.x`  (tested .1  .2 .8) does work
to `v1.14.x` (tested ..0 ..2 ) does NOT work

### Kernel Version

5.10.176+

### Kubernetes Version

v1.24.15-gke.1700

### Anything else?

I know you do alot of testing with Cilium. Did you ever test the capability to reach `curl http://metadata.google.internal`  (with and without Masq) -- it's an essential part on this hyperscaler!  :+1: 

Thanks for the help :heart: 

### Code of Conduct

- [X] I agree to follow this project's Code of Conduct

**Comment by fuog** [comment]
Here also the helm values i use _( removed hubble and other not relevant stuff )_
```
---
upgradeCompatibility: '1.13'

ipv4NativeRoutingCIDR: {{ .Values.gcp.gke.pod_cidr | quote | required "" }}

gke:
  enabled: true

ipam:
  mode: kubernetes

kubeProxyReplacement: "strict"

nodeinit:
  enabled: true
  reconfigureKubelet: true
  removeCbrBridge: true
  restartPods: true
  tolerations:
  - effect: NoSchedule
    key: sandbox.gke.io/runtime
    operator: Equal
    value: gvisor

rollOutCiliumPods: true

socketLB:
  # This will fix problems with gvisor
  hostNamespaceOnly: true

tolerations:
- effect: NoSchedule
  key: sandbox.gke.io/runtime
  operator: Equal
  value: gvisor

# see https://docs.cilium.io/en/stable/network/concepts/masquerading/#ebpf-based
enableIPv4Masquerade: true # default
bpf:
  masquerade: true
ipMasqAgent:
  enabled: true
  config:
    masqLinkLocal: false
    nonMasqueradeCIDRs: # yeah that's helmfile, templating helm value-files it  the CIDRs are GCP specific ranges not loopback
      {{- with .Values.gcp.loadbalancer_healthcheck_source_cidrs }}
      {{- toYaml . | nindent 6 }}
      {{- end }}
      {{- with .Values.gcp.proxy_only_subnets }}
      {{- toYaml . | nindent 6 }}
      {{- end }}

cni:
  binPath: /home/kubernetes/bin

containerRuntime:
  integration: containerd

```

**Comment by fuog** [comment]
i don't get it, i can't see any differences in handling:
```
# .252:988,    1.14,    tcpdump,   ipmasq-on, FAILED
15:44:48.830699 IP 100.68.8.248.42636 > 169.254.169.252.988: Flags [S], seq 3753017338, win 42600, options [mss 1420,sackOK,TS val 779801926 ecr 0,nop,wscale 7], length 0
15:44:51.164101 IP 100.68.8.248.42652 > 169.254.169.252.988: Flags [S], seq 571512866, win 42600, options [mss 1420,sackOK,TS val 779804260 ecr 0,nop,wscale 7], length 0
```

```
# .252:988,    1.14,    cilium-monitor,   ipmasq-on, FAILED
-> network flow 0x190454eb , identity 58701->world state new ifindex eth0 orig-ip 0.0.0.0: 100.68.8.248:42636 -> 169.254.169.252:988 tcp SYN
-> network flow 0x8baa7fe8 , identity 58701->world state new ifindex eth0 orig-ip 0.0.0.0: 100.68.8.248:42652 -> 169.254.169.252:988 tcp SYN
```

```
# .252:988,    1.14,    tcpdump,   ipmasq-off, SUCCESS
16:52:14.027004 lxc2be0981a5a5a In IP 100.68.8.86.58864 > 169.254.169.252.988: Flags \[S\], seq 469584400, win 42600, options \[mss 1420,sackOK,TS val 2943494246 ecr 0,nop,wscale 7\], length 0
16:52:14.027098 lxc2be0981a5a5a Out IP 169.254.169.252.988 > 100.68.8.86.58864: Flags \[S.\], seq 471236792, ack 469584401, win 43648, options \[mss 1420,sackOK,TS val 1067411365 ecr 2943494246,nop,wscale 7\], length 0
16:52:14.027115 lxc2be0981a5a5a In IP 100.68.8.86.58864 > 169.254.169.252.988: Flags \[.\], ack 1, win 333, options \[nop,nop,TS val 2943494246 ecr 1067411365\], length 0
16:52:14.027182 lxc2be0981a5a5a In IP 100.68.8.86.58864 > 169.254.169.252.988: Flags \[P.\], seq 1:84, ack 1, win 333, options \[nop,nop,TS val 2943494246 ecr 1067411365\], length 83
```

```
# .252:988,    1.14,    cilium-monitor,   ipmasq-off, SUCCESS
-> stack flow 0xf73c9910 , identity 58701->world state new ifindex 0 orig-ip 0.0.0.0: 100.68.8.86:42256 -> 169.254.169.252:988 tcp SYN
-> endpoint 2298 flow 0x9f9eadbe , identity world->58701 state reply ifindex 0 orig-ip 169.254.169.252: 169.254.169.252:988 -> 100.68.8.86:42256 tcp SYN, ACK
-> stack flow 0xf73c9910 , identity 58701->world state established ifindex 0 orig-ip 0.0.0.0: 100.68.8.86:42256 -> 169.254.169.252:988 tcp ACK
-> stack flow 0xf73c9910 , identity 58701->world state established ifindex 0 orig-ip 0.0.0.0: 100.68.8.86:42256 -> 169.254.169.252:988 tcp ACK
-> endpoint 2298 flow 0x9f9eadbe , identity world->58701 state reply ifindex 0 orig-ip 169.254.169.252: 169.254.169.252:988 -> 100.68.8.86:42256 tcp ACK
-> stack flow 0xf73c9910 , identity 58701->world state established ifindex 0 orig-ip 0.0.0.0: 100.68.8.86:42256 -> 169.254.169.252:988 tcp ACK, FIN
-> endpoint 2298 flow 0x9f9eadbe , identity world->58701 state reply ifindex 0 orig-ip 169.254.169.252: 169.254.169.252:988 -> 100.68.8.86:42256 tcp ACK, FIN
```


```
# .252:988,    1.13,    cilium-monitor,   ipmasq-on, SUCCESS
-> stack flow 0xf5a90553 , identity 58701->world state new ifindex 0 orig-ip 0.0.0.0: 100.68.8.44:46874 -> 169.254.169.252:988 tcp SYN
-> endpoint 3353 flow 0x27ecb346 , identity world->58701 state reply ifindex 0 orig-ip 169.254.169.252: 169.254.169.252:988 -> 100.68.8.44:46874 tcp SYN, ACK
-> stack flow 0xf5a90553 , identity 58701->world state established ifindex 0 orig-ip 0.0.0.0: 100.68.8.44:46874 -> 169.254.169.252:988 tcp ACK
-> stack flow 0xf5a90553 , identity 58701->world state established ifindex 0 orig-ip 0.0.0.0: 100.68.8.44:46874 -> 169.254.169.252:988 tcp ACK
-> endpoint 3353 flow 0x27ecb346 , identity world->58701 state reply ifindex 0 orig-ip 169.254.169.252: 169.254.169.252:988 -> 100.68.8.44:46874 tcp ACK
-> stack flow 0xf5a90553 , identity 58701->world state established ifindex 0 orig-ip 0.0.0.0: 100.68.8.44:46874 -> 169.254.169.252:988 tcp ACK, FIN
-> endpoint 3353 flow 0x27ecb346 , identity world->58701 state reply ifindex 0 orig-ip 169.254.169.252: 169.254.169.252:988 -> 100.68.8.44:46874 tcp ACK, FIN
-> stack flow 0xf5a90553 , identity 58701->world state established ifindex 0 orig-ip 0.0.0.0: 100.68.8.44:46874 -> 169.254.169.252:988 tcp ACK

```

```
# .252:988,    1.13,    tcpdump,   ipmasq-on, SUCCESS
17:56:37.459395 lxc60ee6382fc5f In  IP 100.68.8.44.33862 > 169.254.169.252.988: Flags [S], seq 871912521, win 42600, options [mss 1420,sackOK,TS val 3585794439 ecr 0,nop,wscale 7], length 0
17:56:37.459519 lxc60ee6382fc5f Out IP 169.254.169.252.988 > 100.68.8.44.33862: Flags [S.], seq 3283580171, ack 871912522, win 43648, options [mss 1420,sackOK,TS val 2787046646 ecr 3585794439,nop,wscale 7], length 0
17:56:37.459537 lxc60ee6382fc5f In  IP 100.68.8.44.33862 > 169.254.169.252.988: Flags [.], ack 1, win 333, options [nop,nop,TS val 3585794439 ecr 2787046646], length 0
17:56:37.459628 lxc60ee6382fc5f In  IP 100.68.8.44.33862 > 169.254.169.252.988: Flags [P.], seq 1:84, ack 1, win 333, options [nop,nop,TS val 3585794439 ecr 2787046646], length 83
17:56:37.459652 lxc60ee6382fc5f Out IP 169.254.169.252.988 > 100.68.8.44.33862: Flags [.], ack 84, win 341, options [nop,nop,TS val 2787046646 ecr 3585794439], length 0
17:56:37.460102 lxc60ee6382fc5f Out IP 169.254.169.252.988 > 100.68.8.44.33862: Flags [P.], seq 1:180, ack 84, win 341, options [nop,nop,TS val 2787046647 ecr 3585794439], length 179
17:56:37.460127 lxc60ee6382fc5f In  IP 100.68.8.44.33862 > 169.254.169.252.988: Flags [.], ack 180, win 332, options [nop,nop,TS val 3585794440 ecr 2787046647], length 0
17:56:37.460434 lxc60ee6382fc5f In  IP 100.68.8.44.33862 > 169.254.169.252.988: Flags [F.], seq 84, ack 180, win 332, options [nop,nop,TS val 3585794440 ecr 2787046647], length 0
17:56:37.460824 lxc60ee6382fc5f Out IP 169.254.169.252.988 > 100.68.8.44.33862: Flags [F.], seq 180, ack 85, win 341, options [nop,nop,TS val 2787046648 ecr 3585794440], length 0
17:56:37.460840 lxc60ee6382fc5f In  IP 100.68.8.44.33862 > 169.254.169.252.988: Flags [.], ack 181, win 332, options [nop,nop,TS val 3585794441 ecr 2787046648], length 0
```

```
# cilium bpf ipmasq list  (the same in 1.13 and 1.14)
IP PREFIX/ADDRESS
10.234.132.0/24
10.234.133.0/24
35.191.0.0/16
130.211.0.0/22
169.254.0.0/16
```

**Comment by fuog** [comment]
bumping to `v1.26.6-gke.1700` did not help.
bumping to `v1.27.6-gke.1445000` did not help.
i can tell, up to `1.27` GKE does everything the same way. 
- `169.254.169.252` as ipon the loopback interface,
- `169.254.169.254:80` iptables DNAT to `169.254.169.252:988 ` 
- `:988` is `kube-system` Daemonset workload with hostport: 988 (and some more ports) DS is called "gke-metadata-server"

**Comment by julianwiedmann** [comment]
:wave: please re-test with a branch that has https://github.com/cilium/cilium/pull/28264.

**Comment by fuog** [comment]
Actually, version `v1.14.4` really solves the problem, brilliant! My demo pod shows a simple curl on the metadata service. including the Cilium Pod.

```bash
❯ kubectl exec -it debugging-pod -- /bin/zsh
 debugging-pod  ~  curl metadata
computeMetadata/
 debugging-pod  ~  exit
❯ kubectl get pods debugging-pod -o wide
NAME            READY   STATUS    RESTARTS   AGE     IP             NODE                                          NOMINATED NODE   READINESS GATES
debugging-pod   1/1     Running   0          3m42s   100.68.2.242   gke-....-eng-default-a1a4-5ea43c56-bttv
❯ kubectl -n mgmt-cni-cilium get pod cilium-8vg5j -o custom-columns='Name:.metadata.name,Image:.spec.containers[0].image'
Name           Image
cilium-8vg5j   quay.io/cilium/cilium:v1.14.4@sha256:4981767b787c69126e190e33aee93d5a076639083c21f0e7c29596a519c64a2e

```

For others who may be trying to solve the same problem, I would like to mention that I use exclusively private GKEs, which are operated within a VPC without public IPs. As far as I can tell, it only affected internal private GKEs.

Great work! to the Cilium maintainers and everyone who contributes! Many thanks

**Comment by fuog** [comment]
:cry: 
unfortunately i have to correct myself. v1.14.4 seems to effectively enable the traffic flow from the pod via 169.254.169.254 to 169.254.169.252:988. Unfortunately the workload identity still does not work. I.e. the service account is not provided as expected. I cannot yet understand exactly why. Unfortunately, I can't find any useful logs in the workload identity area either.

**Comment by fuog** [comment]
I think I have isolated the problem in `v1.14.4`. Yes, the traffic is flowing again, but via eth0 out to the GCP backend. There is also a "metadata-server" at google which is the VM-based metadata server and this does not authenticate like the GKE internal k8s-pods. 

What should actually happen is a traffic flow to the loopback interface. The loopback interface has the ip 169.254.169.252 and the metadata server of the GKE runs on that ip with port 988 (169.254.169.254, as mentioned is only an iptables NAT which redirects to ..252:988).

Here a traffic flow of `v1.14.4` :
```
-> network flow 0x96c5d564 , identity 19326->world state new ifindex eth0 orig-ip 0.0.0.0: 100.68.2.196:55410 -> 169.254.169.254:80 tcp SYN
-> endpoint 3082 flow 0x3858d41a , identity world->19326 state reply ifindex lxc62a8e914c619 orig-ip 169.254.169.254: 169.254.169.254:80 -> 100.68.2.196:55410 tcp SYN, ACK
-> network flow 0x96c5d564 , identity 19326->world state established ifindex eth0 orig-ip 0.0.0.0: 100.68.2.196:55410 -> 169.254.169.254:80 tcp ACK
-> network flow 0x96c5d564 , identity 19326->world state established ifindex eth0 orig-ip 0.0.0.0: 100.68.2.196:55410 -> 169.254.169.254:80 tcp ACK
-> endpoint 3082 flow 0x3858d41a , identity world->19326 state reply ifindex lxc62a8e914c619 orig-ip 169.254.169.254: 169.254.169.254:80 -> 100.68.2.196:55410 tcp ACK
-> network flow 0x96c5d564 , identity 19326->world state established ifindex eth0 orig-ip 0.0.0.0: 100.68.2.196:55410 -> 169.254.169.254:80 tcp ACK, FIN
-> endpoint 3082 flow 0x3858d41a , identity world->19326 state reply ifindex lxc62a8e914c619 orig-ip 169.254.169.254: 169.254.169.254:80 -> 100.68.2.196:55410 tcp ACK, FIN
-> network flow 0x0 , identity 19326->world state established ifindex eth0 orig-ip 0.0.0.0: 100.68.2.196:55410 -> 169.254.169.254:80 tcp ACK
```
Same flow with `v1.13.8`:
```
-> stack flow 0x785afed7 , identity 47271->world state new ifindex 0 orig-ip 0.0.0.0: 100.66.1.34:51346 -> 169.254.169.254:80 tcp SYN
-> endpoint 160 flow 0xe88ce93 , identity world->47271 state reply ifindex 0 orig-ip 169.254.169.254: 169.254.169.254:80 -> 100.66.1.34:51346 tcp SYN, ACK
-> stack flow 0x785afed7 , identity 47271->world state established ifindex 0 orig-ip 0.0.0.0: 100.66.1.34:51346 -> 169.254.169.254:80 tcp ACK
-> stack flow 0x785afed7 , identity 47271->world state established ifindex 0 orig-ip 0.0.0.0: 100.66.1.34:51346 -> 169.254.169.254:80 tcp ACK
-> endpoint 160 flow 0xe88ce93 , identity world->47271 state reply ifindex 0 orig-ip 169.254.169.254: 169.254.169.254:80 -> 100.66.1.34:51346 tcp ACK
-> stack flow 0x785afed7 , identity 47271->world state established ifindex 0 orig-ip 0.0.0.0: 100.66.1.34:51346 -> 169.254.169.254:80 tcp ACK, FIN
-> endpoint 160 flow 0xe88ce93 , identity world->47271 state reply ifindex 0 orig-ip 169.254.169.254: 169.254.169.254:80 -> 100.66.1.34:51346 tcp ACK, FIN
-> stack flow 0x785afed7 , identity 47271->world state established ifindex 0 orig-ip 0.0.0.0: 100.66.1.34:51346 -> 169.254.169.254:80 tcp ACK
```
I see the relevant diff in `...new ifindex 0 ...` vs `... new ifindex eth0 ...`. I hope that helps. @julianwiedmann

**Comment by fuog** [comment]
I have noticed that the PR was not included in `v1.14.4` :see_no_evil:   I have now used the following `-ci` image.
Image: `1a7ed0a50b93dc9f9e5e9ee326979b2ec95b6819` ( Commit: [fc8f9ec0b7d3c9645829bdcccdfb11bc1a73c17e](https://github.com/cilium/cilium/commit/fc8f9ec0b7d3c9645829bdcccdfb11bc1a73c17e) )
 **But it makes no difference, the result remains the same.**

**Comment by julianwiedmann** [comment]
Ah, so you're relying on some custom iptables magic. :)

Just to double-check, can you compare for `v1.13` vs `v1.14` what `cilium status` gives you for `Host Routing`  ? It probably switched from `legacy` to `BPF`, in which case you would need to override with `bpf.hostLegacyRouting=true`.

**Comment by fuog** [comment]
Actually, you are absolutely right. :see_no_evil:  But I have to say that changing a default value within the Cilium binary is very sneaky. Not only did my own and the default `values.yaml` remain the same from my point of view, but also the rendered output, i.e. the YAML declaration, which I normally diff, did not show this massive change. But I may have the following input at this point:

- It would be great to include the information in the Cilium documentation. It concerns private GKE clusters that require the metadata server (usually noticeable in the workload identity). GKE 1.24 - 1.27.  `bpf.hostLegacyRouting=true`  solves the problem because gke's iptables rule is respected again.

- I was able to find another solution that does not require legacy mode. Two corresponding `CiliumLocalRedirectPolicy` rules achieve the same effect and so `bpf.hostLegacyRouting=false` can remain. This of course makes us a bit more BPF again. :sunglasses:  I would perhaps suggest verifying my suggestion more closely and offering it as a "GKE" style helm configuration.

Again check the iptable rules required (with a privileged pod + `hostNetwork=true` ):

```bash
gke-some-node28e-0b07eb0e-jz54# iptables -L -n -t nat | grep 169
DNAT       6    --  0.0.0.0/0            169.254.169.254      tcp dpt:8080 /* metadata-concealment: bridge traffic to metadata server goes to metadata proxy */ to:169.254.169.252:987
DNAT       6    --  0.0.0.0/0            169.254.169.254      tcp dpt:80 /* metadata-concealment: bridge traffic to metadata server goes to metadata proxy */ to:169.254.169.252:988
```

Check the `gke-metadata-server` DaemonSet of GKE:

```bash
kubectl -n kube-system get daemonsets.apps gke-metadata-server -o yaml | kubectl-neat | grep -A8 ports
        ports:
        - containerPort: 987
          hostPort: 987
          name: alts
          protocol: TCP
        - containerPort: 988
          hostPort: 988
          name: metadata-server
          protocol: TCP
```

Building the redirect rules with `localRedirectPolicy=true` :

```yaml
apiVersion: cilium.io/v2
kind: CiliumLocalRedirectPolicy
metadata:
  name: gke-metadata-server-redirect-80
  namespace: kube-system
  annotations:
    kubernetes.io/description: |-
      This policy forces traffic for gke's metadata server to the
      correct endpoint using cilium. This is necessary because in
      BPF native mode, where even the host namespace  routing is
      managed by BPF, GKE's special loopback-iptables-rule are
      also ignored. Alternatively to this rule,
      hostLegacyRouting=true can also be used.
      See https://github.com/cilium/cilium/issues/28655
spec:
  redirectBackend:
    localEndpointSelector:
      matchLabels:
        k8s-app: "gke-metadata-server"
    toPorts:
    - port: "988"
      protocol: "TCP"
  redirectFrontend:
    addressMatcher:
      ip: "169.254.169.254"
      toPorts:
      - port: "80"
        protocol: "TCP"
---
apiVersion: cilium.io/v2
kind: CiliumLocalRedirectPolicy
metadata:
  name: gke-metadata-server-redirect-8080
  namespace: kube-system
  annotations:
    kubernetes.io/description: |-
      This policy forces traffic for gke's metadata server to the
      correct endpoint using cilium. This is necessary because in
      BPF native mode, where even the host namespace  routing is
      managed by BPF, GKE's special loopback-iptables-rule are
      also ignored. Alternatively to this rule,
      hostLegacyRouting=true can also be used.
      See https://github.com/cilium/cilium/issues/28655
spec:
  redirectBackend:
    localEndpointSelector:
      matchLabels:
        k8s-app: "gke-metadata-server"
    toPorts:
    - port: "987"
      protocol: "TCP"
  redirectFrontend:
    addressMatcher:
      ip: "169.254.169.254"
      toPorts:
      - port: "8080"
        protocol: "TCP"
```

I hope this helps others in such a situation. 
Thanks for your the help! @julianwiedmann

**Comment by julianwiedmann** [comment]
>what would be the right spot for this

where in the docs did *you* start looking for this issue? That's the spot :grin:.

In all seriousness - would it eg. have helped to highlight this aspect in the v1.14 upgrade notes?

**Comment by Pionerd** [comment]
Upgrade notes would have been nice at the time given the "breaking" change, but when trying to figure out what to do I usually check the regular docs. So, personally I was doubting between https://docs.cilium.io/en/latest/network/concepts/ipam/gke/ and https://docs.cilium.io/en/latest/gettingstarted/k8s-install-default/#install-cilium -> GKE tab

**Comment by Pionerd** [comment]
@fuog is this still working for you in 1.16.x? For us it seems to break (see #36685)

**Comment by NGallmann** [comment]
> [@fuog](https://github.com/fuog) is this still working for you in 1.16.x? For us it seems to break (see [#36685](https://github.com/cilium/cilium/issues/36685))

Sorry for the late response. Until ~ one week ago it was still the solution for us (yes also on `1.16.x`). But like described here: https://github.com/cilium/cilium/issues/36685#issuecomment-3128192208 GCP changed something on the Metadata-Server since then the only option for us is currently is `bpf.hostLegacyRouting=true`. Why? because the Metadata-server of GKE now binds to the `169.254.169.252:988` address (instead of simply `0.0.0.0:988`) and the localredirectpolicy does not DNAT the package. Thats why  Workload-identity is now broken ...


Here the diff between the old DaemonSet controllerrevision and the current of our cluster:
```diff
❯ diff current-ds.yaml old-ds.yaml
9c9
<           components.gke.io/component-version: 0.4.310
---
>           components.gke.io/component-version: 1.32.2
22c22
<           - --alts-service-suffixes-using-node-identity=storage.googleapis.com,bigtable.googleapis.com,bigtable2.googleapis.com,bigtablerls.googleapis.com,spanner.googleapis.com,spanner2.googleapis.com,spanner-rls.googleapis.com,grpclb.directpath.google.internal,grpclb-dualstack.directpath.google.internal,staging-wrenchworks.sandbox.googleapis.com,preprod-spanner.sandbox.googleapis.com,wrenchworks-loadtest.googleapis.com,wrenchworks-nonprod.googleapis.com
---
>           - --alts-service-suffixes-using-node-identity=storage.googleapis.com,bigtable.googleapis.com,bigtable2.googleapis.com,bigtablerls.googleapis.com,spanner.googleapis.com,spanner2.googleapis.com,spanner-rls.googleapis.com,grpclb.directpath.google.internal,grpclb-dualstack.directpath.google.internal,grpc-directpath-dualstack.googleapis.com,staging-wrenchworks.sandbox.googleapis.com,preprod-spanner.sandbox.googleapis.com,wrenchworks-loadtest.googleapis.com,wrenchworks-nonprod.googleapis.com
34c34
<           - --component-version=0.4.310
---
>           - --component-version=1.32.2
36a37,39
>           - --enable-mds-csi-driver=true
>           - --enable-alts-bound-token=true
>           - --addr=169.254.169.252:988  # Here !
43c46
<           image: gke.gcr.io/gke-metadata-server:gke_metadata_server_20241211.00_p0@sha256:72127abd781ab6d4ffc5c1ec77832bdd9f8c314204249758773bbd32c35a6db8
---
>           image: gke.gcr.io/gke-metadata-server:gke_metadata_server_20250506.02_p4@sha256:330d6bbf701c035795c281ca4f37ee6db2dfbb7c07dd773ce06ebc787344fd75
195c198
<     deprecated.daemonset.template.generation: "5"
---
>     deprecated.daemonset.template.generation: "6"
198c201
<     controller-revision-hash: dfd974d69
---
>     controller-revision-hash: b96c445cb
200c203
<   name: gke-metadata-server-dfd974d69
---
>   name: gke-metadata-server-b96c445cb
202c205
< revision: 5
---
> revision: 6

```

if only cilium would proparly DNAT the package :(

i keep you updated
