### ISSUE TITLE
inconsistent result with cilium network policies when kube-proxy is enabled or disabled

### ISSUE THREAD

**Issue by rahulait** [cilium/cilium#19010]
### Is there an existing issue for this?

- [X] I have searched the existing issues

### What happened?

I am running cilium with kube-proxy disabled(installed using rke2-1.20.12).
```
root@a172-25-172-204:/home/cilium# cilium status
KVStore:                Ok   Disabled
Kubernetes:             Ok   1.20 (v1.20.12+rke2r1) [linux/amd64]
Kubernetes APIs:        ["cilium/v2::CiliumClusterwideNetworkPolicy", "cilium/v2::CiliumEndpoint", "cilium/v2::CiliumNetworkPolicy", "cilium/v2::CiliumNode", "core/v1::Namespace", "core/v1::Node", "core/v1::Pods", "core/v1::Service", "discovery/v1beta1::EndpointSlice", "networking.k8s.io/v1::NetworkPolicy"]
KubeProxyReplacement:   Strict   [eth0 (Direct Routing)]
Cilium:                 Ok       OK
NodeMonitor:            Listening for events on 4 CPUs with 64x4096 of shared memory
Cilium health daemon:   Ok
IPAM:                   IPv4: 23/255 allocated from 172.23.128.0/24,
BandwidthManager:       Disabled
Host Routing:           Legacy
Masquerading:           BPF   [eth0]   172.23.128.0/24
Controller Status:      102/102 healthy
Proxy Status:           OK, ip 172.23.128.26, 0 redirects active on ports 10000-20000
Hubble:                 Ok              Current/Max Flows: 4096/4096 (100.00%), Flows/s: 34.77   Metrics: Disabled
Cluster health:         4/4 reachable   (2022-03-02T05:54:47Z)
root@a172-25-172-204:/home/cilium#

root@172.25.172.204:~# kubectl get pods -A | grep kube-proxy
root@172.25.172.204:~#
```

I have a global clusterwide deny policy which blocks all ingress to cluster but allows ingress from cluster entities.
```
---
apiVersion: "cilium.io/v2"
kind: CiliumClusterwideNetworkPolicy
metadata:
  name: "global-deny-all"
spec:
  description: "block everything coming from outside the cluster"
  endpointSelector: {}
  ingress:
  - fromEntities:
    - cluster
```
I deployed an app, created a service and exposed it using type as loadBalancer.
```
root@172.25.172.204:~# kubectl get svc -n web
NAME    TYPE           CLUSTER-IP      EXTERNAL-IP      PORT(S)          AGE
nginx   LoadBalancer   172.23.60.147   172.25.172.219   4080:32129/TCP   5h52m
root@172.25.172.204:~#
```
I opened access to the app from only one IP address by adding the CNP.
```
apiVersion: cilium.io/v2
kind: CiliumNetworkPolicy
metadata:
  name: "allow-nginx"
  namespace: web
spec:
  endpointSelector:
    matchLabels:
      app: nginx
  ingress:
    - fromCIDR:
      - 198.18.135.71/32
```
I am expecting that if I try to access the app from a machine outside the cluster different than the allowed machine, it should be blocked. However, I am seeing it getting allowed. My hubble logs are:
```
root@172.25.172.204:~# kubectl -n kube-system exec cilium-2rp4t -- hubble observe --since 3m --pod web/nginx-695fc7b69-jv4q7
TIMESTAMP             SOURCE                         DESTINATION                    TYPE          VERDICT     SUMMARY
Mar  2 05:49:22.550   172.23.129.66:55166            web/nginx-695fc7b69-jv4q7:80   L3-Only       FORWARDED   TCP Flags: SYN
Mar  2 05:49:22.550   172.23.129.66:55166            web/nginx-695fc7b69-jv4q7:80   to-endpoint   FORWARDED   TCP Flags: SYN
Mar  2 05:49:22.550   web/nginx-695fc7b69-jv4q7:80   172.23.129.66:55166            to-overlay    FORWARDED   TCP Flags: SYN, ACK
Mar  2 05:49:22.553   172.23.129.66:55166            web/nginx-695fc7b69-jv4q7:80   to-endpoint   FORWARDED   TCP Flags: ACK
Mar  2 05:49:22.553   172.23.129.66:55166            web/nginx-695fc7b69-jv4q7:80   to-endpoint   FORWARDED   TCP Flags: ACK, PSH
Mar  2 05:49:22.553   web/nginx-695fc7b69-jv4q7:80   172.23.129.66:55166            to-overlay    FORWARDED   TCP Flags: ACK, PSH
Mar  2 05:49:22.556   172.23.129.66:55166            web/nginx-695fc7b69-jv4q7:80   to-endpoint   FORWARDED   TCP Flags: ACK, FIN
Mar  2 05:49:22.556   web/nginx-695fc7b69-jv4q7:80   172.23.129.66:55166            to-overlay    FORWARDED   TCP Flags: ACK, FIN
Mar  2 05:49:22.558   172.23.129.66:55166            web/nginx-695fc7b69-jv4q7:80   to-endpoint   FORWARDED   TCP Flags: ACK
```
I sometimes see the policy getting applied correctly, but sometimes it doesn't work as expected. Sometimes I see this issue when I modify the CNP or re-schedule pods on other nodes. I start seeing the unexpected behavior and not sure what I might be missing here.

I had this working fine with kube-proxy enabled. Global deny all always worked as expected. With kube-proxy, I had to set `externalTrafficPolicy: local` in service to avoid SNAT and have client IP preserved when evaluating the CNP. I am trying to test it with kube-proxy disabled now to see if CNP works there without requiring the externalTrafficPolicy change.

However, I am not getting expected behavior which I was expecting for global deny all, hence confused as to why this might be happening. Even without any CNP to allow traffic, I still see traffic reaching app and confused as to why global CCNP is not dropping it with kube-proxy disabled.

### Cilium Version

Client: 1.9.6 38dd27a 2021-04-20T14:57:11-07:00 go version go1.15.11 linux/amd64
Daemon: 1.9.6 38dd27a 2021-04-20T14:57:11-07:00 go version go1.15.11 linux/amd64

### Kernel Version

5.4.158-5.4.7-amd64

### Kubernetes Version

Client Version: version.Info{Major:"1", Minor:"20", GitVersion:"v1.20.12+rke2r1", GitCommit:"4bf2e32bb2b9fdeea19ff7cdc1fb51fb295ec407", GitTreeState:"clean", BuildDate:"2021-10-28T16:49:46Z", GoVersion:"go1.15.15b5", Compiler:"gc", Platform:"linux/amd64"}
Server Version: version.Info{Major:"1", Minor:"20", GitVersion:"v1.20.12+rke2r1", GitCommit:"4bf2e32bb2b9fdeea19ff7cdc1fb51fb295ec407", GitTreeState:"clean", BuildDate:"2021-10-28T16:49:46Z", GoVersion:"go1.15.15b5", Compiler:"gc", Platform:"linux/amd64"}

### Code of Conduct

- [X] I agree to follow this project's Code of Conduct

**Comment by aditighag** [comment]
>Sometimes I see this issue when I modify the CNP or re-schedule pods on other nodes.

The next time the issue happens, try to monitor whether the traffic incoming to the cluster is directed to the node(s) that are hosting the nodeport service backend(s). This traffic would be dropped based on their CCNP. 
With kube-proxy replacement, did you set `externalTrafficPolicy` to local?

**Comment by rahulait** [comment]
With kubeProxyReplacement set to "strict", I don't have externalTrafficPolicy set to local. So it would be set to default cluster.

Here are more logs from my cluster. I am seeing traffic allowed even with just the above specified CCNP which should deny the traffic.

My pods are running on two different nodes (.207 and .211).
```
root@172.25.172.206:~# kubectl get pods -n web -o wide | grep nginx
nginx-695fc7b69-8xlbz    1/1     Running   0          13m   172.23.131.39    a172-25-172-211.deploy.test.com   <none>           <none>
nginx-695fc7b69-mj2nc    1/1     Running   0          13m   172.23.130.18    a172-25-172-207.deploy.test.com   <none>           <none>
root@172.25.172.206:~#

root@172.25.172.206:~# kubectl get svc -n web
NAME    TYPE           CLUSTER-IP      EXTERNAL-IP      PORT(S)          AGE
nginx   LoadBalancer   172.23.27.246   172.25.172.222   4080:31502/TCP   11m
root@172.25.172.206:~#
```
Cilium status:
```
root@172.25.172.206:~# k get pods -o wide | grep cilium | grep -v 'node' | grep -v 'operator'
cilium-6lfnm                                                             1/1     Running     0          22m     172.25.172.207   a172-25-172-207.deploy.test.com   <none>           <none>
cilium-ftmjd                                                             1/1     Running     0          22m     172.25.172.211   a172-25-172-211.deploy.test.com   <none>           <none>
cilium-h6csn                                                             1/1     Running     0          22m     172.25.172.210   a172-25-172-210.deploy.test.com   <none>           <none>
cilium-htvfh                                                             1/1     Running     0          22m     172.25.172.206   a172-25-172-206.deploy.test.com   <none>           <none>
root@172.25.172.206:~#
```

I see the incoming traffic IP as proxy IP(172.23.129.92) in one of the cilium pod on .210 node.
Hubble logs:
```
root@172.25.172.206:~# k exec cilium-6lfnm -- hubble observe --since 3m --pod web/nginx-695fc7b69-mj2nc
TIMESTAMP             SOURCE                         DESTINATION                    TYPE          VERDICT     SUMMARY
Mar  2 21:50:27.380   172.23.129.92:52234            web/nginx-695fc7b69-mj2nc:80   L3-Only       FORWARDED   TCP Flags: SYN
Mar  2 21:50:27.380   172.23.129.92:52234            web/nginx-695fc7b69-mj2nc:80   to-endpoint   FORWARDED   TCP Flags: SYN
Mar  2 21:50:27.380   web/nginx-695fc7b69-mj2nc:80   172.23.129.92:52234            to-overlay    FORWARDED   TCP Flags: SYN, ACK
Mar  2 21:50:27.383   172.23.129.92:52234            web/nginx-695fc7b69-mj2nc:80   to-endpoint   FORWARDED   TCP Flags: ACK
Mar  2 21:50:27.383   172.23.129.92:52234            web/nginx-695fc7b69-mj2nc:80   to-endpoint   FORWARDED   TCP Flags: ACK, PSH
Mar  2 21:50:27.383   web/nginx-695fc7b69-mj2nc:80   172.23.129.92:52234            to-overlay    FORWARDED   TCP Flags: ACK, PSH
Mar  2 21:50:27.386   172.23.129.92:52234            web/nginx-695fc7b69-mj2nc:80   to-endpoint   FORWARDED   TCP Flags: ACK, FIN
Mar  2 21:50:27.386   web/nginx-695fc7b69-mj2nc:80   172.23.129.92:52234            to-overlay    FORWARDED   TCP Flags: ACK, FIN
Mar  2 21:50:27.389   172.23.129.92:52234            web/nginx-695fc7b69-mj2nc:80   to-endpoint   FORWARDED   TCP Flags: ACK
root@172.25.172.206:~#
```
Cilium pod on node .210 with proxy IP as 172.23.129.92:
```
root@a172-25-172-210:/home/cilium# cilium status
KVStore:                Ok   Disabled
Kubernetes:             Ok   1.20 (v1.20.12+rke2r1) [linux/amd64]
Kubernetes APIs:        ["cilium/v2::CiliumClusterwideNetworkPolicy", "cilium/v2::CiliumEndpoint", "cilium/v2::CiliumNetworkPolicy", "cilium/v2::CiliumNode", "core/v1::Namespace", "core/v1::Node", "core/v1::Pods", "core/v1::Service", "discovery/v1beta1::EndpointSlice", "networking.k8s.io/v1::NetworkPolicy"]
KubeProxyReplacement:   Strict   [eth0 (Direct Routing)]
Cilium:                 Ok       OK
NodeMonitor:            Listening for events on 4 CPUs with 64x4096 of shared memory
Cilium health daemon:   Ok
IPAM:                   IPv4: 11/255 allocated from 172.23.129.0/24,
BandwidthManager:       Disabled
Host Routing:           Legacy
Masquerading:           BPF   [eth0]   172.23.129.0/24
Controller Status:      54/54 healthy
Proxy Status:           OK, ip 172.23.129.92, 0 redirects active on ports 10000-20000
Hubble:                 Ok              Current/Max Flows: 4096/4096 (100.00%), Flows/s: 13.99   Metrics: Disabled
Cluster health:         4/4 reachable   (2022-03-02T22:00:48Z)
root@a172-25-172-210:/home/cilium#

root@a172-25-172-206:/home/cilium# cilium node list
Name                              IPv4 Address     Endpoint CIDR     IPv6 Address   Endpoint CIDR
a172-25-172-206.deploy.test.com   172.25.172.206   172.23.128.0/24
a172-25-172-207.deploy.test.com   172.25.172.207   172.23.130.0/24
a172-25-172-210.deploy.test.com   172.25.172.210   172.23.129.0/24
a172-25-172-211.deploy.test.com   172.25.172.211   172.23.131.0/24
root@a172-25-172-206:/home/cilium#
```

Doing a tcpdump on .210, I can see traffic coming to it.
```
root@172.25.172.210:~# tcpdump -i eth0 src 198.18.135.71
tcpdump: verbose output suppressed, use -v or -vv for full protocol decode
listening on eth0, link-type EN10MB (Ethernet), capture size 262144 bytes
22:23:14.807608 IP 198.18.135.71.45103 > 172.25.172.222.4080: Flags [S], seq 2155867570, win 64240, options [mss 1350,sackOK,TS val 4279031727 ecr 0,nop,wscale 7], length 0
22:23:14.884924 IP 198.18.135.71.45103 > 172.25.172.222.4080: Flags [.], ack 3184923974, win 502, options [nop,nop,TS val 4279031804 ecr 1262692819], length 0
22:23:14.884990 IP 198.18.135.71.45103 > 172.25.172.222.4080: Flags [P.], seq 0:83, ack 1, win 502, options [nop,nop,TS val 4279031804 ecr 1262692819], length 83
22:23:14.962012 IP 198.18.135.71.45103 > 172.25.172.222.4080: Flags [.], ack 239, win 501, options [nop,nop,TS val 4279031882 ecr 1262692897], length 0
22:23:14.962234 IP 198.18.135.71.45103 > 172.25.172.222.4080: Flags [.], ack 854, win 501, options [nop,nop,TS val 4279031882 ecr 1262692897], length 0
22:23:14.962274 IP 198.18.135.71.45103 > 172.25.172.222.4080: Flags [F.], seq 83, ack 854, win 501, options [nop,nop,TS val 4279031882 ecr 1262692897], length 0
22:23:15.038939 IP 198.18.135.71.45103 > 172.25.172.222.4080: Flags [.], ack 855, win 501, options [nop,nop,TS val 4279031959 ecr 1262692973], length 0
^C
7 packets captured
7 packets received by filter
0 packets dropped by kernel
2 packets dropped by interface
root@172.25.172.210:~#
```

Is it that when the traffic is getting routed from node .210 to either .207 or .211, it is changing the source IP with the proxy IP and when CCNP is evaluated, it thinks the traffic is coming from within the cluster?
If thats the case, I am not sure why it works with kube-proxy enabled. It should also hit the same issue there. Or is there something extra which cilium without kube-proxy does which is causing this behavior?

**Comment by joestringer** [comment]
> With kubeProxyReplacement set to "strict", I don't have externalTrafficPolicy set to local. So it would be set to default cluster.

Cilium's kube proxy replacement would perform NAT just like kube-proxy would if you didn't use externalTrafficPolicy=local. That explains why the traffic shows up as coming "from a remote node", and why that then matches the "cluster" policy and allows the traffic.

Here's the docs on how to preserve client source IPs as part of kube-proxy replacement: https://docs.cilium.io/en/stable/gettingstarted/kubeproxy-free/#client-source-ip-preservation

**Comment by rahulait** [comment]
Thank you Joe and Aditi. It seems like I should always use externalTrafficPolicy=local for such policies.

I repeated the same steps with kube-proxy enabled and can see CCNP correctly denying traffic even though it detects the source IP as an in-cluster IP.
```
## With kube proxy

root@172.25.172.206:~# k exec cilium-7wvqh -- hubble observe --since 1m --pod web/nginx-695fc7b69-6b9cv
TIMESTAMP             SOURCE                 DESTINATION                    TYPE            VERDICT   SUMMARY
Mar  3 01:48:56.152   172.23.131.111:34986   web/nginx-695fc7b69-6b9cv:80   Policy denied   DROPPED   TCP Flags: SYN
Mar  3 01:48:56.152   172.23.131.111:34986   web/nginx-695fc7b69-6b9cv:80   Policy denied   DROPPED   TCP Flags: SYN
Mar  3 01:48:57.159   172.23.131.111:34986   web/nginx-695fc7b69-6b9cv:80   Policy denied   DROPPED   TCP Flags: SYN
Mar  3 01:48:57.159   172.23.131.111:34986   web/nginx-695fc7b69-6b9cv:80   Policy denied   DROPPED   TCP Flags: SYN
root@172.25.172.206:~#
```
Maybe its implementation specific and it's always better to use externalTrafficPolicy.

**Comment by rahulait** [comment]
Is there a flag in cilium's config using which we can also add externalTrafficPolicy=local by default so that it gets applied globally than requiring each service which is using nodeport or loadbalancer to add it?

**Comment by joestringer** [comment]
> Seems like its implementation specific where cilium with kube-proxy denies traffic but cilium without kube-proxy considers it coming from cluster and it's always better to use externalTrafficPolicy.

OK, thanks for testing this. I think ideally we'd have the same behaviour for both implementations, but it's useful to at least know that the behaviour does differ. Maybe we can do something about this (or at least make some sort of docs update to warn users in future).

> Is there a flag in cilium's config using which we can also add externalTrafficPolicy=local by default so that it gets applied globally than requiring each service which is using nodeport or loadbalancer to add it?

I don't think that configuring externalTrafficPolicy is in the domain of Cilium's control, presumably when you create the services you should configure this?

**Comment by joestringer** [comment]
One more piece of information that might be useful to know here for any future improvements - are you using tunneling mode?

**Comment by rahulait** [comment]
Thanks Joe. Yes, I am using tunneling mode and used metallb for loadbalancer IPs.

**Comment by brb** [comment]
Reproduced locally. In the case of kube-proxy, the VNI=2 (`ID_WORLD`), while with the kube-proxy-replacement - 6 (`ID_REMOTE_HOST`). Next step is to check what `SECLABEL` we set for bpf_host instances which we attach to the native dev which does the redirect.
