### ISSUE TITLE
LoadBalancer traffic dropped on non-bridge netdev attachment: post-DNAT skb floods out ingress device (companion case to #45582)

### ISSUE THREAD

**Issue by flg77** [cilium/cilium#45982]
### Summary

When Cilium is attached to a non-bridge netdev (in my repro: an `active-backup` bond carrying the node's LAN IP) with `kubeProxyReplacement: true`, **L4 LoadBalancer traffic from external L2 clients never reaches the backend pod**. The DNAT happens, but the post-DNAT skb is forwarded back out the same bond/ethernet that received it, instead of being delivered to the destination pod's veth via `cilium_host`.

The bridge variant of the same regression is fixed by [#45582](https://github.com/cilium/cilium/pull/45582), but the fix is gated on `proxy_redirect_via_cilium_net` which is only set for bridge attachments. Plain netdev attachment hits a different code path that still drops/floods the packet.

### Cilium versions tested (all reproduce)

- `1.19.3`
- `1.19.4` (which carries the bridge-only fix from #45582)
- `1.20.0-pre.2`

### Environment

- Kernel `6.12.0` (RHEL 10 derivative)
- Single-node Kubernetes (kubeadm)
- Cilium values:
  ```yaml
  devices: <bond device, e.g. bond0>
  directRoutingDevice: <same bond>
  kubeProxyReplacement: true
  routingMode: tunnel        # vxlan
  cni:
    exclusive: false         # multus chained
  extraConfig:
    enable-tcx: "false"      # workaround that lets cil_from_netdev fire at all on this kernel
  ```
- MetalLB v0.14.x in L2 mode advertising a LoadBalancer IP on the same LAN as the bond
- No `CiliumNetworkPolicy` / `CiliumClusterwideNetworkPolicy` in play
- The bond has 2 ethernet slaves, `fail_over_mac=active`, `miimon=100` — bond MAC tracks the active slave (= one of the slaves' permanent MAC); identical L2 identity to what a bridge atop the same bond would have

### Symptom

External LAN client `C` (a separate physical host on the same L2 as the bond) does `curl https://<LB-IP>/`:

1. `C` ARPs `<LB-IP>` → MetalLB's L2 responder on the node replies with the bond's MAC. ✅
2. `C` sends TCP SYN: `src=C dst=<LB-IP>:443`.
3. Frame reaches the node on bond0. `cil_from_netdev-bond0` runs.
4. Service lookup succeeds (cilium-dbg service list shows `<LB-IP>:443 -> <PodIP>:8443 (active)`).
5. **The post-DNAT skb is then transmitted back out bond0 with `dst=<PodIP>:8443`**, never reaches `lxc<podveth>` and never reaches the backend pod. SYN is repeated/retransmitted; no SYN-ACK; `curl` returns HTTP 000 after the timeout.

### tcpdump

```
$ tcpdump -i any -nn host <CLIENT_IP> or host <POD_IP>
hh:mm:ss.ssssss bond0      Out IP <CLIENT_IP>.<port> > <POD_IP>.8443: Flags [S], seq …
hh:mm:ss.ssssss <slave_if> Out IP <CLIENT_IP>.<port> > <POD_IP>.8443: Flags [S], seq …
# repeats while curl retries; never appears on any lxc* or cilium_host
```

The same SYN is visible on `bond0 Out` and the active slave's `Out` direction. Never on `lxc*`. Never on `cilium_host`. So:
- DNAT happened (dst is the pod IP, not the LB IP).
- But the egress device chosen is `bond0`, not the pod's veth.

### Routing table on the node

```
default via <GW> dev bond0 …
<POD_CIDR> via <CILIUM_HOST_IP> dev cilium_host …
```

So a packet with `dst=<POD_IP>` should route via `cilium_host`, not bond0. Something earlier in the bpf datapath is overriding that decision.

### `cilium-dbg monitor`

`--type drop` shows nothing relevant. `--type trace` shows no event for the inbound LAN SYN (no `from-network` or `to-stack` for that flow). Cilium does not report a drop, but the packet never reaches the endpoint.

### Reproduction (minimal)

A single-node cluster with the values above + a MetalLB LB service is enough. To reproduce without a second physical machine, an `ip netns` + macvlan child of the bond suffices:

```bash
sudo ip netns add lan-probe
sudo ip link add link bond0 name pmac type macvlan mode bridge
sudo ip link set pmac netns lan-probe
sudo ip -n lan-probe link set pmac up
sudo ip -n lan-probe addr add <unused-LAN-ip>/<prefix> dev pmac
sudo ip -n lan-probe route add default via <gateway> dev pmac

sudo ip netns exec lan-probe ping -c2 <gateway>      # ✅ works
sudo ip netns exec lan-probe curl -k --max-time 5 https://<LB-IP>/   # ❌ HTTP 000
```

### Bridge variant for contrast (works on 1.19.4+)

If I take the same bond, put it into a Linux bridge `br0` that carries the node IP, and set Cilium `devices: br0` / `directRoutingDevice: br0`, the LB IP becomes reachable from the same netns probe. This is the case #45582 fixed via `proxy_redirect_via_cilium_net`.

### Suspected root cause

In `bpf/lib/nodeport.h` `nodeport_svc_lb4()` (and the v6 counterpart), the proxy-hairpin branch only runs when `CONFIG(enable_tproxy) || CONFIG(proxy_redirect_via_cilium_net)`. `proxy_redirect_via_cilium_net` is set by `bpf-loader-ctxsetup.go` only for bridge devices. For non-bridge netdev attachment, the code falls through to the "Pass the packet straight to the proxy, without redirecting via cilium_host" path — which then somehow chooses the same netdev as egress instead of `cilium_host`.

### Workarounds tried (none fix it on netdev attachment)

- `enable-host-legacy-routing: "false"` + `enable-bpf-masquerade: "true"` (BPF host routing): same flood
- `routing-mode` `tunnel` and `native`: same flood (same bpf path)
- Bumping `1.19.3 → 1.19.4 → 1.20.0-pre.2`: same flood
- `enable-tcx: "false"` is required as a precondition (per a separate known regression), but not sufficient

### Workaround that does fix it

Attach Cilium to a Linux bridge that carries the node IP (instead of the bond directly). The bridge case is covered by #45582 on 1.19.4 and later.

### Why this matters

For users running Cilium on bare-metal nodes whose host IP is on a bonded/SR-IOV/plain physical NIC (no bridge), and exposing services via MetalLB or BGP in L2 mode on the same L2 as the host IP, the LB path is non-functional. Working around by inserting a bridge is intrusive (especially for KubeVirt setups that want macvlan/macvtap on the bond, which is mutually exclusive with the bond being a bridge slave).

**Comment by flg77** [comment]
Update: tested explicitly on **bridge** attachment with v1.19.4 (which carries #45582) — same exact flood pattern. So this bug is independent of #45582, not a "non-bridge variant" of it.

The release note for #45582 describes "L7 LoadBalancer and Ingress traffic" specifically. Re-reading the PR diff confirms: the fix touches the proxy-hairpin branch inside `nodeport_svc_lb4()`, guarded by `CONFIG(enable_tproxy) || CONFIG(proxy_redirect_via_cilium_net)`. Both conditions are about the **L7 proxy** path (Envoy / Ingress). The pure L4 case (MetalLB LoadBalancer service → backend pod, no L7 proxy in the chain) doesn't enter the proxy-hairpin branch at all, so the bridge-only check is irrelevant for what I'm reporting.

### Re-tested 2026-05-14

Same minimal `ip netns + macvlan` repro, same `curl https://<LB-IP>/`, same `tcpdump` flood out the attached device:

| Cilium version | Attachment | LB-from-LAN |
|---|---|---|
| 1.19.3 | bridge (bond enslaved) | ❌ HTTP 000 (8s timeout) |
| 1.19.3 | bond directly (no bridge) | ❌ HTTP 000 |
| **1.19.4** | **bridge** | **❌ HTTP 000** |
| 1.19.4 | bond directly | ❌ HTTP 000 |
| 1.20.0-pre.2 | bond directly | ❌ HTTP 000 |

Every combination, same flood:

```
veth*  P   IP <CLIENT_IP>.<port> > <POD_IP>.8443: Flags [S]
bond0  Out IP <CLIENT_IP>.<port> > <POD_IP>.8443: Flags [S]
ethX   Out IP <CLIENT_IP>.<port> > <POD_IP>.8443: Flags [S]
```

DNAT happens (dst is the pod IP, not the LB IP); egress device chosen is the attached netdev/bond/bridge-uplink, not `cilium_host` and not the pod's `lxc*` veth. No drop reported in `cilium-dbg monitor`. No trace event for the inbound LAN flow in `cilium-dbg monitor --type trace`.

### What still works

- Host-originated traffic to the LB IP (e.g. `curl https://<LB-IP>/` from the host where Cilium runs) returns the expected response — the socket-LB path on the host is fine.
- Pod-to-LB-IP works (cluster-internal LB).
- Direct ping/SSH to the host IP from external clients works (no DNAT involved).
- `cilium-dbg service list` shows the LB service correctly mapped to the backend pod.

### Smallest delta from working to broken

In my repro, the L7 path (Envoy / Cilium Ingress / Gateway API) is **not** in the chain. The service is a plain `Service: type=LoadBalancer` with MetalLB advertising the VIP. Backend pod is Traefik but the request is terminated by Traefik (the L7 hop happens *after* the SYN reaches the pod, which it doesn't).

So this isn't about proxy redirect at all — it's about the basic LB DNAT egress device decision on the bpf datapath.

### Reproduction

Already in the original report. Notable: a `kubectl exec` into the Cilium pod and `cilium-dbg bpf lb list` shows the service entry exists; `cilium-dbg bpf nat list` shows nothing for the flow (because conntrack never completes — only retransmitted SYNs).

If a maintainer can suggest what additional `cilium-dbg`/`bpftool` output would help narrow this down, happy to provide.

**Comment by ysksuzuki** [comment]
Thank you for the detailed report. For future issues, could you please use the Bug Report template? Otherwise, the issue may not get the required labels and may be missed by the normal triage process.
https://docs.cilium.io/en/latest/contributing/development/reviewers_committers/triage/#issue-triage-process

To help determine whether this is a regression, could you let us know the latest Cilium version where this setup worked as expected?
Also, could you attach a Cilium sysdump from the affected state?

**Comment by flg77** [comment]
Thanks for the triage, and noted on the Bug Report template — I'll use it for any future reports.

## Regression

I can't point to a Cilium version where this worked. This cluster is recent: Cilium was first installed on it at **v1.19.3**, and external-LAN → LoadBalancer-VIP traffic has been non-functional since that first version. No earlier Cilium release ever ran on the node, so I have no known-good baseline and can't confirm this as a regression from a previously-working release. I framed it alongside #45582 only because that fix is itself classed as a regression in the same datapath area — the plain-L4 path described here may simply never have worked for this attachment type.

## Sysdump

I can't attach a raw `cilium sysdump` here — this is a private network and the dump isn't safely redactable for a public issue: it carries the node's routable addressing (including a public IPv6 prefix), a few hundred MAC addresses, the full pod/namespace inventory, and bpf map dumps that encode IPs/MACs as raw hex bytes that can't be redacted without corrupting the maps.

Instead, here is the targeted datapath state for the broken flow plus a fresh reproduction. **All addresses below are consistently remapped to documentation ranges** — `198.51.x` = the external LAN, `10.244.x` = pod CIDR, `10.96.x` = service CIDR, `198.18.x` = a second L2 segment; MACs and hostnames are placeholders. If a full sysdump is genuinely required I'm happy to share one privately with a maintainer.

### Environment (form fields)

- **Cilium:** v1.19.4 (`v1.19.4-95e477fd`) — also reproduced on v1.19.3 and v1.20.0-pre.2
- **Kernel:** 6.12.0 (RHEL 10 derivative)
- **Kubernetes:** v1.35.4, single-node kubeadm
- Cilium is attached to a Linux **bridge** (`br-mgmt`) that enslaves an active-backup bond (`bond0` ← `eno1` + `eno2`); the bridge carries the node IP. `kubeProxyReplacement: true`, `routingMode: tunnel` (vxlan), `enable-tcx: false` (→ Legacy TC attach).

> This fresh capture is the **bridge-attachment** case, and it floods identically to the netdev case — confirming my earlier follow-up. The "bridge variant works" line in the original report is superseded.

<details><summary><code>cilium status</code> — datapath summary</summary>

```
KVStore:               Disabled
Kubernetes:            Ok   1.35 (v1.35.4) [linux/amd64]
KubeProxyReplacement:  True   [br-mgmt 198.51.12.91 ... (Direct Routing)]
Cilium:                Ok   1.19.4 (v1.19.4-95e477fd)
Routing:               Network: Tunnel [vxlan]   Host: Legacy
Attach Mode:           Legacy TC
Device Mode:           veth
Masquerading:          IPTables [IPv4: Enabled, IPv6: Disabled]

KubeProxyReplacement Details:
  Status:              True
  Socket LB:           Enabled   (Coverage: Full)
  Devices:             br-mgmt 198.51.12.91 ... (Direct Routing)
  Mode:                SNAT
  Backend Selection:   Random
  Services:
  - ClusterIP:    Enabled
  - NodePort:     Enabled (Range: 30000-32767)
  - LoadBalancer: Enabled
  - externalIPs:  Enabled
  - HostPort:     Enabled
```
</details>

<details><summary><code>cilium config</code> — relevant datapath keys</summary>

```
Devices                  : [br-mgmt]
RoutingMode              : tunnel
EnableTCX                : false
EnableHostLegacyRouting  : true
EnableIPv4Masquerade     : true
EnableBPFMasquerade      : false
NodePortAcceleration     : disabled
BPFSocketLBHostnsOnly    : false
```
</details>

### The LB service is correctly programmed

`cilium service list` and `cilium bpf lb list` both show the LoadBalancer VIP mapped to the backend pod — the control plane is fine:

```
# cilium service list  (VIP = 198.51.12.230)
51   198.51.12.230:80/TCP    LoadBalancer   1 => 10.244.0.77:8000/TCP (active)
52   198.51.12.230:443/TCP   LoadBalancer   1 => 10.244.0.77:8443/TCP (active)

# cilium bpf lb list
198.51.12.230:80/TCP  (1)   10.244.0.77:8000/TCP (51) (1)
198.51.12.230:443/TCP (1)   10.244.0.77:8443/TCP (52) (1)
```

### Reproduction (fresh capture)

External LAN client `198.51.12.252` (an `ip netns` + veth attached to the bridge) runs `curl https://198.51.12.230/`:

- from the external client: **HTTP 000**, 6 s timeout (both `:80` and `:443`)
- from the host itself: **HTTP 404 in 12 ms** — reaches the backend fine (the socket-LB path works)

**`tcpdump` — the post-DNAT SYN floods out the bridge uplink instead of reaching the pod:**

```
07:44:04.605943 v0    P   IP 198.51.12.252.51766 > 10.244.0.77.8443: Flags [S]   # arrives, already DNAT'd to the pod IP
07:44:04.605982 bond0 Out IP 198.51.12.252.51766 > 10.244.0.77.8443: Flags [S]   # ...re-emitted out the bond
07:44:04.605984 eno1  Out IP 198.51.12.252.51766 > 10.244.0.77.8443: Flags [S]   # ...and the physical slave
07:44:05.649466 v0    P   IP 198.51.12.252.51766 > 10.244.0.77.8443: Flags [S]   # SYN retransmit, identical pattern
... repeats 6x over 6 s; never seen on any lxc* veth or on cilium_host ...
```

The SYN is DNAT'd (dst = pod IP `10.244.0.77`, not the VIP), but the egress device chosen is the bridge uplink (`bond0` / `eno1`), not the backend pod's `lxc*` veth.

**`cilium monitor -v --type trace --type drop`** running across the whole repro window:

- **0 events** mentioning the client `198.51.12.252` or the flow to `10.244.0.77:8443`
- **0 drop events**

…yet a healthy host→pod flow to the *same backend* in the *same window* produces normal trace events:

```
-> endpoint 1038 ... ifindex lxcb7cdd0883ad7 ... 10.244.0.127:34220 -> 10.244.0.77:8443 tcp SYN
-> stack         ...                          10.244.0.77:8443 -> 10.244.0.127:34220 tcp SYN, ACK
-> endpoint 1038 ... ifindex lxcb7cdd0883ad7 ... 10.244.0.127:34220 -> 10.244.0.77:8443 tcp ACK
```

So the LB datapath silently mis-forwards the external SYN: no trace event, no drop, DNAT applied, egress device = the ingress bridge uplink.

Happy to provide any other specific `cilium-dbg` / `bpftool` output that would help narrow this down.

**Comment by ysksuzuki** [comment]
Just to clarify, you mentioned the proxy-hairpin path, but is this actually using L7LB? From the outputs you shared, this looks like a regular L4 LoadBalancer service, not an L7LB-backed service. For example, when L7LB is used, I would expect `cilium-dbg bpf lb list` to show an entry like this:

```
172.18.255.200:80/TCP (0)    0.0.0.0:0 (19) (0) [LoadBalancer, l7-load-balancer] (L7LB Proxy Port: 11355)
```

In that case, traffic to the L7LB frontend would be redirected to the shared Envoy proxy. However, your LB map output appears to point directly to the backend pod IP/port instead, e.g. `<LB-IP>:443 -> <PodIP>:8443`.

If this is regular L4LB traffic, and the selected backend is local to the node that received the LoadBalancer traffic, I would expect the packet to be DNATed on the LB node and then delivered to the local endpoint. With BPF host routing enabled, that should go through the local-delivery path around `nodeport.h` and eventually `ipv4_local_delivery`, rather than the Envoy proxy path:

https://github.com/cilium/cilium/blob/v1.19.4/bpf/lib/nodeport.h#L2932
https://github.com/cilium/cilium/blob/v1.19.4/bpf/bpf_host.c#L786-L787

**Comment by flg77** [comment]
Thanks @ysksuzuki — confirming both points, and I think the host-routing mode is the crux.

**It's regular L4LB, not L7LB.** There's no Envoy/L7 redirect anywhere in this cluster — no `CiliumEnvoyConfig`/`CiliumClusterwideEnvoyConfig` objects exist at all. The service is a plain `Service type=LoadBalancer` (MetalLB VIP), `externalTrafficPolicy: Cluster`. As in my earlier comment, `bpf lb list` maps the frontend straight to the backend pod — `198.51.12.230:443 → 10.244.0.223:8443 [LoadBalancer]`, with **no** `l7-load-balancer` flag and no proxy port. The `[LoadBalancer, l7-load-balancer] (L7LB Proxy Port: …)` form never appears.

**Backend is local.** Single-node cluster, so the chosen backend is always on the node that receives the LB traffic — exactly the local-delivery case you describe.

**But BPF host routing is not active here.** `cilium status` reports:

```
Routing:      Network: Tunnel [vxlan]   Host: Legacy
Attach Mode:  Legacy TC
```

I never set `enable-host-legacy-routing` — Cilium auto-falls back to **legacy host routing** because the native device is a Linux **bridge** (`br-mgmt`, enslaving the bond that carries the node IP); BPF host routing isn't supported on a bridged device.

So `ipv4_local_delivery` (the `nodeport.h` L2932 → `bpf_host.c` L786-787 path you linked) is the **BPF-host-routing** local-delivery path, and it's never entered here. Under legacy host routing the post-DNAT skb is passed up to the kernel stack, and the FIB egresses the (now pod-dest) packet back out the bridge uplink (bond0 → physical NIC) instead of delivering it to the backend's `lxc*` veth — which matches the flood capture exactly (`Out` on bond0/ethX, never on the pod veth).

**Question:** is L4LB → local-backend expected to work under **legacy** host routing at all, or is BPF host routing effectively required for the local-delivery path? If it's the latter, then external-LAN → LoadBalancer-VIP is structurally unsupported whenever Cilium attaches to a bridge device (bridge ⇒ forced legacy host routing) — i.e. "unsupported topology" rather than a datapath bug. Happy to test a specific toggle you'd suggest (e.g. a non-bridged `devices:` layout with BPF host routing on) and report back.

**Comment by ysksuzuki** [comment]
> Cilium auto-falls back to legacy host routing because the native device is a Linux bridge

I'm not aware of a bridge-specific fallback rule in Cilium. The fallback code is here:
https://github.com/cilium/cilium/blob/5023c8679dd03deed0dc5d30d20cfeacc2ac2fc4/pkg/kpr/initializer/kube_proxy_replacement.go#L61

In general, LB VIP traffic DNATed to a local backend should not require BPF host routing. It should also work with legacy host routing. That said, since legacy host routing passes the packet through the regular kernel stack, it can be affected by host-side routing, for example iptables rules installed by other software. So if the packet is really being routed back out via the bridge/bond instead of to the local pod veth, I would suggest tracing the packet with tools such as `pwru` or `tcpdump` to see where it leaves the expected path.
https://github.com/cilium/cilium/blob/5f6bee0b3adc5cbc2b1a71cd787b19937f3f96cb/bpf/bpf_host.c#L753
