### ISSUE TITLE
Self node IP connectivity problems

### ISSUE THREAD

**Issue by Antiarchitect** [cilium/cilium#10873]
## Support
CentOS 7, Kernel: 5.5.13-1.el7.elrepo.x86_64
Kubernetes 1.16.8
Cilium 1.7.2 via official Helm chart.
Parameters:
```  
  global:
    bpf:
      waitForMount: true
    kubeProxyReplacement: strict
    k8sServiceHost: k8s.enapter.ninja
    k8sServicePort: 6443
    prometheus:
      enabled: true
      port: 19090
  agent:
    maxUnavailable: 1
```
kube-proxy daemonset is deleted from kube-system and not present

I have strange connectivity problems in my bare-metal k8s cluster.
I have five worker nodes with **one external and one internal interface**. And **node Ip is set to an internal interface** and the **default route is set to the internal network router** that has perfect access to the world.

**Within the pod, I can reach all external IPs of the other nodes perfectly, but for the same node's external IP nothing passes**. The one single pod that can reach its node internal IP is cilium-agent pod.
If I ssh to the worker node I can reach its own external IP perfectly.

The only option that changes anything I've discovered is --enable-endpoint-routes=true - unfortunately all external node IPs are unreachable with it.

Cilium Operator logs are clean:
```
level=info msg="Cilium Operator 1.7.2 f1c787ee6 2020-04-03T11:47:41-07:00 go version go1.13.9 linux/amd64" subsys=cilium-operator
level=info msg="Starting apiserver on address 127.0.0.1:9234" subsys=cilium-operator
level=info msg="Starting apiserver on address [::1]:9234" subsys=cilium-operator
level=info msg="Establishing connection to apiserver" host="https://xxx.xxx.xxx:6443" subsys=k8s
level=info msg="Connected to apiserver" subsys=k8s
level=info msg="Retrieved node information from kubernetes" nodeName=xxx.xxx.xxx subsys=k8s
level=info msg="Received own node information from API server" ipAddr.ipv4=192.168.202.55 ipAddr.ipv6="<nil>" nodeName=xxx.xxx.xxx subsys=k8s v4Prefix=10.32.7.0/24 v6Prefix="<nil>"
level=info msg="Starting to garbage collect stale CiliumEndpoint custom resources..." subsys=cilium-operator
level=info msg="Starting to garbage collect stale CiliumNetworkPolicy status field entries..." subsys=cilium-operator
level=info msg="Starting to garbage collect stale CiliumClusterwideNetworkPolicy status field entries..." subsys=cilium-operator
level=info msg="Initialization complete" subsys=cilium-operator
level=info msg="Starting CRD identity garbage collector with 15m0s interval..." subsys=cilium-operator
```
No NetworkPolicy, CiliumNetworkPolicy or CiliumClusterwideNetworkPolicy is present in any namespace.

Cilium agent IP route:
```
root@worker-5:~# ip route
default via 192.168.202.1 dev enp5s0f1
10.32.0.0/24 via 10.32.7.185 dev cilium_host src 10.32.7.185 mtu 1450
10.32.1.0/24 via 10.32.7.185 dev cilium_host src 10.32.7.185 mtu 1450
10.32.2.0/24 via 10.32.7.185 dev cilium_host src 10.32.7.185 mtu 1450
10.32.5.0/24 via 10.32.7.185 dev cilium_host src 10.32.7.185 mtu 1450
10.32.6.0/24 via 10.32.7.185 dev cilium_host src 10.32.7.185 mtu 1450
10.32.7.0/24 via 10.32.7.185 dev cilium_host src 10.32.7.185 mtu 1450
10.32.7.185 dev cilium_host scope link
10.32.9.0/24 via 10.32.7.185 dev cilium_host src 10.32.7.185 mtu 1450
10.32.10.0/24 via 10.32.7.185 dev cilium_host src 10.32.7.185 mtu 1450
10.32.11.0/24 via 10.32.7.185 dev cilium_host src 10.32.7.185 mtu 1450
10.32.12.0/24 via 10.32.7.185 dev cilium_host src 10.32.7.185 mtu 1450
95.168.167.192/26 dev enp7s0f0 proto kernel scope link src 95.168.167.248
169.254.0.0/16 dev enp7s0f0 scope link metric 1002
169.254.0.0/16 dev enp5s0f1 scope link metric 1005
172.17.0.0/16 dev docker0 proto kernel scope link src 172.17.0.1 linkdown
192.168.202.0/24 dev enp5s0f1 proto kernel scope link src 192.168.202.55
```

When I perform curl https request from the target pod to pod's node external IP:

```
tcpdump -i any -nn port 443
tcpdump: verbose output suppressed, use -v or -vv for full protocol decode
listening on any, link-type LINUX_SLL (Linux cooked), capture size 262144 bytes
11:42:07.563388 IP 10.32.7.43.50758 > 95.168.167.248.443: Flags [S], seq 3832255956, win 64860, options [mss 1410,sackOK,TS val 1776234131 ecr 0,nop,wscale 7], length 0
11:42:08.564297 IP 10.32.7.43.50758 > 95.168.167.248.443: Flags [S], seq 3832255956, win 64860, options [mss 1410,sackOK,TS val 1776235132 ecr 0,nop,wscale 7], length 0
11:42:10.612329 IP 10.32.7.43.50758 > 95.168.167.248.443: Flags [S], seq 3832255956, win 64860, options [mss 1410,sackOK,TS val 1776237180 ecr 0,nop,wscale 7], length 0
11:42:14.644228 IP 10.32.7.43.50758 > 95.168.167.248.443: Flags [S], seq 3832255956, win 64860, options [mss 1410,sackOK,TS val 1776241212 ecr 0,nop,wscale 7], length 0
11:42:22.900343 IP 10.32.7.43.50758 > 95.168.167.248.443: Flags [S], seq 3832255956, win 64860, options [mss 1410,sackOK,TS val 1776249468 ecr 0,nop,wscale 7], length 0
11:42:39.284242 IP 10.32.7.43.50758 > 95.168.167.248.443: Flags [S], seq 3832255956, win 64860, options [mss 1410,sackOK,TS val 1776265852 ecr 0,nop,wscale 7], length 0
11:43:11.541242 IP 10.32.7.43.50758 > 95.168.167.248.443: Flags [S], seq 3832255956, win 64860, options [mss 1410,sackOK,TS val 1776298109 ecr 0,nop,wscale 7], length 0
11:44:14.933483 IP 10.32.7.43.52738 > 95.168.167.248.443: Flags [S], seq 3673501491, win 64860, options [mss 1410,sackOK,TS val 1776361501 ecr 0,nop,wscale 7], length 0
11:44:15.988281 IP 10.32.7.43.52738 > 95.168.167.248.443: Flags [S], seq 3673501491, win 64860, options [mss 1410,sackOK,TS val 1776362556 ecr 0,nop,wscale 7], length 0
11:44:18.037296 IP 10.32.7.43.52738 > 95.168.167.248.443: Flags [S], seq 3673501491, win 64860, options [mss 1410,sackOK,TS val 1776364605 ecr 0,nop,wscale 7], length 0
11:44:22.068301 IP 10.32.7.43.52738 > 95.168.167.248.443: Flags [S], seq 3673501491, win 64860, options [mss 1410,sackOK,TS val 1776368636 ecr 0,nop,wscale 7], length 0
11:44:30.388304 IP 10.32.7.43.52738 > 95.168.167.248.443: Flags [S], seq 3673501491, win 64860, options [mss 1410,sackOK,TS val 1776376956 ecr 0,nop,wscale 7], length 0
11:44:46.772242 IP 10.32.7.43.52738 > 95.168.167.248.443: Flags [S], seq 3673501491, win 64860, options [mss 1410,sackOK,TS val 1776393340 ecr 0,nop,wscale 7], length 0
11:45:19.029255 IP 10.32.7.43.52738 > 95.168.167.248.443: Flags [S], seq 3673501491, win 64860, options [mss 1410,sackOK,TS val 1776425597 ecr 0,nop,wscale 7], length 0
11:45:34.225079 IP 10.32.7.43.54034 > 95.168.167.248.443: Flags [S], seq 1279720243, win 64860, options [mss 1410,sackOK,TS val 1776440793 ecr 0,nop,wscale 7], length 0
11:45:35.284263 IP 10.32.7.43.54034 > 95.168.167.248.443: Flags [S], seq 1279720243, win 64860, options [mss 1410,sackOK,TS val 1776441852 ecr 0,nop,wscale 7], length 0
11:45:37.332294 IP 10.32.7.43.54034 > 95.168.167.248.443: Flags [S], seq 1279720243, win 64860, options [mss 1410,sackOK,TS val 1776443900 ecr 0,nop,wscale 7], length 0
11:45:41.364304 IP 10.32.7.43.54034 > 95.168.167.248.443: Flags [S], seq 1279720243, win 64860, options [mss 1410,sackOK,TS val 1776447932 ecr 0,nop,wscale 7], length 0
11:45:49.749323 IP 10.32.7.43.54034 > 95.168.167.248.443: Flags [S], seq 1279720243, win 64860, options [mss 1410,sackOK,TS val 1776456317 ecr 0,nop,wscale 7], length 0
11:46:06.132235 IP 10.32.7.43.54034 > 95.168.167.248.443: Flags [S], seq 1279720243, win 64860, options [mss 1410,sackOK,TS val 1776472700 ecr 0,nop,wscale 7], length 0
```

tcpdump from within cilium-agent:
```
tcpdump -nn -i any port 443 | grep 10.32.7.43
tcpdump: verbose output suppressed, use -v or -vv for full protocol decode
listening on any, link-type LINUX_SLL (Linux cooked), capture size 262144 bytes
11:45:19.029269 IP 10.32.7.43.52738 > 95.168.167.248.443: Flags [S], seq 3673501491, win 64860, options [mss 1410,sackOK,TS val 1776425597 ecr 0,nop,wscale 7], length 0
11:45:19.029308 IP 10.32.7.43.52738 > 95.168.167.248.443: Flags [S], seq 3673501491, win 64860, options [mss 1410,sackOK,TS val 1776425597 ecr 0,nop,wscale 7], length 0
11:45:19.029309 IP 10.32.7.43.52738 > 95.168.167.248.443: Flags [S], seq 3673501491, win 64860, options [mss 1410,sackOK,TS val 1776425597 ecr 0,nop,wscale 7], length 0
11:45:19.029363 IP 95.168.167.248.443 > 10.32.7.43.52738: Flags [S.], seq 3507989279, ack 3673501492, win 65160, options [mss 1460,sackOK,TS val 1969924984 ecr 1776425597,nop,wscale 7], length 0
11:45:20.053275 IP 95.168.167.248.443 > 10.32.7.43.52738: Flags [S.], seq 3507989279, ack 3673501492, win 65160, options [mss 1460,sackOK,TS val 1969926008 ecr 1776425597,nop,wscale 7], length 0
11:45:22.100316 IP 95.168.167.248.443 > 10.32.7.43.52738: Flags [S.], seq 3507989279, ack 3673501492, win 65160, options [mss 1460,sackOK,TS val 1969928055 ecr 1776425597,nop,wscale 7], length 0
11:45:26.132236 IP 95.168.167.248.443 > 10.32.7.43.52738: Flags [S.], seq 3507989279, ack 3673501492, win 65160, options [mss 1460,sackOK,TS val 1969932087 ecr 1776425597,nop,wscale 7], length 0
11:45:34.225096 IP 10.32.7.43.54034 > 95.168.167.248.443: Flags [S], seq 1279720243, win 64860, options [mss 1410,sackOK,TS val 1776440793 ecr 0,nop,wscale 7], length 0
11:45:34.225123 IP 10.32.7.43.54034 > 95.168.167.248.443: Flags [S], seq 1279720243, win 64860, options [mss 1410,sackOK,TS val 1776440793 ecr 0,nop,wscale 7], length 0
11:45:34.225125 IP 10.32.7.43.54034 > 95.168.167.248.443: Flags [S], seq 1279720243, win 64860, options [mss 1410,sackOK,TS val 1776440793 ecr 0,nop,wscale 7], length 0
11:45:34.225200 IP 95.168.167.248.443 > 10.32.7.43.54034: Flags [S.], seq 2708372735, ack 1279720244, win 65160, options [mss 1460,sackOK,TS val 1969940180 ecr 1776440793,nop,wscale 7], length 0
11:45:34.388328 IP 95.168.167.248.443 > 10.32.7.43.52738: Flags [S.], seq 3507989279, ack 3673501492, win 65160, options [mss 1460,sackOK,TS val 1969940343 ecr 1776425597,nop,wscale 7], length 0
11:45:35.284308 IP 95.168.167.248.443 > 10.32.7.43.54034: Flags [S.], seq 2708372735, ack 1279720244, win 65160, options [mss 1460,sackOK,TS val 1969941239 ecr 1776440793,nop,wscale 7], length 0
11:45:35.284278 IP 10.32.7.43.54034 > 95.168.167.248.443: Flags [S], seq 1279720243, win 64860, options [mss 1410,sackOK,TS val 1776441852 ecr 0,nop,wscale 7], length 0
11:45:35.284327 IP 10.32.7.43.54034 > 95.168.167.248.443: Flags [S], seq 1279720243, win 64860, options [mss 1410,sackOK,TS val 1776441852 ecr 0,nop,wscale 7], length 0
11:45:35.284329 IP 10.32.7.43.54034 > 95.168.167.248.443: Flags [S], seq 1279720243, win 64860, options [mss 1410,sackOK,TS val 1776441852 ecr 0,nop,wscale 7], length 0
11:45:35.284359 IP 95.168.167.248.443 > 10.32.7.43.54034: Flags [S.], seq 2708372735, ack 1279720244, win 65160, options [mss 1460,sackOK,TS val 1969941239 ecr 1776440793,nop,wscale 7], length 0
11:45:37.332269 IP 95.168.167.248.443 > 10.32.7.43.54034: Flags [S.], seq 2708372735, ack 1279720244, win 65160, options [mss 1460,sackOK,TS val 1969943287 ecr 1776440793,nop,wscale 7], length 0
11:45:37.332315 IP 10.32.7.43.54034 > 95.168.167.248.443: Flags [S], seq 1279720243, win 64860, options [mss 1410,sackOK,TS val 1776443900 ecr 0,nop,wscale 7], length 0
11:45:37.332353 IP 10.32.7.43.54034 > 95.168.167.248.443: Flags [S], seq 1279720243, win 64860, options [mss 1410,sackOK,TS val 1776443900 ecr 0,nop,wscale 7], length 0
11:45:37.332354 IP 10.32.7.43.54034 > 95.168.167.248.443: Flags [S], seq 1279720243, win 64860, options [mss 1410,sackOK,TS val 1776443900 ecr 0,nop,wscale 7], length 0
11:45:37.332399 IP 95.168.167.248.443 > 10.32.7.43.54034: Flags [S.], seq 2708372735, ack 1279720244, win 65160, options [mss 1460,sackOK,TS val 1969943287 ecr 1776440793,nop,wscale 7], length 0
11:45:41.364346 IP 95.168.167.248.443 > 10.32.7.43.54034: Flags [S.], seq 2708372735, ack 1279720244, win 65160, options [mss 1460,sackOK,TS val 1969947319 ecr 1776440793,nop,wscale 7], length 0
11:45:41.364321 IP 10.32.7.43.54034 > 95.168.167.248.443: Flags [S], seq 1279720243, win 64860, options [mss 1410,sackOK,TS val 1776447932 ecr 0,nop,wscale 7], length 0
11:45:41.364413 IP 10.32.7.43.54034 > 95.168.167.248.443: Flags [S], seq 1279720243, win 64860, options [mss 1410,sackOK,TS val 1776447932 ecr 0,nop,wscale 7], length 0
11:45:41.364415 IP 10.32.7.43.54034 > 95.168.167.248.443: Flags [S], seq 1279720243, win 64860, options [mss 1410,sackOK,TS val 1776447932 ecr 0,nop,wscale 7], length 0
11:45:41.364441 IP 95.168.167.248.443 > 10.32.7.43.54034: Flags [S.], seq 2708372735, ack 1279720244, win 65160, options [mss 1460,sackOK,TS val 1969947319 ecr 1776440793,nop,wscale 7], length 0
11:45:49.749305 IP 95.168.167.248.443 > 10.32.7.43.54034: Flags [S.], seq 2708372735, ack 1279720244, win 65160, options [mss 1460,sackOK,TS val 1969955704 ecr 1776440793,nop,wscale 7], length 0
11:45:49.749337 IP 10.32.7.43.54034 > 95.168.167.248.443: Flags [S], seq 1279720243, win 64860, options [mss 1410,sackOK,TS val 1776456317 ecr 0,nop,wscale 7], length 0
11:45:49.749386 IP 10.32.7.43.54034 > 95.168.167.248.443: Flags [S], seq 1279720243, win 64860, options [mss 1410,sackOK,TS val 1776456317 ecr 0,nop,wscale 7], length 0
11:45:49.749388 IP 10.32.7.43.54034 > 95.168.167.248.443: Flags [S], seq 1279720243, win 64860, options [mss 1410,sackOK,TS val 1776456317 ecr 0,nop,wscale 7], length 0
11:45:49.749417 IP 95.168.167.248.443 > 10.32.7.43.54034: Flags [S.], seq 2708372735, ack 1279720244, win 65160, options [mss 1460,sackOK,TS val 1969955704 ecr 1776440793,nop,wscale 7], length 0
11:45:50.772282 IP 95.168.167.248.443 > 10.32.7.43.52738: Flags [S.], seq 3507989279, ack 3673501492, win 65160, options [mss 1460,sackOK,TS val 1969956727 ecr 1776425597,nop,wscale 7], length 0
```
Cilium Monitor on the agent (nothing):
```
cilium monitor --to 1122
Listening for events on 16 CPUs with 64x4096 of shared memory
Press Ctrl-C to quit
level=info msg="Initializing dissection cache..." subsys=monitor
-> endpoint 1122 flow 0xefa22853 identity 60232->1653 state reply ifindex lxcfa00edb3e696 orig-ip 10.32.7.129: 10.32.7.129:5672 -> 10.32.7.43:32864 tcp ACK
-> endpoint 1122 flow 0xefa22853 identity 60232->1653 state reply ifindex lxcfa00edb3e696 orig-ip 10.32.7.129: 10.32.7.129:5672 -> 10.32.7.43:32864 tcp ACK
-> endpoint 1122 flow 0xefa22853 identity 60232->1653 state reply ifindex lxcfa00edb3e696 orig-ip 10.32.7.129: 10.32.7.129:5672 -> 10.32.7.43:32864 tcp ACK
-> endpoint 1122 flow 0xefa22853 identity 60232->1653 state reply ifindex lxcfa00edb3e696 orig-ip 10.32.7.129: 10.32.7.129:5672 -> 10.32.7.43:32864 tcp ACK
-> endpoint 1122 flow 0xefa22853 identity 60232->1653 state reply ifindex lxcfa00edb3e696 orig-ip 10.32.7.129: 10.32.7.129:5672 -> 10.32.7.43:32864 tcp ACK
```

When I try to ping target pod's node external IP from within target pod:
tcpdump from within target pod (only ICMP requests):
```
11:36:53.236286 IP 10.32.7.43 > 95.168.167.248: ICMP echo request, id 93, seq 1204, length 64
        0x0000:  4500 0054 fdfd 4000 4001 23c0 0a20 072b  E..T..@.@.#....+
        0x0010:  5fa8 a7f8 0800 696b 005d 04b4 55b7 8d5e  _.....ik.]..U..^
        0x0020:  0000 0000 e49a 0300 0000 0000 1011 1213  ................
        0x0030:  1415 1617 1819 1a1b 1c1d 1e1f 2021 2223  .............!"#
        0x0040:  2425 2627 2829 2a2b 2c2d 2e2f 3031 3233  $%&'()*+,-./0123
        0x0050:  3435 3637                                4567
11:36:54.260290 IP 10.32.7.43 > 95.168.167.248: ICMP echo request, id 93, seq 1205, length 64
        0x0000:  4500 0054 000b 4000 4001 21b3 0a20 072b  E..T..@.@.!....+
        0x0010:  5fa8 a7f8 0800 a70c 005d 04b5 56b7 8d5e  _........]..V..^
        0x0020:  0000 0000 a5f8 0300 0000 0000 1011 1213  ................
        0x0030:  1415 1617 1819 1a1b 1c1d 1e1f 2021 2223  .............!"#
        0x0040:  2425 2627 2829 2a2b 2c2d 2e2f 3031 3233  $%&'()*+,-./0123
        0x0050:  3435 3637                                4567
11:36:55.284345 IP 10.32.7.43 > 95.168.167.248: ICMP echo request, id 93, seq 1206, length 64
        0x0000:  4500 0054 011a 4000 4001 20a4 0a20 072b  E..T..@.@......+
        0x0010:  5fa8 a7f8 0800 a8ad 005d 04b6 57b7 8d5e  _........]..W..^
        0x0020:  0000 0000 a256 0400 0000 0000 1011 1213  .....V..........
        0x0030:  1415 1617 1819 1a1b 1c1d 1e1f 2021 2223  .............!"#
        0x0040:  2425 2627 2829 2a2b 2c2d 2e2f 3031 3233  $%&'()*+,-./0123
        0x0050:  3435 3637                                4567
```

tcpdump from within the cilium-agent (many requests but few replies):
```
11:39:42.197336 IP 10.32.7.43 > 95.168.167.248: ICMP echo request, id 93, seq 1369, length 64
        0x0000:  4500 0054 4f4c 4000 3f01 d371 0a20 072b  E..TOL@.?..q...+
        0x0010:  5fa8 a7f8 0800 f85d 005d 0559 feb7 8d5e  _......].].Y...^
        0x0020:  0000 0000 ac02 0300 0000 0000 1011 1213  ................
        0x0030:  1415 1617 1819 1a1b 1c1d 1e1f 2021 2223  .............!"#
        0x0040:  2425 2627 2829 2a2b 2c2d 2e2f 3031 3233  $%&'()*+,-./0123
        0x0050:  3435 3637                                4567
11:39:42.197392 IP 95.168.167.248 > 10.32.7.43: ICMP echo reply, id 93, seq 1369, length 64
        0x0000:  4500 0054 949a 0000 4001 cd23 5fa8 a7f8  E..T....@..#_...
        0x0010:  0a20 072b 0000 005e 005d 0559 feb7 8d5e  ...+...^.].Y...^
        0x0020:  0000 0000 ac02 0300 0000 0000 1011 1213  ................
        0x0030:  1415 1617 1819 1a1b 1c1d 1e1f 2021 2223  .............!"#
        0x0040:  2425 2627 2829 2a2b 2c2d 2e2f 3031 3233  $%&'()*+,-./0123
        0x0050:  3435 3637                                4567
11:39:43.220277 IP 10.32.7.43 > 95.168.167.248: ICMP echo request, id 93, seq 1370, length 64
        0x0000:  4500 0054 530b 4000 4001 ceb2 0a20 072b  E..TS.@.@......+
        0x0010:  5fa8 a7f8 0800 4503 005d 055a ffb7 8d5e  _.....E..].Z...^
        0x0020:  0000 0000 5e5c 0300 0000 0000 1011 1213  ....^\..........
        0x0030:  1415 1617 1819 1a1b 1c1d 1e1f 2021 2223  .............!"#
        0x0040:  2425 2627 2829 2a2b 2c2d 2e2f 3031 3233  $%&'()*+,-./0123
        0x0050:  3435 3637                                4567
11:39:43.220299 IP 10.32.7.43 > 95.168.167.248: ICMP echo request, id 93, seq 1370, length 64
        0x0000:  4500 0054 530b 4000 3f01 cfb2 0a20 072b  E..TS.@.?......+
        0x0010:  5fa8 a7f8 0800 4503 005d 055a ffb7 8d5e  _.....E..].Z...^
        0x0020:  0000 0000 5e5c 0300 0000 0000 1011 1213  ....^\..........
        0x0030:  1415 1617 1819 1a1b 1c1d 1e1f 2021 2223  .............!"#
        0x0040:  2425 2627 2829 2a2b 2c2d 2e2f 3031 3233  $%&'()*+,-./0123
        0x0050:  3435 3637                                4567
11:39:43.220302 IP 10.32.7.43 > 95.168.167.248: ICMP echo request, id 93, seq 1370, length 64
        0x0000:  4500 0054 530b 4000 3f01 cfb2 0a20 072b  E..TS.@.?......+
        0x0010:  5fa8 a7f8 0800 4503 005d 055a ffb7 8d5e  _.....E..].Z...^
        0x0020:  0000 0000 5e5c 0300 0000 0000 1011 1213  ....^\..........
        0x0030:  1415 1617 1819 1a1b 1c1d 1e1f 2021 2223  .............!"#
        0x0040:  2425 2627 2829 2a2b 2c2d 2e2f 3031 3233  $%&'()*+,-./0123
        0x0050:  3435 3637                                4567
11:39:43.220367 IP 95.168.167.248 > 10.32.7.43: ICMP echo reply, id 93, seq 1370, length 64
        0x0000:  4500 0054 9734 0000 4001 ca89 5fa8 a7f8  E..T.4..@..._...
        0x0010:  0a20 072b 0000 4d03 005d 055a ffb7 8d5e  ...+..M..].Z...^
        0x0020:  0000 0000 5e5c 0300 0000 0000 1011 1213  ....^\..........
        0x0030:  1415 1617 1819 1a1b 1c1d 1e1f 2021 2223  .............!"#
        0x0040:  2425 2627 2829 2a2b 2c2d 2e2f 3031 3233  $%&'()*+,-./0123
        0x0050:  3435 3637                                4567
```

What cilium monitor shows within the agent:
```
cilium monitor --to 1122 --debug
Listening for events on 16 CPUs with 64x4096 of shared memory
Press Ctrl-C to quit
level=info msg="Initializing dissection cache..." subsys=monitor
-> endpoint 1122 flow 0xefa22853 identity 60232->1653 state reply ifindex lxcfa00edb3e696 orig-ip 10.32.7.129: 10.32.7.129:5672 -> 10.32.7.43:32864 tcp ACK
-> endpoint 1122 flow 0xefa22853 identity 60232->1653 state reply ifindex lxcfa00edb3e696 orig-ip 10.32.7.129: 10.32.7.129:5672 -> 10.32.7.43:32864 tcp ACK
-> endpoint 1122 flow 0xefa22853 identity 60232->1653 state reply ifindex lxcfa00edb3e696 orig-ip 10.32.7.129: 10.32.7.129:5672 -> 10.32.7.43:32864 tcp ACK
```
Node iptables-save:
https://gist.github.com/Antiarchitect/fbd5c03120018130928c41baf6a43e36
It may contain some artifacts from kube-proxy former presence.

**Comment by Antiarchitect** [comment]
The only option that changes anything I've discovered is `endpointRoutes.enabled: true` - unfortunately all external node IPs are unreachable with it

**Comment by Antiarchitect** [comment]
Additional info on the moment:
tcpdom from within target pod (only ICMP requests):
```
11:36:53.236286 IP 10.32.7.43 > 95.168.167.248: ICMP echo request, id 93, seq 1204, length 64
        0x0000:  4500 0054 fdfd 4000 4001 23c0 0a20 072b  E..T..@.@.#....+
        0x0010:  5fa8 a7f8 0800 696b 005d 04b4 55b7 8d5e  _.....ik.]..U..^
        0x0020:  0000 0000 e49a 0300 0000 0000 1011 1213  ................
        0x0030:  1415 1617 1819 1a1b 1c1d 1e1f 2021 2223  .............!"#
        0x0040:  2425 2627 2829 2a2b 2c2d 2e2f 3031 3233  $%&'()*+,-./0123
        0x0050:  3435 3637                                4567
11:36:54.260290 IP 10.32.7.43 > 95.168.167.248: ICMP echo request, id 93, seq 1205, length 64
        0x0000:  4500 0054 000b 4000 4001 21b3 0a20 072b  E..T..@.@.!....+
        0x0010:  5fa8 a7f8 0800 a70c 005d 04b5 56b7 8d5e  _........]..V..^
        0x0020:  0000 0000 a5f8 0300 0000 0000 1011 1213  ................
        0x0030:  1415 1617 1819 1a1b 1c1d 1e1f 2021 2223  .............!"#
        0x0040:  2425 2627 2829 2a2b 2c2d 2e2f 3031 3233  $%&'()*+,-./0123
        0x0050:  3435 3637                                4567
11:36:55.284345 IP 10.32.7.43 > 95.168.167.248: ICMP echo request, id 93, seq 1206, length 64
        0x0000:  4500 0054 011a 4000 4001 20a4 0a20 072b  E..T..@.@......+
        0x0010:  5fa8 a7f8 0800 a8ad 005d 04b6 57b7 8d5e  _........]..W..^
        0x0020:  0000 0000 a256 0400 0000 0000 1011 1213  .....V..........
        0x0030:  1415 1617 1819 1a1b 1c1d 1e1f 2021 2223  .............!"#
        0x0040:  2425 2627 2829 2a2b 2c2d 2e2f 3031 3233  $%&'()*+,-./0123
        0x0050:  3435 3637                                4567
```

tcpdump from within the cilium-agent (many request few replies):
```
11:39:42.197336 IP 10.32.7.43 > 95.168.167.248: ICMP echo request, id 93, seq 1369, length 64
        0x0000:  4500 0054 4f4c 4000 3f01 d371 0a20 072b  E..TOL@.?..q...+
        0x0010:  5fa8 a7f8 0800 f85d 005d 0559 feb7 8d5e  _......].].Y...^
        0x0020:  0000 0000 ac02 0300 0000 0000 1011 1213  ................
        0x0030:  1415 1617 1819 1a1b 1c1d 1e1f 2021 2223  .............!"#
        0x0040:  2425 2627 2829 2a2b 2c2d 2e2f 3031 3233  $%&'()*+,-./0123
        0x0050:  3435 3637                                4567
11:39:42.197392 IP 95.168.167.248 > 10.32.7.43: ICMP echo reply, id 93, seq 1369, length 64
        0x0000:  4500 0054 949a 0000 4001 cd23 5fa8 a7f8  E..T....@..#_...
        0x0010:  0a20 072b 0000 005e 005d 0559 feb7 8d5e  ...+...^.].Y...^
        0x0020:  0000 0000 ac02 0300 0000 0000 1011 1213  ................
        0x0030:  1415 1617 1819 1a1b 1c1d 1e1f 2021 2223  .............!"#
        0x0040:  2425 2627 2829 2a2b 2c2d 2e2f 3031 3233  $%&'()*+,-./0123
        0x0050:  3435 3637                                4567
11:39:43.220277 IP 10.32.7.43 > 95.168.167.248: ICMP echo request, id 93, seq 1370, length 64
        0x0000:  4500 0054 530b 4000 4001 ceb2 0a20 072b  E..TS.@.@......+
        0x0010:  5fa8 a7f8 0800 4503 005d 055a ffb7 8d5e  _.....E..].Z...^
        0x0020:  0000 0000 5e5c 0300 0000 0000 1011 1213  ....^\..........
        0x0030:  1415 1617 1819 1a1b 1c1d 1e1f 2021 2223  .............!"#
        0x0040:  2425 2627 2829 2a2b 2c2d 2e2f 3031 3233  $%&'()*+,-./0123
        0x0050:  3435 3637                                4567
11:39:43.220299 IP 10.32.7.43 > 95.168.167.248: ICMP echo request, id 93, seq 1370, length 64
        0x0000:  4500 0054 530b 4000 3f01 cfb2 0a20 072b  E..TS.@.?......+
        0x0010:  5fa8 a7f8 0800 4503 005d 055a ffb7 8d5e  _.....E..].Z...^
        0x0020:  0000 0000 5e5c 0300 0000 0000 1011 1213  ....^\..........
        0x0030:  1415 1617 1819 1a1b 1c1d 1e1f 2021 2223  .............!"#
        0x0040:  2425 2627 2829 2a2b 2c2d 2e2f 3031 3233  $%&'()*+,-./0123
        0x0050:  3435 3637                                4567
11:39:43.220302 IP 10.32.7.43 > 95.168.167.248: ICMP echo request, id 93, seq 1370, length 64
        0x0000:  4500 0054 530b 4000 3f01 cfb2 0a20 072b  E..TS.@.?......+
        0x0010:  5fa8 a7f8 0800 4503 005d 055a ffb7 8d5e  _.....E..].Z...^
        0x0020:  0000 0000 5e5c 0300 0000 0000 1011 1213  ....^\..........
        0x0030:  1415 1617 1819 1a1b 1c1d 1e1f 2021 2223  .............!"#
        0x0040:  2425 2627 2829 2a2b 2c2d 2e2f 3031 3233  $%&'()*+,-./0123
        0x0050:  3435 3637                                4567
11:39:43.220367 IP 95.168.167.248 > 10.32.7.43: ICMP echo reply, id 93, seq 1370, length 64
        0x0000:  4500 0054 9734 0000 4001 ca89 5fa8 a7f8  E..T.4..@..._...
        0x0010:  0a20 072b 0000 4d03 005d 055a ffb7 8d5e  ...+..M..].Z...^
        0x0020:  0000 0000 5e5c 0300 0000 0000 1011 1213  ....^\..........
        0x0030:  1415 1617 1819 1a1b 1c1d 1e1f 2021 2223  .............!"#
        0x0040:  2425 2627 2829 2a2b 2c2d 2e2f 3031 3233  $%&'()*+,-./0123
        0x0050:  3435 3637                                4567
```

What cilium monitor shows within the agent:
```
cilium monitor --to 1122 --debug
Listening for events on 16 CPUs with 64x4096 of shared memory
Press Ctrl-C to quit
level=info msg="Initializing dissection cache..." subsys=monitor
-> endpoint 1122 flow 0xefa22853 identity 60232->1653 state reply ifindex lxcfa00edb3e696 orig-ip 10.32.7.129: 10.32.7.129:5672 -> 10.32.7.43:32864 tcp ACK
-> endpoint 1122 flow 0xefa22853 identity 60232->1653 state reply ifindex lxcfa00edb3e696 orig-ip 10.32.7.129: 10.32.7.129:5672 -> 10.32.7.43:32864 tcp ACK
-> endpoint 1122 flow 0xefa22853 identity 60232->1653 state reply ifindex lxcfa00edb3e696 orig-ip 10.32.7.129: 10.32.7.129:5672 -> 10.32.7.43:32864 tcp ACK
```

**Comment by Antiarchitect** [comment]
The same tracking 443 port:
tcpdump from within target pod
```
tcpdump -i any -nn port 443
tcpdump: verbose output suppressed, use -v or -vv for full protocol decode
listening on any, link-type LINUX_SLL (Linux cooked), capture size 262144 bytes
11:42:07.563388 IP 10.32.7.43.50758 > 95.168.167.248.443: Flags [S], seq 3832255956, win 64860, options [mss 1410,sackOK,TS val 1776234131 ecr 0,nop,wscale 7], length 0
11:42:08.564297 IP 10.32.7.43.50758 > 95.168.167.248.443: Flags [S], seq 3832255956, win 64860, options [mss 1410,sackOK,TS val 1776235132 ecr 0,nop,wscale 7], length 0
11:42:10.612329 IP 10.32.7.43.50758 > 95.168.167.248.443: Flags [S], seq 3832255956, win 64860, options [mss 1410,sackOK,TS val 1776237180 ecr 0,nop,wscale 7], length 0
11:42:14.644228 IP 10.32.7.43.50758 > 95.168.167.248.443: Flags [S], seq 3832255956, win 64860, options [mss 1410,sackOK,TS val 1776241212 ecr 0,nop,wscale 7], length 0
11:42:22.900343 IP 10.32.7.43.50758 > 95.168.167.248.443: Flags [S], seq 3832255956, win 64860, options [mss 1410,sackOK,TS val 1776249468 ecr 0,nop,wscale 7], length 0
11:42:39.284242 IP 10.32.7.43.50758 > 95.168.167.248.443: Flags [S], seq 3832255956, win 64860, options [mss 1410,sackOK,TS val 1776265852 ecr 0,nop,wscale 7], length 0
11:43:11.541242 IP 10.32.7.43.50758 > 95.168.167.248.443: Flags [S], seq 3832255956, win 64860, options [mss 1410,sackOK,TS val 1776298109 ecr 0,nop,wscale 7], length 0
11:44:14.933483 IP 10.32.7.43.52738 > 95.168.167.248.443: Flags [S], seq 3673501491, win 64860, options [mss 1410,sackOK,TS val 1776361501 ecr 0,nop,wscale 7], length 0
11:44:15.988281 IP 10.32.7.43.52738 > 95.168.167.248.443: Flags [S], seq 3673501491, win 64860, options [mss 1410,sackOK,TS val 1776362556 ecr 0,nop,wscale 7], length 0
11:44:18.037296 IP 10.32.7.43.52738 > 95.168.167.248.443: Flags [S], seq 3673501491, win 64860, options [mss 1410,sackOK,TS val 1776364605 ecr 0,nop,wscale 7], length 0
11:44:22.068301 IP 10.32.7.43.52738 > 95.168.167.248.443: Flags [S], seq 3673501491, win 64860, options [mss 1410,sackOK,TS val 1776368636 ecr 0,nop,wscale 7], length 0
11:44:30.388304 IP 10.32.7.43.52738 > 95.168.167.248.443: Flags [S], seq 3673501491, win 64860, options [mss 1410,sackOK,TS val 1776376956 ecr 0,nop,wscale 7], length 0
11:44:46.772242 IP 10.32.7.43.52738 > 95.168.167.248.443: Flags [S], seq 3673501491, win 64860, options [mss 1410,sackOK,TS val 1776393340 ecr 0,nop,wscale 7], length 0
11:45:19.029255 IP 10.32.7.43.52738 > 95.168.167.248.443: Flags [S], seq 3673501491, win 64860, options [mss 1410,sackOK,TS val 1776425597 ecr 0,nop,wscale 7], length 0
11:45:34.225079 IP 10.32.7.43.54034 > 95.168.167.248.443: Flags [S], seq 1279720243, win 64860, options [mss 1410,sackOK,TS val 1776440793 ecr 0,nop,wscale 7], length 0
11:45:35.284263 IP 10.32.7.43.54034 > 95.168.167.248.443: Flags [S], seq 1279720243, win 64860, options [mss 1410,sackOK,TS val 1776441852 ecr 0,nop,wscale 7], length 0
11:45:37.332294 IP 10.32.7.43.54034 > 95.168.167.248.443: Flags [S], seq 1279720243, win 64860, options [mss 1410,sackOK,TS val 1776443900 ecr 0,nop,wscale 7], length 0
11:45:41.364304 IP 10.32.7.43.54034 > 95.168.167.248.443: Flags [S], seq 1279720243, win 64860, options [mss 1410,sackOK,TS val 1776447932 ecr 0,nop,wscale 7], length 0
11:45:49.749323 IP 10.32.7.43.54034 > 95.168.167.248.443: Flags [S], seq 1279720243, win 64860, options [mss 1410,sackOK,TS val 1776456317 ecr 0,nop,wscale 7], length 0
11:46:06.132235 IP 10.32.7.43.54034 > 95.168.167.248.443: Flags [S], seq 1279720243, win 64860, options [mss 1410,sackOK,TS val 1776472700 ecr 0,nop,wscale 7], length 0
```

tcpdump from within cilium-agent:
```
tcpdump -nn -i any port 443 | grep 10.32.7.43
tcpdump: verbose output suppressed, use -v or -vv for full protocol decode
listening on any, link-type LINUX_SLL (Linux cooked), capture size 262144 bytes
11:45:19.029269 IP 10.32.7.43.52738 > 95.168.167.248.443: Flags [S], seq 3673501491, win 64860, options [mss 1410,sackOK,TS val 1776425597 ecr 0,nop,wscale 7], length 0
11:45:19.029308 IP 10.32.7.43.52738 > 95.168.167.248.443: Flags [S], seq 3673501491, win 64860, options [mss 1410,sackOK,TS val 1776425597 ecr 0,nop,wscale 7], length 0
11:45:19.029309 IP 10.32.7.43.52738 > 95.168.167.248.443: Flags [S], seq 3673501491, win 64860, options [mss 1410,sackOK,TS val 1776425597 ecr 0,nop,wscale 7], length 0
11:45:19.029363 IP 95.168.167.248.443 > 10.32.7.43.52738: Flags [S.], seq 3507989279, ack 3673501492, win 65160, options [mss 1460,sackOK,TS val 1969924984 ecr 1776425597,nop,wscale 7], length 0
11:45:20.053275 IP 95.168.167.248.443 > 10.32.7.43.52738: Flags [S.], seq 3507989279, ack 3673501492, win 65160, options [mss 1460,sackOK,TS val 1969926008 ecr 1776425597,nop,wscale 7], length 0
11:45:22.100316 IP 95.168.167.248.443 > 10.32.7.43.52738: Flags [S.], seq 3507989279, ack 3673501492, win 65160, options [mss 1460,sackOK,TS val 1969928055 ecr 1776425597,nop,wscale 7], length 0
11:45:26.132236 IP 95.168.167.248.443 > 10.32.7.43.52738: Flags [S.], seq 3507989279, ack 3673501492, win 65160, options [mss 1460,sackOK,TS val 1969932087 ecr 1776425597,nop,wscale 7], length 0
11:45:34.225096 IP 10.32.7.43.54034 > 95.168.167.248.443: Flags [S], seq 1279720243, win 64860, options [mss 1410,sackOK,TS val 1776440793 ecr 0,nop,wscale 7], length 0
11:45:34.225123 IP 10.32.7.43.54034 > 95.168.167.248.443: Flags [S], seq 1279720243, win 64860, options [mss 1410,sackOK,TS val 1776440793 ecr 0,nop,wscale 7], length 0
11:45:34.225125 IP 10.32.7.43.54034 > 95.168.167.248.443: Flags [S], seq 1279720243, win 64860, options [mss 1410,sackOK,TS val 1776440793 ecr 0,nop,wscale 7], length 0
11:45:34.225200 IP 95.168.167.248.443 > 10.32.7.43.54034: Flags [S.], seq 2708372735, ack 1279720244, win 65160, options [mss 1460,sackOK,TS val 1969940180 ecr 1776440793,nop,wscale 7], length 0
11:45:34.388328 IP 95.168.167.248.443 > 10.32.7.43.52738: Flags [S.], seq 3507989279, ack 3673501492, win 65160, options [mss 1460,sackOK,TS val 1969940343 ecr 1776425597,nop,wscale 7], length 0
11:45:35.284308 IP 95.168.167.248.443 > 10.32.7.43.54034: Flags [S.], seq 2708372735, ack 1279720244, win 65160, options [mss 1460,sackOK,TS val 1969941239 ecr 1776440793,nop,wscale 7], length 0
11:45:35.284278 IP 10.32.7.43.54034 > 95.168.167.248.443: Flags [S], seq 1279720243, win 64860, options [mss 1410,sackOK,TS val 1776441852 ecr 0,nop,wscale 7], length 0
11:45:35.284327 IP 10.32.7.43.54034 > 95.168.167.248.443: Flags [S], seq 1279720243, win 64860, options [mss 1410,sackOK,TS val 1776441852 ecr 0,nop,wscale 7], length 0
11:45:35.284329 IP 10.32.7.43.54034 > 95.168.167.248.443: Flags [S], seq 1279720243, win 64860, options [mss 1410,sackOK,TS val 1776441852 ecr 0,nop,wscale 7], length 0
11:45:35.284359 IP 95.168.167.248.443 > 10.32.7.43.54034: Flags [S.], seq 2708372735, ack 1279720244, win 65160, options [mss 1460,sackOK,TS val 1969941239 ecr 1776440793,nop,wscale 7], length 0
11:45:37.332269 IP 95.168.167.248.443 > 10.32.7.43.54034: Flags [S.], seq 2708372735, ack 1279720244, win 65160, options [mss 1460,sackOK,TS val 1969943287 ecr 1776440793,nop,wscale 7], length 0
11:45:37.332315 IP 10.32.7.43.54034 > 95.168.167.248.443: Flags [S], seq 1279720243, win 64860, options [mss 1410,sackOK,TS val 1776443900 ecr 0,nop,wscale 7], length 0
11:45:37.332353 IP 10.32.7.43.54034 > 95.168.167.248.443: Flags [S], seq 1279720243, win 64860, options [mss 1410,sackOK,TS val 1776443900 ecr 0,nop,wscale 7], length 0
11:45:37.332354 IP 10.32.7.43.54034 > 95.168.167.248.443: Flags [S], seq 1279720243, win 64860, options [mss 1410,sackOK,TS val 1776443900 ecr 0,nop,wscale 7], length 0
11:45:37.332399 IP 95.168.167.248.443 > 10.32.7.43.54034: Flags [S.], seq 2708372735, ack 1279720244, win 65160, options [mss 1460,sackOK,TS val 1969943287 ecr 1776440793,nop,wscale 7], length 0
11:45:41.364346 IP 95.168.167.248.443 > 10.32.7.43.54034: Flags [S.], seq 2708372735, ack 1279720244, win 65160, options [mss 1460,sackOK,TS val 1969947319 ecr 1776440793,nop,wscale 7], length 0
11:45:41.364321 IP 10.32.7.43.54034 > 95.168.167.248.443: Flags [S], seq 1279720243, win 64860, options [mss 1410,sackOK,TS val 1776447932 ecr 0,nop,wscale 7], length 0
11:45:41.364413 IP 10.32.7.43.54034 > 95.168.167.248.443: Flags [S], seq 1279720243, win 64860, options [mss 1410,sackOK,TS val 1776447932 ecr 0,nop,wscale 7], length 0
11:45:41.364415 IP 10.32.7.43.54034 > 95.168.167.248.443: Flags [S], seq 1279720243, win 64860, options [mss 1410,sackOK,TS val 1776447932 ecr 0,nop,wscale 7], length 0
11:45:41.364441 IP 95.168.167.248.443 > 10.32.7.43.54034: Flags [S.], seq 2708372735, ack 1279720244, win 65160, options [mss 1460,sackOK,TS val 1969947319 ecr 1776440793,nop,wscale 7], length 0
11:45:49.749305 IP 95.168.167.248.443 > 10.32.7.43.54034: Flags [S.], seq 2708372735, ack 1279720244, win 65160, options [mss 1460,sackOK,TS val 1969955704 ecr 1776440793,nop,wscale 7], length 0
11:45:49.749337 IP 10.32.7.43.54034 > 95.168.167.248.443: Flags [S], seq 1279720243, win 64860, options [mss 1410,sackOK,TS val 1776456317 ecr 0,nop,wscale 7], length 0
11:45:49.749386 IP 10.32.7.43.54034 > 95.168.167.248.443: Flags [S], seq 1279720243, win 64860, options [mss 1410,sackOK,TS val 1776456317 ecr 0,nop,wscale 7], length 0
11:45:49.749388 IP 10.32.7.43.54034 > 95.168.167.248.443: Flags [S], seq 1279720243, win 64860, options [mss 1410,sackOK,TS val 1776456317 ecr 0,nop,wscale 7], length 0
11:45:49.749417 IP 95.168.167.248.443 > 10.32.7.43.54034: Flags [S.], seq 2708372735, ack 1279720244, win 65160, options [mss 1460,sackOK,TS val 1969955704 ecr 1776440793,nop,wscale 7], length 0
11:45:50.772282 IP 95.168.167.248.443 > 10.32.7.43.52738: Flags [S.], seq 3507989279, ack 3673501492, win 65160, options [mss 1460,sackOK,TS val 1969956727 ecr 1776425597,nop,wscale 7], length 0
```
Cilium Monitor on the agent (nothing):
```
cilium monitor --to 1122
Listening for events on 16 CPUs with 64x4096 of shared memory
Press Ctrl-C to quit
level=info msg="Initializing dissection cache..." subsys=monitor
-> endpoint 1122 flow 0xefa22853 identity 60232->1653 state reply ifindex lxcfa00edb3e696 orig-ip 10.32.7.129: 10.32.7.129:5672 -> 10.32.7.43:32864 tcp ACK
-> endpoint 1122 flow 0xefa22853 identity 60232->1653 state reply ifindex lxcfa00edb3e696 orig-ip 10.32.7.129: 10.32.7.129:5672 -> 10.32.7.43:32864 tcp ACK
-> endpoint 1122 flow 0xefa22853 identity 60232->1653 state reply ifindex lxcfa00edb3e696 orig-ip 10.32.7.129: 10.32.7.129:5672 -> 10.32.7.43:32864 tcp ACK
-> endpoint 1122 flow 0xefa22853 identity 60232->1653 state reply ifindex lxcfa00edb3e696 orig-ip 10.32.7.129: 10.32.7.129:5672 -> 10.32.7.43:32864 tcp ACK
-> endpoint 1122 flow 0xefa22853 identity 60232->1653 state reply ifindex lxcfa00edb3e696 orig-ip 10.32.7.129: 10.32.7.129:5672 -> 10.32.7.43:32864 tcp ACK
```

**Comment by Antiarchitect** [comment]
Cilium Operator logs are clean:
```
level=info msg="Cilium Operator 1.7.2 f1c787ee6 2020-04-03T11:47:41-07:00 go version go1.13.9 linux/amd64" subsys=cilium-operator
level=info msg="Starting apiserver on address 127.0.0.1:9234" subsys=cilium-operator
level=info msg="Starting apiserver on address [::1]:9234" subsys=cilium-operator
level=info msg="Establishing connection to apiserver" host="https://k8s.enapter.ninja:6443" subsys=k8s
level=info msg="Connected to apiserver" subsys=k8s
level=info msg="Retrieved node information from kubernetes" nodeName=worker-5.prod.lwams1.enapter.ninja subsys=k8s
level=info msg="Received own node information from API server" ipAddr.ipv4=192.168.202.55 ipAddr.ipv6="<nil>" nodeName=worker-5.prod.lwams1.enapter.ninja subsys=k8s v4Prefix=10.32.7.0/24 v6Prefix="<nil>"
level=info msg="Starting to garbage collect stale CiliumEndpoint custom resources..." subsys=cilium-operator
level=info msg="Starting to garbage collect stale CiliumNetworkPolicy status field entries..." subsys=cilium-operator
level=info msg="Starting to garbage collect stale CiliumClusterwideNetworkPolicy status field entries..." subsys=cilium-operator
level=info msg="Initialization complete" subsys=cilium-operator
level=info msg="Starting CRD identity garbage collector with 15m0s interval..." subsys=cilium-operator
```

**Comment by brb** [comment]
Can you dump `sysctl net | grep rp_filter` output?

**Comment by Antiarchitect** [comment]
@brb here: https://gist.github.com/Antiarchitect/1354ce6a8d27614d69a376627c7d3744

**Comment by brb** [comment]
Try setting `rp_filter=0` for `enp7s0f0`.

**Comment by Antiarchitect** [comment]
It appears we have multiple routing tables. And one of them is isp for truly external traffic. So here are the rules we've applied in order to get things work. (We've tried to turn off rp_filter only - didn't help):
```
echo 200 isp >> /etc/iproute2/rt_tables
echo from 95.168.167.248 to 10.32.0.0/16 lookup main > /etc/sysconfig/network-scripts/rule-enp7s0f0
echo from 95.168.167.248 table isp >> /etc/sysconfig/network-scripts/rule-enp7s0f0
echo default via 95.168.167.254 table isp > /etc/sysconfig/network-scripts/route-enp7s0f0
```

**Comment by brb** [comment]
Are you saying that adding `echo from 95.168.167.248 to 10.32.0.0/16 lookup main > /etc/sysconfig/network-scripts/rule-enp7s0f0` entry resolved the issue?

**Comment by Antiarchitect** [comment]
Looks so, it returns packets back to main routing table if they are going from the external node IP and the destination is all cluster pods CIDR
