### ISSUE TITLE
Tproxy Prevents AWS LoadBalancer Health Checks

### ISSUE THREAD

**Issue by jschwartzy** [cilium/cilium#30331]
### Is there an existing issue for this?

- [X] I have searched the existing issues

### What happened?

Installed `Gateway` resource with annotations to spin up an AWS NLB. NLB is using `instance` based targeting.

With `tproxy` enabled, targets never become healthy and underlying services are unreachable.

With `tproxy` disabled, targets become healthy and services are reachable.

Expectation: health checks should succeed and allow external traffic to flow to apps with `tproxy` enabled.

### Cilium Version

cilium image (running): 1.15.0-rc.1

### Kernel Version

5.10.192-183.736.amzn2.x86_64

### Kubernetes Version

v1.26.11-eks-8cb36c9

### Sysdump

[cilium-sysdump-20240119-002937.zip](https://github.com/cilium/cilium/files/13982905/cilium-sysdump-20240119-002937.zip)

### Relevant log output

```shell
TCP Dump comparison

tproxy enabled:

23:02:37.203911 IP ip-10-199-219-106.us-west-2.compute.internal.45374 > ip-100-66-166-103.us-west-2.compute.internal.31741: Flags [S], seq 1451825448, win 8961, options [mss 8361,sackOK,TS val 3959504862 ecr 0,nop,wscale 0], length 0
23:02:37.511887 IP ip-10-199-219-106.us-west-2.compute.internal.29793 > ip-100-66-166-103.us-west-2.compute.internal.31741: Flags [S], seq 3793448500, win 8961, options [mss 8361,sackOK,TS val 496463364 ecr 0,nop,wscale 0], length 0
23:02:37.512209 IP ip-10-199-214-172.us-west-2.compute.internal.55575 > ip-100-66-166-103.us-west-2.compute.internal.31741: Flags [S], seq 3385523574, win 8961, options [mss 8361,sackOK,TS val 2323242147 ecr 0,nop,wscale 0], length 0
23:02:37.592798 IP ip-10-199-217-149.us-west-2.compute.internal.50829 > ip-100-66-166-103.us-west-2.compute.internal.31741: Flags [S], seq 3253445794, win 8961, options [mss 8361,sackOK,TS val 449546413 ecr 0,nop,wscale 0], length 0
23:02:37.950231 IP ip-10-199-219-106.us-west-2.compute.internal.40268 > ip-100-66-166-103.us-west-2.compute.internal.31741: Flags [S], seq 4288321486, win 8961, options [mss 8361,sackOK,TS val 1267044378 ecr 0,nop,wscale 0], length 0
23:02:38.139811 IP ip-10-199-214-172.us-west-2.compute.internal.57470 > ip-100-66-166-103.us-west-2.compute.internal.31741: Flags [S], seq 1377274099, win 8961, options [mss 8361,sackOK,TS val 2517635690 ecr 0,nop,wscale 0], length 0
23:02:38.517647 IP ip-10-199-219-106.us-west-2.compute.internal.29793 > ip-100-66-166-103.us-west-2.compute.internal.31741: Flags [S], seq 3793448500, win 8961, options [mss 8361,sackOK,TS val 496464370 ecr 0,nop,wscale 0], length 0
23:02:39.608988 IP ip-10-199-217-149.us-west-2.compute.internal.50829 > ip-100-66-166-103.us-west-2.compute.internal.31741: Flags [S], seq 3253445794, win 8961, options [mss 8361,sackOK,TS val 449548429 ecr 0,nop,wscale 0], length 0
23:02:39.901740 IP ip-10-199-217-149.us-west-2.compute.internal.54532 > ip-100-66-166-103.us-west-2.compute.internal.31741: Flags [S], seq 1725618500, win 8961, options [mss 8361,sackOK,TS val 2929343572 ecr 0,nop,wscale 0], length 0
23:02:40.155860 IP ip-10-199-214-172.us-west-2.compute.internal.57470 > ip-100-66-166-103.us-west-2.compute.internal.31741: Flags [S], seq 1377274099, win 8961, options [mss 8361,sackOK,TS val 2517637706 ecr 0,nop,wscale 0], length 0

tproxy disabled:

23:19:54.179396 IP ip-10-199-219-106.us-west-2.compute.internal.12362 > ip-100-66-166-103.us-west-2.compute.internal.31741: Flags [F.], seq 1, ack 1, win 8961, options [nop,nop,TS val 3960541843 ecr 95447662], length 0
23:19:54.179547 IP ip-100-66-166-103.us-west-2.compute.internal.31741 > ip-10-199-219-106.us-west-2.compute.internal.12362: Flags [F.], seq 1, ack 2, win 490, options [nop,nop,TS val 95447662 ecr 3960541843], length 0
23:19:54.179805 IP ip-10-199-219-106.us-west-2.compute.internal.12362 > ip-100-66-166-103.us-west-2.compute.internal.31741: Flags [.], ack 2, win 8960, options [nop,nop,TS val 3960541843 ecr 95447662], length 0
23:19:56.568466 IP ip-10-199-217-149.us-west-2.compute.internal.26927 > ip-100-66-166-103.us-west-2.compute.internal.31741: Flags [S], seq 370572562, win 8961, options [mss 8361,sackOK,TS val 450585380 ecr 0,nop,wscale 0], length 0
23:19:56.568573 IP ip-100-66-166-103.us-west-2.compute.internal.31741 > ip-10-199-217-149.us-west-2.compute.internal.26927: Flags [S.], seq 3654461786, ack 370572563, win 62643, options [mss 8961,sackOK,TS val 1905762738 ecr 450585380,nop,wscale 7], length 0
23:19:56.569718 IP ip-10-199-217-149.us-west-2.compute.internal.26927 > ip-100-66-166-103.us-west-2.compute.internal.31741: Flags [.], ack 1, win 8961, options [nop,nop,TS val 450585382 ecr 1905762738], length 0
23:19:56.569718 IP ip-10-199-217-149.us-west-2.compute.internal.26927 > ip-100-66-166-103.us-west-2.compute.internal.31741: Flags [F.], seq 1, ack 1, win 8961, options [nop,nop,TS val 450585382 ecr 1905762738], length 0
23:19:56.569924 IP ip-100-66-166-103.us-west-2.compute.internal.31741 > ip-10-199-217-149.us-west-2.compute.internal.26927: Flags [F.], seq 1, ack 2, win 490, options [nop,nop,TS val 1905762740 ecr 450585382], length 0
23:19:56.570914 IP ip-10-199-217-149.us-west-2.compute.internal.26927 > ip-100-66-166-103.us-west-2.compute.internal.31741: Flags [.], ack 2, win 8960, options [nop,nop,TS val 450585383 ecr 1905762740], length 0
23:19:57.108608 IP ip-10-199-214-172.us-west-2.compute.internal.svs-omagent > ip-100-66-166-103.us-west-2.compute.internal.31741: Flags [S], seq 163003429, win 8961, options [mss 8361,sackOK,TS val 2518674655 ecr 0,nop,wscale 0], length 0
23:19:57.108685 IP ip-100-66-166-103.us-west-2.compute.internal.31741 > ip-10-199-214-172.us-west-2.compute.internal.svs-omagent: Flags [S.], seq 4027483677, ack 163003430, win 62643, options [mss 8961,sackOK,TS val 3305316782 ecr 2518674655,nop,wscale 7], length 0
23:19:57.109208 IP ip-10-199-214-172.us-west-2.compute.internal.svs-omagent > ip-100-66-166-103.us-west-2.compute.internal.31741: Flags [.], ack 1, win 8961, options [nop,nop,TS val 2518674656 ecr 3305316782], length 0
23:19:57.109252 IP ip-10-199-214-172.us-west-2.compute.internal.svs-omagent > ip-100-66-166-103.us-west-2.compute.internal.31741: Flags [F.], seq 1, ack 1, win 8961, options [nop,nop,TS val 2518674656 ecr 3305316782], length 0
23:19:57.109389 IP ip-100-66-166-103.us-west-2.compute.internal.31741 > ip-10-199-214-172.us-west-2.compute.internal.svs-omagent: Flags [F.], seq 1, ack 2, win 490, options [nop,nop,TS val 3305316782 ecr 2518674656], length 0
23:19:57.109833 IP ip-10-199-214-172.us-west-2.compute.internal.svs-omagent > ip-100-66-166-103.us-west-2.compute.internal.31741: Flags [.], ack 2, win 8960, options [nop,nop,TS val 2518674657 ecr 3305316782], length 0
23:19:57.317418 IP ip-100-66-166-103.us-west-2.compute.internal.38736 > ip-100-66-169-97.us-west-2.compute.internal.https: Flags [.], ack 4478314, win 5893, options [nop,nop,TS val 33741778 ecr 2212016656], length 0
23:19:57.511803 IP ip-10-199-219-106.us-west-2.compute.internal.19719 > ip-100-66-166-103.us-west-2.compute.internal.31741: Flags [S], seq 2889666862, win 8961, options [mss 8361,sackOK,TS val 497503367 ecr 0,nop,wscale 0], length 0
23:19:57.511888 IP ip-100-66-166-103.us-west-2.compute.internal.31741 > ip-10-199-219-106.us-west-2.compute.internal.19719: Flags [S.], seq 445413342, ack 2889666863, win 62643, options [mss 8961,sackOK,TS val 95450995 ecr 497503367,nop,wscale 7], length 0
23:19:57.512467 IP ip-10-199-219-106.us-west-2.compute.internal.19719 > ip-100-66-166-103.us-west-2.compute.internal.31741: Flags [.], ack 1, win 8961, options [nop,nop,TS val 497503368 ecr 95450995], length 0
23:19:57.512514 IP ip-10-199-219-106.us-west-2.compute.internal.19719 > ip-100-66-166-103.us-west-2.compute.internal.31741: Flags [F.], seq 1, ack 1, win 8961, options [nop,nop,TS val 497503368 ecr 95450995], length 0
23:19:57.512646 IP ip-100-66-166-103.us-west-2.compute.internal.31741 > ip-10-199-219-106.us-west-2.compute.internal.19719: Flags [F.], seq 1, ack 2, win 490, options [nop,nop,TS val 95450996 ecr 497503368], length 0
23:19:57.513023 IP ip-10-199-219-106.us-west-2.compute.internal.19719 > ip-100-66-166-103.us-west-2.compute.internal.31741: Flags [.], ack 2, win 8960, options [nop,nop,TS val 497503368 ecr 95450996], length 0
^C80515 packets captured
```

### Anything else?

Also noticed that pods failing health checks and are unreachable with `tproxy` enabled for `1.15-rc.1`. 
This does not occur with Cilium `1.14.5`. 

### Code of Conduct

- [X] I agree to follow this project's Code of Conduct

**Comment by jschwartzy** [comment]
This looks like it's an issue with `1.15.0-rc.1`, I reverted back to `1.14.5` with `tproxy` enabled and the AWS NLB comes up with Healthy targets.

**Comment by aditighag** [comment]
>Expectation: health checks should succeed and allow external traffic to flow to apps with tproxy enabled.

Can you clarify what these health checks are? Are they L7 health checks? Do you have any L7 policies selecting the affected traffic?

**Comment by aditighag** [comment]
I see Gateway defined in k8s-services-20240119-002937.yaml in the sysdump., so it's likely that the L7 traffic is redirected to Envoy.  /cc @cilium/sig-servicemesh team to check compatibilities between Envoy and Tproxy features.

**Comment by jschwartzy** [comment]
> > Expectation: health checks should succeed and allow external traffic to flow to apps with tproxy enabled.
> 
> Can you clarify what these health checks are? Are they L7 health checks? Do you have any L7 policies selecting the affected traffic?

In AWS, we have a Network Load Balancer configured in instance targeting mode, which creates a NodePort to all applicable worker nodes. This specific Health check is a TCP request to the NodePort which is routed to the Gateway's service port. 

Currently we do not have any L7 policies setup. 

I can confirm that this same setup is working on `1.14.5`.

Here's a screenshot of what the Load Balancer configuration looks like:

<img width="1754" alt="Screen Shot 2024-01-19 at 12 51 44 PM" src="https://github.com/cilium/cilium/assets/77411123/42f940b5-5ea4-4219-bb26-3d944337fcd4">


Corresponding service:
```
> kubectl get svc
NAME                              TYPE           CLUSTER-IP       EXTERNAL-IP                                                                 PORT(S)                      AGE
cilium-gateway-gateway-nlb-test   LoadBalancer   172.x.x.x     k8s-test-ciliumga-<redacted>-<redacted>.elb.us-west-2.amazonaws.com   80:31108/TCP                 18h
```

**Comment by mhofstetter** [comment]
Thanks a lot for reporting the issue @jschwartzy !

It looks like the BPF socket lookup for the (Envoy) proxy port fails if `bpf.tproxy` is enabled.

The following is an extract of the hubble flows to the LoadBalancer service.

```
❯ hubble observe --input-file hubble-flows-cilium-5jpqh-20240119-002937.json  --to-port 31499
Jan 19 00:27:38.526: 10.196.105.229:32084 (world) <> test/cilium-gateway-gateway-nlb-test:31499 (host) Socket lookup failed DROPPED (TCP Flags: SYN)
Jan 19 00:27:39.534: 10.196.105.229:32084 (world) <> test/cilium-gateway-gateway-nlb-test:31499 (host) Socket lookup failed DROPPED (TCP Flags: SYN)
Jan 19 00:27:41.550: 10.196.105.229:32084 (world) <> test/cilium-gateway-gateway-nlb-test:31499 (host) Socket lookup failed DROPPED (TCP Flags: SYN)
...
```

Dropping the privileges from the Envoy process (https://github.com/cilium/cilium/pull/27498 & https://github.com/cilium/proxy/pull/315) changed that the socket option `SO_REUSEPORT` is always set on the Envoy Listener socket. This is still not supported with BPF TPROXY.

Will come up with a fix soon.

**Comment by mhofstetter** [comment]
Reopen until it's backported to `v1.15`. 

* cilium/proxy backport: https://github.com/cilium/proxy/pull/506
* cilium/cilium backport: will follow

**Comment by joestringer** [comment]
Thanks for helping us to identify & fix this issue in the RC phase before the final v1.15 release @jschwartzy !
