### ISSUE TITLE
Cilium does not SNAT external source IP for pods on same node

### ISSUE THREAD

**Issue by camrynl** [cilium/cilium#33574]
### Is there an existing issue for this?

- [X] I have searched the existing issues

### What happened?

When Cilium has an external loadbalancer service and traffic comes to the backend pod on the same node, the traffic does not get SNAT'd. The source IP is still listed as the external IP, is this behavior expected?

here's a few lines for tcpdump from Azure Cilium cluster:
- `10.10.0.4` is the remote node
- `4.154.44.178` is the external source IP
- `192.168.0.85` is the backend pod
```
19:17:26.029224 aa:b7:5e:85:08:28 > b6:f7:e8:43:9e:b1, ethertype IPv4 (0x0800), length 66: 10.10.0.4.33062 > 192.168.0.85.80: Flags [.], ack 239, win 501, options [nop,nop,TS val 4020837107 ecr 3898350364], length 0
19:17:26.029227 aa:b7:5e:85:08:28 > b6:f7:e8:43:9e:b1, ethertype IPv4 (0x0800), length 66: 10.10.0.4.33062 > 192.168.0.85.80: Flags [.], ack 854, win 501, options [nop,nop,TS val 4020837107 ecr 3898350364], length 0
19:17:27.623269 aa:b7:5e:85:08:28 > b6:f7:e8:43:9e:b1, ethertype IPv4 (0x0800), length 74: 4.154.44.178.42510 > 192.168.0.85.80: Flags [S], seq 1047219310, win 64240, options [mss 1418,sackOK,TS val 3905188164 ecr 0,nop,wscale 7], length 0
19:17:27.623291 b6:f7:e8:43:9e:b1 > aa:b7:5e:85:08:28, ethertype IPv4 (0x0800), length 74: 192.168.0.85.80 > 4.154.44.178.42510: Flags [S.], seq 3094247633, ack 1047219311, win 65160, options [mss 1460,sackOK,TS val 2492421118 ecr 3905188164,nop,wscale 7], length 0
19:17:27.626958 aa:b7:5e:85:08:28 > b6:f7:e8:43:9e:b1, ethertype IPv4 (0x0800), length 195: 4.154.44.178.42510 > 192.168.0.85.80: Flags [P.], seq 1:130, ack 1, win 502, options [nop,nop,TS val 3905188166 ecr 2492421118], length 129: HTTP: GET / HTTP/1.1
19:17:27.626962 aa:b7:5e:85:08:28 > b6:f7:e8:43:9e:b1, ethertype IPv4 (0x0800), length 66: 4.154.44.178.42510 > 192.168.0.85.80: Flags [.], ack 1, win 502, options [nop,nop,TS val 3905188166 ecr 2492421118], length 0
```

In comparison, on a cluster with Azure CNI + kubeproxy the traffic hitting the backend pod on the same node will get SNAT'd and the source IP is then the VM IP. Why doesn't cilium SNAT the source IP to the VM IP too?

here's a few lines for tcpdump from Azure CNI + kubeproxy cluster:
- can see that source IP is both `10.10.04` and `10.10.0.5 `-- both VM IPs
- backend pod is `192.168.1.254`
```
19:15:29.516360 aa:aa:aa:aa:aa:aa > 8e:0c:89:4a:11:ce, ethertype IPv4 (0x0800), length 196: 10.10.0.4.33969 > 192.168.1.254.80: Flags [P.], seq 1:131, ack 1, win 502, options [nop,nop,TS val 44337702 ecr 2156826872], length 130: HTTP: GET / HTTP/1.1
19:15:29.516392 8e:0c:89:4a:11:ce > aa:aa:aa:aa:aa:aa, ethertype IPv4 (0x0800), length 66: 192.168.1.254.80 > 10.10.0.4.33969: Flags [.], ack 131, win 509, options [nop,nop,TS val 2156826873 ecr 44337702], length 0
19:15:29.516557 8e:0c:89:4a:11:ce > aa:aa:aa:aa:aa:aa, ethertype IPv4 (0x0800), length 304: 192.168.1.254.80 > 10.10.0.4.33969: Flags [P.], seq 1:239, ack 131, win 509, options [nop,nop,TS val 2156826874 ecr 44337702], length 238: HTTP: HTTP/1.1 200 OK
19:15:29.516604 8e:0c:89:4a:11:ce > aa:aa:aa:aa:aa:aa, ethertype IPv4 (0x0800), length 681: 192.168.1.254.80 > 10.10.0.4.33969: Flags [P.], seq 239:854, ack 131, win 509, options [nop,nop,TS val 2156826874 ecr 44337702], length 615: HTTP
19:15:29.518200 aa:aa:aa:aa:aa:aa > 8e:0c:89:4a:11:ce, ethertype IPv4 (0x0800), length 66: 10.10.0.4.33969 > 192.168.1.254.80: Flags [.], ack 239, win 501, options [nop,nop,TS val 44337704 ecr 2156826874], length 0
19:15:29.518209 aa:aa:aa:aa:aa:aa > 8e:0c:89:4a:11:ce, ethertype IPv4 (0x0800), length 66: 10.10.0.4.33969 > 192.168.1.254.80: Flags [.], ack 854, win 497, options [nop,nop,TS val 44337704 ecr 2156826874], length 0
19:15:30.162062 aa:aa:aa:aa:aa:aa > 8e:0c:89:4a:11:ce, ethertype IPv4 (0x0800), length 74: 10.10.0.5.9759 > 192.168.1.254.80: Flags [S], seq 1102461234, win 64240, options [mss 1418,sackOK,TS val 481232354 ecr 0,nop,wscale 7], length 0
19:15:30.162094 8e:0c:89:4a:11:ce > aa:aa:aa:aa:aa:aa, ethertype IPv4 (0x0800), length 74: 192.168.1.254.80 > 10.10.0.5.9759: Flags [S.], seq 826327324, ack 1102461235, win 65160, options [mss 1460,sackOK,TS val 3406834629 ecr 481232354,nop,wscale 7], length 0
19:15:30.163489 aa:aa:aa:aa:aa:aa > 8e:0c:89:4a:11:ce, ethertype IPv4 (0x0800), length 66: 10.10.0.5.9759 > 192.168.1.254.80: Flags [.], ack 1, win 502, options [nop,nop,TS val 481232356 ecr 3406834629], length 0
```

### Cilium Version

1.14.10

### Kernel Version

5.15.0-1066-azure

### Kubernetes Version

1.29.4

### Cilium Users Document

- [ ] Are you a user of Cilium? Please add yourself to the [Users doc](https://github.com/cilium/cilium/blob/main/USERS.md)

### Code of Conduct

- [X] I agree to follow this project's Code of Conduct

**Comment by julianwiedmann** [comment]
> When Cilium has an external loadbalancer service and traffic comes to the backend pod on the same node, the traffic does not get SNAT'd. The source IP is still listed as the external IP, is this behavior expected?

yep, that's essentially the `externalTrafficPolicy=Local` case in https://docs.cilium.io/en/latest/network/kubernetes/kubeproxy-free/#client-source-ip-preservation. If the traffic stays inside the "entry" node, Cilium's kube-proxy replacement doesn't require SNAT.

**Comment by camrynl** [comment]
@julianwiedmann the load balancer used was `externaltrafficpolicy: cluster`

**Comment by julianwiedmann** [comment]
> @julianwiedmann the load balancer used was `externaltrafficpolicy: cluster`

ack, but in the scenario you described (LB and backend on the same node) you're effectively seeing the same behaviour as with `eTP=local`.
