### ISSUE TITLE
NodePort service can not be accessed outside k8s cluster

### ISSUE THREAD

**Issue by kubefay** [cilium/cilium#15719]
## Bug report
When I install cilium by the following:
helm install cilium /cilium/install/kubernetes/cilium \
    --namespace kube-system \
    --set kubeProxyReplacement=strict \
    --set k8sServiceHost=192.168.8.101 \
    --set ipv6.enalbed=false \
    --set k8sServicePort=6443

The NodePort service doesn't work correctly.
Flow from outside cluster with src ip 192.168.0.1 can attach to the pod, but the reply flow interupt at the lxc veth
-->

**General Information**

- Cilium version (run `cilium version`)
Client: 1.9.90 573978bbf 2021-04-09T03:42:39+02:00 go version go1.16.3 linux/amd64
Daemon: 1.9.90 573978bbf 2021-04-09T03:42:39+02:00 go version go1.16.3 linux/amd64

- Kernel version (run `uname -a`)
Linux node1 5.3.0-050300-generic #201909152230 SMP Sun Sep 15 22:32:54 UTC 2019 x86_64 x86_64 x86_64 GNU/Linux

- Orchestration system version in use (e.g. `kubectl version`, ...)
Client Version: version.Info{Major:"1", Minor:"19", GitVersion:"v1.19.7", GitCommit:"1dd5338295409edcfff11505e7bb246f0d325d15", GitTreeState:"clean", BuildDate:"2021-01-13T13:23:52Z", GoVersion:"go1.15.5", Compiler:"gc", Platform:"linux/amd64"}
Server Version: version.Info{Major:"1", Minor:"19", GitVersion:"v1.19.7", GitCommit:"1dd5338295409edcfff11505e7bb246f0d325d15", GitTreeState:"clean", BuildDate:"2021-01-13T13:15:20Z", GoVersion:"go1.15.5", Compiler:"gc", Platform:"linux/amd64"}

- Link to relevant artifacts (policies, deployments scripts, ...)

apiVersion: apps/v1
kind: Deployment
metadata:
  name: my-nginx
spec:
  selector:
    matchLabels:
      run: my-nginx
  replicas: 2
  template:
    metadata:
      labels:
        run: my-nginx
    spec:
      containers:
      - name: my-nginx
        image: nginx
        ports:
        - containerPort: 80

kubectl expose deployment my-nginx --type=NodePort --port=80

- Generate and upload a system zip:
```
curl -sLO https://git.io/cilium-sysdump-latest.zip && python cilium-sysdump-latest.zip
```
[cilium-sysdump-20210416-011452.zip](https://github.com/cilium/cilium/files/6320106/cilium-sysdump-20210416-011452.zip)

**How to reproduce the issue**
use the vagrant box cilium/ubuntu-dev, and follow the guide at https://docs.cilium.io/en/latest/gettingstarted/kubeproxy-free/#kubeproxy-free

**Comment by aanm** [comment]
@TicktW can you attach a monitor output with `cilium monitor` of that traffic as well as pcap from tcpdump from the client making the request and the VM?

**Comment by TicktW** [comment]
tcpdump from client:
tcpdump: listening on vboxnet2, link-type EN10MB (Ethernet), capture size 262144 bytes
07:43:36.874671 0a:00:27:00:00:02 > 08:00:27:ee:45:53, ethertype IPv4 (0x0800), length 74: (tos 0x0, ttl 64, id 64671, offset 0, flags [DF], proto TCP (6), length 60)
    192.168.8.1.35960 > 192.168.8.101.31620: Flags [S], cksum 0x2148 (correct), seq 2785085783, win 64240, options [mss 1460,sackOK,TS val 3226804837 ecr 0,nop,wscale 7], length 0
07:43:37.877232 0a:00:27:00:00:02 > 08:00:27:ee:45:53, ethertype IPv4 (0x0800), length 74: (tos 0x0, ttl 64, id 64672, offset 0, flags [DF], proto TCP (6), length 60)
    192.168.8.1.35960 > 192.168.8.101.31620: Flags [S], cksum 0x1d5e (correct), seq 2785085783, win 64240, options [mss 1460,sackOK,TS val 3226805839 ecr 0,nop,wscale 7], length 0
07:43:39.893221 0a:00:27:00:00:02 > 08:00:27:ee:45:53, ethertype IPv4 (0x0800), length 74: (tos 0x0, ttl 64, id 64673, offset 0, flags [DF], proto TCP (6), length 60)
    192.168.8.1.35960 > 192.168.8.101.31620: Flags [S], cksum 0x157e (correct), seq 2785085783, win 64240, options [mss 1460,sackOK,TS val 3226807855 ecr 0,nop,wscale 7], length 0
07:43:41.909213 0a:00:27:00:00:02 > 08:00:27:ee:45:53, ethertype ARP (0x0806), length 42: Ethernet (len 6), IPv4 (len 4), Request who-has 192.168.8.101 tell 192.168.8.1, length 28
07:43:41.909662 08:00:27:ee:45:53 > 0a:00:27:00:00:02, ethertype ARP (0x0806), length 60: Ethernet (len 6), IPv4 (len 4), Reply 192.168.8.101 is-at 08:00:27:ee:45:53, length 46
07:43:43.957222 0a:00:27:00:00:02 > 08:00:27:ee:45:53, ethertype IPv4 (0x0800), length 74: (tos 0x0, ttl 64, id 64674, offset 0, flags [DF], proto TCP (6), length 60)
    192.168.8.1.35960 > 192.168.8.101.31620: Flags [S], cksum 0x059e (correct), seq 2785085783, win 64240, options [mss 1460,sackOK,TS val 3226811919 ecr 0,nop,wscale 7], length 0
07:43:52.149225 0a:00:27:00:00:02 > 08:00:27:ee:45:53, ethertype IPv4 (0x0800), length 74: (tos 0x0, ttl 64, id 64675, offset 0, flags [DF], proto TCP (6), length 60)
    192.168.8.1.35960 > 192.168.8.101.31620: Flags [S], cksum 0xe59d (correct), seq 2785085783, win 64240, options [mss 1460,sackOK,TS val 3226820111 ecr 0,nop,wscale 7], length 0

cilium monitor:
root@node1:/home/cilium# cat netlog | grep ':80 '
-> endpoint 159 flow 0x0 identity world->57859 state established ifindex lxc76c65a67ae83 orig-ip 192.168.8.1: 192.168.8.1:35960 -> 10.0.0.240:80 tcp SYN
-> endpoint 159 flow 0x0 identity world->57859 state established ifindex lxc76c65a67ae83 orig-ip 192.168.8.1: 192.168.8.1:35960 -> 10.0.0.240:80 tcp SYN

tcpdump at vet0 connected to the pod:
vagrant@node1:/vagrant$ sudo tcpdump -env -i lxc76c65a67ae83
tcpdump: listening on lxc76c65a67ae83, link-type EN10MB (Ethernet), capture size 262144 bytes
07:43:36.847017 3a:4c:fe:98:a3:85 > be:64:97:38:14:d0, ethertype IPv4 (0x0800), length 74: (tos 0x0, ttl 62, id 64671, offset 0, flags [DF], proto TCP (6), length 60)
    192.168.8.1.35960 > 10.0.0.240.80: Flags [S], cksum 0x5a9a (correct), seq 2785085783, win 64240, options [mss 1460,sackOK,TS val 3226804837 ecr 0,nop,wscale 7], length 0
07:43:36.847336 be:64:97:38:14:d0 > 3a:4c:fe:98:a3:85, ethertype IPv4 (0x0800), length 74: (tos 0x0, ttl 64, id 0, offset 0, flags [DF], proto TCP (6), length 60)
    10.0.0.240.80 > 192.168.8.1.35960: Flags [S.], cksum 0xd3c7 (incorrect -> 0x887c), seq 102112588, ack 2785085784, win 64308, options [mss 1410,sackOK,TS val 3263687696 ecr 3226804837,nop,wscale 7], length 0
07:43:37.849240 3a:4c:fe:98:a3:85 > be:64:97:38:14:d0, ethertype IPv4 (0x0800), length 74: (tos 0x0, ttl 62, id 64672, offset 0, flags [DF], proto TCP (6), length 60)
    192.168.8.1.35960 > 10.0.0.240.80: Flags [S], cksum 0x56b0 (correct), seq 2785085783, win 64240, options [mss 1460,sackOK,TS val 3226805839 ecr 0,nop,wscale 7], length 0
07:43:37.849528 be:64:97:38:14:d0 > 3a:4c:fe:98:a3:85, ethertype IPv4 (0x0800), length 74: (tos 0x0, ttl 64, id 0, offset 0, flags [DF], proto TCP (6), length 60)
    10.0.0.240.80 > 192.168.8.1.35960: Flags [S.], cksum 0xd3c7 (incorrect -> 0x8492), seq 102112588, ack 2785085784, win 64308, options [mss 1410,sackOK,TS val 3263688698 ecr 3226804837,nop,wscale 7], length 0
07:43:38.864287 be:64:97:38:14:d0 > 3a:4c:fe:98:a3:85, ethertype IPv4 (0x0800), length 74: (tos 0x0, ttl 64, id 0, offset 0, flags [DF], proto TCP (6), length 60)
    10.0.0.240.80 > 192.168.8.1.35960: Flags [S.], cksum 0xd3c7 (incorrect -> 0x809b), seq 102112588, ack 2785085784, win 64308, options [mss 1410,sackOK,TS val 3263689713 ecr 3226804837,nop,wscale 7], length 0
07:43:39.865350 3a:4c:fe:98:a3:85 > be:64:97:38:14:d0, ethertype IPv4 (0x0800), length 74: (tos 0x0, ttl 62, id 64673, offset 0, flags [DF], proto TCP (6), length 60)

root@node1:/home/cilium#
