### ISSUE TITLE
ServiceMesh 503 when Envoy and App are Co-located with BPF Host Routing 

### ISSUE THREAD

**Issue by jschwartzy** [cilium/cilium#33243]
### Is there an existing issue for this?

- [X] I have searched the existing issues

### What happened?

In the following scenario:
Cloud Provider: EKS on AWS
`HostRouting` is set to `bpf`.

 The `envoy` proxy pod and the destination pod are on the same host, `envoy` is unable to forward the request, resulting in a `503 service unavailable` error. 

Here's how we have managed to reproduce this error across a number of different configurations:
1. Install GatewayAPI CRDs
2. Install Cilium with the following configuration values
```
ipv4NativeRoutingCIDR: <your pod CIDR range>
envoyConfig: 
  enabled: true
l7Proxy: true
loadBalancer:
  l7:
    backend: envoy
envoy:
  enabled: true
loadbalancer:
  serviceTopology: true
autoDirectNodeRoutes: true
devices: eth+ 
enableRuntimeDeviceDetection: true
kubeProxyReplacement: true
k8sServicePort: 443
k8sServiceHost: <your Control Plane Endpoint>
localRedirectPolicy: true
routingMode: native
bpf:
  masquerade: true 
  tproxy: true 
cni:
  customConf: true
  configMap: cni-configuration
eni:
  enabled: true
  awsEnablePrefixDelegation: true
  awsReleaseExcessIPs: true
gatewayAPI:
  enabled: true
ipam:
  mode: eni
rollOutCiliumPods: true
```         
3.  Custom CNI Configuration (we separate the node IPs 10.x from Pod IPs: 100.x)
```
 cni-config: |
          {
            "cniVersion"        : "1.0.0",
            "name"              : "cilium",
            "plugins": [
              {
                "cniVersion": "1.0.0",
                "type": "cilium-cni",
                "eni": {
                  "subnet-ids" : [<your-pod-subnet-ids],
                  "first-interface-index" : 1
                }
              }
            ]
          }
```
4. Install a Gateway
```
apiVersion: gateway.networking.k8s.io/v1
kind: Gateway
metadata:
  name: gateway-nlb
  namespace: test
spec:
  gatewayClassName: cilium
  infrastructure:
    annotations:
      service.beta.kubernetes.io/aws-load-balancer-type: external
      service.beta.kubernetes.io/aws-load-balancer-nlb-target-type: instance
      service.beta.kubernetes.io/aws-load-balancer-attributes: load_balancing.cross_zone.enabled=true
      service.beta.kubernetes.io/aws-load-balancer-target-group-attributes: preserve_client_ip.enabled=true
      service.beta.kubernetes.io/aws-load-balancer-backend-protocol: tcp
      service.beta.kubernetes.io/aws-load-balancer-target-node-labels: cilium-debug=true
      service.beta.kubernetes.io/load-balancer-source-ranges: 10.0.0.0/8, 100.64.0.0/10
  listeners:
  - protocol: HTTP
    port: 80
    name: http
    allowedRoutes:
      namespaces:
        from: Same
```
5. Install an app (we ran a few tests, including some live apps - I'll include a simple Go app we use.) 
```
apiVersion: apps/v1
kind: Deployment
metadata:
  labels:
    app: k8s-test
  name: k8s-test
  namespace: test
spec:
  progressDeadlineSeconds: 600
  replicas: 1
  revisionHistoryLimit: 10
  selector:
    matchLabels:
      app: k8s-test
  strategy:
    rollingUpdate:
      maxSurge: 25%
      maxUnavailable: 0
    type: RollingUpdate
  template:
    metadata:
      labels:
        app: k8s-test
    spec:
      containers:
      - image: <your-container-repo>/k8s-test:latest
        imagePullPolicy: Always
        lifecycle:
          preStop:
            exec:
              command:
              - sleep
              - "30"
        livenessProbe:
          failureThreshold: 3
          httpGet:
            path: /healthz
            port: http
            scheme: HTTP
          initialDelaySeconds: 10
          periodSeconds: 10
          successThreshold: 1
          timeoutSeconds: 1
        name: service
        ports:
        - containerPort: 8080
          name: http
          protocol: TCP
        readinessProbe:
          failureThreshold: 3
          httpGet:
            path: /healthz
            port: http
            scheme: HTTP
          initialDelaySeconds: 10
          periodSeconds: 10
          successThreshold: 1
          timeoutSeconds: 1
        resources:
          requests:
            cpu: 100m
            memory: 100Mi
        terminationMessagePath: /dev/termination-log
        terminationMessagePolicy: File
        volumeMounts:
        - mountPath: /app/log
          name: applog
      dnsPolicy: ClusterFirst
      restartPolicy: Always
      schedulerName: default-scheduler
      securityContext:
        runAsNonRoot: true
        runAsUser: 65534
      serviceAccount: k8s-test
      serviceAccountName: k8s-test
      terminationGracePeriodSeconds: 60
      topologySpreadConstraints:
      - labelSelector:
          matchExpressions:
          - key: app
            operator: In
            values:
            - k8s-test
          - key: release
            operator: In
            values:
            - k8s-test
        maxSkew: 1
        topologyKey: topology.kubernetes.io/zone
        whenUnsatisfiable: ScheduleAnyway
      - labelSelector:
          matchExpressions:
          - key: app
            operator: In
            values:
            - k8s-test
          - key: release
            operator: In
            values:
            - k8s-test
        maxSkew: 1
        topologyKey: kubernetes.io/hostname
        whenUnsatisfiable: ScheduleAnyway
      volumes:
      - emptyDir: {}
        name: applog
---
apiVersion: v1
kind: Service
metadata:
  labels:
    app: k8s-test
  name: k8s-test
  namespace: test
spec:
  internalTrafficPolicy: Cluster
  ipFamilies:
  - IPv4
  ipFamilyPolicy: SingleStack
  ports:
  - name: http
    port: 80
    protocol: TCP
    targetPort: http
  selector:
    app: k8s-test
  sessionAffinity: None
  type: ClusterIP
---
apiVersion: v1
automountServiceAccountToken: true
kind: ServiceAccount
metadata:
  labels:
    app: k8s-test
  name: k8s-test
  namespace: test        
```
6. Install an HttpRoute:
```
apiVersion: gateway.networking.k8s.io/v1
kind: HTTPRoute
metadata:
  name: test-nlb
  namespace: test
spec:
  hostnames:
  - 127.0.0.1
  parentRefs:
  - name: gateway-nlb
  rules:
  - backendRefs:
    - kind: Service
      name: k8s-test
      port: 80
      weight: 1
    matches:
    - path:
        type: PathPrefix
        value: /k8s-test/      
    filters:
    - type: URLRewrite
      urlRewrite:
        path:
          replacePrefixMatch: /
          type: ReplacePrefixMatch
```   
7. For the easiest way to reproduce this, we'll find the NodePort for the underlying Gateway, login to the Node where the app replica resides and try to connect to it via GatewayAPI.
8. Get svc:
```
> kubectl get svc cilium-gateway-gateway-nlb
NAME                               TYPE           CLUSTER-IP       EXTERNAL-IP                                                                 PORT(S) 
cilium-gateway-gateway-nlb   LoadBalancer   172.20.31.103    k8s-test-ciliumga-<redacted>-<redacted>.elb.us-west-2.amazonaws.com   80:31277/TCP   
```
9. Find out where our replica is running:
```
> kubectl get po -lapp=k8s-test -o wide
NAME                           READY   STATUS    RESTARTS   AGE   IP             NODE                                           
k8s-test-85d44bcc7d-mbv52   1/1     Running   0          16s   100.64.25.42   ip-10-1-1-1.us-west-2.compute.internal
```
10. Get onto that node that is suitable for your environment (ssh, ssm, etc).
11. Curl the localhost IP on the NodePort and use the HttpRoute path to hit the app:
```
sh-4.2$ curl -v  http://127.0.0.1:31277/k8s-test/healthz
*   Trying 127.0.0.1:31277...
* Connected to 127.0.0.1 (127.0.0.1) port 31277
> POST /k8s-test/healthz HTTP/1.1
> Host: 127.0.0.1:31277
> User-Agent: curl/8.3.0
> Accept: */*
> 
< HTTP/1.1 503 Service Unavailable
< content-length: 91
< content-type: text/plain
< date: Tue, 18 Jun 2024 19:04:45 GMT
< server: envoy
< 
* Connection #0 to host 127.0.0.1 left intact
upstream connect error or disconnect/reset before headers. reset reason: connection timeout
```

Here's the simple Go app we used:
```
package main

import (
	"encoding/json"
	"log"
	"net/http"
	"os"

	"github.com/gorilla/handlers"
	"github.com/gorilla/mux"
)

func main() {

	r := mux.NewRouter()

	r.HandleFunc("/{prefix}/healthz", healthHandler)

	r.HandleFunc("/healthz", healthHandler)
	loggedRouter := handlers.LoggingHandler(os.Stdout, r)

	log.Fatal(http.ListenAndServe(":8080", loggedRouter))
}

func healthHandler(w http.ResponseWriter, r *http.Request) {
	json.NewEncoder(w).Encode(map[string]string{"health": "ok"})
}
```

Docker to create the app:
```
FROM golang:1.20

WORKDIR /app
COPY go.mod go.sum ./
RUN go mod download
COPY *.go ./
RUN CGO_ENABLED=0 GOOS=linux go build -o /k8s-test
RUN chmod +x /k8s-test
CMD ["/k8s-test"]
```

### Cilium Version

```
Client: 1.15.6 a09e05e6 2024-06-08T21:31:01+00:00 go version go1.21.11 linux/amd64
Daemon: 1.15.6 a09e05e6 2024-06-08T21:31:01+00:00 go version go1.21.11 linux/amd64
```

### Kernel Version

`5.10.210-201.852.amzn2.x86_64`

### Kubernetes Version

```
Client Version: v1.29.5
Kustomize Version: v5.0.4-0.20230601165947-6ce0bf390ce3
Server Version: v1.28.9-eks-036c24b
```

### Sysdump

[cilium-sysdump-20240618-183408.zip](https://github.com/user-attachments/files/15891692/cilium-sysdump-20240618-183408.zip)

### Relevant log output

```shell
//cilium-dbg monitor on a different node than where the app runs (success)
-> endpoint 224 flow 0x310063a4 , identity ingress->49337 state new ifindex lxc607f7573e605 orig-ip 100.64.26.177: 100.64.26.177:46771 -> 100.66.194.32:8080 tcp SYN
-> network flow 0x18c2793 , identity 49337->ingress state reply ifindex eth1 orig-ip 0.0.0.0: 100.66.194.32:8080 -> 100.64.26.177:46771 tcp SYN, ACK
-> endpoint 224 flow 0x310063a4 , identity ingress->49337 state established ifindex lxc607f7573e605 orig-ip 100.64.26.177: 100.64.26.177:46771 -> 100.66.194.32:8080 tcp ACK
-> endpoint 224 flow 0x310063a4 , identity ingress->49337 state established ifindex lxc607f7573e605 orig-ip 100.64.26.177: 100.64.26.177:46771 -> 100.66.194.32:8080 tcp ACK
-> network flow 0x18c2793 , identity 49337->ingress state reply ifindex eth1 orig-ip 0.0.0.0: 100.66.194.32:8080 -> 100.64.26.177:46771 tcp ACK


//cilium-dbg monitor on the same node than where the app runs (failure)
-> endpoint 224 flow 0xf89bad12 , identity ingress->49337 state new ifindex 0 orig-ip 100.66.194.38: 100.66.194.38:43345 -> 100.66.194.32:8080 tcp SYN
-> network flow 0x39a2e094 , identity 49337->ingress state reply ifindex eth0 orig-ip 0.0.0.0: 100.66.194.32:8080 -> 100.66.194.38:43345 tcp SYN, ACK
-> endpoint 224 flow 0x9bc87b24 , identity world->49337 state new ifindex lxc607f7573e605 orig-ip 10.196.104.131: 10.196.104.131:61438 -> 100.66.194.32:8080 tcp SYN
-> network flow 0x88b2c23c , identity 49337->world state reply ifindex eth1 orig-ip 0.0.0.0: 100.66.194.32:8080 -> 10.196.104.131:61438 tcp SYN, ACK
-> endpoint 224 flow 0x9bc87b24 , identity world->49337 state established ifindex lxc607f7573e605 orig-ip 10.196.104.131: 10.196.104.131:61438 -> 100.66.194.32:8080 tcp ACK
-> endpoint 224 flow 0x9bc87b24 , identity world->49337 state established ifindex lxc607f7573e605 orig-ip 10.196.104.131: 10.196.104.131:61438 -> 100.66.194.32:8080 tcp ACK
-> network flow 0x88b2c23c , identity 49337->world state reply ifindex eth1 orig-ip 0.0.0.0: 100.66.194.32:8080 -> 10.196.104.131:61438 tcp ACK
-> network flow 0x88b2c23c , identity 49337->world state reply ifindex eth1 orig-ip 0.0.0.0: 100.66.194.32:8080 -> 10.196.104.131:61438 tcp ACK, FIN
-> endpoint 224 flow 0x9bc87b24 , identity world->49337 state established ifindex lxc607f7573e605 orig-ip 10.196.104.131: 10.196.104.131:61438 -> 100.66.194.32:8080 tcp ACK, FIN
-> endpoint 224 flow 0x91177042 , identity world->49337 state new ifindex lxc607f7573e605 orig-ip 10.196.108.107: 10.196.108.107:57380 -> 100.66.194.32:8080 tcp SYN
-> network flow 0x5d77ed3b , identity 49337->world state reply ifindex eth1 orig-ip 0.0.0.0: 100.66.194.32:8080 -> 10.196.108.107:57380 tcp SYN, ACK
-> endpoint 224 flow 0x91177042 , identity world->49337 state established ifindex lxc607f7573e605 orig-ip 10.196.108.107: 10.196.108.107:57380 -> 100.66.194.32:8080 tcp ACK
-> endpoint 224 flow 0x91177042 , identity world->49337 state established ifindex lxc607f7573e605 orig-ip 10.196.108.107: 10.196.108.107:57380 -> 100.66.194.32:8080 tcp ACK
-> network flow 0x5d77ed3b , identity 49337->world state reply ifindex eth1 orig-ip 0.0.0.0: 100.66.194.32:8080 -> 10.196.108.107:57380 tcp ACK
-> network flow 0x5d77ed3b , identity 49337->world state reply ifindex eth1 orig-ip 0.0.0.0: 100.66.194.32:8080 -> 10.196.108.107:57380 tcp ACK, FIN
-> endpoint 224 flow 0x91177042 , identity world->49337 state established ifindex lxc607f7573e605 orig-ip 10.196.108.107: 10.196.108.107:57380 -> 100.66.194.32:8080 tcp ACK, FIN
-> endpoint 224 flow 0x91177042 , identity world->49337 state established ifindex lxc607f7573e605 orig-ip 10.196.108.107: 10.196.108.107:57380 -> 100.66.194.32:8080 tcp ACK
-> endpoint 224 flow 0x8239eff1 , identity world->49337 state new ifindex lxc607f7573e605 orig-ip 10.196.107.196: 10.196.107.196:56322 -> 100.66.194.32:8080 tcp SYN
-> network flow 0xe8581089 , identity 49337->world state reply ifindex eth1 orig-ip 0.0.0.0: 100.66.194.32:8080 -> 10.196.107.196:56322 tcp SYN, ACK
-> endpoint 224 flow 0x8239eff1 , identity world->49337 state established ifindex lxc607f7573e605 orig-ip 10.196.107.196: 10.196.107.196:56322 -> 100.66.194.32:8080 tcp ACK
-> endpoint 224 flow 0x8239eff1 , identity world->49337 state established ifindex lxc607f7573e605 orig-ip 10.196.107.196: 10.196.107.196:56322 -> 100.66.194.32:8080 tcp ACK
-> endpoint 224 flow 0x8239eff1 , identity world->49337 state established ifindex lxc607f7573e605 orig-ip 10.196.107.196: 10.196.107.196:56322 -> 100.66.194.32:8080 tcp ACK, FIN
-> network flow 0xe8581089 , identity 49337->world state reply ifindex eth1 orig-ip 0.0.0.0: 100.66.194.32:8080 -> 10.196.107.196:56322 tcp ACK
-> network flow 0xe8581089 , identity 49337->world state reply ifindex eth1 orig-ip 0.0.0.0: 100.66.194.32:8080 -> 10.196.107.196:56322 tcp ACK, FIN
-> endpoint 224 flow 0x8239eff1 , identity world->49337 state established ifindex lxc607f7573e605 orig-ip 10.196.107.196: 10.196.107.196:56322 -> 100.66.194.32:8080 tcp ACK
-> endpoint 224 flow 0x2785c445 , identity host->49337 state new ifindex 0 orig-ip 10.196.104.81: 10.196.104.81:35380 -> 100.66.194.32:8080 tcp SYN
-> stack flow 0xfa3a954e , identity 49337->host state reply ifindex 0 orig-ip 0.0.0.0: 100.66.194.32:8080 -> 10.196.104.81:35380 tcp SYN, ACK
-> endpoint 224 flow 0x2785c445 , identity host->49337 state established ifindex 0 orig-ip 10.196.104.81: 10.196.104.81:35380 -> 100.66.194.32:8080 tcp ACK
-> endpoint 224 flow 0x2785c445 , identity host->49337 state established ifindex 0 orig-ip 10.196.104.81: 10.196.104.81:35380 -> 100.66.194.32:8080 tcp ACK
-> endpoint 224 flow 0x9c6707b6 , identity host->49337 state established ifindex 0 orig-ip 10.196.104.81: 10.196.104.81:35368 -> 100.66.194.32:8080 tcp ACK
-> endpoint 224 flow 0x2785c445 , identity host->49337 state established ifindex 0 orig-ip 10.196.104.81: 10.196.104.81:35380 -> 100.66.194.32:8080 tcp ACK, FIN
-> endpoint 224 flow 0x9c6707b6 , identity host->49337 state established ifindex 0 orig-ip 10.196.104.81: 10.196.104.81:35368 -> 100.66.194.32:8080 tcp ACK, FIN
-> endpoint 224 flow 0x9c6707b6 , identity host->49337 state new ifindex 0 orig-ip 10.196.104.81: 10.196.104.81:35368 -> 100.66.194.32:8080 tcp SYN
-> stack flow 0x26f38e9a , identity 49337->host state reply ifindex 0 orig-ip 0.0.0.0: 100.66.194.32:8080 -> 10.196.104.81:35368 tcp SYN, ACK
-> endpoint 224 flow 0x9c6707b6 , identity host->49337 state established ifindex 0 orig-ip 10.196.104.81: 10.196.104.81:35368 -> 100.66.194.32:8080 tcp ACK
-> stack flow 0xfa3a954e , identity 49337->host state reply ifindex 0 orig-ip 0.0.0.0: 100.66.194.32:8080 -> 10.196.104.81:35380 tcp ACK
-> stack flow 0x26f38e9a , identity 49337->host state reply ifindex 0 orig-ip 0.0.0.0: 100.66.194.32:8080 -> 10.196.104.81:35368 tcp ACK
-> stack flow 0xfa3a954e , identity 49337->host state reply ifindex 0 orig-ip 0.0.0.0: 100.66.194.32:8080 -> 10.196.104.81:35380 tcp ACK, FIN
-> endpoint 224 flow 0x2785c445 , identity host->49337 state established ifindex 0 orig-ip 10.196.104.81: 10.196.104.81:35380 -> 100.66.194.32:8080 tcp ACK
-> stack flow 0x26f38e9a , identity 49337->host state reply ifindex 0 orig-ip 0.0.0.0: 100.66.194.32:8080 -> 10.196.104.81:35368 tcp ACK, FIN
-> endpoint 224 flow 0x9c6707b6 , identity host->49337 state established ifindex 0 orig-ip 10.196.104.81: 10.196.104.81:35368 -> 100.66.194.32:8080 tcp ACK
```

### Anything else?

Note: there are several Github issues related to this, but wanted to provide a very direct summary and reproducible test-case.
https://github.com/cilium/cilium/issues/20942
https://github.com/cilium/cilium/issues/25613

As per the comments in these other issues, if we set:
```
bpf:
  hostLegacyRouting: true
```
Direct node-to-pod-via-envoy works.

We have also attempted without success:
1. configuring pods and nodes to use the same subnets / CIDR ranges 
2. set the first-inteface-index to 0 in the custom ConfigMap, so pods are put on the same ENI as Node. 

### Cilium Users Document

- [ ] Are you a user of Cilium? Please add yourself to the [Users doc](https://github.com/cilium/cilium/blob/main/USERS.md)

### Code of Conduct

- [X] I agree to follow this project's Code of Conduct

**Comment by eudoxiabanderbear** [comment]
When looking at the flow using tcpdump, we did see that the application pod did receive the SYN call from the ingress. However when the application pop was attempting to send the SYN-ACK back, the packet appears to be unable to route back, to the ingress.   Followed by the ingress, attempting to restart the TCP flow.

```
19:23:00.745947 IP ip-100-66-155-240.us-west-2.compute.internal.46283 > ip-100-66-156-47.us-west-2.compute.internal.7654: Flags [S], seq 2885681828, win 62727, options [mss 8961,sackOK,TS val 340353580 ecr 0,nop,wscale 7], length 0
19:23:00.745967 IP ip-100-66-156-47.us-west-2.compute.internal.7654 > ip-100-66-155-240.us-west-2.compute.internal.46283: Flags [S.], seq 3184591693, ack 2885681829, win 62643, options [mss 8961,sackOK,TS val 3149138160 ecr 340353580,nop,wscale 7], length 0
19:23:00.745984 IP ip-100-66-156-47.us-west-2.compute.internal.7654 > ip-100-66-155-240.us-west-2.compute.internal.46283: Flags [S.], seq 3184591693, ack 2885681829, win 62643, options [mss 8961,sackOK,TS val 3149138160 ecr 340353580,nop,wscale 7], length 0
19:23:01.755860 IP ip-100-66-155-240.us-west-2.compute.internal.46283 > ip-100-66-156-47.us-west-2.compute.internal.7654: Flags [S], seq 2885681828, win 62727, options [mss 8961,sackOK,TS val 340354590 ecr 0,nop,wscale 7], length 0
19:23:01.755887 IP ip-100-66-156-47.us-west-2.compute.internal.7654 > ip-100-66-155-240.us-west-2.compute.internal.46283: Flags [S.], seq 3184591693, ack 2885681829, win 62643, options [mss 8961,sackOK,TS val 3149139170 ecr 340353580,nop,wscale 7], length 0
19:23:01.755904 IP ip-100-66-156-47.us-west-2.compute.internal.7654 > ip-100-66-155-240.us-west-2.compute.internal.46283: Flags [S.], seq 3184591693, ack 2885681829, win 62643, options [mss 8961,sackOK,TS val 3149139170 ecr 340353580,nop,wscale 7], length 0
19:23:01.755906 IP ip-100-66-156-47.us-west-2.compute.internal.7654 > ip-100-66-155-240.us-west-2.compute.internal.46283: Flags [S.], seq 3184591693, ack 2885681829, win 62643, options [mss 8961,sackOK,TS val 3149139170 ecr 340353580,nop,wscale 7], length 0
19:23:01.755909 IP ip-100-66-156-47.us-west-2.compute.internal.7654 > ip-100-66-155-240.us-west-2.compute.internal.46283: Flags [S.], seq 3184591693, ack 2885681829, win 62643, options [mss 8961,sackOK,TS val 3149139170 ecr 340353580,nop,wscale 7], length 0
```

**Comment by sayboras** [comment]
Thanks for your issue. 

As mentioned in your comment, the workaround is to set bpf.hostLegacyRouting=true. You can probably set endpointRoutes.enabled=true as well. 

Based on my previous investigation, most likely it's due to below block, especially the variable ENABLE_SKIP_FIB.

https://github.com/cilium/cilium/blob/451c3b28a9775b6d7c77eb292dd0366cad1cd22c/pkg/datapath/linux/config/config.go#L1048-L1059

**Comment by jschwartzy** [comment]
Really appreciate the follow-up and suggestion.

I attempted to comment out this code to observe the behavior:
'''
// if len(option.Config.GetDevices()) == 1 {
		// 	if e.IsHost() || !option.Config.EnforceLXCFibLookup() {
		// 		fmt.Fprintf(fw, "#define ENABLE_SKIP_FIB 1\n")
		// 	}
		// }
```
Still hitting the same issue.
```
* Connection #0 to host 127.0.0.1 left intact
upstream connect error or disconnect/reset before headers. reset reason: connection timeout
```
Also tried running this on both `arm64` and `amd64` to rule out any architecture-specific behavior.

**Comment by julianwiedmann** [comment]
> When looking at the flow using tcpdump, we did see that the application pod did receive the SYN call from the ingress. However when the application pop was attempting to send the SYN-ACK back, the packet appears to be unable to route back, to the ingress. Followed by the ingress, attempting to restart the TCP flow.

I think it's worth revisiting this issue once https://github.com/cilium/cilium/pull/33014 has been merged.

This would allow replies destined for the Ingress endpoint to be processed as expected [here](https://github.com/cilium/cilium/blob/c3d943fd6cef0de02f1e51f30882f28a431ec107/bpf/bpf_lxc.c#L1128).

**Comment by jschwartzy** [comment]
Issue is still present in `1.16.0`.

**Comment by jschwartzy** [comment]
Attempted to include the PR linked above into Cilium `1.16.1` but no change to the behavior.

If we comment out the code linked below, the co-located Envoy proxy/replica routing works successfully. 

https://github.com/cilium/cilium/blob/2387d597752132e1f2fc351f11bc04c2d76ea6e9/pkg/datapath/linux/config/config.go#L518-L520

```
[~]$ curl -v http://127.0.0.1:31026/k8s-test/healthz
*   Trying 127.0.0.1:31026...
* Connected to 127.0.0.1 (127.0.0.1) port 31026
> GET /k8s-test/healthz HTTP/1.1
> Host: 127.0.0.1:31026
> User-Agent: curl/8.3.0
> Accept: */*
> 
< HTTP/1.1 200 OK
< date: Wed, 21 Aug 2024 00:05:06 GMT
< content-length: 16
< content-type: text/plain; charset=utf-8
< x-envoy-upstream-service-time: 1
< server: envoy
< 
{"health":"ok"}
* Connection #0 to host 127.0.0.1 left intact
```

The `ENABLE_HOST_ROUTING` flag is associated with:
https://github.com/cilium/cilium/blob/main/bpf/bpf_host.c
https://github.com/cilium/cilium/blob/main/bpf/bpf_lxc.c

Any additional suggestions what we can try? Appreciate it.

**Comment by dgsardina** [comment]
I am hitting this issue on 1.16.3

**Comment by julianwiedmann** [comment]
@jschwartzy with https://github.com/cilium/cilium/pull/35143 having landed in `v1.16.4`, I think it would be good to re-test this issue once more and see whether it's addressed.

**Comment by jschwartzy** [comment]
Tested on `1.16.4` successfully, thank you for following up!

**Comment by julianwiedmann** [comment]
super, thank you!

**Comment by kotyara85** [comment]
Hitting the same issue with 1.17.10 running envoy-gateway. This also seems to be the case when nodes are on the same rack. 
We use bgp lb in cilium
```
  agent-not-ready-taint-key: node.cilium.io/agent-not-ready
  arping-refresh-period: 30s
  auto-direct-node-routes: "false"
  bgp-secrets-namespace: kube-system
  bpf-distributed-lru: "false"
  bpf-events-drop-enabled: "true"
  bpf-events-policy-verdict-enabled: "true"
  bpf-events-trace-enabled: "true"
  bpf-lb-acceleration: disabled
  bpf-lb-algorithm-annotation: "false"
  bpf-lb-external-clusterip: "false"
  bpf-lb-map-max: "65536"
  bpf-lb-mode-annotation: "false"
  bpf-lb-sock: "false"
  bpf-lb-source-range-all-types: "false"
  bpf-map-dynamic-size-ratio: "0.0025"
  bpf-node-map-max: "65536"
  bpf-policy-map-max: "16384"
  bpf-root: /sys/fs/bpf
  cgroup-root: /run/cilium/cgroupv2
  cilium-endpoint-gc-interval: 5m0s
  cluster-id: "0"
  cluster-name: default
  clustermesh-enable-endpoint-sync: "false"
  clustermesh-enable-mcs-api: "false"
  controller-group-metrics: write-cni-file sync-host-ips sync-lb-maps-with-k8s-services
  custom-cni-conf: "true"
  datapath-mode: veth
  debug: "false"
  debug-verbose: ""
  default-lb-service-ipam: lbipam
  devices: eth0
  direct-routing-skip-unreachable: "false"
  dnsproxy-enable-transparent-mode: "true"
  dnsproxy-socket-linger-timeout: "10"
  egress-gateway-reconciliation-trigger-interval: 1s
  enable-auto-protect-node-port-range: "true"
  enable-bandwidth-manager: "true"
  enable-bbr: "false"
  enable-bgp-control-plane: "true"
  enable-bgp-control-plane-status-report: "true"
  enable-bpf-clock-probe: "false"
  enable-bpf-masquerade: "true"
  enable-endpoint-health-checking: "true"
  enable-endpoint-lockdown-on-policy-overflow: "false"
  enable-endpoint-routes: "true"
  enable-experimental-lb: "false"
  enable-health-check-loadbalancer-ip: "false"
  enable-health-check-nodeport: "true"
  enable-health-checking: "true"
  enable-hubble: "false"
  enable-internal-traffic-policy: "true"
  enable-ipv4: "true"
  enable-ipv4-big-tcp: "true"
  enable-ipv4-masquerade: "true"
  enable-ipv6: "false"
  enable-ipv6-big-tcp: "false"
  enable-ipv6-masquerade: "true"
  enable-k8s-networkpolicy: "true"
  enable-k8s-terminating-endpoint: "true"
  enable-l2-neigh-discovery: "true"
  enable-l2-pod-announcements: "true"
  enable-l7-proxy: "true"
  enable-lb-ipam: "true"
  enable-local-redirect-policy: "true"
  enable-masquerade-to-route-source: "false"
  enable-metrics: "true"
  enable-node-selector-labels: "false"
  enable-non-default-deny-policies: "true"
  enable-policy: default
  enable-policy-secrets-sync: "true"
  enable-runtime-device-detection: "true"
  enable-sctp: "false"
  enable-source-ip-verification: "true"
  enable-svc-source-range-check: "true"
  enable-tcx: "true"
  enable-vtep: "false"
  enable-well-known-identities: "false"
  enable-xt-socket-fallback: "true"
  envoy-access-log-buffer-size: "4096"
  envoy-base-id: "0"
  envoy-keep-cap-netbindservice: "false"
  external-envoy-proxy: "true"
  health-check-icmp-failure-threshold: "3"
  http-retry-count: "3"
  hubble-disable-tls: "false"
  hubble-export-file-max-backups: "5"
  hubble-export-file-max-size-mb: "10"
  hubble-listen-address: :4244
  hubble-socket-path: /var/run/cilium/hubble.sock
  hubble-tls-cert-file: /var/lib/cilium/tls/hubble/server.crt
  hubble-tls-client-ca-files: /var/lib/cilium/tls/hubble/client-ca.crt
  hubble-tls-key-file: /var/lib/cilium/tls/hubble/server.key
  identity-allocation-mode: crd
  identity-gc-interval: 15m0s
  identity-heartbeat-timeout: 30m0s
  install-no-conntrack-iptables-rules: "false"
  ipam: delegated-plugin
  ipam-cilium-node-update-rate: 15s
  iptables-random-fully: "false"
  ipv4-native-routing-cidr: 10.0.0.0/8
  k8s-require-ipv4-pod-cidr: "false"
  k8s-require-ipv6-pod-cidr: "false"
  kube-proxy-replacement: "true"
  kube-proxy-replacement-healthz-bind-address: ""
  l2-pod-announcements-interface: eth0
  labels: io\.kubernetes\.pod\.namespace app\.kubernetes\.io/name io\.cilium\.k8s\.policy\.cluster
    !io\.cilium\.k8s\.policy\.serviceaccount !io\.cilium\.k8s\.namespace\.labels !app\.kubernetes\.io
  max-connected-clusters: "255"
  mesh-auth-enabled: "true"
  mesh-auth-gc-interval: 5m0s
  mesh-auth-queue-size: "1024"
  mesh-auth-rotated-identities-queue-size: "1024"
  monitor-aggregation: medium
  monitor-aggregation-flags: all
  monitor-aggregation-interval: 5s
  nat-map-stats-entries: "32"
  nat-map-stats-interval: 30s
  node-port-bind-protection: "true"
  nodeport-addresses: ""
  nodes-gc-interval: 5m0s
  operator-api-serve-addr: 127.0.0.1:9234
  operator-prometheus-serve-addr: :9963
  policy-cidr-match-mode: ""
  policy-secrets-namespace: cilium-secrets
  policy-secrets-only-from-secrets-namespace: "true"
  preallocate-bpf-maps: "false"
  procfs: /host/proc
  prometheus-serve-addr: :9962
  proxy-connect-timeout: "2"
  proxy-idle-timeout-seconds: "60"
  proxy-initial-fetch-timeout: "30"
  proxy-max-concurrent-retries: "128"
  proxy-max-connection-duration-seconds: "0"
  proxy-max-requests-per-connection: "0"
  proxy-xff-num-trusted-hops-egress: "0"
  proxy-xff-num-trusted-hops-ingress: "0"
  remove-cilium-node-taints: "true"
  routing-mode: native
  service-no-backend-response: reject
  set-cilium-is-up-condition: "true"
  set-cilium-node-taints: "true"
  synchronize-k8s-nodes: "true"
  tofqdns-dns-reject-response-code: refused
  tofqdns-enable-dns-compression: "true"
  tofqdns-endpoint-max-ip-per-hostname: "1000"
  tofqdns-idle-connection-grace-period: 0s
  tofqdns-max-deferred-connection-deletes: "10000"
  tofqdns-proxy-response-max-delay: 100ms
  tunnel-protocol: vxlan
  tunnel-source-port-range: 0-0
  unmanaged-pod-watcher-interval: "15"
  vtep-cidr: ""
  vtep-endpoint: ""
  vtep-mac: ""
  vtep-mask: ""
```

@jschwartzy
