### ISSUE TITLE
Kubevirt and route-mtu don't play well: better documentation needed

### ISSUE THREAD

**Issue by jackmaninov** [cilium/cilium#38828]
Note: former title was "Packets to Kubevirt VM from Egress Gateway missing after fragmentation using default MTU"
### Is there an existing issue for this?

- [x] I have searched the existing issues

### Version

equal or higher than v1.17.2 and lower than v1.18.0

### What happened?

I am having some sort of MTU / packet fragmentation issue while attempting to pass traffic from a virtual machine running under Kubevirt through an Egress Gateway. My intended use case is to be able to run VMs on a worker node with its inboud/outbound traffic to the internet passing through a separate ingress node using the cilium egress gateway feature. 

In my test environment, I have two machines running Talos linux 1.9.5 on KVM VPSs on different providers, with cilium tunnelling traffic between them using vxlan as per the default. The Kubevirt VM runs on one machine, and a CiliumEgressGatewayPolicy routs its traffic to an address on the other machine. The VM can be running in either `bridge` or `masquerade` networking mode. For testing I am using VMs and pods running alpine (3.21.2 at the time of writing).

The issue is that inbound packets from the egress gateway that are over the MTU of the underlying network minus the vxlan overhead (in my case 1450 bytes) do not make it back to the VM. I test for this using HTTP requests to `ifconfig.me` (34.160.111.145), which returns the IP address the site sees the request coming from; I use this to validate that traffic is correctly passing through the egress gateway. 

Due to the behaviour of the site, using `curl` returns a packet small enough not to fragment (simply returning an IP address), while using `wget` returns a full HTML page that is large enough to fragment. Using cilium's default MTU detection (equivalent to setting `MTU: 0` in the helm chart values), I get a successful result using `curl` and a hung connection using `wget`:

```
vm2-alpine:~$ curl ifconfig.me
162.254.84.23vm2-alpine:~$
vm2-alpine:~$ wget ifconfig.me
Prepended http:// to 'ifconfig.me'
--2025-04-09 09:43:34--  http://ifconfig.me/
Resolving ifconfig.me (ifconfig.me)... 34.160.111.145, 2600:1901:0:b2bd::
Connecting to ifconfig.me (ifconfig.me)|34.160.111.145|:80... connected.
HTTP request sent, awaiting response... ^C
vm2-alpine:~$
```

Meanwhile a regular pod running an alpine image in the same namespace alongside the VM and subject to the same CiliumEgressGatewayPolicy is successful:

```
/ # curl ifconfig.me
162.254.84.23/ #
/ # wget ifconfig.me
Connecting to ifconfig.me (34.160.111.145:80)
saving to 'index.html'
index.html           100% |******************************************************************************************************************************| 10405  0:00:00 ETA
'index.html' saved
/ #
```

While the VM's HTTP request is hanging, I do not see cilium dropping any packets while running `cilium-dbg monitor --type drop`  on either machine. Using `tcpdump` I can see an HTTP response packet of length 2800 entering the `cilium_vxlan` interface on the ingress machine (which is resent a few times at 2800 and then backs down to 1400), which seems to fragment into a first packet of length 867 on the `cilium_vxlan` interface on the worker machine running the VM:

Ingress node (162.254.84.23):

```
/ # tcpdump -n host 34.160.111.145 -i cilium_vxlan
tcpdump: verbose output suppressed, use -v[v]... for full protocol decode
listening on cilium_vxlan, link-type EN10MB (Ethernet), snapshot length 262144 bytes
10:12:40.550242 IP 10.244.2.6.52854 > 34.160.111.145.80: Flags [S], seq 3181702053, win 64240, options [mss 1460,sackOK,TS val 2705943387 ecr0,nop,wscale 7], length 0
10:12:40.622150 IP 34.160.111.145.80 > 10.244.2.6.52854: Flags [S.], seq 2284002840, ack 3181702054, win 65535, options [mss 1412,sackOK,TS val 2465103236 ecr 2705943387,nop,wscale 8], length 0
10:12:40.649977 IP 10.244.2.6.52854 > 34.160.111.145.80: Flags [.], ack 1, win 502, options [nop,nop,TS val 2705943487 ecr 2465103236], length 0
10:12:40.650265 IP 10.244.2.6.52854 > 34.160.111.145.80: Flags [P.], seq 1:127, ack 1, win 502, options [nop,nop,TS val 2705943487 ecr 2465103236], length 126: HTTP: GET / HTTP/1.1
10:12:40.723370 IP 34.160.111.145.80 > 10.244.2.6.52854: Flags [.], ack 127, win 1050, options [nop,nop,TS val 2465103336 ecr 2705943487], length 0
10:12:40.835555 IP 34.160.111.145.80 > 10.244.2.6.52854: Flags [P.], seq 1:169, ack 127, win 1050, options [nop,nop,TS val 2465103448 ecr 2705943487], length 168: HTTP: HTTP/1.1 200 OK
10:12:40.853201 IP 34.160.111.145.80 > 10.244.2.6.52854: Flags [P.], seq 169:2969, ack 127, win 1050, options [nop,nop,TS val 2465103466 ecr 2705943487], length 2800: HTTP
10:12:40.853375 IP 34.160.111.145.80 > 10.244.2.6.52854: Flags [P.], seq 2969:5769, ack 127, win 1050, options [nop,nop,TS val 2465103466 ecr2705943487], length 2800: HTTP
10:12:40.853417 IP 34.160.111.145.80 > 10.244.2.6.52854: Flags [P.], seq 5769:8569, ack 127, win 1050, options [nop,nop,TS val 2465103466 ecr2705943487], length 2800: HTTP
10:12:40.853447 IP 34.160.111.145.80 > 10.244.2.6.52854: Flags [P.], seq 8569:10668, ack 127, win 1050, options [nop,nop,TS val 2465103466 ecr 2705943487], length 2099: HTTP
10:12:40.868194 IP 10.244.2.6.52854 > 34.160.111.145.80: Flags [.], ack 169, win 501, options [nop,nop,TS val 2705943705 ecr 2465103448], length 0
10:12:40.885790 IP 10.244.2.6.52854 > 34.160.111.145.80: Flags [.], ack 169, win 501, options [nop,nop,TS val 2705943719 ecr 2465103448,nop,nop,sack 1 {9969:10668}], length 0
10:12:40.984919 IP 34.160.111.145.80 > 10.244.2.6.52854: Flags [P.], seq 169:2969, ack 127, win 1050, options [nop,nop,TS val 2465103600 ecr 2705943719], length 2800: HTTP
10:12:40.989109 IP 34.160.111.145.80 > 10.244.2.6.52854: Flags [.], seq 2969:4369, ack 127, win 1050, options [nop,nop,TS val 2465103603 ecr 2705943719], length 1400: HTTP
10:12:40.989193 IP 34.160.111.145.80 > 10.244.2.6.52854: Flags [P.], seq 4369:5769, ack 127, win 1050, options [nop,nop,TS val 2465103603 ecr2705943719], length 1400: HTTP
10:12:40.998072 IP 34.160.111.145.80 > 10.244.2.6.52854: Flags [P.], seq 5769:8569, ack 127, win 1050, options [nop,nop,TS val 2465103610 ecr2705943719], length 2800: HTTP
10:12:41.006041 IP 34.160.111.145.80 > 10.244.2.6.52854: Flags [.], seq 8569:9969, ack 127, win 1050, options [nop,nop,TS val 2465103618 ecr 2705943719], length 1400: HTTP
10:12:41.306665 IP 34.160.111.145.80 > 10.244.2.6.52854: Flags [.], seq 169:1569, ack 127, win 1050, options [nop,nop,TS val 2465103921 ecr 2705943719], length 1400: HTTP
10:12:41.939802 IP 34.160.111.145.80 > 10.244.2.6.52854: Flags [.], seq 169:1569, ack 127, win 1050, options [nop,nop,TS val 2465104553 ecr 2705943719], length 1400: HTTP
10:12:43.156599 IP 34.160.111.145.80 > 10.244.2.6.52854: Flags [.], seq 169:1569, ack 127, win 1050, options [nop,nop,TS val 2465105769 ecr 2705943719], length 1400: HTTP
10:12:43.713195 IP 10.244.2.6.52854 > 34.160.111.145.80: Flags [F.], seq 127, ack 169, win 501, options [nop,nop,TS val 2705946550 ecr 2465103448,nop,nop,sack 1 {9969:10668}], length 0
10:12:43.792941 IP 34.160.111.145.80 > 10.244.2.6.52854: Flags [.], ack 128, win 1050, options [nop,nop,TS val 2465106404 ecr 2705946550], length 0
10:12:43.940108 IP 34.160.111.145.80 > 10.244.2.6.53884: Flags [.], seq 3571440428:3571441828, ack 3914819932, win 1050, options [nop,nop,TS val 1491080555 ecr 2705914647], length 1400: HTTP: HTTP/1.1 200 OK
10:12:45.584133 IP 34.160.111.145.80 > 10.244.2.6.52854: Flags [.], seq 169:1569, ack 128, win 1050, options [nop,nop,TS val 2465108201 ecr 2705946550], length 1400: HTTP
^C
24 packets captured
24 packets received by filter
0 packets dropped by kernel
```

Worker node:

```
Worker Node (45.131.65.166):
tcpdump -n -i cilium_vxlan | grep 34\.160\.111\.145
tcpdump: verbose output suppressed, use -v[v]... for full protocol decode
listening on cilium_vxlan, link-type EN10MB (Ethernet), snapshot length 262144 bytes
10:11:02.151228 IP 10.244.2.6.50008 > 34.160.111.145.80: Flags [S], seq 1251196821, win 64240, options [mss 1460,sackOK,TS val 2705845002 ecr0,nop,wscale 7], length 0
10:11:02.231621 IP 34.160.111.145.80 > 10.244.2.6.50008: Flags [S.], seq 3749262195, ack 1251196822, win 65535, options [mss 1412,sackOK,TS val 2296397906 ecr 2705845002,nop,wscale 8], length 0
10:11:02.234773 IP 10.244.2.6.50008 > 34.160.111.145.80: Flags [.], ack 1, win 502, options [nop,nop,TS val 2705845085 ecr 2296397906], length 0
10:11:02.236884 IP 10.244.2.6.50008 > 34.160.111.145.80: Flags [P.], seq 1:127, ack 1, win 502, options [nop,nop,TS val 2705845087 ecr 2296397906], length 126: HTTP: GET / HTTP/1.1
10:11:02.306904 IP 34.160.111.145.80 > 10.244.2.6.50008: Flags [.], ack 127, win 1050, options [nop,nop,TS val 2296397991 ecr 2705845087], length 0
10:11:02.420327 IP 34.160.111.145.80 > 10.244.2.6.50008: Flags [P.], seq 9801:10668, ack 127, win 1050, options [nop,nop,TS val 2296398107 ecr 2705845087], length 867: HTTP
10:11:02.422561 IP 10.244.2.6.50008 > 34.160.111.145.80: Flags [.], ack 1, win 502, options [nop,nop,TS val 2705845273 ecr 2296397991,nop,nop,sack 1 {9801:10668}], length 0
10:11:07.025749 IP 10.244.2.6.50008 > 34.160.111.145.80: Flags [F.], seq 127, ack 1, win 502, options [nop,nop,TS val 2705849876 ecr 2296397991,nop,nop,sack 1 {9801:10668}], length 0
10:11:07.097334 IP 34.160.111.145.80 > 10.244.2.6.50008: Flags [.], ack 128, win 1050, options [nop,nop,TS val 2296402785 ecr 2705849876], length 0
^C82 packets captured
82 packets received by filter
0 packets dropped by kernel
```

After a lot of testing, I found that I am able to get my expected behaviour inside the VM by reducing cilium's MTU to 1450, seemingly to take into account the overhead of vxlan. If I also, for example, turn on wireguard encryption, I must further reduce cilium's MTU to 1390 (i.e. wireguard's 60 byte IPV4 overhead) in order for large packets to be able to return to the VM.

Since KubeVirt should be connecting using SocketLB (I *do* have `socketLB.hostNamespaceOnly=true`), I suspect there is some issue or bug with maximum MTU detection on this data path, as I would not expect to need to lower cilium's MTU setting for the entire cluster in order to have this one workload able to successfully connect to outside networks. My only hint as to what is going on is that when I have MTU set above 1450, I see packets of invalid length between the two nodes while the VM's HTTP request is hanging:

Ingress node:

```
/ # tcpdump -n -vv |grep invalid -C1
tcpdump: listening on ens3, link-type EN10MB (Ethernet), snapshot length 262144 bytes
    162.254.84.23.45329 > 45.131.65.166.8472: OTV, flags [I] (0x08), overlay 0, instance 6
IP [total length 1452 > length 1450] (invalid) (tos 0x0, ttl 55, id 5934, offset 0, flags [none], proto TCP (6), length 1452)
    34.160.111.145.80 > 10.244.2.113.50856: Flags [.], seq 1:1401, ack 127, win 1050, options [nop,nop,TS val 683030465 ecr 420844019], length 1400: HTTP, length: 1400
--
    162.254.84.23.45329 > 45.131.65.166.8472: OTV, flags [I] (0x08), overlay 0, instance 6
IP [total length 1452 > length 1450] (invalid) (tos 0x0, ttl 55, id 5935, offset 0, flags [none], proto TCP (6), length 1452)
    34.160.111.145.80 > 10.244.2.113.50856: Flags [P.], seq 1401:2801, ack 127, win 1050, options [nop,nop,TS val 683030465 ecr 420844019], length 1400: HTTP
--
    162.254.84.23.45329 > 45.131.65.166.8472: OTV, flags [I] (0x08), overlay 0, instance 6
IP [total length 1452 > length 1450] (invalid) (tos 0x0, ttl 55, id 5936, offset 0, flags [none], proto TCP (6), length 1452)
    34.160.111.145.80 > 10.244.2.113.50856: Flags [.], seq 2801:4201, ack 127, win 1050, options [nop,nop,TS val 683030465 ecr 420844019], length 1400: HTTP
--
    162.254.84.23.45329 > 45.131.65.166.8472: OTV, flags [I] (0x08), overlay 0, instance 6
IP [total length 1452 > length 1450] (invalid) (tos 0x0, ttl 55, id 5937, offset 0, flags [none], proto TCP (6), length 1452)
    34.160.111.145.80 > 10.244.2.113.50856: Flags [P.], seq 4201:5601, ack 127, win 1050, options [nop,nop,TS val 683030465 ecr 420844019], length 1400: HTTP
--
    162.254.84.23.45329 > 45.131.65.166.8472: OTV, flags [I] (0x08), overlay 0, instance 6
IP [total length 1452 > length 1450] (invalid) (tos 0x0, ttl 55, id 5938, offset 0, flags [none], proto TCP (6), length 1452)
    34.160.111.145.80 > 10.244.2.113.50856: Flags [.], seq 5601:7001, ack 127, win 1050, options [nop,nop,TS val 683030465 ecr 420844019], length 1400: HTTP
--
    162.254.84.23.45329 > 45.131.65.166.8472: OTV, flags [I] (0x08), overlay 0, instance 6
IP [total length 1452 > length 1450] (invalid) (tos 0x0, ttl 55, id 5939, offset 0, flags [none], proto TCP (6), length 1452)
    34.160.111.145.80 > 10.244.2.113.50856: Flags [P.], seq 7001:8401, ack 127, win 1050, options [nop,nop,TS val 683030465 ecr 420844019], length 1400: HTTP
--
    162.254.84.23.45329 > 45.131.65.166.8472: OTV, flags [I] (0x08), overlay 0, instance 6
IP [total length 1452 > length 1450] (invalid) (tos 0x0, ttl 55, id 5940, offset 0, flags [none], proto TCP (6), length 1452)
    34.160.111.145.80 > 10.244.2.113.50856: Flags [.], seq 8401:9801, ack 127, win 1050, options [nop,nop,TS val 683030465 ecr 420844019], length 1400: HTTP
--
    162.254.84.23.45329 > 45.131.65.166.8472: OTV, flags [I] (0x08), overlay 0, instance 6
IP [total length 1452 > length 1450] (invalid) (tos 0x0, ttl 55, id 5942, offset 0, flags [none], proto TCP (6), length 1452)
    34.160.111.145.80 > 10.244.2.113.50856: Flags [.], seq 1:1401, ack 127, win 1050, options [nop,nop,TS val 683030594 ecr 420844235], length 1400: HTTP, length: 1400
--
    162.254.84.23.45329 > 45.131.65.166.8472: OTV, flags [I] (0x08), overlay 0, instance 6
IP [total length 1452 > length 1450] (invalid) (tos 0x0, ttl 55, id 5943, offset 0, flags [none], proto TCP (6), length 1452)
    34.160.111.145.80 > 10.244.2.113.50856: Flags [P.], seq 1401:2801, ack 127, win 1050, options [nop,nop,TS val 683030594 ecr 420844235], length 1400: HTTP
--
    162.254.84.23.45329 > 45.131.65.166.8472: OTV, flags [I] (0x08), overlay 0, instance 6
IP [total length 1452 > length 1450] (invalid) (tos 0x0, ttl 55, id 5944, offset 0, flags [none], proto TCP (6), length 1452)
    34.160.111.145.80 > 10.244.2.113.50856: Flags [.], seq 2801:4201, ack 127, win 1050, options [nop,nop,TS val 683030598 ecr 420844235], length 1400: HTTP
--
    162.254.84.23.45329 > 45.131.65.166.8472: OTV, flags [I] (0x08), overlay 0, instance 6
IP [total length 1452 > length 1450] (invalid) (tos 0x0, ttl 55, id 5945, offset 0, flags [none], proto TCP (6), length 1452)
    34.160.111.145.80 > 10.244.2.113.50856: Flags [P.], seq 4201:5601, ack 127, win 1050, options [nop,nop,TS val 683030598 ecr 420844235], length 1400: HTTP
--
    162.254.84.23.45329 > 45.131.65.166.8472: OTV, flags [I] (0x08), overlay 0, instance 6
IP [total length 1452 > length 1450] (invalid) (tos 0x0, ttl 55, id 5946, offset 0, flags [none], proto TCP (6), length 1452)
    34.160.111.145.80 > 10.244.2.113.50856: Flags [.], seq 5601:7001, ack 127, win 1050, options [nop,nop,TS val 683030605 ecr 420844235], length 1400: HTTP
--
    162.254.84.23.45329 > 45.131.65.166.8472: OTV, flags [I] (0x08), overlay 0, instance 6
IP [total length 1452 > length 1450] (invalid) (tos 0x0, ttl 55, id 5947, offset 0, flags [none], proto TCP (6), length 1452)
    34.160.111.145.80 > 10.244.2.113.50856: Flags [P.], seq 7001:8401, ack 127, win 1050, options [nop,nop,TS val 683030605 ecr 420844235], length 1400: HTTP
--
    162.254.84.23.45329 > 45.131.65.166.8472: OTV, flags [I] (0x08), overlay 0, instance 6
IP [total length 1452 > length 1450] (invalid) (tos 0x0, ttl 55, id 5948, offset 0, flags [none], proto TCP (6), length 1452)
^C153 packets captured
271 packets received by filter
0 packets dropped by kernel
```

These invalid packets are no longer seen when I lower the MTU to 1450. Some off-by-two bug? These packets also do not appear when wireguard encryption is enabled (though the connection hang remains with MTU > 1390), so perhaps these are being dropped by wireguard in that instance?

I'm not  sure how I can continue to debug this at this point, but reducing the cilium MTU seems to be a successful workaround in the meantime (with whatever associated performance penalty).

### How can we reproduce the issue?

1. Install cilium with `cilium install --values values-minimal.yaml` with values:

```
MTU: 0 
tunnelProtocol: vxlan

# for Talos kube-proxy replacement
# ---
kubeProxyReplacement: true
k8sServiceHost: localhost
k8sServicePort: 7445

securityContext:
  capabilities:
    ciliumAgent:
      - CHOWN
      - KILL
      - NET_ADMIN
      - NET_RAW
      - IPC_LOCK
      - SYS_ADMIN
      - SYS_RESOURCE
      - DAC_OVERRIDE
      - FOWNER
      - SETGID
      - SETUID
    cleanCiliumState:
      - NET_ADMIN
      - SYS_ADMIN
      - SYS_RESOURCE
cgroup:
  autoMount:
    enabled: false
  hostRoot: /sys/fs/cgroup
# ---
# end Talos kube-proxy replacement

encryption:
  enabled: false
  type: wireguard
  nodeEncryption: true

egressGateway:
  enabled: true

l7Proxy: true
bpf:
  masquerade: true

enableIPv4Masquerade: true

nodePort:
  enabled: true
  enableHealthCheck: true
      
hostPort:
  enabled: true

cluster:
  name: beta
  id: 1


socketLB:
  enabled: true
  hostNamespaceOnly: true
```

2. Modify values with `MTU: 1450` for workaround.
3. Set `encryption.enabled: true` and `MTU: 1390` for successful wireguard tunnelling, any higher MTU also fails

### Cilium Version

1.17.2, though I also see the missing packets on 1.15.15 on my production environment.

### Kernel Version

6.12.18-talos on the hots. 6.12.8-0-virt in the alpine VM.

### Kubernetes Version

1.32.3

### Sysdump

[cilium-sysdump-20250409-134851.zip](https://github.com/user-attachments/files/19665494/cilium-sysdump-20250409-134851.zip)

### Relevant log output

```shell

```

### Anything else?

I notice some packet checksum errors as well while running `tcpdump`, however they exist both in the working and non-working state of MTU. As per issue https://github.com/cilium/cilium/issues/26300 I tried disabling checksum offloading, but to no effect.

### Cilium Users Document

- [ ] Are you a user of Cilium? Please add yourself to the [Users doc](https://github.com/cilium/cilium/blob/main/USERS.md)

### Code of Conduct

- [x] I agree to follow this project's Code of Conduct

**Comment by squeed** [comment]
So, AIUI, KubeVirt detects the MTU of the "shell" pod's interface and passes that through to the VM. Cilium, however, does something special: it sets the MTU on the route, not on the interface. (I cannot remember why this happens). I believe that KubeVirt doesn't correctly handle this MTU.

The fix is - as you said - to explicitly set the MTU on the interface via the MTU argument. I've filed PR https://github.com/cilium/cilium/pull/38868 to do this.

**Comment by squeed** [comment]
I don't know if kubevirt is smart enough to read the route MTU, but I would like your feedback if you're able to try my PR ot.

**Comment by jackmaninov** [comment]
I will try out your PR, probably tomorrow.

However, I still think there is some issue on the cilium side, as I am losing packets inbound to the VM, which is not controlled by Kubevirt. For example,I can lower the MTU in my VM as much as I like, but I still get a hung connection. Surely cilium should be aware of its own route MTU. 

Also I'm not enough of a TCP expert to be certain, but shoudn't I expect to receive my HTTP response back, just fragmented (as anyways the packets seem to be coming back with length 2800 at first)? Perhaps with a sub-optimal packet size if there is confusion about the MTU along the route.

**Comment by jackmaninov** [comment]
OK, interestingly if I set the route MTU inside the VM  with:

```
ip del route default
ip route add 0.0.0.0/0 via 10.0.2.1 mtu 1450
```

but have the interface MTU set to 1500 (both within the VM and on the host) by `MTU: 0` in the helm values then the packets are returned successfully.  This is the route served by DHCP, so I suppose a way to instruct Kubevirt of the route MTU is the correct way to go.

Also your reply was the hint I needed to find your discussion on #23712, thank you.

**Comment by jackmaninov** [comment]
> I don't know if kubevirt is smart enough to read the route MTU, but I would like your feedback if you're able to try my PR out.

Tried out your PR, but kubevirt is still serving me a default route with MTU of 1500, so they don't seem to be reading this value.
