### ISSUE TITLE
Cilium Egress Gateway egress interface

### ISSUE THREAD

**Issue by castironclay** [cilium/cilium#40406]
I followed the docs and successfully configured Egress Gateway in my cluster. I had an idea to route particular pods out to external services via dedicated VPN connections and to test I first used [wgcf](https://github.com/ViRb3/wgcf) to get a wireguard tunnel up and going. Below is my policy manifest. 
```yaml
apiVersion: cilium.io/v2
kind: CiliumEgressGatewayPolicy
metadata:
  name: egress-wgcf-example
spec:
  # Specify which pods should be subject to the current policy.
  # Multiple pod selectors can be specified.
  selectors:
  - podSelector:
      matchLabels:
        run: curlpod
  # Specify which destination CIDR(s) this policy applies to.
  # Multiple CIDRs can be specified.
  destinationCIDRs:
    - "0.0.0.0/0"

  # Configure the gateway node.
  egressGateway:
    # Specify which node should act as gateway for this policy.
    interface: wgcf
    nodeSelector:
      matchLabels:
        kubernetes.io/hostname: agent1
```
I saw it successfully matched my egress IP and gateway
```yaml
Source IP    Destination CIDR   Egress IP    Gateway IP
10.42.1.71   0.0.0.0/0          172.16.0.2   192.168.100.7
```
What I then expected to happen was traffic would egress agent1 via the wgcf interface but what I actually observed was Cilium using the IP of the wgcf interface as the SNAT IP, then using the node's routing table to determine where to route the traffic but because it was SNAT'd to 172.16.0.2 the traffic didn't make it out of my AWS VPC because it used the NIC and not the tunnel interface. From reading the docs I now see that is the expected behavior but is this something we could change in Cilium? Have `egressGateway.interface` not only use that value for the SNAT IP but also be the egress interface?

**Comment by aditighag** [comment]
IIUC, you want egress and gateway IP to be derived form the same interface? What's the `--devices` configuration flag set to?

**Comment by castironclay** [comment]
Yes I'd like Cilium to intelligently choose the exit interface of the node to match the `egressGateway.interface`. I have not changed the `devices` values because I will be bringing up new VPN tunnels routinely. Could I instead use `forceDeviceDetection` to have Cilium detect these new tunnel interfaces as they are created? Does using the `forceDeviceDetection` option mean I would need to restart the Cilium agent on the node that has the new interface? My current values file is below. 

```yaml
apiVersion: helm.cattle.io/v1
kind: HelmChartConfig
metadata:
  name: rke2-cilium
  namespace: kube-system
spec:
  valuesContent: |-
    prometheus:
      enabled: true
      serviceMonitor:
        enabled: true
    operator:
      prometheus:
        enabled: true
        serviceMonitor:
          enabled: true
    kubeProxyReplacement: true
    k8sServiceHost: "localhost"
    k8sServicePort: "6443"
    l7Proxy: true
    nodePort:
      enabled: true
    hostFirewall:
      enabled: true
    hubble:
      enabled: true
      relay:
        enabled: true
      ui:
        enabled: true
      metrics:
        enableOpenMetrics: true
      prometheus:
        serviceMonitor:
          enabled: true
    envoy:
      prometheus:
        serviceMonitor:
          enabled: true
    policyEnforementMode: default
    ingressController:
      enabled: true
      enforceHttp: false
      default: true
      loadBalancerMode: shared
      secretsNamespace:
        create: true
        name: cilium
      service:
        enabled: true
        externalTrafficPolicy: Cluster
        type: NodePort
        insecureNodePort: 30080
        secureNodePort: 30443
    encryption:
      enabled: true
      type: wireguard
      nodeEncryption: true
      wireguard:
        persistentKeepalive: 15s
    egressGateway:
      enabled: true
    bpf:
      masquerade: true
```

**Comment by aditighag** [comment]
>Yes I'd like Cilium to intelligently choose the exit interface of the node to match the egressGateway.interface. 

That should already be the case -- FIB lookup in the BPF datapath is done based on the egress interface. Can you try adding the wg tunnel interface to the `devices` config flag?

>I have not changed the devices values because I will be bringing up new VPN tunnels routinely. 

You can set `enableRuntimeDeviceDetection` to true. Once you apply the config, you'll need to restart the cilium agent pods.

**Comment by castironclay** [comment]
So I think it does detect the correct interface already judging by my the output of `cilium-dbg bpf egress list` but it is sending the packet out the ens5 interface with a source IP of 172.16.0.2
```bash
Source IP    Destination CIDR   Egress IP    Gateway IP
10.42.1.71   0.0.0.0/0          172.16.0.2   192.168.100.7
```
The wgcf interface is not currently in the routing table due to me using `Table = Off` in my config as to not adjust the routing table of the VM itself but still allows me to use 0.0.0.0/0 for my AllowedIPs. Doing `curl --interface wgcf ipinfo.io` routes as expected and I had assumed that setting `interface` in the egress policy was doing the same thing. 
```
default via 192.168.100.1 dev ens5 proto dhcp src 192.168.100.7 metric 100
10.42.0.0/24 via 10.42.1.203 dev cilium_host proto kernel src 10.42.1.203 mtu 1150
10.42.1.0/24 via 10.42.1.203 dev cilium_host proto kernel src 10.42.1.203
10.42.1.203 dev cilium_host proto kernel scope link
```
```
# Executed on node but hangs as packets are not routed properly

k exec -it curlpod2 -- curl http://ifconfig.io

# Output seen from tcpdump showing ens5 is the outgoing interface

tcpdump -nvvei any tcp port 80
tcpdump: data link type LINUX_SLL2
tcpdump: listening on any, link-type LINUX_SLL2 (Linux cooked v2), snapshot length 262144 bytes
17:09:31.539853 lxc4b96d88627ab In  ifindex 223 22:53:d3:d6:d9:48 ethertype IPv4 (0x0800), length 80: (tos 0x0, ttl 64, id 16021, offset 0, flags [DF], proto TCP (6), length 60)
    10.42.1.45.44956 > 104.21.92.106.80: Flags [S], cksum 0xd004 (incorrect -> 0xf64b), seq 521137879, win 65490, options [mss 1110,sackOK,TS val 2943817246 ecr 0,nop,wscale 7], length 0
17:09:31.539910 ens5  Out ifindex 2 0e:93:fa:b5:b4:ab ethertype IPv4 (0x0800), length 80: (tos 0x0, ttl 62, id 16021, offset 0, flags [DF], proto TCP (6), length 60)
    172.16.0.2.44956 > 104.21.92.106.80: Flags [S], cksum 0x70c0 (incorrect -> 0x5590), seq 521137879, win 65490, options [mss 1110,sackOK,TS val 2943817246 ecr 0,nop,wscale 7], length 0

# Expected result in tcpdump seen when using curl and setting --interface

tcpdump -nvvei any tcp port 80
tcpdump: data link type LINUX_SLL2
tcpdump: listening on any, link-type LINUX_SLL2 (Linux cooked v2), snapshot length 262144 bytes
17:11:30.613879 wgcf  Out ifindex 231 ethertype IPv4 (0x0800), length 80: (tos 0x0, ttl 64, id 23387, offset 0, flags [DF], proto TCP (6), length 60)
    172.16.0.2.45614 > 104.21.92.106.80: Flags [S], cksum 0x70c0 (incorrect -> 0x5e35), seq 3261771585, win 64480, options [mss 1240,sackOK,TS val 1337002584 ecr 0,nop,wscale 7], length 0
```

I was able to do a workaround using policy based routing but was hoping to not need to do that. 

New values file additions.
```yaml
    forceDeviceDetection: true
    enableRuntimeDeviceDetection: true
    devices: "wg+, ens+"
```

**Comment by castironclay** [comment]
Any updates on this? Wanting to confirm I'm at least setting things up correctly.

**Comment by castironclay** [comment]
I am still interested in action on this.

**Comment by julianwiedmann** [comment]
> From reading the docs I now see that is the expected behavior but is this something we could change in Cilium? Have egressGateway.interface not only use that value for the SNAT IP but also be the egress interface?

yep that would be a good improvement! We've experimented with it a bit in the past, and the [initial IPv4 datapath code](https://github.com/cilium/cilium/blob/abf296e8566f0732ce61558b69e05cf59cd0d7ac/bpf/lib/egress_gateway.h#L63) exists. But you'd need similar changes as the last two patches in https://github.com/cilium/cilium/pull/38961 to make it actually work. Contributions welcome :).

**Comment by castironclay** [comment]
Great thank you @julianwiedmann

**Comment by andsens** [comment]
> I was able to do a workaround using policy based routing but was hoping to not need to do that.

For anyone stumbling across this and wondering what the workaround is:  
Configure wireguard so that it adds your routes to a non-main table:
```
[Interface]
Table = 1337
```

Then add a rule for the VPN interface IP as a source that directs traffic to that table:
```
ip -4 rule add from 172.16.0.2/32 table 1337
```
