### ISSUE TITLE
Combination loadBalancerSourceRanges and ECMP doesn't work

### ISSUE THREAD

**Issue by uablrek** [cilium/cilium#20297]
### Is there an existing issue for this?

- [X] I have searched the existing issues

### What happened?

When a service that specifies `loadBalancerSourceRanges` is used then *some* (~25-50%) connect fails if ECMP is used to load-balance incoming traffic between K8s nodes.

* If ECMP is **not** used but with loadBalancerSourceRanges it works
* If loadBalancerSourceRanges is **not** used but with ECMP it works
* Same setup works with other CNI-plugins, for example `calico`, `flannel` and `antrea`

So, it's just the combo loadBalancerSourceRanges+ECMP that doesn't work on `cilium`.

Service manifest;
```
apiVersion: v1
kind: Service
metadata:
  name: mserver-dual-srange
spec:
  loadBalancerSourceRanges:
  - "192.168.1.0/24"
  - "192.168.2.0/24"
  - "1000::1:192.168.1.0/120"
  - "1000::1:192.168.2.0/120"
  ipFamilyPolicy: PreferDualStack
  selector:
    app: mserver-deployment
  ports:
  - port: 5001
    name: mconnect
  - port: 5003
    name: ctraffic
  type: LoadBalancer
```

Example test with [mconnect](https://github.com/Nordix/mconnect);
```
# mconnect -address 10.0.0.8:5001 -nconn 100
Failed connects; 53
Failed reads; 0
mserver-deployment-67fb4fc9cf-kgdlz 9
mserver-deployment-67fb4fc9cf-xzf9s 15
mserver-deployment-67fb4fc9cf-qdstc 10
mserver-deployment-67fb4fc9cf-fkdr8 13
```

Same with Antrea CNI-plugin;
```
# mconnect -address 10.0.0.8:5001 -nconn 100
Failed connects; 0
Failed reads; 0
mserver-deployment-67fb4fc9cf-8wpl5 24
mserver-deployment-67fb4fc9cf-hct49 25
mserver-deployment-67fb4fc9cf-4f6lp 26
mserver-deployment-67fb4fc9cf-8pskn 25
```

### Cilium Version

```
# kubectl exec -n kube-system   cilium-5vrgf -- cilium version
Defaulted container "cilium-agent" out of: cilium-agent, mount-cgroup (init), clean-cilium-state (init)
Client: 1.11.6 fee2d77 2022-06-13T16:02:58-07:00 go version go1.17.11 linux/amd64
Daemon: 1.11.6 fee2d77 2022-06-13T16:02:58-07:00 go version go1.17.11 linux/amd64
```

### Kernel Version

```
# uname -a
Linux vm-001 5.18.1 #8 SMP PREEMPT_DYNAMIC Sat Jun 18 12:53:37 CEST 2022 x86_64 GNU/Linux
```

### Kubernetes Version

```
# kubectl version
WARNING: This version information is deprecated and will be replaced with the output from kubectl version --short.  Use --output=yaml|json to get the full version.
Client Version: version.Info{Major:"1", Minor:"24", GitVersion:"v1.24.2", GitCommit:"f66044f4361b9f1f96f0053dd46cb7dce5e990a8", GitTreeState:"clean", BuildDate:"2022-06-15T14:22:29Z", GoVersion:"go1.18.3", Compiler:"gc", Platform:"linux/amd64"}
Kustomize Version: v4.5.4
Server Version: version.Info{Major:"1", Minor:"24", GitVersion:"v1.24.2", GitCommit:"f66044f4361b9f1f96f0053dd46cb7dce5e990a8", GitTreeState:"clean", BuildDate:"2022-06-15T14:15:38Z", GoVersion:"go1.18.3", Compiler:"gc", Platform:"linux/amd64"}
```

### Anything else?

Cilium manifest [quick-install.yaml.txt](https://github.com/cilium/cilium/files/8974481/quick-install.yaml.txt)

### Code of Conduct

- [X] I agree to follow this project's Code of Conduct

**Comment by uablrek** [comment]
## Update

It seems like traffic to that enters *some* K8s nodes (seemingly random) is dropped. So scratch;

~If ECMP is not used but with loadBalancerSourceRanges it works~

I was fooled because I happened to test a node that worked.

My routing with ecmp;
```
# ip ro
default via 192.168.0.250 dev eth0 
10.0.0.0/24 
        nexthop via 192.168.1.2 dev eth1 weight 1 
        nexthop via 192.168.1.3 dev eth1 weight 1 
        nexthop via 192.168.1.4 dev eth1 weight 1 
        nexthop via 192.168.1.5 dev eth1 weight 1 
...
```
In this particular run traffic worked to 192.168.1.4 and 192.168.1.5 but not to 192.168.1.2 and 192.168.1.3. So when using ECMP ~50% traffic was lost.

**Comment by brb** [comment]
@uablrek Thanks for opening the issue. That's weird. Maybe you could attach Cilium's sysdump?

**Comment by uablrek** [comment]
FYI, I am using a setup where the K8s master is not a K8s-node;

![vms](https://user-images.githubusercontent.com/37046727/176387963-2f85cbe0-1d35-47f4-9e18-3001c0333f8e.png)

This works fine with `cilium` _except_ for web-hooks. I don't think the problem in this issue is caused by this though (I suspect a race somewhere).

This setup is very convenient since it decouples setup for example `etcd` and master-HA from the cluster. I believe AWS uses a similar setup. IMHO `cilium` should support it (including web-hooks).

**Comment by uablrek** [comment]
Yes, the normal K8s way. I use kube-proxy replacement, not DSR. Note that this setup work fine without loadBalancerSourceRanges so it's nothing wrong with the test or the system. Only that the precense of loadBalancerSourceRanges seem not to work.

**Comment by brb** [comment]
In your sysdump I see many drops due to the LB src range check. My gut feeling is that the dropped packet src IP is something else than the LB allows (thus, my ask for the `cilium monitor` output).

What is the client IP addr?

**Comment by uablrek** [comment]
Most likely not. Note that the communication fails depending on the receiving K8s node, not the source. An also that the exact same test works with other CNI-plugins.

**Comment by uablrek** [comment]
Tcpdump on a K8s when it fails;
```
# tcpdump -ni eth1 host 10.0.0.8
tcpdump: verbose output suppressed, use -v[v]... for full protocol decode
listening on eth1, link-type EN10MB (Ethernet), snapshot length 262144 bytes
12:50:38.639110 IP 192.168.1.201.44582 > 10.0.0.8.5001: Flags [S], seq 1572552035, win 64240, options [mss 1460,sackOK,TS val 2750824396 ecr 0,nop,wscale 6], length 0
12:50:39.658679 IP 192.168.1.201.44582 > 10.0.0.8.5001: Flags [S], seq 1572552035, win 64240, options [mss 1460,sackOK,TS val 2750825416 ecr 0,nop,wscale 6], length 0
12:50:41.674830 IP 192.168.1.201.44582 > 10.0.0.8.5001: Flags [S], seq 1572552035, win 64240, options [mss 1460,sackOK,TS val 2750827432 ecr 0,nop,wscale 6], length 0
```
Source is 192.168.1.201 which match "192.168.1.0/24".

**Comment by uablrek** [comment]
Side-remark; there is _no problem_ with ipv6. Only ipv4.

**Comment by uablrek** [comment]
Narrowed output from `cilium monitor`;
```
>> IPCache entry upserted: {"cidr":"::/0","id":2,"old-id":2,"encrypt-key":0}
xx drop (Denied by LB src range check) flow 0x0 to endpoint 0, , identity world->unknown: 192.168.1.201:57372 -> 10.0.0.8:5001 tcp SYN
xx drop (Denied by LB src range check) flow 0x0 to endpoint 0, , identity world->unknown: 192.168.1.201:57372 -> 10.0.0.8:5001 tcp SYN
xx drop (Denied by LB src range check) flow 0x0 to endpoint 0, , identity world->unknown: 192.168.1.201:57372 -> 10.0.0.8:5001 tcp SYN
^C
Received an interrupt, disconnecting from monitor...
```

**Comment by uablrek** [comment]
Same on a working node;
```
level=info msg="Initializing dissection cache..." subsys=monitor
-> overlay flow 0x0 , identity remote-node->unknown state new ifindex cilium_vxlan orig-ip 0.0.0.0: 192.168.1.201:36272 -> 11.0.1.191:5001 tcp SYN
-> overlay flow 0x0 , identity remote-node->unknown state new ifindex cilium_vxlan orig-ip 0.0.0.0: 192.168.1.201:36272 -> 11.0.1.191:5001 tcp ACK
-> overlay flow 0x0 , identity remote-node->unknown state new ifindex cilium_vxlan orig-ip 0.0.0.0: 192.168.1.201:36272 -> 11.0.1.191:5001 tcp ACK
```
I can't see any "src range check" logs at all.

**Comment by uablrek** [comment]
> Any idea why the request is received over the vxlan tunnel?

No. I have no unusual routes or iptables rules. And IPv6 works, which should be taken into account.

**Comment by uablrek** [comment]
Still a problem, please see https://cilium.slack.com/archives/C53TG4J4R/p1702116817784589.

I don't use the setup described in https://github.com/cilium/cilium/issues/20297#issuecomment-1169681515 any more. The controller is in-cluster (as the normal setup). And I use `cilium:v1.14.0`.

The problem seem general, to many connect in a short time makes some connects drop, but it is made worse by some setups.
