### ISSUE TITLE
Some backend of cluster IPs never gets picked

### ISSUE THREAD

**Issue by Weil0ng** [cilium/cilium#12609]
## Bug report

**General Information**

- Cilium version (run `cilium version`): 
Client: 1.8.0 bfda356ab 2020-07-14T14:55:21-07:00 go version go1.14.4 linux/amd64
Daemon: 1.8.0 bfda356ab 2020-07-14T14:55:21-07:00 go version go1.14.4 linux/amd64

- Kernel version (run `uname -a`)
Linux gke-test-default-pool-31018309-mqh4 4.19.112+ #1 SMP Thu May 21 12:32:19 PDT 2020 x86_64 x86_64 x86_64 GNU/Linux

- Orchestration system version in use (e.g. `kubectl version`, Mesos, ...)
Client Version: version.Info{Major:"1", Minor:"18", GitVersion:"v1.18.5", GitCommit:"e6503f8d8f769ace2f338794c914a96fc335df0f", GitTreeState:"clean", BuildDate:"2020-06-26T03:47:41Z", GoVersion:"go1.13.9", Compiler:"gc", Platform:"linux/amd64"}
Server Version: version.Info{Major:"1", Minor:"17+", GitVersion:"v1.17.8-gke.16", GitCommit:"39e5210b77df372ed214a56b84af65e7ee0fb8dc", GitTreeState:"clean", BuildDate:"2020-07-10T00:42:05Z", GoVersion:"go1.13.9b4", Compiler:"gc", Platform:"linux/amd64"}

- Link to relevant artifacts (policies, deployments scripts, ...)
Yaml to reproduce issue:
```
apiVersion: apps/v1
kind: Deployment
metadata:
  name: nginx-deployment
  labels:
    app: nginx
spec:
  replicas: 4
  selector:
    matchLabels:
      app: nginx
  template:
    metadata:
      labels:
        app: nginx
    spec:
      containers:
      - name: nginx
        image: nginx:1.14.2
        ports:
        - containerPort: 80
---
apiVersion: v1
kind: Pod
metadata:
        name: server
        labels:
                role: server
                app: MyApp
spec:
        containers:
        - name: nginx
          image: nginx
---
apiVersion: v1
kind: Service
metadata:
  name: curl-service
spec:
  selector:
    app: nginx
  ports:
    - protocol: TCP
      port: 88
      targetPort: 80
```

- Generate and upload a system zip: shared offline on slack
```
curl -sLO https://git.io/cilium-sysdump-latest.zip && python cilium-sysdump-latest.zip
```

**How to reproduce the issue**

1. Apply provided yaml
2. curl from server pod to curl-service:88
3. monitor connections

**Comment by borkmann** [comment]
Hmm, I currently cannot reproduce it. I'm having:
```
root@apoc:~/go/src/github.com/cilium/cilium# uname -a
Linux apoc 4.19.57 #4 SMP Fri Feb 14 11:57:54 CET 2020 x86_64 x86_64 x86_64 GNU/Linux

root@apoc:~/go/src/github.com/cilium/cilium# kubectl get service
NAME           TYPE        CLUSTER-IP     EXTERNAL-IP   PORT(S)   AGE
curl-service   ClusterIP   10.106.50.93   <none>        88/TCP    6m47s
kubernetes     ClusterIP   10.96.0.1      <none>        443/TCP   20m

root@apoc:~/go/src/github.com/cilium/cilium# kubectl get ep curl-service
NAME           ENDPOINTS                                                    AGE
curl-service   10.217.0.141:80,10.217.0.168:80,10.217.0.25:80 + 1 more...   6m57s

root@apoc:~/go/src/github.com/cilium/cilium# ./cilium/cilium service list
ID   Frontend          Service Type   Backend                    
[...]
4    10.106.50.93:88   ClusterIP      1 => 10.217.0.168:80       
                                      2 => 10.217.0.25:80        
                                      3 => 10.217.0.35:80        
                                      4 => 10.217.0.141:80     
```
Doing a `curl 10.106.50.93:88` from e.g. host-ns gives (only capturing tcpdump with syn flag below to reduce noise): 
```
11:06:47.374456 IP 10.217.0.229.36146 > 10.217.0.141.80: Flags [S], seq 4061969752, win 29200, options [mss 1460,sackOK,TS val 1295328004 ecr 0,nop,wscale 7], length 0
11:06:47.374474 IP 10.217.0.141.80 > 10.217.0.229.36146: Flags [S.], seq 1377058211, ack 4061969753, win 28960, options [mss 1460,sackOK,TS val 636281181 ecr 1295328004,nop,wscale 7], length 0
11:06:47.981238 IP 10.217.0.229.52938 > 10.217.0.168.80: Flags [S], seq 3438011801, win 29200, options [mss 1460,sackOK,TS val 2799452616 ecr 0,nop,wscale 7], length 0
11:06:47.981255 IP 10.217.0.168.80 > 10.217.0.229.52938: Flags [S.], seq 1854614025, ack 3438011802, win 28960, options [mss 1460,sackOK,TS val 3147148196 ecr 2799452616,nop,wscale 7], length 0
11:06:48.492613 IP 10.217.0.229.59398 > 10.217.0.25.80: Flags [S], seq 2922564493, win 29200, options [mss 1460,sackOK,TS val 600177839 ecr 0,nop,wscale 7], length 0
11:06:48.492630 IP 10.217.0.25.80 > 10.217.0.229.59398: Flags [S.], seq 2807457238, ack 2922564494, win 28960, options [mss 1460,sackOK,TS val 2160820439 ecr 600177839,nop,wscale 7], length 0
11:06:48.915066 IP 10.217.0.229.45212 > 10.217.0.35.80: Flags [S], seq 1515118466, win 29200, options [mss 1460,sackOK,TS val 332689455 ecr 0,nop,wscale 7], length 0
11:06:48.915083 IP 10.217.0.35.80 > 10.217.0.229.45212: Flags [S.], seq 2333238932, ack 1515118467, win 28960, options [mss 1460,sackOK,TS val 2619491532 ecr 332689455,nop,wscale 7], length 0
11:07:05.389758 IP 10.217.0.229.36254 > 10.217.0.141.80: Flags [S], seq 2194542474, win 29200, options [mss 1460,sackOK,TS val 1295346019 ecr 0,nop,wscale 7], length 0
11:07:05.389776 IP 10.217.0.141.80 > 10.217.0.229.36254: Flags [S.], seq 558731254, ack 2194542475, win 28960, options [mss 1460,sackOK,TS val 636299196 ecr 1295346019,nop,wscale 7], length 0
11:07:06.953902 IP 10.217.0.229.53052 > 10.217.0.168.80: Flags [S], seq 1601935035, win 29200, options [mss 1460,sackOK,TS val 2799471588 ecr 0,nop,wscale 7], length 0
11:07:06.953920 IP 10.217.0.168.80 > 10.217.0.229.53052: Flags [S.], seq 893481570, ack 1601935036, win 28960, options [mss 1460,sackOK,TS val 3147167168 ecr 2799471588,nop,wscale 7], length 0
11:07:11.850051 IP 192.168.178.1.35398 > 192.168.178.29.80: Flags [S], seq 1309757261, win 29200, options [mss 1460,sackOK,TS val 2149673027 ecr 0,nop,wscale 6,mptcp capable csum {0x506d326f492e1fc2}], length 0
```
What additional steps am I missing?

**Comment by brb** [comment]
@Weil0ng Did you use https://github.com/rakyll/hey to send requests to the svc?

**Comment by Weil0ng** [comment]
@brb I just did `curl curl-serivce:88` inside pod `server` repeatedly.

```
8    10.79.251.71:88     ClusterIP      1 => 10.76.0.2:80 
                                        2 => 10.76.0.4:80
                                        3 => 10.76.0.3:80
                                        4 => 10.76.0.5:80
```
Here's tcpdump on eth0:
```
17:30:18.474926 IP 10.76.2.6.41756 > 10.76.1.5.53: 33868+ AAAA? curl-service.default.svc.cluster.local. (56)
17:30:18.478497 IP 10.76.2.6.57960 > 10.76.0.5.80: Flags [S], seq 2503302983, win 42600, options [mss 1420,sackOK,TS val 97657502 ecr 0,nop,wscale 7], length 0
17:30:18.480334 IP 10.76.2.6.57960 > 10.76.0.5.80: Flags [.], ack 402340650, win 333, options [nop,nop,TS val 97657504 ecr 1696245201], length 0
17:30:18.480689 IP 10.76.2.6.57960 > 10.76.0.5.80: Flags [P.], seq 0:79, ack 1, win 333, options [nop,nop,TS val 97657505 ecr 1696245201], length 79: HTTP: GET / HTTP/1.1
17:30:18.481254 IP 10.76.2.6.57960 > 10.76.0.5.80: Flags [.], ack 239, win 332, options [nop,nop,TS val 97657505 ecr 1696245203], length 0
17:30:18.481352 IP 10.76.2.6.57960 > 10.76.0.5.80: Flags [.], ack 851, win 328, options [nop,nop,TS val 97657505 ecr 1696245203], length 0
17:30:18.482093 IP 10.76.2.6.57960 > 10.76.0.5.80: Flags [F.], seq 79, ack 851, win 331, options [nop,nop,TS val 97657506 ecr 1696245203], length 0
17:30:18.482384 IP 10.76.2.6.57960 > 10.76.0.5.80: Flags [.], ack 852, win 331, options [nop,nop,TS val 97657506 ecr 1696245204], length 0
17:30:19.474261 IP 10.76.2.6.37633 > 10.76.1.5.53: 14941+ A? curl-service.default.svc.cluster.local. (56)
17:30:19.474876 IP 10.76.2.6.37633 > 10.76.1.5.53: 48235+ AAAA? curl-service.default.svc.cluster.local. (56)
17:30:19.475945 IP 10.76.2.6.51628 > 10.76.0.3.80: Flags [S], seq 2672649178, win 42600, options [mss 1420,sackOK,TS val 3658201027 ecr 0,nop,wscale 7], length 0
17:30:19.478123 IP 10.76.2.6.51628 > 10.76.0.3.80: Flags [.], ack 668310240, win 333, options [nop,nop,TS val 3658201029 ecr 978064997], length 0
17:30:19.478375 IP 10.76.2.6.51628 > 10.76.0.3.80: Flags [P.], seq 0:79, ack 1, win 333, options [nop,nop,TS val 3658201029 ecr 978064997], length 79: HTTP: GET / HTTP/1.1
17:30:19.478860 IP 10.76.2.6.51628 > 10.76.0.3.80: Flags [.], ack 239, win 332, options [nop,nop,TS val 3658201030 ecr 978064998], length 0
17:30:19.478881 IP 10.76.2.6.51628 > 10.76.0.3.80: Flags [.], ack 851, win 328, options [nop,nop,TS val 3658201030 ecr 978064998], length 0
17:30:19.479604 IP 10.76.2.6.51628 > 10.76.0.3.80: Flags [F.], seq 79, ack 851, win 331, options [nop,nop,TS val 3658201031 ecr 978064998], length 0
17:30:19.480089 IP 10.76.2.6.51628 > 10.76.0.3.80: Flags [.], ack 852, win 331, options [nop,nop,TS val 3658201031 ecr 978064999], length 0
17:30:20.093214 IP 10.76.2.6.32809 > 10.76.1.5.53: 27764+ A? curl-service.default.svc.cluster.local. (56)
17:30:20.093549 IP 10.76.2.6.32809 > 10.76.1.5.53: 24963+ AAAA? curl-service.default.svc.cluster.local. (56)
17:30:20.094754 IP 10.76.2.6.57966 > 10.76.0.5.80: Flags [S], seq 2110667085, win 42600, options [mss 1420,sackOK,TS val 97659119 ecr 0,nop,wscale 7], length 0
17:30:20.095072 IP 10.76.2.6.57966 > 10.76.0.5.80: Flags [.], ack 1951919642, win 333, options [nop,nop,TS val 97659119 ecr 1696246817], length 0
17:30:20.095284 IP 10.76.2.6.57966 > 10.76.0.5.80: Flags [P.], seq 0:79, ack 1, win 333, options [nop,nop,TS val 97659119 ecr 1696246817], length 79: HTTP: GET / HTTP/1.1
17:30:20.095648 IP 10.76.2.6.57966 > 10.76.0.5.80: Flags [.], ack 239, win 332, options [nop,nop,TS val 97659120 ecr 1696246817], length 0
17:30:20.095803 IP 10.76.2.6.57966 > 10.76.0.5.80: Flags [.], ack 851, win 328, options [nop,nop,TS val 97659120 ecr 1696246817], length 0
17:30:20.097213 IP 10.76.2.6.57966 > 10.76.0.5.80: Flags [F.], seq 79, ack 851, win 331, options [nop,nop,TS val 97659121 ecr 1696246817], length 0
17:30:20.097643 IP 10.76.2.6.57966 > 10.76.0.5.80: Flags [.], ack 852, win 331, options [nop,nop,TS val 97659122 ecr 1696246819], length 0
17:30:20.675507 IP 10.76.2.6.46685 > 10.76.1.5.53: 20687+ A? curl-service.default.svc.cluster.local. (56)
17:30:20.675916 IP 10.76.2.6.46685 > 10.76.1.5.53: 24290+ AAAA? curl-service.default.svc.cluster.local. (56)
17:30:20.677833 IP 10.76.2.6.51636 > 10.76.0.3.80: Flags [S], seq 3058479241, win 42600, options [mss 1420,sackOK,TS val 3658202229 ecr 0,nop,wscale 7], length 0
17:30:20.678196 IP 10.76.2.6.51636 > 10.76.0.3.80: Flags [.], ack 3635140147, win 333, options [nop,nop,TS val 3658202229 ecr 978066198], length 0
17:30:20.678506 IP 10.76.2.6.51636 > 10.76.0.3.80: Flags [P.], seq 0:79, ack 1, win 333, options [nop,nop,TS val 3658202229 ecr 978066198], length 79: HTTP: GET / HTTP/1.1
17:30:20.678922 IP 10.76.2.6.51636 > 10.76.0.3.80: Flags [.], ack 239, win 332, options [nop,nop,TS val 3658202230 ecr 978066198], length 0
17:30:20.679001 IP 10.76.2.6.51636 > 10.76.0.3.80: Flags [.], ack 851, win 328, options [nop,nop,TS val 3658202230 ecr 978066198], length 0
17:30:20.679456 IP 10.76.2.6.51636 > 10.76.0.3.80: Flags [F.], seq 79, ack 851, win 331, options [nop,nop,TS val 3658202230 ecr 978066198], length 0
17:30:20.679743 IP 10.76.2.6.51636 > 10.76.0.3.80: Flags [.], ack 852, win 331, options [nop,nop,TS val 3658202231 ecr 978066199], length 0
```

Only `10.76.0.5` and `10.76.0.3` are ever picked.

**Comment by Weil0ng** [comment]
Hmmmmm, actually, if I curl with ip instead of service name, aka `curl 10.79.251.71:88` then I cannot reproduce this (all backends get picked as expected).

**Comment by borkmann** [comment]
> Hmmmmm, actually, if I curl with ip instead of service name, aka `curl 10.79.251.71:88` then I cannot reproduce this (all backends get picked as expected).

Did you check into the DNS packet whether it returns the svc IP (`10.79.251.71`) or backends from there? I would expect svc IP, but just to make sure.

**Comment by borkmann** [comment]
> > Hmmmmm, actually, if I curl with ip instead of service name, aka `curl 10.79.251.71:88` then I cannot reproduce this (all backends get picked as expected).
> 
> Did you check into the DNS packet whether it returns the svc IP (`10.79.251.71`) or backends from there? I would expect svc IP, but just to make sure.

```
root@apoc:~# kubectl exec -i -t dnsutils -- nslookup curl-service
Server:		10.96.0.10
Address:	10.96.0.10#53

Name:	curl-service.default.svc.cluster.local
Address: 10.106.50.93

root@apoc:~# kubectl get services
NAME           TYPE        CLUSTER-IP     EXTERNAL-IP   PORT(S)   AGE
curl-service   ClusterIP   10.106.50.93   <none>        88/TCP    24h

root@apoc:~# kubectl exec -i -t tiefighter -- curl curl-service.default.svc.cluster.local:88
<!DOCTYPE html>
<html>
<head>
[...]

root@apoc:~/go/src/github.com/cilium/cilium# ./cilium/cilium service list
ID   Frontend          Service Type   Backend                    
[...]
3    10.106.50.93:88   ClusterIP      1 => 10.217.0.73:80        
                                      2 => 10.217.0.187:80       
                                      3 => 10.217.0.196:80       
                                      4 => 10.217.0.69:80        

root@apoc:~# tcpdump -i any -n "port 80 && (tcp[tcpflags] & (tcp-syn) != 0)"  
tcpdump: verbose output suppressed, use -v or -vv for full protocol decode
listening on any, link-type LINUX_SLL (Linux cooked), capture size 262144 bytes
11:45:47.712720 IP 10.217.0.177.56682 > 10.217.0.196.80: Flags [S], seq 200509741, win 64240, options [mss 1460,sackOK,TS val 2664843235 ecr 0,nop,wscale 7], length 0
11:46:02.648553 IP 10.217.0.177.53920 > 10.217.0.187.80: Flags [S], seq 1896073111, win 64240, options [mss 1460,sackOK,TS val 1699758087 ecr 0,nop,wscale 7], length 0
11:46:08.860498 IP 10.217.0.177.41822 > 10.217.0.73.80: Flags [S], seq 1406570995, win 64240, options [mss 1460,sackOK,TS val 3060251995 ecr 0,nop,wscale 7], length 0
11:46:18.482276 IP 10.217.0.177.50324 > 10.217.0.69.80: Flags [S], seq 2785602328, win 64240, options [mss 1460,sackOK,TS val 1960063220 ecr 0,nop,wscale 7], length 0
11:46:25.536335 IP 10.217.0.177.54074 > 10.217.0.187.80: Flags [S], seq 119799074, win 64240, options [mss 1460,sackOK,TS val 1699780974 ecr 0,nop,wscale 7], length 0
[...]
```
So works fine on my side. All backends get picked as expected. DNS is returning the svc IP in my case, so no difference to curl'ing directly.

**Comment by Weil0ng** [comment]
@brb DNS looks good in my setup too:
```
root@server:/# nslookup curl-service 
Server:         10.83.240.10                      
Address:        10.83.240.10#53            
                                                                        
Name:   curl-service.default.svc.cluster.local     
Address: 10.83.247.211

cuiwl@weil0ng:~$ kubectl get svc   
NAME            TYPE        CLUSTER-IP      EXTERNAL-IP   PORT(S)        AGE      
curl-service    ClusterIP   10.83.247.211   <none>        88/TCP         3m35s         
iperf-service   ClusterIP   10.83.247.13    <none>        5201/TCP       3m35s       
kubernetes      ClusterIP   10.83.240.1     <none>        443/TCP        16h             
my-np           NodePort    10.83.253.6     <none>        80:30007/TCP   3m35s 
```

But I'm still seeing the issue...trying to add prints along datapath to debug now...

**Comment by Weil0ng** [comment]
Kinda have a theory what's going on here:

- bpf_sock is using `bpf_get_socket_cookie` in `sock4_xlate_fwd` to select backend slot
- `bpf_get_socket_cookie` is sequentially incrementing its value (https://elixir.bootlin.com/linux/v4.19.132/source/net/core/sock_diag.c#L30)
- `curl` happens, two sequential rewrites happen:
  * a dns lookup, got socket cookie N
  * subsequent tcp socket got cookie N + 1
- backend slot is calculated by `cookie % svc_count + 1`, where `svc_count` in this case is **4**
- above TCP socket got `backend_slot = (N+1)%4+1`
- another `curl` happens
  * dns lookup got N + 2
  * TCP got N + 3
- above TCP socket got `backend_slot = (N+3)%4+1`
- another `curl` would get `(N+5)%4+1` which is equal to `(N+1)%4+1`

so we will only get `(N+1)%4+1` and `(N+3)%4+1` repeatedly...this also explains why when I `curl` with IP directly, it'll touch all backends...

Not sure why it didn't happen in your env @brb , maybe for you socket_cookie is not enabled in the kernel?

**Comment by Weil0ng** [comment]
I also checked with different backend counts, as expected, the problem occurs for even number of backends, but not for odd number.

**Comment by brb** [comment]
@Weil0ng Nice catch! In 4.19 the socket cookie is not global, while in >= 5.3 it is (https://github.com/torvalds/linux/commit/cd48bdda4fb82c2fe569d97af4217c530168c99c). We should use prandom for TCP even if `BPF_HAVE_SOCKET_COOKIE` is set.
