### ISSUE TITLE
Invalid conntrack packets leaving node on default interface

### ISSUE THREAD

**Issue by jusch23** [cilium/cilium#38164]
### Is there an existing issue for this?

- [x] I have searched the existing issues

### Version

equal or higher than v1.15.14 and lower than v1.16.0

### What happened?

In some (rare) situations I observed packets leaving a node on the default interface. While analysing the problem, I found older issues in the kube-proxy project discussing a similar (or even the same?) problem:

https://github.com/kubernetes/kubernetes/issues/74839
https://github.com/kubernetes/kubernetes/issues/117924

I also found an old issue for cilium (https://github.com/cilium/cilium/issues/21853), where the problem initially existed, but did not occur after an upgrade.

In my kubernetes cluster (v1.30.8, deployed via kubeadm) cilium is deployed with kube-proxy. When I deploy the test application (see reproduction section), I don't see any invalid packets leaving the node in the tcpdump. But after deleting the test application, there are (FIN) packets leaving the node on the default interface.

I looked at the code where the forward rules are added (https://github.com/cilium/cilium/blob/v1.15.14/pkg/datapath/iptables/iptables.go#L1135), that from my understanding handles some additional cases which are not considered by kube-proxy. In particular, it mentions direct routing with the existing DROP rule introduced in kube-proxy to drop invalid packets (https://github.com/kubernetes/kubernetes/pull/74840). So on my node I can see the DROP rule from kube-proxy and the forward rules from cilium:

```
$ iptables -nvL
...
Chain KUBE-FORWARD (1 references)
 pkts bytes target     prot opt in     out     source               destination
    0     0 DROP       all  --  *      *       0.0.0.0/0            0.0.0.0/0            ctstate INVALID
    0     0 ACCEPT     all  --  *      *       0.0.0.0/0            0.0.0.0/0            /* kubernetes forwarding rules */
    0     0 ACCEPT     all  --  *      *       0.0.0.0/0            0.0.0.0/0            /* kubernetes forwarding conntrack rule */ ctstate RELATED,ESTABLISHED
...
Chain CILIUM_FORWARD (1 references)
 pkts bytes target     prot opt in     out     source               destination
 286K 3437M ACCEPT     all  --  *      cilium_host  0.0.0.0/0            0.0.0.0/0            /* cilium: any->cluster on cilium_host forward accept */
    0     0 ACCEPT     all  --  cilium_host *       0.0.0.0/0            0.0.0.0/0            /* cilium: cluster->any on cilium_host forward accept (nodeport) */
 257K  792M ACCEPT     all  --  lxc+   *       0.0.0.0/0            0.0.0.0/0            /* cilium: cluster->any on lxc+ forward accept */
    0     0 ACCEPT     all  --  cilium_net *       0.0.0.0/0            0.0.0.0/0            /* cilium: cluster->any on cilium_net forward accept (nodeport) */
```

In the kube-proxy issue https://github.com/kubernetes/kubernetes/issues/117924 the netfilter flag `nf_conntrack_tcp_be_liberal` is set to solve the problem instead of adding the DROP rule for invalid packets. I also tried using this flag, but I still saw the invalid packets leaving the node on the default interface (in my case: ens192) without masquerading. So I added a DROP rule in the CILIUM_FORWARD chain:
`iptables -I CILIUM_FORWARD 1 -m conntrack --ctstate INVALID -o ens192 -j DROP`

By adding this rule, the invalid packets are dropped as intended (counter for the drop iptables increased in the reproduction test). Cilium and my other workloads still work fine, but I am not sure if this rule is a valid workaround. If so, is it possible to add this rule within cilium?

### How can we reproduce the issue?

- Running tcpdump on all nodes
`$ tcpdump -nn -i ens192 src net 192.168.0.0/16 # ens192 is default interface`
- Deploy test application
- No output in tcpdump
- Delete application
- Output in tcpdump, e.g.
```
14:05:52.396221 IP 192.168.6.6.39816 > 172.24.123.214.80: Flags [F.], seq 20400159, ack 597920915, win 18384, options [nop,nop,TS val 2280180250 ecr 135380375], length 0
14:05:52.396443 IP 192.168.6.226.49610 > 172.24.123.214.80: Flags [F.], seq 297960888, ack 3616669924, win 15888, options [nop,nop,TS val 702184518 ecr 1246076831], length 0
14:05:52.603624 IP 192.168.6.6.39816 > 172.24.123.214.80: Flags [F.], seq 0, ack 1, win 18384, options [nop,nop,TS val 2280180458 ecr 135380375], length 0
14:05:52.603624 IP 192.168.6.226.49610 > 172.24.123.214.80: Flags [F.], seq 0, ack 1, win 15888, options [nop,nop,TS val 702184726 ecr 1246076831], length 0
14:05:52.811595 IP 192.168.6.6.39816 > 172.24.123.214.80: Flags [F.], seq 0, ack 1, win 18384, options [nop,nop,TS val 2280180666 ecr 135380375], length 0
14:05:52.812555 IP 192.168.6.226.49610 > 172.24.123.214.80: Flags [F.], seq 0, ack 1, win 15888, options [nop,nop,TS val 702184935 ecr 1246076831], length 0
14:05:53.219727 IP 192.168.6.226.49610 > 172.24.123.214.80: Flags [F.], seq 0, ack 1, win 15888, options [nop,nop,TS val 702185342 ecr 1246076831], length 0
14:05:53.219811 IP 192.168.6.6.39816 > 172.24.123.214.80: Flags [F.], seq 0, ack 1, win 18384, options [nop,nop,TS val 2280181074 ecr 135380375], length 0
14:05:54.075597 IP 192.168.6.226.49610 > 172.24.123.214.80: Flags [F.], seq 0, ack 1, win 15888, options [nop,nop,TS val 702186198 ecr 1246076831], length 0
14:05:54.075599 IP 192.168.6.6.39816 > 172.24.123.214.80: Flags [F.], seq 0, ack 1, win 18384, options [nop,nop,TS val 2280181930 ecr 135380375], length 0
```

### Cilium Version

v1.15.14

### Kernel Version

```
$ uname -a
Linux XXXXXXX 4.18.0-553.34.1.el8_10.x86_64 #1 SMP Mon Dec 16 04:25:43 EST 2024 x86_64 x86_64 x86_64 GNU/Linux
```

### Kubernetes Version

```
$ kubectl version
Client Version: v1.30.8
Kustomize Version: v5.0.4-0.20230601165947-6ce0bf390ce3
Server Version: v1.30.8
```

### Relevant log output

```shell

```

### Anything else?

Cilium helm values overrides:

```
$ helm get values -n kube-system cilium
USER-SUPPLIED VALUES:
cluster:
  name: k8s-cluster-dev
cni:
  exclusive: false
dashboards:
  enabled: true
externalIPs:
  enabled: true
hostFirewall:
  enabled: true
hubble:
  enabled: true
  metrics:
    dashboards:
      enabled: true
    enabled:
    - dns
    - drop:labelsContext=source_namespace,destination_namespace;sourceContext=pod;destinationContext=pod
    - tcp
    - flow
    - icmp
    - httpV2:labelsContext=source_namespace,destination_namespace;sourceContext=pod;destinationContext=pod
    serviceMonitor:
      enabled: true
      labels:
        release: kube-prometheus-stack
  relay:
    enabled: true
  ui:
    enabled: true
image:
  pullPolicy: IfNotPresent
ipam:
  mode: cluster-pool
  operator:
    clusterPoolIPv4PodCIDRList:
    - 192.168.0.0/16
kubeProxyReplacement: false
operator:
  dashboards:
    enabled: true
  prometheus:
    serviceMonitor:
      enabled: true
      labels:
        release: kube-prometheus-stack
  replicas: 2
  unmanagedPodWatcher:
    restart: false
policyAuditMode: false
policyEnforcementMode: default
prometheus:
  enabled: true
  serviceMonitor:
    enabled: true
    labels:
      release: kube-prometheus-stack
routingMode: tunnel
tunnelPort: 8472
tunnelProtocol: vxlan
```
Cilium Status
```
$ cilium-dbg status
KVStore:                 Ok   Disabled
Kubernetes:              Ok   1.30 (v1.30.8) [linux/amd64]
Kubernetes APIs:         ["EndpointSliceOrEndpoint", "cilium/v2::CiliumClusterwideNetworkPolicy", "cilium/v2::CiliumEndpoint", "cilium/v2::CiliumNetworkPolicy", "cilium/v2::CiliumNode", "cilium/v2alpha1::CiliumCIDRGroup", "core/v1::Namespace", "core/v1::Pods", "core/v1::Service", "networking.k8s.io/v1::NetworkPolicy"]
KubeProxyReplacement:    False     [ens192  10.131.189.133 (Direct Routing)]
Host firewall:           Enabled   [ens192]
SRv6:                    Disabled
CNI Chaining:            none
CNI Config file:         successfully wrote CNI configuration file to /host/etc/cni/net.d/05-cilium.conflist
Cilium:                  Ok   1.15.14 (v1.15.14-779ce308)
NodeMonitor:             Listening for events on 128 CPUs with 64x4096 of shared memory
Cilium health daemon:    Ok
IPAM:                    IPv4: 3/254 allocated from 192.168.2.0/24,
IPv4 BIG TCP:            Disabled
IPv6 BIG TCP:            Disabled
BandwidthManager:        Disabled
Host Routing:            Legacy
Masquerading:            IPTables [IPv4: Enabled, IPv6: Disabled]
Controller Status:       27/27 healthy
Proxy Status:            OK, ip 192.168.2.218, 0 redirects active on ports 10000-20000, Envoy: embedded
Global Identity Range:   min 256, max 65535
Hubble:                  Ok              Current/Max Flows: 4095/4095 (100.00%), Flows/s: 252.24   Metrics: Ok
Encryption:              Disabled
Cluster health:          9/9 reachable   (2025-03-12T14:58:53Z)
Modules Health:          Stopped(0) Degraded(0) OK(12)
```

### Cilium Users Document

- [ ] Are you a user of Cilium? Please add yourself to the [Users doc](https://github.com/cilium/cilium/blob/main/USERS.md)

### Code of Conduct

- [x] I agree to follow this project's Code of Conduct

**Comment by squeed** [comment]
Interesting, I wonder if the conntrack or ipcache state is being torn down too early.
