### ISSUE TITLE
Azure LB health probe failing (IPv6 link-local address)

### ISSUE THREAD

**Issue by stelucz** [cilium/cilium#25242]
### Is there an existing issue for this?

- [X] I have searched the existing issues

### What happened?

When Azure LB is deployed to expose Kubernetes service, it will never become healthy and load balance traffic as health probes are failing.

Probes are reaching nodes properly but it seems that probes are dropped/denied by Cilium and thus load balancer is not receiving responds to probes.

LB probes have source address from IPv6 link-local address space, in my case `fe80::1234:5678:9abc`.

tcpdump at node:
```
tcpdump -nei any ip6 and port 30460
tcpdump: data link type LINUX_SLL2
tcpdump: verbose output suppressed, use -v[v]... for full protocol decode
listening on any, link-type LINUX_SLL2 (Linux cooked v2), snapshot length 262144 bytes
12:52:51.558487 enP47348s1 In  ifindex 3 12:34:56:78:9a:bc ethertype IPv6 (0x86dd), length 92: fe80::1234:5678:9abc.65168 > fddc:bbc4:705:2::a.30460: Flags [SEW], seq 1547269981, win 64800, options [mss 1440,nop,wscale 8,nop,nop,sackOK], length 0
12:52:51.558487 eth0  In  ifindex 2 12:34:56:78:9a:bc ethertype IPv6 (0x86dd), length 92: fe80::1234:5678:9abc.65168 > fddc:bbc4:705:2::a.30460: Flags [SEW], seq 1547269981, win 64800, options [mss 1440,nop,wscale 8,nop,nop,sackOK], length 0
12:52:52.573384 enP47348s1 In  ifindex 3 12:34:56:78:9a:bc ethertype IPv6 (0x86dd), length 92: fe80::1234:5678:9abc.65168 > fddc:bbc4:705:2::a.30460: Flags [SEW], seq 1547269981, win 64800, options [mss 1440,nop,wscale 8,nop,nop,sackOK], length 0
12:52:52.573384 eth0  In  ifindex 2 12:34:56:78:9a:bc ethertype IPv6 (0x86dd), length 92: fe80::1234:5678:9abc.65168 > fddc:bbc4:705:2::a.30460: Flags [SEW], seq 1547269981, win 64800, options [mss 1440,nop,wscale 8,nop,nop,sackOK], length 0
12:52:54.579086 enP47348s1 In  ifindex 3 12:34:56:78:9a:bc ethertype IPv6 (0x86dd), length 92: fe80::1234:5678:9abc.65168 > fddc:bbc4:705:2::a.30460: Flags [S], seq 1547269981, win 64800, options [mss 1440,nop,wscale 8,nop,nop,sackOK], length 0
12:52:54.579086 eth0  In  ifindex 2 12:34:56:78:9a:bc ethertype IPv6 (0x86dd), length 92: fe80::1234:5678:9abc.65168 > fddc:bbc4:705:2::a.30460: Flags [S], seq 1547269981, win 64800, options [mss 1440,nop,wscale 8,nop,nop,sackOK], length 0
12:52:57.574024 enP47348s1 In  ifindex 3 12:34:56:78:9a:bc ethertype IPv6 (0x86dd), length 92: fe80::1234:5678:9abc.65330 > fddc:bbc4:705:2::a.30460: Flags [SEW], seq 3203281907, win 64800, options [mss 1440,nop,wscale 8,nop,nop,sackOK], length 0
12:52:57.574024 eth0  In  ifindex 2 12:34:56:78:9a:bc ethertype IPv6 (0x86dd), length 92: fe80::1234:5678:9abc.65330 > fddc:bbc4:705:2::a.30460: Flags [SEW], seq 3203281907, win 64800, options [mss 1440,nop,wscale 8,nop,nop,sackOK], length 0
12:52:58.587394 enP47348s1 In  ifindex 3 12:34:56:78:9a:bc ethertype IPv6 (0x86dd), length 92: fe80::1234:5678:9abc.65330 > fddc:bbc4:705:2::a.30460: Flags [SEW], seq 3203281907, win 64800, options [mss 1440,nop,wscale 8,nop,nop,sackOK], length 0
12:52:58.587394 eth0  In  ifindex 2 12:34:56:78:9a:bc ethertype IPv6 (0x86dd), length 92: fe80::1234:5678:9abc.65330 > fddc:bbc4:705:2::a.30460: Flags [SEW], seq 3203281907, win 64800, options [mss 1440,nop,wscale 8,nop,nop,sackOK], length 0
12:53:00.601813 enP47348s1 In  ifindex 3 12:34:56:78:9a:bc ethertype IPv6 (0x86dd), length 92: fe80::1234:5678:9abc.65330 > fddc:bbc4:705:2::a.30460: Flags [S], seq 3203281907, win 64800, options [mss 1440,nop,wscale 8,nop,nop,sackOK], length 0
12:53:00.601813 eth0  In  ifindex 2 12:34:56:78:9a:bc ethertype IPv6 (0x86dd), length 92: fe80::1234:5678:9abc.65330 > fddc:bbc4:705:2::a.30460: Flags [S], seq 3203281907, win 64800, options [mss 1440,nop,wscale 8,nop,nop,sackOK], length 0
```

I managed to capture logs from hubble and cilium monitor. Both contains drop verdict, but I captured such drop verdicts just once and not again later.

Issue is reproducible either by using Azure cloud provider to expose Kubernetes service automatically or by creating NodePort Kubernetes service and deploying load balancer manually in Azure.

### Cilium Version

v1.12.4
v1.13.2

### Kernel Version

5.15.0-1036-azure #43-Ubuntu SMP Wed Mar 29 16:11:05 UTC 2023 x86_64 x86_64 x86_64 GNU/Linux

### Kubernetes Version

Client Version: v1.26.0
Kustomize Version: v4.5.7
Server Version: v1.25.4

### Relevant log output

```shell
hubble observe -f --verdict DROPPED
Apr 26 11:12:23.171: [fddc:bbc4:705:2::4]:30460 (host) <> [fe80::1234:5678:9abc]:54675 (world) Stale or unroutable IP DROPPED (TCP Flags: SYN, ACK)
Apr 26 11:12:23.395: [fddc:bbc4:705:2::4]:30460 (host) <> [fe80::1234:5678:9abc]:54503 (world) Stale or unroutable IP DROPPED (TCP Flags: SYN, ACK)
Apr 26 11:12:24.155: [fddc:bbc4:705:2::4]:30460 (host) <> [fe80::1234:5678:9abc]:54769 (world) Stale or unroutable IP DROPPED (TCP Flags: SYN, ACK)
Apr 26 11:12:25.154: [fddc:bbc4:705:2::4]:30460 (host) <> [fe80::1234:5678:9abc]:54769 (world) Stale or unroutable IP DROPPED (TCP Flags: SYN, ACK)


cilium monitor -t drop
Listening for events on 8 CPUs with 64x4096 of shared memory
Press Ctrl-C to quit
level=info msg="Initializing dissection cache..." subsys=monitor
xx drop (Stale or unroutable IP) flow 0x2885480f to endpoint 0, file bpf_host.c line 351, , identity host->unknown: [fddc:bbc4:705:2::4]:30460 -> [fe80::1234:5678:9abc]:56055 tcp SYN, ACK
xx drop (Stale or unroutable IP) flow 0xa247e0c9 to endpoint 0, file bpf_host.c line 351, , identity host->unknown: [fddc:bbc4:705:2::4]:30460 -> [fe80::1234:5678:9abc]:56055 tcp SYN, ACK
xx drop (Stale or unroutable IP) flow 0x6aa6b80e to endpoint 0, file bpf_host.c line 351, , identity host->unknown: [fddc:bbc4:705:2::4]:30460 -> [fe80::1234:5678:9abc]:55938 tcp SYN, ACK
xx drop (Stale or unroutable IP) flow 0x84d4eaf1 to endpoint 0, file bpf_host.c line 351, , identity host->unknown: [fddc:bbc4:705:2::4]:30460 -> [fe80::1234:5678:9abc]:55564 tcp SYN, ACK
xx drop (Stale or unroutable IP) flow 0x33bb69e7 to endpoint 0, file bpf_host.c line 351, , identity host->unknown: [fddc:bbc4:705:2::4]:30460 -> [fe80::1234:5678:9abc]:56055 tcp SYN, ACK
```

### Code of Conduct

- [X] I agree to follow this project's Code of Conduct

**Comment by stelucz** [comment]
If pod uses `hostNetwork` then probes are working fine as expected.

```
tcpdump -nei any ip6 and port 6443 and host fe80::1234:5678:9abc
tcpdump: data link type LINUX_SLL2
tcpdump: verbose output suppressed, use -v[v]... for full protocol decode
listening on any, link-type LINUX_SLL2 (Linux cooked v2), snapshot length 262144 bytes
06:29:38.709832 enP54030s1 In  ifindex 3 12:34:56:78:9a:bc ethertype IPv6 (0x86dd), length 80: fe80::1234:5678:9abc.64010 > fddc:bbc4:705:1::5.6443: Flags [F.], seq 1679197470, ack 843898114, win 49156, length 0
06:29:38.709832 eth0  In  ifindex 2 12:34:56:78:9a:bc ethertype IPv6 (0x86dd), length 80: fe80::1234:5678:9abc.64010 > fddc:bbc4:705:1::5.6443: Flags [F.], seq 0, ack 1, win 49156, length 0
06:29:38.709898 eth0  Out ifindex 2 00:0d:3a:2a:e5:6f ethertype IPv6 (0x86dd), length 80: fddc:bbc4:705:1::5.6443 > fe80::1234:5678:9abc.64010: Flags [.], ack 1, win 507, length 0
06:29:38.709899 enP54030s1 Out ifindex 3 00:0d:3a:2a:e5:6f ethertype IPv6 (0x86dd), length 80: fddc:bbc4:705:1::5.6443 > fe80::1234:5678:9abc.64010: Flags [.], ack 1, win 507, length 0
06:29:38.709946 eth0  Out ifindex 2 00:0d:3a:2a:e5:6f ethertype IPv6 (0x86dd), length 80: fddc:bbc4:705:1::5.6443 > fe80::1234:5678:9abc.64010: Flags [F.], seq 1, ack 1, win 507, length 0
06:29:38.709947 enP54030s1 Out ifindex 3 00:0d:3a:2a:e5:6f ethertype IPv6 (0x86dd), length 80: fddc:bbc4:705:1::5.6443 > fe80::1234:5678:9abc.64010: Flags [F.], seq 1, ack 1, win 507, length 0
06:29:38.710003 enP54030s1 In  ifindex 3 12:34:56:78:9a:bc ethertype IPv6 (0x86dd), length 80: fe80::1234:5678:9abc.64010 > fddc:bbc4:705:1::5.6443: Flags [.], ack 2, win 49156, length 0
06:29:38.710003 eth0  In  ifindex 2 12:34:56:78:9a:bc ethertype IPv6 (0x86dd), length 80: fe80::1234:5678:9abc.64010 > fddc:bbc4:705:1::5.6443: Flags [.], ack 2, win 49156, length 0
06:29:38.710395 enP54030s1 In  ifindex 3 12:34:56:78:9a:bc ethertype IPv6 (0x86dd), length 92: fe80::1234:5678:9abc.64072 > fddc:bbc4:705:1::5.6443: Flags [SEW], seq 453601271, win 64800, options [mss 1440,nop,wscale 8,nop,nop,sackOK], length 0
06:29:38.710395 eth0  In  ifindex 2 12:34:56:78:9a:bc ethertype IPv6 (0x86dd), length 92: fe80::1234:5678:9abc.64072 > fddc:bbc4:705:1::5.6443: Flags [SEW], seq 453601271, win 64800, options [mss 1440,nop,wscale 8,nop,nop,sackOK], length 0
06:29:38.710439 eth0  Out ifindex 2 00:0d:3a:2a:e5:6f ethertype IPv6 (0x86dd), length 92: fddc:bbc4:705:1::5.6443 > fe80::1234:5678:9abc.64072: Flags [S.], seq 1636735641, ack 453601272, win 64800, options [mss 1440,nop,nop,sackOK,nop,wscale 7], length 0
06:29:38.710440 enP54030s1 Out ifindex 3 00:0d:3a:2a:e5:6f ethertype IPv6 (0x86dd), length 92: fddc:bbc4:705:1::5.6443 > fe80::1234:5678:9abc.64072: Flags [S.], seq 1636735641, ack 453601272, win 64800, options [mss 1440,nop,nop,sackOK,nop,wscale 7], length 0
06:29:38.710609 enP54030s1 In  ifindex 3 12:34:56:78:9a:bc ethertype IPv6 (0x86dd), length 80: fe80::1234:5678:9abc.64072 > fddc:bbc4:705:1::5.6443: Flags [.], ack 1, win 49156, length 0
06:29:38.710609 eth0  In  ifindex 2 12:34:56:78:9a:bc ethertype IPv6 (0x86dd), length 80: fe80::1234:5678:9abc.64072 > fddc:bbc4:705:1::5.6443: Flags [.], ack 1, win 49156, length 0
```

Issue is also happening in `v1.14.0-snapshot.2` Cilium image.

**Comment by joestringer** [comment]
Hey @asauber , this seems a little bit related to another issue you were looking at. Do you think that you might have an idea what's going on here?

**Comment by asauber** [comment]
Yes, `[fe80::1234:5678:9abc]:54769 (world)` is the message of interest for that issue, and it does look like the same issue.

When the fix is up, I'll reference here.

**Comment by stelucz** [comment]
Hi @joestringer @asauber 
unfortunately 1.13.3 did not fix the problem with health probes. Can you help to troubleshoot it more deeply? hubble observe nor cilium monitor does not contain any drops related to probes. tcpdump is the same as last time, just SYN packets of probes.

**Comment by borkmann** [comment]
@asauber could you help taking another look? Thanks

**Comment by asauber** [comment]
Hi, yes, I can take another look. 

@stelucz Can you provide any additional info about your Azure LB configuration? Is this via a plain `Service` resource? If so, which annotations do you have configured?

**Comment by stelucz** [comment]
@asauber 
yes, LB is deployed and configured by [cloud-provider-azure](https://github.com/kubernetes-sigs/cloud-provider-azure) that is installed by helm chart. IPv4 LB works fine. But IPv6 has this health probe issue. Azure portal reports Health probe status: Unhealthy.

Service:
```
k describe svc rb-lb2
Name:                     rb-lb2
Namespace:                default
Labels:                   <none>
Annotations:              <none>
Selector:                 name=rebel-base
Type:                     LoadBalancer
IP Family Policy:         SingleStack
IP Families:              IPv6
IP:                       fd85:ee78:d8a6:8607::1b41
IPs:                      fd85:ee78:d8a6:8607::1b41
LoadBalancer Ingress:     26xx:xxxx:xxxx:xxxx::113
Port:                     <unset>  80/TCP
TargetPort:               80/TCP
NodePort:                 <unset>  31454/TCP
Endpoints:                [fd85:ee78:d8a6:8607::1:335]:80,[fd85:ee78:d8a6:8607::1:776]:80
Session Affinity:         None
External Traffic Policy:  Cluster
Events:                   <none>
```
I tried to create NodePort IPv6 service and configure Azure LB manually to verify there is no issue with cloud-provider-azure implementation and outcome was the same. LB ended up with unhealthy probe status. So my guess that eBPF/Cilium is blackholing/dropping probe packets coming from IPv6 LL address. Interestingly, I do not see any drops being reported by Cilium related to probes.

Just let me know, what other outputs or actions are you interested in. Thanks a lot!

**Comment by borkmann** [comment]
@stelucz what is the `fddc:bbc4:705:2::4` address, is that the one of the service VIP, backend Pod IP or host IP?

For TCP is the Azure LB trying to do connect+close? (And UDP just ICMP ping?)

**Comment by stelucz** [comment]
@borkmann `fddc:bbc4:705:2::4` is host IP (k8s worker) same as `fddc:bbc4:705:2::a` in tcpdump. I pasted tcpdump from different node than hubble outputs. Sorry for confusion.

Based on [Azure docs](https://learn.microsoft.com/en-us/azure/load-balancer/load-balancer-custom-probe-overview):
```TCP probes initiate a connection by performing a three-way open TCP handshake with the defined port. TCP probes terminate a connection with a four-way close TCP handshake.```

Good point with UDP, I have not tried it yet. So, I deployed UDP service with type of LoadBalancer and checked configuration. In this case cloud-provider somehow manages to create Azure LB without health probe. So, no probes are being send from Azure LB resource. I doublechecked that on hosts and really no probes are used for UDP. Azure LB assumes in such case that backend hosts are alive and connectivity to `LoadBalancer Ingress` address works fine from outside of cluster.

**Comment by asauber** [comment]
@stelucz, could you try changing your service to use `externalTrafficPolicy: Local`?

According to the [Azure documentation](https://learn.microsoft.com/en-us/azure/aks/configure-kubenet-dual-stack?tabs=azure-cli%2Ckubectl#limitations), this is a requirements for Linux Nodes.

The reason that this option might is used, in general, is to allow an external LoadBalancer to direct traffic toward Node IPs rather than Cluster-local IPs.

Based on some testing, this is a minimal working example of an IPv6 LoadBalancer service on AKS, using Cilium v1.13.4.

```
apiVersion: apps/v1
kind: Deployment
metadata:
  name: nginx
spec:
  replicas: 2
  selector:
    matchLabels:
      app: nginx
  template:
    metadata:
      labels:
        app: nginx
    spec:
      containers:
        - name: nginx
          image: nginx:1.25.1
          ports:
            - containerPort: 80
---
apiVersion: v1
kind: Service
metadata:
  name: nginx
spec:
  selector:
    app: nginx
  type: LoadBalancer
  externalTrafficPolicy: Local
  ipFamilies:
  - IPv6
  ipFamilyPolicy: SingleStack
  ports:
    - port: 80
      targetPort: 80

**Comment by stelucz** [comment]
@asauber indeed this works in my environment.
```
k describe svc nginx-local-6
Name:                     nginx-local-6
Namespace:                default
Labels:                   <none>
Annotations:              <none>
Selector:                 app=nginx
Type:                     LoadBalancer
IP Family Policy:         SingleStack
IP Families:              IPv6
IP:                       fd85:ee78:d8a6:8607::14a1
IPs:                      fd85:ee78:d8a6:8607::14a1
LoadBalancer Ingress:     2603:1020:201:10::57
Port:                     <unset>  80/TCP
TargetPort:               80/TCP
NodePort:                 <unset>  32247/TCP
Endpoints:                [fd85:ee78:d8a6:8607::1:3e0]:80
Session Affinity:         None
External Traffic Policy:  Local
HealthCheck NodePort:     32343
```

probe at host then looks like:
```
10:55:28.535787 enP47348s1 In  IP6 fe80::1234:5678:9abc.53772 > fddc:bbc4:705:2::a.32343: Flags [P.], seq 563787687:563787920, ack 2804514967, win 49151, length 233
10:55:28.535787 eth0  In  IP6 fe80::1234:5678:9abc.53772 > fddc:bbc4:705:2::a.32343: Flags [P.], seq 0:233, ack 1, win 49151, length 233
10:55:28.536007 eth0  Out IP6 fddc:bbc4:705:2::a.32343 > fe80::1234:5678:9abc.53772: Flags [P.], seq 1:236, ack 233, win 501, length 235
10:55:28.536010 enP47348s1 Out IP6 fddc:bbc4:705:2::a.32343 > fe80::1234:5678:9abc.53772: Flags [P.], seq 1:236, ack 233, win 501, length 235
10:55:28.546653 enP47348s1 In  IP6 fe80::1234:5678:9abc.53772 > fddc:bbc4:705:2::a.32343: Flags [.], ack 236, win 49156, length 0
10:55:28.546653 eth0  In  IP6 fe80::1234:5678:9abc.53772 > fddc:bbc4:705:2::a.32343: Flags [.], ack 236, win 49156, length 0
```

curl to probe port:
```
curl [fddc:bbc4:705:2::a]:32343
{
        "service": {
                "namespace": "default",
                "name": "nginx-local-6"
        },
        "localEndpoints": 1
}
```

> The reason that this option might is used, in general, is to allow an external LoadBalancer to direct traffic toward Node IPs rather than Cluster-local IPs.

I do not see any usage of Cluster-local IPs / Service IPs in LB's configuration when service is created without `externalTrafficPolicy: Local`. 

![Backend pool](https://i.ibb.co/xCWkxzT/backend-pool.png)

**Comment by asauber** [comment]
I'm glad to hear that it works.

Yes, this setting doesn't affect any of the addresses associated with the Service, it affects the forwarding behavior of kube-proxy implementation. The [Kubernetes documentation](https://kubernetes.io/docs/tasks/access-application-cluster/create-external-load-balancer/#preserving-the-client-source-ip) has a bit more details.

**Comment by stelucz** [comment]
@asauber cool. Thank you a lot for helping around this issue. Should there be an implementation for it in the future, I am happy to test it. Just ping me here.

**Comment by ti-mo** [comment]
@asauber Ping, anything still need to happen here? Feel free to close otherwise.
