### ISSUE TITLE
Can't access LoadBalancer IP with MetalLB outside of cluster nodes

### ISSUE THREAD

**Issue by Elegant996** [cilium/cilium#12895]
## Bug report

**General Information**
Unable to access LoadBalancer IP from any external client, including our router. `curl` requests do not return and timeout. Running the `curl` requests against the LoadBalancer IP on any node in the cluster returns appropriate results.

LoadBalancer IP is created using MetalLB. Same results occur for `layer2` and `bgp` configurations. No firewall is enabled on any of the cluster nodes and the router and client have full access to the network.

If the service is _freshly_ created, it will work momentarily before returning to timeouts.

- Cilium version (run `cilium version`)
```
Client: 1.8.2 aa42034f0 2020-07-23T15:02:39-07:00 go version go1.14.6 linux/amd64
Daemon: 1.8.2 aa42034f0 2020-07-23T15:02:39-07:00 go version go1.14.6 linux/amd64
```
- Kernel version (run `uname -a`)
```
Linux kube-master.example.com 5.6.14-300.fc32.x86_64 #1 SMP Wed May 20 20:47:32 UTC 2020 x86_64 x86_64 x86_64 GNU/Linux
```
- Orchestration system version in use (e.g. `kubectl version`, Mesos, ...)
```
Client Version: version.Info{Major:"1", Minor:"17", GitVersion:"v1.17.9", GitCommit:"4fb7ed12476d57b8437ada90b4f93b17ffaeed99", GitTreeState:"clean", BuildDate:"2020-07-15T16:18:16Z", GoVersion:"go1.13.9", Compiler:"gc", Platform:"linux/amd64"}
Server Version: version.Info{Major:"1", Minor:"17", GitVersion:"v1.17.9", GitCommit:"4fb7ed12476d57b8437ada90b4f93b17ffaeed99", GitTreeState:"clean", BuildDate:"2020-07-15T16:10:45Z", GoVersion:"go1.13.9", Compiler:"gc", Platform:"linux/amd64"}
```
- Link to relevant artifacts (policies, deployments scripts, ...)
```
---
apiVersion: apps/v1
kind: Deployment
metadata:
  name: nginx-deployment
  labels:
    app: nginx
spec:
  selector:
    matchLabels:
      app: nginx
  template:
    metadata:
      labels:
        app: nginx
    spec:
      containers:
      - name: nginx
        image: nginx
        ports:
        - containerPort: 80
---
apiVersion: v1
kind: Service
metadata:
  annotations:
    metallb.universe.tf/address-pool: default
  name: nginx-service
spec:
  selector:
    app: nginx
  type:  LoadBalancer
  loadBalancerIP: 10.0.30.15
  ports:
    - name: http
      port: 8088
      targetPort: 80
```
- Generate and upload a system zip:
```
curl -sLO https://git.io/cilium-sysdump-latest.zip && python cilium-sysdump-latest.zip
```
[cilium-sysdump-20200814-103947.zip](https://www.dropbox.com/s/nz8gcfh41xulfj9/cilium-sysdump-20200814-103947.zip?dl=0)

**How to reproduce the issue**

1. Deploy cluster (1 master, 2 nodes) using `kubeadm` with pod CIDR of 10.244.0.0/16
2. Deploy `cilium` with [Native Routing](https://docs.cilium.io/en/v1.8/concepts/networking/routing/#native-routing)
3. Run `curl http://10.0.30.15:8088` on any client/router outside the cluster

**Comment by brb** [comment]
@Elegant996 Please check whether:

1. LB IP is assigned to the service (`kubectl get svc`).
2. Cilium has properly provisioned services (`cilium bpf lb list`).
3. What happens with a request (`cilium monitor`).

**Comment by Elegant996** [comment]
@brb Please see the below as requested:

1. `kubectl get svc`
```
NAME                  TYPE           CLUSTER-IP       EXTERNAL-IP   PORT(S)             AGE
nginx-service         LoadBalancer   10.108.90.255    10.0.30.15    8088:32485/TCP      39m
```

2. `cilium bpf lb list`
```
10.0.30.15:8088        10.244.1.159:80 (76)
                       0.0.0.0:0 (76) [LoadBalancer]
```

3. `cilium monitor`

No monitoring for the IP 10.0.30.15 was observed when attempting a `curl`.

```
level=info msg="Initializing dissection cache..." subsys=monitor
-> stack flow 0x5f1b484c identity 2606->1 state established ifindex 0 orig-ip 0.0.0.0: 10.244.0.38:47836 -> 10.0.30.10:6443 tcp ACK
-> endpoint 1771 flow 0x1e0819d7 identity 1->2606 state reply ifindex 0 orig-ip 10.0.30.10: 10.0.30.10:6443 -> 10.244.0.38:47836 tcp ACK
-> endpoint 3628 flow 0xffa5fc8e identity 1->21670 state new ifindex 0 orig-ip 10.0.30.10: 10.0.30.10:35254 -> 10.244.0.18:9808 tcp SYN
-> stack flow 0x2b9b7392 identity 21670->1 state reply ifindex 0 orig-ip 0.0.0.0: 10.244.0.18:9808 -> 10.0.30.10:35254 tcp SYN, ACK
-> endpoint 3628 flow 0xffa5fc8e identity 1->21670 state established ifindex 0 orig-ip 10.0.30.10: 10.0.30.10:35254 -> 10.244.0.18:9808 tcp ACK
-> endpoint 3628 flow 0xffa5fc8e identity 1->21670 state established ifindex 0 orig-ip 10.0.30.10: 10.0.30.10:35254 -> 10.244.0.18:9808 tcp ACK
-> stack flow 0xa51084af identity 65060->1 state established ifindex 0 orig-ip 0.0.0.0: 10.244.0.168:59362 -> 10.0.30.10:6443 tcp ACK
-> stack flow 0x2b9b7392 identity 21670->1 state reply ifindex 0 orig-ip 0.0.0.0: 10.244.0.18:9808 -> 10.0.30.10:35254 tcp ACK
-> endpoint 3628 flow 0xffa5fc8e identity 1->21670 state established ifindex 0 orig-ip 10.0.30.10: 10.0.30.10:35254 -> 10.244.0.18:9808 tcp ACK, FIN
-> stack flow 0x2b9b7392 identity 21670->1 state reply ifindex 0 orig-ip 0.0.0.0: 10.244.0.18:9808 -> 10.0.30.10:35254 tcp ACK, FIN
-> endpoint 3628 flow 0xffa5fc8e identity 1->21670 state established ifindex 0 orig-ip 10.0.30.10: 10.0.30.10:35254 -> 10.244.0.18:9808 tcp ACK
-> stack flow 0xdaffe78d identity 2606->2 state established ifindex 0 orig-ip 0.0.0.0: 10.244.0.38:56308 -> 10.0.10.25:443 tcp ACK
-> stack flow 0xacfed4e2 identity 2606->2 state established ifindex 0 orig-ip 0.0.0.0: 10.244.0.38:56540 -> 10.0.10.25:443 tcp ACK
-> stack flow 0xe50007f6 identity 720->1 state established ifindex 0 orig-ip 0.0.0.0: 10.244.0.39:45552 -> 10.0.30.10:6443 tcp ACK
-> endpoint 21 flow 0xd98933f6 identity 1->720 state reply ifindex 0 orig-ip 10.0.30.10: 10.0.30.10:6443 -> 10.244.0.39:45552 tcp ACK
-> endpoint 3519 flow 0x18a537c5 identity 1->5194 state new ifindex 0 orig-ip 10.0.30.10: 10.0.30.10:51546 -> 10.244.0.182:6080 tcp SYN
-> stack flow 0x33795581 identity 5194->1 state reply ifindex 0 orig-ip 0.0.0.0: 10.244.0.182:6080 -> 10.0.30.10:51546 tcp SYN, ACK
-> endpoint 3519 flow 0x18a537c5 identity 1->5194 state established ifindex 0 orig-ip 10.0.30.10: 10.0.30.10:51546 -> 10.244.0.182:6080 tcp ACK
-> endpoint 3519 flow 0x18a537c5 identity 1->5194 state established ifindex 0 orig-ip 10.0.30.10: 10.0.30.10:51546 -> 10.244.0.182:6080 tcp ACK
-> stack flow 0x33795581 identity 5194->1 state reply ifindex 0 orig-ip 0.0.0.0: 10.244.0.182:6080 -> 10.0.30.10:51546 tcp ACK
-> endpoint 3519 flow 0x18a537c5 identity 1->5194 state established ifindex 0 orig-ip 10.0.30.10: 10.0.30.10:51546 -> 10.244.0.182:6080 tcp ACK, FIN
-> stack flow 0x33795581 identity 5194->1 state reply ifindex 0 orig-ip 0.0.0.0: 10.244.0.182:6080 -> 10.0.30.10:51546 tcp ACK, FIN
-> endpoint 3519 flow 0x18a537c5 identity 1->5194 state established ifindex 0 orig-ip 10.0.30.10: 10.0.30.10:51546 -> 10.244.0.182:6080 tcp ACK
-> endpoint 3519 flow 0x9a8a59ac identity 1->5194 state new ifindex 0 orig-ip 10.0.30.10: 10.0.30.10:51552 -> 10.244.0.182:6080 tcp SYN
-> stack flow 0x6f23e74e identity 5194->1 state reply ifindex 0 orig-ip 0.0.0.0: 10.244.0.182:6080 -> 10.0.30.10:51552 tcp SYN, ACK
-> endpoint 3519 flow 0x9a8a59ac identity 1->5194 state established ifindex 0 orig-ip 10.0.30.10: 10.0.30.10:51552 -> 10.244.0.182:6080 tcp ACK
-> endpoint 3519 flow 0x9a8a59ac identity 1->5194 state established ifindex 0 orig-ip 10.0.30.10: 10.0.30.10:51552 -> 10.244.0.182:6080 tcp ACK
-> endpoint 3519 flow 0x9a8a59ac identity 1->5194 state established ifindex 0 orig-ip 10.0.30.10: 10.0.30.10:51552 -> 10.244.0.182:6080 tcp ACK, FIN
-> stack flow 0x6f23e74e identity 5194->1 state reply ifindex 0 orig-ip 0.0.0.0: 10.244.0.182:6080 -> 10.0.30.10:51552 tcp ACK
-> stack flow 0x6f23e74e identity 5194->1 state reply ifindex 0 orig-ip 0.0.0.0: 10.244.0.182:6080 -> 10.0.30.10:51552 tcp ACK, FIN
-> endpoint 3519 flow 0x9a8a59ac identity 1->5194 state established ifindex 0 orig-ip 10.0.30.10: 10.0.30.10:51552 -> 10.244.0.182:6080 tcp ACK
-> stack flow 0x7d1b5cc6 identity 5495->1 state established ifindex 0 orig-ip 0.0.0.0: 10.244.0.228:54862 -> 10.0.30.10:6443 tcp ACK
-> endpoint 298 flow 0x44befdec identity 1->5495 state reply ifindex 0 orig-ip 10.0.30.10: 10.0.30.10:6443 -> 10.244.0.228:54862 tcp ACK
-> stack flow 0xf3ef0a2 identity 15952->1 state established ifindex 0 orig-ip 0.0.0.0: 10.244.0.64:47502 -> 10.0.30.10:6443 tcp ACK
-> endpoint 3629 flow 0xb8782fa2 identity 1->15952 state reply ifindex 0 orig-ip 10.0.30.10: 10.0.30.10:6443 -> 10.244.0.64:47502 tcp ACK
-> endpoint 1880 flow 0xc312e1a8 identity 1->65060 state reply ifindex 0 orig-ip 10.0.30.10: 10.0.30.10:6443 -> 10.244.0.168:59362 tcp ACK
-> endpoint 2414 flow 0x99e80d30 identity 1->1567 state new ifindex 0 orig-ip 10.0.30.10: 10.0.30.10:55602 -> 10.244.0.2:7472 tcp SYN
-> stack flow 0x7d65f7f2 identity 1567->1 state reply ifindex 0 orig-ip 0.0.0.0: 10.244.0.2:7472 -> 10.0.30.10:55602 tcp SYN, ACK
-> endpoint 2414 flow 0x99e80d30 identity 1->1567 state established ifindex 0 orig-ip 10.0.30.10: 10.0.30.10:55602 -> 10.244.0.2:7472 tcp ACK
-> endpoint 2414 flow 0x99e80d30 identity 1->1567 state established ifindex 0 orig-ip 10.0.30.10: 10.0.30.10:55602 -> 10.244.0.2:7472 tcp ACK
-> stack flow 0x7d65f7f2 identity 1567->1 state reply ifindex 0 orig-ip 0.0.0.0: 10.244.0.2:7472 -> 10.0.30.10:55602 tcp ACK
-> endpoint 2414 flow 0x99e80d30 identity 1->1567 state established ifindex 0 orig-ip 10.0.30.10: 10.0.30.10:55602 -> 10.244.0.2:7472 tcp ACK, FIN
-> stack flow 0x7d65f7f2 identity 1567->1 state reply ifindex 0 orig-ip 0.0.0.0: 10.244.0.2:7472 -> 10.0.30.10:55602 tcp ACK, FIN
-> endpoint 2414 flow 0x99e80d30 identity 1->1567 state established ifindex 0 orig-ip 10.0.30.10: 10.0.30.10:55602 -> 10.244.0.2:7472 tcp ACK
-> stack flow 0x66011ec8 identity 2606->1 state established ifindex 0 orig-ip 0.0.0.0: 10.244.0.38:47854 -> 10.0.30.10:6443 tcp ACK
-> endpoint 1771 flow 0x7a43256b identity 1->2606 state reply ifindex 0 orig-ip 10.0.30.10: 10.0.30.10:6443 -> 10.244.0.38:47854 tcp ACK
-> endpoint 1771 flow 0xdc4541f1 identity 1->2606 state new ifindex 0 orig-ip 10.0.30.10: 10.0.30.10:48818 -> 10.244.0.38:9808 tcp SYN
-> stack flow 0x3644d8e8 identity 2606->1 state reply ifindex 0 orig-ip 0.0.0.0: 10.244.0.38:9808 -> 10.0.30.10:48818 tcp SYN, ACK
-> endpoint 1771 flow 0xdc4541f1 identity 1->2606 state established ifindex 0 orig-ip 10.0.30.10: 10.0.30.10:48818 -> 10.244.0.38:9808 tcp ACK
-> endpoint 1771 flow 0xdc4541f1 identity 1->2606 state established ifindex 0 orig-ip 10.0.30.10: 10.0.30.10:48818 -> 10.244.0.38:9808 tcp ACK
-> stack flow 0x3644d8e8 identity 2606->1 state reply ifindex 0 orig-ip 0.0.0.0: 10.244.0.38:9808 -> 10.0.30.10:48818 tcp ACK
-> endpoint 1771 flow 0xdc4541f1 identity 1->2606 state established ifindex 0 orig-ip 10.0.30.10: 10.0.30.10:48818 -> 10.244.0.38:9808 tcp ACK, FIN
-> stack flow 0x3644d8e8 identity 2606->1 state reply ifindex 0 orig-ip 0.0.0.0: 10.244.0.38:9808 -> 10.0.30.10:48818 tcp ACK, FIN
-> endpoint 1771 flow 0xdc4541f1 identity 1->2606 state established ifindex 0 orig-ip 10.0.30.10: 10.0.30.10:48818 -> 10.244.0.38:9808 tcp ACK
-> stack flow 0x360328b8 identity 2606->1 state established ifindex 0 orig-ip 0.0.0.0: 10.244.0.38:48186 -> 10.0.30.10:6443 tcp ACK
-> endpoint 1771 flow 0x563fbe0e identity 1->2606 state reply ifindex 0 orig-ip 10.0.30.10: 10.0.30.10:6443 -> 10.244.0.38:48186 tcp ACK
-> endpoint 1771 flow 0x1e0819d7 identity 1->2606 state reply ifindex 0 orig-ip 10.0.30.10: 10.0.30.10:6443 -> 10.244.0.38:47836 tcp ACK
-> stack flow 0x5f1b484c identity 2606->1 state established ifindex 0 orig-ip 0.0.0.0: 10.244.0.38:47836 -> 10.0.30.10:6443 tcp ACK
-> endpoint 3628 flow 0x66bd62c1 identity 1->21670 state new ifindex 0 orig-ip 10.0.30.10: 10.0.30.10:35272 -> 10.244.0.18:9808 tcp SYN
-> stack flow 0x4797e3d7 identity 21670->1 state reply ifindex 0 orig-ip 0.0.0.0: 10.244.0.18:9808 -> 10.0.30.10:35272 tcp SYN, ACK
-> endpoint 3628 flow 0x66bd62c1 identity 1->21670 state established ifindex 0 orig-ip 10.0.30.10: 10.0.30.10:35272 -> 10.244.0.18:9808 tcp ACK
-> endpoint 3628 flow 0x66bd62c1 identity 1->21670 state established ifindex 0 orig-ip 10.0.30.10: 10.0.30.10:35272 -> 10.244.0.18:9808 tcp ACK
-> stack flow 0x4797e3d7 identity 21670->1 state reply ifindex 0 orig-ip 0.0.0.0: 10.244.0.18:9808 -> 10.0.30.10:35272 tcp ACK
-> endpoint 3628 flow 0x66bd62c1 identity 1->21670 state established ifindex 0 orig-ip 10.0.30.10: 10.0.30.10:35272 -> 10.244.0.18:9808 tcp ACK, FIN
-> stack flow 0x4797e3d7 identity 21670->1 state reply ifindex 0 orig-ip 0.0.0.0: 10.244.0.18:9808 -> 10.0.30.10:35272 tcp ACK, FIN
-> endpoint 3628 flow 0x66bd62c1 identity 1->21670 state established ifindex 0 orig-ip 10.0.30.10: 10.0.30.10:35272 -> 10.244.0.18:9808 tcp ACK
-> endpoint 1880 flow 0xb52e20e0 identity 2->65060 state established ifindex 0 orig-ip 10.0.20.10: 10.0.20.10:55821 -> 10.244.0.168:8443 tcp ACK
-> stack flow 0xa1527867 identity 65060->2 state reply ifindex 0 orig-ip 0.0.0.0: 10.244.0.168:8443 -> 10.0.20.10:55821 tcp ACK
-> endpoint 2414 flow 0x24da315a identity 1->1567 state new ifindex 0 orig-ip 10.0.30.10: 10.0.30.10:55614 -> 10.244.0.2:7472 tcp SYN
-> stack flow 0xc4c729e4 identity 1567->1 state reply ifindex 0 orig-ip 0.0.0.0: 10.244.0.2:7472 -> 10.0.30.10:55614 tcp SYN, ACK
-> endpoint 2414 flow 0x24da315a identity 1->1567 state established ifindex 0 orig-ip 10.0.30.10: 10.0.30.10:55614 -> 10.244.0.2:7472 tcp ACK
-> endpoint 2414 flow 0x24da315a identity 1->1567 state established ifindex 0 orig-ip 10.0.30.10: 10.0.30.10:55614 -> 10.244.0.2:7472 tcp ACK
-> stack flow 0xc4c729e4 identity 1567->1 state reply ifindex 0 orig-ip 0.0.0.0: 10.244.0.2:7472 -> 10.0.30.10:55614 tcp ACK
-> endpoint 2414 flow 0x24da315a identity 1->1567 state established ifindex 0 orig-ip 10.0.30.10: 10.0.30.10:55614 -> 10.244.0.2:7472 tcp ACK, FIN
-> stack flow 0xc4c729e4 identity 1567->1 state reply ifindex 0 orig-ip 0.0.0.0: 10.244.0.2:7472 -> 10.0.30.10:55614 tcp ACK, FIN
-> endpoint 2414 flow 0x24da315a identity 1->1567 state established ifindex 0 orig-ip 10.0.30.10: 10.0.30.10:55614 -> 10.244.0.2:7472 tcp ACK
-> stack flow 0xa51084af identity 65060->1 state established ifindex 0 orig-ip 0.0.0.0: 10.244.0.168:59362 -> 10.0.30.10:6443 tcp ACK
-> stack flow 0x1ff75a8a identity 4->6 state reply ifindex 0 orig-ip 0.0.0.0: 10.244.0.65:4240 -> 10.0.30.12:53954 tcp ACK
-> endpoint 955 flow 0x697117eb identity 6->4 state established ifindex 0 orig-ip 10.0.30.12: 10.0.30.12:53954 -> 10.244.0.65:4240 tcp ACK
-> endpoint 1880 flow 0x55166059 identity 1->65060 state new ifindex 0 orig-ip 10.0.30.10: 10.0.30.10:40020 -> 10.244.0.168:9000 tcp SYN
-> stack flow 0x9663930e identity 65060->1 state reply ifindex 0 orig-ip 0.0.0.0: 10.244.0.168:9000 -> 10.0.30.10:40020 tcp SYN, ACK
-> endpoint 1880 flow 0x55166059 identity 1->65060 state established ifindex 0 orig-ip 10.0.30.10: 10.0.30.10:40020 -> 10.244.0.168:9000 tcp ACK
-> endpoint 1880 flow 0x55166059 identity 1->65060 state established ifindex 0 orig-ip 10.0.30.10: 10.0.30.10:40020 -> 10.244.0.168:9000 tcp ACK
-> stack flow 0x9663930e identity 65060->1 state reply ifindex 0 orig-ip 0.0.0.0: 10.244.0.168:9000 -> 10.0.30.10:40020 tcp ACK
-> stack flow 0x9663930e identity 65060->1 state reply ifindex 0 orig-ip 0.0.0.0: 10.244.0.168:9000 -> 10.0.30.10:40020 tcp ACK, FIN
-> endpoint 1880 flow 0x55166059 identity 1->65060 state established ifindex 0 orig-ip 10.0.30.10: 10.0.30.10:40020 -> 10.244.0.168:9000 tcp ACK, FIN
```

Thanks!

**Comment by brb** [comment]
Maybe check with tcpdump whether the node receives a request.

**Comment by Elegant996** [comment]
Able to receive ICMP replies but no dice for port 8088:

```
11:39:25.626461 IP 10.0.30.2.20389 > 10.0.30.15.8088: tcp 0
11:39:28.622981 IP 10.0.30.2.20389 > 10.0.30.15.8088: tcp 0
11:39:46.254389 IP 10.0.30.2.20459 > 10.0.30.15.8088: tcp 0
11:39:49.251319 IP 10.0.30.2.20459 > 10.0.30.15.8088: tcp 0
11:39:59.175427 IP 10.0.30.2 > 10.0.30.15: ICMP echo request, id 18704, seq 0, length 64
11:39:59.175562 IP 10.0.30.15 > 10.0.30.2: ICMP echo reply, id 18704, seq 0, length 64
11:40:00.189178 IP 10.0.30.2 > 10.0.30.15: ICMP echo request, id 18704, seq 1, length 64
11:40:00.189380 IP 10.0.30.15 > 10.0.30.2: ICMP echo reply, id 18704, seq 1, length 64
```

**Comment by Elegant996** [comment]
@brb Setting `kube-proxy-replacement` to `disabled` so that everything runs off of `kube-proxy` does resolve the issue. I can play around with `partial` and see what happens but this is definitely an issue with the eBPF replacement whether it be set to `strict` and kube-proxy removed or `probe` (default).

**Comment by Elegant996** [comment]
@brb Testing complete, results can be found below.

1. No issues, `curl` functions as expected with either `externalTrafficPolicy: Local` or `Cluster`.
```
helm upgrade cilium cilium/cilium --version 1.8.2 \
  --namespace kube-system \
  --set global.kubeProxyReplacement=disabled \
  --set global.cni.chainingMode=portmap
```

2. `curl` functions as expected if `externalTrafficPolicy: Local` but not with `Cluster` and yields a `curl: (56) Recv failure: Connection reset by peer`.
```
helm upgrade cilium cilium/cilium --version 1.8.2 \
  --namespace kube-system \
  --set global.tunnel=disabled \
  --set global.autoDirectNodeRoutes=true \
  --set global.kubeProxyReplacement=disabled \
  --set global.nativeRoutingCIDR=10.244.0.0/16 \
  --set config.ipam=kubernetes \
  --set global.endpointRoutes.enabled=true \
  --set global.ipam.operator.clusterPoolIPv4PodCIDR=10.244.0.0/16 \
  --set global.ipam.operator.clusterPoolIPv4MaskSize=24 \
  --set global.cni.chainingMode=portmap
```

3. `curl` functions the same as the findings in the second test bed but `portmap` is no longer required.
```
helm upgrade cilium cilium/cilium --version 1.8.2 \
  --namespace kube-system \
  --set global.tunnel=disabled \
  --set global.autoDirectNodeRoutes=true \
  --set global.kubeProxyReplacement=partial \
  --set global.enableHealthCheckNodeport=false \
  --set global.hostServices.enabled=true \
  --set global.nodePort.enabled=false \
  --set global.externalIPs.enabled=true \
  --set global.hostPort.enabled=true \
  --set global.k8sServiceHost=10.0.30.10 \
  --set global.k8sServicePort=6443 \
  --set global.nativeRoutingCIDR=10.244.0.0/16 \
  --set config.ipam=kubernetes \
  --set global.endpointRoutes.enabled=true \
  --set global.ipam.operator.clusterPoolIPv4PodCIDR=10.244.0.0/16 \
  --set global.ipam.operator.clusterPoolIPv4MaskSize=24
```

4. `curl` breaks completely in both `externalTrafficPolicy: Local` and `Cluster`.
```
helm upgrade cilium cilium/cilium --version 1.8.2 \
  --namespace kube-system \
  --set global.tunnel=disabled \
  --set global.autoDirectNodeRoutes=true \
  --set global.kubeProxyReplacement=partial \
  --set global.enableHealthCheckNodeport=true \
  --set global.hostServices.enabled=true \
  --set global.nodePort.enabled=true \
  --set global.externalIPs.enabled=true \
  --set global.hostPort.enabled=true \
  --set global.k8sServiceHost=10.0.30.10 \
  --set global.k8sServicePort=6443 \
  --set global.nativeRoutingCIDR=10.244.0.0/16 \
  --set config.ipam=kubernetes \
  --set global.endpointRoutes.enabled=true \
  --set global.ipam.operator.clusterPoolIPv4PodCIDR=10.244.0.0/16 \
  --set global.ipam.operator.clusterPoolIPv4MaskSize=24
```

Overall, when enabling `global.kubeProxyReplacement=partial` only services with `externalTrafficPolicy: Local` worked as expected and when `global.nodePort.enabled=true` was introduced, all services failed with `curl`.

**Comment by brb** [comment]
Have you tried disabling per-endpoint routes (`--set global.endpointRoutes.enabled=false`)?

**Comment by Elegant996** [comment]
The `global.endpointRoutes.enabled` seems to have no impact but nothing is responsive when switching from type `LoadBalancer` to `NodePort`. Using `curl` on `10.96.126.86:31990`, the `nginx` service NodeIP/Port, just times out.

Side note, if we set `global.enableHealthCheckNodeport` to `false` per the documentation when `NodePort` is disabled, the pod crashes and will not start.

Thanks!

**Comment by brb** [comment]
Can you check with tcpdump whether the node which runs the backend of the svc receives a request which should be forwarded by the node which received the original request from the client from outside?

> Side note, if we set global.enableHealthCheckNodeport to false per the documentation when NodePort is disabled, the pod crashes and will not start.

Can you please create a separate issue for it?

**Comment by briantopping** [comment]
Is this related to #14563?

**Comment by Zempashi** [comment]
For reference, I got the exact set of symptoms (works with `externalTrafficPolicy: Local` when floating ip is located on a node that got a backend pod, works with kube-proxy-replacement disabled), but the issue was not cilium. It was the underlying network that forbid me to send a response from another node. This is the exact purpose of DSR which I enabled (and I noticed that @Elegant996 also has DSR enabled in sys-dump).

**Comment by WMP** [comment]
I have this save issue, literally like as @Zempashi . I install external metallb, because i want to use layer2 protocol, and in cilium documentation metallb works only with BGP mode. This is my metallb config:
```
  address-pools:
    - name: ingress-internal
      protocol: layer2
      addresses:
      - 172.17.1.95/32
      auto-assign: false
    - name: wildcard
      protocol: layer2
      addresses:
      - 172.17.2.7/32
      auto-assign: false
```
My service works without any issue  with `type: LoadBalancer   externalTrafficPolicy: Local`, but when i want to use `externalTrafficPolicy: Cluster`, curl from other host in this vlan get response only when metalLB IP is propagated on this same node with backend pod. But from cluster nodes works 100% good.

**Comment by WMP** [comment]
I reolve this: https://github.com/rancher/rke2/issues/2728

**Comment by Zempashi** [comment]
@WMP, like I said, it wasn't a problem with cilium but the network setup. Are you sure that your network allow unsymmetrical pathes ? (Request come in node A where the IP is located then get "rerouted" to a node where a backend pod really is: node B for exemple, and then response is emitted from node B)
Many cloud network doesn't allow that, as it can be seen as spoofing the MAC address (The response come from a different MAC from the one on which the request was send)

**Comment by WMP** [comment]
No, the disable-kube-proxy rke2 option does not remove kube-rpoxy deployment in case the cluster was created with kube-proxy. This means that in theory I had disable-kube-proxy set, but this deployment was running and iptables was full of rules.
