### ISSUE TITLE
cilium-agent stuck in init when upgrading to 1.19 and kube-proxy in ipvs mode

### ISSUE THREAD

**Issue by ralgozino** [cilium/cilium#44464]
### Is there an existing issue for this?

- [x] I have searched the existing issues

### Version

equal or higher than v1.19.0 and lower than v1.20.0

### What happened?

Upgrading Cilium from 1.18.x to 1.19.0 (and 1.19.1) when the cluster is running with kube-proxy in IPVS mode results in cilium-agent daemonset stuck in `Init:0/6` status.

### How can we reproduce the issue?

1. Get a k8s cluster with kube-proxy in IPVS mode
2. Install cilium 1.18.x (for example, using the cilium cli `cilium install`)
3. Upgrade to cilium 1.19.x (for example, update the cilium cli and run `cilium install`)
4. See cilium-agent pods get suck in Init:0/6 and the `config` container logs that it fails to contact Kubernete's API server service.

Note: the cilium-agent for the control plane seems to be OK.

### Cilium Version

Issue is present when upgrading to both 1.19.0 and 1.19.1 from 1.18.x.

### Kernel Version

Issue presents on both

Linux 6.8.0-100-generic #100-Ubuntu SMP PREEMPT_DYNAMIC aarch64 aarch64 aarch64 GNU/Linux

and

Linux 6.12.66-flatcar #1 SMP PREEMPT aarch64 GNU/Linux

### Kubernetes Version

Issue replicated in both 1.33.4 and 1.34.3

### Regression

1.18.x works

### Relevant log output

```shell
time=2026-02-20T08:41:51.269571119Z level=info msg=Running subsys=cilium-dbg
time=2026-02-20T08:41:51.27048087Z level=info msg="Starting hive" subsys=cilium-dbg
time=2026-02-20T08:41:51.27053487Z level=info msg="Establishing connection to apiserver" subsys=cilium-dbg module=k8s-client ipAddr=https://172.30.0.1:443
time=2026-02-20T08:42:26.28586537Z level=info msg="Establishing connection to apiserver" subsys=cilium-dbg module=k8s-client ipAddr=https://172.30.0.1:443
Error: Build config failed: failed to start: Get "https://172.30.0.1:443/api/v1/namespaces/kube-system": dial tcp 172.30.0.1:443: i/o timeout
```

### Anything else?

Restarting kube-proxy does not solve the issue. Restarting cilium-agent's rollout does not solve the issue.

I found that rebooting the node makes cilium-agent become ready. Also, if you don't reboot the nodes but you edit kube-proxy configmap in kube-system namespace and change the `mode` parameter to either `iptables` or `nftables` and rollout kube-proxy, then cilium-agent gets unstuck.

Also, updating when kube-proxy is in either `iptables` or `nftables` mode does not present the issue. The issue is present only when kube-proxy is in `ipvs` mode.

Note: a clean installation of 1.19.0 (instead of an upgrade) does not get stuck in Init:0/6.

### Cilium Users Document

- [x] Are you a user of Cilium? Please add yourself to the [Users doc](https://github.com/cilium/cilium/blob/main/USERS.md)

### Code of Conduct

- [x] I agree to follow this project's Code of Conduct

**Comment by aanm** [comment]
I'm unable to reproduce the issue.
I installed Cilium v1.18.7 on an IPVS kind cluster and then updated using `cilium upgrade`:
```
$ ./cilium status
    /¯¯\
 /¯¯\__/¯¯\    Cilium:             OK
 \__/¯¯\__/    Operator:           OK
 /¯¯\__/¯¯\    Envoy DaemonSet:    OK
 \__/¯¯\__/    Hubble Relay:       disabled
    \__/       ClusterMesh:        disabled

DaemonSet              cilium                   Desired: 2, Ready: 2/2, Available: 2/2
DaemonSet              cilium-envoy             Desired: 2, Ready: 2/2, Available: 2/2
Deployment             cilium-operator          Desired: 1, Ready: 1/1, Available: 1/1
Containers:            cilium                   Running: 2
                       cilium-envoy             Running: 2
                       cilium-operator          Running: 1
                       clustermesh-apiserver    
                       hubble-relay             
Cluster Pods:          3/3 managed by Cilium
Helm chart version:    1.19.0
Image versions         cilium             quay.io/cilium/cilium:v1.19.0@sha256:be9f8571c2e114b3e12e41f785f2356ade703b2eac936aa878805565f0468c60: 2
                       cilium-envoy       quay.io/cilium/cilium-envoy:v1.35.9-1768828720-c6e4827ebca9c47af2a3a6540c563c30947bae29@sha256:696582a3391ce05a62edb4140e6a99f774351f363f5b5d7f1581f3a244430249: 2
                       cilium-operator    quay.io/cilium/operator-generic:v1.19.0@sha256:5b04006015e5800307dc6314676edc4c0bb7ac2fc7848be2b94b43bb030ab648: 1
```

**Comment by ralgozino** [comment]
Hi @aanm , I was able to replicate the issue on a kind cluster too. Here are the steps I followed:

1. Create kind cluster

```yaml
# kind-config.yaml
kind: Cluster
apiVersion: kind.x-k8s.io/v1alpha4
networking:
  disableDefaultCNI: true
nodes:
- role: control-plane
- role: worker
- role: worker
```

```
$ kind create cluster --config kind-config.yaml
```

2. Set kubeProxy to ivps mode

```
# edit kubeproxy configuration:
$ kubectl edit configmaps -n kube-system kube-proxy
# change `mode: iptables` to `mode: ivps`
# restart the daemonset to apply the change:
$ kubectl rollout restart daemonset -n kube-system kube-proxy
```

3. Install Cilium 1.18
```
$ cilium version
cilium-cli: v0.18.9 compiled with go1.25.5 on darwin/arm64
cilium image (default): v1.18.3
cilium image (stable): v1.19.1
cilium image (running): 1.19.0
$ cilium install
🔮 Auto-detected Kubernetes kind: kind
ℹ️  Using Cilium version 1.18.3
🔮 Auto-detected cluster name: kind-kind
🔮 Auto-detected kube-proxy has been installed
```

4. Wait for all pods to be ready
```
$ cilium status
    /¯¯\
 /¯¯\__/¯¯\    Cilium:             OK
 \__/¯¯\__/    Operator:           OK
 /¯¯\__/¯¯\    Envoy DaemonSet:    OK
 \__/¯¯\__/    Hubble Relay:       disabled
    \__/       ClusterMesh:        disabled

DaemonSet              cilium                   Desired: 3, Ready: 3/3, Available: 3/3
DaemonSet              cilium-envoy             Desired: 3, Ready: 3/3, Available: 3/3
Deployment             cilium-operator          Desired: 1, Ready: 1/1, Available: 1/1
Containers:            cilium                   Running: 3
                       cilium-envoy             Running: 3
                       cilium-operator          Running: 1
                       clustermesh-apiserver
                       hubble-relay
Cluster Pods:          3/3 managed by Cilium
Helm chart version:    1.18.3
Image versions         cilium             quay.io/cilium/cilium:v1.18.3@sha256:5649db451c88d928ea585514746d50d91e6210801b300c897283ea319d68de15: 3
                       cilium-envoy       quay.io/cilium/cilium-envoy:v1.34.10-1761014632-c360e8557eb41011dfb5210f8fb53fed6c0b3222@sha256:ca76eb4e9812d114c7f43215a742c00b8bf41200992af0d21b5561d46156fd15: 3
                       cilium-operator    quay.io/cilium/operator-generic:v1.18.3@sha256:b5a0138e1a38e4437c5215257ff4e35373619501f4877dbaf92c89ecfad81797: 1
```

5. Update Cilium to 1.19
```
$ cilium version
cilium upgrade
🔮 Auto-detected Kubernetes kind: kind
ℹ️  Using Cilium version 1.19.0
🔮 Auto-detected cluster name: kind-kind
🔮 Auto-detected kube-proxy has been installed
⚠️  You maybe need to restart Cilium pods for configmap changes to take effect
```

6. See how the cilium pods get stuck, and running cilium status confirms:
```
$ cilium status
    /¯¯\
 /¯¯\__/¯¯\    Cilium:             2 errors, 2 warnings
 \__/¯¯\__/    Operator:           OK
 /¯¯\__/¯¯\    Envoy DaemonSet:    1 errors
 \__/¯¯\__/    Hubble Relay:       disabled
    \__/       ClusterMesh:        disabled

DaemonSet              cilium                   Desired: 3, Ready: 1/3, Available: 1/3, Unavailable: 2/3
DaemonSet              cilium-envoy             Desired: 3, Ready: 1/3, Available: 1/3, Unavailable: 2/3
Deployment             cilium-operator          Desired: 1, Ready: 1/1, Available: 1/1
Containers:            cilium                   Pending: 2, Running: 1
                       cilium-envoy             Running: 3
                       cilium-operator          Running: 1
                       clustermesh-apiserver
                       hubble-relay
Cluster Pods:          3/3 managed by Cilium
Helm chart version:    1.19.0
Image versions         cilium             quay.io/cilium/cilium:v1.18.3@sha256:5649db451c88d928ea585514746d50d91e6210801b300c897283ea319d68de15: 1
                       cilium             quay.io/cilium/cilium:v1.19.0@sha256:be9f8571c2e114b3e12e41f785f2356ade703b2eac936aa878805565f0468c60: 2
                       cilium-envoy       quay.io/cilium/cilium-envoy:v1.35.9-1768828720-c6e4827ebca9c47af2a3a6540c563c30947bae29@sha256:696582a3391ce05a62edb4140e6a99f774351f363f5b5d7f1581f3a244430249: 3
                       cilium-operator    quay.io/cilium/operator-generic:v1.19.0@sha256:5b04006015e5800307dc6314676edc4c0bb7ac2fc7848be2b94b43bb030ab648: 1
Errors:                cilium             cilium          2 pods of DaemonSet cilium are not ready
                       cilium             cilium          daemonset cilium is rolling out - 2 out of 3 pods updated
                       cilium-envoy       cilium-envoy    2 pods of DaemonSet cilium-envoy are not ready
Warnings:              cilium             cilium-4pldk    pod is pending
                       cilium             cilium-vwbvc    pod is pending
```

```
$ kubectl logs -n kube-system -l app.kubernetes.io/name=cilium-agent --all-containers
Error from server (BadRequest): container "cilium-agent" in pod "cilium-rdgh8" is waiting to start: PodInitializing

$ kubectl describe pod -n kube-system cilium-rdgh8
Name:                 cilium-rdgh8
Namespace:            kube-system
Priority:             2000001000
Priority Class Name:  system-node-critical
Service Account:      cilium
Node:                 kind-worker2/172.19.0.4
Start Time:           Mon, 23 Feb 2026 14:43:41 +0100
Labels:               app.kubernetes.io/name=cilium-agent
                      app.kubernetes.io/part-of=cilium
                      controller-revision-hash=64fbc56c6b
                      k8s-app=cilium
                      pod-template-generation=2
Annotations:          kubectl.kubernetes.io/default-container: cilium-agent
Status:               Pending
SeccompProfile:       Unconfined
IP:                   172.19.0.4
IPs:
  IP:           172.19.0.4
Controlled By:  DaemonSet/cilium
Init Containers:
  config:
    Container ID:  containerd://cb2c5795e717de8760d07051571017ff51fef8f1da6432964c9e9e789d6d1956
    Image:         quay.io/cilium/cilium:v1.19.0@sha256:be9f8571c2e114b3e12e41f785f2356ade703b2eac936aa878805565f0468c60
    Image ID:      quay.io/cilium/cilium@sha256:be9f8571c2e114b3e12e41f785f2356ade703b2eac936aa878805565f0468c60
    Port:          <none>
    Host Port:     <none>
    Command:
      cilium-dbg
      build-config
    State:       Running
      Started:   Mon, 23 Feb 2026 14:45:15 +0100
    Last State:  Terminated
      Reason:    Error
      Message:   time=2026-02-23T13:44:09.56899417Z level=info msg=Running subsys=cilium-dbg
time=2026-02-23T13:44:09.571557711Z level=info msg="Starting hive" subsys=cilium-dbg
time=2026-02-23T13:44:09.571634336Z level=info msg="Establishing connection to apiserver" subsys=cilium-dbg module=k8s-client ipAddr=https://10.96.0.1:443
time=2026-02-23T13:44:44.575249589Z level=info msg="Establishing connection to apiserver" subsys=cilium-dbg module=k8s-client ipAddr=https://10.96.0.1:443
time=2026-02-23T13:45:14.595668547Z level=error msg="Unable to contact k8s api-server" subsys=cilium-dbg module=k8s-client ipAddr=https://10.96.0.1:443 error="Get \"https://10.96.0.1:443/api/v1/namespaces/kube-system\": dial tcp 10.96.0.1:443: i/o timeout"
time=2026-02-23T13:45:14.595875505Z level=error msg="Start hook failed" subsys=cilium-dbg function="client.(*compositeClientset).onStart (k8s-client)" error="Get \"https://10.96.0.1:443/api/v1/namespaces/kube-system\": dial tcp 10.96.0.1:443: i/o timeout"
time=2026-02-23T13:45:14.595916255Z level=error msg="Failed to start hive" subsys=cilium-dbg error="Get \"https://10.96.0.1:443/api/v1/namespaces/kube-system\": dial tcp 10.96.0.1:443: i/o timeout" duration=1m5.024321071s
time=2026-02-23T13:45:14.59601338Z level=info msg="Stopping hive" subsys=cilium-dbg
time=2026-02-23T13:45:14.596158964Z level=info msg="Stopped hive" subsys=cilium-dbg duration=115.208µs
Error: Build config failed: failed to start: Get "https://10.96.0.1:443/api/v1/namespaces/kube-system": dial tcp 10.96.0.1:443: i/o timeout


      Exit Code:    1
      Started:      Mon, 23 Feb 2026 14:44:09 +0100
      Finished:     Mon, 23 Feb 2026 14:45:14 +0100
    Ready:          False
    Restart Count:  1
    Environment:
      K8S_NODE_NAME:          (v1:spec.nodeName)
      CILIUM_K8S_NAMESPACE:  kube-system (v1:metadata.namespace)
    Mounts:
      /tmp from tmp (rw)
      /var/run/secrets/kubernetes.io/serviceaccount from kube-api-access-nvcwz (ro)
  mount-cgroup:
    Container ID:
    Image:         quay.io/cilium/cilium:v1.19.0@sha256:be9f8571c2e114b3e12e41f785f2356ade703b2eac936aa878805565f0468c60
    Image ID:
    Port:          <none>
    Host Port:     <none>
    Command:
      sh
      -ec
      cp /usr/bin/cilium-mount /hostbin/cilium-mount;
      nsenter --cgroup=/hostproc/1/ns/cgroup --mount=/hostproc/1/ns/mnt "${BIN_PATH}/cilium-mount" $CGROUP_ROOT;
      rm /hostbin/cilium-mount

    State:          Waiting
      Reason:       PodInitializing
    Ready:          False
    Restart Count:  0
    Environment:
      CGROUP_ROOT:  /run/cilium/cgroupv2
      BIN_PATH:     /opt/cni/bin
    Mounts:
      /hostbin from cni-path (rw)
      /hostproc from hostproc (rw)
      /var/run/secrets/kubernetes.io/serviceaccount from kube-api-access-nvcwz (ro)
  apply-sysctl-overwrites:
    Container ID:
    Image:         quay.io/cilium/cilium:v1.19.0@sha256:be9f8571c2e114b3e12e41f785f2356ade703b2eac936aa878805565f0468c60
    Image ID:
    Port:          <none>
    Host Port:     <none>
    Command:
      sh
      -ec
      cp /usr/bin/cilium-sysctlfix /hostbin/cilium-sysctlfix;
      nsenter --mount=/hostproc/1/ns/mnt "${BIN_PATH}/cilium-sysctlfix";
      rm /hostbin/cilium-sysctlfix

    State:          Waiting
      Reason:       PodInitializing
    Ready:          False
    Restart Count:  0
    Environment:
      BIN_PATH:  /opt/cni/bin
    Mounts:
      /hostbin from cni-path (rw)
      /hostproc from hostproc (rw)
      /var/run/secrets/kubernetes.io/serviceaccount from kube-api-access-nvcwz (ro)
  mount-bpf-fs:
    Container ID:
    Image:         quay.io/cilium/cilium:v1.19.0@sha256:be9f8571c2e114b3e12e41f785f2356ade703b2eac936aa878805565f0468c60
    Image ID:
    Port:          <none>
    Host Port:     <none>
    Command:
      /bin/bash
      -c
      --
    Args:
      mount | grep "/sys/fs/bpf type bpf" || mount -t bpf bpf /sys/fs/bpf
    State:          Waiting
      Reason:       PodInitializing
    Ready:          False
    Restart Count:  0
    Environment:    <none>
    Mounts:
      /sys/fs/bpf from bpf-maps (rw)
      /var/run/secrets/kubernetes.io/serviceaccount from kube-api-access-nvcwz (ro)
  clean-cilium-state:
    Container ID:
    Image:         quay.io/cilium/cilium:v1.19.0@sha256:be9f8571c2e114b3e12e41f785f2356ade703b2eac936aa878805565f0468c60
    Image ID:
    Port:          <none>
    Host Port:     <none>
    Command:
      /init-container.sh
    State:          Waiting
      Reason:       PodInitializing
    Ready:          False
    Restart Count:  0
    Environment:
      CILIUM_ALL_STATE:           <set to the key 'clean-cilium-state' of config map 'cilium-config'>         Optional: true
      CILIUM_BPF_STATE:           <set to the key 'clean-cilium-bpf-state' of config map 'cilium-config'>     Optional: true
      WRITE_CNI_CONF_WHEN_READY:  <set to the key 'write-cni-conf-when-ready' of config map 'cilium-config'>  Optional: true
    Mounts:
      /run/cilium/cgroupv2 from cilium-cgroup (rw)
      /sys/fs/bpf from bpf-maps (rw)
      /var/run/cilium from cilium-run (rw)
      /var/run/secrets/kubernetes.io/serviceaccount from kube-api-access-nvcwz (ro)
  install-cni-binaries:
    Container ID:
    Image:         quay.io/cilium/cilium:v1.19.0@sha256:be9f8571c2e114b3e12e41f785f2356ade703b2eac936aa878805565f0468c60
    Image ID:
    Port:          <none>
    Host Port:     <none>
    Command:
      /install-plugin.sh
    State:          Waiting
      Reason:       PodInitializing
    Ready:          False
    Restart Count:  0
    Limits:
      cpu:     1
      memory:  1Gi
    Requests:
      cpu:        100m
      memory:     10Mi
    Environment:  <none>
    Mounts:
      /host/opt/cni/bin from cni-path (rw)
      /var/run/secrets/kubernetes.io/serviceaccount from kube-api-access-nvcwz (ro)
Containers:
  cilium-agent:
    Container ID:
    Image:         quay.io/cilium/cilium:v1.19.0@sha256:be9f8571c2e114b3e12e41f785f2356ade703b2eac936aa878805565f0468c60
    Image ID:
    Ports:         9879/TCP (health), 4244/TCP (peer-service)
    Host Ports:    9879/TCP (health), 4244/TCP (peer-service)
    Command:
      cilium-agent
    Args:
      --config-dir=/tmp/cilium/config-map
    State:          Waiting
      Reason:       PodInitializing
    Ready:          False
    Restart Count:  0
    Liveness:       http-get http://127.0.0.1:health/healthz delay=0s timeout=5s period=30s #success=1 #failure=10
    Readiness:      http-get http://127.0.0.1:health/healthz delay=0s timeout=5s period=30s #success=1 #failure=3
    Startup:        http-get http://127.0.0.1:health/healthz delay=5s timeout=1s period=2s #success=1 #failure=300
    Environment:
      K8S_NODE_NAME:                  (v1:spec.nodeName)
      CILIUM_K8S_NAMESPACE:          kube-system (v1:metadata.namespace)
      CILIUM_CLUSTERMESH_CONFIG:     /var/lib/cilium/clustermesh/
      GOMEMLIMIT:                    node allocatable (limits.memory)
      KUBE_CLIENT_BACKOFF_BASE:      1
      KUBE_CLIENT_BACKOFF_DURATION:  120
    Mounts:
      /host/etc/cni/net.d from etc-cni-netd (rw)
      /host/proc/sys/kernel from host-proc-sys-kernel (rw)
      /host/proc/sys/net from host-proc-sys-net (rw)
      /lib/modules from lib-modules (ro)
      /run/xtables.lock from xtables-lock (rw)
      /sys/fs/bpf from bpf-maps (rw)
      /tmp from tmp (rw)
      /var/lib/cilium/clustermesh from clustermesh-secrets (ro)
      /var/lib/cilium/tls/hubble from hubble-tls (ro)
      /var/run/cilium from cilium-run (rw)
      /var/run/cilium/envoy/sockets from envoy-sockets (rw)
      /var/run/cilium/netns from cilium-netns (rw)
      /var/run/secrets/kubernetes.io/serviceaccount from kube-api-access-nvcwz (ro)
Conditions:
  Type                        Status
  PodReadyToStartContainers   True
  Initialized                 False
  Ready                       False
  ContainersReady             False
  PodScheduled                True
Volumes:
  tmp:
    Type:       EmptyDir (a temporary directory that shares a pod's lifetime)
    Medium:
    SizeLimit:  <unset>
  cilium-run:
    Type:          HostPath (bare host directory volume)
    Path:          /var/run/cilium
    HostPathType:  DirectoryOrCreate
  cilium-netns:
    Type:          HostPath (bare host directory volume)
    Path:          /var/run/netns
    HostPathType:  DirectoryOrCreate
  bpf-maps:
    Type:          HostPath (bare host directory volume)
    Path:          /sys/fs/bpf
    HostPathType:  DirectoryOrCreate
  hostproc:
    Type:          HostPath (bare host directory volume)
    Path:          /proc
    HostPathType:  Directory
  cilium-cgroup:
    Type:          HostPath (bare host directory volume)
    Path:          /run/cilium/cgroupv2
    HostPathType:  DirectoryOrCreate
  cni-path:
    Type:          HostPath (bare host directory volume)
    Path:          /opt/cni/bin
    HostPathType:  DirectoryOrCreate
  etc-cni-netd:
    Type:          HostPath (bare host directory volume)
    Path:          /etc/cni/net.d
    HostPathType:  DirectoryOrCreate
  lib-modules:
    Type:          HostPath (bare host directory volume)
    Path:          /lib/modules
    HostPathType:
  xtables-lock:
    Type:          HostPath (bare host directory volume)
    Path:          /run/xtables.lock
    HostPathType:  FileOrCreate
  envoy-sockets:
    Type:          HostPath (bare host directory volume)
    Path:          /var/run/cilium/envoy/sockets
    HostPathType:  DirectoryOrCreate
  clustermesh-secrets:
    Type:        Projected (a volume that contains injected data from multiple sources)
    SecretName:  cilium-clustermesh
    Optional:    true
    SecretName:  clustermesh-apiserver-remote-cert
    Optional:    true
    SecretName:  clustermesh-apiserver-local-cert
    Optional:    true
  host-proc-sys-net:
    Type:          HostPath (bare host directory volume)
    Path:          /proc/sys/net
    HostPathType:  Directory
  host-proc-sys-kernel:
    Type:          HostPath (bare host directory volume)
    Path:          /proc/sys/kernel
    HostPathType:  Directory
  hubble-tls:
    Type:        Projected (a volume that contains injected data from multiple sources)
    SecretName:  hubble-server-certs
    Optional:    true
  kube-api-access-nvcwz:
    Type:                    Projected (a volume that contains injected data from multiple sources)
    TokenExpirationSeconds:  3607
    ConfigMapName:           kube-root-ca.crt
    Optional:                false
    DownwardAPI:             true
QoS Class:                   Burstable
Node-Selectors:              kubernetes.io/os=linux
Tolerations:                 op=Exists
                             node.kubernetes.io/disk-pressure:NoSchedule op=Exists
                             node.kubernetes.io/memory-pressure:NoSchedule op=Exists
                             node.kubernetes.io/network-unavailable:NoSchedule op=Exists
                             node.kubernetes.io/not-ready:NoExecute op=Exists
                             node.kubernetes.io/pid-pressure:NoSchedule op=Exists
                             node.kubernetes.io/unreachable:NoExecute op=Exists
                             node.kubernetes.io/unschedulable:NoSchedule op=Exists
Events:
  Type    Reason     Age                 From               Message
  ----    ------     ----                ----               -------
  Normal  Scheduled  2m35s               default-scheduler  Successfully assigned kube-system/cilium-rdgh8 to kind-worker2
  Normal  Pulling    2m35s               kubelet            Pulling image "quay.io/cilium/cilium:v1.19.0@sha256:be9f8571c2e114b3e12e41f785f2356ade703b2eac936aa878805565f0468c60"
  Normal  Pulled     2m7s                kubelet            Successfully pulled image "quay.io/cilium/cilium:v1.19.0@sha256:be9f8571c2e114b3e12e41f785f2356ade703b2eac936aa878805565f0468c60" in 16.586s (27.685s including waiting). Image size: 241633352 bytes.
  Normal  Created    61s (x2 over 2m7s)  kubelet            Container created
  Normal  Started    61s (x2 over 2m7s)  kubelet            Container started
  Normal  Pulled     61s                 kubelet            Container image "quay.io/cilium/cilium:v1.19.0@sha256:be9f8571c2e114b3e12e41f785f2356ade703b2eac936aa878805565f0468c60" already present on machine and can be accessed by the pod

$ kubectl logs -n kube-system cilium-rdgh8 -c config
time=2026-02-23T13:46:31.223409847Z level=info msg=Running subsys=cilium-dbg
time=2026-02-23T13:46:31.224562472Z level=info msg="Starting hive" subsys=cilium-dbg
time=2026-02-23T13:46:31.224610888Z level=info msg="Establishing connection to apiserver" subsys=cilium-dbg module=k8s-client ipAddr=https://10.96.0.1:443
time=2026-02-23T13:47:06.246802376Z level=info msg="Establishing connection to apiserver" subsys=cilium-dbg module=k8s-client ipAddr=https://10.96.0.1:443
time=2026-02-23T13:47:36.27490646Z level=error msg="Unable to contact k8s api-server" subsys=cilium-dbg module=k8s-client ipAddr=https://10.96.0.1:443 error="Get \"https://10.96.0.1:443/api/v1/namespaces/kube-system\": dial tcp 10.96.0.1:443: i/o timeout"
time=2026-02-23T13:47:36.275015085Z level=error msg="Start hook failed" subsys=cilium-dbg function="client.(*compositeClientset).onStart (k8s-client)" error="Get \"https://10.96.0.1:443/api/v1/namespaces/kube-system\": dial tcp 10.96.0.1:443: i/o timeout"
time=2026-02-23T13:47:36.27503546Z level=error msg="Failed to start hive" subsys=cilium-dbg error="Get \"https://10.96.0.1:443/api/v1/namespaces/kube-system\": dial tcp 10.96.0.1:443: i/o timeout" duration=1m5.050423945s
time=2026-02-23T13:47:36.275093626Z level=info msg="Stopping hive" subsys=cilium-dbg
time=2026-02-23T13:47:36.275194001Z level=info msg="Stopped hive" subsys=cilium-dbg duration=82.333µs
Error: Build config failed: failed to start: Get "https://10.96.0.1:443/api/v1/namespaces/kube-system": dial tcp 10.96.0.1:443: i/o timeout

**Comment by aanm** [comment]
With those steps I can reproduce it and I can confirm your bug. Only when doing upgrade from v1.18.7 to v1.19.1. When installing v1.19.1 from scratch the issue does not occur.

**Comment by aanm** [comment]
It also looks that ipvs is marked for deprecation in kube-proxy https://github.com/kubernetes/enhancements/issues/5495

**Comment by jammerful** [comment]
I'm also seeing this issue.

**Comment by jmeza-xyz** [comment]
Am able to replicate this issue and believe it is caused by the firewall bypass configuration in PR https://github.com/cilium/cilium/pull/40346. Since the `enable-k8s-host-firewall-bypass` is set to true by default I believe it attempts to communicate with the kube-api outside of ipvs and timeouts since the host doesn't know how to route to the kube-api ip.

The workaround is to either disable the `enable-k8s-host-firewall-bypass` configuration before upgrade or after upgrade via extraConfig or extraEnv respectably. The other option is to set helm values `k8sServiceHost` and `k8sServicePort` to force Cilium to use those values to communicate with the kube-api directly.

These are the minimum settings used during testing:
kube-proxy args:
```hcl
kube-proxy-arg          = [
        "proxy-mode=ipvs",
        "ipvs-scheduler=lc",
        "ipvs-strict-arp=true"
      ]
```
Cilium values.yaml:
```yaml
bpf:
  hostLegacyRouting: true
encryption:
  enabled: true
  nodeEncryption: true
  type: wireguard
routingMode: "tunnel"
tunnelProtocol: "vxlan"
# Option 1 before rke2 upgrade
    extraConfig:
      enable-k8s-host-firewall-bypass: "false"
# Option 1 after rke2 upgrade
    extraEnv:
      - name: "CILIUM_ENABLE_K8S_HOST_FIREWALL_BYPASS"
        value: "false"
# Option 2
    k8sServiceHost: "127.0.0.1"
    k8sServicePort: "6443"
```
Since I'm on rke2, an example rke2 helm chart config below.
```yaml
---
apiVersion: helm.cattle.io/v1
kind: HelmChartConfig
metadata:
  name: rke2-cilium
  namespace: kube-system
spec:
  valuesContent: |-
    bpf:
      hostLegacyRouting: true
    encryption:
      enabled: true
      nodeEncryption: true
      type: wireguard
    routingMode: "tunnel"
    tunnelProtocol: "vxlan"
# Option 1 before rke2 upgrade
    extraConfig:
      enable-k8s-host-firewall-bypass: "false"
# Option 1 after rke2 upgrade
    extraEnv:
      - name: "CILIUM_ENABLE_K8S_HOST_FIREWALL_BYPASS"
        value: "false"
# Option 2
    k8sServiceHost: "127.0.0.1"
    k8sServicePort: "6443"
```
If the helm controller in rke2 fails to apply the helm chart config due to the cluster being broken, edit the cilium daemon set and add the Env values manually to the cilium-agent container.

**Comment by 41ks** [comment]
We are seeing a similar issue when upgrading our clusters using the `veth` datapath mode from v1.18.6 to v1.19.1 and running `cilium build-config`. 

Failing run
```
# cilium build-config "--source=config-map:cluster-cni/cilium-config,cilium-node-config:cluster-cni" --dest=/etc/cilium-agent-config/node-overrides --debug
time=2026-03-18T13:46:32.574326934Z level=info source=/go/src/github.com/cilium/cilium/cilium-dbg/cmd/build-config.go:42 msg=Running subsys=cilium-dbg
time=2026-03-18T13:46:32.574506827Z level=debug source=/go/src/github.com/cilium/cilium/vendor/github.com/cilium/hive/cell/invoke.go:38 msg=Invoking subsys=cilium-dbg function="client.registerMappingsUpdater (.../k8s/client/rest_config_provider.go:434)"
time=2026-03-18T13:46:32.575389848Z level=debug source=/go/src/github.com/cilium/cilium/vendor/github.com/cilium/hive/cell/invoke.go:59 msg=Invoked subsys=cilium-dbg duration=866.323µs function="client.registerMappingsUpdater (.../k8s/client/rest_config_provider.go:434)"
time=2026-03-18T13:46:32.575412904Z level=debug source=/go/src/github.com/cilium/cilium/vendor/github.com/cilium/hive/cell/invoke.go:38 msg=Invoking subsys=cilium-dbg function="cmd.init.func12 (cmd/build-config.go:34)"
time=2026-03-18T13:46:32.575534429Z level=debug source=/go/src/github.com/cilium/cilium/vendor/github.com/cilium/hive/cell/invoke.go:59 msg=Invoked subsys=cilium-dbg duration=105.034µs function="cmd.init.func12 (cmd/build-config.go:34)"
time=2026-03-18T13:46:32.575551211Z level=debug source=/go/src/github.com/cilium/cilium/vendor/github.com/cilium/hive/cell/invoke.go:38 msg=Invoking subsys=cilium-dbg function="health.metricPublisher (.../hive/health/metrics.go:59)"
time=2026-03-18T13:46:32.575674011Z level=debug source=/go/src/github.com/cilium/cilium/vendor/github.com/cilium/hive/cell/invoke.go:59 msg=Invoked subsys=cilium-dbg duration=113.736µs function="health.metricPublisher (.../hive/health/metrics.go:59)"
time=2026-03-18T13:46:32.575699449Z level=info source=/go/src/github.com/cilium/cilium/vendor/github.com/cilium/hive/hive.go:385 msg="Starting hive" subsys=cilium-dbg
time=2026-03-18T13:46:32.575724944Z level=debug source=/go/src/github.com/cilium/cilium/vendor/github.com/cilium/hive/cell/lifecycle.go:139 msg="Executing start hook" subsys=cilium-dbg function="statedb.newHiveDB.func1 (.../cilium/statedb/cell.go:34) (statedb)"
time=2026-03-18T13:46:32.575748545Z level=debug source=/go/src/github.com/cilium/cilium/vendor/github.com/cilium/hive/cell/lifecycle.go:149 msg="Start hook executed" subsys=cilium-dbg function="statedb.newHiveDB.func1 (.../cilium/statedb/cell.go:34) (statedb)" duration=11.216µs
time=2026-03-18T13:46:32.575762733Z level=debug source=/go/src/github.com/cilium/cilium/vendor/github.com/cilium/hive/cell/lifecycle.go:139 msg="Executing start hook" subsys=cilium-dbg function="*health.provider.Start (health)"
time=2026-03-18T13:46:32.575770644Z level=debug source=/go/src/github.com/cilium/cilium/vendor/github.com/cilium/hive/cell/lifecycle.go:149 msg="Start hook executed" subsys=cilium-dbg function="*health.provider.Start (health)" duration=208ns
time=2026-03-18T13:46:32.575781066Z level=debug source=/go/src/github.com/cilium/cilium/vendor/github.com/cilium/hive/cell/lifecycle.go:139 msg="Executing start hook" subsys=cilium-dbg function="*job.groupHooks.Start (k8s-client)"
time=2026-03-18T13:46:32.575788182Z level=debug source=/go/src/github.com/cilium/cilium/vendor/github.com/cilium/hive/cell/lifecycle.go:149 msg="Start hook executed" subsys=cilium-dbg function="*job.groupHooks.Start (k8s-client)" duration=436ns
time=2026-03-18T13:46:32.575798762Z level=debug source=/go/src/github.com/cilium/cilium/vendor/github.com/cilium/hive/cell/lifecycle.go:139 msg="Executing start hook" subsys=cilium-dbg function="client.(*compositeClientset).onStart (k8s-client)"
time=2026-03-18T13:46:32.575824021Z level=info source=/go/src/github.com/cilium/cilium/pkg/k8s/client/cell.go:315 msg="Establishing connection to apiserver" subsys=cilium-dbg module=k8s-client ipAddr=https://172.17.0.1:443
time=2026-03-18T13:46:37.576259413Z level=info source=/go/src/github.com/cilium/cilium/pkg/k8s/client/cell.go:315 msg="Establishing connection to apiserver" subsys=cilium-dbg module=k8s-client ipAddr=https://172.17.0.1:443
time=2026-03-18T13:46:42.580149255Z level=info source=/go/src/github.com/cilium/cilium/pkg/k8s/client/cell.go:315 msg="Establishing connection to apiserver" subsys=cilium-dbg module=k8s-client ipAddr=https://172.17.0.1:443
time=2026-03-18T13:46:47.58364081Z level=info source=/go/src/github.com/cilium/cilium/pkg/k8s/client/cell.go:315 msg="Establishing connection to apiserver" subsys=cilium-dbg module=k8s-client ipAddr=https://172.17.0.1:443
time=2026-03-18T13:46:52.587638191Z level=info source=/go/src/github.com/cilium/cilium/pkg/k8s/client/cell.go:315 msg="Establishing connection to apiserver" subsys=cilium-dbg module=k8s-client ipAddr=https://172.17.0.1:443
time=2026-03-18T13:46:57.591427236Z level=info source=/go/src/github.com/cilium/cilium/pkg/k8s/client/cell.go:315 msg="Establishing connection to apiserver" subsys=cilium-dbg module=k8s-client ipAddr=https://172.17.0.1:443
time=2026-03-18T13:47:02.595636958Z level=info source=/go/src/github.com/cilium/cilium/pkg/k8s/client/cell.go:315 msg="Establishing connection to apiserver" subsys=cilium-dbg module=k8s-client ipAddr=https://172.17.0.1:443
time=2026-03-18T13:47:07.598541846Z level=info source=/go/src/github.com/cilium/cilium/pkg/k8s/client/cell.go:315 msg="Establishing connection to apiserver" subsys=cilium-dbg module=k8s-client ipAddr=https://172.17.0.1:443
time=2026-03-18T13:47:12.602444333Z level=info source=/go/src/github.com/cilium/cilium/pkg/k8s/client/cell.go:315 msg="Establishing connection to apiserver" subsys=cilium-dbg module=k8s-client ipAddr=https://172.17.0.1:443
time=2026-03-18T13:47:17.603223312Z level=info source=/go/src/github.com/cilium/cilium/pkg/k8s/client/cell.go:315 msg="Establishing connection to apiserver" subsys=cilium-dbg module=k8s-client ipAddr=https://172.17.0.1:443
time=2026-03-18T13:47:22.603935066Z level=info source=/go/src/github.com/cilium/cilium/pkg/k8s/client/cell.go:315 msg="Establishing connection to apiserver" subsys=cilium-dbg module=k8s-client ipAddr=https://172.17.0.1:443
time=2026-03-18T13:47:27.608339525Z level=info source=/go/src/github.com/cilium/cilium/pkg/k8s/client/cell.go:315 msg="Establishing connection to apiserver" subsys=cilium-dbg module=k8s-client ipAddr=https://172.17.0.1:443
time=2026-03-18T13:47:32.611392219Z level=info source=/go/src/github.com/cilium/cilium/pkg/k8s/client/cell.go:315 msg="Establishing connection to apiserver" subsys=cilium-dbg module=k8s-client ipAddr=https://172.17.0.1:443
time=2026-03-18T13:47:32.611834849Z level=error source=/go/src/github.com/cilium/cilium/pkg/k8s/client/cell.go:335 msg="Unable to contact k8s api-server" subsys=cilium-dbg module=k8s-client ipAddr=https://172.17.0.1:443 error="Get \"https://172.17.0.1:443/api/v1/namespaces/kube-system\": dial tcp 172.17.0.1:443: operation not permitted"
time=2026-03-18T13:47:32.61189062Z level=error source=/go/src/github.com/cilium/cilium/vendor/github.com/cilium/hive/cell/lifecycle.go:142 msg="Start hook failed" subsys=cilium-dbg function="client.(*compositeClientset).onStart (k8s-client)" error="Get \"https://172.17.0.1:443/api/v1/namespaces/kube-system\": dial tcp 172.17.0.1:443: operation not permitted"
time=2026-03-18T13:47:32.611913204Z level=error source=/go/src/github.com/cilium/cilium/vendor/github.com/cilium/hive/hive.go:391 msg="Failed to start hive" subsys=cilium-dbg error="Get \"https://172.17.0.1:443/api/v1/namespaces/kube-system\": dial tcp 172.17.0.1:443: operation not permitted" duration=1m0.036203369s
time=2026-03-18T13:47:32.611944648Z level=info source=/go/src/github.com/cilium/cilium/vendor/github.com/cilium/hive/hive.go:401 msg="Stopping hive" subsys=cilium-dbg
time=2026-03-18T13:47:32.611990075Z level=debug source=/go/src/github.com/cilium/cilium/vendor/github.com/cilium/hive/cell/lifecycle.go:184 msg="Executing stop hook" subsys=cilium-dbg function="*job.groupHooks.Stop (k8s-client)"
time=2026-03-18T13:47:32.612015489Z level=debug source=/go/src/github.com/cilium/cilium/vendor/github.com/cilium/hive/cell/lifecycle.go:194 msg="Stop hook executed" subsys=cilium-dbg function="*job.groupHooks.Stop (k8s-client)" duration=11.299µs
time=2026-03-18T13:47:32.612031632Z level=debug source=/go/src/github.com/cilium/cilium/vendor/github.com/cilium/hive/cell/lifecycle.go:184 msg="Executing stop hook" subsys=cilium-dbg function="*health.provider.Stop (health)"
time=2026-03-18T13:47:32.612041792Z level=debug source=/go/src/github.com/cilium/cilium/vendor/github.com/cilium/hive/cell/lifecycle.go:194 msg="Stop hook executed" subsys=cilium-dbg function="*health.provider.Stop (health)" duration=398ns
time=2026-03-18T13:47:32.612061343Z level=debug source=/go/src/github.com/cilium/cilium/vendor/github.com/cilium/hive/cell/lifecycle.go:184 msg="Executing stop hook" subsys=cilium-dbg function="statedb.newHiveDB.func2 (.../cilium/statedb/cell.go:37) (statedb)"
time=2026-03-18T13:47:32.612080737Z level=debug source=/go/src/github.com/cilium/cilium/vendor/github.com/cilium/hive/cell/lifecycle.go:194 msg="Stop hook executed" subsys=cilium-dbg function="statedb.newHiveDB.func2 (.../cilium/statedb/cell.go:37) (statedb)" duration=8.189µs
time=2026-03-18T13:47:32.612118608Z level=info source=/go/src/github.com/cilium/cilium/vendor/github.com/cilium/hive/hive.go:405 msg="Stopped hive" subsys=cilium-dbg duration=139.085µs
Error: Build config failed: failed to start: Get "https://172.17.0.1:443/api/v1/namespaces/kube-system": dial tcp 172.17.0.1:443: operation not permitted
```

I can confirm that setting `enable-k8s-host-firewall-bypass` to `false` solved the problem. Though this was not obvious and required a deep dive into 1.18 > 1.19 changes to find
```
# cilium build-config "--source=config-map:cluster-cni/cilium-config,cilium-node-config:cluster-cni" --dest=/etc/cilium-agent-config/node-overrides --debug --enable-k8s-host-firewall-bypass=false
time=2026-03-18T13:50:03.467453882Z level=info source=/go/src/github.com/cilium/cilium/cilium-dbg/cmd/build-config.go:42 msg=Running subsys=cilium-dbg
time=2026-03-18T13:50:03.467784688Z level=debug source=/go/src/github.com/cilium/cilium/vendor/github.com/cilium/hive/cell/invoke.go:38 msg=Invoking subsys=cilium-dbg function="client.registerMappingsUpdater (.../k8s/client/rest_config_provider.go:434)"
time=2026-03-18T13:50:03.46965165Z level=debug source=/go/src/github.com/cilium/cilium/vendor/github.com/cilium/hive/cell/invoke.go:59 msg=Invoked subsys=cilium-dbg duration=1.802948ms function="client.registerMappingsUpdater (.../k8s/client/rest_config_provider.go:434)"
time=2026-03-18T13:50:03.469676718Z level=debug source=/go/src/github.com/cilium/cilium/vendor/github.com/cilium/hive/cell/invoke.go:38 msg=Invoking subsys=cilium-dbg function="cmd.init.func12 (cmd/build-config.go:34)"
time=2026-03-18T13:50:03.469809665Z level=debug source=/go/src/github.com/cilium/cilium/vendor/github.com/cilium/hive/cell/invoke.go:59 msg=Invoked subsys=cilium-dbg duration=117.599µs function="cmd.init.func12 (cmd/build-config.go:34)"
time=2026-03-18T13:50:03.469827278Z level=debug source=/go/src/github.com/cilium/cilium/vendor/github.com/cilium/hive/cell/invoke.go:38 msg=Invoking subsys=cilium-dbg function="health.metricPublisher (.../hive/health/metrics.go:59)"
time=2026-03-18T13:50:03.469917057Z level=debug source=/go/src/github.com/cilium/cilium/vendor/github.com/cilium/hive/cell/invoke.go:59 msg=Invoked subsys=cilium-dbg duration=81.291µs function="health.metricPublisher (.../hive/health/metrics.go:59)"
time=2026-03-18T13:50:03.469943507Z level=info source=/go/src/github.com/cilium/cilium/vendor/github.com/cilium/hive/hive.go:385 msg="Starting hive" subsys=cilium-dbg
time=2026-03-18T13:50:03.469975805Z level=debug source=/go/src/github.com/cilium/cilium/vendor/github.com/cilium/hive/cell/lifecycle.go:139 msg="Executing start hook" subsys=cilium-dbg function="statedb.newHiveDB.func1 (.../cilium/statedb/cell.go:34) (statedb)"
time=2026-03-18T13:50:03.469992274Z level=debug source=/go/src/github.com/cilium/cilium/vendor/github.com/cilium/hive/cell/lifecycle.go:149 msg="Start hook executed" subsys=cilium-dbg function="statedb.newHiveDB.func1 (.../cilium/statedb/cell.go:34) (statedb)" duration=5.459µs
time=2026-03-18T13:50:03.470001986Z level=debug source=/go/src/github.com/cilium/cilium/vendor/github.com/cilium/hive/cell/lifecycle.go:139 msg="Executing start hook" subsys=cilium-dbg function="*health.provider.Start (health)"
time=2026-03-18T13:50:03.470009325Z level=debug source=/go/src/github.com/cilium/cilium/vendor/github.com/cilium/hive/cell/lifecycle.go:149 msg="Start hook executed" subsys=cilium-dbg function="*health.provider.Start (health)" duration=169ns
time=2026-03-18T13:50:03.47002112Z level=debug source=/go/src/github.com/cilium/cilium/vendor/github.com/cilium/hive/cell/lifecycle.go:139 msg="Executing start hook" subsys=cilium-dbg function="*job.groupHooks.Start (k8s-client)"
time=2026-03-18T13:50:03.470033217Z level=debug source=/go/src/github.com/cilium/cilium/vendor/github.com/cilium/hive/cell/lifecycle.go:149 msg="Start hook executed" subsys=cilium-dbg function="*job.groupHooks.Start (k8s-client)" duration=470ns
time=2026-03-18T13:50:03.470046048Z level=debug source=/go/src/github.com/cilium/cilium/vendor/github.com/cilium/hive/cell/lifecycle.go:139 msg="Executing start hook" subsys=cilium-dbg function="client.(*compositeClientset).onStart (k8s-client)"
time=2026-03-18T13:50:03.470063311Z level=info source=/go/src/github.com/cilium/cilium/pkg/k8s/client/cell.go:315 msg="Establishing connection to apiserver" subsys=cilium-dbg module=k8s-client ipAddr=https://172.17.0.1:443
time=2026-03-18T13:50:03.537656201Z level=info source=/go/src/github.com/cilium/cilium/pkg/k8s/client/cell.go:342 msg="Connected to apiserver" subsys=cilium-dbg module=k8s-client
time=2026-03-18T13:50:03.537690473Z level=debug source=/go/src/github.com/cilium/cilium/pkg/controller/manager.go:123 msg="Starting new controller" subsys=controller name=k8s-heartbeat uuid=adaea2ff-29a7-44dc-8224-6c576576f64a
time=2026-03-18T13:50:03.537820741Z level=debug source=/go/src/github.com/cilium/cilium/pkg/controller/controller.go:338 msg="Controller func executed" subsys=controller name=k8s-heartbeat uuid=adaea2ff-29a7-44dc-8224-6c576576f64a duration=10.868µs
time=2026-03-18T13:50:03.538550905Z level=debug source=/go/src/github.com/cilium/cilium/vendor/github.com/cilium/hive/cell/lifecycle.go:149 msg="Start hook executed" subsys=cilium-dbg function="client.(*compositeClientset).onStart (k8s-client)" duration=68.49593ms
time=2026-03-18T13:50:03.538577607Z level=debug source=/go/src/github.com/cilium/cilium/vendor/github.com/cilium/hive/cell/lifecycle.go:139 msg="Executing start hook" subsys=cilium-dbg function="cmd.(*buildConfig).onStart (build-config)"
time=2026-03-18T13:50:03.538593647Z level=info source=/go/src/github.com/cilium/cilium/pkg/option/resolver/resolver.go:180 msg="Reading configuration from source" subsys=cilium-dbg module=build-config configSource="{Kind:config-map Namespace:cluster-cni Name:cilium-config}"
time=2026-03-18T13:50:03.569651012Z level=info source=/go/src/github.com/cilium/cilium/pkg/option/resolver/resolver.go:76 msg="Got configuration source" subsys=cilium-dbg module=build-config lenConfigPairs=48 configSource="{Kind:config-map Namespace:cluster-cni Name:cilium-config}"
time=2026-03-18T13:50:03.569684862Z level=info source=/go/src/github.com/cilium/cilium/pkg/option/resolver/resolver.go:180 msg="Reading configuration from source" subsys=cilium-dbg module=build-config configSource="{Kind:cilium-node-config Namespace:cluster-cni Name:}"
time=2026-03-18T13:50:03.595646343Z level=info source=/go/src/github.com/cilium/cilium/pkg/logging/klog_bridge.go:175 msg="\"Warning: cilium.io/v2alpha1 CiliumNodeConfig will be deprecated in cilium v1.16; use cilium.io/v2 CiliumNodeConfig\"" subsys=klog
time=2026-03-18T13:50:03.601585254Z level=info source=/go/src/github.com/cilium/cilium/pkg/option/resolver/resolver.go:76 msg="Got configuration source" subsys=cilium-dbg module=build-config lenConfigPairs=0 configSource="{Kind:cilium-node-config Namespace:cluster-cni Name:}"
time=2026-03-18T13:50:03.603473709Z level=debug source=/go/src/github.com/cilium/cilium/vendor/github.com/cilium/hive/cell/lifecycle.go:149 msg="Start hook executed" subsys=cilium-dbg function="cmd.(*buildConfig).onStart (build-config)" duration=64.88545ms
time=2026-03-18T13:50:03.603497741Z level=debug source=/go/src/github.com/cilium/cilium/vendor/github.com/cilium/hive/cell/lifecycle.go:139 msg="Executing start hook" subsys=cilium-dbg function="*job.groupHooks.Start (health)"
time=2026-03-18T13:50:03.603507067Z level=debug source=/go/src/github.com/cilium/cilium/vendor/github.com/cilium/hive/cell/lifecycle.go:149 msg="Start hook executed" subsys=cilium-dbg function="*job.groupHooks.Start (health)" duration=998ns
time=2026-03-18T13:50:03.603525115Z level=debug source=/go/src/github.com/cilium/cilium/vendor/github.com/cilium/hive/cell/lifecycle.go:139 msg="Executing start hook" subsys=cilium-dbg function="*job.queuedJob.Start (health)"
time=2026-03-18T13:50:03.603542935Z level=debug source=/go/src/github.com/cilium/cilium/vendor/github.com/cilium/hive/cell/lifecycle.go:149 msg="Start hook executed" subsys=cilium-dbg function="*job.queuedJob.Start (health)" duration=6.012µs
time=2026-03-18T13:50:03.603556919Z level=info source=/go/src/github.com/cilium/cilium/vendor/github.com/cilium/hive/hive.go:389 msg="Started hive" subsys=cilium-dbg duration=133.600391ms
time=2026-03-18T13:50:03.603702266Z level=debug source=/go/src/github.com/cilium/cilium/vendor/github.com/cilium/hive/job/oneshot.go:134 msg="Starting one-shot job" subsys=cilium-dbg module=health name=module-status-metrics func="health.metricPublisher.func2 (.../hive/health/metrics.go:78)"
time=2026-03-18T13:50:03.603782098Z level=info source=/go/src/github.com/cilium/cilium/vendor/github.com/cilium/hive/hive.go:401 msg="Stopping hive" subsys=cilium-dbg
time=2026-03-18T13:50:03.603808966Z level=debug source=/go/src/github.com/cilium/cilium/vendor/github.com/cilium/hive/cell/lifecycle.go:184 msg="Executing stop hook" subsys=cilium-dbg function="*job.queuedJob.Stop (health)"
time=2026-03-18T13:50:03.603912638Z level=debug source=/go/src/github.com/cilium/cilium/pkg/hive/health/provider.go:89 msg="upserting health status" subsys=cilium-dbg module=health lastLevel=none reporter-id=health.job-module-status-metrics status="health.job-module-status-metrics: [OK] Running"
time=2026-03-18T13:50:03.604058073Z level=debug source=/go/src/github.com/cilium/cilium/pkg/hive/health/provider.go:144 msg="stopping health reporter" subsys=cilium-dbg module=health reporter-id=health.job-module-status-metrics
time=2026-03-18T13:50:03.60408301Z level=debug source=/go/src/github.com/cilium/cilium/vendor/github.com/cilium/hive/cell/lifecycle.go:194 msg="Stop hook executed" subsys=cilium-dbg function="*job.queuedJob.Stop (health)" duration=258.512µs
time=2026-03-18T13:50:03.604098839Z level=debug source=/go/src/github.com/cilium/cilium/vendor/github.com/cilium/hive/cell/lifecycle.go:184 msg="Executing stop hook" subsys=cilium-dbg function="*job.groupHooks.Stop (health)"
time=2026-03-18T13:50:03.604111319Z level=debug source=/go/src/github.com/cilium/cilium/vendor/github.com/cilium/hive/cell/lifecycle.go:194 msg="Stop hook executed" subsys=cilium-dbg function="*job.groupHooks.Stop (health)" duration=3.727µs
time=2026-03-18T13:50:03.604131174Z level=debug source=/go/src/github.com/cilium/cilium/vendor/github.com/cilium/hive/cell/lifecycle.go:184 msg="Executing stop hook" subsys=cilium-dbg function="client.(*compositeClientset).onStop (k8s-client)"
time=2026-03-18T13:50:03.60414267Z level=debug source=/go/src/github.com/cilium/cilium/pkg/controller/manager.go:162 msg="Removed controller" subsys=controller name=k8s-heartbeat uuid=adaea2ff-29a7-44dc-8224-6c576576f64a
time=2026-03-18T13:50:03.604158364Z level=debug source=/go/src/github.com/cilium/cilium/pkg/controller/controller.go:428 msg="Shutting down controller" subsys=controller name=k8s-heartbeat uuid=adaea2ff-29a7-44dc-8224-6c576576f64a
time=2026-03-18T13:50:03.604170291Z level=debug source=/go/src/github.com/cilium/cilium/vendor/github.com/cilium/hive/cell/lifecycle.go:194 msg="Stop hook executed" subsys=cilium-dbg function="client.(*compositeClientset).onStop (k8s-client)" duration=31.365µs
time=2026-03-18T13:50:03.604181501Z level=debug source=/go/src/github.com/cilium/cilium/vendor/github.com/cilium/hive/cell/lifecycle.go:184 msg="Executing stop hook" subsys=cilium-dbg function="*job.groupHooks.Stop (k8s-client)"
time=2026-03-18T13:50:03.60419249Z level=debug source=/go/src/github.com/cilium/cilium/vendor/github.com/cilium/hive/cell/lifecycle.go:194 msg="Stop hook executed" subsys=cilium-dbg function="*job.groupHooks.Stop (k8s-client)" duration=2.334µs
time=2026-03-18T13:50:03.604204847Z level=debug source=/go/src/github.com/cilium/cilium/vendor/github.com/cilium/hive/cell/lifecycle.go:184 msg="Executing stop hook" subsys=cilium-dbg function="*health.provider.Stop (health)"
time=2026-03-18T13:50:03.604216315Z level=debug source=/go/src/github.com/cilium/cilium/vendor/github.com/cilium/hive/cell/lifecycle.go:194 msg="Stop hook executed" subsys=cilium-dbg function="*health.provider.Stop (health)" duration=202ns
time=2026-03-18T13:50:03.604232414Z level=debug source=/go/src/github.com/cilium/cilium/vendor/github.com/cilium/hive/cell/lifecycle.go:184 msg="Executing stop hook" subsys=cilium-dbg function="statedb.newHiveDB.func2 (.../cilium/statedb/cell.go:37) (statedb)"
time=2026-03-18T13:50:03.604243837Z level=debug source=/go/src/github.com/cilium/cilium/vendor/github.com/cilium/hive/cell/lifecycle.go:194 msg="Stop hook executed" subsys=cilium-dbg function="statedb.newHiveDB.func2 (.../cilium/statedb/cell.go:37) (statedb)" duration=2.907µs
time=2026-03-18T13:50:03.604254844Z level=info source=/go/src/github.com/cilium/cilium/vendor/github.com/cilium/hive/hive.go:405 msg="Stopped hive" subsys=cilium-dbg duration=453.567µs
```

**Comment by atykhyy** [comment]
@41ks Your bad run of `cilium build-config` is running into a permission issue, almost certainly because the host firewall bypass needs to set `SO_MARK` on the dialer socket. I suppose the bypass should check whether the process it's running in has the CAP_NET_ADMIN or CAP_NET_RAW capabilities before trying that. The bypass is only enabled in `build-config` in the first place because `build-config` runs in one of Cilium daemonset's init containers, when the Cilium agent is not running. Do I understand correctly that you use `build-config` as a standalone utility in your upgrade process?
```
time=2026-03-18T13:47:32.611834849Z level=error source=/go/src/github.com/cilium/cilium/pkg/k8s/client/cell.go:335 msg="Unable to contact k8s api-server" subsys=cilium-dbg module=k8s-client ipAddr=https://172.17.0.1:443 error="Get \"https://172.17.0.1:443/api/v1/namespaces/kube-system\": dial tcp 172.17.0.1:443: operation not permitted"
```

@jmeza-xyz Your values.yaml does not say if host firewall is enabled. [The bypass shouldn't kick in unless it is.](https://github.com/cilium/cilium/pull/40942) As for ipvs for kube-apiserver, I have never used it and don't know how it works. Can it be reproduced in kind? Is it the case that when ipvs is used, kube-apiserver looks like it runs in a local pod?

**Comment by nickdallavalentina** [comment]
I hit the same issue today when I upgraded an existing Cilium installation from 1.18.10 to 1.19.4

## Configuration:

- Cilium version before upgrade: 1.18.10
- Cilium version after upgrade: 1.19.4
- Kubernetes version: 1.34.x
- Kops version: 1.34.x
- Cloud provider AWS 
- Kube-proxy mode: `ipvs`
- Cilium install method: Helm
- Cilium kube-proxy replacement setting: false
- Cilium routing mode: tunnel 
- Cilium ipam: cluster-pool
- 
logs of Cilum agents are not able to reach kube-api:

```
Message:   time=<TIMESTAMP> level=info msg=Running subsys=cilium-dbg
time=<TIMESTAMP> level=info msg="Starting hive" subsys=cilium-dbg
time=<TIMESTAMP> level=info msg="Establishing connection to apiserver" subsys=cilium-dbg module=k8s-client ipAddr=https://<K8S_API_SERVER>:443
time=<TIMESTAMP> level=info msg="Establishing connection to apiserver" subsys=cilium-dbg module=k8s-client ipAddr=https://<K8S_API_SERVER>:443
time=<TIMESTAMP> level=error msg="Unable to contact k8s api-server" subsys=cilium-dbg module=k8s-client ipAddr=https://<K8S_API_SERVER>:443 error="Get \"https://<K8S_API_SERVER>:443/api/v1/namespaces/kube-system\": dial tcp <K8S_API_SERVER>:443: i/o timeout"
time=<TIMESTAMP> level=error msg="Start hook failed" subsys=cilium-dbg function="client.(*compositeClientset).onStart (k8s-client)" error="Get \"https://<K8S_API_SERVER>:443/api/v1/namespaces/kube-system\": dial tcp <K8S_API_SERVER>:443: i/o timeout"
time=<TIMESTAMP> level=error msg="Failed to start hive" subsys=cilium-dbg error="Get \"https://<K8S_API_SERVER>:443/api/v1/namespaces/kube-system\": dial tcp <K8S_API_SERVER>:443: i/o timeout" duration=1m5.033954525s
Error: Build config failed: failed to start: Get "https://<K8S_API_SERVER>:443/api/v1/namespaces/kube-system": dial tcp <K8S_API_SERVER>:443: i/o timeout

time=<TIMESTAMP> level=info msg="Stopping hive" subsys=cilium-dbg
time=<TIMESTAMP> level=info msg="Stopped hive" subsys=cilium-dbg duration=38.47µs
```
Behaviour tested:

- restart Cilium agent did not helped ❌
- restart node actually works ( maybe temporary) ✅

I tried scaling up some workloads and letting Karpenter create new nodes. The new nodes don’t seem to be affected, so as a workaround, we’ll probably need to roll out the whole cluster to complete the Cilium upgrade but i will stop to upgrade any other cluster until I will have some more clarity

I can see this contradiction:

kubectl -n kube-system exec -it <CILIUM_POD> -c config -- sh -c 'echo | openssl s_client -connect <API_SERVER>:443 -servername kubernetes.default.svc -brief'

### trying to open connection 
- openssl from the same config container reaches <API_SERVER>:443
- TLS handshake succeeds
- Cilium's Go Kubernetes client times out


### tcpdump behaviour

I captured traffic on an affected node while the Cilium `config` init container was running `cilium-dbg build-config`. To understand how is working:

Capture command:

```bash
tcpdump -ni any -s 0 -w /tmp/cilium-api-debug.pcap \
  '(host <K8S_API_SERVICE_IP> or host <NODE_VPC_IP> ) and port 443'
```

On the affected node, I see packets leaving `eth0` towards the real apiserver backend, but with the Kubernetes API Service ClusterIP as the source address:

```text
<TIMESTAMP> eth0 Out IP <K8S_API_SERVICE_IP>.<SRC_PORT> > <APISERVER_BACKEND_IP>.443: Flags [S]
<TIMESTAMP> eth0 Out IP <K8S_API_SERVICE_IP>.<SRC_PORT> > <APISERVER_BACKEND_IP>.443: Flags [S]
<TIMESTAMP> eth0 Out IP <K8S_API_SERVICE_IP>.<SRC_PORT> > <APISERVER_BACKEND_IP>.443: Flags [S]
```

I guess, I suspect this looks incorrect to me because `<K8S_API_SERVICE_IP>` is the Kubernetes Service ClusterIP and should not be used as the source address for packets leaving the node towards the real apiserver backend.

example:

```
2026-06-16 08:31:16.328474 eth0  Out IP 198.x.x.x.12345 > 172.x.x.x.443: Flags [S], seq x, win x, options [mss x,sackOK,TS val x ecr 0,nop,wscale 9], length 0
```

On a healthy node / healthy cluster, I see my guessing expected behaviour instead:

```text
<POD_IP>.<SRC_PORT> > <K8S_API_SERVICE_IP>.443: Flags [S]
```
example:

```
2026-06-16 08:54:13.635380 lxcxxxxxx In  IP 198.x.x.x.12456 > 198.x.x.x.443: Flags [P.], seq x:x, ack x, win x, options [nop,nop,TS val x ecr x], length 48
```
or

```
2026-06-16 08:54:13.635992 eth0  In  IP 172.x.x.x.443 > 172.x.x.x.12456: Flags [.], ack x, win x, options [nop,nop,TS val x ecr x], length 0
```

so I guess, potentially the expected path should to be:

```text
pod or hostNetwork process
  -> Kubernetes API Service IP
  -> kube-proxy/IPVS selects apiserver backend
  -> packet leaves the node with a routable source address, usually the node VPC IP
  -> apiserver backend replies with SYN/ACK
```

but on the affected node, the observed path is:

```text
cilium-dbg build-config
  -> Kubernetes API Service IP
  -> kube-proxy/IPVS selects apiserver backend
  -> packet leaves eth0 with source address equal to the Kubernetes API Service ClusterIP
  -> cilium-dbg eventually fails with dial tcp <K8S_API_SERVICE_IP>:443: i/o timeout
```

please take a look and correct if I'm wrong, thanks in advance

**Comment by ralgozino** [comment]
Hi @aanm 

Do you have any news to share about this issue? We are still on 1.18.x that still get updates but according to the docs 1.18.x is not tested against latest versions of Kubernetes.

Is setting `enable-k8s-host-firewall-bypass` to `false` the recommended approach?

> [@jmeza-xyz](https://github.com/jmeza-xyz) Your values.yaml does not say if host firewall is enabled. [The bypass shouldn't kick in unless it is.](https://github.com/cilium/cilium/pull/40942) As for ipvs for kube-apiserver, I have never used it and don't know how it works. Can it be reproduced in kind? Is it the case that when ipvs is used, kube-apiserver looks like it runs in a local pod?

Hi @atykhyy , you can find a reproduce procedure with kind in my comment above:
https://github.com/cilium/cilium/issues/44464#issuecomment-3944887005

**Comment by atykhyy** [comment]
@aanm Actually the issue remains with a fresh install (not upgrade) of v1.19. It does not appear immediately because Cilium is installed into a fresh cluster, but once you restart the Cilium pods, some of them get stuck on `build-config` in the same manner as after an upgrade.

@ralgozino I have reproduced the issue using your procedure. I do not know exactly why host firewall bypass interferes with kube-apiserver access when kube-proxy is in ipvs mode, and since [as of v1.35 Kubernetes has deprecated ipvs mode](https://kubernetes.io/docs/reference/networking/virtual-ips/#proxy-mode-ipvs), I don't really want to investigate this deeply. The bottom line is that there is no need for host firewall bypass to be enabled unless Cilium host firewall is enabled _and_ one uses [host L7 DNS policy](https://docs.cilium.io/en/stable/security/policy/host/). However, the `build-config` init container cannot know if host firewall is enabled when it starts, because the whole purpose of that init container is to work out the Cilium configuration for the node (chicken-and-egg problem). I made host firewall bypass default to enabled in `build-config` because this is known to cause no problems when kube-proxy is in iptables mode or when Cilium replaces kube-proxy (Cilium CI does not include configurations with kube-proxy in ipvs mode, probably because it is deprecated). For those who use kube-proxy in ipvs mode, I can suggest two workarounds:

1. If you do not use `CiliumNodeConfig` objects or node labels to configure Cilium on per-node basis, and just use a configmap to configure Cilium agent (the default is `cilium-config` in the `kube-system` namespace), the best workaround is to make Helm remove the `build-config` init container on upgrade. To do this, set the `daemon.configSources` Helm value when upgrading:
```
# change as required if you use a different configmap
cilium upgrade --set daemon.configSources=config-map:cilium-config ...
```

2. If you do use `CiliumNodeConfig` objects or node labels to configure Cilium on per-node basis, then disable the bypass by one of the methods suggested by @jmeza-xyz above.

As for actually fixing the issue such that workarounds would not be needed, it is difficult to wriggle out of the chicken-and-egg problem created by the existence of the `build-config` init container. Probably the least unpalatable option is to simply add a Helm value to disable the bypass, documenting how it interacts with ipvs mode.
