### ISSUE TITLE
Cilium 1.16 BPF Masquerade picks different host IP address (when using multiple IPs per interface)

### ISSUE THREAD

**Issue by tenyo** [cilium/cilium#41866]
### Is there an existing issue for this?

- [x] I have searched the existing issues

### Version

equal or higher than v1.16.14 and lower than v1.17.0
equal or higher than v1.17.8 and lower than v1.18.0

### What happened?

After upgrading from 1.15.14 to 1.16.15 pods are no longer able to connect to anything outside the cluster (internal connections work fine). I've confirmed the problem is also present in earlier patch releases, such as 1.16.4. Downgrading to 1.15.14 resolves the problem.
We are using BPF masquerading (in both 1.15 and 1.16). After troubleshooting I noticed the problem is due to the way Cilium SNATs the egress connections - it picks a different host source IP in 1.16. In our case we have bond0 interface which has both an internal (10.x) and a public IP address. In order for traffic to be routed properly from the host, the source needs to be the public address (which was the case in 1.15). However, now (in 1.16) the source IP is the private address.
I also tried setting `bpf.hostLegacyRouting=true` but it didn't make any difference.

I'm not sure how SNAT addresses are selected by Cilium (or what the "right" behavior is, but public IPs should probably get preference) but I assume something has changed in 1.16 (likely https://github.com/cilium/cilium/pull/30457). 
Maybe there's a way to influence which IP gets selected when there are multiple ones?

### How can we reproduce the issue?

Deploy cilium v1.16.15 with cilium-config:
```
  agent-not-ready-taint-key: node.cilium.io/agent-not-ready
  annotate-k8s-node: 'true'
  arping-refresh-period: 30s
  auto-direct-node-routes: 'false'
  bpf-events-drop-enabled: 'true'
  bpf-events-policy-verdict-enabled: 'true'
  bpf-events-trace-enabled: 'true'
  bpf-lb-acceleration: disabled
  bpf-lb-algorithm: maglev
  bpf-lb-external-clusterip: 'false'
  bpf-lb-map-max: '65536'
  bpf-lb-mode: snat
  bpf-lb-sock: 'true'
  bpf-lb-sock-hostns-only: 'true'
  bpf-map-dynamic-size-ratio: '0.0025'
  bpf-policy-map-max: '16384'
  bpf-root: /sys/fs/bpf
  cgroup-root: /run/cilium/cgroupv2
  cilium-endpoint-gc-interval: 5m0s
  cluster-id: '0'
  cluster-name: stage-da-gen-tenyo
  clustermesh-enable-endpoint-sync: 'false'
  clustermesh-enable-mcs-api: 'false'
  cni-exclusive: 'true'
  cni-log-file: /var/run/cilium/cilium-cni.log
  controller-group-metrics: write-cni-file sync-host-ips sync-lb-maps-with-k8s-services
  custom-cni-conf: 'false'
  datapath-mode: veth
  debug: 'false'
  direct-routing-skip-unreachable: 'false'
  dnsproxy-enable-transparent-mode: 'true'
  dnsproxy-socket-linger-timeout: '10'
  egress-gateway-reconciliation-trigger-interval: 1s
  enable-auto-protect-node-port-range: 'true'
  enable-bandwidth-manager: 'true'
  enable-bbr: 'false'
  enable-bpf-clock-probe: 'false'
  enable-bpf-masquerade: 'true'
  enable-bpf-tproxy: 'true'
  enable-endpoint-health-checking: 'true'
  enable-health-check-loadbalancer-ip: 'false'
  enable-health-check-nodeport: 'true'
  enable-health-checking: 'true'
  enable-host-firewall: 'true'
  enable-ipv4: 'true'
  enable-ipv4-big-tcp: 'false'
  enable-ipv4-masquerade: 'true'
  enable-ipv6: 'false'
  enable-ipv6-big-tcp: 'false'
  enable-ipv6-masquerade: 'true'
  enable-k8s-networkpolicy: 'true'
  enable-k8s-terminating-endpoint: 'true'
  enable-l2-neigh-discovery: 'true'
  enable-l7-proxy: 'true'
  enable-local-redirect-policy: 'false'
  enable-masquerade-to-route-source: 'false'
  enable-metrics: 'true'
  enable-node-selector-labels: 'false'
  enable-policy: default
  enable-runtime-device-detection: 'true'
  enable-sctp: 'false'
  enable-service-topology: 'true'
  enable-session-affinity: 'true'
  enable-svc-source-range-check: 'true'
  enable-tcx: 'true'
  enable-vtep: 'false'
  enable-well-known-identities: 'false'
  enable-wireguard: 'true'
  enable-xt-socket-fallback: 'true'
  encrypt-node: 'true'
  envoy-access-log-buffer-size: '4096'
  envoy-base-id: '0'
  envoy-keep-cap-netbindservice: 'false'
  external-envoy-proxy: 'false'
  identity-allocation-mode: crd
  identity-gc-interval: 15m0s
  identity-heartbeat-timeout: 30m0s
  install-no-conntrack-iptables-rules: 'false'
  ipam: kubernetes
  ipam-cilium-node-update-rate: 15s
  k8s-client-burst: '20'
  k8s-client-qps: '10'
  k8s-require-ipv4-pod-cidr: 'false'
  k8s-require-ipv6-pod-cidr: 'false'
  kube-proxy-replacement: 'true'
  kube-proxy-replacement-healthz-bind-address: 0.0.0.0:10256
  log-opt: '{"format":"json","level":"warning"}'
  log-system-load: 'true'
  max-connected-clusters: '255'
  mesh-auth-enabled: 'false'
  mesh-auth-gc-interval: 5m0s
  mesh-auth-queue-size: '1024'
  mesh-auth-rotated-identities-queue-size: '1024'
  monitor-aggregation: medium
  monitor-aggregation-flags: all
  monitor-aggregation-interval: 5s
  mtu: '1500'
  nat-map-stats-entries: '32'
  nat-map-stats-interval: 30s
  node-port-bind-protection: 'true'
  nodes-gc-interval: 5m0s
  operator-api-serve-addr: 127.0.0.1:9234
  operator-prometheus-serve-addr: ':9963'
  preallocate-bpf-maps: 'true'
  prometheus-serve-addr: ':9962'
  proxy-connect-timeout: '2'
  proxy-idle-timeout-seconds: '60'
  proxy-initial-fetch-timeout: '30'
  proxy-max-connection-duration-seconds: '0'
  proxy-max-requests-per-connection: '0'
  proxy-prometheus-port: '9964'
  proxy-xff-num-trusted-hops-egress: '0'
  proxy-xff-num-trusted-hops-ingress: '0'
  remove-cilium-node-taints: 'true'
  routing-mode: tunnel
  service-no-backend-response: reject
  set-cilium-is-up-condition: 'true'
  set-cilium-node-taints: 'true'
  synchronize-k8s-nodes: 'true'
  tofqdns-dns-reject-response-code: refused
  tofqdns-enable-dns-compression: 'true'
  tofqdns-endpoint-max-ip-per-hostname: '50'
  tofqdns-idle-connection-grace-period: 0s
  tofqdns-max-deferred-connection-deletes: '10000'
  tofqdns-proxy-response-max-delay: 100ms
  tunnel-protocol: vxlan
  unmanaged-pod-watcher-interval: '15'
  vtep-cidr: ''
  vtep-endpoint: ''
  vtep-mac: ''
  vtep-mask: ''
  wireguard-persistent-keepalive: 0s
  write-cni-conf-when-ready: /host/etc/cni/net.d/05-cilium.conflist
```

You would also need to have multiple IP addresses on the network interface used for masquerading on the host.

### Cilium Version

```
Client: 1.16.15 75130674 2025-09-17T14:13:05+02:00 go version go1.24.7 linux/amd64
Daemon: 1.16.15 75130674 2025-09-17T14:13:05+02:00 go version go1.24.7 linux/amd64
```

### Kernel Version

```
Linux stage-worker-a-92sml-dpnvc 6.6.88-flatcar #1 SMP PREEMPT_DYNAMIC Tue Apr 29 22:31:30 -00 2025 x86_64 AMD EPYC 7402P 24-Core Processor AuthenticAMD GNU/Linux
```

### Kubernetes Version

```
Server Version: v1.33.2
```

### Regression

Yes. Worked fine in v1.15.14.

### Relevant log output

```shell
# comparing tcpdump from the host in 1.15 (working properly and we get a response when using the public source IP 100.10.100.10)

18:14:58.329826 lxcc63de5ab3ec6 In  IP 192.168.1.83.56972 > 1.1.1.1.80: Flags [S], seq 1950840356, win 64860, options [mss 1410,sackOK,TS val 242150990 ecr 0,nop,wscale 7], length 0
18:14:58.329863 bond0 Out IP 100.10.100.10.56972 > 1.1.1.1.80: Flags [S], seq 1950840356, win 64860, options [mss 1410,sackOK,TS val 242150990 ecr 0,nop,wscale 7], length 0
18:14:58.329866 enp65s0f0 Out IP 100.10.100.10.56972 > 1.1.1.1.80: Flags [S], seq 1950840356, win 64860, options [mss 1410,sackOK,TS val 242150990 ecr 0,nop,wscale 7], length 0
18:14:58.330881 enp65s0f0 In  IP 1.1.1.1.80 > 100.10.100.10.56972: Flags [S.], seq 2849014218, ack 1950840357, win 65535, options [mss 1460,sackOK,TS val 3735816768 ecr 242150990,nop,wscale 13], length 0
18:14:58.330881 bond0 In  IP 1.1.1.1.80 > 100.10.100.10.56972: Flags [S.], seq 2849014218, ack 1950840357, win 65535, options [mss 1460,sackOK,TS val 3735816768 ecr 242150990,nop,wscale 13], length 0

# vs 1.16 (broken, since it uses the internal IP 10.70.231.131, and just keeps sending SYNs)

18:10:18.753697 lxcc63de5ab3ec6 In  IP 192.168.1.83.34318 > 1.1.1.1.80: Flags [S], seq 1582130546, win 64860, options [mss 1410,sackOK,TS val 241871414 ecr 0,nop,wscale 7], length 0
18:10:18.753722 bond0 Out IP 10.70.231.131.34318 > 1.1.1.1.80: Flags [S], seq 1582130546, win 64860, options [mss 1410,sackOK,TS val 241871414 ecr 0,nop,wscale 7], length 0
18:10:18.753726 enp65s0f0 Out IP 10.70.231.131.34318 > 1.1.1.1.80: Flags [S], seq 1582130546, win 64860, options [mss 1410,sackOK,TS val 241871414 ecr 0,nop,wscale 7], length 0

# showing the two IPs on bond0 on the host

$ ip a show bond0
4: bond0: <BROADCAST,MULTICAST,MASTER,UP,LOWER_UP> mtu 1500 qdisc mq state UP group default qlen 1000
    link/ether 40:a6:b7:74:99:20 brd ff:ff:ff:ff:ff:ff
    inet 100.10.100.10/31 scope global bond0
       valid_lft forever preferred_lft forever
    inet 10.70.231.131/31 scope global bond0
       valid_lft forever preferred_lft forever
```

### Anything else?

Likely caused by https://github.com/cilium/cilium/pull/30457?

### Cilium Users Document

- [x] Are you a user of Cilium? Please add yourself to the [Users doc](https://github.com/cilium/cilium/blob/main/USERS.md)

### Code of Conduct

- [x] I agree to follow this project's Code of Conduct

**Comment by tenyo** [comment]
btw, I also tried `enable-masquerade-to-route-source` but it doesn't seem to be supported with BPF:
```
BPF masquerading to route source (--enable-masquerade-to-route-source=\"true\") currently not supported with BPF-based masquerading
```

**Comment by tenyo** [comment]
In case it helps, I'm adding the `node-addresses` output from 1.15 and 1.16.

In 1.15 (cilium picks the public IP `100.10.100.10`):
```
$ cilium-dbg statedb node-addresses
Address                     NodePort   Primary   DeviceName
100.10.100.1                true       true      lo
100.10.100.10               false      false     bond0
2604:1380:1234:5678::7      true       true      bond0
10.70.231.131               true       true      bond0
192.168.0.24                false      true      cilium_host
fe80::dc4d:4bff:fee3:f43e   false      true      cilium_host

$ cilium-dbg status | grep Masq
Masquerading:            BPF   [bond0]   192.168.0.0/24 [IPv4: Enabled, IPv6: Disabled]
```

In 1.16 (cilium picks the private IP `10.70.231.131`):
```
$ cilium-dbg statedb node-addresses
# Address                   NodePort   Primary   DeviceName
100.10.100.1                true       true      lo
100.10.100.10               false      false     bond0
2604:1380:1234:5678::7      true       true      bond0
10.70.231.131               true       true      bond0
100.10.100.10               false      true      *
2604:1380:1234:5678::7      false      true      *
192.168.0.24                false      true      cilium_host
fe80::dc4d:4bff:fee3:f43e   false      true      cilium_host

$ cilium-dbg status | grep Masq
Masquerading:            BPF   [bond0]   192.168.0.0/24 [IPv4: Enabled, IPv6: Disabled]
```

**Comment by tenyo** [comment]
@joamaki since you worked on https://github.com/cilium/cilium/pull/30457 maybe you could point me to the right place in the code that picks the masquerade IP? 🙏  I still can't quite figure out why now it picks the private IP address instead of the public one.

**Comment by rtgiskard** [comment]
I'm having similar issues, it's ipv6+ipv4 dualstack cluster, a nginx reverse proxy is run there. nginx try to connect uptream via ipv6, find that the ipv6 masquerade not select the proper ipv6 addr:

```
# ip addr on the host:
2: eno1: <BROADCAST,MULTICAST,UP,LOWER_UP> mtu 1500 qdisc mq state UP group default qlen 1000
    link/ether ... brd ff:ff:ff:ff:ff:ff
    altname enp1s0f0
    altname ...
    inet 192.168.3.2/24 brd 192.168.3.255 scope global eno1
       valid_lft forever preferred_lft forever
    inet 192.168.3.220/24 brd 192.168.3.255 scope global secondary eno1
       valid_lft forever preferred_lft forever
    inet6 240e:.../64 scope global dynamic mngtmpaddr noprefixroute 
       valid_lft 6916sec preferred_lft 3316sec
    inet6 fd20::20/64 scope global 
       valid_lft forever preferred_lft forever
    inet6 fd20::1/64 scope global 
       valid_lft forever preferred_lft forever

# check cilium nat map
kubectl -n kube-system exec ds/cilium -- cilium bpf nat list

TCP OUT [fdc0:2::19]:56686 -> [2001:da8:d800:95::110]:443 XLATE_SRC [fd20::1]:56686 Created=1919sec ago NeedsCT=0
TCP IN [2001:da8:d800:95::110]:443 -> [fd20::1]:56686 XLATE_DST [fdc0:2::19]:56686 Created=1919sec ago NeedsCT=0
TCP OUT [fdc0:2::19]:52388 -> [2001:da8:d800:95::110]:443 XLATE_SRC [fd20::1]:52388 Created=22sec ago NeedsCT=0
TCP OUT [fdc0:2::19]:40814 -> [2001:da8:d800:95::110]:443 XLATE_SRC [fd20::1]:40814 Created=1482sec ago NeedsCT=0
TCP IN [2001:da8:d800:95::110]:443 -> [fd20::1]:40814 XLATE_DST [fdc0:2::19]:40814 Created=1482sec ago NeedsCT=0
TCP IN [2001:da8:d800:95::110]:443 -> [fd20::1]:52388 XLATE_DST [fdc0:2::19]:52388 Created=22sec ago NeedsCT=0
```

cilium should prefer global non-local ipv6 addr

**Comment by farodin91** [comment]
Could this be related with https://github.com/cilium/cilium/discussions/40693?

**Comment by tenyo** [comment]
> Could this be related with [#40693](https://github.com/cilium/cilium/discussions/40693)?

I don't think so. This looks more like a bug where cilium is selecting the private instead of the public IP masq address of an interface. The expected behavior is to use the public one when you have both a public and private IP - this changed starting at v1.16.

**Comment by rtgiskard** [comment]
There is an option `enableMasqueradeRouteSource: true`, but not supported with `btp masquerade`, I have to turn off `bpf masquerade` and use nft for masquerade and forward, and then ipv6 nat works well.

Is it possible to masquerade with bpf and doing the same thing

**Comment by tenyo** [comment]
Looking some more into this, it might actually be caused by https://github.com/cilium/cilium/pull/33629 (or a combination of several changes that effectively changed the IP selection behavior). Seems like now (starting at 1.16) cilium gives preference to the `k8sIPv4` address, which is the InternalIP node address. So this would explain why we're now seeing that internal IP being used for NAT connections.
Still unclear if this is a feature or a bug, would be nice if someone could confirm the expected behavior of cilium.

**Comment by tenyo** [comment]
I'm guessing this problem would also be solved by implementing a fix for https://github.com/cilium/cilium/issues/17158 so cilium can automatically pick among multiple SNAT addresses as appropriate.

**Comment by tenyo** [comment]
Enabling Cilium Egress Gateway seems to work around this issue - outbound connections are then masqueraded correctly using the public node IP - also confirming that egress gateway uses a different algorithm to determine the IP.
However, enabling this across all of our existing clusters will require a bunch of additional testing since it changes the current behavior. I still believe this should be fixed in the core algorithm for selecting a masq node IP address.
