### ISSUE TITLE
Service type loadbalancer is not working in DSR mode

### ISSUE THREAD

**Issue by m-yosefpor** [cilium/cilium#18081]
### Is there an existing issue for this?

- [X] I have searched the existing issues

### What happened?

Service type loadbalancer is not working in DSR mode (externalTrafficPolicy: Cluster). service type loadbalancer is implemented with metallb in BGP mode.

according to https://github.com/cilium/cilium/issues/8979 the input packet path seems ok when I capture the traffic:

```
source node ip (outside of cluster): 172.21.41.12
service external ip: 172.16.60.1
pod ip: 10.132.14.92
```

the input packet path:
<somewhere outside the cluster> -> Node A ✅ 
```
16:13:29.728842 ens4  In  IP (tos 0x0, ttl 59, id 44271, offset 0, flags [DF], proto TCP (6), length 60)
    172.21.41.12.55992 > 172.16.60.1.80: Flags [S], cksum 0x1ea5 (correct), seq 3227218382, win 29200, options [mss 1398,sackOK,TS val 268426529 ecr 0,nop,wscale 9], length 0
```

(does LB, picks a target pod, does DNAT but _not_ SNAT) ✅ 
```
16:13:29.728883 ens4  Out IP (tos 0x0, ttl 59, id 44271, offset 0, flags [DF], proto TCP (6), length 68, options (unknown 154))
    172.21.41.12.55992 > 10.132.14.92.8080: Flags [S], cksum 0xce96 (correct), seq 3227218382, win 29200, options [mss 1398,sackOK,TS val 268426529 ecr 0,nop,wscale 9], length 0
```

-> Node B (forwards to target pod)  ✅ 
```
16:13:29.729927 ens4  In  IP (tos 0x0, ttl 59, id 44271, offset 0, flags [DF], proto TCP (6), length 68, options (unknown 154))
    172.21.41.12.55992 > 10.132.14.92.8080: Flags [S], cksum 0xce96 (correct), seq 3227218382, win 29200, options [mss 1398,sackOK,TS val 268426529 ecr 0,nop,wscale 9], length 0
```

-> Pod ✅ 
```
16:13:29.729970 lxc2bdb3aea6589 Out IP (tos 0x0, ttl 58, id 44271, offset 0, flags [DF], proto TCP (6), length 68, options (unknown 154))
    172.21.41.12.55992 > 10.132.14.92.8080: Flags [S], cksum 0xce96 (correct), seq 3227218382, win 29200, options [mss 1398,sackOK,TS val 268426529 ecr 0,nop,wscale 9], length 0
```

the output path is:

Pod -> Node B ✅ 
```
16:13:29.729991 lxc2bdb3aea6589 In  IP (tos 0x0, ttl 64, id 0, offset 0, flags [DF], proto TCP (6), length 60)
    10.132.14.92.8080 > 172.21.41.12.55992: Flags [S.], cksum 0xee2f (incorrect -> 0xbef7), seq 4195991884, ack 3227218383, win 65160, options [mss 1460,sackOK,TS val 323466283 ecr 268426529,nop,wscale 7], length 0
```

(does SNAT so that src=service IP) -> <somewhere outside the cluster, back to the client IP>. ⛔ 

**No SNAT happens, the traffic will not go outside of the node**

### Cilium Version

cilium image (running): v1.10.4

### Kernel Version

$ uname -a
Linux okd4-worker-worker-1 5.14.14-200.fc34.x86_64 #1 SMP Wed Oct 20 16:15:12 UTC 2021 x86_64 x86_64 x86_64 GNU/Linux

### Kubernetes Version

$ oc version
Client Version: 4.8.0-0.okd-2021-11-14-052418
Server Version: 4.8.0-0.okd-2021-11-14-052418
Kubernetes Version: v1.21.2-1555+9e8f924492b7d7-dirty

### Code of Conduct

- [X] I agree to follow this project's Code of Conduct

**Comment by brb** [comment]
@m-yosefpor Thanks for the detailed issue. On the Node B, could run run `cilium bpf nat list | grep $CLIENT_REQ_SRC_PORT` and `cilium bpf ct list global | grep $CLIENT_REQ_SRC_PORT`?

**Comment by m-yosefpor** [comment]
@brb Here is the output:

```
# cilium bpf nat list | grep $CLIENT_REQ_SRC_PORT
Unable to open /sys/fs/bpf/tc/globals/cilium_snat_v6_external: Unable to get object /sys/fs/bpf/tc/globals/cilium_snat_v6_external: no such file or directory. Skipping.
TCP OUT 10.132.14.92:8080 -> 172.21.41.12:56258 XLATE_SRC 172.16.60.1:80 Created=270365sec HostLocal=0


# cilium bpf ct list global | grep $CLIENT_REQ_SRC_PORT
TCP IN 172.21.41.12:56258 -> 10.132.14.92:8080 expires=17832244 RxPackets=3 RxBytes=246 RxFlagsSeen=0x02 LastRxReport=17831877 TxPackets=8 TxBytes=592 TxFlagsSeen=0x12 LastTxReport=17832010 Flags=0x0080 [ DSR ] RevNAT=0 SourceSecurityID=2 IfIndex=0
Unable to open /sys/fs/bpf/tc/globals/cilium_ct6_global: Unable to get object /sys/fs/bpf/tc/globals/cilium_ct6_global: no such file or directory. Skipping.
Unable to open /sys/fs/bpf/tc/globals/cilium_ct_any6_global: Unable to get object /sys/fs/bpf/tc/globals/cilium_ct_any6_global: no such file or directory. Skipping.
```

**Comment by brb** [comment]
Interesting - the NAT and CT tables have correct entries. Do you see the non-SNAT-ed reply packet leaving the Node B via a physical network interface?

**Comment by m-yosefpor** [comment]
@brb no there is no non-SNAT-ed packet. This is the last packet related ro this request:

```
16:13:29.729991 lxc2bdb3aea6589 In  IP (tos 0x0, ttl 64, id 0, offset 0, flags [DF], proto TCP (6), length 60)
    10.132.14.92.8080 > 172.21.41.12.55992: Flags [S.], cksum 0xee2f (incorrect -> 0xbef7), seq 4195991884, ack 
```

no other `In` or `Out` packet

**Comment by brb** [comment]
Which tcpdump filter are you using?

**Comment by m-yosefpor** [comment]
@brb 
```
tcpdum -vvvniany host 172.21.41.12 or host 172.16.60.1
```

**Comment by brb** [comment]
@m-yosefpor Thanks. Which kernel do you run?

**Comment by m-yosefpor** [comment]
@brb $ uname -a
Linux okd4-worker-worker-1 5.14.14-200.fc34.x86_64 #1 SMP Wed Oct 20 16:15:12 UTC 2021 x86_64 x86_64 x86_64 GNU/Linux

**Comment by brb** [comment]
@m-yosefpor Could you run [pwru](https://github.com/cilium/pwru) on the service endpoint node: `pwru --filter-dst-ip=172.21.41.12 --output-tuple` and provide the output?

**Comment by m-yosefpor** [comment]
after switching from host Legacy routing to native BPF, the issue resolved.

**Comment by brb** [comment]
> after switching from host Legacy routing to native BPF, the issue is resolved.

@m-yosefpor Thanks for the update. I think what was happening in your case that some iptables rule was getting into the SNAT-ed reply's way. The BPF host routing should make the reply to bypass the iptables rules.
