### ISSUE TITLE
packet response mac address incorrect 

### ISSUE THREAD

**Issue by travisghansen** [cilium/cilium#18712]
### Is there an existing issue for this?

- [X] I have searched the existing issues

### What happened?

This is a regression experienced after upgrading from 1.10 to 1.11.

This is specially in relation to proxy replacement for services of type `LoadBalancer` (it could be more pervasive but we haven't noticed anything to this point).

We run (non-bundled) metallb and peer against an FRR router instance. DSR is currently disabled. The expected traffic pattern is:

client -> (intermediary routers) -> frr -> cluster node(s) -> pod
pod -> cluster node(s) -> frr -> (intermediary routers) -> client

After upgrading to 1.11 we observe traffic not returning to the frr node but instead taking a different return path (again, DSR is disable currently).

Below are sample tcpdumps with the different versions installed:

```
### 1.11.1

#from FFR to K8s
20:49:35.409093 00:50:56:96:94:c2 > 00:50:56:96:e3:ad > 172.29.11.232.53615 > 172.28.42.32.https

# k8s/cilium node
15:49:42.275581 00:50:56:96:94:c2 > 00:50:56:96:e3:ad > 172.29.11.232.53615 > 172.28.42.32.https
15:49:42.275672 00:50:56:96:e3:ad > 00:22:bd:f8:19:ff > 172.28.42.32.https > 172.29.11.232.53615


### 1.10.3

# from FRR to K8s
17:17:59.767264 00:50:56:96:94:c2 (oui Unknown) > 00:50:56:96:e3:ad (oui Unknown), ethertype IPv4 (0x0800), length 60: 192.168.251.46.54663 > 172.28.42.32.https: Flags [.], ack 1, win 1024, length 0
17:17:59.767264 00:50:56:96:94:c2 (oui Unknown) > 00:50:56:96:e3:ad (oui Unknown), ethertype IPv4 (0x0800), length 60: 192.168.251.46.54663 > 172.28.42.32.https: Flags [F.], seq 1, ack 1, win 1024, length 0
17:17:59.767468 00:50:56:96:e3:ad (oui Unknown) > 00:50:56:96:94:c2 (oui Unknown), ethertype IPv4 (0x0800), length 54: 172.28.42.32.https > 192.168.251.46.54663: Flags [F.], seq 1, ack 2, win 502, length 0
17:17:59.775200 00:50:56:96:94:c2 (oui Unknown) > 00:50:56:96:e3:ad (oui Unknown), ethertype IPv4 (0x0800), length 60: 192.168.251.46.54663 > 172.28.42.32.https: Flags [.], ack 2, win 1024, length 0

# k8s/cilium node
22:04:36.059055 00:50:56:96:94:c2 (oui Unknown) > 00:50:56:96:e3:ad (oui Unknown), ethertype IPv4 (0x0800), length 54: 192.168.251.46.54646 > 172.28.42.32.https: Flags [.], ack 1, win 1024, length 0
22:04:36.059066 00:50:56:96:94:c2 (oui Unknown) > 00:50:56:96:e3:ad (oui Unknown), ethertype IPv4 (0x0800), length 54: 192.168.251.46.54646 > 172.28.42.32.https: Flags [F.], seq 1, ack 1, win 1024, length 0
22:04:36.059484 00:50:56:96:e3:ad (oui Unknown) > 00:50:56:96:94:c2 (oui Unknown), ethertype IPv4 (0x0800), length 60: 172.28.42.32.https > 192.168.251.46.54646: Flags [.], ack 2, win 502, length 0
22:04:36.059592 00:50:56:96:e3:ad (oui Unknown) > 00:50:56:96:94:c2 (oui Unknown), ethertype IPv4 (0x0800), length 60: 172.28.42.32.https > 192.168.251.46.54646: Flags [F.], seq 1, ack 2, win 502, length 0
22:04:36.064077 00:50:56:96:94:c2 (oui Unknown) > 00:50:56:96:e3:ad (oui Unknown), ethertype IPv4 (0x0800), length 54: 192.168.251.46.54646 > 172.28.42.32.https: Flags [.], ack 2, win 1024, length 0
```

Of particular note is the last line from the 1.11.1 output: `15:49:42.275672 00:50:56:96:e3:ad > 00:22:bd:f8:19:ff > 172.28.42.32.https > 172.29.11.232.53615`

The `ff` mac address is associated with a switch in the networking fabric.
The `c2` address is the frr instance.
The `ad` address is one of the cluster nodes.

We're not quite sure why with 1.11.1 those outbound packets are getting (for us) an undesired mac address associated to it.

Any tips/thoughts/pointers? Have I missed a config option that should be set or similar?

Thanks!

### Cilium Version

1.10.3 vs 1.11.1

### Kernel Version

```
NAME             STATUS   ROLES                      AGE    VERSION   INTERNAL-IP    EXTERNAL-IP   OS-IMAGE                KERNEL-VERSION               CONTAINER-RUNTIME
na01lkubwrkd01   Ready    worker                     199d   v1.21.4   172.28.4.151   <none>        CentOS Linux 7 (Core)   5.12.6-1.el7.elrepo.x86_64   docker://19.3.7
na01lkubwrkd02   Ready    worker                     199d   v1.21.4   172.28.4.152   <none>        CentOS Linux 7 (Core)   5.12.6-1.el7.elrepo.x86_64   docker://19.3.7
na01lkubwrkd03   Ready    worker                     199d   v1.21.4   172.28.4.153   <none>        CentOS Linux 7 (Core)   5.12.6-1.el7.elrepo.x86_64   docker://19.3.7
na01lkubwrkd04   Ready    controlplane,etcd,worker   199d   v1.21.4   172.28.4.154   <none>        CentOS Linux 7 (Core)   5.12.6-1.el7.elrepo.x86_64   docker://19.3.7
na01lkubwrkd05   Ready    controlplane,etcd,worker   199d   v1.21.4   172.28.4.155   <none>        CentOS Linux 7 (Core)   5.10.1-1.el7.elrepo.x86_64   docker://19.3.7
na01lkubwrkd06   Ready    controlplane,etcd,worker   199d   v1.21.4   172.28.4.156   <none>        CentOS Linux 7 (Core)   5.12.6-1.el7.elrepo.x86_64   docker://19.3.7
na01lkubwrkd07   Ready    worker                     199d   v1.21.4   172.28.4.157   <none>        CentOS Linux 7 (Core)   5.10.1-1.el7.elrepo.x86_64   docker://19.3.7
na01lkubwrkd08   Ready    worker                     199d   v1.21.4   172.28.4.158   <none>        CentOS Linux 7 (Core)   5.10.1-1.el7.elrepo.x86_64   docker://19.3.7
na01lkubwrkd09   Ready    worker                     200d   v1.21.4   172.28.4.159   <none>        CentOS Linux 7 (Core)   5.10.1-1.el7.elrepo.x86_64   docker://19.3.7
```

### Kubernetes Version

1.21.4

### Sysdump

Sorry didn't catch this before downgrading the cluster :( can add later for sure.

### Code of Conduct

- [X] I agree to follow this project's Code of Conduct

**Comment by borkmann** [comment]
> Of particular note is the last line from the 1.11.1 output: 15:49:42.275672 00:50:56:96:e3:ad > 00:22:bd:f8:19:ff > 172.28.42.32.https > 172.29.11.232.53615
> 
> The ff mac address is associated with a switch in the networking fabric.
> The c2 address is the frr instance.
> The ad address is one of the cluster nodes.

In short, the diff between the two versions is:

1.11:

> 00:50:56:96:e3:ad > 00:22:bd:f8:19:ff > 172.28.42.32.https > 172.29.11.232.53615

1.10:

> 00:50:56:96:e3:ad > 00:50:56:96:94:c2 > 172.28.42.32.https > 192.168.251.46.54646

In 1.11, it's pushing the packet to the switch as next hop vs in 1.10 pushing to the frr instance as next hop.

Is the `00:22:bd:f8:19:ff` the default gateway from the pov of the `172.28.42.32` node?

Who is installing `00:22:bd:f8:19:ff` onto the node? When you do `ip r` and `ip n`, would regular traffic originating from node 172.28.42.32 also take the switch as next hop or rather the frr instance?

In 1.11, we reworked the neigh handling to reuse the existing kernel's neighbor table on the node:
https://isovalent.com/blog/post/2021-12-release-111#managed-ipv4-ipv6-discovery

**Comment by travisghansen** [comment]
OK, finally had a chance to revisit this after waiting for `v1.11.2` to be released. Indeed the issue was related to the nexthop discovery changes between `1.10` and `1.11`.

In our case (for both `dsr` and `snat` configurations, or said differently, even without `dsr` enabled) the result of the changes was asymmetric routing and undesirable behavior (for us). As mentioned in the description we have some intermediate FRR routers where our LB IPs are advertised and all LB traffic coming into the cluster goes through those. We wanted all LB traffic to return through those as well (while not screwing with the standard routes on the nodes).

Based on the work here:

- https://github.com/cilium/cilium/pull/18585
- https://github.com/cilium/cilium/issues/18199

we have now been able to create some policy based routing rules that push any traffic with the LB IPs as the src back through FRR (and only that traffic). A crude example of this is:

```
# create the routing table
echo 20 cilium >> /etc/iproute2/rt_tables

# create a src-based routing rule to use the table
ip rule add from <service/metallb network> lookup cilium
...repeat for all BGP/metallb networks

# populate the table with a default route
ip route replace default via <FRR IP> table cilium

# (optional if you have more than 1 router instance) populate the table with multiple default nexthops
ip route replace default table cilium \
    nexthop via <FRR1>  weight 1 \
    nexthop via <FRRN> weight 1
```

My intent is to write a sort of metallb agent that automates all of the above by watching the metallb configmap AND doing some sort of health check on the nexthops for scenarios where multiples are defined.

Thanks for the help an attention! This can likely be closed at this point.

**Comment by brb** [comment]
> Thanks for the help an attention! This can likely be closed at this point.

Thanks for the update. Closing.

**Comment by travisghansen** [comment]
As a final update I created this to manage this: https://github.com/travisghansen/metallb-node-route-agent
