### ISSUE TITLE
Private network interface not responding to pod IPs ARP queries

### ISSUE THREAD

**Issue by 0xalex88** [cilium/cilium#34556]
### Is there an existing issue for this?

- [X] I have searched the existing issues

### Version

equal or higher than v1.16.0 and lower than v1.17.0

### What happened?

Hi everyone, we're trying to create a cluster mesh between three AWS EKS clusters and a cluster running on dedicated servers.

Everything worked fine until we've switched from tunnel mode to native routing mode (we wanted to avoid the overhead since we have full routing via site-to-site VPNs).

While all the AWS EKS clusters pods can communicate between each other with no issues, the traffic that goes from/to a pod on the dedicated server cluster and the other clusters is dropped, for example:
 - dedicated cluster pod http request towards AWS: on the VPN gateway we see the SYN packet going to AWS, the ACK one coming back and then being nothing else
 - AWS pod http request towards the dedicated cluster pod: SYN packet reaches the gateway, gateway does an ARP request for the pod IP, but the host running that pod doesn't respond with the private interface MAC address
 - communications between pods within the dedicated server cluster: works

on AWS we use the ENI ipam mode and on the dedicated cluster the cluster-pool one.

Is cilium supposed to configure the pod IP/CIDR on the private network interface and/or bridge it with the cilium_host network interface? Or is there any way to tell it that the pod CIDR is natively routable through the private interface?

I've attached the helm config and the sysdump, please let me know if there's anything that I can provide to help troubleshooting

### How can we reproduce the issue?

Install cilium with the provided helm flags:

```yaml
cluster:
  name: "onprem"
  id: 4

ipv4:
  enabled: true

l2announcements:
  enabled: true
k8sClientRateLimit:
  qps: 10
  burst: 20
kubeProxyReplacement: true
k8sServiceHost: "10.16.0.3" # master IP
k8sServicePort: "6443"

ipam:
  mode: cluster-pool
  operator:
    clusterPoolIPv4PodCIDRList: ["10.16.32.0/19"]
    clusterPoolIPv4MaskSize: 26

k8s:
  requireIPv4PodCIDR: true

autoDirectNodeRoutes: true
routingMode: native
endpointRoutes:
  enabled: true

ipv4NativeRoutingCIDR: "10.16.32.0/19"

bpf:
  tproxy: true
  preallocateMaps: true
  masquerade: true
  lbExternalClusterIP: true

ipMasqAgent:
  enabled: true

enableIPv4Masquerade: true

externalIPs:
  enabled: true

securityContext: # Required by talos OS
  capabilities:
    ciliumAgent:
      - CHOWN
      - KILL
      - NET_ADMIN
      - NET_RAW
      - IPC_LOCK
      - SYS_ADMIN
      - SYS_RESOURCE
      - DAC_OVERRIDE
      - FOWNER
      - SETGID
      - SETUID
    cleanCiliumState:
      - NET_ADMIN
      - SYS_ADMIN
      - SYS_RESOURCE

operator:
  replicas: 1
  rollOutPods: true

rollOutCiliumPods: true

clustermesh:
  useAPIServer: true
  apiserver:
    kvstoremesh:
      enabled: false
    service:
      type: NodePort
  config:
    enabled: true

hubble:
  enabled: true
  ui:
    enabled: true
    rollOutPods: true
  relay:
    enabled: true
    rollOutPods: true

ingressController:
  enabled: true
  loadbalancerMode: shared
  default: true
  service:
    type: NodePort

policyEnforcementMode: "always"
```

### Cilium Version

1.16.1

### Kernel Version

6.6.28-talos (@buildkitsandbox) (gcc (GCC) 13.2.0, GNU ld (GNU Binutils) 2.42) #1 SMP Thu Apr 18 16:21:02 UTC 2024

### Kubernetes Version

1.30.0

### Sysdump

[cilium-sysdump-20240823-115643.zip](https://github.com/user-attachments/files/16732694/cilium-sysdump-20240823-115643.zip)

### Cilium Users Document

- [ ] Are you a user of Cilium? Please add yourself to the [Users doc](https://github.com/cilium/cilium/blob/main/USERS.md)

### Code of Conduct

- [X] I agree to follow this project's Code of Conduct

**Comment by squeed** [comment]
Hi there, @0xalex88. These sorts of things can be very difficult to troubleshoot. Could you include a tcpdump and hubble flow logs of a specific flow that is broken?

Do you suspect this is a bug with Cilium, or a question of the right configuration?

**Comment by 0xalex88** [comment]
To be honest I'm not 100% sure the configuration is correct but to my understanding since the cluster pool ipam and the ipv4NativeRoutingCIDR are both set to 10.16.32.0/19, the nodes should respond to ARP queries for that range.
They do it on AWS (with the only difference that the ENI ipam adds the pods IPs to the interface, while the cluster pool doesn't, so maybe on AWS it's the kernel responding to the ARP queries, not cilium).

Not that the IP addresses used for hosts are 10.16.0.0/16 and 10.16.1.0/16, pods are 10.16.32.0/19.

On the dedicated servers cluster, from a VM in the same host network to a pod:

```
# On the client 10.16.0.6 towards the pod ip 10.16.33.61

17:25:00.446337 ens4  Out ARP, Request who-has 10.16.33.61 tell 10.16.0.6, length 28
17:25:01.470374 ens4  Out ARP, Request who-has 10.16.33.61 tell 10.16.0.6, length 28
17:25:02.494286 ens4  Out ARP, Request who-has 10.16.33.61 tell 10.16.0.6, length 28
17:25:03.518299 ens4  Out ARP, Request who-has 10.16.33.61 tell 10.16.0.6, length 28

# On the kubernetes worker node 10.16.1.1 (we only have pcap because we use talos as distro)

PACKET: 60 bytes, wire length 60 cap length 60 @ 2024-09-02 17:24:59.398937986 +0000 UTC
- Layer 1 (14 bytes) = Ethernet	{Contents=[..14..] Payload=[..46..] SrcMAC=fa:16:3e:e1:bb:3a DstMAC=ff:ff:ff:ff:ff:ff EthernetType=ARP Length=0}
- Layer 2 (28 bytes) = ARP	{Contents=[..28..] Payload=[..18..] AddrType=Ethernet Protocol=IPv4 HwAddressSize=6 ProtAddressSize=4 Operation=1 SourceHwAddress=[..6..] SourceProtAddress=[10, 16, 0, 6] DstHwAddress=[..6..] DstProtAddress=[10, 16, 33, 61]}
- Layer 3 (18 bytes) = Payload	18 byte(s)

PACKET: 60 bytes, wire length 60 cap length 60 @ 2024-09-02 17:25:00.422955895 +0000 UTC
- Layer 1 (14 bytes) = Ethernet	{Contents=[..14..] Payload=[..46..] SrcMAC=fa:16:3e:e1:bb:3a DstMAC=ff:ff:ff:ff:ff:ff EthernetType=ARP Length=0}
- Layer 2 (28 bytes) = ARP	{Contents=[..28..] Payload=[..18..] AddrType=Ethernet Protocol=IPv4 HwAddressSize=6 ProtAddressSize=4 Operation=1 SourceHwAddress=[..6..] SourceProtAddress=[10, 16, 0, 6] DstHwAddress=[..6..] DstProtAddress=[10, 16, 33, 61]}
- Layer 3 (18 bytes) = Payload	18 byte(s)

PACKET: 60 bytes, wire length 60 cap length 60 @ 2024-09-02 17:25:01.446984441 +0000 UTC
- Layer 1 (14 bytes) = Ethernet	{Contents=[..14..] Payload=[..46..] SrcMAC=fa:16:3e:e1:bb:3a DstMAC=ff:ff:ff:ff:ff:ff EthernetType=ARP Length=0}
- Layer 2 (28 bytes) = ARP	{Contents=[..28..] Payload=[..18..] AddrType=Ethernet Protocol=IPv4 HwAddressSize=6 ProtAddressSize=4 Operation=1 SourceHwAddress=[..6..] SourceProtAddress=[10, 16, 0, 6] DstHwAddress=[..6..] DstProtAddress=[10, 16, 33, 61]}
- Layer 3 (18 bytes) = Payload	18 byte(s)

PACKET: 60 bytes, wire length 60 cap length 60 @ 2024-09-02 17:25:02.470869619 +0000 UTC
- Layer 1 (14 bytes) = Ethernet	{Contents=[..14..] Payload=[..46..] SrcMAC=fa:16:3e:e1:bb:3a DstMAC=ff:ff:ff:ff:ff:ff EthernetType=ARP Length=0}
- Layer 2 (28 bytes) = ARP	{Contents=[..28..] Payload=[..18..] AddrType=Ethernet Protocol=IPv4 HwAddressSize=6 ProtAddressSize=4 Operation=1 SourceHwAddress=[..6..] SourceProtAddress=[10, 16, 0, 6] DstHwAddress=[..6..] DstProtAddress=[10, 16, 33, 61]}
- Layer 3 (18 bytes) = Payload	18 byte(s)
```

the dedicated hosts however responds correctly to the host IPs ARP requests:

```
PACKET: 42 bytes, wire length 42 cap length 42 @ 2024-09-02 17:24:59.086032883 +0000 UTC
- Layer 1 (14 bytes) = Ethernet	{Contents=[..14..] Payload=[..28..] SrcMAC=a0:42:3f:4f:0a:e4 DstMAC=74:56:3c:06:01:2a EthernetType=ARP Length=0}
- Layer 2 (28 bytes) = ARP	{Contents=[..28..] Payload=[] AddrType=Ethernet Protocol=IPv4 HwAddressSize=6 ProtAddressSize=4 Operation=1 SourceHwAddress=[..6..] SourceProtAddress=[10, 16, 1, 2] DstHwAddress=[..6..] DstProtAddress=[10, 16, 1, 1]}

PACKET: 60 bytes, wire length 60 cap length 60 @ 2024-09-02 17:24:59.086224145 +0000 UTC
- Layer 1 (14 bytes) = Ethernet	{Contents=[..14..] Payload=[..46..] SrcMAC=74:56:3c:06:01:2a DstMAC=a0:42:3f:4f:0a:e4 EthernetType=ARP Length=0}
- Layer 2 (28 bytes) = ARP	{Contents=[..28..] Payload=[..18..] AddrType=Ethernet Protocol=IPv4 HwAddressSize=6 ProtAddressSize=4 Operation=2 SourceHwAddress=[..6..] SourceProtAddress=[10, 16, 1, 1] DstHwAddress=[..6..] DstProtAddress=[10, 16, 1, 2]}
- Layer 3 (18 bytes) = Payload	18 byte(s)
```

the network interfaces are configured to only have the host IP 

```
NODE           NAMESPACE   TYPE          ID                         VERSION
15.x.x.x   network     AddressSpec   enp4s0f0/15.x.x.x/24   2
15.x.x.x   network     AddressSpec   enp4s0f1.1/10.16.1.1/16    2
15.x.x.x   network     AddressSpec   lo/127.0.0.1/8             2
```

```
Name:         talos-worker-1
Namespace:
Labels:       beta.kubernetes.io/arch=amd64
              beta.kubernetes.io/os=linux
              kubernetes.io/arch=amd64
              kubernetes.io/hostname=talos-worker-1
              kubernetes.io/os=linux
Annotations:  <none>
API Version:  cilium.io/v2
Kind:         CiliumNode
Metadata:
  Creation Timestamp:  2024-08-22T23:13:44Z
  Generation:          7
  Owner References:
    API Version:     v1
    Kind:            Node
    Name:            talos-worker-1
    UID:             02c55397-1a61-456c-98cf-a581c640f716
  Resource Version:  1179112
  UID:               d1969fc2-9be5-413d-93bd-f9f7cce0d849
Spec:
  Addresses:
    Ip:    10.16.1.1
    Type:  InternalIP
    Ip:    10.16.33.9
    Type:  CiliumInternalIP
  Alibaba - Cloud:
  Azure:
  Bootid:  cc70af98-d3e9-4033-aa85-e674cf28ccbc
  Encryption:
  Eni:
  Health:
    ipv4:  10.16.33.60
  Ingress:
    ipv4:  10.16.33.5
  Ipam:
    Pod CID Rs:
      10.16.33.0/26
    Pools:
Status:
  Alibaba - Cloud:
  Azure:
  Eni:
  Ipam:
    Operator - Status:
Events:  <none>
```

**Comment by 0xalex88** [comment]
Forgot to add, `hubble observe` doesn't show anything (trying to filter by pod), I guess because not even the SYN packet is sent (since there's no ARP response)
