### ISSUE TITLE
Failure to establish initial connection to clustermesh-apiserver NodePort when Tunneling + KPR + WireGuard + Host firewall are enabled

### ISSUE THREAD

**Issue by giorio94** [cilium/cilium#31209]
### Is there an existing issue for this?

- [X] I have searched the existing issues

### What happened?

When both tunneling and host firewall are enabled, pod to node traffic is encapsulated to avoid masquerading the source address, and preserve the source identity. This is achieved configuring the tunnel endpoint field of the respective ipcache entries to the node IP address itself.

Considering a clustermesh scenario, with the clustermesh-apiserver exposed through a NodePort (and KPR is enabled), this can cause agent to the remote clustermesh traffic to be routed asymmetrically, via the native device in one direction, and the tunnel in the other. Let's assume that we have two (single node for simplicity, although it doesn't matter) clusters: initially, the agent in the first cluster will attempt to connect to the remote clustermesh-apiserver NodePort: the corresponding entry is not present in the ipcache, hence traffic will be routed natively. The same applies for the return traffic, the connection can be successfully established, data pulled from the clustermesh-apiserver, and the remote node IPs are eventually inserted in the ipcache on the node of the first cluster. At this point, the agent on the second cluster tries to reach the clustermesh-apiserver on the first cluster, forward packets get still routed natively (as no ipcache entry is yet present there for the remote node), but return traffic is instead tunneled (obeying to the ipcache entry of the node in the first cluster), causing the asymmetry.

This is particularly problematic if WireGuard is enabled as well, because the encapsulated traffic is then encrypted by WireGuard, but discarded at the destination as the decryption key for that node has not yet been configured (as retrieved from the remote cluster clustermesh-apiserver). Please note that depending on timing this issue may or may not occur, but it typically occurs as long as the clusters are configured at slightly different points in time. Once the agents in one of the cluster configured the ipcache entries for the remote node, the agents (or pods, in case of kvstoremesh) in the other cluster will never succeed in connecting.

### Cilium Version

Tested the main branch as of today, but I'm pretty confident it affects stable versions as well -- although one difference which may play a role is that we started encrypting all encapsulated packets (instead of skipping encapsulation altogether when WireGuard is enabled) in v1.15 (while that is opt-in in v1.14). 

### Code of Conduct

- [X] I agree to follow this project's Code of Conduct

**Comment by radmacd** [comment]
I believe I have experienced this exact issue.

After reading this and then trying to resolve my issue by disabling host-firewall, the cluster mesh came up.

**Comment by qmonnet** [comment]
Here's how to edit the `Makefile.kind` to reproduce the issue (based on Marco's offline input, thanks!) (patch based on top of 2fc54dd6dd9edb507cb3111e175071000189b81c)

```diff
diff --git a/Makefile.kind b/Makefile.kind
index 59f96a57e1ee..222d6e655b1a 100644
--- a/Makefile.kind
+++ b/Makefile.kind
@@ -92,11 +92,35 @@ kind-clustermesh-images: kind-clustermesh-ready kind-build-clustermesh-apiserver
 .PHONY: kind-connect-clustermesh ## Connect the ClusterMesh clusters.
 kind-connect-clustermesh: check_deps kind-clustermesh-ready
 	@echo "  CONNECT the two clusters"
-	$(CILIUM_CLI) clustermesh connect --context kind-clustermesh1 --destination-context kind-clustermesh2
-	$(CILIUM_CLI) clustermesh status --context kind-clustermesh1 --wait
-	$(CILIUM_CLI) clustermesh status --context kind-clustermesh2 --wait
 
-ENABLE_KVSTOREMESH ?= true
+	helm -n kube-system upgrade cilium install/kubernetes/cilium \
+		--kube-context kind-clustermesh1 \
+		--reuse-values \
+		--set clustermesh.config.enabled=true \
+		--set clustermesh.config.clusters[0].name=clustermesh2 \
+		--set clustermesh.config.clusters[0].ips[0]="$$(kubectl \
+			--context kind-clustermesh2 get nodes clustermesh2-worker -o wide --no-headers \
+			| awk '{ print $$6 }')" \
+		--set clustermesh.config.clusters[0].port=30002
+
+	@### Waiting here prevents the two clusters from discovering each other at the
+	@### same time. Comment this line to "fix" the issue.
+	-$(CILIUM_CLI) clustermesh status --context kind-clustermesh1 --wait --wait-duration 2m
+
+	helm -n kube-system upgrade cilium install/kubernetes/cilium \
+		--kube-context kind-clustermesh2 \
+		--reuse-values \
+		--set clustermesh.config.enabled=true \
+		--set clustermesh.config.clusters[0].name=clustermesh1 \
+		--set clustermesh.config.clusters[0].ips[0]="$$(kubectl \
+			--context kind-clustermesh1 get nodes clustermesh1-worker -o wide --no-headers \
+			| awk '{ print $$6 }')" \
+		--set clustermesh.config.clusters[0].port=30001
+
+	$(CILIUM_CLI) clustermesh status --context kind-clustermesh1 --wait --wait-duration 5m
+	$(CILIUM_CLI) clustermesh status --context kind-clustermesh2 --wait --wait-duration 1m
+
+ENABLE_KVSTOREMESH ?= false
 $(eval $(call KIND_ENV,kind-install-cilium-clustermesh))
 kind-install-cilium-clustermesh: check_deps kind-clustermesh-ready ## Install a local Cilium version into the clustermesh clusters and enable clustermesh.
 	@echo "  INSTALL cilium on clustermesh1 cluster"
@@ -107,6 +131,13 @@ kind-install-cilium-clustermesh: check_deps kind-clustermesh-ready ## Install a
 		--set=image.override=$(LOCAL_AGENT_IMAGE) \
 		--set=operator.image.override=$(LOCAL_OPERATOR_IMAGE) \
 		--set=clustermesh.apiserver.image.override=$(LOCAL_CLUSTERMESH_IMAGE) \
+		--set=devices=eth0 \
+		--set=hostFirewall.enabled="true" \
+		--set=kubeProxyReplacement="true" \
+		--set=encryption.enabled="true" \
+		--set=encryption.type=wireguard \
+		--set=clustermesh.apiserver.service.type=NodePort \
+		--set=clustermesh.apiserver.service.nodePort="30001" \
 		--set=clustermesh.apiserver.kvstoremesh.enabled=$(ENABLE_KVSTOREMESH)
 
 	@echo "  INSTALL cilium on clustermesh2 cluster"
@@ -119,6 +150,13 @@ kind-install-cilium-clustermesh: check_deps kind-clustermesh-ready ## Install a
 		--set=image.override=$(LOCAL_AGENT_IMAGE) \
 		--set=operator.image.override=$(LOCAL_OPERATOR_IMAGE) \
 		--set=clustermesh.apiserver.image.override=$(LOCAL_CLUSTERMESH_IMAGE) \
+		--set=devices=eth0 \
+		--set=hostFirewall.enabled="true" \
+		--set=kubeProxyReplacement="true" \
+		--set=encryption.enabled="true" \
+		--set=encryption.type=wireguard \
+		--set=clustermesh.apiserver.service.type=NodePort \
+		--set=clustermesh.apiserver.service.nodePort="30002" \
 		--set=clustermesh.apiserver.kvstoremesh.enabled=$(ENABLE_KVSTOREMESH)
 
 	$(MAKE) kind-connect-clustermesh
```

Then:

```console
$ make kind-clustermesh
$ make kind-clustermesh-images
$ make kind-install-cilium-clustermesh
```

And I get:

```console
$ cilium clustermesh status           
⚠️  Service type NodePort detected! Service may fail when nodes are removed from the cluster!
✅ Service "clustermesh-apiserver" of type "NodePort" found
✅ Cluster access information is available:
  - 172.18.0.3:30002
✅ Deployment clustermesh-apiserver is ready
ℹ️  KVStoreMesh is disabled

⚠️  2/2 nodes are not connected to all clusters [min:0 / avg:0.0 / max:0]

🔌 Cluster Connections:
  - clustermesh1: 2/2 configured, 0/2 connected

🔀 Global services: [ min:0 / avg:0.0 / max:0 ]

❌ 2 Errors:
  ❌ cilium-56w5z is not connected to cluster clustermesh1: Waiting for initial connection to be established
     💡 Run 'kubectl exec -it -n kube-system cilium-56w5z -c cilium-agent -- cilium-dbg troubleshoot clustermesh clustermesh1' to investigate the cause
  ❌ cilium-74b6k is not connected to cluster clustermesh1: Waiting for initial connection to be established
     💡 Run 'kubectl exec -it -n kube-system cilium-74b6k -c cilium-agent -- cilium-dbg troubleshoot clustermesh clustermesh1' to investigate the cause

$ kubectl exec --context kind-clustermesh2 -it -n kube-system cilium-56w5z -c cilium-agent -- cilium-dbg troubleshoot clustermesh clustermesh1
Found 1 remote cluster configurations
Troubleshooting filtered subset of clusters: clustermesh1

Remote cluster "clustermesh1":
📄 Configuration path: /var/lib/cilium/clustermesh/clustermesh1

🔌 Endpoints:
   - https://clustermesh1.mesh.cilium.io:30001
     ✅ Hostname resolved to: 172.18.0.5
     ❌ Cannot establish TCP connection to clustermesh1.mesh.cilium.io:30001: dial tcp 172.18.0.5:30001: i/o timeout
[...]
```

**Comment by qmonnet** [comment]
I have a PR to at least improve the docs and do some prevention in the Helm validation about this issue. [Marco provided feedback](https://github.com/cilium/cilium/pull/33390#pullrequestreview-2142035872) that I think is relevant to track here:

> [...] the very same issue happens with WireGuard node to node encryption enabled (regardless of whether host firewall is enabled).

Also,

> I managed to reproduce a sort of similar issue even with KPR disabled, if kvstoremesh is enabled (i.e., traffic is pod to nodeport, rather than node to nodeport). My guess is that the latter case is instead handled by [this logic](https://github.com/cilium/cilium/blob/43642e5cda6eeb8c7ab7af9d64579ce725501e85/bpf/bpf_lxc.c#L1209-L1211), which forwards the nodeport reply to the stack, and then back via the native device.
>
> Let's consider a scenario in which cluster A connected to cluster B, but not vice versa (e.g., commenting out the last step from your patch). The initial connection from kvstoremesh on A to the clustermesh-apiserver on B works because neither hosting agents knows about the nodes in the other cluster. However, after the initial connection, A learns about the nodes in B, and subsequent connections to the clustermesh-apiserver on B will go through the tunnel, and get dropped on receive side due to the missing wireguard keys. 
>
> This can be verified running `kubectl exec -t -n kube-system deploy/clustermesh-apiserver -c kvstoremesh -- clustermesh-apiserver kvstoremesh-dbg troubleshoot` on A, which fails, while `...  kvstoremesh-dbg status` reports success.
>
> Although the situation can converge if B connects back to A before that the initial TCP connection gets closed, this is still risky.

**Comment by giorio94** [comment]
Thanks!

> [...] the very same issue happens with WireGuard node to node encryption enabled (regardless of whether host firewall is enabled).

Linking https://github.com/cilium/cilium/issues/29872 as well, which looks related. IIRC, node to node encryption is disabled by default on control plane nodes, hence I'd expect it to probably work as long as the clustermesh-apiserver is forced to be scheduled on control-plane nodes only (although I haven't tested that). But I'd not go into that level of detail in the docs, as still potentially fragile (especially considering that node to node encrytion is still beta). The usage of a LB service looks way safer to me in this context.

**Comment by giorio94** [comment]
I've been experimenting exposing the clustermesh-apiserver using a LoadBalancer service, and managed to reproduce the same issue in that case as well. TL;DR; the problem is again asymmetric routing, with forward packets being forwarded via the native device, and replies via the tunnel. This underlying issue reproduces for cross-cluster traffic when both KPR and host firewall are enabled, also after fully establishing the clustermesh configuration. Still, it causes again the most visible issues during the initial connection phase if wireguard is enabled as well, due to replies being then dropped. Differently, it does not reproduce for intra-cluster traffic, because LoadBalancing appears to be always performed at the source (regardless of the KPR setting.

The issue has been reproduced on Kind using a slightly modified version of the Quentin's patch above, configuring the LB service and removing the `$(MAKE) kind-connect-clustermesh` step from the `kind-install-cilium-clustermesh` target, to execute that independently. 

I've used MetalLB (operating in L2 mode) as a LB solution (although I would expect similar results using the equivalent Cilium feature). The key aspect to reproduce this, though, is that the LB must not terminate the traffic, as that would otherwise hide the source address (which needs to match that of a node).

After running `kind-install-cilium-clustermesh`  to install Cilium, I've installed MetalLB in both clusters:

```
kubectl apply -f https://raw.githubusercontent.com/metallb/metallb/v0.14.5/config/manifests/metallb-native.yaml
```

And then configured it applying:

```yaml
apiVersion: metallb.io/v1beta1
kind: IPAddressPool
metadata:
  name: pool
  namespace: metallb-system
spec:
  addresses:
  - 172.19.0.16/28   # Changed to 172.19.0.32/28 in the second cluster
---
apiVersion: metallb.io/v1beta1
kind: L2Advertisement
metadata:
  name: adv
  namespace: metallb-system
```

And finally run `make kind-connect-clustermesh`

-----------------

Full results, using a separate service for the sake of convenience.
* LB address/port (cluster 1): 172.19.0.17:80
* Target pod address/pod (cluster 1): 10.1.1.18.9898
* CiliumInternalIP of the intermediate node (cluster1): 10.1.0.200
* Source node IP address (cluster 2): 172.19.0.5  (the traffic was actually originated from a pod hosted on that node, but it doesn't matter as it get masqueraded being the target external).


#### KPR: disabled, ExternalTrafficPolicy: Local

:white_check_mark: Traffic is symmetric, as both the request and the reply are forwarded via the native device.

tcpdump capture on the target node:

```
08:47:38.614992 eth0  In  IP 172.19.0.5.48392 > 172.19.0.17.80: Flags [S], seq 4223059505, win 65170, options [mss 1330,sackOK,TS val 547150939 ecr 0,nop,wscale 7], length 0
08:47:38.615061 lxc5c42e200b618 Out IP 172.19.0.5.48392 > 10.1.1.18.9898: Flags [S], seq 4223059505, win 65170, options [mss 1330,sackOK,TS val 547150939 ecr 0,nop,wscale 7], length 0
08:47:38.615079 lxc5c42e200b618 In  IP 10.1.1.18.9898 > 172.19.0.5.48392: Flags [S.], seq 1254995253, ack 4223059506, win 64582, options [mss 1330,sackOK,TS val 1683241241 ecr 547150939,nop,wscale 7], length 0
08:47:38.615099 eth0  Out IP 172.19.0.17.80 > 172.19.0.5.48392: Flags [S.], seq 1254995253, ack 4223059506, win 64582, options [mss 1330,sackOK,TS val 1683241241 ecr 547150939,nop,wscale 7], length 0
```

#### KPR: disabled, ExternalTrafficPolicy: External

:white_check_mark: Traffic is symmetric, as both the request and the reply are forwarded via the native device up to the intermediate node, and via the tunnel from the intermediate to the target node.

tcpdump capture on the target node:

```
08:49:51.915753 cilium_vxlan P   IP 10.1.0.200.34102 > 10.1.1.18.9898: Flags [S], seq 1192140771, win 65170, options [mss 1330,sackOK,TS val 547284240 ecr 0,nop,wscale 7], length 0
08:49:51.915832 lxc5c42e200b618 Out IP 10.1.0.200.34102 > 10.1.1.18.9898: Flags [S], seq 1192140771, win 65170, options [mss 1330,sackOK,TS val 547284240 ecr 0,nop,wscale 7], length 0
08:49:51.915863 lxc5c42e200b618 In  IP 10.1.1.18.9898 > 10.1.0.200.34102: Flags [S.], seq 71109577, ack 1192140772, win 64582, options [mss 1330,sackOK,TS val 1299876576 ecr 547284240,nop,wscale 7], length 0
08:49:51.915903 cilium_vxlan Out IP 10.1.1.18.9898 > 10.1.0.200.34102: Flags [S.], seq 71109577, ack 1192140772, win 64582, options [mss 1330,sackOK,TS val 1299876576 ecr 547284240,nop,wscale 7], length 0
```

tcpdump capture on the intermediate node:

```
08:49:51.915479 eth0  In  IP 172.19.0.5.34102 > 172.19.0.17.80: Flags [S], seq 1192140771, win 65170, options [mss 1330,sackOK,TS val 547284240 ecr 0,nop,wscale 7], length 0
08:49:51.915532 cilium_vxlan Out IP 10.1.0.200.34102 > 10.1.1.18.9898: Flags [S], seq 1192140771, win 65170, options [mss 1330,sackOK,TS val 547284240 ecr 0,nop,wscale 7], length 0
08:49:51.916120 cilium_vxlan P   IP 10.1.1.18.9898 > 10.1.0.200.34102: Flags [S.], seq 71109577, ack 1192140772, win 64582, options [mss 1330,sackOK,TS val 1299876576 ecr 547284240,nop,wscale 7], length 0
08:49:51.916173 cilium_net Out IP 10.1.1.18.9898 > 10.1.0.200.34102: Flags [S.], seq 71109577, ack 1192140772, win 64582, options [mss 1330,sackOK,TS val 1299876576 ecr 547284240,nop,wscale 7], length 0
08:49:51.916176 cilium_host In  IP 10.1.1.18.9898 > 10.1.0.200.34102: Flags [S.], seq 71109577, ack 1192140772, win 64582, options [mss 1330,sackOK,TS val 1299876576 ecr 547284240,nop,wscale 7], length 0
08:49:51.916203 eth0  Out IP 172.19.0.17.80 > 172.19.0.5.34102: Flags [S.], seq 71109577, ack 1192140772, win 64582, options [mss 1330,sackOK,TS val 1299876576 ecr 547284240,nop,wscale 7], length 0
```

#### KPR: enabled, ExternalTrafficPolicy: Local

:x: Traffic is asymmetric, with the request going through the native device, and the reply via the tunnel

tcpdump capture on the target node:

```
08:57:41.150340 eth0  In  IP 172.19.0.5.57680 > 172.19.0.17.80: Flags [S], seq 1792548445, win 65170, options [mss 1330,sackOK,TS val 547753475 ecr 0,nop,wscale 7], length 0
08:57:41.150402 lxc5c42e200b618 Out IP 172.19.0.5.57680 > 10.1.1.18.9898: Flags [S], seq 1792548445, win 65170, options [mss 1330,sackOK,TS val 547753475 ecr 0,nop,wscale 7], length 0
08:57:41.150421 lxc5c42e200b618 In  IP 10.1.1.18.9898 > 172.19.0.5.57680: Flags [S.], seq 3482259242, ack 1792548446, win 64582, options [mss 1330,sackOK,TS val 1683843776 ecr 547753475,nop,wscale 7], length 0
08:57:41.150438 cilium_vxlan Out IP 172.19.0.17.80 > 172.19.0.5.57680: Flags [S.], seq 3482259242, ack 1792548446, win 64582, options [mss 1330,sackOK,TS val 1683843776 ecr 547753475,nop,wscale 7], length 0
```

#### KPR: enabled, ExternalTrafficPolicy: Cluster

:x: Traffic is asymmetric, with the request to the intermediate node going through the native device, and the reply via the tunnel. Both the request and the reply are instead forwarded via the tunnel from the intermediate to the target node.

tcpdump capture on the target node :white_check_mark: :

```
08:55:54.990166 cilium_vxlan P   IP 10.1.0.200.50660 > 10.1.1.18.9898: Flags [S], seq 2475010080, win 65170, options [mss 1330,sackOK,TS val 547647314 ecr 0,nop,wscale 7], length 0
08:55:54.990258 lxc5c42e200b618 Out IP 10.1.0.200.50660 > 10.1.1.18.9898: Flags [S], seq 2475010080, win 65170, options [mss 1330,sackOK,TS val 547647314 ecr 0,nop,wscale 7], length 0
08:55:54.990291 lxc5c42e200b618 In  IP 10.1.1.18.9898 > 10.1.0.200.50660: Flags [S.], seq 162924386, ack 2475010081, win 64582, options [mss 1330,sackOK,TS val 1300239651 ecr 547647314,nop,wscale 7], length 0
08:55:54.990309 cilium_vxlan Out IP 10.1.1.18.9898 > 10.1.0.200.50660: Flags [S.], seq 162924386, ack 2475010081, win 64582, options [mss 1330,sackOK,TS val 1300239651 ecr 547647314,nop,wscale 7], length 0
```

tcpdump capture on the intermediate node:

```
08:55:54.989935 eth0  In  IP 172.19.0.5.50660 > 172.19.0.17.80: Flags [S], seq 2475010080, win 65170, options [mss 1330,sackOK,TS val 547647314 ecr 0,nop,wscale 7], length 0
08:55:54.989961 cilium_vxlan Out IP 10.1.0.200.50660 > 10.1.1.18.9898: Flags [S], seq 2475010080, win 65170, options [mss 1330,sackOK,TS val 547647314 ecr 0,nop,wscale 7], length 0
08:55:54.990476 cilium_vxlan P   IP 10.1.1.18.9898 > 10.1.0.200.50660: Flags [S.], seq 162924386, ack 2475010081, win 64582, options [mss 1330,sackOK,TS val 1300239651 ecr 547647314,nop,wscale 7], length 0
08:55:54.990547 cilium_vxlan Out IP 172.19.0.17.80 > 172.19.0.5.50660: Flags [S.], seq 162924386, ack 2475010081, win 64582, options [mss 1330,sackOK,TS val 1300239651 ecr 547647314,nop,wscale 7], length 0
```

-----------------

My understanding is that the issue could be addressed ensuring that replies are not forwarded through the tunnel when host firewall is enabled if the destination matches a NodeIP (but not a CiliumInternalIP). Indeed, in this case, the forward packet couldn't have come through the tunnel. Related: https://github.com/cilium/cilium/pull/30818 (for the KPR disabled case)

**Comment by cccsss01** [comment]
A fix for this would still be beneficial.

**Comment by turkmenkaan** [comment]
I'm experiencing the same issue. My understanding is that the asymmetrical routing escalates into a full-fledged connectivity issue due to the lack of WireGuard decryption key & allowed IPs on the destination cluster. Without WireGuard, this should not cause connectivity issues. Is that correct?

**Comment by giorio94** [comment]
> Without WireGuard, this should not cause connectivity issues. Is that correct?

Yeah, you may still have asymmetrical routing (one direction going through the tunnel, the other not), but it should not cause connectivity issues.

**Comment by turkmenkaan** [comment]
@giorio94 I've started looking at this at a deeper level to see if I can come up with a solution. I'm using your setup mentioned above that includes a LoadBalancer service (using CiliumLoadBalancerIPPool and CiliumL2Announcements instead of MetalLB). Do you remember if you used a bridge networking for kind nodes or did you somehow setup host networking. I'm trying to find the best way to announce the LB IPs to the host network.

**Comment by turkmenkaan** [comment]
I'm trying to wrap my head around how host-firewall contributes to this. I was able to reproduce the issue with kind clusters and looking into the network traffic. At a high level, the following happens when C1 is connected to C2 but not the other way around and a machine from C1 tries to send a packet to C2 VIP:

1. Cluster1 clustermesh-apiserver sends a SYN packet 
2. Cluster1 node sends it to cluster 2 LB externalIP without any overlay network
3. Cluster2 receives the SYN and attempts to send back a SYN, ACK
4. Cilium attempts to send the SYN, ACK over overlay network using cilium_vxlan interface
5. Cilium encrypts the traffic received at the cilium_vxlan interface and attempts to send it across over UDP
6. Packet loss as WireGuard is not initialized at cluster1 yet

To me it sounds like the issue is with WireGuard dropping the packets as it's not configured to receive packets from C2 yet. Can you elaborate on how host-firewall contributes to this flow?

**Comment by turkmenkaan** [comment]
I'm not exactly sure the issue requires the presence of hostFirewall. After disabling hostFirewall, I still was able to reproduce the issue.

**Comment by giorio94** [comment]
If I remember correctly, Host Firewall needs to be enabled to trigger this issue because it causes pod to node traffic to go through the tunnel, in turn being encrypted by Wireguard: https://github.com/cilium/cilium/blob/f17e6546abf199ad814a36a8ebf3a717f1cc5ce8/pkg/node/manager/manager.go#L578-L585

In case you are hitting this issue without Host Firewall enabled, then one possibility is that there has been a regression causing return traffic to go through the tunnel, even though the forward direction did not. It should be fairly easy to confirm in case.

**Comment by turkmenkaan** [comment]
After doing some more testing on this, I think you are right @giorio94. With hostFirewall disabled, this issue does not seem to happen. I don't believe it is a regression.

**Comment by hille721** [comment]
I'm running into the same issue with the ClusterMesh API server exposed via a LoadBalancer and without a host firewall, but with WireGuard Node encryption enabled.
Based on my understanding and comments in the thread, this combination would  also lead to the asymmetric routing problem described here.

My setup:
 * Cilium: 1.18
 * ClusterMesh: Exposed via LoadBalancer service
 * Datapath: VXLAN Tunneling
 * Encryption: WireGuard with Node encryption enabled

**Comment by eliottness** [comment]
Still encountering the same issue with cilium v1.19.1 with VXLAN + Wireguard node encryption, clustermesh-api via NodePort and HostFirewall. In the end sadly clustermesh was the one that was not indispensable
