### ISSUE TITLE
Invalid packet DROPPED to host loopback when other IP is present

### ISSUE THREAD

**Issue by margau** [cilium/cilium#30121]
### Is there an existing issue for this?

- [X] I have searched the existing issues

### What happened?

When there is more than a single IP configured to the host lo interface, (bgp) traffic between cilium and the host loopback  is dropped as invalid.
This happens when cilium is configured to contact bird on the host via BGP on ::1

### Cilium Version

Client: 1.14.4 48fe4293 2023-11-27T09:25:25+01:00 go version go1.20.11 linux/arm64
Daemon: 1.14.4 48fe4293 2023-11-27T09:25:25+01:00 go version go1.20.11 linux/arm64

### Kernel Version

Linux node02-vie01 6.1.0-17-arm64 #1 SMP Debian 6.1.69-1 (2023-12-30) aarch64 aarch64 aarch64 GNU/Linux

### Kubernetes Version

Client Version: version.Info{Major:"1", Minor:"27", GitVersion:"v1.27.3+k3s1", GitCommit:"fe9604cac119216e67f8bd5f14eb5608e3bcd3cf", GitTreeState:"clean", BuildDate:"2023-06-26T15:36:47Z", GoVersion:"go1.20.5", Compiler:"gc", Platform:"linux/arm64"}
Kustomize Version: v5.0.1
Server Version: version.Info{Major:"1", Minor:"27", GitVersion:"v1.27.3+k3s1", GitCommit:"fe9604cac119216e67f8bd5f14eb5608e3bcd3cf", GitTreeState:"clean", BuildDate:"2023-06-26T15:36:47Z", GoVersion:"go1.20.5", Compiler:"gc", Platform:"linux/arm64"}

### Relevant log output

```shell
Working node:
(hubble doesn't see the flow)

cilium bgp peers 
Local AS   Peer AS   Peer Address   Session       Uptime   Family         Received   Advertised
64512      [...]    ::1:179        established   7m5s     ipv4/unicast   0          0    
                                                           ipv6/unicast   0          2    
```

```
1: lo: <LOOPBACK,UP,LOWER_UP> mtu 65536 qdisc noqueue state UNKNOWN group default qlen 1000
    link/loopback 00:00:00:00:00:00 brd 00:00:00:00:00:00
    inet 127.0.0.1/8 scope host lo
       valid_lft forever preferred_lft forever
    inet6 ::1/128 scope host noprefixroute 
       valid_lft forever preferred_lft forever

```
Non-working node, same cluster:
```
hubble observe --to-port=179
Jan  7 14:26:25.409: [::1]:49981 (world) <> [::1]:179 (world) Invalid packet DROPPED (TCP Flags: SYN)
```

```
ip a
1: lo: <LOOPBACK,UP,LOWER_UP> mtu 65536 qdisc noqueue state UNKNOWN group default qlen 1000
    link/loopback 00:00:00:00:00:00 brd 00:00:00:00:00:00
    inet 127.0.0.1/8 scope host lo
       valid_lft forever preferred_lft forever
    inet6 2001:...:3000::2/128 scope global 
       valid_lft forever preferred_lft forever
    inet6 ::1/128 scope host noprefixroute 
       valid_lft forever preferred_lft forever
```

### Anything else?

As far as i can tell, this happens on aarch64 and amd64, with both BGP and Legacy Host Routing.

Use case for the public IP on lo is to have this routable via bird independently from up/down states of physical ethernet interfaces.

### Code of Conduct

- [X] I agree to follow this project's Code of Conduct

**Comment by margau** [comment]
Hi,
yes, moving the IP to dummy works:

```
1: lo: <LOOPBACK,UP,LOWER_UP> mtu 65536 qdisc noqueue state UNKNOWN group default qlen 1000
    link/loopback 00:00:00:00:00:00 brd 00:00:00:00:00:00
    inet 127.0.0.1/8 scope host lo
       valid_lft forever preferred_lft forever
    inet6 ::1/128 scope host noprefixroute 
       valid_lft forever preferred_lft forever
164: dummy0: <BROADCAST,NOARP,UP,LOWER_UP> mtu 1500 qdisc noqueue state UNKNOWN group default qlen 1000
    link/ether 7a:e1:4f:b5:d9:36 brd ff:ff:ff:ff:ff:ff
    inet6 2001:...:3000::2/128 scope global 
       valid_lft forever preferred_lft forever
```
BGP to ::1 is now established.

Is this the intended behavior? If yes, can we document this somewhere?

**Comment by YutaroHayakawa** [comment]
Oh, wait, sorry, I misunderstood your problem. Your expected behavior is establishing a connection with `::1`, then the expected behavior is the connection is established regardless of the address assigned to the `lo`. Can you provide us a sysdump (you can get it with `cilium sysdump` command) or at least Helm values you're using?

**Comment by margau** [comment]
Hi,
helm values (installed via k3s):
```
---
apiVersion: helm.cattle.io/v1
kind: HelmChart
metadata:
  name: cilium
  namespace: kube-system
spec:
  chart: cilium
  bootstrap: true
  repo: https://helm.cilium.io/
  version: v1.14.5
  valuesContent: |-
    debug:
      enabled: true
      verbose: policy
    kubeProxyReplacement: true
    enableIPv6Masquerade: false
    k8sServiceHost: ::1
    k8sServicePort: 6443
    ipv4:
      enabled: false
    ipv6:
      enabled: true
    routingMode: native
    bgpControlPlane:
      enabled: true
    ipv6-native-routing-cidr: 2001:...::/54
    ipam:
      mode: cluster-pool
      operator:
        clusterPoolIPv6PodCIDRList: "2001:...::/56"
        clusterPoolIPv6MaskSize: 64

---
apiVersion: "cilium.io/v2alpha1"
kind: CiliumBGPPeeringPolicy
metadata:
 name: cilium-default-bgp
spec: # CiliumBGPPeeringPolicySpec
 nodeSelector: {}
 virtualRouters: # []CiliumBGPVirtualRouter
 - localASN: 64512
   exportPodCIDR: true
   serviceSelector:
      matchExpressions:
         - {key: somekey, operator: NotIn, values: ['never-used-value']}
   neighbors: # []CiliumBGPNeighbor
    - peerAddress: '::1/128'
      peerASN: ...
---
apiVersion: "cilium.io/v2alpha1"
kind: CiliumLoadBalancerIPPool
metadata:
  name: "default-lb-pool"
spec:
  cidrs:
  - cidr: "2001[...]::/56"

```

**Comment by YutaroHayakawa** [comment]
Hmm, I don't see anything suspicious in your configuration. Which device is the rejected packet coming from? In general, this is local-to-local communication, so no eBPF TC program should be involved, but you are seeing the Hubble flow log, so that means it is coming from or going to some network device, which is weird.

Also, I can see the identity of the `::1` in your Hubble flow is `world`, which should be `host` in theory. That's also interesting.

**Comment by margau** [comment]
Everything is going via Loopback (Cilium to bird on the host).

tcpdump from the host POV of a now working connection:

```
~# tcpdump -i any -nve host ::1 and port 179
tcpdump: data link type LINUX_SLL2
tcpdump: listening on any, link-type LINUX_SLL2 (Linux cooked v2), snapshot length 262144 bytes
22:09:23.282968 lo    In  ifindex 1 00:00:00:00:00:00 ethertype IPv6 (0x86dd), length 111: (flowlabel 0x84c77, hlim 1, next-header TCP (6) payload length: 51) ::1.39677 > ::1.179: Flags [P.], cksum 0x003b (incorrect -> 0x0d29), seq 1579448177:1579448196, ack 480398733, win 576, options [nop,nop,TS val 1744138388 ecr 1744127792], length 19: BGP
	Keepalive Message (4), length: 19
22:09:23.282987 lo    In  ifindex 1 00:00:00:00:00:00 ethertype IPv6 (0x86dd), length 92: (class 0xc0, flowlabel 0x7d0e4, hlim 2, next-header TCP (6) payload length: 32) ::1.179 > ::1.39677: Flags [.], cksum 0x0028 (incorrect -> 0xea09), ack 19, win 22, options [nop,nop,TS val 1744138388 ecr 1744138388], length 0
22:09:24.496018 lo    In  ifindex 1 00:00:00:00:00:00 ethertype IPv6 (0x86dd), length 111: (class 0xc0, flowlabel 0x7d0e4, hlim 2, next-header TCP (6) payload length: 51) ::1.179 > ::1.39677: Flags [P.], cksum 0x003b (incorrect -> 0xe11e), seq 1:20, ack 19, win 22, options [nop,nop,TS val 1744139601 ecr 1744138388], length 19: BGP
	Keepalive Message (4), length: 19
22:09:24.496043 lo    In  ifindex 1 00:00:00:00:00:00 ethertype IPv6 (0x86dd), length 92: (flowlabel 0x84c77, hlim 1, next-header TCP (6) payload length: 32) ::1.39677 > ::1.179: Flags [.], cksum 0x0028 (incorrect -> 0xde52), ack 20, win 576, options [nop,nop,TS val 1744139601 ecr 1744139601], length 0
```

According to tcpdump, the checksum is still incorrect though.

**Comment by YutaroHayakawa** [comment]
Well, BGP is sending keepalive in the above tcpdump. So, I guess the BGP session is established? Did you take the tcpdump for non-working setting?

**Comment by margau** [comment]
Hi, yes, for the Moment everything is working with the workaround via dummy Interface.
I can try to reproduce the defect config, but this will take some time.

**Comment by margau** [comment]
Probably still open, need to reproduce it again.
