### ISSUE TITLE
redirect local policy fails to work

### ISSUE THREAD

**Issue by weizhoublue** [cilium/cilium#17791]
environment :
(1)linux:
```
# uname -a
Linux 172-110-185-60 5.9.8-1.el8.elrepo.x86_64 #1 SMP Wed Nov 11 09:27:50 EST 2020 x86_64 x86_64 x86_64 GNU/Linux
```
(2) cilium 1.10.4
(3) kubernetes. 1.22

I failed to test CiliumLocalRedirectPolicy

steps
(1) I create an backend pod with label "app: back"  ,  and  front end pod , they are on a same node
```
# kubectl get pod -o wide
NAME                                    READY   STATUS      RESTARTS        AGE    IP             NODE             NOMINATED NODE   READINESS GATES
back-pod                                1/1     Running     1 (11m ago)     20m    172.60.1.103   172-110-185-65   <none>           <none>
nginx-172-110-185-65-586b69f46-p8pf7    1/1     Running     0             8m27s   172.60.1.243   172-110-185-65   <none>           <none>
```
```
# kubectl get configmap -n kube-system cilium-config -o yaml | grep redirect
  enable-local-redirect-policy: "true"
```
```
# kubectl get pod -o yaml back-pod
apiVersion: v1
kind: Pod
metadata:
  annotations:
    kubectl.kubernetes.io/last-applied-configuration: |
      {"apiVersion":"v1","kind":"Pod","metadata":{"annotations":{},"labels":{"app":"back"},"name":"back-pod","namespace":"default"},"spec":{"containers":[{"image":"weizhoulan/nginx:latest","name":"back-pod","ports":[{"containerPort":80,"name":"tcp","protocol":"TCP"}]}]}}
  creationTimestamp: "2021-11-05T07:59:48Z"
  labels:
    app: back
  name: back-pod
  namespace: default
  resourceVersion: "5998523"
  uid: 718965d8-dc99-4ccc-ba79-a288a830623a
spec:
  containers:
  - image: weizhoulan/nginx:latest
    imagePullPolicy: Always
    name: back-pod
    ports:
    - containerPort: 80
      name: tcp
      protocol: TCP
    resources: {}
    terminationMessagePath: /dev/termination-log
    terminationMessagePolicy: File
    volumeMounts:
    - mountPath: /var/run/secrets/kubernetes.io/serviceaccount
      name: kube-api-access-pjrwx
      readOnly: true
  dnsPolicy: ClusterFirst
  enableServiceLinks: true
  nodeName: 172-110-185-65
  preemptionPolicy: PreemptLowerPriority
  priority: 0
  restartPolicy: Always
  schedulerName: default-scheduler
  securityContext: {}
  serviceAccount: default
  serviceAccountName: default
  terminationGracePeriodSeconds: 30
  tolerations:
  - effect: NoExecute
    key: node.kubernetes.io/not-ready
    operator: Exists
    tolerationSeconds: 300
  - effect: NoExecute
    key: node.kubernetes.io/unreachable
    operator: Exists
    tolerationSeconds: 300
  volumes:
  - name: kube-api-access-pjrwx
    projected:
      defaultMode: 420
      sources:
      - serviceAccountToken:
          expirationSeconds: 3607
          path: token
      - configMap:
          items:
          - key: ca.crt
            path: ca.crt
          name: kube-root-ca.crt
      - downwardAPI:
          items:
          - fieldRef:
              apiVersion: v1
              fieldPath: metadata.namespace
            path: namespace

```
```
root@172-110-185-65:/home/cilium# cilium status --verbose
KVStore:                Ok   Disabled
Kubernetes:             Ok   1.22 (v1.22.1) [linux/amd64]
Kubernetes APIs:        ["cilium/v2::CiliumClusterwideNetworkPolicy", "cilium/v2::CiliumEgressNATPolicy", "cilium/v2::CiliumEndpoint", "cilium/v2::CiliumLocalRedirectPolicy", "cilium/v2::CiliumNetworkPolicy", "cilium/v2::CiliumNode", "core/v1::Endpoint", "core/v1::Namespace", "core/v1::Node", "core/v1::Pods", "core/v1::Service", "networking.k8s.io/v1::NetworkPolicy"]
KubeProxyReplacement:   Probe   [ens192 172.110.185.65 fd00:110::172:110:185:65 (Direct Routing), ens224 10.6.185.65 fd00:6::10:6:185:65]
Cilium:                 Ok   1.10.4 (v1.10.4-2a46fd6)
NodeMonitor:            Listening for events on 8 CPUs with 64x4096 of shared memory
Cilium health daemon:   Ok
IPAM:                   IPv4: 13/254 allocated from 172.60.1.0/24, IPv6: 13/18446744073709551614 allocated from fc06:1:0:1::/64
Allocated addresses:
  172.60.1.103 (default/back-pod)
  172.60.1.125 (default/rebel-base-78c4d6b8d7-wrzx8)
  172.60.1.138 (default/x-wing-7c6bfcd75-mkp28)
  172.60.1.144 (default/nginx65-776cd65df9-vzbtg)
  172.60.1.174 (router)
  172.60.1.224 (kube-system/hubble-ui-788fc6ffb7-4tjxv)
  172.60.1.241 (cilium-test/echo-other-node-f4d46f75b-sdbgd)
  172.60.1.243 (default/nginx-172-110-185-65-586b69f46-p8pf7)
  172.60.1.249 (kube-system/clustermesh-apiserver-85546dcccc-h6z88)
  172.60.1.39 (kube-system/coredns-78fcd69978-94t2b)
  172.60.1.5 (health)
  172.60.1.62 (default/x-wing-7c6bfcd75-8rzms)
  172.60.1.97 (kube-system/coredns-78fcd69978-d77q5)
  fc06:1:0:1::1e07 (health)
  fc06:1:0:1::46b (default/x-wing-7c6bfcd75-mkp28)
  fc06:1:0:1::5c22 (default/nginx65-776cd65df9-vzbtg)
  fc06:1:0:1::8c3d (default/rebel-base-78c4d6b8d7-wrzx8)
  fc06:1:0:1::9448 (kube-system/coredns-78fcd69978-94t2b)
  fc06:1:0:1::9bc2 (kube-system/clustermesh-apiserver-85546dcccc-h6z88)
  fc06:1:0:1::b05f (default/back-pod)
  fc06:1:0:1::b3e1 (default/nginx-172-110-185-65-586b69f46-p8pf7)
  fc06:1:0:1::b3f5 (cilium-test/echo-other-node-f4d46f75b-sdbgd)
  fc06:1:0:1::b4fb (router)
  fc06:1:0:1::cc41 (kube-system/coredns-78fcd69978-d77q5)
  fc06:1:0:1::eba0 (default/x-wing-7c6bfcd75-8rzms)
  fc06:1:0:1::fb52 (kube-system/hubble-ui-788fc6ffb7-4tjxv)
ClusterMesh:   1/1 clusters ready, 8 global-services
   nanjing: ready, 2 nodes, 8 identities, 8 services, 0 failures (last: never)
   └  etcd: 1/1 connected, lease-ID=7c027c6489b083f5, lock lease-ID=7c027c6489b083f7, has-quorum=true: https://nanjing.mesh.cilium.io:30687 - 3.4.13 (Leader)
BandwidthManager:       EDT with BPF   [ens192, ens224]
Host Routing:           Legacy
Masquerading:           BPF (ip-masq-agent)   [ens192, ens224]   172.60.0.0/16 [IPv4: Enabled, IPv6: Enabled]
Clock Source for BPF:   ktime
Controller Status:      70/70 healthy
  Name                                                  Last success   Last error    Count   Message
  bpf-map-sync-cilium_ipcache                           8s ago         never         0       no error
  bpf-map-sync-cilium_throttle                          5s ago         never         0       no error
  cilium-health-ep                                      50s ago        7h1m55s ago   0       no error
  dns-garbage-collector-job                             3s ago         never         0       no error
  endpoint-1486-regeneration-recovery                   never          never         0       no error
  endpoint-1587-regeneration-recovery                   never          never         0       no error
  endpoint-161-regeneration-recovery                    never          never         0       no error
  endpoint-2099-regeneration-recovery                   never          never         0       no error
  endpoint-2136-regeneration-recovery                   never          never         0       no error
  endpoint-2379-regeneration-recovery                   never          never         0       no error
  endpoint-247-regeneration-recovery                    never          never         0       no error
  endpoint-3173-regeneration-recovery                   never          never         0       no error
  endpoint-3639-regeneration-recovery                   never          never         0       no error
  endpoint-430-regeneration-recovery                    never          never         0       no error
  endpoint-699-regeneration-recovery                    never          never         0       no error
  endpoint-829-regeneration-recovery                    never          never         0       no error
  endpoint-972-regeneration-recovery                    never          never         0       no error
  endpoint-gc                                           4m4s ago       never         0       no error
  ipcache-bpf-garbage-collection                        3m46s ago      never         0       no error
  k8s-heartbeat                                         17s ago        never         0       no error
  kvstore-etcd-lock-session-renew                       never          never         0       no error
  kvstore-etcd-session-renew                            never          never         0       no error
  kvstore-sync-store-cilium/state/nodes/v1/nanjing      46s ago        never         0       no error
  kvstore-sync-store-cilium/state/services/v1/nanjing   46s ago        never         0       no error
  mark-k8s-node-as-available                            7h3m27s ago    never         0       no error
  metricsmap-bpf-prom-sync                              4s ago         never         0       no error
  neighbor-table-refresh                                3m27s ago      never         0       no error
  remote-etcd-nanjing                                   7h3m47s ago    never         0       no error
  resolve-identity-1486                                 3m27s ago      never         0       no error
  resolve-identity-1587                                 1m55s ago      never         0       no error
  resolve-identity-161                                  1m34s ago      never         0       no error
  resolve-identity-2099                                 3m27s ago      never         0       no error
  resolve-identity-2136                                 3m27s ago      never         0       no error
  resolve-identity-2379                                 3m27s ago      never         0       no error
  resolve-identity-247                                  2m15s ago      never         0       no error
  resolve-identity-3173                                 2m14s ago      never         0       no error
  resolve-identity-3639                                 54s ago        never         0       no error
  resolve-identity-430                                  3m27s ago      never         0       no error
  resolve-identity-699                                  3m27s ago      never         0       no error
  resolve-identity-829                                  3m27s ago      never         0       no error
  resolve-identity-972                                  3m27s ago      never         0       no error
  sync-endpoints-and-host-ips                           27s ago        never         0       no error
  sync-policymap-1486                                   15s ago        never         0       no error
  sync-policymap-1587                                   53s ago        never         0       no error
  sync-policymap-161                                    33s ago        never         0       no error
  sync-policymap-2099                                   13s ago        never         0       no error
  sync-policymap-2136                                   14s ago        never         0       no error
  sync-policymap-2379                                   13s ago        never         0       no error
  sync-policymap-247                                    10s ago        never         0       no error
  sync-policymap-3173                                   10s ago        never         0       no error
  sync-policymap-3639                                   53s ago        never         0       no error
  sync-policymap-430                                    46s ago        never         0       no error
  sync-policymap-699                                    13s ago        never         0       no error
  sync-policymap-829                                    13s ago        never         0       no error
  sync-policymap-972                                    13s ago        never         0       no error
  sync-to-k8s-ciliumendpoint (1486)                     5s ago         never         0       no error
  sync-to-k8s-ciliumendpoint (1587)                     13s ago        never         0       no error
  sync-to-k8s-ciliumendpoint (161)                      12s ago        never         0       no error
  sync-to-k8s-ciliumendpoint (2099)                     5s ago         never         0       no error
  sync-to-k8s-ciliumendpoint (2136)                     4s ago         never         0       no error
  sync-to-k8s-ciliumendpoint (2379)                     5s ago         never         0       no error
  sync-to-k8s-ciliumendpoint (247)                      3s ago         never         0       no error
  sync-to-k8s-ciliumendpoint (3173)                     12s ago        never         0       no error
  sync-to-k8s-ciliumendpoint (3639)                     12s ago        never         0       no error
  sync-to-k8s-ciliumendpoint (430)                      6s ago         never         0       no error
  sync-to-k8s-ciliumendpoint (699)                      5s ago         never         0       no error
  sync-to-k8s-ciliumendpoint (829)                      5s ago         never         0       no error
  sync-to-k8s-ciliumendpoint (972)                      5s ago         never         0       no error
  template-dir-watcher                                  never          never         0       no error
  update-k8s-node-annotations                           7h4m2s ago     never         0       no error
Proxy Status:   OK, ip 172.60.1.174, 0 redirects active on ports 10000-20000
Hubble:         Ok   Current/Max Flows: 65535/65535 (100.00%), Flows/s: 22.24   Metrics: Ok
KubeProxyReplacement Details:
  Status:                Probe
  Socket LB Protocols:   TCP, UDP
  Devices:               ens192 172.110.185.65 fd00:110::172:110:185:65 (Direct Routing), ens224 10.6.185.65 fd00:6::10:6:185:65
  Mode:                  SNAT
  Backend Selection:     Random
  Session Affinity:      Enabled
  XDP Acceleration:      Disabled
  Services:
  - ClusterIP:      Enabled
  - NodePort:       Enabled (Range: 30000-32767)
  - LoadBalancer:   Enabled
  - externalIPs:    Enabled
  - HostPort:       Enabled
BPF Maps:   dynamic sizing: on (ratio: 0.002500)
  Name                          Size
  Non-TCP connection tracking   73630
  TCP connection tracking       147261
  Endpoint policy               65535
  Events                        8
  IP cache                      512000
  IP masquerading agent         16384
  IPv4 fragmentation            8192
  IPv4 service                  65536
  IPv6 service                  65536
  IPv4 service backend          65536
  IPv6 service backend          65536
  IPv4 service reverse NAT      65536
  IPv6 service reverse NAT      65536
  Metrics                       1024
  NAT                           147261
  Neighbor table                147261
  Global policy                 16384
  Per endpoint policy           65536
  Session affinity              65536
  Signal                        8
  Sockmap                       65535
  Sock reverse NAT              73630
  Tunnel                        65536
Encryption:                             Disabled
Cluster health:                         4/4 reachable    (2021-11-05T15:16:57Z)
  Name                                  IP               Node        Endpoints
  shanghai/172-110-185-65 (localhost)   172.110.185.65   reachable   reachable
  nanjing/172-111-185-70                172.111.185.70   reachable   reachable
  nanjing/172-111-185-75                172.111.185.75   reachable   reachable
  shanghai/172-110-185-60               172.110.185.60   reachable   reachable
root@172-110-185-65:/home/cilium#
```
（2）in frontend pod ,  test backend service with pod ip , and it works well
in frontend pod ,  test cluster ip of  other service   , and it works well
```
# kubectl exec nginx-172-110-185-65-586b69f46-p8pf7 curl 172.60.1.103:80
kubectl exec [POD] [COMMAND] is DEPRECATED and will be removed in a future version. Use kubectl exec [POD] -- [COMMAND] instead.
<!DOCTYPE html>
<html>
<head>
<title>Welcome to nginx!</title>
<style>
html { color-scheme: light dark; }
body { width: 35em; margin: 0 auto;
font-family: Tahoma, Verdana, Arial, sans-serif; }
</style>
</head>
<body>
<h1>Welcome to nginx!</h1>
<p>If you see this page, the nginx web server is successfully installed and
working. Further configuration is required.</p>

<p>For online documentation and support please refer to
<a href="http://nginx.org/">nginx.org</a>.<br/>
Commercial support is available at
<a href="http://nginx.com/">nginx.com</a>.</p>

<p><em>Thank you for using nginx.</em></p>
</body>
</html>
  % Total    % Received % Xferd  Average Speed   Time    Time     Time  Current
                                 Dload  Upload   Total   Spent    Left  Speed
100   615  100   615    0     0   200k      0 --:--:-- --:--:-- --:--:--  600k
```

```
# kubectl get service -o wide

NAME                      TYPE           CLUSTER-IP       EXTERNAL-IP     PORT(S)                     AGE    SELECTOR
kubernetes                ClusterIP      172.61.0.1       <none>          443/TCP                     38d    <none>
nginx-172-110-185-60-v4   ClusterIP      172.61.122.223   <none>          80/TCP,5201/TCP,12865/TCP   151m   app=nginx-172-110-185-60
nginx-172-110-185-65-v4   ClusterIP      172.61.244.87    <none>          80/TCP,5201/TCP,12865/TCP   119m   app=nginx-172-110-185-65
nginx60                   LoadBalancer   172.61.151.83    172.110.1.102   80:31876/TCP                37d    app=nginx60
nginx65                   LoadBalancer   172.61.13.187    172.110.1.100   80:30020/TCP                38d    app=nginx65
rebel-base                ClusterIP      172.61.82.52     <none>          80/TCP                      27d    name=rebel-base
[root@172-110-185-60 ~]#
[root@172-110-185-60 ~]#
[root@172-110-185-60 ~]# kubectl exec nginx-172-110-185-65-586b69f46-p8pf7 curl 172.61.151.83
kubectl exec [POD] [COMMAND] is DEPRECATED and will be removed in a future version. Use kubectl exec [POD] -- [COMMAND] instead.
  % Total    % Received % Xferd  Average Speed   Time    Time     Time  Current
                                 Dload  Upload   Total   Spent    Left  Speed
100   615  100   615    0     0   200k      0 --:--:-- --:--:-- --:--:--  300k
<!DOCTYPE html>
<html>
<head>
<title>Welcome to nginx!</title>
<style>
html { color-scheme: light dark; }
body { width: 35em; margin: 0 auto;
font-family: Tahoma, Verdana, Arial, sans-serif; }
</style>
</head>
<body>
<h1>Welcome to nginx!</h1>
<p>If you see this page, the nginx web server is successfully installed and
working. Further configuration is required.</p>

<p>For online documentation and support please refer to
<a href="http://nginx.org/">nginx.org</a>.<br/>
Commercial support is available at
<a href="http://nginx.com/">nginx.com</a>.</p>

<p><em>Thank you for using nginx.</em></p>
</body>
</html>
```

(3) apply CiliumLocalRedirectPolicy , redirect 169.254.169.254:8080 to backendEndpoint:80
```
# kubectl get ciliumlocalredirectpolicies.cilium.io -o yaml
apiVersion: v1
items:
- apiVersion: cilium.io/v2
  kind: CiliumLocalRedirectPolicy
  metadata:
    annotations:
      kubectl.kubernetes.io/last-applied-configuration: |
        {"apiVersion":"cilium.io/v2","kind":"CiliumLocalRedirectPolicy","metadata":{"annotations":{},"name":"lrp-addr","namespace":"default"},"spec":{"redirectBackend":{"localEndpointSelector":{"matchLabels":{"app":"back"}},"toPorts":[{"port":"80","protocol":"TCP"}]},"redirectFrontend":{"addressMatcher":{"ip":"169.254.169.254","toPorts":[{"port":"8080","protocol":"TCP"}]}}}}
    creationTimestamp: "2021-11-05T08:02:11Z"
    generation: 1
    name: lrp-addr
    namespace: default
    resourceVersion: "5996756"
    uid: ed2a9d9d-a50f-43cb-a17b-9cb6411c93f9
  spec:
    redirectBackend:
      localEndpointSelector:
        matchLabels:
          app: back
      toPorts:
      - port: "80"
        protocol: TCP
    redirectFrontend:
      addressMatcher:
        ip: 169.254.169.254
        toPorts:
        - port: "8080"
          protocol: TCP
kind: List
metadata:
  resourceVersion: ""
  selfLink: ""
```

（4）check the cilium service , and it is ok
```
# docker exec -it ffc25720a05d bash
root@172-110-185-65:/home/cilium# cilium service list 
38   169.254.169.254:8080   LocalRedirect   1 => 172.60.1.103:80
```

(5)  In the frontend pod , it failed to curl curl -I -s http://169.254.169.254:8080 
and tcpdump in the fontend pod , the outgoing packet show the destination is 169.254.169.254 ( I think of it should be backend endpoint ip who DNAT by cgroup ebpf ? )
and tcpdump in the backend pod, there is no any packets

I also kill the frontend pod and try again , it still failed

```
# kubectl exec -it nginx-172-110-185-65-586b69f46-2nldf bash
kubectl exec [POD] [COMMAND] is DEPRECATED and will be removed in a future version. Use kubectl exec [POD] -- [COMMAND] instead.
root@nginx-172-110-185-65-586b69f46-2nldf:/# tcpdump -i eth0 -nn -e
tcpdump: verbose output suppressed, use -v or -vv for full protocol decode
listening on eth0, link-type EN10MB (Ethernet), capture size 262144 bytes
08:24:27.751820 62:f6:4b:67:7d:41 > ee:9b:72:0e:f0:55, ethertype IPv4 (0x0800), length 74: 172.60.1.40.56884 > 169.254.169.254.8080: Flags [S], seq 2292150708, win 64860, options [mss 1410,sackOK,TS val 2287427338 ecr 0,nop,wscale 7], length 0
08:24:28.802776 62:f6:4b:67:7d:41 > ee:9b:72:0e:f0:55, ethertype IPv4 (0x0800), length 74: 172.60.1.40.56884 > 169.254.169.254.8080: Flags [S], seq 2292150708, win 64860, options [mss 1410,sackOK,TS val 2287428389 ecr 0,nop,wscale 7], length 0
08:24:30.850797 62:f6:4b:67:7d:41 > ee:9b:72:0e:f0:55, ethertype IPv4 (0x0800), length 74: 172.60.1.40.56884 > 169.254.169.254.8080: Flags [S], seq 2292150708, win 64860, options [mss 1410,sackOK,TS val 2287430437 ecr 0,nop,wscale 7], length 0

```

```
# bpftool cgroup tree /var/run/cilium/cgroupv2
CgroupPath
ID       AttachType      AttachFlags     Name
/var/run/cilium/cgroupv2
1293     connect4
1289     connect6
1295     sendmsg4
1291     sendmsg6
1296     recvmsg4
1292     recvmsg6
```
```
# bpftool net
xdp:

tc:
ens192(2) clsact/ingress bpf_netdev_ens192.o:[from-netdev] id 1567
ens192(2) clsact/egress bpf_netdev_ens192.o:[to-netdev] id 1581
ens224(3) clsact/ingress bpf_netdev_ens224.o:[from-netdev] id 1595
ens224(3) clsact/egress bpf_netdev_ens224.o:[to-netdev] id 1609
cilium_net(7) clsact/ingress bpf_host_cilium_net.o:[to-host] id 1553
cilium_host(8) clsact/ingress bpf_host.o:[to-host] id 1506
cilium_host(8) clsact/egress bpf_host.o:[from-host] id 1520
cilium_vxlan(9) clsact/ingress bpf_overlay.o:[from-overlay] id 1267
cilium_vxlan(9) clsact/egress bpf_overlay.o:[to-overlay] id 1278
lxc841d871b2ce0(13) clsact/ingress bpf_lxc.o:[from-container] id 1299
lxcd5ffa3e731d6(15) clsact/ingress bpf_lxc.o:[from-container] id 1304
lxca618ad97c399(17) clsact/ingress bpf_lxc.o:[from-container] id 1297
lxc20a861a29cbd(19) clsact/ingress bpf_lxc.o:[from-container] id 1307
lxcfee06bf2562a(21) clsact/ingress bpf_lxc.o:[from-container] id 1306
lxc0f073e0e02b0(23) clsact/ingress bpf_lxc.o:[from-container] id 1302
lxc41df9eb08ab8(25) clsact/ingress bpf_lxc.o:[from-container] id 1327
lxcc81a39206ad2(47) clsact/ingress bpf_lxc.o:[from-container] id 1441
lxc7ee483132e97(49) clsact/ingress bpf_lxc.o:[from-container] id 1438
lxc_health(55) clsact/ingress bpf_lxc.o:[from-container] id 1524
lxcaf8c2655dabe(57) clsact/ingress bpf_lxc.o:[from-container] id 1623
lxc888b0e01cc31(59) clsact/ingress bpf_lxc.o:[from-container] id 1642

flow_dissector:

```

**Comment by aditighag** [comment]
Hi! 1) Can you run `cilium monitor --related-to <endpoint-id-frontend-pod>` while running the curl command? 2) Is there any server listening on port 8080 inside the frontend pod? You can check this by running `netstat -nlp | grep 8080`.

**Comment by vintikzzz** [comment]
@aanm Hi! 

Got the same problem switching to RLP, connection just hangs:
```
➜ kubectl get svc -A | grep torrent-web-cache
webtor          torrent-web-cache                                    ClusterIP   10.233.58.28    <none>        80/TCP                         9m9s
```
```
➜  kubectl exec -it -n kube-system cilium-sxrqz -- cilium service list | grep Local
74   10.233.29.86:80         LocalRedirect   1 => 10.233.80.186:8080
77   10.233.58.28:80         LocalRedirect   1 => 10.233.80.162:8080
```
```
➜  kubectl exec -it -n kube-system cilium-sxrqz -- cilium monitor | grep 10.233.58.28
-> stack flow 0xfdec2f99 , identity 9097->world state established ifindex 0 orig-ip 0.0.0.0: 10.233.80.186:50332 -> 10.233.58.28:80 tcp SYN
-> stack flow 0xeb226c02 , identity 9097->world state established ifindex 0 orig-ip 0.0.0.0: 10.233.80.186:48968 -> 10.233.58.28:80 tcp SYN
-> stack flow 0x28cbc645 , identity 9097->world state new ifindex 0 orig-ip 0.0.0.0: 10.233.80.186:52038 -> 10.233.58.28:80 tcp SYN
-> stack flow 0x472192e6 , identity 9097->world state established ifindex 0 orig-ip 0.0.0.0: 10.233.80.186:51752 -> 10.233.58.28:80 tcp SYN
-> stack flow 0x81a677a7 , identity 9097->world state established ifindex 0 orig-ip 0.0.0.0: 10.233.80.186:51768 -> 10.233.58.28:80 tcp SYN
-> stack flow 0x14b539bb , identity 9097->world state new ifindex 0 orig-ip 0.0.0.0: 10.233.80.186:52118 -> 10.233.58.28:80 tcp SYN
-> stack flow 0x71b545d8 , identity 9097->world state established ifindex 0 orig-ip 0.0.0.0: 10.233.80.186:49182 -> 10.233.58.28:80 tcp SYN
-> stack flow 0xcebc24b3 , identity 9097->world state established ifindex 0 orig-ip 0.0.0.0: 10.233.80.186:51670 -> 10.233.58.28:80 tcp SYN
-> stack flow 0x8d294edf , identity 9097->world state established ifindex 0 orig-ip 0.0.0.0: 10.233.80.186:52038 -> 10.233.58.28:80 tcp SYN
-> stack flow 0x6316d731 , identity 9097->world state established ifindex 0 orig-ip 0.0.0.0: 10.233.80.186:49272 -> 10.233.58.28:80 tcp SYN
-> stack flow 0xbe1b1dd5 , identity 9097->world state established ifindex 0 orig-ip 0.0.0.0: 10.233.80.186:49304 -> 10.233.58.28:80 tcp SYN
-> stack flow 0x61b12d20 , identity 9097->world state established ifindex 0 orig-ip 0.0.0.0: 10.233.80.186:51752 -> 10.233.58.28:80 tcp SYN
-> stack flow 0x3ba4e636 , identity 9097->world state established ifindex 0 orig-ip 0.0.0.0: 10.233.80.186:51768 -> 10.233.58.28:80 tcp SYN
-> stack flow 0x3faf3a68 , identity 9097->world state new ifindex 0 orig-ip 0.0.0.0: 10.233.80.186:52490 -> 10.233.58.28:80 tcp SYN
-> stack flow 0xc8b3541d , identity 9097->world state established ifindex 0 orig-ip 0.0.0.0: 10.233.80.186:52118 -> 10.233.58.28:80 tcp SYN
-> stack flow 0x1600cc2d , identity 9097->world state established ifindex 0 orig-ip 0.0.0.0: 10.233.80.186:50920 -> 10.233.58.28:80 tcp SYN
-> stack flow 0xed859d2 , identity 9097->world state established ifindex 0 orig-ip 0.0.0.0: 10.233.80.186:49524 -> 10.233.58.28:80 tcp SYN
-> stack flow 0xa52037fa , identity 9097->world state established ifindex 0 orig-ip 0.0.0.0: 10.233.80.186:51070 -> 10.233.58.28:80 tcp SYN
-> stack flow 0x75bd442c , identity 9097->world state established ifindex 0 orig-ip 0.0.0.0: 10.233.80.186:52038 -> 10.233.58.28:80 tcp SYN
-> stack flow 0x8abd88ca , identity 9097->world state established ifindex 0 orig-ip 0.0.0.0: 10.233.80.186:52490 -> 10.233.58.28:80 tcp SYN
-> stack flow 0x953fa82 , identity 9097->world state established ifindex 0 orig-ip 0.0.0.0: 10.233.80.186:52118 -> 10.233.58.28:80 tcp SYN
```

My cilium status:
```
➜ kubectl exec -it -n kube-system cilium-sxrqz -- cilium status --verbose
KVStore:                Ok   etcd: 3/3 connected, lease-ID=733f7ea6317a7ef8, lock lease-ID=733f7ea6317a7efb, has-quorum=true: https://194.163.174.114:2379 - 3.5.1 (Leader); https://194.163.174.112:2379 - 3.5.1; https://194.163.174.113:2379 - 3.5.1
Kubernetes:             Ok   1.23 (v1.23.2) [linux/amd64]
Kubernetes APIs:        ["cilium/v2::CiliumClusterwideNetworkPolicy", "cilium/v2::CiliumLocalRedirectPolicy", "cilium/v2::CiliumNetworkPolicy", "core/v1::Namespace", "core/v1::Node", "core/v1::Pods", "core/v1::Service", "discovery/v1::EndpointSlice", "networking.k8s.io/v1::NetworkPolicy"]
KubeProxyReplacement:   Strict   [enp5s0 116.202.216.184 (Direct Routing)]
Host firewall:          Disabled
Cilium:                 Ok   1.11.1 (v1.11.1-76d34db)
NodeMonitor:            Listening for events on 32 CPUs with 64x4096 of shared memory
Cilium health daemon:   Ok
IPAM:                   IPv4: 22/254 allocated from 10.233.80.0/24,
Allocated addresses:
  10.233.80.100 (nginx-ingress/nginx-ingress-ingress-nginx-controller-4dblr)
  10.233.80.110 (webtor/download-progress-6cn28)
  10.233.80.152 (clickhouse/chi-webtor-webtor-0-0-0)
  10.233.80.162 (webtor/torrent-web-cache-9twqs)
  10.233.80.184 (local-path-provisioner/local-path-provisioner-956b8448c-5wcsj)
  10.233.80.186 (webtor/torrent-http-proxy-zkj2t)
  10.233.80.217 (health)
  10.233.80.218 (monit/prometheus-prometheus-operator-kube-p-prometheus-1)
  10.233.80.234 (clickhouse/chi-webtor-webtor-2-1-0)
  10.233.80.237 (webtor/transcode-web-cache-2znf4)
  10.233.80.242 (olm/olm-operator-5f46f76974-455v5)
  10.233.80.248 (webtor/srt2vtt-678d67f586-787f2)
  10.233.80.251 (monit/prometheus-operator-kube-p-operator-864454f9dd-6lslg)
  10.233.80.32 (olm/packageserver-7885574666-8r2ld)
  10.233.80.34 (webtor/video-thumbnails-generator-6c96c9cbcf-x2tbv)
  10.233.80.4 (webtor/magnet2torrent-6c567f469b-tsj8z)
  10.233.80.44 (router)
  10.233.80.6 (webtor/torrent-store-6db795688-v7p67)
  10.233.80.66 (webtor/nginx-vod-rqflw)
  10.233.80.76 (webtor/video-info-7678fb4695-zg5vt)
  10.233.80.90 (webtor/torrent-archiver-gwft5)
  10.233.80.94 (webtor/image-transformer-57cc8758b6-pxbmp)
BandwidthManager:       Disabled
Host Routing:           Legacy
Masquerading:           IPTables [IPv4: Enabled, IPv6: Disabled]
Clock Source for BPF:   ktime
Controller Status:      130/130 healthy
  Name                                          Last success   Last error     Count   Message
  bpf-map-sync-cilium_ipcache                   5s ago         never          0       no error
  cilium-health-ep                              30s ago        never          0       no error
  dns-garbage-collector-job                     45s ago        never          0       no error
  endpoint-1000-regeneration-recovery           never          never          0       no error
  endpoint-1078-regeneration-recovery           never          never          0       no error
  endpoint-1127-regeneration-recovery           never          never          0       no error
  endpoint-1133-regeneration-recovery           never          never          0       no error
  endpoint-1147-regeneration-recovery           never          never          0       no error
  endpoint-1285-regeneration-recovery           never          never          0       no error
  endpoint-1519-regeneration-recovery           never          never          0       no error
  endpoint-1609-regeneration-recovery           never          never          0       no error
  endpoint-1656-regeneration-recovery           never          never          0       no error
  endpoint-2129-regeneration-recovery           never          never          0       no error
  endpoint-2714-regeneration-recovery           never          never          0       no error
  endpoint-289-regeneration-recovery            never          never          0       no error
  endpoint-306-regeneration-recovery            never          never          0       no error
  endpoint-3079-regeneration-recovery           never          never          0       no error
  endpoint-3348-regeneration-recovery           never          never          0       no error
  endpoint-3582-regeneration-recovery           never          never          0       no error
  endpoint-3680-regeneration-recovery           never          never          0       no error
  endpoint-3759-regeneration-recovery           never          never          0       no error
  endpoint-4044-regeneration-recovery           never          never          0       no error
  endpoint-48-regeneration-recovery             never          never          0       no error
  endpoint-52-regeneration-recovery             never          never          0       no error
  endpoint-995-regeneration-recovery            never          never          0       no error
  endpoint-gc                                   1m45s ago      never          0       no error
  ipcache-bpf-garbage-collection                31s ago        never          0       no error
  ipcache-inject-labels                         1h50m55s ago   1h50m59s ago   0       no error
  k8s-heartbeat                                 10s ago        never          0       no error
  kvstore-etcd-lock-session-renew               never          never          0       no error
  kvstore-etcd-session-renew                    never          never          0       no error
  kvstore-locks-gc                              13s ago        never          0       no error
  kvstore-sync-store-cilium/state/nodes/v1      56s ago        never          0       no error
  mark-k8s-node-as-available                    1h50m31s ago   never          0       no error
  metricsmap-bpf-prom-sync                      4s ago         never          0       no error
  neighbor-table-refresh                        1s ago         never          0       no error
  propagating local node change to kv-store     1h50m57s ago   never          0       no error
  resolve-identity-1000                         1m33s ago      never          0       no error
  resolve-identity-1078                         1m16s ago      never          0       no error
  resolve-identity-1127                         2m48s ago      never          0       no error
  resolve-identity-1133                         1m9s ago       never          0       no error
  resolve-identity-1147                         30s ago        never          0       no error
  resolve-identity-1285                         4m16s ago      never          0       no error
  resolve-identity-1519                         4m58s ago      never          0       no error
  resolve-identity-1609                         2m45s ago      never          0       no error
  resolve-identity-1656                         3m37s ago      never          0       no error
  resolve-identity-2129                         4m10s ago      never          0       no error
  resolve-identity-2714                         3m45s ago      never          0       no error
  resolve-identity-289                          24s ago        never          0       no error
  resolve-identity-306                          1m49s ago      never          0       no error
  resolve-identity-3079                         2m53s ago      never          0       no error
  resolve-identity-3348                         4m4s ago       never          0       no error
  resolve-identity-3582                         55s ago        never          0       no error
  resolve-identity-3680                         32s ago        never          0       no error
  resolve-identity-3759                         1m39s ago      never          0       no error
  resolve-identity-4044                         3m53s ago      never          0       no error
  resolve-identity-48                           4m55s ago      never          0       no error
  resolve-identity-52                           3m10s ago      never          0       no error
  resolve-identity-995                          4m34s ago      never          0       no error
  sync-IPv4-identity-mapping (1000)             1m32s ago      never          0       no error
  sync-IPv4-identity-mapping (1078)             1m15s ago      never          0       no error
  sync-IPv4-identity-mapping (1127)             2m48s ago      never          0       no error
  sync-IPv4-identity-mapping (1133)             1m9s ago       never          0       no error
  sync-IPv4-identity-mapping (1147)             29s ago        never          0       no error
  sync-IPv4-identity-mapping (1285)             4m15s ago      never          0       no error
  sync-IPv4-identity-mapping (1519)             4m58s ago      never          0       no error
  sync-IPv4-identity-mapping (1609)             2m44s ago      never          0       no error
  sync-IPv4-identity-mapping (1656)             3m36s ago      never          0       no error
  sync-IPv4-identity-mapping (2129)             4m9s ago       never          0       no error
  sync-IPv4-identity-mapping (2714)             3m45s ago      never          0       no error
  sync-IPv4-identity-mapping (289)              23s ago        never          0       no error
  sync-IPv4-identity-mapping (306)              1m49s ago      never          0       no error
  sync-IPv4-identity-mapping (3079)             2m53s ago      never          0       no error
  sync-IPv4-identity-mapping (3348)             4m2s ago       never          0       no error
  sync-IPv4-identity-mapping (3582)             54s ago        never          0       no error
  sync-IPv4-identity-mapping (3759)             1m38s ago      never          0       no error
  sync-IPv4-identity-mapping (4044)             3m52s ago      never          0       no error
  sync-IPv4-identity-mapping (48)               4m54s ago      never          0       no error
  sync-IPv4-identity-mapping (52)               3m8s ago       never          0       no error
  sync-IPv4-identity-mapping (995)              4m33s ago      never          0       no error
  sync-endpoints-and-host-ips                   31s ago        never          0       no error
  sync-lb-maps-with-k8s-services                1h50m32s ago   never          0       no error
  sync-pod-labels-with-cilium-endpoint (1000)   1h31m38s ago   never          0       no error
  sync-pod-labels-with-cilium-endpoint (4044)   1h28m58s ago   never          0       no error
  sync-policymap-1000                           13s ago        never          0       no error
  sync-policymap-1078                           13s ago        never          0       no error
  sync-policymap-1127                           13s ago        never          0       no error
  sync-policymap-1133                           13s ago        never          0       no error
  sync-policymap-1147                           13s ago        never          0       no error
  sync-policymap-1285                           13s ago        never          0       no error
  sync-policymap-1519                           13s ago        never          0       no error
  sync-policymap-1609                           13s ago        never          0       no error
  sync-policymap-1656                           13s ago        never          0       no error
  sync-policymap-2129                           13s ago        never          0       no error
  sync-policymap-2714                           13s ago        never          0       no error
  sync-policymap-289                            13s ago        never          0       no error
  sync-policymap-306                            13s ago        never          0       no error
  sync-policymap-3079                           13s ago        never          0       no error
  sync-policymap-3348                           13s ago        never          0       no error
  sync-policymap-3582                           13s ago        never          0       no error
  sync-policymap-3680                           13s ago        never          0       no error
  sync-policymap-3759                           13s ago        never          0       no error
  sync-policymap-4044                           13s ago        never          0       no error
  sync-policymap-48                             13s ago        never          0       no error
  sync-policymap-52                             13s ago        never          0       no error
  sync-policymap-995                            13s ago        never          0       no error
  sync-to-k8s-ciliumendpoint (1000)             2s ago         never          0       no error
  sync-to-k8s-ciliumendpoint (1078)             6s ago         never          0       no error
  sync-to-k8s-ciliumendpoint (1127)             8s ago         never          0       no error
  sync-to-k8s-ciliumendpoint (1133)             9s ago         never          0       no error
  sync-to-k8s-ciliumendpoint (1147)             10s ago        never          0       no error
  sync-to-k8s-ciliumendpoint (1285)             5s ago         never          0       no error
  sync-to-k8s-ciliumendpoint (1519)             8s ago         never          0       no error
  sync-to-k8s-ciliumendpoint (1609)             4s ago         never          0       no error
  sync-to-k8s-ciliumendpoint (1656)             7s ago         never          0       no error
  sync-to-k8s-ciliumendpoint (2129)             9s ago         never          0       no error
  sync-to-k8s-ciliumendpoint (2714)             5s ago         never          0       no error
  sync-to-k8s-ciliumendpoint (289)              4s ago         never          0       no error
  sync-to-k8s-ciliumendpoint (306)              9s ago         never          0       no error
  sync-to-k8s-ciliumendpoint (3079)             3s ago         never          0       no error
  sync-to-k8s-ciliumendpoint (3348)             3s ago         never          0       no error
  sync-to-k8s-ciliumendpoint (3582)             5s ago         never          0       no error
  sync-to-k8s-ciliumendpoint (3680)             1s ago         never          0       no error
  sync-to-k8s-ciliumendpoint (3759)             8s ago         never          0       no error
  sync-to-k8s-ciliumendpoint (4044)             2s ago         never          0       no error
  sync-to-k8s-ciliumendpoint (48)               5s ago         never          0       no error
  sync-to-k8s-ciliumendpoint (52)               9s ago         never          0       no error
  sync-to-k8s-ciliumendpoint (995)              4s ago         never          0       no error
  template-dir-watcher                          never          never          0       no error
  update-k8s-node-annotations                   1h50m58s ago   never          0       no error
Proxy Status:   OK, ip 10.233.80.44, 0 redirects active on ports 10000-20000
Hubble:         Ok   Current/Max Flows: 4095/4095 (100.00%), Flows/s: 337.92   Metrics: Ok
KubeProxyReplacement Details:
  Status:                 Strict
  Socket LB Protocols:    TCP, UDP
  Devices:                enp5s0 116.202.216.184 (Direct Routing)
  Mode:                   SNAT
  Backend Selection:      Random
  Session Affinity:       Enabled
  Graceful Termination:   Enabled
  XDP Acceleration:       Disabled
  Services:
  - ClusterIP:      Enabled
  - NodePort:       Enabled (Range: 30000-32767)
  - LoadBalancer:   Enabled
  - externalIPs:    Enabled
  - HostPort:       Enabled
BPF Maps:   dynamic sizing: off
  Name                          Size
  Non-TCP connection tracking   262144
  TCP connection tracking       524288
  Endpoint policy               65535
  Events                        32
  IP cache                      512000
  IP masquerading agent         16384
  IPv4 fragmentation            8192
  IPv4 service                  65536
  IPv6 service                  65536
  IPv4 service backend          65536
  IPv6 service backend          65536
  IPv4 service reverse NAT      65536
  IPv6 service reverse NAT      65536
  Metrics                       1024
  NAT                           524288
  Neighbor table                524288
  Global policy                 16384
  Per endpoint policy           65536
  Session affinity              65536
  Signal                        32
  Sockmap                       65535
  Sock reverse NAT              262144
  Tunnel                        65536
Encryption:            Disabled
Cluster health:        19/19 reachable   (2022-01-29T16:54:49Z)
  Name                 IP                Node        Endpoints
  edge01 (localhost)   116.202.216.184   reachable   reachable
  core01               194.163.174.113   reachable   reachable
  core02               194.163.174.114   reachable   reachable
  core03               194.163.174.112   reachable   reachable
  edge02               138.201.33.57     reachable   reachable
  edge03               162.55.101.35     reachable   reachable
  worker01             161.97.120.213    reachable   reachable
  worker02             207.180.212.113   reachable   reachable
  worker03             194.163.155.38    reachable   reachable
  worker04             95.111.228.230    reachable   reachable
  worker05             207.180.248.202   reachable   reachable
  worker06             207.180.251.61    reachable   reachable
  worker07             207.180.248.212   reachable   reachable
  worker08             207.180.251.210   reachable   reachable
  worker09             167.86.83.48      reachable   reachable
  worker10             167.86.121.93     reachable   reachable
  worker11             164.68.110.103    reachable   reachable
  worker12             164.68.110.199    reachable   reachable
  worker13             95.111.237.244    reachable   reachable
```

**Comment by aanm** [comment]
cc @aditighag

**Comment by aditighag** [comment]
@vintikzzz 

>Here is cilium monitor output:

Can you post `cilium monitor` output without grep? `cilium monitor --related-to <endpoint-id-client-pod>` 
Let's check if the service translation is happening. Also, is there any server listening on port 8080 inside the client pod? You can check this by running `netstat -nlp | grep 8080`.

**Comment by vintikzzz** [comment]
@aditighag I had to switch to another CNI, I can't provide some logs or command outputs, but I can share some observations. Here are some steps that I did:

1. I decided to redeploy all the things, so I started with 3 control plane nodes (all are in the same DC, maybe even on the host) and checked RLP according to the [docs](https://docs.cilium.io/en/v1.11/gettingstarted/local-redirect-policy/#servicematcher). Everything was OK. I saw redirection in tcpdump as expected. I was quite happy and moved on.
2. Then I added 16 worker nodes. They are from different DC and providers. And just decided to reproduce the test. But everything stopped working, even on nodes from the first step. tcpdump showed me that no redirection was performing. Curl just tries to reach old service ClusterIP.

Maybe this would be helpfull.
