### ISSUE TITLE
ClusterMesh: HTTP request failed with a Global Service when the request size is greater than 8.4KB

### ISSUE THREAD

**Issue by rockc2020** [cilium/cilium#23397]
### Is there an existing issue for this?

- [X] I have searched the existing issues

### What happened?

I setup cilium clustermesh on my two EKS clusters (cluster1 & cluster2) by running the commands per the doc: https://docs.cilium.io/en/latest/network/clustermesh/clustermesh/#gs-clustermesh.

I created a global service with echoserver (https://github.com/Ealenn/Echo-Server) which only has a single Pod running on cluster 2.
service name: `echo-service-test` on both clusters
service namespace: `service-test` on both clusters
service annotation for global: `io.cilium/global-service: 'true'`

I run CURL commands on a Pod in cluster1 like:
```
curl -v echo-service-test.service-test?echo_body=<body_content (url_encoded)>
```

When the size of HTTP request (including the content) is less than 8.4K, everything works fine that I could get an HTTP 200 response with the decoded content.
When the size is greater than 8.4K, the global service cannot receive the request.

**Please note**, this only happened when traffic crossing clusters in the clustermesh. If I run the HTTP request with CURL in the same cluster with the global service (cluster2), no matter the request size (I tried >10KB), the client can alway get the HTTP 200 response with correct contents.

Here is the tcpdump from client Pod in cluster1:
```
# Here is the dump when HTTP request succeeded with size 8462.
=============
    1   0.000000 10.103.193.220 → 172.20.24.119 TCP 76 44194 → 80 [SYN] Seq=0 Win=62188 Len=0 MSS=8884 SACK_PERM TSval=2555126207 TSecr=0 WS=128
    2   0.000969 172.20.24.119 → 10.103.193.220 TCP 76 80 → 44194 [SYN, ACK] Seq=0 Ack=1 Win=62104 Len=0 MSS=8884 SACK_PERM TSval=161820037 TSecr=2555126207 WS=128
    3   0.000985 10.103.193.220 → 172.20.24.119 TCP 68 44194 → 80 [ACK] Seq=1 Ack=1 Win=62208 Len=0 TSval=2555126208 TSecr=161820037
    4   0.001311 10.103.193.220 → 172.20.24.119 HTTP 8462 GET /?echo_body=root%40ip-10-103-116-71%3A%2Fhome%2Fcilium%23%20cilium%20monitor%20--related-to%20721%20-j%20%7C%20grep%208080%0AListening%20for%20events%20on%202%20CPUs%20with%2064x4096%20of%20shared%20memory%0APress%20Ctrl-C%20to%20quit%0Alevel%3Dinfo%20msg%3D%22Initializing%20dissection%20cache...%22%20subsys%3Dmonitor%0A%7B%22cpu%22%3A%22CPU%2001%3A%22%2C%22type%22%3A%22trace%22%2C%22mark%22%3A%220x279871e7%22%2C%22ifindex%22%3A%220%22%2C%22state%22%3A%22established%22%2C%22observationPoint%22%3A%22to-stack%22%2C%22traceSummary%22%3A%22-%5Cu003e%20stack%22%2C%22source%22%3A721%2C%22bytes%22%3A102%2C%22srcLabel%22%3A101851%2C%22dstLabel%22%3A136139%2C%22dstID%22%3A0%2C%22summary%22%3A%7B%22ethernet%22%3A%22Ethernet%5Ct%7BContents%3D%5B..14..%5D%20Payload%3D%5B..94..%5D%20SrcMAC%3Daa%3A54%3Ad0%3A6c%3Af9%3A84%20DstMAC%3Dfa%3A86%3Ad2%3Ab7%3A5b%3A52%20EthernetType%3DIPv4%20Length%3D0%7D%22%2C%22ipv4%22%3A%22IPv4%5Ct%7BContents%3D%5B..20..%5D%20Payload%3D%5B..68..%5D%20Version%3D4%20IHL%3D5%20TOS%3D0%20Length%3D88%20Id%3D41622%20Flags%3DDF%20FragOffset%3D0%20TTL%3D255%20Protocol%3DTCP%20Checksum%3D26886%20SrcIP%3D10.103.118.184%20DstIP%3D10.104.228.123%20Options%3D%5B%5D%20Padding%3D%5B%5D%7D%22%2C%22tcp%22%3A%22TCP%5Ct%7BContents%3D%5B..44..%5D%20Payload%3D%5B..24..%5D%20SrcPort%3D54374%20DstPort%3D8080%28http-alt%29%20Seq%3D1210465229%20Ack%3D3653576238%20DataOffset%3D11%20FIN%3Dfalse%20SYN%3Dfalse%20RST%3Dfalse%20PSH%3Dtrue%20ACK%3Dtrue%20URG%3Dfalse%20ECE%3Dfalse%20CWR%3Dfalse%20NS%3Dfalse%20Window%3D443%20Checksum%3D28749%20Urgent%3D0%20Options%3D%5B..6..%5D%20Padding%3D%5B%5D%7D%22%2C%22l2%22%3A%7B%22src%22%3A%22aa%3A54%3Ad0%3A6c%3Af9%3A84%22%2C%22dst%22%3A%22fa%3A86%3Ad2%3Ab7%3A5b%3A52%22%7D%2C%22l3%22%3A%7B%22src%22%3A%2210.103.118.184%22%2C%22dst%22%3A%2210.104.228.123%22%7D%2C%22l4%22%3A%7B%22src%22%3A%2254374%22%2C%22dst%22%3A%228080%22%7D%7D%7D%0A%7B%22cpu%22%3A%22CPU%2001%3A%22%2C%22type%22%3A%22trace%22%2C%22mark%22%3A%220x279871e7%22%2C%22ifindex%22%3A%220%22%2C%22state%22%3A%22established%22%2C%22observationPoint%22%3A%22to-stack%22%2C%22traceSummary%22%3A%22-%5Cu003e%20stack%22%2C%22source%22%3A721%2C%22bytes%22%3A78%2C%22srcLabel%22%3A101851%2C%22dstLabel%22%3A136139%2C%22dstID%22%3A0%2C%22summary%22%3A%7B%22ethernet%22%3A%22Ethernet%5Ct%7BContents%3D%5B..14..%5D%20Payload%3D%5B..70..%5D%20SrcMAC%3Daa%3A54%3Ad0%3A6c%3Af9%3A84%20DstMAC%3Dfa%3A86%3Ad2%3Ab7%3A5b%3A52%20EthernetType%3DIPv4%20Length%3D0%7D%22%2C%22ipv4%22%3A%22IPv4%5Ct%7BContents%3D%5B..20..%5D%20Payload%3D%5B..44..%5D%20Version%3D4%20IHL%3D5%20TOS%3D0%20Length%3D64%20Id%3D41623%20Flags%3DDF%20FragOffset%3D0%20TTL%3D255%20Protocol%3DTCP%20Checksum%3D26909%20SrcIP%3D10.103.118.184%20DstIP%3D10.104.228.123%20Options%3D%5B%5D%20Padding%3D%5B%5D%7D%22%2C%22tcp%22%3A%22TCP%5Ct%7BContents%3D%5B..44..%5D%20Payload%3D%5B%5D%20SrcPort%3D54374%20DstPort%3D8080%28http-alt%29%20Seq%3D1210465253%20Ack%3D3653576238%20DataOffset%3D11%20FIN%3Dtrue%20SYN%3Dfalse%20RST%3Dfalse%20PSH%3Dfalse%20ACK%3Dtrue%20URG%3Dfalse%20ECE%3Dfalse%20CWR%3Dfalse%20NS%3Dfalse%20Window%3D443%20Checksum%3D28725%20Urgent%3D0%20Options%3D%5B..6..%5D%20Padding%3D%5B%5D%7D%22%2C%22l2%22%3A%7B%22src%22%3A%22aa%3A54%3Ad0%3A6c%3Af9%3A84%22%2C%22dst%22%3A%22fa%3A86%3Ad2%3Ab7%3A5b%3A52%22%7D%2C%22l3%22%3A%7B%22src%22%3A%2210.103.118.184%22%2C%22dst%22%3A%2210.104.228.123%22%7D%2C%22l4%22%3A%7B%22src%22%3A%2254374%22%2C%22dst%22%3A%228080%22%7D%7D%7D%0A%7B%22cpu%22%3A%22CPU%2001%3A%22%2C%22type%22%3A%22trace%22%2C%22mark%22%3A%220xef80ef80%22%2C%22ifindex%22%3A%220%22%2C%22state%22%3A%22reply%22%2C%22observationPoint%22%3A%22to-endpoint%22%2C%22traceSummary%22%3A%22-%5Cu003e%20endpoint%20721%22%2C%22source%22%3A721%2C%22bytes%22%3A90%2C%22srcLabel%22%3A136139%2C%22dstLabel%22%3A101851%2C%22dstID%22%3A721%2C%22summary%22%3A%7B%22ethernet%22%3A%22Ethernet%5Ct%7BContents%3D%5B..14..%5D%20Payload%3D%5B..78..%5D%20SrcMAC%3Dfa%3A86%3Ad2%3Ab7%3A5b%3A52%20DstMAC%3Daa%3A54%3Ad0%3A6c%3Af9%3A84%20EthernetType%3DIPv4%20Length%3D0%7D%22%2C%22ipv4%22%3A%22IPv4%5Ct%7BContents%3D%5B..20..%5D%20Payload%3D%5
    5   0.001862 172.20.24.119 → 10.103.193.220 TCP 68 80 → 44194 [ACK] Seq=1 Ack=8395 Win=56704 Len=0 TSval=161820038 TSecr=2555126209
    6   0.005133 172.20.24.119 → 10.103.193.220 HTTP/JSON 6111 HTTP/1.1 200 OK , JavaScript Object Notation (application/json)
    7   0.005142 10.103.193.220 → 172.20.24.119 TCP 68 44194 → 80 [ACK] Seq=8395 Ack=6044 Win=56704 Len=0 TSval=2555126212 TSecr=161820041
    8   0.005769 10.103.193.220 → 172.20.24.119 TCP 68 44194 → 80 [FIN, ACK] Seq=8395 Ack=6044 Win=56704 Len=0 TSval=2555126213 TSecr=161820041
    9   0.006326 172.20.24.119 → 10.103.193.220 TCP 68 80 → 44194 [FIN, ACK] Seq=6044 Ack=8396 Win=56704 Len=0 TSval=161820042 TSecr=2555126213
   10   0.006335 10.103.193.220 → 172.20.24.119 TCP 68 44194 → 80 [ACK] Seq=8396 Ack=6045 Win=56704 Len=0 TSval=2555126214 TSecr=161820042


# Here is the dump when HTTP request failed with size 8465.
=============
   11  67.280112 10.103.193.220 → 172.20.24.119 TCP 76 59008 → 80 [SYN] Seq=0 Win=62188 Len=0 MSS=8884 SACK_PERM TSval=2555193487 TSecr=0 WS=128
   12  67.280918 172.20.24.119 → 10.103.193.220 TCP 76 80 → 59008 [SYN, ACK] Seq=0 Ack=1 Win=62104 Len=0 MSS=8884 SACK_PERM TSval=161887317 TSecr=2555193487 WS=128
   13  67.280934 10.103.193.220 → 172.20.24.119 TCP 68 59008 → 80 [ACK] Seq=1 Ack=1 Win=62208 Len=0 TSval=2555193488 TSecr=161887317
   14  67.281014 10.103.193.220 → 172.20.24.119 HTTP 8465 GET /?echo_body=root%40ip-10-103-116-71%3A%2Fhome%2Fcilium%23%20cilium%20monitor%20--related-to%20721%20-j%20%7C%20grep%208080%0AListening%20for%20events%20on%202%20CPUs%20with%2064x4096%20of%20shared%20memory%0APress%20Ctrl-C%20to%20quit%0Alevel%3Dinfo%20msg%3D%22Initializing%20dissection%20cache...%22%20subsys%3Dmonitor%0A%7B%22cpu%22%3A%22CPU%2001%3A%22%2C%22type%22%3A%22trace%22%2C%22mark%22%3A%220x279871e7%22%2C%22ifindex%22%3A%220%22%2C%22state%22%3A%22established%22%2C%22observationPoint%22%3A%22to-stack%22%2C%22traceSummary%22%3A%22-%5Cu003e%20stack%22%2C%22source%22%3A721%2C%22bytes%22%3A102%2C%22srcLabel%22%3A101851%2C%22dstLabel%22%3A136139%2C%22dstID%22%3A0%2C%22summary%22%3A%7B%22ethernet%22%3A%22Ethernet%5Ct%7BContents%3D%5B..14..%5D%20Payload%3D%5B..94..%5D%20SrcMAC%3Daa%3A54%3Ad0%3A6c%3Af9%3A84%20DstMAC%3Dfa%3A86%3Ad2%3Ab7%3A5b%3A52%20EthernetType%3DIPv4%20Length%3D0%7D%22%2C%22ipv4%22%3A%22IPv4%5Ct%7BContents%3D%5B..20..%5D%20Payload%3D%5B..68..%5D%20Version%3D4%20IHL%3D5%20TOS%3D0%20Length%3D88%20Id%3D41622%20Flags%3DDF%20FragOffset%3D0%20TTL%3D255%20Protocol%3DTCP%20Checksum%3D26886%20SrcIP%3D10.103.118.184%20DstIP%3D10.104.228.123%20Options%3D%5B%5D%20Padding%3D%5B%5D%7D%22%2C%22tcp%22%3A%22TCP%5Ct%7BContents%3D%5B..44..%5D%20Payload%3D%5B..24..%5D%20SrcPort%3D54374%20DstPort%3D8080%28http-alt%29%20Seq%3D1210465229%20Ack%3D3653576238%20DataOffset%3D11%20FIN%3Dfalse%20SYN%3Dfalse%20RST%3Dfalse%20PSH%3Dtrue%20ACK%3Dtrue%20URG%3Dfalse%20ECE%3Dfalse%20CWR%3Dfalse%20NS%3Dfalse%20Window%3D443%20Checksum%3D28749%20Urgent%3D0%20Options%3D%5B..6..%5D%20Padding%3D%5B%5D%7D%22%2C%22l2%22%3A%7B%22src%22%3A%22aa%3A54%3Ad0%3A6c%3Af9%3A84%22%2C%22dst%22%3A%22fa%3A86%3Ad2%3Ab7%3A5b%3A52%22%7D%2C%22l3%22%3A%7B%22src%22%3A%2210.103.118.184%22%2C%22dst%22%3A%2210.104.228.123%22%7D%2C%22l4%22%3A%7B%22src%22%3A%2254374%22%2C%22dst%22%3A%228080%22%7D%7D%7D%0A%7B%22cpu%22%3A%22CPU%2001%3A%22%2C%22type%22%3A%22trace%22%2C%22mark%22%3A%220x279871e7%22%2C%22ifindex%22%3A%220%22%2C%22state%22%3A%22established%22%2C%22observationPoint%22%3A%22to-stack%22%2C%22traceSummary%22%3A%22-%5Cu003e%20stack%22%2C%22source%22%3A721%2C%22bytes%22%3A78%2C%22srcLabel%22%3A101851%2C%22dstLabel%22%3A136139%2C%22dstID%22%3A0%2C%22summary%22%3A%7B%22ethernet%22%3A%22Ethernet%5Ct%7BContents%3D%5B..14..%5D%20Payload%3D%5B..70..%5D%20SrcMAC%3Daa%3A54%3Ad0%3A6c%3Af9%3A84%20DstMAC%3Dfa%3A86%3Ad2%3Ab7%3A5b%3A52%20EthernetType%3DIPv4%20Length%3D0%7D%22%2C%22ipv4%22%3A%22IPv4%5Ct%7BContents%3D%5B..20..%5D%20Payload%3D%5B..44..%5D%20Version%3D4%20IHL%3D5%20TOS%3D0%20Length%3D64%20Id%3D41623%20Flags%3DDF%20FragOffset%3D0%20TTL%3D255%20Protocol%3DTCP%20Checksum%3D26909%20SrcIP%3D10.103.118.184%20DstIP%3D10.104.228.123%20Options%3D%5B%5D%20Padding%3D%5B%5D%7D%22%2C%22tcp%22%3A%22TCP%5Ct%7BContents%3D%5B..44..%5D%20Payload%3D%5B%5D%20SrcPort%3D54374%20DstPort%3D8080%28http-alt%29%20Seq%3D1210465253%20Ack%3D3653576238%20DataOffset%3D11%20FIN%3Dtrue%20SYN%3Dfalse%20RST%3Dfalse%20PSH%3Dfalse%20ACK%3Dtrue%20URG%3Dfalse%20ECE%3Dfalse%20CWR%3Dfalse%20NS%3Dfalse%20Window%3D443%20Checksum%3D28725%20Urgent%3D0%20Options%3D%5B..6..%5D%20Padding%3D%5B%5D%7D%22%2C%22l2%22%3A%7B%22src%22%3A%22aa%3A54%3Ad0%3A6c%3Af9%3A84%22%2C%22dst%22%3A%22fa%3A86%3Ad2%3Ab7%3A5b%3A52%22%7D%2C%22l3%22%3A%7B%22src%22%3A%2210.103.118.184%22%2C%22dst%22%3A%2210.104.228.123%22%7D%2C%22l4%22%3A%7B%22src%22%3A%2254374%22%2C%22dst%22%3A%228080%22%7D%7D%7D%0A%7B%22cpu%22%3A%22CPU%2001%3A%22%2C%22type%22%3A%22trace%22%2C%22mark%22%3A%220xef80ef80%22%2C%22ifindex%22%3A%220%22%2C%22state%22%3A%22reply%22%2C%22observationPoint%22%3A%22to-endpoint%22%2C%22traceSummary%22%3A%22-%5Cu003e%20endpoint%20721%22%2C%22source%22%3A721%2C%22bytes%22%3A90%2C%22srcLabel%22%3A136139%2C%22dstLabel%22%3A101851%2C%22dstID%22%3A721%2C%22summary%22%3A%7B%22ethernet%22%3A%22Ethernet%5Ct%7BContents%3D%5B..14..%5D%20Payload%3D%5B..78..%5D%20SrcMAC%3Dfa%3A86%3Ad2%3Ab7%3A5b%3A52%20DstMAC%3Daa%3A54%3Ad0%3A6c%3Af9%3A84%20EthernetType%3DIPv4%20Length%3D0%7D%22%2C%22ipv4%22%3A%22IPv4%5Ct%7BContents%3D%5B..20..%5D%20Payload%3D%5
   15  67.482865 10.103.193.220 → 172.20.24.119 TCP 8465 [TCP Retransmission] 59008 → 80 [PSH, ACK] Seq=1 Ack=1 Win=62208 Len=8397 TSval=2555193690 TSecr=161887317
   16  67.686871 10.103.193.220 → 172.20.24.119 TCP 8465 [TCP Retransmission] 59008 → 80 [PSH, ACK] Seq=1 Ack=1 Win=62208 Len=8397 TSval=2555193894 TSecr=161887317
   17  68.118882 10.103.193.220 → 172.20.24.119 TCP 8465 [TCP Retransmission] 59008 → 80 [PSH, ACK] Seq=1 Ack=1 Win=62208 Len=8397 TSval=2555194326 TSecr=161887317
   18  68.950873 10.103.193.220 → 172.20.24.119 TCP 8465 [TCP Retransmission] 59008 → 80 [PSH, ACK] Seq=1 Ack=1 Win=62208 Len=8397 TSval=2555195158 TSecr=161887317
   19  70.582870 10.103.193.220 → 172.20.24.119 TCP 8465 [TCP Retransmission] 59008 → 80 [PSH, ACK] Seq=1 Ack=1 Win=62208 Len=8397 TSval=2555196790 TSecr=161887317
   20  73.846866 10.103.193.220 → 172.20.24.119 TCP 8465 [TCP Retransmission] 59008 → 80 [PSH, ACK] Seq=1 Ack=1 Win=62208 Len=8397 TSval=2555200054 TSecr=161887317
   21  80.502890 10.103.193.220 → 172.20.24.119 TCP 8465 [TCP Retransmission] 59008 → 80 [PSH, ACK] Seq=1 Ack=1 Win=62208 Len=8397 TSval=2555206710 TSecr=161887317
   22  93.558894 10.103.193.220 → 172.20.24.119 TCP 8465 [TCP Retransmission] 59008 → 80 [PSH, ACK] Seq=1 Ack=1 Win=62208 Len=8397 TSval=2555219766 TSecr=161887317
   23 121.206881 10.103.193.220 → 172.20.24.119 TCP 8465 [TCP Retransmission] 59008 → 80 [PSH, ACK] Seq=1 Ack=1 Win=62208 Len=8397 TSval=2555247414 TSecr=161887317
```

Here is the tcpdump from the single server pod in cluster2:
```
# Here is the dump when HTTP request succeeded with size 8462.
=============
    1   0.000000 10.103.193.220 → 10.104.107.251 TCP 76 44194 → 80 [SYN] Seq=0 Win=62188 Len=0 MSS=8884 SACK_PERM TSval=2555126207 TSecr=0 WS=128
    2   0.000020 10.104.107.251 → 10.103.193.220 TCP 76 80 → 44194 [SYN, ACK] Seq=0 Ack=1 Win=62104 Len=0 MSS=8884 SACK_PERM TSval=161820037 TSecr=2555126207 WS=128
    3   0.000588 10.103.193.220 → 10.104.107.251 TCP 68 44194 → 80 [ACK] Seq=1 Ack=1 Win=62208 Len=0 TSval=2555126208 TSecr=161820037
    4   0.001011 10.103.193.220 → 10.104.107.251 HTTP 8462 GET /?echo_body=root%40ip-10-103-116-71%3A%2Fhome%2Fcilium%23%20cilium%20monitor%20--related-to%20721%20-j%20%7C%20grep%208080%0AListening%20for%20events%20on%202%20CPUs%20with%2064x4096%20of%20shared%20memory%0APress%20Ctrl-C%20to%20quit%0Alevel%3Dinfo%20msg%3D%22Initializing%20dissection%20cache...%22%20subsys%3Dmonitor%0A%7B%22cpu%22%3A%22CPU%2001%3A%22%2C%22type%22%3A%22trace%22%2C%22mark%22%3A%220x279871e7%22%2C%22ifindex%22%3A%220%22%2C%22state%22%3A%22established%22%2C%22observationPoint%22%3A%22to-stack%22%2C%22traceSummary%22%3A%22-%5Cu003e%20stack%22%2C%22source%22%3A721%2C%22bytes%22%3A102%2C%22srcLabel%22%3A101851%2C%22dstLabel%22%3A136139%2C%22dstID%22%3A0%2C%22summary%22%3A%7B%22ethernet%22%3A%22Ethernet%5Ct%7BContents%3D%5B..14..%5D%20Payload%3D%5B..94..%5D%20SrcMAC%3Daa%3A54%3Ad0%3A6c%3Af9%3A84%20DstMAC%3Dfa%3A86%3Ad2%3Ab7%3A5b%3A52%20EthernetType%3DIPv4%20Length%3D0%7D%22%2C%22ipv4%22%3A%22IPv4%5Ct%7BContents%3D%5B..20..%5D%20Payload%3D%5B..68..%5D%20Version%3D4%20IHL%3D5%20TOS%3D0%20Length%3D88%20Id%3D41622%20Flags%3DDF%20FragOffset%3D0%20TTL%3D255%20Protocol%3DTCP%20Checksum%3D26886%20SrcIP%3D10.103.118.184%20DstIP%3D10.104.228.123%20Options%3D%5B%5D%20Padding%3D%5B%5D%7D%22%2C%22tcp%22%3A%22TCP%5Ct%7BContents%3D%5B..44..%5D%20Payload%3D%5B..24..%5D%20SrcPort%3D54374%20DstPort%3D8080%28http-alt%29%20Seq%3D1210465229%20Ack%3D3653576238%20DataOffset%3D11%20FIN%3Dfalse%20SYN%3Dfalse%20RST%3Dfalse%20PSH%3Dtrue%20ACK%3Dtrue%20URG%3Dfalse%20ECE%3Dfalse%20CWR%3Dfalse%20NS%3Dfalse%20Window%3D443%20Checksum%3D28749%20Urgent%3D0%20Options%3D%5B..6..%5D%20Padding%3D%5B%5D%7D%22%2C%22l2%22%3A%7B%22src%22%3A%22aa%3A54%3Ad0%3A6c%3Af9%3A84%22%2C%22dst%22%3A%22fa%3A86%3Ad2%3Ab7%3A5b%3A52%22%7D%2C%22l3%22%3A%7B%22src%22%3A%2210.103.118.184%22%2C%22dst%22%3A%2210.104.228.123%22%7D%2C%22l4%22%3A%7B%22src%22%3A%2254374%22%2C%22dst%22%3A%228080%22%7D%7D%7D%0A%7B%22cpu%22%3A%22CPU%2001%3A%22%2C%22type%22%3A%22trace%22%2C%22mark%22%3A%220x279871e7%22%2C%22ifindex%22%3A%220%22%2C%22state%22%3A%22established%22%2C%22observationPoint%22%3A%22to-stack%22%2C%22traceSummary%22%3A%22-%5Cu003e%20stack%22%2C%22source%22%3A721%2C%22bytes%22%3A78%2C%22srcLabel%22%3A101851%2C%22dstLabel%22%3A136139%2C%22dstID%22%3A0%2C%22summary%22%3A%7B%22ethernet%22%3A%22Ethernet%5Ct%7BContents%3D%5B..14..%5D%20Payload%3D%5B..70..%5D%20SrcMAC%3Daa%3A54%3Ad0%3A6c%3Af9%3A84%20DstMAC%3Dfa%3A86%3Ad2%3Ab7%3A5b%3A52%20EthernetType%3DIPv4%20Length%3D0%7D%22%2C%22ipv4%22%3A%22IPv4%5Ct%7BContents%3D%5B..20..%5D%20Payload%3D%5B..44..%5D%20Version%3D4%20IHL%3D5%20TOS%3D0%20Length%3D64%20Id%3D41623%20Flags%3DDF%20FragOffset%3D0%20TTL%3D255%20Protocol%3DTCP%20Checksum%3D26909%20SrcIP%3D10.103.118.184%20DstIP%3D10.104.228.123%20Options%3D%5B%5D%20Padding%3D%5B%5D%7D%22%2C%22tcp%22%3A%22TCP%5Ct%7BContents%3D%5B..44..%5D%20Payload%3D%5B%5D%20SrcPort%3D54374%20DstPort%3D8080%28http-alt%29%20Seq%3D1210465253%20Ack%3D3653576238%20DataOffset%3D11%20FIN%3Dtrue%20SYN%3Dfalse%20RST%3Dfalse%20PSH%3Dfalse%20ACK%3Dtrue%20URG%3Dfalse%20ECE%3Dfalse%20CWR%3Dfalse%20NS%3Dfalse%20Window%3D443%20Checksum%3D28725%20Urgent%3D0%20Options%3D%5B..6..%5D%20Padding%3D%5B%5D%7D%22%2C%22l2%22%3A%7B%22src%22%3A%22aa%3A54%3Ad0%3A6c%3Af9%3A84%22%2C%22dst%22%3A%22fa%3A86%3Ad2%3Ab7%3A5b%3A52%22%7D%2C%22l3%22%3A%7B%22src%22%3A%2210.103.118.184%22%2C%22dst%22%3A%2210.104.228.123%22%7D%2C%22l4%22%3A%7B%22src%22%3A%2254374%22%2C%22dst%22%3A%228080%22%7D%7D%7D%0A%7B%22cpu%22%3A%22CPU%2001%3A%22%2C%22type%22%3A%22trace%22%2C%22mark%22%3A%220xef80ef80%22%2C%22ifindex%22%3A%220%22%2C%22state%22%3A%22reply%22%2C%22observationPoint%22%3A%22to-endpoint%22%2C%22traceSummary%22%3A%22-%5Cu003e%20endpoint%20721%22%2C%22source%22%3A721%2C%22bytes%22%3A90%2C%22srcLabel%22%3A136139%2C%22dstLabel%22%3A101851%2C%22dstID%22%3A721%2C%22summary%22%3A%7B%22ethernet%22%3A%22Ethernet%5Ct%7BContents%3D%5B..14..%5D%20Payload%3D%5B..78..%5D%20SrcMAC%3Dfa%3A86%3Ad2%3Ab7%3A5b%3A52%20DstMAC%3Daa%3A54%3Ad0%3A6c%3Af9%3A84%20EthernetType%3DIPv4%20Length%3D0%7D%22%2C%22ipv4%22%3A%22IPv4%5Ct%7BContents%3D%5B..20..%5D%20Payload%3D%5
    5   0.001027 10.104.107.251 → 10.103.193.220 TCP 68 80 → 44194 [ACK] Seq=1 Ack=8395 Win=56704 Len=0 TSval=161820038 TSecr=2555126209
    6   0.003809 10.104.107.251 → 10.103.193.220 HTTP/JSON 6111 HTTP/1.1 200 OK , JavaScript Object Notation (application/json)
    7   0.004733 10.103.193.220 → 10.104.107.251 TCP 68 44194 → 80 [ACK] Seq=8395 Ack=6044 Win=56704 Len=0 TSval=2555126212 TSecr=161820041
    8   0.005361 10.103.193.220 → 10.104.107.251 TCP 68 44194 → 80 [FIN, ACK] Seq=8395 Ack=6044 Win=56704 Len=0 TSval=2555126213 TSecr=161820041
    9   0.005505 10.104.107.251 → 10.103.193.220 TCP 68 80 → 44194 [FIN, ACK] Seq=6044 Ack=8396 Win=56704 Len=0 TSval=161820042 TSecr=2555126213
   10   0.005992 10.103.193.220 → 10.104.107.251 TCP 68 44194 → 80 [ACK] Seq=8396 Ack=6045 Win=56704 Len=0 TSval=2555126214 TSecr=161820042


# Here is the dump when HTTP request failed with size 8465. Only tcp connection hand shakes are done and never received the request.
=============
   11  67.279956 10.103.193.220 → 10.104.107.251 TCP 76 59008 → 80 [SYN] Seq=0 Win=62188 Len=0 MSS=8884 SACK_PERM TSval=2555193487 TSecr=0 WS=128
   12  67.279975 10.104.107.251 → 10.103.193.220 TCP 76 80 → 59008 [SYN, ACK] Seq=0 Ack=1 Win=62104 Len=0 MSS=8884 SACK_PERM TSval=161887317 TSecr=2555193487 WS=128
   13  67.280509 10.103.193.220 → 10.104.107.251 TCP 68 59008 → 80 [ACK] Seq=1 Ack=1 Win=62208 Len=0 TSval=2555193488 TSecr=161887317
^C
```

I also attached my cilium sysdump of both clusters too.

### Cilium Version

root@ip-10-104-1-35:/home/cilium# cilium version
Client: 1.12.4 6eaecaf 2022-11-16T05:45:01+00:00 go version go1.18.8 linux/amd64
Daemon: 1.12.4 6eaecaf 2022-11-16T05:45:01+00:00 go version go1.18.8 linux/amd64

### Kernel Version

Linux ip-10-104-1-35.us-east-2.compute.internal 5.4.226-129.415.amzn2.x86_64 #1 SMP Fri Dec 9 12:54:21 UTC 2022 x86_64 x86_64 x86_64 GNU/Linux

### Kubernetes Version

Server Version: version.Info{Major:"1", Minor:"22+", GitVersion:"v1.22.15-eks-fb459a0", GitCommit:"be82fa628e60d024275efaa239bfe53a9119c2d9", GitTreeState:"clean", BuildDate:"2022-10-24T20:33:23Z", GoVersion:"go1.16.15", Compiler:"gc", Platform:"linux/amd64"}

### Sysdump

[cilium-sysdump-20230126-120628-client-cluster.zip](https://github.com/cilium/cilium/files/10513045/cilium-sysdump-20230126-120628-client-cluster.zip)
[cilium-sysdump-20230126-120638-server-cluster.zip](https://github.com/cilium/cilium/files/10513051/cilium-sysdump-20230126-120638-server-cluster.zip)

### Code of Conduct

- [X] I agree to follow this project's Code of Conduct

**Comment by borkmann** [comment]
Hi @rockc2020 Do both clusters have the same MTU configured? (You can use `mtu` option in config map to explicitly pin it for Cilium.)

**Comment by rockc2020** [comment]
@borkmann yeah, I also have a quick test with explicitly setting `mtu` to 9000 on both cluster but seems it still happened. Only works when content size is less than mtu.

**Comment by borkmann** [comment]
> When the size is greater than 8.4K, the global service cannot receive the request.

Is the path between the two clusters expected to work with 9k as well?

**Comment by rockc2020** [comment]
> > When the size is greater than 8.4K, the global service cannot receive the request.
> 
> Is the path between the two clusters expected to work with 9k as well?

Not exactly. Our case is that a service needs to return a file to the client crossing clusters. This can't be done with global services either.

In this environment, I just ran a CRUL like:
```
curl -v --header 'X-ECHO-FILE: /etc/services' echo-service-test.service-test
```
It should return the file content of `/etc/services` (~13KB) on the echo Pod but it failed. I also tried another file (5.6KB) and it succeeds.

In this case, the path is short but the response is bigger than MTU, which also failed. File transfer is one out multi-cluster scenarios (not so frequent but important).

**Comment by rockc2020** [comment]
also btw, when clustermesh is disabled, the file `/etc/services` (~13KB) is abled to be returned by the echo service via IP access with CURL: `curl -v --header 'X-ECHO-FILE: /etc/services' 10.104.123.127`.

**Comment by rockc2020** [comment]
Just an update for this once we figured it out that it was caused by the MTU quota which is 8500. https://docs.aws.amazon.com/vpc/latest/tgw/transit-gateway-quotas.html#mtu-quota
Our two EKS clusters are connected with Transit Gateway so it works when the MTU of cilium was set to 8500 on both clusters.

**Comment by pchaigno** [comment]
Closing given previous comment. Please comment here if you still there's still something to be addressed.
