### ISSUE TITLE
Cilium  nat  feuture  don`t work periodically

### ISSUE THREAD

**Issue by foxroot55** [cilium/cilium#28674]
### Is there an existing issue for this?

- [X] I have searched the existing issues

### What happened?

Good day, i have issue with Cilium  nat  feuture.

we have a kubernetes cluster and launched cni cilium. sometimes we see that the traffic does not pass nat processing at the exit from the worker’s network card.
**For example**
_root@worker-02:/home/cilium# cilium monitor  | grep 77.91.127.166_
level=info msg="Initializing dissection cache..." subsys=monitor
-> endpoint 3892 flow 0x247067bf , identity world->7233 state new ifindex **lxc8a9c7355a837** orig-ip 77.91.127.166: 77.91.127.166:49768 -> 10.233.67.234:80 tcp SYN
-> network flow 0xe82decff , identity 7233->world state reply ifindex ens224 orig-ip 0.0.0.0: 10.233.67.234:80 -> 77.91.127.166:49768 tcp SYN, ACK
-> network flow 0xe82decff , identity 7233->world state reply ifindex ens224 orig-ip 0.0.0.0: 10.233.67.234:80 -> 77.91.127.166:49768 tcp SYN, ACK

**POD`s constantly sends  tcp SYN, ACK, because  our clients do not receive this package. But Nat rule  is here**
root@worker-02:/home/cilium# cilium  bpf nat list | grep 77.91.127
TCP OUT 10.233.67.234:80 -> 77.91.127.166:49768 XLATE_SRC 1.1.1.1:8099 Created=6126215sec NeedsCT=0
TCP OUT 10.233.67.234:80 -> 77.91.127.166:50286 XLATE_SRC 1.1.1.1:8099 Created=6126215sec NeedsCT=0

 if we check egress traffic , we can see
**root@worker-02:~#  tcpdump -i lxc8a9c7355a837 -nn**
tcpdump: verbose output suppressed, use -v[v]... for full protocol decode
listening on lxc8a9c7355a837, link-type EN10MB (Ethernet), snapshot length 262144 bytes
14:01:54.527113 IP 10.233.67.234.80 > 77.91.127.166.45364: Flags [S.], seq 2220735384, ack 644086310, win 65160, options [mss 1460,sackOK,TS val 738661409 ecr 3354210426,nop,wscale 7], length 0
14:01:54.527113 IP 10.233.67.234.80 > 77.91.127.166.45364: Flags [S.], seq 2220735384, ack 644086310, win 65160, options [mss 1460,sackOK,TS val 738661409 ecr 3354210426,nop,wscale 7], length 0

**root@worker-02:~#  tcpdump -i ens224 -nn**
tcpdump: verbose output suppressed, use -v[v]... for full protocol decode
listening on ens224, link-type EN10MB (Ethernet), snapshot length 262144 bytes
14:02:49.550876 IP **10.233.67.234.8099** > 77.91.127.166.39420: Flags [S.], seq 262900246, ack 2216812924, win 65160, options [mss 1460,sackOK,TS val 2718558279 ecr 3354265454,nop,wscale 7], length 0
14:02:49.550876 IP **10.233.67.234.8099** > 77.91.127.166.39420: Flags [S.], seq 262900246, ack 2216812924, win 65160, options [mss 1460,sackOK,TS val 2718558279 ecr 3354265454,nop,wscale 7], length 0
14:02:49.550876 IP **10.233.67.234.8099** > 77.91.127.166.39420: Flags [S.], seq 262900246, ack 2216812924, win 65160, options [mss 1460,sackOK,TS val 2718558279 ecr 3354265454,nop,wscale 7], length 0

our traffic leaves the VM and does not  NAT
**if we clear NAT xlate session on the cilium agent, xlate session create again, but NAT still doesn't work**

if we reboot cilium agent   on the k8s cluster all works! 
**kubectl -n kube-system rollout restart daemonset cilium**

root@worker-02:~#  tcpdump -i lxc8a9c7355a837 -nn
tcpdump: verbose output suppressed, use -v[v]... for full protocol decode
listening on lxc8a9c7355a837, link-type EN10MB (Ethernet), snapshot length 262144 bytes
14:11:16.507979 IP 10.233.67.234.80 > 77.91.127.166.33094: Flags [S.], seq 4039000671, ack 3981824356, win 65160, options [mss 1460,sackOK,TS val 739223390 ecr 3354772428,nop,wscale 7], length 0
14:11:16.549306 IP 10.233.67.234.80 > 77.91.127.166.33094: Flags [.], ack 83, win 509, options [nop,nop,TS val 739223431 ecr 3354772469], length 0
14:11:16.611394 IP 10.233.67.234.80 > 77.91.127.166.33094: Flags [P.], seq 1:188, ack 83, win 509, options [nop,nop,TS val 739223494 ecr 3354772469], length 187: HTTP: HTTP/1.1 200 OK
14:11:16.651816 IP 10.233.67.234.80 > 77.91.127.166.33094: Flags [F.], seq 188, ack 84, win 509, options [nop,nop,TS val 739223534 ecr 3354772572], length 0

root@worker-02:~#  tcpdump -i ens224 -nn
tcpdump: verbose output suppressed, use -v[v]... for full protocol decode
listening on ens224, link-type EN10MB (Ethernet), snapshot length 262144 bytes
14:11:35.113032 IP **1.1.1.1.8099** > 77.91.127.166.60084: Flags [S.], seq 1644263663, ack 3450876930, win 65160, options [mss 1460,sackOK,TS val 739241995 ecr 3354791030,nop,wscale 7], length 0
14:11:35.158198 IP **1.1.1.1.8099** > 77.91.127.166.60084: Flags [.], ack 83, win 509, options [nop,nop,TS val 739242040 ecr 3354791075], length 0
14:11:35.228273 IP **1.1.1.18099** > 77.91.127.166.60084: Flags [P.], seq 1:188, ack 83, win 509, options [nop,nop,TS val 739242110 ecr 3354791075], length 187
14:11:35.274851 IP **1.1.1.1.8099** > 77.91.127.166.60084: Flags [F.], seq 188, ack 84, win 509, options [nop,nop,TS val 739242157 ecr 3354791192], length 0

What happes ?

### Cilium Version

cilium image (running): v1.14.2

### Kernel Version

5.15.0-69-generic

### Kubernetes Version

v1.25.5

### Code of Conduct

- [X] I agree to follow this project's Code of Conduct

**Comment by squeed** [comment]
Interesting -- that a reboot fixes this is certainly interesting. Would you be able to provide a sysdump?

**Comment by nijich** [comment]
We have similar problems in #27821. If DSR is not used. The `enties in snat_v4_external` show be paired: there should be OUT and IN entries for SNAT and DNAT (Reverse NAT). However, for some reason the Reverse NAT entry is lost, so the packet from outside cannot be sent back to pod.
