### ISSUE TITLE
CI: K8sServicesTest Checks service across nodes with L7 policy Tests NodePort with L7 Policy: http connect via IPv4 failed

### ISSUE THREAD

**Issue by joestringer** [cilium/cilium#11235]
## Suite-k8s-1.14.K8sServicesTest Checks service across nodes with L7 policy Tests NodePort with L7 Policy

https://jenkins.cilium.io/job/Cilium-PR-K8s-GKE/808/testReport/Suite-k8s-1/14/K8sServicesTest_Checks_service_across_nodes_with_L7_policy_Tests_NodePort_with_L7_Policy/
[f6921cba_K8sServicesTest_Checks_service_across_nodes_with_L7_policy_Tests_NodePort_with_L7_Policy.zip](https://github.com/cilium/cilium/files/4553954/f6921cba_K8sServicesTest_Checks_service_across_nodes_with_L7_policy_Tests_NodePort_with_L7_Policy.zip)

Similar report on Slack #testing channel as well.

This seems very similar to #10118, but that one fails with TFTP on IPv6 rather than HTTP on IPv4. If we triage this issue and find it's the same, we can mark this duplicate and close. But for now it is worth tracking them separately. Please look closely at the initial stack trace below to see if this applies to your failure.

### Stacktrace
```
/home/jenkins/workspace/Cilium-PR-K8s-GKE/src/github.com/cilium/cilium/test/ginkgo-ext/scopes.go:431
Pod "testclient-gnw2p" can not connect to service "http://10.39.242.177:10080" (failed in request 9/10)
Expected command: kubectl exec -n default testclient-gnw2p -- curl --path-as-is -s -D /dev/stderr --fail --connect-timeout 5 --max-time 8 http://10.39.242.177:10080 -w "time-> DNS: '%{time_namelookup}(%{remote_ip})', Connect: '%{time_connect}',Transfer '%{time_starttransfer}', total '%{time_total}'" 
To succeed, but it failed:
Exitcode: 28 
Stdout:
 	 time-> DNS: '0.000027()', Connect: '0.000000',Transfer '0.000000', total '5.000921'
Stderr:
 	 command terminated with exit code 28
	 

/home/jenkins/workspace/Cilium-PR-K8s-GKE/src/github.com/cilium/cilium/test/k8sT/Services.go:572
```
### Standard Output
```
Number of "context deadline exceeded" in logs: 0
Number of "level=error" in logs: 0
Number of "level=warning" in logs: 4
Number of "Cilium API handler panicked" in logs: 0
Number of "Goroutine took lock for more than" in logs: 0
Top 1 errors/warnings:
[[external/envoy/source/common/protobuf/utility.cc:441] Using deprecated option 'envoy.config.core.v3.Node.hidden_envoy_deprecated_build_version' from file base.proto. This configuration will be removed from Envoy soon. Please see https://www.envoyproxy.io/docs/envoy/latest/intro/deprecated for details.
Cilium pods: [cilium-4f5cd cilium-5thlk]
Netpols loaded: 
CiliumNetworkPolicies loaded: default::l7-policy-demo 
Endpoint Policy Enforcement:
Pod                                                         Ingress   Egress
empire-outpost-8888-86bb5475b6-gwjss                                  
pod-to-a-external-1111-7ff666fd8-n47nt                                
pod-to-b-multi-node-clusterip-666594b445-kf2t7                        
event-exporter-v0.2.5-7df89f4b8f-4qxmd                                
cilium-etcd-97jncxtgp9                                                
empire-backup-69f6dffd4b-6qsb5                                        
empire-hq-59d9f9fbc-jsttt                                             
pod-to-a-allowed-cnp-55f885bf8b-jjmqt                                 
pod-to-b-multi-node-nodeport-7cb9c6cb8b-fm52n                         
test-k8s2-664d69b864-s4tkb                                            
fluentd-gcp-scaler-54ccb89d5-2vgqq                                    
kube-dns-5877696fb4-f4hzk                                             
cilium-etcd-58cgq2x75v                                                
etcd-operator-797978964-xbqvg                                         
netperf-server                                                        
pod-to-a-l3-denied-cnp-64c6c75c5d-wlczf                               
pod-to-b-intra-node-845f955cdc-sr6x6                                  
test-k8s2-664d69b864-f677x                                            
kube-dns-5877696fb4-jpw62                                             
kube-dns-5877696fb4-s762v                                             
l7-default-backend-8f479dd9-879zp                                     
stackdriver-metadata-agent-cluster-level-7966cf9bff-t6wpd             
cilium-etcd-n9jqwfrk8f                                                
pod-to-a-59b5fcb7f6-phjrs                                             
pod-to-b-intra-node-hostport-6549fc5b88-bvzqr                         
kube-dns-5877696fb4-mzjnb                                             
testclient-dhqmq                                                      
kube-dns-5877696fb4-9dntr                                             
kube-dns-autoscaler-8687c64fc-5vsld                                   
hubble-cli-7678x                                                      
hubble-cli-tbxcx                                                      
app3-6cc4675d54-mxd4q                                                 
pod-to-b-intra-node-nodeport-5b6fd48f74-l9mhl                         
testds-525rf                                                          
echo-a-5995597649-v2vcx                                               
echo-b-54c9bb5f5c-j6kmh                                               
empire-outpost-9999-8664d77ff8-nfc6c                                  
pod-to-b-multi-node-headless-746f84dff5-fjf7l                         
heapster-gke-6846b8ffb7-xbw2l                                         
metrics-server-v0.3.1-5c6fbf777-rjfkq                                 
app2-b58dc9b5c-9sql8                                                  
pod-to-b-multi-node-hostport-795964f8c8-5vr52                         
pod-to-external-fqdn-allow-google-cnp-b7b6bcdcb-5x9bv                 
testclient-gnw2p                                                      
testds-p6rvb                                                          
kube-dns-5877696fb4-qz7sj                                             
Cilium agent 'cilium-4f5cd': Status: Ok  Health: Ok Nodes "" ContinerRuntime:  Kubernetes: Ok KVstore: Ok Controllers: Total 42 Failed 0
Cilium agent 'cilium-5thlk': Status: Ok  Health: Ok Nodes "" ContinerRuntime:  Kubernetes: Ok KVstore: Ok Controllers: Total 42 Failed 0
```
### Standard Error
```
STEP: Applying policy /home/jenkins/workspace/Cilium-PR-K8s-GKE/src/github.com/cilium/cilium/test/k8sT/manifests/l7-policy-demo.yaml
STEP: Making 10 curl requests from "testclient-dhqmq" to "http://10.39.242.177:10080"
STEP: Making 10 curl requests from "testclient-gnw2p" to "http://10.39.242.177:10080"
=== Test Finished at 2020-04-29T12:07:52Z====
===================== TEST FAILED =====================
cmd: kubectl get pods -o wide --all-namespaces
Exitcode: 0 
Stdout:
 	 NAMESPACE     NAME                                                        READY   STATUS    RESTARTS   AGE     IP             NODE                                         NOMINATED NODE   READINESS GATES
	 cilium        cilium-4f5cd                                                1/1     Running   0          16m     10.138.0.42    gke-cilium-ci-7-default-pool-b3b1ae7a-lsgr   <none>           <none>
	 cilium        cilium-5thlk                                                1/1     Running   0          16m     10.138.0.45    gke-cilium-ci-7-default-pool-b3b1ae7a-qb6q   <none>           <none>
	 cilium        cilium-node-init-kwkwt                                      1/1     Running   0          88m     10.138.0.45    gke-cilium-ci-7-default-pool-b3b1ae7a-qb6q   <none>           <none>
	 cilium        cilium-node-init-q6smw                                      1/1     Running   0          88m     10.138.0.42    gke-cilium-ci-7-default-pool-b3b1ae7a-lsgr   <none>           <none>
	 cilium        cilium-operator-8c95f8555-gvp7w                             1/1     Running   0          16m     10.138.0.42    gke-cilium-ci-7-default-pool-b3b1ae7a-lsgr   <none>           <none>
	 cilium        log-gatherer-r5mrw                                          1/1     Running   0          89m     10.138.0.45    gke-cilium-ci-7-default-pool-b3b1ae7a-qb6q   <none>           <none>
	 cilium        log-gatherer-vvslb                                          1/1     Running   0          89m     10.138.0.42    gke-cilium-ci-7-default-pool-b3b1ae7a-lsgr   <none>           <none>
	 default       test-k8s2-664d69b864-s4tkb                                  2/2     Running   0          8m45s   10.36.13.174   gke-cilium-ci-7-default-pool-b3b1ae7a-qb6q   <none>           <none>
	 default       testclient-dhqmq                                            1/1     Running   0          8m45s   10.36.14.53    gke-cilium-ci-7-default-pool-b3b1ae7a-lsgr   <none>           <none>
	 default       testclient-gnw2p                                            1/1     Running   0          8m45s   10.36.13.14    gke-cilium-ci-7-default-pool-b3b1ae7a-qb6q   <none>           <none>
	 default       testds-525rf                                                1/2     Running   0          8m45s   10.36.13.212   gke-cilium-ci-7-default-pool-b3b1ae7a-qb6q   <none>           <none>
	 default       testds-p6rvb                                                1/2     Running   0          8m45s   10.36.14.157   gke-cilium-ci-7-default-pool-b3b1ae7a-lsgr   <none>           <none>
	 kube-system   event-exporter-v0.2.5-7df89f4b8f-4qxmd                      2/2     Running   0          16m     10.36.13.170   gke-cilium-ci-7-default-pool-b3b1ae7a-qb6q   <none>           <none>
	 kube-system   fluentd-gcp-scaler-54ccb89d5-2vgqq                          1/1     Running   0          16m     10.36.14.29    gke-cilium-ci-7-default-pool-b3b1ae7a-lsgr   <none>           <none>
	 kube-system   fluentd-gcp-v3.1.1-d8bld                                    2/2     Running   0          15m     10.138.0.45    gke-cilium-ci-7-default-pool-b3b1ae7a-qb6q   <none>           <none>
	 kube-system   fluentd-gcp-v3.1.1-tjj8q                                    2/2     Running   0          15m     10.138.0.42    gke-cilium-ci-7-default-pool-b3b1ae7a-lsgr   <none>           <none>
	 kube-system   heapster-gke-6846b8ffb7-xbw2l                               3/3     Running   0          16m     10.36.14.36    gke-cilium-ci-7-default-pool-b3b1ae7a-lsgr   <none>           <none>
	 kube-system   kube-dns-5877696fb4-9dntr                                   4/4     Running   0          16m     10.36.13.171   gke-cilium-ci-7-default-pool-b3b1ae7a-qb6q   <none>           <none>
	 kube-system   kube-dns-5877696fb4-mzjnb                                   4/4     Running   0          16m     10.36.14.62    gke-cilium-ci-7-default-pool-b3b1ae7a-lsgr   <none>           <none>
	 kube-system   kube-dns-autoscaler-8687c64fc-5vsld                         1/1     Running   0          16m     10.36.14.228   gke-cilium-ci-7-default-pool-b3b1ae7a-lsgr   <none>           <none>
	 kube-system   kube-proxy-gke-cilium-ci-7-default-pool-b3b1ae7a-lsgr       1/1     Running   0          16m     10.138.0.42    gke-cilium-ci-7-default-pool-b3b1ae7a-lsgr   <none>           <none>
	 kube-system   kube-proxy-gke-cilium-ci-7-default-pool-b3b1ae7a-qb6q       1/1     Running   0          16m     10.138.0.45    gke-cilium-ci-7-default-pool-b3b1ae7a-qb6q   <none>           <none>
	 kube-system   l7-default-backend-8f479dd9-879zp                           1/1     Running   0          16m     10.36.13.92    gke-cilium-ci-7-default-pool-b3b1ae7a-qb6q   <none>           <none>
	 kube-system   metrics-server-v0.3.1-5c6fbf777-rjfkq                       2/2     Running   0          16m     10.36.14.78    gke-cilium-ci-7-default-pool-b3b1ae7a-lsgr   <none>           <none>
	 kube-system   prometheus-to-sd-f4sfd                                      2/2     Running   0          15m     10.138.0.42    gke-cilium-ci-7-default-pool-b3b1ae7a-lsgr   <none>           <none>
	 kube-system   prometheus-to-sd-kl6hb                                      2/2     Running   0          15m     10.138.0.45    gke-cilium-ci-7-default-pool-b3b1ae7a-qb6q   <none>           <none>
	 kube-system   registry-adder-47qm7                                        1/1     Running   0          15m     10.138.0.45    gke-cilium-ci-7-default-pool-b3b1ae7a-qb6q   <none>           <none>
	 kube-system   registry-adder-vxfjw                                        1/1     Running   0          15m     10.138.0.42    gke-cilium-ci-7-default-pool-b3b1ae7a-lsgr   <none>           <none>
	 kube-system   stackdriver-metadata-agent-cluster-level-7966cf9bff-t6wpd   2/2     Running   1          16m     10.36.13.154   gke-cilium-ci-7-default-pool-b3b1ae7a-qb6q   <none>           <none>
	 
Stderr:
 	 

Fetching command output from pods [cilium-4f5cd cilium-5thlk]
cmd: kubectl exec -n cilium cilium-4f5cd -- cilium service list
Exitcode: 0 
Stdout:
 	 ID   Frontend              Service Type   Backend                  
	 1    10.39.240.1:443       ClusterIP      1 => 35.203.147.18:443   
	 2    10.39.252.13:80       ClusterIP      1 => 10.36.13.92:8080    
	 3    10.39.240.10:53       ClusterIP      1 => 10.36.13.171:53     
	                                           2 => 10.36.14.62:53      
	 4    10.39.248.2:443       ClusterIP      1 => 10.36.14.78:443     
	 5    10.39.252.167:80      ClusterIP      1 => 10.36.14.36:8082    
	 18   10.39.244.249:80      ClusterIP                               
	 19   10.39.244.249:69      ClusterIP                               
	 20   10.39.251.255:2379    ClusterIP                               
	 21   10.39.242.177:10080   ClusterIP                               
	 22   10.39.242.177:10069   ClusterIP                               
	 23   10.39.248.29:10069    ClusterIP                               
	 24   10.39.248.29:10080    ClusterIP                               
	 25   10.39.255.140:10080   ClusterIP                               
	 26   10.39.255.140:10069   ClusterIP                               
	 27   10.39.247.149:10080   ClusterIP      1 => 10.36.13.174:80     
	 28   10.39.247.149:10069   ClusterIP      1 => 10.36.13.174:69     
	 29   10.39.246.62:10080    ClusterIP      1 => 10.36.13.174:80     
	 30   10.39.246.62:10069    ClusterIP      1 => 10.36.13.174:69     
	 31   10.39.244.12:80       ClusterIP                               
	 32   10.39.249.228:80      ClusterIP      1 => 10.36.13.174:80     
	 
Stderr:
 	 

cmd: kubectl exec -n cilium cilium-4f5cd -- cilium endpoint list
Exitcode: 0 
Stdout:
 	 ENDPOINT   POLICY (ingress)   POLICY (egress)   IDENTITY   LABELS (source:key[=value])                                   IPv6   IPv4           STATUS   
	            ENFORCEMENT        ENFORCEMENT                                                                                                      
	 240        Enabled            Disabled          41997      k8s:io.cilium.k8s.policy.cluster=default                             10.36.14.157   ready   
	                                                            k8s:io.cilium.k8s.policy.serviceaccount=default                                             
	                                                            k8s:io.kubernetes.pod.namespace=default                                                     
	                                                            k8s:zgroup=testDS                                                                           
	 583        Disabled           Disabled          14714      k8s:io.cilium.k8s.policy.cluster=default                             10.36.14.29    ready   
	                                                            k8s:io.cilium.k8s.policy.serviceaccount=fluentd-gcp-scaler                                  
	                                                            k8s:io.kubernetes.pod.namespace=kube-system                                                 
	                                                            k8s:k8s-app=fluentd-gcp-scaler                                                              
	 870        Disabled           Disabled          16599      k8s:io.cilium.k8s.policy.cluster=default                             10.36.14.53    ready   
	                                                            k8s:io.cilium.k8s.policy.serviceaccount=default                                             
	                                                            k8s:io.kubernetes.pod.namespace=default                                                     
	                                                            k8s:zgroup=testDSClient                                                                     
	 986        Disabled           Disabled          43521      k8s:io.cilium.k8s.policy.cluster=default                             10.36.14.36    ready   
	                                                            k8s:io.cilium.k8s.policy.serviceaccount=heapster                                            
	                                                            k8s:io.kubernetes.pod.namespace=kube-system                                                 
	                                                            k8s:k8s-app=heapster                                                                        
	                                                            k8s:version=v1.7.2                                                                          
	 1258       Disabled           Disabled          41465      k8s:io.cilium.k8s.policy.cluster=default                             10.36.14.78    ready   
	                                                            k8s:io.cilium.k8s.policy.serviceaccount=metrics-server                                      
	                                                            k8s:io.kubernetes.pod.namespace=kube-system                                                 
	                                                            k8s:k8s-app=metrics-server                                                                  
	                                                            k8s:version=v0.3.1                                                                          
	 2074       Disabled           Disabled          4          reserved:health                                                      10.36.14.239   ready   
	 2968       Disabled           Disabled          26607      k8s:io.cilium.k8s.policy.cluster=default                             10.36.14.228   ready   
	                                                            k8s:io.cilium.k8s.policy.serviceaccount=kube-dns-autoscaler                                 
	                                                            k8s:io.kubernetes.pod.namespace=kube-system                                                 
	                                                            k8s:k8s-app=kube-dns-autoscaler                                                             
	 3099       Disabled           Disabled          12099      k8s:io.cilium.k8s.policy.cluster=default                             10.36.14.62    ready   
	                                                            k8s:io.cilium.k8s.policy.serviceaccount=kube-dns                                            
	                                                            k8s:io.kubernetes.pod.namespace=kube-system                                                 
	                                                            k8s:k8s-app=kube-dns                                                                        
	 
Stderr:
 	 

cmd: kubectl exec -n cilium cilium-5thlk -- cilium service list
Exitcode: 0 
Stdout:
 	 ID   Frontend              Service Type   Backend                  
	 1    10.39.240.10:53       ClusterIP      1 => 10.36.13.171:53     
	                                           2 => 10.36.14.62:53      
	 2    10.39.240.1:443       ClusterIP      1 => 35.203.147.18:443   
	 3    10.39.252.167:80      ClusterIP      1 => 10.36.14.36:8082    
	 4    10.39.252.13:80       ClusterIP      1 => 10.36.13.92:8080    
	 5    10.39.248.2:443       ClusterIP      1 => 10.36.14.78:443     
	 18   10.39.244.249:69      ClusterIP                               
	 19   10.39.244.249:80      ClusterIP                               
	 20   10.39.251.255:2379    ClusterIP                               
	 21   10.39.242.177:10080   ClusterIP                               
	 22   10.39.242.177:10069   ClusterIP                               
	 23   10.39.248.29:10080    ClusterIP                               
	 24   10.39.248.29:10069    ClusterIP                               
	 25   10.39.255.140:10080   ClusterIP                               
	 26   10.39.255.140:10069   ClusterIP                               
	 27   10.39.247.149:10080   ClusterIP      1 => 10.36.13.174:80     
	 28   10.39.247.149:10069   ClusterIP      1 => 10.36.13.174:69     
	 29   10.39.246.62:10069    ClusterIP      1 => 10.36.13.174:69     
	 30   10.39.246.62:10080    ClusterIP      1 => 10.36.13.174:80     
	 31   10.39.244.12:80       ClusterIP                               
	 32   10.39.249.228:80      ClusterIP      1 => 10.36.13.174:80     
	 
Stderr:
 	 

cmd: kubectl exec -n cilium cilium-5thlk -- cilium endpoint list
Exitcode: 0 
Stdout:
 	 ENDPOINT   POLICY (ingress)   POLICY (egress)   IDENTITY   LABELS (source:key[=value])                                 IPv6   IPv4           STATUS   
	            ENFORCEMENT        ENFORCEMENT                                                                                                    
	 91         Disabled           Disabled          4          reserved:health                                                    10.36.13.250   ready   
	 157        Disabled           Disabled          25975      k8s:io.cilium.k8s.policy.cluster=default                           10.36.13.170   ready   
	                                                            k8s:io.cilium.k8s.policy.serviceaccount=event-exporter-sa                                 
	                                                            k8s:io.kubernetes.pod.namespace=kube-system                                               
	                                                            k8s:k8s-app=event-exporter                                                                
	                                                            k8s:version=v0.2.5                                                                        
	 484        Disabled           Disabled          22506      k8s:app=stackdriver-metadata-agent                                 10.36.13.154   ready   
	                                                            k8s:cluster-level=true                                                                    
	                                                            k8s:io.cilium.k8s.policy.cluster=default                                                  
	                                                            k8s:io.cilium.k8s.policy.serviceaccount=metadata-agent                                    
	                                                            k8s:io.kubernetes.pod.namespace=kube-system                                               
	 782        Disabled           Disabled          12099      k8s:io.cilium.k8s.policy.cluster=default                           10.36.13.171   ready   
	                                                            k8s:io.cilium.k8s.policy.serviceaccount=kube-dns                                          
	                                                            k8s:io.kubernetes.pod.namespace=kube-system                                               
	                                                            k8s:k8s-app=kube-dns                                                                      
	 2146       Disabled           Disabled          12186      k8s:io.cilium.k8s.policy.cluster=default                           10.36.13.92    ready   
	                                                            k8s:io.cilium.k8s.policy.serviceaccount=default                                           
	                                                            k8s:io.kubernetes.pod.namespace=kube-system                                               
	                                                            k8s:k8s-app=glbc                                                                          
	                                                            k8s:name=glbc                                                                             
	 2214       Disabled           Disabled          1450       k8s:io.cilium.k8s.policy.cluster=default                           10.36.13.174   ready   
	                                                            k8s:io.cilium.k8s.policy.serviceaccount=default                                           
	                                                            k8s:io.kubernetes.pod.namespace=default                                                   
	                                                            k8s:zgroup=test-k8s2                                                                      
	 3391       Enabled            Disabled          41997      k8s:io.cilium.k8s.policy.cluster=default                           10.36.13.212   ready   
	                                                            k8s:io.cilium.k8s.policy.serviceaccount=default                                           
	                                                            k8s:io.kubernetes.pod.namespace=default                                                   
	                                                            k8s:zgroup=testDS                                                                         
	 3475       Disabled           Disabled          16599      k8s:io.cilium.k8s.policy.cluster=default                           10.36.13.14    ready   
	                                                            k8s:io.cilium.k8s.policy.serviceaccount=default                                           
	                                                            k8s:io.kubernetes.pod.namespace=default                                                   
	                                                            k8s:zgroup=testDSClient                                                                   
	 
Stderr:
 	 

===================== Exiting AfterFailed =====================
```

**Comment by tgraf** [comment]
This is a legitimate failure. L7 proxy redirection from the host into a pod is currently broken when `enable-endpoint-routes` is set. This currently affects: GKE, Azure, ENI.

**Comment by jrajahalme** [comment]
@tgraf Is there any way to locally (in DevVMs) use the datapath mode this is failing on? I.e., is there a way to run with `enable-endpoint-routes` set with `k8s1` and `k8s2` running locally, maybe by manually adding some routes?

**Comment by jrajahalme** [comment]
Azure and ENI have `xt_socket`? If so, then this can't be the issue:

```
10:11:15  Top 5 errors/warnings:
...
10:11:15  BPF host reachable services for UDP needs kernel 4.19.57, 5.1.16, 5.2.0 or newer. If you run an older kernel and only need TCP, then specify: --host-reachable-services-protos=tcp Disabling the feature.
10:11:15  xt_socket kernel module could not be loaded
10:11:15  Disabled ip_early_demux to allow proxy redirection with original source/destination address without xt_socket support also in non-tunneled datapath modes.
```

If the host-to-pod L7 redirection fail only affects systems that do NOT have `xt_socket` then it is possible that the fall-back to disabling ip_early_demux does not fix the missing `xt_socket` for host-to-pod traffic?

Does this failure require NodePort/service, so direct access from host with POD's own IP works (as it is tested by other, non-failing tests)?

**Comment by jrajahalme** [comment]
I ran this test in PR (#11342), focusing on just this test. The test installs the policy before waiting for the PODs to become ready. The policy redirects TCP port 80 via the host proxy. The testds POD "web" container never passes the readiness probe. Looks like the readiness probe would be failing for the same reason (proxy redirection from the host not working), when the test installs the l7 policy before the readiness probe has had a chance to succeed?

**Comment by tgraf** [comment]
I've left the test failing on GKE with `holdEnvironment=true` and I could see it failing while running `curl` manually. It immediately started working when I disabled `enable-endpoint-routes`.

It is possible that this is related to xt_socket

**Comment by jrajahalme** [comment]
When waiting for the PODs to become ready *before* applying the policy the HTTP, and then *not* waiting for PODs to be(come) ready at the beginning of the traffic test, I see the HTTP tests passing, also can see the request and response in Envoy logs:
```
2020-05-05T20:03:20.685932751Z level=debug msg="[[external/envoy/source/common/http/conn_manager_impl.cc:731] [C12][S5626879365898605597] request headers complete (end_stream=true):" subsys=envoy-http threadID=563
2020-05-05T20:03:20.685939327Z level=debug msg="':authority', '10.15.244.35:10080'" subsys=envoy-http threadID=563
2020-05-05T20:03:20.68594542Z level=debug msg="':path', '/'" subsys=envoy-http threadID=563
2020-05-05T20:03:20.685951279Z level=debug msg="':method', 'GET'" subsys=envoy-http threadID=563
2020-05-05T20:03:20.685957246Z level=debug msg="'user-agent', 'curl/7.59.0'" subsys=envoy-http threadID=563
2020-05-05T20:03:20.68596298Z level=debug msg="'accept', '*/*'" subsys=envoy-http threadID=563
2020-05-05T20:03:20.685968716Z level=debug msg="[[external/envoy/source/common/http/conn_manager_impl.cc:1276] [C12][S5626879365898605597] request end stream" subsys=envoy-http threadID=563
2020-05-05T20:03:20.685974971Z level=debug msg="[[cilium/l7policy.cc:111] Cilium L7: Ingress (8201->0) policy lookup for endpoint 10.13.12.3: ALLOW" subsys=envoy-filter threadID=563
...
2020-05-05T20:03:20.686885613Z level=debug msg="[[external/envoy/source/common/http/conn_manager_impl.cc:1615] [C12][S5626879365898605597] encoding headers via codec (end_stream=false):" subsys=envoy-http threadID=563
2020-05-05T20:03:20.686899946Z level=debug msg="':status', '200'" subsys=envoy-http threadID=563
2020-05-05T20:03:20.686906184Z level=debug msg="'date', 'Tue, 05 May 2020 20:03:20 GMT'" subsys=envoy-http threadID=563
2020-05-05T20:03:20.686912198Z level=debug msg="'content-type', 'text/plain'" subsys=envoy-http threadID=563
2020-05-05T20:03:20.686918226Z level=debug msg="'server', 'envoy'" subsys=envoy-http threadID=563
2020-05-05T20:03:20.686924Z level=debug msg="'x-envoy-upstream-service-time', '0'" subsys=envoy-http threadID=563
2020-05-05T20:03:20.687025992Z level=debug msg="[[external/envoy/source/common/http/codec_client.cc:104] [C13] response complete" subsys=envoy-client threadID=563
```

**Comment by jrajahalme** [comment]
So one of the problems in this scenario is that why the container readiness probes fail on GKE when the destination POD has this policy installed:
```
apiVersion: "cilium.io/v2"
kind: CiliumNetworkPolicy
description: "L7 policy for allowing all traffic via proxy in demo DS"
metadata:
  name: "l7-policy-demo"
spec:
  endpointSelector:
    matchLabels:
      zgroup: testDS
  ingress:
  - toPorts:
    - ports:
      - port: "80"
        protocol: TCP
      rules:
        http:
        - {}
    - ports:
      # we allow tftp traffic to bypass the proxy
      - port: "69"
        protocol: UDP
```
This policy should allow the HTTP readiness probe from any source?

**Comment by jrajahalme** [comment]
Another problem is the tftp not working even though http test traffic works. tftp is not proxied,  so this should not be a proxy redirection issue. In the testDS UDP logs we can see that the tftp requests come though:
```
2020-05-05T19:40:15.779868353Z 2020/05/05 19:40:15 Listening on: ":69"
2020-05-05T20:03:28.769348652Z 2020/05/05 20:03:28 Read "hello" requested from 10.13.12.179:51014
2020-05-05T20:03:29.634115704Z 2020/05/05 20:03:29 Read "hello" requested from 10.13.12.179:48037
```
Timing here matches the tftp requests in the `test-output.log`:
```
STEP: Making 10 curl requests from "testclient-bqscs" to "tftp://10.15.244.35:10069/hello"
time="2020-05-05T20:03:23Z" level=debug msg="running command: kubectl exec -n default testclient-bqscs -- curl --path-as-is -s -D /dev/stderr --fail --connect-timeout 5 --max-time 8 tftp://10.15.244.35:10069/hello -w \"time-> DNS: '%{time_namelookup}(%{remote_ip})', Connect: '%{time_connect}',Transfer '%{time_starttransfer}', total '%{time_total}'\""
time="2020-05-05T20:03:26Z" level=debug msg="running command: kubectl exec -n cilium cilium-qmnxz -- uptime"
cmd: "kubectl exec -n cilium cilium-qmnxz -- uptime" exitCode: 0 duration: 871.220344ms stdout:
 20:03:27 up 6 days,  5:06,  0 users,  load average: 1.37, 1.26, 1.19

time="2020-05-05T20:03:27Z" level=debug msg="running command: kubectl exec -n cilium cilium-w2mfq -- uptime"
cmd: "kubectl exec -n cilium cilium-w2mfq -- uptime" exitCode: 0 duration: 873.999814ms stdout:
 20:03:28 up 6 days,  5:06,  0 users,  load average: 1.34, 1.48, 1.34

cmd: "kubectl exec -n default testclient-bqscs -- curl --path-as-is -s -D /dev/stderr --fail --connect-timeout 5 --max-time 8 tftp://10.15.244.35:10069/hello -w \"time-> DNS: '%{time_namelookup}(%{remote_ip})', Connect: '%{time_connect}',Transfer '%{time_starttransfer}', total '%{time_total}'\"" exitCode: 0 duration: 5.085936702s stdout:

Hostname: testds-2f9w8

Request Information:
	client_address=10.13.12.179
	client_port=51014
	real path=/hello
	request_scheme=tftp

time-> DNS: '0.000036()', Connect: '0.000062',Transfer '0.000000', total '4.206292'
time="2020-05-05T20:03:28Z" level=debug msg="running command: kubectl exec -n default testclient-bqscs -- curl --path-as-is -s -D /dev/stderr --fail --connect-timeout 5 --max-time 8 tftp://10.15.244.35:10069/hello -w \"time-> DNS: '%{time_namelookup}(%{remote_ip})', Connect: '%{time_connect}',Transfer '%{time_starttransfer}', total '%{time_total}'\""
cmd: "kubectl exec -n default testclient-bqscs -- curl --path-as-is -s -D /dev/stderr --fail --connect-timeout 5 --max-time 8 tftp://10.15.244.35:10069/hello -w \"time-> DNS: '%{time_namelookup}(%{remote_ip})', Connect: '%{time_connect}',Transfer '%{time_starttransfer}', total '%{time_total}'\"" exitCode: 0 duration: 859.755965ms stdout:

Hostname: testds-2f9w8

Request Information:
	client_address=10.13.12.179
	client_port=48037
	real path=/hello
	request_scheme=tftp

time-> DNS: '0.000025()', Connect: '0.000043',Transfer '0.000000', total '0.000772'
```
It looks like the problem would be the return traffic not getting back. This is UDP, so 'Connect' timing above does not imply any return traffic being received.

**Comment by jrajahalme** [comment]
Above data from https://jenkins.cilium.io/job/Cilium-PR-K8s-GKE/1004/testReport/Suite-k8s-1/14/K8sServicesTest_Checks_service_across_nodes_with_L7_policy_Tests_NodePort_with_L7_Policy/

[b9b48587_K8sServicesTest_Checks_service_across_nodes_with_L7_policy_Tests_NodePort_with_L7_Policy.zip](https://github.com/cilium/cilium/files/4583842/b9b48587_K8sServicesTest_Checks_service_across_nodes_with_L7_policy_Tests_NodePort_with_L7_Policy.zip)

**Comment by jrajahalme** [comment]
Tested with a readiness probe based on `curl` instead of `httpGet` on the premise that maybe the implementation of `httpGet` gets confused when the TCP connection is redirected to the proxy (which basically leads the existing connection to fail due to the host stack now getting the packets), using this diff:
```
diff --git a/test/k8sT/manifests/demo_ds.yaml b/test/k8sT/manifests/demo_ds.yaml
index 423b0b4a71..8d7edfdd92 100644
--- a/test/k8sT/manifests/demo_ds.yaml
+++ b/test/k8sT/manifests/demo_ds.yaml
@@ -19,9 +19,13 @@ spec:
         ports:
         - containerPort: 80
         readinessProbe:
-          httpGet:
-            path: /
-            port: 80
+          exec:
+            command:
+            - curl
+            - -sS
+            - -o
+            - /dev/null
+            - http://localhost:80/
       - name: udp
         image: docker.io/cilium/echoserver-udp:v2020.01.30
         imagePullPolicy: IfNotPresent
```
With this the readiness probes succeed through the policy change and beyond. Here `curl/7.47.01` is the readiness probe taking place every 10 seconds, and `curl/7.59.0` is the test traffic:
```
Generating self-signed cert
Generating a 2048 bit RSA private key
..........................+++
............................+++
writing new private key to '/certs/privateKey.key'
-----
Starting nginx
::ffff:127.0.0.1 - - [05/May/2020:23:04:34 +0000] "GET / HTTP/1.1" 200 418 "-" "curl/7.47.0"
::ffff:127.0.0.1 - - [05/May/2020:23:04:43 +0000] "GET / HTTP/1.1" 200 418 "-" "curl/7.47.0"
::ffff:127.0.0.1 - - [05/May/2020:23:04:53 +0000] "GET / HTTP/1.1" 200 418 "-" "curl/7.47.0"
::ffff:10.138.0.49 - - [05/May/2020:23:05:00 +0000] "GET / HTTP/1.1" 200 567 "-" "curl/7.59.0"
::ffff:10.138.0.49 - - [05/May/2020:23:05:02 +0000] "GET / HTTP/1.1" 200 567 "-" "curl/7.59.0"
::ffff:127.0.0.1 - - [05/May/2020:23:05:03 +0000] "GET / HTTP/1.1" 200 418 "-" "curl/7.47.0"
::ffff:10.138.0.49 - - [05/May/2020:23:05:04 +0000] "GET / HTTP/1.1" 200 567 "-" "curl/7.59.0"
::ffff:10.138.0.49 - - [05/May/2020:23:05:06 +0000] "GET / HTTP/1.1" 200 567 "-" "curl/7.59.0"
::ffff:10.138.0.49 - - [05/May/2020:23:05:07 +0000] "GET / HTTP/1.1" 200 567 "-" "curl/7.59.0"
::ffff:10.138.0.49 - - [05/May/2020:23:05:10 +0000] "GET / HTTP/1.1" 200 567 "-" "curl/7.59.0"
::ffff:10.138.0.49 - - [05/May/2020:23:05:11 +0000] "GET / HTTP/1.1" 200 567 "-" "curl/7.59.0"
::ffff:10.138.0.49 - - [05/May/2020:23:05:12 +0000] "GET / HTTP/1.1" 200 567 "-" "curl/7.59.0"
::ffff:127.0.0.1 - - [05/May/2020:23:05:13 +0000] "GET / HTTP/1.1" 200 418 "-" "curl/7.47.0"
::ffff:10.138.0.49 - - [05/May/2020:23:05:14 +0000] "GET / HTTP/1.1" 200 567 "-" "curl/7.59.0"
::ffff:10.138.0.49 - - [05/May/2020:23:05:15 +0000] "GET / HTTP/1.1" 200 567 "-" "curl/7.59.0"
::ffff:127.0.0.1 - - [05/May/2020:23:05:23 +0000] "GET / HTTP/1.1" 200 418 "-" "curl/7.47.0"
::ffff:127.0.0.1 - - [05/May/2020:23:05:33 +0000] "GET / HTTP/1.1" 200 418 "-" "curl/7.47.0"
::ffff:127.0.0.1 - - [05/May/2020:23:05:43 +0000] "GET / HTTP/1.1" 200 418 "-" "curl/7.47.0"
::ffff:127.0.0.1 - - [05/May/2020:23:05:53 +0000] "GET / HTTP/1.1" 200 418 "-" "curl/7.47.0"
::ffff:127.0.0.1 - - [05/May/2020:23:06:03 +0000] "GET / HTTP/1.1" 200 418 "-" "curl/7.47.0"
::ffff:127.0.0.1 - - [05/May/2020:23:06:13 +0000] "GET / HTTP/1.1" 200 418 "-" "curl/7.47.0"
::ffff:127.0.0.1 - - [05/May/2020:23:06:23 +0000] "GET / HTTP/1.1" 200 418 "-" "curl/7.47.0"
```

**Comment by jrajahalme** [comment]
Finally got this reproduced locally. Service can be accessed from another pod with L7 redirection enabled, but accessing the same service from the host via a hostport fails:
```
STEP: Applying policy /home/vagrant/go/src/github.com/cilium/cilium/test/k8sT/manifests/l7-policy-demo.yaml
STEP: Making 10 curl requests from "testclient-drqzv" to "http://10.105.101.115:10080"
STEP: Making 10 curl requests from "testclient-lgnz2" to "http://10.105.101.115:10080"
STEP: Making 10 curl requests from "testclient-drqzv" to "tftp://10.105.101.115:10069/hello"
STEP: Making 10 curl requests from "testclient-lgnz2" to "tftp://10.105.101.115:10069/hello"
STEP: Making 10 curl requests from k8s1 to "http://127.0.0.1:31129"
=== Test Finished at 2020-05-06T14:59:52-07:00====
===================== TEST FAILED =====================
```
Relevant monitor messages:
```
CPU 01: MARK 0x64616f3c FROM 3760 DEBUG: Inheriting identity=1 from stack
CPU 01: MARK 0x64616f3c FROM 3760 DEBUG: Successfully mapped daddr=10.10.0.123 to identity=1
CPU 01: MARK 0x64616f3c FROM 3760 DEBUG: Attempting local delivery for container id 3760 from seclabel 53153
CPU 01: MARK 0x64616f3c FROM 3760 DEBUG: Conntrack lookup 1/2: src=10.10.0.123:43112 dst=10.10.0.182:80
CPU 01: MARK 0x64616f3c FROM 3760 DEBUG: Conntrack lookup 2/2: nexthdr=6 flags=0
CPU 01: MARK 0x64616f3c FROM 3760 DEBUG: CT verdict: New, revnat=0
Policy verdict log: flow 0x64616f3c local EP ID 3760, remote ID 1, dst port 80, proto 6, ingress true, action redirect, match L4-Only, 10.10.0.123:43112 -> 10.10.0.182:80 tcp SYN
CPU 01: MARK 0x64616f3c FROM 3760 DEBUG: Conntrack create: proxy-port=0 revnat=0 src-identity=1 lb=0.0.0.0
------------------------------------------------------------------------------
CPU 01: MARK 0x64616f3c FROM 3760 to-proxy: 74 bytes (74 captured), state new, identity 1->53153, orig-ip 10.10.0.123
Ethernet	{Contents=[..14..] Payload=[..62..] SrcMAC=2a:f9:5e:10:d6:2c DstMAC=8e:10:ae:90:95:d8 EthernetType=IPv4 Length=0}
IPv4	{Contents=[..20..] Payload=[..40..] Version=4 IHL=5 TOS=0 Length=60 Id=34190 Flags=DF FragOffset=0 TTL=64 Protocol=TCP Checksum=40937 SrcIP=10.10.0.123 DstIP=10.10.0.182 Options=[] Padding=[]}
TCP	{Contents=[..40..] Payload=[] SrcPort=43112 DstPort=80(http) Seq=531482827 Ack=0 DataOffset=10 FIN=false SYN=true RST=false PSH=false ACK=false URG=false ECE=false CWR=false NS=false Window=43690 Checksum=5491 Urgent=0 Options=[..5..] Padding=[]}
------------------------------------------------------------------------------
CPU 01: MARK 0x64616f3c FROM 3760 DEBUG: 74 bytes, Packet to proxy port 12077 (Post)
Ethernet	{Contents=[..14..] Payload=[..62..] SrcMAC=2a:f9:5e:10:d6:2c DstMAC=8e:f3:7e:a0:a2:9a EthernetType=IPv4 Length=0}
IPv4	{Contents=[..20..] Payload=[..40..] Version=4 IHL=5 TOS=0 Length=60 Id=34190 Flags=DF FragOffset=0 TTL=63 Protocol=TCP Checksum=41193 SrcIP=10.10.0.123 DstIP=10.10.0.182 Options=[] Padding=[]}
TCP	{Contents=[..40..] Payload=[] SrcPort=43112 DstPort=80(http) Seq=531482827 Ack=0 DataOffset=10 FIN=false SYN=true RST=false PSH=false ACK=false URG=false ECE=false CWR=false NS=false Window=43690 Checksum=5491 Urgent=0 Options=[..5..] Padding=[]}
------------------------------------------------------------------------------
CPU 01: MARK 0x64616f3c FROM 0 DEBUG: 74 bytes, Packet to proxy port 12077 (Post)
Ethernet	{Contents=[..14..] Payload=[..62..] SrcMAC=2a:f9:5e:10:d6:2c DstMAC=8e:f3:7e:a0:a2:9a EthernetType=IPv4 Length=0}
IPv4	{Contents=[..20..] Payload=[..40..] Version=4 IHL=5 TOS=0 Length=60 Id=34190 Flags=DF FragOffset=0 TTL=63 Protocol=TCP Checksum=41193 SrcIP=10.10.0.123 DstIP=10.10.0.182 Options=[] Padding=[]}
TCP	{Contents=[..40..] Payload=[] SrcPort=43112 DstPort=80(http) Seq=531482827 Ack=0 DataOffset=10 FIN=false SYN=true RST=false PSH=false ACK=false URG=false ECE=false CWR=false NS=false Window=43690 Checksum=5491 Urgent=0 Options=[..5..] Padding=[]}
CPU 01: MARK 0x0 FROM 3760 DEBUG: Inheriting identity=1 from stack
CPU 01: MARK 0x0 FROM 3760 DEBUG: Successfully mapped daddr=10.10.0.123 to identity=1
CPU 01: MARK 0x0 FROM 3760 DEBUG: Attempting local delivery for container id 3760 from seclabel 53153
CPU 01: MARK 0x0 FROM 3760 DEBUG: Conntrack lookup 1/2: src=10.10.0.123:43112 dst=10.10.0.182:80
CPU 01: MARK 0x0 FROM 3760 DEBUG: Conntrack lookup 2/2: nexthdr=6 flags=0
CPU 01: MARK 0x0 FROM 3760 DEBUG: CT entry found lifetime=3546, revnat=0
CPU 01: MARK 0x0 FROM 3760 DEBUG: CT verdict: Established, revnat=0
------------------------------------------------------------------------------
CPU 01: MARK 0x0 FROM 3760 to-proxy: 54 bytes (54 captured), state established, identity 1->53153, orig-ip 10.10.0.123
Ethernet	{Contents=[..14..] Payload=[..46..] SrcMAC=2a:f9:5e:10:d6:2c DstMAC=8e:10:ae:90:95:d8 EthernetType=IPv4 Length=0}
IPv4	{Contents=[..20..] Payload=[..20..] Version=4 IHL=5 TOS=0 Length=40 Id=0 Flags=DF FragOffset=0 TTL=64 Protocol=TCP Checksum=9612 SrcIP=10.10.0.123 DstIP=10.10.0.182 Options=[] Padding=[]}
TCP	{Contents=[..20..] Payload=[] SrcPort=43112 DstPort=80(http) Seq=531482828 Ack=0 DataOffset=5 FIN=false SYN=false RST=true PSH=false ACK=false URG=false ECE=false CWR=false NS=false Window=0 Checksum=2410 Urgent=0 Options=[] Padding=[]}
------------------------------------------------------------------------------
CPU 01: MARK 0x0 FROM 3760 DEBUG: 54 bytes, Packet to proxy port 12077 (Post)
Ethernet	{Contents=[..14..] Payload=[..46..] SrcMAC=2a:f9:5e:10:d6:2c DstMAC=8e:f3:7e:a0:a2:9a EthernetType=IPv4 Length=0}
IPv4	{Contents=[..20..] Payload=[..20..] Version=4 IHL=5 TOS=0 Length=40 Id=0 Flags=DF FragOffset=0 TTL=63 Protocol=TCP Checksum=9868 SrcIP=10.10.0.123 DstIP=10.10.0.182 Options=[] Padding=[]}
TCP	{Contents=[..20..] Payload=[] SrcPort=43112 DstPort=80(http) Seq=531482828 Ack=0 DataOffset=5 FIN=false SYN=false RST=true PSH=false ACK=false URG=false ECE=false CWR=false NS=false Window=0 Checksum=2410 Urgent=0 Options=[] Padding=[]}
------------------------------------------------------------------------------
CPU 01: MARK 0x0 FROM 0 DEBUG: 54 bytes, Packet to proxy port 12077 (Post)
Ethernet	{Contents=[..14..] Payload=[..46..] SrcMAC=2a:f9:5e:10:d6:2c DstMAC=8e:f3:7e:a0:a2:9a EthernetType=IPv4 Length=0}
IPv4	{Contents=[..20..] Payload=[..20..] Version=4 IHL=5 TOS=0 Length=40 Id=0 Flags=DF FragOffset=0 TTL=63 Protocol=TCP Checksum=9868 SrcIP=10.10.0.123 DstIP=10.10.0.182 Options=[] Padding=[]}
TCP	{Contents=[..20..] Payload=[] SrcPort=43112 DstPort=80(http) Seq=531482828 Ack=0 DataOffset=5 FIN=false SYN=false RST=true PSH=false ACK=false URG=false ECE=false CWR=false NS=false Window=0 Checksum=2410 Urgent=0 Options=[] Padding=[]}
```
This pattern of SYN followed by RST from the source repeats a few times from the same source port. No reply traffic for these in the monitor.

**Comment by jrajahalme** [comment]
These packets reach the TPROXY rule as expected:
```
[3:180] -A CILIUM_PRE_mangle -p tcp -m mark --mark 0xf53e0200 -m comment --comment "cilium: TPROXY to host cilium-http-ingress proxy" -j TPROXY --on-port 16117 --on-ip 0.0.0.0 --tproxy-mark 0x200/0xffffffff
```

**Comment by jrajahalme** [comment]
Tested with tcpdump in both nodes, only SYN is seen on the wire:

Source (k8s2):
```
vagrant@k8s2:~$ sudo tcpdump -nvi enp0s8 not port 6443 and not port 10250 and not port 4240 and not icmp
tcpdump: listening on enp0s8, link-type EN10MB (Ethernet), capture size 262144 bytes
19:58:29.557089 IP (tos 0x0, ttl 63, id 23277, offset 0, flags [DF], proto TCP (6), length 60)
    192.168.36.12.54512 > 192.168.36.11.31129: Flags [S], cksum 0xc996 (incorrect -> 0xad94), seq 2721847086, win 29200, options [mss 1460,sackOK,TS val 20403655 ecr 0,nop,wscale 7], length 0
19:58:30.584780 IP (tos 0x0, ttl 63, id 23278, offset 0, flags [DF], proto TCP (6), length 60)
    192.168.36.12.54512 > 192.168.36.11.31129: Flags [S], cksum 0xc996 (incorrect -> 0xac93), seq 2721847086, win 29200, options [mss 1460,sackOK,TS val 20403912 ecr 0,nop,wscale 7], length 0
19:58:32.600741 IP (tos 0x0, ttl 63, id 23279, offset 0, flags [DF], proto TCP (6), length 60)
    192.168.36.12.54512 > 192.168.36.11.31129: Flags [S], cksum 0xc996 (incorrect -> 0xaa9b), seq 2721847086, win 29200, options [mss 1460,sackOK,TS val 20404416 ecr 0,nop,wscale 7], length 0
^C
3 packets captured
3 packets received by filter
0 packets dropped by kernel
```
Destination (k8s1):
```
vagrant@k8s1:~$ sudo tcpdump -nvi enp0s8 not port 6443 and not port 10250 and not port 4240 and not icmp
tcpdump: listening on enp0s8, link-type EN10MB (Ethernet), capture size 262144 bytes
19:58:29.559582 IP (tos 0x0, ttl 63, id 23277, offset 0, flags [DF], proto TCP (6), length 60)
    192.168.36.12.54512 > 192.168.36.11.31129: Flags [S], cksum 0xad94 (correct), seq 2721847086, win 29200, options [mss 1460,sackOK,TS val 20403655 ecr 0,nop,wscale 7], length 0
19:58:30.587351 IP (tos 0x0, ttl 63, id 23278, offset 0, flags [DF], proto TCP (6), length 60)
    192.168.36.12.54512 > 192.168.36.11.31129: Flags [S], cksum 0xac93 (correct), seq 2721847086, win 29200, options [mss 1460,sackOK,TS val 20403912 ecr 0,nop,wscale 7], length 0
19:58:32.603208 IP (tos 0x0, ttl 63, id 23279, offset 0, flags [DF], proto TCP (6), length 60)
    192.168.36.12.54512 > 192.168.36.11.31129: Flags [S], cksum 0xaa9b (correct), seq 2721847086, win 29200, options [mss 1460,sackOK,TS val 20404416 ecr 0,nop,wscale 7], length 0
^C
3 packets captured
3 packets received by filter
0 packets dropped by kernel
```

**Comment by jrajahalme** [comment]
SYN ACKs can be seen on the `lo` device on the destination (this is different test run so the sequence numbers do not match the above):
```
vagrant@k8s1:~$ sudo tcpdump -nvi lo port 80
tcpdump: listening on lo, link-type EN10MB (Ethernet), capture size 262144 bytes
21:27:06.341073 IP (tos 0x0, ttl 64, id 0, offset 0, flags [DF], proto TCP (6), length 60)
    10.10.0.182.80 > 10.0.2.15.61114: Flags [S.], cksum 0x16fd (incorrect -> 0x4aec), seq 912638323, ack 3284315795, win 43690, options [mss 65495,sackOK,TS val 21907361 ecr 21732850,nop,wscale 7], length 0
21:27:07.363843 IP (tos 0x0, ttl 64, id 0, offset 0, flags [DF], proto TCP (6), length 60)
    10.10.0.182.80 > 10.0.2.15.61114: Flags [S.], cksum 0x16fd (incorrect -> 0x6ed0), seq 928619164, ack 3284315795, win 43690, options [mss 65495,sackOK,TS val 21907616 ecr 21733106,nop,wscale 7], length 0
21:27:09.371515 IP (tos 0x0, ttl 64, id 0, offset 0, flags [DF], proto TCP (6), length 60)
    10.10.0.182.80 > 10.0.2.15.61114: Flags [S.], cksum 0x16fd (incorrect -> 0xc47a), seq 959987495, ack 3284315795, win 43690, options [mss 65495,sackOK,TS val 21908118 ecr 21733608,nop,wscale 7], length 0
^C
3 packets captured
6 packets received by filter
0 packets dropped by kernel
vagrant@k8s1:~$ 
```

**Comment by jrajahalme** [comment]
Consolidated view on enp0s8, cilium_host, and lo at the destination node (k8s1). Note the tight timing between the last two:
```
enp0s8:      21:36:38.877439 IP (tos 0x0, ttl 63, id 12432, offset 0, flags [DF], proto TCP (6), length 60)
                 192.168.36.12.44230 > 192.168.36.11.31129: Flags [S], cksum 0xe6ce (correct), seq 3447939959, win 29200, options [mss 1460,sackOK,TS val 21875984 ecr 0,nop,wscale 7], length 0

cilium_host: 21:36:38.877574 IP (tos 0x0, ttl 61, id 12432, offset 0, flags [DF], proto TCP (6), length 60)
                 10.0.2.15.9200 > 10.10.0.182.80: Flags [S], cksum 0x9b88 (correct), seq 3447939959, win 29200, options [mss 1460,sackOK,TS val 21875984 ecr 0,nop,wscale 7], length 0

lo:          21:36:38.877712 IP (tos 0x0, ttl 64, id 0, offset 0, flags [DF], proto TCP (6), length 60)
                 10.10.0.182.80 > 10.0.2.15.9200: Flags [S.], cksum 0x16fd (incorrect -> 0xc431), seq 2618200169, ack 3447939960, win 43690, options [mss 65495,sackOK,TS val 22050495 ecr 21875984,nop,wscale 7], length 0

cilium_host: 21:36:38.877778 IP (tos 0x0, ttl 63, id 0, offset 0, flags [DF], proto TCP (6), length 40)
                 10.0.2.15.9200 > 10.10.0.182.80: Flags [R], cksum 0x43d6 (correct), seq 3447939960, win 0, length 0

```

**Comment by tgraf** [comment]
@jrajahalme Great progress. I've reassigned the issue to you.

**Comment by jrajahalme** [comment]
This test fails the same way in GKE for both ubuntu and COS image types, so this is independent of the missing xt_socket module in COS.

**Comment by jrajahalme** [comment]
Testing on GKE this test fails only when the service backend is selected on the same node. When source and destination are in different nodes the test works.

**Comment by jrajahalme** [comment]
Rebased to master with some datapath refactors, testing on GKE/ubuntu:
POD on node1 -> HostIP/port on node2: works if LB selects endpoint in node1, fails if in node2.
POD on node1 -> HostIP/port on node1: works if LB selects endpoint in node2, fails if in node1.
Repeated the test with a 1-node GKE cluster, it fails consistently.

**Comment by jrajahalme** [comment]
Filed a new issue with a repro and root cause analysis: #11807

**Comment by jrajahalme** [comment]
Not sure if the tftp fail (#10118) is for the same reason.
