### ISSUE TITLE
DSR  with Geneve - Recv failure: Connection reset by peer

### ISSUE THREAD

**Issue by BurlyLuo** [cilium/cilium#26723]
### Is there an existing issue for this?

- [X] I have searched the existing issues

### What happened?

When enable DSR with Geneve, the service is not reachable.
![image](https://github.com/cilium/cilium/assets/35321202/4338dd9f-37e6-4afb-9a0f-894f90300830)

```
root@cilium-dsr-control-plane:/# cilium  config view | grep -i dsr
bpf-lb-dsr-dispatch                            geneve
bpf-lb-mode                                    dsr
cluster-name                                   cilium-dsr
root@cilium-dsr-control-plane:/# 
root@2204:~/wcni-kind/split/cilium/cilium-dsr-geneve# dip 
NAME                       STATUS   ROLES           AGE   VERSION   INTERNAL-IP   EXTERNAL-IP   OS-IMAGE                         KERNEL-VERSION      CONTAINER-RUNTIME
cilium-dsr-control-plane   Ready    control-plane   13h   v1.27.3   172.18.0.4    <none>        Debian GNU/Linux 11 (bullseye)   5.19.0-46-generic   containerd://1.7.1
cilium-dsr-worker          Ready    <none>          13h   v1.27.3   172.18.0.2    <none>        Debian GNU/Linux 11 (bullseye)   5.19.0-46-generic   containerd://1.7.1
cilium-dsr-worker2         Ready    <none>          13h   v1.27.3   172.18.0.3    <none>        Debian GNU/Linux 11 (bullseye)   5.19.0-46-generic   containerd://1.7.1
root@2204:~/wcni-kind/split/cilium/cilium-dsr-geneve# 
root@2204:~/wcni-kind/split/cilium/cilium-dsr-geneve# k get pods -owide 
NAME                    READY   STATUS    RESTARTS   AGE   IP           NODE                NOMINATED NODE   READINESS GATES
wluo-6679f6c78f-zbmrw   1/1     Running   0          13h   10.0.1.167   cilium-dsr-worker   <none>           <none>
root@2204:~/wcni-kind/split/cilium/cilium-dsr-geneve# 

root@2204:~/wcni-kind/split/cilium/cilium-dsr-geneve# curl 172.18.0.4:32000
**curl: (56) Recv failure: Connection reset by peer**
root@2204:~/wcni-kind/split/cilium/cilium-dsr-geneve# 

From the pcap, when the client send a HTTP request,
we can see that the Backend node send back a abnormal ACK, that cause the client RST the session. 
```
Pcap attachetment:
[dsr-with-genneve.zip](https://github.com/cilium/cilium/files/11994430/dsr-with-genneve.zip)
w.cap==backend node
c.cap==LB node

### Cilium Version

```
root@cilium-dsr-control-plane:/# cilium version 
cilium-cli: v0.15.0 compiled with go1.20.4 on linux/amd64
cilium image (default): v1.13.4
cilium image (stable): v1.13.4
cilium image (running): 1.14.0-rc.0
root@cilium-dsr-control-plane:/# 
```

### Kernel Version

```
KERNEL-VERSION: 5.19.0-46-generic
root@2204:~/wcni-kind/split/cilium/cilium-dsr-geneve# dip
NAME                       STATUS   ROLES           AGE   VERSION   INTERNAL-IP   EXTERNAL-IP   OS-IMAGE                         KERNEL-VERSION      CONTAINER-RUNTIME
cilium-dsr-control-plane   Ready    control-plane   12h   v1.27.3   172.18.0.4    <none>        Debian GNU/Linux 11 (bullseye)   5.19.0-46-generic   containerd://1.7.1
cilium-dsr-worker          Ready    <none>          12h   v1.27.3   172.18.0.2    <none>        Debian GNU/Linux 11 (bullseye)   5.19.0-46-generic   containerd://1.7.1
cilium-dsr-worker2         Ready    <none>          12h   v1.27.3   172.18.0.3    <none>        Debian GNU/Linux 11 (bullseye)   5.19.0-46-generic   containerd://1.7.1
root@2204:~/wcni-kind/split/cilium/cilium-dsr-geneve# 
```

### Kubernetes Version

```
v1.27.3
```

### Sysdump

[cilium-sysdump-20230709-043000.zip](https://github.com/cilium/cilium/files/11994426/cilium-sysdump-20230709-043000.zip)

### Relevant log output

```shell
N/A
```

### Anything else?

```
Install details:
root@2204:~/wcni-kind/split/cilium/cilium-dsr-geneve# cat 1-setup-env.sh 
#!/bin/bash
date
set -v

# 1.prep noCNI env[Ubuntu 22.04][https://docs.cilium.io/en/v1.14/installation/kind/#install-cilium]
cat <<EOF | kind create cluster --name=cilium-dsr --image=kindest/node:v1.27.3 --config=-
kind: Cluster
apiVersion: kind.x-k8s.io/v1alpha4
networking:
  disableDefaultCNI: true
  kubeProxyMode: "none"

nodes:
  - role: control-plane
  - role: worker
  - role: worker
        
containerdConfigPatches:
- |-
  [plugins."io.containerd.grpc.v1.cri".registry.mirrors."192.168.2.100:5000"]
    endpoint = ["http://192.168.2.100:5000"]
EOF

# 2.remove taints
controller_node_ip=`kubectl get node -o wide --no-headers | grep -E "control-plane|bpf1" | awk -F " " '{print $6}'`
kubectl taint nodes $(kubectl get nodes -o name | grep control-plane) node-role.kubernetes.io/control-plane:NoSchedule-
kubectl get nodes -o wide

# 3.install cni
helm repo add cilium https://helm.cilium.io > /dev/null 2>&1
helm repo update > /dev/null 2>&1

# Direct Routing Options(--set tunnel=disabled --set autoDirectNodeRoutes=true --set ipv4NativeRoutingCIDR="10.0.0.0/8")
# kubeproxyreplacement Options(--set kubeProxyReplacement=true)
# DSR Mode(--set loadBalancer.mode=dsr)
# With Geneve(--set loadBalancer.dsrDispatch=geneve)
helm install cilium cilium/cilium --set k8sServiceHost=$controller_node_ip --set k8sServicePort=6443 --version 1.14.0-rc.0 --namespace kube-system --set debug.enabled=true --set debug.verbose=datapath --set monitorAggregation=none --set ipam.mode=cluster-pool --set cluster.name=cilium-dsr --set kubeProxyReplacement=true --set tunnel=disabled --set autoDirectNodeRoutes=true --set ipv4NativeRoutingCIDR="10.0.0.0/8" --set loadBalancer.mode=dsr --set loadBalancer.dsrDispatch=geneve

# 4. wait all pods ready
kubectl wait --timeout=100s --for=condition=Ready=true pods --all -A

# 5. cilium status
kubectl -nkube-system exec -it ds/cilium -- cilium status

# 6. cgroup v2 verify
for container in $(docker ps  -a --format "table {{.Names}}" | grep cilium-dsr);do docker exec $container ls -al /proc/self/ns/cgroup;done
```

### Code of Conduct

- [X] I agree to follow this project's Code of Conduct

**Comment by ysksuzuki** [comment]
It seems that the CT and NAT entries for client `172.18.0.1:53158` are missing. cc @julianwiedmann 
`TCP OUT 10.0.1.167:80 -> 172.18.0.1:53158 XLATE_SRC 172.18.0.4:32000` should be in the nat list.

```
$ cat cilium-bugtool-cilium-kw4nv-20230709-043000/cmd/cilium-bpf-nat-list.md
TCP OUT 10.0.1.167:80 -> 172.18.0.1:34586 XLATE_SRC 172.18.0.4:32000 Created=97878sec NeedsCT=0
TCP OUT 10.0.1.167:80 -> 172.18.0.1:46962 XLATE_SRC 172.18.0.4:32000 Created=97878sec NeedsCT=0

$ cat cilium-bugtool-cilium-kw4nv-20230709-043000/cmd/cilium-bpf-ct-list-global.md | grep 10.0.1.167
TCP IN 172.18.0.1:46962 -> 10.0.1.167:80 expires=16871823 RxPackets=5 RxBytes=486 RxFlagsSeen=0x1e LastRxReport=16871814 TxPackets=3 TxBytes=194 TxFlagsSeen=0x16 LastTxReport=16871814 Flags=0x0413 [ RxClosing TxClosing SeenNonSyn FromTunnel ] RevNAT=0 SourceSecurityID=2 IfIndex=0
TCP OUT 172.18.0.1:46962 -> 10.0.1.167:80 expires=16871823 RxPackets=2 RxBytes=128 RxFlagsSeen=0x16 LastRxReport=16871814 TxPackets=4 TxBytes=432 TxFlagsSeen=0x1a LastTxReport=16871814 Flags=0x0093 [ RxClosing TxClosing SeenNonSyn DSR ] RevNAT=0 SourceSecurityID=2 IfIndex=0
TCP IN 172.18.0.1:34586 -> 10.0.1.167:80 expires=16871874 RxPackets=5 RxBytes=486 RxFlagsSeen=0x1e LastRxReport=16871865 TxPackets=3 TxBytes=194 TxFlagsSeen=0x16 LastTxReport=16871865 Flags=0x0413 [ RxClosing TxClosing SeenNonSyn FromTunnel ] RevNAT=0 SourceSecurityID=2 IfIndex=0
TCP OUT 172.18.0.1:34586 -> 10.0.1.167:80 expires=16871874 RxPackets=2 RxBytes=128 RxFlagsSeen=0x16 LastRxReport=16871865 TxPackets=4 TxBytes=432 TxFlagsSeen=0x1a LastTxReport=16871865 Flags=0x0093 [ RxClosing TxClosing SeenNonSyn DSR ] RevNAT=0 SourceSecurityID=2 IfIndex=0
ICMP IN 172.18.0.1:0 -> 10.0.1.167:0 related expires=16871923 RxPackets=1 RxBytes=74 RxFlagsSeen=0x02 LastRxReport=16871865 TxPackets=0 TxBytes=0 TxFlagsSeen=0x00 LastTxReport=0 Flags=0x0410 [ SeenNonSyn FromTunnel ] RevNAT=0 SourceSecurityID=2 IfIndex=0
```

**Comment by BurlyLuo** [comment]
Another finding：
if let bpf take the masquerade logical. it can be worked as expect.
[w.zip](https://github.com/cilium/cilium/files/11997702/w.zip)
```
helm install cilium cilium/cilium --set k8sServiceHost=$controller_node_ip --set k8sServicePort=6443 --version 1.14.0-rc.0 --namespace kube-system --set debug.enabled=true --set debug.verbose=datapath --set monitorAggregation=none --set ipam.mode=cluster-pool --set cluster.name=cilium-kubeproxy-replacement-ebpf --set kubeProxyReplacement=strict --set tunnel=disabled --set autoDirectNodeRoutes=true --set ipv4NativeRoutingCIDR="10.0.0.0/8" --set bpf.masquerade=true 
```

**Comment by BurlyLuo** [comment]
> It seems that the CT and NAT entries for client `172.18.0.1:53158` are missing. cc @julianwiedmann `TCP OUT 10.0.1.167:80 -> 172.18.0.1:53158 XLATE_SRC 172.18.0.4:32000` should be in the nat list.
> 
> ```
> $ cat cilium-bugtool-cilium-kw4nv-20230709-043000/cmd/cilium-bpf-nat-list.md
> TCP OUT 10.0.1.167:80 -> 172.18.0.1:34586 XLATE_SRC 172.18.0.4:32000 Created=97878sec NeedsCT=0
> TCP OUT 10.0.1.167:80 -> 172.18.0.1:46962 XLATE_SRC 172.18.0.4:32000 Created=97878sec NeedsCT=0
> 
> $ cat cilium-bugtool-cilium-kw4nv-20230709-043000/cmd/cilium-bpf-ct-list-global.md | grep 10.0.1.167
> TCP IN 172.18.0.1:46962 -> 10.0.1.167:80 expires=16871823 RxPackets=5 RxBytes=486 RxFlagsSeen=0x1e LastRxReport=16871814 TxPackets=3 TxBytes=194 TxFlagsSeen=0x16 LastTxReport=16871814 Flags=0x0413 [ RxClosing TxClosing SeenNonSyn FromTunnel ] RevNAT=0 SourceSecurityID=2 IfIndex=0
> TCP OUT 172.18.0.1:46962 -> 10.0.1.167:80 expires=16871823 RxPackets=2 RxBytes=128 RxFlagsSeen=0x16 LastRxReport=16871814 TxPackets=4 TxBytes=432 TxFlagsSeen=0x1a LastTxReport=16871814 Flags=0x0093 [ RxClosing TxClosing SeenNonSyn DSR ] RevNAT=0 SourceSecurityID=2 IfIndex=0
> TCP IN 172.18.0.1:34586 -> 10.0.1.167:80 expires=16871874 RxPackets=5 RxBytes=486 RxFlagsSeen=0x1e LastRxReport=16871865 TxPackets=3 TxBytes=194 TxFlagsSeen=0x16 LastTxReport=16871865 Flags=0x0413 [ RxClosing TxClosing SeenNonSyn FromTunnel ] RevNAT=0 SourceSecurityID=2 IfIndex=0
> TCP OUT 172.18.0.1:34586 -> 10.0.1.167:80 expires=16871874 RxPackets=2 RxBytes=128 RxFlagsSeen=0x16 LastRxReport=16871865 TxPackets=4 TxBytes=432 TxFlagsSeen=0x1a LastTxReport=16871865 Flags=0x0093 [ RxClosing TxClosing SeenNonSyn DSR ] RevNAT=0 SourceSecurityID=2 IfIndex=0
> ICMP IN 172.18.0.1:0 -> 10.0.1.167:0 related expires=16871923 RxPackets=1 RxBytes=74 RxFlagsSeen=0x02 LastRxReport=16871865 TxPackets=0 TxBytes=0 TxFlagsSeen=0x00 LastTxReport=0 Flags=0x0410 [ SeenNonSyn FromTunnel ] RevNAT=0 SourceSecurityID=2 IfIndex=0
> ```
> 
> **EDIT:**
> 
> I could reproduce in my kind env. The CT and NAT entries were properly entered, but ACK wasn't SNATed
> 
> ```
> $ curl --local-port 52889 172.18.0.3:32007
> curl: (56) Recv failure: Connection reset by peer
> 
> $ tcpdump -nl -i any port 52889
> 17:29:55.316319 cilium_geneve P   IP 172.18.0.1.52889 > 10.0.2.36.8000: Flags [S], seq 2394672373, win 64240, options [mss 1460,sackOK,TS val 2443063221 ecr 0,nop,wscale 7], length 0
> 17:29:55.316349 lxccc6306375da1 Out IP 172.18.0.1.52889 > 10.0.2.36.8000: Flags [S], seq 2394672373, win 64240, options [mss 1460,sackOK,TS val 2443063221 ecr 0,nop,wscale 7], length 0
> 17:29:55.316367 lxccc6306375da1 In  IP 10.0.2.36.8000 > 172.18.0.1.52889: Flags [S.], seq 4147545826, ack 2394672374, win 65160, options [mss 1460,sackOK,TS val 1820355724 ecr 2443063221,nop,wscale 7], length 0
> 17:29:55.316396 eth0  Out IP 172.18.0.3.32007 > 172.18.0.1.52889: Flags [S.], seq 4147545826, ack 2394672374, win 65160, options [mss 1460,sackOK,TS val 1820355724 ecr 2443063221,nop,wscale 7], length 0
> 17:29:55.316436 cilium_geneve P   IP 172.18.0.1.52889 > 10.0.2.36.8000: Flags [.], ack 1, win 502, options [nop,nop,TS val 2443063221 ecr 1820355724], length 0
> 17:29:55.316449 lxccc6306375da1 Out IP 172.18.0.1.52889 > 10.0.2.36.8000: Flags [.], ack 1, win 502, options [nop,nop,TS val 2443063221 ecr 1820355724], length 0
> 17:29:55.316505 cilium_geneve P   IP 172.18.0.1.52889 > 10.0.2.36.8000: Flags [P.], seq 1:81, ack 1, win 502, options [nop,nop,TS val 2443063221 ecr 1820355724], length 80
> 17:29:55.316517 lxccc6306375da1 Out IP 172.18.0.1.52889 > 10.0.2.36.8000: Flags [P.], seq 1:81, ack 1, win 502, options [nop,nop,TS val 2443063221 ecr 1820355724], length 80
> 17:29:55.316520 lxccc6306375da1 In  IP 10.0.2.36.8000 > 172.18.0.1.52889: Flags [.], ack 81, win 509, options [nop,nop,TS val 1820355724 ecr 2443063221], length 0
> # Wrong source IP
> 17:29:55.316543 eth0  Out IP 172.18.0.4.8000 > 172.18.0.1.52889: Flags [.], ack 2394672454, win 509, options [nop,nop,TS val 1820355724 ecr 2443063221], length 0
> 17:29:55.316553 eth0  In  IP 172.18.0.1.52889 > 172.18.0.4.8000: Flags [R], seq 2394672454, win 0, length 0
> 17:29:55.316574 lxccc6306375da1 Out IP 172.18.0.1.52889 > 10.0.2.36.8000: Flags [R], seq 2394672454, win 0, length 0
> 17:29:55.524006 cilium_geneve P   IP 172.18.0.1.52889 > 10.0.2.36.8000: Flags [P.], seq 1:81, ack 1, win 502, options [nop,nop,TS val 2443063428 ecr 1820355724], length 80
> 17:29:55.524040 lxccc6306375da1 Out IP 172.18.0.1.52889 > 10.0.2.36.8000: Flags [P.], seq 1:81, ack 1, win 502, options [nop,nop,TS val 2443063428 ecr 1820355724], length 80
> 17:29:55.524056 lxccc6306375da1 In  IP 10.0.2.36.8000 > 172.18.0.1.52889: Flags [R], seq 4147545827, win 0, length 0
> 17:29:55.524097 eth0  Out IP 172.18.0.3.32007 > 172.18.0.1.52889: Flags [R], seq 4147545827, win 0, length 0
> 
> $ kubectl -n kube-system exec cilium-7jdrw -- cilium bpf ct list global | grep 52889
> TCP OUT 172.18.0.1:52889 -> 10.0.2.36:8000 expires=16787038 RxPackets=2 RxBytes=128 RxFlagsSeen=0x16 LastRxReport=16787029 TxPackets=4 TxBytes=432 TxFlagsSeen=0x1a LastTxReport=16787029 Flags=0x0093 [ RxClosing TxClosing SeenNonSyn DSR ] RevNAT=0 SourceSecurityID=2 IfIndex=0
> TCP IN 172.18.0.1:52889 -> 10.0.2.36:8000 expires=16787038 RxPackets=5 RxBytes=486 RxFlagsSeen=0x1e LastRxReport=16787029 TxPackets=3 TxBytes=194 TxFlagsSeen=0x16 LastTxReport=16787029 Flags=0x0413 [ RxClosing TxClosing SeenNonSyn FromTunnel ] RevNAT=0 SourceSecurityID=2 IfIndex=0
> 
> $ kubectl -n kube-system exec cilium-7jdrw -- cilium bpf nat list
> TCP OUT 10.0.2.36:8000 -> 172.18.0.1:52889 XLATE_SRC 172.18.0.3:32007 Created=10418sec NeedsCT=0
> TCP OUT 10.0.2.36:8000 -> 172.18.0.1:52888 XLATE_SRC 172.18.0.3:32007 Created=10418sec NeedsCT=0
> TCP OUT 10.0.2.36:8000 -> 172.18.0.1:52790 XLATE_SRC 172.18.0.3:32007 Created=10418sec NeedsCT=0
> ```

@ysksuzuki  there is an issue about:
```
root@2204:~/wcni-kind/split/cilium/cilium-kubeproxy-replacement-ebpf#  kk exec ds/cilium -- cilium status
Defaulted container "cilium-agent" out of: cilium-agent, config (init), mount-cgroup (init), apply-sysctl-overwrites (init), mount-bpf-fs (init), clean-cilium-state (init), install-cni-binaries (init)
KVStore:                 Ok   Disabled
Kubernetes:              Ok   1.27 (v1.27.3) [linux/amd64]
Kubernetes APIs:         ["EndpointSliceOrEndpoint", "cilium/v2::CiliumClusterwideNetworkPolicy", "cilium/v2::CiliumEndpoint", "cilium/v2::CiliumNetworkPolicy", "cilium/v2::CiliumNode", "cilium/v2alpha1::CiliumCIDRGroup", "core/v1::Namespace", "core/v1::Pods", "core/v1::Service", "networking.k8s.io/v1::NetworkPolicy"]
KubeProxyReplacement:    True   [eth0 172.18.0.4 (Direct Routing)]
Host firewall:           Disabled
CNI Chaining:            none
Cilium:                  Ok   1.14.0-rc.0 (v1.14.0-rc.0-08239f59)
NodeMonitor:             Listening for events on 12 CPUs with 64x4096 of shared memory
Cilium health daemon:    Ok   
IPAM:                    IPv4: 3/254 allocated from 10.0.0.0/24, 
IPv4 BIG TCP:            Disabled
IPv6 BIG TCP:            Disabled
BandwidthManager:        Disabled
Host Routing:            Legacy
Masquerading:            IPTables [IPv4: Enabled, IPv6: Disabled]
Controller Status:       24/24 healthy
Proxy Status:            OK, ip 10.0.0.46, 0 redirects active on ports 10000-20000, Envoy: embedded
Global Identity Range:   min 256, max 65535
Hubble:                  Ok              Current/Max Flows: 4095/4095 (100.00%), Flows/s: 0.94   Metrics: Disabled
Encryption:              Disabled        
Cluster health:          3/3 reachable   (2023-07-10T06:28:34Z)
root@2204:~/wcni-kind/split/cilium/cilium-kubeproxy-replacement-ebpf# 
```
At this mode, we can see it run with KubeProxyReplacement:    True   [eth0 172.18.0.4 (Direct Routing)]
but about Masquerading:            IPTables [IPv4: Enabled, IPv6: Disabled]
how to understand the [Masquerading:            **IPTables** [IPv4: Enabled, IPv6: Disabled]]
that means we use iptables as well?
thanks

**Comment by ysksuzuki** [comment]
@BurlyLuo 
It seems that traffic leaving from the cluster(reply packets from the backend pod to the client in this case) is masqueraded by the iptables rule.
https://docs.cilium.io/en/stable/network/concepts/masquerading/#iptables-based

I guess `cilium config set enable-ipv4-masquerade false` fix this problem.

```
iptables -S -t nat
-A CILIUM_POST_nat -s 10.0.2.0/24 -m set --match-set cilium_node_set_v4 dst -m comment --comment "exclude traffic to cluster nodes from masquerade" -j ACCEPT
-A CILIUM_POST_nat -s 10.0.2.0/24 ! -d 10.0.0.0/8 ! -o cilium_+ -m comment --comment "cilium masquerade non-cluster" -j MASQUERADE
-A CILIUM_POST_nat -m comment --comment "exclude proxy return traffic from masquerade" -j ACCEPT
-A CILIUM_POST_nat -s 127.0.0.1/32 -o cilium_host -m comment --comment "cilium host->cluster from 127.0.0.1 masquerade" -j SNAT --to-source 10.0.2.90
-A CILIUM_POST_nat -o cilium_host -m conntrack --ctstate DNAT -m comment --comment "hairpin traffic that originated from a local pod" -j SNAT --to-source 10.0.2.90
```

**Comment by BurlyLuo** [comment]
> @BurlyLuo It seems that traffic leaving from the cluster(reply packets from the backend pod to the client in this case) is masqueraded by the iptables rule. https://docs.cilium.io/en/stable/network/concepts/masquerading/#iptables-based
> 
> I guess `cilium config set enable-ipv4-masquerade false` fix this problem.
> 
> ```
> iptables -S -t nat
> -A CILIUM_POST_nat -s 10.0.2.0/24 -m set --match-set cilium_node_set_v4 dst -m comment --comment "exclude traffic to cluster nodes from masquerade" -j ACCEPT
> -A CILIUM_POST_nat -s 10.0.2.0/24 ! -d 10.0.0.0/8 ! -o cilium_+ -m comment --comment "cilium masquerade non-cluster" -j MASQUERADE
> -A CILIUM_POST_nat -m comment --comment "exclude proxy return traffic from masquerade" -j ACCEPT
> -A CILIUM_POST_nat -s 127.0.0.1/32 -o cilium_host -m comment --comment "cilium host->cluster from 127.0.0.1 masquerade" -j SNAT --to-source 10.0.2.90
> -A CILIUM_POST_nat -o cilium_host -m conntrack --ctstate DNAT -m comment --comment "hairpin traffic that originated from a local pod" -j SNAT --to-source 10.0.2.90
> ```

Yes. i got the above logical.
but there still an question that masquerade should contain the SANT ,rt? so the k8s service, like the issue dsr-geneve case, should be a part of masquerade, rt?
but i can't get any conntrack -L for the case.

**Comment by BurlyLuo** [comment]
> > @BurlyLuo It seems that traffic leaving from the cluster(reply packets from the backend pod to the client in this case) is masqueraded by the iptables rule. https://docs.cilium.io/en/stable/network/concepts/masquerading/#iptables-based
> > I guess `cilium config set enable-ipv4-masquerade false` fix this problem.
> > ```
> > iptables -S -t nat
> > -A CILIUM_POST_nat -s 10.0.2.0/24 -m set --match-set cilium_node_set_v4 dst -m comment --comment "exclude traffic to cluster nodes from masquerade" -j ACCEPT
> > -A CILIUM_POST_nat -s 10.0.2.0/24 ! -d 10.0.0.0/8 ! -o cilium_+ -m comment --comment "cilium masquerade non-cluster" -j MASQUERADE
> > -A CILIUM_POST_nat -m comment --comment "exclude proxy return traffic from masquerade" -j ACCEPT
> > -A CILIUM_POST_nat -s 127.0.0.1/32 -o cilium_host -m comment --comment "cilium host->cluster from 127.0.0.1 masquerade" -j SNAT --to-source 10.0.2.90
> > -A CILIUM_POST_nat -o cilium_host -m conntrack --ctstate DNAT -m comment --comment "hairpin traffic that originated from a local pod" -j SNAT --to-source 10.0.2.90
> > ```
> 
> Yes. i got the above logical. but there still an question that masquerade should contain the SANT ,rt? so the k8s service, like the issue dsr-geneve case, should be a part of masquerade, rt? but i can't get any conntrack -L for the case when cilium running with [Masquerading: IPTables [IPv4: Enabled, IPv6: Disabled]]

Yes @ysksuzuki  that due to the masq cause the backend_node sent back the packet with local ip. it should be use SNAT to set the correct rather than with masq.

If yes, there should be 2 points, we need care:
```
# 1st: work fine with disable ipv4-masq. it need to solve the conficts.
# 2st: if run with BPF masq, we can avoid this issue. due to there is no masq iptables. 
```

**Comment by julianwiedmann** [comment]
With KPR DSR, the backend is replying straight back to the client. And we apply the RevDNAT at the native interface. I'm struggling with how that would work if iptables has already masqueraded the packet.
