### ISSUE TITLE
[Cilium with kubeproxy] IPv4 Fragmented packets are being dropped

### ISSUE THREAD

**Issue by liuyuan10** [cilium/cilium#13349]
## Bug report

We find even when running cilium with kubeproxy in tunneling mode, IPv4 fragmented packets coming into the cluster (e.g. nodePort) are dropped at a high chance. Further investigation observes:

- OOO packets being observed on the 2nd Node. Proved by "tcpdump -ni cilium_geneve". tcpdump on the first node doesn't see packets reordered.
- The drop happens when fragmented packets are OOO. Cilium on the 2nd node can't handle the case where the non-first fragments are seen first.

The two things combined together are causing high packet drops for IPv4 fragmented packets coming into cluster.

While I know IPv4 fragments are not supported yet for node port  #11180, we don't expect it to break when using kube-proxy.

Our cilium config is:
```
  auto-direct-node-routes: "false"
  blacklist-conflicting-routes: "false"
  bpf-map-dynamic-size-ratio: "0.0025"
  bpf-policy-map-max: "16384"
  cluster-name: default
  debug: "false"
  disable-cnp-status-updates: "true"
  enable-auto-protect-node-port-range: "true"
  enable-bpf-clock-probe: "true"
  enable-bpf-masquerade: "false"
  enable-endpoint-health-checking: "true"
  enable-host-reachable-services: "true"
  enable-hubble: "true"
  enable-ipv4: "true"
  enable-ipv6: "false"
  enable-local-node-route: "true"
  enable-metrics: "true"
  enable-remote-node-identity: "true"
  enable-session-affinity: "true"
  enable-well-known-identities: "false"
  enable-xt-socket-fallback: "true"
  identity-allocation-mode: crd
  install-iptables-rules: "true"
  ipam: kubernetes
  k8s-require-ipv4-pod-cidr: "true"
  k8s-require-ipv6-pod-cidr: "false"
  kube-proxy-replacement: disabled
  masquerade: "true"
  monitor-aggregation: medium
  monitor-aggregation-flags: all
  monitor-aggregation-interval: 5s
  native-routing-cidr: 192.168.0.0/16
  node-port-bind-protection: "true"
  operator-api-serve-addr: 127.0.0.1:9234
  operator-prometheus-serve-addr: :6942
  preallocate-bpf-maps: "false"
  prometheus-serve-addr: :9990
  sidecar-istio-proxy-image: cilium/istio_proxy
  tofqdns-enable-poller: "false"
  tunnel: geneve
  wait-bpf-mount: "false"
```

**General Information**

- Cilium version (run `cilium version`)
1.8.1
- Kernel version (run `uname -a`)
5.4.0-47 ubuntu 1804
- Orchestration system version in use (e.g. `kubectl version`, Mesos, ...)
1.17.8
- Link to relevant artifacts (policies, deployments scripts, ...)
- Generate and upload a system zip:

**How to reproduce the issue**

1. create a udp echo service:
```
apiVersion: apps/v1
kind: Deployment
metadata:
  name: udp-echo-deployment
spec:
  selector:
    matchLabels:
      app: udp-echo
  replicas: 1
  template:
    metadata:
      labels:
        app: udp-echo
    spec:
      containers:
      - name: echo-container
        image: n0r1skcom/echo
        ports:
        - containerPort: 3333
          protocol: UDP
---
apiVersion: v1
kind: Service
metadata:
  name: udp-echo-service-ilb
spec:
  selector:
    app: udp-echo
  type: NodePort
  ports:
    - name: udp
      protocol: UDP
      port: 3331
      targetPort: 3333
```
2. using netcat from outside of the cluster and hit the nodePort with `nc -u IP port`
3. Send a long string bigger than MTU (like 2000) to trigger IP fragmentation. Can use a [random string generator](http://www.unit-conversion.info/texttools/random-string-generator/)
4. keeping sending large payload and packet drops will be observed (no echo back).

**Comment by qmonnet** [comment]
This is indeed because we need to see the first fragment first to establish the related entry in the fragment-tracking map. I confirm out-of-order datagrams for which the first logical fragment does not arrive first in the flow are not supported.

Supporting out-of-order flows would need a heavier approach, I don't see a way to do it without datagram reassembly or at least storing some of the fragments for a time. I don't know if this is something we could do at all from within the eBPF datapath (I don't see how to send the fragments we have stored, or how to fully reassemble a big datagram). Or maybe there are alternative solutions I don't know about :thinking:.

**Comment by liuyuan10** [comment]
Thanks for the confirmation. OOO fragmented packets support is a feature gap between cilium (even in mixed mode) vs kernel based data path. I can see it's hard to support in EBPF.

Could you also comment on the first issue? Why packets are being reordered between the first and second node? That has made the feature gap more severe.

**Comment by liuyuan10** [comment]
Another idea is that can we treat fragmented packets specially and have them sent to IP stack so we can take advantage of the kernel to handle this problem?

**Comment by qmonnet** [comment]
> Could you also comment on the first issue? Why packets are being reordered between the first and second node? That has made the feature gap more severe.

I don't know why packets would be reordered, but this is not something I would expect and this definitely needs more investigation. Hopefully that's something we could improve, and that would make fragmentation support better.

I'll ask at the Community meeting next Monday if anyone is familiar with this issue.

> Another idea is that can we treat fragmented packets specially and have them sent to IP stack so we can take advantage of the kernel to handle this problem?

Probably something worth exploring, too. We could keep the approach currently implemented as a “fast path” for fragmented datagrams, and maybe fall back on the kernel otherwise.

**Comment by liuyuan10** [comment]
I run a quick test verifying that the reordering happens on the 2nd node after receiving the packet:

I always see the right order on the physical interface
```
# tcpdump -ni eno1 src 192.168.1.32 | grep 172.28.2.21
tcpdump: verbose output suppressed, use -v or -vv for full protocol decode
listening on eno1, link-type EN10MB (Ethernet), capture size 262144 bytes
22:22:07.641863 IP 192.168.1.32.42142 > 192.168.1.64.6081: Geneve, Flags [none], vni 0x2: IP truncated-ip - 50 bytes missing! 172.28.3.118.43843 > 172.28.2.21.3333: UDP, bad length 2001 > 1472
22:22:07.641874 IP 192.168.1.32.42142 > 192.168.1.64.6081: Geneve, Flags [none], vni 0x2: IP 172.28.3.118 > 172.28.2.21: ip-proto-17
```

But packets are very likely to be reordered at the cilium_geneve interface:
```
# tcpdump -ni cilium_geneve dst 172.28.2.21
tcpdump: verbose output suppressed, use -v or -vv for full protocol decode
listening on cilium_geneve, link-type EN10MB (Ethernet), capture size 262144 bytes
22:22:07.641874 IP 172.28.3.118 > 172.28.2.21: ip-proto-17
22:22:07.641875 IP 172.28.3.118.43843 > 172.28.2.21.3333: UDP, bad length 2001 > 1472
```

This could help us to limit the scope of investigation. I'll appreciate it if anyone can point me the particular code to look at regarding this.

**Comment by liuyuan10** [comment]
I used `get_smp_processor_id` to print the cpu processing the incoming packet at tc ingress hook of cilium_geneve on the 2nd node. I don't see any xdp installed so I think that's where cilium first see the packets. I noticed that for nodePort traffic, fragments are handled by different CPUs and hence the reordered packets. You can also prove it by `ethtool -L enp1s0f1 combined 1` to have a single rx queue. But when traffic are from a pod, it's always processed by the same CPU.

Is cilium doing something here? One thing I find suspicious is that the source port of outer layer is always the same for node port traffic. But for pod2pod, the geneve source port is different for each different udp session.

**Comment by pchaigno** [comment]
> I noticed that for nodePort traffic, fragments are handled by different CPUs and hence the reordered packets.

This sounds like an issue with the underlying system configuration rather than with Cilium. Since the packets are fragmented, maybe RSS computes a hash based the 5-tuple and thus sends non-first fragments that are missing the L4 ports to a different queue than the first fragment? If you can configure the n-tuple of your NIC, it should be possible to check this.

> using netcat from outside of the cluster and hit the nodePort with `nc -u IP port`

One thing I don't understand is why are packets from outside the cluster coming via the Geneve tunnel? I'd expect to see only packets from other Cilium-managed nodes coming via the tunnel.

**Comment by pchaigno** [comment]
During the Cilium community meeting, Joe and Valas mentioned some ideas to address the more general issue of IPv4 fragmentation handling. We will be discussing those during [the SIG-Datapath meeting](https://docs.cilium.io/en/latest/community/#all-sigs) on Wednesday.

**Comment by liuyuan10** [comment]
OK. I find the root cause for the reordering issue. The MTU of cilium_host is set at 1500, which is the same as the physical interface. It causes fragmentation on outer layer for nodePort traffic. For pod-to-pod, we have a route with a smaller mtu that avoids it:

```
# ip route
default via 172.24.0.69 dev eth0 mtu 1450
172.24.0.69 dev eth0 scope link
```

I believe the fix is to decrease the MTU of cilium_host to be smaller than physical interface to accommodate encap header. Let me prepare a fix patch. Also let me know if it's not a good idea

**Comment by liuyuan10** [comment]
I find routes on node already has a smaller MTU on cilium_host:

```
ip r
default via 192.168.0.1 dev enp1s0f1 onlink
172.17.0.0/16 dev docker0 proto kernel scope link src 172.17.0.1 linkdown
172.24.0.0/24 via 172.24.0.69 dev cilium_host src 172.24.0.69 mtu 1450
172.24.0.69 dev cilium_host scope link
172.24.1.0/24 via 172.24.0.69 dev cilium_host src 172.24.0.69 mtu 1450
192.168.0.0/24 dev enp1s0f1 proto kernel scope link src 192.168.0.3
```

But clearly it's not taking effect and I have to manually set mtu to cilium_host to fix this issue. and I can confirm in tc egress hook of cilium_host, it's seeing 1500 sized packets. anyone know why is that?

**Comment by pchaigno** [comment]
I added the `requires-docs-change` label because we probably need to update the documentation to mention this kernel bug, as per https://github.com/cilium/cilium/pull/13416#discussion_r501858421, to be able to mark this issue as resolved.
