### ISSUE TITLE
Cilium is droping ipv6 packets with auth extension header

### ISSUE THREAD

**Issue by chenyuezhou** [cilium/cilium#24187]
### Is there an existing issue for this?

- [X] I have searched the existing issues

### What happened?

# env

##  pods

```
➜  cilium git:(v1.12.6) kubectl get pods -A -o wide
NAMESPACE            NAME                                         READY   STATUS    RESTARTS   AGE     IP             NODE                 NOMINATED NODE   READINESS GATES
kube-system          cilium-5xdwm                                 1/1     Running   0          6h38m   172.18.0.4     kind-worker3         <none>           <none>
kube-system          cilium-gqxdx                                 1/1     Running   0          6h38m   172.18.0.5     kind-worker          <none>           <none>
kube-system          cilium-operator-74559f97bf-gmkdm             1/1     Running   0          6h38m   172.18.0.3     kind-worker2         <none>           <none>
kube-system          cilium-rmbnl                                 1/1     Running   0          6h38m   172.18.0.2     kind-control-plane   <none>           <none>
kube-system          cilium-tbwqj                                 1/1     Running   0          6h38m   172.18.0.3     kind-worker2         <none>           <none>
kube-system          coredns-565d847f94-rh9g5                     1/1     Running   0          6h39m   10.244.1.233   kind-worker3         <none>           <none>
kube-system          coredns-565d847f94-v2vs7                     1/1     Running   0          6h39m   10.244.1.75    kind-worker3         <none>           <none>
kube-system          etcd-kind-control-plane                      1/1     Running   0          6h39m   172.18.0.2     kind-control-plane   <none>           <none>
kube-system          kube-apiserver-kind-control-plane            1/1     Running   0          6h39m   172.18.0.2     kind-control-plane   <none>           <none>
kube-system          kube-controller-manager-kind-control-plane   1/1     Running   0          6h39m   172.18.0.2     kind-control-plane   <none>           <none>
kube-system          kube-scheduler-kind-control-plane            1/1     Running   0          6h39m   172.18.0.2     kind-control-plane   <none>           <none>
local-path-storage   local-path-provisioner-684f458cdd-vgnx9      1/1     Running   0          6h39m   10.244.1.27    kind-worker3         <none>           <none>
test-pod1            test-pod1-6bdb469947-6bxl7                   1/1     Running   0          5h21m   10.244.2.84    kind-worker          <none>           <none>
test-pod2            test-pod2-76457d55db-b9vrt                   1/1     Running   0          5h21m   10.244.3.59    kind-worker2         <none>           <none>
```

# test

### cilium endpoint list

```
root@kind-worker:/home/cilium# cilium endpoint list
ENDPOINT   POLICY (ingress)   POLICY (egress)   IDENTITY   LABELS (source:key[=value])                                                IPv6                  IPv4           STATUS   
           ENFORCEMENT        ENFORCEMENT                                                                                                                                  
249        Disabled           Disabled          1          reserved:host                                                                                                   ready   
684        Disabled           Disabled          31569      k8s:id=tk1                                                                 fd00:10:244:2::478f   10.244.2.84    ready   
                                                           k8s:io.cilium.k8s.namespace.labels.kubernetes.io/metadata.name=test-pod1                                                
                                                           k8s:io.cilium.k8s.policy.cluster=kind-kind                                                                              
                                                           k8s:io.cilium.k8s.policy.serviceaccount=default                                                                         
                                                           k8s:io.kubernetes.pod.namespace=test-pod1                                                                               
2630       Disabled           Disabled          4          reserved:health                                                            fd00:10:244:2::f51a   10.244.2.174   ready
```

### cilium monitor

ipv6 packets was dropped

```
xx drop (CT: Truncated or invalid header) flow 0x0 to endpoint 0, file bpf_lxc.c line 712, , identity 31569->unknown: fd00:10:244:2::478f -> fd00:10:244:3::22be
xx drop (CT: Truncated or invalid header) flow 0x0 to endpoint 0, file bpf_lxc.c line 712, , identity 31569->unknown: fd00:10:244:2::478f -> fd00:10:244:3::22be
xx drop (CT: Truncated or invalid header) flow 0x0 to endpoint 0, file bpf_lxc.c line 712, , identity 31569->unknown: fd00:10:244:2::478f -> fd00:10:244:3::22be
xx drop (CT: Truncated or invalid header) flow 0x0 to endpoint 0, file bpf_lxc.c line 712, , identity 31569->unknown: fd00:10:244:2::478f -> fd00:10:244:3::22be
xx drop (CT: Truncated or invalid header) flow 0x0 to endpoint 0, file bpf_lxc.c line 712, , identity 31569->unknown: fd00:10:244:2::478f -> fd00:10:244:3::22be
```

## test-pod1

```
[root@test-pod1-6bdb469947-6bxl7 /]# ip a show dev eth0
11: eth0@if12: <BROADCAST,MULTICAST,UP,LOWER_UP> mtu 1500 qdisc noqueue state UP group default qlen 1000
    link/ether 22:67:c9:71:99:10 brd ff:ff:ff:ff:ff:ff link-netnsid 0
    inet 10.244.2.84/32 scope global eth0
       valid_lft forever preferred_lft forever
    inet6 fd00:10:244:2::478f/128 scope global nodad 
       valid_lft forever preferred_lft forever
    inet6 fe80::2067:c9ff:fe71:9910/64 scope link 
       valid_lft forever preferred_lft forever
```

send ipv6 packets to test-pod2 with scapy

```
#!/usr/bin/python2

from scapy.all import *
from socket import *
import sys

if __name__ == "__main__":
    if len(sys.argv) != 6:
        print("smac, dmac, saddr, daddr, iface needed")
        sys.exit(-1)

    smac = sys.argv[1]
    dmac = sys.argv[2]
    saddr = sys.argv[3]
    daddr = sys.argv[4]
    iface = sys.argv[5]

    # ipv6
    sendp(Ether(src=smac, dst=dmac)/IPv6(src=saddr, dst=daddr)/TCP(),
            iface=iface, loop=1, inter=0.1, count=5)
    # ipv6/hop/auth
    sa = SecurityAssociation(AH, spi=0x222, auth_algo='SHA2-384-192', auth_key=b'secret key')
    pkt = IPv6(src=saddr, dst=daddr)/IPv6ExtHdrHopByHop()/TCP()
    pkt = sa.encrypt(pkt)
    pkt = Ether(src=smac, dst=dmac)/pkt
    # pkt = Ether(src=smac, dst=dmac)/IPv6(src=saddr, dst=daddr)/IPv6ExtHdrHopByHop()/AH(nh=IPPROTO_TCP)/TCP()/"TEST"
    pkt.show2()
    sendp(pkt, iface=iface, loop=1, inter=0.1, count=5)
    # ipv6/hop/hop
    pkt = Ether(src=smac, dst=dmac)/IPv6(src=saddr, dst=daddr)/IPv6ExtHdrHopByHop()/IPv6ExtHdrHopByHop()/TCP()
    pkt.show2()
    sendp(pkt, iface=iface, loop=1, inter=0.1, count=5)
```

### cilium endpoint list

```
root@kind-worker:/home/cilium# cilium endpoint list
ENDPOINT   POLICY (ingress)   POLICY (egress)   IDENTITY   LABELS (source:key[=value])                                                IPv6                  IPv4           STATUS   
           ENFORCEMENT        ENFORCEMENT                                                                                                                                  
249        Disabled           Disabled          1          reserved:host                                                                                                   ready   
684        Disabled           Disabled          31569      k8s:id=tk1                                                                 fd00:10:244:2::478f   10.244.2.84    ready   
                                                           k8s:io.cilium.k8s.namespace.labels.kubernetes.io/metadata.name=test-pod1                                                
                                                           k8s:io.cilium.k8s.policy.cluster=kind-kind                                                                              
                                                           k8s:io.cilium.k8s.policy.serviceaccount=default                                                                         
                                                           k8s:io.kubernetes.pod.namespace=test-pod1                                                                               
2630       Disabled           Disabled          4          reserved:health                                                            fd00:10:244:2::f51a   10.244.2.174   ready
```

## test-pod2

```
[root@test-pod2-76457d55db-b9vrt /]# ip a show dev eth0
7: eth0@if8: <BROADCAST,MULTICAST,UP,LOWER_UP> mtu 1500 qdisc noqueue state UP group default qlen 1000
    link/ether 32:1e:42:44:b8:8b brd ff:ff:ff:ff:ff:ff link-netnsid 0
    inet 10.244.3.59/32 scope global eth0
       valid_lft forever preferred_lft forever
    inet6 fd00:10:244:3::22be/128 scope global nodad 
       valid_lft forever preferred_lft forever
    inet6 fe80::301e:42ff:fe44:b88b/64 scope link 
       valid_lft forever preferred_lft forever
```

try capture packets

lost ipv6 packets with auth header. 

```
[root@test-pod2-76457d55db-b9vrt /]# tcpdump -A -i any host fd00:10:244:3::22be -nnne -w test.pcap
dropped privs to tcpdump
tcpdump: listening on any, link-type LINUX_SLL (Linux cooked v1), capture size 262144 bytes
^C20 packets captured
20 packets received by filter
0 packets dropped by kernel
[root@test-pod2-76457d55db-b9vrt /]# tcpdump -r test.pcap -nnne
reading from file test.pcap, link-type LINUX_SLL (Linux cooked v1)
dropped privs to tcpdump
17:15:55.391981  In e6:63:9a:c6:92:68 ethertype IPv6 (0x86dd), length 76: fd00:10:244:2::478f.20 > fd00:10:244:3::22be.80: Flags [S], seq 0, win 8192, length 0
17:15:55.391995 Out 32:1e:42:44:b8:8b ethertype IPv6 (0x86dd), length 76: fd00:10:244:3::22be.80 > fd00:10:244:2::478f.20: Flags [R.], seq 0, ack 1, win 0, length 0
17:15:55.492998  In e6:63:9a:c6:92:68 ethertype IPv6 (0x86dd), length 76: fd00:10:244:2::478f.20 > fd00:10:244:3::22be.80: Flags [S], seq 0, win 8192, length 0
17:15:55.493006 Out 32:1e:42:44:b8:8b ethertype IPv6 (0x86dd), length 76: fd00:10:244:3::22be.80 > fd00:10:244:2::478f.20: Flags [R.], seq 0, ack 1, win 0, length 0
17:15:55.594211  In e6:63:9a:c6:92:68 ethertype IPv6 (0x86dd), length 76: fd00:10:244:2::478f.20 > fd00:10:244:3::22be.80: Flags [S], seq 0, win 8192, length 0
17:15:55.594223 Out 32:1e:42:44:b8:8b ethertype IPv6 (0x86dd), length 76: fd00:10:244:3::22be.80 > fd00:10:244:2::478f.20: Flags [R.], seq 0, ack 1, win 0, length 0
17:15:55.695383  In e6:63:9a:c6:92:68 ethertype IPv6 (0x86dd), length 76: fd00:10:244:2::478f.20 > fd00:10:244:3::22be.80: Flags [S], seq 0, win 8192, length 0
17:15:55.695392 Out 32:1e:42:44:b8:8b ethertype IPv6 (0x86dd), length 76: fd00:10:244:3::22be.80 > fd00:10:244:2::478f.20: Flags [R.], seq 0, ack 1, win 0, length 0
17:15:55.796582  In e6:63:9a:c6:92:68 ethertype IPv6 (0x86dd), length 76: fd00:10:244:2::478f.20 > fd00:10:244:3::22be.80: Flags [S], seq 0, win 8192, length 0
17:15:55.796594 Out 32:1e:42:44:b8:8b ethertype IPv6 (0x86dd), length 76: fd00:10:244:3::22be.80 > fd00:10:244:2::478f.20: Flags [R.], seq 0, ack 1, win 0, length 0
17:15:56.446211  In e6:63:9a:c6:92:68 ethertype IPv6 (0x86dd), length 92: fd00:10:244:2::478f > fd00:10:244:3::22be: HBH HBH 20 > 80: Flags [S], seq 0, win 8192, length 0
17:15:56.446228 Out 32:1e:42:44:b8:8b ethertype IPv6 (0x86dd), length 140: fd00:10:244:3::22be > fd00:10:244:2::478f: ICMP6, parameter problem, next header - octet 40, length 84
17:15:56.548016  In e6:63:9a:c6:92:68 ethertype IPv6 (0x86dd), length 92: fd00:10:244:2::478f > fd00:10:244:3::22be: HBH HBH 20 > 80: Flags [S], seq 0, win 8192, length 0
17:15:56.548031 Out 32:1e:42:44:b8:8b ethertype IPv6 (0x86dd), length 140: fd00:10:244:3::22be > fd00:10:244:2::478f: ICMP6, parameter problem, next header - octet 40, length 84
17:15:56.649895  In e6:63:9a:c6:92:68 ethertype IPv6 (0x86dd), length 92: fd00:10:244:2::478f > fd00:10:244:3::22be: HBH HBH 20 > 80: Flags [S], seq 0, win 8192, length 0
17:15:56.649911 Out 32:1e:42:44:b8:8b ethertype IPv6 (0x86dd), length 140: fd00:10:244:3::22be > fd00:10:244:2::478f: ICMP6, parameter problem, next header - octet 40, length 84
17:15:56.751859  In e6:63:9a:c6:92:68 ethertype IPv6 (0x86dd), length 92: fd00:10:244:2::478f > fd00:10:244:3::22be: HBH HBH 20 > 80: Flags [S], seq 0, win 8192, length 0
17:15:56.751875 Out 32:1e:42:44:b8:8b ethertype IPv6 (0x86dd), length 140: fd00:10:244:3::22be > fd00:10:244:2::478f: ICMP6, parameter problem, next header - octet 40, length 84
17:15:56.853919  In e6:63:9a:c6:92:68 ethertype IPv6 (0x86dd), length 92: fd00:10:244:2::478f > fd00:10:244:3::22be: HBH HBH 20 > 80: Flags [S], seq 0, win 8192, length 0
17:15:56.853935 Out 32:1e:42:44:b8:8b ethertype IPv6 (0x86dd), length 140: fd00:10:244:3::22be > fd00:10:244:2::478f: ICMP6, parameter problem, next header - octet 40, length 84
```
# analysis

"xx drop (CT: Truncated or invalid header) flow 0x0 to endpoint 0, file bpf_lxc.c line 712, , identity 31569->unknown: fd00:10:244:2::478f -> fd00:10:244:3::22be", 

maybe packet was droped here 

`bpf/lib/ipv6.h@ipv6_hdrlen`

```
48:static __always_inline int ipv6_hdrlen(struct __ctx_buff *ctx, __u8 *nexthdr)
49-{
50-     int i, len = sizeof(struct ipv6hdr);
51-     struct ipv6_opt_hdr opthdr __align_stack_8;
52-     __u8 nh = *nexthdr;
53-
54-#pragma unroll
55-     for (i = 0; i < IPV6_MAX_HEADERS; i++) {
56-             switch (nh) {
57-             case NEXTHDR_NONE:
58-                     return DROP_INVALID_EXTHDR;
59-
60-             case NEXTHDR_FRAGMENT:
61-                     return DROP_FRAG_NOSUPPORT;
62-
63-             case NEXTHDR_HOP:
64-             case NEXTHDR_ROUTING:
65-             case NEXTHDR_AUTH:
66-             case NEXTHDR_DEST:
67-                     if (ctx_load_bytes(ctx, ETH_HLEN + len, &opthdr, sizeof(opthdr)) < 0)
68-                             return DROP_INVALID;
69-
70-                     nh = opthdr.nexthdr;
71-                     if (nh == NEXTHDR_AUTH)
72-                             len += ipv6_authlen(&opthdr);
73-                     else
74-                             len += ipv6_optlen(&opthdr);
75-                     break;
76-
77-             default:
78-                     *nexthdr = nh;
79-                     return len;
80-             }
81-     }
82-
83-     /* Reached limit of supported extension headers */
84-     return DROP_INVALID_EXTHDR;
85-}
```

Line 70 needs to be put after line 74

parse ipv6/hop/auth/tcp packet

**first loop**

before line:70 (nh = opthdr.nexthdr;)

nh=hop, len=sizeof(ipv6hdr), opthdr=head_of_hop

after line:70 

nh=auth, len=sizeof(ipv6hdr), opthdr=head_of_hop

after line: 74 (len += ipv6_optlen(&opthdr);)

nh=auth, len=sizeof(ipv6hdr) + auth_hdrlen

**second loop**

before line:70 (nh = opthdr.nexthdr;)

nh=auth, len=sizeof(ipv6hdr) + auth_hdrlen, opthdr=wrong offset(should be sizeof(ipv6hdr) + hop_hdrlen); **wrong here**

### Cilium Version

```
➜  cilium git:(v1.12.6) ✗ cilium version
cilium-cli: v0.12.13 compiled with go1.20 on linux/amd64
cilium image (default): v1.12.6
cilium image (stable): v1.13.0
cilium image (running): v1.12.6
```

### Kernel Version

```
➜  cilium git:(v1.12.6) ✗ uname -a 
Linux VM-34-184-centos 5.4.197-1.el7.elrepo.x86_64 #1 SMP Sat Jun 4 08:43:19 EDT 2022 x86_64 x86_64 x86_64 GNU/Linux
```

### Kubernetes Version

```
➜  ~ kubectl version
WARNING: This version information is deprecated and will be replaced with the output from kubectl version --short.  Use --output=yaml|json to get the full version.
Client Version: version.Info{Major:"1", Minor:"26", GitVersion:"v1.26.1", GitCommit:"8f94681cd294aa8cfd3407b8191f6c70214973a4", GitTreeState:"clean", BuildDate:"2023-01-18T15:58:16Z", GoVersion:"go1.19.5", Compiler:"gc", Platform:"linux/amd64"}
Kustomize Version: v4.5.7
Server Version: version.Info{Major:"1", Minor:"25", GitVersion:"v1.25.3", GitCommit:"434bfd82814af038ad94d62ebe59b133fcb50506", GitTreeState:"clean", BuildDate:"2022-10-25T19:35:11Z", GoVersion:"go1.19.2", Compiler:"gc", Platform:"linux/amd64"}
```

### Sysdump

file size too big.

### Code of Conduct

- [X] I agree to follow this project's Code of Conduct

**Comment by brb** [comment]
@chenyuezhou Thanks for the detailed issue! Are you planning to fix it?

**Comment by chenyuezhou** [comment]
hi @brb sry for disturb.

I found that many cases of `make -C test run_bpf_tests` failed to load. is there something wrong with my environment?

error log

```
--- FAIL: TestBPF (0.95s)
    --- FAIL: TestBPF/hairpin_sctp_flow.o (0.02s)
        bpf_test.go:150: verifier error: load program: permission denied:
                ; int hairpin_flow_rev_setup(struct __ctx_buff *ctx)
                0: (bf) r6 = r1
                1: (b7) r1 = 0
                ; builder->layer_offsets[i] = 0;
                2: (6b) *(u16 *)(r10 -32) = r1
                last_idx 2 first_idx 0
......
```

detail error log

[error.tar.gz](https://github.com/cilium/cilium/files/10937781/error.tar.gz)


```
ubuntu@VM-0-10-ubuntu:~/cilium$ llc --version
Ubuntu LLVM version 14.0.0
  
  Optimized build.
  Default target: x86_64-pc-linux-gnu
  Host CPU: znver2

  Registered Targets:
    aarch64    - AArch64 (little endian)
    aarch64_32 - AArch64 (little endian ILP32)
    aarch64_be - AArch64 (big endian)
    amdgcn     - AMD GCN GPUs
    arm        - ARM
    arm64      - ARM64 (little endian)
    arm64_32   - ARM64 (little endian ILP32)
    armeb      - ARM (big endian)
    avr        - Atmel AVR Microcontroller
    bpf        - BPF (host endian)
    bpfeb      - BPF (big endian)
    bpfel      - BPF (little endian)
    hexagon    - Hexagon
    lanai      - Lanai
    m68k       - Motorola 68000 family
    mips       - MIPS (32-bit big endian)
    mips64     - MIPS (64-bit big endian)
    mips64el   - MIPS (64-bit little endian)
    mipsel     - MIPS (32-bit little endian)
    msp430     - MSP430 [experimental]
    nvptx      - NVIDIA PTX 32-bit
    nvptx64    - NVIDIA PTX 64-bit
    ppc32      - PowerPC 32
    ppc32le    - PowerPC 32 LE
    ppc64      - PowerPC 64
    ppc64le    - PowerPC 64 LE
    r600       - AMD GPUs HD2XXX-HD6XXX
    riscv32    - 32-bit RISC-V
    riscv64    - 64-bit RISC-V
    sparc      - Sparc
    sparcel    - Sparc LE
    sparcv9    - Sparc V9
    systemz    - SystemZ
    thumb      - Thumb
    thumbeb    - Thumb (big endian)
    ve         - VE
    wasm32     - WebAssembly 32-bit
    wasm64     - WebAssembly 64-bit
    x86        - 32-bit X86: Pentium-Pro and above
    x86-64     - 64-bit X86: EM64T and AMD64
    xcore      - XCore
```

```
ubuntu@VM-0-10-ubuntu:~/cilium$ uname -a
Linux VM-0-10-ubuntu 5.15.0-56-generic #62-Ubuntu SMP Tue Nov 22 19:54:14 UTC 2022 x86_64 x86_64 x86_64 GNU/Linux
```

cilium commit: `853ec101d8adee8d482040aa038e5b71ce7775e2`

**Comment by brb** [comment]
Did the failures appear before or after your changes? If the latter, could you show the changes?

The actual failure:
```
; if (!hdr)
            	90: (15) if r1 == 0x0 goto pc+697
            	 R0=inv(id=0) R1=pkt(id=2,off=0,r=0,umax_value=65535,var_off=(0x0; 0xffff)) R2=inv(id=0,umin_value=20,umax_value=65555,var_off=(0x0; 0x1ffff)) R3=inv3 R4=fp-46 R5=fp-44 R6=ctx(id=0,off=0,imm=0) R7=invP(id=1,umax_value=65514,var_off=(0x0; 0xffff)) R10=fp0 fp-8=00000000 fp-16=00000000 fp-24=mmmmmmmm fp-32=??000000 fp-40=00mm00mm fp-48=ctx
            	91: (b7) r2 = 64
            	; hdr->ttl = 64;
            	92: (73) *(u8 *)(r1 +8) = r2
            	invalid access to packet, off=8 size=1, R1(id=2,off=8,r=0)
            	R1 offset is outside of the packet
```

**Comment by chenyuezhou** [comment]
these failure appear before may changes

```
ubuntu@VM-0-10-ubuntu:~/cilium$ git diff
ubuntu@VM-0-10-ubuntu:~/cilium$ 
```

**Comment by chenyuezhou** [comment]
@brb I can successfully load all test cases with llc 1.2

```
ubuntu@VM-0-10-ubuntu:~/cilium$ git diff
ubuntu@VM-0-10-ubuntu:~/cilium$ make -C test run_bpf_tests
make: Entering directory '/home/ubuntu/cilium/test'
make -C ../bpf/tests all
make[1]: Entering directory '/home/ubuntu/cilium/bpf/tests'
make[1]: Nothing to be done for 'all'.
make[1]: Leaving directory '/home/ubuntu/cilium/bpf/tests'
go test ./bpf_tests -exec sudo -bpf-test-path /home/ubuntu/cilium/bpf/tests 
ok      github.com/cilium/cilium/test/bpf_tests 1.992s
make: Leaving directory '/home/ubuntu/cilium/test'
ubuntu@VM-0-10-ubuntu:~/cilium$ llc --version
Ubuntu LLVM version 12.0.1
  
  Optimized build.
  Default target: x86_64-pc-linux-gnu
  Host CPU: znver2

  Registered Targets:
    aarch64    - AArch64 (little endian)
    aarch64_32 - AArch64 (little endian ILP32)
    aarch64_be - AArch64 (big endian)
    amdgcn     - AMD GCN GPUs
    arm        - ARM
    arm64      - ARM64 (little endian)
    arm64_32   - ARM64 (little endian ILP32)
    armeb      - ARM (big endian)
    avr        - Atmel AVR Microcontroller
    bpf        - BPF (host endian)
    bpfeb      - BPF (big endian)
    bpfel      - BPF (little endian)
    hexagon    - Hexagon
    lanai      - Lanai
    mips       - MIPS (32-bit big endian)
    mips64     - MIPS (64-bit big endian)
    mips64el   - MIPS (64-bit little endian)
    mipsel     - MIPS (32-bit little endian)
    msp430     - MSP430 [experimental]
    nvptx      - NVIDIA PTX 32-bit
    nvptx64    - NVIDIA PTX 64-bit
    ppc32      - PowerPC 32
    ppc32le    - PowerPC 32 LE
    ppc64      - PowerPC 64
    ppc64le    - PowerPC 64 LE
    r600       - AMD GPUs HD2XXX-HD6XXX
    riscv32    - 32-bit RISC-V
    riscv64    - 64-bit RISC-V
    sparc      - Sparc
    sparcel    - Sparc LE
    sparcv9    - Sparc V9
    systemz    - SystemZ
    thumb      - Thumb
    thumbeb    - Thumb (big endian)
    wasm32     - WebAssembly 32-bit
    wasm64     - WebAssembly 64-bit
    x86        - 32-bit X86: Pentium-Pro and above
    x86-64     - 64-bit X86: EM64T and AMD64
    xcore      - XCore
```

**Comment by chenyuezhou** [comment]
sry for typo, "llc version 12"

**Comment by pchaigno** [comment]
Note we recommend using LLVM 10 as that's what is used by Cilium.
